,src,lang,text
0,"











Ferenc pápa: ma is élnek köztünk szentek
01 Nov 2019, 16:11 by Euronews 




A szentek nem elérhetetlen jelképek, ők köztünk éltek - mondta Ferenc pápa, aki mindenszentek ünnepén a Szent Péter téren mondott beszédet péntek délben.

A katolikus egyházfő kijelentette, a szentté avatott férfiak és nők ""nem egyszerű jelképek, elérhetetlen emberek"".
“A szentek, akiket ma ünneplünk, nem távoli, elérhetetlen emberek. Nagyon is a földön jártak, megtapasztalták az élet mindennapjainak nehézségeit, annak sikereivel és kudarcaival együtt, az Úrban találva meg az erőt, amellyel mindig talpra álltak és folytatták útjukat"".
Ferenc pápa ezeknek a példaképeknek a követésére szólította fel az embereket, és hangsúlyozta, hogy élnek közöttünk ma is olyanok, akik Isten jelenlétét tükrözik.
Mindenszentek napján, november elsején és halottak napján, november másodikán a keresztény hívek igyekeznek ellátogatni a temetőbe elhunyt szeretteik sírjához.
Este mécses - és gyertyagyújtással tisztelegnek emlékük előtt. Az eredetileg katolikus ünnepet és hagyományait idővel más felekezetek is átvették.


",hu,"











Pope Francis: Saints still live among us today
01 Nov 2019, 16:11 by Euronews




The saints are not inaccessible symbols, they lived among us, ”said Pope Francis, who delivered a speech on St. Peter's Square at noon on Friday.

The Catholic Head of State declared that men and women ordained ""are not simple symbols, unreachable people.""
“The saints we celebrate today are not distant, inaccessible people. They were very much on the earth, experiencing the hardships of everyday life, along with its successes and failures, finding in the Lord the strength with which to always recover and continue their journey. ""
Pope Francis called upon people to follow these role models and emphasized that there are people among us today who reflect the presence of God.
On All Saints' Day, November 1st, and on the Day of the Dead, November 2nd, Christian believers seek to visit the grave of their dead loved ones.
In the evening they light candles and light candles in memory of their memory. The original Catholic celebration and traditions were eventually adopted by other denominations.


"
