,src,lang,text
0,"











«Флаеры», «база» и сореванования на выбывание. Международным стантфестом в Гродно завершилась Неделя чирлидинга в Беларуси 
07 Nov 2019, 14:52 by Юлия ТИМОЩУК
Самый крупный торговый центр Гродно принимал Международный стантфест по чирлидингу среди групповых и партнерских стантов «Old Сity challenge».
Турнир собрал шесть клубов из Гродно, Минска и Мозыря, а также два клуба из Москвы. Главным судьей турнира выступил инструктор Всемирной ассоциации чирлидинга, судья международной категории Дэрон Форрест из США.



Крупное состязание прошло в рамках «Недели чирлидинга в Беларуси», которая стартовала 1 ноября в Минске. Участие в ней приняли уже более 1500 участников из пяти городов страны, Международный стантфест в Гродно стал ее завершающим этапом.



– Для Гродненской области очень почетно принимать соревнование такого уровня, и, безусловно, наши чирлидеры гордятся тем, что поддержали Неделю чирлидинга в Беларуси, – обратился к участникам и зрителям турнира начальник управления спорта и туризма Гродненского облисполкома Олег Андрейчик. –  У нас на Гродненщине развивается 56 видов спорта. Один из самых зрелищных и красивых – чирлидинг. Несмотря на то, что он признан официальным видом спорта в Беларуси только в 2017 году, Гродно уже сегодня является одним из лидирующих городов по развитию чирлидинга в нашей стране.






Гродненские спортсмены становились неоднократными победителями и призерами национальных соревнований, а в июне 2019 года участники гродненских клубов «Dartly», «Майами» и «Sky hamsters» представляли Беларусь на чемпионате Европы по чирлидингу в Санкт-Петербурге. В составе сборной команды «Smile» в дисциплине «чир-команда» ребята гродненского клуба «Sky Hamsters» завоевали бронзу чемпионата Европы.









Сегодня ребята из Гродно старались показать максимум своих умений и навыков. Выступления под куполом ТЦ «Old City» с интересом оценивали не только судьи соревнований, но и многочисленные зрители и болельщики. Состязание состояло из трех блоков: визитки (выступления станта), элементов на выбывание и удержания станта на время.






Один из участников турнира, член гродненского клуба «Dartly» Богдан Лозовик перед выступлением не пренебрегает разминкой. Самым сложным в чирлидинге спортсмен считает именно акробатику.– Чтобы все удавалось, стараюсь поддерживать оптимальную физическую форму. Поэтому три раза в неделю посещаю обычные тренировки плюс одну тренировку по акробатике. Очень важна моральная и психологическая составляющая. Выполнение многих элементов не возможно без взаимопонимания и доверия между теми, кто их выполняет – и со стороны базы к флаеру, в том, что он будет стоять ровно, и со стороны флаера к базе, что он не уйдет.









Мнение Богдана поддерживает и участница московского чир-клуба «Lady» Софья Логачева.– Я в чирлидинге уже 8 лет, и за это время у нас бывали всякие ситуации. Когда ты выходишь выступать, в голове крутится только одна мысль: «Нужно выполнить всю программу, несмотря на все свои страхи и эмоции». Раньше я была флаером, но страх того, что меня не поймают, пересилил, поэтому сменила роль и теперь стою задним во время выступлений, слежу за флаером и отвечаю за его прием.






Организаторами международного состязания выступили ОО «Белорусская федерация чирлидинга и команд поддержки», управление спорта и туризма Гродненского облисполкома и ТЦ «Old City» при поддержке отдела физической культуры, спорта и туризма Гродненского горисполкома.












Фото: Вадим ГОЛОТИК


",ru,"











“Flyers”, “base” and elimination competitions. Cheerleading Week in Belarus ends with International Stanfest in Grodno
07 Nov 2019, 14:52 by Julia TIMOSCHUK
The largest shopping center in Grodno hosted the International Cheerleading Stanfest among the Old City City challenge group and partner stations.
The tournament brought together six clubs from Grodno, Minsk and Mazyr, as well as two clubs from Moscow. The chief judge of the tournament was the instructor of the World Cheerleading Association, an international referee, Daron Forrest from the USA.



A major competition was held as part of the “Cheerleading Week in Belarus”, which started on November 1 in Minsk. More than 1,500 participants from five cities of the country have already taken part in it; the International Stanfest in Grodno has become its final stage.



“It’s very honorable for the Grodno region to host a competition of this level, and, of course, our cheerleaders are proud to support the Cheerleading Week in Belarus,” said the head of the sports and tourism department of the Grodno Oblast Executive Committee Oleg Andreichik. - We have 56 sports developing in the Grodno region. One of the most spectacular and beautiful is cheerleading. Despite the fact that it was recognized as an official sport in Belarus only in 2017, Grodno today is one of the leading cities in the development of cheerleading in our country.






Grodno athletes became repeated winners and prize-winners of national competitions, and in June 2019, participants in the Grodno clubs Dartly, Miami and Sky hamsters represented Belarus at the European Cheerleading Championships in St. Petersburg. As part of the Smile team in the cheer-team discipline, the guys from the Grodno club Sky Hamsters won the bronze of the European Championship.









Today, the guys from Grodno tried to show the maximum of their skills. The performances under the dome of the Old City shopping center were appreciated not only by the competition judges, but also by numerous spectators and fans. The competition consisted of three blocks: business cards (performances of the stan), elements for knocking out and holding the stan for a while.






One of the participants of the tournament, a member of the Dartly Grodno club, Bogdan Lozovik, does not neglect the warm-up before the performance. The athlete considers acrobatics to be the most difficult in cheerleading. - In order to succeed, I try to maintain an optimal physical shape. Therefore, I attend regular training three times a week, plus one acrobatics training. The moral and psychological component is very important. The fulfillment of many elements is not possible without mutual understanding and trust between those who execute them - both from the base to the flyer, that it will stand upright, and from the flyer to the base that it will not go away.









Bogdan’s opinion is supported by Sofia Logacheva, a member of the Lady’s Moscow chir club. “I’ve been cheerleading for 8 years, and during this time we have had all kinds of situations. When you go out to speak, only one thought revolves in your head: “You need to complete the entire program, despite all your fears and emotions.” I used to be a flyer, but the fear that they won’t catch me overpowered, so I changed my role and now I stand back during the performances, I follow the flyer and am responsible for its reception.






The organizers of the international competition were the public association “Belarusian Cheerleading Federation and Support Teams”, the Department of Sports and Tourism of the Grodno Oblast Executive Committee and the shopping center “Old City” with the support of the Department of Physical Culture, Sports and Tourism of the Grodno City Executive Committee.












Photo: Vadim GOLOTIK


"
