,src,lang,text
0,"











Insólito: intendente pide a los empleados que no vayan a trabajar borrachos, pero sí con resaca

07 Nov 2019, 14:08

El entrante intendente de la localidad tucumana de Tafí del Valle pidió esta mañana a los empleados municipales a su cargo que no vayan a trabajar borrachos, aunque les dijo que pueden hacerlo con resaca.
""Estoy pidiendo voluntad de trabajar. Yo no vengo a perseguir a nadie, pero vengo a imponer el trabajo. Que sean respetuosos"", dijo  Francisco ""Pancho"" Calivas en un encendido discurso.
""El día lunes sabemos que van a venir quemao (con resaca), pero machaos (borrachos) no queremos a ninguno"", expresó a sus empleados el flamante jefe comunal.
En ese sentido, Calivas agregó que ""hoy en día toda la gente quiere entrar al municipio porque saben cuánto están cobrando, por eso le pido a ustedes que juntos alentemos a este nuevo Tafí. Dependerá de ustedes, de la voluntad de trabajar"", arengó el intendente, según reprodujo el sitio de La Gaceta.
La asunción de Calivas se produjo ayer miércoles sin la asistencia del gobernador tucumano, Juan Manzur, y en medio de una polémica al conocerse un audio en el que el jefe comunal le ofrece cargos y recursos a un concejal opositor a cambio de tener una conducción afín en el cuerpo deliberativo.


",es,"











Unusual: intendant asks employees not to go to work drunk, but with hangover

07 Nov 2019, 14:08

The incoming mayor of the town of Tafi del Valle in Tucuman asked the municipal employees in his charge not to go to work drunk this morning, although he told them they can do it with a hangover.
""I am asking for the will to work. I do not come to persecute anyone, but I come to impose the work. That they be respectful,"" Francisco ""Pancho"" Calivas said in a fiery speech.
""On Monday we know that they will come burning (with a hangover), but machaos (drunkards) we don't want any,"" the brand-new communal chief told his employees.
In that sense, Calivas added that ""today all people want to enter the municipality because they know how much they are charging, so I ask you to encourage this new Tafi together. It will depend on you, on the will to work,"" he said. the mayor, as reproduced the site of La Gaceta.
The assumption of Calivas took place yesterday Wednesday without the assistance of the governor of Tucuman, Juan Manzur, and in the middle of a controversy when an audio was known in which the communal chief offers charges and resources to an opposition councilor in exchange for having a related leadership in the deliberative body.


"
