,src,lang,text
0,"











Il pense acheter une poule aux enchères.... il en récupère 1000 !
07 Nov 2019, 14:04 by La rédaction

Sans le savoir, un homme a fait l'acquisition de 1000 poules au lieu d'une en Nouvelle-Zélande sur un site d'enchères. Il a finalement accepté d'en garder 20, et cherche à faire adopter les autres.

Il ne s'attendait pas à une telle acquisition. En Nouvelle-Zélande, un homme pensait acheter une poule aux enchères, mais il en a finalement récupéré... 1000!
Comment est-ce possible? Le Néo-Zélandais avait repéré une petite annonce en ligne sur un célèbre site d'enchères. Le prix de départ étant étonnamment bas (1,50 dollar néo-zélandais, soit moins d'un euro), l'acheteur a fait une offre, pensant acquérir une seule poule. Il a alors programmé une enchère automatique à hauteur de 20 dollars maximum.
Mais c'est en réalité 1000 poules qui étaient mises aux enchères à ce prix étonnamment bas. Lorsqu'il a appris qu'il était le meilleur enchérisseur, il est allé à la rencontre du revendeur. C'est à ce moment-là que l'homme a réalisé qu'il allait devenir le propriétaire de 1.000 poules. ""J'étais sous le choc"", a-t-il déclaré auprès du site Stuff. 
Dans l'impossibilité de toutes les accueillir, il a annoncé qu'il pourrait en garder 20. Inquiet du sort des autres, il a contacté un refuge animalier afin que les poules puissent être adoptées. 

Voir les commentaires (5)



",fr,"











He thinks to buy a hen auction .... he gets 1000!
07 Nov 2019, 14:04 by The editors

Unknowingly, a man bought 1000 chickens instead of one in New Zealand at an auction site. He finally agreed to keep 20, and tries to get others to adopt.

He did not expect such an acquisition. In New Zealand, a man thought to buy a hen at auction, but he finally recovered ... 1000!
How is it possible? The New Zealander spotted an ad online on a famous auction site. The starting price being surprisingly low ($ 1.50 New Zealand, or less than one euro), the buyer made an offer, thinking to acquire a single hen. He then programmed an automatic bid for up to $ 20.
But it is actually 1000 chickens that were auctioned at this surprisingly low price. When he learned that he was the highest bidder, he went to meet the dealer. It was then that the man realized that he would become the owner of 1,000 chickens. ""I was in shock,"" he told the Stuff website.
Unable to receive them all, he announced that he would be able to keep them. 20. Worried about the fate of others, he contacted an animal refuge so that the chickens could be adopted.

See the comments (5)



"
