,src,lang,text
0,"











Un Benchaâboun très exhaustif sur le PLF 2020

07 Nov 2019, 14:38

Depuis la présentation du PLF 2020, les commentaires et réactions à ses différentes mesures ont été nombreux, et les opérateurs économiques et financiers marocains ont largement fait part de leurs interrogations, voire de leurs inquiétudes.
C’est pourquoi devant la presse, M. Mohamed Benchaâboun, ministre de l’Economie et des Finances, a tenu à apporter des éclaircissements sur le contexte général et la vision d’ensemble du PLF 2020, ainsi qu’à rassurer sur certains points précis qui comptent parmi les plus débattus. « Le PLF contient beaucoup de dispositions qui n’ont pas bien pu être comprises par l’environnement », explique-t-il. Et d’ajouter : « Pour comprendre la loi de finances, on est obligé d’aller au-delà, [de voir] ce qu’il y a derrière le rideau ».

Des efforts pour tous

D’emblée, M. le ministre rappelle la priorité donnée par le Roi Mohammed VI et le gouvernement aux mesures sociales, notamment dans la foulée du pacte social signé cette année. Et d’ajouter que l’augmentation du coût du social « dépasse celle des recettes, donc il y a un effort qui est fait, et qui doit se poursuivre », tout en admettant qu’il « reste la problématique de l’appréciation du service rendu au citoyen ».
Ainsi, insiste M. Benchaâboun, « les réformes ne doivent pas être réduites à la réduction de la fiscalité », et « si chaque secteur, pris séparément, propose des mesures pour l’augmentation de valeur, nous sommes partants ». De plus, et c’est un message adressé aux opérateurs économiques, il rappelle que « la réduction de l’IS n’est pas synonyme de hausse des investissements », que « tout le monde est d’accord sur l’équité fiscale, tant qu’il s’agit de baisser » et que « les requêtes de réduction ne permettent pas forcément au secteur de se développer ». Le ministre préfère donc évoquer « des mesures d’accompagnement pour tous gagner ». Il a pris pour exemple le port de Tanger-Med, qui n’a vu aucun investissement significatif malgré un taux d’IS réduit de 50%, jusqu’à la mise en place de vraies infrastructures.
Pour ce qui concerne la TVA des différents secteurs, le ministre insiste sur le fait que l’impact en termes monétaires sera faible selon les études du MEF.
Toujours au niveau fiscal, M. le ministre veut poursuivre l’un des objectifs mis en avant lors des Assises de la fiscalité, à savoir « simplifier la relation à l’administration de manière générale », à travers le remplacement de plusieurs impôts et taxes par la contribution professionnelle unifiée. « Nous voulions le faire dans cette loi de finances », selon M. Benchaâboun, « mais il fallait aussi toucher la loi sur la taxe locale ». Il annonce sa mise en place à partir du 1er janvier 2021.
Revenant sur les affaires des commerçants avec l’ICE, le ministre juge que « les gros commerces se sont cachés derrière les petits », alors que « les petits ne sont pas concernés ».

Un phénomène de société

De plus, le ministre rappelle que « quand vous avez 80% des contribuables qui ne sont pas conformes, il s’agit d’un phénomène de société, pas un problème de contrôle ». A cet égard, il rappelle les deux éléments de rupture qui sont prévus pour l’année prochaine : la mise en place de la nouvelle loi cadre, et l’entrée en vigueur de l’accord d’échange d’informations avec l’OCDE.
C’est également la raison pour laquelle certaines mesures ne sont pas présentes, selon le ministre. « Tout ne peux pas être mis dans la loi de finances », dit-il, citant l’exemple de la règlementation des changes, qui concerne aussi le fonctionnement de l’Office des changes et ses attributions.
Sur la question du change, le ministre a partagé ses ambitions : celle de supprimer la nécessité, et donc l’existence, de comptes à l’étranger pour les Marocains résidant dans le Royaume. En effet, il compte, d’ici la fin de l’année, « permettre aux Marocains d’avoir des comptes en devises ou en dirhams convertibles » à travers un système plus souple. Ainsi, un loyer versé depuis l’étranger pourra l’être sur un compte au Maroc en devises, qui lui-même pourra être ponctionné pour régler les factures à l’étranger.
Cela permettra, selon le ministre, de lutter contre des phénomènes comme la surfacturation, qui n’aurait plus de raison d’être avec la possibilité d’avoir un compte en devises. Cela permettrait également de stabiliser la réserve de changes. M. Benchaâboun espère donc « changer les comportements de la grande masse ».

Une dernière amnistie ?

Interrogé sur les déclarations libératoires, le ministre des Finances précise que « le PLF n’a pas prévu de recettes vis-à-vis de ces mesures ». Il s’agit surtout de « juguler le phénomène du cash en circulation à l’étranger ». « Une amnistie n’est pas juste », accorde-t-il, « mais ce qui se passe maintenant n’est pas juste non plus ». Toutefois, « l’adhésion des gens à cette démarche conditionne sa réussite ».
Et si les mesures semblables de 2014 n’ont pas eu d’effets autres que ponctuels, c’est parce que « on n’a pas changé les règles, donc cela n’allait pas changer les comportements ». Cette année représentera, selon le ministre, la première rupture dans la réglementation. Et pour ceux qui espèrent rester mauvais contribuables, M. Benchaâboun rappelle que « l’administration fiscale disposent d’outils de plus en plus performants, et le contrôle physique va être remplacé par la data ».
Sur le problème de la contentialité bancaire, le ministre, qui rappelle qu’au niveau des règles sur les fonds propres, le Maroc affiche « l’un des taux les plus importants au monde », sépare la question en deux volets : le structurel et le conjoncturel. M. Benchaâboun a pour projet de créer des fonds de restructuration et de soutien pour les difficultés conjoncturelles, et « d’encourager de façon structurelle ». L’Etat pourrait, en cas de difficulté, rentrer dans les fonds propres, pour en sortir sans intérêts au bout de 7 à 10 ans.

Le soutien plutôt que les incitations

Le Small Business Act poursuivrait son petit bonhomme de chemin. La première réalisation serait un portail, opérationnel avant la fin de l’année, qui regroupe toutes les informations nécessaires de manière didactique. Ensuite viendra le rapprochement institutionnel entre la CCG, l’ANPME et les CRI, accompagné du texte de loi. Cette idée de simplifier les programmes d’appui à l’entreprenariat est plus que nécessaire, puisque les cadres du MEF eux-mêmes admettent qu’ils ne connaissaient pas l’existence de certains de ces programmes ! Le Small Business Act consiste ainsi en un « processus d’évolution vers plus de transparence et de couverture du tissu d’entreprises, pour aboutir à des réformes constitutionnelles et pour clarifier, dans un seul endroit, l’ensemble des outils », selon le ministre.
En ce qui concerne le budget et les investissements infrastructurels de l’Etat, M. Benchaâboun rappelle qu’il « faut assurer les équilibres, qui font partie des obligations constitutionnelles ». Et vue la conjoncture actuelle, il faut soit réduire l’investissement, soit avoir recours à de nouveaux (parce qu’utilisés pour la première fois au Maroc) mécanismes comme ceux mis en avant dans le PLF 2020. Il s’agit, rappelons-le, de partenariats public-privé, où les projets seront financés par le privé, les institutionnels, ou encore les entreprises publiques. Une fois le projet réalisé, l’Etat en récupèrera l’exploitation, et paiera un loyer. Cela permettra, selon le ministre, aux investisseurs sur le long terme de trouver une rentabilité qu’ils peinent à atteindre avec les investissements actuels, avec en plus la confiance de traiter avec l’Etat. Cette année, 15% des investissements seront réalisés avec de tels schémas, pour un total de 12 MMDH. Un exemple est la signature récente pour la construction de 5 CHU pour 4,5 MMDH.
Concernant les avantages fiscaux accordés aux entreprises venant s’implanter au Maroc, qui vont tendre à disparaître, M. Benchaâboun rappelle que « la fiscalité, à l’international, n’est plus un avantage, car vous payez le complément dans votre pays ». Il rappelle également, à propos du cas spécifique de CFC, que « rien ne change pour ceux déjà installés, ou qui s’installeront en 2020 ». Et après, les suivants auront le droit à 5 ans d’exonération. Les premiers taux à 15% n’arriveront donc qu’à partir de 2026. Il rappelle aussi qu’il s’agit d’un taux unifié, les ventes locales étant jusqu’alors taxées à 31%. Il précise également que CFC sera exonérée de la taxe sur les produits des actions.
Les avantages fiscaux doivent évoluer vers un système de soutien social. Par exemple, il s’agirait de soutenir les acquéreurs de logements sociaux plutôt que d’accorder des exonérations aux promoteurs.
M. le ministre, interpellé sur la question de l’IR, déclare, avec regret, que « nous ne pouvons hélas par tout faire en même temps » pour la classe moyenne, notant toutefois une amélioration pour les fonctionnaires et les allocations familiales. La baisse de l’IR va arriver, promet-il, espérant qu’elle sera compensée par l’élargissement de l’assiette.
Les contrats-programmes vont aussi être revus, come cela est déjà le cas pour certaines entreprises. Par exemple, pour l’ONCF, l’Etat prendra en charge le rail, et l’office l’exploitation et l’investissement dans le roulant. Cela ne se fera pas avant 2022, et dans l’intervalle seront mis en place des mécanismes pour respecter les échéances.
Enfin, M. le ministre revient sur le très discuté article 9 et l’insaisissabilité des comptes de l’Etat, qui « existe dans toutes les démocraties ou presque ». Il explique qu’il s’agit de formaliser de manière plus stricte les dépenses de l’Etat, afin que les dépenses réalisées correspondent au budget signé par le Parlement. Si le budget prévu est dépassé, les dépenses venant de jugements rendus seront budgétisées, et réglées, l’année suivante. Selon M. Benchaâboun, il est essentiel de supprimer l’aléatoire des dépenses de l’Etat, notamment parce que les agences de rating sont très regardantes sur ce sujet.

Selim Benabdelkhalek


POUR ALLER PLUS LOIN





",fr,"











A very comprehensive Benchaaboun on the PLF 2020

07 Nov 2019, 14:38

Since the presentation of the PLF 2020, comments and reactions to its various measures have been numerous, and Moroccan economic and financial operators have widely expressed their concerns, even their concerns.
Therefore, in front of the press, Mr. Mohamed Benchaaboun, Minister of Economy and Finance, wanted to clarify the general context and the overall vision of the PLF 2020, as well as to reassure on certain points which are among the most debated. ""The PLF contains many provisions that have not been well understood by the environment,"" he explains. And to add: ""To understand the law of finances, one is obliged to go beyond, [to see] what is behind the curtain"".

Efforts for all

From the outset, the minister recalled the priority given by King Mohammed VI and the government to social measures, particularly in the wake of the social pact signed this year. And to add that the increase of the cost of the social ""exceeds that of the receipts, so there is an effort which is made, and which must continue"", while admitting that it ""remains the problematic of the appreciation of the service to the citizen "".
Thus, insists Mr. Benchaaboun, ""the reforms should not be reduced to the reduction of taxation,"" and ""if each sector, taken separately, proposes measures for the increase in value, we are starters."" Moreover, and this is a message addressed to the economic operators, he reminds that ""the reduction of the IS is not synonymous with increased investments"", that ""everyone agrees on tax fairness, as long as it is a question of falling ""and that"" the requests of reduction do not allow the sector to develop "". The minister prefers to mention ""accompanying measures for all to win"". He took for example the port of Tangier-Med, which saw no significant investment despite a rate of IS reduced by 50%, until the establishment of real infrastructure.
Regarding the VAT of different sectors, the Minister insists that the impact in monetary terms will be low according to MEF studies.
Still on the fiscal side, the minister wants to pursue one of the objectives put forward during the Tax Conference, namely ""simplifying the relationship with the administration in general"", through the replacement of several taxes and duties. by the unified professional contribution. ""We wanted to do it in this budget law,"" according to Mr. Benchaaboun, ""but it was also necessary to touch the law on the local tax"". He announces its implementation from January 1, 2021.
Returning to the business of traders with the ICE, the minister believes that ""the big businesses have hidden behind the small"", while ""the small are not concerned"".

A phenomenon of society

In addition, the minister recalls that ""when you have 80% of taxpayers who do not comply, it is a phenomenon of society, not a problem of control"". In this respect, it recalls the two disruptions that are foreseen for next year: the implementation of the new framework law, and the entry into force of the information exchange agreement with the OECD. .
That's also why some measures are not there, according to the minister. ""Everything can not be put in the finance law,"" he says, citing the example of the exchange regulations, which also concerns the operation of the Exchange Office and its powers.
On the question of exchange, the minister shared his ambitions: that of removing the need, and therefore the existence of accounts abroad for Moroccans living in the Kingdom. Indeed, it expects, by the end of the year, ""to allow Moroccans to have accounts in currencies or convertible dirhams"" through a more flexible system. Thus, a rent paid from abroad can be paid to an account in Morocco in foreign currency, which itself can be punctured to pay bills abroad.
This will allow, according to the minister, to fight against phenomena such as extra billing, which would no longer be necessary with the possibility of having a foreign exchange account. This would also stabilize the foreign exchange reserve. Mr. Benchaaboun hopes to ""change the behavior of the mass.""

A last amnesty?

When asked about the discharge declarations, the Minister of Finance said that ""the PLF has not forecast revenue vis-à-vis these measures"". It is mainly about ""curbing the phenomenon of cash in circulation abroad"". ""An amnesty is not fair,"" he says, ""but what is happening now is not right either."" However, ""the adhesion of people to this process determines its success"".
And if the similar measures of 2014 had no effects other than punctual, it is because ""we did not change the rules, so it was not going to change the behaviors"". This year will represent, according to the minister, the first break in regulation. And for those who hope to remain bad taxpayers, Mr. Benchaâboun reminds that ""the tax administration has more and more powerful tools, and the physical control will be replaced by the data"".
On the problem of banking contentiveness, the minister, who recalls that at the level of capital rules, Morocco displays ""one of the highest rates in the world"", separates the issue into two parts: the structural and the economic situation. Mr. Benchaaboun plans to create restructuring and support funds for economic difficulties, and ""to encourage structurally"". The State could, in case of difficulty, return to equity, to exit without interest after 7 to 10 years.

Support rather than incentives

The Small Business Act would continue its merry way. The first realization would be a portal, operational before the end of the year, which gathers all the necessary information in a didactic way. Then comes the institutional rapprochement between the CGC, the ANPME and the IRCs, accompanied by the text of the law. This idea of simplifying entrepreneurship support programs is more than necessary, since MEF executives themselves admit that they did not know about some of these programs! The Small Business Act thus consists of a ""process of evolution towards greater transparency and coverage of the fabric of companies, leading to constitutional reforms and clarifying, in one place, all the tools"", according to the Minister.
With regard to the budget and infrastructural investments of the State, Mr. Benchaaboun recalls that ""we must ensure balances, which are part of the constitutional obligations"". And given the current situation, it is necessary either to reduce the investment, or to have recourse to new (because used for the first time in Morocco) mechanisms like those put forward in the PLF 2020. It is, let's recall- the, of public-private partnerships, where the projects will be financed by the private, the institutional, or even the public companies. Once the project is completed, the State will recover the operation, and will pay a rent. This will allow, according to the minister, long-term investors to find a profitability they struggle to achieve with current investments, with the additional confidence to deal with the state. This year, 15% of investments will be made with such schemes, for a total of 12 MMDH. An example is the recent signing for the construction of 5 CHUs for 4.5 MMDH.
Regarding the tax benefits granted to companies coming to Morocco, which will tend to disappear, Mr. Benchaâboun reminds that ""taxation, internationally, is no longer an advantage, because you pay the supplement in your country"" . He also recalls, in the specific case of CFC, that ""nothing changes for those already installed, or who will settle in 2020"". And after, the following will be entitled to 5 years of exemption. The first 15% rates will not arrive until 2026. He also recalls that this is a unified rate, local sales were previously taxed at 31%. It also states that CFC will be exempt from the tax on the proceeds of the shares.
Tax benefits must evolve into a social support system. For example, it would be to support purchasers of social housing rather than granting exemptions to developers.
The minister, questioned on the question of the IR, declares, with regret, that ""we can unfortunately not do everything at the same time"" for the middle class, noting however an improvement for the civil servants and the family allowances. The decline in the IR will happen, he promises, hoping that it will be offset by the broadening of the base.
The program contracts will also be reviewed, as is already the case for some companies. For example, for the ONCF, the State will take over the rail, and the office the exploitation and the investment in the rolling stock. This will not happen until 2022, and in the meantime mechanisms will be put in place to meet deadlines.
Finally, the Minister returns to the highly discussed article 9 and the unseizability of the accounts of the state, which ""exists in almost all democracies"". He explains that it is necessary to formalize more strictly the expenditure of the State, so that the realized expenses correspond to the budget signed by the Parliament. If the planned budget is exceeded, the expenses coming from judgments rendered will be budgeted, and settled, the following year. According to Mr. Benchaâboun, it is essential to eliminate the randomness of state spending, especially because the agenciesRating s are very watchful on this subject.

Selim Benabdelkhalek


FOR FURTHER





"
