,src,lang,text
0,"











8 ключевых digital-событий ноября от WebPromoExperts

07 Nov 2019, 14:00

Академия интернет-маркетинга WebPromoExperts подготовила для вас подборку полезных онлайн-событий ноября, благодаря которым вы сможете прокачать свои скиллы, узнать новое и получить экспертные советы от докладчиков в прямом эфире.
Вы узнаете: 

на что стоит обращать внимание при создании сайтов, чтобы не переплатить и сэкономить свой бюджет; 
какие 10 критических ошибок уводят клиентов с вашего сайта;
секреты продающих, интересных и кратких текстов;
чем отличается “эсэмэмщик” от SMM-специалиста и получите 5 правил крутого SMM-специалиста;
что такое LinkedIn и как эффективно ее использовать для продвижения своих услуг или бизнеса в целом;
как продвигать свой YouTube-канал, получите карту тем для контента на канале и перечень инструментов для проверки качества заполнения информационного выпуска;
что ждет SEO в 2020 году, каким оно будет и какие практики будут актуальны;
кейсы успешного продвижения фармацевтических компаний в интернете.

1. Бесплатный онлайн-семинар: «Как сделать сайт чужими руками и не переплатить».
Когда: 07 ноября, 15.00 (по Киеву).



Игорь Михайлюк — руководитель IT отдела Академии интернет-маркетинга WebРromoExperts. Более 8 лет в IT разработке, 6 из них успешно руководит проектами. За это время было выполнено около 100 различных проектов: от партнерок и сайтов компаний до учебных порталов и систем оценок персонала.

Что вы узнаете на онлайн-семинаре:


Что делать в первую очередь, если нужен сайт.
Магический треугольник проекта: как соотносить время, качество и деньги.
Кто вам понадобится чтобы сделать сайт.
Как работать в условиях сжатого бюджета, на чем можно сэкономить, как закрыть задачи собственным ресурсом.
Технические требования и техническое задание, в чем разница, нужны ли они?
Поэтапный контроль исполнителей — как смотреть и видеть реальную картину.
Очевидных вещей не существует — о чем не следует забывать.


Семинар будет особенно полезен:


маркетологам, которым поручили создание сайта;
предпринимателям, которым необходимо это сделать самостоятельно;
специалистам начинающим свой путь в IT.

Стоимость: участие онлайн — бесплатно, запись семинара — 200 грн. 

Регистрируйтесь

2. Бесплатный онлайн-семинар: «10 критических ошибок, которые уводят клиентов с вашего сайта: краткое пособие, как их избежать».
Когда: 12 ноября, 15.00 (по Киеву).



Виктория Абед — эксперт по маркетинговым стратегиям и коммуникациям. Имеет 11-летний опыт работы развития международного бизнеса, 9 из которых – практический опыт в маркетинге. 

Что вы узнаете на онлайн-семинаре:


10 критических ошибок, которые уводят клиентов с вашего сайта: краткое пособие, как их избежать.
Что в первую очередь исправить на сайте прямо сейчас.
О чем не следует забывать, имея свой сайт.
Каким сайт должен быть в 2019 году.
Какие технические требования для сайта.
Как сделать сайт простым и понятным для пользователей.


Семинар будет особенно полезен:


владельцам бизнеса;
маркетологам;
тем, кто занимается сайтом самостоятельно.

Стоимость: участие онлайн — бесплатно, запись семинара — 200 грн. 

Регистрируйтесь

3. Онлайн-семинар: «Копирайтинг 80 level: секреты продающих и интересных текстов».
Когда: 14 ноября, 15:00 (по Киеву).



Инна Татолова – копирайтер, журналист, экс-автор Сosmopolitan Ukraine, Elle Ukraine, Marie Claire Ukraine. Больше семи лет работает в журналистике. Была автором самых разных украинских изданий — UBR.ua, Cosmopolitan Ukraine, Elle.ua, Marie Claire Ukraine, AIN.UA.

Что вы узнаете на онлайн-семинаре:


Что такое рекламный текст и чем он отличается от статьи.
Какие тексты хочется читать.
Из каких частей должен состоять продающий текст.
Как создается контент: детальная схема создания текстового контента, от наработок темы, до стратегии и написания.
Какие стоп-слова лучше не использовать в текстах.
Что такое SEO-текст, и что с ним делать.
Где искать темы для текстов, если вдохновение не приходит.
Как научиться писать краткие, но информативные тексты.

Бонус! В прямом эфире специалист разберет ваши тексты и даст рекомендации по написанию текстов в вашей нише!

Семинар будет особенно полезен:


копирайтерам;
SMM-специалистам;
собственникам бизнеса.

Стоимость: early bird — 300 грн, в день семинара — 350 грн.

Регистрируйтесь

4. Онлайн-конференция: «Pharma Digital Day. Впервые бесплатно про онлайн продвижение фармацевтических компаний».
Когда: 15 ноября, 9:30 (по Киеву).



Как фармацевтическому бренду рассказать о себе, как продвигать продукт в рамках законодательства, как привлекать людей и создать правильный имидж? В сложной нише фармацевтической продукции существует так много подводных камней.
Для кого? Для диджитал специалистов, которые продвигают фармкомпании, для владельцев, руководителей, топ-менеджеров, маркетологов фармацевтических компаний и фармацевтов, которые хотят разобраться в digital.
Что именно вы узнаете? 

Как увеличить продажи фармацевтической продукции в интернете.
Как продвигать продукцию с учетом законодательства.
Как выбрать правильную стратегию и выстроить грамотный SMM.
Новые технологии и тренды в фарминдустрии на 2020 год.
Как выстроить digital-стратегию в рамках общей стратегии фармацевтического бренда.

Кто спикеры? 
Владимир Скиба (Dr Reddy’s), Ирина Буртовая (Takeda), Елена Кормилюк.(Bayer), Ирина Пашкетник (Фармак), Юлия Литовченко (Programmatic Media Group), Владимир Демяненко (D2), Антон Авринский (Liki24), и др.
Нет возможности присоединиться в день эфира? Вы можете приобрести предварительно запись конференции по выгодной цене.

Регистрируйтесь

5. Бесплатный онлайн-семинар: «SMM-специалист — Шива или нет? Ключевые навыки SMM-менеджера для реализации маркетинга в социальных сетях».
Когда: 19 ноября, 15.00 (по Киеву).



Анастасия Радионова — SMM Head в DIEVO. Работает с социальными сетями более 5 лет. В портфолио Анастасии кейсы брендов АВК, Huggies, Tuborg, Kinder, Lenovo, Karcher, Suzuki, Нова Пошта и многие другие. Верит в кост-эффективный SMM, работу с аудиторией и системный подход к управлению social media.

Что вы узнаете на онлайн-семинаре:


Основные функции, которые решает Social Media Marketing для бизнеса.
Типовые задачи менеджера по работе с социальными сетями в агентстве и для малого бизнеса.
Что должен уметь начинающий SMM-специалист и какие навыки развивать в процессе работы.
Как видят менеджера по работе с социальными сетями клиенты и работодатели.
Предупрежден — значит вооружен. Ключевые KPI`s для самооценки.
 Повышение квалификации: откуда черпать новые знания и вдохновение.
 5 правил крутого SMM-специалиста.


Семинар будет особенно полезен:


начинающим SMM-специалистам;
digital-маркетологам;
предпринимателям.

Стоимость: участие онлайн — бесплатно, запись семинара — 200 грн. 

Регистрируйтесь

6. Онлайн-семинар: «LinkedIn 3 в 1: репутация, карьера, продажи».
Когда: 21 ноября, 15:00 (по Киеву).



Станислав Маслихин — директор по маркетингу Октава Киберзащита. Станислав 9 лет в В2В маркетинге (из них 7 лет на управленческих позициях). Сотрудничал с компаниями из IT, агро, полиграфии, машиностроения, рекламы, полимерной отрасли. Ключевые компетенции: стратегический маркетинг, создание отдела маркетинга под ключ, интернет-маркетинг.

Что вы узнаете на онлайн-семинаре:


Что такое LinkedIn и для чего может быть полезна данная социальная сеть.
Что нужно сделать прежде, чем регистрироваться в LinkedIn.
Основные компоненты all-star профиля.
Ключевые зоны роста сети контактов.
Контент в LinkedIn: статистика и алгоритмы.
Аналитика в LinkedIn.
Дополнительные возможности в LinkedIn.


Семинар будет особенно полезен:


B2B-маркетологам;
cпециалистам, которые хотят развивать карьеру и личный бренд;
руководителям отдела продаж.

Стоимость: early bird — 300 грн, в день семинара — 350 грн.

Регистрируйтесь

7. Бесплатный онлайн-семинар: «YouTube – место встречи бренда с целевой аудиторией».
Когда: 26 ноября, 15.00 (по Киеву).



Дмитрий Андреев — основатель креативной консалтинговой компании MOON Studio. Дмитрий Андреев в 2015-м основал продакшн MOON studio. Среди списка клиентов также: BMW, Rolls Royce, Aston Martin, Walker, международный бренд PocketBook, магазин Gara Гарика Корогодского, IWC, Chanel и Dior.

Что вы узнаете на онлайн-семинаре:


Как разработать стратегию для YouTube канала.
Как определиться с направлением и наполнением канала.
Как измерить эффективность этого инструмента.
Примеры нескольких концепций B2B роликов.
Карта тем для контента YouTube канала.
Перечень инструментов для проверки качества заполнения информационного выпуска (заголовки, теги, SEO).


Семинар будет особенно полезен:


владельцам бизнеса любой величины;
руководителям компаний и брендов/CEO;
руководителям отдела маркетинга/CMO.

Стоимость: участие онлайн — бесплатно, запись семинара — 200 грн. 

Регистрируйтесь

8. Онлайн-семинар: «Что ждет SEO в 2020 году?».
Когда: 28 ноября, 15:00 (по Киеву).



Дарья Хмельницкая — SEO-специалист в продуктовой компании SE Ranking. Больше 5 лет практического опыта в SEO для разных тематик. Продвигала сайты под СНГ, Европу, США. Выступает на топовых конференциях, посвященных SEO сфере — SEO Day, SEMPRO.

Что вы узнаете на онлайн-семинаре:


Для тех, кто переживает, не умрет ли SEO.
Обзор и анализ нововведений за 2019 год.
Что в «Яндексе», куда движется поисковик.
Продумываем стратегию на будущий год, учитывая нововведения поисковиков.
Какие практики будут актуальны в 2020 году.
Как использовать изменения в поисковиках с пользой.
Что лучше оставить в 2019 году.
Как использовать изменения в поисковиках с пользой.
Как продумать стратегию по SEO на 2020 год.


Семинар будет особенно полезен:


SEO-специалистам;
интернет-маркетологам;
владельцам бизнеса.

Стоимость: early bird — 300 грн, в день семинара — 350 грн.

Регистрируйтесь



",ru,"











8 key November digital events from WebPromoExperts

07 Nov 2019, 14:00

WebPromoExperts Academy of Internet Marketing has prepared for you a selection of useful online events in November, thanks to which you can pump your skills, learn new things and get expert advice from speakers live.
You will learn:

what you should pay attention to when creating sites so as not to overpay and save your budget;
what are the 10 critical errors that lead customers away from your site;
secrets of selling, interesting and short texts;
what is the difference between the “text messenger” and the SMM specialist and get 5 rules of a cool SMM specialist;
what is LinkedIn and how to use it effectively to promote your services or business in general;
how to promote your YouTube channel, get a theme map for content on the channel and a list of tools for checking the quality of filling out the news release;
what awaits SEO in 2020, what it will be and what practices will be relevant;
cases of successful promotion of pharmaceutical companies on the Internet.

1. Free online seminar: ""How to make a website with the wrong hands and not overpay.""
When: November 7, 15.00 (in Kiev).



Igor Mikhaylyuk is the head of the IT department of the Academy of Internet Marketing WebРromoExperts. More than 8 years in IT development, 6 of them successfully manage projects. During this time, about 100 various projects have been completed: from affiliate programs and company websites to training portals and staff rating systems.

What you will learn at the online seminar:


What to do first if you need a site.
The magic triangle of the project: how to correlate time, quality and money.
Who will you need to make a site.
How to work in a tight budget, where you can save money, how to close tasks with your own resource.
Technical requirements and technical specifications, what is the difference, are they needed?
Phased control of performers - how to look and see the real picture.
Obvious things do not exist - which should not be forgotten.


The workshop will be especially useful:


marketers who have been tasked with creating the site;
Entrepreneurs who need to do this themselves;
professionals starting their journey in IT.

Cost: participation online - free of charge, seminar recording - 200 UAH.

Sign up

2. Free online seminar: ""10 critical mistakes that lead customers away from your site: a short guide on how to avoid them.""
When: November 12, 15.00 (in Kiev).



Victoria Abed is an expert on marketing strategies and communications. He has 11 years of international business development experience, 9 of which are practical marketing experience.

What you will learn at the online seminar:


10 critical mistakes that lead customers away from your site: a short guide on how to avoid them.
What is the first thing to fix on the site right now.
What should not be forgotten, having your own site.
What the site should be in 2019.
What are the technical requirements for the site.
How to make the site simple and understandable for users.


The workshop will be especially useful:


business owners;
marketers
those who deal with the site on their own.

Cost: participation online - free of charge, seminar recording - 200 UAH.

Sign up

3. Online seminar: “Copywriting 80 level: secrets of selling and interesting texts.”
When: November 14, 15:00 (in Kiev).



Inna Tatolova - copywriter, journalist, ex-author of Cosmopolitan Ukraine, Elle Ukraine, Marie Claire Ukraine. He has been working in journalism for more than seven years. She was the author of a variety of Ukrainian publications - UBR.ua, Cosmopolitan Ukraine, Elle.ua, Marie Claire Ukraine, AIN.UA.

What you will learn at the online seminar:


What is an advertising text and how does it differ from an article.
What texts do you want to read.
What parts should the selling text consist of.
How content is created: a detailed scheme for creating text content, from the topic to the strategy and writing.
What stop words are better not to use in texts.
What is SEO text and what to do with it.
Where to look for themes for texts if inspiration doesn't come.
How to learn to write short, but informative texts.

Bonus! Live specialist will analyze your texts and give recommendations on writing texts in your niche!

The workshop will be especially useful:


copywriters;
SMM specialists
business owners.

Cost: early bird - 300 UAH, on the day of the seminar - 350 UAH.

Sign up

4. Online Conference: “Pharma Digital Day. For the first time, free about the online promotion of pharmaceutical companies. ”
When: November 15, 9:30 (in Kiev).



How can a pharmaceutical brand tell about itself, how to promote a product under the law, how to attract people and create the right image? There are so many pitfalls in the complex pharmaceutical niche.
For whom? For digital specialists who promote pharmaceutical companies, for owners, managers, top managers, marketers of pharmaceutical companies and pharmacists who want to understand digital.
What exactly do you learn?

How to increase sales of pharmaceutical products on the Internet.
How to promote products subject to legislation.
How to choose the right strategy and build a competent SMM.
New technologies and trends in the pharmaceutical industry for 2020.
How to build a digital strategy as part of the overall strategy of a pharmaceutical brand.

Who are the speakers?
Vladimir Skiba (Dr Reddy’s), Irina Burtovaya (Takeda), Elena Kormilyuk. (Bayer), Irina Pashketnik (Farmak), Yulia Litovchenko (Programmatic Media Group), Vladimir Demyanenko (D2), Anton Avrinsky (Liki24), etc.
No way to join on air? You can pre-record the conference at a bargain price.

Sign up

5. Free online seminar: “SMM specialist - Shiva or not? Key skills of an SMM manager for marketing on social networks. ”
When: November 19, 15.00 (in Kiev).



Anastasia Radionova - SMM Head at DIEVO. He has been working with social networks for more than 5 years. Anastasia's portfolio includes cases of the brands AVK, Huggies, Tuborg, Kinder, Lenovo, Karcher, Suzuki, Nova Poshta and many others. He believes in cost-effective SMM, work with the audience and a systematic approach to managing social media.

What you will learn at the online seminar:


Key features that Social Media Marketing for Business solves.
Typical tasks of the manager for working with social networks in the agency and for small businesses.
What should be able to beginner SMM-specialist and what skills to develop in the process.
As seen by the social media manager, clients and employers.
Forewarned is forearmed. Key KPI`s for self-esteem.
Further education: where to get new knowledge and inspiration from.
5 rules of a cool SMM specialist.


The workshop will be especially useful:


novice SMM specialists;
digital marketers;
entrepreneurs.

Cost: participation online - free of charge, seminar recording - 200 UAH.

Sign up

6. Online seminar: “LinkedIn 3 in 1: reputation, career, sales.”
When: November 21, 15:00 (in Kiev).



Stanislav Maslihin - Marketing Director Octava Cyber Defense. Stanislav is 9 years in B2B marketing (of which 7 years in managerial positions). He collaborated with companies from IT, agricultural, printing, engineering, advertising, the polymer industry. Key competencies: strategic marketing, the creation of a turnkey marketing department, Internet marketing.

What you will learn at the online seminar:


What is LinkedIn and why can this social network be useful.
What you need to do before registering with LinkedIn.
The main components of an all-star profile.
Key areas of contact network growth.
LinkedIn Content: Statistics and Algorithms.
LinkedIn analytics.
Additional features on LinkedIn.


The workshop will be especially useful:


B2B marketers;
to specialists who want to develop a career and personal brand;
sales managers.

Cost: early bird - 300 UAH, on the day of the seminar - 350 UAH.

Sign up

7. Free online seminar: “YouTube is the meeting place of the brand with the target audience.”
When: November 26, 15.00 (in Kiev).



Dmitry Andreev is the founder of the creative consulting company MOON Studio. Dmitry Andreev in 2015 founded the production of MOON studio. Among the list of clients also include: BMW, Rolls Royce, Aston Martin, Walker, the international PocketBook brand, Gara Garik Korogodsky’s store, IWC, Chanel and Dior.

What you will learn at the online seminar:


How to develop a strategy for a YouTube channel.
How to determine the direction and content of the channel.
How to measure the effectiveness of this tool.
Examples of several concepts of B2B videos.
Theme map for YouTube channel content.
The list of tools for checking the quality of filling the news release (headings, tags, SEO).


The workshop will be especially useful:


business owners of any size;
heads of companies and brands / CEO;
Heads of Marketing / CMO.

Cost: participation online - free of charge, seminar recording - 200 UAH.

Sign up

8. Online seminar: “What awaits SEO in 2020?”.
When: November 28, 15:00 (in Kiev).



Daria Khmelnitskaya - SEO-specialist in the product company SE Ranking. More than 5 years of practical experience in SEO for various topics. Promoted sites under the CIS, Europe, USA. Speaks at top conferences on SEO - SEO Day, SEMPRO.

What you will learn at the online seminar:


For those who worry if SEO dies.
Review and analysis of innovations for 2019.
What's in Yandex, where the search engine is heading.
We are thinking through a strategy for next year, taking into account the innovations of search engines.
What practices will be relevant in 2020.
How to use changes in search engines with benefit.
What is better to leave in 2019.
How to use changes in search engines with benefit.
How to think up a SEO strategy for 2020.


The workshop will be especially useful:


SEO specialists;
Internet marketers
business owners.

Cost: early bird - 300 UAH, on the day of the seminar - 350 UAH.

Sign up



"
