,src,lang,text
0,"











Piyasaların yönü
04 Nov 2019, 01:00 by Feridun Eyüpoğlu
Piyasalar bekle gör moduna girdi.
Peki neyi bekleyip neyi görecek yatırımcı?
Öncelikle nispeten dar banta kavuşan piyasa hareketlerini sağlayan koşulların kalıcı olup olmadığı görülecek.
Son zamanlarda öne çıkan iyimserliğin temelinde küresel faiz politikalarının rolü büyük.
Geçen hafta Amerikan Merkez Bankası Fed, 25 baz puan indirim yaptı faizlerde.

Gevşek para politikasının devamını kısmen de olsa teyit eden açıklamaların eşliğindeki bu indirim Türkiye gibi gelişmekte olan piyasalara şimdilik moral vermeyi sürdüryor.

Benzer bir tutumu Avrupa Merkez Bankası da önceki hafta sergilemişti.
Bu atmosfer TCMB’nin de 250 baz puanlık indirimle cesur bir adım atmasını sağlamıştı!
Jeopolitik arenada Suriye’ye dönük güvenli bölge yaratma sürecinde alınan mesafe de Türk para piyasalarına nefes aldıran bir unsur oldu.
Ayrıca dıştaki en önemli gündem maddelerinden bir olan ABD-Çin ticaret kapışmasındaki nispeten sakin seyir destekleyici bir unsur niteliği taşıyor.

Bu manzara Merkez Bankası’nın beklentileri aşan faiz indirmine kurun niye tepki vermediğini de anlatıyor!

Ama ülke risk primi hala tam olarak rahatlamış değil.
Uzun süredir ilk kez bir kredi derecelendirme kuruluşunun bize gülümsemesi de 5 yıllık CDS’in 320’nin altına gelmesini sağlayamadı.

Yüzde 14’e inen politika faizimiz; enflasyondaki ana trendlere baktığımızda reel faiz anlamında koruma opsiyonunu yitiriyor görünsütü vermekte!

Dolayısıyla tedbirli olunması gereken günlerdeyiz.
Yukarıda çizdiğimiz destekleyici manzaraya zarar verebilecek gelişmeler piyasalamızda sert hareketlere yol açabilir çünkü.

Fed’in politikalarını değiştirebilecek veri ve haber akışı bu anlamda yakın takip altında bulunuyor.

Keza ilk faz anlaşmanın yakın olduğu belirtilen ABD-Çin ticaret görüşmelerini sabote edecek herhangi bir adım piyasaların tadını kaçırabilir!
Ameriakn Başkanı Donald Trump’ın olası sürpriz tweetleri de gündemi etkileme potansiyeli taşımakta.
Özellikle de azil sürecinin tetiklenmiş olması Trump’ı yeni atraksiyonları yöneltebilir.
Bu çerçevede zikzaklı bir seyir izleyen Türk-Amerikan ilişkilerindeki gidişat da büyük önem taşıyor.

Cumhurbaşkanı Recep Tayyip Erdoğan’ın 13 Kasım’daki olası ABD ziyaretine ilişkin süreç bu anlamda büyük önem taşıyor!

Çünkü Türkiye’yi ikide birde hedef alan Kongre kararlarıyla karşılaşıyoruz.
Keza Trump’ın da yanar döner nitelik taşıyan açıklamaları ve uygulamaları da her an suyu bulandırma potansiyeline sahip.
Bu haftanın iç gündeminde ise görülmesi gereken en önemli veri enflasyon cephesinden gelecek.

Yüzde 1,75 civarı beklediğim ekim enflasyonu baz etkili olarak yıllık TÜFE’yi 2019’un dip seviyesine itecektir.

Ancak, artık düşüş trendinin sonuna geldiğimiz de istatistik bilimi bize söylüyor.
Ekim rakamlarının sinyal etkisi yatırımcı için yön tayini açısından önem taşımakta.
 

Haftalık beklentiler

 
Haftalık bazdaki teknik beklentilerde dar banttaki tenkinli hareketin normal koşullarda gündemde kalması söz konusu.
BİST 100 Endeksi’nde 97 bin punalık destek dikkatle takip edilmeli.
Anormal bir gelişme endeksi 95 bin seviyesine itebilir.
Yükselişi destekleyecek atmosfer oluşumları ise bizi 101 bin direncinin yeniden test edilmesine yöneltir.

Dolar/TL’de 5,64 – 5,84 aralığı haftanın beklentileri arasında öne çıkıyor!

Euro’ya baktığımızda ise karşımıza 6,27 - 6,48 TL bandı çıkmakta.
Dar bantta sıkışma eğilimiz gösteren gram altının olası seyri ise 272 – 285 liralık aralığı gündeme taşıyor.


",tr,"











Direction of markets
04 Nov 2019, 01:00 by Feridun Eyüpoğlu
Markets entered wait-and-see mode.
So what to expect and see what investor?
First of all, it will be seen whether the conditions that provide market movements with relatively narrow band are permanent or not.
Global interest rate policies play a major role in the recent optimism.
Last week the Federal Reserve, the Federal Reserve, cut 25 basis points interest rates.

partly because of the reduction in this accompanied by continued loose monetary policy for the time being, though confirming the release to the morale emerging markets such as Turkey sürdüry.

The European Central Bank took a similar position the previous week.
This atmosphere enabled the CBRT to take a bold step with a 250 basis point discount!
In the geopolitical arena, the distance taken in the process of creating a safe zone towards Syria was a factor that made Turkish money markets breathe.
Moreover, the relatively calm course of the US-China trade confrontation, one of the most important agenda items on the outside, is a supportive factor.

This view also explains why the Central Bank did not react to the rate cut that exceeded expectations.

But the country's risk premium is still not fully relieved.
For the first time in a long time, a credit rating agency's smile to us could not bring the 5-year CDS below 320.

Our policy rate decreased to 14 percent; When we look at the main trends in inflation, it seems that the real interest rate is losing its protection option!

Therefore, we are in a cautious day.
Developments that may damage the supporting landscape we have drawn above can lead to harsh movements in our market.

The data and news flow that can change the Fed's policies are closely monitored in this sense.

Likewise, any step that could sabotage US-China trade talks that the first phase of the deal is close to may spoil the markets!
Ameriakn President Donald Trump's potential surprise tweets also have the potential to influence the agenda.
In particular, the process of dismissal may trigger Trump's new attraction.
In this context, the trend in Turkish-American relations, which follows a zigzag course, is also of great importance.

President Recep Tayyip Erdoğan's visit to the United States on November 13 is very important in this sense!

Because we face Turkey in a target area with two Congress resolutions.
Likewise, Trump's revolving statements and practices have the potential to make water cloudy at any time.
The most important data to be seen in this week's domestic agenda will come from the inflation front.

October inflation, which I expected around 1.75 percent, will push the annual CPI to the bottom level of 2019 with a base effect.

However, the science of statistics tells us that we are now at the end of the downtrend.
The signal effect of October figures is important for the investor in determining the direction.


Weekly Expectations


Technical expectations on a weekly basis are likely to keep the narrow-band taut movement on the agenda under normal circumstances.
97 thousand points of support in the BIST 100 Index should be followed carefully.
An abnormal development index can push to 95,000.
On the other hand, atmospheric formations that support the rise lead us to retest the resistance of 101 thousand.

Dollar / TL 5.64 - 5.84 range stands out among the expectations of the week!

When we look at the Euro, we see a band of 6.27 - 6.48 TL.
In the narrow band, the possible course of gram gold, which shows a tendency to jam, carries the range of 272 - 285 pounds.


"
