,src,lang,text
0,"











DTF смотрит: советуем хорроры — оригинальные, страшные и неглупые
02 Nov 2019, 19:21 by Вадим Елистратов
Хэллоуин был в четверг, но для тех, кто хочет поддержать настроение, редакция DTF советует хорроры.
Мы решили себя ни в чём не ограничивать, так что тут есть и новинки, и ретро, и мнения о картинах, которые вы наверняка смотрели.
Егор Аргунов — «Голова-ластик»
Однажды посмотрев «Голову-ластик», вы не забудете его никогда. Это первый фильм великого Дэвида Линча и по совместительству его самая необычная, экспериментальная и по-хорошему сумасшедшая работа.
Завязка у фильма, впрочем, проста. Генри Спенсер, скромный мужчина с необычной причёской, неожиданно узнаёт о том, что стал отцом. Правда, его девушка родила не совсем обычного ребёнка — скорее гуманоида непонятного происхождения, напоминающего то ли эмбриона, то ли инопланетянина. Девушка, не выдержав и часа с новорождённым, уходит восвояси, а Генри остаётся лишь ухаживать за своим уродливым ребёнком.



Полтора часа, которые зритель переживёт вместе с Генри, рискуют стать вашим самым сюрреалистичным опытом просмотра кино. Линч нарушает привычные приёмы повествования, а многие моменты, происходящие в фильме, не получится адекватно объяснить ни при каких обстоятельствах. Не зря Стэнли Кубрик показывал съёмочной команде «Сияния» именно «Голову-ластик». Другого такого хоррора — умного и по-настоящему уникального — вы не найдёте.
Алина Абрамянц (Jemma Jenkins) — «Аннигиляция»
«Аннигиляция» Алекса Гарленда — один из немногих фильмов, которые я не буду пересматривать. С меня хватило просмотра мрачным январским вечером.
У «Аннигиляции» была сложная прокатная судьба: в студии Paramount решили, что она своей интеллектуальностью отпугнёт массового зрителя, а продюсер Скотт Рудин выступил против неминуемой переделки фильма. И пока студия думала, как угодить всем сразу, вокруг «Аннигиляции» возник ореол одной из самых умных научно-фантастических лент последних лет, которую именно из-за «заумности» и не пускают в широкий прокат. То есть фильм, можно сказать, сам себя продвинул как первоклассную научную фантастику с налётом триллера — а я такое очень люблю. А хорроры, наоборот, не люблю.



Впервые я увидела «Аннигиляцию» весной, задолго до рокового январского просмотра, и она меня совершенно не напугала: всё яркое, сочное, медведь немного нелепо кричит. Но во время второго просмотра — при тусклом свете, в одиночестве и с громким звуком в наушниках — я наконец поняла, почему фильма так боятся: на передний план вылезла беспомощность главных героинь перед неизвестным противником, тошнотворные визуальные образы, пугающе неестественные звери и прочие проявления неясной силы, которая подминает всё под себя. Самое страшное, что для меня было в фильме — это медведь, кричащий «Help me». Никому не пожелаю впервые увидеть его ночью.
В остальном «Аннигиляция» — действительно любопытная фантастика, в которой интересно самому нащупывать главную метафору и потом размышлять о ней. И лучше всего, конечно, не в темноте.
Олег Чимде — «Солнцестояние»
«Солнцестояние» Ари Астера — это «хоррор при свете дня». В темноте там буквально пара моментов, в остальном же кино очень светлое, яркое. Скримеров в нём нет, зато есть нечто пострашнее: очень сложные ситуации, в которые попадают главные герои, сильнейшее напряжение между ними и искажающееся пространство.
Завязка для хорроров, при этом, стандартная: по жанру «Солнцестояние» даже можно причислить к слэшерам. Группа студентов приезжает в шведскую общину, чтобы оторваться, а заодно изучить её — двое из героев пишут диссертацию на тему закрытых древних сообществ. Среди них есть типичный умник, легкомысленный тусовщик, болван и его девушка, страдающая из-за недавней трагедии.


Фильм очень красиво снят. Обратите внимание на фон. Видите ли вы среди деревьев что-то необычное?

Однако никаким клише Астер не следует. Напротив, он идёт против течения и пугает совсем не тем, чем ожидаешь, хоть жесть в фильме и тоже есть. Общину он показывает таким образом, что в неё искренне веришь и принимаешь местные обычаи — они логичны, хоть и идут вразрез со всем тем, что принято в цивилизованном обществе. Это настоящая семья, где есть искреннее сочувствие и забота. И самое страшное здесь то, что вам может захотеться в ней жить.
Алексей Хромов — «Оцепеневшие от страха»
В последние годы жанр хоррора переживает эпоху ренессанса. Но всё же лучшие новые его представители — фильмы с каким-нибудь социальным подтекстом. А иногда хочется чего-нибудь простого, но очень страшного, как в юности.
И с этой задачей отлично справляется фильм «Оцепеневшие от страха». В прокате он прошёл практически незамеченным, что вполне ожидаемо для дешёвой картины, снятой в Аргентине. Но, несмотря на классический сюжет и простоту спецэффектов, ему есть чем напугать зрителя.



Сюжет разворачивается в спальном районе небольшого города, где начинают происходить жуткие необъяснимые явления: мёртвая женщина летает по ванной, а сбитый машиной ребёнок возвращается с кладбища. Полицейские и исследователи сверхъестественного пытаются разобраться в причинах происходящего.
Несмотря на то, что действие, в основном, происходит всего в трёх домах, авторы сумели действительно нагнать страху. Всё дело в классическом подходе: чудовища постоянно мелькают где-то на фоне в полутьме. Но даже когда они показываются полностью, придраться к качеству грима и эффектов захочется только постфактум, после того, как пройдёт первый испуг. Очень уж правильно выстроен темп.
Илья Цуканов — «Кабинет доктора Калигари»
Если не знаете, что посмотреть из хорроров, взгляните на «Кабинет доктора Калигари» — классику девяносто девятилетней давности, с которой начинались многие приёмы жанра киноужасов.
На ежегодной ярмарке в немецкий городок таинственный доктор Калигари показывает всей публике свою диковинку — сомнамбулу, человека, что спит на протяжении вот уже двадцати трёх лет, просыпается только по приказу доктора и предсказывает будущее. И на следующий день начинаются загадочные убийства. Дальше про сюжет я вам рассказывать не буду, потому что финал может удивить.



Хотя главная ценность этого фильма в том, как именно он снят: игра актёров крайне экспрессивна, а искорёженные и противоестественно изогнутые декорации смотрятся безумно сюрреалистично даже сегодня.
Виктор Рут — «Сквозь горизонт»
«Сквозь горизонт» умело пугает не только тем, что в кадре, но и тем, что остаётся за ним. А ещё это неофициальный приквел к Warhammer 40,000 (по крайней мере в это хотят верить фанаты).
Действие фильма происходит в недалёком будущем. Согласно сюжету, бесследно исчезнувший экспериментальный космический корабль Event Horizon, вдруг появился около Нептуна. К нему сразу же направляют группу спасателей, которым даже не сказали кого они должны спасать. Ну и, конечно же, оказывается, что этот корабль — самая настоящая колыбель зла.


«Там, куда мы отправимся, не нужны глаза, чтобы видеть»

В первой половине фильма герои ведут себя максимально правдоподобно — отказываются выполнять миссию ещё на первых минутах, почти что сразу раскрывают главную загадку корабля и делают всё возможное, чтобы поскорее с него сбежать. Но, к сожалению, ко второй половине они почему-то начинают следовать всем известным клише.
Тем не менее режиссёру Андерсону удалось создать много пугающих моментов, которые надолго остаются в памяти после просмотра. Да и пугают тут не только жестокие и кровавые сцены, а и контекст в котором существует местное зло.
Иван Абрамов — Head Count
Head Count — режиссёрский дебют Элли Каллахан, вышедший сразу на Netflix, минуя кинотеатры. Это низкобюджетный хоррор с малоизвестными актёрами, собравший прохладные отзывы критиков, но, на мой вкус, фильм идеально подходит для просмотра в компании друзей на хэллоуинской вечеринке.
По сюжету главный герой оказывается на тусовке среди абсолютно незнакомых ему людей. Компания случайно призывает некую потустороннюю сущность, травя страшные истории у костра — фишка в том, что та может принимать облик абсолютного любого человека.



Head Count — фильм одной концепции, которую элегантно обыграли с помощью жуткого саунд-дизайна и специфической операторской работы. Камера никогда не показывает всех участников вечеринки разом — из-за этого до последнего не знаешь, кто из персонажей настоящий, а кто двойник. Основные события всё время разворачиваются где-то за кадром — этот приём сглаживает шероховатости фильма и делает его отличным хоррором на раз. В общем, это что-то типа It Follows, только чуть попроще.
Андрей Лисяный — «Чёрное зеркало», выпуск «Белое Рождество»
Чёрное зеркало — сериал-антология мелодрам, сатир и триллеров, объединенной темой влияния современных соцсетей и информационных технологий на общество. Одна из главных тем Зеркала — оцифровка личности и связанные с нею опасности. Это довольно старая идея, популярная в книжной фантастике, играх и аниме, но Чарли Брукеру удалось её освежить, показав в мире в «пяти минутах от нашего».
Белое Рождество — специальная серия, состоящая из трёх небольших зарисовок, объединённых общей историей. Одно из достоинств сериала — непредсказуемость сюжета, так что смотреть эпизод лучше не зная вообще ничего. Стоит лишь заметить, что серия написана на пике популярности сериала и может послужить хорошей отправной точкой для знакомства.



Но главное достоинство Белого Рождества и антологии в целом — экзистенциальный ужас. Не скримеры, не отвратительные сцены, а более глубокие и страшные вещи. Подобно SOMA Чёрное зеркало заставляет задуматься о нашей собственной природе, и о кошмарных пытках, которые мы сами можем построить в погоне за технологиями и благополучием. Чем дальше, тем больше ощущение, что всё неправильно, нечестно, что люди не должны так жить. В итоге, спокойный разговор двух человек в светлой комнате вызывает больше дискомфорта и ужаса, чем десяток другой фильмов о монстрах и зомби.
Александр Омолоев (Сэм Спейд) — «Порок»
ФБР никак не может найти серийного убийцу, который терроризирует техасскую глубинку, но тут к следователю приходит крепкий парень по имени Фэнтон Мейкс и уверенно заявляет, что знает виновного – маньяком был его брат. Впрочем, беспокоиться не о чем – тот покончил с собой и лежит в машине «скорой» через дорогу, подите взгляните.
Что-то в этой истории, конечно, не так. Допрос продолжается, и Мейкс рассказывает, с чего всё началось – с двух мальчиков и их доброго, заботливого папы, которому однажды явился ангел. Высшие силы наказали папе истреблять демонов, а для удобства оставили топор, рукавицы и список фамилий. Так и зажили – папа рубил людей на задворках, сын постарше и посообразительнее на него злился, а помладше – сперва пытался добавить в отцовский список своих школьных неприятелей, но потом что-то понял – и сам стал ждать ангела.



«Порок» – режиссёрский дебют Билла Пэкстона, который заодно сыграл папу – несовершенный, скромный фильм и, строго говоря, вообще не хоррор. Вступление похоже то ли на камерный детектив, то ли на исповедь. Вторая часть – на психопортрет семьи, в которой теряется грань между нормой и безумием. И даже рубяще-режущий финал – это не бог весть как страшно. «Порок» не о том. Где обычные хорроры кидаются на людей, чтобы те вздрагивали, этот фильм заставляет содрогаться. И показывает, как выразился бы Ларс фон Триер, наглядный пример – в том смысле, что если ангел прибавит к списку твою фамилию, возразить будет нечего.
Вадим Елистратов — «Игра Джеральда»
Я довольно долго пролистывал этот фильм на Netflix, пока не узнал, что его снял Майк Флэнаган — шоураннер «Призраков дома на холме». Более того, эта картина — нечто вроде творческого фундамента для сериала. Тут Флэнаган пробует схожие приёмы и даже актёров, которых он потом позовёт в своё шоу.
«Игра Джеральда» — это экранизация одноимённого романа Стивена Кинга. Муж (собственно, Джеральд) и его красотка жена Джесси (Карла Гуджино) приезжают в загородный дом, чтобы остаться наедине на все выходные.



Страсть в их отношениях с годами угасла, поэтому они пробуют реализовать свои сексуальные фантазии. Джеральд приковывает Джесси к кровати настоящими наручниками, но когда она говорит ему остановиться, он хватается за сердце и умирает, оставив супругу в заточении. Тем временем в дом забегает пока ещё не голодный бездомный пёс, которого Джесси недавно прикормила...
Удивительно, но эта завязка ведёт к глубокому и реально страшному фильму. Как и свойственно Кингу, события быстро уходят в логику сна, а главная героиня борется не только за выживание, но и с демонами прошлого. Ну а Флэнаган показывает своё мастерство, вытаскивая фильм, действие которого почти целиком разворачивается в одной комнате.


",ru,"











DTF is watching: we recommend horror - original, scary and intelligent
02 Nov 2019, 19:21 by Vadim Elistratov
Halloween was on Thursday, but for those who want to keep their spirits up, DTF editors advise horror.
We decided not to limit ourselves to anything, so there are novelties, and retro, and opinions about the paintings that you probably watched.
Egor Argunov - “Eraserhead”
Once you see the ""Eraserhead"", you will never forget it. This is the first film of the great David Lynch and part-time his most unusual, experimental and in a good way crazy work.
The plot of the film, however, is simple. Henry Spencer, a modest man with an unusual hairstyle, suddenly finds out that he became a father. True, his girlfriend gave birth to a not quite ordinary child - rather a humanoid of incomprehensible origin, resembling either an embryo or an alien. The girl, unable to stand an hour and a newborn, leaves home, and Henry can only take care of his ugly child.



The hour and a half that the viewer will experience with Henry risk becoming your most surreal experience of watching a movie. Lynch violates the usual tricks of the story, and many of the moments in the film cannot be adequately explained under any circumstances. It was not for nothing that Stanley Kubrick showed exactly the Eraserhead to the Shining crew. You will not find another such horror - smart and truly unique.
Alina Abramyants (Jemma Jenkins) - Annihilation
The “Annihilation” of Alex Garland is one of the few films that I will not be revising. I've had enough viewing on a gloomy January evening.
Annihilation had a difficult rolling fate: Paramount decided that it would scare the mass audience off with its intelligence, and producer Scott Rudin opposed the imminent remake of the film. And while the studio was thinking how to please everyone right away, around “Annihilation” there was an aura of one of the smartest science fiction films of recent years, which is precisely because of “cleverness” and is not allowed to go on sale. That is, the film, one might say, promoted itself as a first-class science fiction film with a thriller touch - and I love this very much. And horror, on the contrary, I do not like.



The first time I saw ""Annihilation"" in the spring, long before the fateful January viewing, and it didn’t scare me at all: everything is bright, juicy, the bear is a little ridiculous screaming. But during the second viewing - in a dim light, alone and with a loud sound in the headphones - I finally realized why the film was so afraid: the helplessness of the main characters in front of an unknown enemy crawled out into the foreground, nauseating visual images, frighteningly unnatural animals and other manifestations of an obscure a force that crushes everything under itself. The worst thing for me in the film was the bear screaming “Help me”. I don’t wish anyone to see him for the first time at night.
Otherwise, “Annihilation” is a really curious fantasy, in which it is interesting to find the main metaphor yourself and then think about it. And best of all, of course, not in the dark.
Oleg Chimde - Solstice
""Solstice"" Ari Aster is a ""horror in the light of day."" There are literally a couple of moments in the dark, but the rest of the movie is very bright and bright. There are no screamers in it, but there is something more terrible: very difficult situations in which the main characters fall, the strongest tension between them and the distorted space.
The plot for horror, at the same time, is standard: according to the genre ""Solstice"" you can even rank as slashers. A group of students comes to the Swedish community to break away, and at the same time study it - two of the heroes are writing a dissertation on closed ancient communities. Among them there is a typical clever man, a frivolous party-goer, a boob and his girlfriend, suffering from a recent tragedy.


The film is very beautifully shot. Pay attention to the background. Do you see anything unusual among the trees?

However, no cliches of Aster should be. On the contrary, he goes against the stream and scares him not at all what you expect, even though the tin in the film is also there. He shows the community in such a way that you sincerely believe in and accept local customs - they are logical, although they run counter to all that is accepted in a civilized society. This is a real family where there is sincere sympathy and care. And the worst thing is that you might want to live in it.
Alexei Khromov - “Numb with Fear”
In recent years, the horror genre is undergoing a renaissance. But still, his best new representatives are films with some social connotation. And sometimes you want something simple, but very scary, as in youth.
And the movie ""Numb with Fear"" copes with this task perfectly. At the box office, it went almost unnoticed, which is quite expected for a cheap picture filmed in Argentina. But, despite the classic plot and the simplicity of special effects, he has something to scare the viewer.



The plot unfolds in a residential area of a small town, where terrible inexplicable events begin to occur: a dead woman flies through the bathroom, and a child hit by a car returns from the cemetery. Police and supernatural researchers are trying to figure out the reasons for what is happening.
Despite the fact that the action mainly takes place in only three houses, the authors were able to really catch up with fear. It's all about the classical approach: monsters constantly flash somewhere in the background in the gloom. But even when they are shown in full, fault with the quality of makeup and effects will want only after the fact, after the first fright has passed. The pace is very well built.
Ilya Tsukanov - “Doctor Caligari's Study”
If you don’t know what to see from the horror, take a look at “Doctor Caligari’s Cabinet” - a classic of ninety-nine years ago, which began with many of the techniques of the horror movie genre.
At the annual fair in the German town, the mysterious doctor Caligari shows the whole public his curiosity - the somnambulist, a man who has been sleeping for twenty-three years, wakes up only on the orders of the doctor and predicts the future. And the next day, the mysterious killings begin. I won’t tell you more about the plot, because the ending may surprise you.



Although the main value of this film is exactly how it was shot: the actors' play is extremely expressive, and the twisted and unnaturally curved scenery looks insanely surreal even today.
Victor Ruth - Through the Horizon
“Through the horizon” skillfully scares not only what is in the frame, but also what remains behind it. This is also an unofficial prequel to Warhammer 40,000 (at least fans want to believe that).
The film takes place in the near future. According to the plot, the Event Horizon experimental spacecraft that disappeared without a trace suddenly appeared near Neptune. A group of rescuers is immediately sent to him, who were not even told whom they should save. Well, of course, it turns out that this ship is the real cradle of evil.


“Where we go, we don’t need eyes to see”

In the first half of the film, the characters behave as plausibly as possible - they refuse to carry out the mission in the first minutes, almost immediately reveal the main mystery of the ship and do everything possible to escape from it as soon as possible. But, unfortunately, by the second half, for some reason, they begin to follow all the well-known cliches.
Nevertheless, the director Anderson managed to create many frightening moments that remain in memory for a long time after watching. Yes, and not only cruel and bloody scenes scare here, but also the context in which local evil exists.
Ivan Abramov - Head Count
Head Count - directorial debut of Ellie Callahan, immediately released on Netflix, bypassing theaters. This is a low-budget horror with little-known actors that has gathered cool reviews from critics, but, to my taste, the film is ideal for watching in the company of friends at a Halloween party.
In the story, the main character is at a party among completely unfamiliar people. The company accidentally calls for some otherworldly essence, grass scary stories around the fire - the trick is that it can take the form of an absolute person.



Head Count is a film of one concept, which was elegantly beaten with the help of an eerie sound design and specific camera work. The camera never shows all the participants in the party at once - because of this, until the last you do not know which of the characters is real, and who is the double. The main events unfold all the time somewhere behind the scenes - this technique smooths out the roughness of the film and makes it an excellent horror at a time. In general, this is something like It Follows, just a little simpler.
Andrei Lisyany - Black Mirror, White Christmas issue
The black mirror is a series anthology of melodramas, satyrs and thrillers, a joint theme of the influence of modern social networks and information technologies on society. One of the main themes of the Mirror is the digitization of personality and the dangers associated with it. This is a rather old idea, popular in book science fiction, games and anime, but Charlie Brucker managed to refresh it by showing it in the world “five minutes from ours”.
White Christmas is a special series consisting of three small sketches united by a common story. One of the advantages of the series is the unpredictability of the plot, so it's better to watch the episode without knowing anything at all. It is worth noting that the series is written at the peak of the popularity of the series and can serve as a good starting point for dating.



But the main virtue of White Christmas and the anthology as a whole is existential horror. Not screamers, not disgusting scenes, but deeper and more terrible things. Like SOMA, the Black Mirror makes you think about our own nature, and about the nightmarish torture that we ourselves can build in the pursuit of technology and prosperity. The farther, the greater the feeling that everything is wrong, dishonest, that people should not live like that. As a result, a calm conversation between two people in a bright room causes more discomfort and horror than a dozen other films about monsters and zombies.
Alexander Omoloev (Sam Spade) - ""Vice""
The FBI cannot find a serial killer who terrorizes the Texas outback, but then a strong couple comes to the investigatornamed Fanton Makes confidently declares that he knows the culprit - his brother was a maniac. However, there is nothing to worry about - he committed suicide and lies in an ambulance car across the road, take a look.
Something in this story, of course, is wrong. The interrogation continues, and Makes tells how it all began - with two boys and their kind, caring dad, to whom an angel once appeared. Higher powers punished the pope to exterminate the demons, and for convenience they left an ax, mittens and a list of names. And they lived like that - dad chopped people up in the backyards, the older and more intelligent son was angry with him, and the younger one - at first he tried to add his school enemies to his father's list, but then he realized something - and he began to wait for the angel.



""Vice"" is Bill Paxton's directorial debut, which at the same time played dad - an imperfect, modest film and, strictly speaking, not a horror at all. The introduction is either a chamber detective or a confession. The second part is on the psycho-portrait of a family in which the line between norm and madness is lost. And even the chopping and cutting finale is not a god news how scary. The ""vice"" is not about that. Where ordinary horror rush at people to shudder, this film makes you shudder. And he shows how Lars von Trier would put it, a good example - in the sense that if an angel adds your name to the list, there will be nothing to object to.
Vadim Elistratov - “Game of Gerald”
I flipped through this film for quite some time on Netflix until I found out that it was shot by Mike Flanagan, the showrunner of Ghosts on the Hill. Moreover, this picture is a kind of creative foundation for the series. Then Flanagan tries similar tricks and even actors, whom he will then call in his show.
“The Game of Gerald” is an adaptation of Stephen King’s novel of the same name. The husband (in fact, Gerald) and his beautiful wife Jesse (Carla Gugino) come to the country house to stay alone for the whole weekend.



The passion in their relationship has faded over the years, so they try to realize their sexual fantasies. Gerald puts Jesse in bed with real handcuffs, but when she tells him to stop, he grabs his heart and dies, leaving his wife in prison. Meanwhile, a not-so-hungry homeless dog runs into the house, which Jesse recently fed ...
Surprisingly, this tie leads to a deep and really scary movie. As is characteristic of King, events quickly go into the logic of sleep, and the main character fights not only for survival, but also with the demons of the past. Well, Flanagan shows his skill by pulling out a film, the action of which almost entirely takes place in one room.


"
