,src,lang,text
0,"











Çekya, Macaristan ve Polonya'nın sığınmacı kabul etmemesi hukuk ihlali
02 Nov 2019, 19:12 by Euronews 
Avrupa Adalet Divanı Başsavcısı Eleanor Sharpston, Çekya, Macaristan ve Polonya'nın 2015 yılında sığınmacı kabul etmeyerek Avrupa Birliği (AB) hukukunu ihlal ettiğini bildirdi.
Lüksemburg merkezli AB'nin en yüksek hukuki mercisi olan Avrupa Adalet Divanının Başsavcısı Eleanor Sharpston, AB Komisyonunun Çekya, Macaristan ve Polonya'ya karşı zorunlu kota sistemine uymamaları nedeniyle açtığı dava hakkında görüşünü açıkladı.
Başsavcı Sharpston, ""Mahkeme, Polonya, Macaristan ve Çekya'nın geçici ve belli bir süre uygulanması planlanan zorunlu kota sistemine uymayarak AB hukuku çerçevesinde yükümlülüklerini yerine getirmediklerine hükmetmeli."" ifadelerini kullandı.
AB Komisyonu 2015 yılında göç krizinin ön saflarında yer alan İtalya ve Yunanistan üzerindeki yükü azaltmak için üye ülkelerin zorunlu kota sistemiyle 160 bin sığınmacıyı yeniden yerleştirmesine yönelik bir karar almıştı.
Çekya, Macaristan ve Polonya bu karara karşı çıkarak sığınmacı almayı reddetmişti. Bunun üzerine AB Komisyonu söz konusu üç ülke hakkında Avrupa Adalet Divanında dava açmıştı.
Başsavcının görüşü bağlayıcı olmasa da mahkemenin kararını büyük ölçüde etkilemesi bekleniyor.
AB Komisyonu Konsey kararına rağmen sığınmacı almayı reddeden bu üç ülkeyi Avrupa Adalet Divanı'na Aralık 2017'de şikayet etmişti.



AB'de sığınmacı kabul etmek istemeyen ülkelere yönelik yeni gelişme




Kaçak göçmenler AB'ye hangi yollardan giriyor?





",tr,"











Czech, Hungary and Poland refusing to accept asylum seekers
02 Nov 2019, 19:12 by Euronews
Eleanor Sharpston, Attorney General of the European Court of Justice, reported that in 2015, Czech, Hungary and Poland violated European Union (EU) law by refusing to accept asylum seekers.
Eleanor Sharpston, Attorney General of the European Court of Justice, the highest legal authority of the Luxembourg-based EU, announced his opinion on the case the EU Commission filed against the Czech Republic, Hungary and Poland for failing to comply with the mandatory quota system.
""The court should decide that Poland, Hungary and Czechia have failed to fulfill their obligations under EU law, failing to comply with the mandatory quota system, which is planned to be implemented temporarily and temporarily."" he said.
In 2015, the EU Commission adopted a decision to resettle 160,000 asylum seekers with a mandatory quota system to reduce the burden on Italy and Greece, which are at the forefront of the migration crisis.
Czech, Hungary and Poland opposed this decision and refused to accept asylum seekers. The EU Commission then filed a lawsuit against the three countries at the European Court of Justice.
The attorney general's opinion is not binding, but is expected to greatly influence the court's decision.
In December 2017, the European Commission complained to the European Court of Justice of the three countries that refused to accept asylum seekers despite the Council's decision.



New development for countries that do not want to accept asylum in the EU




How do illegal immigrants enter the EU?





"
