,src,lang,text
0,"











Entenda os protestos que sacodem o mundo
Organizadas pelas redes sociais, manifestações populares levam milhares de pessoas às ruas do Chile a Hong Kong
02 Nov 2019, 17:00 by Daniel Avelar

Amsterdã

Nos últimos meses, o noticiário internacional foi dominado por ondas de protestos: marchas contra a austeridade paralisaram o Equador e o Chile; revoluções democráticas derrubaram governantes no Sudão e no Líbano; atos por autonomia regional foram registrados na Catalunha e em Hong Kong, e assim por diante.
Essas revoltas parecem ser caóticas e desconexas, destinadas a sumir tão repentinamente quanto surgiram, mas há semelhanças notáveis entre elas: enquanto os descontentes aprenderam a se organizar pelas redes sociais, as autoridades atingidas pela ira popular frequentemente responderam com força policial e vigilância em massa.
Não é um fenômeno inédito. O decênio que se encerra com um ascenso das revoltas populares em nível planetário já nasceu ao som dos gritos da Primavera Árabe, do movimento Occupy e das marchas de junho de 2013 no Brasil. Assim, os anos 2010 poderão ser lembrados como a década do “#basta!”​
Em termos históricos, o volume de protestos deste período só encontra paralelo nos rebeldes anos 1960, marcados por lutas por direitos civis ao redor do planeta. Ainda não dá para saber ao certo qual será o impacto das revoltas atuais, mas o primeiro passo é entender suas raízes. A Folha tenta explicá-las a seguir.
 
Argélia
Por que os manifestantes estão nas ruas?As manifestações começaram após o presidente Abdelaziz Bouteflika, que reconciliou o país norte-africano após mais de 200 mil pessoas morrerem em uma guerra civil nos anos 1990, anunciar a intenção de concorrer a um quinto mandato. Ele governava o país com mão de ferro desde 1999, mas andava recluso nos últimos anos devido a problemas de saúde. 
O que mudou depois dos atos?Bouteflika acabou cedendo à pressão popular e renunciou em 2 de abril. Novas eleições foram convocadas para 12 de dezembro, mas a oposição pretende boicotar a votação por não confiar nas autoridades.
“Minha intenção é contribuir para acalmar as mentes e corações dos cidadãos.""Abdelaziz Bouteflika, ex-presidente

Bolívia
Por que os manifestantes estão nas ruas?Os protestos estão divididos entre pró e contra o presidente Evo Morales após ele conquistar um quarto mandato em 20 de outubro. Em uma apuração cheia de idas e vindas, com duas formas de contagem de votos diferentes, Morales foi declarado vencedor no primeiro turno por uma margem bastante apertada, mas o opositor Carlos Mesa não reconheceu o resultado. O Brasil também não reconheceu a reeleição.
O que mudou depois dos atos?A OEA e a ONU recomendaram a realização de um segundo turno. O governo boliviano rejeitou a proposta, mas convidou observadores a realizarem uma auditoria.
“Todos nós temos que estar decididos a sair às ruas pra mostrar que não aceitamos a fraude.""Carlos Mesa, candidato opositor



Gallery: Protestos contra e a favor do resultado das eleições na Bolívia



Chile
Por que os manifestantes estão nas ruas?Tudo começou com um aumento nas tarifas de transporte público. Os manifestantes foram às ruas, e houve destruição de estações de metrô. A pauta cresceu, e os chilenos passaram a brigar contra a desigualdade social. Após os atos de vandalismo, o presidente Sebastián Piñera declarou estado de emergência e toque de recolher. Apesar da violência policial, o movimento reuniu mais de 1 milhão de pessoas em Santiago, no dia 25. A revolta é a principal crise no país desde o fim da ditadura, em 1990.
O que mudou depois dos atos?Piñera retrocedeu no aumento das tarifas e anunciou um pacote de medidas econômicas.
“Estamos em guerra contra um inimigo poderoso, que está disposto a usar a violência sem nenhum limite.""Sebastián Piñera, presidente



Gallery: Grande marcha em Santiago



Egito
Por que os manifestantes estão nas ruas? Protestos surgiram na capital, Cairo, e em outras cidades do país para exigir a renúncia do ditador Abdel Fatah al-Sisi, repetindo cenas registradas durante as manifestações da Primavera Árabe, em 2011.Os atos foram convocados pelas redes sociais pelo ator e empresário Mohamed Ali, que vive exilado na Espanha, e se tornaram a pior crise enfrentada por Sisi desde que ele chegou ao poder por meio de um golpe de Estado, em 2013. Vídeos em redes sociais mostram gritos de “fora, Sisi” e “o povo quer a queda do regime”.
O que mudou depois dos atos?O movimento murchou após forte repressão policial.
“O povo quer a queda do regime.""Grito de manifestantes, imitando cantos da Primavera Árabe

Equador
Por que os manifestantes estão nas ruas?Manifestações paralisaram o Equador contra a decisão do presidente Lenín Moreno de extinguir subsídios sobre combustíveis. Os cortes atendiam às exigências de ajuste fiscal em troca de empréstimos de mais de US$ 4,2 bilhões negociados com o FMI. Como em outros momentos de turbulência no país, movimentos indígenas foram protagonistas.
O que mudou depois dos atos?Moreno decretou um estado de emergência e chegou a transferir temporariamente a capital de Quito para Guayaquil, mas acabou cedendo às demandas e suspendeu o corte nos subsídios.
“O bem mais valioso que temos é a paz, e eu valorizo a paz como valorizo o sacrifício dos irmãos indígenas.""Lenín Moreno, presidente, após ceder aos manifestantes



Gallery: No Equador, manifestantes protestaram contra o aumento de preço dos combustíveis



Espanha
Por que os manifestantes estão nas ruas?Uma série de protestos (pacíficos, mas com focos de violência) eclodiram na região da Catalunha após a Suprema Corte condenar nove líderes separatistas a até 13 anos de prisão. As penas são relacionadas a um plebiscito sobre a independência catalã, realizado em 2017 sem a anuência de Madri. Ao desencadear novas manifestações, o veredito acabou dando ainda mais força aos separatistas. A Catalunha tem idioma e bandeira distintos, e os partidários da independência reclamam de partilhar as riquezas da região com outras partes da Espanha.
O que mudou depois dos atos?Por enquanto, nada. O impasse continua.
“A União Europeia permite que a polícia de um de seus Estados-membros use a violência contra seus cidadãos.""Carles Puigdemont, líder catalão exilado



Gallery: Manifestação separatista em Barcelona



Haiti
Por que os manifestantes estão nas ruas?Milhares vêm enfrentando repressão policial desde setembro para exigir a renúncia do presidente Jovenel Moïse, após sucessivos escândalos de corrupção e cortes no fornecimento de combustíveis. O movimento atual repete ondas de protesto anteriores e gera incerteza sobre o futuro do país mais pobre das Américas, que segue caótico dois anos após o fim de uma missão de paz da ONU liderada pelo Brasil. A população ainda sofre os efeitos do grande terremoto de 2010 e de um furacão em 2016.
O que mudou depois dos atos?O impasse continua. Acusado de não aparecer durante a crise, Moïse prometeu falar à nação mais vezes.
“Não deixarei o país nas mãos de gangues armadas e traficantes.""Jovenel Moïse, presidente, ao dizer que não pretende renunciar

Hong Kong
Por que os manifestantes estão nas ruas? A revolta começou após o anúncio de um projeto de lei que facilitaria a extradição de suspeitos para serem julgados na China continental. O plano foi visto como uma ameaça às liberdades individuais no território autônomo e acabou revogado. O movimento passou a englobar outras demandas do povo, que vê interferência crescente do regime chinês e também pede a responsabilização de agentes que atacaram manifestantes durante os atos, os maiores ocorridos ali desde 1997.
O que mudou depois dos atos?Projeto de lei foi engavetado, mas o impasse continua.
“A responsabilidade é minha... Eu peço as mais sinceras desculpas ao povo de Hong Kong.Carrie Lam, líder do governo local, após cancelar projeto de extradição



Gallery: Polícia de Hong Kong confronta manifestantes em noite de Halloween



Iraque
Por que os manifestantes estão nas ruas? Os protestos pedem a melhoria das condições de vida no país, destruído após a invasão dos EUA e da guerra contra o Estado Islâmico. Entre os manifestantes, há membros de vários grupos religiosos. A revolta põe em xeque o governo do premiê Adil Abdul-Mahdi. Uma derrocada no Iraque pode agravar o caos na região, uma vez que o país é palco de disputas entre seus vizinhos Irã e Arábia Saudita.
O que mudou depois dos atos?O presidente Barham Saleh propôs antecipar eleições e disse que o premiê Mahdi aceitaria renunciar se houver acordo no Parlamento para apontar um substituto.
“Eu espero que você saia com a sua dignidade intacta, mas se você resistir ... deverá ser deposto imediatamente.""Muqtada al-Sadr, clérigo xiita, sobre o premiê Mahdi.

Líbano
Por que os manifestantes estão nas ruas? Os libaneses sofrem há anos com a corrupção dos governantes e com uma economia em frangalhos. A gota d’água foi o anúncio de uma nova taxa sobre ligações telefônicas feitas por aplicativos como o WhatsApp, equivalente a R$ 0,83 por dia. O movimento representa demandas de diferentes seitas do país e atinge toda a classe política. É uma das piores crises no país desde 1990.
O que mudou depois dos atos?O premiê Saad Hariri renunciou na terça (29). Seus rivais do Hizbullah temem ser os próximos alvos da ira popular. A taxa para os aplicativos foi revogada. O governo apresentou um plano de combate à corrupção e de privatizações.
“Eu não posso esconder isso de vocês. Eu estou num beco sem saída.""Saad Hariri, premiê, ao anunciar sua renúncia

Reino Unido
Por que os manifestantes estão nas ruas? Brexit. Nos últimos meses, multidões têm se reunido em Londres para exigir a realização de um segundo plebiscito que possa revogar a saída britânica da UE. Mais de 1 milhão participaram do ato no dia 19, em uma das maiores mobilizações de rua da história do país. Mas as manifestações têm feito pouco eco no Parlamento. O premiê Boris Johnson, alvo frequente dos atos, tentará conquistar uma maioria parlamentar nas eleições de dezembro para enfim aprovar o divórcio do bloco europeu.
O que mudou depois dos atos?Eleições gerais foram antecipadas para dezembro e o brexit foi adiado para janeiro, mas o impasse continua.
“Eu prefiro estar morto em uma vala [a pedir o adiamento do brexit].""Boris Johnson, premiê, antes de solicitar novo prazo



Gallery: Protestos contra Boris Johnson



Rússia
Por que os manifestantes estão nas ruas? Uma eleição rotineira para a câmara de vereadores de Moscou se transformou em um problema para o presidente Vladimir Putin. Protestos começaram após as autoridades cancelarem a inscrição de candidaturas independentes. Os atos desafiam o autoritarismo crescente no país, onde opositores são perseguidos e muitas vezes acabam no exílio e haverá aumento do controle do uso da internet.
O que mudou depois dos atos?Os eleitores impuseram uma derrota simbólica ao governo na votação de setembro, reduzindo a maioria dos aliados de Putin no legislativo municipal.
“Nós acreditamos que as ações duras das forças de segurança para barrar os protestos são absolutamente justificadas.""Dmitry Peskov, porta-voz do Kremlin.

Sudão
Por que os manifestantes estão nas ruas? Uma série de protestos explodiu em dezembro, quando um aumento no preço do pão virou prerrogativa para exigir a queda do ditador Omar al-Bashir. Enfrentando repressão policial, os manifestantes conquistaram sua deposição em abril, mas seguiram protestando para que os militares não tomassem conta do governo e impedissem eleições. O Exército tentou sufocar a revolta e matou mais de cem ativistas na capital, Cartum, em junho.
O que mudou depois dos atos?Bashir foi deposto por um golpe do Exército e militares partilharam poder com civis. A transição para a democracia deve ocorrer após eleições em 2022.
“Não confiamos nas Forças Armadas, confiamos que o povo do Sudão protegerá a revolução.""Samahir Elmubarak, porta-voz dos protestos.


",pt,"











Understand the protests that shake the world
Organized by social networks, popular demonstrations bring thousands of people to the streets of Chile to Hong Kong.
02 Nov 2019, 17:00 by Daniel Avelar

Amsterdam

In recent months, the international news has been dominated by waves of protests: marches against austerity have paralyzed Ecuador and Chile; democratic revolutions overthrew rulers in Sudan and Lebanon; acts for regional autonomy were recorded in Catalonia and Hong Kong, and so on.
These riots appear to be chaotic and unconnected, destined to fade as suddenly as they arose, but there are striking similarities between them: while disgruntled people learned to organize themselves through social networks, authorities struck by popular anger often responded with police force and mass surveillance.
It is not an unprecedented phenomenon. The decade ending with the rise of popular uprisings on the planetary level has already been born to the sound of the Arab Spring shouts, the Occupy movement and the June 2013 marches in Brazil. Thus, the years 2010 can be remembered as the decade of ""#basta!""
Historically, the volume of protests of this period is only paralleled by the rebel 1960s, marked by civil rights struggles around the planet. It is not yet clear what the impact of the current riots will be, but the first step is to understand its roots. Folha tries to explain them below.

Algeria
Why are protesters on the streets? The protests began after President Abdelaziz Bouteflika, who reconciled the country after more than 200,000 people died in a civil war in the 1990s, announced their intention to run for a fifth term. He has ruled the country with an iron fist since 1999, but has been in seclusion in recent years due to ill health.
What changed after the acts? Bouteflika eventually gave in to popular pressure and resigned on April 2. New elections have been called for December 12, but the opposition intends to boycott the vote for not trusting the authorities.
“My intention is to help calm the minds and hearts of citizens.” Abdelaziz Bouteflika, former president

Bolivia
Why are protesters on the streets? Protests are split between pro and President Evo Morales after he won a fourth term on October 20. In a back-and-forth countdown with two different ways of counting votes, Morales was declared winner in the first round by a fairly tight margin, but opponent Carlos Mesa did not recognize the result. Brazil did not recognize the reelection either.
What changed after the acts The OAS and the UN recommended a second round. The Bolivian government rejected the proposal but invited observers to conduct an audit.
“We all have to be determined to take to the streets to show that we don't accept the fraud.” Carlos Mesa, opposition candidate



Gallery: Protests Against and In Support of Election Results in Bolivia



Chile
Why are protesters on the streets? It started with an increase in public transport fares. Protesters took to the streets, and subway stations were destroyed. The agenda grew, and Chileans began to fight against social inequality. Following acts of vandalism, President Sebastián Piñera declared a state of emergency and curfew. Despite police violence, the movement gathered more than 1 million people in Santiago on the 25th. The revolt is the main crisis in the country since the end of the dictatorship in 1990.
What changed after the acts? ”Piñera stepped back from raising tariffs and announced a package of economic measures.
“We are at war with a powerful enemy who is willing to use violence without any limits.” Sebastián Piñera, President



Gallery: Big March in Santiago



Egypt
Why are protesters on the streets? Protests erupted in the capital, Cairo, and other cities in the country to demand the resignation of dictator Abdel Fatah al-Sisi, repeating scenes recorded during the Arab Spring demonstrations in 2011. The acts were summoned by social networks by actor and businessman Mohamed. Ali, who lives in exile in Spain, has become the worst crisis Sisi has faced since he came to power through a coup d'état in 2013. Videos on social networks show shouts of “out, Sisi” and “the people wants the fall of the regime ”.
What changed after the acts? The movement withered after strong police repression.
“People want regime overthrown.” Shout of protesters, mimicking Arab Spring chants

Ecuador
Why are protesters on the streets? Demonstrations have paralyzed Ecuador against President Lenin Moreno's decision to extinguish fuel subsidies. The cuts met fiscal adjustment requirements in return for loans of more than $ 4.2 billion negotiated with the IMF. As in other times of turmoil in the country, indigenous movements were protagonists.
What changed after the acts? ”Moreno decreed a state of emergency and temporarily moved the capital from Quito to Guayaquil, but eventually gave in to demands and suspended the subsidy cut.
""The most valuable asset we have is peace, and I value peace as I value the sacrifice of the indigenous brothers."" Lenín Moreno, president, after giving in to the protesters



Gallery: In Ecuador Protesters Protested Over Higher Fuel Prices



Spain
Why are protesters on the streets? A series of protests (peaceful but violent) erupted in the Catalonia region after the Supreme Court sentenced nine separatist leaders to up to 13 years in prison. The penalties are related to a referendum on Catalan independence, held in 2017 without the consent of Madrid. By triggering new demonstrations, the verdict ended up giving even more force to the separatists. Catalonia has a distinct language and flag, and independence supporters complain of sharing the region's riches with other parts of Spain.
What changed after the acts? For now, nothing. The impasse continues.
“The European Union allows the police of one of its member states to use violence against their citizens.” Carles Puigdemont, Catalan leader in exile



Gallery: Separatist Demonstration in Barcelona



Haiti
Why are protesters on the streets? Thousands have been facing police crackdown since September to demand President Jovenel Moïse's resignation following repeated corruption scandals and fuel supply cuts. The current movement repeats earlier waves of protest and creates uncertainty about the future of the poorest country in the Americas, which remains chaotic two years after the end of a Brazil-led UN peacekeeping mission. The population still suffers the effects of the great earthquake of 2010 and a hurricane in 2016.
What changed after the acts? The impasse continues. Accused of not appearing during the crisis, Moïse promised to speak to the nation more often.
“I will not leave the country in the hands of armed gangs and traffickers.” Jovenel Moïse, president, said he did not intend to resign

Hong Kong
Why are protesters on the streets? The revolt began after the announcement of a bill that would facilitate the extradition of suspects for trial in mainland China. The plan was seen as a threat to individual freedoms in the autonomous territory and was eventually revoked. The movement has come to encompass other demands of the people, who see increasing interference from the Chinese regime and also call for the blaming of agents who attacked protesters during the acts, the largest since 1997.
What changed after the acts? Bill has been shelved, but the stalemate continues.
""It is my responsibility ... I sincerely apologize to the people of Hong Kong. Carry Lam, local government leader, after canceling extradition project



Gallery: Hong Kong Police Confront Protesters on Halloween Night



Iraq
Why are protesters on the streets? The protests call for improved living conditions in the country, destroyed after the US invasion and the war against the Islamic State. Protesters include members of various religious groups. The revolt threatens the government of Prime Minister Adil Abdul-Mahdi. A crash in Iraq could aggravate chaos in the region as the country is the scene of disputes between its neighbors Iran and Saudi Arabia.
What changed after the acts? President Barham Saleh proposed to anticipate elections and said Prime Minister Mahdi would agree to resign if there is agreement in Parliament to appoint a replacement.
“I hope you leave with your dignity intact, but if you resist… you must be deposed immediately.” Muqtada al-Sadr, Shiite cleric, on Prime Minister Mahdi.

Lebanon
Why are protesters on the streets? The Lebanese have been suffering for years from the corruption of the rulers and a crumbling economy. The last straw was the announcement of a new rate on phone calls made by apps like WhatsApp, equivalent to $ 0.83 per day. The movement represents demands from different sects of the country and reaches the entire political class. It is one of the worst crises in the country since 1990.
What changed after the acts? Prime Minister Saad Hariri resigned on Tuesday (29). Its Hizbullah rivals fear to be the next targets of popular anger. The application fee has been revoked. The government has put forward a plan to fight corruption and privatization.
“I can't hide it from you. I'm in a dead end. ""Saad Hariri, Prime Minister, announcing his resignation

UK
Why are protesters on the streets? Brexit In recent months, crowds have been gathering in London to demand a second referendum to repeal the British exit from the EU. More than 1 million took part in the act on the 19th, in one of the largest street mobilizations in the country's history. But the demonstrations have echoed little in Parliament. Prime Minister Boris Johnson, a frequent target of the acts, will try to win a parliamentary majority in December elections to finally approve the divorce of the European bloc.
What changed after the acts? General elections were brought forward to December and brexit was postponed to January, but the stalemate continues.
""I'd rather be dead in a ditch [than ask for the postponement of brexit]."" Boris Johnson, prime minister, before requesting a new deadline



Gallery: Protests Against Boris Johnson



Russia
Why are protesters on the streets? A routine election for the Moscow city council has become a problem for President Vladimir Putin. Protests began after authorities canceled independent applications. The acts challenge the growing authoritarianism in the country, where opponents are persecuted and often end up in exile and there will be increased control over internet use.
What changed after the acts? Voters imposed a symbolic defeat on the government in the September vote, reducing the majority of Putin's allies in the municipal legislature.
""We believe the harsh actions of security forces to stop the protests are absolutely justified."" Dmitry Peskov, spokesman for the Kremlin.

Sudan
Why are protesters on the streets? A series of protests erupted in December when a rise in the price of bread became prerogative to demand dictator Omar al-Bashir fall. Facing police repression, the protesters won their deposition in April, but continued to protest that the military would not take over the government and prevent elections. The army tried to quell the revolt and killed more than 100 activists in the capital, Khartoum, in June.
What changed after the acts? ”Bashir was overthrown by an army coup and the military shared power with civilians. The transition to democracy must take place after elections in 2022.
“We do not trust the Armed Forces, we trust that the people of Sudan will protect the revolution.” Samahir Elmubarak, spokesman for the protests.


"
