,src,lang,text
0,"











Crisis bij Bayern na pijnlijke nederlaag, heldenrol voor Hazard bij Dortmund

02 Nov 2019, 17:30


Bayern München heeft flink terrein prijsgegeven in de Bundesliga. Der Rekordmeister begon als nummer twee aan de zaterdagmiddag, maar speelde een kansloze wedstrijd tegen Eintracht Frankfurt en is gepasseerd door Borussia Dortmund en RB Leipzig: Thorgan Hazard was bij Borussia Dortmund de grote held met een doelpunt en assist.

Bayern moest het liefst 81 minuten met een man minder doen in Frankfurt, de tegenstander van Standard in de Europa League. Jerôme Boateng maakte net buiten het strafschopgebied een overtreding op Gonçalo Paciência en kreeg een rode kaart.
De thuisploeg liep in de loop van de eerste helft uit naar 2-0 dankzij een klutsgoal van Filip Kostic en een volley van Djibril Sow. Bundesliga-topscorer Robert Lewandowski soleerde Bayern terug in de wedstrijd, maar de regerend landskampioen speelde een verloren wedstrijd. David Abraham, Martin Hinteregger en Paciência vergrootten de feestvreugde voor de tegenstander van Standard.
Heldenrol HazardBorussia Dortmund en RB Leipzig profiteerden van de zeperd van Bayern. BVB won in eigen huis de topper van VfL Wolfsburg. Thorgan Hazard en Raphaël Guerreiro stonden kort na elkaar aan het einde van vlotte aanvallen, Mario Götze tekende uit een strafschop voor 3-0.
Lees meerGOAL: Hazard blinkt uit met eerste goal én assist bij Dortmund
FSV Mainz kreeg tegen RB Leipzig alle hoeken van het veld te zien. Mede dankzij twee treffers van Timo Werner stond het na vijftig (!) minuten al 7-0. RB Leipzig leek naar lange tijd genoegen mee te nemen, maar Werner zorgde vlak voor tijd alsnog voor het toetje met zijn derde van de middag: 8-0.
Winnaar van het weekendDe grote winnaar van het weekend is echter Borussia Mönchengladbach: de koploper staat na het afhaken van Bayern München drie punten los van achtervolger Borussia Dortmund. Het Bayer Leverkusen van Leon Bailey, die een rode kaart, kon via Kevin Volland de openingstreffer van Oscar Wendt nog ongedaan maken, maar Die Fohlen gingen dankzij Marcus Thuram alsnog met drie punten terug naar Mönchengladbach.


",nl,"











Crisis at Bayern after painful defeat, hero role for Hazard at Dortmund

02 Nov 2019, 17:30


Bayern Munich has lost a lot of ground in the Bundesliga. Der Rekordmeister started as number two on Saturday afternoon, but played a hopeless match against Eintracht Frankfurt and was passed by Borussia Dortmund and RB Leipzig: Thorgan Hazard was the big hero at Borussia Dortmund with a goal and assist.

Bayern had to do no less than 81 minutes with a man less in Frankfurt, the opponent of Standard in the Europa League. Jerôme Boateng made a foul on Gonçalo Paciência just outside the penalty area and received a red card.
The home team increased to 2-0 in the course of the first half thanks to a punch-through from Filip Kostic and a volley from Djibril Sow. Bundesliga top scorer Robert Lewandowski soloized Bayern back in the game, but the reigning Dutch champion played a lost game. David Abraham, Martin Hinteregger and Paciência increased the party spirit for Standard's opponent.
Hero role HazardBorussia Dortmund and RB Leipzig benefited from Bayern. BVB won the top prize in VfL Wolfsburg in-house. Thorgan Hazard and Raphaël Guerreiro were shortly after each other at the end of smooth attacks, Mario Götze signed a penalty for 3-0.
Read moreGOAL: Hazard excels with first goal and assist at Dortmund
FSV Mainz saw all corners of the field against RB Leipzig. Thanks in part to two Timo Werner hits, it was already 7-0 after fifty (!) Minutes. RB Leipzig seemed to take pleasure for a long time, but Werner took care of the dessert with his third of the afternoon: 8-0.
Winner of the weekend The big winner of the weekend, however, is Borussia Mönchengladbach: the leader, after leaving Bayern Munich, is three points apart from pursuer Borussia Dortmund. The Bayer Leverkusen of Leon Bailey, who received a red card, was able to cancel Oscar Wendt's opening goal via Kevin Volland, but thanks to Marcus Thuram Die Fohlen went back to Mönchengladbach with three points.


"
