,src,lang,text
0,"











Mange har sviktet i Nav-skandalen
Adresseavisen mener

02 Nov 2019, 06:00

Byråkrati, politisk ledelse og rettsvesen har mye å svare for i Nav-skandalen. Mediene bør også gå i seg selv.
Del denne artikkelen på Facebook Del denne artikkelen på Twitter Del denne artikkelen på e-post
Nav-skandalen, som ble gjort kjent i starten av denne uka, gjør det lett å kreve at noen ansvarliggjøres for at minst 48 personer er feilaktig dømt her til lands. Det er lett å være etterpåklok, men dimensjonene over saken gir grunn til selvransakelse i svært mange ledd. Det gjelder også noen av oss som nå kaster velrettede steiner mot en systemsvikt av skremmende dimensjoner.
Ledelsen i Nav, politisk ledelse og rettssystemet har sviktet. Det kanskje mest skremmende ved saken er at institusjonene som skal kvalitetssikre og sørge for at den lille mann og kvinne ikke blir overkjørt av systemfeil eller svikt i tolkning og bruk av regler, i altfor liten grad har utført sine oppgaver godt nok.
Det kan godt hende at noen bør gå som følge av skandalen, men det er langt flere som bør gå i seg selv. Det gjelder også oss i mediene. Derfor er det bra at Aftenposten, ifølge nettstedet Medier24, sier at de skal granske seg selv for å få svar på hvorfor det ikke var de som avdekket Nav-skandalen.
Det er hjerteskjærende å lese historien til noen av ofrene i saken. Det er opprørende at Nav da skandalen var under oppseiling, i august, mente det ville være for «arbeidskrevende» å ettergå saker for å finne flere eksempler på at det er gjort feil. Det gir uttrykk for et syn på mennesker og system som er totalt uakseptabelt.
Mange av ofrene i Nav-skandalen er mennesker langt fra de øverste trinnene på samfunnsstigen, mange av dem uten ressurser til å kreve sin rett. Når verken politikere, domstoler eller medier fungerer som korrektiv til tvilsom eller diskutabel bruk av makt, er det ikke bare systemet, men rettsstaten vi liker å omtale oss som, som viser alvorlige tegn på svikt. Det er mest alvorlig for den dømmende makt, byråkrati og politikere, men vi i media har heller ingen grunn til å slå oss på brystet i denne saken. Også vi kan nok ha for lett for å ta det myndighetene sier og gjør for god fisk, selv når det egentlig viser seg å være skikkelig dårlig fisk.

Les også lederen «Nav-alarmen burde gått for lenge siden»



",no,"











Many have failed in the Nav scandal
The address newspaper believes

02 Nov 2019, 06:00

Bureaucracy, political leadership and the judiciary have much to blame for in the Nav scandal. The media should also go by itself.
Share this article on Facebook Share this article on Twitter Share this article by email
The nav scandal, made public at the start of this week, makes it easy to demand that someone be held responsible for at least 48 people being wrongly convicted in this country. It is easy to be hindsight, but the dimensions of the case give grounds for self-examination in a very large number of stages. This also applies to some of us who are now throwing well-directed stones at a system failure of daunting dimensions.
The leadership of Nav, political leadership and the judicial system has failed. Perhaps the most frightening thing about the case is that the institutions that are supposed to ensure quality and ensure that the little man and woman are not overrun by system errors or failures in interpretation and application of rules, have performed too little work well enough.
Some may want to go as a result of the scandal, but there are far more that should go by themselves. This also applies to us in the media. Therefore, it is good that Aftenposten, according to the website Medier24, says that they should examine themselves to find out why it was not those who revealed the Nav scandal.
It is heartbreaking to read the story of some of the victims in the case. It is upsetting that when the scandal was under way in August, Nav thought it would be ""labor intensive"" to investigate cases to find more examples of wrongdoing. It expresses a view of people and system that is totally unacceptable.
Many of the victims of the Nav scandal are people far from the top steps of the social ladder, many of them without the resources to claim their rights. When neither politicians, courts, nor the media act as a corrective to dubious or debatable use of force, it is not only the system, but the rule of law that we like to refer to as showing serious signs of failure. It is most serious for the judiciary, bureaucracy and politicians, but we in the media also have no reason to get busted in this matter. Also we can probably have too easy to take what the authorities say and do for good fish, even when it really turns out to be really bad fish.

Also read the leader ""The nav alarm should have gone a long time ago""



"
