,src,lang,text
0,"











Sudáfrica ganó su tercer mundial de rugby e igualó en títulos a los famosos 'All Blacks'
Los 'Springbocks', como se la apoda a la selección sudafricana, ahora comparten con los neozelandeses el título de más veces campeones del mundial de rugby.

02 Nov 2019, 06:59

En la final, disputada este sábado en Yokohama, Japón, los nuevos campeones se coronaron justamente derrotando a Inglaterra, el equipo que eliminó a Nueva Zelanda, su archirrival oceánico y campeón vigente, reconocido por sus bailes maoríes y su uniforme que les brinda el apodo de ‘All Blacks’.
Los europeos venían siendo el mejor equipo del certamen, pero no pudieron con la jerarquía sudafricana y terminaron derrotados por un abultado 12-32.
No obstante, la parte inicial del encuentro estuvo determinada por una sucesión de penaltis que mostraban un juego muy reñido. Incluso varios jugadores tuvieron que ser atendidos por sendos choques con sus rivales. Aún así, al final del primer tiempo el marcador era de 6-12 para Sudáfrica.
Hasta el minuto 64, las cosas seguían parejas, con un marcador de 12 a 18, pero entonces llegó el primer try sudafricano gracias a Mazakole Mapimpi, que alargó las cosas a un 12-23), con conversión posterior de Pollard.
A 6 minutos del final, cuando ya todo parecía consumado, los ‘Springbocks’ le pusieron cifras concretas al marcador con otro try, esta vez con gran corrida de Chelsin Kolbe y otra conversión de Pollard.
Inglaterra fue incapaz de volver a armar alguna jugada de peligro y vio esfumarse su sueño de la segunda estrella, pese al gran mundial que habían jugado.





",es,"











South Africa won its third rugby world championship and matched titles to the famous 'All Blacks'
The 'Springbocks', as it is nicknamed the South African national team, now share with the New Zealanders the title of more times rugby world champions.

02 Nov 2019, 06:59

In the final, played this Saturday in Yokohama, Japan, the new champions were crowned justly defeating England, the team that eliminated New Zealand, their oceanic archrival and current champion, recognized for their Maori dances and their uniform that gives them the nickname from 'All Blacks'.
The Europeans were being the best team of the contest, but they could not with the South African hierarchy and ended up defeated by a bulky 12-32.
However, the initial part of the match was determined by a succession of penalties that showed a very close game. Even several players had to be treated by clashes with their rivals. Even so, at the end of the first half the score was 6-12 for South Africa.
Until the 64th minute, things remained even, with a score of 12 to 18, but then the first South African try came thanks to Mazakole Mapimpi, who extended things to a 12-23), with subsequent conversion from Pollard.
6 minutes from the end, when everything seemed consummated, the ‘Springbocks’ put specific figures on the scoreboard with another try, this time with a great run by Chelsin Kolbe and another Pollard conversion.
England was unable to re-arm some danger play and saw their second star dream vanish, despite the great World Cup they had played.





"
