,src,lang,text
0,"











Somme : 33 blessés, dont au moins 4 graves, dans l'accident de bus sur l'A1
Un bus a eu un accident sur l'A1 dans la Somme ce dimanche 3 novembre en fin de matinée. 33 personnes ont été blessées: quatre sont dans un état grave selon la préfecture.
03 Nov 2019, 14:10 by Quentin Marchal
Un tragique accident de bus a eu lieu en fin de matinée ce dimanche 3 novembre, sur l'autoroute A1. Trente-trois personnes ont été blessées, dont quatre gravement, dans l'accident de l'appareil, qui effectuait la liaison Paris-Londres, a annoncé la préfecture de la Somme. Aucun pronostic vital n'est engagé. 
Parmi les passagers figuraient onze Français, dix Britanniques, cinq Américains, deux Roumains, un Espagnol, un Australien, un Mauricien, un Japonais et un Sri-Lankais. Les blessés ont été répartis sur différents centres hospitaliers de la région, notamment à Amiens et Péronne. 
 À 11h50, le bus de la compagnie Flixbus a fait une sortie de route au niveau de la sortie 13 - Estrées-Deniécourt, entre Amiens et Saint-Quentin, et s’est couché sur son flanc, a indiqué la préfecture dans un communiqué, sans préciser les circonstances de l'accident. D'importants moyens de secours ont été mobilisés, dont des équipes du Samu, du Service départemental d'incendie et de secours (SDIS) et de la gendarmerie.
L'accident a provoqué la fermeture provisoire de la sortie 13, sans couper la circulation sur l'autoroute A1, qui est revenue à la normale. Le bus accidenté a été évacué dans l'après-midi.

À lire aussi


Dans un communiqué, Flixbus a indiqué être en ""contact étroit avec les autorités locales afin de déterminer les causes exactes de l'accident, ainsi que pour assurer la prise en charge des passagers"".

La rédaction vous recommande







",fr,"











Sum: 33 wounded, including at least 4 serious, in the bus crash on the A1
A bus had an accident on the A1 in the Somme this Sunday, November 3 late in the morning. 33 people were injured: four are in serious condition according to the prefecture.
03 Nov 2019, 14:10 by Quentin Marchal
A tragic bus accident took place late in the morning on Sunday, November 3rd, on the A1 motorway. Thirty-three people were injured, including four seriously, in the crash of the aircraft, which made the Paris-London, announced the Somme prefecture. No vital prognosis is engaged.
Among the passengers were eleven Frenchmen, ten Britons, five Americans, two Romanians, a Spaniard, an Australian, a Mauritian, a Japanese and a Sri Lankan. The wounded were spread over various hospitals in the region, including Amiens and Péronne.
At 11:50 am, the bus of the company Flixbus made a road exit at exit 13 - Estrées-Deniécourt, between Amiens and Saint-Quentin, and lay on its side, said the prefecture in a statement, without specifying the circumstances of the accident. Major relief resources were mobilized, including teams from Samu, the Departmental Fire and Rescue Service (SDIS) and the Gendarmerie.
The accident caused the temporary closure of exit 13, without cutting traffic on the A1, which returned to normal. The damaged bus was evacuated in the afternoon.

Read also


In a statement, Flixbus said it was in ""close contact with the local authorities to determine the exact causes of the accident, as well as to ensure the care of passengers.""

The editor recommends you







"
