,src,lang,text
0,"











عقد معه «صفقة وهمية» لبيعه 400 هاتف
اتهام شاب بالاستيلاء على 500 ألف درهم من رجل أعمال

07 Nov 2019, 22:00

نظرت محكمة الجنح في رأس الخيمة، أمس، قضية شاب عربي متهم بالاستيلاء على نصف مليون درهم من رجل أعمال خليجي، مقابل بيعه 400 هاتف «آي فون»، بخصم مغرٍ من إحدى شركات الاتصالات في الدولة، بعدما وقع على عقد وهمي.
وجاء في لائحة اتهام النيابة العامة، أن المتهم استولى على 500 ألف درهم من أصل مليون و200 ألف درهم، مقابل بيعه 400 هاتف آي فون، كونه يدير محلاً لبيع الهواتف المحمولة، ولديه خصم من إحدى شركات الاتصالات في الدولة لأسعار الهواتف المحمولة، حيث تسلّم المتهم الأموال، ولم يعط المجني عليه الهواتف.
وأنكر المتهم أمام هيئة المحكمة الاتهامات المسندة إليه، وأفاد بأنه لم يتسلم أي مبالغ من المجني عليه، وأنه اتفق معه على بيع 400 هاتف، عبر شركة وسيطة، وتم توقيع عقد بين المجني عليه والشركة دون أن يكون له دخل.
ومن جهته، أكد المجني عليه أمام المحكمة، أنه اتفق مع المتهم على شراء 400 هاتف محمول بقيمة تتجاوز المليون درهم، ودفع 500 ألف درهم لشركة وسيطة بينهما، بناءً على رغبة المتهم الذي طلب منه توقيع الاتفاق مع إحدى الشركات من أجل الحصول على الهواتف.
وأوضح أنه عندما ذهب في الموعد لتسلم الهواتف، لم يجد مدير الشركة الذي وقع العقد معه، كما أن المتهم أنكر تسلمه أي مبالغ مالية.
وأضاف أنه ذهب إلى الشرطة لتقديم بلاغ بتعرضه للاحتيال، مؤكداً أنه قام بدفع المبالغ إلى الشركة الوسيطة بناءً على طلب المتهم الذي رفض تسلّم أي مبالغ مالية دون توقيع عقد، متابعاً أن المتهم يدير محلاً لبيع الهواتف المحمولة، ما دفعه إلى تصديقه ومحاولة شراء كمية الهواتف المتفق عليها، مقابل الحصول على خصم من السعر الأصلي.
ومن جهته، طلب محامي الدفاع عن المتهم من المحكمة أجلاً للاطلاع على ملف القضية، والاستعداد لتقديم المرافعة، واستجابت المحكمة لطلب الدفاع، وأجّلت القضية لجلسة الأسبوع المقبل.


",ar,"











He made a ""fake deal"" to sell him 400 phones
Young man charged with seizing 500,000 dirhams from businessman

07 Nov 2019, 22:00

RAS AL KHAIMAH: A misdemeanor accused of seizing half a million dirhams from a Gulf businessman in exchange for selling 400 iPhones to a seductive deduction from a telecom company in the emirate's Ras Al Khaimah court yesterday, after signing a fake contract.
According to the indictment indictment, the defendant seized 500 thousand dirhams out of one million and 200 thousand dirhams, for selling 400 iPhone phones, as he runs a shop selling mobile phones, and has a discount from a telecommunications company in the UAE for the price of mobile phones, where he received the accused Money, the victim did not give phones.
The defendant denied the charges against him and stated that he had not received any payments from the victim, and that he had agreed with him to sell 400 telephones, through an intermediary company, and a contract had been signed between the victim and the company without income.
For his part, the victim confirmed before the court, that he agreed with the accused to buy 400 mobile phones worth more than one million dirhams, and paid 500 thousand dirhams to an intermediary between them, at the desire of the accused, who was asked to sign the agreement with one of the companies in order to obtain the phones.
He explained that when he went on time to receive the phones, he did not find the director of the company who signed the contract with him, and the defendant denied receiving any money.
He added that he went to the police to submit a report of fraud, stressing that he paid the money to the intermediary company at the request of the accused, who refused to receive any money without signing a contract, adding that the accused runs a shop selling mobile phones, which led him to believe and try to buy the amount of phones agreed On them, in exchange for a discount from the original price.
For his part, the defense lawyer asked the court for a review of the case file, and a willingness to present the case.


"
