,src,lang,text
0,"











La Biblioteca Nacional se perfila hacia el mundo digital en la Filven 2019
07 Nov 2019, 22:36 by Últimas Noticias
El Instituto Autónomo Biblioteca Nacional de Venezuela y de Servicios de Bibliotecas (IABNSB) expondrá su experiencia en la gestión de recursos documentales, promoción de la lectura y la adaptación a los entornos digitales en la XV Feria Internacional del Libro de Venezuela (Filven 2019), que se inaugura este 7 de noviembre.
Dentro de la programación del evento se encuentra el conversatorio “Biblioteca Nacional en el entorno digital: avances y desafíos”, que se realizará el miércoles 13 de noviembre, a partir de las 2:00 de la tarde, en la Biblioteca Pública de Caracas (BPC) “Simón Rodríguez”. Allí, se mostrarán las experiencias generadas a partir de la Biblioteca Digital de Venezuela “César Rengifo”, el Sistema Bibliotecario de Venezuela (Sisbiv) y el sistema en línea para la gestión del Depósito Legal.
Además de esta actividad, en la BPC Simón Rodríguez, ubicada en la esquina El Conde, se desarrollarán otros eventos como La Ruta del Libro, una actividad pautada para los días 11, 13 y 15 de noviembre, a partir de las 10:00 de la mañana, que mostrará a través de cinco estaciones todos los procesos que se desarrollan para preservar libros, ponerlos a disposición de usuarios en recintos bibliotecarios y promover la lectura.
Los asistentes a la Filven 2019 también disfrutarán en la referida biblioteca de los conversatorio “Jack Ryan o el audiovisual en la agresión contra Venezuela”, a cargo de Vladimir Sosa Sarabia, este 8 de noviembre, a las 4:00 de la tarde; “Nuevo rol del documentalista en la Biblioteca Nacional”, bajo la responsabilidad de Daniel González, el 12 de noviembre, a las 2:00 de la tarde; y “Una mirada hemerográfica en defensa de la soberanía y la identidad”, a cargo de Antonio Castillo y Alexis Rodríguez, el 13 de noviembre, a las 4:00 de la tarde.
La BPC también albergará el taller “Jugando con las Palabras”, de Raúl Bermúdez, el 8 de noviembre, a las 10:00 de la mañana; “Encuadernación Creativa”, el 9 de noviembre, a la 1:00 de la tarde; y “Cómo elegir buenos cuentos para niños y niñas”, el 12 de noviembre, a las 10:00 de la mañana.

En homenaje a Luis Alberto Crespo

La Biblioteca Nacional de Venezuela también se sumará a las actividades en tributo a Luis Alberto Crespo, escritor homenajeado en esta edición de la Filven, con el recital “Cuando la poesía tiene música interior”, que se efectuará este 8 de noviembre, a las 11:00 de la mañana, en el espacio Stefanía Mosca del Concejo Municipal de Caracas.
En ese mismo lugar, el 15 de noviembre, un grupo de poetas presentará sus creaciones literarias en homenaje al comandante eterno, Hugo Chávez,  en el recital “Los poetas de Chávez”, a partir de las 4:00 de la tarde.
El 16 de noviembre, a partir de la 1:00 de la tarde, se efectuará el conversatorio “La historia de Venezuela a través de sus Publicaciones Oficiales”, a cargo de Pedro Sansonetti, en la Casa de la Historia Insurgente, a partir de la 1:00 de la tarde.
En esta edición de la Filven, además, la Biblioteca Nacional de Venezuela contará con un estand para mostrar los recursos en línea que dispone para garantizar el acceso al acervo documental del país y orientar a los usuarios en el trámite del Depósito Legal.

Nota de Prensa



",es,"











The National Library is emerging towards the digital world at Filven 2019
07 Nov 2019, 22:36 by Latest News
The Autonomous Institute of the National Library of Venezuela and Library Services (IABNSB) will present its experience in the management of documentary resources, promotion of reading and adaptation to digital environments at the XV International Book Fair of Venezuela (Filven 2019), which opens this November 7.
Within the program of the event is the “National Library in the digital environment: advances and challenges”, which will be held on Wednesday, November 13, starting at 2:00 p.m., in the Public Library of Caracas ( BPC) ""Simón Rodríguez"". There, the experiences generated from the Digital Library of Venezuela “César Rengifo”, the Librarian System of Venezuela (Sisbiv) and the online system for the management of the Legal Deposit will be shown.
In addition to this activity, at the Simón Rodríguez BPC, located in the corner of El Conde, other events such as The Book Route, an activity scheduled for November 11, 13 and 15, will be held starting at 10:00 a.m. the morning, which will show through five stations all the processes that are developed to preserve books, make them available to users in library rooms and promote reading.
Attendees at the Filven 2019 will also enjoy in the aforementioned library of the ""Jack Ryan or the audiovisual in the aggression against Venezuela"", by Vladimir Sosa Sarabia, this November 8, at 4:00 pm; “New role of the documentary filmmaker in the National Library”, under the responsibility of Daniel González, on November 12, at 2:00 p.m. and ""A helographic look in defense of sovereignty and identity,"" by Antonio Castillo and Alexis Rodríguez, on November 13, at 4:00 in the afternoon.
The BPC will also host the “Playing with the Words” workshop, by Raúl Bermúdez, on November 8, at 10:00 in the morning; ""Creative Binding"", on November 9, at 1:00 in the afternoon; and ""How to choose good stories for boys and girls,"" on November 12, at 10:00 a.m.

In tribute to Luis Alberto Crespo

The National Library of Venezuela will also add to the activities in tribute to Luis Alberto Crespo, a writer honored in this edition of the Filven, with the recital “When poetry has interior music”, which will take place this November 8, at 11 : 00 in the morning, in the Stefanía Mosca space of the Municipal Council of Caracas.
In that same place, on November 15, a group of poets will present their literary creations in homage to the eternal commander, Hugo Chávez, at the recital ""The Poets of Chávez"", starting at 4:00 in the afternoon.
On November 16, starting at 1:00 in the afternoon, the conversation ""The history of Venezuela through its Official Publications"" will be held, by Pedro Sansonetti, in the House of Insurgent History, from 1:00 in the afternoon.
In this edition of the Filven, in addition, the National Library of Venezuela will have a stand to show the online resources available to guarantee access to the country's documentary collection and guide users in the process of Legal Deposit.

Press release



"
