,src,lang,text
0,"












به دنبال برخورد نظامی یا متفرق کردن تظاهرات نیستیم

سخنگوی نیروهای مسلح عراق، ادعای برخی رسانه‌ها مبنی بر بررسی متفرق کردن تظاهرات یا دست زدن به اقدامی نظامی علیه میدان التحریر از سوی دولت را تکذیب کرد.
02 Nov 2019, 14:04 by بولتن نیوز | bultannews.com
به گزارش بولتن نیوز، عبدالکریم خلف سخنگوی نیروهای مسلح عراق، عبدالکریم خلف سخنگوی فرمانده کل نیروهای مسلح عراق امروز شنبه ادعای برخی رسانه‌ها مبنی بر بررسی متفرق کردن تظاهرات یا دست زدن به هرگونه اقدامی نظامی علیه میدان التحریر یا تخلیه رستوران الترکی از سوی دولت را تکذیب کرد.
 
وی همچنین وقوع هرگونه درگیری و برخورد میان تظاهرات کنندگان و نیروهای امنیتی در پل السنک بغداد تکذیب کرد.
 
بر اساس گزارش الفرات، خلف تاکید کرد ما قاطعانه هرگونه تلفات در صفوف تظاهرات کنندگان در منطقه السنک را تکذیب می‌کنیم.
 
خلف همچنین در اظهارنظر دیگری گفت دولت در بالاترین سطوح از نیروهای حفظ نظم خواسته است تمام نیروهای حاضر در خط نخست با تظاهرات کنندگان هیچ سلاحی نداشته باشند.
 
خلف افزود نیروهای امنیتی هرگز به دنبال پایان دادن به حضور تظاهرات کنندگان در میدان التحریر یا دست زدن به هیچ اقدام نظامی برای متفرق کردن تظاهرات یا تخلیه رستوران الترکی نیستند و آنچه در این زمینه شایعه می شود، در راستای شله‌ور کردن آتش فتنه میان تظاهرات کنندگان و نیروهای امنیتی صورت می‌گیرد.
 
سخنگوی فرمانده کل نیروهای مسلح عراق خاطرنشان کرد مقررات منع آمد و شد به خاطر این اتخاذ شده تا نیروهای امنیتی در خلال ساعات برقراری آن به ساماندهی اوضاع و استراحت و جایگزینی بخش‌ها پرداخته تا برای روز بعد آماده شوند.
 
وی افزود امکان بازداشت ده‌ها نفر از خانواده‌ها که از تظاهرات برمی‌گردند، آن طور که برخی رسانه‌ها شایعه می‌کنند، وجود ندارد.
 

تظاهرات عراق خطری برای نظام سیاسی این کشور به همراه ندارد

 
یک گزارش مطبوعاتی درباره عراق امروز شنبه نشان داد که تظاهراتی که بغداد پایتخت و برخی استان‌ها شاهد آن هستند، هرگز خطری برای نظام سیاسی موجود تشکیل نخواهد داد، زیرا فاقد سازوکارهای تغییر است. این گزارش آورده است تمام آنچه این تظاهرات ممکن است محقق کند، استعفای دولتی است که بار دیگر با حضور احزابی که بر آن مسلط هستند، بازخواهد گشت.
 
در این گزارش که روزنامه القدس العربی چاپ لندن منتشر کرده ، آمده است پیامدهای تظاهرات به نظر می‌رسد که خطری برای نظام سیاسی عراق در بغداد به همراه نداشته باشد، همچنین این تظاهرات سازوکاری برای تغییر تمام نظام در اختیار ندارد تمام آن چیزی که امکان تحقق داشته باشد، استعفای دولت است که البته بار دیگر با حضور همان احزابی که بر آن مسلط هستند، بازخواهد گشت.
 
این گزارش افزود اما درباره سرنگونی احزاب حاکم باید گفت که این مسئله از طریق تظاهرات صورت نمی‌گیرد، بلکه از طریق انتخابات ممکن است، زیرا احزاب حاکم مشروعیت خود را از انتخاباتی گرفته‌اند که از سال 2004 برگزار شده است. این گزارش هشدار داده است که حکومت نظامی که برخی از آن سخن می‌گفت، ممکن نیست و حتما منجر به جنگ داخلی خواهد شد.
 
این گزارش درباره میزان نفوذ ایران در عراق آورده است نفوذ ایران در عراق واضح و روشن است و هیچ بحث و جدلی درباره آن وجود ندارد، ولی این نفوذ دینی و هویتی و نه نظامی است، چرا که هیچ سرباز ایرانی در عراق حضور ندارد هیچ نیروی نظامی یا حتی شبه نظامی ایرانی در عراق حضور ندارد، برخی به ایران به عنوان یک کشور اسلامی نگاه می‌کنند، همانطور که بسیاری از عراقی‌های اسلامگرای اهل سنت چنین نگاهی به ترکیه یا عثمانی دارند.
 

بررسی راه‌های گسترش روابط عراق و روسیه

 
خبر دیگر از عراق اینکه روابط دوجانبه بغداد و مسکو و راه‌های گسترش آن بررسی شد. بر اساس گزارش رسانه‌های عراق، حیدر العذاری سفیر عراق در مسکو با میخائیل بوگدانف نماینده ویژه ولادیمیر پوتین رئیس جمهور روسیه در خاورمیانه و شمال آفریقا دیدار کرد که طی آن راه‌های توسعه روابط دوجانبه مورد بحث و تبادل نظر قرار گرفت.
 
العذاری تاکید کرد سفرهای متقابل میان دو مقامات دو کشور به ارتقای سطح روابط دوجانبه و گسترش روابط تاریخی عراق و روسیه کمک کرده است.
 
العذاری در این دیدار به تشریح آخرین وضعیت عراق و تلاش‌های دولت برای برآورده کردن خواسته‌های تظاهرات کنندگان پرداخت و اظهار داشت دولت به طور جدی برای برآوردن تمام خواسته‌ها بر اساس سقف زمانی که نخست وزیر وضع کرده تلاش می‌کند.
 
بوگدانف هم تصریح کرد دولت روسیه با اهتمام زیادی تمام تحولات عراق را پیگیری کرده و همواره برای ارائه تمام کمک‌های لازم بر اساس صداقت تاریخی که روسیه را به عراق مرتبط کرده، تلاش می‌کند.
 
وی افزود روسیه به طور جدی برای افزایش سطح همکاری اقتصادی با عراق در تمام بخش‌ها تلاش می‌کند.
 
انتهای پیام/


",fa,"












We do not seek military confrontation or dispersal of demonstrations

A spokesman for the Iraqi Armed Forces denied claims by some media outlets that the government was considering dispersing demonstrations or carrying out military action against Tahrir Square.
02 Nov 2019, 14:04 by Bulletin News | bultannews.com
Armed Forces spokesman Abdul Karim Khalaf spokesman Abdul Karim Khalaf spokesman for the Iraqi Armed Forces said on Saturday that some media outlets are investigating dispersal of demonstrations or taking any military action against al-Tahrir Square or evacuation of al-Turki restaurant by the government. Kurdish.

He also denied any clashes between demonstrators and security forces in Baghdad's Al-Senak Bridge.

According to Al-Furat, Khalaf stressed that we firmly deny any casualties in the ranks of demonstrators in the Al-Senk area.

Khalaf also said in another comment that the government at the highest levels had called on the law enforcement agencies not to have any weapons with the demonstrators at the forefront.

Khalaf added that security forces never seek to end demonstrators in Tahrir Square or take any military action to disperse the demonstrations or evacuate the restaurant, and what is rumored to be in the wake of a riot fire among demonstrators. And the security forces.

A spokesman for the commander-in-chief of the Iraqi Armed Forces noted that the non-compliance regulations had been adopted because security forces would arrange breaks and replacements during the opening hours to prepare for the next day.

He added that it is impossible to arrest dozens of families returning from the demonstrations, as some media rumors suggest.


The Iraqi protests do not pose a threat to the country's political system


A press briefing on Iraq today showed that the demonstrations that Baghdad, the capital and some provinces, will never pose a threat to the existing political system because it lacks the mechanisms of change. The report states that all that the demonstrations might accomplish is the resignation of a government that will return once again to the dominant parties.

The report, published by the London-based al-Quds Al-Arabi newspaper, said the consequences of the protests seemed to pose no threat to the Iraqi political system in Baghdad, and that the demonstrations did not have the mechanism to change the whole system, all that was possible. Well, it is the resignation of the government that will, of course, come back again with the presence of those parties in power.

The report added, however, that the overthrow of the ruling parties is not through demonstrations but through elections, as the ruling parties derive their legitimacy from the 2004 elections. The report has warned that a military rule that some have spoken about is not possible and will inevitably lead to civil war.

Report on Iran's Influence on Iraq Brings Iran's influence in Iraq clear and there is no dispute about it, but it is religious and identity, not military, because no Iranian troops are in Iraq. There is no military or even Iranian militia in Iraq; some see Iran as an Islamic country, as many Sunni Islamist Iraqis look to Turkey or the Ottomans.


Exploring the Ways of Expanding Iraqi-Russian Relations


Another news from Iraq that the bilateral relations between Baghdad and Moscow and ways to expand it have been examined. Iraq's ambassador to Moscow, Heydar al-Azari, met with Russian President Mikhail Bogdanov's special envoy, Vladimir Putin, in the Middle East and North Africa, to discuss ways to develop bilateral relations, Iraqi media reported.

Al-Azari stressed that reciprocal trips between the two officials have helped boost bilateral ties and expand Iraq-Russia historical ties.

At the meeting, al-Azari described the latest situation in Iraq and the government's efforts to meet the demands of the demonstrators, saying the government was working hard to meet all demands on the timeframe set by the prime minister.

Bogdanov also stated that the Russian government is keen to keep track of all developments in Iraq and is always striving to provide all the necessary assistance based on the historical integrity that has linked Russia to Iraq.

Russia is working hard to increase the level of economic cooperation with Iraq in all sectors, he added.

End of message /


"
