,src,lang,text
0,"











Ако сте любители на българското кино, тази вечер пред вас се открива уникална възможност в Пловдив!

02 Nov 2019, 14:29

Изключителна възможност за всички почитатели на родното кино се открива тази вечер /събота/ от 20.15ч. в Lucky - Дом на киното. Големият български режисьор Стефан Командарев ще представи предпремиерно филма си ""В КРЪГ"".
""В КРЪГ"" е вторият филм от планираната трилогия след реализацията на ""Посоки"". Той разказва историите на три двойки патрулиращи полицаи в нощна София. Във филма ще видим множество известни български артисти, сред които Павел Поппандов, Асен Блатечки, Ирини Жамбонас, Иван Бърнев, Васил Василев–Зуека, Стефан Денолюбов, Стоян Дойчев, Герасим Георгиев–Геро, Николай Урумов, Анастасия Ингилизова, Ованес Торосян и др. Режисьор на продукцията е Стефан Командарев, оператор Веселин Христов.
След като взе две от най-престижните награди на кинофестивала в Сараево (""Сърцето на Сараево"" за най-добра актриса за Ирини Жамбонас и наградата Cineuropa за изключително постижение в европейската аудиовизуална култура), тази вечер ""В кръг"" взе нови три награди, този път от фестивала ""Златна Роза"" във Варна.
Специалната награда на град Варна, отново висока оценка за Ирини Жамбонас, която получи Награда за най-добра женска роля и Награда на публиката. Така само след участието си на два фестивала, В КРЪГ има впечатляващите 5 награди!
Заповядайте на днес от 20:15 ч., за да се срещнете със режисьора Стефан Командарев и да му зададете своите въпроси.


",bg,"











If you are a fan of Bulgarian cinema, tonight is a unique opportunity for you in Plovdiv!

02 Nov 2019, 13:29

An exceptional opportunity for all fans of native cinema is opening tonight (Saturday) from 8.15pm. at Lucky - Cinema House. The great Bulgarian director Stefan Komandarev will premiere his film ""IN THE CIRCLE"".
""IN THE CIRCLE"" is the second movie in the planned trilogy following the release of Directions. He tells the stories of three pairs of patrol officers in night Sofia. In the film we will see many famous Bulgarian artists, including Pavel Poppandov, Asen Blatechki, Irini Zhambonas, Ivan Burnev, Vasil Vasilev-Zueka, Stefan Denolubov, Stoyan Doichev, Gerasim Georgiev-Gero, Nikolay Urumov, Anastasia, Anastasia, Anastasia. The production is directed by Stefan Komandarev, operator Veselin Hristov.
After receiving two of the most prestigious awards at the Sarajevo Film Festival (""Sarajevo's Heart"" for Best Actress for Irina Jambonas and the Cineuropa Award for Excellence in European Audiovisual Culture), Tonight won three new awards, this time from the Golden Rose Festival in Varna.
The special award of the city of Varna, again highly appreciated for Irina Zhambonas, who received the Best Actress Award and the Audience Award. So just after participating in two festivals, there are an impressive 5 awards in the ROUND!
Come today at 8:15 pm to meet the director Stefan Komandarev and ask him your questions.


"
