,src,lang,text
0,"











UN GRUPO HISTÓRICO
La Fura repasa sus 40 años en un libro
Mercè Saumell publica 'La Fura dels Baus en cuarentena. 1979-2019', un documentado y manejable libro sobre la historia de un grupo teatral insólito con varios directoresUna app permite descargar videos de los espectáculos a partir de algunas de las fotografías publicadas en el volumen
03 Nov 2019, 17:15 by Marta Cervera
La Fura dels Baus celebra su 40 aniversario con un libro de Mercè Saumell, gran conocedora de este grupo teatral en constante evolución surgido en 1979 en Moià con Carlus Padrissa, Marcel.lí Antúnez y Pera Tantiñá, pero transformado al cabo unos años tras su llegada a Barcelona y la integración de Miquel Badosa (Miki Espuma), Pepe Gatell, Àlex Ollé, Jurgen Muller, Hansel Cereza y Jordi Arús. Pasaron de sorprender localmente con el teatro acción o teatro del caos gracias a montajes intensos donde la música industrial se fundía con imágenes y dinámicas a dar el salto a una dimensión internacional tras triunfar con la ceremonia inaugural de los JJOO'92 . Abrirse a disciplinas como la ópera ha sido una manera de reinventarse y de seguir avanzando.
Saumell, que hizo una tesis sobre el grupo, lo sigue desde que lo descubrió en 1984. Acaba de lanzar ‘La Fura dels Baus en cuarentena’(Editorial Planeta). Su libro tiene un tono entre divulgativo y académico pero atractivo visualmente gracias el diseño gráfico de Francisca Torres. Se aleja de los libros de aniversario de tapa dura y varios kilos de peso más pensados cara a la galería. El grupo ya propuso algo así hace años. Ahora apuesta por un formato manejable y de consulta práctica, breves capítulos y muchas imágenes en blanco y negro y color. Incluye, además, contenidos interactivos en formato video y una app complementaria para poder descargar y visualizar algunos espectáculos significativos, tanto de teatro como de ópera. Recoge entre otros  retazos de ‘Suz/o/Suz’ (1985) o ‘La Atlántida’, obra póstuma de Falla, su primer experimentos con cantantes líricos.
“Me interesaba plasmar toda la complejidad que hay detrás de sus creaciones, explicar su método de trabajo. Todas sus propuestas están marcadas por el espacio en el que se realizan y el trabajo en equipo"". Esa pluralidad de miradas está en su ADN como pudo comprobarse ya en las dos primeras trilogías fureras que asentaron un lenguaje propio inconfundible.


La Fura del Baus en 1984, dentro de un coche destrozado que utilizaban en 'Accions', en el Mercado de Abastos de Madrid.  EL PERIÓDICO

La Fura empezó haciendo teatro de calle pero a diferencia de Comediants, referente del teatro independiente, ellos lo subvirtieron. “Optaron por algo mucho más provocador, físico y visceral&rdquor;, dice la autora. “Nosotros éramos más punks&rdquor;, apunta Teresa Puig, la primera chica que formó parte del grupo en sus inicios cuando surgió en Moià. Si algo les distingue es “esa capacidad para mezclar lo más carnal y orgánico con el mundo tecnológico&rdquor;, destaca Saumell. Algo queda de todo lo aprendido en su primera época de ‘Accions’(1983), donde destrozaban un coche, ‘Manes’(1985) y  ‘Tier Mon’(1988) en las sofisticadas óperas que preparan en todo el mundo. Como esa aclamada tetralogía wagneriana estrenada en Valencia con los cantantes elevados por grúas y un dragón biónico. 
“Son ingentes las cosas que han realizado en estos 40 años&rdquor;, destaca Saumell. Con el tiempo, cada uno se ha especializado en una línea, creando y ampliando así su red de colaboradores “no solo a nivel creativo sino también a nivel de gestión y de producción&rdquor;. Muchos han seguido unidos a la matriz que actualmente cuenta con seis directores, cada uno con sus propios proyectos y equipos: Miki Espuma, Jurgen Muller, Pep Gatell y Pera Tantiñá, Àlex Ollé, Carlus Padrissa. Estos dos últimos han contribuido a la renovación escénica de la ópera con espectaculares montajes. Otros compañeros como Marcelí Antúnez y Andreu Morte, dejaron el grupo. 


Espectáculo de La Fura dels Baus en la ceremonia inaugural de los JJOO'92.  EL PERIÓDICO

La principal novedad de este libro respecto a otros sobre La Fura es el material relacionado con los procesos de creación.  “Suelen utilizar ‘storyboards’. Los dibujos de algunos de sus proyectos evidencian  un trabajo que ha estado siempre más próximo a la danza contemporánea y a otros géneros ajenos al teatro textual&rdquor;. Al no provenir del teatro de texto, la música sirvió como hilo conductor de sus espectáculos. Desde su fundación como  cooperativa escenicomusical han editado más de una decena de discos. El relacionado con el espectáculo 'Noun' se grabó en 1990 en los estudios Real World  de Peter Gabriel y la banda sonora de 'FreeBach 212', la última aventura de Miki Espuma, se ha realizado este año en un estudio de Km 0, Audiovisuals de Sarrià.
La clave de La Fura para mantenerse a lo largo de cuatro décadas y seguir dando qué hablar  reside en su capacidad para continuar aprendiendo y experimentando. ""El trabajo con especialistas en otras disciplinas ha sido fundamental para avanzar"", afirma Ollé.  ""Como si se tratase de una pareja sentimental, la clave para mantenerse tantos años es reiventarse"". En la ópera él y Padrissa han sorprendido al público con montajes realizados codo a codo con creadores como Jaume Plensa, escultor; Franc Aleu, videoartista; Roland Olbeter, diseñador de curiosas máquinas, Chu Uroz, diseñador de moda; Rafael Argullol, filósofo y Lita Cabellut, artista plástica, con quien Padrissa trabajó en el impresionante 'Karl V' estrenada en Munich en febrero.


Momento de 'Karl V', ópera de Ernst Krenev con dirección escénica de Carlus Padrissa donde colaboró Lita Cabellut.   WILFRIED HOESL 

Es pronto para pensar en el futuro de la marca cuando sus fundadores se retiren. “Todavía tienen mucha cuerda porque conservan la vitalidad y muchos proyectos en su agenda&rdquor;. Entre ellos hay uno que les hace particular ilusión: Fundación Épica. Es un trabajo relacionado con la educación y la inclusión social a través de las artes escénicas inaugurado hace un año en Badalona. ""Es el futuro"", afirma Padrissa respecto a este laboratorio de ideas donde el teatro se utiliza como instrumento de cohesión social, un espacio donde compartir y transmitir conocimientos para seguir evolucionando. 

Más noticias de Ocio y Cultura





Lo más visto


Edición Global
Catalunya



Laura Borràs (Junts per Catalunya) se enfrenta a Iñaki López en 'laSexta noche': ""Intente ser educado""


Últimas noticias de Catalunya y de las elecciones generales | Directo


Sondeo: Los catalanes aprueban la actuación de los Mossos en los disturbios


Junqueras a Sánchez: ""Su tiempo se está agotando. Yo no tengo prisa""


""¡Racista!"", ""¡Fascista!"": la salsa 'arrabbiata'




Laura Borràs (Junts per Catalunya) se enfrenta a Iñaki López en 'laSexta noche': ""Intente ser educado""


Últimas noticias de Catalunya y de las elecciones generales | Directo


Sondeo: Los catalanes aprueban la actuación de los Mossos en los disturbios


Máxima alerta policial por la visita del Rey a Barcelona y por el 10-N


""¡Racista!"", ""¡Fascista!"": la salsa 'arrabbiata'




",es,"











A HISTORICAL GROUP
La Fura reviews her 40 years in a book
Mercè Saumell publishes' La Fura dels Baus in quarantine. 1979-2019 ', a documented and manageable book on the history of an unusual theater group with several directors An app allows you to download videos of the shows from some of the photographs published in the volume
03 Nov 2019, 17:15 by Marta Cervera
La Fura dels Baus celebrates its 40th anniversary with a book by Mercè Saumell, a great connoisseur of this constantly evolving theater group that emerged in 1979 in Moià with Carlus Padrissa, Marcel.lí Antúnez and Pera Tantiñá, but transformed a few years after his arrival to Barcelona and the integration of Miquel Badosa (Miki Espuma), Pepe Gatell, Àlex Ollé, Jurgen Muller, Hansel Cereza and Jordi Arús. They went on to surprise locally with the action theater or chaos theater thanks to intense montages where industrial music merged with images and dynamics to make the leap to an international dimension after triumphing with the inaugural ceremony of the Olympic Games. Opening up to disciplines such as opera has been a way of reinventing oneself and moving forward.
Saumell, who did a thesis on the group, has followed it since he discovered it in 1984. He has just launched ‘La Fura dels Baus in quarantine’ (Editorial Planeta). His book has a tone between informative and academic but visually attractive thanks to the graphic design of Francisca Torres. It moves away from the hardcover anniversary books and several kilos of more thought weight facing the gallery. The group already proposed something like this years ago. Now bet on a manageable format and practical consultation, short chapters and many images in black and white and color. It also includes interactive content in video format and a complementary app to download and view some significant shows, both theater and opera. Collect among other pieces of ‘Suz / o / Suz’ (1985) or ‘La Atlántida’, posthumous work of Falla, his first experiments with lyrical singers.
“I was interested in capturing all the complexity behind their creations, explaining their working method. All his proposals are marked by the space in which they are carried out and teamwork. ""That plurality of looks is in his DNA as could be seen already in the first two fierce trilogies that established an unmistakable own language.


La Fura del Baus in 1984, inside a shattered car that they used in 'Accions', in the Mercado de Abastos de Madrid. THE NEWSPAPER

La Fura started doing street theater but unlike Comediants, a reference in independent theater, they subverted it. “They opted for something much more provocative, physical and visceral & rdquor ;, says the author. “We were more punks & rdquor ;, says Teresa Puig, the first girl who was part of the group at the beginning when she emerged in Moià. If something distinguishes them, it is “that ability to mix the most carnal and organic with the technological world”, highlights Saumell. Something remains of everything learned in its first era of ‘Accions’ (1983), where they smashed a car, ‘Manes’ (1985) and ‘Tier Mon’ (1988) in the sophisticated operas they prepare all over the world. Like that acclaimed Wagnerian tetralogy premiered in Valencia with singers raised by cranes and a bionic dragon.
“The things they have done in these 40 years are huge,” says Saumell. Over time, each one has specialized in a line, creating and expanding their network of collaborators “not only at the creative level but also at the management and production level.” Many have remained united to the matrix that currently has six directors, each with their own projects and teams: Miki Espuma, Jurgen Muller, Pep Gatell and Pera Tantiñá, Àlex Ollé, Carlus Padrissa. These last two have contributed to the scenic renovation of the opera with spectacular montages. Other partners like Marcelí Antúnez and Andreu Morte, left the group.


La Fura dels Baus show at the opening ceremony of the Olympic Games. THE NEWSPAPER

The main novelty of this book regarding others about La Fura is the material related to the creation processes. ""They usually use‘ storyboards. "" The drawings of some of his projects show a work that has always been closer to contemporary dance and other genres outside the textual theater. Not coming from the text theater, the music served as the guiding thread of their shows. Since its founding as a stage-cooperative cooperative they have released more than a dozen albums. The one related to the show 'Noun' was recorded in 1990 at Peter Gabriel's Real World studios and the soundtrack of 'FreeBach 212', the last adventure of Miki Espuma, has been performed this year in a Km 0 studio, Audiovisuals from Sarrià.
The key to La Fura in maintaining itself for four decades and continuing to give what to speak lies in its ability to continue learning and experiencing. ""Working with specialists in other disciplines has been essential to move forward,"" says Ollé. ""As if it were a sentimental couple, the key to staying so many years is to get well again."" In opera he and Padrissa have surprised the audience with assemblies made side by side with creators such as Jaume Plensa, sculptor; Franc Aleu, video artist; Roland Olbeter, designer of curious machines, Chu Uroz, fashion designer; Rafael Argullol, philosopher and Lita Cabellut, plastic artist, with whom Padrissa worked on the impressive 'Karl V' premiered in Munich in February.


Moment of 'Karl V', opera by Ernst Krenev with stage direction by Carlus Padrissa where Lita Cabellut collaborated. WILFRIED HOESL

It is too early to think about the future of the brand when its founders retire. ""They still have a lot of rope because they retain vitality and many projects on their agenda."" Among them there is one that makes them particularly excited: Epic Foundation. It is a work related to education and social inclusion through the performing arts opened a year ago in Badalona. ""It is the future,"" says Padrissa regarding this laboratory of ideas where theater is used as an instrument of social cohesion, a space to share and transmit knowledge to continue evolving.

More news of Leisure and Culture





Most seen


Global Edition
Catalunya



Laura Borràs (Junts per Catalunya) faces Iñaki López in 'laSexta noche': ""Try to be polite""


Latest news from Catalonia and the general elections | Direct


Poll: The Catalans approve the performance of the Mossos in the riots


Junqueras to Sánchez: ""Your time is running out. I'm in no hurry""


""Racist!"", ""Fascist!"": The 'arrabbiata' sauce




Laura Borràs (Junts per Catalunya) faces Iñaki López in 'laSexta noche': ""Try to be polite""


Latest news from Catalonia and the general elections | Direct


Poll: The Catalans approve the performance of the Mossos in the riots


Maximum police alert for the King's visit to Barcelona and for 10-N


""Racist!"", ""Fascist!"": The 'arrabbiata' sauce




"
