,src,lang,text
0,"











Від Самсона і Наполеона до англійців і самаритян. Репортаж НВ з одного з найбільш нетуристичних місць в світі
Місто, якому нікуди рости, угруповання ХАМАС і доглядач британського військового кладовища часів Першої світової. Журналіст Радіо НВ Юрій Мацарський побував в одному з найбільш нетуристичних місць на планеті - Секторі Газа в Палестинській Автономії.
03 Nov 2019, 17:24 by Юрій Мацарський
Палестинська автономія розташована на двох не межуючих одна з одною територіях. Одна з них — прибережний Сектор Газа. Другу територію самі палестинці називають Західним берегом річки Йордан, а ізраїльтяни відзначають на картах як «Іудея і Самарія». Остання частина назви відсилає до народу самаритян, що довгий час вважався на Заході вимерлим. шанс «відкрити» самаритян для великого світу був більше 200 років тому у Наполеона, але він буквально вислизнув у нього з рук разом з біженцями з Гази.
Газа — одне із найдавніших міст світу, воно згадується в Біблії, хроніках арабських завойовників, давньоєгипетських і перських літописах. Вона не завжди була центром Сектора Газа — цей регіон з до кінця не врегульованим статусом з’явився на карті всього кілька десятиліть тому. Раніше місто, назва якого співзвучна з арабським словом, що означає силу або міць, входило до складу царств і імперій, самі назви яких здаються зараз казковими — Ассирія, Ханаан, Філістимська земля.


На в'їзді в село самаритян - попередження для громадян Ізраїлю про те, що їм туди дорога закрита / Фото: НВ

Спадкоємцями останньої вважають себе і нинішні жителі Гази, зводячи походження слова «палестина» до загадкового народу філістимлян, що наводили страх на мешканців Єгипту та Леванту за сотні років до початку християнської ери.
Відтоді в самій Газі майже нічого не залишилося — найбільш цінні предмети, створені філістимлянами, давно вже вивезені в найвідоміші музеї світу, інші артефакти роз'їхалися по приватних колекціях. Але шанс доторкнутися до давньої історії, проте, є. Велика мечеть Гази — головна культова споруда міста — стоїть на фундаменті грецької християнської базиліки, зруйнованої ще в Середні століття. А ось ця базиліка, досить імовірно, була зведена на фундаменті храму бога-риби Дагона — глави священного пантеону філістимлян, центром культу якого була саме Газа.


Велика мечеть Гази стоїть на місці храму, зруйнованого старозавітним Самсоном / Фото: НВ

У Біблії цей храм ціною власного життя зруйнував обманом захоплений в полон і засліплений силач Самсон, поховавши під його руїнами всю філістімлянську знать. Так що кам’яна підлога Великої мечеті, найімовірніше, пам’ятає важкі кроки могутнього сліпця, а подряпини і вищерблини на ньому могли залишити уламки зруйнованого Самсоном язичницького храму.
Ця підлога старша за стіни мечеті на століття, а то і на тисячоліття. Культова споруда кілька разів руйнувалася майже до фундаменту, а потім будувалася заново. В останній раз Велика мечеть була майже стерта в пил під час Першої світової війни. Її високий мінарет використовувався наступаючими з боку єгипетського Синая британськими військами в якості орієнтира для артилерії, через що чимало снарядів впало в безпосередній близькості від мечеті або прямо на неї.
На Близькому сході Британська імперія воювала проти імперії Османської. Як і на європейському театрі Першої світової, тут тривали затяжні окопні бої, тисячі тонн снарядів обрушувалися на позиції воюючих сторін і навіть танки — тоді зовсім ще новий вид озброєння — були відправлені в допомогу британським частинам, що укріпилися на підступах до Гази. Місто було взято британцями приблизно за рік до кінця війни — в листопаді 1917. Про ціну, яку заплатили бійці армії Його величності за капітуляцію османського гарнізону, досі нагадує величезний цвинтар на півночі Гази.


Військове кладовище - напевно, єдине місце в Газі, де іудейська символіка не береться осміянню і наруги / Фото: НВ

Більшість з трьох тисяч шестисот шістдесяти одної могили військового кладовища Британської співдружності відносяться саме до Першої світової війні. Під стандартними військовими надгробками тут покояться бійці, що з'їхалися на Близький Схід з усіх куточків тоді ще гігантської імперії — канадці, шотландці, південноафриканці, індійці, солдати і офіцери Австралійсько-новозеландського армійського корпусу. Є ще кілька могил часів Другої світової, в тому числі, бійців і медсестер з Польського корпусу, і сектор з прахом миротворців, які загинули вже в повоєнний час.
Доглядає за надгробками Ібрагім Джерада — він доглядач британських військових кладовищ вже в четвертому поколінні. Першим з Джерада, найнятим англійцями доглядати за могилами, був його прадід, колишній доглядач військових поховань в Беер-Шеві ще в 1920-ті. Після утворення держави Ізраїль Джерада перебралися в Газу, де продовжили фамільну справу. Офіційний роботодавець Ібрагіма — Комісія військових поховань країн Британської співдружності. Ця організація зі штаб-квартирою в Лондоні управляє сотнями військових кладовищ, розкиданих по всьому світу. І всі вони дуже схожі одне на інше: однакові білі надгробки піднімаються над акуратно підстриженою травою. На кожному надгробку — ім'я загиблого, дати його народження і смерті, емблема частини, в якій він служив і графічний символ релігії, яку сповідував воїн. Найчастіше це християнський хрест, але є і кілька шестикінечних іудейських зірок на каменях, встановлених над могилами солдатів імперії єврейського походження. Ці зірки — єдині в Газі не осквернені та не використовувані в якості карикатур іудейські релігійні символи. Правляче в Секторі Газа угруповання ХАМАС, визнане в США, Канаді, ЄС і, звичайно, Ізраїлі терористичною організацією, сповідує не просто антиізраїльську, а прямо-таки антисемітську ідеологію, на підконтрольну їй територію заборонений навіть ввезення книг на івриті. Але зірки на надгробках вціліли, ймовірно тому, що ХАМАС не хоче сваритися з Лондоном та іншими столицями колишньої вже імперії. Хоча «вціліли» — це не зовсім те слово, яке стоїть тут використовувати, адже часто над могилою стоїть зовсім не той камінь, який вкопували в землю день похорону того, хто покоїться під ним.
«Ось, подивіться, деякі камені виглядають як нові. Так і є. Багато могил було пошкоджено в ході недавніх війн в секторі Газа. Кулями або осколками. Наша комісія надіслала нам нові могильні камені, і ми замінили ними пошкоджені», — розповідає Ібрагім Джерада, показуючи на могилу загиблого восени 1917 року воїна-маорі з далекої Нової Зеландії, над якою височить зовсім новий надгробок.


Місцеві жителі називають це кладовище шматочком Європи і приходять гуляти сюди цілими сім'ями / Фото: НВ

Крім заміни каменів, пошкоджених кулями і снарядами, в Ібрагіма вистачає і іншої роботи. Він веде переписку з нащадками полеглих в боях солдатів і офіцерів — хтось просить прислати фото могил своїх предків, хтось — уточнює, чи не в Газі спочивають останки їхніх дідів і прадідів, є і ті, хто надсилає прохання нанести на надгробки ті або інші написи. Тоді знову доводиться зв’язуватися з Лондоном і замовляти новий камінь, вже з вигравіруваним на ньому новим девізом. Крім того, доглядач зобов’язаний підтримувати газон в ідеальному стані і не давати людям, що цілими сім'ями приходять на цвинтар, надто вже вільно розгулювати по могилах.
Газа — це величезне місто, якому вже нікуди рости, майже вся територія Сектора Газа — суцільна житлова забудова, майстерні та магазини. Парків і скверів там майже немає. А зелене військове кладовище, заховане від галасливих вулиць за високим парканом і огорожею з кипарисів — прямо-таки ідеальне місце для сімейного відпочинку.
«Я не дуже-то їх ганяю, тільки коли вони вже зовсім втрачають контроль над собою. Ну це ж діти, не на вулиці ж серед машин їм бігати. Нехай краще тут грають», — немов вибачається Ібрагім після того як гримнув на хлопчаків, що стрибають по монументу на честь полеглих британців, прикрашеного написом «Імена їх жити будуть у вічності».
Якби в Газу приїжджали туристи, це кладовище напевно стало б одним з найпопулярніших у них місць. Але туристів тут немає, в Сектор Газа дозволено в'їзд тільки журналістам, співробітникам ООН, працівникам благодійних організацій. Тому і військове кладовище, і інші визначні пам’ятки стародавнього міста мало кому взагалі відомі за межами Гази. Правда, і пам’яток там зовсім небагато. Велика мечеть, цвинтар, невеликий османський форт Каср аль-Паша зі скромною музейною експозицією, що складається з декількох монет римської епохи, черепків візантійської посуду, пари кривих турецьких шабель і бюста Ясіра Арафата. Ось, напевно, і все. Зате той же Каср аль-Паша, якщо був би побудований в будь-якому іншому місці, став би справжнім магнітом для тих, хто цікавиться. Адже цей маленький форт якийсь час служив резиденцією Наполеона Бонапарта за часів його близькосхідного походу. В Єгипет, а потім і в Палестину Бонапарт вирушив ще до того, як піднявся на вершину влади, в Газу в 1799 році він прибув не як імператор Франції, а в якості командувача армією.
Як і британці, більш ніж через сто років після нього, наступав Наполеон з Синая. Звістка про наближення його полків викликала в Газі паніку. Тисячі людей залишили свої будинки і втекли з міста, налякані звістками про жорстокість, з якою французи обійшлися з жителями вже захоплених ними єгипетських міст.


Стіни форту, в якому жив Наполеон, прикрашені скульптурними зображеннями левів / Фото: НВ

Саме тоді — взимку 1799 року — Газа назавжди втратила одну з найзагадковіших своїх громад. Місто в повному складі покинули всі самаритяни, що жили в ньому. На відміну від інших біженців, що часто не мали уявлення про те, де їм шукати порятунку і на кого сподіватися, самаритяни точно знали куди йдуть і до кого звертатися за захистом. Шлях їхній лежав на північний схід, до міста Наблус, в околицях якого розташована священна для самаритян гора Герізім. А захисту вони шукали у бога. Бог самаритян — це бог Авраама і Мойсея, бог Ізраїлю, який уклав завіт з обраним народом і надихнув царів і пророків на написання священних книг, з яких складено найбільш сокровенну літературну працю — Тору.
Самі самаритяни називають себе народом Ізраїлю і вірять в те, що це їхній закон і їхня віра були дані Мойсеєві Всевишнім, а іудеї, що також кличуть себе ізраїльтянами і теж шанують Тору, закон божий перекрутили, а основні постулати віри переінакшили, позбавивши їх священного наповнення.
У Торі самаритян і в Торі іудеїв дійсно багато розбіжностей. Але вони, в основному, незначні, що стосуються, наприклад, написання тих чи інших імен або географічних назв. А головна відмінність двох священних книг — це вказівка на місце будівництва храму. І юдеї, і самаритяни дотримуються концепції «Один храм для єдиного бога», але у перших місце, обране самим Всевишнім для зведення єдиного священної споруди, розташоване в Єрусалимі (Храмова гора), а у других — в передмісті Наблуса, на вершині гори Герізім.


В Єрусалимі, на Храмовій горі іудеїв зараз знаходяться мусульманські святині, включаючи критий золотом Купол скелі / Фото: НВ

Самаритяни вірять в те, що їхній храм був побудований першим, а в Єрусалимі пізніше з’явилася його копія, начисто позбавлена божественної присутності. Причому, побудували її ассірійці, які оселилися в Єрусалимі і навколо стародавнього міста після підпорядкування палестинських земель Ассірійській імперії за дві тисячі років до початку християнської ери. У книгах самаритян йдеться, що завойовники перейняли у них віру в єдиного бога, але до кінця нею не прониклися і навіть взялися за переписування священних текстів, щоб виправдати свої нововведення. Іудеї ж у свою чергу вважають нащадками ассірійських загарбників саме самаритян.
Іудеї вважають, що культ храму на горі Герізім — вигадка одного з їхніх же колишніх одновірців, який мріяв стати первосвящеником в Єрусалимі, але опинився негідним цієї ролі і втік на нове місце, мешканців якого вдалося переконати в святості Герізіма.
Самаритяни розповідають цю саму історію з точністю до навпаки: самозванець з їхнього народу вирушив до ассирійців в Єрусалим після того, як не зміг захопити релігійну владу над громадою.


На горі Герізім давно немає самаритянського храму, на його місці - уламки візантійської церкви і невелика дозорна башта османських часів / Фото: НВ

Зараз храму немає ні в Єрусалимі, ні в передмісті Наблуса. Єврейську святиню зруйнували римляни, самаритянську — візантійці. На Храмовій горі тепер височіють мечеть Аль-Акса і мусульманська святиня Купол Скелі, що вкриває камінь, відштовхнувшись від якого, вірять мусульмани, вирушив у подорож на небеса пророк Мохаммед. На вершині гори Герізім — лише руїни грецької церкви, зведеної на місці стародавнього храму і маленька башточка османських часів.
«Ця гора сама по собі священна. І без храму. Адже сам Всевишній обрав її в якості свого земного дому після виходу народу з рабства. Декілька разів на рік тут збирається вся наша громада, ми тут молимося і відзначаємо наші свята. Тут ми просимо Бога про пришестя месії, який відновить храм і займе місце на чолі громади. Поки месія не прийшов, громаду очолює первосвященик. І в іудеїв теж був свій первосвященик, але після руйнування їхнього храму вони залишилися без єдиного релігійного лідера, а ми цю традицію зберегли. Коли храм буде відновлено, у нас буде кому в ньому служити і кому приносити жертви богу», — пояснює деякі тонкощі своєї віри Абуд Коен — онук первосвященика самаритян.


Нинішній первосвященик самаритян Абуд Коен, як і всі його попередники, веде свій рід від брата Мойсея Аарона / Фото: НВ

Він відмінно говорить англійською, займається високими технологіями, водить хороший автомобіль і живе в сучасному будинку з видом на один зі схилів священної гори. У 1904 році, коли американські місіонери виявили на приналежному тоді Османській імперії Близькому Сході, що самаритяни не зникли і не загубилися в століттях, представники цього народу жили зовсім інакше. У ті часи вони перебували на межі зникнення, адже багато самаритян, прагнучи знайти роботу, переходили в іслам, християнство чи іудаїзм, офіційно визнані османськими владою. Самаритяни ж були позбавлені безлічі цивільних прав і буквально виживали. На рубежі 19 і 20 століть у громаді було близько 120 осіб. Їх випадкове виявлення місіонерами буквально врятувало громаду — американські та європейські дослідники кинулися в Наблус і кинулися десятками, а то й сотнями скуповувати стародавні сувої і книги, написані особливою мовою, схожою на іврит, але зі значними відступами від його класичних правил. Іноземні гроші були витрачені на їжу і погашення боргів перед османською владою. Громада врятувалася, але втратила безліч своїх літературних пам’яток. Зате зараз самаритяни вже не вмирають від голоду, їх чисельність зросла з 120 до 800 осіб, а їхні громадянські права зобов’язуються охороняти відразу три уряди — палестинський, ізраїльський і йорданський. Підданство Йорданії даровано самаритянам правлячою там королівською Хашимітською династією.
Близькосхідні політики намагалися використовувати самаритян в якості посередників в палестино-ізраїльському врегулюванні — все-таки релігійно вони дуже близькі до євреїв, але при цьому багато хто з них живе на палестинських територіях і в побуті розмовляє арабською — але поки прогрес в цьому напрямку навряд чи помітний. Можливо, справа в тому, що половина всієї громади — а це ті самі жителі околиць гори Герізім, всього близько 400 чоловік — симпатизує радше палестинцям, тоді як друга половина, що кілька десятиліть тому оселилася в одному з районів ізраїльського Тель-Авіва, віддає перевагу ізраїльтянам. У повному складі громада збирається лише кілька разів на рік на найважливіші релігійні свята. У ці дні з особливого сейфа виймають найвеличнішу цінність самаритян — давній сувій Тори, про який говорять, що він передається від первосвященика первосвященику вже більше двох тисяч років.


Тора самаритян відрізняється від іудейської не тільки змістом, а й мовою - священні тексти самаритян написані давньоєврейською, який незрозумілий сучасним ізраїльтянам / Фото: НВ

У сейф священні книги ховають не просто так. У 1980-і роки самаритяни в більшості своїй жили в Наблусі, відвідуючи священну гору тільки періодично. Їхні цінні сувої зберігалися в синагозі в одному з центральних районів міста. Одного ранку віряни виявили двері в молитовний будинок виламаними, а два особливо цінних сувої зникли. Незабаром одна з місцевих мафіозних груп звернулася до громади з пропозицією повернути сувої за мільйон доларів. Самаритяни вступили з мафією в переговори, які тривають і досі. А з Наблуса незабаром вирішили переїхати. Правда, як каже сам первосвященик, це рішення не було пов’язано з крадіжкою книг — просто місця все зростаючій у ті часи громаді в місті стало не вистачати.
«Люди з громади хочуть триматися разом, ближче один до одного, але в Наблусі це було зробити все складніше. Тому ми і переїхали сюди. Але ми в хороших стосунках з нашими арабськими сусідами. І з нашими єврейськими сусідами. Ми мирні люди і всім раді», — розповідає літній первосвященик, якого, як і його онука, теж звуть Абуд Коен.
Він радий гостям і з України, тим більше, в громаді зараз живе півтора десятка українок, які приїхали в це село після заміжжя з самаритянами. Так що Герізім — це тепер трохи і українська історія.


",uk,"











From Samson and Napoleon to the English and Samaritans. Reporting from one of the most unpopular places in the world
A city that has nowhere to grow, the Hamas Group and the caretaker of the British World War I Cemetery. Radio NV journalist Yuri Matsarsky visited one of the most non-tourist spots on the planet - the Gaza Strip in the Palestinian Authority.
03 Nov 2019, 17:24 by Yuri Matsarskiy
Palestinian autonomy is located in two non-adjacent territories. One is the coastal Gaza Strip. Palestinians call the second territory the West Bank of the Jordan, and the Israelis mark it on the maps as ""Judea and Samaria."" The last part of the name refers to the Samaritans, who have long been considered extinct in the West. Napoleon's chance to ""discover"" the Samaritans for the great world was over 200 years ago, but he literally slipped out of his hands with the refugees from Gaza.
Gaza - one of the oldest cities in the world, it is mentioned in the Bible, chronicles of Arab conquerors, ancient Egyptian and Persian chronicles. It has not always been the center of the Gaza Strip - this region with an unsettled status appeared on the map only a few decades ago. Previously, the city, whose name is in harmony with the Arabic word, meaning power or power, was part of the kingdoms and empires, whose names now seem fabulous - Assyria, Canaan, Philistine land.


At the entrance to the Samaritan village - warning to Israeli citizens that their road is closed there / Photo: NV

The current inhabitants of Gaza consider themselves the heirs of the latter, reducing the origin of the word ""Palestine"" to the mysterious people of the Philistines, who feared the inhabitants of Egypt and the Levant hundreds of years before the beginning of the Christian era.
Since then, there is almost nothing left in Gaza itself - the most valuable items created by the Philistines have long been taken to the most famous museums in the world, other artifacts have been dispersed through private collections. But there is a chance to touch ancient history. The Grand Mosque of Gaza, the city's main cult building, stands on the foundation of a Greek Christian basilica, which was destroyed in the Middle Ages. But this basilica was probably built on the foundation of the temple of the god-fish Dagon - the head of the sacred pantheon of the Philistines, the center of the cult of which was Gaza.


The Great Mosque of Gaza stands on the site of a temple destroyed by Old Testament Samson / Photo: NV

In the Bible, this temple was destroyed at the cost of his life by the deception of a captive and blinded strongman, Samson, who buried all the Philistine nobility under his ruins. So the stone floor of the Grand Mosque probably remembers the heavy steps of a mighty blind man, and the scratches and dents on it could leave the rubble of Samson's pagan temple destroyed.
This floor is older than the walls of the mosque by centuries, and even by millennia. The cult building was destroyed several times almost to the foundation and then rebuilt. The last time the Grand Mosque was nearly dusted off during World War I. Its high minaret was used by the advancing Egyptian Sinai by British troops as a reference point for artillery, because of which many shells fell in the immediate vicinity of the mosque or directly at it.
In the Middle East, the British Empire fought against the Ottoman Empire. Like at the European Theater of the First World War, protracted trench battles continued here, thousands of tons of shells were struck at warring positions and even tanks - then a completely new type of armaments - were sent to aid the British troops, which had become entrenched on the approaches to Gaza. The city was taken by the British about a year before the end of the war - in November 1917. The price paid to the soldiers of His Majesty's army for the surrender of the Ottoman garrison still resembles a huge cemetery in northern Gaza.


The military cemetery is probably the only place in Gaza where Jewish symbolism is not ridiculed and ridiculed / Photo: NV

Most of the three thousand six hundred and sixty-one graves of the British Commonwealth War Cemetery belong to the First World War. Under the standard military tombstones, fighters are here resting in the Middle East from all corners of the then giant empire - Canadians, Scots, South Africans, Indians, soldiers and officers of the Australian-New Zealand Army Corps. There are several other World War II graves, including soldiers and nurses from the Polish Corps, and a sector with the ashes of peacemakers who have died since the war.
He looks after Ibrahim Jerad's tombstones - he is the caretaker of British military cemeteries in the fourth generation. The first of Jerad's hired Englishmen to look after the graves was his great-grandfather, a former caretaker of the Beer Shev war graves back in the 1920s. After the formation of the state of Israel Jerad moved to Gaza, where they continued the family business. Ibrahim's Official Employer is the British Commonwealth War Graves Commission. Headquartered in London, the organization manages hundreds of military cemeteries scattered around the world. And they are all very similar to each other: the same white tombstones rise above the neatly trimmed grass. On each tombstone is the name of the deceased, the date of his birth and death, the emblem of the part in which he served and the graphic symbol of the religion professed by the warrior. Most often it is a Christian cross, but there are also several six-pointed Jewish stars on the stones mounted above the tombs of soldiers of an empire of Jewish descent. These stars are the only ones in Gaza that are not defiled and are not used as caricatures by Jewish religious symbols. The Hamas ruling Gaza group, recognized in the US, Canada, EU and, of course, Israel as a terrorist organization, professes not just anti-Israeli but also anti-Semitic ideology, and is not even allowed to bring books into Hebrew. But the stars on the tombstones survived, probably because Hamas does not want to quarrel with London and other capitals of the former empire. Although ""survived"" is not quite the word that should be used here, because often beyond the grave is not the stone that dug into the ground the day of the burial of the one who rested under it.
""Look, some of the stones look new. Yes it is. Many graves have been damaged during the recent wars in the Gaza Strip. Bullets or shards. Our commission sent us new grave stones, and we replaced them with damaged ones, ”says Ibrahim Jerad, pointing to the grave of a fallen 1917 Maori warrior from faraway New Zealand, over whom a brand new tombstone hangs.


Locals call this cemetery a piece of Europe and come here to walk with whole families / Photo: NV

In addition to replacing stones damaged by bullets and shells, Ibrahim lacks other work. He corresponds with the descendants of soldiers and officers who died in combat - someone asks to send a photo of the graves of their ancestors, someone - specifies whether the remains of their grandparents and grandfathers are resting in Gaza, and there are those who send a request to write on these or other inscriptions. Then again, you have to contact London and order a new stone, with the new motto engraved on it. In addition, the caretaker is obliged to keep the lawn in perfect condition and not allow people who come to the cemetery as whole families to walk around the graves too freely.
Gaza is a huge city that has nowhere to grow, almost all of the Gaza Strip is full of residential development, workshops and shops. There are almost no parks and squares. And the green military cemetery, hidden from the noisy streets behind a high fence and a cypress enclosure - is just the perfect place for a family getaway.
""I'm not really chasing them, only when they are completely losing control of themselves. Well, these are children, not on the street among the cars they run. Let them play better here, ”Ibrahim apologizes after thrashing at the boys jumping on the monument in honor of the fallen British, adorned with the words“ Their names will live on forever ”.
If tourists came to Gaza, this cemetery would probably become one of their most popular places. But there are no tourists here, only journalists, UN staff and charity workers are allowed to enter the Gaza Strip. That is why the military cemetery and other sights of the ancient city are unknown to anyone outside Gaza. True, there are very few monuments there. A large mosque, a cemetery, a small Ottoman fort, Qasr al-Pasha with a modest museum exhibit, consisting of several Roman-era coins, shards of Byzantine crockery, a pair of crooked Turkish sabers and a bust of Yasser Arafat. That's probably all. But the same Qasr al-Pasha, if built anywhere else, would be a real magnet for those interested. After all, this small fort used to be the residence of Napoleon Bonaparte during his Middle Eastern march. Bonaparte went to Egypt and then to Palestine before he rose to the top of power, to Gaza in 1799 he arrived not as the emperor of France, but as an army commander.
Like the British, more than a hundred years after him, Napoleon came from Sinai. The news of his regiments approaching triggered panic in Gaza. Thousands of people have left their homes and fled the city, frightened by the news of the brutality that the French have dealt with in the occupied Egyptian cities.


The walls of the fort in which Napoleon lived, decorated with sculptural images of lions / Photo: NV

It was then - in the winter of 1799 - that Gaza lost one of its most mysterious communities forever. The city was completely abandoned by all the Samaritans who lived in it. Unlike other refugees who often had no idea where to look for rescue and who to look for, the Samaritans knew exactly where to go and who to seek protection from. Their path lay northeast, to the town of Nablus, in the vicinity of which the Samaritans Mount Gerizim is sacred. And they sought protection from God. The God of the Samaritans is the God of Abraham and Moses, the God of Israel, who made a covenant with the chosen people and inspired the kings and prophets to write the most holy booksa secret literary work - the Torah.
The Samaritans themselves call themselves the people of Israel and believe that it is their law and their faith that was given to the Most High Moses, and the Jews, who also call themselves Israelis and also worship the Torah, have distorted the law of God, and have overturned the basic tenets of the faith, deprived them of their holiness. .
There are indeed many differences in the Torah of the Samaritans and in the Torah of the Jews. But they are mostly insignificant, such as spelling names or geographical names. And the main difference between the two holy books is the indication of the place where the temple was built. Both Jews and Samaritans adhere to the concept of ""One Temple for a One God,"" but in the first place, chosen by the Most High for the erection of a single holy building, is located in Jerusalem (Temple Mount), and in the second, in the outskirts of Nablus, on top of Mount Gerizim.


In Jerusalem, on the Temple Mount of the Jews, there are now Muslim shrines, including the Gold Dome of the Rock / Photo: NV

The Samaritans believe that their temple was first built, and later in Jerusalem a copy of it appeared, completely devoid of divine presence. Moreover, it was built by the Assyrians, who settled in Jerusalem and around the ancient city after the subjugation of the Palestinian lands to the Assyrian Empire two thousand years before the Christian era. The books of the Samaritans state that the conquerors took over their belief in a single god, but by the end they did not penetrate and even undertook the rewriting of sacred texts to justify their innovations. The Jews, in turn, consider the descendants of the Assyrian invaders to be Samaritans.
The Jews believe that the cult of the temple on Mount Gerizim is the invention of one of their former co-religionists who dreamed of becoming a high priest in Jerusalem but found himself unfit for this role and fled to a new place whose inhabitants had succeeded in convincing the holiness of Jerizim.
The Samaritans tell the same story, quite the opposite: an impostor from their people went to the Assyrians in Jerusalem after failing to seize religious authority over the community.


There is no Samaritan temple on Mount Gerizim for a long time, in its place there are fragments of a Byzantine church and a small watchtower of Ottoman times / Photo: NV

Now there is no temple either in Jerusalem or in the suburb of Nablus. The Jewish shrine was destroyed by the Romans, the Samaritan by the Byzantines. Al-Aqsa Mosque and the Muslim shrine of the Rock Dome are now standing on the Temple Mount, which is a rock that has been pushed away by Muslims, the Prophet Mohammed went on a journey to heaven. At the top of Mount Gerizim - only the ruins of a Greek church, erected on the site of an ancient temple and a small tower of Ottoman times.
“This mountain is sacred in itself. And without the temple. After all, the Almighty himself chose her as his earthly home after the people left slavery. Several times a year, our entire community gathers here, we pray and celebrate our holidays here. Here we ask God for the coming of a messiah who will restore the temple and take the place of the community. Until the messiah arrives, the congregation is led by a high priest. The Jews also had their high priest, but after their temple was destroyed, they remained without a single religious leader, and we have kept that tradition. When the temple is rebuilt, we will have whom to serve and sacrifice to God, ”explains Abud Cohen, the grandson of the Samaritan high priest, to explain some of his subtleties.


The current Samaritan high priest Abud Cohen, like all his predecessors, is descended from his brother Moses Aaron / Photo: NV

He is fluent in English, high tech, drives a good car and lives in a modern home overlooking one of the slopes of the Sacred Mountain. In 1904, when American missionaries discovered in the then-Ottoman Empire in the Middle East that the Samaritans had not disappeared or lost in centuries, the people of this people lived quite differently. At the time, they were on the verge of extinction, as many Samaritans, seeking employment, converted to Islam, Christianity, or Judaism, officially recognized by the Ottoman authorities. The Samaritans were stripped of their civil rights and survived. At the turn of the 19th and 20th centuries, there were about 120 people in the community. Their accidental identification by the missionaries literally saved the community - American and European researchers rushed to Nablus and rushed to the hundreds and even hundreds to buy ancient scrolls and books written in a special Hebrew-like language, but with significant deviations from its classical rules. Foreign money was spent on food and debt repayment to the Ottoman authorities. The community escaped but lost many of its literary monuments. But now the Samaritans are no longer starving, their numbers have risen from 120 to 800, and their civil rights are pledged to protect three governments at once - the Palestinian, Israeli and Jordanian. Jordan's citizenship was given to the Samaritans ruling the royal Hashemite dynasty there.
Middle Eastern politicians have tried to use Samaritans as mediators in the Palestinian-Israeli settlement - yet religiously they are very close to the Jews, yet many of them live in the Palestinian territories and speak Arabic at home - but so far, progress in this area is unlikely to progress. . Perhaps the fact is that half of the entire community - which is the same inhabitants of the neighborhood of Mount Gerizim, only about 400 people - is more sympathetic to Palestinians, while the other half, who settled in one of Israel's Tel Aviv districts a few decades ago to the Israelites. As a whole, the community meets only a few times a year for major religious holidays. These days, the greatest value of the Samaritans, the ancient Torah scroll, which is said to have been passed down from the high priest to the high priest for over two thousand years, is taken from a special safe.


The Torah of the Samaritans differs from the Jewish not only in content but also in the language - the sacred texts of the Samaritans are written in Hebrew, which is incomprehensible to modern Israelites / Photo: NV

In the safe, sacred books are not just hidden. In the 1980s, Samaritans lived in Nablus for the most part, visiting the sacred mountain only periodically. Their valuable scrolls were stored in a synagogue in one of the central areas of the city. One morning, the faithful found the door to the house of worship broken open, and two particularly valuable scrolls disappeared. Soon, one of the local mafia groups approached the community with a proposal to return a million dollars worth of scrolls. The Samaritans have entered into negotiations with the mafia, which are still ongoing. And Nablus soon decided to move. However, as the high priest himself says, this decision was not connected with the theft of books - it was simply that there was not enough space in the city community in those days.
“People from the community want to stay together, closer to each other, but in Nablus it was getting harder. That's why we moved here. But we are in good relations with our Arab neighbors. And with our Jewish neighbors. We are peaceful people and everyone is happy, ”says the elderly high priest, who, like his grandson, is also called Abud Cohen.
He is pleased to welcome guests from Ukraine as well, especially in the community there are now one and a half dozen Ukrainian women who came to this village after marrying Samaritans. So Gerizim is now a bit of Ukrainian history as well.


"
