,src,lang,text
0,"











Gustavo Petro y Sergio Fajardo vuelven a cruzar 'pullas' rumbo a las elecciones de 2022
Los excandidatos presidenciales cruzaron opiniones respecto a las elecciones presidenciales de 2022
05 Nov 2019, 15:27 by Redacción Actualidad


Fajardo y Petro aspiran llegar a la presidencia en 2022. Foto: Twitter

Compartir: Facebook Twitter
Gustavo Petro y Sergio Fajardo volvieron a enfrascarse en un 'rifi rafe' que viene de atrás, más exactamene de las últimas elecciones presidenciales en donde ambos políticos descartaron una alianza. 



Y es que durante este fin de semana, ambos políticos cruzaron opiniones respecto a los posibles candidatos para las próximas elecciones presidenciales, que se realizarán en 2022. el primero en 'atacar' fue Gustavo Petro, quien en diálogo con El Tiempo afirmó que Fajardo fue derrotado en las elecciones del 27 de octubre y que:  ""Ya casi no lo miro como candidato presidencial posible en 2022, porque su derrota en Antioquia es pavorosa, creo que no eligió ningún concejal, que era su fuerte […] Lo único que pudo sacar, y por eso sale en la prensa, fue el abrazo con Claudia”.



Además, Petro agregó que una próxima aspiración presidencial de Fajardo solo seria posible si el exalcalde de Medellín ""recoge"" al ""uribismo ligth"", que, según Petro: ""Es la diferencia entre los 6 millones del plebiscito por la paz, en 2016, y los 10 millones de Duque en la segunda vuelta presidencial del año pasado, que no es suma despreciable de personas que ya han votado por Fajardo”.



Fajardo no se quedó callado y le respondió a Gustavo Petro enfatizando en que ""Sí voy a ser candidato a la presidencia. Ese tipo de discusiones, aparte de mezquinas, son de una persona que no ha sabido perder"". ADemás, Fajardo le contestó a todas las personas que lo acusan de ser 'tibio': “Me parece divertida la expresión tibia, pero surge porque no voté por Petro. Si ser tibio significa no votar por Petro, entonces me moriré tibio”, afirmó Fajardo en diálogo con Blu Radio. 



Cabe recordar que Sergio Fajardo ya se encuentra realizando la campaña para su aspiración de, nuevamente, ser candidato a la Presidencia de la República, algo que cuando perdió en 2018 había descartado.





También puedes leer: ""900 testigos electorales fueron borrados"": Gustavo Petro




Recuerda seguir todo nuestro contenido en Google News



Redacción Actualidad - Colombia.com

Compartir: Facebook Twitter


",es,"











Gustavo Petro and Sergio Fajardo cross again 'pullas' towards the 2022 elections
The former presidential candidates crossed opinions regarding the 2022 presidential elections
05 Nov 2019, 15:27 by Current News


Fajardo and Petro aspire to reach the presidency in 2022. Photo: Twitter

Share: Facebook Twitter
Gustavo Petro and Sergio Fajardo returned to engage in a 'rifi rafe' that comes from behind, more precisely from the last presidential elections where both politicians ruled out an alliance.



And it is that during this weekend, both politicians crossed opinions regarding the possible candidates for the next presidential elections, which will be held in 2022. The first to 'attack' was Gustavo Petro, who in dialogue with El Tiempo said that Fajardo was defeated in the elections of October 27 and that: ""I almost no longer look at him as a possible presidential candidate in 2022, because his defeat in Antioquia is terrifying, I think he did not choose any councilor, who was his strong [...] The only thing he could take out, and that's why it comes out in the press, it was the hug with Claudia. ”



In addition, Petro added that an upcoming presidential aspiration of Fajardo would only be possible if the former mayor of Medellín ""picks up"" the ""ligth uribismo"", which, according to Petro: ""It is the difference between the 6 million plebiscite for peace, in 2016, and the 10 million Duke in the second presidential round of last year, which is not a negligible sum of people who have already voted for Fajardo. ”



Fajardo did not remain silent and responded to Gustavo Petro emphasizing that ""Yes I will be a candidate for the presidency. That kind of discussion, apart from petty ones, is about a person who has not known how to lose."" In addition, Fajardo replied to all the people who accuse him of being 'lukewarm': “The warm expression seems funny to me, but it arises because I did not vote for Petro. If being lukewarm means not voting for Petro, then I will die lukewarm, ”Fajardo said in dialogue with Blu Radio.



It should be remembered that Sergio Fajardo is already running the campaign for his aspiration to, once again, be a candidate for the Presidency of the Republic, something that when he lost in 2018 he had ruled out.





You can also read: ""900 electoral witnesses were deleted"": Gustavo Petro




Remember to follow all our content on Google News



Current News - Colombia.com

Share: Facebook Twitter


"
