,src,lang,text
0,"











В Англия е Ливърпул, но кой в Първа лига е царят на обратите?
05 Nov 2019, 15:40 by Sportlive.bg
През миналия уикенд Ливърпул показа своята готовност за шампионската титла в Англия, след като обърна Астън Вила и победи след 2 гола в последните минути на мача. Оказа се, че през сезона дотук мърсисайдци са спечелили 6 от 7-те двубои, в които са губили в резултата. В седмия са завършили наравно.
Това предизвика любопитство да разберем кой отбор у нас е царят на обратите. Или по-скоро кой елитен тим в Първа лига е спечелил най-много точки, след като е бил в губеща позиция в мача. Оказа се, че това е новакът Арда (Кърджали). Кърджалии са губели в 7 мача досега, но в края са спечелили 10 точки. Става дума за 3 победи и 1 равенство.
На второ място е шампионът Лудогорец, който е губел в резултата в 3 мача, а е спечелил в тях 7 точки - 2 победи и 1 реми. Трети е Локомотив (Пловдив) - в 4 мача, в които е изоставал, пловдивският гранд е взел 6 точки - 2 победи и 2 загуби.
Топ 5 допълват Ботев (Враца) и ЦСКА. Врачани са изоставали досега в 10 мача, в които са завоювали 5 точки. Става дума за 1 победа и 2 равенства. ЦСКА е бил губещият тим в 5 мача, в които в крайна сметка е спечелил 4 точки - 1 победа и 1 равенство.
Отборите, които не са спечелили нищо, след като съперникът им е повел, са 4 в Първа лига. Това са Левски, Берое, Царско село и Витоша. Статистиката е направена преди началото на 15-ия кръг. А кой мач от родното първенство е разследван от УЕФА вижте в този материал. 

Още по темата








",bg,"











Liverpool is in England, but who in the Premier League is the King of Turns?
05 Nov 2019, 15:40 by Sportlive.bg
Last weekend Liverpool showed their readiness for the title in England after turning on Aston Villa and winning by 2 goals in the final minutes of the match. It turned out that during the season so far Merseyside have won 6 of the 7 duels in which they lost in the result. In seventh, they finished equally.
This caused curiosity to find out which team in our country is the King of Turns. Or rather, which elite team in the Premier League has scored the most points after losing the match. It turned out to be the newcomer Arda (Kardzhali). Kardzhali have lost in 7 games so far, but in the end they have gained 10 points. These are 3 wins and 1 draw.
In second place is the champion Ludogorets, who lost in the result in 3 games and earned 7 points in them - 2 wins and 1 draw. The third is Lokomotiv (Plovdiv) - in 4 games in which he has lagged behind, the Plovdiv Grand has taken 6 points - 2 wins and 2 losses.
The top 5 are complemented by Botev (Vratsa) and CSKA. The Doctors have fallen far behind in 10 games in which they have won 5 points. It's about 1 win and 2 draws. CSKA was the losing team in 5 games, in which he ultimately won 4 points - 1 win and 1 draw.
Teams that have not won anything since their opponent led are 4 in the First League. These are Levski, Beroe, Tsarsko selo and Vitosha. The statistics were made before the beginning of the 15th round. And which UEFA match was investigated by UEFA in this article.

More on the topic








"
