,src,lang,text
0,"











Історія забороненого кохання. Опубліковано тизер українсько-польського історичного серіалу Кава з кардамоном
У Києві в музеї Варвари та Богдана Ханенків представили тизер історичної серіалу, знятого за мотивами роману української письменниці Наталії Гурницької Мелодія кави в тональності кардамону.

05 Nov 2019, 15:52

У Мережі з'явився тизер українсько-польського історичного серіалу Кава з кардамоном. Головні ролі в ньому виконають українська актриса Олена Лавренюк, яка втілить образ юної української красуні Анни і польський актор Павло Делонг, який виконає роль одруженого польського шляхтича Адама. Дії фільму відбуваються у XIX сторіччі.


Павло Делонг і Олена Лавренюк в серіалі Кава з кардамоном / Фото: @ Прес-служба Кава з кардамоном

Олена Лавренюк знайома українським глядачам за театральними роботами, а також за фільмами 11 дітей з Моршина та Dzidzio Контрабас. Павла Делонга український глядач знає за драмою Стівена Спілберг Список Шиндлера.













Кава з кардамономОпублікований тизер українсько-польського серіалу Кава з кардамоном

Тизер майбутнього серіалу був знятий у Львові. Зйомки серіалу почнуться навесні 2020 року. Режисер фільму Станіслав Капралов.
Читайте також:&nbspПрем'єра в Каннах і шанс на Оскар. Сім цікавих фактів про фільм Додому Нарімана Алієва


",uk,"











The story of forbidden love. The teaser of the Ukrainian-Polish historical series Coffee with Cardamom has been published
In Kiev at the Museum of the Barbarian and Bohdan Khanenko presented a teaser of a historical series, based on a novel by Ukrainian writer Natalia Gurnitska Melody Coffee in a cardamom tone.

05 Nov 2019, 15:52

A teaser of the Ukrainian-Polish historical series Coffee with Cardamom appeared on the Network. The main roles in it will be played by Ukrainian actress Olena Lavrenyuk, who will portray the image of young Ukrainian beauty Anna and Polish actor Pavel Delong, who will play the role of the married Polish nobleman Adam. The film takes place in the 19th century.


Pavel Delong and Elena Lavrenyuk on the Cardamom Coffee Series / Photo: @ Cardamom Coffee Press

Elena Lavrenyuk is familiar to Ukrainian audiences in theater works, as well as in films of 11 children from Morshyn and Dzidzio Kontrabas. Paul DeLong's Ukrainian viewer knows the Steven Spielberg drama Schindler's List.













Cardamom CoffeePublished teaser of the Ukrainian-Polish series Cardamom Coffee

The teaser for the upcoming series was filmed in Lviv. Filming will begin in the spring of 2020. The film is directed by Stanislav Kapralov.
Also Read: & nbspCanne Premiere and Chance for an Oscar. Seven interesting facts about Nariman Aliyev's movie Home


"
