,src,lang,text
0,"











Satire
Entre sacs taxés et constituante, la Revue montheysanne 2019 affûte ses piques
05 Nov 2019, 15:00 by lmt

Les Tréteaux du Bourg de Monthey présentent dès vendredi «La Compostituante», une revue qui recycle l’actualité locale et régionale avec mordant et dérision.

Tous les deux ans, le mois de novembre s’annonce mordant sur les bords de la Vièze. Rien à voir avec les frimas automnaux, mais bien avec le retour de la Revue montheysanne. Dès vendredi et jusqu’au 24 novembre, celle-ci prendra ses quartiers au P’tit Théâtre de la Vièze pour revisiter l’actualité locale et régionale et placer sous les feux des projecteurs des événements ou des personnages qui l’ont marquée, avec une bonne dose d’humour agrémenté à la sauce piquante.
Comme le laisse entendre le titre «La Compostituante», les scènes imaginées pour cette édition 2019 s’inspirent largement de politique, entre sacs taxés, recyclage et élection à la constituante. Mais on y trouvera aussi un brin de culture, décodée dans un registre satirique.
L’équipe de la Revue s’est élargie et rajeunie cette année. Six nouveaux acteurs feront leur apparition sur scène: «Ils ont entre 30 et 40 ans et plusieurs d’entre eux ne connaissaient même pas la Revue jusque-là», sourit Nathalie Grau, présidente des Tréteaux du Bourg. «Nous espérons que cela amènera une dynamique supplémentaire. Cela devrait aussi nous permettre de séduire un autre public.»
Dirigés comme de coutume par Gérard Constantin, les onze comédiens proposeront quatre scènes entrecoupées de deux interscènes. «Un invité surprise fera même son apparition pour jouer son propre rôle, c’est dire si les Montheysans sont capables d’autodérision!», ajoute la présidente de la troupe montheysanne.
Accompagnées au piano par Serge Cosendai, dix chansons rythmeront les différents tableaux.
 
Infos pratiques
Du 8 au 24 novembre, les mercredis et vendredis à 20 heures, les samedis et dimanches à 17 heures. Billets en vente à Monthey Tourisme.


",fr,"











Satire
Between taxed bags and constituent, the Revue montheysanne 2019 sharpens its pikes
05 Nov 2019, 15:00 by lmt

The trestles of Bourg de Monthey present Friday ""La Compostituante"", a magazine that recycles local and regional news with biting and derision.

Every two years, the month of November promises to bite on the banks of the Vièze. Nothing to do with the autumn frosts, but with the return of the Revue montheysanne. From Friday and until November 24, it will take up residence at the P'tit Théâtre de la Vièze to revisit local and regional news and put under the spotlight events or characters who have marked, with a good dose of humor with spicy sauce.
As suggested by the title ""La Compostituante"", the scenes imagined for this 2019 edition are largely inspired by politics, between taxed bags, recycling and election to the constituent. But there will also be a bit of culture, decoded in a satirical register.
The Review team has expanded and rejuvenated this year. Six new actors will appear on stage: ""They are between 30 and 40 years old and many of them did not even know the Review until then,"" smiles Nathalie Grau, president of Tréteaux du Bourg. ""We hope this will bring additional momentum. It should also allow us to seduce another audience. ""
Directed as usual by Gerard Constantin, the eleven actors will propose four scenes interspersed with two interscenes. ""A surprise guest will even appear to play his own role, it is to say if the Montheysans are capable of self-deprecation!"", Adds the president of the troop montheysanne.
Accompanied on the piano by Serge Cosendai, ten songs will punctuate the different paintings.

Practical information
November 8 to 24, Wednesdays and Fridays at 8 pm, Saturdays and Sundays at 5 pm Tickets on sale at Monthey Tourisme.


"
