,src,lang,text
0,"











NOTÍCIA
""Notícia ruim faz mal para a saúde psicológica”, diz fundador de site
03 Nov 2019 by O Povo
Cansado de noticiar violência, mortes, corrupção e catástrofes e depois de passar por uma doença no estômago, o jornalista Rinaldo de Oliveira resolveu dar um basta nas “bad news’ e resolveu apostar em um jornalismo positivo que valorizasse as ""good news”. Há oito anos, ao lado da esposa também jornalista, ele criou um portal de notícias para valorizar a positividade na rede. “Brincam comigo dizendo que sou o jornalista que trocou a notícia ruim pela notícia boa. Eu adoro essa máxima”, afirma com bom humor.
Rinaldo de Oliveira fala sobre sua experiência no programa Impressões, da TV Brasil, que vai ao ar nesta segunda-feira (4), às 23h.
O portal do qual ele é editor e fundador, o ""Só Notícia Boa"" já ganhou o mundo. Com 2 milhões de acessos por mês, é lido em 120 países. Além do Brasil que tem 90% das pageviews, Portugal, Estados Unidos, Reino Unido, França, Itália e Japão também revelam o gosto pelas notícias boas. “A gente tem que levar esperança para as pessoas por meio da informação, do jornalismo”, diz com entusiasmo. E completa: “O que a gente faz é levar informação positiva para inspirar, para melhorar, para fazer com que as pessoas comecem bem o dia”.
Com 30 anos de profissão investidos no jornalismo de rádio e TV, Rinaldo abandonou a bancada do jornal local da Band em Brasília. Ele relembra o que deixou para trás para investir no sonho de fazer jornalismo positivo. “Quando você apresenta um telejornal durante meia hora, você olha para a uma câmera e fala: assassinato. Olha para a outra câmera e diz: morreu. Era meia hora falando de coisa ruim. Aí eu tive um problema de estômago. Fui parar no médico. E o médico me disse que o meu problema não era físico, eu estava somatizando”, diz o jornalista, apontando o dedo indicador para a sua cabeça. “Era o trabalho. A notícia ruim me fazia mal”, conclui citando uma pesquisa norte-americana que mostra que a notícia ruim faz mal para a saúde psicológica.
Para Rinaldo, tipos de cobertura que envolvem grandes tragédias, podem causar impacto na esperança das pessoas. “Tira a esperança, dá medo. Eu não ouvia falar, há 30 anos, de depressão, síndrome do pânico, tanto suicídio... Eu acho que isso pode estar ligado ao seu hábito, ao que você está consumindo no dia a dia de notícia”.
Para ele a notícia boa “está no sangue das pessoas”. “Houve uma pesquisa, há um tempo, que a gente deu do Facebook (redes sociais), dizendo que o que as pessoas mais gostam de compartilhar é coisa boa, é notícia boa”. Para ele, o mau hábito ao consumir informações pode estar ligado à falta de melhores opções. “Por mais que a gente diga que as pessoas gostam de coisa ruim, que esses programas sangrentos dão audiência... (Eu digo) Alto lá! É porque as pessoas estão acostumadas e não têm alternativa. Por isso elas assistem isso”.
Com a proposta de trilhar um caminho oposto ao das pautas amargas e contribuir para a formação de cidadãos melhores, gentis, solidários e altruístas, os bons resultados vêm surgindo. Só no Instagram, o portal vem ganhando de 500 a mil novos seguidores por dia, segundo Rinaldo. “De tantas coisas ruins que as pessoas veem, elas ficam achando que é o fim do mundo, que ninguém presta mais, que ninguém mais é bom, que ninguém mais ajuda. E não. A gente mostra exatamente o contrário, que tem muita gente boa e muita coisa legal acontecendo neste mundo que não aparece na grande mídia. E por quê? Aí é outra discussão”, pondera Rinaldo. “Mas a gente foca nisso. Então, a gente só fala do bem”.
Há algum tempo, Rinaldo tinha muita dificuldade para achar notícias boas. Atualmente sua maior dificuldade é fazer uma triagem do material que recebe. “Tem a questão da veracidade, porque muita coisa que você encontra na rede social é mentira, ou aconteceu há muitos anos. Então, a gente faz a triagem e depois da triagem vai checar para escrever”.
Em tempos de efervescência nas redes sociais, Rinaldo é cauteloso. “A gente tá vivendo um momento em que as pessoas estão se informando pelo Facebook, pelo Instagram, pelo WhatsApp”. E faz um alerta: “Essa história de fake news é muito perigosa. As pessoas não podem perder o foco e o próprio jornalista também não, de que a gente é muito importante. Porque a informação com credibilidade é da gente. Porque a gente aprendeu a fazer noticiário dessa forma”.
Dúvidas, críticas e sugestões? Fale com a gente


",pt,"











NEWS
""Bad news is bad for your psychological health,"" says website founder
03 Nov 2019 by The People
Tired of reporting violence, deaths, corruption and catastrophes and after going through a stomach ailment, journalist Rinaldo de Oliveira decided to stop bad news and decided to bet on a positive journalism that valued good news. Eight years old, along with his wife, a journalist, he created a news portal to value positivity on the network. .
Rinaldo de Oliveira talks about his experience on TV Brazil's Impressions program, which airs this Monday (4), at 23h.
The portal of which he is editor and founder, ""Just Good News"" has already won the world. With 2 million hits per month, it is read in 120 countries. Besides Brazil that has 90% of pageviews, Portugal, United States, United Kingdom, France, Italy and Japan also reveal the taste for good news. “We have to bring hope to people through information, journalism,” he says enthusiastically. He adds: ""What we do is bring positive information to inspire, to improve, to make people start the day well.""
With 30 years of profession invested in radio and TV journalism, Rinaldo left the band of the local band newspaper in Brasilia. He remembers what he left behind to invest in the dream of doing positive journalism. “When you broadcast a half hour newscast, you look at a camera and say: murder. Look at the other camera and say: died. It was half an hour talking about a bad thing. Then I had a stomach problem. I ended up at the doctor. And the doctor told me that my problem was not physical, I was adding up, ”says the journalist, pointing his index finger at his head. “It was work. Bad news hurt me, ”he concludes by quoting an American survey that shows that bad news is bad for psychological health.
For Rinaldo, types of coverage that involve major tragedies can impact people's hopes. “Take away hope, give fear. I haven't heard about 30 years of depression, panic syndrome, so much suicide ... I think this may be linked to your habit, what you are consuming in the news every day. ”
For him the good news ""is in people's blood."" ""There was a survey a while ago that we gave from Facebook (social networks), saying that what people like to share is good, good news."" For him, the bad habit of consuming information may be linked to the lack of better options. “As much as we say that people like bad things, that these bloody shows give an audience ... (I say) Loud there! It's because people are used to it and have no alternative. That's why they watch it. ”
With the proposal to follow a path opposite to the bitter guidelines and contribute to the formation of better citizens, kind, supportive and altruistic, good results have been emerging. Only on Instagram, the portal has been gaining from 500 to 1,000 new followers per day, according to Rinaldo. “From so many bad things that people see, they keep thinking it's the end of the world, that nobody is good anymore, that nobody is good anymore, that nobody else helps. And not. We show exactly the opposite, that there are a lot of good people and a lot of cool things going on in this world that doesn't appear in the mainstream media. It's because? That's another discussion, ”ponders Rinaldo. “But we focus on that. So we just talk about the good. ”
Some time ago, Rinaldo had a hard time finding good news. Currently your biggest difficulty is sorting out the material you receive. “There is the question of truth, because a lot of what you find on the social network is a lie, or it happened many years ago. So we do the screening and after the screening will check to write. ”
In times of effervescence on social networks, Rinaldo is cautious. ""We are living in a moment when people are getting informed by Facebook, Instagram, WhatsApp."" And he warns: “This fake news story is very dangerous. People can not lose focus and not even the journalist, that we are very important. Because the credible information belongs to us. Because we learned to make news this way. ”
Questions, criticisms and suggestions? Talk to us


"
