,src,lang,text
0,"











Грузия спекулирует на горе людей, а миссия ЕС потворствует ей — Цхинвал

03 Nov 2019, 00:05

Тбилиси спекулирует на горе семьи Мартиашвили, и в этом ему способствует миссия наблюдателей Евросоюза, заявил председатель комитета парламента Южной Осетии по внешней политике и межпарламентским связям Заза Дриаев. Так депутат, избранный от Ленингорского района РЮО, прокомментировал требование миссии наблюдателей ЕС открыть пропускной пункт на границе с Грузией. Как сообщало EADaily, с таким же заявлением выступили США.
Поводом для заявления со стороны миссии ЕС послужила смерть 70-летней женщины, жительницы Ленингорского района, которая скончалась в Цхинвале в Республиканской соматической больнице.
«Для предотвращения дальнейших сложностей нужно как можно скорее открыть пропускной пункт. Подобные трагедии наглядно показывают, как жесткие ограничения свободы передвижения влияют на население. Пропускной пункт, через который можно попасть из Ленингора в Грузию, закрыт Южной Осетией 5 сентября. Из-за этого местному населению не хватает оперативной и адекватной медицинской помощи», — заявили представители ЕС.
Заза Дриаев разъяснил ситуацию, подчеркнув, что Миссия не уполномочена что-либо требовать от Южной Осетии.
«В связи со смертью в больнице г. Цхинвал жительницы Ленингорского района Марго Мартиашвили миссия наблюдателей ЕС требует от руководства РЮО открыть границу с Грузией. Мы выражаем семье Марго Мартиашвили соболезнования. Я уверен в том, что врачи сделали всё от них зависящее, чтобы спасти её. Власти Грузии спекулируют на горе семьи Мартиашвили и нагнетают обстановку, и в этом им способствует миссия ЕС», — заявил Дриаев.
Что касается заявления миссии наблюдателей ЕС, имеющих мандат для мониторинга ситуации лишь на территории Грузии, Дриаев отметил, что миссия может только предлагать и договариваться на равноправной основе с руководством РЮО.
«Граница закрыта из-за обострения ситуации на границах с Грузией, и миссия ЕС почему-то не требует у руководства Грузии свернуть блокпосты и вывести свои вооруженные формирования, если она так обеспокоена судьбой простых граждан. Своими действиями они способствуют и поддерживают их, как и раньше», — цитирует депутата газета «Южная Осетия».
Дриаев отметил, что уже несколько лет осетинам, выходцам из Кобинской котловины, Гудского и Трусовского ущелий, запрещен въезд на эти территории грузинскими властями. Они не могут посетить могилы своих родных, попасть на фамильные святилища. По словам Дриаева, по прихоти грузинских властей нарушаются их права на свободу передвижения, но этим фактом ЕС не обеспокоен и ничего не требует у Грузии.
«Хоть и было направлено обращение к грузинскому руководству через посольство Швейцарии о допуске на эти территории выходцев вышеуказанных ущелий, но никаких результатов не дают эти обращения. Они меняют названия рек, гор, ущелий, стирают все следы проживания осетин на этих землях. Восточная Осетия — родина многих наших известных людей. Оттуда родом писатели Сека и Цомак Гадиевы, иранист-осетиновед Васо Абаев, ученый-биохимик Темирболат Берозов и многие другие», — напомнил Заза Дриаев.
Пропускные пункты «Раздахан» в Ленингорском районе и «Синаугр» в Дзауском районе власти РЮО в сентябре закрыли для движения на неопределенное время из-за обострения ситуации по периметру границы. Тбилиси выставил полицейский блокпост у села Уиста и продолжает строить второй блокпост — у села Синагур. Цхинвал требует убрать грузинские посты. КПП планируется окрыть после нормализации обстановки у границ РЮО.


",ru,"











Georgia is speculating on the grief of people, and the EU mission condones it - Tskhinval

03 Nov 2019, 00:05

Tbilisi is speculating on the grief of the Martiashvili family, and the European Union’s observer mission is contributing to this, said Zaza Driaev, chairman of the South Ossetian parliament’s committee on foreign policy and inter-parliamentary relations. So the deputy elected from the Leningor region of South Ossetia commented on the requirement of the EU observer mission to open a checkpoint on the border with Georgia. As EADaily reported, the United States made the same statement.
The reason for the statement on the part of the EU mission was the death of a 70-year-old woman, a resident of the Leningor region, who died in Tskhinval in the Republican somatic hospital.
“To prevent further difficulties, you need to open a checkpoint as soon as possible. Such tragedies clearly show how severe restrictions on freedom of movement affect the population. The checkpoint through which you can get from Leningor to Georgia was closed by South Ossetia on September 5. Because of this, the local population lacks prompt and adequate medical care, ”said EU representatives.
Zaza Driaev clarified the situation, emphasizing that the Mission is not authorized to demand anything from South Ossetia.
“In connection with the death in Tskhinval hospital of a resident of the Leningor region, Margot Martiashvili, the EU observer mission requires the leadership of South Ossetia to open the border with Georgia. We express our condolences to the Margo Martiashvili family. I am sure that the doctors did everything in their power to save her. The Georgian authorities are speculating on the grief of the Martiashvili family and escalating the situation, and the EU mission contributes to this, ”said Driaev.
Regarding the statement of the mission of EU observers with a mandate to monitor the situation only in Georgia, Dryaev noted that the mission can only offer and agree on an equal footing with the leadership of South Ossetia.
“The border is closed due to the aggravation of the situation on the borders with Georgia, and the EU mission for some reason does not require the Georgian leadership to curb checkpoints and withdraw its armed formations if it is so concerned about the fate of ordinary citizens. They promote and support them with their actions, as before, ”the South Ossetia newspaper quotes the deputy.
Driaev noted that for several years now, Ossetians, immigrants from the Kobinsky depression, the Gudsky and Trusovsky gorges, were prohibited from entering by Georgian authorities. They cannot visit the graves of their relatives, get to the family shrines. According to Dryaev, at the whim of the Georgian authorities their rights to freedom of movement are violated, but the EU is not concerned about this fact and does not require anything from Georgia.
“Although an appeal was sent to the Georgian leadership through the Swiss embassy on the admission of natives of the above gorges to these territories, these appeals do not give any results. They change the names of rivers, mountains, gorges, erase all traces of Ossetians living on these lands. East Ossetia is the birthplace of many of our famous people. The writers Seca and Tsomak Gadieva, the Iranian-Ossetian scientist Vaso Abayev, the biochemist scientist Temirbolat Berozov and many others come from there, ”Zaza Dryaev recalled.
The Razdakhan checkpoints in the Leningorsky district and the Sinaugr checkpoints in the Dzausky district, the authorities of the Republic of South Ossetia closed in September for movement indefinitely due to the aggravation of the situation around the border. Tbilisi has set up a police checkpoint near the village of Uista and continues to build a second checkpoint at the village of Sinagur. Tskhinval demands the removal of Georgian posts. It is planned to open the checkpoint after normalizing the situation at the borders of South Ossetia.


"
