,src,lang,text
0,"











צחי נחמיאס דורש מקאנומד להחזיר הלוואה באופן מיידי
זאת לאחר שחלף מועד החזר ההלוואה שנתן לחברת הקנאביס, בעת החתימה על מזכר ההבנות להשקעה של כ-25 מיליון שקל בה; נחמיאס מאיים כי אם ההלוואה לא תוחזר - הוא יתבע את פירוק החברה
03 Nov 2019 by צלי גרינברג
צחי נחמיאס, בעלי מגה אור הציבורית, ושותפיו ב""טומהוק פארמה גרייד"", דורש מחברת הקנאביס הרפואי הציבורית קאנומד להחזיר את ההלוואה שניתנה לה ב-24 ביוני השנה, בעת החתימה על מזכר ההבנות להשקעה של כ-25 מיליון שקל בחברה תמורת 51% ממניותיה. כך נודע לכלכליסט. נחמיאס מאיים כי במידה שההלוואה לא תוחזר - הוא יתבע את פירוק החברה
במסגרת ההסכם, קאנומד קיבלה הלוואה של 1.5 מיליון שקל, מתוך הלוואה של עד 3 מיליון שקל שהיתה אמורה להיפרס עם ההתקדמות בהסכם, והתחייבה להחזירה עד 1 בנובמבר 2019 אם ההסכם בין הצדדים ייפסק. במזכר ההבנות שפירסמה קאנומד עם חתימתו נכתב עוד, כי במקרה שהחברה לא תפרע את ההלוואות בתוספת ריבית (שהועמדה על 4% שנתי) במועד האחרון שנקבע, יהיה ""המשקיע זכאי, כסעד יחיד, להקצאת מניות החברה בשווי סכום ההלוואה בתוספת ריבית, לפי מחצית ממחיר המניה הממוצע בבורסה ב-7 הימים שקדמו למועד האחרון"".


צחי נחמיאס צילום: לימור זפרני

בדיקת כלכליסט מעלה, כי 1.5 מיליון שקל יקנו לנחמיאס על פי התנאים שתוארו בהסכם כ-8% ממניות קאנומד, בהנחה שהחברה לא תוכל להחזיר לו ההלוואה. לכלכליסט נודע עוד, כי גורמים מטעמו של נחמיאס פנו לחברה לפני כשבוע וחצי לטובת מענה לדרישתו, אך לא נענו. בנוסף, החברה עדיין לא יידעה את הרשות לניירות ערך בגין הקצאת מניות כלשהי לנחמיאס.
קאנומד דיווחה ב-18 לאוגוסט, כי מזכר ההבנות שלה עם נחמיאס, להכנסתו יחד עם משקיעים נוספים כבעלי שליטה בחברה, פקע, לאחר שדחתה את דרישתו של נחמיאס להפחית את סכום ההשקעה בה. מקאנומד נמסר בתגובה: ""החברה מתעתדת להשיב מחר את מלוא ההלוואה מה שייתר את בקשת הפירוק או הקצאת המניות"".


",iw,"











Tzachi Nahmias requires Cannomad to repay a loan immediately
This is after the loan repayment date given to the cannabis company, at the time of signing the MoU of NIS 25 million; Nahmias threatens that if the loan is not repaid - he will demand the liquidation of the company
03 Nov 2019 by Roast Greenberg
Tzahi Nahmias, a public mega-light company, and his partners at Tomahawk Pharma Grade, requires Cannabis Public Medical Company to repay the loan it was granted on June 24 this year, when it signed a memorandum of understanding to invest NIS 25 million in the company for 51% of its shares . That's how Calcalist learned. Nahmias threatens that if the loan is not repaid - he will demand the liquidation of the company
As part of the agreement, Canomed received a loan of NIS 1.5 million, out of a loan of up to NIS 3 million which was to be deployed as the agreement progressed, and pledged to repay by November 1, 2019 if the agreement between the parties terminated. The memorandum of understanding published by Canomed with its signature further states that in the event that the company does not repay the loans plus interest (set at an annual rate of 4%), the investor will be entitled, as a single relief, to the allocation of the shares of the company at the value of the loan plus interest, at half the share price. The stock exchange average in the 7 days prior to the deadline. ""


Tzachi Nahmias Photo: Limor Zafrani

The Calcalist test shows that NIS 1.5 million will buy Nahmias under the terms described in the agreement, about 8% of Canomed shares, assuming the company will not be able to repay the loan. The Calcalist also learned that Nachmias, on behalf of Nahmias, had contacted the company about a week and a half ago to respond to his demand, but had not responded. In addition, the company has not yet notified the Securities and Exchange Commission about any share allocation to Nachmias.
Canomed reported on August 18 that its Memorandum of Understanding with Nahmias, for its entry, along with other investors as controlling shareholders, had expired after rejecting Nahmias' demand to reduce its investment. Macanomed said in response: ""The company intends to repay the full loan tomorrow, which will resolve the liquidation or stock allocation request.""


"
