,src,lang,text
0,"











Украина не будет восстанавливать оккупированный Донбасс до его освобождения - министр

01 Nov 2019, 08:40

Украина не будет финансировать восстановление оккупированной части Донбасса до их полного освобождения. Об этом заявил министр инфраструктуры Украины Владислав Криклий в эфире телеканала ""1+1"".
""Украинцы не будут платить за неконтролируемую территорию - это априори невозможно. Пусть сначала страна-агрессор вернет эти территории, выплатит репарации. А уже после этого мы будем думать, как будем вкладывать и восстанавливать (освобожденную – ""ОстроВ"") территорию"", – сказал министр. 
Пока, по его словам, в отношении оккупированных территорий необходимо решать задачу обеспечивать связь с гражданами, которые верят в успех Украины. ""Мы обустраиваем контрольно-пропускные пункты, мы должны создавать больше сервиса"", - отметил Криклий.

МАТЕРИАЛЫ ПО ТЕМЕ












",ru,"











Ukraine will not restore occupied Donbass until its liberation - Minister

01 Nov 2019, 08:40

Ukraine will not finance the restoration of the occupied part of Donbass until they are completely liberated. This was stated by Minister of Infrastructure of Ukraine Vladislav Krikliy on the air of the 1 + 1 television channel.
""Ukrainians will not pay for uncontrolled territory - this is a priori impossible. First, let the aggressor country return these territories, pay reparations. And after that we will think about how we will invest and restore (liberated - OstroV) territory,"" said Minister
So far, he said, in relation to the occupied territories, it is necessary to solve the problem of ensuring communication with citizens who believe in the success of Ukraine. “We are equipping checkpoints, we need to create more service,” Crikli noted.

MATERIALS ON THE TOPIC












"
