,src,lang,text
0,"











सौरव गांगुली आता रवी शास्त्रींना लावणार कामाला; देणार 'ही' अतिरीक्त जबाबदारी
कारण बीसीसीआयचे अध्यक्ष सौरव गांगुली यांनी शास्त्री यांनी अतिरीक्त जबाबदारी देण्याचे सुतोवाच केले आहे.
01 Nov 2019, 08:51 by ऑनलाइन लोकमत
मुंबई : आतापर्यंत भारताचे मुख्य प्रशिक्षक रवी शास्त्री हे फक्त संघाबरोबरच असल्याचे पाहायला मिळाले आहे. पण आता त्यांना चागलंच कामाला लावलं जाणार आहे. कारण बीसीसीआयचे अध्यक्ष सौरव गांगुली यांनी शास्त्री यांनी अतिरीक्त जबाबदारी देण्याचे सुतोवाच केले आहे.
आतापर्यंत फक्त भारतीय संघाबरोबर शास्त्री होते. भारतीय संघाचा सराव शास्त्री करून घेताता. त्याचबरोबर संघ व्यवस्थापनामध्येही त्यांचा सहभाग असतो. संघाची निवड, रणनीती आखणेस हे कामही शास्त्री करतात. पण आता त्यांना या व्यतिरीक्त नवीन काम करावे लागणार आहे.
ऑस्ट्रेलियामध्ये जसे हाय परफॉर्मन्स सेंटर आहे, तसेच गांगुलीला राष्ट्रीय क्रिकेट अकादमीला बनवायचे आहे. त्यासाठी एक जागाही त्यांनी पाहिली आहे. अकादमीचे संचालकपद सध्या भारताचा माजी कर्णधार राहुल द्रविडकडे आहे. पण रवी शास्त्री यांनीही या अकादमीमध्ये यावे आणि मार्गदर्शन करावे, असे गांगुलीला वाटत आहे.
याबाबत गांगुली म्हणाला की, "" राष्ट्रीय क्रिकेट अकादमीचे संचालकपद द्रविडकडे आहे. या अकादमीमध्ये पारस म्हाम्ब्रेदेखील आहे. त्याचबरोबर भारताचे गोलंदाजी प्रशिक्षक भारत अरुणही येथे येतात. पण शास्त्री येत नाहीत. पण आता त्यांना येथे येऊन मार्गदर्शन करावे लागेल.""


",mr,"











Sourav Ganguly to work for Ravi Shastri; Will give 'this' additional responsibility
Because BCCI president Sourav Ganguly has suggested that Shastri give extra responsibility.
01 Nov 2019, 08:51 by Online Lokmat
Mumbai: So far India's head coach Ravi Shastri has only been seen with the team. But now they are going to be put to work. Because BCCI president Sourav Ganguly has suggested that Shastri give extra responsibility.
Until now, there was only a scribe with the Indian team. When practicing the Indian team He is also involved in team management. The team also works on the selection of the team and the strategy. But now they have to do new things in addition.
Just like Australia has a high performance center, Ganguly wants to make it to the National Cricket Academy. They have also seen a place for it. Former India captain Rahul Dravid is currently the director of the Academy. But Ganguly feels that Ravi Shastri should also come and guide him in this academy.
On this, Ganguly said, ""Dravid has the title of Director of National Cricket Academy. He also has Paras Mahmbre. India bowling coach Bharat Arun also comes here. But Shastri does not come.


"
