,src,lang,text
0,"











కార్మికులు ఎక్కడైనా విధుల్లో చేరొచ్చు

05 Nov 2019, 09:54




అన్నపూర్ణ మ్యారేజెస్ అన్ని కులముల వారికి పెళ్లి సంబంధములు చూడబడును.www.annapurnamarriages.com Ph: 88865 47666 ప్రవేశం ఉచితం
ADVT


తమ డిపోలతోపాటు డీవీఎం, ఆర్‌ఎం,


కలెక్టర్‌, ఎస్పీ, ఆర్డీవో, డీఎస్పీలకూ లేఖ


ఇవ్వొచ్చు: ఆర్టీసీ ఎండీ ప్రకటన


చేరాలని కార్మికులపై మంత్రుల ఒత్తిడి


ఇళ్లకు కార్యకర్తల్ని పంపి రాయబారాలు


ఇప్పటికి విధుల్లో చేరిన 26 మందే


వారిలో కొందరు మళ్లీ సమ్మెలోకి


(ఆంధ్రజ్యోతి న్యూస్‌ నెట్‌వర్క్‌): ఆర్టీసీ కార్మికులు తిరిగి విధుల్లోకి చేరేందుకు సీఎం కేసీఆర్‌ విధించిన గడువు మంగళవారం అర్ధరాత్రితో ముగియనుండటంతో.. విదుల్లో చేరదలచినవారు తమ లేఖలను తాము పనిచేస్తున్న డిపోల్లో మాత్రమే కాకుండా ఇతర చోట్ల కూడా సమర్పించే అవకాశాన్ని ఆర్టీసీ కల్పించింది. ఆయా జిల్లాల కలెక్టరేట్లు, ఎస్పీ, ఆర్డీవో, డీఎస్పీ కార్యాలయాల్లోగానీ, డిపో మేనేజర్‌, డీవీఎం, రీజనల్‌ మేనేజర్‌ కార్యాలయాల్లోగానీ లేఖలు ఇవ్వవచ్చని ఆర్టీసీ ఎండీ సునీల్‌శర్మ ఒక ప్రకటనలో తెలిపారు. హైదరాబాద్‌లో పనిచేసే కార్మికులు బస్‌భవన్‌లోని ఈడీ కార్యాలయాల్లో కూడా అందించవచ్చని పేర్కొన్నారు. ఇదిలా ఉండగా, కేసీఆర్‌ డెడ్‌లైన్‌ విధించినా.. కార్మికులు వెనక్కి తగ్గకపోవడంతో మంత్రులు రంగంలోకి దిగారు. కార్మికులను విధుల్లో చేరేలా ఒత్తిడి తెస్తున్నారు. తమ అనుచరులు, కార్యకర్తలను కార్మికుల ఇళ్లకు పంపిస్తున్నారు. ముందుగా విధుల్లో చేరాలంటూ రాయబారాలు నడుపుతున్నారు. ముఖ్యంగా కరీంనగర్‌, మెదక్‌, మహబూబ్‌నగర్‌ ఉమ్మడి జిల్లాల్లో ఈ ప్రయత్నాలు ఎక్కువగా జరుగుతున్నాయి. ముఖ్యంగా కరీంనగర్‌ జిల్లాలో ఒక మంత్రి అనుచరులు ఎక్కువ ఒత్తిడి తెస్తున్నట్లు, ఆ మంత్రి ప్రత్యేక శ్రద్ధ తీసుకుంటున్నట్లు సమాచారం. కాగా, రాష్ట్ర వ్యాప్తంగా ఇప్పటివరకు 26 మంది మాత్రమే విధుల్లో చేరారు. చేరినవారిలోనూ కొందరు వెనక్కి వచ్చి సమ్మెలో పాల్గొంటున్నారు. సోమవారం మరో ఏడుగురు విధుల్లో చేరారు. సూర్యాపేట డిపోకు చెందిన కండక్టర్‌ బెల్లి నర్సయ్య, డిపో క్లర్క్‌ సైమాన్‌, మెదక్‌ డిపోకు చెందిన కండక్టర్‌ కృష్ణమూర్తి, వికారాబాద్‌ డిపోకు చెందిన ఎం.ఆంజనేయులు అనే కాంట్రాక్టు కండక్టర్‌, ఉప్పల్‌ డిపోకు చెందిన కండక్టర్‌ సురే్‌షకుమార్‌, అసిస్టెంట్‌ మేనేజర్‌ కేశవ కృష్ణ, కాచిగూడ డిపో డ్రైవర్‌ ఎన్‌.భాస్కర్‌ విధుల్లో చేరుతున్నట్లు లేఖ రాసి డీఎంలకు అందజేశారు.
 

ప్రలోభాలకు లొంగొద్దు: థామ్‌సరెడ్డి

మంత్రుల వల్ల ఎలాంటి డిమాండ్లు పరిష్కారం కావని, వారి మాటలకు లొంగిపోవద్దని కార్మికులకు టీఎంయూ కార్యనిర్వాహక అధ్యక్షుడు థామ్‌సరెడ్డి సూచించారు. రాయబారాలు పంపుతున్న మంత్రులు.. కేబినేట్‌ భేటీలో ఎందుకు మాట్లాడలేదని ప్రశ్నించారు.


",te,"











Workers can be on duty anywhere

05 Nov 2019, 09:54




Annapurna Marriages is open for all castes to see. * Www.annapurnamarriages.com Ph: 88865 47666 Admission is free
ADVT


DVM, RM, along with their depots


Letter to Collector, SP, Ardivo and DSP


Can be given as: RTC MD statement


Ministers pressure on workers to join


Embassies by sending activists to homes


26 joining the ranks


Some of them strike again


(Andhrajyothi News Network): The deadline for CM KCR to re-enter the workforce of RTC workers ends at midnight on Tuesday. In a statement, RTC MD Sunil Sharma said the letters could be sent to collectors, SP, RDVO, DSP offices, Depot Manager, DVM and Regional Manager offices. The workers in Hyderabad can also be provided at the ED offices in Bashabhan. Meanwhile, the KCR deadline was imposed. Workers are being pressured to join duty. Sending their followers and activists to workers' homes. Embassies to join the duties first. Most of these efforts are taking place especially in the joint districts of Karimnagar, Medak and Mahabubnagar. In Karimnagar district, a minister's followers are putting more pressure and that minister is paying special attention. So far, only 26 people have joined the statewide. Some of those who join are backing out and participating in the strike. Seven more joined duty Monday. Suryapeta Depot Conductor Belly Narsayya, Depot Clerk Simon, Medak Depot Conductor Krishnamurthy, Vikarabad Depot M Anjaneyulu Conductor, Uppal Depot .


Do not succumb to temptations: Thamesare

The TMU executive president, Thomsareddy, advised workers not to succumb to their demands by the ministers. The ministers who are sending embassies .. questioned why the cabinet did not speak.


"
