,src,lang,text
0,"











McDonald’s despidió a su CEO por tener una relación (consensuada) con una empleada
En un comunicado, la cadena de restaurantes indicó que Steve Easterbrook ""violó la política de la compañía"" debido a esa relación sentimental que mantuvo.

05 Nov 2019, 09:34

En la misiva, la gigante norteamericana indicó que Easterbrook será reemplazado por Chris Kempczinski, quien hasta este domingo 3 de noviembre se desempeñó como el presidente de McDonald’s en Estados Unidos.
La compañía también reveló un correo de despedida que Easterbrook le envió a su personal; allí, él reconoció que había cometido “un error” y aceptó su despido:
“Entablé una reciente relación consensuada con una empleada, lo que violó la política de McDonald’s. Esto fue un error. Dados los valores de la compañía, estoy de acuerdo con la junta de que es es hora de que siga adelante”.
En ese correo, Easterbrook también le deseó éxitos a Kempczinski.
Un artículo de la revista Time señala que, de acuerdo con la opinión de expertos, la gigante de comida rápida no tenía otra opción que despedir a su CEO:
“Especialmente desde el comienzo del movimiento #MeToo, las compañías han estado bajo una presión creciente para demostrar que están tomando medidas enérgicas contra todas las formas de conducta sexual inapropiada”.
El medio añadió que “permitir que Easterbrook permanezca en la empresa enviaría el mensaje de que las políticas de la empresa no importan, y que no todos los miembros de la fuerza laboral serán tratados de manera equitativa“.


",es,"











McDonald’s fired its CEO for having a (consensual) relationship with an employee
In a statement, the restaurant chain said Steve Easterbrook ""violated the company's policy"" because of his sentimental relationship.

05 Nov 2019, 09:34

In the letter, the American giant indicated that Easterbrook will be replaced by Chris Kempczinski, who until Sunday November 3 served as the president of McDonald’s in the United States.
The company also revealed a farewell email that Easterbrook sent to its staff; there, he acknowledged that he had made ""a mistake"" and accepted his dismissal:
“I established a recent consensual relationship with an employee, which violated McDonald’s policy. This was a mistake. Given the values of the company, I agree with the board that it is time for me to move on. ”
In that email, Easterbrook also wished Kempczinski successes.
An article in Time magazine notes that, according to expert opinion, the fast-food giant had no choice but to fire its CEO:
""Especially since the beginning of the #MeToo movement, companies have been under increasing pressure to demonstrate that they are taking strong action against all forms of inappropriate sexual behavior.""
The media added that ""allowing Easterbrook to remain in the company would send the message that the company's policies do not matter, and that not all members of the workforce will be treated fairly.""


"
