,src,lang,text
0,"











Nova acusação de assédio sexual abala cinema francês
06 Nov 2019, 22:09 by RFI

Adèle Haenel é uma das atrizes mais em voga na França, vencedora de dois César, o Oscar do cinema francês. Depois de anos de silêncio, ela acusou o diretor Christophe Ruggia de assédio sexual e provocou uma onda de choque que relança, dois anos depois, o movimento #MeToo no país. Sua decisão de não entrar na Justiça contra o cineasta provoca polêmica. A Promotoria de Paris abriu uma investigação nesta quarta-feira (6).

A atriz, de 30 anos, que começa a fazer sucesso internacional com o filme ""Retrato de uma jovem em chamas"", de Céline Sciamma, em competição no último Festival de Cannes, revelou nessa segunda-feira (4) que Ruggia a assediou quando ela era adolescente.
Adèle Haenel fez a declaração ao site de notícias Mediapart, que publicou uma vasta investigação sobre o caso, com vários depoimentos confirmando a acusação da atriz. Ela estreou no cinema quando era adolescente. Em seu primeiro filme ""Les diables"", dirigido por Ruggia, interpretava uma órfã autista, em fuga.
A atriz afirmou que o cineasta exerceu um ""controle"" sobre ela durante a filmagem. Se disse vítima de um ""assédio sexual permanente"", ""toques"" repetidos e ""beijos forçados no pescoço"" que ocorreram na casa do diretor e em vários festivais de cinema quando ela tinha entre 12 e 15 anos.

Cineasta nega

Ruggia, de 54 anos, voltou a refutar as acusações nesta quarta-feira (6), mas admitiu ter ""cometido o erro de brincar de ser um pigmaleão com os mal-entendidos e os obstáculos que esta postura suscita"". ""Não percebi que minha adulação (...) podia ser, devido a sua juventude, penosa em alguns momentos"", disse. O diretor pediu ainda ""perdão"".
Logo depois que a denúncia foi revelada, e sem que a Justiça fosse acionada, o cineasta foi expulso da Sociedade de Diretores de Filmes da França. A associação profissional, que tem 300 membros, ofereceu seu ""apoio total"" a Haenel. Atrizes famosas, como a vencedora do Oscar Marion Cotillard, também a apoiaram.

Consequências

Apesar de, na esteira do #Metoo, que na França ganhou sua versão #Balancetonporc (dedure seu porco), outras atrizes francesas terem acusado anteriormente um diretor ou produtor de assédio sexual, essa é a primeira vez que se trata de uma celebridade.
""Estamos diante de um momento de mudança. É a primeira vez na França que uma atriz conhecida internacionalmente, que trabalha muito e está muito cotada, fala sobre este assunto"", afirma a jornalista Véronique Le Bris, fundadora do site cine-woman.fr, para quem as acusações de Haenel terão ""obrigatoriamente consequências"".
Para a professora universitária Iris Brey, especialista na representação do gênero no cinema, ""até agora, na França, não houve o desejo de manter estas discussões pós #MeToo"".
Haenel explicou em um live no site Mediapart que decidiu revelar o caso agora, mais de 15 anos depois, porque o ""mundo mudou"". ""Devo o fato de poder falar agora a todas aquelas que falaram no âmbito do #MeToo"", disse.

""Os monstros não existem""

""Para mim, é uma responsabilidade, porque posso me permitir, porque trabalho o suficiente"", desabafou a atriz. ""Os monstros não existem. É nossa sociedade, nós, nossos amigos, nossos pais. É nisto que devemos prestar atenção"", advertiu.
Haenel decidiu não denunciar Ruggia à Justiça, lamentando que haja ""tão poucas"" condenações nesse tipo de casos. Ela estimou ainda que há uma ""violência sistêmica contra as mulheres no âmbito judicial"", levando a ministra da Justiça francesa a reagir. Nicole Belloubet aconselhou a atriz a dar queixa. ""Acredito, ao contrário do que ela disse, que a Justiça pode se encarregar desse tipo de situação"", garantiu a ministra.
entanto, a Promotoria de Paris anunciou ter aberto uma investigação preliminar por ""agressões sexuais"" contra uma menor por parte de uma ""pessoa com autoridade"", assim como por ""assédio sexual"".

Reações nas redes sociais

O testemunho de Haenel gerou uma avalanche de reações nas redes sociais. ""Adèle, sua coragem é um presente de uma generosidade sem igual"", escreveu Cotillard. ""Você rompeu um silêncio tão pesado..."", acrescentou.
""Uma grande admiração por Adèle Haenel, que fala por todas aquelas que estão na sombra"", disse no Instagram a atriz Julie Gayet, companheira do ex-presidente François Hollande.
Ruggia afirmou que sua ""exclusão social está em andamento"", lamentando que hoje em dia se acuse à margem da Justiça, ""no pelourinho midiático"".
Unifrance, organismo encarregado da promoção do cinema francês no exterior, também ofereceu seu apoio, ""condenando sem reservas qualquer ato violento, ou comportamento inapropriado"". O órgão anunciou a elaboração, em breve, de um código de conduta dirigido aos profissionais que participam de seus eventos.

(Com informações da AFP)



",pt,"











New sexual harassment charge shakes French cinema
06 Nov 2019, 22:09 by RFI

Adèle Haenel is one of the most fashionable actresses in France, winner of two Caesar, the Oscars of French cinema. After years of silence, she accused director Christophe Ruggia of sexual harassment and triggered a shockwave that relaunched the #MeToo movement in the country two years later. His decision not to go to court against the filmmaker provokes controversy. The Paris Prosecutor's Office opened an investigation on Wednesday (6).

The 30-year-old actress, who is starting to make an international hit with Céline Sciamma's ""Portrait of a Young Woman on Fire"" in competition at the last Cannes Film Festival, said Monday that Ruggia harassed her when She was a teenager.
Adèle Haenel made the statement to the Mediapart news site, which has published an extensive investigation into the case, with several testimonials confirming the actress's accusation. She made her film debut as a teenager. In her first film ""Les diables"", directed by Ruggia, she played an autistic orphan on the run.
The actress stated that the filmmaker exercised ""control"" over her during the filming. She said she was the victim of ""permanent sexual harassment"", repeated ""ringing"" and ""forced neck kisses"" that occurred at the director's house and at several film festivals when she was 12 to 15 years old.

Filmmaker denies

Ruggia, 54, refuted the accusations on Wednesday, but admitted ""making the mistake of playing a pigmaleão with the misunderstandings and obstacles that this stance raises."" ""I did not realize that my adulation ... could be, due to his youth, painful at times,"" he said. The director also asked for ""forgiveness"".
Shortly after the complaint was revealed, and without a court action being filed, the filmmaker was expelled from the French Society of Film Directors. The professional association, which has 300 members, offered its ""full support"" to Haenel. Famous actresses, such as Oscar winner Marion Cotillard, also supported her.

Consequences

Although, in the wake of #Metoo, which in France won its version #Balancetonporc (dedure your pig), other French actresses have previously accused a director or producer of sexual harassment, this is the first time that this is a celebrity.
""We are facing a moment of change. It is the first time in France that an internationally known actress, who works hard and is very quoted, talks about this subject,"" says journalist Véronique Le Bris, founder of cine-woman.fr , for whom Haenel's accusations will ""necessarily have consequences"".
For university professor Iris Brey, a specialist in the representation of genre in cinema, ""until now, in France, there has been no desire to maintain these post #MeToo discussions.""
Haenel explained in a live on Mediapart that he decided to reveal the case now, more than 15 years later, because the ""world has changed"". ""I owe the fact that I can now speak to all those who spoke under #MeToo,"" he said.

""The monsters do not exist""

""It's a responsibility to me because I can afford it, because I work hard enough,"" the actress said. ""The monsters do not exist. It is our society, we, our friends, our parents. This is what we should pay attention to,"" he warned.
Haenel has decided not to report Ruggia to court, lamenting that there are ""so few"" convictions in such cases. She also estimated that there is ""systemic violence against women in the judicial sphere"", prompting the French Minister of Justice to react. Nicole Belloubet advised the actress to complain. ""I believe, contrary to what she said, that the court can handle this kind of situation,"" said the minister.
However, the Paris Prosecutor's Office has announced that it has opened a preliminary investigation into ""sexual assaults"" on a minor by an ""authoritative person"" as well as ""sexual harassment"".

Reactions on social networks

Haenel's testimony generated a flood of reactions on social networks. ""Adèle, your courage is a gift of unparalleled generosity,"" Cotillard wrote. ""You broke such a heavy silence ..."" he added.
""A great admiration for Adèle Haenel, who speaks for all those who are in the shadow,"" actress Julie Gayet, a companion of former president François Hollande, told Instagram.
Ruggia said his ""social exclusion is underway"", lamenting that he is accused today on the fringes of justice, ""in the media pillory.""
Unifrance, the agency in charge of promoting French cinema abroad, also offered his support, ""condemning unreservedly any violent acts or inappropriate behavior."" The agency has announced the elaboration, soon, of a code of conduct addressed to professionals who participate in its events.

(With AFP info)



"
