,src,lang,text
0,"











Cina, una condanna a morte e 8 in carcere per traffico di fentanyl verso gli Usa
Le pillole di oppioide arrivano da Oriente sul territorio messicano, attraverso i porti della costa del Pacifico
06 Nov 2019, 22:00 by Guido Olimpio e Guido Santevecchi
Un tribunale cinese ha condannato a morte un trafficante di fentanyl. Una sentenza esemplare che va oltre l’aspetto legale in quanto entra in una partita più ampia: guerra dei dazi, situazione messicana, rapporti tra le due potenze rivali.
Il verdetto è stato emesso dal tribunale di Xingtai (provincia dell’Hebei) ed ha riguardato trafficanti accusati di aver spedito la droga verso gli Stati Uniti. Ad un imputato, Wang Fengxi, i giudici hanno inflitto la pena capitale mentre gli 8 complici passeranno diversi anni in galera. Il meccanismo usato dai criminali è ben oleato, con ordini che arrivavano via online e referenti dall’altra parte dell’Oceano. Modus operandi che limita i contatti diretti al minimo, grazie all’uso di Internet e di sponde ben coperte. Una minaccia molto sentita a Washington. Infatti un alto funzionario cinese ha sottolineato come su questo caso ci sia stata una collaborazione con gli Usa. Parole non di circostanza. Gli americani hanno più volte accusato la controparte di fare poco contro i network abili nell’inviare – anche per posta o con corrieri – ingenti partite dell’oppiaceo.


Cinque degli arrestati in Cina (Ap)

Pechino, all’inizio di maggio, aveva promesso di mettere sotto controllo la produzione e la vendita di tutte le varianti del fentanyl, una sostanza letale, 50 volte più potente della morfina. E in seguito aveva lanciato segnali di cooperazione, mossa inserita nella sfida sui dazi. I cinesi, da parte loro, hanno rammentato che il traffico esiste perché c’è una grande domanda che arriva proprio dall’America. In passato si è ipotizzato che Prince sia stato stroncato da una dose dell’oppiaceo e la stessa fine hanno fatto 32 mila americani nel solo 2018, anno nel quale lo stesso Trump ha dichiarato l’emergenza per questo “veleno”. Realizzarla costa poco, ma rende moltissimo alle bande che agiscono sull’asse Cina-Messico-Stati Uniti. E spesso è venduta insieme all’eroina, con effetti ancora più devastanti. Inoltre il fentanyl, è stato usato dalle unità speciali russe per mettere fine all’assedio del teatro Dubrovka di Mosca da parte dei terroristi ceceni (2002). Impiego che provocò una strage, con 169 vittime.
Le pillole arrivano da Oriente sul territorio messicano, attraverso i porti della costa del Pacifico. Località teatro di faide tra le bande rivali. Cartello di Sinaloa e quello di Jalisco si sono lanciati su questa fetta di mercato molto vantaggiosa, importando la merce poi avviata verso Nord, ma anche producendola in proprio. Pochi giorni fa la Dea ha lanciato un nuovo allarme: i trafficanti mettono a punto analgesici “taroccati” contenenti fentanyl. Il patto tra boss “latini” e reti orientali ha poi favorito il riciclaggio: operatori cinesi lavano montagne di dollari realizzati dai padrini in Messico.


",it,"











China, a death sentence and 8 in prison for fentanyl traffic to the US
Opioid pills arrive from the East on Mexican territory, through the ports of the Pacific coast
06 Nov 2019, 22:00 by Guido Olimpio and Guido Santevecchi
A Chinese court sentenced a fentanyl trafficker to death. An exemplary sentence that goes beyond the legal aspect as it enters a wider game: war of duties, Mexican situation, relations between the two rival powers.
The verdict was issued by the court of Xingtai (Hebei province) and involved traffickers accused of sending the drugs to the United States. For a defendant, Wang Fengxi, the judges have imposed the death penalty while the 8 accomplices will spend several years in jail. The mechanism used by criminals is well oiled, with orders arriving via online and referrals from the other side of the Ocean. Modus operandi that limits the direct contacts to the minimum, thanks to the use of Internet and well covered banks. A very felt threat to Washington. In fact, a senior Chinese official pointed out that there was a collaboration with the US on this case. Words not of circumstance. The Americans have repeatedly accused the other party of doing little against the networks able to send - even by post or courier - huge matches of the opium.


Five of those arrested in China (AP)

Beijing, at the beginning of May, had promised to monitor the production and sale of all variants of fentanyl, a lethal substance, 50 times more powerful than morphine. And later he launched signs of cooperation, a move included in the duty challenge. The Chinese, for their part, recalled that traffic exists because there is a big demand coming from America. In the past it was assumed that Prince was struck by a dose of opiate and the same end was made by 32,000 Americans in 2018 alone, the year in which Trump himself declared the emergency for this ""poison"". Realizing it is cheap, but it makes a lot of money for the gangs acting on the China-Mexico-United States axis. And it is often sold together with heroin, with even more devastating effects. In addition, fentanyl was used by Russian special units to end the siege of the Dubrovka theater in Moscow by Chechen terrorists (2002). Employment that caused a massacre, with 169 victims.
The pills arrive from the East on Mexican territory, through the ports of the Pacific coast. Location of feuds among rival gangs. Cartel of Sinaloa and that of Jalisco have launched on this very advantageous market share, importing the goods then started towards the North, but also producing it on their own. A few days ago the Goddess launched a new alarm: the traffickers developed ""fake"" analgesics containing fentanyl. The pact between ""Latin"" bosses and Eastern networks has also favored recycling: Chinese operators wash mountains of dollars made by godparents in Mexico.


"
