,src,lang,text
0,"











Гороскоп для всех знаков зодиака на 3 ноября

03 Nov 2019, 04:00

Гороскоп на сегодня, 3 ноября, для всех знаков зодиака, читайте на Фактах ICTV.
День благоприятен для духовной практики, саморазвития. События могут принести смешанный и неоднозначный результат.
Если на сегодня запланирована встреча с авторитетными лицами или с отцом — желательно проявить уважение и почтение, даже если нет единодушия в каких-то вопросах. Позже будет возможность вернуться к разговору и обсудить все еще раз.
Хорошо сегодня наводить порядок в делах. Решение материальных вопросов, скорее всего, не даст ожидаемого результата.
Может тянуть к нечестным, грубым и конфликтным поступкам, но энергии дня не благоволят этому.
Читайте: Гороскоп на неделю с 4 по 10 ноября
В отношениях с людьми лучше проявлять сдержанность и доброжелательность. Настаивание на своем может принести нежелательные последствия для отношений.
Важно следить за эмоциями, которыми наполняете слова и пожелания, — сегодня сила сказанного такова, что оно может достаточно быстро сбыться.
К слову, ранее Факты ICTV публиковали гороскоп для всех знаков зодиака на ноябрь 2019.


",ru,"











Horoscope for all the signs of the zodiac on November 3

03 Nov 2019, 04:00

The horoscope for today, November 3, for all zodiac signs, read on ICTV Facts.
The day is favorable for spiritual practice, self-development. Events can bring mixed and mixed results.
If you are planning a meeting with authority figures or with your father today, it is advisable to show respect and reverence, even if there is no unanimity in any matters. Later there will be an opportunity to return to the conversation and discuss everything again.
It’s good to put things in order today. The solution of material issues, most likely, will not give the expected result.
It may lead to dishonest, rude and conflicting actions, but the energies of the day do not favor this.
Read: Horoscope for the week of November 4 to 10
In relations with people it is better to show restraint and goodwill. Insisting on one's self can have undesirable consequences for a relationship.
It is important to follow the emotions that fill words and wishes - today the strength of what has been said is such that it can come true quickly enough.
By the way, earlier ICTV Facts published a horoscope for all zodiac signs for November 2019.


"
