,src,lang,text
0,"











Tots Sants
02 Nov 2019 by Joan Borja
«Halloween or not Halloween», that’s the question. Efectivament: cada any dels últims anys, a mitjan tardor, per Tots Sants es reobri el debat. Halloween, sí; Halloween, no. La discussió, més o menys acalorada, amenitza converses de café, soparots amicals i sobretaules familiars. Fins i tot, últimament ha arribat a assimilar-se com una forma ritual de la salutació o la cordialitat. Vull dir: com qui parla del temps o de la salut («Hola, bon dia! Com estàs! Xe, quina calor, eh? No és de creure que estiguem ja al novembre...»), la gent en comenta el fenomen («Hola, bona nit! Com va tot? Xe, tu mira, tots els xiquets disfressats del Halloween eixe! Tu què trobes? En vol de mans, eh? En fi... Hala! Adeu. Records a casa, Mari!»)
El fenomen és incontestable. I dijous a la nit es va manifestar amb tota l’efervescència i tota la intensitat pels carrers i les places de la majoria de pobles i ciutats valencianes. Disfressats de dimonis, bruixes, esquelets, zombis, esperits o espectres siderals, els xiquets i les xiquetes, acomboiats en ramats més o menys grans —pasturats o no pels corresponents pares i mares—, assaltaven enjogassats les cases i els comerços del veïnat amb el sabut crit desficiat i amenaçant: «Truc o tracte? Truc o tracte? Truc o tracte?»; «Paga o plora! Paga o plora! Paga o plora!» «Crit o confit? Crit o confit? Crit o confit?» «Truco o trato? Truco o trato? Truco o trato?» Fins i tot, els del plurilingüisme amb nivell avançat, anaven atracant el personal, percaçant llepolies, cridant la fórmula anglesa original: «Trick or treat? Trick or treat? Trick or treat?» És a dir: «‘Broma’ o ‘regal’?» Amb el clar sentit de: «Què prefereixes, regalar-nos un dolç o que et fem una broma (és a dir, una malifeta)?»
L’espectacle dels xiquets emocionats —alterats, nerviosos, turbulents—, corrent pels carrers, en estols, iniciant-se dolçament i didàcticament en aquesta indissimulada forma del xantatge, l’amenaça i la coacció, és francament entendridor. «Paga o plora! Paga o plora! Paga o plora!» «Trick or treat! Trick or treat! Trick or treat!» No hi ha dubte, en qualsevol cas, que es tracta d’un costum nou, inesperat, desconcertant, que ha arrelat amb força i que —ai!— ha arribat a la nostra quotidianitat per quedar-se. És just ací, clar, on arranquen els debats: que si veges tu quin trellat, que si la globalització se’ns menjarà pels garrons, que si estem perdent les tradicions, que si forasters vindran que de casa mos trauran, que si mos estan fent americans, que si el món un dia s’acabarà...
Hi ha, fins i tot, qui ho planteja com una dicotomia excloent: Halloween o Tots Sants? I és enmig d’aquest debat que em fa l’efecte que s’ha acabat orquestrant —amb un èxit notable— un estimabilíssim i interessantíssim moviment de reacció que proposa i reivindica, pels camins de la genuïnitat, itineraris alternatius als de la suposada ianquinització associada al fenomen del Halloween. Pensem, sense anar més lluny, en l’espectacular —i recomanabilíssima!— aposta que el Museu Valencià d’Etnologia ha fet en el projecte «Espanta la por. Per Tots Sants, monstres valencians.» O, aquesta segona viscuda en primera persona, la meravella meravellosa —meravellosíssima!— del concert De por, que Dani Miquel i els seus Ma, Me, Mi, Mo Músics van oferir al Palau Altea Centre d’Arts, també dijous, vespra de Tots Sants, just a la mateixa hora en què milers i milers de xiquetes i xiquets valencians assaltaven com posseïts els comerços del país —degudament proveïts de llepolies per a l’ocasió.



És un fet: el nostre és el temps en què hem importat el trick-or-treating anglosaxó. D’acord. Però és també un temps en què comencem a redimir de la desmemòria referents autòctons de l’imaginari valencià tan espectaculars com la Quarantamaula, el Caro, el Butoni, la Bolangera, l’Home dels Nassos, Esclafamuntanyes, el Gegant del Romaní, el Moro Mussa, la Mumerota, la Vella Pinta, la Malhora, la Mala Fortuna, l’Home del Sac, l’Home de la Pansa, els Esquiladers...
—Vine, Joan, que t’he portat una caixeta de caquis de l’Alcúdia —em sorprén l’impensable Dani Miquel quan ens saludem al final del concert, després d’una maratoniana sessió de fotos i dedicatòries de discos, amb centenars de xiquets.
—Xe! Ho dius de veres? Com que una caixa de caquis?
—Sí, home. Sabia que vindries i t’he portat una caixeta de caquis —m’explica—. Ja saps que, a l’Alcúdia, caquis! —somriu, amb l’alegria contagiosa que el caracteritza, a prova de viatges, concerts, fotos, dedicatòries i fatigues—. Per cert... Ara resulta que s’han inventat, allí al meu poble, el Caquiween. Tu què trobes? —planteja, amb somriure irònic, crític i picardiós.
—Que què trobe? Trobe que un bon amic meu, el teatrer Tomàs Mestre, ho encertava de ple quan argumentava, fa un grapat d’anys: «Mira: el dia que els xiquets valencians van deixar de jugar a moros i cristians i van començar a jugar a indis i vaquers, això de la globalització ja havia avançat bona cosa!»
I és que, als meus ulls, el fenomen del Holyween  (com diuen algunes persones majors), no solament és irrefrenable: entra dins de l’ordre lògic de les coses, en un món globalitzat com el nostre. Perquè celebrar la festivitat de Tots Sants amb rialles, bromes, jocs, disfresses, correres, llepolies i xilladisses és una alternativa molt més atractiva i seductora, per a xiqeuts adolescents i joves (i també per als adults!) que el recolliment, el dol, la tristor, el res, l’aflicció, l’atuïment i la penitència. Més encara en un temps com el nostre, feliçment propens al sentit lúdic i a l’hedonisme.
—Els meus fills també celebren Halloween. I no crec que això siga cap pecat, ni que els faça cap mal. Veig que s’ho passen bé i, contra això... Què vols que et diga? Contra això no puc anar! —m’explicava fa quatre o cinc anys, carregat de raó, l’amic Diego Zaragozí—. Tu els has vist, els xiconets i els joves d’ara? Doncs corre, ves i dis-los que no, que res d’ajuntar-se a fer festa: que s’han de quedar a casa resant a les animetes...
Ben mirat, tampoc no és cosa inèdita, en la nostra tradició cultural, això d’aprofitar i celebrar Tots Sants pel cantó de la vida, l’emprenedoria, la joia i el divertiment més que no pel cantó de la mort, la tristesa, l’abúlia i l’encongiment. Pensem, per exemple, en la història i l’esplendor d’un esdeveniment com la Fira de Tots Sants de Cocentaina, que enguany compleix —es diu fàcil!— 673 anys des del dia que el rei Pere el Cerimoniós en va concedir el privilegi de celebració, l’any 1346. Com pocs altres esdeveniments, la Fira de Tots Sants de Cocentaina, exultant de visitants, tractes i transaccions comercials, representa la voluntat popular d’una flamejant vitalitat, coincidint harmònicament amb la festivitat de la mort. 135.935 metres quadrats de superfície ocupada, 750 expositors, 52 milions d’euros en mercaderies, més de mig milió de visitants... Declarada enguany Bé d’Interés Turístic Internacional, la Fira de Tots Sants de Cocentaina —moltíssim més antiga que la paraula Halloween— és en si mateix un exponent insuperable de la compatibilitat de la vida amb la festa dels morts. Fins a l’extrem que, a Cocentaina, s’ha consolidat el costum de membrar els morts no tant l’1 de novembre, dia de Tots Sants, avui, 2 de novembre, Dia de les Ànimes. Com si digueren: «A Cocentaina, en Fira, els morts poden esperar.» Precisament, perquè quan tots celebren la mort, la Fira celebra la vida.
Celebrada expansivament o amb recolliment, Tots Sants, a l’inici de novembre —coincidint amb el temps de la sembra i la mort aparent del camp—, és una festivitat d’àmbit universal consagrada a la memòria dels morts. Tal com sosté l’estudiós Francesc Gisbert, en Màgia per a un poble: «Segons una creença popular que ja compartien celtes i altres pobles antics, el vespre de Tots Sants, les ànimes del Purgatori o del país dels morts tornen, per un dia, a les cases que habitaven. Les portes del Purgatori no són vigilades i les ànimes poden escapolir-se’n. D’ací la temença a caminar per sendes solitàries i topar-se amb una aparició. L’endemà, però, han de regressar al seu estat habitual. Aquelles que hagen rebut el record i les ofrenes dels parents (els ciris, alguna missa...) abandonaran el purgatori i pujaran al cel.» Fe i fet, tal dia com avui, 2 de novembre, diuen a Cocentaina que les ànimes tornen a casa, i que cal deixar-los el llit ben fet perquè reposen i descansen.
En aquest sentit, evoque ara les palometes o mariposes que la meua iaia —sempre vestida de dol— encenia a casa, cada any, per Tots Sants, dins d’una tassa amb aigua i oli. Tantes llumetes com ànimes volíem honrar i memorar en família. I igual que recorde aquelles flames fràgils i misterioses, dansant en la fosca, enmig del respectuós silenci de casa, recorde també que el folklorista Francesc Martínez i Martínez apuntava: «La nit de Tots Sants les barques no ixen a la mar, perquè diuen que es pesquen calaveres».
—Ens prohibien d’anar al cine o eixir a sopar, o ballar, perquè deien que s’apareixien les animetes —m’explica Maria Bolo Martínez, d’Altea—. Però nosaltres eixíem. I anàvem al cine. I, tornant a casa per la sendeta del Blanquinal, quan passàvem per davall d’un garrofer gran que hi havia, Maties la Tarrossa encenia mistos i cridava: «Les animetes, les animetes! Uuuuuuu! No heu fet cas, i les animetes s’apareeeeeeixen!» I, clar, mos cagàvem de por! —continua remembrant, entre rialles.
No. No és cosa només d’ara, que els valencians celebrem i ens debatem entre la vida i la mort alhora, indestriablement, per Tots Sants. Al capdavall la mateixa paraula Halloween, sembla que etimològicament significa, com en la nostra tradició romànica, ‘vigília de Tots Sants’, atés que hallow, en anglés antic significava ‘sant’ o ‘sagrat’, amb un mateix origen que la paraula moderna holy (sembla que l’encerta, la gent major que en comptes de dir Halloween tendeix a pronunciar Holyween!). I, així, és de la combinació escocesa All Hallows' Eve (‘vespra de Tots Sants) —segons diuen— que s’hauria originat el terme Halloween.
Tinc per a mi, en qualsevol cas, que Halloween ha vingut per quedar-se: tant o més que l’imaginari dels indis, els vaquers i el Far West; o que el mateix univers de la Walt Disney. Fins a l’extrem que  em sembla que la qüestió potser no és tant «Halloween or not Halloween», sinó «Tots Sants or not Tots Sants». Això justament pensava, ahir, al cementeri d’Altea, mentre visitava amb els fills les tombes dels meus, i en servava la memòria.
I és que, a partir d’una edat, la vida no és pot ja comprendre sense la mort. I aprenem —i acceptem— que davant la disjuntiva «malifeta o acord» («trick or treat») sempre val més un bon tracte que un mal inopinat. Vull dir: que potser convindria acceptar, si molt convé, l’enjogassament de Halloween, com a ‘vigília de Tots Sants’. Però sense perdre’n el sentit genuí i últim de la celebració vital de Tots Sants, indestriablement unida a la memòria dels morts. No els morts de les pel·lícules, les sèries, les novel·les, els còmics i els dibuixos animats: ni tan sols els morts de la Quarantamaula, el Caro, el Butoni, la Bolangera, l’Home dels Nassos, Esclafamuntanyes, el Gegant del Romaní, el Moro Mussa, la Mumerota, la Vella Pinta, la Malhora, la Mala Fortuna, l’Home del Sac, l’Home de la Pansa i els Esquiladers. Els morts: els propis morts, els morts que som, els nostres morts.


",ca,"











All Saints
02 Nov 2019 by Joan Borja
«Halloween or not Halloween», that's the question. Indeed: every year of the last years, in the middle of autumn, for All Saints the debate is reopened. Halloween, yes; Halloween, no. The discussion, more or less heated, invites coffee conversations, friends' dinners and family dinners. Even, lately he has come to assimilate himself as a ritual form of greetings or cordiality. I mean: like who talks about time or health (""Hello, good morning! How are you! Xe, what heat, eh? It's not to believe we are already in November ...""), people comment on the phenomenon («Hello, good night! How is it all? Xe, you look at it, all the children dressed as Halloween! What are you doing? At your fingertips, eh? End ... Oh! Oh! »)
The phenomenon is indisputable. And last Thursday, it was manifested with all the effervescence and intensity of the streets and squares of most towns and cities in Valencia. Disguised as demons, witches, skeletons, zombies, spirits or sidereal spectra, boys and girls, fitted in more or less large flocks -fattered or not by their corresponding parents and mothers-, they plagued the homes and shops of the neighborhood with the I learned misguided and threatening cries: ""Trick or treat? Trick or Treat? Trick or Treat? ""; «Pay or cry! Pay or cry! Pay or cry! »« Cry or confit? Shout or confit Shout or Confit? »« Trick or Treat? Trick or deal? Trick or Treat? ""Even those of plurilingualism with an advanced level, were docking the staff, losing lightning, shouting the original English formula:"" Trick or treat? Trick or treat? Trick or treat? »That is to say: '' joke 'or' gift '?» With the clear sense of: «What do you prefer, give us a candy or make a joke (that is, a mischief)?»
The spectacle of the emotional children - altered, nervous, turbulent - running through the streets, in stools, starting sweetly and didactically in this unhealthy way of blackmail, threatening and coercion, is frankly understandable. «Pay or cry! Pay or cry! Pay or cry! »« Trick or treat! Trick or treat! Trick or treat! »There is no doubt, in any case, that this is a new, unexpected, baffling custom that has rooted strongly and that -ay! - has come to our daily routine to stay. It's just here, of course, where the debates start: if you see what you are talking about, that if globalization will be eaten by the piglets, that if we are losing traditions, that if foreigners will come from home they will remove us, that if we are doing Americans, that if the world one day will end ...
Is there even someone who poses it as an excluding dichotomy: Halloween or All Saints? And it is in the middle of this debate that it gives me the impression that it has ended up orchestrating - with a remarkable success - an extremely interesting and stimulating reaction movement that proposes and vindicates, on the paths of genuineness, alternative itineraries to those of the supposed ianquinización associated to the phenomenon of Halloween. We think, without going any further, in the spectacular - and highly recommendable! - bet that the Valencian Museum of Ethnology has done in the project ""Fear of fear. For All Saints, Valencian monsters. »Or, this second person lived in the first person, the marvelous wonder - most amazing! - of the Por Porque concert, that Dani Miquel and his Ma, Me, Mi, Mo Musicians offered at the Palau Altea Center ""Arts, also Thursday, the eve of All Saints, right at the same time when thousands and thousands of Valencian boys and girls assaulted the country's trades as possessions - suitably stocked with sweets for the occasion.



It's a fact: ours is the time we imported the trick-or-treat Anglo-Saxon. Okay. But it is also a time when we began to redeem the indigenous references of the Valencian imaginary as spectacular as the Quarantamaula, Caro, Butoni, Bolangera, the Nose Man, Esclafamuntanyes, the Giant of the Rosemary, the Moor Mussa, La Mumerota, La Vieja Pinta, La Malhora, La Mala Fortuna, El Hombre del Sac, La Pansa Man, The Esquiladers ...
-Vine, Joan, that I brought a chess box to Alcúdia -we surprised the unthinkable Dani Miquel when we greeted at the end of the concert, after a marathon session of photos and discs, with hundreds of children
-Yes! Do you say so? Like a Box of Persimmons?
-Yes, man. I knew that you came and I brought you a box of caquis, ""he explained. You know, in Alcudia, chaos! - It smiles, with the contagious joy that characterizes it, for trips, concerts, photos, dedications and fatigue. By the way ... Now it turns out that they have invented, there in my town, the Caquiween. What do you find -Stapes, with ironic, critical and pessimistic smile.
-What do you find? Find that a good friend of mine, the theater player Tomàs Mestre, was right when he argued for a handful of years: ""Look: on the day the Valencian children stopped playing moros and Christians and started playing Indians And cowboys, that of globalization had already advanced a good thing! ""
And, in my eyes, the phenomenon of the Holyween (as some older people say), is not only unstoppable: it enters the logical order of things, in a globalized world like ours. Because celebrating All Saints' feast with laughter, jokes, games, costumes, jogging, licking and sweatshirts is a much more attractive and seductive alternative, for young teens and young people (and also for adults!) That the rejoicing, the mourning , sadness, res, affliction, apprehension and penance. Even more in a time like ours, happily prone to playfulness and hedonism.
-Your children also celebrate Halloween. And I do not think this is a sin, nor does it make any harm. I see that they have a good time and, against that ... What do you want me to tell you? Against this I can not go! -I explained four or five years ago, rightly wrong, friend Diego Zaragozí-. Have you seen them, the kids and the youth of now? Well, run, you see and tell them not, that there is nothing to join in to celebrate: they must stay at home praying for the little animals ...
Well-looked, it is not an unpublished thing, in our cultural tradition, that of taking advantage of and celebrating All Saints for the corner of life, entrepreneurship, joy and entertainment more than the corner of death, sadness, the abulia and the shrug. Let us think, for example, in the history and splendor of an event such as the Fair of All Saints of Cocentaina, which this year fulfills - it is easy to say - 673 years since the day that King Pere the Ceremonious granted the privilege of celebration, in 1346. Like just a few other events, the Fair of All Saints of Cocentaina, exulting visitors, deals and commercial transactions, represents the popular will of a flaming vitality, coinciding harmonically with the festivity of death. 135,935 square meters of occupied area, 750 exhibitors, 52 million euros in merchandise, more than half a million visitors ... Declared this Year of International Tourist Interest, the Fair of All Saints of Cocentaina - much older than the word Halloween - is in itself an unbeatable exponent of the compatibility of life with the party of the dead. To the extreme that, in Cocentaina, the custom of naming the dead was consolidated not so much on November 1, All Saints day, today, November 2, Day of Souls. As if they said: ""In Cocentaina, in Fira, the dead can wait."" Precisely, because when everyone celebrates the death, the Fair celebrates life.
Celebrated expansively or with recollection, All Saints, at the beginning of November - coinciding with the time of sowing and the apparent death of the field, is a festival of universal scope consecrated to the memory of the dead. As the scholar Francesc Gisbert maintains, in Magic for a people: ""According to a popular belief that they already shared Celts and other ancient peoples, the All Saints night, souls of the Purgatory or the country of the dead go back, for a day , to the houses that inhabited. Purgatory doors are not watched and souls can escape. Hence the fear of walking on solitary paths and breaking into an appearance. The next day, however, they must return to their usual state. Those who have received the memory and the offerings of the relatives (the candles, some misa ...) will leave the purgatory and they will go up to the sky. ""Faithfulness, such day as today, November 2, they say to Cocentaina that the souls return at home, and that you have to leave the bed well to rest and rest.
In this sense, I now evoke palometas or butterflies that my hand was-always dressed in dolphins-at home, every year, for All Saints, in a cup with water and oil. As many lamps as souls we wanted to honor and memorize as a family. And just like remembering those fragile and mysterious flames, dancing in the dark, in the middle of the respectful silence of the house, remember also that the folklorist Francesc Martínez and Martínez pointed out: ""The night of All Saints the boats do not come to the sea, because they say that They are fishing skulls ».
- They prohibited us from going to the movies or going out to dinner, or to dance, because they said the animals were showing up, ""explains Maria Bolo Martínez, from Altea. But we started. And we went to the movies. And, returning home to the Blanquinal path, when we passed under a large carrot that was there, Maties la Tarrosa swarmed and called: ""The little animals, the little ones! Uuuuuuu! You have not ignored, and the little animals are coming out! ""And, of course, we were scared. -Continues remembering, laughing.
No. It's not a matter of now, that Valencians celebrate and debate each other between life and death at the same time, inextricably, for All Saints. After all, the same Halloween word, it seems that etymologically it means, as in our Romance tradition, the ""vigil of All Saints"", since hallow, in ancient English, meant ""holy"" or ""sacred"", with the same origin as the modern word holy (it seems to be right, elder people who instead of saying Halloween tends to pronounce Holyween!). And, like this, it is from the Scottish combination All Hallows 'Eve (' Tue's evets Sants) - as they say - that Halloween would have originated.
I have for myself, in any case, that Halloween has come to stay: more or less than the imagination of the Indians, cowboys and the Far West; or that the same universe of Walt Disney. To the extreme that I think the question may not be so much ""Halloween or not Halloween"", but ""All Saints or not All Saints."" This was exactly what I thought, yesterday, at Altea Cemetery, while I visited the tombs of my children with children, and served the memory.
And, from an age, life can not be understood without death. And we learn - and we accept - that before the disjunctive ""maliciousness or agreement"" (""trick or treat"") it is always more a good deal than an ill-conceived evil. I would like to say: maybe it would be best to accept, if necessary, Halloween's rage, as the 'Goodwill of All Saints'. But without losing the genuine and ultimate meaning of the vital celebration of All Saints, inextricably linked to the memory of the dead. Not the deaths of movies, series, novels, comics and cartoons: not even the dead of the Forty-Fourth, Caro, Butoni, Bolangera, Nassos's Man, Esclafamuntanyes, the Giant of the Rosemary, the Moor Mussa, the Mumerota, the Old Pinta, the Malhora, the Mala Fortuna, the Man of the Sac, the Man of the Pansa and the Esquiladers. The dead: the dead themselves, the dead we are, our dead.


"
