,src,lang,text
0,"











54 قتيلا حصيلة هجوم القاعدة على عناصر جيش المالي
الميليشيات المسلحة المنتمية لتنظيم القاعدة تعزز تهديداتها باعتداء أكثر دموية استهدف عناصر الجيش المالي.

02 Nov 2019

باماكو – ارتفع ضحايا هجوم أمس الجمعة على موقع للجيش شرقي مالي أمس الجمعة إلى 54 قتيلا ، مما يجعله أحد الهجمات الأكثر دموية ضد قوات الأمن منذ استيلاء انفصاليين ومتمردين إسلاميين على مساحات من شمالي البلاد في عام 2012.
وأعلن ذلك المتحدث باسم الحكومة يايا سانجاري في بيان على موقع التواصل الاجتماعي تويتر،حسبما ذكرت وكالة بلومبرج اليوم السبت.
وقال البيان ""إن تعزيزات تم الدفع بها إلى موقع الجيش في انديليماني قرب حدود النيجر،عثرت على 54 جثة ، بما في ذلك مدني واحد  وابلغت عن اضرار مادية جسيمة"".
كان مسؤولون قد صرحوا في وقت سابق اليوم السبت بان 35جنديا قد قتلوا في الهجوم.
وقال الجيش المالي في بيان على موقعه اليوم السبت إن الغارة، التي يعتقد أن مسلحين إسلاميين هم الذين نفذوها، وقعت في وقت مبكر يوم الجمعة في قاعدة بمنطقة اندليماني، في شمال البلاد على الحدود مع النيجر.
ويأتي هذا الهجوم في أعقاب هجوم آخر أسفر عن مقتل 38 جنديا ماليا في موقعين عسكريين في أوئل الشهر الماضي. ويعتقد أن مسلحين إسلاميين كانوا وراء الهجوم أيضا.
وتعرضت منطقة وسط وشمال مالي لأعمال عنف متكررة وهجمات في أعقاب انقلاب عسكري وقع في عام 2012 ، والذي شهد سيطرة جماعات متمردة انفصالية وفي وقت لاحق مسلحين مرتبطين بتنظيم القاعدة على المنطقة.
وساعدت العمليات التي قامت بها قوات عسكرية فرنسية وإفريقية فضلا عن جهود جيش مالي في طرد المسلحين واستعادة سيطرة الحكومة على المنطقة، إلا أن أنشطة المتمردين والعمليات العسكرية مستمرة في المنطقة على الرغم من التوقيع على عدة اتفاقيات سلام.
وكان الجيش قد قال أمس الجمعة عبر تويتر إن ""هجوما إرهابيا استهدف الجمعة موقعا عسكريا في انديليمان في منطقة ميناكا، وأسفر عن مقتل 15 جنديا بحسب حصيلة غير نهائية"".
ويأتي ذلك بعد شهر من مقتل أربعين جنديا في هجومين جهاديين في 30 سبتمبر/أيلول والأول من أكتوبر/تشرين الأول قرب بوركينا فاسو الواقعة جنوب مالي، بحسب مسؤول في وزارة الدفاع.
وأضاف الجيش إن ""هجوم الجمعة أسفر عن جرحى وأضرار مادية""، لافتا إلى إرسال تعزيزات إلى المنطقة المستهدفة.
وقال مصدر عسكري إن ""جنودا ماليين فقدوا الجمعة"". وحتى بعد الظهر لم تتبن أي جهة الهجوم.
وسيطر جهاديون مرتبطون بتنظيم القاعدة على شمال مالي في ربيع 2012، لكن تدخلا عسكريا بادرت إليه فرنسا في يناير/كانون الثاني 2013 ولا يزال مستمرا أدى إلى طرد القسم الأكبر من الجهاديين.
غير أن الهجمات الجهادية تواصلت واتسع نطاقها من شمال مالي إلى وسطها ثم إلى بوركينا فاسو والنيجر المجاورتين.

مقالات ذات صلة






",ar,"











Death toll from al - Qaeda attack on Malian army
Armed militias affiliated to al-Qaeda reinforce their threats of a more deadly attack on members of the Malian army.

02 Nov 2019

BAMAKO - Victims of Friday's attack on an army post in eastern Mali on Friday rose to 54, making it one of the deadliest attacks on security forces since separatists and Islamist rebels seized areas of the north of the country in 2012.
Government spokesman Yaya Sanjari made the announcement in a statement on the social networking site Twitter, Bloomberg reported Saturday.
""Reinforcements pushed to the army post in Andelimani, near the Niger border, found 54 bodies, including one civilian, and reported serious material damage,"" the statement said.
Earlier on Saturday, officials said 35 soldiers were killed in the attack.
The raid, believed to have been carried out by Islamic militants, took place early on Friday at a base in the northern region of Andlemani, on the border with Niger, the Malian army said in a statement on its website on Saturday.
The attack follows another attack that killed 38 financial soldiers at two military posts early last month. Islamic militants were also believed to have been behind the attack.
Central and northern Mali have been the scene of repeated violence and attacks following a military coup in 2012, which saw the secession of rebel groups and later al Qaeda-linked militants.
Operations by French and African military forces, as well as efforts by the Malian army to drive out the militants and regain government control of the area, have helped rebel activities and military operations in the region despite the signing of several peace agreements.
On Friday, the military said on Twitter that ""a terrorist attack on Friday targeted a military post in Andeliman in the region of Menaka, killing 15 soldiers, according to an untold toll.""
This comes a month after 40 soldiers were killed in two jihadist attacks on September 30 and October 1 near Burkina Faso, south of Mali, a defense ministry official said.
The army added that ""Friday's attack resulted in injuries and material damage,"" pointing to send reinforcements to the target area.
""Malian soldiers went missing on Friday,"" a military source said. No one claimed responsibility for the attack.
Al-Qaeda-linked jihadists took control of northern Mali in the spring of 2012, but a military intervention initiated by France in January 2013 continues and has driven most of the jihadists out.
However, jihadist attacks have continued and expanded from northern Mali to the center and then to neighboring Burkina Faso and Niger.

Related articles






"
