,src,lang,text
0,"











Atletico Tucumán ganó y se acercó a lo primeros puestos
02 Nov 2019 by Redacción Diario de Cuyo
Atlético Tucumán consiguió un triunfo por 2-0 ante Colón en Santa Fe, se subió a los primeros puestos de la tabla en la undécima fecha de la Superliga  y está entre los clasificado a la próxima Copa Sudamericana. 
Bajo una intensa lluvia, El Decano se encontró con un conjunto sabalero repleto de suplentes debido a que en la próxima semana tendrá por delante el gran desafío de disputar su primera final internacional frente a Independiente del Valle. Debido a esto, Augusto Lotti y Javier Toledo aprovecharon la oportunidad y marcaron para que el equipo tucumano se lleve unos tres puntos importantes. 
En la próxima jornada, Atlético visitará a Unión para seguir subiendo en la tabla buscando lo primeros puestos y conseguir su quinta victoria consecutiva. Por otro lado, el encuentro del conjunto santafesino ante Arsenal fue reprogramado para el viernes 13 de diciembre debido a la final sudamericana. 


",fa,"










Today's highlights: From Trump's cake and North Korean leader to Thailand's biggest hamburger
02 Nov 2019 by Asr Iran


Attack of a wild elephant on a tourist's car at a wildlife park in Thailand. The driver fled after the elephant attack and was not injured. / AFP



Iraqis continue protest in Baghdad's Tahrir Square / AFP / Associated Press






Manila National Cemetery Philippines Philippines on the Day of the Dead / Getty Images



Anti-government protests of Pakistan's Islamic Jamaat Party in Islamabad / AFP



Donald Trump cake and Kim Jong-un (North Korean leader) at the 3-day International Cake and Pastry Exhibition in Birmingham, United Kingdom / The Guardian



International Cake Fair in Birmingham, United Kingdom / The Guardian



Discovery of a trafficked tiger from Italy inside a truck on the Belarusian / EPA border



Forest fires in the US state of California / Associated Press






Thailand's Largest 6kg Burger Launched at a Restaurant in Bangkok / Reuters






150 students sit in Spain's ""Catalonia"" district demanding release of independence leaders from Spain's central government prison / EPA



First snow fall in Moscow / AFP



"
