,src,lang,text
0,"











Водитель легковушки насмерть сбил пешехода на переходе

Водитель не скрылся с места происшествия.

07 Nov 2019, 09:13 by Инна Лутовинова
Сегодня рано утром водитель легковушки сбил пешехода на переходе улицы Знаменка, дом №3, сообщает ТАСС со ссылкой на пресс-службу Госавтоинспекции по городу.
Пешеход скончался на месте от полученных травм.


",ru,"











The driver of the car to death knocked down a pedestrian at the crossing

The driver did not escape from the scene.

07 Nov 2019, 09:13 by Inna Lutovinova
This early morning, a driver of a car knocked down a pedestrian at the crossing of Znamenka Street, house number 3, TASS reports citing the press service of the traffic police in the city.
A pedestrian died on the spot from his injuries.


"
