,src,lang,text
0,"











Σε πρώτο πλάνο ο άνθρωπος για τη νέα δημοτική αρχή
Δυναμικό ξεκίνημα από τον Γιώργο Τριάντο

07 Nov 2019, 09:30


Εκατοντάδες είναι οι συμπολίτες μας που έγιναν αποδέκτες των υπηρεσιών που παρέχει η Διεύθυνση Κοινωνικής Πολιτικής και Υγείας του Δήμου της Ρόδου, αυτές τις πρώτες πενήντα ημέρες της νέας δημοτικής θητείας, ανάμεσά τους και είκοσι νοικοκυριά που δεν είχαν στέγη, όπως καταγράφηκε στον απολογισμό που έκανε για αυτό το χρονικό διάστημα και τον οποίο παρουσίασε χθες, αναλυτικά, ο Αντιδήμαρχος Δημόσιας Υγείας και Κοινωνικής Πολιτικής, κ. Γιώργος Τριάντος.

Με τίτλο «τις τελευταίες πενήντα ημέρες…» και τη βοήθεια προτζέκτορα, ο Αντιδήμαρχος, μαζί με στελέχη της υπηρεσίας, χθες το μεσημέρι, προέβη στην παρουσίαση συγκεριμένων στοιχείων για τους συμπολίτες μας που έκαναν χρήση των υπηρεσιών κοινωνική μέριμνας και πρόνοιας που παρέχει ο Δήμος της Ρόδου και οι αριθμοί καταδεικνύουν ότι πίσω από τη Ρόδο της ευμάρειας υπάρχει μία «άλλη» η οποία έχει ανάγκη μεγάλης στήριξης, σε κάποιες περιπτώσεις ακόμη και για τα απολύτως βασικά. Αναλυτικά:
Οι πρώτες διαπιστώσειςΚαταρχήν, ο κ. Τριάντος θέλησε να ξεκαθαρίσει δεν ήρθαν για ν’ απαξιώσουν ή να ανακαλύψουν τον τροχό. Απεναντίας, πιστεύουν ότι απαιτείται οργάνωση, χρηστή διοίκηση, εξωστρέφεια και κυρίως αξιοποίηση των ανθρώπινων και οικονομικών πόρων.
Είναι αλήθεια-συνέχισε-ότι στα κοινωνικά θέματα βρήκαν δομές και υπηρεσίες. Εξάλλου, όλοι το ξέρουμε ότι ο Δήμος μας, εδώ και πολλά χρόνια, ήταν πάντα πρωτοπόρος στα θέματα αλληλεγγύης. Όμως, όπως τόνισε, χρειάζονται να γίνουν ακόμη πολλά, γιατί οι ανθρώπινες ανάγκες δεν σταματούν ποτέ, με κύριο ζητούμενο την καλυτέρευση της ποιότητας ζωής.
«Χρειάζονται τομές», είπε ο Αντιδήμαρχος, χρειάζεται εμπλουτισμός και αναβάθμιση των προνοιακών δομών και κατά συνέπεια και των υπηρεσιών που προσφέρουν, προκειμένου να καλυφθούν οι νέες απαιτήσεις. «Και πάνω από όλα χρειάζεται επικοινωνία με την κοινωνία, με τον άνθρωπο, που πιστέψτε με, πολλές φορές δεν γνωρίζει που πρέπει να απευθυνθεί», είπε.
Στο πλαίσιο αυτό, μάλιστα, το πρώτο πράγμα που δημιούργησαν είναι ο Οδηγός Κοινωνικής πολιτικής της Διεύθυνσης Κοινωνικής Πολιτικής και Υγείας που θεωρούν ότι θα αποτελέσει ένα χρηστικό εργαλείο για όλους, γιατί συνοπτικά και μαζεμένα μπορεί κανείς να δει τις υπηρεσίες που προσφέρονται από την κοινωνική υπηρεσία, αλλά και τα δικαιολογητικά που απαιτούνται για τα 18 διαφορετικά επιδόματα που παρέχει. Ο Οδηγός σε λίγες μέρες θα αναρτηθεί και στην Ιστοσελίδα του δήμου ώστε ο καθένας να έχει πρόσβαση σε αυτόν.

Οι υπηρεσίες σε αριθμούς

Στη συνέχεια, ο κ. Τριάντος ανέφερε ότι από το Τμήμα Κοινωνικής Πρόνοιας και το Κέντρο Κοινότητας της Διεύθυνσης, τις τελευταίες 50 μέρες, εξυπηρετήθηκαν 1.761 άτομα. Επιπλέον, μοιράστηκαν σε 850 περίπου ωφελούμενους του ΚΕΑ δυο φορές τρόφιμα από το πρόγραμμα ΤΕΒΑ και μια φορά, με την έναρξη της σχολικής χρονιάς, σχολικά είδη (γραφική ύλη, σχολικές τσάντες και αθλητικές φόρμες) σε 300 περίπου παιδιά. Διανομές πραγματοποιήσαμε και στη Σύμη, που είναι εταίρος του Δήμου στο πρόγραμμα του ΤΕΒΑ.Συνολικά πραγματοποιήθηκαν 11 έρευνες και βεβαιώσεις αστεγίας, 10 συνεδρίες ψυχολογικής στήριξης, 3 κοινωνικής στήριξης και 70 αποφάσεις δωρεάν φαρμακευτικής περίθαλψης ανασφαλίστου. Επίσης, ολοκληρώσαμε την εργασιακή συμβουλευτική στο πλαίσιο υλοποίησης του Πιλοτικού Προγράμματος Διασύνδεσης Ωφελουμένων του Κ.Ε.Α. με υπηρεσίες ενεργοποίησης και συγκεκριμένα με την διασύνδεσή τους με την τοπική υπηρεσία του ΟΑΕΔ.

Νέες δομέςΣτο Δημοτικό Συμβούλιο κατέθεσαν σχετική πρόταση και έτσι ξεκίνησαν και επίσημα την επέκταση των Δομών του Κέντρου Κοινότητας, του οποίου ο προϋπολογισμός έφτασε στο 1.850.000€ έως το 2023. Στα μέσα της νέας χρονιάς θα λειτουργήσουν τρεις νέες Δομές, με 7 νέες προσλήψεις μέσω ΑΣΕΠ.
Συγκεκριμένα:
1. Το Κέντρο Στήριξης Οικογένειας (ΚΣΟΙ) για την υποστήριξη των οικογενειών, που αντιμετωπίζουν πρόβλημα (κακοποίηση, δυσαρμονία σχέσεων γονέων-παιδιών, προβλήματα προσαρμογής των παιδιών στο σχολικό περιβάλλον και τη μαθησιακή διαδικασία κ.λπ.), συμβάλλοντας με τον τρόπο αυτό στην πρόληψη της ιδρυματοποίησης και επιδρώντας θετικά στην αντιμετώπιση της υπογεννητικότητας Θα προσλάβουν έναν κοινωνικό λειτουργό και έναν παιδοψυχολόγο και ελλείψει αυτού έναν ψυχολόγο.
2. Θα υλοποιήσουν το Ολοκληρωμένο σύστημα Πρωτοβάθμιας Φροντίδας για Ηλικιωμένους (Ο.Φ.ΗΛΙ.) για τις τρεις μορφές φροντίδας (ΚΑΠΗ, ΚΗΦΗ, Βοήθεια στο Σπίτι) των ατόμων της τρίτης και τέταρτης ηλικίας που υπάρχουν σήμερα μέσω της πρόληψης ενός κοινωνικού λειτουργού κι ενός ψυχολόγου. 3. Τέλος, θα λειτουργήσουν Δομή Επαγγελματικής Συμβουλευτικής και Ενδυνάμωσης Ευάλωτων Κοινωνικών Ομάδων για να μπορέσουν να υλοποιήσουν ολοκληρωμένες δράσεις/παρεμβάσεις για ευπαθείς ομάδες (συμβουλευτική, mentoring, επαγγελματικός προσανατολισμός, απασχόληση, κατάρτιση, ευαισθητοποίηση, δημοσιότητα κ.λπ.). Στόχος, η προώθηση της ισότητας των ευκαιριών και της ενεργής συμμετοχής μέσω της απασχολησιμότητας. Στη δομή θα προσλάβουν έναν κοινωνιολόγο, έναν λογιστή και ένα νηπιαγωγό Ειδικής Αγωγής.
Μέριμνα για τους άστεγουςΕπίσης, έφτιαξαν ένα σποτάκι για το πρόγραμμα «Στέγαση και Εργασία για αστέγους»-ο Δήμος της Ρόδου είναι ο δεύτερος στην Ελλάδα που το υλοποιεί- το οποίο σε λίγες μέρες θα αρχίσει να προβάλλεται στον τηλεοπτικό σταθμό Θάρρι. Το «Στέγαση» είναι ένα σπουδαίο πρόγραμμα που έδωσε την ευκαιρία σε 20 άστεγα νοικοκυριά να επιλύσουν το στεγαστικό τους πρόβλημα, να ενδυναμωθούν και να ενταχθούν ομαλά ξανά στον κοινωνικό ιστό.
Σημειώνεται ότι το πρόγραμμα αυτό προβλέπει επιχορήγηση όσο αφορά στην κατοικία, το ενοίκιο, τους λογαριασμούς, την επίπλωση της κατοικίας (σ.σ. τα απαραίτητα είδη) και την ενίσχυσή των συμπολιτών μας αυτών ώστε να μπορέσουν να ξεκινήσουν μία δική τους μικρή επιχείρηση. Όπως είπε ο Αντιδήμαρχος, πρόκειται για ένα πολύ καλό πρόγραμμα και στόχος τους είναι να το συνεχίσουν και να το επεκτείνουν.
Για την τρίτη ηλικίαΚαταρχήν, στο πλαίσιο της Παγκόσμιας Ημέρας Τρίτης ηλικίας πραγματοποίησαν εκδρομή στη Χάλκη (σ.σ. ο Αντιδήμαρχος ευχαρίστησε τον κ. Γιώργο Σπανό και τη Dodekanisos Seaways). Παράλληλα, τα ΚΑΠΗ του Δήμου συνεχίζουν τα 20 διαφορετικά προγράμματά τους, Το ΚΗΦΗ με τους 15 ωφελούμενους, πραγματοποίησε ημερήσια εκδρομή στο νησί, φιλοξένησε τους μαθητές του νηπιαγωγείου Κοσκινού με τους οποίους συναναστράφηκαν οι ηλικιωμένοι, συνεχίστηκαν οι δημιουργικές κατασκευές, οι ομιλίες και οι καθημερινές νοσηλευτικές φροντίδες.
Στις 50 μέρες αυτές μέρες το πρόγραμμα «Βοήθεια στο σπίτι» στους 450 ωφελούμενους του πρόσφερε: 435 ατομικές συνεδρίες, 993 υπηρεσίες νοσηλευτικής φροντίδας, 704 συνοδείες/διαμεσολαβήσεις με φορείς, 415 μετακινήσεις, 1079 κοινωνικές συναναστροφές, 218 αγορές ειδών πρώτης ανάγκης, 326 υπηρεσίες υγιεινής και καθαριότητας οικίας και 154 ενημερώσεις για παροχές που δικαιούνται. Ακόμη, κατέθεσαν πρόταση στο δ.σ. για την πρόσληψη στο άμεσο μέλλον ενός γιατρού παθολόγου και ενός φυσικοθεραπευτή, προκειμένου να εμπλουτίσουν τις προσφερόμενες υπηρεσίες. Επίσης, μέσα στο Νοέμβριο, δρομολογούν την διοργάνωση 8 ημερίδων στο πλαίσιο του Εθνικού Προγράμματος Πρόληψης και Προαγωγή των Ηλικιωμένων Ατόμων Ηπιόνη του Υπουργείου Υγείας. Συγκεκριμένα θα επισκεφτούν τα ΚΗΦΗ, τα ΚΑΠΗ, το Ασκληπειό, τις Καλυθιές, τον Έμπωνα, την Κρεμαστή, την Ιαλυσό και τα Αφάντου.
Για την ταφή απόρωνΣε ένα «ευαίσθητο» πρόβλημα αναφέρθηκε στη συνέχεια ο Αντιδήμαρχος, το οποίο αφορά στην ταφή των οικονομικά αδύναμων και των αστέγων συμπολιτών μας, μια και στο παρελθόν, σε εξαιρετικές περιπτώσεις, υπήρξαν περιστατικά που παρέμειναν για αρκετές ημέρες στο νοσοκομείο αφού και μετά θάνατο ήταν μόνοι. Όπως έκανε γνωστό, λοιπόν, μερίμνησαν και το πέρασαν από το δ.σ., για αυτές τις πολύ σπάνιες και ειδικές περιπτώσεις, να θάβονται με έξοδα από ίδιους πόρους του Δήμου.
Κοινωνία των πολιτώνΣτο σχεδιασμό τους εντάσσεται, ακόμη, και ένα άνοιγμα προς την Κοινωνία των Πολιτών. Όπως είπε ο κ. Τριάντος, σκοπός τους είναι να επεκτείνουν και σε άλλες δράσεις την Κοινωνική Σύμπραξη της Περιφερειακής Ενότητας Ρόδου, προκειμένου να υποστηρίξουν τα μικρά νησιά σε θέματα κοινωνικής πολιτικής τα οποία στερούνται δομών. Ακόμα, επιθυμούν να επεκτείνουν το Δίκτυο Κοινωνικής Αλληλεγγύης σε ολόκληρο το νησί. Όπως επίσης, να αξιοποιήσουν την ακίνητη περιουσία προς όφελος των δημοτών.
Για τον ΔΟΠΚάνοντας και τον απολογισμό των δράσεων του ΔΟΠ αυτές τις πενήντα πρώτες ημέρες, ο Αντιδήμαρχος ανέφερε, μεταξύ άλλων, δέχθηκαν 17 αιτήσεις οικονομικά αδυνάτων συμπολιτών μας, αφού συνεχώς κατατίθενται αιτήματα για έκτακτη οικονομική ενίσχυση και επιδόματα. Καθημερινά συνεχίζεται η χορήγηση συσσιτίου σε 146 οικονομικά αδύναμους συμπολίτες μας, που είναι επί δύο μερίδες την ημέρα, όπως επίσης έγιναν 9 καινούργιες αιτήσεις για το συσσίτιο και επανέλεγχος 26 καινούργιων. Ακόμη, έκαναν τρεις κοινωνικές έρευνες, συγκέντρωση τροφίμων για το πρόγραμμα σίτισης από 18 δωρητές, συνεργάστηκαν με το παράρτημα του Ερυθρού Σταυρού και δόθηκαν σχολικά είδη, ιματισμός και τρόφιμα σε 17 οικογένειες που εξυπηρετούνται από την κοινωνική υπηρεσία. Επίσης, ο ΔΟΠ ανταποκρίθηκε στο αίτημα του Κεντρικού Λιμεναρχείου Ρόδου για την παροχή γευμάτων στους μετανάστες και τους πρόσφυγες που φιλοξενούνται εκεί.
Παράλληλα, το Τμήμα Υγειονομικών Υπηρεσιών συνεχίζει τη λειτουργία των έξι δημοτικών ιατρείων από τα οποία εξυπηρετήθηκαν στο διάστημα αυτό 1900 άτομα.Στο Τμήμα προσχολικής αγωγής έχουν δύο σταθμούς, ο ένας είναι ο γνωστός της Καβαρινού και ο άλλος είναι στο κοινωνικό προσχολικό κέντρο Αγίων Αποστόλων που φιλοξενούνται γύρω στα 40 παιδιά και 16 νήπια αντίστοιχα. Στο Κέντρο συμβουλευτικών υπηρεσιών παιδιών και εφήβων στελεχωμένο με επιστημονική υπηρεσία, πραγματοποιήθηκαν 320 συνεδρίες, ενημερωτικές ομιλίες σε παιδικούς σταθμούς, νηπιαγωγεία και σχολεία από ψυχολόγους. Τέλος συνεχίστηκε η πράξη-παροχής συσσιτίου και κοινωνικού φαρμακείου.
Ακόμη, ένα πρόβλημα με το οποίο ασχολήθηκαν είναι το θέμα των οικογενειών με παιδιά ΑμΕΑ, που χρειάστηκε πολλές φορές να μετακινηθούν εκτός Ρόδου για να πάρουν τα πιστοποιητικά και τα υπόλοιπα δικαιολογητικά. Σύμφωνα με τον κ. Τριάντο, ήδη μέσα στον καινούργιο σχεδιασμό και τις νέες προσλήψεις, ως Διεύθυνση, φρόντισαν ώστε να υπάρχει ειδικότητα ενός παιδοψυχολόγου ή ελλείψει αυτού ενός αναπτυξιολόγου που είναι υπεύθυνοι για να δίνουν αυτές τις βεβαιώσεις ώστε πλέον να μη χρειάζεται να μεταβαίνουν στην Αθήνα γι’ αυτές τις υποθέσεις ενώ ανάλογη κίνηση έχει γίνει και από τις Σχολικές Επιτροπές και το κενό αυτό θα καλυφθεί.
Αναφέρθηκε επίσης και στο πρόβλημα που αντιμετώπισαν με το κοινωνικό φαρμακείο το οποίο δεν λειτουργεί εδώ και κάποιες μέρες. Πράγματι, είπε ο Αντιδήμαρχος, υπήρξε διακοπή ρεύματος αφού το πρόβλημα είναι σύνθετο και τώρα βρίσκονται στην επίλυσή του. Όπως εξήγησε, το οίκημα δεν ανήκει στον Δήμο αλλά στον πρώην Οργανισμό Εργατικής Κατοικίας που το είχε παραχωρήσει ωστόσο η σύμβαση αυτή είχε λήξει. Τον Απρίλιο αποφασίστηκε να μετακομίσει στο νέο Ροδίνι αλλά αποδείχθηκε ότι το κτίριο δεν άνηκε στον Δήμο με αποτέλεσμα να γίνει διακοπή ρεύματος από τον ΔΕΔΔΗΕ. Όταν πήγαν να κάνουν τις ενέργειες για επανασύνδεση διαπίστωσαν ότι δεν είχε γίνει ανανέωση του συμβολαίου, έγιναν οι κατάλληλες ενέργειες και εντός των ημερών πήραν διαβεβαίωση ότι θα λυθεί ενώ οι Τεχνικές Υπηρεσίες προέβησαν στις απαιτούμενες ενέργειες και το ιατρείο αναμένεται να λειτουργήσει εντός των ημερών.
Τέλος, από την έρευνα που έκαναν στις δομές, υπάρχουν προβλήματα με την κατάσταση των κτιρίων που στεγάζουν υπηρεσίες της Διεύθυνσης Κοινωνικής Πολιτικής, όπως είναι το ΚΗΦΗ στα Κοσκινού, το ΚΑΠΗ της Ιαλυσού, σε λιγότερο βαθμό το ΚΑΠΗ του Αγίου Ιωάννη κ.α. και ήδη έχουν βάλει τις παρεμβάσεις στο πρόγραμμα. Πρόβλημα υπάρχει και με το προσχολικό κέντρο στους Αγίους Αποστόλους αφού δεν μπορούν να προχωρήσουν στην πυρασφάλεια γιατί υπάρχει εμπλοκή με το ιδιοκτησιακό καθεστώς.








",el,"











In the foreground man about the new municipal authority
Dynamic start by George Triantos

07 Nov 2019, 09:30


Hundreds are our fellow citizens who have received the services provided by the Department of Social Policy and Health of the Municipality of Rhodes during the first fifty days of the new municipal term, including twenty homeless households, as recorded in a report for this time and which was presented yesterday, in detail, by the Deputy Mayor of Public Health and Social Policy, Mr. George Triandos.

Under the heading ""in the last fifty days ..."" and with the help of a projector, the Vice Mayor, together with service executives, yesterday presented specific information about our fellow citizens who made use of the social and welfare services provided by its municipality. Rhodes and numbers show that behind Rhodes of prosperity there is another ""one"" that needs a great deal of support, in some cases even for the most basic. Analytically:
First findings: First of all, Mr. Triandos wanted to make clear they did not come to dismantle or discover the wheel. On the contrary, they believe that organization, sound administration, extroversion and above all human and financial resources are needed.
It is true - he continued - that on social issues they found structures and services. After all, we all know that our Municipality has for many years always been a pioneer in solidarity. But, as he stressed, much more needs to be done, because human needs never stop, with the primary focus on improving the quality of life.
""They need cuts,"" the deputy mayor said, adding that the welfare structures and consequently the services they offer need to be enriched and upgraded to meet the new requirements. ""And most of all it takes communication with society, with the man you believe in, many times he doesn't know where to turn,"" he said.
In this context, the first thing they created is the Social Policy Guide of the Directorate of Social Policy and Health which they consider to be a useful tool for everyone, because one can summarize and see the services offered by the social service, but also the supporting documents required for the 18 different bonuses he provides. The Guide will also be posted on the Municipal Website in a few days so that everyone can access it.

Services in numbers

Afterwards, Mr. Triandos said that 1,761 people have been served by the Department of Social Welfare and the Center's Community Center over the past 50 days. In addition, approximately 850 KEA beneficiaries distributed food twice under the TEVA program and once, at the beginning of the school year, school supplies (stationery, school bags and sportswear) to approximately 300 children. We also distributed to Symi, which is a partner of the Municipality in the TEVA program. Altogether 11 homelessness surveys and certificates, 10 psychological support sessions, 3 social support sessions, and 70 free uninsured pharmaceutical decisions were made. We also completed job counseling as part of the implementation of the Beneficiary Interconnection Pilot Program. with activation services and in particular with their interconnection with the local OAED service.

New structuresThe City Council submitted a proposal to this effect and officially began the expansion of Community Center Structures, with a budget of € 1,850,000 by 2023. Three new Structures will operate in the middle of the new year, with 7 new hires through ASEP.
Specifically:
1. The Family Support Center (JSD) to support families who are experiencing problems (abuse, parent-child relationship disharmony, problems of adapting children to the school environment and learning process, etc.), thereby contributing to preventing institutionalization and positively affecting birth control They will hire a social worker and a child psychologist and if not a psychologist.
2. Implement the Integrated Primary Care System for the Elderly for the three types of care (KAPI, KIFI, Homework Assistance) available today to the elderly and the elderly through the prevention of a social worker and of a psychologist. 3. Finally, a Vocational Counseling and Empowerment Structure for Vulnerable Social Groups will be set up to enable them to implement integrated actions / interventions for vulnerable groups (counseling, mentoring, career guidance, employment, training, awareness, publicity). The aim is to promote equality of opportunity and active participation through employability. The structure will employ a sociologist, an accountant and a special education teacher.
Caring for the homeless They also made a splash for the program ""Housing and Work for the Homeless"" - the municipality of Rhodes is the second in Greece to implement it - which will start airing in the Tharri television station in a few days. Housing is a great program that gave 20 homeless families the opportunity to solve their housing problem, empower and re-integrate into the social fabric.
It should be noted that this program provides for a grant in respect of housing, rent, bills, home furnishings (essentials) and the support of our fellow citizens so that they can start their own small business. As the Deputy Mayor said, this is a very good program and their goal is to continue and expand it.
For the Elderly Age In principle, in the context of the World Elderly Day, they made a trip to Halki (ed. The Vice Mayor thanked Mr. George Spanos and the Dodekanisos Seaways). At the same time, KAPI of the Municipality continues their 20 different programs, KIFI with its 15 beneficiaries, took a day trip to the island, hosted the students of the Koskinos kindergarten with whom the elderly collaborated, the creative activities continued, the creative constructions continued, care.
During these 50 days, the Home Help program offered its 450 beneficiaries: 435 individual sessions, 993 nursing services, 704 companions / mediators, 415 relocations, 1079 social gatherings, 218 essentials, 326 services and home cleaning and 154 entitlement benefit updates. In addition, they submitted a proposal to the BoD. for the hiring of a physician physician and a physiotherapist in the near future to enrich the services offered. Also, in November, they are launching an 8-day event within the Ministry of Health's National Program for the Prevention and Promotion of Elderly People. Specifically you will visit KIFI, KAPI, Asklepios, Kalythies, Embonas, Kremasti, Ialyssos and Afantou.
For the burial of deprived persons A ""sensitive"" problem was subsequently reported by the Vice Mayor, referring to the burial of our financially weak and homeless fellow citizens, as in the past, in exceptional cases, there were incidents that remained in the hospital for several days afterwards. death was lonely. As it became known, therefore, they arranged and passed it on to the Bureau, for these very rare and special cases, to be buried at the expense of the Municipality's own resources.
Civil societyEven in their design, there is an openness to Civil Society. As Mr Triandos said, their aim is to extend to other actions the Social Partnership of the Rhodes Regional Unity, in order to support the small islands in social policy issues that lack structures. Still, they want to extend the Social Solidarity Network to the whole island. Also, make use of real estate for the benefit of the citizens.
On the ICOB and taking stock of the IOB's actions over the first fifty days, the Vice Mayor said, among other things, that he had received 17 applications from our financially weak fellow citizens, as requests for extraordinary financial support and allowances were constantly being filed. The daily supply of food to our 146 economically feeble fellow citizens continues for two portions a day, as well as 9 new requests for food and the re-audit of 26 new ones. In addition, they conducted three social surveys, collected food for the 18-donor food program, worked with the Red Cross Branch and provided school supplies, clothing, and food to 17 families served by the social service. The IOC also responded to a request from the Central Port Authority of Rhodes to provide meals to migrants and refugees hosted there.
At the same time, the Department of Health Services continues to operate the six municipal clinics of which 1900 persons were served during this period. In the Department of Preschool there are two stations, one is known as Kavarinos and the other is in the Saint Apostoli Social Preschool Center. around 40 children and 16 toddlers respectively. The Science and Adolescent Counseling Services Center hosted 320 sessions, informative lectures in kindergartens, kindergartens and schools of psychologists. Finally, the supply of food and social pharmacy continued.
Another problem they dealt with is the issue of families with children with disabilities, who often had to move out of Rhodes to obtain their certificates and certificates.other supporting documents. According to Mr. Trianto, already in the new design and new hires, as Directorate, they have made sure that there is a specialty of a child psychologist or, in the absence of that, a developmentalist who is responsible for giving these certifications so that they no longer have to move to Athens. for these cases while similar action has been taken by the School Committees and this gap will be filled.
He also referred to the problem they had with the social pharmacy which has not been operating for some days. Indeed, the Deputy Mayor said, there has been a power failure since the problem is complex and they are now resolving it. As he explained, the property does not belong to the Municipality but to the former Workers' Organization which had granted it but the contract had expired. In April it was decided to move to the new Rodini but it turned out that the building did not belong to the Municipality and as a result the power was cut off by DEDDIE. When they went to reconnect, they found that the contract had not been renewed, appropriate action was taken and within days they were assured that it would be resolved while the Technical Services took the required action and the clinic was expected to operate within days.
Finally, from the research done on the structures, there are problems with the condition of buildings housing the Social Policy Directorate, such as KIFI in Koskinou, KAPI of Ialyssos, to a lesser extent KAPI of Agios Ioannis et al. and already have the interventions in the program. There is also a problem with the pre-school center in the Holy Apostles since they cannot go on fire because there is a blockage with ownership.








"
