,src,lang,text
0,"











Челябинцам предложили решить судьбу автовокзала «Центральный»

07 Nov 2019, 09:32

В Челябинске началось голосование по поводу судьбы автовокзала «Центральный», расположенного у Дворца спорта «Юность».
Как передает корреспондент РИА «Новый День», идея открыть автовокзал на площадях дворца спорта возникал у городских властей весной 2011 года, когда обострился конфликт между тогдашним губернатором Михаилом Юревичем и Артуром Никитным – владельцем ТРК «Синегорье», на площадях которого размещался автовокзал «Южный».
Было решено разделить рейсы, обслуживаемые «Южным» на две части – чтобы одни отправлялись от автостанции на улице Блюхера, а другие – от ДС «Юность», ко дворцу спорта решили перенести и автовокзал «Северный», а его площади продать. Сейчас там располагается магазин и автостоянка.
Автовокзал «Центральный» был открыт в июле 2011. Ни горожанам, ни приезжим он не понравился из-за неудобной схемы общественного транспорта. Особенно не повезло транзитным пассажирам, которым нужно было добираться до железнодорожного вокзала и аэропорта.
В 2014 году работу автостанции в ТК «Синегорье» возобновили.
С тех пор вопрос целесообразности существования автовокзала у «Юности» поднимался неоднократно. В августе текущего года было даже организовано голосование, принять в котором смогли все желающие. И тогда большинство респондентов высказалось за сохранение станции на прежнем месте.
Но, возможно, в мэрии уже созрел новый проект, и итоги голосования объявлены непоказательными:
«Анализ показал, что решение было принято преимущественно не жителями Челябинска и Челябинской области, а населением других регионов, которые в ряде случаев не имеют с Челябинском прямого автобусного сообщения. С учетом результатов анализа, администрация города инициировала повторный опрос, но только для жителей Челябинска», – заявили в администрации Челябинска. При этом статистики, каков процент жителей областного центра в общей массе пассажиров нет.
Проголосовать можно на на портале «Активный житель 74» до 15 ноября.

Челябинск, Ольга Арсентьева

© 2019, РИА «Новый День»
Написать автору или сообщить новостьПодписывайтесь на каналыЯндекс НовостиЯндекс ДзенYouTube


Ссылки по теме





",ru,"











Chelyabinsk citizens were offered to decide the fate of the Central bus station

07 Nov 2019, 09:32

In Chelyabinsk, a vote began on the fate of the Central Bus Station, located near the Youth Palace.
According to RIA Novyi Day correspondent, the city authorities came up with the idea to open a bus station in the sports palace in the spring of 2011, when the conflict between the then governor Mikhail Yurevich and Arthur Nikitny, the owner of Sinegorye shopping mall, which hosted the Yuzhny bus station, was exacerbated. .
It was decided to divide the flights serviced by Yuzhny into two parts — so that some departed from the bus station on Blucher Street, and others departed from the Yunost DC, and they decided to transfer the Severny bus station to the sports palace and sell its area. Now there is a store and a parking lot.
The central bus station was opened in July 2011. Neither the townspeople nor the visitors liked it because of the inconvenient public transport scheme. Particularly unlucky were the transit passengers who needed to get to the train station and airport.
In 2014, the work of the bus station in Sinegorye shopping center was resumed.
Since then, the question of the appropriateness of the existence of a bus station at Yunost has been raised repeatedly. In August of this year, even a vote was organized, in which everyone could take part. And then the majority of respondents spoke in favor of maintaining the station in its former place.
But, perhaps, a new project has already matured at the city hall, and the results of the vote have been declared non-indicative:
“The analysis showed that the decision was made mainly not by residents of Chelyabinsk and the Chelyabinsk region, but by the population of other regions, which in some cases do not have direct bus connections with Chelyabinsk. Based on the results of the analysis, the city administration initiated a second survey, but only for residents of Chelyabinsk, ”the Chelyabinsk administration said. Moreover, statistics on the percentage of residents of the regional center in the total mass of passengers are not.
You can vote on the portal ""Active Resident 74"" until November 15.

Chelyabinsk, Olga Arsentieva

© 2019, RIA ""New Day""
Write to the author or report newsSubscribe to channelsYandex NewsYandex ZenYouTube


Related Links





"
