,src,lang,text
0,"











Нерезиденты увеличили портфель ОВГЗ до рекордных 101 млрд

07 Nov 2019, 09:06


Портфель облигаций внутреннего госзайма (ОВГЗ) Украины в собственности нерезидентов по итогам прошедших 5 ноября аукционов увеличился на 1,07 млрд гривен и достиг исторического максимума – 100,99 млрд гривен.

Об этом свидетельствуют данные НБУ, передают Українські Новини.
С начала текущего года года нерезиденты увеличили вложения в ОВГЗ почти в 16 раз, в том числе их портфель гривневых облигаций вырос с 6,14 млрд гривен до 98,17 млрд гривен.
Объем долларовых ОВГЗ в собственности нерезидентов с начала года увеличился с 0,16 млрд гривен до 2,82 млрд гривен, в евро – с 0,05 млрд гривен до 1,37 млрд гривен (в эквиваленте).
В целом объем ОВГЗ в обращении с начала года увеличился на 6,7% – до 808,01 млрд гривен.
Как сообщали Українські Новини, Минфин в 2018 году привлек в государственный бюджет 65,128 млрд гривен, 3,478 млрд долларов и 503 млн евро за счет размещения облигаций внутреннего государственного займа.
Министерство финансов в январе-сентябре привлекло в государственный бюджет 194,8 млрд гривен, 3,8 млрд долларов и 189 млн евро за счет размещения облигаций внутреннего государственного займа (ОВГЗ).
МВФ опубликовал новый World Economic Outlook (October 2019) [1], где обновил свою оценку прироста долларового эквивалента ВВП Украины в 2018 и 2019 г – до $130,9 и $150,4 млрд.


",ru,"











Non-residents increased OVDPs portfolio to a record 101 billion

07 Nov 2019, 09:06


According to the results of the auctions held on November 5, the portfolio of bonds of the internal state loan (OVDP) of Ukraine in non-residents increased by 1.07 billion hryvnia and reached a historic maximum of 100.99 billion hryvnia.

This is evidenced by the NBU data, Ukrainian News reports.
Since the beginning of this year, non-residents have increased their investments in government bonds by almost 16 times, including their hryvnia bond portfolio increased from 6.14 billion hryvnia to 98.17 billion hryvnia.
The volume of dollar-denominated government bonds held by non-residents since the beginning of the year increased from 0.16 billion hryvnias to 2.82 billion hryvnias, in euros - from 0.05 billion hryvnias to 1.37 billion hryvnias (equivalent).
In general, the volume of government bonds in circulation since the beginning of the year increased by 6.7% - up to 808.01 billion hryvnias.
As Ukrainian News reported, in 2018 the Ministry of Finance raised UAH 65.128 billion, $ 3.488 billion and EUR 503 million from the state budget through the placement of domestic government loan bonds.
The Ministry of Finance in January-September attracted 194.8 billion hryvnias, 3.8 billion dollars and 189 million euros to the state budget through the placement of bonds of the internal state loan (OVDP).
The IMF published a new World Economic Outlook (October 2019) [1], where it updated its estimate of the growth in the dollar equivalent of Ukraine’s GDP in 2018 and 2019 to $ 130.9 and $ 150.4 billion.


"
