,src,lang,text
0,"











وصفة صحية لمساعدتك في حرق الدهون
04 Nov 2019, 12:36 by almowaten translator
المواطن- ترجمة: منة الله أشرف 
فقدان الوزن أمر يأمل كثيرون في تحقيقه وهناك طرق مختلفة للقيام بذلك، وكشف خبير تغذية لموقع “Express.co.uk” البريطاني، وصفة صحية تساعد في حرق الدهون وإنزال الوزن.
قال هاري سميث، اختصاصي التغذية، إن الأطعمة الغنية بالبروتين، وتناول وجبات الطعام بانتظام، يساعد على استفادة جسمك من الحمية دون حرمان، وهو الأمر الذي بسببه لا يستطيع الكثيرون الانتظام في حمية غذائية لمدة طويلة.

ماذا يجب أن تأكل؟

وقال “سميث”: “الخطوة الأولى هي زيادة البروتين في نظامك الغذائي، معظمها يأتي من منتجات الألبان والأسماك، وكذلك تناول الغذاء الكامل غير المعلب وغير المعالج، مثل الخضراوات والحبوب والبقوليات”.
وتشمل الأطعمة الغنية بالبروتين اللحوم والأسماك والبيض والجبن والزبادي اليوناني والحليب والخضراوات، والمكسرات.

طريقة حساب السعرات الحرارية

أما الخطوة الثانية فهي حساب حصتك من الوجبة، وهناك طريقة سهلة لذلك، وهي وجود نباتين على الأقل في الوجبة، وبروتين بحجم قبضة اليد.
وأضاف: “الممتع أنه يمكنك زيادة حصتك الغذائية في الطعام، باعتدال، مع الاستمرار في النظام الغذائي، فبإمكانك تناول الأطعمة المفضلة لديك وشربها وفقدان الوزن، طالما أنك لم تستهلك السعرات الحرارية”.
الخطوة الثالثة: هي وزن الجسم مرة واحدة شهريًا، أو استخدام قياسات الشريط أسبوعيًا.
‎وسومحمية‏ صحةفقدان الوزنهل قرأت هذا ؟  متى يحتاج الجسم لحمية ديتوكس.. وما هي أضرارها؟ تعرف على سر النحافة بدون حمية 5 طرق لتخسر وزنك دون حمية أو صالات رياضية حمية الملفوف أحدث طرق الوقاية من سرطان القولون

‎إلغاء الرد

لن يتم نشر عنوان بريدك الإلكتروني.
هذا الموقع يستخدم Akismet للحدّ من التعليقات المزعجة والغير مرغوبة. تعرّف على كيفية معالجة بيانات تعليقك.


",ar,"











A healthy recipe to help you burn fat
04 Nov 2019, 12:36 by almowaten translator
Citizen- Translation: Mennat Allah Ashraf
Losing weight is something many hope to achieve.
Harry Smith, a dietitian, said that high-protein foods, and eating regularly, help your body benefit from diet without deprivation, which is why many can not go on a diet for a long time.

What should I eat?

""The first step is to increase protein in your diet, most of which comes from dairy products and fish, as well as eating whole, unpackaged and unprocessed food, such as vegetables, grains and legumes,"" Smith said.
Protein-rich foods include meat, fish, eggs, cheese, Greek yogurt, milk, vegetables, and nuts.

Calorie calculation method

The second step is to calculate your portion of the meal, and an easy way to do that is to have at least two plants in the meal, and a protein the size of a fist.
""What's fun is that you can increase your food intake, in moderation, while still on the diet. You can eat and drink your favorite foods and lose weight, as long as you don't consume calories.""
Step 3: Body weight once a month, or use tape measurements weekly.
How will I read this? When the body needs a diet detox .. And what are the damages? 5 ways to lose weight without diet or gyms cabbage diet The latest ways to prevent colon cancer

Cancel reply

your e-mail address will not be published.
This site uses Akismet to reduce spam and spam comments. Learn how to process your comment data.


"
