,src,lang,text
0,"











Tres parlamentos fragmentados dentro de América Latina
04 Nov 2019, 18:48 by Carlos Malamud
En las últimas semanas han estallado a diestra y siniestra distintos conflictos y movilizaciones populares en diferentes países de América Latina. Inclusive en Bolivia, que celebró elecciones presidenciales y parlamentarias el pasado 20 de octubre las denuncias de fraude y las protestas posteriores crearon un clima de violencia semejante al existente en otras latitudes.
Sin embargo, este no fue el caso de Argentina y Uruguay, que tuvieron sus comicios presidenciales y parlamentarios el último domingo de octubre, aunque con un desenlace muy diferente en cuanto al reconocimiento de sus resultados. No solo eso. Durante toda la fase previa, pese a las grandes dificultades económicas argentinas, los dos países rioplatenses estuvieron exentos de brotes de violencia. Es una excepción remarcable en la realidad regional y merece algún tipo de explicación.
En momentos como este, cuando todos estos brotes de descontento se leen como renovados ataques contra la estabilidad y la supervivencia de la democracia liberal y representativa, quizá sea conveniente preguntarse por la importancia que tienen unos procesos electivos con suficientes garantías de imparcialidad y una presencia importante de partidos u otras organizaciones políticas.
Pese a la derrota, el partido de Macri conserva una posición de cierta fortaleza
Bolivia, Argentina y Uruguay son los últimos procesos electorales del intenso ciclo que vivió América Latina entre mediados de 2017 y fines de 2019: 14 elecciones presidenciales que han generado una realidad mucho más heterogénea y compleja. En contra de lo imaginado, no se produjo en la región ningún giro a la derecha, como muestran los triunfos de Evo Morales y Alberto Fernández. Inobjetable el último, plagado de sospechas y acusaciones el primero.
Mientras, la incertidumbre uruguaya permanece. Daniel Martínez, el candidato del gobernante Frente Amplio no habría superado el 40% de los votos, una cantidad muy alejada del 50% necesario para evitar la segunda vuelta. Es más, las primeras negociaciones entre Luis Lacalle Pou, el candidato del Partido Nacional que competirá con Martínez en el balotaje, y los restantes referentes opositores (Ernesto Talvi del Partido Colorado y Guido Manini Ríos de Cabildo Abierto) han sentado las bases para una amplia alianza con serias opciones de triunfo. Concluirían así los tres mandatos consecutivos, 15 años, del iz-quierdista Frente Amplio.
En Argentina y pese a la remontada de Mauricio Macri, la ventaja inicial del peronismo/kirchnerismo era tal que fue imposible forzar una segunda vuelta. Pese a ello la distancia entre Macri y Fernández respecto a las primarias (las PASO) se acortó profundamente. El resultado, un 48.03% para Fernández y un 40.44% para Macri, ha dejado, pese a su contundencia sensaciones contradictorias y en algún caso un cierto regusto amargo. Algo normal cuando se esperaban 15 puntos de diferencia.
Lo paradójico es que al no haber pasado Fernández del 50% de los votos, sus opciones de reforzar su base de poder ha disminuido, lo que de alguna manera revertirá en una gobernabilidad más compleja en este delicada coyuntura. La buena elección de Cambiemos, pese a la derrota, le otorga una posición de mayor fortaleza relativa (es la primera minoría en la Cámara de Diputados y tiene un grupo parlamentario considerable en el Senado) y con mejores opciones de controlar al nuevo gobierno. Lo que se gana por un lado se pierde por el otro.
El MAS de Morales no podrá aportarle a su jefe de filas las tremendas mayorías que le garantizaron un gobierno sin problemas en los mandatos anteriores
En los tres casos los parlamentos salidos de las urnas están muy fragmentados. El MAS de Morales no podrá aportarle a su jefe de filas las tremendas mayorías que le garantizaron un gobierno sin problemas en los mandatos anteriores. Y si el fraude en la elección presidencial sirvió para reelegir a Morales para un cuarto mandato (hasta 2025), también permitió mitigar las cifras de una mediocre elección parlamentaria.
En caso de llegar a gobernar Martínez en Uruguay, el Frente Amplio estará en minoría y deberá pactar con una oposición crecida. Sin embargo, de ser Lacalle el próximo presidente todo indica que la coalición que le permita llegar al gobierno se reproducirá en el Congreso.
Con todo, es en Argentina donde la negociación será más necesaria pero también más difícil. Alberto Fernández llegará a la Casa Rosada el próximo 10 de diciembre, con una economía en estado crítico y las arcas vacías: elevada inflación, deuda externa, devaluación del peso, aumento de la pobreza, etc., que limitará enormemente la posibilidad de aplicar políticas de corte populista. El dilema que enfrenta será terrible, aunque previamente deba solucionar otras cuestiones, que todavía no tienen una respuesta clara y que condicionarán sin duda el futuro del país: ¿se mantendrá unido el peronismo o la reunificación electoral fue solo electoral? Y, más importante todavía, ¿cuál de los dos Fernández va a mandar?


",es,"











Three fragmented parliaments within Latin America
04 Nov 2019, 18:48 by Carlos Malamud
In recent weeks, different conflicts and popular mobilizations have erupted left and right in different countries of Latin America. Even in Bolivia, which held presidential and parliamentary elections on October 20, allegations of fraud and subsequent protests created a climate of violence similar to that existing in other latitudes.
However, this was not the case in Argentina and Uruguay, which had their presidential and parliamentary elections on the last Sunday of October, although with a very different outcome in terms of recognizing their results. Not only that. Throughout the previous phase, despite the great economic difficulties in Argentina, the two Rio Plata countries were exempt from violence outbreaks. It is a remarkable exception in regional reality and deserves some kind of explanation.
At times like this, when all these outbreaks of discontent are read as renewed attacks against the stability and survival of liberal and representative democracy, it may be appropriate to ask about the importance of elective processes with sufficient guarantees of impartiality and an important presence of parties or other political organizations.
Despite the defeat, Macri's party retains a position of some strength
Bolivia, Argentina and Uruguay are the last electoral processes of the intense cycle that Latin America experienced between mid-2017 and the end of 2019: 14 presidential elections that have generated a much more heterogeneous and complex reality. Contrary to the imagined, there was no right turn in the region, as shown by the triumphs of Evo Morales and Alberto Fernández. Unbeatable the last, full of suspicion and accusations the first.
Meanwhile, Uruguayan uncertainty remains. Daniel Martínez, the candidate of the ruling Frente Amplio would not have exceeded 40% of the votes, an amount far removed from the 50% needed to avoid the second round. Moreover, the first negotiations between Luis Lacalle Pou, the candidate of the National Party that will compete with Martínez on the ballot, and the remaining referents (Ernesto Talvi of the Colorado Party and Guido Manini Ríos de Cabildo Open) have laid the foundations for a broad alliance with serious triumph options. This would conclude the three consecutive terms, 15 years, of the leftist Front Broad.
In Argentina and despite the comeback of Mauricio Macri, the initial advantage of Peronism / Kirchnerism was such that it was impossible to force a second round. Despite this, the distance between Macri and Fernández with respect to the primary ones (the PASO) was shortened deeply. The result, 48.03% for Fernández and 40.44% for Macri, has left, despite its forceful contradictory sensations and in some cases a certain bitter aftertaste. Something normal when 15 points of difference were expected.
The paradoxical thing is that since Fernández has not passed 50% of the votes, his options to strengthen his power base have diminished, which will somehow revert to a more complex governance at this delicate juncture. The good election of Cambiemos, despite the defeat, gives it a position of greater relative strength (it is the first minority in the Chamber of Deputies and has a considerable parliamentary group in the Senate) and with better options to control the new government. What is gained on the one hand is lost on the other.
The MAS of Morales will not be able to contribute to his head of ranks the tremendous majorities that guaranteed him a government without problems in the previous mandates
In all three cases, parliaments coming out of the polls are very fragmented. The MAS of Morales will not be able to contribute to his head of ranks the tremendous majorities that guaranteed him a government without problems in the previous mandates. And if the fraud in the presidential election served to re-elect Morales for a fourth term (until 2025), it also allowed mitigating the figures of a mediocre parliamentary election.
In the event of Martínez governing in Uruguay, the Frente Amplio will be in the minority and must agree with a growing opposition. However, if Lacalle is the next president, everything indicates that the coalition that allows him to reach the government will be reproduced in Congress.
However, it is in Argentina where negotiation will be more necessary but also more difficult. Alberto Fernández will arrive at Casa Rosada on December 10, with an economy in critical condition and empty coffers: high inflation, external debt, devaluation of the peso, increased poverty, etc., which will greatly limit the possibility of applying policies Populist cut. The dilemma he faces will be terrible, although he must first solve other questions, which still do not have a clear answer and which will undoubtedly condition the future of the country: will Peronism be held together or was electoral reunification only electoral? And, more importantly, which of the two Fernández is going to send?


"
