,src,lang,text
0,"











Justiz
Eintracht Frankfurt-Fan verklagt Land
04 Nov 2019, 18:09 by Oliver Teutsch

Der Mann fordert Schmerzensgeld wegen eines Lendenwirbelbruchs nach einem Polizeieinsatz.

Wegen eines Polizeieinsatzes im Vorfeld des Europa-League-Spiels Eintracht Frankfurt gegen Schachtjor Donezk muss sich das Land Hessen seit Montag vor Gericht verantworten. Ein Eintracht-Fan, der bei dem Einsatz im Februar dieses Jahres schwer verletzt worden war, klagt auf Schmerzensgeld. Er war von Polizisten über eine Bande geschubst worden und hatte beim Sturz einen Lendenwirbelbruch erlitten.
Der Vorfall hatte hohe Wellen geschlagen. Den Kläger hat das so mitgenommen, dass er seinen Namen lieber nicht in der Zeitung lesen möchte. Der Informatiker schilderte aber zum Auftakt des Prozesses vor der 4. Zivilkammer des Landgerichts am Montag eindrücklich, wie schwerwiegend die Verletzung und wie weitreichend die Folgen für ihn sind: „Das Leben ist nicht mehr so, wie es davor war.“ Der Kläger, Mitte 30, war an dem Tag bei der Aufbaucrew für die geplante Choreo. Nachdem Eintracht-Präsident Peter Fischer sich im Vorfeld als Einpeitscher versucht und vorgegeben hatte, das Stadion müsse „brennen“, hatte die Polizei einen Vorbereitungsraum der Ultras nach Pyrotechnik durchsucht, aber nichts gefunden. Die Fans wollten das nicht auf sich sitzen lassen und witterten dahinter eine Maßnahme von Hessens Innenminister Peter Beuth (CDU), einem Vorreiter im Kampf gegen Pyrotechnik im Stadion. Kurzerhand besprühten die Ultras ein Transparent mit der fragwürdigen Botschaft: „Beuth, der Ficker fickt zurück.“
Schlimme Zeit in der Klinik
Der Kläger schildert nun, wie die Polizei auf das Transparent zunächst recht gelassen reagiert habe. „Wie aus dem Nichts“ sei dann aber eine behelmte Einheit aufgetaucht und habe „mit lautem Geschrei auf alles eingeprügelt“, um an das Banner zu kommen, was ihr auch gelang. Die Situation hatte sich schon wieder halbwegs beruhigt, als der Kläger versuchte, an dem Banner zu ziehen. „Ich habe gleich gemerkt, dass das blöd war“, gesteht er. Ein Polizist schubste ihn Richtung Werbebande. Vor dieser stand er, als zwei weitere Polizisten auf ihn zukamen und ihn so hart vor die Brust stießen, dass er in einem Purzelbaum rückwärts über die Bande flog. „Ich konnte nicht mehr aus eigener Kraft aufstehen“, erzählt er. Wie schwerwiegend die Verletzung war, konnte er da noch nicht ahnen. „Ich hatte eine sehr, sehr schlimme Zeit im Krankenhaus“, sagt der Informatiker. Nur langsam wurde es besser.
Er bekommt starke Schmerzmittel, die ihm Kreislaufprobleme und Herzrasen verursachen. Der Alltag wird zu einer Herausforderung. „Die ersten Monate war Sitzen überhaupt nicht möglich.“ Längeres Sitzen falle ihm heute noch schwer, er schlafe unruhig, habe Rückenprobleme.
Chancen stehen gut
Nach der Aussage des Klägers schauen sich die Prozessbeteiligten ein Video an, auf dem der folgenreiche Schubser zu sehen ist. Das Land Hessen wird im Prozess von zwei Rechtsanwälten einer Frankfurter Kanzlei vertreten und lehnt die Zahlung eines Schmerzensgelds ab. Der Kläger habe „erheblichen Körpereinsatz gegen die Polizei ausgeübt“, sagt einer der Anwälte. Auf dem Video ist davon nichts zu sehen.
Die drei Polizisten, die den Kläger schubsten, machen von ihrem Aussageverweigerungsrecht Gebrauch. Doch die Chancen des Fans auf Schmerzensgeld scheinen nicht schlecht zu stehen. Richter Florian Günthner sagte zumindest in einer ersten Einschätzung: „Das Schubsen über die Bande wird bislang vom beklagten Land nicht begründet.“ Der Prozess soll im Januar fortgesetzt werden. Bis dahin sollen auch endlich die Akten der Staatsanwaltschaft zu dem strafrechtlichen Verfahren beim Gericht eingetroffen sein.


",de,"











judiciary
Eintracht Frankfurt fan sued country
04 Nov 2019, 18:09 by Oliver Teutsch

The man demands compensation for a lumbar vertebra fracture after a police operation.

Because of a police operation in the run-up to the Europa League match Eintracht Frankfurt against Shakhtar Donetsk, the state of Hesse has been in court since Monday. A Eintracht fan who had been seriously injured in the February attack this year, laments on pain and suffering. He had been pushed over a gang by policemen and had suffered a lumbar spine fracture during the fall.
The incident had hit high waves. The plaintiff took it so much that he prefers not to read his name in the newspaper. But the computer scientist described impressively at the beginning of the trial before the 4th Civil Division of the district court on Monday, how serious the injury and how far-reaching the consequences are for him: ""Life is not as it was before."" The plaintiff, center 30, was with the construction crew for the planned choreo that day. After Eintracht President Peter Fischer tried in advance as a whip and had given, the stadium had to ""burn"", the police had searched a preparation room of the Ultras for pyrotechnics, but found nothing. The fans did not want to let that sit on it and sensed behind it a measure of Hesse's Interior Minister Peter Beuth (CDU), a pioneer in the fight against pyrotechnics in the stadium. Without further ado, the Ultras sprayed a banner with the questionable message: ""Beuth, the fucker fucks back.""
Bad time in the clinic
The plaintiff now describes how the police initially reacted quite calmly to the banner. ""Out of nowhere"" but then appeared a helmeted unit and have ""beaten loud with screaming at everything"" to get to the banner, what they succeeded. The situation had calmed down again when the plaintiff tried to pull at the banner. ""I immediately realized that was stupid,"" he admits. A policeman pushed him towards the advertising board. He stood in front of it when two more policemen came up to him and hit him so hard on the chest that he flew backwards over the gang in a somersault. ""I could not get up on my own,"" he says. How severe the injury was, he could not guess. ""I had a very, very bad time in the hospital,"" says the computer scientist. Only slowly did it get better.
He gets strong analgesics that cause him circulatory problems and palpitations. Everyday life becomes a challenge. ""The first months sitting was not possible at all."" Longer sitting he still find it difficult, he sleeps restless, have back problems.
Chances are good
According to the plaintiff's statement, the participants in the proceedings look at a video showing the momentous Schubser. The state of Hesse is represented in the lawsuit by two lawyers at a Frankfurt law firm and refuses to pay a compensation. The plaintiff had ""exercised considerable physical force against the police,"" says one of the lawyers. There is nothing to see on the video.
The three policemen who pushed the plaintiff make use of their right to refuse to testify. But the chances of the fan on pain and suffering money do not seem to be bad. Judge Florian Günthner said at least in a first assessment: ""The pushing over the gang is so far not justified by the defendant country."" The process is to be continued in January. Until then, finally, the files of the prosecutor's office to the criminal proceedings have arrived at the court.


"
