,src,lang,text
0,"











آزمون: «علی دایی» و «زلاتان» اسطوره‌های من هستند

04 Nov 2019, 18:31


نسخه روسی تارنمای رسمی اتحادیه فوتبال اروپا، مصاحبه‌ای اختصاصی را با «سردار آزمون» ترتیب داد که طی آن مهاجم تیم ملی ایران از روزهای کودکی و بازی در خیابان‌ها تا رسیدن به اوج دوران فوتبالی صحبت کرد.


آفتاب‌‌نیوز :

سردار آزمون در ۲ بازی نخست خود به همراه زنیت در لیگ قهرمانان اروپا یک گل زد و به این تیم کمک کرد تا پس از بازی مقابل لیون و بنفیکا چهار امتیاز دشت کند؛ او در فصل ۲۰۱۶ - ۲۰۱۷ در مرحله گروهی برای روستوف گلزنی کرد یکی به اتلتیکو و دیگری به باواریایی ها؛ پیش از این، هیچ ایرانی در بیش از یک دهه گذشته در لیگ قهرمانان گلزنی نکرده بود و حالا مهاجم ۲۴ ساله ایرانی به همراه زنیت به این مهم دست یافت.
در مصاحبه زیر از نخستین گام‌های فوتبالی سردار سوال کردیم و اینکه رابطه عاشقانه وی با فوتبال اروپا چگونه آغاز شد.
اولین خاطراتی که از فوتبال دارید، چیست؟



هشت یا ۹ ساله بودم و برای اولین بار در خیابان‌های بندر ترکمن فوتبال بازی کردم؛ با خانواده‌ام کنار اقوام بودیم و با بچه‌های محل فوتبال بازی می‌کردم؛ خوشبختانه من کوچک‌ترین فرزند در خانواده بودم و پدرم تا جایی که در توان داشت از من حمایت می‌کرد.
چه کسی شما را به مدرسه فوتبال برد؟
وقتی تصمیم گرفتم فوتبال را شروع کنم خانواده‌ام از من حمایت کردند به ویژه خواهرم؛ او ایمان داشت که من روزی فوتبالیستی بزرگ می‌شوم. خدا را شکر همه چیز مثل این پیش‌بینی پیش رفت و به خانواده‌ام بهانه‌ای دادم تا به من افتخار کنند اما هنوز قله‌های زیادی را برای فتح کردن پیش رو دارم.
آیا به یاد دارید که در سطح نوجوانان و جوانان چطور بازی می‌کردید؟
یادم می‌آید در زادگاهم در تورنمنتی که برای زیر ۱۲ ساله‌ها بود شرکت کردم؛ یک تورنمنت بین منطقه‌ای بود و به اندازه ای بازیکن خوب در آن جمع شده بودند که یک تیم فوتبال زیر ۱۴ سال تشکیل شود و از آکادمی ما ۵ نفر انتخاب شدند و سه نفر از آنان در لیگ برتر ایران رشد کردند.
سرمربی فوق العاده‌ای به نام محمود سیدی داشتیم؛ هنوز هم از چیزهایی که به من یاد داد، استفاده زیادی می‌کنم. نصحیت‌های او را به یاد دارم اگر او نبود هرگز تا اینجا پیشرفت نمی‌کردم.
در کودکی رقابت‌های یورو را تماشا می‌کردید؟
در ۱۵ سالگی شروع به دیدن لیگ قهرمانان و لیگ اروپا کردم؛ فوتبال می‌دیدم اما دوست داشتم با خانواده‌ام وقت بگذرانم؛ فوتبال را با خانواده نگاه می‌کردم و برای من این خاطرات ارزشمندترین‌ها است.
هیچ اسطوره ای در فوتبال دارید؟
در ایران اسطوره من از دوران کودکی علی دایی بود و از بازیکنان خارجی زلاتان ابراهیموویچ؛ مقابل زلاتان بازی کردم و باید بگویم چیزهای زیادی از او یاد گرفتم.
یک بارعموی مرحومم به من گفت که روزی بایرن را شکست می‌دهم و این اتفاق افتاد. او به این موضوع فکر می‌کرد و زمانی که با روستوف با بایرن مونیخ هم قرعه شد، شروع کردم به رویاپردازی و این رویا به حقیقت پیوست.
شما از یک خانواده والیبالی می آیید، چطور فوتبالیست شدید؟
بله، خانواده من والیبال بازی می‌کنند؛ خوش شانس بودم که خانواده‌ای ورزشی دارم و آنها هرگز مرا رها نکردند؛ با این حال فوتبال را انتخاب کردم زیرا پدرم همیشه می‌خواست فوتبالیست شوم.
خانواده ثروتمندی نداشتم چیزی بین فقیر و متوسط؛ آدم‌هایی بودند که به من می‌خندیدند و می‌گفتند که هرگز فوتبالیست نخواهم شد؛ اما این حرف‌ها فقط مرا و عزمم را برای تبدیل شدن به یک فوتبالیست حرفه‌ای قوی‌تر کرد و ثابت کردم که می‌توانم یک بازیکن خوب باشم.
از اولین بازی‌های خود در رقابت‌های اروپایی چه خاطره‌ای دارید؟
لیگ قهرمانان و لیگ اروپا از لحاظ سطح با سایر رقابت‌ها تفاوت زیادی دارند؛ به نظر من، لیگ قهرمانان اروپا بهترین تورنمنت جهان است؛ هر بازیکنی در جهان می‌خواهد در این تورنمنت یا لیگ اروپا بازی و به تیمش برای موفقیت کمک کند.
مهم نیست با چه تیمی اما امیدوارم هر سال در لیگ قهرمانان بازی کنم؛ در عین حال باید بگویم که لیگ برتر روسیه تورنمنتی سطح بالا است؛ این لیگ بیشتر روی قدرت بدنی متمرکز بوده و بازیکنان قدرتمند و فیزیکی زیادی دارد.
آیا با حضور در لیگ قهرمانان به بازیکن بهتری تبدیل شدید؟
بله، در این تورنمنت شما با بهترین بازیکنان جهان بازی می‌کنید؛ بهترین و قدرتمندترین تیم‌ها جمع می‌شوند و این موضوع روی عملکرد و پیشرفت شما تاثیر مستقیم دارد.
تجربه حضور در لیگ قهرمانان اعتماد به نفس شما را بالا می‌برد و از لحاظ روانی شما را قوی می‌کند؛ بعد از حضور در این تورنمنت دیگر از هیچ مسابقه‌ای نمی‌ترسید؛ حتی یک شکست در لیگ قهرمانان همه چیز را برای شما عوض می‌کند بنابراین تمایل به نباختن در وجود شما رخنه می‌کند.
واضح‌ترین خاطرات شما از رقابت‌های اروپایی چیست؟
خاطرات خوب زیادی دارم؛ یکی از آنها گلی بود که در بازی مقابل بایرن به ثمر رساندم؛ خانواده‌ام در ورزشگاه بودند؛ خوشحال بودم که باعث خوشحالی آنان شدم؛ آن روز یک لحظه خاص در زندگی من بود؛ علاوه بر این، بازی مقابل بایرن را در مونیخ به یاد دارم اگرچه آن دیدار را با نتیجه ۵ بر صفر باختیم. از آن بازی چیزهای زیادی یاد گرفتم و قوی‌تر شدم؛ فکر می‌کنم چیزهایی که از آن بازی یاد گرفتم به مراتب خوشحال کننده‌تر از گلی بود که در برابر چشمان خانواده و دوستانم به بایرن زدم.
آیا تمام گل‌هایی که در رقابت های اروپایی زدی را به یاد دارید؟ کدام یک ارزشمندترین بود؟
البته که همه چیز را به یاد دارم؛ فکر می‌کنم گلی که مقابل اتلتیکو زدم ارزشمندترین بود؛ پیش از بازی در نشست مطبوعاتی انتقادهایی از من شد زیرا مدت‌ها بود که گلی نزده بودم. در سوی دیگر اتلتیکو هم ۱۰ یا ۱۱ بازی اخیر خود را در لیگ قهرمانان نباخته بود و گلزنی در چنین شرایطی خیلی ارزشمند است و به نظرم بهترین گل دوران فوتبالم است.
از همان روزهای اول برای زنیت تاثیرگذار بودید؛ چه چیزی باعث شد به این سرعت وفق پیدا کنید؟
این موضوع فقط مختص من نیست؛ هر بازیکنی که به تیمی بزرگ همچون زنیت برود این کار را خواهد کرد؛ این اتفاق با حمایت هم تیمی‌ها، هواداران، مربی‌ها و تمام اعضای باشگاه می‌افتد.
ما هواداران فوق‌العاده‌ای داریم؛ صبور و همیشه حامی؛ بازیکنان خوبی هم داریم و کادر فنی قوی در اختیارمان است و این موضوع به هر بازیکنی کمک می‌کند؛ امیداورم سال‌ها برای زنیت بازی کنم و برای موفقیت به یکدیگر کمک کنیم.


",fa,"











Quiz: ""Ali Daei"" and ""Zlatan"" are myths

04 Nov 2019, 18:31


The Russian version of the official European Football Association Web site conducted an exclusive interview with the Sardar Test, during which the Iranian national team striker talked about his childhood days and playing in the streets to reach the height of football.


Sunshine News:

The Test captain scored one goal in his first two games with Zenit in the Champions League and helped the team to four points after playing against Lyon and Benfica; he scored in Group 1 for Rostov in Group One. To Atletico and another to the Bavarians; before that, no Iranian had scored in the Champions League in more than a decade, and now the six-year-old Iranian striker has achieved this.
In the following interview we asked about Sardar's first steps in football and how his love affair with European football began.
What are your first memories of football?



I was eight or five years old and played football for the first time in the streets of Turkmenistan port, with my family and playing soccer with my family; fortunately I was the youngest child in the family and my father supported me as much as he could.
Who took you to football school?
When I decided to start football my family supported me, especially my sister; she believed that I would grow up to be a footballer someday. Thank God everything went ahead like this and I gave my family an excuse to be proud, but I still have many peaks to conquer.
Do you remember how you played at the youth and youth level?
I remember attending my hometown at a tournament for under-5s; it was an inter-regional tournament with enough good players to form a soccer team under 5 and our academy consisted of 3 people and three Some of them grew up in the Iranian Premier League.
We had a great coach named Mahmoud Sayyid; I still get a lot of what he taught me. I would remember his advice if he had never been here.
Did you watch Euro competitions as a child?
At age 9, I started watching the Champions League and the Europa League; I watched football but loved to spend time with my family; I watched football with my family and to me these memories are the most valuable.
Do you have any myths in football?
In Iran my childhood was from Ali Daei and I played against Zlatan from Zlatan Ibrahimovic's foreign players and I have to say I learned a lot from him.
One of my late friends told me that one day I was going to defeat Bayern and it happened. He was thinking about it, and when I got involved with Rostov with Bayern Munich, I started dreaming, and that dream came true.
You come from a volleyball family, how did you become a footballer?
Yes, my family played volleyball; I was lucky to have a sports family and they never left me; however, I chose football because my dad always wanted to be a footballer.
I didn't have a wealthy family between the poor and the average; there were people laughing at me saying that I would never become a footballer, but that just made me stronger and more determined to become a professional footballer and proved that I could be a good player.
What are your memories of your first European games?
The Champions League and the Europa League are very different in terms of other competitions; in my opinion, the Champions League is the best tournament in the world; every player in the world wants to play in this tournament or the Europa League and help his team succeed.
No matter what team but I hope to play in the Champions League every year; at the same time I have to say that the Russian Premier League is a high level tournament; it is more focused on physical strength and has a lot of strong and physical players.
Did you become a better player with the Champions League?
Yes, in this tournament you play with the best players in the world; the best and most powerful teams come together and this has a direct impact on your performance and progress.
The Champions League experience boosts your confidence and strengthens you mentally; after the tournament you are no longer afraid of a match; even a Champions League defeat will change everything for you so you don't want to lose. It breaks through you.
What are your most vivid memories of European competition?
I have a lot of good memories - one of them was a goal against Bayern; my family were at the stadium; I was happy to make them happy; that was a special moment in my life; I remember in Munich, though we lost that match by 2-0. I learned a lot from that game and got stronger; I think what I learned from that game was far more enjoyable than the goal I hit Bayern with my family and friends.
Do you remember all the goals you scored in European competitions? Which one was the most valuable?
Of course I remember everything - I think the goal I scored against Atletico was the most valuable - before the game at the press conference I was criticized because I hadn't scored in a long time. Atletico, on the other hand, have not lost their last two or four Champions League games, and the scoring in this situation is very valuable and I think is the best goal of my career.
From the very first days you were influential for Zenith; what made you adapt so quickly?
It's not just me; every player who goes to a big team like Zenith will do it, with the support of teammates, fans, coaches and all the members of the club.
We have great supporters, we are patient and always supportive, we have good players and we have a strong technical staff and this helps every player; I hope to play Zenit for years and help each other succeed.


"
