,src,lang,text
0,"











У МАУ заявляють, що збираються уникнути банкрутства

04 Nov 2019, 18:00

Наразі у МАУ переглядають фінансову політику, оптимізують у бік звуження маршрутну мережу, закривають деякі напрямки польотів - прессекретар
Авіакомпанія «Міжнародні авіалінії України» заявляє, що здійснює низку заходів для уникнення збитків і жодної мови про банкрутство не може бути.
Про це повідомила прессекретар МАУ Євгенія Сацька, коментуючи заяву міністра інфраструктури Владислава Криклія щодо можливого банкрутства авіакомпанії, якщо не будуть погашені борги перед державою, пише Укрінформ.
«Українські перевізники несуть низку додаткових витрат порівняно з іноземними конкурентами: акциз на паливо, мито на ввезення авіатехніки і запасних частин, необхідність облітати повітряний простір Сходу України, АРК і РФ. Для мінімізації негативного впливу цих чинників на діяльність і фінансовий стан, авіакомпанії МАУ доводиться діяти в рамках власних можливостей: переглядати фінансову політику і зменшувати витрати, оптимізувати в бік звуження маршрутну мережу, закривати деякі напрямки польотів. Мета цих дій – оздоровити авіакомпанію. Тому жодної мови про банкрутство авіакомпанії не йде і йти не може», - зауважила вона.
Сацька додала, що цитування міністра інфраструктури у ЗМІ щодо можливого банкрутства авіакомпанії «виглядає як слова, що вирвані з контексту».
«Питання заборгованості є предметом переговорів між двома суб’єктами господарювання, це нормальний бізнес-процес, кожен з учасників якого зацікавлений у тому, щоб знайти рішення і працювати надалі, надаючи послуги з перевезення нашим, підкреслю, спільним клієнтам-пасажирам», - зауважила вона.
Сацька також зауважила, що авіакомпанія знаходиться на етапі змін, головною метою яких є повернення МАУ в зону беззбитковості, подальший збалансований розвиток і прибутковість бізнесу.
«Для реалізації цього завдання авіакомпанія змушена скоротити частотність виконання частини своїх рейсів, а деякі з них – з негативною рентабельністю - повністю скасувати. Це економічно виважений крок для стабілізації бізнесу, який дозволить МАУ переглянути і оптимізувати мережу маршрутів і розклад рейсів з урахуванням економічних чинників: розміру флоту, витрат на обслуговування польотів тощо», - додала вона.
Як повідомлялося, міністр інфраструктури України Владислав Криклій в інтерв’ю для заявив, що авіакомпанія «Міжнародні авіалінії України» (МАУ) розпочала виплату боргів перед державою за власним графіком погашення.
Очільник МІУ наголосив: якщо питання з боргами компанії перед державою не вирішиться, вона збанкрутує.
Як відомо, у жовтні в МАУ заявили про значне скорочення програми польотів і закриття частини маршрутів з 16 листопада. У компанії планують сконцентруватися на прибуткових напрямках, щоб змінити свою фінансову модель.
За даними ЗМІ, борговий портфель компанії перевищує 1 млрд грн, зокрема 400 млн грн МАУ заборгувала Україні.







",uk,"











The UIA says they are going to avoid bankruptcy

04 Nov 2019, 17:00

UIA is currently reviewing its financial policies, optimizing its narrowing of the itinerary, closing some destinations - press secretary
International Airlines of Ukraine declares that it takes a number of measures to avoid losses and there can be no language of bankruptcy.
This was announced by UIA spokesman Yevgeniy Satskaya, commenting on the statement of Infrastructure Minister Vladislav Krykliy about the possible bankruptcy of the airline, if the debts to the state are not paid off, Ukrinform writes.
“Ukrainian carriers incur a number of additional costs compared to foreign competitors: excise duty on fuel, duty on imports of aircraft and spare parts, the need to fly through the airspace of the East of Ukraine, the ARC and the Russian Federation. To minimize the negative impact of these factors on operations and financial condition, UIA has to act within its own capabilities: to review financial policies and reduce costs, to optimize the narrowing of the itinerary, to close some flight destinations. The purpose of these actions is to improve the airline. Therefore, there is no talk of bankruptcy of the airline and it cannot go, ”she said.
Satska added that quoting the Minister of Infrastructure in the media about the possible bankruptcy of the airline ""looks like words taken out of context.""
""The issue of debt is a matter of negotiation between two economic entities, it is a normal business process, each of the participants of which is interested in finding a solution and work in the future, providing transportation services to our, I emphasize, joint clients-passengers"", - said she.
Satska also noted that the airline is in a phase of change, the main purpose of which is to return UIA to break-even zone, further balanced development and profitability of the business.
“To accomplish this, the airline has to reduce the frequency of part of its flights, and some of them - with negative profitability - completely cancel. It is a cost-effective business stabilization step that will allow UIA to review and optimize its route network and flight schedule, taking into account economic factors: fleet size, flight service costs, etc., ”she added.
As reported, the Minister of Infrastructure of Ukraine, Vladislav Krykliy, in an interview, stated that the International Airlines of Ukraine (UIA) has started paying its debts to the state on its own repayment schedule.
The MIU chief stressed that if the issue with the company's debts to the state is not resolved, it will go bankrupt.
It is known that in October the UIA announced a significant reduction of the flight program and the closure of some routes from November 16. The company plans to focus on profitable areas to change its financial model.
According to the media, the company's debt portfolio exceeds UAH 1 billion, in particular, UIA owed UAH 400 million to Ukraine.







"
