,src,lang,text
0,"











برای خرید بلیط هواپیما دیگر در صد سایت نگردید!
06 Nov 2019 by عصر ايران
بلیط هواپیما این روزها با بالا رفتن قیمت ارز بسیار گران شده و پیدا کردن بلیط هواپیما ارزان کار سختی شده است. بلیط هواپیما برای کسانی که می‌خواهند چه برای گردش و چه برای کسب و کار به سفر بروند، بسیار ضروری است. چون در زمان سفر صرفه جویی می‌کند و موجب می‌شود شما زمان بیشتری برای هدف سفرتان داشته باشید. در مقابل بلیط هواپیما ارزان در بودجه شما صرفه‌جویی می‌کند!




خرید بلیط هواپیما ارزان و دشواری پیدا کردن آن

اگر بخواهید یک بلیط هواپیما مشهد ، استانبول یا هر مقصد دیگری را بخرید، متوجه می‌شوید که خرید بلیط هواپیما ارزان و مناسب کار دشواری است. کافی است در گوگل یک جستجوی ساده انجام دهید تا با انواع بلیط هواپیما با قیمت‌ها و کیفیت خدمات متفاوت رو به رو شوید. آژانس های مسافرتی متعدد هر کدام بلیط هواپیما خطوط هواپیمایی گوناگون را در ساعت های مختلف روز با قیمت های متفاوتی می‌فروشند. پرتعداد بودن سایت‌های فروش بلیط هواپیما که تعدادشان هم کم نیست، مزید بر علت است.
اینکه کدام آژانس مسافرتی قیمت مناسب‌تری پیشنهاد می‌دهد، کدام شرکت هواپیمایی خدمات بهتری ارائه می‌دهد و قیمت کدام بلیط هواپیما ارزان تر و مناسب‌تر است موجب می‌شود پیدا کردن یک بلیط هواپیما ارزان کاری دشوار و گیج کننده باشد.
اما سفرمارکت به عنوان یک ابزار نوین و دانش بنیان، این مژده را به علاقه‌مندان به سفر می‌دهد که توانسته این مشکل را حل کند و خرید بلیط هواپیما را تبدیل به تجربه‌ای متفاوت کرده است.




بلیط هواپیما ارزان با سفرماکت

سفر مارکت یک مارکت پلیس (marketplace) یا بازار مجازی سفر و بلیط هواپیما است که به صورت یک موتور جستجوی هوشمند عمل کرده و بلیط هواپیما عرضه شده توسط آژانس‌های مسافرتی و سایت‌های فروش بلیط هواپیما را به صورت یکجا و مقایسه‌ای، در یک پلتفرم برای شما به نمایش می‌گذارد.
شما در سفر مارکت می‌توانید با مقایسه بلیط هواپیما آژانس‌ها و عرضه‌کننده‌های گوناگون، بلیط هواپیما ارزان و مناسب مورد نظرتان را انتخاب و خریداری کنید.
سفرمارکت به عنوان یک بازار بلیط هواپیما عمل کرده و هر کدام از آژانس‌ها و عرضه‌کننده‌های بلیط هواپیما در یک رقابت سالم با یکدیگر تلاش می‌کنند تا بهترین و مناسب‌ترین قیمت بلیط هواپیما را به کاربران عرضه کنند. به همین سبب سفر مارکت این ادعا را دارد که می‌تواند موجب ارزان شدن تدریجی قیمت بلیط هواپیما شود.




سفر مارکت و تجربه خرید آسان بلیط هواپیما

با سفر مارکت دیگر لازم نیست برای خرید بلیط هواپیما در چندین سایت بگردید و وقت و انرژی خود را تلف کنید. کافی است وارد سایت safarmarket.com شوید و مبدا، مقصد و تاریخ سفرتان را مشخص کنید. شما تنها با یک جستجوی ساده می‌توانید بلیط هواپیما ارزان مورد نظرتان را با مقایسه همه سایت‌ها و آژانس‌های معتبر و موفق فروش بلیط در یک سایت پیدا کرده و خریداری کنید.
فرقی نمی‌کند بلیط هواپیما بخواهید یا تور مسافرتی داخلی و خارجی. سفر مارکت ارزان ترین بلیط یا تور را برای شما از بین آژانس‌های معتبر که در بازار سفر دارای اعتبار و پیشینه مناسب هستند، گردآورده و به شما عرضه می‌کند.


",fa,"











No more sites to buy plane tickets!
06 Nov 2019 by Asr Iran
Airfare These days it is very difficult to find a cheap airfare with rising currency prices. Airfare is essential for those who want to travel whether for business or for business. Because it saves time on travel and makes you have more time for the purpose of your trip. Saves cheap airfare on your budget!




Buying a cheap plane ticket and finding it difficult

If you are planning to buy a plane ticket to Mashhad, Istanbul or any other destination, you will find it difficult to buy a cheap and convenient plane ticket. Just do a simple search on Google to get a variety of airfare with different prices and quality of service. Numerous travel agencies sell airline tickets to different airlines at different times of the day at different prices. The high number of airline ticketing sites, which is not low, is a big reason.
Which travel agency offers the best price, which airline offers the best service, and which airline ticket is the cheapest and most convenient, makes finding a cheap airline ticket difficult and confusing.
But as a new and knowledge-based tool, the supermarket is giving travel enthusiasts the good news that has been able to solve the problem and has made buying airline tickets a different experience.




Cheap plane tickets with TravelMact

Market Travel is a police marketplace or virtual marketplace for travel and airplane tickets that acts as an intelligent search engine and compares airplane tickets provided by travel agencies and airplane ticketing sites in one platform to you show to others.
You can choose and buy the cheapest and convenient plane tickets for you by comparing the airline tickets of different agencies and suppliers.
The SFM acts as an airline ticket market, and each of the airline ticketing agencies and suppliers is working together to provide the best and most reasonable airline ticket prices to users. That is why the market trip claims that it can bring down the price of a plane ticket.




Market travel and the easy shopping experience of plane tickets

No longer do you have to go to multiple sites to buy airline tickets and waste your time and energy. Just log on to safarmarket.com and specify your origin, destination and date of travel. With just a simple search you can find and buy the cheap plane tickets you want by comparing all the reputable and successful ticketing sites and agencies on one site.
Whether you want a plane ticket or a domestic and foreign travel tour. Market Travel collects and offers you the cheapest tickets or tours from reputable agencies that have the right track record in the travel market.


"
