,src,lang,text
0,"











آغاز نخستین جلسات علنی استماع برای تحقیقات استیضاح ترامپ
06 Nov 2019 by عصر ايران



رئیس کمیته اطلاعاتی مجلس نمایندگان آمریکا گفته نخستین جلسات علنی برای ادامه تحقیقات استیضاح رئیس‌جمهور این کشور از هفته آینده برگزار می‌شود.به گزارش فارس، «آدام شیف»، رئیس کمیته اطلاعاتی مجلس نمایندگان آمریکا گفته نخستین جلسات علنی برای تحقیقات استیضاح «دونالد ترامپ»، رئیس‌جمهور آمریکا از هفته آینده (بعد از یکشنبه) برگزار می‌شود. 
شیف که طراح اصلی تحقیقات استیضاح از دونالد ترامپ بابت گفت‌وگوی جنجالی او با رئیس‌جمهور اوکراین در ماه جولای است گفته که برگزاری این جلسات علنی فرصتی است که مردم آمریکا خودشان درباره اقدامات ترامپ قضاوت کنند.
مجلس نمایندگان آمریکا با تصویب قطعنامه‌ای هفته گذشته ضمن رسمیت بخشیدن به تحقیقات استیضاح ترامپ،  آغاز مرحله جدید این تحقیقات را کلید زد. کمیته‌های مجلس نمایندگان آمریکا در هفته‌های قبل‌تر تحقیقات استیضاح را به صورت غیرعلنی پیش برده بودند اما مصوبه جدید خواستار علنی کردن این تحقیقات است. 
 شیف امروز چهارشنبه گفت «ویلیام تایلور»، دیپلمات ارشد آمریکا در اوکراین و «جورج کنت»، دستیار وزیر خارجه آمریکا چهارشنبه هفته آینده (۱۳ نوامبر/۲۲ آبان) در جلسات استماع علنی کمیته امور اطلاعاتی مجلس نمایندگان حاضر خواهند شد. 
این کمیته سپس روز جمعه ۱۵ نوامبر میزبان «ماری یووانویچ»، سفیر سابق آمریکا در اوکراین خواهد بود که اخراج او از این سمت در اردیبهشت‌ماه سال جاری توسط ترامپ به بخش مهمی از تحقیقات استیضاح تبدیل شده است. 


",fa,"











Start of the first public hearing for Trump impeachment investigations
06 Nov 2019 by Asr Iran



House Intelligence Committee chief says first public hearings to continue impeachment probe next week. Adam Schiff, chairman of the House Intelligence Committee, said first public hearings on impeachment by Donald Trump. The US president is due next week (after Sunday).
Schiff, the lead investigator of impeachment investigations from Donald Trump over his controversial interview with the Ukrainian president in July, said the public hearings were an opportunity for the American people to judge Trump himself.
The US House of Representatives approved a resolution last week, recognizing Trump's impeachment investigation, and marked the beginning of a new phase in the investigation. US House committees had been conducting impeachment investigations weeks earlier, but the new resolution calls for the investigation to be made public.
Schiff said Wednesday that US senior diplomat in Ukraine William Taylor and US Assistant Secretary of State George Kent will attend the House Intelligence Committee's public hearings on Wednesday (November 7).
The committee will then host former US Ambassador to Ukraine Marie Yovanovitch on Friday, November 6, and her expulsion from Trump in May has become an important part of impeachment investigations.


"
