,src,lang,text
0,"











Independiente de Cauquenes anunció su retiro de la segunda división profesional y criticó a la ANFP
El elenco de la región del Maule también disparó contra el Sifup.
06 Nov 2019 by Diego Rodríguez
Independiente de Cauquenes anunció su retiro del torneo actual en la segunda división profesional tras declararse quebrado y criticó duramente al ente rector del fútbol chileno y al Sifup por el mal manejor durante este periodo.
A través de un comunicado, el elenco de la región del Maule criticó la poca consideración que han tenido con clubes de la tercera categoría del fútbol chileno.
Permanente discriminación arbitraria de la ANFP, donde acusan nulo apoyo económico a los clubes de la segunda división profesional. Donde reclaman tener los mismos gastos que instituciones de divisiones superiores.
Otro hecho que reclaman es la nula voz en consejos de presidentes, donde sus reclamos no son considerados para la conformación de las bases de torneos.
Pero no solo criticaron a la ANFP sino que también al Sifup, pues aseguraron que al decidir postergar el retorno del fútbol, no se pueden generar ingresos para costear sueldos de funcionarios y jugadores.
De todas formas, señalaron que se harán cargo de los sueldos correspondientes por esta temporada, pese a las complicaciones con las que han debido lidiar.

Revisa aquí el comunicado del club:






",es,"











Independiente de Cauquenes announced his retirement from the second professional division and criticized the ANFP
The cast of the Maule region also shot at the Sifup.
06 Nov 2019 by Diego Rodríguez
Independiente de Cauquenes announced his retirement from the current tournament in the second professional division after declaring himself bankrupt and criticized the Chilean soccer governing body and Sifup for bad manners during this period.
Through a statement, the cast of the Maule region criticized the little consideration they have had with clubs in the third category of Chilean football.
Permanent arbitrary discrimination of the ANFP, where they accuse null financial support to the clubs of the second professional division. Where they claim to have the same expenses as institutions of higher divisions.
Another fact that they claim is the void voice in councils of presidents, where their claims are not considered for the conformation of the tournament bases.
But they not only criticized the ANFP but also the Sifup, because they said that by deciding to postpone the return of football, income cannot be generated to pay salaries for officials and players.
In any case, they indicated that they will take care of the corresponding salaries for this season, despite the complications they have had to deal with.

Check here the club statement:






"
