,src,lang,text
0,"











Em derrota para Bolsonaro, Câmara aprova projeto de armas desidratado
06 Nov 2019, 00:10 by Camila Turtelli
Em uma derrota para o governo do presidente Jair Bolsonaro, a Câmara aprovou na noite desta terça-feira, 5, uma versão desidratada do projeto de lei do Executivo que tratava sobre a posse e o porte de armas.
Depois de uma série de tentativas de se aprovar a matéria em plenário, parlamentares fecharam um acordo para votar apenas partes do projeto que tratam de regras para colecionadores, atiradores e caçadores (CACs), além de mudar penas de crimes com armas e outros temas. O projeto foi aprovado com 283 votos a favor e 140 contra, além de duas abstenções.
Em maio, Bolsonaro editou um decreto que facilitou o porte de arma e o acesso a munições para os CACs. Mas, no fim de junho, o presidente revogou o texto e outros dois, também sobre armas, e enviou ao Congresso esse projeto que originalmente tratava também sobre o registro, posse e comercialização de armas de fogo e munição e também sobre o Sistema Nacional de Armas (Sinarm).
Além de retirar algumas medidas previstas no texto do governo, os deputados também incluíram aumento de algumas penas previstas, como a para quem for flagrado em posse ou portando, de maneira irregular, uma arma.


Observação sobre caça foi feita à mão no próprio Plenário da CâmaraImagem: Divulgação

Foi aprovada ainda uma emenda do deputado Arthur Lira (PP-AL) que especifica que o atirador esportivo, maior de 25 anos, terá direito ao porte de armas somente depois de cinco anos da primeira emissão do certificado de registro, em vez de dois anos depois, como constava da redação proposta pelo relator, deputado Alexandre Leite (DEM-SP).
Foram retiradas do texto qualquer possibilidade de estender porte e posse a outras categorias, como queria o governo. Agora, o Executivo deve enviar um novo texto à Câmara amanhã para tratar da ampliação das categorias que têm direito a porte de arma para o exercício de sua profissão e outros assuntos.
No fim de agosto, a Câmara aprovou a flexibilização da posse estendida de armas de fogo em propriedades rurais, a primeira legislação pró-arma aprovada no Congresso desde o início do governo Bolsonaro.


",pt,"











Defeating Bolsonaro, House approves dehydrated weapons bill
06 Nov 2019, 00:10 by Camila Turtelli
In a defeat for President Jair Bolsonaro's government, the House passed a dehydrated version of the executive's bill dealing with gun possession and possession on Tuesday night.
After a series of attempts to approve the matter in plenary, lawmakers struck a deal to vote only parts of the bill dealing with rules for collectors, shooters and hunters (CACs), as well as changing penalties for gun crimes and other topics. The bill was approved with 283 votes in favor and 140 against, plus two abstentions.
In May, Bolsonaro issued a decree that facilitated gun possession and access to ammunition for CACs. But at the end of June, the president revoked the text and two others, also on weapons, and sent to Congress this bill that originally also dealt with the registration, possession and marketing of firearms and ammunition and also the National System of Weapons (Sinarm).
In addition to withdrawing some measures provided for in the government's text, MPs also included increasing some of the penalties provided, such as for those who are caught in possession or irregularly carrying a weapon.


Note on hunting was made by hand at the House Plenary itself Image: Press Release

Also approved was an amendment by Congressman Arthur Lira (PP-AL) specifying that the 25-year-old sports shooter will be entitled to carry guns only after five years of first issuing the certificate of registration, instead of two years. then, as stated in the wording proposed by the rapporteur, Deputy Alexandre Leite (DEM-SP).
Any possibility of extending size and possession to other categories, as the government wanted, was removed from the text. Now, the Executive must send a new text to the House tomorrow to expand the categories that are entitled to carry weapons for the exercise of his profession and other matters.
In late August, the House approved the extension of extended firearm ownership on farms, the first pro-gun legislation passed in Congress since the beginning of the Bolsonaro administration.


"
