,src,lang,text
0,"











India vs Bangladesh, 1st T20I : रिषभ पंतमुळे DRS गमावला; चाहत्यांनी महेंद्रसिंग धोनी नावाचा गजर केला
भारत विरुद्ध बांगलादेश यांच्यातील पहिल्या ट्वेंटी-20 सामन्यात रिषभ पंतला रोषाला सामोरे जावं लागलं.
03 Nov 2019, 16:16 by ऑनलाइन लोकमत
भारत विरुद्ध बांगलादेश यांच्यातील पहिल्या ट्वेंटी-20 सामन्यात रिषभ पंतला रोषाला सामोरे जावं लागलं. युजवेंद्र चहलने टाकलेल्या दहाव्या षटकात पंतकडून दोन चुका झाल्या त्यामुळे चाहत्यांनी महेंद्रसिंग धोनीच्या नावाचा गजर केला. नवी दिल्लीतील अरुण जेटली स्टेडियमवर सुरू असलेल्या या सामन्यात धोनी नामाचा गजर घुमला. प्रथम फलंदाजी करताना भारताने 6 बाद 148 धावा केल्या. प्रत्युत्तरात बांगलादेशला पहिल्या षटकात धक्का बसला, परंतु त्यानंतर मोहम्मद नइम आणि सौम्या सरकार यांनी बांगलादेशच्या डावाला आकार दिला. त्यांनी पहिल्या पॉवरप्लेमध्ये संघाला 45 धावा करून दिल्या. पण, चहलने ही जोडी तोडली. त्यानंतर आलेला मुशफीकर रहीमही बाद झाला असता, परंतु पंतचा अंदाज चुकला. नेमकं काय घडलं?



चहलनं डावाचे दहावे षटक टाकले. त्यावर तिसऱ्या चेंडूवर रहीम पायचीत होता, परंतु कर्णधार रोहित शर्मानं DRS घेतला नाही. त्याच षटकात पंतनं धावबाद करण्याची सोपी संधी गमावली. षटकाच्या अखेरच्या चेंडूवर पंतनं झेलबादची अपील केली आणि रोहितला DRS घेण्यास सांगितले. रोहितनं अखेरच्या क्षणाला DRS घेतला, परंतु तो वाया गेला. यामुळे चाहते चांगलेच संतापले आणि त्यांनी धोनी धोनी असा जयघोष करण्यास सुरुवात केली. 



यजमानांना 148 धावाच करता आल्या. शिखर धवन, रिषभ पंत वगळता अन्य फलंदाजांनी निराश केले. बांगलादेशच्या गोलंदाजांची खेळपट्टीचा योग्य वापर करताना टीम इंडियाच्या धावांवर अंकुश ठेवला. भारताचे 6 फलंदाज माघारी परतले. वॉशिंगट सुंदर आणि कृणाल पांड्या यांनी अखेरच्या षटकात काही दमदार फटके मारले. 
कर्णधार रोहित शर्माला मोठी खेळी करण्यात अपयश आले. त्यानं पहिल्या षटकात दोन चौकार खेचून दणक्यात सुरुवात केली, परंतु षटकाच्या अखेरच्या चेंडूवर त्याला तंबूत परतावे लागले. शफिऊल इस्लामने त्याला पायचीत ( LBW) केलं. नॉन स्ट्रायकर एंडला असलेल्या शिखर धवनच्या सल्ल्यानं रोहितनं DRS घेतला. पण, चेंडू त्याच्या यष्टींचा वेध घेऊन जात असल्याचे दिसले आणि रोहितला माघारी परतावे लागले. रोहित अवघ्या 9 धावांत माघारी परतला. त्यानंतर लोकेश राहुलकडून अपेक्षा होती, पण अमिनुल इस्लामच्या गुगलीवर तो सोपी झेल देऊन बाद झाला. 
शिखर धवनची मोठे फटके मारताना चाचपडत होता. दुसऱ्या बाजूनं मात्र श्रेयस अय्यरनं आक्रमक पवित्रा घेतला होता. ही जोडी टीम इंडियाचा डाव सावरण्याचा प्रयत्न करत होती. या दोघांची 34 धावांची भागीदारी अमिनुलने मोडली. त्यानं श्रेयसला 22 धावांवर मोहम्मद नइमच्या हाती झेलबाद केले. भारताच्या 10.2 षटकांत 3 बाद 70 धावा झाल्या होत्या. त्यानंतर सर्वांचे लक्ष कमबॅक करणाऱ्या रिषभ पंतकडे लागले होते. पंत मात्र मोठे फटके खेळताना चाचपडताना दिसला. पण, शिखर आणि रिषभ यांच्यात ताळमेळ जुळलेच नाही. 
15व्या षटकात धवन धावबाद झाला. धवनने 42 चेंडूंत 41 धावा केल्या. पदार्पणवीर शिवम दुबे 1 धावा करून माघारी परतला. फिरकीपटू अफिफ होसैनने त्याच्याच गोलंदाजीवर अफलातून झेल घेत दुबेला माघारी पाठवले. पंतने एका बाजूनं खिंड लढवली, पण भारताला समाधानकारक पल्ला गाठून देता आला नाही. पंतला 27 धावांवर शफिऊलने बाद केले. 


",mr,"











India vs Bangladesh, 1st T20I: Rishabh Pant loses DRS; Fans chanted Mahendra Singh Dhoni
In the first Twenty20 match between India and Bangladesh, Rishabh Pant faced fury.
03 Nov 2019, 16:16 by Online Lokmat
In the first Twenty20 match between India and Bangladesh, Rishabh Pant faced fury. Pant made two mistakes in the tenth over by Yuzvendra Chahal, so fans chanted Mahendra Singh Dhoni's name. The match was played at the Arun Jaitley Stadium in New Delhi. India batted first and scored 148 for six. In reply, Bangladesh were bowled out in the first over, but then Mohammed Naim and Soumya Sarkar shaped Bangladesh's innings. He scored 45 runs in the first powerplay. But, Chahal broke the pair. Mushfiqur Rahim, who came after, could have been dismissed, but Pant's guess was wrong. What exactly happened?



The innings gave up the tenth over of the innings. Rahim was trapped on the third ball, but skipper Rohit Sharma did not take the DRS. In the same over, Pant missed the easy opportunity to run. On the last ball of the over, Pant appealed to Zellabad and asked Rohit to take the DRS. Rohit took DRS at the last minute, but it was wasted. This made the fans very angry and they started shouting 'Dhoni Dhoni'.



The hosts scored 148 runs. Other than Shikhar Dhawan, Rishabh Pant, the batsmen were disappointed. Team India's runs were restrained in the proper use of the Bangladesh bowlers' pitch. Six batsmen from India returned. Washington Sunder and Krunal Pandya made some strong hits in the last over.
Skipper Rohit Sharma failed to make a big run. He started the duck with two fours in the first over, but had to return to the tent at the end of the over. Shafiul Islam trapped him (LBW). Shikhar Dhawan's advice to non-striker end Rohit took DRS. However, the ball seemed to be taking its toll and Rohit had to return. Rohit returned with just 9 runs. Lokesh Rahul was expected later, but he was dismissed with an easy catch on Aminul Islam's googly.
Shikhar Dhawan was hit by a big blow. On the other side, however, Shreyas Iyer had taken an aggressive posture. The duo was trying to beat Team India. Aminul broke the 34-run partnership. He dismissed Shreyas in the hands of Mohammad Naim for 22 runs. India were 70 for 3 in 10.2 overs. After that, Rishabh Pant was catching everyone's attention. Pant, however, appeared to be playing a big blow. However, the synergy between Shikhar and Rishabh has never been compromised.
Dhawan was ruined in the 15th over. Dhawan made 41 off 42 balls. The debutant Shivam Dubey returned with a 1-run stand. Spinner Afif Hossain caught on his own bowling and sent Dube back. Pant struggled from one side, but India could not reach a satisfactory pace. Shafiul was dismissed for 27 by Pant.


"
