,src,lang,text
0,"











Times mager
Steigt auf und leuchtet!
03 Nov 2019, 16:54 by Sylvia Staude

Wer diese Glosse liest, kommt möglicherweise etwas besser durch die dunkle Jahreszeit. 

Das Times mager beantragt hiermit, als Marke einzutragen: „Das Times mager ist das Schönste“, „Das Times mager ist das Größte“, „Jede Times-mager-Leserin ist die Größte“, „Jeder Times-mager-Leser ist der Größte“, „Wer Times mager liest, weiß mehr“, „Wer Times mager liest, steigt auf und leuchtet“. Vielleicht sicherheitshalber noch: „Wer Times mager liest, steigt auf und leuchtet besser“. Besser als wer? Egal.
Steigt auf und leuchtet? Okay, das rollt und rockt auf Englisch als „rise and shine“ natürlich viel besser von der Zunge, aber in den USA wird „rise and shine“ bereits von Kylie Jenner als Markenzeichen beansprucht. Die Milliardärin ist eine von den Kardashians, und sie ist Milliardärin, weil sie erstens nichts ohne Kameracrew auf den Fersen tut, nicht einmal ihr kleines Kind weckt sie ohne TV-Begleitung. Weil sie zweitens dann Klein-Stormi mit einem gesungenen „rise and shine“ im neuen Tag begrüßt. Billionen von Internetnutzern fanden, sie habe total schief gesungen, aber vorher haben sie es geklickt wie wild. Im Kylie-Jenner-Shop (von Klicks wird man nicht reich genug) ist indessen die Handyhülle „I love myself“ heruntergesetzt auf 7,50 kosten die „Rise and Shine“-Hoodies aber weiterhin 65 Dollar. (Denken Sie immer daran: Wer Times mager liest, leuchtet besser und braucht also kein teures Hoodie. Wir benachrichtigen Sie aber, sobald die Times-mager©-Shirts auf dem Markt sind, auf denen Ihnen von der schönsten Feuilleton-Glosse aller Zeiten schriftlich bestätigt wird, dass Sie die Größte/der Größte sind.)
Das Internet aber hatte schon begonnen, die Unverfrorenheit Kylie Jenners zu diskutieren („diskutieren“ ist in diesem Zusammenhang ein, nun ja, elefantengroßer Euphemismus), „rise and shine“ als Trademark zu pachten. Als sich, wenige Tage ist es her, aus New Jersey eine Frau namens Cathy Beggan meldete und angab, die Marke „rise and shine“ bereits seit 2006 zu besitzen in Form einer „Rise-N-Shine“-Produktlinie von Nahrungsergänzungsmitteln und Kosmetika. Sollte aber Jenner bereit sein, Lizenzgebühren zu zahlen, könne man sich gütlich einigen.
Zu einer gütlichen Einigung wäre selbstverständlich auch das Times mager bereit, sollten gewisse Konkurrenz-Glossen behaupten wollen, sie seien schöner, größer, klüger, besser formuliert – und hätten vielleicht auch noch die leuchtenderen Leserinnen und Leser. Abgesehen davon, dass Letzteres schon mal gar nicht sein kann, wären wir einverstanden mit T-Shirt-Formulierungen wie „zweitschönstes“, „zweitgrößtes“ oder auch „beste Sparleuchte auf dem Feuilleton-Glossen-Markt“.


",de,"











Times lean
Get up and shine!
03 Nov 2019, 16:54 by Sylvia Staude

Those who read this gloss may get a little better through the dark season.

The Times Mager hereby petitioned as a trademark: ""The Times Lean is the Fairest,"" ""The Times Lean is the Biggest,"" ""Every Times-lean Reader is the Biggest,"" ""Every Times-lean reader is the greatest ""Who reads Times Meager knows more"", ""Who reads Times Meager, rises and glows"". Maybe for safety's sake: ""If you read Times, lean up and shine better."" Better than who? No matter.
Rises up and lights up? Okay, that rolls and rocks in English as ""rise and shine"" of course much better of the tongue, but in the US ""rise and shine"" is already claimed by Kylie Jenner as a trademark. The billionaire is one of the Kardashians, and she's a billionaire because, first, she does not do anything without a camera crew on her heels, not even her little kid wakes her up without TV support. Because secondly, then, she greets Klein-Stormi with a sung ""rise and shine"" in the new day. Billions of internet users thought she had sung badly, but before that they clicked it wildly. In the Kylie-Jenner-Shop (one does not get enough of clicks), however, the mobile phone case ""I love myself"" is down to 7.50, but the ""Rise and Shine"" Hoodies still cost $ 65. (Remember, Times Times reads better, so you do not need an expensive hoodie, but we'll alert you as soon as the Times-lean © shirts are on the market, telling you of the most beautiful feature ever it is confirmed that you are the largest / the largest.)
However, the Internet had already begun to discuss Kyle Jenner's insolence (""discussing"" in this context is, well, elephant-sized euphemism), leasing ""rise and shine"" as a trademark. When, a few days ago, New Jersey reported a woman named Cathy Beggan, claiming to own the ""rise and shine"" brand since 2006 in the form of a ""Rise N Shine"" line of nutritional supplements and cosmetics. But should Jenner be willing to pay royalties, one could agree amicably.
Of course, the Times would also be willing to reach an amicable agreement if certain competing glosses claim that they are nicer, bigger, smarter, better worded - and perhaps even the more luminous readers. Apart from the fact that the latter can not be, we would agree with T-shirt formulations such as ""second best"", ""second largest"" or ""best saving light on the Feuilleton gloss market"".


"
