,src,lang,text
0,"











Météo: quelques éclaircies dans beaucoup de grisaille mais une température douce

02 Nov 2019, 07:40


Journée morose, ce samedi, qui commence sous la pluie et qui devrait être nuageux mais sec le reste de la journée. Dimanche, toujours des nuages mais quelques éclaircies pourraient faire leur apparition. Le temps restera variable en début de semaine.

Pour ce samedi, on prévoit un risque de quelques averses mais aussi des périodes sèches, surtout dans l’après-midi. Les maxima atteindront 15°C. Il fera venteux avec des rafales jusque 70 km/h.
Durant la nuit de samedi à dimanche, le temps sera souvent sec mais assez nuageux. Les minima tourneront autour de 10°C.
Dimanche, le temps restera souvent très nuageux mais quelques éclaircies par intermittence seront possibles, surtout sur l’ouest en cours d’après-midi. Le temps sera souvent sec, sur le sud du pays le risque de pluie est plus marqué. Les maxima se situeront entre 9°C et 13°C. Le vent sera modéré, généralement de secteur sud à sud-ouest.
Pour lundi, l’IRM prévoit un temps variable avec des périodes de pluie ou d’averses. Quelques coups de tonnerre ne seront exclus l’après-midi et le soir. Les températures évolueront peu avec des maxima entre 9°C et 13°C. Le vent sera toujours modéré de secteur sud à sud-ouest.


",fr,"











Weather: some clear in a lot of greyness but a mild temperature

02 Nov 2019, 07:40


Sluggish day, this Saturday, which begins in the rain and should be cloudy but dry the rest of the day. Sunday, still clouds but some clearings could appear. The time will remain variable at the beginning of the week.

For this Saturday, there is a risk of some showers but also dry periods, especially in the afternoon. The maxima will reach 15 ° C. It will be windy with gusts up to 70 km / h.
During the night from Saturday to Sunday, the weather will be often dry but rather cloudy. The minima will be around 10 ° C.
On Sunday, the weather will often be very cloudy, but some intermittent clearings will be possible, especially on the west during the afternoon. The weather will often be dry, on the south of the country the risk of rain is more marked. The maxima will be between 9 ° C and 13 ° C. The wind will be moderate, generally from south to southwest.
For Monday, the MRI provides a variable time with periods of rain or showers. A few thunderclaps will be excluded in the afternoon and evening. Temperatures will change little with maxima between 9 ° C and 13 ° C. The wind will always be moderate from south to southwest.


"
