,src,lang,text
0,"











വായിലും മൂക്കിലും രക്തം; കാര്യസ്ഥന്റെ മൊഴിവൈരുധ്യം, സംശയം ഉറപ്പിച്ച് ‘കൂടത്തിൽ’
02 Nov 2019, 07:07 by മനോരമ ലേഖകൻ
തിരുവനന്തപുരം ∙ കരമന കാലടി ഉമാമന്ദിരത്തിൽ (കൂടത്തിൽ തറവാട്) ജയമാധവൻ നായരുടെ (63) മരണം കൊലപാതകമെന്നു സംശയിക്കാവുന്ന വിവരങ്ങൾ കേസ് അന്വേഷിക്കുന്ന പൊലീസിന്റെ പ്രത്യേക അന്വേഷണ സംഘത്തിനു ലഭിച്ചു. 

മുഖത്ത് മുറിവുകൾ

ജയമാധവൻ നായരുടെതലയ്ക്കേറ്റ ക്ഷതങ്ങളാണ് മരണകാരണമെന്നു പോസ്റ്റ്മോർട്ടം റിപ്പോർട്ടിലും ആന്തരികാവയങ്ങളുടെ രാസപരിശോധനഫലത്തിലും വ്യക്തമായിരുന്നു. മുഖത്തും മുറിവുകളുണ്ട്. മുഖമിടിച്ചു കമിഴ്ന്നു വീണതായാണു റിപ്പോർട്ടുകൾ വ്യക്തമാക്കുന്നത്.
മുഖത്തു രക്തം കട്ടപിടിച്ച നിലയിലായിരുന്നു. വായിലും മൂക്കിലും രക്തം കയറിയിരുന്നു. മുറിവുകൾ സംഭവിച്ചത് എങ്ങനെയെന്നതു സംബന്ധിച്ച അന്വേഷണമാണ് നടക്കുന്നത്. തള്ളിയിട്ടാൽ ഉണ്ടാകുന്ന മുറിവുകളാണോ എന്നും അങ്ങനെ സംഭവിക്കാനുള്ള സാധ്യതകളുമാണു പരിശോധിക്കുന്നത്. പോസ്റ്റ്മോർട്ടം ചെയ്ത തിരുവനന്തപുരം മെഡിക്കൽ കോളജിലെ ഡോക്ടറിൽ നിന്നു പൊലീസ് വിശദാംശങ്ങൾ ശേഖരിച്ചു. 

ഇടതുകാലിന് സ്വാധീനക്കുറവ്

ജയമാധവൻ നായർക്ക് ഇടതുകാലിനു നേരിയ സ്വാധീനക്കുറവുണ്ടായിരുന്നുവെന്നും ഇതിന്റെ പേരിലാണു രവീന്ദ്രൻ നായർ സഹായിയായി കൂടിയതെന്നും പൊലീസ് പറയുന്നു. ഇടതുകാലിന്റെ സ്വാധീനക്കുറവിന്റെ കാര്യം പോസ്റ്റ്മോർട്ടം റിപ്പോർട്ടിലും പരാമർശിക്കപ്പെടുന്നുണ്ട്. ജയമാധവൻ നായർ ഒട്ടേറെ ഗുളികകൾ കഴിച്ചിരുന്നതായി വീട്ടുജോലിക്കാരി മുൻപ് മൊഴി നൽകിയിരുന്നു.

മൊഴിയിൽ സംശയങ്ങൾ

കട്ടിളപ്പടിയിൽ തട്ടി വീണു ജയമാധവൻ നായർ മരിച്ചതായാണു കാലടിയിലെ നാട്ടുകാർക്കുള്ള വിവരം. കാര്യസ്ഥൻ രവീന്ദ്രൻ നായർ പറഞ്ഞാണ് ഇക്കാര്യങ്ങൾ നാട്ടുകാർ അറിഞ്ഞത്. എന്നാൽ, മരണം നടന്ന 2017 ഏപ്രിൽ 2നു കാര്യസ്ഥൻ കരമന പൊലീസിനു നൽകിയ മൊഴിയിൽ രക്തം വാർന്നൊഴുകിയ കാര്യങ്ങളൊന്നും വിശദീകരിച്ചിരുന്നില്ല.
രാത്രി വാതിൽ ചാരിയിടുകയാണു പതിവെന്നും അങ്ങനെയാണു താൻ രാവിലെ അബോധാവസ്ഥയിൽ കിടന്ന ജയമാധവൻ നായരെ കണ്ടെത്തിയതെന്നും മൊഴിയിലുണ്ട്. ഇക്കാര്യവും പരിശോധിക്കുന്നു. ആശുപത്രിയിലേക്കു കൊണ്ടുപോകാൻ മുൻ കാര്യസ്ഥൻ സഹദേവനും ഉണ്ടായിരുന്നുവെന്നു രവീന്ദ്രൻ നായർ പറഞ്ഞതു സഹദേവൻ നിഷേധിച്ചിട്ടുണ്ട്.


",ml,"











Blood in the mouth and nose; Manager's statement, suspicion confirmed
02 Nov 2019, 07:07 by Manorama Correspondent
The Special Investigation Team of the police has received information that the death of Jayamadhavan Nair, 63, of the Karamana Kaladi Uma Mandiram (Koodathil Tharavadu) was the murder.

Wounds on the face

The autopsy report and chemical analysis of the internal organs revealed that the cause of death was the injuries sustained by Jayamadhavan Nair. There are also wounds on the face. According to reports, he fell flat on his face.
There was blood on his face. There was blood on the mouth and nose. An investigation is underway into how the injuries occurred. The risk of injury is also investigated. The police collected details from a doctor at the Thiruvananthapuram Medical College who did the post-mortem.

Lack of influence on the left leg

According to the police, Jayamadhavan Nair had little influence on his left leg. The lack of impact on the left foot is also mentioned in the autopsy report. The housekeeper had earlier said that Jayamadhavan Nair had taken several tablets.

Doubts on the statement

The natives of Kalady have reported that Jayamadhavan Nair had died after falling into a staircase. The locals were informed of this by Karyastan Raveendran Nair. However, on April 2, 2017, the coroner's statement to the Karamana police did not explain the bloodshed.
It is said that he was reclining at night and that is how he found Jayamadhavan Nair lying unconscious in the morning. This is also being examined. Raveendran Nair has said that former minister Sahadevan was taken to the hospital.


"
