,src,lang,text
0,"











Итоги понедельника на оккупированных территориях Донбасса. Главное

04 Nov 2019, 23:45

В районе проведения операции Объединенных сил 4 ноября вооруженные формирования Российской Федерации и ее наемники 16 раз нарушили режим прекращения огня, - сообщает штаб ООС. Противник обстрелял позиции наших подразделений из запрещенной минскими договоренностями артиллерии калибра 122 мм, минометов калибра 82 и 120 мм, вооружения БМП, гранатометов, крупнокалиберных пулеметов и другого стрелкового оружия.В течение текущих суток потерь вследствие обстрелов среди личного состава Объединенных сил нет.
Из-за мощного обстрела, который совершили на Луганщине вооруженные формирования Российской Федерации и ее наемники 4 ноября у Новотошковского, пришлось эвакуировать местную школу, - сообщает штаб операции Объединеннных сил. ""На время мощного обстрела наших позиций российскими оккупантами в районе Новотошковского детей, находившихся в школе, эвакуировали в бомбоубежище. Жертв среди гражданского населения нет. После окончания обстрела обучение продолжилось"", - сообщили в штабе. Ранее в штабе сообщили, что у Новотошковского оккупанты вели огонь из всего спектра вооружения, начиная со стрелкового оружия и минометов различных калибров и артиллерии калибра 122 мм.
На участке разведения №2 в районе населенного пункта Золотое-4 Луганской области 4 ноября продолжались технические и пиротехнические работы, - сообщает штаб операции Объединенных сил. ""Проходит техническое обследование, разминирование дорог и обочин, очистка местности, загрязненной взрывоопасными предметами"", - сообщили в штабе. При этом в штабе уточнили, что согласно графику указанные работы продлятся до 9 ноября.
Процесс разведение сил и средств на участке разведения сторон №3 (Богдановка и Петровское) в Донецкой области начнется 8 ноября. Об этом сообщил командующий ООС генерал-лейтенант Владимир Кравченко во время пресс-конференции в Краматорске 4 ноября. ""Мы уже предоставили письмо в ОБСЕ. 7 ноября приступаем, 8 ноября - практически разводимся, если не будет нарушен режим тишины"", - сказал Владимир Кравченко. В свою очередь руководитель украинской стороны СЦКК полковник Александр Борщевский отметил, что разведение войск состоится при условии соблюдения режима прекращения огня на протяжении семи дней.
Депутат Государственной думы РФ Алексей Журавлев незаконно пересек границу Украины и посетил Золотое-5 в Луганской области, где проходит разведение сил и средств. Об этом сообщил командующий Операцией ОС генерал-лейтенант Владимир Кравченко во время пресс-конференции в Краматорске 4 ноября. «Обстановка вокруг контролируемая, что по Станице Луганской, что по всему Золотому, кроме Золотого-5, который находится не под контролем Украины и куда попал представитель Госдумы. Он попал туда незаконно», - сказал Владимир Кравченко. Информация о том, что депутат Госдумы РФ Журавлев посетил прежние позиции боевиков «ЛНР» в районе Золотого-5, появилась в сюжете контролируемого боевиками телеканала «News Front». Журавлева сопровождали наблюдатели Специальной мониторинговой миссии ОБСЕ и боевики с нарукавными нашивками синего цвета, так называемого СЦКК.
Руководитель ""представительства"" так называемой ""ДНР"" в СЦКК Руслан Якубов заявил, что Украина якобы срывает договоренности по разведению сил и средств в Петровском. Об этом сообщают подконтрольные боевикам СМИ. При этом представитель боевиков умолчал, что Украина отказалась от разведения из-за того, что на этом участке 30 октября были зафиксированы обстрелы со стороны оккупационных войск. Как сообщалось ранее, 4 ноября на участке ""Петровское – Богдановка"" должен был начаться зеркальный отвод войск. Дата и соответствующий план были согласованы Контактной группой на встрече в Минске 29 октября. Представители так называемой ""народной милиции ДНР"" в понедельник 12 часов произвели запуск белой сигнальной ракеты в Петровском в знак готовности возобновить процесс разведения войск, хотя были заранее предупреждены украинской стороной о том, что до семидневного соблюдения режима тишины на этом участке разведение сил и средств невозможно. 
Незаконные вооруженные формирования обстреляли беспилотный летательный аппарат СММ ОБСЕ в районе Чермалыка, - сообщает штаб Объединенных сил. ""...Представители Миссии с помощью БПЛА типа ""Квадро"" наблюдали за ситуацией в районе населенного пункта Чермалык Донецкой области. Когда летательный аппарат пересек линию разграничения и выполнял свои функции на временно оккупированной территории, в 12.09 противник выпустил в его сторону восемь очередей из стрелкового оружия, а через семь минут - еще 5 очередей. Кроме того, оккупанты совершили попытки влияния на работу БПЛА средствами радиоэлектронной борьбы"", - говорится в сообщении. Представители СММ ОБСЕ, чтобы предотвратить потерю беспилотного летательного аппарата, вынуждены были посадить его в месте взлета, в районе Чермалыка.   
Майор украинской полиции Владимир Стецюк умер во время службы в районе проведения операции Объединенных сил на блокпосту «Лисичанск-Горное» Луганской области. Об этом сообщает Нацполиция Украины. В сообщении отмечается, что майору полиции было 47 лет. ""Последние полтора года нес службу в составе роты патрульной полиции особого назначения «Тернополь». Вместе с побратимами неоднократно выполнял боевые задачи на востоке государства, где всегда проявлял мужество, стойкость и профессионализм"", - говорится в сообщении.
В оккупированном Донецке задолженность жителей только за квартплату составляет более 500 миллионов российских рублей. Об этом заявил начальник управления ЖКХ оккупационной администрации Донецка Валерий Литвинов в комментарии оккупационным СМИ. ""У нас сегодня более полумиллиарда - долг только по квартплате…"", - сказал он. При этом, по словам Литвинова, в оккупированном Донецке есть домовладельцы, имеющие десятки квартир и не оплачивающие при этом их содержание. ""Некоторые жители имеют по 15-17 квартир и долг до миллиона (рублей - ""ОстроВ"")"", - сказал он, не назвав фамилии должников. Литвинов добавил, что долг пытаются взыскать через ""суд"". 

МАТЕРИАЛЫ ПО ТЕМЕ












",ru,"











Monday results in the occupied territories of Donbass. the main thing

04 Nov 2019, 23:45

In the area of the operation of the United Forces on November 4, the armed formations of the Russian Federation and its mercenaries violated the ceasefire 16 times, the OOS headquarters reports. The enemy fired on the positions of our units from 122 mm artillery banned by the Minsk agreements, 82 and 120 mm mortars, BMP armaments, grenade launchers, heavy machine guns and other small arms. There are no casualties from the personnel of the United Forces over the current day.
Because of the powerful shelling that the armed groups of the Russian Federation and its mercenaries carried out on Nov. 4 at Novotoshkovsky in Lugansk region, the local school had to be evacuated, the headquarters of the operation of the United Forces reports. ""During the powerful shelling of our positions by Russian invaders in the Novotoshkovsky district, children who were at school were evacuated to a bomb shelter. There were no civilian casualties. After the shelling, training continued,"" the headquarters said. Earlier, the headquarters reported that at Novotoshkovsky the invaders fired from the entire spectrum of weapons, starting with small arms and mortars of various calibers and 122 mm artillery.
On November 4, technical and pyrotechnic work continued at the breeding site No. 2 in the area of the Zolotoye-4 settlement of the Luhansk region, the headquarters of the United Forces operation reported. ""A technical examination is underway, clearance of roads and curbs, cleaning of the area contaminated with explosive objects,"" the headquarters said. At the same time, the headquarters clarified that according to the schedule, these works will last until November 9.
The process of the separation of forces and assets at the breeding section No. 3 (Bogdanovka and Petrovskoye) in the Donetsk region will begin on November 8. This was announced by the OOS commander, Lieutenant General Vladimir Kravchenko during a press conference in Kramatorsk on November 4. ""We have already submitted a letter to the OSCE. We are starting on November 7, November 8 - practically getting divorced if the silence regime is not violated,"" said Vladimir Kravchenko. In turn, the head of the Ukrainian side of the JCCC, Colonel Alexander Borschevsky, noted that the withdrawal of troops will be subject to a ceasefire for seven days.
A deputy of the State Duma of the Russian Federation Alexei Zhuravlev illegally crossed the border of Ukraine and visited Zolotoe-5 in the Luhansk region, where a separation of forces and assets is taking place. This was announced by the commander of the Operation OS, Lieutenant General Vladimir Kravchenko during a press conference in Kramatorsk on November 4. “The situation around is controlled, that on the Village of Lugansk, that on everything Golden, except for Golden-5, which is not under the control of Ukraine and where the representative of the State Duma got. He got there illegally, ”said Vladimir Kravchenko. The information that the State Duma deputy Zhuravlev visited the former positions of the ""LPR"" militants in the Zolotoy-5 area appeared in the plot of the News Front TV channel controlled by the militants. Zhuravlev was accompanied by observers from the OSCE Special Monitoring Mission and militants with blue sleeve insignia, the so-called CCTSK.
The head of the “representative office” of the so-called “DPR” in the JCCC, Ruslan Yakubov, said that Ukraine allegedly disrupts the arrangements for the separation of forces and assets in Petrovsky. This is reported by media controlled by the militants. At the same time, the representative of the militants said that Ukraine refused to breed due to the fact that shelling by the occupying forces was recorded on this site on October 30. As previously reported, on November 4, a mirror withdrawal of troops was to begin on the Petrovskoye-Bogdanovka section. The date and the corresponding plan were agreed by the Contact Group at a meeting in Minsk on October 29. Representatives of the so-called “People’s Police of the DPR” launched a white flare rocket in Petrovsky on Monday at 12 o’clock as a sign of readiness to resume the process of troop withdrawal, although they were warned in advance by the Ukrainian side that it was not possible to withdraw forces and assets before seven days of silence. .
Illegal armed groups fired at the unmanned aerial vehicle of the OSCE SMM in the Chermalyk area, the headquarters of the United Forces said. ""... Representatives of the Mission with the help of UAVs of the type"" Quadro ""observed the situation in the area of the settlement Chermalyk of Donetsk region. When the aircraft crossed the demarcation line and performed its functions in the temporarily occupied territory, at 12.09 the enemy fired eight lines of rifle weapons, and after seven minutes - 5 more bursts. In addition, the invaders made attempts to influence the operation of UAVs by electronic warfare, ""the report said. Representatives of the OSCE SMM, in order to prevent the loss of an unmanned aerial vehicle, were forced to land it at the take-off site, in the Chermalyk area.
The Ukrainian police major Volodymyr Stetsyuk died while serving in the area of the United Forces operation at the Lysychansk-Gornoye checkpoint in the Luhansk region. It is reported by the National Police of Ukraine. The report notes that the police major was 47 years old. “For the past year and a half, he served in the company of the Ternopol special-purpose patrol police. Together with his twin brothers, he repeatedly performed combat missions in the east of the country, where he always showed courage, stamina and professionalism,” the statement said.
In occupied Donetsk, the debt of residents for rent alone is more than 500 million Russian rubles. This was stated by the head of the housing and communal services of the occupation administration of Donetsk Valery Litvinov in a comment by the occupation media. “Today we have more than half a billion - debt only on rent ...”, he said. Moreover, according to Litvinov, in occupied Donetsk there are homeowners who have dozens of apartments and do not pay for their maintenance. ""Some residents have 15-17 apartments and a debt of up to a million (rubles - OstroV""), ""he said, without giving the names of the debtors. Litvinov added that they are trying to collect the debt through a “court”.

MATERIALS ON THE TOPIC












"
