,src,lang,text
0,"











Wesley Safadão critica Mileide Mihaile por dar arma de brinquedo para filho deles
Ex-mulher do cantor provocou polêmica ao publicar vídeo em que menino segura arma

04 Nov 2019, 23:33


São Paulo

O cantor Wesley Safadão, 31, criticou a ex-mulher, Mileide Mihaile, por ela ter dado uma arma de brinquedo para o filho deles Yhudy, 8.
Na última semana, a influenciadora digital provocou polêmica na internet ao publicar um vídeo em suas redes sociais em que o menino aparece fantasiado para o Halloween e segura uma arma de brinquedo nas mãos. 
Depois de receber várias críticas de internautas, Mihaile apagou o vídeo. Em nota encaminhada ao quadro A Hora da Venenosa, apresentado por Fabíola Reipert, na Record, a assessoria de imprensa do cantor diz que ele não concorda que a criança tenha esse tipo de brinquedo. 



Gallery: Imagens de Wesley Safadão


""Quando Yhudy está sob a guarda da mãe, Wesley não tem como ter controle sobre a rotina e as atividades que realizam juntos. Em relação à fantasia utilizando a arma de brinquedo, Wesley discorda e repudia totalmente"", informou. 
Na nota, a assessoria também afirmou que o cantor tem muito cuidado com a formação de seus três filhos e sempre que o menino está em sua companhia ""recebe toda orientação e suporte, supervisionando suas brincadeiras, amizades e acesso à internet"".
""Além disso, Wesley sempre conversa bastante com todos os filhos no intuito de gerar uma consciência humana e ajudá-los a seguir o caminho do bem"", informou a nota. 
Mihaile e Safadão já tiveram diversos desentendimentos, inclusive judiciais, mas em julho deste ano a influenciadora disse que está em paz com o ex-marido. Eles ficaram juntos por oito anos e são pais de Yhudy.  
Em 2012, o cantor começou a se relacionar Thyane Dantas. Eles tiveram a primeira filha, Ysis, em 2014. Eles se casaram em 2016 e em setembro de 2018 nasceu Dom, segundo filho do casal. 


",pt,"











Wesley Safadão criticizes Mileide Mihaile for giving their son a toy gun
The singer's ex-wife provoked controversy by posting video in which boy holds gun

04 Nov 2019, 23:33


Sao Paulo

Singer Wesley Safadão, 31, criticized his ex-wife, Mileide Mihaile, for giving her a toy gun to their son Yhudy, 8.
Last week, the digital influencer sparked controversy on the Internet by posting a video on her social networks in which the boy appears in costume for Halloween and holds a toy gun in his hands.
After receiving several reviews from netizens, Mihaile deleted the video. In a note sent to the picture A Hora da Poenosa, presented by Fabíola Reipert, on Record, the press office of the singer says that he does not agree that the child has this type of toy.



Gallery: Images of Wesley Safadão


""When Yhudy is under the care of her mother, Wesley has no control over their routine and activities together. In relation to fantasy using the toy gun, Wesley totally disagrees and repudiates,"" he said.
In the note, the press office also stated that the singer is very careful about the formation of his three children and whenever the boy is in his company ""receives all guidance and support, supervising their play, friendships and internet access.""
""In addition, Wesley always talks a lot with all his children in order to generate a human conscience and help them follow the path of good,"" the statement said.
Mihaile and Safadão have had a number of disagreements, including lawsuits, but in July this year the influencer said she is at peace with her ex-husband. They have been together for eight years and are parents of Yhudy.
In 2012, the singer began to relate Thyane Dantas. They had their first daughter, Ysis, in 2014. They were married in 2016 and in September 2018 was born Dom, the couple's second son.


"
