,src,lang,text
0,"











Украина и Финляндия обсудили двусторонние отношения в оборонной сфере

04 Nov 2019, 23:51


Заместитель министра обороны Украины Александр Полищук и генеральный директор Департамента оборонной политики Министерства обороны Финляндии Яанне Куусела обсудили двусторонние отношения в оборонной сфере.

Об этом сообщает пресс-служба Министерства обороны Украины.
Согласно сообщению, сегодня состоялась встреча между заместителем министра обороны Александром Полищуком и делегацией Финляндии.
Полищук ознакомил иностранных коллег о состоянии реформирования военного ведомства, а также о приоритетных направлениях деятельности Минобороны для дальнейшего развития и усиления возможностей украинской армии.
""Финская сторона подтвердила неизменность своей позиции относительно поддержки территориальной целостности и независимости Украины, а также готовность к дальнейшему наращиванию сотрудничества между оборонными ведомствами двух стран"", - отметили в ведомстве.
Напомним, ранее министр иностранных дел Финляндии Пекка Хаависто подтвердил дополнительный взнос в размере 600 тыс. евро на разминирование на Донбассе.

читайте также







",ru,"











Ukraine and Finland discussed bilateral relations in the defense sector

04 Nov 2019, 23:51


Deputy Minister of Defense of Ukraine Oleksandr Polishchuk and Director General of the Department of Defense Policy of the Ministry of Defense of Finland Jaanne Kuusela discussed bilateral relations in the defense sector.

This was reported by the press service of the Ministry of Defense of Ukraine.
According to the report, today a meeting was held between the Deputy Minister of Defense Alexander Polishchuk and the delegation of Finland.
Polishchuk informed his foreign colleagues about the state of reforming the military department, as well as about the priority areas of the Ministry of Defense for the further development and strengthening of the capabilities of the Ukrainian army.
""The Finnish side has confirmed the invariability of its position regarding the support of the territorial integrity and independence of Ukraine, as well as its readiness to further increase cooperation between the defense departments of the two countries,"" the department said.
We will remind, earlier the Minister of Foreign Affairs of Finland Pekka Haavisto confirmed an additional contribution of 600 thousand euros for mine clearance in the Donbass.

read also







"
