,src,lang,text
0,"











Ex-Twitter-Mitarbeiter sollen für Saudi-Arabien spioniert haben
Mitarbeiter von Twitter sollen ihren Job dazu genutzt haben, um private Informationen von Kritikern der saudi-arabischen Regierung zu beschaffen. Das geht aus Unterlagen des US-Justizministeriums hervor.

07 Nov 2019, 02:12

Das US-Justizministerium wirft zwei früheren Twitter-Mitarbeitern vor, für Saudi-Arabien spioniert zu haben. Die Vorwürfe wurden am Mittwoch vor einem Bezirksgericht in San Francisco bekannt gemacht. Den Unterlagen zufolge sollen die beiden Männer, ein US-Bürger und ein Bürger aus Saudi-Arabien, ihre Stellung bei dem Internetkonzern dazu benutzt haben, private Kontoinformationen von Regierungskritikern zu beschaffen.
Spionagevorwürfe wurden auch gegen einen dritten Mann aus Saudi-Arabien erhoben: Er habe Kontakt zu einem Vertreter der saudi-arabischen Regierung gehalten, der die mutmaßlichen Spione angeleitet habe.
Dem Sender CNN zufolge wurde der verdächtige US-Bürger am Dienstag in Seattle festgenommen. Die beiden anderen Männer würden sich vermutlich in Saudi-Arabien aufhalten, hieß es.
Das amerikanische Gesetz schütze US-Firmen vor derartiger ""rechtswidriger Fremdeinmischung"", zitierte die ""Washington Post"" aus einer Mitteilung von David Anderson, Ankläger des Justizministeriums. Ziel der Gruppe war es demnach, aus den internen Systemen des Onlinedienstes ""persönliche Informationen über bekannte saudi-arabische Kritiker und Tausende andere Twitter-Nutzer"" zu gewinnen.
Laut der Beschwerdeschrift waren die Twitter-Mitarbeiter von 2013 bis 2015 bei dem Kurznachrichtendienst tätig. Sie sollen für ihre Spionagedienste Geld erhalten haben; einer der Männer bekam demnach auch eine wertvolle Uhr.
Von Twitter hieß es in einer Erklärung, man sei dem FBI und dem Justizministerium dankbar. Man sei sich bewusst, wie weit Akteure mit üblen Absichten zu gehen bereit seien, ""um unseren Dienst zu beschädigen"".

Anmerkung: In einer früheren Version hieß es, Twitter habe erklärt, schlechte Schauspieler seien bereit, dem Dienst zu schaden. Wir haben die Stelle angepasst.


aar/dpa/AFP



",de,"











Ex-Twitter employees are said to have spied for Saudi Arabia
Twitter employees are said to have used their job to obtain private information from critics of the Saudi Arabian government. This is the result of documents from the US Department of Justice.

07 Nov 2019, 02:12

The US Department of Justice accused two former Twitter employees of spying on Saudi Arabia. The allegations were made public on Wednesday in a district court in San Francisco. According to the documents, the two men, a US citizen and a citizen of Saudi Arabia, have used their position in the Internet company to obtain private account information from government critics.
Espionage was also raised against a third man from Saudi Arabia: he was in contact with a representative of the Saudi Arabian government who had led the suspected spies.
According to CNN, the suspected US citizen was arrested on Tuesday in Seattle. The other two men would probably be in Saudi Arabia, it said.
American law protects US companies against such ""unlawful foreign interference,"" the Washington Post quoted in a statement by David Anderson, prosecutor of the Department of Justice. The group's goal was to ""extract personal information about well-known Saudi Arabian critics and thousands of other Twitter users"" from the online service's internal systems.
According to the complaint, the Twitter staff worked for the Short Message Service from 2013 to 2015. They should have received money for their intelligence services; one of the men therefore got a valuable watch.
Twitter said in a statement that they were grateful to the FBI and the Ministry of Justice. One was aware of how far actors with malicious intentions were willing to go ""in order to damage our service"".

Note: In an earlier version, Twitter said that bad actors are willing to harm the service. We have adjusted the position.


aar / dpa / AFP



"
