,src,lang,text
0,"











ANTONELLO NICOSIA ARRESTATO PER MAFIA/ “Vicino a Messina Denaro”: ira M5s
Antonello Nicosia, arrestato radicale per mafia. Audio choc “Messina Denaro mio premier”. M5s: “Parole inaccettabili”.
04 Nov 2019, 17:25 by Niccolò Magnani
Anche Antonello Nicosia coinvolto nell’operazione antimafia a Sciacca: l’esponente dei Radicali, collaboratore della deputata Occhionero di Italia Viva, è accusato di essere stato un favoreggiatore dei boss più vicini al latitante Matteo Messina Denaro. Nicosia ha incontrato infatti diversi boss detenuti in istituti di pena di alta sicurezza e nelle intercettazioni rivolgeva insulti pesantissimi al magistrato Giovanni Falcone. Un fatto di cronaca che ha sconvolto il mondo politico, ecco la presa di posizione del Movimento 5 Stelle: «Parole inaccettabili, che lasciano sgomenti. Secondo la magistratura Nicosia, collaboratore di una deputata di Italia Viva, avrebbe approfittato del suo ruolo nelle istituzioni per effettuare visite nelle carceri siciliane, facendo da tramite tra i boss in cella, di cui alcuni al 41 bis, e i clan. Vergognose anche le sue intercettazioni su Giovanni Falcone. La mafia va combattuta con ogni mezzo!». (Aggiornamento di Massimo Balsamo)
ANTONELLA NICOSIA ARRESTATO PER MAFIA
Il mondo della politica, seppur marginalmente, torna nella bufera questa mattina dopo l’arresto di Antonello Nicosia, esponente dei Radicali e collaboratore della deputata oggi in Italia Viva (ma eletta in LeU) Pina Occhionero: la Procura di Palermo ha fermato lui e altre 4 persone accusate a vario titolo di associazione mafiosa e favoreggiamento. Tra i nomi “big” appunto oltre a Nicosia, anche il presunto capomafia Accursio Dimino: le accuse sono gravissime e come riporta l’Ansa, la Procura è convinta che Nicosia facesse da tramite tra capimafia, alcuni dei quali addirittura al 41 bis, e i clan all’esterno riportando ordini, messaggi e direttive. Nelle intercettazioni choc riportate, solo in parte, da Fatto Quotidiano e altri quotidiani online questa mattina si evincono diversi passaggi in cui Nicosia rivolgeva insulti pesantissimi a Falcone e Borsellino, tesseva le lodi di Messina Denaro e mostrava piena dedizione per Accursio Dimino, fedelissimo del boss più ricercato d’Italia e già scarcerato nel 2016 dopo due condanne per associazione mafiosa interamente scontate (tra l’altro appena uscito di galera e, secondo gli inquirenti, tornato al suo posto al vertice della famiglia mafiosa di Sciacca). In attesa di capire le posizioni e le difese tanto di Nicosia quanto di Dimino, sono le intercettazioni ad impressionare ancora una volta delle indagini che a livello mediatico “promettono” di avere un impatto devastante.
ANTONELLO NICOSIA, LE INTERCETTAZIONI CHOC
Nicosia è accusato di aver sfruttato con le visite e ispezioni nelle carceri, frutto del lavoro come esponente dei Radicali, per portare e farsi tramite di messaggi per altri boss fuori dalla galera: accusa infamante dalla quale dovrà ovviamente difendersi a pieno diritto, ma con il “macigno” di intercettazioni come queste. «Matteo Messina Denaro è il nostro primo ministro», oppure attraversando la strada che porta all’aeroporto di Palermo – riporta il Fatto – dedicato ai giudici Falcone e Borsellino, attaccava «È stato un incidente sul lavoro. All’aeroporto bisogna cambiare il nome. Non va bene Falcone e Borsellino. Perché dobbiamo arriminare (continuare a vedere, ndr) sempre la stessa merda». L’accusa dei pm è tanto netta quanto gravissima: «Antonello Nicosia, sfruttando il baluardo dell’appartenenza politica. Nicosia ha addirittura portato avanti l’ambizioso progetto di alleggerire il regime detentivo speciale di cui all’art. 41 bis o di favorire la chiusura di determinati istituti penitenziari giudicati inidonei a garantire un trattamento dignitoso ai reclusi», scrivono i giudici nel decreto di arresto. Un primo commento arriva anche dalla deputata di Italia Viva Pina Occhionero alle cui dipendenza lavorava Nicosia prima dell’arresto: «Ringrazio la magistratura e le forze dell’ordine per lo straordinario lavoro di contrasto alla mafia. Da ciò che emerge dalle notizie riportate sui giornali quello che diceva e scriveva Nicosia era ben lontano dalla verità, arrivando a veicolare messaggi mafiosi per conto dei detenuti. Quello che si legge nelle intercettazioni è comunque vergognoso e gravissimo. La collaborazione con me durata solo quattro mesi, era nata in virtù del suo curriculum, in cui si spacciava per docente universitario oltre che di studioso dei diritti dei detenuti. Non appena ho avuto modo di rendermi conto che il suo curriculum e i suoi racconti non corrispondevano alla realtà – conclude – ho interrotto la collaborazione».

Ti potrebbe interessare anche









",it,"











ANTONELLO NICOSIA ARRESTED FOR MAFIA / ""Near Messina Denaro"": wrath M5s
Antonello Nicosia, radical arrested for mafia. Audio choc ""Messina Denaro mio premier"". M5s: ""Unacceptable words"".
04 Nov 2019, 17:25 by Niccolò Magnani
Also Antonello Nicosia involved in the anti-mafia operation in Sciacca: the Radical exponent, a collaborator of the deputy Occhionero of Italy Viva, is accused of having been a facilitator of the bosses closest to the fugitive Matteo Messina Denaro. In fact, Nicosia has met with several bosses held in high security punishment institutions and in the interceptions turned heavy insults to magistrate Giovanni Falcone. A news story that has upset the political world, here is the position taken by the 5 Star Movement: «Unacceptable words, which leave us appalled. According to the magistracy, Nicosia, a collaborator of a deputy of Italia Viva, would have taken advantage of her role in the institutions to make visits to Sicilian prisons, acting as intermediary between the bosses in the cell, some of them in 41 bis, and the clans. His interceptions on Giovanni Falcone are also shameful. The mafia must be fought by any means! "" (Update by Massimo Balsamo)
ANTONELLA NICOSIA ARRESTED FOR MAFIA
The world of politics, albeit marginally, returns to the storm this morning after the arrest of Antonello Nicosia, a member of the Radicals and a contributor to the deputy today in Italy Viva (but elected to the UN) Pina Occhionero: the prosecutor's office of Palermo has stopped him and others 4 people accused of being a mafia association and aiding and abetting Among the ""big"" names, in addition to Nicosia, is the presumed headmaster Accursio Dimino: the accusations are very serious and as stated by the Ansa, the prosecutor's office is convinced that Nicosia acted as intermediary between the mafia bosses, some of them even in 41a, and outside clan reporting orders, messages and directives. In the shock interceptions reported, only in part, by Fatto Quotidiano and other online newspapers this morning we deduce various passages in which Nicosia turned heavy insults to Falcone and Borsellino, praised Messina Denaro and showed full dedication to Accursio Dimino, loyal to the boss most sought after in Italy and already released from prison in 2016 after two convictions for a fully discounted mafia association (among other things, just released from prison and, according to investigators, returned to his post at the head of the Sciacca mafia family). Waiting to understand the positions and the defenses of both Nicosia and Dimino, it is the interceptions that once again impress the investigations that at the media level ""promise"" to have a devastating impact.
ANTONELLO NICOSIA, THE CHOC INTERCEPTIONS
Nicosia is accused of having exploited with visits and inspections in prisons, the result of work as an exponent of the Radicals, to bring and become messages through other bosses out of jail: a shameful accusation from which he must obviously defend himself fully, but with the ""Boulder"" of interceptions like these. ""Matteo Messina Denaro is our prime minister"", or by crossing the road that leads to Palermo airport - reports the fact - dedicated to the judges Falcone and Borsellino, he attacked ""It was an accident at work. At the airport you need to change the name. Falcone and Borsellino are no good. Because we have to stop (keep seeing, ed) always the same shit ». The prosecutors' accusation is as clear as it is serious: ""Antonello Nicosia, taking advantage of the bulwark of political belonging. Nicosia has even carried out the ambitious project to lighten the special detention regime under art. 41 bis or to favor the closure of certain penitentiary institutes judged to be unsuitable for guaranteeing dignified treatment to prisoners, ""the judges write in the arrest decree. A first comment also comes from the Italian deputy Viva Pina Occhionero whose dependency worked Nicosia before the arrest: ""I thank the judiciary and the police for the extraordinary work of contrasting the mafia. From what emerges from the news reported in the newspapers what Nicosia said and wrote was far from the truth, coming to convey mafia messages on behalf of the prisoners. What is read in the interceptions is however shameful and very serious. The collaboration with me lasted only four months, it was born by virtue of his resume, in which he pretended to be a university professor as well as a scholar of the rights of prisoners. As soon as I got to the point of realizing that his curriculum and his stories did not correspond to reality - he concludes - I interrupted the collaboration "".

You might also be interested









"
