,src,lang,text
0,"











NÓNG: Nghi án chồng giết vợ con rồi nhảy lầu tự tử
04 Nov 2019, 17:00 by A.Đ (tổng hợp)
Công an Bến Tre đang điều tra vụ án hai mẹ con bị sát hại xảy ra tại xã Tân Thạch, huyện Châu Thành Bến Tre.    
Ảnh minh họa. Nguồn: Internet
Thông tin trên báo VNN: Theo thông tin ban đầu, tối 2/11, Công an xã Tân Thạch nhận được tin báo của người dân có án mạng xảy ra tại nhà bà Bùi Thị L (48 tuổi, ngụ ấp Tân An Thượng). 
Lúc lực lượng có mặt thì phát hiện bà L và Bùi Lê Hoàng Hồng N (17 tuổi, con gái của bà L) chết trong nhà.
Ngoài sân, công an phát hiện ông Từ Thế Bảo (57 tuổi, chồng của bà L) đang bị thương. Ông Bảo đã được đưa đi cấp cứu tại Bệnh viện Quân y 120 (Tiền Giang).
Được biết, trước đây bà L và ông Bảo xảy ra mâu thuẫn. Ông Bảo về Tiền Giang sinh sống. Thời gian sau, ông này trở về nhà sống với vợ. Đến tối 2/11 thì xảy ra sự việc. 
Theo Pháp luật TP.HCM: Công an lấy lời khai, ông Bảo khai nhận đã dùng dao và tuýp sắt sát hại vợ và con gái, sau đó nhảy lầu tự tử.
Vụ việc đang được Công an tỉnh Bến Tre tiếp tục điều tra làm rõ.


",vi,"











HOT: Suspected of killing husband and wife then jumping suicide
04 Nov 2019, 17:00 by A.D (synthesized)
Ben Tre police are investigating the case of the mother and son murdered in Tan Thach commune, Chau Thanh district, Ben Tre.
Illustration. Source: Internet
Information on the VNN newspaper: According to initial information, on the evening of November 2, the police of Tan Thach commune received a notice of the people who had the murder occurring at the house of Ms. Bui Thi L (48 years old, living in Tan An Thuong hamlet). .
When the force was present, it was discovered that Ms. L and Bui Le Hoang Hong N (17 years old, her daughter L) died in the house.
In the yard, police discovered Mr. Xu The Bao (57 years old, Mrs. L's husband) was injured. Mr. Bao was taken to an emergency at Military Hospital 120 (Tien Giang).
It is known that Mrs. L and Mr. Bao had a conflict before. Mr. Bao returned to live in Tien Giang. Some time later, he returned home to live with his wife. By the evening of 2/11, the incident.
According to the law of Ho Chi Minh City: The police took the testimony, Mr. Bao claimed that he used his knife and metal tube to kill his wife and daughter, then jumped to the floor to kill himself.
The case is under investigation by the Ben Tre Province Police.


"
