,src,lang,text
0,"











Alfa Romeo bez zmian na kolejny sezon

04 Nov 2019, 17:01







Kierowcy F1 na torze Monza



Kubica: Miałem nadzieję na łatwiejszy powrót



Robert Kubica zwrócił się do kibiców



Robert Kubica odchodzi z ROKiT Willams Racing

Raikkonen i Giovinazzi zostają w Alfa Romeo na kolejny sezon Foto: SID | Video: Getty Images

Antonio Giovinazzi pozostanie kierowcą Alfa Romeo w następnym sezonie - taką informację przekazał w poniedziałek zespół. Partnerem Włocha pozostanie Kimi Raikkonen.
- Antonio okazał się być bardzo szybkim kierowcą (...) i spodziewamy się, że będzie rozwijał się wraz z coraz większym doświadczeniem. Jego opinie techniczne, etyka pracy i pozytywne podejście pomogą nam kontynuować rozwój zespołu, podobnie jak konsekwencja w postaci niezmienionego składu na następny sezon - powiedział szef zespołu Alfa Romeo, Frederic Vasseur.



Nadzieje na lepszy sezon
Duże nadzieje z kolejnym sezonem w zespole wiąże również 25-letni kierowca, który zwraca uwagę, że w przyszłym sezonie nie będzie już debiutantem i dla jego wyników nie będzie już żadnych wymówek. - W tym roku wiele się nauczyliśmy i jestem pewien, że możemy zrobić duży krok naprzód w przyszłym sezonie - mówi Giovinazzi.
W mijającym sezonie Antonio Giovinazzi zdobył 4 punkty i zajmuje w klasyfikacji kierowców 18. miejsce, wyprzedzając tylko kierowców Williamsa: Roberta Kubicę i George'a Russella. Doświadczony Fin, były mistrz świata Kimi Raikkonen z dorobkiem 31 punktów zajmuje 14. miejsce. W klasyfikacji konstruktorów ekipa Alfa Romeo zajmuje po 19 wyścigach 8 pozycję.
Dominacja Mercedesa
Po niedzielnym Grand Prix USA szósty w karierze tytuł mistrza świata zapewnił sobie Brytyjczyk Lewis Hamilton, a w klasyfikacji konstruktorów niezagrożenie prowadzi ekipa Mercedesa. Do zakończenia sezonu pozostały jeszcze dwa wyścigowe weekendy: w Brazylii (15-17 listopada) oraz w Abu Dhabi (29 listopada - 1 grudnia).
Autor: mc/TG / Źródło: eurosport.pl, PAP


",pl,"











Alfa Romeo unchanged for the next season

04 Nov 2019, 17:01







F1 drivers on the Monza track



Kubica: I was hoping for an easier return



Robert Kubica turned to the fans



Robert Kubica leaves ROKiT Willams Racing

Raikkonen and Giovinazzi stay at Alfa Romeo for the next season. Photo: SID | Video: Getty Images

Antonio Giovinazzi will remain the driver of Alfa Romeo next season - this was the information the team gave on Monday. Kimi Raikkonen will remain the Italian partner.
- Antonio turned out to be a very fast driver (...) and we expect him to develop with more and more experience. His technical opinions, work ethics and a positive approach will help us continue the team's development, as well as consistency in the form of unchanged composition for the next season - said the head of the Alfa Romeo team, Frederic Vasseur.



Hopes for a better season
The 25-year-old driver also has high hopes for the next season in the team, who points out that next season he will no longer be a rookie and there will be no excuses for his results. ""We have learned a lot this year and I'm sure we can take a big step forward next season,"" says Giovinazzi.
In the past season, Antonio Giovinazzi scored 4 points and ranks 18th in the driver classification, ahead of only Williams drivers Robert Kubica and George Russell. Experienced Finn, former world champion Kimi Raikkonen with the achievements of 31 points ranks 14th. After 19 races, the Alfa Romeo team is ranked 8th in the constructors' classification.
Mercedes domination
After Sunday's US Grand Prix, the sixth career in the world won the British champion Lewis Hamilton, and the Mercedes team leads in the constructors' classification. There are two racing weekends left until the end of the season: in Brazil (November 15-17) and in Abu Dhabi (November 29 - December 1).
Author: mc / TG / Source: eurosport.pl, PAP


"
