,src,lang,text
0,"











El CF Pobla de Mafumet y el Banyoles empatan a cero en el Municipal Pobla de Mafumet
03 Nov 2019, 19:20 by SPORT.es

El Pobla de Mafumet vio cómo se le escapan dos puntos en casa frente al Banyoles

El partido celebrado este domingo en el Municipal Pobla de Mafumet y que enfrentó al Pobla de Mafumet y al Banyoles acabó con un empate a cero entre ambos contendientes. Los dos equipos venían de cosechar resultados dispares en sus últimos partidos. El CF Pobla de Mafumet llegó con la intención de recuperar la senda de la victoria después de sufrir una derrota por 1-0 en el partido anterior ante el Sant Andreu. En el lado de los visitantes, el Banyoles venció en sus dos últimos encuentros de la competición contra el Reus Deportiu en su estadio y el Castelldefels a domicilio, por 3-0 y 2-3 respectivamente. Con este marcador, el conjunto pobletano es primero tras la finalización del duelo, mientras que el Banyoles es décimo.
En la primera parte ninguno de los equipos estuvo acertado de cara al gol, por lo que los primeros 45 minutos concluyeron con el mismo resultado de 0-0.
Ninguno de los equipos consiguió marcar en la segunda parte, por lo que el partido acabó con un marcador de 0-0.
Los entrenadores realizaron todos los cambios posibles. Por parte del equipo local saltaron desde el banquillo Koucha Karim, Cissé y Guillem Martinez en sustitución de Sanz, Guille y Bernat, mientras que los cambios por parte del conjunto visitante fueron Majó, Abouhafs y Mercader, que entraron por Del Pozo, Adrià Casanova y Henry.
El árbitro mostró tres tarjetas amarillas, una de ellas al Pobla de Mafumet (concretamente a Guille) y dos al Banyoles (Bastidas y Turón).
Tras este empate al concluir el partido, el CF Pobla de Mafumet se colocó en el primer puesto de la tabla con 26 puntos, en lugar de acceso al playoff de primeros de grupo de ascenso a Segunda B. Por su parte, el Banyoles con este punto consiguió la décima plaza con 15 puntos al finalizar el partido.
La próxima jornada de liga enfrentará al CF Pobla de Mafumet fuera de casa contra el CE Europa, mientras que el Banyoles se enfrentará en su feudo ante el Igualada.


Ficha técnica



CF Pobla de Mafumet:

Arnau, Sergi Caballero, Cardona, Pol Domingo, Figueras, Sanz (Koucha Karim, min.46), Bernat (Guillem Martinez, min.80), Garcia, Guille (Cissé, min.66), Carreón y Molina Guerrero



Banyoles:

Martí, Turón, Congost, Quimo, Bastidas, Guell, Moreno, Bech, Henry (Mercader, min.87), Del Pozo (Majó, min.76) y Adrià Casanova (Abouhafs, min.80)



Estadio:

Municipal Pobla de Mafumet



Goles:

0-0




",es,"











CF Pobla de Mafumet and Banyoles tie to zero at the Municipal Pobla de Mafumet
03 Nov 2019, 19:20 by SPORT.es

El Pobla de Mafumet saw two points escape at home in front of Banyoles

The game held this Sunday at the Municipal Pobla de Mafumet and which faced the Pobla de Mafumet and Banyoles ended with a zero draw between the two contestants. The two teams came from reaping disparate results in their last games. CF Pobla de Mafumet arrived with the intention of recovering the path of victory after suffering a 1-0 defeat in the previous match against Sant Andreu. On the visitors side, Banyoles won in their last two games of the competition against Reus Deportiu in their stadium and Castelldefels at home, by 3-0 and 2-3 respectively. With this marker, the Pobletano set is first after the end of the duel, while the Banyoles is tenth.
In the first part none of the teams were successful in the face of the goal, so the first 45 minutes concluded with the same result of 0-0.
None of the teams managed to score in the second half, so the match ended with a 0-0 score.
The coaches made all possible changes. On the part of the local team they jumped from the bench Koucha Karim, Cissé and Guillem Martinez replacing Sanz, Guille and Bernat, while the changes by the visiting team were Majó, Abouhafs and Mercader, who entered through Del Pozo, Adrià Casanova and Henry.
The referee showed three yellow cards, one of them to Pobla de Mafumet (specifically to Guille) and two to Banyoles (Bastidas and Turón).
After this tie at the end of the match, CF Pobla de Mafumet placed in the first place of the table with 26 points, instead of access to the playoff of first group of promotion to Second B. For its part, the Banyoles with this point got the tenth place with 15 points at the end of the game.
The next league day will face CF Pobla de Mafumet away from home against CE Europe, while Banyoles will face in his feud against Igualada.


Data sheet



CF Pobla de Mafumet:

Arnau, Sergi Caballero, Cardona, Pol Domingo, Figueras, Sanz (Koucha Karim, min. 46), Bernat (Guillem Martinez, min. 80), Garcia, Guille (Cissé, min. 66), Carreón and Molina Guerrero



Banyoles:

Martí, Turón, Congost, Quimo, Bastidas, Guell, Moreno, Bech, Henry (Mercader, min. 87), Del Pozo (Majó, min. 76) and Adrià Casanova (Abouhafs, min. 80)



Stadium:

Municipal Pobla de Mafumet



Goals:

0-0




"
