,src,lang,text
0,"











Éditorial
Libéralisme, le grand doute
ÉDITORIAL. Trente ans après la chute du mur de Berlin, «Le Temps» se penche sur la crise du libéralisme. Face aux inégalités croissantes, à la montée des populismes, au changement climatique, notre modèle de société a-t-il encore un avenir?
03 Nov 2019, 19:25 by Marc Allgöwer
Il est «obsolète» pour le président russe. Son homologue américain préfère se définir comme un «nationaliste». Le libéralisme, à les entendre, n’aurait qu’à rejoindre la poubelle de l’histoire où lui-même avait jeté Karl Marx en 1989. Ses multiples travers l’ont perdu. Car qui dit libéralisme dit finance débridée, immigration incontrôlée, élites déconnectées, destruction d’emplois et de la planète. Oui, indéniablement, le modèle actuel a péché par démesure en proclamant sa victoire sur les ruines du mur de Berlin. Trente ans plus tard, il porte moins beau. La crise est devenue existentielle.
Lire aussi le premier article de notre série:  James Traub: «Le nouvel ordre mondial de 1989 est un souvenir douloureux»
En Europe comme en Amérique du Nord, le libéralisme reste pourtant la force qui nous façonne en tant que citoyens. Il ne s’agit pas ici de se référer aux partis politiques qui se disent libéraux. Le concept fondamental est bien plus large et trace une filiation directe entre l’époque des Lumières et la nôtre. Définie simplement, la démocratie libérale a pour principe cardinal les droits de l’individu. Tout le reste de notre organisation politique et économique en découle: séparation des pouvoirs, Etat de droit, respect des minorités, liberté d’entreprendre. Cette conception d’une société ouverte permet aux opinions de s’exprimer dans toute leur diversité, à l’accusé de bénéficier d’un procès équitable, à chacun de vivre selon sa foi ou son orientation sexuelle. Elle nous permet de vivre ensemble malgré nos désaccords et nos contradictions.



Mais cette force est désormais perçue comme une faiblesse. Nos vies – de plus en plus hétérogènes et menacées par le changement, qu’il soit climatique ou technologique – évoluent si vite que le modèle semble dépassé. Pire, face à cette crise existentielle, la plus grande qualité d’une société ouverte, sa capacité à se remettre en question, est vécue comme un défaut. Les partisans de la fermeture l’ont bien senti: leur heure est venue. Tremblez, petites natures libérales.
Ce 9 novembre 2019 n’a donc rien d’une fête, il n’y aura pas de retrouvailles avec un passé enchanté. Il doit être l’occasion de faire notre examen de conscience. C’est la démarche que Le Temps a choisi de suivre cette semaine. Il recourt ainsi à l’arme la plus puissante de nos démocraties libérales: la capacité de douter, creuset de toute réforme. Au travail.
Lire également: Libéralisme: derrière le modèle, la vérité des chiffres


",fr,"











Editorial
Liberalism, the great doubt
EDITORIAL. Thirty years after the fall of the Berlin Wall, ""Le Temps"" looks at the crisis of liberalism. Faced with growing inequalities, rising populism, climate change, does our model of society still have a future?
03 Nov 2019, 19:25 by Marc Allgöwer
He is ""obsolete"" for the Russian president. His American counterpart prefers to define himself as a ""nationalist"". Liberalism, to hear them, would only have to join the dustbin of history where he himself had thrown Karl Marx in 1989. His multiple losses have lost him. For whoever says liberalism says unbridled finance, uncontrolled immigration, disconnected elites, destruction of jobs and the planet. Yes, undeniably, the current model has sinned in excess by proclaiming its victory over the ruins of the Berlin Wall. Thirty years later, he wears less beautiful. The crisis has become existential.
Read also the first article in our series: James Traub: ""The New World Order of 1989 is a painful memory""
In Europe as in North America, liberalism remains the force that shapes us as citizens. It is not a question here of referring to the political parties that call themselves liberals. The basic concept is much broader and traces a direct connection between the Enlightenment and ours. Simply defined, liberal democracy has the cardinal principle of the rights of the individual. All the rest of our political and economic organization derives from it: separation of powers, rule of law, respect for minorities, freedom of enterprise. This conception of an open society allows opinions to be expressed in all their diversity, the accused to benefit from a fair trial, and everyone to live according to their faith or sexual orientation. It allows us to live together despite our disagreements and contradictions.



But this force is now perceived as a weakness. Our lives - increasingly heterogeneous and threatened by change, whether climate or technological - are evolving so fast that the model seems outdated. Worse, faced with this existential crisis, the highest quality of an open society, its ability to question itself, is experienced as a defect. The supporters of the closure felt it: their time has come. Tremble, little liberal natures.
This November 9, 2019 is nothing like a party, there will be no reunion with an enchanted past. It must be an opportunity to do our examination of conscience. This is the approach that Le Temps has chosen to follow this week. It thus resorts to the most powerful weapon of our liberal democracies: the capacity to doubt, crucible of any reform. At work.
Read also: Liberalism: behind the model, the truth of figures


"
