,src,lang,text
0,"











Борисов: ГЕРБ пак е първа сила, с най-много съветници, където няма кмет
Синьо-червената мъгла, която дълги години е управлявала София за малко да спечели
03 Nov 2019, 22:04 by Камелия Цветанова




Снимка: Димитър Кьосемарлиев, Dnes.bg
12345678
Въпреки че ГЕРБ е в управлението от много години, отново огромният брой избиратели ни дадоха своето доверие, а след управление на БСП те имат нула кметове, коментира премиерът Бойко Борисов резултатите от балотажа в страната.
Според него на този вот се е върнала нормалността в изборния процес, защото не е нормално една партия да печели във всички големи градове.
 ""Там, където губим - Благоевргад, Русе... партията е първа политическа сила като общински съветници, така че може да се подели отговорността“, коментира той.  Според него по време на предизборната кампания са се изговорили много глупости, но пък трябвало да приключат с втория тур на изборите.
""Надявам се от утре да се хванат на работа, защото се оказа, че много мераклии за работа има, а там където сме загубили в областните градове, ще можем да споделим управлението“, коментира Борисов.
Освен че поздрави победителите, Борисов отсече, че коментарите на анализаторите, че ГЕРБ има по-слаб резултат на този вот, са неоснователни.
""Дай Боже на всеки такова отстъпление, да бият 15 пъти поред и да го наричат отстъпление. Кое е отстъпление?!Партията е първа"", настоя той. 
По думите му изборите дори вече са станали скучни, защото първата политическа сила винаги е ГЕРБ.
Премиерът припомни, че на конференция на ГЕРБ преди месеци той е разкритикувал част от местните организации на ГЕРБ и е казал, че в някои градове са се превърнали в дерибий.
 

Още по темата







",bg,"











Borisov: GERB is again the first force with the most councilors without a mayor
The blue-red fog that had ruled Sofia for many years to win
03 Nov 2019, 22:04 by Kamelia Tsvetanova




Photo: Dimitar Kyosemarliev, Dnes.bg
12345678
Although GERB has been in the government for many years, once again a huge number of voters have given us their confidence, and after running the BSP they have zero mayors, Prime Minister Boyko Borisov commented on the results of the election in the country.
According to him, normality in the electoral process has returned to this vote, because it is not normal for a party to win in all major cities.
""Where we lose - Blagoevgrad, Ruse ... the party is the first political force as municipal councilors, so responsibility can be shared,"" he said. He said a lot of nonsense was said during the election campaign, end with the second round of elections.
""I hope that tomorrow they will get to work, because it turned out that there are a lot of job gaps, and where we lost in the regional cities, we will be able to share the management,"" Borisov commented.
In addition to congratulating the winners, Borisov said that analysts' comments that GERB had a lower vote result were unfounded.
""God grant everyone such a retreat, beating them 15 times in a row and calling it a retreat. What is a retreat ?! The party is the first,"" he insisted.
According to him, the elections have already become boring, because the first political force is always GERB.
The prime minister recalled that at a GERB conference months ago he had criticized some of the local GERB organizations and said that in some cities they had become derby.


More on the topic







"
