,src,lang,text
0,"












اذعان آمریکا به استفاده از FATF برای تغییر رفتار ایران

اخیرا وزارت امور خارجه آمریکا در یک بیانیه‌ رسمی از اقدامات FATF در جهت مقابله با تهدیدات ایران نسبت به نظام مالی بین‌المللی استقبال نموده و...
03 Nov 2019, 22:13 by بولتن نیوز | bultannews.com
به گزارش بولتن نیوز، دولت در حالی اصرار بر تکمیل اجرای برنامه‌ اقدام گروه ویژه اقدام مالی FATF بخصوص تصویب لوایح الحاق ایران به کنوانسیون‌های پالرمو و تامین مالی تروریسم CFT را دارد که مقامات وزارت‌امور خارجه و وزارت بازرگانی آمریکا در دو سال اخیر پیگیر اجرای برنامه‌ اقدام FATF توسط ایران بوده‌اند و از عدم اجرای کامل این برنامه توسط ایران انتقاد کرده اند.
در دو سال اخیر، مقامات آمریکایی به طور مکرر از ایران درخواست کرده‌اند که لوایح الحاق به کنوانسیون‌های تامین مالی تروریسم و پالرمو را هر چه سریعتر و بدون شرط‌گذاری تصویب نمایند. این درخواست‌ها در حالی تکرار می‌شوند که FATF تاکنون سه دفعه اقدامات مقابله‌ای علیه ایران را به تعویق انداخته و هر بار چهار ماه به ایران فرصت داده است تا اجرای برنامه‌ی اقدام را تکمیل نماید. مقایسه رفتار مقامات آمریکایی با رفتار FATF که اقدامات متعدد ایران را نادیده گرفته و بر روی تصویب لوایح الحاق به کنوانسیون‌های پالرمو و CFT اصرار می‌ورزد، نشانگر وجود ارتباط بین FATF و سیاست‌های آمریکا در قبال ایران است.
تاکنون برخی مقامات آمریکایی در اظهارات شان به استفاده ابزاری از FATF توسط آمریکا اشاره کرده اند. اخیرا وزارت امور خارجه آمریکا هم در بیانیه ای به این موضوع اشاره کرده است. در تاریخ 10 آبان‌ماه، وزارت امور خارجه آمریکا بیانیه‌ای در حمایت از اقدامات مقابله‌ای FATF علیه ایران منتشر کرده که در بند اول آن آمده است: «ایران نشان داده است که اراده‌ای برای رسیدگی به نقصان‌های نظام ضدپولشویی و ضدتامین مالی تروریسم خود ندارد و تعمدا می‌خواهد هیچ شفافیت در اقتصاد آن نباشد تا بتواند به صادرات تروریسم ادامه بدهد. سپاه پاسداران انقلاب اسلامی به اجرای نقشه‌های تامین مالی غیرقانونی خود در ابعاد بزرگ ادامه می‌دهد تا از فعالیت‌های مخرب خود حمایت کند».
در بند بالا وزارت خارجه آمریکا تلویحا اذعان دارد که اجرای خواسته‌های FATF منجر به شفاف‌سازی اقتصاد ایران برای آمریکا خواهد شد و این شفاف‌سازی از دور زدن تحریم‌ها توسط سپاه جلوگیری خواهد کرد.
در بند دیگری از بیانیه وزارت امور خارجه آمریکا آمده است: «جامعه جهانی تصریح کرده است که ایران باید به تعهدات خود عمل کرده و مانند یک ملت عادی رفتار کند. FATF به ایران هشدار داد که باید کنوانسیون‌های پالرمو و تامین مالی تروریسم را در تطابق با استانداردهای FATF تا فوریه 2020 تصویب نماید. در غیر اینصورت FATF اقدامات مقابله‌ای را به طور کامل علیه ایران برمی‌گرداند. ما (وزارت امور خارجه آمریکا) از تصمیم FATF برای محافظت از نظام مالی بین‌الملل حمایت می‌کنیم و از اعضای FATF می‌خواهیم ایران را بابت اقدامات ادامه‌دار خودش در زمینه تروریسم و تأمین مالی تروریسم پاسخگو کنیم».
این بند نیز اعتراف تلویحی آمریکا به جایگاه FATF در سیاست فشار حداکثری آمریکاست. مایک پمپئو وزیر امور خارجه آمریکا و دیگر مقامات آمریکایی در تشریح سیاست فشار حداکثری اذعان داشته‌اند که این سیاست با هدف «عادی‌سازی» رفتار ایران دنبال می‌شود. بنابراین اجرای خواسته‌های FATF و به طور خاص تصویب لوایح الحاق ایران به کنوانسیون‌های پالرمو و CFT ابزاری در جهت تغییر رفتار ایران نسبت به خواسته‌های آمریکاست.
حال این سوال مطرح می شود که در حالی که FATF تکمیل‌کننده پازل فشار حداکثری آمریکاست و در نتیجه، افزایش فشارهای اقتصادی را به دنبال دارد، چرا مسئولان دولتی با دادن وعده بهبود شرایط اقتصادی بر تکمیل اجرای برنامه‌ اقدام FATF بخصوص تصویب دو لایحه مذکور اصرار دارند؟


",fa,"












US acknowledges using FATF to change Iranian behavior

In a recent statement, the US Department of State welcomed the FATF's efforts to counter Iran's threats to the international financial system and ...
03 Nov 2019, 22:13 by Bulletin News | bultannews.com
The government insists on completing implementation of the FATF Financial Action Task Force Action Plan, specifically ratifying Iran's accession to the Palermo Conventions and CFT Terrorist Financing Conventions, which US State Department and Commerce officials have been pursuing over the past two years. The FATF has been by Iran and has criticized Iran for not fully implementing the program.
In the past two years, US officials have repeatedly called on Iran to ratify the Palestinian and Terrorist Conventions financing conventions as soon as possible without reservation. These demands are repeated as the FATF has postponed three counter measures against Iran so far and has given Iran four months to complete the implementation of the action plan. A comparison of US officials' behavior with that of the FATF, which ignores Iran's numerous actions and insists on ratification of the Palermo and CFT Conventions, indicates the link between the FATF and US policies toward Iran.
So far, some US officials have cited US use of FATF in their statements. The US State Department has also recently mentioned this in a statement. On November 10, the US State Department issued a statement in support of the FATF's counter-measures against Iran, stating in paragraph 1: ""Iran has shown that it has no intention and intentionally wants to address the deficiencies of its anti-money laundering and terrorism financing system. There should be no transparency in its economy in order to continue exporting terrorism. The Islamic Revolutionary Guard Corps continues its large-scale illegal financing plans to support its malicious activities. ""
In the above section, the US Department of State implicitly acknowledges that the implementation of FATF demands will lead to a clear US economy for the United States and will prevent the IRGC from circumventing sanctions.
Another paragraph of the US State Department statement reads: ""The international community has stated that Iran must live up to its obligations and act as an ordinary nation. The FATF has warned Iran that it should ratify the Palermo Conventions and Financing of Terrorism in accordance with FATF standards by February 2020. Otherwise, the FATF will take full action against Iran. We (the State Department) support the FATF's decision to protect the international financial system and call on the FATF members to hold Iran accountable for its ongoing counterterrorism and terrorist financing efforts. ""
It is also a tacit acknowledgment of the United States for FATF's position in US maximum pressure policy. US Secretary of State Mike Pompeo and other US officials have acknowledged in describing the policy of maximum pressure that the policy is aimed at ""normalizing"" Iran's behavior. Therefore, implementing FATF demands, and in particular the ratification of Iran's accession laws to the Palermo and CFT Conventions, is a tool to change Iran's behavior toward US demands.
Now the question arises that while the FATF is completing the puzzle of US maximum pressure and, as a result, increasing economic pressures, why do government officials insist on completing the FATF Action Plan, particularly with the passage of two bills, by promising improved economic conditions? ?


"
