,src,lang,text
0,"











Под Мелитополем сельчане перекрыли трассу из-за многотонников, которые везут грузы на ВЭС (видео)
06 Nov 2019, 11:06 by Влада Хмельницкая

Многотонники, которые везут гравий и песок чрез Вознесенку Мелитопольского района на строительные площадки ветроэлектростянций, окончательно убили сельские дороги. У жителей села оборвалось терпение и они вышли на акцию протеста, перекрыв трассу.

Напомним, ранее фуры с бетоном, щебнем и песком доставляли свои грузы на ВЭС через Мелитополь, убивая городские дороги. Местная власть написала не одно письмо претензию на этот счет. Однако толку от писем было мало. Перегруженные бетономешалки продолжали курсировать и разбивать местные дороги.

https://ria-m.tv/news/168381/peregrujennyie_betonovozyi_po_puti_na_stroyaschiesya_ves_razbivayut_dorogi_melitopolya_(foto).html

Когда же на северном въезде в Мелитополь установили весовой комплекс, фуры стали двигаться через села, добивая их и без того, разрушенные дороги.
- Стотонники с гравием и песком все везут через Вознесенку. Они разбили все дороги. У меня вдоль дороги детский сад, школа, дом культуры. Мы хотим добиться, чтобы через Вознесенку не везли эти грузы, а разрушенные дороги отремонтировали, - говорит председатель сельсовета Ольга Гарабажиу.



Председателя сельского совета поддерживают и сельчане.
- Они не смотрят, что там у нас детсад , сельсовет. Они везут свои грузы. Аварии случаются. Колесо оторвется и человека на смерть, - кричит одна из сельчанок.



Вознесеновцы выдвинули требование, чтобы инвесторы, которые вкладывают миллионы в строительство ВЭС для дальнейшей получении прибыли, заплатили селу компенсацию и тогда на эти деньги можно будет восстановить дорожное полотно.
Как развиваются события в Вознесенке мы будем информировать читателей далее. Следите за новостями.


",ru,"











Near Melitopol, the villagers blocked the highway due to the multi-ton transporting goods to the wind farms (video)
06 Nov 2019, 11:06 by Vlada Khmelnitskaya

Polytons carrying gravel and sand through Voznesenka, Melitopol District, to the construction sites of wind farms finally killed rural roads. The villagers lost their patience and they went to a protest rally, blocking the highway.

Recall that earlier trucks with concrete, gravel and sand delivered their goods to the wind farm through Melitopol, killing city roads. Local authorities have written more than one letter of complaint in this regard. However, the letters were of little use. Overloaded concrete mixers continued to ply and smash local roads.

https://ria-m.tv/news/168381/peregrujennyie_betonovozyi_po_puti_na_stroyaschiesya_ves_razbivayut_dorogi_melitopolya_(foto).html

When a weight complex was established at the northern entrance to Melitopol, the wagons began to move through the villages, finishing off their already destroyed roads.
- Cotters with gravel and sand are all driven through Ascension. They paved all the roads. I have a kindergarten, a school, a house of culture along the road. We want to ensure that these loads are not transported through Voznesenka, and that the destroyed roads are repaired, ”said the Chairman of the Village Council Olga Garabazhiu.



The chairman of the village council is supported by the villagers.
- They don’t look that we have a kindergarten, a village council. They carry their goods. Accidents happen. The wheel will come off and a person will die, ”one of the villagers shouts.



The Voznesenovites put forward a demand that investors who invest millions in the construction of a wind farm for further profit, pay compensation to the village and then the roadway can be restored with this money.
How events are developing in Voznesenka we will inform readers further. Follow the news.


"
