,src,lang,text
0,"











Trenér Novák věří Sáblíkové na další trofeje, nadchli ho mladí
01 Nov 2019, 14:50 by ČTK
Praha - Trenér Petr Novák věří, že trojnásobná olympijská vítězka a dvacetinásobná mistryně světa Martina Sáblíková může bojovat o další světové trofeje. Sní o dalším posunu světového rekordu na 5000 metrů. Nadchly ho výkony mladých členů jeho rychlobruslařského týmu, kteří se ve svých věkových kategoriích prosazují do světové špičky.
Fotogalerie














Sáblíková minulou sezonu završila třemi světovými zlaty a týmž počtem světových rekordů, ale podle Nováka má ještě prostor na zlepšení. ""Vždycky jde všechno udělat ještě lépe. Pořád je můj sen pět kilometrů pod 6:40 a to v jejích silách je. Martina opravdu může, když bude dobré počasí v Salt Lake City nebo v Calgary, jet ještě čas pod 6:40,"" řekl na adresu královny dlouhých tratí, která v březnu posunula světový rekord na 5000 metrů na 6:42,01.
Věří, že jeho nejúspěšnější svěřenkyně může rozšířit mimořádně bohatou medailovou sbírku. ""Čtyřboje nechávám u ledu, protože tam ta pětistovka rozhoduje o všem. Co se týká tří a pěti kilometrů, tak z mého pohledu může bojovat pořád o pódium, hlavně o ty tituly. To znamená, že na mistrovství světa jednotlivých tratí rozhodně bude ve hře na tři i pět kilometrů,"" prohlásil Novák.
A znovu by Sáblíkovou rád viděl bojovat o medaili i na patnáctistovce, na které získala bronz na ZOH 2010 ve Vancouveru. ""Letos zahájila 1:56,19 a to je čas, který dává šanci bojovat když ne o první, tak o třetí místo,"" řekl s odkazem na výhru Sáblíkové v přípravném závodě v Inzellu. Bude záležet na konkrétní situaci a na tom, kolik bude mít Sáblíková sil. ""Nehazardoval bych, ale kdyby vyhrála trojku, tak proč ne,"" poznamenal.
V létě ho nadchla nejen práce Sáblíkové a Nikoly Zdráhalové, ale také výkony nejmladších členů týmu. ""Vyvážíme za hranice v průměru sedmnáct závodníků, i deseti- a jedenáctileté. Hodně z nich se umisťuje v top deset na světě. V těch mladých jsem takový tým ještě neměl. Zajíždějí časy, které nám dávají šanci, že mohou za dva roky třeba bojovat o olympiádu. Jsem rád, že ten systém tréninku funguje nejenom na Martinu, ale i na všechny ostatní,"" pochvaloval si.


",cs,"











Coach Novák believes Sáblíková for other trophies, he was excited by the young
01 Nov 2019, 14:50 by CTK
Prague- Coach Petr Novak believes that the triple Olympic champion and twentyfold world champion Martina Sáblíková can fight for other world trophies. He dreams of moving the world record further to 5000 meters. He was enthusiastic about the performance of the young members of his speed skating team, who in their age categories are gaining ground in the world.
Photogallery














Sáblíková topped three world golds and the same number of world records last season, but she still has room for improvement. ""Everything can always be done even better. Still my dream is five miles below 6:40 and it is in her power. Martina can really go under 6:40 when the weather is good in Salt Lake City or Calgary,"" he said to the Queen of Long Lines, which in March set the world record at 5000 meters to 6: 42.01.
He believes that his most successful ward can expand the extremely rich medal collection. ""I leave the quadruples on the ice, because the five hundreds decides everything. As far as three and five kilometers, so from my point of view can still fight for the podium, especially for the titles. That means that at the World Championship single track will definitely be in play for three and five kilometers, ""said Novak.
And again, he would like to see Sáblíková fight for the medal at the 15-year-old who won bronze at the 2010 Winter Olympics in Vancouver. ""This year she started 1: 56,19 and this is the time that gives a chance to fight if not for the first, but for the third place,"" he said referring to Sáblíková's win in the preparatory race in Inzell. It will depend on the specific situation and how much Sáblíková will have. ""I wouldn't throw it, but if she wins a 3, why not,"" he said.
In the summer he was impressed not only by the work of Sáblíková and Nikola Zdráhalová, but also by the performance of the youngest team members. ""We export an average of seventeen racers, even ten- and eleven-year-olds. Many of them place in the top ten in the world. I haven't had such a team in the young. There are times that give us the chance to fight in two years. I am glad that the training system works not only on Martin but also on everyone else, ""he praised.


"
