,src,lang,text
0,"











Ολοκληρώθηκε με επιτυχία το πρώτο Origen & The City
Για πρώτη φορά, η Origen παρουσίασε το πρώτο Origen & The City υπό την αιγίδα του Δήμου Θεσσαλονίκης!
01 Nov 2019, 14:19 by neolaia.gr Team
Το Σάββατο 19 Οκτωβρίου στις 11:00, το Origen & The City έλαβε χώρα στην καρδιά της πόλης, στο Δημαρχιακό Μέγαρο Θεσσαλονίκης!
Το κοινό είχε την ευκαιρία να παρακολουθήσει το πρώτο Origen & The City εντελώς δωρεάν και να μάθει για την στοχοθεσία!
Η μέρα ξεκίνησε με τον ιδρυτής της Origen, Παντελή Σπάρταλη να καλωσορίζει το κοινό και να μιλάει για το νέο project «Origen & The City» και τους στόχους της ομάδας για αυτό.




Ο ιδρυτής της Origen, Παντελής Σπάρταλης, σε μια mini-συνέντευξη με την ομιλήτρια, Φύλλις Γραβιηλίδου

Η ομιλήτρια της εκδήλωσης, Φύλλις Γαβριηλίδου, έδωσε στο κοινό εργαλεία όπου θα μας βοηθήσουν να θέτουμε τους στόχους μας πιο αποτελεσματικά αλλά και με περισσότερες πιθανότητες επιτυχίας!




Η ομιλήτρια του πρώτου Origen & The City, Φύλλις Γαβριηλίδου

Ακολούθησε ένα διάλειμμα, όπου το κοινό είχε την ευκαιρία να γνωρίσει ομάδες της πόλης! Το InfinityGreece, η ομάδα BEST του ΑΠΘ και το Finance Club του Πανεπιστημίου Μακεδονίας ήταν εκεί!
Στο διάλειμμα επίσης, ήταν το Seven 2 Seven όπου πρόσφερε στο κοινό καφέ και νερό καθώς και το Γλυκό Αλμυρό με μπισκότα και muffins!




Η οργανωτική ομάδα και οι εθελοντές του πρώτου Origen & The City!

ΕΙΣΑΙ ΜΕΣΑ ΓΙΑ ΤΑ ΝΕΑ ΚΟΝΤΟΠΑΚ VIBER ΣΤΙΚΕΡΣ; ΝΤΑΟΥΝΛΟΟΥΝΤ ΛΕΜΕ ΕΔΩ --> https://vb.me/fac486

ΔΙΑΒΑΣΤΕ ΕΠΙΣΗΣ










",el,"











The first Origen & The City was successfully completed
For the first time, Origen presented the first Origen & The City under the auspices of the Municipality of Thessaloniki!
01 Nov 2019, 14:19 by neolaia.gr Team
On Saturday October 19th at 11:00 am, Origen & The City took place in the heart of the city, at the Thessaloniki City Hall!
The public had the opportunity to watch the first Origen & The City completely free and find out about targeting!
The day started with Origen founder Panteli Spartalis welcoming the public and talking about the new Origen & The City project and the team's goals for it.




Origen founder Pantelis Spartalis in a mini-interview with the speaker, Phyllis Gravilidou

The speaker of the event, Phyllis Gavriilidou, gave the public tools where they will help us set our goals more effectively but with more chances of success!




The speaker of the first Origen & The City, Phyllis Gavriilidou

This was followed by a break where the public had the opportunity to meet groups in the city! InfinityGreece, the BEST team of the Aristotle University of Thessaloniki and the Finance Club of the University of Macedonia were there!
At the break also, it was Seven 2 Seven where it offered the public coffee and water as well as Sweet Salty with cookies and muffins!




The Origen & The City volunteer team and volunteers!

ARE YOU IN FOR THE NEW VIBER STICKERS? Downtown Lemme HERE -> https://vb.me/fac486

READ ALSO










"
