,src,lang,text
0,"











Κάλεσμα Μητσοτάκη από την Κίνα για επενδύσεις : Εμπιστευτείτε την Ελλάδα
Ο πρωθυπουργός κάλεσε ευθέως τους επιχειρηματίες της ασιατικής χώρας να εμπιστευτούν την Ελλάδα, υπογραμμίζοντας πως «τώρα είναι η κατάλληλη εποχή».
04 Nov 2019, 06:05 by ΤοΒΗΜΑ Team
«Καθώς η Ελλάδα βρίσκεται σε φάση οικονομικής ανάκαμψης, είμαστε απόλυτα βέβαιοι ότι κατευθυνόμαστε σε ένα νέο κεφάλαιο στις σχέσεις Ελλάδας και Κίνας. Δεν υπάρχει καλύτερη ώρα για να γράψουμε ένα νέο κεφάλαιο στις ελληνοκινεζικές σχέσεις. Μια νέα εποχή ανατέλλει επιτέλους για την Ελλάδα, ύστερα από μια εξαιρετικά δύσκολη δεκαετία». Αυτό το μήνυμα έστειλε ο Κυριάκος Μητσοτάκης μιλώντας σε ελληνοκινεζικό επιχειρηματικό φόρουμ στη Σαγκάη με συμμετοχή περισσοτέρων από 60 Ελλήνων και δεκάδων Κινέζων επιχειρηματιών.
Ο πρωθυπουργός κάλεσε ευθέως τους επιχειρηματίες της ασιατικής χώρας να εμπιστευτούν την Ελλάδα, υπογραμμίζοντας πως «τώρα είναι η κατάλληλη εποχή».

Διαβάστε ακόμη : Νέες συμφωνίες μεταξύ Ελλάδας και Κίνας σε 5 τομείς - Τι αποφάσισαν Μητσοτάκης – Σι Τζινπίνγκ

Ο κ. Μητσοτάκης, σημειώνοντας ότι έρχεται πρώτη φορά ως πρωθυπουργός στη Σαγκάη, ανέφερε: «Η κυβέρνηση μου εκλέχθηκε τον Ιούλιο με απόλυτη πλειοψηφία και μια καθαρή εντολή να επαναφέρει τη χώρα στην ανάπτυξη. Είμαστε μια κυβέρνηση που είναι απολύτως προσηλωμένη στην εφαρμογή των απαραίτητων αλλαγών, οι οποίες θα «ξεκλειδώσουν» τις πραγματικές δυνατότητες αυτής της χώρας, ενώ εσείς από τη πλευρά σας συγκεντρώνετε όλα εκείνα τα στοιχεία που μπορούν να καταστήσουν την Ελλάδα ένα πραγματικό success story».
Επ’ αυτού αναφέρθηκε στα αρνητικά επιτόκια δανεισμού που είχε η Ελλάδα πριν από μερικές ημέρες, κάτι που – όπως επισήμανε – ήταν αδιανόητο μέχρι πριν από έναν χρόνο.
«Έχουμε ξεκλειδώσει μεγάλες επενδύσεις»
«Οι αγορές έχουν ανταποκριθεί θετικά στο μήνυμά μας, έχουμε ξεκλειδώσει μεγάλες επενδύσεις όπως το Ελληνικό. Η κυβέρνηση έχει ήδη νομοθετήσει σημαντικές περικοπές φόρων και απλοποίηση των διαδικασιών αδειοδότησης, οι τιμές στην αγορά ακινήτων αναμένεται να αυξάνονται κατά πάνω 10% σε ετήσια βάση, ο τουρισμός βρίσκεται σε πολύ υψηλά επίπεδα και η ανεργία είναι στο χαμηλότερο επίπεδο των τελευταίων ετών», σημείωσε ο πρωθυπουργός και τόνισε:
«Δεν είναι έκπληξη λοιπόν ότι η οικονομία αναμένεται να αναπτυχθεί με ρυθμό σχεδόν 3% το 2020. Ίσως αυτό να ακούγεται χαμηλό με βάση τα κινεζικά δεδομένα, όμως, με βάση τα ευρωπαϊκά δεδομένα, συμβαίνει το ακριβώς αντίθετο, είναι από τους υψηλότερους ρυθμούς στην Ευρωζώνη».
Ο κ. Μητσοτάκης εξήρε τη συμβολή της Κίνας στην προσπάθεια που έκανε η Ελλάδα στα χρόνια της οικονομικής κρίσης και εξέφρασε την εκτίμηση ότι οι οικονομικοί δεσμοί των δυο χωρών μπορούν να αναπτυχθούν περαιτέρω.
«Η Κίνα επένδυσε στην Ελλάδα όταν άλλοι έλαμπαν δια της απουσίας τους. Η επένδυση της Cosco στο λιμάνι του Πειραιά είναι το παράδειγμα της εταιρείας που τόλμησε να επενδύσει στην Ελλάδα, όταν άλλοι το θεωρούσαν αδιανόητο», συνέχισε επισημαίνοντας πως αυτό που χρειάζεται η χώρα μας τώρα, περισσότερο από ποτέ, είναι επενδυτικά κεφαλαία.
Αναφέρθηκε στην γεωπολιτική θέση της Ελλάδας, σημειώνοντας ότι αυτό ευνοεί επιχειρηματικές δράσεις συνεργαζόμενων σχημάτων, ενώ αναφέρθηκε και σε επιμέρους τομείς.
Μιλώντας για την ναυτιλία, είπε ότι τα τελευταία 15 χρόνια Έλληνες πλοιοκτήτες κατασκεύασαν πάνω από 1000 πλοία στα κινεζικά ναυπηγεία, επένδυση που ξεπερνά το 50 δισ. δολάρια.
Η κινέζικη αγορά
«Είναι πολύ σημαντικό για εμάς η κινεζική αγορά να είναι ανοιχτή στους Έλληνες προμηθευτές, οι οποίοι μπορούν να προσφέρουν υψηλής ποιότητας εξοπλισμό ως ένα στοιχείο προστιθέμενης αξίας στη διαδικασία ναυπήγησης των πλοίων που κατασκευάζονται στην Κίνα από Έλληνες πλοιοκτήτες και πραγματοποιούν ένα σημαντικό τμήμα του εμπορίου από και προς την Κίνα», συμπλήρωσε.
Για τον τουρισμό τόνισε ότι σκοπός της Ελλάδας είναι να έρθουν μισό εκατομμύριο Κινέζοι τουρίστες έως το 2021, υπογραμμίζοντας ότι είναι πολύ σημαντική η υφιστάμενη απευθείας αεροπορική σύνδεση της Αθήνας με το Πεκίνο και εκείνη με τη Σαγκάη που, όπως ανακοινώθηκε, θα ξεκινήσει από το καλοκαίρι του 2020.
«Η χώρα μου είναι προικισμένη με ένα μοναδικό φυσικό και πολιτιστικό περιβάλλον, μια προνομιακή γεωπολιτική θέση στο σταυροδρόμι τριών ηπείρων και διαθέτει ανθρώπους με ταλέντο και υψηλή κατάρτιση», υπογράμμισε ο πρωθυπουργός και διαβεβαίωσε τους Κινέζους επιχειρηματίες ότι η κυβέρνηση θα κάνει ό,τι μπορεί για να υποστηρίξει και να διευκολύνει επενδύσεις τους στην Ελλάδα.
Πηγή: ΑΠΕ-ΜΠΕ

Γνωρίστε τον κόσμο, με εικόνες και βίντεο, μπροστά και πίσω από τις κάμερες του One Channel #onechannel



",el,"











China Mitsotakis Call for Investment: Trust Greece
The prime minister directly called on Asian businessmen to trust Greece, stressing that ""now is the right time"".
04 Nov 2019, 06:05 by TOBIMA Team
""As Greece is in a phase of economic recovery, we are absolutely confident that we are heading for a new chapter in Greek-Chinese relations. There is no better time to write a new chapter in Greek-Chinese relations. A new era is finally coming up for Greece, after a very difficult decade. "" This message was sent by Kyriakos Mitsotakis speaking at a Greek-Chinese business forum in Shanghai with the participation of more than 60 Greek and dozens of Chinese businessmen.
The prime minister directly called on Asian businessmen to trust Greece, stressing that ""now is the right time"".

Read more: New agreements between Greece and China in 5 areas - What Mitsotakis decided - Xi Jinping

Mitsotakis, noting that he is coming to Shanghai for the first time as prime minister, said: ""My government was elected in July by an absolute majority and a clear mandate to bring the country back to growth. We are a government that is fully committed to implementing the necessary changes that will 'unlock' the real potential of this country, while you are bringing together all those elements that can make Greece a real success story. ""
He referred to the negative lending rates Greece had a few days ago, which - as he pointed out - was unthinkable until a year ago.
""We have unlocked big investments""
""The markets have responded positively to our message, we have unlocked big investments like Hellenic. The government has already legislated significant tax cuts and simplification of licensing procedures, real estate prices are expected to rise by more than 10% annually, tourism is at a very high level and unemployment is at its lowest level in recent years, ”he said. the prime minister and stressed:
""So it's not surprising that the economy is expected to grow at almost 3% in 2020. It may sound low on the basis of Chinese data, but based on European data, just the opposite, it is one of the highest rates in the Eurozone. ».
Mr Mitsotakis praised China's contribution to Greece's efforts during the years of the economic crisis and expressed the appreciation that the economic ties between the two countries could be further developed.
""China invested in Greece when others were shining through their absence. Cosco's investment in the port of Piraeus is an example of a company that dared to invest in Greece when others considered it unthinkable, ""he continued, noting that what our country needs now, more than ever, is investment capital.
He referred to the geopolitical position of Greece, noting that it favors cooperative business operations, while also referring to individual sectors.
Speaking about shipping, he said that over the past 15 years Greek shipowners have built more than 1,000 ships in Chinese shipyards, an investment that exceeds $ 50 billion.
The Chinese market
""It is very important for us that the Chinese market is open to Greek suppliers, who can offer high quality equipment as an added value to the process of shipbuilding in China by Greek shipowners and carry out a significant portion of trade from and to China, ""he added.
On tourism, he stressed that Greece's goal is to reach half a million Chinese tourists by 2021, stressing the importance of Athens' existing direct air link with Beijing and that of Shanghai, which will be launched by the summer. 2020.
""My country is endowed with a unique natural and cultural environment, a privileged geopolitical location at the crossroads of three continents and has talented and highly trained people,"" the prime minister underlined and assured Chinese businessmen that the government would do what it can to to support and facilitate their investments in Greece.
Source: RES-EIA

Meet the world, with pictures and videos, in front of and behind One Channel #onechannel cameras



"
