,src,lang,text
0,"











Sucedió en la rotonda de Banda de Varela
Automovilista adolescente provocó un violento siniestro vial en la ruta 1
Un jovencito de apenas 15 años conducía un vehículo que, tras perder el control, chocó un cartel de señalización.

04 Nov 2019, 06:00

Ayer a la madrugada, un adolescente de 15 años que conducía un automóvil a alta velocidad por ruta provincial Nº 1, provocó un violento siniestro vial a la altura de la rotonda de Banda de Varela. Como consecuencia, el menor resultó con lesiones y debió ser trasladado al hospital de niños Eva Perón. 
El hecho de tránsito sucedió alrededor de las 5.40, según informaron fuentes policiales, el jovencito que circulaba al mando de un rodado marca Peugeot 307 gris, dominio KDA-397, por razones que se tratan de establecer perdió el control del vehículo y chocó contra un cartel de señalización vial. 
Producto de la violencia del impacto sufrió lesiones que demandaron que fuera asistido por facultativos médicos del SAME y luego trasladado al hospital de niños Eva Perón. Además, el vehículo terminó con importantes daños materiales. En el lugar trabajaron efectivos de la comisaría Tercera y sumariantes del Precinto Judicial N° 3.Vuelco en Paclín
Por otro lado, a las 14.30 en la ruta nacional N° 38, a la altura de la localidad de Amadores (Paclín),  Lucas Fabricio Nieva (27) circulaba al mando de un automóvil Volkswagen Gol Trend, dominio IPF-533, de color negro, en compañía de Abril del Valle Ahumada (18), Genaro Ortega Leiva (20), Lucas Nahuel Becerra (24) y una adolescente de 17 años y, por razones que se tratan de establecer, perdió el control del rodado y volcaron a un costado de la banquina. 
Como resultado del brutal vuelco, todos los ocupantes sufrieron lesiones que demandaron que fueran asistidos por facultativos médicos del hospital zonal. 
En el hecho intervinieron efectivos de la Comisaría Departamental La Merced para labrar las actuaciones de rigor, bajo las directivas de la Fiscalía de Instrucción en turno. 


",es,"











It happened at the roundabout of Banda de Varela
Teen motorist caused a violent road accident on route 1
A young man of just 15 years was driving a vehicle that, after losing control, crashed a signpost.

04 Nov 2019, 06:00

Yesterday morning, a 15-year-old teenager who was driving a car at high speed on provincial route No. 1, caused a violent road accident at the height of the roundabout of Banda de Varela. As a result, the child was injured and had to be transferred to the Eva Perón children's hospital.
The traffic incident occurred around 5.40, according to police sources, the young man who circulated under the command of a gray Peugeot 307 brand, domain KDA-397, for reasons that are trying to establish lost control of the vehicle and crashed into a car. road signs poster.
As a result of the impact violence, he suffered injuries that demanded that he be assisted by medical professionals from SAME and then transferred to the Eva Perón children's hospital. In addition, the vehicle ended with significant material damage. In the place they worked effective of the Third police station and summaries of the Judicial Precinct N ° 3. I turn in Paclín
On the other hand, at 14.30 on national route No. 38, at the height of the town of Amadores (Paclín), Lucas Fabricio Nieva (27) was driving a Volkswagen Gol Trend car, domain IPF-533, colored black, in the company of April of the Ahumada Valley (18), Genaro Ortega Leiva (20), Lucas Nahuel Becerra (24) and a 17-year-old teenager and, for reasons that are trying to establish, lost control of the shot and turned to A side of the bench.
As a result of the brutal overturn, all occupants suffered injuries that demanded that they be assisted by medical doctors from the zonal hospital.
In fact, the La Merced Police Station intervened to work the rigorous actions, under the directives of the Office of the Prosecutor of Instruction in turn.


"
