,src,lang,text
0,"











Νέα απειλή από Αγκυρα : Θα στείλουμε τους τζιχαντιστές πίσω στην Ευρώπη
«Θα στείλουμε τα συλληφθέντα μέλη του Ισλαμικού Κράτους πίσω στις χώρες τους», δήλωσε ο υπουργός Εσωτερικών της Τουρκίας, Σουλεϊμάν Σοϊλού, εξαπολύοντας πυρά κατά της Ευρώπης για τη στάση που έχει κρατήσει στο θέμα. 
02 Nov 2019, 12:40 by ΤοΒΗΜΑ Team
«Θα στείλουμε τα συλληφθέντα μέλη του Ισλαμικού Κράτους πίσω στις χώρες τους», δήλωσε ο υπουργός Εσωτερικών της Τουρκίας, Σουλεϊμάν Σοϊλού, εξαπολύοντας πυρά κατά της Ευρώπης για τη στάση που έχει κρατήσει στο θέμα. 
«Αυτό δεν είναι αποδεκτό από μας. Είναι επίσης ανεύθυνο», είπε ο κ. Σοϊλού, υποστηρίζοντας ότι οι ευρωπαϊκές χώρες αφήνουν την Τουρκία να διαχειριστεί μόνη της το θέμα των φυλακισμένων τζιχαντιστών.

Διαβάστε ακόμη : «Γι' αυτό μου επιτέθηκε» ο 16χρονος - Οι άγνωστοι διάλογοι μεταξύ των παιδιών

Υπενθυμίζεται ότι η Τουρκία συνέλαβε μέλη της τζιχαντιστικής οργάνωσης Ισλαμικό Κράτος που δραπέτευσαν από τις φυλακές όπου κρατούνταν στη βορειοανατολική Συρία τον περασμένο μήνα, μετά την έναρξη της στρατιωτικής επίθεσης της Άγκυρας στην περιοχή αυτή της Συρίας.

Γνωρίστε τον κόσμο, με εικόνες και βίντεο, μπροστά και πίσω από τις κάμερες του One Channel #onechannel



",el,"











New threat from Ankara: We will send jihadists back to Europe
""We will send the arrested members of the Islamic State back to their countries,"" said Turkish Interior Minister Suleyman Soilu, setting fire to Europe over its stance on the matter.
02 Nov 2019, 12:40 by TOBIMA Team
""We will send the arrested members of the Islamic State back to their countries,"" said Turkish Interior Minister Suleyman Soilu, setting fire to Europe over its stance on the matter.
""This is not acceptable to us. It is also irresponsible, ""Mr Soyilou said, arguing that European countries leave Turkey alone to handle the issue of prisoner jihadists.

Read more: ""That's why I was attacked"" by the 16-year-old - The Unknown Dialogues Between Children

It is recalled that Turkey arrested members of the Islamic State jihadist organization who escaped from prisons held in northeastern Syria last month, following the start of Ankara's military offensive in that area of Syria.

Meet the world, with pictures and videos, in front of and behind One Channel #onechannel cameras



"
