,src,lang,text
0,"











L'Aveyronnaise Noémie Honiat en guest star de ""C'est du gâteau"" sur Netflix
02 Nov 2019, 12:56 by Marie-Christine Bessou

« C’est du gâteau », la nouvelle série de Netflix, a démarré avec la chef pâtissière de Villefranche-de-Rouergue, Noémie Honiat en guest star. Six épisodes à déguster sans modération.

Irrésistible! Tel est le qualificatif qui convient le mieux à la nouvelle série phénomène de Netflix visible depuis une semaine.
La plateforme américaine en ligne a saisi le filon des émissions culinaires qui surfent toujours sur le haut de la vague mais en lui insufflant une bourrasque rafraîchissante qui décoiffe. Alors les toques s’envolent, surfant elles aussi sur la tête des candidats qui s’affrontent trois pas trois à coups de spatules de batteur.
Des candidats choisis après sélection sur casting, les vidéos de leur sens de l’humour et de leur inaptitude pâtissière faisant foi. « Nailed it » (ndrl : « J’y suis arrivé » en anglais) est devenu « C’est du gâteau » dans la version française. Et la présentation a été confiée à des vedettes cathodiques médiatiques, l’humoriste animateur Artus et la chef pâtissière Noémie Honiat, bien connue des téléspectateurs et des Aveyronnais puisqu’elle exerce ses talents à Villefranche-de-Rouergue, au restaurant L’Univers avec son compagnon, Quentin Bourdy.















On rit franchement
Et le résultat du mélange de ces ingrédients est sacrément drôle. Même si on n’est pas accro du royaume culinaire, on rit franchement aux galères de ces candidats néophytes à qui on présente des gâteaux de ouf qu’on n’imagine même pas en rêve et qu’ils doivent réaliser.
On ne s’ennuie pas une seule seconde dans cette demi-heure de folie pâtissière car le rythme est mené tambour battant par Artus, avec beaucoup d’humour bien sûr mais aussi un zeste de moquerie et un zeste de séduction.
Sans se laisser perturber ni distraire, les candidats s’attaquent à de sacrés challenges sucrés comme le premier gâteau de la série sous la forme d’une énorme vague bleue façon génoise avec surfeur, requin, étoile de mer, palmier et tutti quanti.



Beaucoup de détails sur lesquels insiste à chaque fois Noémie Honiat. Car « notre » chef pâtissière villefranchoise, toujours aussi charmante et télégénique, est bien la seule touche professionnelle et raisonnable de la série.
Quand Artus se marre, tourne en dérision le candidat où hésite à planter sa cuillère dans des gâteaux pas cuits ou s’aplatissant tel un soufflé raté, Noémie Honiat exerce son talent de pédagogue. Elle rassure, explique, positive même face à des réalisations cataclysmiques. Elle trouve toujours un petit compliment à délivrer. On la sent heureuse de confier quelques astuces et secrets de fabrication aux candidats et donc à vous derrière votre écran.
Comme « la série marche très bien » et que les retours sont excellents, nul doute que cette première saison en appellera d’autres. La chef pâtissière parisienne qui a conçu tous ces gâteaux, tous plus délirants les uns que les autres, pourra encore lâcher la bride de son imagination pour vous faire saliver, souffrir et rire à nouveau devant des montagnes de pâte, de crème, de sauces, etc. Et Noémie Honiat sera toujours là, avec vous, pour décrypter les recettes les plus folles.

Voir les commentaires (3)



",fr,"











Aveyronnaise Noémie Honiat as guest star of ""C'est du gâteau"" on Netflix
02 Nov 2019, 12:56 by Marie-Christine Bessou

""It's cake"", the new series of Netflix, started with the pastry chef of Villefranche-de-Rouergue, Noémie Honiat guest star. Six episodes to enjoy without moderation.

Irresistible! This is the most appropriate qualifier for the new Netflix phenomenon series that has been visible for a week.
The American online platform has seized the vein of culinary shows that always surf on the top of the wave but infusing it with a refreshing flurry of fun. Then the toques fly, surfing them also on the head of the candidates who face three not three with blows of drummer spatulas.
Candidates chosen after selection on casting, the videos of their sense of humor and their pastry aptitude being authentic. ""Nailed it"" (""I got there"" in English) became ""It's cake"" in the French version. And the presentation was entrusted to media Catholic stars, humorist and animator Artus and pastry chef Noémie Honiat, well known to viewers and Aveyronnais since she practices her talents in Villefranche-de-Rouergue, at the restaurant L'Univers with his companion, Quentin Bourdy.















We laugh honestly
And the result of mixing these ingredients is damn funny. Even if one is not addicted to the culinary realm, one laughs frankly at the galleys of these neophyte candidates who are presented with egg cakes that one can not even imagine in a dream and that they must realize.
We do not get bored for a single second in this half-hour of pastry madness because the rhythm is carried beating by Artus, with a lot of humor of course but also a zest of mockery and a zest of seduction.
Without being disturbed or distracted, the candidates tackle sacred challenges such as the first cake of the series in the form of a huge wave like Genoese with surfer, shark, starfish, palm tree and tutti quanti.



Many details on which insists Noémie Honiat every time. Because ""our"" pastry chef villefranchoise, always so charming and telegenic, is the only professional and reasonable touch of the series.
When Artus gets tired, makes a mockery of the candidate who hesitates to plant his spoon in uncooked cakes or flattening like a failed soufflé, Noémie Honiat exerts her pedagogical talent. She reassures, explains, positive even in the face of cataclysmic achievements. She always finds a little compliment to deliver. We feel happy to entrust some tricks and manufacturing secrets to candidates and therefore to you behind your screen.
As ""the series works very well"" and the returns are excellent, there is no doubt that this first season will call others. The Parisian pastry chef who designed all these cakes, all more delirious than the other, will still be able to let go of the flange of his imagination to make you salivate, suffer and laugh again in front of mountains of dough, cream, sauces, etc. And Noémie Honiat will always be there, with you, to decrypt the craziest recipes.

See the comments (3)



"
