,src,lang,text
0,"











Rusia a intrat în era internetului suveran: Legea controversată a intrat în vigoare
04 Nov 2019, 11:24 by Jurnal.md

O lege controversată privind crearea unui internet suveran, promulgată de preşedintele rus Vladimir Putin la începutul lunii mai şi care permite statului rus să deconecteze ţara de la reţelele de internet globale, a intrat la finalul săptămânii trecute în vigoare în Rusia.

Guvernul intenţionează să creeze infrastructură pentru ""un internet suveran"", prezentat ca o necesitate în combaterea atacurilor cibernetice efectuate din afara graniţelor ruse.
Criticii legii susţin însă că aceasta reprezintă un pas în direcţia cenzurii.
„Este pentru prima dată când statul are control complet asupra internetului”, a declarat Alexander Isavnin, expert în cadrul organizaţiei anti-cenzură Roskomsvoboda.
Parlamentul rus a adoptat în luna aprilie o lege care obligă platformele de socializare online să aibă serverele în Rusia.
Isavnin explică faptul că, deşi înainte furnizorii de servicii internet puteau să opereze sub condiţiile pieţei libere, statul rus poate exercita acum control direct.
Traficul web din Rusia va fi acum direcţionat prin platforme care se află în ţară. Furnizorii de servicii internet sunt obligaţi să instaleze echipamentul necesar pentru efectuarea acestei tranziţii, scrie Mediafax.
Mai multe site-uri care aparţin opoziţiei au fost deja blocate, în timp ce mulţi ruşi se tem că ţara va deveni izolată din punct de vedere digital.
Purtătorul de cuvânt al preşedintelui, Dmitri Peskov, a susţinut anterior că Rusia nu intenţionează să se deconecteze de la internet, însă se pregăteşte pentru posibilele ameninţări.
Vladimir Putin a argumentat că legea reprezintă o măsură de securitate naţională.


",ro,"











Russia has entered the era of the sovereign internet: The controversial law has come into force
04 Nov 2019, 11:24 by Jurnal.md

A controversial law on the creation of a sovereign internet, promulgated by Russian President Vladimir Putin in early May and allowing the Russian state to disconnect the country from global internet networks, came into effect at the end of last week in Russia.

The government intends to create infrastructure for ""a sovereign internet"", presented as a necessity in combating cyber attacks carried out outside the Russian borders.
However, critics of the law argue that this is a step in the direction of censorship.
""This is the first time the state has complete control over the Internet,"" said Alexander Isavnin, an expert in the anti-censorship organization Roskomsvoboda.
In April, the Russian parliament passed a law requiring online social media platforms to have servers in Russia.
Isavnin explains that, although previously Internet service providers could operate under free market conditions, the Russian state can now exercise direct control.
Russian web traffic will now be directed through platforms located in the country. Internet service providers are required to install the equipment needed to make this transition, writes Mediafax.
Several opposition sites have already been blocked, while many Russians fear the country will become digitally isolated.
The president's spokesman, Dmitry Peskov, has previously said that Russia does not intend to disconnect from the internet, but is preparing for possible threats.
Vladimir Putin argued that the law is a national security measure.


"
