,src,lang,text
0,"











Илон Мъск дари много пари за засаждането на 20 млн. дръвчета

04 Nov 2019, 11:54

Шефът на ""СпейсЕкс“ и ""Тесла“ Илон Мъск дари 1 млн. долара за засаждането на 20 млн. дървета. Инициативата се казва ""Отбор дървета“ и е организирана от двама влогъри, които дадоха обет, че ако достигнат 20 млн. харесвания в ""Ютюб“ ще засадят 20 млн. дървета, предаде bTV.
Идеята бързо събра подкрепа от известни личности, като шефът на ""Туитър“ Джак Дорси също направи дарение. До момента влогърите са събрали близо 8 млн. долара, като най-голямото дарение от Мъск. Събраните пари ще бъдат използвани за засаждане на дървета на всички континенти, освен на Антарктика.
Шефът на ""СпейсЕкс“ се пошегува, че дарява за каузата на Дървобрад – измислен от Дж. Р. Р. Толкин герой във ""Властелинът на пръстените“, който представлява мъдро говорещо дърво.


",bg,"











Ilon Musk donated a lot of money to plant 20 million trees

04 Nov 2019, 12:54

SpaceEx and Tesla chief Ilon Musk donated $ 1 million to plant 20 million trees. The initiative is called ""Tree Team"" and was organized by two vloggers who vowed that if they reached 20 million likes on YouTube they would plant 20 million trees, bTV reported.
The idea quickly garnered support from celebrities, with Twitter boss Jack Dorsey also making a donation. So far, vloggers have raised nearly $ 8 million, the largest donation from Musk. The money raised will be used to plant trees of all continents except Antarctica.
The SpaceEx boss jokes that he donates to Woodbird's cause - invented by JRR Tolkien a hero in The Lord of the Rings, who is a wise talking tree.


"
