,src,lang,text
0,"











Förslaget: Hundratals fonder ska bort från PPM-torget
Premiepensionssystemet ska bli tryggare genom ökad statlig kontroll, föreslår en utredning. En konsekvens blir ett kraftigt minskat utbud på premiepensionens fondtorg – från dagens runt 500 till någonstans mellan 150 och 200 fonder.
04 Nov 2019, 11:19 by TT



Artikeln du läser är låst. Logga in eller teckna en digital prenumeration för att läsa Nordens största affärstidning.

Full tillgång till Di.se med nyheter och analyser
Tillgång till över 1100 aktiekurser i realtid
Dagens industri som e-tidning redan kvällen innan
Innehållet i alla Di:s appar, tjänster och nyhetsbrev

Är du prenumerant? Prova att ladda om sidan och kontrollera att du är inloggad.
Saknar du en prenumeration? Bli prenumerant

Till Di Live- de viktigaste marknadsdrivande nyheterna just nu

Kommentera artikeln


",sv,"











The proposal: Hundreds of funds will be removed from the PPM square
The premium pension system should be safer through increased state control, a study suggests. One consequence will be a greatly reduced supply in the premium pension fund square - from today's around 500 to somewhere between 150 and 200 funds.
04 Nov 2019, 11:19 by TT



The article you are reading is locked. Log in or sign up for a digital subscription to read the largest business newspaper in the Nordic region.

Full access to Di.se with news and analysis
Access to over 1100 real-time share prices
Today's industry as an e-newspaper already the night before
The content of all Di's apps, services and newsletters

Are you a subscriber? Try reloading the page and make sure you are logged in.
Missing a subscription? Become a subscriber

To Di Live - the most important market driving news right now

Comment on this article


"
