,src,lang,text
0,"











На Харківщині в лісі підстрелили грибника

04 Nov 2019, 11:30


У Харківській області під час збору грибів у лісі чоловік отримав вогнепальні поранення.

Про це повідомляє УНН з посиланням на власні джерела у правоохоронних органах.
Згідно з повідомленням, до лікарні в обласному центрі доправлено чоловіка 1974 року народження, який отримав вогнепальні поранення скроневої ділянки голови, черевної порожнини та грудної клітки. 
За словами медиків, такі поранення характерні для пострілу дробом з мисливської рушниці. Згодом із тіла потерпілого вилучили мисливський дріб. 
Як зазначається, чоловік розповів, що займався збором грибів біля смт Солониців, коли почув звук пострілу та відчув різкий біль. Після цього, потерпілий побачив, що неподалік пройшла група чоловіків у камуфляжі та з рушницями. 
За фактом, правоохоронці розпочали досудове розслідування за кваліфікацією ""замах на вбивство"".
Нагадаємо, Національне антикорупційне бюро України повідомило про підозру директору державного підприємства в Харківській області, якого днями затримали під час надання хабара у розмірі 100 тис. доларів детективу НАБУ. 

читайте також







",uk,"











In Kharkov, a mushroom was shot in the forest

04 Nov 2019, 11:30


In the Kharkov region, a mushroom man received gunshot wounds while collecting mushrooms in the forest.

About it reports UNN with reference to own sources in law enforcement agencies.
According to a report, a man born in 1974 who received gunshot wounds to the temporal lobe of the head, abdominal cavity and chest was sent to a hospital in the regional center.
According to doctors, such wounds are typical for shotgun shot from a hunting rifle. Subsequently, a hunting shot was removed from the victim's body.
As it is noted, the man told that he was engaged in collecting mushrooms near the village of Thessaloniki when he heard the sound of a shot and felt a sharp pain. Afterwards, the victim saw that a group of men in camouflage and rifles passed by.
In fact, law enforcement officers launched a pre-trial investigation into the ""attempted murder"" qualification.
We will remind, the National anticorruption bureau of Ukraine reported about suspicion of the director of the state enterprise in the Kharkov area who was detained recently during bribe granting in the amount of 100 thousand dollars to the NABU detective.

read also







"
