,src,lang,text
0,"











ГЕРБ разгроми конкуренцията и спечели всички балотажи в 1 област
Партията на премиера Бойко Борисов има 5 кметове на общини в Смолянска област - Смолян, Чепеларе, Баните, Златоград и Доспат

04 Nov 2019, 11:24

https://blitz.bg/analizi-i-komentari/gerb-razgromi-konkurentsiyata-i-specheli-vsichki-balotazhi-v-1-oblast_news707291.html Blitz.bg



Снимки: Георги КОЛЕВ, БЛИЦ















Николай Мелемов от ГЕРБ бе избран за трети мандат за кмет на община Смолян с 56.73%. Това сочат данните при 100% обработени протоколи на ОИК.Пълен СПИСЪК на новите кметове на областните градове при 100% обработени бюлетини ГРАФИКИ



Николай Мелемов


Мелемов победи на балотажа Стефан Сабрутев от БСП. Сабрутев получи 40.52% от вота. ""Не подкрепям никого"" са дали 2.75%. Резултатът сочи, че Мелемов е увеличил с близо 2000 гласа резултата си спрямо първия тур.
В общините Чепеларе и Баните, където също се провеждаха балотажи за кмет на община, победители отново са кандидатите на ГЕРБ.
Кмет на община Чепеларе става треньорът по биатлон Боран Хаджиев с 57.48%. Той е знаков треньор на олимпийската ни шампионка по биатлон Екатерина Дафовска. Опонентката му Анета Пашалиева от ДПС е с 39.85%.





Боран Хаджиев


С още по-голяма разлика в община Баните втори мандат взе досегашният кмет от ГЕРБ Милен Белчев, събрал 63.10% от гласовете на избирателите. Диана Фиданова, издигната от АБВ, е с 36.17%.





Милен Белчев


Така ГЕРБ има 5 кметове на общини в Смолянска област - Смолян, Чепеларе, Баните, Златоград и Доспат, пише ""Марица"".
От ДПС са кметовете на общините Мадан, Рудозем и Борино и подкрепените от движението кметове на Неделино и Девин.
БСП спечели кмет на община само в коалицията с ДПС в Девин. 
На балотажите ДПС загуби изборите в ключови за тях села в региона.
Чепеларското село Забърдо си избра за пореден мандат досегашния кмет Валентин Черпоков от ВМРО – БНД. Той спечели със 193 гласа, което е 50.92%, пред Росица Каварджиева от ДПС, получила 184 гласа или 48.55%.
Смолянското село Виево си избра за пореден мандат досегашния кмет Венко Палчев от БСП. Той получи 156 гласа или 56.93% пред Николай Хаджийски от ДПС с 117 гласа, които са 42.70%.
В едно от най-многолюдните села в региона, рудоземското Чепинци, балотажа спечели Мустафа Брахимбашев от Местна коалиция (ЗНС,БСП) с 649 гласа, което е 50.70% пред Хайри Брахимбашев от ДПС, който взе 616 гласа, 48.13%.
В друго рудоземско село Сопот кмет стана Фахри Рупецов от ДПС със 122 гласа, или 56.22%, пред Селви Хамдиев Асанлицки от ГЕРБ с 94 гласа или 43.32%.
Във второто по многолюдност село в региона, златоградското Старцево, балотажа спечели Румен Биндев от ГЕРБ със 643 гласа, 57.56% пред Младен Чаушев от ""Демократична България- Обединение"", който събра 463 гласа, 41.45%. 
В община Девин три села са с нови кметове след балотажите. В село Беден вота спечели Христина Христова от МК (БСП, ДПС) със 124 гласа, 52.77% пред Николай Димов от ГЕРБ събрал 109 гласа, 46.38%.
В село Брезе новият кмет е Румен Билянов от МК МИР със 136 гласа, 54.84% пред Катя Панайотова от ГЕРБ, която получи 108 гласа, 43.55%.
В село Триград новият кмет е Емил Гогушев от МК (БСП, ДПС), който спечели 241 гласа, 52.16% пред Цветан Славков от ГЕРБ, получил 217 гласа, 46.97%.
В доспатското село Късак спечели Касим Кехайов от ГЕРБ с 251 гласа, 58.78% пред Джамал Шалганов от ДПС, който събра 176 гласа, 41.22%.
В село Змеица убедителна победа има Антон Доспатлиев от ГЕРБ, с 550 гласа или 68.66% пред Валери Георгиев от ДПС, който получи 244 гласа, 30.46%.
Най-оригинално гласуваха в село Оряховец, община Баните, където досегашният кмет Невен Белчев, брат близнак на спечелилия балотажа за кмет на общината Милен Белчев, се отказа от изборите преди балотажа. Така избирателите даваха вота си само за опонента му - Карамфил Шуменски от МК Новото време (ДПС, ЗНС), който събра 272 гласа, 82.18%. Вот ""Не подкрепям никого"" са дали 59 избиратели, 17.82%.ЧЕТЕТЕ В БЛИЦ ГОРЕЩИ НОВИНИ ОТ МЕСТНИТЕ ИЗБОРИ!


",bg,"











GERB defeated the competition and won all the run-offs in one area
Prime Minister Boyko Borisov's party has 5 mayors of municipalities in the Smolyan region - Smolyan, Chepelare, Banite, Zlatograd and Dospat

04 Nov 2019, 11:24

https://blitz.bg/analizi-i-comments/gerb-razgromi-konkurentsiyata-i-specheli-vsichki-balotazhi-v-1-oblast_news707291.html Blitz.bg



Photos: Georgi KOLEV, BLITZ















Nikolai Melemov from GERB was elected for a third term as mayor of Smolyan municipality by 56.73%. This is indicated by the data on 100% processed OIC protocols. Full list of new mayors of district cities with 100% processed bulletins GRAPHICS



Nikolay Melemov


Melemov defeated BSP's Stefan Sabrutev run-off. Sabrutev received 40.52% of the vote. ""I don't support anyone"" gave 2.75%. The result shows that Melemov has increased his results by almost 2000 votes compared to the first round.
In the municipalities of Chepelare and Banite, which also ran for mayor of the municipality, the winners are again GERB candidates.
Mayor of Chepelare Municipality becomes the biathlon coach Boran Hadjiev with 57.48%. He is a sign coach of our Olympic biathlon champion Ekaterina Dafovska. His opponent Aneta Pashalieva from the MRF is with 39.85%.





Boran Hadzhiev


The mayor of GERB, Milen Belchev, who received 63.10% of the electoral votes, took a second term with an even bigger difference in the municipality of Banite. Diana Fidanova, raised by ABV, is 36.17%.





Milen Belchev


Thus GERB has 5 mayors of municipalities in the Smolyan region - Smolyan, Chepelare, Banite, Zlatograd and Dospat, Maritsa writes.
The MRF is the mayors of the municipalities of Madan, Rudozem and Borino and the mayors of Nedelino and Devin, supported by the movement.
The BSP won the mayor of the municipality only in the coalition with the MRF in Devin.
In the run-up, the MRF lost elections in key villages in the region.
The Chepelare village of Zabardo has elected for the next term the current mayor Valentin Cherpokov from VMRO - BND. He won by 193 votes, which is 50.92%, before the MRF's Rositsa Kavardjieva, who received 184 votes or 48.55%.
The Smolyan village of Vievo has elected for a second term the incumbent Mayor Venko Palchev from the BSP. He received 156 votes or 56.93% over the MRF's Nikolai Hadzhiyski with 117 votes, which is 42.70%.
In one of the most populous villages in the region, the Rudozem-based Chepintsi, the runoff won Mustafa Brahimbashev from the Local Coalition (ZNS, BSP) with 649 votes, which is 50.70% ahead of the MRF's Hiri Brahimbashev, who received 616 votes, 48.13%.
In another Rudozem village, Sopot mayor was Fahri Rupetsov of the MRF with 122 votes, or 56.22%, before Selvi Hamdiyev Asanlitski of GERB with 94 votes or 43.32%.
In the second most populous village in the region, the Stara Zagora district of Zlatograd, Rumen Bindev won by GERB with 643 votes, 57.56% ahead of Mladen Chaushev of Democratic Bulgaria-United, which collected 463 votes, 41.45%.
In Devin municipality, three villages have new mayors after the run-off. In the village of Beden, Hristina Hristova won by MK (BSP, MRF) by 124 votes, 52.77% before Nikolai Dimov from GERB collected 109 votes, 46.38%.
In the village of Breze, the new mayor is Rumen Bilyanov of MK MIR with 136 votes, 54.84% ahead of Katya Panayotova of GERB, who received 108 votes, 43.55%.
In the village of Trigrad, the new mayor is Emil Gogushev of the MK (BSP, MRF), who won 241 votes, 52.16% ahead of Tsvetan Slavkov from GERB, received 217 votes, 46.97%.
In the Dospat village of Kusak, Kasim Kehayov from GERB won by 251 votes, 58.78% ahead of Jamal Shalganov of the MRF, which collected 176 votes, 41.22%.
In the village of Zmeitsa, Anton Dospatlieu of GERB, with 550 votes, or 68.66% ahead of Valery Georgiev of MRF, who received 244 votes, 30.46%, had a convincing victory.
Most originally, they voted in the village of Oryahovets, Banite municipality, where former mayor Neven Belchev, a twin brother of the run-off for mayor of the municipality Milen Belchev, dropped out of elections before the run-off. Thus, the voters cast their votes only for his opponent - Carnation Shumensky of MK Novnoe Vaz (MRF, ZNS), which collected 272 votes, 82.18%. 59 voters, 17.82% gave ""I do not support anyone"". READ HOT NEWS FROM THE LOCAL ELECTIONS!


"
