,src,lang,text
0,"











Stijlmarkt
Frankfurter Stijlmarkt: „Hier gibt es nicht diesen Einheitsbrei“
04 Nov 2019, 11:03 by Kathrin Rosendorff

Auf dem Frankfurter Campus Westend kamen zwei Tage lang sehr viele Menschen, um stylish wie nachhaltig einkaufen zu gehen. Lange Schlangen gab es bei den Foodtrucks.

Nicht jedes alte Auto eignet sich zum coolen Flaschenöffner. Bei der Auswahl ist Mathias Mergel wählerisch. Die Rede ist natürlich von Spielzeugautos. „Dafür suche ich im Internet keine neuen Spielzeugautos, sondern sie sollen aus den 60ern bis 90ern sein. Außerdem muss der Metallboden passen, so dass ich diesen auch gut auf den Flaschenöffner nieten kann“, erzählt Mergel, der für den Stijlmarkt auf dem Campus Westend am Wochenende aus Essen nach Frankfurt angereist ist.
Seine „Matchplopz“ verkauft er hier für 13 Euro das Stück. Überhaupt gibt es viel zu sehen und zu kaufen beim Stijlmarkt, den es in verschiedenen deutschen Städten gibt. Hier finden die Besucherinnen und Besucher nicht nur hipstertaugliche Produkte wie angesagte Stirnbänder für Winter und Sommer, sondern es soll ebenso laut Veranstaltern ein Ort für regionale Ware und fairen Handel sein.
Nachhaltigkeit ist Teil des Konzepts beim Stijlmarkt Frankfurt
Nachhaltigkeit ist ebenfalls Teil des Konzepts. Das Upcyclen wie bei den Spielzeugautos passt da gut, wie auch die upcycelten Vintage-Baumwollstoffe als Ersatz für Alu- oder Frischhaltefolien der Frankfurter Marke „ever & again“.


Pascal Scherz und seine Frau Maria Paula Arenas verkaufen mit ihrer Firma Kupa bunte Taschen und Rucksäcke, die in Kolumbien handgenäht werden.  © Monika Müller

Aus Stuttgart sind Pascal Scherz und seine Frau Maria Paula Arenas angereist. Sie verkaufen Reisetaschen und Rucksäcke aus Leder und Stoff, aber auch ausklappbare Wickeltaschen und Kinderrucksäcke. „Wir sind die mit dem bunten Reißverschluss“, sagt Scherz. Kupa heißt die Firma, die Arenas’ Bruder in Kolumbien gegründet hat. „Wir haben mittlerweile 25 Mitarbeiter in Bogotá. Und alle Sachen sind aus kolumbianischen Materialien und werden dort von Hand genäht“, so Scherz. In Deutschland verkaufen sie auf Märkten sowie im Onlineshop. Die Wuppertaler Designerin Pia Heise macht hübsche Taschen und Rucksäcke aus alten Lastwagenplanen (129 Euro), aus ihrer alten Lederjacke hat sie ein Portemonnaie (29 Euro) gemacht.
Heise findet, dass der Stijlmarkt in Frankfurt ein gutes Publikum anziehe. „Die Leute sind hier sehr offen für Neues.“ Viele Besucherinnen und Besucher sind gekommen, die Gänge sind voll. Die meisten sind so zwischen 25 und 40 Jahre alt. Corinna (29) sagt: „Es ist cool, dass es hier regionale und nachhaltige Sachen gibt. Ich achte da selbst sehr drauf, ich kaufe auch keine Kleider mehr bei H&M“, sagt sie. Ihre Freundin Carina (29) will sich einfach inspirieren lassen: „Wir machen uns einen schönen Mädelstag.“
Stjilmarkt Franfurt: Lederjacken zum Verlieben
Aber es gibt auch zwischendrin Ü-50-Gäste. Wie ein Ehepaar aus dem Taunus. „Wir sind zum ersten Mal hier. Mich hat interessiert, wie junge Leute sich so stylen. Und hier gibt es nicht diesen Einheitsbrei. Das finde ich toll“, sagt die Frau aus Eschborn. Sie habe sich hier eben in eine Lederjacke verliebt. Ihr Mann lässt sich zwischendrin kurz den Bart beim Herrenfriseur stutzen. Der hat direkt in einer Ecke seinen Laden, der an Großvaters Zeiten erinnert, aufgebaut.
„Kleb’ dir ein neues Fahrrad“ steht an einem Stand. Hier kann man sein Rad neu und individuell mit Farbfolien bekleben. „Das ist dann gut, wenn beispielsweise die Tochter das Rad vom großen Bruder übernimmt. Da kann man es nach ihrem Geschmack neu bekleben und muss nicht gleich ein neues Rad kaufen“, sagt Cordula Holzmann vom Hamburger Label „Mooxibike“ zur Fahrradfolie. Außerdem: „Die Leute sollen den Künstler in sich entdecken.“
Lange Schlangen vor den Foodtrucks auf dem Campus Westend
Derweil bilden sich am Samstagnachmittag lange Schlangen draußen bei den Foodtrucks. Obwohl Regen angekündigt war, scheint die Sonne. Viele erholen sich vom Gucken und Shoppen auf den Holzbänken. Dort gibt es beispielsweise „Hipster-Chili“, an einem anderen Stand vietnamesisches Baguette mit Fancy Pork (feinem Schwein) oder Lemon-Grass-Tofu. Alle seien eigene Rezepte, und das Brot käme von einem Sachsenhäuser Bäcker, erzählt der Herr an der Kasse.
V’s Bánh Mì nennen sie sich. Bánh Mì ist das Wort für vietnamesisches Baguette. „Wir wollen uns hier ausprobieren und schauen, wie die Baguettes ankommen. Wir haben gerade erst angefangen“, sagt eine der Macherinnen und belegt fleißig weiter.  


",de,"











Stijlmarkt
Frankfurt Stijlmarkt: ""There is no such thing here as this""
04 Nov 2019, 11:03 by Kathrin Rosendorff

For two days, many people came to the Westend campus in Frankfurt to shop in a stylish and sustainable way. There were long lines at the food trucks.

Not every old car is a cool bottle opener. When choosing Mathias marl is choosy. The speech is of course toy cars. ""I'm not looking for new toy cars on the internet, but they're supposed to be from the 60s to the 90s. In addition, the metal base has to fit so that I can also rivet it well on the bottle opener, ""says Mergel, who traveled from Essen to Frankfurt for the Stijlmarkt on Campus Westend over the weekend.
He sells his ""Matchplopz"" here for 13 euros. In general, there is a lot to see and buy at the Stijlmarkt, which is available in various German cities. Visitors will not only find products suitable for hipsters, such as hip headbands for winter and summer, but also, according to the organizers, a place for regional goods and fair trade.
Sustainability is part of the concept at Stijlmarkt Frankfurt
Sustainability is also part of the concept. The upcycling as with the toy cars fits well, as well as the upcycled vintage cotton fabrics as a substitute for aluminum or cling films of the Frankfurt brand ""ever & again"".


Pascal Scherz and his wife Maria Paula Arenas sell with their company Kupa colorful bags and backpacks, which are hand-sewn in Colombia. © Monika Müller

From Stuttgart Pascal Scherz and his wife Maria Paula Arenas arrived. They sell travel bags and rucksacks made of leather and fabric, but also fold-out diaper bags and children's rucksacks. ""We are the ones with the colorful zipper,"" says Scherz. Kupa is the name of the company Arenas' brother founded in Colombia. ""We now have 25 employees in Bogotá. And all things are made of Colombian materials and are sewn there by hand, ""says Scherz. In Germany they sell in markets as well as in the online shop. The Wuppertal designer Pia Heise makes beautiful bags and backpacks from old truck tarpaulins (129 euros), from her old leather jacket she has made a purse (29 euros).
Heise thinks the Stijlmarkt in Frankfurt attracts a good crowd. ""People are very open to new things here."" Many visitors have come, the aisles are full. Most are between 25 and 40 years old. Corinna (29) says: ""It's cool that there are regional and sustainable things here. I really care about that, I do not even buy clothes at H & M, ""she says. Her friend Carina (29) just wants to be inspired: ""We'll have a nice girl's day.""
Stjilmarkt Franfurt: leather jackets to fall in love with
But there are also Ü-50 guests in between. Like a couple from the Taunus. ""We are here for the first time. I was interested in how young people style themselves. And here there is not this uniformity. I think that's great, ""says the woman from Eschborn. She just fell in love with a leather jacket. In between, her husband briefly lets his beard be trimmed by the barber. He set up his shop right in the corner, reminiscent of grandfather's time.
""Stick a new bike"" is standing on a stand. Here you can glue your bike new and individually with color films. ""That's good if, for example, the daughter takes over the bike from her big brother. Since you can repackage it to their liking and does not have to buy a new bike immediately, ""says Cordula Holzmann from the Hamburg label"" Mooxibike ""to Fahrradfolie. Also: ""People should discover the artist in themselves.""
Long lines in front of the food trucks on Campus Westend
Meanwhile, long queues are forming outside the food trucks on Saturday afternoon. Although rain was announced, the sun is shining. Many recover from peering and shopping on the wooden benches. There is, for example, ""hipster chili"", at another booth Vietnamese baguette with fancy pork (fine pig) or lemon grass tofu. All are their own recipes, and the bread came from a Saxon baker, says the gentleman at the cash register.
V's Bánh Mì they call themselves. Bánh Mì is the word for Vietnamese baguette. ""We want to try out here and see how the baguettes arrive. We have just started, ""says one of the creators and continues diligently.


"
