,src,lang,text
0,"











Murió electrocutado por usar el celular mientras lo cargaba
04 Nov 2019 by Redacción Diario de Cuyo
Un joven de 18 años fue hallado muerto en su vivienda en el distrito de Chilca, en Huancayo, Perú; y los investigadores sospechan que las causas del deceso están vinculadas a que el chico usaba su teléfono celular mientras lo cargaba.
El cadáver, identificado como Carlos Eulogio Ronaldiño, fue encontrado al mediodía del pasado martes sobre una cama, horas después del accidente, con señales de quemaduras en los dedos y en el pecho, donde tenía apoyado el dispositivo.



De acuerdo a las pericias realizadas en el lugar, los investigadores analizan dos versiones sobre las circunstancias de la muerte: una sugiere que el estudiante universitario recibió una descarga eléctrica mientras trataba de reparar un cable del teléfono y murió en el acto; mientras que otra indica que estaba usando su celular o se quedó dormido con él cuando ocurrió la descarga que lo mató.
El cuerpo de Ronaldiño fue trasladado a la morgue de Hualhuas para realizarle la autopsia y conocer las causas exactas de su deceso.


",es,"











He died electrocuted for using the cell phone while charging
04 Nov 2019 by Cuyo Daily Writing
An 18-year-old boy was found dead in his home in the Chilca district of Huancayo, Peru; and investigators suspect that the causes of death are linked to the boy using his cell phone while charging.
The body, identified as Carlos Eulogio Ronaldiño, was found at noon last Tuesday on a bed, hours after the accident, with signs of burns on his fingers and chest, where he had supported the device.



According to the expertise conducted at the scene, the researchers analyze two versions of the circumstances of death: one suggests that the university student received an electric shock while trying to repair a telephone cable and died on the spot; while another indicates that he was using his cell phone or fell asleep with him when the discharge that killed him occurred.
Ronaldiño's body was transferred to the morgue of Hualhuas to perform an autopsy and to know the exact causes of his death.


"
