,src,lang,text
0,"











en la Plaça del Congrés Eucarístic
Elche se prepara para acoger las esculturas de Jaume Plensa
04 Nov 2019 by Culturplaza


'María'

ALICANTE. Las esculturas Silvia y María, del artista Jaume Plensa, que han estado expuestas en la Ciutat de les Arts i les Ciències (València) durante casi cinco meses, dentro de una muestra impulsada y organizada por la Fundación Hortensia Herrero, han sido las escogidas para quedarse en la Comunitat Valenciana. Estas dos esculturas empiezan ahora un periplo por diferentes localidades de la Comunitat Valenciana, comenzando por Elche. 
A partir del próximo 14 de noviembre, la localidad ilicitana albergará estas piezas para el disfrute de sus vecinos, quienes podrán localizarlas en la Plaça del Congrés Eucarístic, junto a la Basílica de Santa María en la que se celebra el ‘Misterio de Elche’. Allí estarán aproximadamente ocho meses antes de continuar viajando, de nuevo juntas, hasta una localidad de la provincia de Castellón aún por determinar.
 Hortensia Herrero, presidenta de la Fundación que lleva su nombre y vicepresidente de Mercadona, ya anunció durante el acto de presentación de la muestra de Jaume Plensa, el pasado 26 de junio, que este año serían dos las piezas que adquiriría para que se quedaran en la Comunitat Valenciana. Una de ellas, concretamente la denominada María, la adquiere la propia Fundación, y la otra, la bautizada como Silvia, la adquiere Mercadona.



“Como hemos hecho en años anteriores, también quise que quedara una parte de esta exposición temporal para siempre con nosotros, con los valencianos. Por eso decidimos adquirir dos de estas cabezas escultóricas. Ahora, estas piezas van a viajar a diferentes localidades de la Comunitat Valenciana durante aproximadamente dos años. Vamos a empezar por Alicante llevándolas a Elche y, posteriormente, las trasladaremos a una localidad de la provincia de Castellón. El objetivo es poder compartir esta sensibilidad artística con el mayor número de personas para que puedan disfrutar de la belleza de las obras de Jaume Plensa”, explica Hortensia Herrero.
A lo largo del día de hoy van a comenzar los trabajos para la adecuación del entorno y la construcción e instalación de las bases sobre las que se ubicarán las dos esculturas.
Jaume Plensa, artista internacional
Jaume Plensa es uno de los artistas españoles con mayor proyección internacional, pues ciudades como Montreal, San Diego, Chicago, Seul, Tokio, Miami, Nueva York, Londres, Salzburgo, Liverpool, Dubai o Dallas cuentan con esculturas suyas instaladas de forma permanente. Asimismo la obra de Plensa ha sido objeto de exposiciones temporales en museos e instituciones como la Bienal de Venecia, el Nasher Sculpture Center de Dallas, el Yorkshire Sculpture Park, el Museo Picasso de Antibes, el MAMAC de Niza, o en museos de ciudades como Helsinki, Tampa o Nahsville y en sus galerías de París, Nueva York y Chicago. 
Plensa acaba de inaugurar una exposición en el Museo Reina Sofía de Madrid y lo hará en unas semanas en el MACBA de Barcelona. Ha recibido numerosos premios internacionales como la medalla de Caballero de las Artes y las Letras de Francia, el Premio Velázquez de las Artes y ha sido nombrado Doctor Honoris Causa por el Art Institute de Chicago y por la Univeristat Autònoma de Barcelona.
Fundación Hortensia Herrero
La Fundación Hortensia Herrero es una entidad sin ánimo de lucro cuya misión fundacional es recuperar, compartir y desarrollar la sensibilidad artística y cultural en el ámbito de la Comunitat Valenciana. Presidida por Hortensia Herrero, vicepresidenta de Mercadona, hasta la fecha ha tenido actuaciones en el mundo de la rehabilitación de edificaciones histórico-religiosas, en el del arte y en el de la danza. La exposición temporal de Jaume Plensa ha sido la tercera realizada por la Fundación, tras la instalada en 2017, a cargo de Manolo Valdés, y la de 2018, con Tony Cragg.


",es,"











in the Plaça del Congrés Eucarístic
Elche prepares to host the sculptures of Jaume Plensa
04 Nov 2019 by Culturplaza


'Mary'

ALICANTE The sculptures Silvia and María, by artist Jaume Plensa, which have been exhibited in the City of Arts and Sciences (Valencia) for almost five months, within a sample promoted and organized by the Hortensia Herrero Foundation, have been chosen for stay in the Valencian Community. These two sculptures now begin a journey through different locations of the Valencian Community, starting with Elche.
From next November 14, the town of Ilicitana will house these pieces for the enjoyment of its neighbors, who can locate them in the Plaça del Congrés Eucarístic, next to the Basilica of Santa María in which the ‘Mystery of Elche’ is celebrated. There they will be approximately eight months before continuing to travel, again together, to a town in the province of Castellón yet to be determined.
Hortensia Herrero, president of the Foundation that bears her name and vice president of Mercadona, already announced during the presentation of the sample of Jaume Plensa, on June 26, that this year there would be two pieces that she would acquire to stay in the Valencian Community. One of them, specifically the so-called Maria, is acquired by the Foundation itself, and the other, baptized as Silvia, is acquired by Mercadona.



“As we have done in previous years, I also wanted to keep a part of this temporary exhibition forever with us, with the Valencians. That is why we decided to acquire two of these sculptural heads. Now, these pieces are going to travel to different locations of the Valencian Community for approximately two years. We will start in Alicante taking them to Elche and, later, we will transfer them to a town in the province of Castellón. The objective is to be able to share this artistic sensibility with the greatest number of people so that they can enjoy the beauty of Jaume Plensa's works, ”explains Hortensia Herrero.
Throughout today work will begin to adapt the environment and the construction and installation of the bases on which the two sculptures will be located.
Jaume Plensa, international artist
Jaume Plensa is one of the Spanish artists with the greatest international projection, as cities such as Montreal, San Diego, Chicago, Seoul, Tokyo, Miami, New York, London, Salzburg, Liverpool, Dubai or Dallas have his permanently installed sculptures. Likewise, Plensa's work has been the subject of temporary exhibitions in museums and institutions such as the Venice Biennale, the Nasher Sculpture Center in Dallas, the Yorkshire Sculpture Park, the Picasso Museum in Antibes, the MAMAC in Nice, or in city museums such as Helsinki, Tampa or Nahsville and in its galleries in Paris, New York and Chicago.
Plensa has just opened an exhibition at the Reina Sofía Museum in Madrid and will do so in a few weeks at the MACBA in Barcelona. He has received numerous international awards such as the Medal of the Knight of Arts and Letters of France, the Velázquez Award for the Arts and has been named Doctor Honoris Causa by the Art Institute of Chicago and by the Autonomous University of Barcelona.
Hortensia Herrero Foundation
The Hortensia Herrero Foundation is a non-profit organization whose founding mission is to recover, share and develop artistic and cultural sensibility in the Valencian Community. Chaired by Hortensia Herrero, Vice President of Mercadona, to date she has had performances in the world of the rehabilitation of historical-religious buildings, in art and in dance. The temporary exhibition of Jaume Plensa has been the third one made by the Foundation, after the one installed in 2017, by Manolo Valdés, and that of 2018, with Tony Cragg.


"
