,src,lang,text
0,"











Denuncia SEV presunto desvío por más de $9.6 millones en agravio de la UPAV
EL secretario de Educación dijo que los recursos desaparecieron por medio de transferencias bancarias hechas en 2018 a la asociación civil ""Alianza para el Fomento del Aprendizaje”
04 Nov 2019 by Miguel Salazar | Diario de Xalapa
Xalapa, Ver.- El secretario de educación Zenyazen Escobar García denunció ante la Fiscalía Anticorrupción un presunto desvío de recursos por más de 9 millones 648 mil pesos en agravio de la Universidad Popular Autónoma de Veracruz (UPAV).
Entrevistado esta mañana a su llegada a las instalaciones de la Fiscalía antes citada, sostuvo que los recursos desaparecieron por medio de diversas transferencias bancarias que se hicieron durante 2018 a la asociación civil ""Alianza para el Fomento del Aprendizaje”.

Precisó que anteriormente la UPAV mantenía un convenio con esa asociación y que el recurso faltante no fue justificado durante la entrega–recepción de la nueva administración.

Sostuvo que se trata de pagos y aportaciones voluntarias de estudiantes, que presuntamente se transfirieron para cubrir pagos de gratificaciones, ayudas económicas y compensaciones a los asesores solidarios.
Sin embargo, debido a que los asesores comenzaron a quejarse porque dejaron de recibir el recurso, se inició una investigación con la que se descubrió el faltante.
La denuncia presentada va en contra de quien o quienes resulten responsables y de acuerdo con el titular de la SEV se esperan resultados a la brevedad.

NOTAS RELACIONADAS






",es,"











SEV denounces alleged diversion of more than $ 9.6 million to the UPAV
The Secretary of Education said the resources disappeared through bank transfers made in 2018 to the civil association ""Alliance for the Promotion of Learning""
04 Nov 2019 by Miguel Salazar | Xalapa's Diary
Xalapa, Ver.- The secretary of education Zenyazen Escobar García denounced before the Anticorruption Prosecutor an alleged diversion of resources for more than 9 million 648 thousand pesos to the detriment of the Popular Autonomous University of Veracruz (UPAV).
Interviewed this morning upon arrival at the aforementioned Office of the Prosecutor, he said that the resources disappeared through various bank transfers that were made during 2018 to the civil association ""Alliance for the Promotion of Learning.""

He said that previously the UPAV maintained an agreement with that association and that the missing resource was not justified during the delivery-reception of the new administration.

He argued that these are payments and voluntary contributions from students, which were allegedly transferred to cover payments of bonuses, financial aid and compensation to solidarity advisers.
However, because the advisors began to complain that they stopped receiving the appeal, an investigation was initiated with which the missing one was discovered.
The complaint filed is against who or who are responsible and according to the head of the SEV results are expected soon.

RELATED NOTES






"
