,src,lang,text
0,"











Открылся аутлет Fashion House на Таллинском шоссе с магазинами Puma, Quiksilver и Baldinini. Вот как выглядит новое пространство

04 Nov 2019

На Таллинском шоссе открылась первая очередь аутлета Fashion House. Торговый центр находится неподалеку от КАД и железнодорожной станции Горелово.
В Fashion House продают одежду и обувь со скидками от 30 до 70 %. В аутлете есть магазины брендов Baldinini, Incanto, Puma, Quiksilver, Ralf Ringer. После рождества обещают открытие Adidas, Reebok и Lacoste. Полный список магазинов можно посмотреть на сайте.
Интерьеры аутлета повторяют торговые улицы Лондона, Парижа и Милана. На территории есть фонтан. Вот как выглядит пространство.















В честь открытия в некоторых магазинах аутлета действуют дополнительные скидки. 



Fashion House Group открыла шесть аутлетов Европе и России. В Москве проект заработал в 2013 году.


",ru,"











Fashion House outlet opened on Tallinn Highway with Puma, Quiksilver and Baldinini stores. Here's what the new space looks like

04 Nov 2019

The first phase of the Fashion House outlet has opened on Tallinn Highway. A shopping center is located near the Ring Road and Gorelovo Train Station.
Fashion House sells clothes and shoes with discounts from 30 to 70%. In the outlet there are stores of the brands Baldinini, Incanto, Puma, Quiksilver, Ralf Ringer. After Christmas, they promise the opening of Adidas, Reebok and Lacoste. A complete list of stores can be viewed on the website.
The interiors of the outlet repeat the shopping streets of London, Paris and Milan. On the territory there is a fountain. This is what space looks like.















In honor of the opening in some outlet stores, additional discounts apply.



Fashion House Group has opened six outlets in Europe and Russia. In Moscow, the project was launched in 2013.


"
