,src,lang,text
0,"











דויטשה טלקום תוקפת את למונייד הישראלית: ""הצבע הוורוד שייך לנו""
ענקית התקשורת הגרמנית דורשת מחברת טכנולוגיות הביטוח לוותר על הגוון הוורוד במותג שלה במדינה, בטענה שהצבע שייך לה. ""מבחינת דויטשה טלקום, היא בעלת כל גוון שנמצא בין אדום לסגול"", סיפר יו""ר למונייד - שנערכת למאבק
04 Nov 2019 by מאיר אורבך
חברת טכנולוגיות הביטוח הישראלית למונייד החלה לפעול בגרמניה, ונקלעה למשבר לא שגרתי: חברת דויטשה טלקום, ענקית תקשורת אירופית, דרשה מהחברה הישראלית להפסיק להשתמש בצבע וורוד במותג שלה במדינה. לטענת דויטשה טלקום, הצבע מזוהה איתה ואף נמצא בבעלותה. למונייד, מצידה, נערכת להשיב מלחמה שערה.
בשיחה עם כלכליסט הסביר שי וינינגר, נשיא למונייד ואחד ממייסדיה: ""השקנו פעילות בגרמניה ביוני 2019 כמדינה ראשונה מבין סדרה של מדינות באירופה וזמן קצר לאחר מכן קיבלנו דרישה מדויטשה טלקום וצו מניעה שדורשים להפסיק להשתמש בצבע הוורוד. מבחינת דויטשה טלקום הם מחזיקים בבעלות לפי דעתם כל גוון שנמצא בין אדום לסגול"".  


המטה של דויטשה טלקום בעיר בון, גרמניה צילום: Deutsche Telecom

 
לדבריו, הופתעה הנהלת למונייד: ""זו התנהגות שמזכירה בריונות. חשבנו שכנראה מדובר בבדיחה וכשבדקנו לעומק, הבנו שזה לא פעם ראשונה וככה היא פועלת ומפחידה חברות כדי לא להתקרב לצבעים שלהם"", סיפר. ""גם חברות שאין להן קשר לתחום של דויטשה קיבלו דרישה כזו. הם רוצים בעלות מלאה על הצבע הוורוד"".  


הוורוד בשימוש למונייד צילום: lemonade

ואולם, החברה הישראלית לא נכנעה ואף החליטה לתקוף בחזרה את הענקית הגרמנית, ולהיאבק בה משפטית כשבידיה קייס לא רע, להערכת ההנהלה. ""ניסינו לפתוח דיון והוא היה הזוי מאוד"", סיפר וינינגר. ""אנחנו מכבדים קניין רוחני שחשוב מאוד לעולם, ולחברות צריך להיות יכולת להגן עליו - אבל כשמדברים על צבע זה שונה. צבע שייך לכלל ולא ניתן לדמיין חברות שתופסות בעלות על צבע"". 


שי ויניגר ודניאל שרייבר, מייסדי למונייד צילום: BEN KELMER

  
באפריל האחרון גייסה למונייד 300 מיליון דולר מסופטבנק. משקיעים נוספים בחברה כוללים את גוגל ונצ'רס, קרן הון הסיכון האמריקאית ג'נרל קטליסט, Thrive Capital, חברת הביטוח אליאנץ ו-OurCrowd, קרנות הון הסיכון אלף וסקויה החברה מעסיקה כיום 170 עובדים, מתוכם 60 בישראל.


",iw,"











Deutsche Telekom attacks Israeli lemmaid: ""The pink color belongs to us""
The German telecommunications giant is demanding insurance technology company give up its pink hue in the country, claiming the color belongs to it. ""As far as Deutsche Telecom is concerned, it has every shade that is between red and purple,"" the chairman told Monade - who is preparing for the fight
04 Nov 2019 by Meir Orbach
Israeli insurance technology firm Monad has started operating in Germany, and is in an unconventional crisis: Deutsche Telecom, a European telecommunications giant, has demanded that the Israeli company stop using pink and its brand in the country. Deutsche Telecom claims the color is associated with it and even owned by it. Monide, for her part, is preparing to fight back her hair.
Speaking to Calcalist, Xi Weininger, president of LeMunide and one of its founders, explained: ""We launched operations in Germany in June 2019 as the first of a series of European countries and shortly thereafter we received a demand from Deutsche Telecom and an injunction that require them to stop using the pink color. A shade that is between red and purple. ""


Deutsche Telecom headquarters in Bonn, Germany Photo: Deutsche Telecom


He said the management was surprised: ""This is a bully-like behavior. We thought it was probably a joke and when we checked in depth, we realized it wasn't the first time and that's how it works and scares companies not to get close to their colors,"" he said. ""Companies that are unrelated to Deutsche's field have also been given such a demand. They want full ownership of the pink color.""


Pink used for monid Photo: lemonade

However, Israeli society did not surrender and even decided to attack the German giant, and fight it legally with a bad case in her hands, management believes. ""We tried to open a discussion and he was very delusional,"" Weininger said. ""We respect intellectual property that is very important to the world, and companies need to be able to protect it - but when talking about color it is different. Color belongs to the whole and it is impossible to imagine companies that perceive color.""


Shay Weiniger and Daniel Schreiber, founders of Monade Photo: BEN KELMER


Last April, Monaid raised $ 300 million from Softbank. Other investors in the company include Google Ventures, US venture capital fund General Catalyst, Thrive Capital, Allianz and OurCrowd, venture capital funds Alf and Sequoia. The company currently employs 170 people, of which 60 are in Israel.


"
