,src,lang,text
0,"











آتش سوزی در هواپیمای حامل نخست وزیر ژاپن
04 Nov 2019 by عصر ايران



خبرگزاری کیودو ژاپن گزارش کرد هواپیمای حامل نخست وزیر ژاپن در حال پرواز به سوی تایلند بود که بعد از ظهر روز گذشته (یکشنبه) به وقت محلی دچار سانحه حریق شد.
به گزارش ایرنا کیودو روز دوشنبه گزارش کرد خدمه حدود ساعت ۱۵ عصر روز یکشنبه در حال درست کردن وعده غذایی در بوئینگ ۷۷۷-۳۰۰ ای آر بودند که حریق رخ داد اما بلافاصله خاموش شد، خسارتی به بار نیاورد و کسی هم آسیب ندید.
مقامات ژاپنی همچنین اعلام کردند این حریق تغییری در برنامه پرواز نخست وزیر این کشور ایجاد نکرده است.
این هواپیما که توسط نیروی دفاع از خود ژاپن اداره می شود آوریل امسال جایگزین هواپیمای قبلی دولت که یک بوئینگ ۷۴۷ بود شد.
آبه ساعت ۱۳:۴۱ بعد از ظهر یکشنبه فرودگاه هاندا توکیو را به مقصد تایلند با هدف شرکت در نشست «آ. سه. آن» موسوم به اتحادیه کشورهای جنوبی شرق آسیا ترک کرد.


",fa,"











Fires on Japanese Prime Minister's plane
04 Nov 2019 by Asr Iran



Japan's Prime Minister's plane was flying to Thailand after a local fire yesterday (Sunday), Kyodo news agency reported.
Crews were preparing a meal at Boeing 6-7 AR at about 9pm on Sunday, but the fire was extinguished immediately, causing no damage and no one was injured, IRNA Kyodo reported Monday.
Japanese officials also said the fire had not changed the prime minister's flight plan.
The aircraft, operated by the Japanese Self-Defense Force, replaced the previous government plane, a Boeing 2, in April.
Abe arrives at Honda Tokyo Airport in Thailand at 6:50 pm on Sunday to attend the A.A. Three. The so-called ""Union of South East Asian Nations"" left.


"
