,src,lang,text
0,"











Подросток на вокзале получил 50% ожогов тела
05 Nov 2019, 02:32 by Корреспондент.net
Парень пытался перелезть через грузовой вагон на железнодорожной станции.
В Броварах Киевской области 15-летний подросток получил 50% ожогов тела, пытаясь перелезть через грузовой вагон на железнодорожном вокзале. Об этом сообщает пресс-служба полиции области.
Так, сообщается, что парень самостоятельно обратился за помощью к работникам станции, которые вызвали милицию и помощь.
По предварительной информации, парень пытался перелезть через грузовой вагон на железнодорожном вокзале.
Отмечается, что сейчас подросток находится в медикаментозной коме. Впоследствии он будет перенаправлен в столичное ожоговое отделение.
""Полиция Киевщины обращается ко всем гражданам с призывом соблюдать правила безопасности жизнедеятельности, напоминает о необходимости переходить железнодорожные пути в установленных местах, а также призывает родителей и педагогов проводить соответствующие разъяснительные беседы с детьми"", - говорится в сообщении.
Работники ювенальной превенции и следователи Броварского района выясняют все обстоятельства произошедшего.
Ранее в лесном массиве неподалеку от пгт Деловое Раховского района Закарпатской области от удара током погиб семилетний мальчик.


В Одесской области 11-летнюю девочку убило током




",ru,"











A teenager at a train station received 50% of body burns
05 Nov 2019, 02:32 by Correspondent.net
The guy tried to climb over a freight car at the train station.
In Brovary, Kiev region, a 15-year-old teenager received 50% of body burns while trying to climb over a freight car at a railway station. This was reported by the regional police press service.
So, it is reported that the guy independently turned for help to the station employees who called the police and help.
According to preliminary information, the guy tried to climb over a freight car at the railway station.
It is noted that now the teenager is in a medical coma. Subsequently, he will be redirected to the metropolitan burn department.
""The police of the Kiev region appeals to all citizens to abide by the rules of life safety, recalls the need to cross the railway tracks in designated places, and also urges parents and teachers to conduct appropriate explanatory conversations with children,"" the statement said.
Workers of juvenile prevention and investigators of the Brovarsky district find out all the circumstances of the incident.
Earlier, in a forest near the town of Delovoye, Rakhiv district, Transcarpathian region, a seven-year-old boy died from electric shock.


In Odessa region 11-year-old girl was killed by electric shock




"
