,src,lang,text
0,"












سیاستمداران آلمانی به مرگ تهدید شدند

دو تن از رهبران حزب سبز آلمان می‌گویند از سوی یک گروه نئونازی در آمریکا ایمیل‌هایی با مضمون تهدید به مرگ دریافت کرده‌اند.
03 Nov 2019, 13:36 by بولتن نیوز | bultannews.com
به گزارش بولتن نیوز، شبکه تلویزیونی بی بی سی گزارش داد دو تن از رهبران حزب سبز آلمان می‌گویند از سوی شاخه آلمانی یک گروه نئونازی در آمریکا ایمیل‌هایی با مضمون تهدید به مرگ دریافت کرده اند. بر اساس این گزارش، این ایمیل‌ها به دفتر چم اوزدمیر-که اصالت ترک دارد-و کلودیا روث ارسال شده است.
دفتر اوزدمیر اعلام کرد این ایمیل‌ها را در اختیار پلیس آلمان قرار داده است. شاخه آلمانی گروه نئونازی Atomwaffe در ورای این اقدام قرار دارد. این گروه افراد نامبرده را در فهرست اهداف ترور خود قرار داده بود.
جزییات مرتبط با این تهدید به قتل در روزنامه آلمانی Funke Mediengruppe اعلام شد که بخشی از این ایمیل تهدید آمیز را منتشر کرده است.
در بخشی از این ایمیل آمده است: ""در حال حاضر، ما در حال برنامه ریزی برای این مسئله هستیم که چگونه و چه زمانی شما را اعدام کنیم. آیا باید در تجمع عمومی بعدی این کار را انجام دهیم؟ یا این که در مقابل خانه‌ات این کار را انجام دهیم؟""
اوزدمیر که حدود یک دهه تا ژانویه سال گذشته رئیس مشترک حزب سبز آلمان بود این پیام را در اختیار پلیس قرار داد. بر اساس گزارش روزنامه آلمانی لحن این ایمیل سبب شد اوزدمیر آن را بیشتر از تهدید‌های قبلی جدی بگیرد.
اوزدمیر یکی از منتقدان سرسخت رجب طب اردوغان، رئیس جمهور ترکیه است و تاکنون از سوی اتباع ترک بارها به مرگ تهدید شده است. روث نیز اعلام کرد این جدیدترین تلاش از سوی برخی برای ارعاب سیاستمداران محسوب می‌شود.


",fa,"












German politicians were threatened with death

Two leaders of the German Green Party say neo-Nazi groups in the US have received death-threatening emails.
03 Nov 2019, 13:36 by Bulletin News | bultannews.com
Two German Green Party leaders say they have received death-threatening emails from a German branch of a neo-Nazi group in the United States, according to BBC News. The emails were reportedly sent to the office of Cham Ozdemir - of Turkish descent - and Claudia Ruth.
Ozdemir's office said it had sent the emails to German police. The German branch of the Atomwaffe neo-Nazi group is behind the move. The group had listed the individuals listed as targets for their assassination.
Details of the murder threat were published in the German daily Funke Mediengruppe, which published part of the threatening email.
Part of this email reads: ""Right now, we're planning on how and when to execute you. Should we do this at the next public rally? Or in front of your house? Do this? ""
Ozdemir, who was the co-chairman of the German Green Party for about a decade until January last year, gave the message to the police. According to the German-language newspaper Tune, this email made Ozdemir more serious than the previous threats.
Ozdemir is a staunch critic of Turkish President Recep Tayyip Erdogan and has been repeatedly threatened with death by Turkish nationals. Ruth also said this was the latest attempt by some to intimidate politicians.


"
