,src,lang,text
0,"











Hija de Jessica Newton responde a especulaciones de embarazo con Deyvis Orosco
¿Cassandra Sánchez y Deyvis Orosco serán papás o no? Así respondió la hija de Jessica Newton.
03 Nov 2019, 13:04 by Brenda Quiroz
Cassandra Sánchez De Lamadrid estuvo en todas las páginas web de espectáculos por los rumores sobre su posible embarazo con Deyvis Orosco. Hoy la joven ha decidido responder y decir si está esperando un bebé del cantante.



La joven mencionó que se enteró del ‘embarazo’ por redes sociales y que cuando desee formar una familia será una bendición.
“El momento en el que decidamos tener una familia será una bendición. Somos dos personas muy ordenadas que creen y respetan, por sobre todas las cosas, los valores que nos han dado nuestros padres. Ahora estamos viviendo una etapa muy linda, cada día más enamorados y más felices. Si Dios quiere, en el futuro seguro la noticia será una realidad.”, indicó a Trome.



Entonces por el momento los jóvenes no será papis, pero su relación está más fuerte que nunca.
¿Cómo empezaron los rumores del embarazo de Cassandra Sánchez y Deyvis Orosco?
Todo comenzó con una publicación de la hija de Jessica Newton en Instagram. La joven escribió que se sentía muy “feliz” por algo que planeaba junto a su pareja Deyvis Orosco.
""Feliz, feliz, feliz. Deyvis Orosco. ¿Adivinan?"", ""Con la cabeza en las nubes por todo lo que estoy planeando. ¿Adivinan?"", escribió.
Tras esta publicación, los medios empezaron a especular sobre la posible llegada de un bebé, pero todo quedó en rumores.



Deyvis Orosco y Cassandra Sánchez de Lamadrid más enamorados que nunca



Cassandra Sánchez y Deyvis Orosco ya cumplieron un año de relación y se muestran más enamorados que nunca en Instagram.




Te puede interesar








",es,"











Jessica Newton's daughter responds to pregnancy speculation with Deyvis Orosco
Will Cassandra Sánchez and Deyvis Orosco be parents or not? That's how Jessica Newton's daughter responded.
03 Nov 2019, 13:04 by Brenda Quiroz
Cassandra Sánchez De Lamadrid was on all the entertainment websites because of the rumors about her possible pregnancy with Deyvis Orosco. Today the young woman has decided to respond and say if she is waiting for a singer's baby.



The young woman mentioned that she learned about ‘pregnancy’ through social networks and that when she wants to start a family it will be a blessing.
“The moment we decide to have a family will be a blessing. We are two very neat people who believe and respect, above all things, the values that our parents have given us. Now we are living a very beautiful stage, each day more in love and happier. If God wants, in the future, the news will be a reality, ”he told Trome.



So for the moment young people will not be daddies, but their relationship is stronger than ever.
How did the rumors of Cassandra Sánchez and Deyvis Orosco's pregnancy begin?
It all started with a post by Jessica Newton's daughter on Instagram. The young woman wrote that she felt very ""happy"" about something she planned with her partner Deyvis Orosco.
""Happy, happy, happy. Deyvis Orosco. Guess?"", ""Head in the clouds for everything I'm planning. Guess?"" He wrote.
After this publication, the media began to speculate about the possible arrival of a baby, but everything was rumored.



Deyvis Orosco and Cassandra Sánchez de Lamadrid more in love than ever



Cassandra Sánchez and Deyvis Orosco have already completed a year of relationship and are more in love than ever on Instagram.




It may interest you








"
