,src,lang,text
0,"











Fülön csípték az újpesti nők rémét
06 Nov 2019, 09:15 by Infostart
Több alkalommal is éjszaka próbált lecsapni, de a védekezni próbáló nők mindannyiszor elijesztették. Ettől még nem kerüli el a büntetést.
Idén június 10-én hajnali 2.40-kor egy férfi odalépett egy, a IV. kerületi Ócveánárok utcában sétáló nőhöz, akivel dulakodott, majd amikor a nő sikítani kezdett, az elkövető elszaladt.
Július 12-én szintén éjjel a nem túl messzi Harsányi Kálmán utca közelében lévő vasúti töltésnél támadott meg ugyanő egy fiatal nőt, akivel erőszakoskodott, de a nő ellenállt, a férfi elmenekült.
Október 26-án hajnalban ""triplázhatott"" a férfi, a 914-es éjszakai busz végállomásánál egy nővel együtt szállt le, elsétált egy Megyeri úti hát lépcsőházáig, ott érte utol, ahol fogdosni kezdte, de megtámadott nő ekkor is védekezett, amitől a támadó megijedt és elszaladt.
A nyomozók a kamerafelvételek segítségével azonosították a 30 éves Sz. Andrást, akit hétfőn Újpesten - otthon - el is fogtak és őrizetbe is vették. Előzetesbe kerülhet - derült ki a rendőrség tájékoztatásából.

Nyitókép: Pixabay.com



",hu,"











The nightmare of the Újpest women was pinched on their ears
06 Nov 2019, 09:15 by Infostart
He tried to hit him several times at night, but he was always frightened by women trying to defend himself. He does not escape the penalty yet.
On June 10 this year, at 2.40 am, a man stepped on a stage IV. to the woman she was walking in on Oceans Street in District 16, and when the woman began to scream, the perpetrator ran away.
On the night of July 12, a young woman was raped by the same person at a railway embankment not far from Harsányi Kálmán Street, but she resisted and the man fled.
At dawn on October 26, the man could ""triple"" at the end of the 914 night bus with a woman, walked to the back staircase of Megyeri Road, catching up where he started to grab, but the attacked woman was still defending, and ran away.
Detectives identified the 30-year-old Sz. Andrew, who was arrested and detained on Monday in Újpest - at home - using camera footage. It could get in the way, police said.

Opening Image: Pixabay.com



"
