,src,lang,text
0,"











Talemeldinger
Slik sender du talemeldinger på mobilen
Et raskere alternativ til den vanlige tekstmeldingen.
06 Nov 2019, 09:09 by Kirsti Østvang
Synes du det er kjedelig å skrive tekstmeldinger? Talemeldinger er et kjekt alternativ som lar deg spille inn en melding som sendes som en lydfil til mottakeren.



Noen kaller det for en moderne walkie talkie, og i visse deler av verden har det blitt veldig populært de senere årene. I 2015 skrev Quartz at det var i ferd med å bre om seg i Kina.
Å sende en talemelding er ikke veldig vanskelig. Du kan gjøre det i de fleste populære meldingapper og -tjenester. Det fungerer relativt likt hos alle.
iPhone/iMessage
På iPhone, åpne Meldinger-appen og start en samtale med en annen iMessage-bruker.
Trykk og hold på lydbølge-ikonet til høyre i tekstboksen for å ta opp lydmeldingen din. Si det du ønsker å sende og løft fingeren fra skjermen for å avslutte opptaket.


IMESSAGE: I Apples Meldinger-app kan du spille inn en talemelding ved å trykke ikonet som er merket med rød runding. Skjermbilde: Kirsti Østvang Vis mer

Du kan trykke på avspillingsknappen for å høre meldingen. Vil du slette den, trykker du på X-ikonet.
For å sende meldingen, trykker du på oppoverpilen.
WhatsApp
I WhatsApp går du til en samtale, og så trykker du på mikrofon-ikonet til høyre for meldingsfeltet. Hold fingeren inne mens du leser inn meldingen din, og så slipp når du er ferdig.
I WhatsApp blir lydmeldingen sendt umiddelbart idet du slipper fingeren, men angrer du underveis, kan du bare sveipe til venstre for å avbryte.
Facebook Messenger


FACEBOOK MESSENGER: Du finner talemeldingsfunksjonen ved siden av de andre verktøyene. Skjermbilde: Kirsti Østvang Vis mer

I Facebook Messenger, går du til en samtale, men her ligger mikrofon-ikonet til venstre for tekstfeltet.
Det fungerer riktignok likt som på de to tjenestene ovenfor ved at du må trykke og holde inne mens du leser inn lydmeldingen din.
Når du slipper opp, blir lydmeldingen sendt umiddelbart.
Ønsker du å avbryte opptaket, må du dra fingeren opp på skjermen.
Android
Har du Android-telefon, skal du i utgangspunktet kunne bruke den medfølgende meldingsappen på mobilen.


GOOGLE MESSAGES: Her må du bla deg ned i en funksjonsliste for å sende talemelding. Skjermbilde: Kirsti Østvang Vis mer

I Samsungs Meldinger-app, finnes det et lydbølge-ikon til høyre for tekstfeltet. Også her er det bare å holde inne ikonet, lese inn meldingen og så slippe når du er ferdig.
Da vil du enten kunne trykke på X for å slette det eller trykke på send-knappen.
I Googles Messages-app må du starte en samtale, trykke på pluss-ikonet til venstre for meldingsfeltet, og så bla ned til du kommer til en seksjon for lydmeldinger. Her er det et mikrofon-ikon som du må trykke og holde inne.
Når du slipper, vil du få en lydmelding som legger seg i meldingsfeltet, som du enten kan slette ved å trykke på X eller sende.

LES OGSÅ:




",no,"











Voice Messaging
How to send voicemails on your mobile
A faster alternative to the regular text message.
06 Nov 2019, 09:09 by Kirsti Østvang
Do you think it is boring to write text messages? Voice messages are a nice option that allows you to record a message that is sent as an audio file to the recipient.



Some call it a modern walkie talkie, and in some parts of the world it has become very popular in recent years. In 2015, Quartz wrote that it was spreading in China.
Sending a voice message is not very difficult. You can do so in most popular messaging apps and services. It works relatively equally with everyone.
iPhone / iMessage
On the iPhone, open the Messages app and start a conversation with another iMessage user.
Tap and hold the sound wave icon to the right of the text box to record your audio message. Say what you want to send and lift your finger off the screen to finish recording.


IMESSAGE: In the Apple Messages app, you can record a voice message by touching the icon marked in red rounding. Screenshot: Kirsti Østvang Show more

You can press the play button to hear the message. To delete it, touch the X icon.
To send the message, press the up arrow.
WhatsApp
In WhatsApp, go to a call and then tap the microphone icon to the right of the message box. Hold your finger as you read your message and then release when you're done.
In WhatsApp, the audio message is sent immediately as you release your finger, but if you regret along the way, you can just swipe left to cancel.
Facebook Messenger


FACEBOOK MESSENGER: You will find the voicemail feature next to the other tools. Screenshot: Kirsti Østvang Show more

In Facebook Messenger, you go to a conversation, but here is the microphone icon to the left of the text box.
Admittedly, it works just like the two services above by pressing and holding while you read your audio message.
When you release, the audio message is sent immediately.
If you want to interrupt the recording, drag your finger up on the screen.
Android
If you have an Android phone, you should basically be able to use the included messaging app on your phone.


GOOGLE MESSAGES: Here you have to scroll down in a feature list to send voicemail. Screenshot: Kirsti Østvang Show more

In the Samsung Messages app, there is a sound wave icon to the right of the text box. Here too, just hold the icon, read the message and then release when you're done.
Then you will either be able to press X to delete it or press the send button.
In the Google Messages app, start a conversation, touch the plus icon to the left of the message box, and then scroll down to an audio message section. Here is a microphone icon that you have to press and hold.
When you release, you will receive an audio message that settles in the message box, which you can either delete by pressing X or sending.

ALSO READ:




"
