,src,lang,text
0,"











कूड़ा और पराली जलाने वालों से ऐसे निपटेगी हरियाणा सरकार, मुख्य सचिव ने दिए आदेश
06 Nov 2019, 09:16 by फरीदाबाद| कार्यालय संवाददाता
प्रदूषण को नियंत्रित करने के लिए उठाए गए कदमों की हरियाणा की मुख्य सचिव केशनी आनंद ने दूसरे दिन मंगलवार को भी वीडियो कॉन्फ्रेंसिंग के जरिये समीक्षा की। दोपहर बाद हुई इस कॉन्फ्रेंस में कमोबेश सभी सरकारी महकमों के अधिकारियों ने अपनी रिपोर्ट पेश की। मुख्य सचिव ने हर सूरत में प्रदूषण को नियंत्रित करने के आदेश दिए हैं। साथ ही कूड़ा या पराली जलाने वालों पर मुकदमा दर्ज करने के लिए कहा है। 
मुख्य सचिव को जानकारी दी : मुख्य सचिव की वीडियो कॉन्फ्रेंसिंग के बाद जारी बयान में पलवल के अतिरिक्त उपायुक्त आर.के. सिंह ने कहा कि पलवल जिला में प्रदूषण नियंत्रण को लेकर जिला प्रशासन गंभीर है। अतिरिक्त उपायुक्त ने पलवल जिला में प्रदूषण नियंत्रण के लिए अब तक उठाए कदमों की मुख्य सचिव को जानकारी दी।
पराली जलाने की घटना पर जवाबदेही तय : अतिरिक्त उपायुक्त ने बताया कि जिले की सभी पंचायतों में ग्राम सभाएं आयोजित करने के निर्देश जारी किए हैं। सरपंच व राजस्व विभाग के पटवारियों को भी पराली जलाने की घटनाओं को रोकने के लिए जवाबदेह बनाया गया है। 

पराली जलाने पर दो के खिलाफ केस

पलवल /होडल। तकनीकी प्रबंधक कृषि ने 15 अक्टूबर को अपनी टीम के सदस्यों के साथ क्षेत्र के गांवों का औचक निरीक्षण किया था। पुलिस ने चार नवंबर को गांव करमन निवासी त्रिलोक व रूपचंद के खिलाफ धान के अवशेष जलाने का मामला दर्ज किया है। 


",hi,"











Haryana government will deal with those who burn garbage and stubble, Chief Secretary orders
06 Nov 2019, 09:16 by Faridabad | Office reporter
The steps taken to control pollution were reviewed by Haryana Chief Secretary Keshani Anand through video conferencing on Tuesday on the second day. In this conference held in the afternoon, the officials of almost all government departments presented their report. The Chief Secretary has given orders to control pollution in every Surat. They have also asked to file a case against those who burn garbage or straw.
Informed the Chief Secretary: In a statement released after the video conferencing of the Chief Secretary, Additional Deputy Commissioner of Palwal, R.K. Singh said that the district administration is serious about pollution control in Palwal district. The Additional Deputy Commissioner informed the Chief Secretary about the steps taken so far for pollution control in Palwal district.
Accountability fixed on burning of stubble: Additional Deputy Commissioner said that instructions have been issued to organize gram sabhas in all panchayats of the district. The sarpanch and the Patwaris of the Revenue Department have also been made accountable for preventing incidents of stubble burning.

Case against two for burning stubble

Palwal / Hodal. On October 15, Technical Manager Agriculture, along with members of his team, conducted a surprise inspection of the villages in the area. On November 4, the police registered a case of burning paddy residue against Trilok and Rupchand, residents of village Karaman.


"
