,src,lang,text
0,"











Один человек погиб при пожаре в квартире под Новосибирском

05 Nov 2019, 13:53

В Новосибирской области в результате пожара в пятиэтажке погиб человек, еще один пострадал, сообщает ТАСС.
Инцидент произошел в Новосибирском районе. По данным пресс-службы ГУ МЧС по региону, горела комната на площади 18 квадратных метров. Пожар был ликвидирован.
""Одна женщина эвакуирована с ожогами, мужчина задохнулся. Всего из дома с верхних этажей были эвакуированы 10 человек"", - сообщают в ведомстве.
Сейчас на месте работают три автоцистерны и 13 человек личного состава.


",ru,"











One person died in a fire in an apartment near Novosibirsk

05 Nov 2019, 13:53

In the Novosibirsk region, as a result of a fire in a five-story building, a man died, another was injured, reports TASS.
The incident occurred in the Novosibirsk region. According to the press service of the State Ministry for Emergencies in the region, a room on an area of 18 square meters was burning. The fire was eliminated.
""One woman was evacuated with burns, a man suffocated. In total, 10 people were evacuated from the house from the upper floors,"" the department said.
Now there are three tank trucks and 13 personnel.


"
