,src,lang,text
0,"











Comissão amplia para R$ 998 valor de saque do FGTS
MP do governo previa saque de R$ 500; aumento vale para quem tinha um salário mínimo na conta em 24 de julho, quando medida entrou em vigor

05 Nov 2019, 20:23


Brasília

A comissão de deputados e senadores que analisava a MP (medida provisória) com regras para o saque do FGTS aumentou de R$ 500 para R$ 998 o valor que pode ser retirado de contas do FGTS (Fundo de Garantia do Tempo de Serviço).
O relatório do deputado Hugo Motta (Republicanos-PB), aprovado nesta terça-feira (5), estabelece que só poderá realizar este saque total quem tinha um saldo de até um salário mínimo (R$ 998) em 24 de julho deste ano, quando a MP entrou em vigor.
O texto ainda precisa passar pelos plenários da Câmara e do Senado.



Gallery: Veja o que dá para comprar com os R$ 500 do FGTS


Caso a lei seja sancionada pelo presidente Jair Bolsonaro (PSL), quem já retirou o dinheiro poderá sacar o restante.
Para quem tinha mais de um salário mínimo na conta do FGTS o saque continua limitado a R$ 500.
O relator incluiu em seu parecer prazo de 180 dias a partir da sanção presidencial para a retirada de valores residuais de R$ 80.
O texto aprovado no colegiado permite saque da conta do FGTS caso o trabalhador ou qualquer de seus dependentes tenham doenças raras.
O texto também acaba com a multa adicional de 10% sobre os depósitos no caso das demissões sem justa causa.


",pt,"











Commission increases to R $ 998 withdrawal amount from FGTS
Government MP provided for withdrawal of $ 500; increase goes to those who had a minimum wage on the account on July 24 when measure took effect

05 Nov 2019, 20:23


Brasilia

The committee of deputies and senators who analyzed the MP (provisional measure) with rules for the withdrawal of FGTS increased from $ 500 to $ 998 the amount that can be withdrawn from FGTS accounts.
The report by Rep. Hugo Motta (Republicans-PB), approved on Tuesday (5), states that can only perform this full withdrawal who had a balance of up to a minimum wage (R $ 998) on July 24 this year, when the MP came into force.
The text still needs to go through the plenary of the House and Senate.



Gallery: See what you can buy with the $ 500 FGTS


If the law is sanctioned by President Jair Bolsonaro (PSL), anyone who has withdrawn the money can withdraw the rest.
For those who had more than one minimum wage in the FGTS account the withdrawal remains limited to $ 500.
The rapporteur included in his opinion a term of 180 days from the presidential sanction for the removal of residual values of R $ 80.
The text approved by the board allows withdrawal from the FGTS account if the worker or any of his dependents have rare diseases.
The text also ends the additional 10% fine on deposits in the event of unfair dismissals.


"
