,src,lang,text
0,"











Abierta convocatoria para becas de educación superior en la I.U. Digital de Antioquia

05 Nov 2019, 20:05

Se realizó el lanzamiento de la convocatoria para otorgar becas de educación superior para el primer periodo del año 2020 en la Universidad Digital en Antioquia.



El programa Becas Regiones del Fondo para la Educación Superior de Antioquia, destinará 4.400 millones de pesos para entregar 810 becas a jóvenes interesados en estudiar Administración de Empresas, Administración de Empresas Turísticas y Hoteleras, Publicidad y Mercado Digital o Tecnología en Desarrollo de Sofware.
Los interesados tendrán a partir de hoy y hasta el 30 de noviembre para inscribirse en la página web www.corpoeducacionsuperior.org
Los seleccionados se conocerán a partir del 12 de diciembre en el mismo portal web.


",es,"











Open call for scholarships for higher education in the I.U. Digital of Antioquia

05 Nov 2019, 20:05

The call for the granting of higher education scholarships for the first period of the year 2020 at the Digital University in Antioquia was launched.



The Regions Scholarships program of the Fund for Higher Education of Antioquia, will allocate 4,400 million pesos to deliver 810 scholarships to young people interested in studying Business Administration, Administration of Tourism and Hotel Companies, Advertising and Digital Market or Software Development Technology.
Those interested will have from today until November 30 to register on the website www.corpoeducacionsuperior.org
Those selected will be known from December 12 on the same web portal.


"
