,src,lang,text
0,"











На трассе в Койгородском районе в ДТП пострадали четыре человека
04 Nov 2019, 10:05 by Алексей Громов

Аварию спровоцировал 22-летний водитель Chevrolet – он не справился с управлением и вылетел на встречку. Его увезли в больницу с многочисленными травмами и сотрясением. Кроме него, на скорой увезли еще троих.

3 ноября около 14:50 на трассе Визинга-Кажим произошло лобовое столкновение иномарок, в котором пострадали четыре человека.
Как сообщает пресс-служба УГИБДД по РК, 22-летний водитель за рулем иномарки Chevrolet ехал в сторону Визинги. Проезжая 82-ой километр трассы он не справился с управлением и вылетел на встречную полосу – там он столкнулся с автомобилем Lifan.
В результате столкновения в больницу попали четыре человека.
Виновника аварии увезли на скорой с черепно-мозговой травмой и сотрясением головного мозга – в момент аварии он не был пристегнут ремнем безопасности.
Также пострадала 18-летняя пассажирка Chevrolet – ее увезли в больницу с черепно-мозговой травмой, сотрясением и многочисленными ушибами.
37-летнего водителя Lifan увезли на скорой с переломами, его 21-летнюю пассажирку – также забрали в больницу с переломом правой руки.
Виновник аварии за нарушения ПДД до этого не привлекался, его стаж – 6 лет.
Как ранее сообщали НЕВСКИЕ НОВОСТИ, на переправе в Алешино приостановлена работа парома. Это связано с неблагоприятными погодными условиями – там проходят восстановительные работы.
#дтп #койгородский район #трасса Визинга-Кажим


",ru,"











Four people injured on a highway in the Koigorodsky district in an accident
04 Nov 2019, 10:05 by Alexey Gromov

The accident was provoked by the 22-year-old Chevrolet driver - he lost control and flew into the oncoming lane. He was taken to the hospital with numerous injuries and a concussion. In addition to him, three more were taken away by ambulance.

November 3 at about 14:50 on the Vizing-Kazhim highway there was a head-on collision of foreign cars in which four people were injured.
According to the press service of the State Traffic Safety Inspectorate for the Republic of Kazakhstan, a 22-year-old driver driving a Chevrolet foreign car was driving towards Vizinga. Passing the 82nd kilometer of the highway, he lost control and flew into the oncoming lane - there he collided with a Lifan car.
As a result of the collision, four people were hospitalized.
The culprit of the accident was taken to an ambulance with a head injury and concussion - at the time of the accident he was not wearing a seat belt.
An 18-year-old Chevrolet passenger was also injured - she was taken to a hospital with a head injury, concussion and numerous bruises.
The 37-year-old Lifan driver was taken by ambulance with fractures; his 21-year-old passenger was also taken to the hospital with a fracture of his right hand.
The culprit of the accident for traffic violations was not involved before, his experience is 6 years.
As NEVSKY NEWS previously reported, the ferry was suspended at the Aleshino crossing. This is due to adverse weather conditions - there are restoration work.
# accident # Koygorodsky district # Vizinga-Kazhim highway


"
