,src,lang,text
0,"











Начальник облавтодора: Строительство запорожских мостов может возобновится в 2020 году. Фото

07 Nov 2019, 12:48


В Запорожье строительство мостовых переходов через реку Днепр может возобновиться уже в следующем году. Об этом сегодня, 7 ноября, журналистам сообщил начальника Службы автодорог Запорожской области Андрей Ивко.

Отметим, что сегодня в Запорожье с рабочим визитом находится премьер-министр Украины Алексей Гончарук. В данные минуты представители СМИ ожидают его визита на запорожских мостах.
Андрей Ивко отметил, что уже завершена экспертиза и проведена корректировка проекта. Напомним, городской совет и облавтодор выделили на корректировку проекта по 15 миллионов гривен, общая стоимость составила 30 миллионов.



Запорожский горсовет выделил 15 млн грн на корректировку проекта строительства мостов






Сейчас специалисты готовят тендерную документацию, далее будет объявлен международный тендер. « В Запорожье смогут прийти организации со всего мира: китайцы, голландцы или немцы. Общая стоимость объекта – 12, 9 миллиардов гривен», – подчеркнул Андрей Ивко.
В первую очередь, по его словам, строители за два года завершать строительство верхней части мостовых переходов через Днепр. Таким образом откроют движение на Бабурку в два потока: по новому мосту в одну сторону в три полосы, по мосту Преображенского – в другую.
Обещают, что строительство мостов займет четыре года.
Как сообщал РепортерUA ранее, 31 октября, народные депутаты на заседании Верховной Рады внесли изменения в государственный бюджет Украины на 2019 год. В рамках закона выделены средства на продолжение строительства мостовых переходов в Запорожье. Согласно документа из государственного бюжета выделяют 750 миллионов гривен. В целом за законопроект проголосовал 291 народный избранник.
В достройке запорожских мостов привлекли китайскую компанию «China Road and Bridge Corporation». Между «Укравтодором» и данной компанией в октябре был заключен меморандум о сотрудничестве.  Министра инфраструктуры Украины Владислав Криклий заявил, что плановый объем инвестиций – 550 млн долларов США. 
Напомним, во время рабочего визита в Запорожье президент Украины Владимир Зеленский поставил задачу возобновить достройку моста через Днепр в начале 2020 года. 



Плотина, мосты и наболевшие вопросы горожан: итоги визита Владимира Зеленского в Запорожье. Видео




Опрос: что нужно построить в Запорожье? Видео



































РепортерUA


",ru,"











Head of the oblavtodor: Construction of Zaporizhzhya bridges may resume in 2020. Photo

07 Nov 2019, 12:48


In Zaporozhye, the construction of bridge crossings over the Dnieper River may resume next year. About this today, November 7, the head of the Zaporizhzhya region Road Service Andrei Ivko told reporters.

It should be noted that today in Zaporozhye the Prime Minister of Ukraine Alexey Goncharuk is on a working visit. In these minutes, media representatives are expecting his visit to Zaporizhzhya bridges.
Andrei Ivko noted that the examination has already been completed and the project has been adjusted. Recall that the city council and oblavtodor allocated 15 million hryvnias for the adjustment of the project, the total cost was 30 million.



Zaporizhzhya City Council allocated UAH 15 million for the adjustment of the bridge construction project






Now experts are preparing tender documents, and then an international tender will be announced. “Organizations from all over the world will be able to come to Zaporozhye: Chinese, Dutch, or Germans. The total cost of the facility is UAH 12.9 billion, ”emphasized Andrey Ivko.
First of all, according to him, the builders in two years to complete the construction of the upper part of the bridge crossings over the Dnieper. Thus, they will open traffic to Baburka in two streams: along the new bridge in one direction in three lanes, along the Preobrazhensky bridge in the other.
They promise that the construction of bridges will take four years.
As the UA Reporter reported earlier, on October 31, MPs at a meeting of the Verkhovna Rada made changes to the state budget of Ukraine for 2019. Under the law, funds were allocated to continue the construction of bridge crossings in Zaporozhye. According to the document, 750 million hryvnias are allocated from the state budget. In total, 291 deputies voted for the bill.
In the completion of Zaporizhzhya bridges attracted the Chinese company “China Road and Bridge Corporation”. Between Ukravtodor and this company, a memorandum of cooperation was signed in October. Minister of Infrastructure of Ukraine Vladislav Krikli stated that the planned investment is 550 million US dollars.
Recall that during a working visit to Zaporozhye, President of Ukraine Vladimir Zelensky set the task of resuming completion of the bridge across the Dnieper in early 2020.



Dam, bridges and sore issues of the townspeople: the results of the visit of Vladimir Zelensky to Zaporozhye. Video




Poll: what needs to be built in Zaporizhia? Video



































ReporterUA


"
