,src,lang,text
0,"











La mort de la matriarca dels dofins revifa la polèmica al Zoo de Barcelona
El centre confia en traslladar durant el 2020 els tres exemplars que encara té a un aquari europeu

07 Nov 2019, 12:22

El Zoo de Barcelona està de dol. L’Anak, dofí femella i matriarca del grup, no ha pogut superar el virus que l’última setmana ha afectat els quatre exemplars d’aquesta espècie que encara hi havia a les instal·lacions -petites i obsoletes- que el parc té per als cetacis, i que l’Ajuntament va anunciar, ara fa tres anys, que volia tancar. Els dofins, tot i que ja no fan espectacles, continuen allà, a l’espera que els trobin un destí alternatiu. Però ara ja són tres. Dimecres, entre les set i les vuit del vespre, l’Anak se’n va anar per sempre. Ho va fer acompanyada d’un equip de vuit cuidadors, veterinaris i fins i tot treballadors de manteniment que els últims dies han intensificat els esforços per aplicar a l’animal els tractaments que necessitava. I acompanyada, també, del Blau, el dofí adult amb qui va tenir el Nuik, l’exemplar més jove dels que encara viuen al zoològic.
“Estem tocats”, reconeixia ahir el director del parc, Sito Alarcón, que recordava que la matriarca dels dofins va arribar a Barcelona procedent de Cuba fa tres dècades -ara tenia uns 34 anys- i que, per tant, la majoria de treballadors del zoo l’han vist sempre allà. Alarcón, però, conscient que aquesta mort tornaria a posar el delfinari i el conjunt del Zoo al centre de la polèmica, també va fer una crida a continuar endavant. A evitar que la mort de l’Anak -“Una ensopegada”, va dir- afecti d’alguna manera el desenvolupament del nou pla estratègic que el ple va aprovar al maig per reconduir el futur d’aquesta instal·lació amb menys animals i més centrada en la conservació i la recerca. Els dofins no tenen cabuda en el nou model. De fet, Barcelona havia de ser, com a molt tard el 2019, una ciutat lliure de dofins en captivitat.




El ple avala el canvi de model del Zoo de Barcelona

Des del 2016 que es busca sortida als dofins, i ahir ho van retreure al govern de Colau tant ERC i Junts per Catalunya com entitats animalistes com Depana, que considera una “negligència” mantenir-los al delfinari. Però fins ara no s’ha trobat una alternativa viable. Només dos dofins, la Leia i el Kuni, van ser enviats a l’Oceanogràfic de València per motius de salut i benestar. A llà els dos exemplars han tornat a la rutina de les exhibicions que ja no feien a Barcelona i l’Ajuntament continuava buscant un espai adequat per als quatre exemplars que es van quedar. La prioritat inicial era trobar-los un santuari, però Alarcón va admetre ahir que aquesta via ja s’ha descartat perquè a hores d’ara no n’hi ha cap de fet i va assegurar que qui ha de prendre la decisió del trasllat és l’Associació Europea de Zoos i Aquaris (EAZA). Confia que els tres dofins puguin ser traslladats el 2020 a un zoo o un aquari europeu.
La malaltia de la qual es recuperen podria fer endarrerir el procés. De moment, es manté tancada la instal·lació dels dofins i els cuidadors observen com els tres animals assumeixen l’absència de l’Anak. Tot apunta que el que va provocar la seva mort va ser un virus originat al sistema digestiu, perquè l’Anak va deixar de menjar, però serà la necròpsia el que determinarà la causa oficial de la mort.
La manera com ha mort aquest dofí, però, és “indigna” als ulls del comitè d’empresa. En nom dels treballadors, Damià Gibernet va lamentar ahir que fins ara la prioritat del govern municipal hagi sigut el “postureig” de fer anuncis com ara que Barcelona serà una ciutat lliure de cetacis en captivitat i que no hagi solucionat encara la qüestió del santuari per als dofins ni hagi fet la inversió necessària per millorar el delfinari actual: “Si no hi ha inversió, podem acusar l’Ajuntament de maltractament animal”. Els treballadors van recollir el seu malestar en un escrit en què deixaven clar que el delfinari projectat durant el mandat de CiU -i descartat pels comuns- ja podria estar acabat, i consideraven que algú hauria d’assumir responsabilitats pel que fa a la situació en què viuen els dofins.

Pols per triar qui es queda al Zoo

També Zoo XXI, que és qui va impulsar la iniciativa ciutadana per avançar cap a un parc que només reprodueixi animals que es puguin reintroduir en el seu hàbitat, va lamentar les condicions de vida dels dofins. L’entitat assegura que ha tingut accés a informes mèdics de l’Anak que certifiquen que patia “estrès agut” i que també tenia problemes a la pell. Pel que fa al possible trasllat dels tres exemplars de dofins, recelen de les condicions que pugui fixar l’EAZA perquè no comparteix la decisió de no reproduir-los en captivitat i de mantenir-los al marge dels espectacles. Des de Depana, que fa anys que pressiona per traslladar els dofins, Marta Gumà denuncia que els cetacis s’haurien pogut moure molt abans en lloc d’esperar la “quimera” dels santuaris. Les instal·lacions que allotgen actualment els dofins incompleixen els mínims establerts per les institucions internacionals, i el Zoo de Barcelona ja va quedar fora de l’Associació Europea de Mamífers Aquàtics.
Preparant els canvi de model
Zoo XXI ja va alertar a principis de mandat que recelava del fet que la competència del zoo hagués passat a mans del PSC -de Laia Bonet, en concret-, que va votar en contra de la proposta i va donar suport al posicionament del comitè d'empresa. De moment, segons ha concretat Alarcón, el que s'estan fent són els estudis dels diferents hàbitats i dels animals que hi ha d'haver. S'ha començat per la Mediterrània, però fins ara no s'han aplicat canvis en els criteris de reproducció d'animals.  

Barcelona traslladarà els dofins del zoo i no construirà un nou delfinari



",ca,"











The death of the matriarch of the dolphins revives the controversy in the Zoo of Barcelona
The center hopes to transfer the three copies that it still has to a European aquarium in 2020

07 Nov 2019, 12:22

The Barcelona Zoo is mourning. Anak, the female dolphin and matriarch of the group, has not been able to overcome the virus that the last week has affected the four specimens of this species that were still in the facilities -political and obsolete- that the park has to to the cetaceans, and that the City Council announced, three years ago, that it wanted to close. Dolphins, although they no longer do shows, continue there, waiting for them to find an alternative destination. But now there are three. Wednesday, between seven and eight in the evening, the Anak left forever. He was accompanied by a team of eight carers, veterinarians and even maintenance workers who, in recent days, have intensified efforts to apply to the animal the treatments he needed. And also accompanied by Blau, the adult dolphin who had Nuik, the youngest specimen of those who still live in the zoo.
""We are touched,"" the park director, Sito Alarcón, acknowledged yesterday that he remembered that the dolphin matriarch came to Barcelona from Cuba three decades ago - he was about 34 years old - and that, therefore, most of the workers in the Zoo have always been there. Alarcón, aware, however, that this death would once again bring the dolphinarium and the whole Zoo at the center of the controversy, he also appealed to continue on. To prevent the death of Anak - ""A stumbling block,"" he said, affected in some way the development of the new strategic plan that the plenary approved in May to redirect the future of this facility with fewer animals and more focused on conservation and research. The dolphins have no place in the new model. In fact, Barcelona had to be, no later than 2019, a city free of dolphins in captivity.




The plenary endorses the change of model of the Zoo of Barcelona

Since 2016, the dolphins have been sought out, and yesterday they were taken to the government of Colau, both ERC and Junts for Catalonia, as animalistic entities such as Depana, who considers them ""neglected"" to keep them in the dolphinarium. But a viable alternative has not been found to date. Only two dolphins, Leia and Kuni, were sent to the Oceanogràfic of Valencia for health and well-being. In the past, the two specimens have returned to the routine of exhibitions that were no longer in Barcelona and the City Council continued to look for a suitable space for the four copies that remained. The initial priority was to find a sanctuary, but Alarcón admitted yesterday that this route has already been ruled out because at this time there are none in fact and said that who should make the decision of the transfer is the European Association of Zoos and Aquariums (EAZA). He hopes that the three dolphins may be transported to a European zoo or aquarium in 2020.
The disease that is recovered could cause the process to slow down. For the moment, the dolphin installation is closed and caregivers observe how the three animals assume the absence of the Anak. Everything points out that the one that caused his death was a virus that originated in the digestive system, because Anak stopped eating, but it would be the necropsy that determined the official cause of death.
The way this dolphin has died, however, is ""unworthy"" in the eyes of the business committee. On behalf of the workers, Damià Gibernet yesterday regretted that the priority of the municipal government has been the ""posture"" of making announcements such as that Barcelona will be a city free of captive cetaceans and that it has not yet resolved the question of the sanctuary for The dolphins did not make the necessary investment to improve the current dolphinarium: ""If there is no investment, we can accuse the City of animal abuse."" Workers picked up their discomfort in a paper in which they made it clear that the dolphinarium projected during the mandate of CiU - and ruled out by the communes - could already be finished, and they considered that someone should assume responsibilities with regard to the situation in what do dolphins live

Pulse to choose who stays at the Zoo

Also Zoo XXI, who promoted citizens' initiative to move to a park that only reproduces animals that can be reintroduced into their habitat, regretted the dolphin's living conditions. The organization says that it had access to medical reports from Anak that certify that he had ""acute stress"" and that he also had skin problems. Regarding the possible transfer of the three dolphin specimens, they are suspicious of the conditions that can be set by the EAZA because it does not share the decision not to reproduce them in captivity and to keep them apart from the shows. From Depana, who has been pushing for dolphins for years, Marta Gumà complains that the Cetaceans could have been moving long before instead of waiting for the ""chimera"" of the sanctuaries. The facilities that currently house the dolphins breach the minimum established by the international institutions, and the Barcelona Zoo was already outside the European Association of Aquatic Mammals.
Preparing the model change
Zoo XXI already warned at the beginning of the mandate that it was distrustful that the competition of the zoo had passed into the hands of the PSC - of Laia Bonet, in particular -, that voted against the proposal and supported the positioning of the committee of company For the moment, according to Alarcón, what they are doing are the studies of the different habitats and animals that must be. It has begun in the Mediterranean, but up to now, no changes have been made in the breeding criteria for animals.

Barcelona will transfer dolphins from the zoo and will not build a new dolphinarium



"
