,src,lang,text
0,"











Ngôi làng nổi tiếng vì 'đi dễ khó về'
Nga Ẩn mình trong dãy núi Caucasus là Dargavs, ngôi làng mà người dân tin rằng đã vào thì không thể quay ra.
07 Nov 2019, 12:03 by VnExpress
Làng Dargavs có những ngôi nhà được xây thành cụm, lát bằng gạch, đá và những ô cửa sổ đơn, đỉnh mái nhọn. Bao quanh nó là những khu đất nông nghiệp đẹp như tranh vẽ. Trái ngược với khung cảnh đó, ngôi làng còn được biết đến với tên gọi khác - thành phố của người chết.
Có nhiều giả thuyết xung quanh tên này. Người dân địa phương tin rằng những ai đặt chân đến làng sẽ không có đường trở lại. Thực tế, tại đây có một nghĩa trang cổ, với hơn 10.000 xác chết được chôn cất từ thế kỷ 14 đến 18. Người chết đều được chôn kèm tài sản.


Làng Dargavs nằm cạnh sông Gizeldon. Ảnh: Ahsartag/Atlas Obscura.

Nghĩa địa có 99 hầm mộ nằm bên trong một thung lũng dài 17 km. Một số mộ chỉ đủ rộng để chứa một người, số khác cao 4 tầng và rộng rãi. Theo lời kể của những người thám hiểm đã đi dọc các con đường này, một số xác chết được bảo quản rất tốt.
Mỗi ngôi mộ đều có giếng trước mặt, đóng vai trò quan trọng trong hành trình tiễn đưa người chết đến thế giới bên kia, theo các nhà sử học. Sau khi chôn cất, họ hàng của người chết thả một đồng xu xuống giếng. Nếu nó chạm vào một hòn đá khi tới đáy, họ sẽ coi đây là dấu hiệu tốt, rằng người chết đã lên thiên đàng.
Vào thế kỷ 18, người dân trong làng trải qua một dịch bệnh lớn. Nhiều người bị mắc bệnh và tự giam mình trong hầm mộ để cách ly thế giới bên ngoài. Họ nằm đó, chờ đợi cái chết. Nhiều người tin rằng, đây là sự trừng trị của các vị thần cổ xưa vì cách mà dân làng đã đối xử với một phụ nữ trẻ nhiều thế kỷ trước.


Ngôi làng được nhiều du khách miêu tả là ""đẹp như tranh vẽ"". Ảnh: Oleg Moro/Atlas Obscura.

Trong những năm sau đó xuất hiện thêm đại dịch tả tàn phá ngôi làng, cư dân sống gần đó đã quyết định di tản khỏi thung lũng. Họ di chuyển đến đồng bằng khiến nơi đây dần bị bỏ hoang.
Làng đang thu hút một lượng lớn khách du lịch tò mò ở khắp nơi trên thế giới, dù việc đi lại khó khăn. Nhiều người đến đây lấy xương và sọ làm đồ lưu niệm, mà không nhận ra chúng là tàn dư của những người từng bỏ mạng tại đây. 


Bên trong một ngôi mộ. Ảnh: Oleg Moro/Atlas Obscura.

Năm 2018, một công ty điện ảnh có trụ sở tại Moskva buộc phải hủy bỏ kế hoạch quay một bộ phim tại ""thành phố chết chóc"" này. Kịch bản bị chỉ trích vì hoảng sợ và chính quyền địa phương từ chối cho họ quay hình. 
Trong một cuộc phỏng vấn với BBC, nhà sử học Ludmila Gaboeva cho biết du khách đến thành phố này không chỉ muốn chiêm ngưỡng kiến trúc thời trung cổ, mà còn bị mê hoặc bởi cảnh đẹp xung quanh.
""Những câu chuyện về sự bí ẩn của làng Dargavs được truyền miệng từ đầu thế kỷ 20. Các nhà thám hiểm ở khắp nước quy tụ về đây. Trong các hầm mộ, có những chiếc quan tài trông như chiếc thuyền, dấu tay và ký hiệu kỳ lạ. Tuy nhiên, khó hiểu nhất là nhiều người đến đây chỉ để trải nghiệm cảm giác sợ hãi"".
Làng Dargavs nằm ở quận Prigorodny, bắc Ossetia. Nghĩa trang nằm ở rìa làng. Trên TripAdvisor, địa điểm này nhận được 82% lượt đánh giá ""tuyệt vời"" và 18% còn lại nhận xét ""rất tốt"".
Phần lớn du khách đến đây theo kiểu tự túc. Tuy nhiên do khu vực này nằm ở nơi hẻo lánh, đường đi hiểm trở, du khách nên mua tour của các công ty lữ hành địa phương để an toàn. Bạn phải mất một giờ từ Vladikavkaz, băng qua những con đường nhỏ hẹp và nhiều ngọn đồi để đến được nơi đây.
Nam Trần (Theo News)


",vi,"











The village is famous for 'going home is hard to come back'
Russia Hidden in the Caucasus Mountains is the Dargavs, a village that people who believe has entered cannot return.
07 Nov 2019, 12:03 by VnExpress
The village of Dargavs has houses built in clusters, paved with bricks, stones and single windows, top of the roof. It is surrounded by picturesque agricultural lands. Contrary to that setting, the village was also known by another name - the city of the dead.
There are many theories surrounding this name. Locals believe that those who set foot in the village will not have a way back. In fact, there is an ancient cemetery, with more than 10,000 corpses buried from the 14th to 18th centuries. The dead are buried with property.


The village of Dargavs is located by the Gizeldon River. Photo: Ahsartag / Atlas Obscura.

The graveyard has 99 catacombs located inside a 17 km long valley. Some tombs are only large enough to accommodate one person, others are 4 stories high and spacious. According to the explorers who walked along these roads, some of the corpses were well preserved.
Each tomb has a well in front of it, playing an important role in the journey to see off the dead to the afterlife, according to historians. After being buried, relatives of the dead drop a coin into the well. If it touched a stone when it reached the bottom, they would take this as a good sign, that the dead had gone to heaven.
In the 18th century, villagers experienced a major epidemic. Many people became ill and locked themselves in the tomb to isolate the outside world. They lay there, waiting for death. Many believe that this is the punishment of ancient gods because of the way villagers treated a young woman centuries ago.


The village is described by many tourists as ""picturesque"". Photo: Oleg Moro / Atlas Obscura.

In the following years, a cholera epidemic devastated the village, and the nearby residents decided to evacuate the valley. They moved to the plains, gradually leaving the place deserted.
The village is attracting a large number of curious tourists all over the world, despite difficult travel. Many people come here to take bones and skulls as souvenirs, without realizing they are remnants of those who died here.


Inside a grave. Photo: Oleg Moro / Atlas Obscura.

In 2018, a Moscow-based film company was forced to cancel plans to film a movie in the ""dead city"". The script was criticized for being panicked and the local authorities refused to allow them to film.
In an interview with the BBC, historian Ludmila Gaboeva said visitors to this city not only want to admire medieval architecture, but also be fascinated by the surrounding beauty.
""Stories of the mystery of the Dargavs village are word of mouth from the early 20th century. Explorers from across the country gather here. In the catacombs, there are coffins that look like boats, fingerprints and strange sign. However, the most confusing is that many people come here just to experience the feeling of fear. ""
The village of Dargavs is located in Prigorodny district, north Ossetia. The cemetery is located at the edge of the village. On TripAdvisor, this place received 82% of ""great"" reviews and the remaining 18% commented ""very good"".
Most visitors come here in a self-sufficient manner. However, because this area is located in a remote area, with rugged roads, visitors should buy tours of local travel companies to be safe. It takes you an hour from Vladikavkaz, across the narrow roads and many hills to get here.
Nam Tran (According to News)


"
