,src,lang,text
0,"











Se juntaron Ricky Martin, Bad Bunny y Residente
07 Nov 2019, 12:19 by Últimas Noticias
El cantante Ricky Martin informó que se unirá a Residente y Bad Bunny para hacer el tema Cántalo.
“¡Se dio el junte, prepárense! Cántalo”, lanzó en Instagram sin dar más detalles, pero acompañado de una imagen en la que se aprecia las sombras de los tres artistas mencionados.
Por su parte, Bad Bunny no hizo comentarios, pero sí compartió la información de Ricky y posteó cuatro veces la foto del trío que realizará por primera vez una colaboración.
A menos de una hora del lanzamiento de la información, ha provocado el revuelo entre sus seguidores.
Los tres cantantes boricuas se unieron unos meses atrás para pedir la dimisión del gobernador de Puerto Rico, Ricky Rosselló, tras la filtración de un polémico chat que provocó una crisis social y política en el país. Durante días se involucraron en diferentes protestas y la visibilidad que dieron a esta causa fue crucial para conseguir su objetivo. De hecho, Martin adelantó que su próximo álbum tratará sobre esa crisis.
El Nuevo Día


",es,"











Ricky Martin, Bad Bunny and Resident got together
07 Nov 2019, 12:19 by Latest News
Singer Ricky Martin reported that he will join Resident and Bad Bunny to do the song Sing it.
“The meeting was given, get ready! Sing it ”, he launched on Instagram without giving more details, but accompanied by an image that shows the shadows of the three artists mentioned.
For his part, Bad Bunny did not comment, but he did share the information of Ricky and posted four times the photo of the trio that will make a collaboration for the first time.
Less than an hour after the release of the information, it has caused a stir among its followers.
The three Puerto Rican singers joined a few months ago to request the resignation of the governor of Puerto Rico, Ricky Rosselló, after the leak of a controversial chat that caused a social and political crisis in the country. For days they got involved in different protests and the visibility they gave to this cause was crucial to achieve their goal. In fact, Martin said his next album will be about that crisis.
The new day


"
