,src,lang,text
0,"











Утверждены суммы матпомощи семьям погибших при прорыве дамбы в Щетинкино

07 Nov 2019, 12:13




Адресная помощь жертвам трагедии на золотом руднике в Курагинском районе. В краевом министерстве социальной политики объявили итоговые суммы, которые получат пострадавшие из резервного фонда правительства региона. Итак, семьям семнадцати погибших положено по миллиону рублей. Близким трёх пропавших без вести — по полмиллиона.
Пострадавших — двадцать три человека, из них семнадцать были в средней степени тяжести, они получат по 200 тыс рублей, и шесть — с лёгкими повреждениями — им выплатят по 100 тыс. Помощь оказывают по инициативе губернатора края Александра Усса, и чтобы найти всех, кому она предназначена, пришлось потрудиться.
Оказалось, достаточно сложно и заняло некоторое время — это поиск родственников и сбор необходимых документов, потому что часть родственников погибших проживала в Кемеровской области, часть в Сыктывкаре даже, пришлось нам связываться. Как раз наладили работу с другими министерствами в Хакассии, Кемеровской области, Вологодской области.Денис Богданов, заместитель министра социальной политики Красноярского края


",ru,"











Amounts of material assistance to the families of those killed during the break of the dam in Schetinkino were approved

07 Nov 2019, 12:13




Targeted assistance to victims of the tragedy at the gold mine in the Kuragin region. The regional ministry of social policy announced the totals that will receive the victims of the reserve fund of the regional government. So, the families of seventeen dead are each assigned a million rubles. Close three missing - half a million.
Twenty-three people were injured, of whom seventeen were of moderate severity, they will receive 200 thousand rubles each, and six with minor injuries will be paid 100 thousand each. Assistance is provided on the initiative of the governor of the region, Alexander Uss, and to find everyone who it is intended, I had to work hard.
It turned out to be quite complicated and took some time - it was searching for relatives and collecting the necessary documents, because part of the relatives of the victims lived in the Kemerovo region, part in Syktyvkar, even we had to contact. They just started working with other ministries in Khakassia, Kemerovo region, Vologda region. Denis Bogdanov, Deputy Minister of Social Policy of the Krasnoyarsk Territory


"
