,src,lang,text
0,"











SPÖ und rote Gewerkschafter brauchen einander ""wie einen Bissen Brot""

06 Nov 2019, 10:54

Gewerkschafter Josef Muchitsch ruft zur Geschlossenheit auf. - Rendi-Wagner: ""SPÖ hat vergessen mit einer Stimme zu sprechen"".
Die Dienstleistungsgewerkschaft vida begeht dieser Tage freiwillig abseits der Öffentlichkeit ihren Gewerkschaftstag. Im Rahmen der FSG-Fraktionskonferenz am Dienstag, über die von der u.a. Eisenbahner-Vertretung erst am Mittwoch berichtet wurde, dominierten offenkundig Geschlossenheitsappelle innerhalb der angeschlagenen Sozialdemokratie.
FSG und SPÖ benötigten einander ""wie einen Bissen Brot"", meinte etwa FSG-Vize und Bau/Holz-Chef Josef Muchitsch laut Aussendung. Schließlich könne man für die Arbeitnehmer nicht alles in den Kollektivverträgen regeln, es bedürfe auch Stärke bei der sozialen Gesetzgebung. Die Sozialdemokratie müsse daher die Selbstbeschäftigung beenden und Geschlossenheit zeigen.
SPÖ-Vorsitzende Pamela Rendi-Wagner betonte in ihrer Begrüßungsansprache, es sei für die Sozialdemokratie essenziell, wie die Gewerkschaften bei Kollektivvertragsverhandlungen mit einer Stimme zu sprechen. Das habe man in der SPÖ vergessen. Die Arbeitnehmer wüssten, dass sie sich auf die Gewerkschaft verlassen können. Dieses Vertrauen müsse auch die SPÖ wiedergewinnen.


Max Lercher© Bild: APA/GEORG HOCHMUTH

Der frühere SPÖ-Bundesgeschäftsführer Max Lercher will, dass die Sozialdemokraten wieder eine ""kämpferische Bewegung"" werden, ""die ganz genau weiß, wo sie hin will"". Er rief auch dazu auf, dass sich die SPÖ in Zukunft nicht nur auf die Städte verlassen solle, sondern auch wieder auf die Regionen bauen müsse und diese nicht nur ""Schwarz-Blau"" überlassen werden dürfen. FSG-Bundessekretär Willi Mernyi wiederum forderte die SPÖ dazu auf, in die Betriebe zu gehen: ""Dort ist unser Kampf zu führen. Gewinnen wir die Betriebe, gewinnen wir auch die Wahl.""
Ein trauriges Bild zeichnete die Leiterin des Renner-Instituts Maria Maltschnig, die eines der von Rendi-Wagner etablierten Zukunftslabore leitet: Bei aller Stärke der Sozialdemokratie, was Programme formulieren und Sachverstand betreffe, habe sie den Eindruck gewonnen, dass das Herz dabei verloren gegangen sei.
Die von den traditionell medienscheuen Eisenbahnern dominierte vida begeht ihren Gewerkschaftstag seit gestern bis morgen im Wiener Austria Center. An der Eröffnung nahm zumindest laut Aussendung zahlreiche Prominenz von Wiens Bürgermeister Michael Ludwig (SPÖ) bis zu Innenminister Wolfgang Peschorn teil. Eine Einladung an Medien zu dem Gewerkschaftstag erging nicht.
newsletter_signupnewsletter_inline_box


",de,"











SPÖ and red trade unionists need each other ""like a bite of bread""

06 Nov 2019, 10:54

Unionist Josef Muchitsch calls for unity. - Rendi-Wagner: ""SPÖ forgot to speak with one voice"".
The service union vida is voluntarily celebrating its union day off these days. At the FSG fact-finding conference on Tuesday, held by the u.a. Railroaders Representation was reported only on Wednesday, apparently dominated closed-door appeals within battered social democracy.
FSG and SPÖ needed each other ""like a bite of bread,"" said about FSG vice and construction / wood boss Josef Muchitsch loud release. After all, one can not regulate everything in the collective agreements for the workers, it also requires strength in social legislation. The Social Democracy must therefore end the self-employment and show unity.
In her welcome speech, SPÖ leader Pamela Rendi-Wagner emphasized that it was essential for social democracy, as the unions speak with one voice in collective bargaining negotiations. You forgot that in the SPÖ. The workers knew that they could rely on the union. This confidence must also regain the SPÖ.


Max Lercher © Image: APA / GEORG HOCHMUTH

Former SPÖ general manager Max Lercher wants the Social Democrats to become a ""militant movement"" again ""who knows exactly where they want to go"". He also called for the SPÖ not only to rely on the cities in the future, but also to be able to build on the regions again and not just leave them ""black and blue"". FSG federal secretary Willi Mernyi in turn called on the SPÖ to go into the companies: ""There our fight is to lead."" If we win the companies, we also win the election. ""
A sad picture was drawn by the director of the Renner Institute Maria Maltschnig, who heads one of Rendi-Wagner's established future laboratories. Despite all the strength of social democracy in terms of programs and expertise, she had the impression that her heart had been lost ,
The vida, which is dominated by the traditionally media-shy trainers, commemorates its trade union day from yesterday until tomorrow at the Vienna Austria Center. At the opening, at least according to broadcast numerous celebrities from Vienna Mayor Michael Ludwig (SPÖ) to Interior Minister Wolfgang Peschorn participated. An invitation to the media for the union day was not issued.
newsletter_signupnewsletter_inline_box


"
