,src,lang,text
0,"











Transaksi Narkoba di Depan SD, Dua Pengedar Ditangkap Warga
06 Nov 2019, 10:17 by Hilmi Abdul Halim
PURWAKARTA, (PR).- Polisi Resor Purwakarta menangkap 39 pengedar narkoba dalam tiga bulan terakhir. Beberapa pengungkapan tersebut bisa dituntaskan berkat bantuan warga yang ikut menangkap pelaku secara langsung saat melakukan transaksi.
Salah satunya kasus peredaran narkoba yang melibatkan dua tersangka berinisial D dan N. Tindakan pelaku terungkap saat warga menjalankan sistem keamanan lingkungan (Siskamling). ""Warga mencurigai gerak-gerik pelaku lalu menangkapnya,"" kata Kepala Polres Purwakarta Ajun Komisaris Besar Matrius, Rabu 6 November 2019.
Kedua pelaku diketahui sedang bertransaksi narkoba di depan salah satu sekolah dasar di wilayah Kelurahan Nagri Kidul. Kedua pelaku mengaku hanya bertindak sebagai kurir.
Menurut Matrius, para pelaku menggunakan modus tempel dalam proses transaksinya dengan pihak pemesan. Modus tersebut diakui sedang marak di Purwakarta saat ini.
Polisi masih memburu penyuplai narkoba yang menyuruh kedua kurir tersebut. ""Sementara untuk warga yang membantu petugas menangkap pelaku akan diusulkan mendapat reward,"" ujar Matrius.
Kapolres mengungkapkan, total 39 pelaku yang ditangkap dalam tiga bulan terakhir, terbagi ke dalam 29 perkara. ""Yang terakhir, kami menangkap pengedar sabu di mana setelah kami kembangkan ditemukan juga 3,5 kilogram ganja di rumahnya di Bandung,"" kata Matrius.
Matrius menduga para pelaku tersebut terkait dengan jaringan pengedar dari Aceh yang akan beroperasi di wilayah Bandung, Purwakarta, dan sekitarnya.***

Baca Juga








",id,"











Drug Transactions in Front of Elementary School, Two Dealers Arrested by Residents
Nov 6, 2019, 10:17 by Hilmi Abdul Halim
PURWAKARTA, (PR) .- Purwakarta Resort Police arrested 39 drug dealers in the last three months. Some of these disclosures can be completed thanks to the help of residents who participated in capturing the perpetrators directly when making transactions.
One of them is a drug trafficking case involving two suspects with the initials D and N. The perpetrators' actions were revealed when the residents ran an environmental security system (Siskamling). ""Residents suspect the perpetrators' movements then arrest him,"" said Purwakarta Police Chief Adjunct Senior Commissioner Matrius, Wednesday 6 November 2019.
The two perpetrators were known to be dealing drugs in front of one of the elementary schools in the Nagri Kidul District. Both actors claimed to only act as couriers.
According to Matrius, the perpetrators used the paste mode in the transaction process with the buyer. The mode is recognized as being rampant in Purwakarta at this time.
The police are still after the drug supplier who ordered the two couriers. ""As for residents who help officers arrest the perpetrators will be proposed to get a reward,"" said Matrius.
The police chief revealed that a total of 39 perpetrators arrested in the last three months were divided into 29 cases. ""Finally, we caught the methamphetamine dealer, after we developed 3.5 kilograms of marijuana at his home in Bandung,"" Matrius said.
Matrius suspects that the perpetrators are linked to a network of dealers from Aceh that will operate in the Bandung, Purwakarta and surrounding areas. ***

Also Read








"
