,src,lang,text
0,"











Georgina Rodriguez
Canal italiano faz paródia com a namorada de Cristiano Ronaldo [Vídeo]
06 Nov 2019, 10:00 by Revista VIP

Georgina Rodríguez é uma das mulheres mais faladas do momento. A namorada de Cristiano Ronaldo deu origem a uma paródia, realizada por um canal italiano.
















































































Canal italiano cria paródia de Georgina Rodríguez

Georgina Rodríguez já é alvo de brincadeiras por parte dos canais de televisão de Itália. A modelo, de 25 anos, mudou-se há cerca de um ano para Turim, onde vive com Cristiano Ronaldo e os quatro filhos: Cristianinho, de 9 anos, Mateo e Eva, de dois, e Alana Martina, de um. 
O programa 'Quelli che il Calcio' [aqueles que jogam futebol] do canal RAI 2 dedicou um momento de humor à namorada de CR7, que não deixou ninguém indiferente.
Na paródia televisiva, a atriz Liliana Fiorelli imita Georgina Rodríguez a falar dos filhos, do seu papel como influenciadora e dos carros. Tudo isto gravado diretamente da «garagem do senhor Ronaldo», como a falsa Gio insiste em chamar o companheiro.
A brincadeira foi pensada ao pormenor já que Liliana Fiorelli surge com um top decotado, onde se podem ler as suas iniciais.

Assista aqui ao momento:




VEJA AINDA: Cristiano Ronaldo atrevido em público: «Georgina, vê se acalmas o rapaz»
Texto: Inês Marques Fernandes com Redação WIN; Fotos: Reprodução Instagram


",pt,"











Georgina Rodriguez
Italian channel parodies Cristiano Ronaldo's girlfriend [Video]
06 Nov 2019, 10:00 by VIP Magazine

Georgina Rodríguez is one of the most talked about women of the moment. Cristiano Ronaldo's girlfriend gave rise to a parody, performed by an Italian channel.
















































































Italian channel creates parody of Georgina Rodríguez

Georgina Rodríguez is already the target of jokes on Italy's television channels. The 25-year-old moved to Turin about a year ago, where she lives with Cristiano Ronaldo and her four children: Cristianinho, 9, Mateo and Eva, two, and Alana Martina, one.
The program 'Quelli che il Calcio' [those who play soccer] on channel RAI 2 devoted a moment of humor to CR7's girlfriend, who left no one indifferent.
In the television parody, actress Liliana Fiorelli imitates Georgina Rodríguez to talk about her children, her role as an influencer and cars. All this is recorded directly from Mr. Ronaldo's garage, as the fake Gio insists on calling his mate.
The game was thought out in detail as Liliana Fiorelli comes with a low-cut top, where you can read her initials.

Watch the moment here:




SEE STILL: Cristiano Ronaldo cheeky in public: «Georgina, see if you calm the boy»
Text: Inês Marques Fernandes with WIN Writing; Photos: Instagram Playback


"
