,src,lang,text
0,"











ΑΒ Shop & Go – ΑΒ Food Market
Μια ισχυρή συνεργασία με την υπογραφή αξιοπιστίας της ΑΒ Βασιλόπουλος
06 Nov 2019, 10:00 by ΤοΒΗΜΑ Team
Με 80 χρόνια παρουσίας στην κορυφή του ελληνικού λιανεμπορίου, η ΑΒ Βασιλόπουλος, επενδύει με προσήλωση στο δίκτυό της, που σήμερα μετρά περισσότερα από 460 καταστήματα σε κάθε γειτονιά της Ελλάδας, και έχει συνδεθεί με την άριστη ποιότητα προϊόντων, την ποικιλία και το υψηλό επίπεδο εξυπηρέτησης που διέπουν κάθε της στρατηγική επιλογή, με συνέπεια και ευθύνη.
Σε αυτό το πλαίσιο, εδώ και 15 χρόνια, στηρίζει την ελληνική επιχειρηματικότητα και τονώνει, άμεσα και έμμεσα την απασχόληση σε τοπικές κοινωνίες, μέσα από τα καινοτόμα μοντέλα Franchise που φέρουν την υπογραφή της ΑΒ Βασιλόπουλος.
Στηρίζοντας στην πράξη τους νέους επιχειρηματίες της χώρας μας, θέτει στέρεα θεμέλια για το ξεκίνημα μιας νέας επιχειρηματικής διαδρομής και δυναμικά κίνητρα στο επιχειρείν. Συγκεκριμένα, η ΑΒ Βασιλόπουλος υποστηρίζει την προσπάθεια των νέων της συνεργατών σε Αθήνα και Θεσσαλονίκη προσφέροντας 100.000€ σε εξοπλισμό για κάθε νέο AB Shop&Go και έως 250.000€ για κάθε νέο AB Food Market. Η εξειδικευμένη ομάδα της ΑΒ βρίσκεται sτο πλευρό των νέων επιχειρηματιών από την πρώτη στιγμή και σε κάθε στάδιο εξέλιξης κάθε νέου καταστήματος, , προσφέροντας έμπρακτα την υψηλή τεχνογνωσία της ΑΒ.

ΑΒ Shop & Go: Το επιτυχημένο μοντέλο 
franchise για κάθε γειτονιά στην πόλη

Το ΑΒ Shop & Go, αποτελεί την πρόταση της ΑΒ για έκτακτες ανάγκες αγορών στην πόλη. Χωροθετείται σε πυκνοκατοικημένες γειτονιές αστικών κέντρων ή σε σημεία που συγκεντρώνεται πολύς κόσμος σε όλη τη διάρκεια της ημέρας. Ενδεικτικά σημεία αποτελούν οι σταθμοί Μέσων Μαζικής Μεταφοράς, σημεία που συγκεντρώνουν πολλούς χώρους εργασίας και σχολεία. Το ΑΒ Shop & Go διαθέτει τη χαρακτηριστική άριστη ποιότητα προϊόντων και το υψηλό επίπεδο εξυπηρέτησης κάθε καταστήματος ΑΒ, ενώ με το φιλικό και οικείο του περιβάλλον κάνει εύκολες και γρήγορες τις καθημερινές αγορές. Διαθέτει χώρους πώλησης 100-120 τ.μ. και, συνήθως, περιλαμβάνει επιπλέον έναν μικρό χώρο αποθήκης.




ΑΒ 
Food 
Market: Το επιτυχημένο σχήμα για την περιφέρεια

Tο ΑΒ Food Market έχει σχεδιαστεί ειδικά για την κάλυψη των αναγκών της περιφέρειας. Βρίσκεται σε πόλεις και κωμοπόλεις της ελληνικής περιφέρειας ή σε μεγάλα τουριστικά κέντρα. Διαθέτει προϊόντα με την υπογραφή ποιότητας της ΑΒ Βασιλόπουλος  και διακρίνεται για το υψηλό επίπεδο εξυπηρέτησης. Με χώρους πώλησης 300τμ – 600τμ και συνήθως 20-25 θέσεις για αυτοκίνητα, οι αγορές πραγματοποιούνται εύκολα και γρήγορα.




Μια ισχυρή συνεργασία με την υπογραφή αξιοπιστίας ΑΒ

Με την εγγύηση του αξιόπιστου και αναγνωρίσιμου Brand της ΑΒ Βασιλόπουλος, η εταιρεία προσφέρει μια ανταγωνιστική προτεινόμενη τιμολογιακή πολιτική, την γνωστή ποιότητα προϊόντων και υπηρεσιών, την υγιεινή και ασφάλεια των τροφίμων, την τεχνολογία για την εξυπηρέτηση του πελάτη, τα συστήματα logistics για την αποθήκευση και τον εφοδιασμό, την επικοινωνία και προώθηση των πωλήσεων και τα προγράμματα πιστότητας. Με λίγα λόγια, η ΑΒ δημιουργεί τις συνθήκες για τη διεκδίκηση της επιτυχίας σε όσους φιλοδοξούν να κάνουν μια νέα επιχειρηματική αρχή.



Σε μια εποχή «υψηλών ταχυτήτων» και μεγάλων προκλήσεων, η ΑΒ Βασιλόπουλος αποτελεί εγγύηση συνεργασίας. Με οδηγό το όραμά της να προσφέρει το καλύτερο σε κάθε γωνιά της Ελλάδας, η εταιρεία μοιράζεται την ξεχωριστή αγοραστική εμπειρία μέσα από τα επιτυχημένα επιχειρηματικά μοντέλα ΑΒ Food Market και AB Shop&Go, που διευκολύνουν τις καθημερινές αγορές σε κάθε γειτονιά και ταυτόχρονα δίνουν διέξοδο στην ελληνική επιχειρηματικότητα.


",el,"











AB Shop & Go - AB Food Market
A strong collaboration with AB Vassilopoulos' credibility signing
06 Nov 2019, 10:00 by TOVIMA Team
With 80 years of being at the forefront of Greek retailing, AB Vassilopoulos invests heavily in its network, which now counts more than 460 stores in every neighborhood in Greece, and has been associated with excellent product quality, variety and a high level of service. governing each of its strategic choices, with consistency and responsibility.
In this context, for 15 years, it supports Greek entrepreneurship and stimulates, directly and indirectly, employment in local communities through the innovative Franchise models bearing the signature of AB Vassilopoulos.
In practice, by supporting young entrepreneurs in our country, it is laying the foundations for the start of a new business path and strong business motivation. Specifically, AB Vassilopoulos supports the efforts of its new partners in Athens and Thessaloniki by offering 100,000 euros in equipment for each new AB Shop & Go and up to 250,000 euros for each new AB Food Market. AB's specialized team is on the side of new entrepreneurs from the very first moment and at every stage of development of every new store, offering AB's high know-how.

AB Shop & Go: The successful model
franchise for every neighborhood in the city

AB Shop & Go is AB's proposal for emergency shopping needs in the city. It is located in densely populated urban neighborhoods or in places where many people gather throughout the day. Highlights are public transport stations, places that bring together many workplaces and schools. AB Shop & Go has the characteristic excellent quality of products and the high level of service of every AB shop, while its friendly and intimate environment makes everyday shopping easy and fast. It has 100-120 sq.m. and usually also includes a small storage space.




AB
Food
Market: The successful shape for the region

The AB Food Market is specifically designed to meet the needs of the region. It is located in cities and towns of the Greek region or in major tourist centers. It has AB Vassilopoulos quality signature products and is distinguished for its high level of service. With 300sqm - 600sqm sales and usually 20-25 car seats, shopping is easy and fast.




A strong partnership with AB's credibility signing

With the guarantee of AB Vassilopoulos' reliable and recognizable Brand, the company offers a competitive proposed pricing policy, known quality of products and services, food hygiene and safety, customer service technology, logistics systems for storage and supply, communication and sales promotion and loyalty programs. In short, AB creates the conditions for those who aspire to succeed in starting a new business.



At a time of ""high speed"" and great challenges, AB Vassilopoulos is a guarantee of cooperation. Guided by its vision of delivering the best in every corner of Greece, the company shares a unique shopping experience through the successful business models of AB Food Market and AB Shop & Go, which facilitate everyday shopping in every neighborhood and at the same time give way to Greek entrepreneurship. .


"
