,src,lang,text
0,"











В Гонконге неизвестный напал с ножом на члена местного парламента

06 Nov 2019, 10:36

В Гонконге неизвестный напал с ножом на члена местного парламента
Есть обновление от 08:00 →Полиция применила боевое оружие против демонстрантов в Гонконге


Протестующий наступает на фотографию Юниуса Хо в районе Ваньчай, Гонконг Фото: EPA/Vostock-photo

Москва. 6 ноября. INTERFAX.RU - Неизвестный с ножом атаковал в Гонконге члена местного законодательного совета Юниуса Хван Хо (Junius Ho Kwan-yiu), выступающего на стороне властей КНР и критикующего антиправительственные протесты в специальном административном районе Китая, пишет издание South China Morning Post.
По данным газеты, инцидент произошел в 8:44 утра по местному времени (03:44 по Москве) в среду в районе Туен Мун на Новой Территории в Гонконге. Хван Хо встречался там с избирателями в рамках кампании по выборам в местный районный совет. На этой встрече был и мужчина, напавший на политика. Неизвестный вручил Хван Хо букет цветов, поблагодарил за усилия на посту члена парламента и попросил разрешения сделать совместную фотографию.



ХроникаПротесты в ГонконгеВсе материалы хроники
Когда Хван Хо согласился, этот мужчина со словами ""Я достану свой мобильный, хорошо?"" выхватил вместо этого из своей сумки нож и набросился с ним на члена парламента, ранив того в грудь. После этого сам Хван Хо и еще двое мужчин - помощников политика - скрутили нападавшего. В результате помощника политика, а также нападавший также пострадали в потасовке. Все четверо были доставлены в больницу.
Сам Хван Хо заявил, что ему предстоит перенести операцию, но его жизни ничто не угрожает. Политик также назвал день нападения ""черным днем"" для Гонконга. Кроме того, Хван Хо утверждает, что гонконгские политики, поддерживающие власти КНР, подвергаются запугиванию со стороны ""темных сил"". Представитель правительства Гонконга осудил атаку на Хван Хо, заявив, что нападавший был арестован и что полиция занимается расследованием инцидента.
57-летний Юниус Хван Хо был избран членом парламента Гонконга в 2016 году. В 2017 году Хван Хо говорил, что местные жители, выступающие за независимость Гонконга от Китая, заслуживают смерти. В июле 2019 года в интернете появилось видео, где политик пожимает руки неким мужчинам в белых футболках и благодарит их. Ролик появился после того, как группа неизвестных мужчин, также одетых в белых футболки, избила людей на станции метро Гонконга Юаньлан, среди которых как обычные пассажиры, так и активисты оппозиции. Сам Хван Хо отрицал связь с напавшими на Юаньлан злоумышленниками.
Протесты в Гонконге
В июне в Гонконге начались массовые выступления с протестами против предложений о поправках к закону, которые позволили бы властям высылать подозреваемых в совершении преступлений на материковую часть Китая. Позднее они переросли в беспорядки и погромы.
После объявления администрации о том, что рассмотрение изменений в закон отложены, демонстранты выдвинули новые требования. В частности, они добиваются рассмотрения дел о чрезмерно жестких действиях полиции в ходе столкновений с участниками протестов, а также отставки Лэм с поста главы администрации. Демонстранты заявляют, что не остановятся, пока глава администрации и члены законодательных органов не будут избраны путем демократических выборов.


",ru,"











In Hong Kong, an unknown assaulted a member of the local parliament with a knife

06 Nov 2019, 10:36

In Hong Kong, an unknown assaulted a member of the local parliament with a knife
There is an update from 08:00 → Police used military weapons against demonstrators in Hong Kong


A protester steps on a photograph of Junius Ho in Wanchai district, Hong Kong Photo: EPA / Vostock-photo

Moscow. November 6th. INTERFAX.RU - An unknown man with a knife in Hong Kong attacked a member of the local legislative council, Junius Ho Kwan-yiu, who is on the side of the PRC authorities and criticizes anti-government protests in a special administrative region of China, writes the South China Morning Post.
According to the newspaper, the incident occurred at 8:44 a.m. local time (03:44 Moscow time) on Wednesday in the Thuyun area of New Territory in Hong Kong. Hwang Ho met with voters there as part of the local district council election campaign. At this meeting there was a man who attacked a politician. The unknown handed Hwang Ho a bouquet of flowers, thanked for the efforts as a member of parliament and asked permission to take a joint photo.



Chronicle Hong Kong ProtestsAll Chronicles
When Hwang Ho agreed, this man with the words ""I'll get my mobile, okay?"" instead, he grabbed a knife from his bag and attacked a member of parliament with him, wounding him in the chest. After that, Hwang Ho himself and two other men - political aides - twisted the attacker. As a result, the assistant politician, as well as the attacker, also suffered a brawl. All four were taken to the hospital.
Hwang Ho himself said that he will have to undergo an operation, but nothing threatens his life. The politician also called the day of the attack ""black day"" for Hong Kong. In addition, Hwang Ho claims that Hong Kong politicians supporting the Chinese authorities are being intimidated by the ""dark forces."" A Hong Kong government spokesman condemned the attack on Hwang Ho, saying the attacker was arrested and the police are investigating the incident.
Junius Hwang Ho, 57, was elected to the Hong Kong Parliament in 2016. In 2017, Hwang Ho said that locals advocating Hong Kong's independence from China deserve to die. In July 2019, a video appeared on the Internet where a politician shakes hands with some men in white T-shirts and thanks them. The video appeared after a group of unidentified men, also dressed in white T-shirts, beat people at Hong Kong's Yuanlan subway station, including both ordinary passengers and opposition activists. Hwang Ho himself denied any connection with the attackers attacking Yuanlan.
Hong Kong protests
In June, Hong Kong began mass protests against proposals for amendments to the law that would allow authorities to expel suspected criminals to mainland China. Later they grew into riots and pogroms.
After the administration announced that the consideration of amendments to the law was postponed, the demonstrators put forward new requirements. In particular, they are seeking cases of excessively harsh police actions during clashes with protesters, as well as Lam’s resignation as head of administration. Demonstrators say they will not stop until the head of administration and members of the legislature are elected by democratic elections.


"
