,src,lang,text
0,"











Agente de Nuno Batista prepara versão feminina do conceito de ‘Zé do Pipo’
06 Nov 2019, 10:00 by Duarte Costa

O conceito musical de ‘Zé do Pipo’ é para continuar, apesar do desaparecimento do cantor, há cerca de um ano.

Luís Martins, agente de Nuno Batista, explicou à revista Maria que será lançada a versão feminina de ‘Zé do Pipo’. “Vem aí uma mulher. É uma ideia que eu já tinha antes de se ter passado o que se passou”, explicou.
O agente não revelou muitos mais pormenores, mas garantiu que já está em marcha a criação do primeiro videoclip e que esta nova figura vai ter “um nome bem divertido” e “um visual muito engraçado”.
RELACIONADAS


Ator João Batista é acusado de agredir e perseguir ex-namorada


Atriz da TVI Alba Batista vai ser protagonista de série internacional


Cristina Ferreira e a depilação feminina: ""Não sou do deserto. Tenho 3 ou 4 árvores""


Fãs do 'Você na TV' com saudades de Maria: ""Falta a presença feminina""!


Nuno Batista, mais conhecido no mundo artístico como Zé do Pipo, desapareceu há um ano. Suspeita-se que se terá suicidado numa praia em Peniche, embora nunca tenha sido encontrado.


",pt,"











Nuno Batista's agent prepares female version of 'Zé do Pipo' concept
06 Nov 2019, 10:00 by Duarte Costa

Zé do Pipo's musical concept is to continue despite the singer's disappearance about a year ago.

Luís Martins, agent of Nuno Batista, explained to Maria magazine that the female version of 'Zé do Pipo' will be launched. “Here comes a woman. It's an idea I had before what happened, ”he explained.
The agent did not disclose much more details, but assured that the creation of the first video clip is already underway and that this new figure will have ""a very funny name"" and ""a very funny look"".
RELATED


Actor João Batista is accused of assaulting and stalking ex-girlfriend


TVI actress Alba Batista to star in international series


Cristina Ferreira and female waxing: ""I'm not from the desert. I have 3 or 4 trees""


'You on TV' fans miss Maria: 'Missing female presence'!


Nuno Batista, better known in the art world as Zé do Pipo, disappeared a year ago. It is suspected that he committed suicide on a beach in Peniche, although he was never found.


"
