,src,lang,text
0,"











В Днепре отметили годовщину Дня социального работника
Социальной сфере в Украине целых 20 лет. Годовщину дня социального работника отметили и в Днепре.

02 Nov 2019, 13:56

На праздник пригласили специалистов управления фонда социального страхования, медиков, профсоюзных и общественных деятелей. Все эти структуры каждый день обеспечивают комфортную жизнь населению.
На Днепропетровщине социально защищены около миллиона жителей. Это люди с инвалидностью, участники АТО и переселенцы.




""Через наш центр госпитализируется более тысячи человек, пациентов. То есть, большая часть из них работающая и неработающие - это инвалиды труда"", - говорит заведующая городским центром по лечению профессиональных заболеваний Людмила Глиняная. 
""Это наша цель и задача - защищать каждого человека труда: шахтера, металлург, химика, врача, всех тех, которые сегодня живут и работают в нашей единой системе. Дай Бог, чтобы это всегда было так. Чтобы человек труда был всегда социально защищен на самом высоком уровне"", - сказал начальник Управления Фонда соцстрахования в области Борис Мазур.


Ольга Михайлова


Хотите получать оперативные и важные новости прямо в свой мессенджер? Подписывайтесь на наш канал в Telegram.



",ru,"











In Dnepr celebrated the anniversary of the Day of social worker
The social sphere in Ukraine is as much as 20 years. The anniversary of the day of social workers was celebrated in the Dnieper.

02 Nov 2019, 13:56

Specialists of the Social Insurance Fund department, doctors, trade union and public figures were invited to the celebration. All these structures every day provide a comfortable life for the population.
In the Dnipropetrovsk region, about a million residents are socially protected. These are people with disabilities, ATO participants and migrants.




“More than a thousand people and patients are hospitalized through our center. That is, most of them working and non-working are disabled people,” says Lyudmila Glinyanaya, head of the city center for the treatment of occupational diseases.
“This is our goal and task - to protect every person of work: a miner, metallurgist, chemist, doctor, all those who live and work in our single system today. God grant that this is always the case. That the person of labor is always socially protected on the highest level, ""said Boris Mazur, head of the Department of Social Insurance Fund in the region.


Olga Mikhailova


Do you want to receive prompt and important news directly to your messenger? Subscribe to our channel in Telegram.



"
