,src,lang,text
0,"











Dragoceno violino pozabil na vlaku
Pogrešano je Tecchlerjevo godalo iz leta 1709. Stephen Morris upa na poštenost najditelja.
02 Nov 2019, 13:58 by E. B.



Violina se med igranjem zlije v eno z glasbenikom.



Dragoceni kos je nastal v zgodnjem 18. stoletju.


Stephen Morris si nikoli ne bo odpustil, da je tako neodgovorno ravnal z dragocenim glasbilom, kljub temu pa še vedno upa, da se mu bo nasmehnila sreča in ga bo dobri najditelj vendarle poklical.


Dragoceni kos je nastal v zgodnjem 18. stoletju.

Ugledni violinist je zadnji koncert odigral z ženinim inštrumentom, in čeprav se seveda nihče v občinstvu ni pritoževal, se je Morris veselil, da se bo v Kraljevi filharmoniji izkazal še bolje. 
Ustvarja tudi glasbo za film
A to ni mogoče brez 300.000 evrov vredne violine, ki jo je nesrečnik nerodno pozabil na vlaku, zdaj pa živi v strahu, da jo bo najditelj prodal za drobiž in bo glasbilo izginilo za vedno. Gre za enega od le nekaj primerkov violine, ki jo je izdelal mojster David Tecchler 1709., Morris, ki je z inštrumentom posnel glasbo za Gospodarja prstanov in Jamesa Bonda, sodeloval je tudi z legendama Davidom Bowiejem in Steviejem Wonderjem, pa z nadomestki preprosto ne zna pričarati tako dih jemajoče melodije.
Trenutno si izposoja ženino violino.
Violino zdaj išče tudi metropolitanska policija, glasbeni virtuoz pa javnosti sporoča, da je izgubil pomemben delček zgodovine, od katerega je odvisna njegova nadaljnja kariera pa še kariera katerega drugega mojstra: Morris se je namreč nameraval čez nekaj let upokojiti, Tecchlerjevo umetnino pa podariti najbolj nadarjenemu nasledniku.»Nisem se imel za njenega lastnika, ampak za skrbnika. Takšna violina je dragocena dediščina, ki jo je treba predati naprej. Dobra violina je kakor del roke, v glasbi je preprosto del tebe,« je pojasnil glasbenik, ki bolj kot kdaj prej upa na poštenost ljudi.
300 tisoč evrov je vredno pogrešano glasbilo.
David Tecchler se je rodil leta 1666 na Bavarskem, ko je bil star okoli 20 let, pa je odpotoval v Rim in se izuril v izdelavi godalnih inštrumentov. Poleg violin so bili cenjeni še njegovi kontrabasi in violončela. 


",sl,"











I forgot my precious violin on the train
The Tecchler String of 1709. Miss Morris is hoped for the honesty of the finder.
02 Nov 2019, 13:58 by E. B.



The violin blends into one with the musician while playing.



A valuable piece was created in the early 18th century.


Stephen Morris will never forgive himself for handling such a precious instrument so irresponsibly, however, he still hopes to make him happy and a good finder to call him anyway.


A valuable piece was created in the early 18th century.

The eminent violinist played the last concert with the groom's instrument, and although of course no one in the audience complained, Morris was looking forward to performing even better in the Royal Philharmonic.
She also creates music for the movie
However, this cannot be done without the $ 300,000 violin that the unlucky man has forgotten on the train, and now lives in fear that the finder will sell it for change and the musical instrument will be gone forever. These are one of only a few examples of a violin made by master David Tecchler in 1709. Morris, who recorded music for The Lord of the Rings and James Bond, collaborated with legends David Bowie and Stevie Wonder, but simply did not knows how to conjure such breathtaking tunes.
He is currently borrowing his wife's violin.
The violin is now being sought by the Metropolitan Police, and the music virtuoso announces to the public that he has lost a significant chunk of history, which depends on his further career, as well as that of another master: Morris intended to retire in a few years and donate Tecchler's artwork to the most talented ""I did not consider myself to be its owner, but an administrator. Such a violin is a valuable heritage that must be passed on. A good violin is like a piece of a hand, it's simply a part of you in music, ""explained the musician, who hopes more than ever for the honesty of people.
€ 300,000 is worth the missing musical instrument.
Born in Bavaria in 1666, David Tecchler traveled to Rome and trained in string instruments when he was about 20 years old. In addition to violins, his double bass and cello were also appreciated.


"
