,src,lang,text
0,"











В Новгородской области смыло дороги и подтопило деревни. Спасатели вынесли лайку из воды на ручках

06 Nov 2019, 12:00



ГУ МЧС по Новгородской области

Девять районов Новгородской области оказались подтоплены после ливневых дождей. Об этом сообщает региональное МЧС 6 ноября.
Вода заняла 298 приусадебных участков. От наводнения пострадали 249 человек. Потоки смыли деревянные переправы, шесть населённых пунктов оказались отрезанными от большой земли, из-за подтопления прекращено движение транспорта на 16 дорожных участках.  Больше других от стихии пострадал Демянский район, местные власти ввели режим ЧС.
К ликвидации последствий дождевого паводка привлечено более 152 сотрудников МЧС. На опубликованных ведомством снимках запечатлён момент спасения лайки. Собаку вынесли из затопленного дома на руках.













В Новгородской области смыло дороги и подтопило деревни. Спасатели вынесли лайку из воды на ручках

По прогнозам синоптиков, в ближайшие сутки уровень воды в реках Пола и Уверь в Новгородской области будет только увеличиваться.


",ru,"











In the Novgorod region, roads were washed away and villages were flooded. Rescuers carried a like out of the water on the handles

06 Nov 2019, 12:00



GU Ministry of Emergencies in the Novgorod region

Nine districts of the Novgorod region were flooded after heavy rains. This was reported by the regional Ministry of Emergency Situations on November 6.
Water occupied 298 household plots. 249 people were affected by the flood. Streams washed away wooden crossings, six settlements were cut off from the mainland, due to flooding, traffic stopped on 16 road sections. More than others, the Demyansky district suffered from the disaster, local authorities introduced an emergency mode.
More than 152 employees of the Ministry of Emergencies were involved in the liquidation of the consequences of the rain flood. The images published by the department capture the moment when the husky rescued. The dog was carried out of the flooded house in his arms.













In the Novgorod region, roads were washed away and villages were flooded. Rescuers carried a like out of the water on the handles

According to weather forecasts, in the coming days, the water level in the Pola and Uver rivers in the Novgorod region will only increase.


"
