,src,lang,text
0,"











الملك يعقد جلسة مباحثات مع رئيسة سنغافورة .. ويسلمها قلادة الملك عبدالعزيز
06 Nov 2019, 12:12 by ""الاقتصادية"" من الرياض





























عقد خادم الحرمين الشريفين الملك سلمان بن عبدالعزيز اليوم جلسة مباحثات رسمية مع حليمة يعقوب رئيسة سنغافورة. وقبيل المباحثات سلم خادم الحرمين الشريفين رئيسة سنغافورة قلادة الملك عبدالعزيز تقديرا لفخامتها. عقب ذلك تم بحث العلاقات بين المملكة وسنغافورة وفرص تعزيز التعاون بين البلدين في المجالات كافة إضافة إلى بحث عدد من الموضوعات ذات الاهتمام المشترك.
حضر المباحثات الأمير فيصل بن بندر أمير الرياض والأمير الدكتور منصور بن متعب وزير الدولة عضو مجلس الوزراء مستشار خادم الحرمين الشريفين والأمير عبدالعزيز بن سعود وزير الداخلية والأمير فيصل بن فرحان وزير الخارجية والدكتور مساعد العيبان وزير الدولة عضو مجلس الوزراء والدكتور ماجد القصبي وزير التجارة والاستثمار وزير الشؤون البلدية القروية المكلف (الوزير المرافق) ومحمد الجدعان وزير المالية وسعد الصالح سفير السعودية لدى سنغافورة.
كما حضرها من الجانب السنغافوري ماساجوس ذو الكفلي وزير البيئة والموارد المائية والوزير المكلف بشؤون المسلمين والدكتور كوه بوه كوون كبير وزراء الدولة وزير التجارة والصناعة وونغ تشاو مينغ سفير سنغافورة لدى السعودية وجوان بيريرا عضو البرلمان وفوو مي هار عضو البرلمان وبيني لي سكرتير أول خاص لرئيسة سنغافورة وعدد من المسؤولين.
 


",ar,"











King holds talks with President of Singapore
06 Nov 2019, 12:12 by ""Economic"" from Riyadh





























Custodian of the Two Holy Mosques King Salman bin Abdulaziz on Thursday held talks with Singapore President Halima Yacoub. Prior to the talks, the Custodian of the Two Holy Mosques handed the King of Singapore a necklace in recognition of her excellence. Later, they discussed relations between the Kingdom of Saudi Arabia and Singapore and the opportunities of enhancing cooperation between the two countries in all fields.
The talks were attended by Prince Faisal bin Bandar, Prince of Riyadh, Prince Mansour bin Miteb, Minister of State, Member of the Council of Ministers, Advisor to the Custodian of the Two Holy Mosques, Prince Abdulaziz bin Saud, Minister of Interior, Prince Faisal bin Farhan, Foreign Minister, Musaed Al Aiban, Minister of State, Member of the Council of Ministers, Dr. Majid Al Qasabi, Minister of Trade and Investment The rural municipality in charge (accompanying minister), Mohammed al-Jadaan, minister of finance, and Saad al-Saleh, Saudi ambassador to Singapore.
Also attending were Singapore's Minister of Environment and Water Resources Masagos Zulfi, Minister in Charge of Muslim Affairs, Dr. Koh Poo Kwon, Chief Minister of State for Trade and Industry, Wong Zhao Ming, Singapore's Ambassador to Saudi Arabia, Joan Pereira, Member of Parliament, Fu Mei Har, Member of Parliament, Of officials.



"
