,src,lang,text
0,"











MEGA-DEAL BEI „DIE HÖHLE DER LÖWEN“
Was bringt Ölziehen wirklich?

06 Nov 2019, 12:43


Am Dienstagabend stellten die Gründer Jenny (34) und Philipp Rathgeber (35) bei der Sendung „Die Höhle der Löwen“ (Vox) ihre „Elixr“-Mundöle vor. Und das sehr erfolgreich! Denn die Investoren boten doppelt so viel, wie das Duo haben wollte. Aber was haben die beiden eigentlich entwickelt? Bei ihrer Innovation dreht sich alles ums sogenannte Ölziehen, eine uralte Tradition aus dem Ayurveda.

Aber was kann dieses traditionelle Verfahren? Wie funktioniert das überhaupt? Welches Öl ist geeignet? Ist die Wirkung wissenschaftlich bestätigt?


BILD beantwortet die wichtigsten Fragen zum Thema:


Was genau bewirkt das Ölziehen?
„Das Öl zieht die Schadstoffe wie ein Magnet aus der Schleimhaut des Mundes und der Zunge“, erklärt die Buchautorin und Pharmazeutin Dr. Angela Fetzner („Die Ölziehkur. Entgiften und Heilen“).
Auch der Zahnarzt Dr. Dominik Nischwitz ist von der Methode überzeugt. „Ölziehen ist eine großartige, alte Methode, die zu Unrecht etwas aus der Mode geraten ist“, erklärt er.
Wie wird es angewandt?
Um Beläge und Bakterien zu entfernen wird ein Esslöffel Öl, z. B. Kokosöl, in den Mund genommen und wie bei einer Mundspülung verteilt, durch die Zahnzwischenräume gezogen – zu Beginn drei, dann etwa zehn Minuten lang.
Welches Öl ist das richtige?
Das richtige Öl ist für die Wirkung entscheidend! „Aber grundsätzlich hat JEDES pflanzliche Öl die Fähigkeit, fettlösliche Giftstoffe aufzunehmen und zu binden, sagen Experten. Ein teures Mundzieh-Öl ist also NICHT nötig“, meint Dr. Fetzner.Tipp: Kaltgepresstes Bio-Kokosöl oder Sesamöl sind kostengünstig und bestens geeignet. Sesamöl zeichnet sich durch gute antibiotische und entzündungshemmende Eigenschaften aus. Durch die besondere Molekülstruktur kann es am besten in die Schleimhäute eindringen.
Wegen seiner Konsistenz und des Geschmacks wird vor allem Kokosöl zum Ölziehen gern genutzt: „Es zeichnet sich durch antibakterielle, antiseptische, antivirale und entzündungshemmende Eigenschaften aus.


Vor allem Kokosöl ist für das Verfahren geeignetFoto: Moment/Getty Images

Ist die Wirkung bereits wissenschaftlich bestätigt?
Nein! Die Wissenschaft ist sich über die Wirkung des Ölziehens noch uneinig. Forschungsansätze gibt es bisher vor allem aus dem Bereich der Zahnmedizin. In einer 2015 veröffentlichten Studie des Kannur Dental College in Indien konnte ein positiver Effekt des Ölziehens auf die Mundgesundheit festgestellt werden.Bei einer anderen Studie blieb der Effekt aus. Viele Ärzte empfehlen die Methode trotzdem, da eben auch keine negative Nebenwirkungen auftreten und viele Patienten von einer Besserung ihrer Beschwerden berichten.


",de,"











MEGA-DEAL AT ""THE CAVE OF THE LIONS""
What really brings oil pulling?

06 Nov 2019, 12:43


On Tuesday evening, founders Jenny (34) and Philipp Rathgeber (35) presented their ""Elixr"" essential oils on the show ""The Cave of the Lions"" (Vox). And very successful! Because the investors offered twice as much as the duo wanted. But what did the two actually develop? Their innovation is all about so-called oil pulling, an ancient Ayurvedic tradition.

But what can this traditional procedure do? How does it work? Which oil is suitable? Is the effect scientifically proven?


BILD answers the most important questions on the topic:


What exactly does the oil pulling do?
""The oil pulls the pollutants like a magnet out of the mucous membrane of the mouth and tongue,"" explains the author and pharmacist. Angela Fetzner (""The oil pulling cure detoxify and cure"").
Also the dentist Dominik Nischwitz is convinced of the method. ""Oil pulling is a great, old method that has been wrongly out of fashion,"" he explains.
How is it used?
To remove deposits and bacteria is a tablespoon of oil, z. As coconut oil, taken in the mouth and distributed as in a mouthwash, through the interdental spaces - at the beginning of three, then about ten minutes long.
Which oil is the right one?
The right oil is crucial for the effect! ""But basically, ALL vegetable oils have the ability to absorb and bind fat-soluble toxins, experts say. An expensive mouthwash oil is NOT necessary, ""says Dr. Fetzner.Tipp: Cold-pressed organic coconut oil or sesame oil are inexpensive and ideally suited. Sesame oil is characterized by good antibiotic and anti-inflammatory properties. Due to the special molecular structure, it is best able to penetrate into the mucous membranes.
Because of its consistency and taste, coconut oil is particularly popular for oil pulling: ""It is characterized by antibacterial, antiseptic, antiviral and anti-inflammatory properties.


Especially coconut oil is suitable for the process. Photo: Moment / Getty Images

Is the effect already scientifically confirmed?
No! Science still disagrees on the effects of oil extraction. Research approaches have so far mainly been in the field of dentistry. In 2015, Kannur Dental College's study in India found a positive effect of oil pulling on oral health. In another study, the effect did not materialize. Many doctors recommend the method anyway, as well as no negative side effects occur and many patients report an improvement in their symptoms.


"
