,src,lang,text
0,"











Homenajear a los difuntos en su día puede costar más de Bs 78 mil
En el cementerio del sur se consigue ramos de flores que oscilan entre Bs 10 mil, 12 mil y 20 mil. ""La gente se lleva de a 2 o 3 ramitos. Los crisantemos y pompones son los más caros, el paquete cuesta Bs 60 mil”, según afirman los encargados de los floristerías.
01 Nov 2019, 07:46 by Descifrado
Este sábado 2 de noviembre se celebra en Venezuela el Día de los Muertos o Fieles Difuntos, y a pesar de la inflación la gente siempre busca la manera de rendir honores a sus seres queridos.
En un recorrido por algunos campos santos de la ciudad se pudo conocer el costo de mantenimiento de las tumbas, de las misas, velas y flores; que son las formas o tradiciones con las que la gente “atiende” o recuerda a los familiares que ya partieron con el Señor, según reseña el diario 2001.
Cerca del Cementerio General del Sur hay tiendas o floristerías que ofrecen flores a precios solidarios y otras un poco más costosas, pero todo se ajusta al bolsillo.De interés: Banco de Venezuela habilitará pagos en petros
La encargada de la Floristería Flor Diana, María Do Nascimento indicó que hacen ramos pequeños con 3 flores grandes y follaje a precios accesibles. “Hacemos ramos de Bs 10 mil, 12 mil y 20 mil, son surtidos. La gente se lleva de a 2 o 3 ramitos. Los crisantemos y pompones son los más caros, el paquete cuesta Bs 60 mil”.
Do Nascimento afirmó que los días de más movimiento son los sábados y domingos porque la gente no trabaja. “En un día bueno vendo 20 tobos de flores. La demanda bajó 50%, todo está más costoso”.
Mientras que, camino al Cementerio del Este en La Guairita, hay varias ventas de flores donde se puede conseguir variedad de ramos de acuerdo al gusto y al presupuesto. En la floristería Hermanos Liscano los ramos oscilan entre 25 mil y 60 mil bolívares.
Con respecto a los costos dentro del camposanto del Este, los dolientes cancelan una cuota anual de Bs 200 mil por mantenimiento, destinados al cuidado de las zonas públicas del cementerio, vigilancia, alumbrado público, mantenimiento de bombas de agua.
Sin embargo, la limpieza y embellecimiento de la tumba corre por cuenta de los deudos, quienes tienen la opción de contratar los servicios de un jardinero en el panteón.
Lea el trabajo completo en 2001


Forma parte de nuestro canal en Telegram y mantente informado del acontecer político y económico de Venezuela https://t.me/Descifrado



Artículos relacionados






",es,"











Tribute to the deceased in their day can cost more than Bs 78 thousand
In the cemetery of the south you get bouquets of flowers that range between Bs 10 thousand, 12 thousand and 20 thousand. ""People take 2 or 3 twigs. Chrysanthemums and pom poms are the most expensive, the package costs Bs 60 thousand,"" according to those in charge of florists.
01 Nov 2019, 07:46 by Decryption
On Saturday, November 2, the Day of the Dead or the Faithful is celebrated in Venezuela, and despite inflation, people always look for ways to honor their loved ones.
In a tour of some holy fields of the city, the cost of maintaining the graves, masses, candles and flowers could be known; which are the ways or traditions with which people “attend” or remember family members who have already left with the Lord, according to the 2001 newspaper.
Near the General Cemetery of the South there are shops or florists that offer flowers at solidarity prices and others a little more expensive, but everything fits the pocket.Of interest: Banco de Venezuela will enable payments in petros
The person in charge of the Flor Diana Florist, María Do Nascimento indicated that they make small bouquets with 3 large flowers and foliage at affordable prices. “We make branches of Bs 10 thousand, 12 thousand and 20 thousand, they are assorted. People take 2 or 3 twigs. Chrysanthemums and pom poms are the most expensive, the package costs Bs 60 thousand. ”
Do Nascimento said that the days of more movement are Saturdays and Sundays because people do not work. “On a good day I sell 20 flower tobos. Demand dropped 50%, everything is more expensive. ”
While, on the way to the Cemetery of the East in La Guairita, there are several flower sales where you can get variety of bouquets according to taste and budget. In the Floristería Hermanos Liscano, the bouquets range from 25,000 to 60,000 bolivars.
With regard to the costs within the cemetery of the East, the mourners pay an annual fee of Bs 200 thousand for maintenance, intended for the care of the public areas of the cemetery, surveillance, public lighting, maintenance of water pumps.
However, the cleaning and beautification of the tomb is the responsibility of the bereaved, who have the option of hiring the services of a gardener in the pantheon.
Read the full paper in 2001


Be part of our Telegram channel and stay informed of the political and economic events of Venezuela https://t.me/Descifrado



Related Posts






"
