,src,lang,text
0,"











""Почта России"" решила стать экосистемой платформенных бизнесов

01 Nov 2019, 07:15

""Почта России"" решила стать экосистемой платформенных бизнесов
Москва. 1 ноября. INTERFAX.RU - Совет директоров ""Почты России"" в середине ноября рассмотрит стратегию развития на 2020-2027 годы, которая предусматривает превращение предприятия в экосистему платформенных бизнесов. Об этом сообщил ""Коммерсантъ"" со ссылкой на источник, близкий к членам совета.
Стратегия предполагает выход предприятия на новые рынки, в том числе рынок облачных услуг и центров обработки данных, венчурные инвестиции, запуск онлайн-сервиса, в том числе для коммерческого управления недвижимостью и заказа розничных товаров.
В зависимости от сценариев развития инвестпрограмма ""Почты России"" до 2027 года составит от 221 млрд рублей до 353 млрд рублей, говорится в проекте стратегии. отмечается в проекте. На цифровую трансформацию предприятие планирует потратить 47 млрд рублей, на развитие логистики — 32 млрд рублей, на модернизацию отделений почтовой связи в крупных городах, расширение сети и ""улучшение условий работы персонала"" — 33 млрд рублей. Еще 31 млрд рублей составят инвестиции в развитие новых продуктов, в том числе запуск доставочной платформы.
Проект по созданию агрегатора по оказанию социальных, бытовых, госуслуг и образовательных сервисов потребует 85 млрд рублей из госбюджета. В проекте стратегии развития ""Почты России"" до 2023 года похожая задумка оценивалась в 50 млрд рублей, напомнила газета.
Среди рисков для новой стратегии ""Почта России"" указала возможное изменение макроэкономической ситуации в России, сокращение рынка услуг почтовой связи, пенсионную реформу и госполитику по сокращению обращения наличных денег.
1 октября 2019 года ""Почта России"" была преобразована в акционерное общество. Процесс преобразования компании из ФГУП занял год.
""Почта России"" - федеральный почтовый оператор с 42 тысячами отделений и 335 тысячами сотрудников.


",ru,"











Russian Post decided to become an ecosystem of platform businesses

01 Nov 2019, 07:15

Russian Post decided to become an ecosystem of platform businesses
Moscow. Nov. 1. INTERFAX.RU - The board of directors of Russian Post in mid-November will consider a development strategy for 2020-2027, which provides for the transformation of the enterprise into an ecosystem of platform businesses. This was reported by Kommersant, citing a source close to the members of the council.
The strategy involves the enterprise entering new markets, including the market for cloud services and data centers, venture capital investments, launching an online service, including for commercial property management and ordering retail goods.
Depending on the development scenarios, the Russian Post investment program until 2027 will range from 221 billion rubles to 353 billion rubles, the draft strategy says. noted in the project. The company plans to spend 47 billion rubles on digital transformation, 32 billion rubles on logistics development, 33 billion rubles on modernization of post offices in large cities, expansion of the network and “improvement of working conditions for personnel”. Another 31 billion rubles will be investments in the development of new products, including the launch of a delivery platform.
The project to create an aggregator for the provision of social, domestic, public services and educational services will require 85 billion rubles from the state budget. In the draft development strategy of the Russian Post until 2023, a similar idea was estimated at 50 billion rubles, the newspaper recalled.
Among the risks for the new strategy, Russian Post indicated a possible change in the macroeconomic situation in Russia, a reduction in the postal services market, pension reform and a government policy to reduce cash circulation.
On October 1, 2019, Russian Post was transformed into a joint stock company. The process of transforming the company from FSUE took a year.
Russian Post is a federal postal operator with 42 thousand branches and 335 thousand employees.


"
