,src,lang,text
0,"











СМИ: Минюст США подозревает Under Armour в махинациях с финотчетностью

04 Nov 2019, 02:33

Министерство юстиции США проводит расследовании в отношении американского производителя экипировки и спортивной одежды Under Armour, сообщила газета The Wall Street Journal со ссылкой на источники. Ведомство подозревает компанию в манипуляциях с финансовой отчетностью, по которым компания пыталась показаться большее развитой.
Источники заявили, что следователи провели допрос в Балтиморе, где расположена штаб-квартира Under Armour. По словам одного из собеседников газеты, Минюст возбудил уголовное дело по этому делу. Компания заявила, что сотрудничает со следствием.
По данным газеты, до 2016 года компания показывала рост доходов не ниже 20% в течение 26 недель, но в 2016 году у нее не получилось достичь заявленных в прогнозе показателей. В конце 2017 года акции компании снизились. В отчетности Under Armour понизила прогнозы роста на будущий год, а также сообщила, что компанию покинул финансовый директор, проработавший всего один год в своей должности. Основатель, председатель и исполнительный директор производителя Кевин Планк объяснял низкие показатели уменьшением количества покупателей и изменениями в индустрии спортивной одежды, в том числе и банкротством одного из ритейлеров.
Компания Under Armour была основана в 2016 году. Она производит и поставляет спортивную одежду, экипировку и обувь. Кроме того, компания работает с американскими командами в различных видах спорта. Она представлена и в России.


",ru,"











Media: US Department of Justice suspects Under Armor of fraud with financial reporting

04 Nov 2019, 02:33

The US Department of Justice is conducting an investigation into the US-based Under Armor equipment and sportswear manufacturer, The Wall Street Journal reported citing sources. The department suspects the company of manipulating financial statements, according to which the company tried to seem more developed.
Sources said investigators interrogated in Baltimore, where the Under Armor headquarters are located. According to one of the interlocutors of the newspaper, the Justice Ministry opened a criminal case in this case. The company said it was cooperating with the investigation.
According to the newspaper, until 2016, the company showed revenue growth of at least 20% for 26 weeks, but in 2016 it did not manage to achieve the indicators stated in the forecast. At the end of 2017, the company's shares fell. In reporting, Under Armor lowered its growth forecasts for next year, and also reported that the company had left the financial director, who worked only one year in his post. Founder, chairman and CEO of the manufacturer Kevin Plank explained the low rates by the decrease in the number of customers and changes in the sportswear industry, including the bankruptcy of one of the retailers.
Under Armor was founded in 2016. She manufactures and supplies sportswear, equipment and shoes. In addition, the company works with American teams in various sports. She is represented in Russia.


"
