,src,lang,text
0,"











Cưới ngày mưa bão, chú rể Quảng Ngãi đón dâu bằng ""siêu xe"" thuyền thúng
02 Nov 2019, 03:11 by Minh Khuê (Tổng hợp)
Quan viên hai họ ướt như chuột, sắn quần lội nước đi ăn cưới, chú rể đón dâu bằng thuyền thúng… là những hình ảnh ấn tượng trong đám cưới của cặp đôi Quảng Ngãi khi ngày vui trăm năm đúng vào hôm mưa bão.    



Những ngày qua do ảnh hưởng của cơn bão số 5, nhiều tỉnh thành miền Trung ngập trong nước bởi mưa lớn kéo dài. Quảng Ngãi là một trong số những tỉnh chịu ảnh hưởng nặng nề của thời tiết, cuộc sống của người dân bị đảo lộn. Những sinh hoạt đời thường đã khó khăn, thế nhưng với những gia đình có việc trọng đại như dám cưới thì quả thật là… méo mặt.



Ngày cưới đúng vào hôm mưa bão, cặp đôi vẫn quyết định tổ chức theo như dự định 
Mới đây trên mạng xã hội xuất hiện những hình ảnh ấn tượng về một đám cưới ở Quảng Ngãi đúng trong ngày mưa bão. Vẫn biết thời tiết không ủng hộ nhưng “ngày lành tháng tốt” đã được ấn định, thiệp hồng cũng đã trao đi, cả hai gia đình vẫn quyết định tổ chức ngày vui trăm năm cho cô dâu, chú rể đúng ngày dù hôm ấy bão to.



Đội thanh niên hỗ trợ chú rể đi ""siêu xe"" sang nhà gái đón dâu
Cả thành phố Quảng Ngãi chìm trong biển nước, trời thì mưa lớn… quan viên hai họ đi ăn cỗ cưới, mặc áo quần xúng xính nhưng ai cũng phải xắn quần, lội nước. Một số người lớn tuổi trong họ được con cháu “ưu tiên” ngồi thuyền thúng để đại diện đi đón đưa dâu.
Đặc biệt hơn cả, thay vì xe hoa sang chảnh, lộng lẫy thì chú rể được đội thanh niên hỗ trợ “đánh siêu xe” thuyền thúng sang đón dâu. Ngồi trên chiếc thuyền tròn, chòng chành, tay cầm ô che cho vợ, gương mặt của cả cô dâu và chú rể vẫn rạng ngời hạnh phúc.



Các vị ""bô lão"" xắn quần lội nước đi đám cưới
Nhìn những bức ảnh có thể thấy dù thời tiết xấu nhưng từ những người lớn tuổi đến đội thanh niên trai tráng tham dự đám cưới đều rất vui vẻ, gương mặt ai cũng nở nụ cười tươi rói. Đám cưới cũng nhận được sự quan tâm lớn của cộng đồng mạng. Tất cả đều gửi lời chúc mừng tới cặp đôi và cho rằng họ đã thực sự có một đám cưới đáng nhớ. Hi vọng rằng, vất vả, khó khăn lắm cả hai mới có thể về chung một nhà, họ sẽ hạnh phúc và gắn bó bên nhau dài lâu.



Đội bê lễ cũng phải vén cao quần, băng qua nước ngập 



Những cô gái đỡ lễ bên nhà gái cũng ướt sũng khi mặc áo dài thướt tha



Mặc dù đám cưới hơi vất vả khi vào hôm mua bão nhưng ai cũng vẻ, rộn ràng



Ưu tiên người già, đại diện cho hai họ đi đón dâu nên được ngồi ""xe sang"" thay vì lội nước


",vi,"











Married on a rainy day, the Quang Ngai groom welcomes the bride with a ""basket boat""
02 Nov 2019, 03:11 by Minh Khue (Collection)
The officials of the two families were wet like rats, cassava pants wading to go to the wedding, the bridegroom welcomed the bride by basket boat ... are impressive images of the Quang Ngai couple's wedding when the hundredth day of fun was right on the stormy day.



In the past few days, due to the impact of the storm No. 5, many central provinces were flooded with water due to prolonged heavy rain. Quang Ngai is one of the provinces heavily affected by the weather, people's lives are turned upside down. The daily life was difficult, but for families with big jobs like daring to get married, it was really ... distorted.



The wedding day was right on the stormy day, the couple decided to organize as planned
Recently on social networks appeared impressive images of a wedding in Quang Ngai right on the rainy day. Still knowing the weather was not in favor but the ""good day"" was set, the pink card was given, both families still decided to organize a hundred-day fun for the bride and groom on that day even on that day. heavy storm.



The youth team supports the groom to go ""super car"" to the bride's house to welcome the bride
The whole Quang Ngai city was submerged in water, it was raining heavily ... the two of them went to eat a wedding dress, dressed in clothes, but everyone had to roll up their pants and wade. Some of them are ""prioritized"" by their children and grandchildren sitting on basket baskets to take their representatives to take strawberries.
More specifically, instead of a luxurious and luxurious float, the groom is supported by the youth team to ""beat the super car"" with a basket boat to welcome the bride. Sitting on a round boat, standing, holding umbrellas for his wife, the face of both the bride and groom still radiant happiness.



The ""elders"" rolled up their pants to the wedding
Looking at the photos, we can see that although the weather is bad, from the elders to the young men to attend the wedding are very happy, everyone's faces are smiling brightly. The wedding also received great attention from the online community. They all congratulated the couple and said they really had a memorable wedding. Hopefully, it is very hard and hard for both of them to come to the same house, they will be happy and stick together for long.



Calf team must also lift high pants, cross the flooded water



The girls who supported the ceremony at the girl's house were also wet when wearing long dresses



Although the wedding was a bit hard on the day of buying storm, everyone seemed to be busy



Priority to the elderly, representing the two of them to go to the bride, should be ""car to ride"" instead of wading


"
