,src,lang,text
0,"











Tesla-Chef Musk verkündet seinen Abschied von Twitter
Nachdem ihm einige seiner Tweets ordentlich Ärger eingebracht haben, hat sich Tesla-Chef Elon Musk aus dem Kurzbotschaftendienst Twitter verabschiedet. Seinen mehr als 29 Millionen Abonnenten teilte er seine Entscheidung am Freitag in einer Reihe von Tweets mit.

02 Nov 2019, 03:25

Er sei sich nicht sicher, welchen Nutzen Twitter habe, schrieb der Unternehmer darin und fügte hinzu: ""Gehe offline.""
Daraufhin erhielt Musk tausende Tweets als Reaktionen, viele bedauerten seine künftige Twitter-Abstinenz. Womöglich wird Musk nun die Nachrichten- und Diskussionsplattform Reddit für seine Wortmeldungen nutzen. ""Reddit scheint immer noch gut zu sein"", schrieb er zumindest am Freitag.
Musk muss sich wegen der Beleidigung eines britischen Höhlenforschers via Twitter vor einem Gericht in Los Angeles verantworten. Der Kläger Vernon Unsworth war im Sommer 2018 an der weltweit Aufsehen erregenden Rettungsaktion einer thailändischen Jungen-Fussballmannschaft aus einer überschwemmten Höhle beteiligt.
Unsworth hatte ein von Musk angebotenes Mini-U-Boot zur Rettung der Fussballmannschaft abgelehnt und das Angebot als ""PR-Trick"" bezeichnet. Daraufhin twitterte Musk, der Brite sei ein ""Pädo-Typ"". Dieser Begriff sei während seiner Kindheit in Südafrika ein übliches Schimpfwort gewesen, rechtfertigte Musk gegenüber dem Gericht seine Wortwahl.
Auch mit der US-Börsenaufsicht SEC handelte sich Musk mit mehreren Tweets Ärger ein. Im August 2018 sorgte er etwa mit einem Tweet für Wirbel, in dem er darüber sinniert hatte, Tesla von der Börse zu nehmen. An den Aktienmärkten sorgte das für Trubel, die SEC warf Musk Irreführung der Aktionäre vor. Er musste als Tesla-Aufsichtsratschef zurücktreten und bekam Auflagen für seine Äusserungen in Online-Medien.
(SDA)
 


",de,"











Tesla boss Musk announces his departure from Twitter
After some of his tweets have brought nasty trouble, Tesla boss Elon Musk has left the short message service Twitter. He informed his more than 29 million subscribers of his decision on Friday in a series of tweets.

02 Nov 2019, 03:25

He was not sure what benefits Twitter has, the entrepreneur wrote in it, adding, ""Go offline.""
As a result, Musk received thousands of tweets as reactions, many regretting his future Twitter abstinence. Maybe Musk will now use the news and discussion platform Reddit for his speeches. ""Reddit still seems to be good,"" he wrote at least Friday.
Musk has to answer for the insult of a British speleologist via Twitter in a court in Los Angeles. The plaintiff Vernon Unsworth was involved in the summer of 2018 in the worldwide sensational rescue operation of a Thai boys football team from a flooded cave.
Unsworth had rejected a musk-offered mini-submarine to rescue the football team and called the offer a ""PR trick"". As a result, Musk tweeted that the Briton was a ""pedo type"". This term had been a common swear word during his childhood in South Africa, Musk justified his choice of words to the court.
Also with the US Securities and Exchange Commission, Musk entered with several tweets of trouble. In August 2018, he caused about a tweet for Vortex, in which he had thought about taking Tesla from the stock market. On the stock markets caused the commotion, the SEC accused Musk misdirection of shareholders. He had to resign as Tesla supervisory board chief and got editions for his statements in online media.
(SDA)



"
