,src,lang,text
0,"











Леванте матира Барселона с героичен обрат, спря серията им в Ла Лига
02 Nov 2019, 18:57 by Sportlive.bg
Барселона допусна изненадваща загуба в мач от 12-ия кръг на Ла Лига срещу Леванте. Каталунците отстъпиха с 1:3, след като водеха с 1:0 до 61-ата минута. Леванте, който има само 5 точки по-малко от шампионите през сезона дотук, показа уверена и вдъхновена игра, докато съперникът им бе плах и натрупа доста грешки в двубоя.
Това бе първата загуба на Меси и компания в последните 6 мача. Каталунците бяха в серия от 5 поредни победи в първенството. Все пак, тимът запази лидерската си позиция, но всичко може да се промени с изиграването на останалите двубои от кръга - преднината пред Реал Мадрид е само една точка. Леванте пък заема осмата позиция.
Още през първата част стана ясно, че Леванте ще създаде проблеми на Барселона. Въпреки това, каталунците поведоха в 38', след като Лионел Меси реализира дузпа, свирена за нарушение на Хорхе Мирамон срещу Семедо в наказателното поле. Малко преди края на полувремето капитанът на гостите можеше да удвои преднината им, след като остана сам срещу вратаря на крачка от вратата, но Абарискета се намеси, а после мирамон изчисти топката. Още преди почивката Валверде извърши принудителна смяна - Карлес Перес замени Луис Суарес, който изглежда има проблеми с глезена.



Леванте не се отказа да търси промяна в резултата и след почивката и го постигна в 61'. Тогава, след грешка на Жерар Пике, Хосе Кампаня получи чудесен пас от Моралес и, останал сам срещу Тер Щеген, прати топката в левия му ъгъл. Две минути по-късно Борха Майорал получи чудесен пас на свой ред и завъртя топката в левия ъгъл на германския страж на Барселона. Обратът беше факт. 
Минута по-късно домакините можеха да вкарат и трети гол на каталунците, но се размина. Това обаче се случи в 68', след статична ситуация - защитник на Барселона изби топката след центрирането, но тя попадна у Неманя Радоя, който стреля, а след рикошет в крака на Пике кълбото стана неспасяемо за Тер Щеген - 3:1.
В 74' Лео Меси намали изоставането на своя тим след впечатляваща акция. Той проби в наказателното поле, направи двойно подаване с Гризман, излъга двама бранители и стреля точно покрай вратаря. За съжаление на него и феновете на тима, намеса на ВАР показа, че Гризман е бил в засада и попадението беше отменено. В края (92') влезлият като резерва Ансу Фати можеше да върне поне един гол, но отблизо прати топката в ръцете на Айтор. В последните секунди пък с пропуск за Леванте се отчете Гонсало Мелеро. 
Малко преди края на полувремето капитанът на гостите можеше да удвои преднината им, след като остана сам срещу вратаря на крачка от вратата, но Абарискета се намеси, а после мирамон изчисти топката. Още преди почивката Валверде извърши принудителна смяна - Карлес Перес замени Луис Суарес, който изглежда има проблеми с глезена.Леванте не се отказа да търси промяна в резултата и след почивката и го постигна в 61'. Тогава, след грешка на Жерар Пике, Хосе Кампаня получи чудесен пас от Моралес и, останал сам срещу Тер Щеген, прати топката в левия му ъгъл. Две минути по-късно Борха Майорал получи чудесен пас на свой ред и завъртя топката в левия ъгъл на германския страж на Барселона. Обратът беше факт. Минута по-късно домакините можеха да вкарат и трети гол на каталунците, но се размина. Това обаче се случи в 68', след статична ситуация - защитник на Барселона изби топката след центрирането, но тя попадна у Неманя Радоя, който стреля, а след рикошет в крака на Пике кълбото стана неспасяемо за Тер Щеген - 3:1.В 74' Лео Меси намали изоставането на своя тим след впечатляваща акция. Той проби в наказателното поле, направи двойно подаване с Гризман, излъга двама бранители и стреля точно покрай вратаря. За съжаление на него и феновете на тима, намеса на ВАР показа, че Гризман е бил в засада и попадението беше отменено.




Още по темата








",bg,"











Levante matched Barcelona with a heroic twist, stopping their series in La Liga
02 Nov 2019, 18:57 by Sportlive.bg
Barcelona suffered a surprising loss in the 12th round of La Liga against Levante. The Catalans retreated 1: 3 after leading 1: 0 to the 61st minute. Levante, who is only 5 points less than the champions during the season so far, showed confident and inspired play, while their opponent was timid and accumulated a lot of mistakes in the match.
This was Messi's and company's first loss in the last 6 games. The Catalans were in a series of 5 consecutive championship wins. Still, the team retains its leadership position, but that can change with the rest of the rounds being played - Real Madrid's lead is just one point. Levante ranks eighth.
Already in the first part it became clear that Levante would create problems for Barcelona. However, the Catalans led in the 38 'after Lionel Messi executed a penalty shot for a foul by Jorge Miramon against Semedo in the penalty area. Shortly before halftime, the visitors' captain could double their lead after being left alone against the goalkeeper a few steps from the goal, but Abarisketa intervened and then cleared the ball with a mimicry. Even before the break Valverde made a forced change - Carles Perez replaced Luis Suarez, who seems to have ankle problems.



Levante did not give up looking for a change in the score after the break and scored it at 61 '. Then, after a mistake by Gerard Pique, Jose Campania received a wonderful pass from Morales and, left alone against Ter Shtegen, sent the ball into his left corner. Two minutes later Borja Majoral received a fine pass in his turn and turned the ball into the left corner of the German guard of Barcelona. The twist was a fact.
A minute later, the hosts could score a third goal for the Catalans, but it went away. However, this happened in 68 ', after a static situation - Barcelona defender beat the ball after centering, but it fell to Nemanja Radoya who fired, and after a rebound at the feet of Pique the ball became unbeaten for Ter Shtegen - 3: 1.
At 74 'Leo Messi reduced his team backlog after an impressive run. He broke into the penalty area, made a double pass with Grizman, lied to two defenders and fired right past the goalkeeper. Unfortunately for him and the fans of the team, the VAR intervention showed that Grizman was ambushed and the hit was canceled. At the end (92 '), back-to-back Ansu Fati could return at least one goal, but he sent the ball closely into Aitor's hands. In the final seconds, however, with a pass for Levante reported Gonzalo Melero.
Shortly before halftime, the guest captain could have doubled their lead after being left alone against the goalkeeper a few steps from the goal, but Abarisketa intervened and then cleared the ball with a miraemon. Even before the break Valverde made a forced change - Carles Perez replaced Luis Suarez, who appeared to have ankle problems. Levante did not refuse to seek a change in the score after the break and reached it at 61 '. Then, after a mistake by Gerard Pique, Jose Campania received a wonderful pass from Morales and, left alone against Ter Shtegen, sent the ball into his left corner. Two minutes later Borja Majoral received a fine pass in his turn and turned the ball into the left corner of the German guard of Barcelona. The twist was a fact. A minute later, the hosts could score a third goal for the Catalans, but it went away. However, this happened at 68 ', after a static situation - Barcelona defender beat the ball after centering, but it fell to Nemanya Radoya, who fired, and after a ricochet at the feet of Pique the ball became unbeatable for Ter Shtegen - 3: 1.V 74 'Leo Messi reduced his team backlog after an impressive run. He broke into the penalty area, made a double pass with Grizman, lied to two defenders and fired right past the goalkeeper. Unfortunately for him and the fans of the team, the VAR intervention showed that Grizman was ambushed and the hit was canceled.




More on the topic








"
