,src,lang,text
0,"











Bundesliga-Ticker
Eintracht Frankfurt gegen Bayern München: SGE gewinnt 5:1
02 Nov 2019, 18:02 by Christian St&ouml;r

Eintracht Frankfurt bezwingt Rekordmeister Bayern München mit 5:1. Der Live-Ticker zum Nachlesen.

Eintracht Frankfurt - FC Bayern München 5:1 (2:1)


AufstellungEintracht Frankfurt
Rönnow - Abraham, Ndicka, Hinteregger - da Costa, Kostic - Fernandes (80. Silva), Rode (71. Gacinovic), Sow - Paciencia, Dost (64. Kamada)


Aufstellung Bayern München
Neuer - Kimmich, Pavard, Boateng, Alaba - Thiago - Gnabry (69. Goretzka), Thomas Müller (64. Martinez),  Coutinho (57. Coman), Davies - Lewandowski


Tore
1:0 (25.) Kostic, 2:0 (33.) Sow, 2:1 (37.) Lewandowski, 3:1 (49.) Abraham, 4:1 (61.) Hinteregger, 5:1 (85.) Paciencia


Rote Karte
- / Boateng (10.)


Schiedsrichter
Markus Schmidt




>>>Ticker aktualisieren<<<


Die letzten 16 Bundesligaspiele hat die Eintracht nicht mehr gegen die Bayern gewinnen können. Doch mit dem spektakulären 5:1 ist diese Serie nun zu Ende gegangen. Der frühe Platzverweis machte der Eintracht das Leben leichter, nach dem 3:1 von Abraham kurz nach der Pause war die Partie entschieden.

Abpfiff

90. Minute: Wie viel Nachspielzeit wird es geben? Antwort: Gar keine, Schiri Schmidt pfeift ab.
90. Minute: Noch einmal versuchen es die Bayern, Lewandowski setzt nach Goretzkas Flanke zum Kopfball an, doch wieder Abraham im Weg.
87. Minute: Kamada sieht nach einem Foul an Davies die Gelbe Karte.
86. Minute: Und nun zieht da Costa ab, doch neuer ist zur Stelle und pariert.
85. Minute: TOOOOR für die Eintracht. Ein portugiesisches Tor sozusagen. Silva bedient Paciencia, der aus zwei Metern vollendet. Es steht 5:1.
83. Minute: Es geht jetzt ruhiger zur Sache. Die Bayern haben sich wohl mit der Niederlage abgefunden.
80. Minute: Adi Hütter wechselt zum dritten Mal. Silva kommt für Fernandes.
75. Minute: Die Bayern haben immer noch mehr Ballbesitz, doch die Torschussbilanz fällt eindeutig aus: 15:5 für die Eintracht.
72. Minute: Foul von Kimmich, der dafür die Gelbe Karte sieht.
71. Minute: Die Eintracht wechselt erneut. Gacinovic ersetzt Rode.
70. Minute: Pfosten. Davies zieht aus kurzer Distanz ab, trifft aber nur den linken Außenpfosten. 
69. Minute: Dritter Wechsel bein den Bayern. Goretzka kommt für Gnabry.
68. Minute:Kostic nimmt an der Strafraumgrenze einen Pass auf und zieht ab, doch Neuer lenkt den Ball mit einer Hand zur Seite.
64. Minute: Nun wechselt auch Adi Hütter. Dost geht runter, für ihn kommt Kamada.
64. Minute: Zweiter Wechsel bei den Bayern. Martinez kommt für Müller.
63. Minute: Und wieder die Eintracht. Kostic setzt sich gegen Alaba durch, zieht dann mit rechts ab, neuer kommt ans Leder und verlangsamt den Ball, den Davies schließlich vor der Linie raushaut.
61. Minute: TOOOOR für die Eintracht. Ecke für die SGE, Kostic schlägt den Ball an den Fünfer, wo Hinteregger vor Pavard am Ball ist und ins linke Eck einköpft. Es steht 4:1.
60. Minute: Dost schließt aus elf Metern, Neuer pariert, es gibt Ecke.
59. Minute: Immer wieder Abraham in der Eintracht-Abwehr. Kimmich steckt für Gnabry durch, der auf Lewandowski querlegen will - aber Abraham geht dazwischen und spitzelt das Leder weg. Der Treffer hätte wegen Abseitsstellung Gnabrys wohl nicht gezählt.
58. Minute: Chance für die Bayern. Ndicka verliert den Ball am eigenen Strafraum, Gnabry kommt ran, lupft über Rönnow an den zweiten Pfosten - aber auch über Lewandowski und Müller.
57. Minute: Auswechslung bei den Bayern: Coman kommt für Coutinho.
56. Minute: Chance für die Eintracht. Dost legt ab auf Paciencia, doch Alaba behindert den Portugiesen, der ball geht übers Tor.
52. Minute: Die Bayern geben nicht auf. Lewandowski flankt den Ball in den Strafraum, doch wieder steht Abraham richtig und schlägt den Ball weg.
51. Minute: Gelbe Karte. Aber nicht für einen Spieler, der auf dem Feld steht, sondern für einen, der draußen sitzt. Bayerns Ersatztorhüter Ulreich hat sich wohl lautstark beschwert.
50. Minute: Beinahe der Anschluss, doch Torschütze Abraham wirft sich beim Rechtsschuss von Lewandowski in den Weg und verhindert so einen Treffer. 
49. Minute: TOOOOR für die Eintracht. David Abraham erhöht auf 3:1. Dost spielt zu da Costa, der von rechts in den Strafraum auf Abraham flankt, der den Ball aus zwei Metern am zweiten Pfosten über die Linie drückt.
46. Minute: und weiter geht’s. Die Mannschaften sind unverändert aus der Kabine gekommen, auf Wechsel haben die Trainer bisher verzichtet.
Eine turbulente erste Hälfte ist zu Ende. Nach der frühen Roten Karte für Boateng nutzt die Eintracht ihr Überzahlspiel zu zwei Toren, doch Lewandowski macht es mit dem Anschlusstreffer noch einmal spannend. Die SGE hatte mehr Abschlüsse (9:3), trotz Überzahl aber weniger Ballbesitz (37 %). 

Halbzeit

45. Minute: Zwei Minuten werden nachgespielt.
42. Minute: Im Augenblick haben die Bayern wieder viel Ballbesitz, die eintracht lässt defensiv aber nichts zu.
37. Minute: Jetzt aber ist es doch passiert. Und wer war’s? Natürlich Robert Lewandowski. Davies passt auf Lewandowski, der sich alleine vier Eintrachtlern gegenübersieht. Doch der Polen tanzt erst Hinteregger und Abraham aus, ehe er aus sieben Metern an Rönnow vorbei ins rechte Ecke einschießt. Es steht nur noch 2:1. Und eine Serie geht auf jeden Fall weiter (siehe 15.05 Uhr): Lewandowski trifft auch im zehnten Bundesligaspiel hintereinander.
36. Minute: Jetzt zappelt der Ball im Eintracht-Netz, doch das Tor zählt nicht, Kimmich stand im Abseits.
33. Minute: TOOOOR für die Eintracht. Sow erhöht auf 2:0. Paciencia und Rode bereiten für Kostic vor, der mit links abzieht. Kimmich fälscht ab - direkt auf Sow, der aus sieben Metern volley ins kurze Eck schießt.
28. Minute: Coutinho spielt zu Kimmich, doch sein Schuss ist kein Problem für Rönnow.


Filip Kostic freut sich über das 1:0.© AFP

25. Minute: TOOOR für die Eintracht, Kostic trifft zum 1:0. Dost schickt da Costa, der für Sow ablegt. Alaba blockt den Ball nach halblinks ab - wo schon Kostic völlig frei steht und die Kugel an Neuer vorbei ins lange Eck schiebt. Sein erstes Bundesligator in dieser Saison.
20. Minute: München ist zwar in Unterzahl, hat derzeit aber immer noch mehr Ballbesitz (57 %). Mehr Torabschlüsse hat aber die Eintracht (5:2) 
15. Minute: Schuss von Davies, doch Rönnow ist zur Stelle.
14. Minute: Die Bayern sortieren sich neu. Pavard übernimmt die Innenverteidigerposition von Boateng, Kimmich spielt jetzt hinten rechts.
10. Minute: Paciencia tritt zum Freistoß an, doch der Ball bleibt zunächst in der Mauer hängen. Der Nachschuss wird aber richtig gefährlich. Neuer ist aber zur Stelle, es bleibt beim 0:0
9. Minute: Wo war das Foul, im Strafraum oder doch davor? Der Videobeweis muss her. Und tatsächlich: Das Foul war knapp vorm Sechzehner, es gibt also nur Freistoß. Das war die gute Nachricht für die Bayern. Die schlechte: Boateng sieht wegen einer Notbremse die Rote Karte. 
8. Minute: Foulelfmeter für die Eintracht. Die Eintracht fährt einen starken Konter. Boateng muss hinter Paciencia her, dern den Portugiesen an der Strafraumgrenze foult. Schiri Schmidt zeigt auf den Punkt und Gelb für Jerome Boateng. 
6. Minute: Per Hacke leitet Kostic den Ball weiter zu Paciencia, dessen Hereingabe Neuer zum Handeln zwingt. Der Torwart lenkt den Ball vor Dost ab.
4. Minute: Nun aber die Eintracht. Martin Hinteregger legt vor auf Kostic, der den Ball knapp am rechten Pfosten vorbeischießt.
2. Minute: Und wieder die Bayern. Gnabry zieht von halbrechts aus acht Metern ab. Der Ball geht aber am langen Eck vorbei.
2 . Minute: Und die Bayern machen gleich mal viel Druck. Lewandowski kommt über links, leitet weiter zu Gnabry, dessen Pass auf Müller aber hängenbleibt.
1. Minute: Die Bayern warten auf den Anstoß. und los geht’s, Schiedsrichter Markus Schmidt gibt das Spiel frei.

Anpfiff

15.28 Uhr: Das Stadion ist proppenvoll, die Stimmung ist mal wieder überragend.
15.25 Uhr: In 96 Bundesligaspielen verließen die Münchner 53 Mal den Platz als Sieger, 21 Partien gewann die Eintracht. Zeit also für die SGE, die Bilanz ein wenig aufzuhübschen.
15.15 Uhr: Auch eine andere Serie würde die Eintracht nur allzu gerne beenden. Die SGE hat nämlich die letzten 16 Bundesligaspiele gegen die Münchner nicht gewinnen können. Einen Erfolg gab es dafür im Mai 2018 - im Pokalendspiel.
15.05 Uhr: Robert Lewandowski trifft und trifft und trifft. Als erster Spieler in der Geschichte der Fußball-Bundesliga war der polnische Nationalspieler in den ersten neun Spielen mindestens einmal erfolgreich. Heute wird die SGE alles daran setzen, dieser Serie ein Ende zu bereiten.
14.35 Uhr: Die Aufstellungen sind da. Makoto Hasebe bleibt erst mal auf der Bank, für ihn steht Evan Ndicka in der Anfangsformation. Das Angriffsduo bilden Goncalo Paciencia und Bas Dost. Filip Kostic ist nach seinen Knieproblemen wieder mit von der Partie. 
Bei den Bayern steht Thomas Müller in der Startelf. Der Jubilar absolviert in Frankfurt sein 500. Pflichtspiel für den Rekordmeister.



14.30 Uhr: Gegen Bayern München wird erneut Frederik Rönnow im Kasten stehen. Die Nummer drei im Tor ist Jan Zimmermann, genannt Zimbo. Der 34-Jährige ist der gute Geist der Eintracht, ein Menschenfreund, der hilft, wo er kann. Rönnow bezeichnet Zimmermann als guten Freund, mit dem man Pferde stehlen kann. Zusammen mit Sebastian Rode spielen sie auch leidenschaftlich gerne Skat. In unserem Interview äußert sich Zimmermann nun über seine Rolle als Integrationshelfer, sein Leben als stolzer Papa und handyfreie Zeiten.
Eintracht Frankfurt: Mehr Zeit für An- und Abreise einplanen
14.15 Uhr: Die Fans von Eintracht Frankfurt sind ja bekanntermaßen die besten der Liga, wenn nicht gar die besten der Welt. Das wollen sie auch gegen den FC Bayern München beweisen. Nach dem Spiel könnte die Heimfahrt dann durchaus ein bisschen länger dauern, egal wie es ausgehen wird. Grund sind die Arbeiten an der Anbindung der neuen S-Bahn-Station „Gateway Gardens“. Deshalb werden Züge ab dem Bahnhof Frankfurt-Stadion ausschließlich in Richtung Frankfurt City abfahren. Fahrgäste, die in Richtung Flughafen, Mainz, Wiesbaden oder Riedstadt-Goddelau wollen, müssen ab Frankfurt Stadion eine Station bis Niederrad oder bis zum Frankfurter Hauptbahnhof fahren und dort umsteigen.
Spieltag, 13.00 Uhr: Was kann Eintracht Frankfurt heute gegen den Rekordmeister Bayern München erreichen? Immerhin gingen die letzten Spiele gegen die Bayern unter der Ägide von Adi Hütter allesamt deutlich verloren: 0:5, 0:3, 1:5. Doch die SGE will unbedingt ihren Nimbus als bisher heimstärkste Mannschaft der Liga wahren (drei Siege, zwei Unentschieden). Anderseits kommen die Bayern ebenfalls mit einer Serie ins Waldstadion: Sie sind auswärts seit mittlerweile seit zehn Bundesligaspielen ungeschlagen. Trotzdem fühlt sich die Eintracht gewappnet für das Duell gegen die angeschlagenen Bayern, für die nun zwei Wochen der wahrheit beginnen.*
Vorbericht: Eintracht Frankfurt trifft auf den FC Bayern München
Eintracht Frankfurt und die „englischen Wochen“. Nach der Partie im Pokal am Mittwoch (Eintracht Frankfurt gewann beim FC St. Pauli) steht die nächste schwere Begegnung für die Mannschaft von Adi Hütter auf dem Programm. Am Samstag ist die Mannschaft von Ex-Trainer Niko Kovac zu Gast im Waldstadion. Volle Hütte garantiert. 
Eintracht Frankfurt: Gegner Bayern München mit Problemen
Nach dem eher mühsamen Pokalerfolg beim VfL Bochum gerät Trainer Niko Kovac zunehmend in die Kritik. Die Ergebnisse mögen beim Rekordmeister zwar stimmen, aber wie die Erfolge zustande kommen gefällt längst nicht jedem. Von der Dominanz der vergangenen Jahren ist bei den Bayer zur Zeit wenig zu spüren. Niko Kovac versucht die Erwartungen zu dämpfen: „Der Anspruch ist: Wir wollen und müssen gewinnen. Aber natürlich wollen wir den Fans auch schönen Fußball bieten und das machen wir im Moment nicht. Aber mir ist lieber, wir brillieren nicht und gewinnen. Fußball ist ein Sport, der ergebnisorientiert abläuft - wenn du gewinnst, ist es besser, als wenn du verlierst. Wir müssen durch sicheres Spiel Selbstvertrauen bekommen. Wir müssen von Beginn an im Spiel Positiverlebnisse schaffen. Wenn die Angst in den Knochen steckt, wird es schwierig. Annahme, Mitnahme - es muss alles funktionieren. Keine Zaubersachen. Die Einfachheit ist das schwierige. Wenn wir es einfach halten, werden wir erfolgreich sein.“


Einst im Mai: Eintracht Frankfurt gewinnt den DFB-Pokal - gegen Bayern München.© Peter Kneffel/dpa

Der ehemalige Trainer der Eintracht, der mit seinem alten Verein die Bayern im Pokalfinale 2018 besiegen konnte, freut sich aber auf die Partie an alter Wirkungsstätte. „Ich freue mich auf das Spiel, es wird intensiv. Wir müssen ein anderes Gesicht zeigen, da wird schon von Beginn an die Post abgehen“, sagte Kovac. 
Eintracht Frankfurt: Niederlage im letzten Bundesligaspiel gegen Mönchengladbach
Eintracht Frankfurt verlor seine letzte Bundesliga-Partie bei Borussia Mönchengladbach mit 2:4. Dabei zeigte die SGE in der ersten Hälfte eine schwache Leistung. In Halbzeit zwei versuchte das Team von Adi Hütter den Spieß noch umzudrehen, die Gastgeber waren aber zu effektiv.
Eintracht im Pokal gegen den FC St. Pauli: Die Spieler von Eintracht Frankfurt in der Einzelkritik
Vermisst werden bei der Eintracht vor allem die beiden Stürmer Bas Dost und Andre Silva, die auch in Mönchengladbach verletzt fehlten. Ob es für eine Einsatz im DFB-Pokal reicht, wird sich wohl erst kurzfristig entscheiden. Dost leidet an Problemen an den Adduktoren, Andre Silva plagt sich mit Schmerzen an der Achillessehne herum.
Wenn Sie den Ticker aus FCB-Sicht lesen wollen, empfehlen wir Ihnen den Ticker unserer Kolleginnen und Kollegen der TZ aus München. 

*fr.de ist Teil des bundesweiten Ippen-Digital-Redaktionsnetzwerks.



",de,"











Bundesliga Scores
Eintracht Frankfurt vs. Bayern Munich: SGE wins 5: 1
02 Nov 2019, 18:02 by Christian Stouml; r

Eintracht Frankfurt defeats record champions Bayern Munich 5: 1. The live ticker to read.

Eintracht Frankfurt - Bayern Munich 5: 1 (2: 1)


Line-up Frankfurt
Ronnow - Abraham, Ndicka, Hinteregger - da Costa, Kostic - Fernandes (80th Silva), Rode (71st Gacinovic), Sow - Paciencia, Dost (64th Kamada)


Lineup Bayern Munich
New - Kimmich, Pavard, Boateng, Alaba - Thiago - Gnabry (69th Goretzka), Thomas Muller (64th Martinez), Coutinho (57th Coman), Davies - Lewandowski


Gates
1: 0 (25.) Kostic, 2: 0 (33.) Sow, 2: 1 (37.) Lewandowski, 3: 1 (49.) Abraham, 4: 1 (61.) Hinteregger, 5: 1 (85 .) Paciencia


Red card
- / Boateng (10.)


referee
Markus Schmidt




>>> Update Ticker <<<


The last 16 Bundesliga games Eintracht has not won against Bayern. But with the spectacular 5: 1 this series has now come to an end. The early dismissal made Eintracht life easier, after the 3-1 from Abraham shortly after the break, the game was decided.

final whistle

90th Minute: How much stoppage time will there be? Answer: Not at all, referee Schmidt whistles.
90th Minute: try again Bayern, Lewandowski is after Goretzka flank to the header, but again Abraham in the way.
87 minutes: Kamada sees a yellow card after a foul on Davies.
86 minutes: And now pulls Costa off, but newer is on the spot and parried.
85 minutes: GOOO for the concord. A Portuguese goal, so to speak. Silva serves Paciencia, who completes from two meters. It is 5: 1.
83 minutes: It is now quieter to the point. The Bavarians have probably come to terms with the defeat.
80 minutes: Adi Hütter changes for the third time. Silva comes for Fernandes.
Minute: The Bayern still have more possession, but the scoring record is clear: 15: 5 for Eintracht.
72 minutes: Foul from Kimmich, who sees the yellow card.
71 minutes: The harmony changes again. Gacinovic replaces Rode.
70th Minute: post. Davies pulls from close range, but hits only the left outer post.
69th Minute: Third change leg Bayern. Goretzka comes for Gnabry.
68th Minute: Kostic takes on the penalty area a pass on and pulls off, but Neuer steers the ball with one hand to the side.
64th Minute: Now also changes Adi Hütter. Dost goes down, Kamada comes for him.
64th Minute: Second change at Bayern. Martinez comes for Müller.
63rd Minute: And again the Eintracht. Kostic prevails against Alaba, then pulls off to the right, new comes to the leather and slows the ball, the Davies finally raushaut before the line.
61 minutes: TOOOOR for Eintracht. Corner for the SGE, Kostic hits the ball to the fiver, where Hinteregger in front of Pavard is on the ball and heads into the left corner. It is 4: 1.
60th Minute: Dost closes from eleven meters, Neuer parried, there are corner.
59th Minute: Abraham in Eintracht defense again and again. Kimmich gets through for Gnabry, who wants to cross over to Lewandowski - but Abraham intervenes and spits the leather away. The goal would have probably not counted because offside Gnabrys.
58 minutes: chance for Bayern. Ndicka loses the ball on his own penalty area, Gnabry approaches, lobsing over Rönnow at the second post - but also over Lewandowski and Müller.
57 minutes: Replacement at the Bayern: Coman comes for Coutinho.
56 minutes: chance for Eintracht. Dost bet on Paciencia, but Alaba obstructs the Portuguese, the ball goes over the gate.
52nd Minute: Bayern will not give up. Lewandowski crosses the ball into the box, but again Abraham is right and hits the ball away.
51 minutes: Yellow card. But not for a player standing in the field, but for someone sitting outside. Bayern replacement goalkeeper Ulreich has probably complained loudly.
50th Minute: Almost the connection, but scorer Abraham throws himself in the right shot by Lewandowski in the way and prevents a hit.
49 minutes: GOOO for the concord. David Abraham raises to 3: 1. Dost plays as da Costa crosses the ball from the right onto Abraham, who hits the ball from two yards out at the second post.
46th Minute: and on it goes. The teams have come out unchanged from the cabin, the coach have waived change so far.
A turbulent first half is over. After the early red card for Boateng the Eintracht uses their overpayment game to two goals, but Lewandowski makes it with the connecting hit once again exciting. The SBU had more qualifications (9: 3), despite superior but less possession (37%).

half

45th Minute: Two minutes are replayed.
42 minutes: At the moment, the Bayern have a lot of possession again, the Eintracht leaves defensive but nothing to.
37 minutes: But now it happened. And who was it? Of course Robert Lewandowski. Davies fits Lewandowski, who faces four Eintrachtlern alone. But the Pole first dances out Hinteregger and Abraham, before he shoots past Rönnow from seven meters into the right corner. It is only 2: 1. And a series goes on in any case (see 15:05 clock): Lewandowski also meets in the tenth Bundesliga game in a row.
36 minutes: Now the ball wriggles in Eintracht net, but the goal does not count, Kimmich was offside.
33 minutes: TOOOOR for Eintracht. Sow increased to 2: 0. Paciencia and Rode prepare for Kostic pulling off left. Kimmich fakes off - directly on Sow, who volley from seven yards into the near corner.
28 minutes: Coutinho plays to Kimmich, but his shot is no problem for Rönnow.


Filip Kostic is happy about the 1: 0 © AFP

25th Minute: TOOOR for Eintracht, Kostic meets to 1: 0. Dost sends da Costa, who drops for Sow. Alaba blocks the ball after half left - where Kostic is completely free and pushes the ball past Neuer into the far corner. His first Bundesliga goal this season.
20th Minute: Munich is outnumbered, but currently still has more possession (57%). More goals but has the Eintracht (5: 2)
15 minutes: Shot by Davies, but Rönnow is on the spot.
14th Minute: The Bavarians are sorting themselves new. Pavard takes on the center-back position of Boateng, Kimmich is now playing in the back right.
10th Minute: Paciencia enters the free-kick, but the ball initially remains in the wall. The extra margin is really dangerous. New is on the spot, it remains at 0: 0
9 minutes: Where was the foul, in the penalty area or before? The video evidence must be forth. And indeed: The foul was just in front of the sixteenth, so there is only free kick. That was the good news for Bayern. The bad: Boateng sees the red card because of an emergency brake.
8 minutes: penalty kick for Eintracht. Eintracht drives a strong counterattack. Boateng must be behind Paciencia, who fouls the Portuguese at the edge of the box. Referee Schmidt points to the point and yellow for Jerome Boateng.
6th Minute: Per Hack leads Kostic the ball further to Paciencia, whose cross New begs to trade. The goalkeeper deflects the ball from Dost.
4th Minute: But now the Eintracht. Martin Hinteregger puts forward Kostic, who misses the ball just past the right post.
2nd Minute: And again the Bayern. Gnabry pulls from half right off eight meters. But the ball passes the long corner.
2. Minute: And Bayern make a lot of pressure. Lewandowski crosses the left and heads to Gnabry, whose pass gets stuck on Müller.
1 minute: Bayern are waiting for the impulse. Let's go, referee Markus Schmidt releases the game.

kick-off

15:28: The stadium is jam-packed, the mood is once again outstanding.
15:25: In 96 Bundesliga games left the Munich 53 times the place as the winner, 21 games won the Eintracht. So it's time for the SBU to lift the balance a little bit.
15:15: Another series would like to finish the Eintracht only too happy. The SGE did not win the last 16 Bundesliga games against Munich. There was a success in May 2018 - in the Cup final.
15:05: Robert Lewandowski meets and meets and hits. As the first player in the history of the Bundesliga, the Polish international was at least once successful in the first nine games. Today, the SGE will do its utmost to put an end to this series.
14:35: The lists are there. Makoto Hasebe stays on the bench for the first time, for him Evan Ndicka is in the starting lineup. The attacking duo are Goncalo Paciencia and Bas Dost. Filip Kostic is back after his knee problems.
At Bayern Thomas Müller is in the starting eleven. The jubilee completed his 500th competitive match in Frankfurt for the record champions.



14.30 clock: Against Bayern Munich again Frederik Rönnow will be in the box. Number three in goal is Jan Zimmermann, called Zimbo. The 34-year-old is the good spirit of Eintracht, a philanthropist who helps wherever he can. Rönnow calls Zimmermann a good friend, with whom you can steal horses. Together with Sebastian Rode they also love to play skat. In our interview, Zimmermann now expresses his role as an integration worker, his life as a proud dad and mobile-free times.
Eintracht Frankfurt: Allow more time for arrival and departure
14:15: The fans of Eintracht Frankfurt are known to be the best in the league, if not the best in the world. They want to prove that against Bayern Munich. After the game, the trip home could take a bit longer, no matter how it goes. The reason for this is the work on the connection to the new S-Bahn station ""Gateway Gardens"". Therefore, trains from Frankfurt-SDeparture exclusively in the direction of Frankfurt City. Passengers who want to go in the direction of the airport, Mainz, Wiesbaden or Riedstadt-Goddelau have to travel from Frankfurt Stadion to Niederrad or to Frankfurt Central Station and change there.
Matchday, 13.00 clock: What can Eintracht Frankfurt against the record champions Bayern Munich today? After all, the last games against Bayern under the aegis of Adi Hütter were all lost significantly: 0: 5, 0: 3, 1: 5. But the SGE is keen to maintain its nimbus as the team's home-strongest side (three wins, two draws). On the other hand, the Bavarians also come with a series to the Waldstadion: They are unbeaten away since now for ten Bundesliga games. Nevertheless, the Eintracht feels prepared for the duel against the ailing Bayern, for which now begins two weeks of truth.
Preliminary report: Eintracht Frankfurt meets Bayern Munich
Eintracht Frankfurt and the ""English weeks"". After the match in the cup on Wednesday (Eintracht Frankfurt won at FC St. Pauli) is the next difficult encounter for the team of Adi Hütter on the program. On Saturday, the team of former coach Niko Kovac is a guest at the Waldstadion. Full cottage guaranteed.
Eintracht Frankfurt: opponents Bayern Munich with problems
After the rather tedious cup victory at VfL Bochum coach Niko Kovac gets increasingly criticized. The results may be true for the record champions, but the successes do not appeal to everyone. The dominance of the past few years is currently barely noticeable at Bayer. Niko Kovac tries to dampen expectations: ""The claim is: we want and we have to win. But of course we also want to offer the fans beautiful football and we are not doing that right now. But I prefer, we do not shine and win. Football is a sport that is result-oriented - if you win, it's better than losing. We have to get confident by playing safely. We have to create positive experiences from the beginning in the game. When the fear is in the bones, it becomes difficult. Assumption, capture - everything has to work. No magic things. The simplicity is the difficult one. If we keep it simple, we will be successful. ""


Once in May: Eintracht Frankfurt wins the DFB Cup - against Bayern Munich © Peter Kneffel / dpa

The former coach of Eintracht, who could defeat Bayern in the Cup final 2018 with his old club, but is looking forward to the game at the old site. ""I'm looking forward to the game, it's going to be intense. We have to show a different face, there will go from the beginning of the post office, ""said Kovac.
Eintracht Frankfurt: Defeat in the last Bundesliga match against Mönchengladbach
Eintracht Frankfurt lost its last Bundesliga game at Borussia Mönchengladbach with 2: 4. The SGE showed a weak performance in the first half. In halftime two Adi Hütter's team tried to turn the tables, but the hosts were too effective.
Eintracht in the Cup against FC St. Pauli: The players of Eintracht Frankfurt in the individual review
Missing in the Eintracht especially the two striker Bas Dost and Andre Silva, who were missing in Mönchengladbach injured. Whether it will be enough for an assignment in the DFB Cup, will probably decide at short notice. Dost suffers from problems with the adductor, Andre Silva is struggling with pain on the Achilles tendon.
If you want to read the ticker from FCB point of view, we recommend you the ticker of our colleagues of the TZ from Munich.

* fr.de is part of the nationwide Ippen digital editorial network.



"
