,src,lang,text
0,"











Desafíos para la articulación solidaria entre los pueblos: Segunda jornada antimperialista en La Habana (+Fotos y Video)
02 Nov 2019, 18:19 by Thalía Fuentes Puebla
La segunda jornada del Encuentro Antimperialista de Solidaridad, por la Democracia y contra el Neoliberalismo inició este sábado en La Habana con el panel “Desafíos para una articulación solidaria de nuestras luchas”.
Cientos de voces se unen en el Palacio de Convenciones para exigir la liberación de Lula, apoyar a Cuba, a Venezuela y las causas justas y denunciar los intentos del imperio de amedrentar a los pueblos más débiles.  
Ismael Drullet, del Capítulo Cubano de los Movimientos Sociales, habló de los cambios recientes en América Latina, principalmente en el escenario político de la región y la vuelta a la izquierda, que influirá positivamente desde el punto de vista  económico y social .  
“Es imprescindible la solidaridad con las luchas, crecer en este sentido sentará las bases para una nueva sociedad. Es clave compartir y unificar la estrategia y articular las ideas con el mismo objetivo (...) Hay que fortalecer la unidad, principalmente entre movimientos sociales y partidos políticos, para enfrentar al imperialismo y al capitalismo”, aseguró.  


Segunda Jornada Encuentro Antimperialista. Foto: Marcelino Vázquez/ACN.

El también secretario de Relaciones Internacionales de la Central de Trabajadores de Cuba dijo: “Para Fidel, unidad significa compartir el combate, ideas, estrategias, objetivos a los que se llega mediante debates y análisis.
“Cuba ofrece su permanente disposición en crear condiciones favorables para la articulación regional e internacional y lograr, entre todos, un mundo mejor, que es posible”.
Drullet enfatizó en que somos parte de un pueblo que nunca ha dejado de luchar y de abrir horizontes, desde que el capitalismo tocó nuestras puertas.
Monica Valente, de la Secretaría Ejecutiva del Foro de Sao Paulo, tomó la palabra para reiterar la necesidad de unir fuerzas en contra de la hegemonía de los Estados Unidos. Agradeció además al pueblo cubano por el ejemplo que representan para todo el continente y el mundo.  



Por la Asamblea Internacional de los Pueblos, intervino el argentino Manuel Bertoldi quien destacó las fuertes movilizaciones en Chile, Haití, el Líbano y Cataluña, que enfrentan a los modelos neoliberales, porque estos no  representan a las mayorías populares. 
“Los cambios dependen de la dinámica que utilicemos en la lucha de clases y de crear programas de transición que representen a las masas populares”.   
Bertoldi insistió en la necesidad  de consolidar estrategias en la política cultural para romper con los esquemas de consumismo. “Hay que fortalecer el trabajo en las bases, principalmente para acabar con el patriarcado y luchar por los derechos de las mujeres”.  



Habló también de que la estrategia comunicacional que utilice la izquierda tiene que responder a los cambios que hoy predominan en el mercado, con mensajes atractivos que lleguen a las masas.
“Hay que construir una fuerza revolucionaria, con teoría revolucionaria”.  
Por su parte, Ralph Gonsalves, primer ministro de San Vicente y las Granadinas, aseguró que está en el Encuentro para expresar su solidaridad con el gobierno legítimo de la República de Venezuela, en contra de los que quieren imponer una solución no democrática en ese país.





En el panel intervinieron Ismael Drullet, Mónica Valente, Manuel Bertoldi y Ralph Gonsalves. Infografía: Dinella García/Cubadebate.

Asimismo, el representante del Partido Comunista de China recordó que Cuba fue el primer país en toda América Latina en establecer las relaciones diplomáticas con el gigante asiático. 
“No importa el escenario internacional, las relaciones Cuba-China se siguen consolidando, agregó el delegado, quien aseguró que su país “seguirá apoyando como siempre la justa causa de la isla caribeña, por su soberanía, y al socialismo acorde a sus condiciones nacionales”.
Cicero Pereira Da Silva, de Brasil, dijo que parte de la estrategia de los Estados Unidos se enfoca en destruir los movimientos de izquierda en el territorio. Por eso, la unidad es vital para enfrentar a esos poderes hegemónicos.  Con un grito de “Lula Libre”, concluyó su intervención. 


Segunda Jornada Encuentro Antimperialista. Foto: Marcelino Vázquez/ACN.



Segunda Jornada Encuentro Antimperialista. Foto: Marcelino Vázquez/ACN.



Segunda Jornada Encuentro Antimperialista. Foto: Marcelino Vázquez/ACN.



Segunda Jornada Encuentro Antimperialista. Foto: Marcelino Vázquez/ACN.



Segunda Jornada Encuentro Antimperialista. Foto: Marcelino Vázquez/ACN.



Segunda Jornada Encuentro Antimperialista. Foto: Marcelino Vázquez/ACN.



Segunda Jornada Encuentro Antimperialista. Foto: Marcelino Vázquez/ACN.



Palabras de Ulises Guilarte de Nacimiento, secretario general de la Central de Trabajadores de Cuba, en la entrega de más de dos millones de firmas para la liberación de Lula.

Bajo la vocación internacionalista y solidaria de la mayor de las Antillas, desde el pasado 28 de octubre el pueblo cubano ha recogido firmas en centros de trabajo y estudio, en reclamo de la libertad del expresidente brasileño y líder del Partido de los Trabajadores de Brasil, Luiz Inácio Lula da Silva, quien se mantiene encarcelado por causas judiciales politizadas.
Como resultado fueron entregadas esta mañana más de dos 2 millones 500 mil  firmas a la delegación brasileña que participa en el Encuentro Antimperialista de Solidaridad, por la Democracia y contra el Neoliberalismo
Durante ese proceso se celebraron actos en los centros laborales y estudiantiles, donde se demandó la libertad inmediata del exmandatario sudamericano y se condenó la estrategia del imperialismo, con la complicidad de la derecha regional, para desacreditar a los líderes progresistas. 
También se rechazaron las medidas del presidente Jair Bolsonaro contra el pueblo de Brasil y sus declaraciones contra Cuba y la colaboración médica.
Las firmas fueron entregadas por Ulises Guilarte de Nacimiento, secretario general de la Central de Trabajadores de Cuba  y por Fernando González Llort, presidente del Instituto Cubano de Amistad con los Pueblos (ICAP), a Gleisi Hoffmann, presidenta del Partido de los Trabajadores de Brasil.
Guilarte aseguró que el mundo ha sido testigo hace más de un año y medio de las injusticias contra Lula, por parte de la derecha oligárquica de su país.
“Ha crecido en el fragor de las luchas hasta convertirse hoy en un estadista de talla mundial. Quienes lo acusan no han podido presentar una prueba en su contra”.
Asimismo, refirió que el cuadro entregado a la delegación de ese país suramericano es testimonio de la solidaridad mundial con las causas justas.
Por su parte, Hoffmann, en nombre de su delegación saludó ""con entusiasmo"" a Cuba, que lleva más de 60 años de lucha y que se ha convertido en un ejemplo para todos los pueblos del mundo. 
""Hoy más de 60 millones de brasileños no cuentan con la atención médica por la persecuación a los colaboradores cubanos, debido a un hombre que llegó a la presidencia del país de forma ilegítima, Jair Bolsonaro.""Lula ha sido condenado sin pruebas, en un proceso politizado""
Dijo también que el pueblo de Brasil sufre con la situación actual que atraviesa. ""Hay 12 millones y medio de desempleados, crece la desiguldad y el hambre ha vuelto"".
No obstante, habló de esperanza, con el auge de las movilizaciones de izquierda contra el neoliberalismo y la victorias presidenciales de candidatos progresistas.
En video, entrega de firmas a la delegación brasileña





Abel Prieto fue el primero en tomar la palabra para llamar a la izquierda a generar los antídotos ante la globalización. Foto: Twitter Embajada de Venezuela en Cuba.

Para debatir sobre la industria cultural y del entretenimiento como un peligroso medio de dominación sesionó hoy en el Palacio de Convenciones la comisión “Descolonización y guerra cultural. Comunicación estratégica y lucha social”.
La mesa, presidida por Víctor Gaute, miembro del secretariado del Comité Central del Partido Comunista de Cuba, contó también con la participación de Alpidio Alonso, ministro de Cultura, Abel Prieto, director de la oficina del Programa Martiano y los intelectuales Ignacio Ramonet y Amauri Chamorro, entre otros.
Abel Prieto fue el primero en tomar la palabra para advertir que “la izquierda no le ha dado la prioridad que tiene a esta guerra cultural y estamos viviendo la desatención de esos frutos”.


Abel Prieto llamó a “Abrir el rasguño en la piedra entre todos. Para lograr que la verdad encuentre un espacio a través de la cultura de la resistencia”. Foto: Twitter Embajada de Venezuela en Cuba.

Al respecto, se refirió al fruto de la dominación cultural derecha: la gestación del pobre de derecha. “Una criatura que vota contra sí misma, contra su familia, contra el destino de sus hijos. A la hora de definirse políticamente se define por sus opresores”, agregó el intelectual cubano, quien afirmó que no se trata de una criatura tan rara, a ella le debemos grandes triunfos electorales.
Para enfrentar esta guerra, Prieto llamó a la izquierda a generar los antídotos ante la globalización y ser más activos en promover nuestros símbolos de resistencia, refiriéndose a la reciente recontextualización de la canción de resistencia fascista, “Bella Ciao”, en la serie española de televisión “La casa de papel”.
Prieto, que habló con la originalidad y el humor que lo caracterizan, hizo alusión a su reciente experiencia en Twitter, ""empiezas a apreciar más lo que ocurre que el reflejo de lo que ocurre"". Incluso él, que espera que acabe su intervención para tuitearla.



Se trata, concluyó, de promover otro modelo de comunicación, donde exista una democratización real y enfrentemos el poder de las trasnacionales.
“Abrir el rasguño en la piedra entre todos. Para lograr que la verdad encuentre un espacio a través de la cultura de la resistencia”.


La comisión Descolonización y guerra cultural sesiona en el Palacio de las Convenciones, junta a otras cinco para debatir sobre la izquierda en el escenario actual. Foto: Twitter Embajada de Venezuela en Cuba.

En el evento también intervino Sally Burch, directora ejecutiva de la Agencia Latinoamericana de Información, quien alertó sobre el peligro de las redes sociales y las soluciones desde el lado de las minorías.
“Existe una tendencia a dejar de lado los medios propios e invertir en las redes sociales. Pero es un terreno minado, porque no los controlamos. Ellos deciden a quien llegamos. Censuran y acumulan poder y riqueza con todo lo que ponemos ahí”.
Con ello en mente, Burch afirmó que el propósito debe ser entonces democratizar y recuperar la comunicación en las nuevas tecnologías.
Otro de los panelistas del debate fue Amauri Chamorro, intelectual ecuatoriano, que quiere alertar que:
“Las crisis políticas no se resuelven con hashtags. Nada puede sustituir el puerta a puerta. Si fuera así Cuba, Venezuela o Nicaragua no hubieran sobrevivido a la ofensiva que han vivido”.
Sin embargo, “tenemos que ser menos aburridos como izquierda. Innovar, ser vanguardia. No hemos modernizado nuestro discurso para disputar a ese público que tiene menos de 40 años”, señaló.
“Hay que pensar como reconectarnos con esa nueva sociedad y Cuba tiene algo que no tenía América Latina al entrar a las redes sociales, una sociedad altamente educada”, añadió el periodista.


Comisión Democracia, la soberanía y el antimperialismo. Foto: Ana Mari Machado/Twitter.

Una de las comisiones del encuentro centró sus debates en la democracia, la soberanía y el antimperialismo, a partir de la denuncia continuada política hostil, agresiva, injerencista e imperial del gobierno de Estados Unidos y las derechas oligárquicas aliadas, contra los pueblos a nivel mundial.
Los delegados expusieron los logros alcanzados durante los mandatos de los gobiernos de izquierda, populares y progresistas a favor de las grandes mayorías. Entre ellos el gobierno de Nicolás Maduro, Evo Morales, Rafael Correa, Dilma Rousseff, Cristina Fernández, entre otros.
Al hablar de democracia, en el panel intervino el secretario del Consejo de Estado de la República de Cuba, Homero Acosta, quien explicó a los delegados las particularidades de la reforma constitucional que tuvo lugar en Cuba. Destacó el protagonismo del pueblo en este proceso, y se refirió a las novedades de la nueva Carta Magna.





Comisión Democracia, la soberanía y el antimperialismo. Foto: Ana Mari Machado/Twitter.

Los mensajes giraron en torno a:

Respaldar el derecho de los pueblos a su libre autodeterminación, la independencia y la soberanía, respetando las normas del Derecho Internacional y de los Estados.
Defender la Proclama de América Latina y el Caribe como Zona de Paz, frente a la Doctrina Monroe, el marcartismo y la activación del Tratado Interamericano de Asistencia Recíproca (TIAR), contra la militarización y las bases extranjeras de EE.UU.
Necesidad de la participación consciente, crítica, propositiva de los sectores populares para frenar el ascenso de las derechas.
La defensa de la soberanía es una prioridad frente a la usurpación y el control de los bienes, del medio ambiente y de las tradiciones culturales.

Insistieron en que, en los tiempos actuales, el imperialismo articula estrategias de imposición e instauración de gobiernos de derecha, con el apoyo de campañas mediáticas nacionales y trasnacionales, con el objetivo de revertir los logros y los avances en la justicia social. Como ejemplos en este aspecto citaron a Jair Bolsonaro, Mauricio Macri y Lenín Moreno.
Por eso, ante esta situación, se impone la movilización popular, para avanzar en la recuperación de las conquistas alcanzadas y profundizar en la construcción del poder popular, único capaz de construir la verdadera democracia.
Propuestas para el plan de acción:

Proponer que se adopte una Declaración de Solidaridad y apoyo a la resolución “Necesidad de poner fin al bloqueo económico, comercial y financiero impuesto por los Estados Unidos de América contra Cuba”, para ser enviada al Secretario General de las Naciones Unidas, y al Plenario de la AG de la ONU, como expresión de solidaridad de los pueblos, organizaciones y personalidades, asistentes al evento de La Habana.
Realizar acciones concretas en parlamentos y gobiernos el 21 de septiembre, “Día Mundial por la Paz”, en defensa de la Proclama de América Latina y el Caribe como Zona de Paz.
Activar la movilización amplia, permanente y representativa de los sectores de nuestras sociedades, frente a las acciones del imperialismo yanqui y sus aliados incondicionales, sobre la base del llamado a la unidad en la diversidad, en defensa de la paz, la soberanía y la autodeterminación de los pueblos.
Reforzar las acciones contra el bloqueo de forma conjunta y contando con la participación de los movimientos sociales y populares, los partidos políticos y los movimientos de solidaridad con Cuba.

En video: Delegados hablan sobre el Encuentro Antimperialista





Especiales


Política



Desafíos para la articulación solidaria entre los pueblos: Segunda jornada antimperialista en La Habana (+Fotos y Video) 2 noviembre 2019| 1 |
Música cubana para celebrar el cumpleaños de La Habana (+Fotos) 2 noviembre 2019| + |
Zonas de tolerancia 1 noviembre 2019| 16
La rebelión en Chile efectivamente vino de afuera: de Chicago, Washington y Langley 1 noviembre 2019| 31 |
¡Sorpréndete! Cubadebate te invita a una visita virtual a La Habana en video 360 grados 1 noviembre 2019| 46 |
ir a Especiales »


Irak: Más de 120 heridos en manifestaciones en el puerto Um Qasr 2 noviembre 2019| + |
Interponen primera acción penal por delitos de lesa humanidad contra Sebastián Piñera 2 noviembre 2019| + |
Desafíos para la articulación solidaria entre los pueblos: Segunda jornada antimperialista en La Habana (+Fotos y Video) 2 noviembre 2019| 1 |
Venezuela captura a alias “Vaquita”, narcoparamilitar fotografiado con Guaidó (+Video) 2 noviembre 2019| 7 |
Mujica y Alberto Fernández ofrecen charlas sobre cultura y política en universidad argentina 1 noviembre 2019| 2 |
ir a Política »



",en,"











Thai cave where soccer team was dramatically rescued reopens to tourists
02 Nov 2019, 18:11 by David Aaro
Thailand's government has officially reopened the cave where 12 boys and their soccer coach were trapped during a rescue saga that received worldwide attention last year.
Approximately 2,000 visitors flocked to the reopening of Tham Luang cave on Friday, hoping to be the first to enter the world-famous site in Chiang Rai, according to the Bangkok Post.
It had been closed to visitors since members of the Wild Boars youth soccer team were trapped for 17 days in the flooded caverns nearly 15 months ago.


THAI KING CONTINUES PALACE PURGE, EXPELS BEDROOM GUARDS FOR 'EXTREMELY EVIL MISCOCNDUCT' AND 'ADULTERY'




Thai rescue teams work inside the cave complex during last year's rescue efforts. (Tham Luang Rescue Operation Center via AP)

More than a million people have visited the cave over the past year, although no one has been able to go inside due to restoration efforts, according to the Bangkok Post.
On Friday, the outlet reported that 20 people were admitted at a time inside the cave's mouth and the first chamber. The attraction was open between 8:30 a.m. and 4:30 p.m.
“We have allowed visitors to see the mouth of the cave,” said Kamolchai Kotcha, director of the local conservation office that oversees the cave told the Japan Times.



More than 90 divers were part of the rescue effort that saw experts from various countries trying to help. The youths, aged between 11 and 16, and their coach had all been rescued by July 10 of last year.
The young boys were handcuffed and heavily sedated during the rescue efforts, according to ""The Cave,"" a book by Australian Broadcast Corporation correspondent Liam Cochrane.


HONG KONG PROTESTERS MET WITH TEAR GAS AFTER ATTACKING CHINESE NEWS AGENCY OFFICES


While all of the boys survived, Thai Navy diver Saman Gunan died after losing consciousness while making his way out of the treacherous caverns as he was delivering air tanks during the rescue efforts.
The rescue efforts were detailed on the Australian television series, ""Four Corners.""
“It’s one of the most difficult and dangerous and risky things I’ve ever done, not in terms of my own personal safety, but in terms of the people I was responsible for,” British cave diver Jason Mallinson told Cochrane.
“I’ve never done anything as risky as that and I don’t think I ever will again. But it was the only option we had, and we took it.”


Some of the boys who were trapped in the cave last year. (Royal Thai Navy Facebook Page via AP, File)



CLICK HERE TO GET THE FOX NEWS APP


In addition to the publication of Cochrane's book and others, Netflix has secured the right to make a miniseries about the dramatic rescue.


"
