,src,lang,text
0,"











أكتوبر الماضي حطم الرقم القياسي وأصبح الشهر الأعلى حرارة في التاريخ
07 Nov 2019, 06:26 by ""الاقتصادية"" من الرياض
قالت خدمة رصد الأرض في الاتحاد الأوروبي ""هيئة كوبرنيكوس"" إن متوسط درجات الحرارة في جميع أنحاء العالم في أكتوبر 2019 كان الأكثر حرارة لهذا الشهر منذ بدء تسجيل درجات الحرارة. وقالت هيئة كوبرنيكوس أن شهر أكتوبر الماضي كان أكثر أشهر أكتوبر دفئا في التاريخ. مشيرة إلى أنه الشهر الخامس على التوالي الذي يحطم الرقم القياسي أو يقترب منه بحسب ما ذكرت ""سكاي نيوز"".
فقد سجلت فيه حرارة تزيد 0.69 درجة مئوية عن المعدل الوسطي للفترة 1981 - 2010 محطما بـ 0.01 درجة مئوية درجة الحرارة التي سجلت في أكتوبر 2015 وبفارق 1.2 درجة عن المعدل المسجل قبل الثورة الصناعية. وقالت الهيئة إن العديد من الدول الأوروبية شهدت درجات حرارة أعلى من المتوسط طوال الشهر، باستثناء تلك الموجودة في الشمال والشمال الغربي من القارة، إلا أن الحالات الشاذة في درجات الحرارة في أوروبا تكون أكبر من مثيلاتها في العالم خاصة في فصل الشتاء.
وكانت درجات الحرارة أعلى أيضا من المتوسط في أجزاء كبيرة من القطب الشمالي، لكن الجزء الغربي من الولايات المتحدة وكندا تعرض لدرجات حرارة أكثر برودة من المعتاد.  وقالت كوبرنيكوس إن درجة حرارة أكتوبر زادت بالفعل بمعدل 1.2 درجة مئوية فوق مستويات ما قبل الثورة الصناعية، المحددة من قبل الهيئة الحكومية الدولية المعنية بتغير المناخ (IPCC). وأوضحت هيئة كوبرنيكوس في بيان ""إنه الشهر الخامس على التوالي الذي يسجل فيه مستوى قياسي أو يقترب كثيرا منه"".
يشار إلى أن درجات الحرارة في شهري يونيو ويوليو حطمت الرقم القياسي في هذا المجال فيما حل شهر أغسطس 2019 في المرتبة الثانية بينما حل شهر سبتمبر في المرتبة الأولى. وكانت السنوات الأربع الأخيرة الأكثر دفئا في العالم. وتوقعت المنظمة العالمية للأرصاد الجوية في أغسطس أن يكون العام 2019 بين أكثر 5 سنوات دفئا بسبب تأثير التغير المناخي الذي يتوقعه العلماء.


",ar,"











Last October broke the record and became the hottest month in history
07 Nov 2019, 06:26 by ""Economic"" from Riyadh
The European Union's Earth Observatory (Copernicus) said the average temperature worldwide in October 2019 was the hottest this month since records began. Copernicus said October was the warmest month in history. Noting that it is the fifth month in a row that breaks the record or approaching it, according to ""Sky News"".
It recorded a temperature of 0.69 ° C above the average for the period 1981-2010, breaking the 0.01 ° C temperature recorded in October 2015, a difference of 1.2 degrees from the rate recorded before the Industrial Revolution. Many European countries experienced higher-than-average temperatures throughout the month, with the exception of those in the north and northwest of the continent, but abnormal temperatures in Europe are higher than in the world, especially in winter, the agency said.
Temperatures were also higher than average in large parts of the Arctic, but the western part of the United States and Canada experienced colder temperatures than usual. Copernicus said the October temperature had already increased by 1.2 degrees Celsius above pre-industrial levels set by the Intergovernmental Panel on Climate Change (IPCC). ""It is the fifth consecutive month that it has reached a record high or is approaching much,"" Copernicus said in a statement.
It is noteworthy that temperatures in June and July broke the record in this area, while August came in second place while September came in first place. The last four years have been the warmest in the world. The World Meteorological Organization (WMO) predicted in August that 2019 would be among the warmest 5 years due to the impact of climate change that scientists predict.


"
