,src,lang,text
0,"











Φθινόπωρο με... ανοιξιάτικες θερμοκρασίες - Πρόγνωση και για Σαββατοκύριακο
06 Nov 2019, 06:38 by SigmaLive
Σχετικά θερμή αέρια μάζα επηρεάζει την περιοχή.
Σήμερα ο καιρός θα είναι κυρίως αίθριος. Οι άνεμοι θα πνέουν βόρειοι ως βορειοανατολικοί και τοπικά μέχρι ανατολικοί, ασθενείς μέχρι μέτριοι, 3 με 4 μποφόρ, αλλά στα ανατολικά μέτριοι, 4 μποφόρ. Στα δυτικά θα καταστούν σταδιακά νοτιοδυτικοί ως βορειοδυτικοί ασθενείς, 3 μποφόρ. Η θάλασσα θα είναι λίγο ταραγμένη, αλλά στα ανατολικά μέχρι ταραγμένη. Η θερμοκρασία θα ανέλθει γύρω στους 28 βαθμούς στο εσωτερικό και τα νότια παράλια, γύρω στους 27 στα υπόλοιπα παράλια και γύρω στους 20 βαθμούς στα ψηλότερα ορεινά.
Απόψε ο καιρός θα είναι κυρίως αίθριος. Οι άνεμοι θα πνέουν κυρίως βορειοδυτικοί ως βορειοανατολικοί, ασθενείς και παροδικά τοπικά μέχρι μέτριοι, 3 με 4 μποφόρ. Η θάλασσα θα είναι λίγο ταραγμένη, αλλά στα δυτικά και τοπικά στα νότια θα καταστεί ήρεμη μέχρι λίγο ταραγμένη. Η θερμοκρασία θα πέσει γύρω στους 13 βαθμούς στο εσωτερικό, γύρω στους 17 στα νοτιοανατολικά παράλια, γύρω στους 15 στα υπόλοιπα παράλια και γύρω στους 10 βαθμούς στα ψηλότερα ορεινά.
Την Πέμπτη, την Παρασκευή και το Σάββατο ο καιρός θα είναι κυρίως αίθριος, ενώ νεφώσεις που θα αναπτύσσονται στα ορεινά, το απόγευμα της Παρασκευής, δεν αποκλείεται να δώσουν μεμονωμένες βροχές.


",el,"











Autumn with ... spring temperatures - Forecast and for the weekend
06 Nov 2019, 06:38 by SigmaLive
Relatively hot gas mass affects the area.
Today the weather will be mostly clear. The winds will blow north as northeast and locally to east, patients moderate to 3 to 4 beaufort, but east moderate to 4 beaufort. To the west they will gradually become southwest as northwest patients, 3 beaufort. The sea will be a little shaky, but east to shaky. The temperature will rise to about 28 degrees inland and south coast, around 27 degrees to the rest of the coast and around 20 degrees to the highest mountains.
Tonight the weather will be mostly clear. The winds will mainly blow northwest as northeast, patient and transient locally to moderate, 3 to 4 beaufort. The sea will be a little shaky, but to the west and south to the south it will calm down a bit. Temperatures will drop about 13 degrees inland, around 17 on the southeast coast, around 15 on the other coasts, and around 10 degrees on the higher mountains.
On Thursday, Friday and Saturday, the weather will be mostly cloudy, with clouds rising in the mountains on Friday afternoons.


"
