,src,lang,text
0,"











Самосвал опрокинулся у моста Бетанкура, засыпав песком заезд

06 Nov 2019, 06:18

Один из заездов на мост Бетанкура с Петровского проспекта по Ремесленной улице с утра 6 ноября перекрыт из-за ДТП. На общественном транспорте с Петровского выбраться затруднительно.
На резком повороте опрокинулся самосвал. На фотографиях очевидцев в группе «ДТП и ЧП Санкт-Петербург» «ВКонтакте» видно, что грузовик упал набок, и песок высыпался на проезжую часть.













УГИБДД сообщает, что в этом ДТП никто не пострадал, и обращает внимание на необходимость соблюдения скоростного режима.

Перекрыт заезд на мост (точнее, уже не на Бетанкура, а на Мало-Петровский мост через Ждановку) в направлении Ждановской набережной, то есть Петроградской стороны. По этому участку Ремесленной с Петровского в сторону Ждановской идут троллейбусы 7-го маршрута и автобусы 14-го. Они выстроились в длинную очередь.
Автомобильной пробки ДТП не создаёт. Затор на мосту перед светофором в сторону П.С. и далее, вплоть до набережной Адмирала Лазарева, часто образуется в утренние часы пик.


",ru,"











Dump truck capsized at Betancourt bridge, falling asleep with sand

06 Nov 2019, 06:18

One of the arrivals to the Betancourt bridge from Petrovsky Prospekt along Remeshennaya Street in the morning of November 6 was blocked due to an accident. It is difficult to get out of Petrovsky by public transport.
At a sharp turn, a dump truck capsized. The photos of eyewitnesses in the group “Accident and State of emergency of St. Petersburg” “VKontakte” show that the truck fell to one side, and sand spilled onto the roadway.













The traffic police reports that no one was injured in this accident, and draws attention to the need to comply with the speed limit.

Access to the bridge (more precisely, not to Betancourt, but to the Malo-Petrovsky bridge over Zhdanovka) in the direction of Zhdanovskaya embankment, that is, the Petrograd side, was blocked. Trolleybuses of the 7th route and buses of the 14th go along this section of the Craft from Petrovsky towards Zhdanovskaya. They lined up in a long line.
An automobile traffic jam does not create an accident. Jam on the bridge in front of the traffic light towards P.S. and further, up to the promenade of Admiral Lazarev, often formed in the morning rush hours.


"
