,src,lang,text
0,"











Четвертий морський порт Одещини втратив начальника

06 Nov 2019, 06:44

Керівника порту «Южний» звільнили з посади
Міністерство інфраструктури України звільнило 4 листопада Анатолія Яблунівського з посади в.о. директора торгового морського порту «Южний».
«4  листопада 2019 року наказом Міністерства інфраструктури звільнено з роботи  виконуючого обов’язки директора ДП «Морський торговельний порт «Южний» Яблунівського Анатолія Миколайовича відповідно до пункту 2 частини першої статті 36 Кодексу законів про працю України. Наказ підписано Міністром інфраструктури Владиславом Криклієм», - йдеться у повідомленні на сайті відомства.
На цій посаді Яблунівський працював з червня 2018 року. саме коли справи порту для колективу бажали бути кращими. Спад виробництва руди, яка становила суттєву частку перевалки вантажів, позначився на підприємстві.
В той же час у пресслужбі порту повідомляють, що цьогоріч до металу і зернових додались нікелева руда, бетонітова глина та мінеральні добрива. Загалом за рахунок цих вантажів ДП «МТП «Южний» збільшив перевалку на понад мільйон тонн.
Також речники підприємства розповсюдили звіт про переможні досягнення та зустріч колективом Нового року вже посеред жовтня.
«Колектив Державного підприємства «Морський торговельний порт «Южний» на 77 днів раніше виконав річний виробничий план. За даними головної диспетчерської  15 жовтня о 20:00 підприємством опрацьовано 11 млн. 680 тисяч тонн вантажів (100% плану на 2019 рік). 67% від загального обсягу склав експорт руди, чавуну, зернобобових вантажів та продуктів їх переробки,  решта – імпорт енергетичного та коксівного вугілля, транзит, каботаж. З початку року опрацьовано 197 суден, що на 14% більше, ніж минулоріч. Понад 40% флоту, який опрацьовують біля причалів держстивідора  – судна типу «кейпсайз» вантажомісткістю понад 200 тис. тонн», - йдеться у повідомленні на сайті порту.
Зазначимо, що вже четвертий торговий морський порт Одеської області втратив начальника за два місяці роботи нового міністра Владислава Криклія. Перед тим міністр почистив командну ланку морських портів в Одесі, Чорноморську, Білгород-Дністровському.







",uk,"











The fourth sea port of Odesa has lost its chief

06 Nov 2019, 06:44

The manager of the port ""Yuzhny"" was fired
The Ministry of Infrastructure of Ukraine dismissed Anatoly Yablunovsky on November 4 director of the commercial seaport ""South"".
“On November 4, 2019, by an order of the Ministry of Infrastructure, Anatoliy Yablunivsky, the director of SE“ Yuzhny ”Commercial Port of Yuzhny Commercial Port, was dismissed from his job in accordance with paragraph 2 of Part One of Article 36 of the Labor Code of Ukraine. The order was signed by the Minister of Infrastructure Vladislav Krykliy », - said in a statement on the website of the department.
Yablunovsky has worked in this position since June 2018. just when the port business for the team wanted to be better. The decline in ore production, which accounted for a significant proportion of cargo transhipment, had an impact on the enterprise.
At the same time, the port's press service reported that nickel ore, concrete clay and mineral fertilizers were added to the metal and grain this year. In total, due to these cargoes, SE «Yuzhny» increased the transshipment by more than one million tons.
Also, company spokesmen circulated a report on the achievements and meeting of the New Year team in mid-October.
«The staff of the State Enterprise« Maritime Commercial Port «Yuzhny» 77 days earlier fulfilled the annual production plan. According to the Chief Dispatcher's Office, on October 15, at 20:00, the company processed 11 million 680 thousand tons of cargo (100% of the plan for 2019). Exports of ore, cast iron, legumes and products of their processing accounted for 67% of the total, the rest - imports of energy and coking coal, transit, cabotage. 197 vessels have been processed since the beginning of the year, which is 14% more than last year. More than 40% of the fleet, which is being worked out near the berths of the State Auditor - ships of type ""capes"" with a cargo capacity of more than 200 thousand tons "", - said in a message on the site of the port.
It should be noted that the fourth commercial seaport of Odessa region has lost its chief for two months of the new minister Vladislav Krikli. Before that, the Minister cleaned the command line of seaports in Odessa, the Black Sea, Belgorod-Dnestrovsky.







"
