,src,lang,text
0,"











Perícia oficial não foi acionada para examinar gravação no condomínio de Bolsonaro

02 Nov 2019, 15:51

O Sindicato dos Peritos Oficiais do Estado do Rio de Janeiro divulgou neste sábado uma nota informando que a perícia técnica oficial não foi acionada para examinar a gravação apreendida no condomínio Vivendas da Barra, onde Jair Bolsonaro tem residência.
“Segundo os fatos amplamente divulgados, o exame foi feito por técnicos do Ministério Público, e teve como objeto um CD apresentado pelo síndico do condomínio, não havendo assim a apreensão dos equipamentos do sistema de portaria”, diz a nota.
“Lamentamos que um evento de grande importância criminal para o país, que envolveu até o Presidente da República, venha a ser apresentado sem o devido processo de comprovação científica. Uma prova técnica robusta e incontestável só pode ser produzida com respeito à cadeia de custódia e com a devida Perícia Oficial da mídia original e do equipamento original no qual foi gravada.”


",pt,"











Official forensics was not called to examine taping at Bolsonaro condominium

02 Nov 2019, 15:51

The Rio de Janeiro State Official Experts Union issued a note on Saturday stating that the official technical expertise was not activated to examine the taped seizure at the Vivendas da Barra condominium, where Jair Bolsonaro is residing.
""According to the facts widely disclosed, the examination was made by prosecutors, and its object was a CD presented by the condominium manager, thus not having the seizure of the concierge system equipment,"" says the note.
“We regret that an event of great criminal importance for the country, which involved even the President of the Republic, will be presented without due process of scientific proof. Robust and unquestionable technical evidence can only be produced with respect to the chain of custody and the appropriate Official Expertise of the original media and original equipment on which it was recorded. ”


"
