,src,lang,text
0,"











Unión va a las 13.15, la hora de la picadita
Vermú, papas fritas, good show y Madelón
El Tate hace cinco partidos que no pierde y el “Taladro” sumó en Avellaneda pero no zafa del todo con el promedio del descenso. Leo pone los mismos once que arrancaron el miércoles. 

02 Nov 2019, 15:06

Un punto siempre es un punto y vale uno, suma uno. Lo que ocurre es que cuando un equipo empata como lo hizo Unión el miércoles, levantando un 0-2 y ante un grande como Independiente, parece un triunfo antes que un empate. Entonces, cuando pasan esas cosas, hay que darle la derecha a Leonardo Carol Madelón cuando dijo que “desde Rosario Central para acá nos juramos entre todos adentro del vestuario para empezar un nuevo campeonato”. Es un nuevo Unión, sin dudas. Que se empezó a reinventar desde el 1 a 0 en el clásico ante Colón, para ir a dar el golpe en La Plata contra Maradona y resucitar de local frente a Independiente de Avellaneda.
Ahora, con poco tiempo para el descanso, luego de la remontada contra el Rey de Copas, llegará este domingo especial en horario atípico para visitar al Banfield de Julio César Falcioni en Peña y Arenales. A la hora de la picadita, igual que cuando fue al Bosque para dejar sin ruidos a Maradona.
Quizás el plan Madelón sea el mismo de 60 y 118: jugar con la desesperación, los nervios y el apuro de un rival que viene de sacar un puntazo frente a Racing pero que no logra despegarse del fondo con los promedios (está a sólo dos unidades de Rosario Central y Patronato de Paraná).
Si la cabeza y el corazón de Unión siguen como hasta ahora, será complicado ganarle al once de Madelón. Pressing alto, mucha entrega y capacidad de gol recuperada. Acaso ahí está la clave de Leo: armar con Bou-Mazzola esas duplas con su estilo de recuperar, transformarse en los primeros defensores del equipo y golpear en el momento justo.
Eso sí, después del 2-2 con el Rojo, tendrá que hacer repaso de tape y corregir errores de concentración en la defensa. Porque el otro día en Santa Fe, a los goles se los hizo el mismo Unión.
El 4-4-2 empieza a salir de memoria, como los viejos buenos equipos de Unión con Madelón. Es cierto que en el banco tiene, en determinados lugares, gente para hacer “lío”, como pasó con el muy buen ingreso técnico de Juan Ignacio Cavallaro para cambiarle la cara, mover siempre la pelotita de un lado para el otro, no apurarse con el pelotazo y abrir la defensa del rival para empatar un partido que parecía perdido con el 0-2.
“Siempre es bueno que los dos delanteros hagan goles”, dijo Leo en la noche del 15 de Abril. Sin dudas que, en el caso de Mazzola, hay un claro proceso de crecimiento personal. Se acostumbró a hacer goles importantes, como el del clásico o el del 2-2 del miércoles. Unión no fue a buscar a Chile a un gran goleador (sus números lejos están de indicar eso), pero el arco se le está abriendo con la rojiblanca a bastones al ex Gimnasia de La Plata.
A la hora del vermú y las papas fritas -domingo, desde las 13.15-, el hincha de Unión siempre confía en un good show y en Leo Madelón. Un entrenador que siempre se está reinventando, con otros nombres y otros objetivos. Pero que le genera a la gente la tranquilidad de saber que, al final de cuentas, le sacará el jugo a las piedras.

Más problemas para Luis Spahn

Casi al mismo tiempo que el MPA solicitara un peritaje contable a los números de Unión, luego de los simultáneos allanamientos realizados en la sede tatengue y en su domicilio familiar, se suman más problemas para el presidente de Unión, Luis Spahn. Es que mientras espera el desenlace de la causa “Fútbol para Todos” (debió declarar ante la jueza María Servini en Capital Federal), ahora se conoció que un fiscal federal le solicitó al juez Reinaldo Rodríguez que dicte el procesamiento para el presidente tatengue, investigado por la figura de “retención indebida de tributos”.
En principio, los argumentos indican que “Spahn omitió realizar -como agente de retención- el depósito correspondiente a las retenciones prácticas en el Impuesto a las Ganancias dentro de los 30 días corridos de vencido el plazo que establece la ley, y por un período que se extendió durante todo el año pasado”.Lo que sorprende, además, es que el descargo del pope máximo tatengue cuando fue interrogado giró en desconocer la existencia de la deuda, por lo que “le tiró la pelotita” directamente a la tesorería del club.Esta nueva causa -una más- que apunta a la figura del presidente rojiblanco está radicada en el Juzgado Federal Nº 1 de Santa Fe y es en base a una investigación que llevó adelante la Afip, que detectó que la entidad no depositó los montos, generando un perjuicio al fisco de casi dos millones de pesos.

Ayuda al Chaco

“¡Ayudanos a ayudar!”, pide Unión en sus cuentas oficiales de redes sociales. “Hasta el 10 de noviembre recibiremos en la sede del club alimentos no perecederos, que serán llevados al impenetrable chaqueño, para asistir a miles de niños y niñas que necesitan ayuda. ¡Sumate a esta iniciativa!”, comunica la entidad de la avenida López y Planes.


",es,"











Union goes at 13.15, the hour of the minced
Vermouth, french fries, good show and Madelón
The Tate makes five games that he does not lose and the ""Drill"" added in Avellaneda but did not completely hit the average of the decline. Leo puts the same eleven that started on Wednesday.

02 Nov 2019, 15:06

A point is always a point and is worth one, add one. What happens is that when a team draws as Union did on Wednesday, raising a 0-2 and against a great as an Independent, it seems a triumph before a draw. Then, when these things happen, Leonardo Carol Madelón must be given the right when he said that ""from Central Rosario to here we swear among all inside the locker room to start a new championship."" It is a new Union, no doubt. That began to reinvent from the 1 to 0 in the classic against Columbus, to go to give the blow in the Silver against Maradona and to resurrect of premises in front of Independent of Avellaneda.
Now, with little time for rest, after the comeback against the King of Cups, this special Sunday will arrive at an unusual time to visit the Banfield de Julio César Falcioni in Peña and Arenales. At the time of the snack, just like when he went to the Forest to leave Maradona without noise.
Perhaps the Madelón plan is the same as 60 and 118: play with the desperation, nerves and trouble of an opponent who comes from throwing a punch in front of Racing but who fails to take off from the bottom with the averages (it is only two units of Rosario Central and Patronato de Paraná).
If the head and heart of Union continue as before, it will be difficult to beat Madelón's eleven. High pressing, a lot of delivery and recovered goal capacity. Perhaps there is the key to Leo: arm with Bou-Mazzola those pairs with his style of recovery, become the first defenders of the team and hit at the right time.
Of course, after 2-2 with the Red, will have to review tape and correct errors of concentration in the defense. Because the other day in Santa Fe, the goals were made by the same Union.
The 4-4-2 starts to go out of memory, like the old good teams of Union with Madelón. It is true that in the bank has, in certain places, people to make “mess”, as happened with the very good technical income of Juan Ignacio Cavallaro to change his face, always move the ball from one side to the other, not rushing with the ball and open the defense of the opponent to tie a game that seemed lost with the 0-2.
""It's always good for the two strikers to make goals,"" Leo said on the night of April 15. Undoubtedly, in the case of Mazzola, there is a clear process of personal growth. He got used to making important goals, such as the classic or Wednesday's 2-2. Unión did not go to Chile to find a great scorer (their numbers are far from indicating that), but the bow is being opened with the rojiblanca with sticks to the former Gymnastics of La Plata.
At the time of the vermouth and the fries - Sunday, from 1:15 pm -, the Union fan always relies on a good show and Leo Madelón. A coach who is always reinventing himself, with other names and other objectives. But that gives people the peace of mind of knowing that, in the end, they will get the juice out of the stones.

More problems for Luis Spahn

Almost at the same time that the MPA requested an accounting report to the Union numbers, after the simultaneous raids carried out at the tatengue headquarters and at his family home, there are more problems for the president of the Union, Luis Spahn. It is that while awaiting the outcome of the “Soccer for All” case (he had to testify before Judge María Servini in Federal Capital), it was now known that a federal prosecutor asked Judge Reinaldo Rodríguez to dictate the prosecution for President Tatengue, investigated for the figure of “undue retention of taxes”.
In principle, the arguments indicate that “Spahn failed to make - as a withholding agent - the deposit corresponding to the practical withholdings in the Income Tax within 30 calendar days of the expiration of the term established by law, and for a period that it was extended throughout the past year. ”What is surprising, moreover, is that the discharge of the pope maximum tatengue when he was interrogated turned in ignoring the existence of the debt, so he“ threw the ball ”directly to the club's treasury This new cause - one more - that points to the figure of President Rojiblanco is based in the Federal Court No. 1 of Santa Fe and is based on an investigation carried out by the Afip, which detected that the entity did not deposit the amounts, generating damage to the treasury of almost two million pesos.

Help the Chaco

“Help us to help!”, Asks Unión in its official social media accounts. “Until November 10 we will receive non-perishable food at the clubhouse, which will be taken to the impenetrable Chaco, to assist thousands of children who need help. Join this initiative! ”, Communicates the entity of López y Planes Avenue.


"
