,src,lang,text
0,"











Dos perezosos llegan a la TV para promover valores en los niños
La producción, de nombre ‘Los Pérez’, se estrena este lunes 4 de noviembre por Trece Costa Rica Televisión y constará de 24 micro episodios
02 Nov 2019, 20:09 by Lysalex Hernández A.


Lenny y Zila son los protagonistas principales de la serie 'Los Pérez', cuyo personajes principales son dos divertidos perezosos. Fotografía: Trece Costa Rica Televisión

Desde este lunes 4 de noviembre, el canal Trece Costa Rica Televisión se convertirá en el hogar de Lenny y Zila, dos perezosos que llegan a la pantalla chica para compartir sus aventuras con el público y promover valores entre los niños, en edad preescolar y escolar, para mejorar la convivencia.
Bajo el nombre de Los Pérez, la primera temporada de la serie está compuesta por 24 micro episodios, de tres minutos de duración cada uno, y se emitirán en distintos horarios por la televisora local. Se tiene previsto estrenar uno por semana.
Una de las novedades de los personajes principales del programa, que viven en un gran árbol del bosque lluvioso de Costa Rica, es que los perezosos son títeres, con el propósito de atraer a los televidentes más jóvenes del país.



Los Pérez abordarán distintos temas en esta primera edición, entre los que destacan la amistad, el aseo personal, la solidaridad, el ser responsable y hasta la necesidad de guardar los juguetes para evitar accidentes, serán parte esencial de esta divertida historia.
“Estoy seguro que a los niños y a los padres les van a encantar, porque fomentan los valores que se han ido perdiendo en nuestro país y que son urgentes rescatar para poder lograr una sana convivencia” indicó Erick Jarquín, productor del canal, en un comunicado de prensa.
Este programa también promoverá el talento de estos perezosos, quienes además de contestar preguntas sobre situaciones cotidianas, se destacarán por cantar, ya que sueñan con grabar su propio disco. El público podrá seguirlos en este camino por cumplir su anhelo.


",es,"











Two sloths arrive on TV to promote values in children
The production, called ‘Los Pérez’, opens this Monday, November 4, by Thirteen Costa Rica Television and will consist of 24 micro episodes
02 Nov 2019, 20:09 by Lysalex Hernández A.


Lenny and Zila are the main protagonists of the series 'Los Pérez', whose main characters are two funny sloths. Photography: Thirteen Costa Rica Television

From this Monday, November 4, the channel Trece Costa Rica Televisión will become the home of Lenny and Zila, two sloths who arrive on the small screen to share their adventures with the public and promote values among children, in preschool and school age , to improve coexistence.
Under the name of Los Pérez, the first season of the series is composed of 24 micro episodes, lasting three minutes each, and will be broadcast at different times by the local television station. It is planned to release one per week.
One of the novelties of the main characters of the program, who live in a large rainforest tree in Costa Rica, is that the sloths are puppets, with the purpose of attracting the youngest viewers in the country.



The Perez will address different issues in this first edition, among which are friendship, personal hygiene, solidarity, being responsible and even the need to store toys to avoid accidents, will be an essential part of this fun story.
""I am sure that children and parents are going to love it, because they promote the values that have been lost in our country and that they are urgently rescued in order to achieve a healthy coexistence,"" said Erick Jarquin, producer of the channel, in a statement Press
This program will also promote the talent of these sloths, who in addition to answering questions about everyday situations, will stand out for singing, as they dream of recording their own album. The public can follow them on this path to fulfill their desire.


"
