,src,lang,text
0,"











Фигуристка Алена Косторная выиграла этап Гран-при в Гренобле

02 Nov 2019, 20:13

Российская фигуристка Алена Косторная завоевала золотую медаль в одиночном катании на этапе Гран-при во французском Гренобле. По итогам двух программ она получила 236 баллов. Алина Загитова заняла второе место (216,06). Еще одна россиянка Мария Сотскова заняла 11-е место (144,89). Для Косторной это первый сезон на взрослом уровне.
Парное катание выиграли российские фигуристы Анастасия Мишина и Александр Галлямов и набрали 207,58 балла. Серебро взяла еще одна российская пара — Дарья Павлюченко и Денис Ходыкин (206,56). Этап Гран-при во Франции завершится в субботу произвольными программами спортивных пар.

Подробнее о противостоянии Алины Загитовой и Алены Косторной читайте в материале “Ъ”.



",ru,"











Figure skater Alena Kostornaya won the Grand Prix stage in Grenoble

02 Nov 2019, 20:13

Russian figure skater Alena Kostornaya won the gold medal in individual skating at the Grand Prix stage in French Grenoble. According to the results of two programs, she received 236 points. Alina Zagitova took second place (216.06). Another Russian Maria Sotskova took 11th place (144.89). For Kostornaya this is the first season at the adult level.
Russian figure skaters Anastasia Mishina and Alexander Gallyamov won pair skating and scored 207.58 points. Silver was taken by another Russian couple - Daria Pavlyuchenko and Denis Khodykin (206.56). The Grand Prix stage in France will end on Saturday with free pairs of sports programs.

Read more about the confrontation between Alina Zagitova and Alena Kostornaya in the article ""Kommersant"".



"
