,src,lang,text
0,"











Зеленский ветировал законопроект о госвыплатах
07 Nov 2019, 16:00 by Корреспондент.net
Президент вернул парламенту законопроект о верификации госвыплат со своими предложениями.
Президент Владимир Зеленский вернул в Верховную Раду законопроект №1231 о верификации пенсий и других госвыплат. 
Согласно информации на сайте парламента, 7 ноября законопроект возвращен с предложениями президента, готовится на рассмотрение с вето главы государства.
На данный момент текст предложений Зеленского к закону отсутствует.
Законопроектом, в частности, предлагалось ввести верификацию госвыплат - пенсий, пособий, льгот, субсидий, стипендий (кроме академических), других выплат, осуществляемых за счет средств государственного, местных бюджетов, фондов общеобязательного государственного социального и пенсионного страхования. Верификацию таких выплат предлагалось осуществлять в информационно-аналитической платформе.
Напомним, Рада приняла данный законопроект 17 октября.
Ранее в Кабмине сообщил, кто сможет получить субсидию. На нее могут рассчитывать те семьи, которые тратят на оплату коммунальных услуг более 15% доходов.
 





",ru,"











Zelensky vetoed the bill on state payments
07 Nov 2019, 16:00 by Correspondent.net
The President returned to Parliament a bill on verification of state payments with his proposals.
President Vladimir Zelensky returned to Verkhovna Rada bill No. 1231 on verification of pensions and other state payments.
According to information on the parliament’s website, on November 7 the bill was returned with the president’s proposals, and is being prepared for consideration by the veto of the head of state.
At the moment, the text of Zelensky’s proposals for the law is missing.
The bill, in particular, proposed introducing verification of state payments - pensions, allowances, benefits, subsidies, scholarships (except for academic ones), other payments made at the expense of state and local budgets, funds of compulsory state social and pension insurance. Verification of such payments was proposed to be carried out in an information-analytical platform.
Recall Parliament adopted the bill on October 17.
Earlier in the Cabinet, he announced who could receive the subsidy. Those families that spend more than 15% of their income on utility bills can count on it.






"
