,src,lang,text
0,"











Stadt Wien: Immer Ärger mit den Pächtern

07 Nov 2019, 16:13

Der Umbau von Schloss Cobenzl beginnt. Nicht nur dort gab es jahrelang Streit. Die juristischen Fehden der Stadt mit ihren Pächtern sind beinahe legendär.
Der alte Luster mit den vergilbten Lampenschirmen hängt schief von der Decke. Die Polstermöbel sind schon lange ausgeblichen, ebenso die Tapeten. Das komplette Areal ist mit Absperrzäunen umrundet. „Betreten der Baustelle verboten!“, steht auf dem Schild davor.
Das Schloss Cobenzl mit seinem historischen Rondell hat wahrlich schon bessere Zeiten erlebt.
Doch nun startet eine neue Ära für das Anwesen auf einem der Hausberge der Wienerinnen und Wiener. Das marode Bauwerk mit den mit Graffiti beschmierten Fenstern soll Glasfronten und Dachterrassen weichen.




Laura Schrettl





Laura Schrettl





Laura Schrettl





Laura Schrettl



Am Donnerstag erfolgte der Spatenstich für das neue Café und Restaurant „Weitsicht Cobenzl“. Neben Café und Restaurant sollen auch Veranstaltungsräume und Werkstätten in dem 5.000m² großen Areal Platz finden. 4.000m² davon sind für Events bestimmt – drei neue Säle sollen entstehen.
Highlight soll ein sogenannter Sky Walk werden. Damit ist eine Dachterrasse als Aussichtsplattform gemeint, diese entsteht auf dem neuen Café und wird frei zugänglich sein.
image<p>Geplante Dachterassen</p> 2018-07-04-cobenzl-2-jpg.jpgRealarchitektur/mostlikely architecture140026003904655/images/large/3904655/2018-07-04-cobenzl-2-jpg.jpg
Rondell muss abgerissen werden
Das Hauptgebäude des Schlosses bleibe größtenteils erhalten (bis auf ein baufälliges Nebengebäude). Das Café-Rondell müsse abgerissen und neu aufgebaut werden. Das neue Café soll aber auf den historischen Grundmauern und in sehr ähnlicher Form neu errichtet werden. Das Café wird künftig von Gert Kunze vom Café Eiles bespielt.
Der neue Pächter und Betreiber ist Martin Rohla. Es ist nicht sein erstes Projekt. Man kennt ihn bereits von Habibi & Hawara, Stadtflucht Bergmühle und der Swing Kitchen.
Am Cobenzl ist aber selbst Rohla auf Dinge gestoßen, die er nicht erwartet hätte. Zum Beispiel einen Swimmingpool. „Das war wirklich eine Messi-Meisterleistung, das so zu verrümpeln. Da ist noch einiges zu tun“, sagt der neue Pächter.
Die Wiener bekommen ihren Cobenzl zurück

Link zum Video

Die Kosten für das Projekt (Eröffnung 2021) belaufen sich auf etwa 12 bis 15 Millionen Euro. Diese trägt die Goodshares GmbH von Rohla gemeinsam mit der Supernova Beteiligungs GmbH. Die Stadt Wien finanziert nicht mit.
Auch die zuständige Stadträtin Ulli Sima (SPÖ) ist froh, dass nun endlich etwas Neues im Schloss Cobenzl einzieht. Denn bis dahin war es ein langer Weg.
Rechtsstreit
Zwei Jahre lang prozessierte die Stadt Wien mit dem langjährigen Pächter des Schlosses Olaf Auer. Er betrieb das Schloss ab dem Jahr 1983. Je länger Auers Engagement auf dem Cobenzl dauerte, desto unzufriedener wurde die Stadt.
""Ziemlich abgewirtschaftet"" und ""heruntergekommen"" sei das Areal, attestierte die zuständige Stadträtin Ulli Sima (SPÖ) damals.
Im Jahr 2012 kündigte die Stadt den Pachtvertrag und meldete Eigenbedarf an. Doch Auer wollte das Feld nicht räumen und blieb.
imageCobenzl-P&auml;chter stellt Einbrecher<p>Der langj&auml;hrige P&auml;chter Olaf Auer</p> 46-77910089.jpgkurierKurier/Jeff Mangione108019203905336/images/large/3905336/46-77910089.jpg
2014 brachte die Stadt schließlich Räumungsklage ein. Doch Auer ging auch dann nicht - und bekämpfte die Räumung. Bis zum Obersten Gerichtshof (OGH) ging der Fall. Im September 2016 entschied der OGH zugusten der Stadt, Ende Dezember 2016 musste Auer gehen. Wenig später verstarb er.
Auer war nicht der erste Generalpächter, den die Stadt loswerden wollte. Am bekanntesten ist wohl Norbert Weber, der sich heute Norbert Waldenburg nennt.
image46-60678501<p>Norbert Weber nennt sich heute <span class=""rtr-schema-org"" itemscope="""" itemtype=""http://schema.org/Person"">Norbert Waldenburg</span>.</p> 46-60678501.jpgk/Franz Gruber108017013905120/images/large/3905120/46-60678501.jpg
Weber (also:Waldenburg) war viele Jahre Betreiber der Copa Cagrana. In den 1980er Jahren eröffnete er das erste Lokal am Donauufer bei der Reichsbrücke. Die Copa Cagrana war geboren.
Die Gastro-Meile auf der Donauinsel ging viele Jahre gut, bis in die frühen Nuller-Jahren. Die Stadt wollte die Copa Cagrana neugestalten, Weber machte nicht mit. 2010 brachte die Stadt Räumungsklage gegen Weber ein.
Doch auch er blieb. Es folgten gegenseitige Schuldzuweisungen, Weber zeigte Sima sogar an. 2013 bot der Pächter der Stadt die gesamte Copa Cagrana zum letzten Mal an - um 3,5 Milliionen Euro. Doch die Stadt kaufte nicht. Stattdessen prozessierte sie weiter. Es häuften sich Anwaltskosten in der Höhe von einer Million Euro an.
Auch dieser Fall landete beim OGH. Im Jahr 2017 wies der Oberste Gerichtshof alle Rechtsmittel des Generalpächters ab, die Stadt durfte mit der Räumung beginnen. Abgesehen vom Prozess gegen den Generalpächter liefen weit über 100 weitere Zivilprozesse und Verwaltungsverfahren in der Causa Copa.
Das Happy End für die Stadt kam 2019: Am 4. Juni eröffnete die Stadträtin den ersten neuen Abschnitt der nun ""Copa Beach"" genannten Ausgehmeile.
image<p>Der neue ""<span class=""rtr-schema-org"" itemscope="""" itemtype=""http://schema.org/Place""><meta itemprop=""name"" content=""Copa Beach"">Copa Beach</span>"" an der Copa Cagrana</p> 46-96203115.jpgDominik Schreiber46-96203115108016203905093/images/large/3905093/46-96203115.jpg
Der Streit um die Copa war nicht der einzige, den die Stadt mit Norbert Waldenburg führte. Waldenburg betrieb auch das Partyschiff Johann Strauss. Seit 1985 lag es am Donaukanal. Nach einem Brand im Jahr 2011 entzog die Stadt die Genehmigung, hochtrabende Pläne für ein Kaffeehaus wurden nie umgesetzt.
Am 4. Mai 2018 wurde es um 22.500 Euro versteigert. Und auch diese Versteigerung hatte ein gerichtliches Vorspiel.
image<p>Partyschiff <span class=""rtr-schema-org"" itemscope="""" itemtype=""http://schema.org/Person""><meta itemprop=""name"" content=""Johann Strauss"">Johann Strauss</span></p> 46-104949390.jpgapaAPA/HERBERT PFARRHOFER""JOHANN STRAUSS"" MUSS ENTFERNT WERDEN108018333905432/images/large/3905432/46-104949390.jpg
Am aktuellsten ist aber der Rechtsstreit mit einem anderen langjährigen Pächter. Und zwar mit Gerold Ecker, Betreiber des Badeschiffs. Weil die Stadt den Donaukanal neu bespielen will, will sie Ecker, der auch die Badeschiff-Vorkaifläche und jene vor der Adria gepachtet hat, loswerden.
Auch Ecker will die Flächen nicht räumen und streitet deswegen mit der Grundeigentümerin, das ist die Donauhochwasserschutz-Konkurrenz (DHK) vor Gericht. Die Stadt hat längst neue Pächter bestellt und diese öffentlichkeitswirksam präsentiert:
image<p>Pr&auml;sentation der neuen P&auml;chter</p> 46-144322628.jpgStadt Wien46-144322628108015583905438/images/large/3905438/46-144322628.jpg
Stadtrechnungshof
Sogar der Stadtrechnungshof hat sich schon der Themen angenommen. Er überprüfte die Verträge der Stadt Wien mit den Pächtern entlang des Donaukanals, der Donauinsel und Neuer Donau. Das Ergebnis: Die Stadt habe in einigen Fällen viel zu wenig Zins eingehoben, Sonderrechte gewährt und Weitervermietung erlaubt.
Die Pächter fühlten (und fühlen) sich in den Rechtsstreitigkeiten oft unfair behandelt. Gerold Ecker hat den Donaukanal zu Zeiten bespielt, wo er längst noch nicht hipp war. Bei der Copa Cagrana war es ähnlich. Nach Jahren der Pionierarbeit mussten die Betreiber dann das Feld räumen.
newsletter_signupnewsletter_inline_box


",de,"











City of Vienna: Always trouble with the tenants

07 Nov 2019, 16:13

The reconstruction of Schloss Cobenzl begins. Not only there was a dispute for years. The legal feuds of the city with its tenants are almost legendary.
The old chandelier with the yellowed lamp shades hangs awry from the ceiling. The upholstered furniture has long faded, as have the wallpaper. The entire area is surrounded by barrier fences. ""Enter the construction site forbidden!"", Is written on the sign in front of it.
The castle Cobenzl with its historic rondel has experienced really better times.
But now a new era for the estate starts on one of the local mountains of the Viennese. The ramshackle structure with its graffiti-smeared windows is said to give way to glass fronts and roof terraces.




Laura Schrettl





Laura Schrettl





Laura Schrettl





Laura Schrettl



On Thursday the ground was broken for the new café and restaurant ""Weitsicht Cobenzl"". In addition to the café and restaurant, function rooms and workshops will also be located in the 5,000 m² area. 4.000m ² of which are intended for events - three new halls are to be created.
Highlight should be a so-called Sky Walk. This means a roof terrace as a viewing platform, which will be created on the new café and will be freely accessible.
image <p> Planned roof terraces </ p> 2018-07-04-cobenzl-2-jpg.jpgReal architecture / mostlikely architecture140026003904655 / images / large / 3904655 / 2018-07-04-cobenzl-2-jpg.jpg
Rondell must be demolished
The main building of the castle remains largely preserved (except for a dilapidated outbuilding). The café rondel must be demolished and rebuilt. However, the new café is to be rebuilt on the historical foundations and in a very similar form. The café will be used by Gert Kunze from Café Eiles.
The new tenant and operator is Martin Rohla. It is not his first project. It is already known by Habibi & Hawara, Stadtmühl Bergmühle and Swing Kitchen.
But on the Cobenzl even Rohla found something he did not expect. For example, a swimming pool. ""It was really a Messi masterpiece to bluff that. There is still a lot to do, ""says the new tenant.
The Viennese get their Cobenzl back

Link to the video

The cost of the project (opening 2021) amounts to about 12 to 15 million euros. This is the responsibility of Goodshares GmbH of Rohla together with Supernova Beteiligungs GmbH. The City of Vienna does not finance with.
The responsible city councilor Ulli Sima (SPÖ) is glad that finally something new moves in the castle Cobenzl. Because until then it was a long way.
litigation
For two years, the city of Vienna processed with the long-time tenant of the castle Olaf Auer. He operated the castle from the year 1983. The longer Auer's engagement on the Cobenzl lasted, the more dissatisfied the city became.
""Pretty run-down"" and ""run-down"" was the area, attested the competent councilor Ulli Sima (SPÖ) at that time.
In 2012, the city announced the lease and reported its own needs. But Auer did not want to leave the field and stayed.
imageCobenzl Putter puts Burglar <p> The Longtime Peasant Olaf Auer </ p> 46-77910089.jpgkurierKurier / Jeff Mangione108019203905336 / images / large / 3905336 / 46-77910089.jpg
In 2014, the city finally brought an eviction action. But even then Auer did not go - and fought the eviction. The case went to the Supreme Court (OGH). In September 2016, the OGH ruled the city, at the end of December 2016 Auer had to leave. He died a little later.
Auer was not the first general tenant the city wanted to get rid of. Best known is probably Norbert Weber, who calls himself today Norbert Waldenburg.
image46-60678501 <p> Norbert Weber calls himself today <span class = ""rtr-schema-org"" itemscope = """" itemtype = ""http://schema.org/Person""> Norbert Waldenburg </ span>. </ p > 46-60678501.jpgk / Franz Gruber108017013905120 / images / large / 3905120 / 46-60678501.jpg
Weber (Waldenburg) was for many years operator of the Copa Cagrana. In the 1980s, he opened the first restaurant on the Danube bank at the Reichsbrücke. The Copa Cagrana was born.
The gastro-mile on the Danube Island went well for many years, until the early Nineties. The city wanted to redesign the Copa Cagrana, Weber did not participate. In 2010, the city brought an eviction action against Weber.
But he stayed, too. It was followed by mutual blame, Weber even showed Sima. In 2013, the tenant of the city offered the entire Copa Cagrana for the last time - for 3.5 million euros. But the city did not buy. Instead, she continued to process. Attorneys' fees of one million euros accumulated.
This case also landed at the Supreme Court. In 2017, the Supreme Court dismissed all appeals of the general tenant, the city was allowed to begin the eviction. Apart from the case against the general tenant, more than 100 other civil and administrative proceedings were conducted in the Causa Copa.
The happy ending for the city came in 2019: On June 4, the councilwoman opened the first new section of the now called ""Copa Beach"".
image <p> The new ""<span class ="" rtr-schema-org ""itemscope ="" ""itemtype ="" http://schema.org/Place ""> <meta itemprop ="" name ""content ="" Copa Beach ""> Copa Beach </ span> ""at the Copa Cagrana </ p> 46-96203115.jpgDominik Schreiber46-96203115108016203905093 / images / large / 3905093 / 46-96203115.jpg
The dispute over the Copa was not the only one the city led with Norbert Waldenburg. Waldenburg also ran the party ship Johann Strauss. Since 1985 it was on the Danube Canal. After a fire in 2011, the city withdrew its approval, grand plans for a coffee house were never implemented.
On May 4, 2018, it was auctioned for 22,500 euros. And this auction also had a foreplay.
image <p> Party Ship <span class = ""rtr-schema-org"" itemscope = """" itemtype = ""http://schema.org/Person""> <meta itemprop = ""name"" content = ""Johann Strauss""> Johann Strauss </ span> </ p> 46-104949390.jpgapaAPA / HERBERT PFARRHOFER ""JOHANN STRAUSS"" MUST BE REMOVED108018333905432 / images / large / 3905432 / 46-104949390.jpg
Most recent is the legal dispute with another longtime tenant. And with Gerold Ecker, operator of the Badeschiffs. Because the city wants to re-play the Danube Canal, she wants to get rid of Ecker, who also leased the Badeschiff pre-grass area and the one off the Adriatic.
Also Ecker does not want to clear the surfaces and argues therefore with the land owner, that is the Danube flood protection competition (DHK) in court. The city has long since ordered new tenants and presented them to the public:
image <p> Presentation of the New Pupils </ p> 46-144322628.jpg City of Vienna46-144322628108015583905438 / images / large / 3905438 / 46-144322628.jpg
city Court
Even the city audit court has already addressed the subjects. He checked the contracts of the City of Vienna with the tenants along the Danube Canal, the Danube Island and the New Danube. The result: In some cases, the city has levied far too little interest, granted special rights and allowed re-letting.
The tenants felt (and feel) often treated unfairly in litigation. Gerold Ecker recorded the Danube Canal at times when he was far from hip. It was similar in the Copa Cagrana. After years of pioneering work, the operators then had to clear the field.
newsletter_signupnewsletter_inline_box


"
