,src,lang,text
0,"











Минюст требует ликвидировать Совет тейпов ингушского народа

07 Nov 2019, 16:00

Управление Минюста по Ингушетии направило в Верховный суд республики заявление о ликвидации Совета тейпов ингушского народа. Об этом сообщает издание «Медиазона».
Основной претензией Минюста стал неактуальный юридический адрес организации и ряд других нарушений, обнаруженных во время проверки. Среди них — якобы несоответствующее официальному изображение герба республики, на котором чиновники заметили «солярный знак», напоминающий свастику. Возникли вопросы и к уставу совета. Организацию потребовали исключить из государственного реестра юрлиц.
Ранее Минюст уже требовал приостановить деятельность совета. Сейчас его глава Малсаг Ужахов находится в СИЗО по уголовному делу о столкновениях на несанкционированном митинге, который прошел в марте против передачи части земель республики Чечне.


",ru,"











Justice Ministry demands liquidation of the Teip Council of the Ingush people

07 Nov 2019, 16:00

The Ministry of Justice of Ingushetia sent a statement to the Supreme Court of the Republic on the liquidation of the Teip Council of the Ingush people. This was reported by the publication ""Mediazona"".
The main complaint of the Ministry of Justice was the irrelevant legal address of the organization and a number of other violations discovered during the audit. Among them is an allegedly inappropriate official image of the coat of arms of the republic, on which officials noticed a “solar sign” resembling a swastika. There were questions about the charter of the council. The organization was demanded to be excluded from the state register of legal entities.
Earlier, the Justice Ministry had already demanded to suspend the activities of the council. Now its head Malsag Uzhakhov is in a pre-trial detention center in a criminal case of clashes at an unauthorized rally in March against the transfer of part of the republic’s lands to Chechnya.


"
