,src,lang,text
0,"











Maradona dice que está ""muy sano"" y que donará su dinero cuando muera
Maradona entregó un parte satisfactorio sobre su salud.
05 Nov 2019, 01:22 by EFE


Diego Maradona - Foto archivo - AFP

Compartir: Facebook Twitter
 Diego Maradona contradijo este lunes a su hija Gianinna Maradona, dijo que está ""muy sano"" y adelantó que donará su dinero cuando muera.
Gianinna Maradona afirmó, a través de su cuenta de Instagram, que a su padre ""lo están matando por dentro sin que él se de cuenta"".
""¿Se acuerdan que había un zoo en el que te podías sacar fotos con un león gigante? Lo tenían empastillado, si no imposible domar a la fiera. Cualquier parecido con la realidad es pura con coincidencia. Recen por él"", escribió.
El campeón del mundo con Argentina en México 1986 y ahora entrenador de Gimnasia y Esgrima La Plata le respondió a su hija este lunes a través de un video que publicó en su cuenta de Instagram.



""No me estoy muriendo para nada. Duermo plácidamente porque estoy trabajando. Me dolió muchísimo perder con Estudiantes. No sé lo que habrá querido decir Gianinna o qué interpretará. Yo sé que ahora, mientras uno se va haciendo más viejo, se preocupan más por lo que dejás que por lo que estás haciendo"", afirmó.
""Y yo les digo a todos que voy a donarlo. Todo lo que corrí en mi vida lo voy a donar. Así que seguirán diciéndole a otro cuando yo me muera, pero por ahora no. Estoy muy sano"", añadió.
Maradona está en juicio con Claudia Villafañe, su exesposa y madre de dos de sus hijas, Dalma y Gianinna, porque acusa a su expareja de haberlo estafado.
Villafañe se sumó a la disputa a través de una publicación en su cuenta de Instagram.
""Si tenés los huevos para subir un video a tu Instagram hablando de nuestra hija, espero que los tengas mañana para presentarte en el juzgado, ya que hasta ahora nunca lo hiciste"", escribió.

EFE - Colombia.com

Compartir: Facebook Twitter


",es,"











Maradona says he is ""very healthy"" and will donate his money when he dies
Maradona gave a satisfactory part about his health.
05 Nov 2019, 01:22 by EFE


Diego Maradona - Stock Photo - AFP

Share: Facebook Twitter
Diego Maradona contradicted his daughter Gianinna Maradona on Monday, said he is ""very healthy"" and said he will donate his money when he dies.
Gianinna Maradona said, through his Instagram account, that his father ""is being killed inside without him noticing.""
""Do you remember that there was a zoo where you could take pictures with a giant lion? They had it stuffed, if not impossible to tame the beast. Any resemblance to reality is pure with coincidence. Pray for him,"" he wrote.
The world champion with Argentina in Mexico 1986 and now gymnastics and fencing coach La Plata responded to his daughter on Monday through a video he posted on his Instagram account.



""I am not dying at all. I sleep peacefully because I am working. It hurt a lot to lose with Students. I do not know what Gianinna will have meant or what she will interpret. I know that now, as one gets older, they care more for what you leave for what you are doing, ""he said.
""And I tell everyone that I am going to donate it. Everything that I ran in my life I am going to donate. So they will continue telling another when I die, but not for now. I am very healthy.""
Maradona is on trial with Claudia Villafañe, his ex-wife and mother of two of his daughters, Dalma and Gianinna, because he accuses his ex-wife of having cheated him.
Villafañe joined the dispute through a post on his Instagram account.
""If you have the eggs to upload a video to your Instagram talking about our daughter, I hope you have them tomorrow to appear at the court, because until now you never did,"" he wrote.

EFE - Colombia.com

Share: Facebook Twitter


"
