,src,lang,text
0,"











6 неща, които се случват в тялото, когато ядете твърде много млечни продукти
Холестеролът и кръвното налягане се повишават
05 Nov 2019, 01:30 by Михаела Лазарова
Млечните продукти са много важни за цялостното здраве. В тях се съдържат незаменими хранителни вещества, включително калций, калий, витамин D. Пълномаслените млечни продукти се считат за здравословни, стига да се приемат в разумни количества.
Отдавна медицината дебатира по темата полезни или вредни са млечните продукти и отговорът определено не е еднозначен. Той зависи от индивидуалните особености на човек, дали има достатъчно от ензима лактаза, който разгражда лактозата (млечният протеин) в организма и още много други фактори.
Важно е да се научим да проследяваме симптомите на свръхконсумация на млечни продукти и да знаем кога е време да спрем.
Вижте кои са признаците, които подсказват, че сте консумирали твърде много млечни продукти.

Подуване, газове, бълбукане в корема

Ако сте прекалили с млечния протеин, това може да предизвика цялостен дискомфорт в коремната област, както в червата, така и в стомаха.

Стомашна болка

Млечната киселина дразни стомашната лигавица. Когато е в прекалено големи количества в стомаха, тя може да причини болки и неразположения.

Усилват се възпаленията в тялото

Ако страдате от болки в ставите, тези симптоми ще се засилят, ако сте прекалили с млечните продукти. За да намалите този вреден ефект, наблегнете на мастните киселини. Те имат естествен противовъзпалителен ефект върху тялото, като успокояват различни състояния, свързани с болки, подуване, скованост, дискомфорт.


Повече по темата може да прочетете в Az-jenata.bg




",bg,"











6 things that happen in the body when you eat too much dairy
Cholesterol and blood pressure rise
05 Nov 2019, 01:30 by Michael Lazarova
Dairy products are very important for overall health. They contain essential nutrients, including calcium, potassium, vitamin D. Whole milk products are considered healthy as long as they are taken in reasonable quantities.
For a long time, medicine has been debating the topic of useful or harmful dairy products and the answer is definitely not straightforward. It depends on the individual characteristics of the person, whether there is enough of the enzyme lactase, which breaks down lactose (milk protein) in the body and many other factors.
It is important that we learn how to track the symptoms of over-consumption of dairy products and know when it is time to stop.
See what are the signs that you have consumed too much dairy.

Swelling, gas, blistering in the abdomen

If you have too much milk protein, it can cause complete discomfort in the abdomen, both in the intestine and in the stomach.

Stomachache

Lactic acid irritates the gastric mucosa. When it is too large in the stomach, it can cause pain and discomfort.

The inflammation in the body increases

If you suffer from joint pain, these symptoms will be exacerbated if you have overdosed on dairy products. To reduce this harmful effect, focus on fatty acids. They have a natural anti-inflammatory effect on the body, soothing various conditions associated with pain, swelling, stiffness, discomfort.


You can read more on the topic at Az-jenata.bg




"
