,src,lang,text
0,"











आईपीएल में ‘पावर प्लेयर' शुरू करने पर आज होगी चर्चा, गांगुली लेंगे फैसला 
05 Nov 2019, 01:19 by हिन्दुस्तान टीम,नई दिल्ली
भारतीय क्रिकेट कंट्रोल बोर्ड (BCCI) दुनिया की सबसे सफल क्रिकेट लीगों में शामिल इंडियन प्रीमियर लीग (IPL) में बड़ा बदलाव करने की योजना बना रहा है। मंगलवार (5 नवंबर) को मुंबई स्थित मुख्यालय में होने वाली आईपीएल गवर्निंग काउंसिल की बैठक में इस पर विस्तृत चर्चा की जाएगी। इस पर अंतिम फैसला बीसीसीआई अध्यक्ष सौरव गांगुली ही करेंगे।
बोर्ड लीग के अगले संस्करण में ‘पावर प्लेयर' का नियम लाने पर विचार कर रही है। इस नियम के तहत टीम मैच में कभी भी विकेट गिरने के बाद या ओवर खत्म के बाद खिलाड़ी को बदल सकती हैं।
विचार को मंजूरीबीसीसीआई के एक अधिकारी ने कहा कि इस विचार को मंजूरी तो मिल गई है, लेकिन हम ऐसी स्थिति पर विचार कर रहे हैं जहां टीमों को अंतिम-11 के बजाए 15 खिलाड़ियों को चुनना हो और एक खिलाड़ी को मैच के दौरान कभी भी विकेट गिरने के बाद या ओवर खत्म होने के बाद बदला जा सके। हम इसे आईपीएल में लाने की सोच रहे हैं लेकिन आगामी सैयद मुश्ताक अली ट्रॉफी में इस नियम को लागू करना सही होगा। यदि यह नियम लागू हुआ तो आईपीएल और ज्यादा रोमांचक हो जाएगा।

B'DAY SPL: दिलचस्प है विराट कोहली के निकनेम 'चीकू' के पीछे की कहानी


B'DAY SPL: जब टीम की खातिर पिता के अंतिम संस्कार में नहीं गए थे विराट कोहली

इसका मैच पर क्या असर होगा?इस सवाल पर उन्होंने कहा कि यह नियम मैच का परिणाम बदल सकता है और दोनों टीमों के लिए हटकर सोचने तथा रणनीति बनाने को बढ़ावा देगा। आईपीएल की गवर्निंग काउंसिल की बैठक में इस नियम के अलावा सदस्य 2019 आईपीएल की समीक्षा करेंगे। साथ ही इस बात पर भी चर्चा होगी कि आगामी सीजन को और लोकप्रिय कैसे बनाया जाए।
ऐसा होगा नियम नए नियम के अनुसार, आपको यदि छह गेंद पर 20 रन चाहिए और आंद्रे रसेल बाहर बैठे हैं क्योंकि वह पूरी तरह से फिट नहीं और अंतिम-11 का हिस्सा नहीं थे। लेकिन अब, इस नियम से वह ऐसी स्थिति में मैदान पर आ सकते हैं और बड़े शॉट लगाकर मैच बदल सकते हैं। इसी तरह आपको आखिरी ओवर में अगर आपको छह रन बचाने हैं और आपके पास जसप्रीत बुमराह जैसा खिलाड़ी डग-आउट में बैठा है। तो कप्तान क्या करेगा? वह बुमराह को 19वां ओवर खत्म होने के बाद लेकर आएगा और फिर आप जानते ही हैं। इस नियम में मैच को बदलने का दम है।


",hi,"











There will be discussion on starting 'Power Player' in IPL today, Ganguly will decide
05 Nov 2019, 01:19 by Hindustan Team, New Delhi
The Board of Control for Cricket in India (BCCI) is planning to make major changes in the Indian Premier League (IPL), one of the most successful cricket leagues in the world. It will be discussed in detail at the IPL Governing Council meeting to be held at the headquarters in Mumbai on Tuesday (5 November). The final decision will be taken by BCCI President Sourav Ganguly.
The board is considering introducing a 'power player' rule in the next edition of the league. Under this rule, teams can change the player at any time in the match after the wicket falls or after the over.
Approval of the idea, a BCCI official said that the idea has been approved, but we are considering a situation where teams have to choose 15 players instead of the last-11 and one player can get wickets anytime during the match. Can be changed after a fall or after the over. We are thinking of bringing it in the IPL but it would be right to implement this rule in the upcoming Syed Mushtaq Ali Trophy. If this rule is implemented then IPL will be more exciting.

B'DAY SPL: Interesting story behind Virat Kohli's nickname 'Chiku'


B'DAY SPL: When Virat Kohli did not go to father's funeral for team's sake

To what effect will this have on the match? On this question, he said that this rule can change the outcome of the match and will promote thinking and strategy for both teams. In addition to this rule, members will review the 2019 IPL in the IPL Governing Council meeting. Also, there will be discussion on how to make the upcoming season more popular.
This will be the rule. According to the new rule, if you want 20 runs off six balls and Andre Russell is sitting out because he was not fully fit and was not part of the final-11. But now, with this rule, he can come on the field in such a situation and can change the match by making big shots. Similarly if you have to save six runs in the last over and you have a player like Jasprit Bumrah sitting in the dug-out. So what will the captain do? He will bring Bumrah after the 19th over is over and then you know. This rule has the power to change the match.


"
