,src,lang,text
0,"











Зеленський підписав поправки до держбюджету-2019 із фінансуванням метро на Виноградар у Києві та виділенням 1 млрд грн на зарплати шахтарям
07 Nov 2019, 13:37 by Daria Trokhimovich



Фото ReutersПрезидент України підписав підтриманий Верховною Радою законопроект №2283 зі змінами до державного бюджету на 2019 рік, який передбачає направлення додаткового 1 млрд грн на фінансування державних шахт і виплату їхнім працівникам зарплати.
Як повідомляється на офіційному сайті Верховної Ради, глава держави 7 листопада повернув зі своїм підписом підтриманий парламентом 18 жовтня в першому читанні та 1 листопада у другому читанні відповідний законопроект №2283.
Як повідомлялося, зміни до бюджету передбачають фінансування продовження лінії метро до столичного житлового масиву “Виноградар” за рахунок державного бюджету.
“Законопроект складається з кількох блоків: зміни, пов’язані з Кабінетом Міністрів, зміни, які виділяють додаткові кошти шахтарям і нашим військовим на передовій і поповнюють резервний фонд. Якщо у міста Києва все-таки є багато коштів на рахунках, і ви сьогодні дозволили їм не повертати до держбюджету ще додаткові кошти, то про шахтарів, військових і резервний фонд більше нікому потурбуватися, окрім нас”, – прокоментувала міністр фінансів.
“Законопроект пропонує унормувати зарахування конфіскованих коштів до спецфонду, які на 1 жовтня надійшли обсягом 1,561 млрд грн, але не передбачені плановими показниками доходів держбюджету зі спрямування 524 млн грн на облаштування військових комісаріатів… і 1,361 млрд грн – Укравтодору”, – пояснила з парламентської трибуни член комітету з питань бюджету Леся Забуранна (фракція “Слуга народу”).
Окрім цього, законопроект передбачає перерозподіл коштів за деякими бюджетними програмами.


",uk,"











Zelensky signs amendments to the state budget-2019 with financing of the Vynogradar subway in Kiev and allocation of 1 billion UAH for salaries to miners
07 Nov 2019, 12:37 by Daria Trokhimovich



Photo by ReutersPresident of Ukraine signed a bill approved by the Verkhovna Rada No. 2283 with changes to the state budget for 2019, which provides for an additional 1 billion UAH for financing state mines and payment of their salaries to employees.
According to the official website of the Verkhovna Rada, on November 7, the Head of State returned with his signature, supported by Parliament, on October 18 in the first reading and on November 1 in the second reading the corresponding bill No. 2283.
Reportedly, the changes to the budget envisage financing the extension of the metro line to the metropolitan housing estate “Vinogradar” at the expense of the state budget.
“The bill is made up of several blocks: changes related to the Cabinet of Ministers, changes that allocate additional money to miners and our military to the front line and replenish the reserve fund. If the cities of Kiev still have a lot of funds in their accounts, and today you have allowed them not to return additional funds to the state budget, then there is no one else to worry about miners, the military and the reserve fund, except us, ”the finance minister commented.
“The bill proposes to normalize the appropriation of confiscated funds to the special fund, which on October 1 came to the amount of UAH 1.561 billion, but is not provided by the planned state budget revenues for the direction of UAH 524 million for the arrangement of military commissariats ... and UAH 1.361 billion - Ukravtodor Member of the Committee on Budget Affairs Les Zaburna (People's Servant Faction).
In addition, the bill provides for the redistribution of funds under some budget programs.


"
