,src,lang,text
0,"











Sara Carreira convida fãs a participarem no seu EP
07 Nov 2019, 13:50 by A Televisão

Com lançamento marcado do primeiro EP para o próximo dia 22, Sara Carreira lançou um desafio aos fãs onde dá a oportunidade de fazerem parte deste projeto.

A cantora reservou uma faixa extra para uma participação dos fãs e quem estiver interessado basta enviar uma mensagem em formato áudio, a explicar o que significa para si as músicas da filha de Tony Carreira.
O envio deve ser feito pelo What’s App para o número 914 402 885.
RELACIONADAS


Atrasos no 'Like Me'! TVI não quer pagar aos influencers que participarem no programa


Rita Pereira dá ternurento abraço ao filho e convida os fãs a fazerem o mesmo com ela


Lili Caneças convida Robert De Niro para se mudar para Portugal


Ellie Goulding convida família de ex para casamento







",pt,"











Sara Carreira invites fans to participate in her EP
07 Nov 2019, 13:50 by The Television

With scheduled release of the first EP for the next 22, Sara Carreira has launched a challenge for fans where gives the opportunity to be part of this project.

The singer has reserved an extra track for a fan participation and anyone interested just send an audio message explaining what the songs of Tony Carreira's daughter mean to themselves.
Submission must be made by What’s App to 914 402 885.
RELATED


Delays in 'Like Me'! TVI does not want to pay influencers who participate in the program


Rita Pereira gives her son a tender hug and invites fans to do the same to her


Lili Caneças invites Robert De Niro to move to Portugal


Ellie Goulding Invites Ex Family To Wedding







"
