,src,lang,text
0,"











Районы НСО получили новые автобусы по областной программе
15 новых автобусов для транспортных предприятий районов купили с начала года в рамках реализации утвержденной региональным правительством программы.

01 Nov 2019, 13:46

Сегодня, 1 ноября, в поселке Колывань заместитель министра транспорта и дорожного хозяйства Новосибирской области Вячеслав Невежин передал водителям ключи от трех автобусов. Об этом сообщили в пресс-службе регионального правительства.
Три новых низкопольных автобуса марки ПАЗ Вектор Next приобретено для МУП Колыванского района «Автосервис». Стоимость транспортных средств – 12,1 млн рублей. За счет субсидий из областного бюджета компенсировано 60% от общей цены автобусов.
Всего с начала года для местных транспортных предприятий купили 15 ПАЗов на сумму 34,4 млн рублей. Субсидия из регионального бюджета составила 9,4 млн рублей.
Министерство транспорта и дорожного хозяйства собрало заявки на покупку еще 61 автобуса. Объем поддержки областного бюджета составит 78,8 млн рублей.
«Приобретение новых автобусов является решением одной из важных проблем в сфере пассажирских перевозок – износ парка подвижного состава. Поэтому правительство региона третий год оказывает содействие перевозчикам и муниципальным образованиям в приобретении транспорта», - отметил Вячеслав Невежин.
Министр заявил, что новые автобусы комфортные и безопасные. Также низкопольные ПАЗы являются удобным средством передвижения для людей с ограниченными возможностями здоровья.
 
Фото: Правительство Новосибирской области


",ru,"











NSO districts received new buses under the regional program
From the beginning of the year, 15 new buses for transport enterprises of the districts were purchased as part of the implementation of the program approved by the regional government.

01 Nov 2019, 13:46

Today, on November 1, in the village of Kolyvan, the Deputy Minister of Transport and Road Facilities of the Novosibirsk Region, Vyacheslav Nevezhin, handed over the keys to three buses to the drivers. This was reported in the press service of the regional government.
Three new PAZ Vector Next low-floor buses were purchased for Avtoservis Municipal Unitary Enterprise Kolyvan District. The cost of vehicles is 12.1 million rubles. Due to subsidies from the regional budget, 60% of the total price of buses was compensated.
Since the beginning of the year, 15 grooves worth 34.4 million rubles have been bought for local transport enterprises. The subsidy from the regional budget amounted to 9.4 million rubles.
The Ministry of Transport and Road Facilities has collected applications for the purchase of another 61 buses. The amount of support for the regional budget will amount to 78.8 million rubles.
“The acquisition of new buses is a solution to one of the important problems in the field of passenger transportation - depreciation of the rolling stock. Therefore, the regional government has been assisting carriers and municipalities in acquiring vehicles for the third year, ”said Vyacheslav Nevezhin.
The minister said the new buses are comfortable and safe. Also, low-floor grooves are a convenient means of transportation for people with disabilities.

Photo: Government of the Novosibirsk Region


"
