,src,lang,text
0,"











എഴുത്തച്ഛൻ പുരസ്കാരം ആനന്ദിന്; അവാർഡ് സാഹിത്യരംഗത്തെ സമഗ്രസംഭാവന പരിഗണിച്ച്
01 Nov 2019, 13:40 by മനോരമ ലേഖകൻ
തിരുവനന്തപുരം ∙ എഴുത്തച്ഛൻ പുരസ്കാരം നോവലിസ്റ്റും ചെറുകഥാകൃത്തുമായ ആനന്ദിന്. സാഹിത്യരംഗത്തെ സമഗ്ര സംഭാവന പരിഗണിച്ചാണ് അഞ്ച് ലക്ഷം രൂപയുടെ പുരസ്കാരം. കേന്ദ്ര–കേരള സാഹിത്യ അക്കാദമി പുരസ്കാരങ്ങൾ ആനന്ദ് നേടിയിട്ടുണ്ട്. തിരുവനന്തപുരത്ത് സാംസ്കാരിക മന്ത്രി എ.കെ.ബാലനാണ് പുരസ്കാരം പ്രഖ്യാപിച്ചത്.
1936-ൽ തൃശ്ശൂർ ജില്ലയിലെ ഇരിങ്ങാലക്കുടയിൽ ജനിച്ച ആനന്ദ് പട്ടാളത്തിലും ഗവൺമെന്റ് സർവീസിലും എഞ്ചിനീയറായിരുന്നു. പി. സച്ചിദാനന്ദൻ എന്നാണ് യഥാർഥ പേര്. ‘ആൾക്കൂട്ടം, മരണസർട്ടിഫിക്കറ്റ്’ എന്നീ നോവലുകളിലൂടെയാണ് ആനന്ദ് മലയാളവായനക്കാർക്ക് സുപരിചിതനായത്. മുംബൈ നഗരത്തിന്റെ പശ്‌ചാത്തലത്തിൽ രചിക്കപ്പെട്ട ‘ആൾക്കൂട്ടം’ ഇന്ത്യൻ യുവത്വത്തിന്റെ പ്രശ്‌നങ്ങൾ ആവിഷ്‌ക്കരിക്കുന്നു. ആധുനിക നോവൽ സാഹിത്യത്തിലെ ഒരു നാഴികക്കല്ല് എന്നു വിശേഷിപ്പിക്കപ്പെട്ട നോവലാണ് ‘ആൾക്കൂട്ടം’.
‘അഭയാർത്ഥികൾ, മരുഭൂമികൾ ഉണ്ടാകുന്നത്, വ്യാസനും വിഘ്‌നേശ്വരനും, ഗോവർദ്ധന്റെ യാത്രകൾ’ എന്നിവ മുഖ്യനോവലുകളാണ്. ‘വീടും തടവും, ഒടിയുന്ന കുരിശ്, ഇര, സംവാദം’ എന്നിവ ചെറുകഥാസമാഹാരങ്ങളും ‘ശവഘോഷയാത്ര’ നാടകവുമാണ്. ‘ഇടപെടലുകൾ, ആനന്ദിന്റെ ലേഖനങ്ങൾ, ജൈവമനുഷ്യൻ, വേട്ടക്കാരനും വിരുന്നുകാരനും, നഷ്‌ടപ്രദേശങ്ങൾ’ എന്നിവ ഉപന്യാസ-പഠനഗ്രന്ഥങ്ങളാണ്. ചരിത്രം, രാഷ്‌ട്രീയം, സാമൂഹ്യശാസ്‌ത്രം എന്നിവ ആനന്ദിന്റെ കൃതികളുടെ അടിസ്‌ഥാനഘടകങ്ങളാണ്.
English Summary: Ezhuthachan Puraskaram for Novelist Anand


",ml,"











Anand receives Ezhuthachan Award Award for Literary Achievement
01 Nov 2019, 13:40 by Manorama Correspondent
Anand wins novelist and short story writer for 'Ezhuthachan' award The award carries a total cash prize of Rs 5 lakh. Anand has won the Central and Kerala Sahitya Akademi awards. The award was announced by CK Minister AK Balan in Thiruvananthapuram.
Born in 1936 at Iringalakkadu in Thrissur district, Anand was an engineer in the army and government services. P. The real name is Sachidanandan. Anand became familiar with Malayalam novels through his novels 'Crowd and Death Certificate'. Written in the backdrop of the city of Mumbai, the mob discusses the problems of Indian youth. The mob is a novel that has been described as a milestone in modern novel literature.
Refugees, Deserts, Vyas and Vigneswaran and Govardhan's Journey are the major novels. The house, the prison, the breaking cross, the victim, and the talk are short stories and the funeral parody drama. Essays and essays are articles on Anand's articles, biological man, hunter, entertainer and loser. History, politics and sociology form the basis of Anand's work.
English Summary: Novelist Anand for Ezhuthachan Puraskaram


"
