,src,lang,text
0,"











Запущен первый в России онлайн-университет социальных наук

01 Nov 2019, 13:30

Масштабная образовательная платформа ""Добро.Университет"", которая была спроектированная с использованием современных технологий онлайн-обучения при сотрудничестве с крупнейшими игроками некоммерческого сектора предложит онлайн-курсы, посвященные разработке и реализации социальных проектов.
О целесообразности запуска проекта рассказал председатель Совета Ассоциации волонтерских центров, член Общественной Палаты Российской Федерации Артем Метелев.
""В прошлом году мы спросили волонтеров, чего им не хватает и увидели явный запрос на образовательные программы. Мы решили запустить онлайн-университет и в партнерстве с ведущими фондами и партнерскими организациями разработали онлайн-курсы, посвященные волонтерству в здравоохранении, культуре, спорте, управлении сообществами, продвижению социальных инициатив и многому другому"", – сказал Метелев. 
По его словам, помимо обучения университет предоставляет возможность пользоваться базой знаний, различными исследованиями, методиками, а также практиками, которые будут загружены в так называемую ""википедию волонтерства"".
""Мы планируем активно развивать университет, и уже в самое ближайшее время там появится карта обучающих семинаров, школ и тренингов, который каждый сможет пройти в оффлайн-режиме"", – объяснил председатель Совета Ассоциации волонтерских центров, член Общественной Палаты. 
При разработке платформы анализировался и учитывался опыт более 40 проектов в сфере онлайн-обучения. Любой желающий может пройти полноценный обучающий курс и получить новые знания и навыки. 
Образовательную программу разрабатывают организации, которые имеют большой опыт и экспертизу в конкретной сфере. Среди видов материалов, которые предлагает ""Добро.Университетом"" – видеокурсы, вебинары, библиотека учебных и методических пособий, статей и исследований от ведущих специалистов в сфере онлайн-образования.
Первыми видеокурсами на платформе станут материалы, предоставленные лидирующими некоммерческими организациями и социально ответственными компаниями России. В частности, вводный курс о добровольчестве от Ассоциации волонтерских центров, курс по поисково-спасательной деятельности совместно с ""Лиза Алерт"", волонтерству в сфере культуры совместно с Всероссийским обществом охраны памятников истории и культуры (ВООПИК), по социальному проектированию (вместе с Форумом доноров), ""Социальное волонтерство"", который подготовлен Агентством стратегических инициатив совместно с фондом ""Вера"", по комьюнити-менеджменту совместно с комьюнити-бюро ""Compot"", курс по продвижению социальных проектов и другие.
Каждый курс делится на модули и уроки, состоящие из видеоролика и дополнительных материалов. Задания подаются через ""живые"" кейсы и реальные примеры, погружение в атмосферу, формат рассказа историй с элементами документалистики, что позволяет слушателям легче воспринимать его и эффективнее обучаться. На любой из курсов можно записаться бесплатно. По итогам слушатели смогут получить электронный сертификат о его прохождении.
В дальнейшем планируется выдача слушателям сертификата государственного образца от интеллектуального партнера платформы. Информация о прохождении курса будут передаваться в электронную волонтерскую книжку ЕИС ""Добровольцы России"" и другие интегрированные информационные системы, среди которых АИС ""Молодежь России"", ""Работа в России"", цифровой профиль гражданина и другие. 
Целевая аудитория проекта – сотрудники некоммерческих и волонтерских организаций, органов власти, сами волонтеры, преподаватели и студенты, сотрудники социально ответственных компаний, а также все неравнодушные граждане. 
""Добро.Университет"" запускается Ассоциацией волонтерских центров совместно с ФГБУ ""Роспатриотцентр"" в рамках нового проекта ""Добро.рф"", который объединит ЕИС ""Добровольцы России"" и онлайн-издание ""Добро.Журнал"", посвященное созидательной гражданской активности.
Цель этого университета  – создать крупнейшую базу знаний для развития и поддержки общественных инициатив в Российской Федерации. Интеллектуальным партнером университета станет один из крупнейших вузов страны. 

Двери ""Добро.Университета"" открыты для всех желающих с 1 ноября по адресу университет.добро.рф.



",ru,"











Launched Russia's first online university of social sciences

01 Nov 2019, 13:30

The large-scale educational platform ""Dobro.Universitet"", which was designed using modern online learning technologies in cooperation with the largest players in the non-profit sector, will offer online courses on the development and implementation of social projects.
The chairman of the Council of the Association of Volunteer Centers, a member of the Public Chamber of the Russian Federation, Artem Metelev, spoke about the feasibility of launching the project.
“Last year, we asked volunteers what they lacked and saw a clear request for educational programs. We decided to launch an online university and, in partnership with leading foundations and partner organizations, developed online courses on volunteering in healthcare, culture, sports, management communities, promoting social initiatives and much more, ""said Metelev.
According to him, in addition to training, the university provides an opportunity to use the knowledge base, various studies, methods, as well as practices that will be uploaded to the so-called ""Wikipedia of volunteering.""
""We plan to actively develop the university, and in the very near future there will be a map of training seminars, schools and trainings, which everyone can take offline,"" explained the chairman of the Association of Volunteer Centers Council, a member of the Public Chamber.
When developing the platform, the experience of more than 40 projects in the field of online learning was analyzed and taken into account. Anyone can take a full training course and gain new knowledge and skills.
The educational program is developed by organizations that have extensive experience and expertise in a particular field. Among the types of materials that Dobro.Universitet offers are video courses, webinars, a library of teaching and methodological aids, articles and studies from leading experts in the field of online education.
The first video courses on the platform will be materials provided by leading non-profit organizations and socially responsible companies in Russia. In particular, an introductory course on volunteering from the Association of Volunteer Centers, a course on search and rescue activities together with Lisa Alert, volunteering in the field of culture together with the All-Russian Society for the Protection of Historic and Cultural Monuments (VOOPIK), on social design (together with the Forum of Donors ), ""Social Volunteering"", which was prepared by the Agency for Strategic Initiatives in conjunction with the Vera Foundation, on community management in conjunction with the Compot community bureau, a course on promoting social projects and others.
Each course is divided into modules and lessons, consisting of a video and additional materials. Tasks are given through live cases and real-life examples, immersion in the atmosphere, the format of storytelling with documentary elements, which allows students to more easily perceive it and learn more effectively. You can enroll in any of the courses for free. Following the results, students will be able to receive an electronic certificate of its passage.
In the future, it is planned to issue students a state standard certificate from an intellectual partner of the platform. Information about the course will be transferred to the electronic volunteer book EIS ""Volunteers of Russia"" and other integrated information systems, including AIS ""Youth of Russia"", ""Work in Russia"", a digital profile of a citizen and others.
The target audience of the project is employees of non-profit and volunteer organizations, authorities, volunteers themselves, teachers and students, employees of socially responsible companies, as well as all concerned citizens.
Dobro.Universitet is launched by the Association of Volunteer Centers together with the Federal State Budget Institution Rospatriottsentr within the framework of the new Dobro.rf project, which will unite the UIS Volunteers of Russia and the online publication Dobro.Zhurn, dedicated to creative civic activism.
The goal of this university is to create the largest knowledge base for the development and support of public initiatives in the Russian Federation. The intellectual partner of the university will be one of the largest universities in the country.

Doors of Dobro.Universitet are open to all comers from November 1 to the address university.debro.rf.



"
