,src,lang,text
0,"











УЗ рассматривает различные варианты частно-государственного партнерства, - Саболевский

01 Nov 2019, 13:52

«Укрзализныця» считает перспективными для привлечения частного капитала железнодорожные вокзалы, немагистральную инфраструктуру и интермодальные комплексы, сообщает пресс-служба компании со ссылкой на директора по стратегическому развитию и инвестиционной политике Антон Саболевского
«Укрзализныця» сотрудничает со Всемирным банком и планирует привлечь ЕБРР по поводу концессии железнодорожных вокзалов. В мировой практике развито частно-государственное партнерство в форме концессии вокзалов. Также частные инвестиции целесообразно вкладывать в припортовых станции, подъездные пути для увеличения пропускной способности и улучшения качества услуг, а также интермодальные комплексы», - отметил Саболевский.
Он добавил, что мировой опыт свидетельствует о нецелесообразности полной приватизации железных дорог, поэтому в разных странах через механизм IPO избираются наиболее приемлемые варианты. Выход «Укрзализныци» на IPO позволит привлечь инвестиции в обновление подвижного состава и инфраструктуры.
«Для улучшения качества обслуживания клиентов необходимы инвестиции, а действующие тарифы и отсутствие государственного финансирования не оставляют другого выбора, как обращаться к частному рынку капитала и привлекать средства, чтобы инвестировать в развитие железной дороги. Именно IPO является тем инструментом, который позволяет не брать на себя долговые обязательства, не увеличивать кредитный портфель, а за часть акций привлекать определенное количество средств для инвестирования в подвижной состав и инфраструктуру», - отметил Саболевский.
Ранее «Укрзализныця», Мининфраструктуры и ЕБРР подписали меморандум о сотрудничестве по подготовке железнодорожной компании к IPO.





",ru,"











UZ considers various options of public-private partnership, - Sabolevsky

01 Nov 2019, 13:52

Ukrzaliznytsia believes that railway stations, non-trunk infrastructure and intermodal complexes are promising for attracting private capital, the company’s press service reports with reference to Anton Sabolevsky, director for strategic development and investment policy
Ukrzaliznytsia is collaborating with the World Bank and plans to attract the EBRD regarding the concession of railway stations. In world practice, private-state partnerships are developed in the form of train station concessions. It is also advisable to invest private investments in port stations, access roads to increase throughput and improve the quality of services, as well as intermodal complexes, ”Sabolevsky said.
He added that world experience indicates the inappropriateness of the full privatization of railways, therefore, in different countries through the IPO mechanism the most appropriate options are selected. Ukrzaliznytsia’s IPO will help attract investment in the renewal of rolling stock and infrastructure.
“Investments are needed to improve the quality of customer service, and current tariffs and the lack of state financing do not leave any other choice, how to turn to the private capital market and raise funds to invest in the development of the railway. That IPO is the tool that allows you not to incur debt obligations, not to increase the loan portfolio, but to attract a certain amount of funds for investing in rolling stock and infrastructure for part of the shares, ”Sabolevsky said.
Earlier, Ukrzaliznytsia, the Ministry of Infrastructure and the EBRD signed a memorandum of cooperation to prepare the railway company for an IPO.





"
