,src,lang,text
0,"











दिल्ली हमेशा मेरे जीवन का एक बहुत ही प्यारा हिस्सा रहेगी : सयानी गुप्ता
01 Nov 2019, 13:24 by नई दिल्ली | हिन्दुस्तान टीम
अभिनेत्री सयानी गुप्ता का नाता दिल्ली से काफी पुराना है। वह अपने कॉलेज के दिनों को बहुत याद करती हैं। वह अकसर दिल्ली आती हैं, लेकिन उनका मानना है कि अब दिल्ली बदल गई है। आइए उन्हीं से जानते हैं कि दिल्ली में उन्होंने क्या बदलाव देखे...
अभिनेत्री सयानी गुप्ता के फिल्मों और वेब सिरीज में दमदार प्रदर्शन ने उन्हें बेहतरीन एक्टर्स की फेहरिस्त में शुमार कर लिया है। वह जब भी दिल्ली आती हैं, तो सतर्क और घर के अंदर रहना ही पसंद करती है। इसका दोष वह शहर के आक्रामक रवैये को देती हैं।
दिल्ली विश्वविद्यालय के लेडी श्रीराम कॉलेज फॉर वीमेन (एलएसआर) से पढ़ीं सयानी को लगता है कि शहर बहुत बदल गया है। बकौल सयानी, ‘जब मैं दिल्ली आती हूं, तो बाहर जाना पसंद नहीं करती, क्योंकि दिल्ली अब पहली जैसी नहीं रही। अब आप जो भी पहनते हैं, उसके बारे में सोचना पड़ता है। मेरे कॉलेज के दिनों में ऐसा बिल्कुल नहीं था। मैंने उस दौरान (2004-2007) बैकलेस टॉप पहन कर डीटीसी बसों में यात्रा की है और तब ऐसा कोई डर नहीं था!’
2012 में वह दिल्ली एक फिल्म ‘सेकंड मैरिज डॉट कॉम’ की शूटिंग के लिए एनसीआर आई थीं, तब हुई एक अप्रिय घटना उन्हें कंपकंपा देती है। वह बताती हैं, ‘मैं शूटिंग से एक दिन पहले ही  गुरुग्राम पहुंच गई थी और उसी दिन शाम 6 बजे सार्वजनिक रूप से किसी ने मेरे साथ छेड़छाड़ की। मुझे बेहद गुस्सा आया। फिर वेब फिल्म ‘दि हंग्री’ (2017) के लिए मैं और टिस्का चोपड़ा दिल्ली आए... हमारे साथ जो जूनियर आर्टिस्ट्स थे, वही हमें देख रहे थे। ऐसे में आप अपने ही सेट पर अजीब-सा महसूस करते हैं। दिल्ली ऐसी हो गई है...!’ सयानी कहती हैं कि उन्होंने शहर का बदसूरत पक्ष भी देखा है। लेकिन फिर भी वह अपने कॉलेज के दिनों की वजह से और यहां के खाने के कारण दिल्ली आती-जाती रहती हैं। 
वह कहती हैं, ‘दिल्ली हमेशा मेरे जीवन का एक बहुत ही प्यारा हिस्सा रहेगी। कॉलेज में मेरे प्रारंभिक वर्ष शानदार थे, क्योंकि एलएसआर एक करिश्माई स्थान था। जब मैं दिल्ली में काम कर रही थी, तब भी कई कॉन्फ्रेंस में हिस्सा लिया करती थी। मैं रात में साढ़े नौ से 10 बजे के आसपास प्रगति मैदान के बाहर कई बाहर टहली हूं। अब तो यह सोचा भी नहीं जा सकता। अब तो शायद कोई सेकेंड्स में ही आपको उठा ले जाएगा।
हिना रखेजा 


",hi,"











Delhi will always be a very loving part of my life: Sayani Gupta
01 Nov 2019, 13:24 by New Delhi | Hindustan team
Actress Sayani Gupta's relationship is much older than Delhi. She misses her college days very much. She often comes to Delhi, but believes that Delhi has changed now. Let's know from him what changes he saw in Delhi ...
Actress Sayani Gupta's strong performance in films and web series has made her one of the best actors. Whenever she comes to Delhi, she prefers to stay alert and indoors. She blames the city's aggressive attitude.
Sayani, who studied at Lady Shri Ram College for Women (LSR) of Delhi University, feels that the city has changed a lot. Sayani said, ""When I come to Delhi, I don't like to go out, because Delhi is no longer the same."" Now you have to think about what you wear. This was not the case in my college days. During that time (2004-2007) I have traveled in DTC buses wearing backless tops and there was no such fear then! '
In 2012, she came to NCR to shoot for a Delhi film 'Second Marriage.com', an unpleasant incident shakes her. She says, ""I reached Gurugram a day before the shooting and someone molested me in public the same day at 6 pm."" I got very angry. Then I and Tisca Chopra came to Delhi for the web film 'The Hungry' (2017) ... the junior artists who were with us were watching us. In such a situation, you feel strange on your own set. Delhi has become so…! ”Sayani says that she has also seen the ugly side of the city. But still she keeps on coming to Delhi because of her college days and eating here.
She says, ""Delhi will always be a very loving part of my life. My early years in college were fantastic, as LSR was a charismatic place. When I was working in Delhi, I used to attend many conferences. I stroll several outside the Pragati Maidan around 9:30 AM to 10 PM. Now this cannot be imagined. Now maybe someone will pick you up in seconds.
Henna Rakheja


"
