,src,lang,text
0,"











Éder e Gonçalo Paciência de regresso à selecção nacional
Foto de vinha no norte da Madeira vence competição da revista internacional Winerist
07 Nov 2019, 04:34 by Rúben Santos


Foto Global Imagens

O seleccionador nacional de futebol, Fernando Santos, anunciou há instantes, na Cidade do Futebol, em Oeiras, a lista de convocados para os próximos dois desafios da Selecção das Quinas, frente às congéneres da Lituânia e Luxemburgo, tendo em vista o apuramento para o Euro 2020.

Eis a lista de 25 convocados divulgada por Fernando Santos:

- Guarda-redes: Rui Patrício (Wolverhampton), Beto (Goztepe) e José Sá (Olympiacos)
- Defesas: Nélson Semedo (Barcelona), Ricardo Pereira (Leicester), Pepe (FC Porto), Rúben Dias (Benfica), José Fonte (Lille), Rúben Semedo (Olympiacos), Mário Rui (Nápoles) e Raphael Guerreiro (Dortmund)
- Médios: Danilo (FC Porto), João Mário (Lokomotiv), Rúben Neves (Wolverhampton), João Moutinho (Wolverhampton), Bruno Fernandes (Sporting) e Pizzi (Benfica)
- Avançados: Bernardo Silva (Manchester City), Bruma (PSV), Gonçalo Paciência (Eintracht Frankfurt), Cristiano Ronaldo (Juventus), Éder (Lokomotiv Moscovo), Diogo Jota (Wolverhampton), André Silva (Eintracht Frankfurt) e Daniel Podence (Olympiakos).
A Ucrânia, que já garantiu o primeiro lugar do Grupo B, soma 19 pontos, seguida de Portugal, com 11. A Sérvia segue com 10 pontos, o Luxemburgo com quatro e a Lituânia tem apenas um.


",pt,"











Éder and Gonçalo Patience returns to national team
Vineyard Photo in Northern Madeira Wins Winerist International Magazine Competition
07 Nov 2019, 04:34 by Rúben Santos


Global Photo Images

The national football coach, Fernando Santos, announced a moment ago, in the City of Football, in Oeiras, the list of squads for the next two challenges of the National Team, against the counterparts of Lithuania and Luxembourg, with a view to qualifying for the Euro 2020

Here is the 25-man squad published by Fernando Santos:

- Goalkeeper: Rui Patrício (Wolverhampton), Beto (Goztepe) and José Sá (Olympiacos)
- Defenders: Nélson Semedo (Barcelona), Ricardo Pereira (Leicester), Pepe (FC Porto), Reuben Dias (Benfica), Jose Fonte (Lille), Reuben Semedo (Olympiacos), Mario Rui (Naples) and Raphael Guerreiro (Dortmund)
- Midfielders: Danilo (FC Porto), João Mário (Lokomotiv), Rúben Neves (Wolverhampton), João Moutinho (Wolverhampton), Bruno Fernandes (Sporting) and Pizzi (Benfica)
- Forwards: Bernardo Silva (Manchester City), Bruma (PSV), Gonçalo Patience (Eintracht Frankfurt), Cristiano Ronaldo (Juventus), Éder (Lokomotiv Moscow), Diogo Jota (Wolverhampton), André Silva (Eintracht Frankfurt) and Daniel Podence ( Olympiakos).
Ukraine, who have already secured top spot in Group B, have 19 points, followed by Portugal with 11. Serbia follow with 10 points, Luxembourg with four and Lithuania have just one.


"
