,src,lang,text
0,"











Jovem é morta dentro de casa de prostituição: 'Eu sou feio', disse atirador
Motociclista se aproximou de capacete, disse a frase e atirou na vítima
06 Nov 2019, 19:47 by Redação
Uma mulher de 23 anos foi morta a tiros na noite da terça-feira (5) em uma casa de prostituição na cidade de Colniza, no Mato Grosso. Jessica Payerl Antunes trabalhava no local quando foi atingida. O corpo da vítima foi achado em uma mesa.
Não se sabe o que motivou o crime. Um suspeito já foi identificado, mas até o momento não foi preso.
De acordo com a Polícia Militar, um homem chegou ao local em uma moto vermelha, entrou, atirou e fugiu. Jessica caiu de bruços sobre uma mesa próxima, onde foi achada já sem vida quando o socorro do Serviço Móvel de Urgência (samu) chegou. 
Uma testemunha relatou à Polícia Civil, segundo o G1 Mato Grosso, que estava com a vítima sentada na mesa quando o suspeito chegou. De capacete na cabeça, ele foi até elas, falou ""eu sou feio"", sacou a arma e atirou em Jéssica. A moça foi baleada uma vez em cada braço e no queixo. 
O dono do local disse que estava lá quando ouviu os tiros, mas não chegou a ver o atirador, que fugiu rapidamente.
As investigações continuam. 


",pt,"











Young woman killed in prostitution house: 'I'm ugly,' said shooter
Motorcyclist approached helmet, said the phrase and shot the victim
06 Nov 2019, 19:47 by Writing
A 23-year-old woman was shot dead Tuesday night at a prostitution house in the city of Colniza, Mato Grosso. Jessica Payerl Antunes was working at the scene when she was hit. The victim's body was found on a table.
It is not known what motivated the crime. A suspect has already been identified but has not been arrested so far.
According to the Military Police, a man arrived at the scene on a red motorcycle, got in, shot and fled. Jessica fell face down on a nearby table, where she was found lifeless when the Mobile Emergency Service (samu) help arrived.
A witness reported to the Civil Police, according to G1 Mato Grosso, who was with the victim sitting at the table when the suspect arrived. With a helmet on his head, he went to them, said ""I'm ugly"", drew his gun and shot Jessica. The girl was shot once in each arm and chin.
The local owner said he was there when he heard the gunfire, but did not get to see the sniper, who fled quickly.
The investigations continue.


"
