,src,lang,text
0,"











Flores d'arcais: ''l’estinzione del movimento 5 stelle non pu

06 Nov 2019, 19:22


PORTATE UN FLORES SULLA TOMBA DEI GRILLINI: ''L’ESTINZIONE DEL MOVIMENTO 5 STELLE NON PUÒ ESSERE FERMATA''. IL DIRETTORE DI 'MICROMEGA' IMPIETOSO VERSO DI MAIO E I SUOI: ''LE RAGIONI STRUTTURALI DEL M5S SONO DUE, E A NESSUNA DI ESSE DI MAIO, O CASALEGGIO, O PERFINO GRILLO, SONO IN GRADO DI RINUNCIARE. L’ASSURDA PRETESA DI NON ESSERE NÉ DI DESTRA NÉ DI SINISTRA, E…''



Paolo Flores d'Arcais per http://temi.repubblica.it/micromega-online/

Solo un anno e mezzo fa il M5S, con una campagna elettorale scandita da “onestà, onestà!” e incentrata sulla lotta alle diseguaglianze, alla corruzione, alle mafie, alla spartizione partitocratica di Rai e altri mille enti a nomina politica, otteneva quasi undici milioni di suffragi, il 32,68% alla Camera e il 32,22% al Senato.




paolo flores d arcais

Contro ogni logica e ogni decenza, Di Maio si accordava con Salvini per spartirsi le poltrone nel governo Conte (1 giugno 2018), e il 1 luglio un sondaggio Ipsos dava la Lega già sopra il M5S, che rapidamente sarebbe tracollata perdendo un elettore su due (17,2% alle europee del maggio 2019).
Era ovvio. Del resto al primo occhiolino tra Di Maio e Salvini, il 21 marzo 2018, avevo scritto: “Senza ricorrere a Nostradamus: i cinquestelle perderebbero tutti i voti dei cittadini in rivolta per giustizia e libertà, gli resterebbero solo gli enragés delle partite Iva, ma in quest’orizzonte Salvini (e Berlusconi!) sono i pesci nell’acqua, i grillini di ‘onestà!’ finirebbero naufraghi”. E infatti.




BEPPE GRILLO DI MAIO NAPOLI

Conclusa al Papeete l’esperienza abominevole, Di Maio ruota il M5S da Salvini a Zingaretti (benché non volesse l’accordo sul Conte 2, come Zingaretti, d’altronde), e anzi ufficializza la nuova alleanza con il “cheese!” di Narni. Risultato delle elezioni in Umbria, il M5S al 7,4%. Perciò Di Maio capriola di nuova, mai più candidati comuni alle Regionali, in Emilia-Romagna andiamo da soli. Se davvero, allora, senza scomodare Nostradamus, ripeterà il risultato a una cifra.




salvini conte

Di Maio sembra una mosca intrappolata in un bicchiere rovesciato. Può provare a inventarsi tutti i numeri da circo che vuole, non servirà. L’estinzione del M5S è in corso e non può essere fermata. Perché le sue ragioni strutturali sono due, e a nessuna di esse Di Maio, o Casaleggio, o perfino Beppe Grillo, sono in grado di rinunciare.
Le avevo indicate anni e anni fa, quando il MoVimento mieteva i suoi primi successi: l’assurda pretesa di non essere né di destra né di sinistra, e una selezione dei suoi dirigenti con “procedure da X Factor o ‘Amici’ della De Filippi”.




matteo salvini luigi di maio

L’osceno connubio M5S-Salvini non poteva funzionare perché Salvini costituiva da sempre la destra lepenista (oggi si dovrebbe dire che è il lepenismo a costituire il salvinismo francese), la vocazione al governo pre-fascista, mentre Di Maio continuava a illudersi di poter mantenere il M5S nella sua ambiguità di essere “oltre”. E così tra una forza coerente (la Lega di Salvini) e una “né carne né pesce” l’egemonia non poteva che finire interamente nelle mani della prima.
Ma andando con il Pd questa ambiguità mortale del M5S resta. Qui ovviamente non parliamo (non ne parliamo più da anni) di “destra” e “sinistra” nel senso politicoso e partitocratico (e spesso anche giornalistico, ahimè), ma in quello sostanziale dei valori e interessi di riferimento, insomma dello schieramento che difende privilegi e promuove illibertà, dove Berlusconi, Meloni e Salvini sono solo varianti becere o ancor più becere (e Renzi la versione presentabile), o di quello che promuove eguaglianza e libertà, più eguaglianza e più libertà, ogni giorno.




Grillo e Di Maio

Ogni politica fa pendere la bilancia su uno dei due versanti, non esiste l’interesse e il bene generale che accontenta tutti. E le destre, quanto più sono estreme tanto più fanno pendere la bilancia verso le garanzie per il privilegio e l’hybris di illibertà. I fascismi questo sono: dove la patina (o anche la polpa) sociale serve a proteggere i privilegi sviando la collera popolare su capri espiatori (l’ebreo, il migrante) anziché sulle radici di classe.
Oggi l’unica forza che manca, nella geografia della politica organizzata, è proprio una forza giustizia-e-libertà, ma il M5S non potrà mai convertirsi in tale forza, l’unica che potrebbe fornirgli un futuro, essendo tutti gli altri spazi compiutamente occupati (con non poche sovrapposizioni). Non potrà perché la sua selezione a roulette, la sua non-democrazia dei likevoti, non consente che nasca al suo interno una classe dirigente con la cultura e la tempra necessarie.




casaleggio bugani grillo

Il M5S non potrà che continuare ad allearsi col Pd, checché cianci in contrario, perché l’opzione “ruota di scorta” di Salvini è tramontata per sempre. Ma è un’alleanza tanto obbligata quanto fatale, una modalità della sua estinzione. A meno che di tale necessità non faccia invece una virtù: rendendo coerente la sua vocazione antipartitocratica ed egualitaria delle origini, e prospettando per l’alleanza M5S-Pd una immersione rigeneratrice integrale e prolungata nella società civile delle lotte di questi decenni e di quelle che forse si profilano, ambientaliste e non solo.




beppe grillo davide casaleggio 9

Con relativo scioglimento dei rispettivi apparati di potere e apparizione di una classe dirigente nuova al novanta per cento. Miracolo difficilmente pensabile.


",it,"











Flores d'arcais: '' the extinction of the 5-star movement cannot

06 Nov 2019, 19:22


BRING A FLORES ON THE GRILLINI TOMB: '' THE 5 STARS MOVEMENT EXTINCTION CANNOT BE STOPPED ''. THE DIRECTOR OF 'MICROMEGA' IMPIETOSO TOWARDS MAIO AND HIS OWN: '' THE STRUCTURAL REASONS OF M5S ARE TWO, AND TO ANYONE OF MAIO, OR CASALEGGIO, OR PERFINO GRILLO, I AM ABLE TO GIVE UP. THE ABSURDA PRETESA OF NOT BEING NOR RIGHT OR LEFT, AND ... ''



Paolo Flores d'Arcais for http://temi.repubblica.it/micromega-online/

Only a year and a half ago the M5S, with an electoral campaign marked by ""honesty, honesty!"" And focused on the fight against inequality, corruption, the mafias, the partitocratic division of Rai and a thousand other politically appointed bodies, obtained almost eleven millions of votes, 32.68% in the House and 32.22% in the Senate.




paolo flores d arcais

Against all logic and decency, Di Maio agreed with Salvini to divide the seats in the Conte government (June 1, 2018), and on July 1, an Ipsos poll gave the League already over the M5S, which would quickly collapse losing one voter out of two (17.2% to the Europeans in May 2019).
It was obvious. Moreover, at the first wink between Di Maio and Salvini, on 21 March 2018, I had written: ""Without resorting to Nostradamus: the fifties would lose all the votes of the citizens in revolt for justice and freedom, he would have only the enragés of VAT numbers, but in this horizon Salvini (and Berlusconi!) are the fish in the water, the grillini of 'honesty!' they would end up shipwrecked ”. And indeed.




BEPPE GRILLO DI MAIO NAPOLI

The abominable experience ended at Papeete, Di Maio rotates the M5S from Salvini to Zingaretti (although he did not want the agreement on Conte 2, like Zingaretti, on the other hand), and indeed formalizes the new alliance with the ""cheese!"" Of Narni . Result of the elections in Umbria, the M5S at 7.4%. Therefore Di Maio somersault of new, never more common candidates for the Regionals, in Emilia-Romagna we go alone. If indeed, then, without disturbing Nostradamus, he will repeat the result in one digit.




salvini count

Di Maio looks like a fly trapped in an overturned glass. You can try to come up with all the circus numbers you want, you won't need it. The extinction of the M5S is ongoing and cannot be stopped. Because its structural reasons are two, and to none of them Di Maio, or Casaleggio, or even Beppe Grillo, I am able to give up.
I had indicated them years and years ago, when the MoVement reaped its first successes: the absurd claim to be neither right nor left, and a selection of its leaders with ""X Factor or 'Amici' procedures by De Filippi "".




matteo salvini luigi from maio

The obscene union M5S-Salvini could not work because Salvini had always been the rightist lepenist (today we should say that it is the lepenism that constitutes French Salvinism), the vocation to the pre-fascist government, while Di Maio continued to delude himself that he could keep the M5S in its ambiguity of being ""beyond"". And so between a coherent force (the League of Salvini) and a ""neither meat nor fish"" the hegemony could only end up entirely in the hands of the former.
But going with the PD this deadly ambiguity of the M5S remains. Here we obviously do not talk (we have not talked about it for years) of ""right"" and ""left"" in the politic and partocratic sense (and often also journalism, alas), but in the substantial one of values and interests of reference, in short, of the line that defends privileges and promotes illiberty, where Berlusconi, Meloni and Salvini are only variants that are becere or even more becere (and Renzi the presentable version), or of that which promotes equality and freedom, more equality and more freedom, every day.




Grillo and Di Maio

Each policy slants the scales on one of the two sides, there is no interest and the general good that satisfies everyone. And the more extreme the more right the more they tip the scales towards guarantees for the privilege and the hybris of illiberty. Fascisms are this: where the patina (or even the pulp) serves to protect privileges by diverting popular anger over scapegoats (Jews, migrants) rather than class roots.
Today the only force that is lacking, in the geography of organized politics, is precisely a justice-and-freedom force, but the M5S can never be converted into such a force, the only one that could provide it with a future, since all the other spaces are completely complete occupied (with not a few overlaps). He cannot because his selection at roulette, his non-democracy of likevoti, does not allow a ruling class with the necessary culture and temperament to be born within it.




casaleggio bugani grillo

The M5S can only continue to ally with the Democratic Party, no matter what they say against it, because Salvini's ""spare wheel"" option has gone down forever. But it is an alliance that is as obligatory as it is fatal, a modality of its extinction. Unless such a necessity does not instead make a virtue: by making its anti-partisan and egalitarian vocation of the origins coherent, and envisaging for the M5S-Pd alliance an integral and prolonged regenerative immersion in the civil society of the struggles of these decades and those which perhaps they are environmentalists and not only.




beppe grillo davide casaleggio 9

With relative dissolution of the respective apparatuses of power and appearance of a new ruling class at ninety percent. Miracle hardly thinkable.


"
