,src,lang,text
0,"











Останній подарунок Джорджа Майкла вийшов у світ для розповсюдження «любові та святкової радості»

06 Nov 2019, 19:50

Пісню «This Is How (We Want You Get You High)» Майкл записав у 2015-му, але до прем'єри не дожив
Родина Майкла Джорджа зробила його шанувальникам подарунок до зимових свят, випустивши вперше за останні сім років нову композицію британського співака.
Про це повідомляє Contact Music.
Зазначається, що пісню «This Is How (We Want You Get You High)» Майкл записав у 2015-му, але до прем'єри не дожив.
Новий сингл оприлюднили сьогодні, 6 листопада, щоб розповсюдити «любов та святкову радість».
«Ми з гордістю вручаємо цей новий трек у якості його подарунку для вас, щоби передати всім вас любов та радість», - сказав менеджер артиста.
Посмертний трек пролунає й у документальному фільмі про Джорджа Майкла «Last Christmas», що вийде у кінотеатрах 15 листопада.



Нагадаємо, Джордж Майкл помер на Різдво 2016 року у 53-річному віці. Причиною раптової смерті співака стали захворювання серця та печінки.
Як відомо, в 2017-му світ почув посмертний сингл Джоджа Майкла «Fantasy», але це була не нова, а перероблена однойменна композиція.







",uk,"











George Michael's latest gift was released to spread ""love and festive joy""

06 Nov 2019, 18:50

Michael recorded the song ""This Is How (We Want You Get You High)"" in 2015, but didn't live until the premiere
Michael George's family has made his fans a gift for the winter holidays, releasing for the first time in seven years a new composition by the British singer.
About it reports Contact Music.
It is noted that Michael recorded the song ""This Is How (We Want You Get You High)"" in 2015, but did not live until the premiere.
The new single was released today, November 6, to spread ""love and festive joy.""
""We are proud to present this new track as a gift for you to convey to you all love and joy,"" said the artist manager.
The posthumous track is also featured in the documentary on George Michael's ""Last Christmas,"" which will hit theaters on November 15.



Recall George Michael died at Christmas 2016 at the age of 53. The cause of the singer's sudden death were heart and liver diseases.
As you know, in 2017, the world heard the posthumous single of JJ Michael's ""Fantasy"", but it was not a new but a redesigned song of the same name.







"
