,src,lang,text
0,"











Asistente de voz de Amazon, único testigo de un asesinato en Estados Unidos
La Policía de Florida aseguró que había solicitado una orden judicial para acceder a las grabaciones de Alexa en el momento exacto del crimen pasional.

06 Nov 2019, 19:20

Silvia Galva Crepo falleció en julio por una herida que recibió en el pecho con una lanza que tenía una cuchilla de 20 centímetros. El asesinato ocurrió en su residencia ubicada en Hallandale Beach, Florida, según el comunicado publicado en el SunSentinel.
La única persona presente en el crimen fue su esposo, Adam Crespo, por lo que la policía cree que es el culpable del homicidio y pretende comprobarlo por medio de las grabaciones de los Echo y Echo Dot de Amazon que estaban en el hogar, apuntó el medio.
De acuerdo con la orden de allanamiento, Adam tuvo una discusión fuerte con su esposa antes del crimen y los investigadores quieren escuchar lo que grabaron los parlantes inteligentes para saber si fue un asesinato o un suicidio.
“Creemos que pruebas de los crímenes, (como) grabaciones de audio del ataque de la víctima en la habitación principal… podrían estar en un servidor gestionado por o para Amazon”, señaló la policía en el informe.
A pesar de que la policía ya tiene algunos audios, Amazon aseguró que no estaba de acuerdo con revelar la información de sus clientes y dijo que estas órdenes eran inapropiadas, pero tenían que acatarlas por obligación, de acuerdo con Gizmodo.


",es,"











Amazon voice assistant, the only witness to a murder in the United States
Florida Police said they had requested a court order to access Alexa's recordings at the exact moment of the crime of passion.

06 Nov 2019, 19:20

Silvia Galva Crepo died in July from a wound she received in the chest with a spear that had a 20-centimeter blade. The murder occurred at his residence located in Hallandale Beach, Florida, according to the statement published in the SunSentinel.
The only person present in the crime was her husband, Adam Crespo, so the police believe he is guilty of the murder and intends to prove it through the recordings of Amazon's Echo and Echo Dot that were in the home, said the means, medium.
According to the search warrant, Adam had a strong discussion with his wife before the crime and investigators want to hear what the smart speakers recorded to know if it was a murder or a suicide.
""We believe that evidence of the crimes, (such as) audio recordings of the victim's attack in the main room ... could be on a server managed by or for Amazon,"" police said in the report.
Although the police already have some audios, Amazon said they did not agree to disclose their clients' information and said that these orders were inappropriate, but they had to abide by obligations, according to Gizmodo.


"
