,src,lang,text
0,"











6 причин из-за которых повышается уровень гормона стресса кортизола

06 Nov 2019, 21:23




Кортизол известен как гормон стресса. Постоянный стресс и недосып, а также другие причины приводят к хронически повышенному уровню кортизола, что может иметь различные неприятные последствия для здоровья.Почти все причины хронически повышенного уровня кортизола – это составляющие нездорового образа жизни.Стресс. Кортизол секретируется корой надпочечников, когда человек находится в стрессовой ситуации. В обстоятельствах непродолжительного стресса он помогает организму справиться с напряженной ситуацией, после чего вновь снижается. Но если стресс становится хроническим, уровень кортизола  оказывается постоянно высоким.Нездоровая диета и напитки с кофеином. Рацион, который содержит много сладких продуктов, продуктов из белой муки и напитков с кофеином (кофе, кола, энергетические напитки), также способствует повышению уровня кортизола в крови.Недостаток сна и слишком мало отдыха. Аналогичным образом, недостаток сна или отсутствие достаточного количества расслабляющих моментов в жизни человека ведут к постоянно повышенному уровню кортизола.Искусственный свет. Искусственное освещение, в особенности, поздними вечерами и ночью, - это еще одна причина высокой концентрации кортизола.Алкоголь. Сначала спиртное снижает выброс кортизола, что приводит к расслабляющему эффекту. Но через некоторое время - примерно через два часа - влияние алкоголя на уровень кортизола снижается, в результате чего организм оказывается менее способным справляться со стрессом, чем раньше. Таким образом, алкоголь усугубляет проблему стресса в долгосрочной перспективе.Слишком мало воды. Обезвоживание влияет на работу всех органов и систем в организме. Одно из его последствий - повышенный уровень кортизола.Симптомы или последствия хронически высокого уровня кортизола. Люди, страдающие от постоянно повышенного уровня кортизола, могут испытывать следующие симптомы:

Частые инфекции из-за ослабленная иммунной системы.
Высокое кровяное давление и болезни сердца.
Нарушение сна, усталость и беспокойство.
Тревога, перепады настроения и депрессия.
Проблемы с концентрацией и памятью.
Снижение либидо: кортизол ингибирует выброс половых гормонов.
Повышение уровня сахара в крови.
Склонность к избыточному весу, особенно к ожирению на животе.
Потеря мышечной массы, неспособность нарастить мышцы тренировками.
Повышенная чувствительность к боли.
Раздраженный кишечник или изжога.

Ранее МедикФорум писал о том, в каких случаях стресс может быть полезен для человека.


",ru,"











6 reasons why stress hormone cortisol rises

06 Nov 2019, 21:23




Cortisol is known as the stress hormone. Constant stress and lack of sleep, as well as other causes lead to chronically elevated levels of cortisol, which can have various unpleasant health consequences. Almost all causes of chronically elevated levels of cortisol are components of an unhealthy lifestyle. Stress. Cortisol is secreted by the adrenal cortex when a person is in a stressful situation. In circumstances of short stress, it helps the body cope with a tense situation, and then decreases again. But if stress becomes chronic, cortisol levels are constantly high. An unhealthy diet and caffeinated drinks. A diet that contains a lot of sugary foods, white flour products, and caffeinated drinks (coffee, cola, energy drinks) also increases blood cortisol levels. Lack of sleep and too little rest. Similarly, lack of sleep or lack of sufficient relaxing moments in a person’s life leads to a constantly elevated level of cortisol. Artificial light. Artificial lighting, especially in the late evenings and at night, is another reason for the high concentration of cortisol. Alcohol. At first, alcohol reduces the release of cortisol, which leads to a relaxing effect. But after some time - after about two hours - the effect of alcohol on cortisol levels decreases, as a result of which the body is less able to cope with stress than before. Thus, alcohol exacerbates the stress problem in the long run. Too little water. Dehydration affects the functioning of all organs and systems in the body. One of its consequences is an increased level of cortisol. Symptoms or consequences of a chronically high level of cortisol. People suffering from constantly elevated levels of cortisol may experience the following symptoms:

Frequent infections due to a weakened immune system.
High blood pressure and heart disease.
Sleep disturbance, tiredness and restlessness.
Anxiety, mood swings and depression.
Problems with concentration and memory.
Decreased libido: cortisol inhibits the release of sex hormones.
Increased blood sugar.
Tendency to overweight, especially to obesity on the abdomen.
Loss of muscle mass, inability to build muscle with exercise.
Hypersensitivity to pain.
Irritable bowel or heartburn.

Previously, the MedicForum wrote about when stress can be beneficial to humans.


"
