,src,lang,text
0,"











«Ведь ты сильная. Ты старшая дочь и сестра». Честный текст о том, как не надо помогать близким
Должны ли мы оказывать поддержку своим близким, если это приносит нам неудобство? Над этим вопросом можно много рассуждать и спорить, но у психолога Анны Духаревой есть на него однозначный и бескомпромиссный ответ. Ее текст помогает понять, где заканчивается забота и начинаются личные границы взрослого человека.
06 Nov 2019, 14:10 by AdMe.ru
145  18  188  68 48k
Должны ли мы оказывать поддержку своим близким, если это приносит нам неудобство? Над этим вопросом можно много рассуждать и спорить, но у психолога Анны Духаревой есть на него однозначный и бескомпромиссный ответ. Ее текст помогает понять, где заканчивается забота и начинаются личные границы взрослого человека.
Мы в AdMe.ru считаем, что ответственность — это полезное качество сильного человека, но согласны с автором в том, что злоупотреблять им все же не стоит.
В мире много токсичной ответственности. Можно немножечко прибить себя тем или надорвать спину этим. Придумать что-то свое или вписаться в тренд. Но ничто еще так не убивало меня, как попытка взять ответственность за жизнь другого взрослого человека. Из мира словно пропадает вся магия, вся радость. Больше нет права петь песни и танцевать, зачитываться любимыми книгами и вышивать. Пока_тот_другой_человек_не_счастлив. Когда я попадаю в это состояние, мне хочется лечь и умереть.


© Juanmonino / gettyimages  

Надо ли говорить, что такая ответственность распространена в моей семье? И что чаще всего она ложится на женщин? «Почему ты не погладила рубашку мужу? Что о тебе подумают, если увидят его таким?» «Ты должна подавать пример сестре и братьям. Если бросишь аспирантуру, что они подумают об этом?» «Выбирай квартиру рядом. Кто будет заботиться обо мне, если я заболею?» И так до бесконечности...
Этому веришь. Ведь ты сильная. Ты старшая дочь и сестра. Ты психологиня. Ты должна, должна абсолютно всем их душевное счастье. Да, ты должна одним своим появлением в комнате излечивать неврозы и прогонять тревогу. Ты должна абсолютно всех понять и простить. А как иначе? Ты должна быть выше этого, мудрее. Просто заткнись и терпи!


© Andrea Peipe, Cap Photography / gettyimages  

А потом, когда в 4 утра не можешь уснуть, потому что в мире столько людей, о которых надо позаботиться, приходит осознание. Не должна. Это как выпрыгнуть из самолета в открытое небо. Так хочется и так страшно. А вдруг все-таки должна? А вдруг не позабочусь и все умрут? Вдруг отпущу ответственность и стану плохой, виноватой, ужасной?
Делаешь прыжок и чувствуешь, как внутренние органы падают вниз. А потом... полет. Лучше всего у меня отношения с семьей, когда я отношусь к ним как к взрослым людям. Муж в 33 года сам в состоянии решить, пойдет он в глаженой рубашке или в мятой. Сестра и братья сами выберут свой путь, без оглядки на меня. А если кто-то серьезно заболеет, то лучше вызвать скорую. Я тут ничем не могу помочь. И мои клиенты — взрослые люди. Они сами несут ответственность за свою жизнь.


© Westend61 / gettyimages  

Я ничего не могу поделать с тем, что моя знакомая с сахарным диабетом ест шоколад. Она знает, что нельзя, но я не вправе отбирать. Я не могу заставить обратиться к врачу родственницу, которая считает, что ее больная спина — это норма. Я не могу.
Я помогающий практик, дочь, сестра. Я могу помогать, но не делать за кого-то. Я всегда готова подставить плечо. Но только если оно там действительно необходимо. И так хорошо дышится без этой ответственности за других взрослых. Сразу появляются силы петь, писать статьи, читать и думать. Словно кто-то подарил крылья. А на самом деле просто пора перестать их самой себе обрезать.
Помните, вокруг вас взрослые люди. Помогайте, но не усыновляйте. И берегите себя.
Фото на превью Анна Духарева / VK


",ru,"











“After all, you are strong. You are the eldest daughter and sister. ” Honest text on how not to help loved ones
Should we support our loved ones if this brings us inconvenience? There is much to argue and argue about this question, but the psychologist Anna Dukhareva has an unequivocal and uncompromising answer to it. Her text helps to understand where care ends and the personal boundaries of an adult begin.
06 Nov 2019, 14:10 by Bright Side
145 18 188 68 48k
Should we support our loved ones if this brings us inconvenience? There is much to argue and argue about this question, but the psychologist Anna Dukhareva has an unequivocal and uncompromising answer to it. Her text helps to understand where care ends and the personal boundaries of an adult begin.
At Bright Side, we believe that responsibility is a useful quality of a strong person, but we agree with the author that you should not abuse him.
There is a lot of toxic liability in the world. You can beat yourself a little with that or tear your back with it. Come up with something of your own or fit into the trend. But nothing has killed me more than trying to take responsibility for the life of another adult. It is as if all magic, all joy, is disappearing from the world. You no longer have the right to sing songs and dance, read your favorite books and embroider. Bye_this_other_man_not_happy. When I get into this state, I want to lie down and die.


© Juanmonino / gettyimages

Needless to say, such a responsibility is common in my family? And what more often does it fall on women? “Why didn’t you stroke the shirt of your husband? What would they think of you if they saw him like that? """" You must set an example for your sister and brothers. If you drop out of graduate school, what will they think about it? """" Choose an apartment nearby. Who will take care of me if I get sick? ”And so on ad infinitum ...
You believe that. After all, you are strong. You are the eldest daughter and sister. You are a psychologist. You owe, owe absolutely all their spiritual happiness. Yes, you should cure neurosis and drive off anxiety with your appearance in the room. You must absolutely understand and forgive everyone. How else? You must be higher than this, wiser. Just shut up and bear it!


© Andrea Peipe, Cap Photography / gettyimages

And then, when you cannot fall asleep at 4 in the morning, because there are so many people in the world who need to be taken care of, awareness comes. Should not. It's like jumping out of an airplane into the open sky. So you want and so scary. What if she should? What if I don’t take care and everyone will die? Suddenly let go of responsibility and become bad, guilty, terrible?
You take a jump and feel how the internal organs fall down. And then ... flight. My best relationship with my family is when I treat them like adults. A husband at the age of 33 is able to decide for himself whether he will go in an ironed shirt or in mint. Sister and brothers will choose their own path, without looking at me. And if someone is seriously ill, it is better to call an ambulance. I can’t help here. And my clients are adults. They themselves are responsible for their lives.


© Westend61 / gettyimages

There is nothing I can do about the fact that my friend with diabetes eats chocolate. She knows that it is impossible, but I have no right to select. I can’t get a relative who believes her sore back is the norm to see a doctor. I can not.
I am a helping practitioner, daughter, sister. I can help, but not do it for someone. I am always ready to turn my shoulder. But only if it is really necessary there. And breathes so well without this responsibility for other adults. The power immediately appears to sing, write articles, read and think. Like someone gave wings. But in fact, it's just time to stop cutting them off yourself.
Remember, adults are around you. Help, but do not adopt. And take care of yourself.
Preview photo by Anna Dukhareva / VK


"
