,src,lang,text
0,"











Fotballradioen: Mathisen tror ikke Start klarer opprykket
Jesper Mathisen spår at Start-spillerne ikke takler presset når det hele skal avgjøres. Hør ny episode av Fotballradioen.
06 Nov 2019, 14:05 by Pål Wollebæk Jørgensen
Steinar Skeie gjester Fotballradioen når gjøres en oppsummering av sesongen 2019 - som langt fra er over for alle. Det er allerede klart at Start må ut i kvalifisering for å rykke opp til Eliteserien. Har Joey Hardarsons-gutter det som skal til?

Glisne tribuner har preget Starts sesong. Dette mener supporterne er årsaken.

Nei, er Jesper Mathisens klare svar på det. Skeie snakker også om et nytt godt Vindbjart-lag i emning, og at han fortsatt har en drøm om å ta over treneransvaret i Start.

Episoden hører du under:



",no,"











Football radio: Mathisen doesn't think Start can handle the promotion
Jesper Mathisen predicts that the Start players will not cope with the pressure when it is all decided. Hear a new episode of Football Radio.
06 Nov 2019, 14:05 by Pål Wollebæk Jørgensen
Steinar Skeie guests The football radio when summarizing the 2019 season - which is far from over for everyone. It is already clear that Start must qualify to advance to the Elite Series. Do Joey Hardarsons guys have what it takes?

Shining stands have characterized Starts season. This is what supporters think is the reason.

No, Jesper Mathisen's clear answer is that. Skeie also talks about a new good Vindbjart team in training, and that he still has a dream to take over the coaching responsibility at Start.

You can hear the episode:



"
