,src,lang,text
0,"











Grava
Motoristas e passageiros agora podem gravar o udio do que ocorre dentro do veculo; especialistas afirmam que a prtica legal
07 Nov 2019, 19:51 by Vinicius Szafran
O aplicativo de transporte Uber anunciou nesta quarta-feira (6) um novo recurso de segurana, que permite a gravao do udio do que acontece dentro do veculo, por parte de motoristas e passageiros. Embora o recurso parta do princpio ""quem no deve, no teme"", vrios questionamentos surgiram, principalmente sobre a legalidade dessa funo.
Segundo a empresa, as gravaes no podem ser acessadas nem mesmo pelo autor. Elas so criptografadas e armazenadas no aparelho da pessoa, e apenas a companhia tem a chave para extrair o arquivo, impedindo que ele seja compartilhado por outros aplicativos. Caso ocorra algum incidente, o autor da gravao pode envi-la para a empresa pelo prprio aplicativo, que poder analisar e encaminhar para as autoridades.
Se uma gravao for iniciada pelo usurio, o motorista ser notificado, mas no poder evitar que a gravao acontea. O mesmo acontece no caso contrrio. Para alguns, apenas o fato de gravaes acontecerem dentro do carro um incmodo. No entanto, especialistas ouvidos pelo Estadoafirmam que a prtica legal e no viola as regras de privacidade.



O advogado Renato Opice Blum, especialista em direito digital, diz que a prtica tem embasamento no artigo 11 da Lei Geral de Proteo de Dados, prevista para entrar em vigor em agosto de 2020. ""A gravao justificada pela proteo do titular, mas isso exige comunicao do que est sendo feito"", argumenta ele.
Fabro Steibel, diretor executivo do Instituto de Tecnologia e Sociedade do Rio de Janeiro (ITS-Rio), tambm tem o mesmo entendimento. ""Os dois lados estaro cientes de que uma eventual gravao poder ser feita e usada para ajudar na investigao de incidentes. O objetivo no a publicao. Se essa gravao for vazada outra coisa"", diz ele.
Steibel, no entanto, alerta sobre o risco de os usurios passarem a usar o recurso para denunciar crimes, ao invs de procurar as autoridades. Para o especialista, haver dificuldade para analisar as gravaes, considerando que mais de 22 milhes de pessoas utilizam o aplicativo no Brasil.
J o fundador da Data Privacy Brasil, Bruno Bioni, tem dvidas se esse recurso ser efetivo. ""O Uber j implementou outros recursos de segurana na plataforma, como botes de ajuda e pnico. Gravar o udio realmente necessrio?"", questiona Bioni. Em sua viso, existem ainda outros riscos. ""Quais so os procedimentos adotados para garantir que esses dados sero usados s para a finalidade descrita pela empresa?"".
Recentemente, descobriu-se que empresas como Twitter e Facebook usaram informaes de segurana de seus usurios para redirecionar anncios a eles, por exemplo.







",pt,"











Record
Drivers and passengers can now record the audio of what happens inside the vehicle; experts claim that legal practice
07 Nov 2019, 19:51 by Vinicius Szafran
The transport app Uber announced on Wednesday (6) a new safety feature, which allows the recording of audio from what happens inside the vehicle, by drivers and passengers. Although the appeal is based on the ""who should not fear not"" principle, several questions have arisen, mainly about the legality of this function.
According to the company, the recordings cannot be accessed even by the author. They are encrypted and stored on the person's device, and only the company has the key to extract the file, preventing it from being shared by other applications. If an incident occurs, the recorder can send it to the company through the application itself, which can review and refer to the authorities.
If a recording is initiated by the user, the driver will be notified, but cannot prevent the recording from happening. The same is true otherwise. For some, just the fact that recordings happen inside the car is a nuisance. However, experts heard by the state contend that legal practice is not in violation of privacy rules.



Advocate Renato Opice Blum, an expert in digital law, says the practice is based on Article 11 of the General Data Protection Act, scheduled to take effect in August 2020. ""Recording is justified by the protection of the holder, but that requires communicating what is being done, ""he argues.
Fabro Steibel, executive director of the Rio de Janeiro Institute of Technology and Society (ITS-Rio), also has the same understanding. ""Both sides will be aware that a possible recording can be made and used to help investigate incidents. The goal is not to publish. If that recording is leaked something else,"" he says.
Steibel, however, warns of the risk that users will use the resource to report crimes rather than seek the authorities. For the expert, it will be difficult to analyze the recordings, considering that over 22 million people use the application in Brazil.
Data Privacy Brasil founder Bruno Bioni is doubtful whether this feature is effective. ""Uber has already implemented other security features on the platform, such as help buttons and panic. Does recording audio really necessary?"" Asks Bioni. In his view, there are still other risks. ""What are the procedures adopted to ensure that this data will be used solely for the purpose described by the company?""
It has recently been found that companies like Twitter and Facebook have used security information from their users to redirect ads to them, for example.







"
