,src,lang,text
0,"











Перед прибытием Путина на форум несколько омских центральных улиц стали недоступны для прохода
07 Nov 2019, 19:27 by Евгений Куприенко

Все организовали оперативно и по-тихому.

Омичи запечатлели неприятное следствие прибытия в Омск с визитом высоких гостей, глав России и Казахстана. Речь идет о выборочном перекрытии проходов в границах улиц Ленина, а также Музейной.
Согласно данным НГС.Омск, подчас бдительность сотрудников силовых структур доходит до абсурда: сотрудник распахнувшего свои двери накануне «Эрмитажа-Сибирь» вынужден был оставить свой велосипед прямо на улице, не получив возможности разместить его в помещении.
В свою очередь, сейчас заграждения последовательно появляются на Любинском проспекте, а также вблизи самого филиала музея имени Врубеля. Омичи также частично потеряли возможность двигаться по улице Ленина. Автомобилистам определенно приходится несладко.
Отметим, горадминистрация подчеркивала, что некоторые центральные магистрали будут перекрыты на фоне демонстрации коммунистов, однако речь шла об утренних часах.

ПО ТЕМЕ:






",ru,"











Before Putin arrived at the forum, several Omsk central streets became inaccessible
07 Nov 2019, 19:27 by Evgeny Kuprienko

All organized quickly and quietly.

Omsk captured an unpleasant consequence of the arrival in Omsk with the visit of distinguished guests, the heads of Russia and Kazakhstan. We are talking about selective blocking of passages within the boundaries of Lenin streets, as well as Museum.
According to the NSG.Omsk, sometimes the vigilance of law enforcement officers comes to the point of absurdity: an employee who opened his doors on the eve of the Hermitage-Siberia was forced to leave his bicycle right on the street, having not been able to place it in the room.
In turn, now barriers consistently appear on Lubinsky Prospekt, as well as near the branch of the Vrubel Museum itself. Omsk residents also partially lost the ability to move along Lenin Street. Motorists definitely have a hard time.
Note, the city administration emphasized that some central highways will be blocked against the backdrop of a communist demonstration, but it was a matter of morning hours.

ON THIS TOPIC:






"
