,src,lang,text
0,"











Студентам из подтопленных территорий до конца года компенсируют стоимость обучения в ссузах и вузах
Пока еще не всех студентов первых и вторых курсов перевели на бесплатное обучение. Виталий Мутко сообщил, что вся работа должна быть завершена до 15 ноября
07 Nov 2019, 17:58 by Волшебный редактор
До конца года студентам первых и вторых курсов из подтопленных территорий, обучающихся в ссузах и вузах России, компенсируют стоимость одного года обучения на коммерческой основе. Из бюджета Иркутской области на это направили более 42 миллионов рублей. А областному бюджету расходы потом компенсируют из федеральной казны.
Напомним, ранее глава государства дал поручение компенсировать расходы на оплату обучения 2019-2020 годов студентам из подтопленных территорий.
Виталий Мутко сообщил, что вся работа должна быть завершена до 15 ноября.
– Нужно довести эту тему до конца. Скорректировать задание. Регион что сделал со студентами собственных колледжей? Они перевели их с платной основы на бесплатную. И все, тема была закрыта. Пятнадцатого ноября я хочу получить исчерпывающий доклад по решению этого вопроса, – сказал Виталий Мутко.
Сергей Левченко отметил, что к началу ноября 79 студентов первых и вторых курсов колледжей, находящихся в региональном подчинении, уже переведены на бесплатное образование, на бюджетные места, сообщили в правительстве Иркутской области.
Если вы нашли ошибку, пожалуйста, выделите фрагмент текста и нажмите Ctrl+Enter.


",ru,"











Students from flooded areas until the end of the year are compensated for the cost of training in colleges and universities
So far, not all first and second year students have been transferred to free tuition. Vitaliy Mutko said that all work should be completed before November 15
07 Nov 2019, 17:58 by Magic Editor
Until the end of the year, first and second year students from flooded areas studying in colleges and universities in Russia are compensated for the cost of one year of study on a commercial basis. More than 42 million rubles were allocated from the budget of the Irkutsk region. And the regional budget then compensates for the costs from the federal treasury.
Recall that earlier the head of state instructed to compensate the cost of tuition for 2019-2020 to students from flooded territories.
Vitaliy Mutko said that all work should be completed before November 15.
- We need to bring this topic to the end. Correct the task. What has the region done to students of its own colleges? They transferred them from a paid basis to a free one. And everything, the topic was closed. On November 15, I want to receive an exhaustive report on resolving this issue, ”said Vitaliy Mutko.
Sergey Levchenko noted that by the beginning of November, 79 first-year and second-year college students in regional subordination had already been transferred to free education, to budget places, the government of the Irkutsk region said.
If you find an error, please select a piece of text and press Ctrl + Enter.


"
