,src,lang,text
0,"











Βραβεύθηκαν οι «Zero Waste Beach Champions 2019»
07 Nov 2019, 17:27 by Sigmalive
Συνολικά έξι παράκτιες επιχειρήσεις, αναδείχθηκαν πρωταθλήτριες στα φετινά βραβεία «Zero Waste Beach Champions 2019». Οι βραβευθείσες εταιρείες ξεχώρισαν για τις υπεύθυνες πρακτικές που υιοθέτησαν για τη διαχείριση των σκουπιδιών, ανάμεσα σε συνολικά 224 υποψήφιες καλές πρακτικές που υποβλήθηκαν από τα μέλη του Δικτύου Υπεύθυνων Παράκτιων Επιχειρήσεων.
Το Δίκτυο Υπεύθυνων Παράκτιων Επιχειρήσεων δημιουργήθηκε πέρυσι στο πλαίσιο του πρωτοποριακού προγράμματος «Zero Waste Beach», που υλοποιεί το Κέντρο Μελετών και Έρευνας ΑΚΤΗ, με την οικονομική υποστήριξη του Ιδρύματος της Coca-Cola και έχει ως στόχο την αντιμετώπιση της θαλάσσιας πλαστικής ρύπανσης.
Η τελετή βράβευσης, που τελούσε υπό την αιγίδα του Προέδρου της Δημοκρατίας κ. Νίκου Αναστασιάδη, πραγματοποιήθηκε στο Ammos Bar στη Λάρνακα, στην παρουσία του υπουργού Γεωργίας, Αγροτικής Ανάπτυξης και Περιβάλλοντος κ. Κώστα Καδή. Οι έξι πρωταθλήτριες επιχειρήσεις διακρίθηκαν στις κατηγορίες της περιβαλλοντικής υπευθυνότητας, της βιωσιμότητας, της καινοτομίας και της κοινωνικής ευθύνης.
Ειδικότερα, στην κατηγορία των μεγάλων επιχειρήσεων:

Το Atlantic Sancta Napa Hotel έλαβε το βραβείο Περιβαλλοντικής Υπευθυνότητας,
ο Όμιλος KANIKA HOTELS & RESORTS πήρε το βραβείο Βιωσιμότητας και
το Altantica Sungarden Beach Hotel εξασφάλισε το βραβείο Καινοτομίας.

Στην κατηγορία των μικρών επιχειρήσεων:

τα Πράσινα Σημεία Πάφου Κολώνης – Μουττάλλου έλαβαν το βραβείο Κοινωνικής Ευθύνης,
ο Σύνδεσμος Παράκτιας Αλιείας Πάφου εξασφάλισε το βραβείο Καινοτομίας ενώ,
το βραβείο Βιωσιμότητας απονεμήθηκε στο εστιατόριο ΠΑΣ ΤΟ ΚΥΜΑ.

Με ειδικά μετάλλια και τις ευχαριστίες της ΑΚΤΗΣ τιμήθηκαν εκπρόσωποι της Τοπικής Αυτοδιοίκησης, της Κοινωνίας των Πολιτών και εθελοντές που υποστήριξαν το πρόγραμμα «Zero Waste Beach» και τις δράσεις της ΑΚΤΗΣ για μια Κύπρο πιο καθαρή. Πρόκειται για τον δήμαρχο Γεροσκήπου, κ. Μιχάλη Παυλίδη, τον Γενικό Γραμματέα της CYMERA, κ. Μιχάλη Ιερείδη, τον γραμματέα του κοινοτικού Συμβουλίου Περβολιών κ. Χριστόφορο Παντελή και τον πρόεδρο του Κοινοτικού Συμβουλίου Περβολιών κ. Κώστα Τίγγη, καθώς και τον εθελοντή δύτη, κ. Παναγιώτη Ψωμά.
Με την ολοκλήρωση της τελετής βράβευσης ακολούθησε συμβολικός εθελοντικός καθαρισμός της ακτής Μακένζυ υπό την καθοδήγηση της επιστημονικής ομάδας της ΑΚΤΗΣ σύμφωνα με το διεθνές πρωτόκολλο Ocean Conservancy. Με αυτή τη διαδικασία που υλοποιεί η ΑΚΤΗ σε όλους τους καθαρισμούς ακτών και βυθού, τα δεδομένα εισάγονται στη διεθνή βάση δεδομένων του Ocean Conservancy και αποτελούν σημαντικά δεδομένα πεδίου που υποστηρίζουν την παγκόσμια έρευνα και την προσπάθεια για την καταπολέμηση της θαλάσσιας πλαστικής ρύπανσης.
Μιλώντας στην εκδήλωση, η Διευθύντρια Δημοσίων Σχέσεων και Επικοινωνίας της Α/φοι Λανίτη, Κάλια Πατσιά, σημείωσε ως μεγαλύτερο επίτευγμα του Zero Waste Beach την συμβολή του στην ευαισθητοποίηση της κοινής γνώμης. «Σε αυτά τα δύο χρόνια υλοποίησης του προγράμματος, έχουν καταγραφεί εξαιρετικά αποτελέσματα. Πιστεύουμε ωστόσο ότι το πιο σημαντικό επίτευγμα ήταν ότι βάλαμε στη δημόσια ατζέντα το θέμα της θαλάσσιας πλαστικής ρύπανσης μέσα από τις δράσεις και τις πρωτοβουλίες που αναπτύχθηκαν στο πλαίσιο του προγράμματος», ανέφερε χαρακτηριστικά. 
Η Πρόεδρος του ΔΣ του Κέντρου Μελετών και Έρευνας ΑΚΤΗ, Ξένια Λοϊζίδου, ανέδειξε από την πλευρά της ότι τα αποτελέσματα του «Zero Waste Beach» κατά τη δεύτερη χρονιά υλοποίησης του προγράμματος ήταν εντυπωσιακά. «Συγκεντρώσαμε περισσότερους από 700 τόνους ανακυκλώσιμων υλικών, από τους βυθούς, τις ακτές και τα μέλη του Δικτύου Υπεύθυνων Παράκτιων Επιχειρήσεων, τα οποία σε διαφορετική περίπτωση θα πήγαιναν κατευθείαν στο θαλάσσιο περιβάλλον ή στην καλύτερη περίπτωση στα μικτά σκουπίδια. Αν δουλέψουμε όλοι μαζί, μπορούμε να αντιμετωπίσουμε την πλαστική ρύπανση».





",el,"











Zero Waste Beach Champions 2019 Awarded
07 Nov 2019, 17:27 by Sigmalive
A total of six offshore companies have been nominated for this year's Zero Waste Beach Champions 2019 awards. The awarded companies were distinguished for their waste management practices, among a total of 224 candidate good practices submitted by members of the Coastal Offshore Network.
The Network of Offshore Responsible Officers was created last year as part of the groundbreaking program ""Zero Waste Beach"", implemented by the COST Research and Research Center, with the financial support of the Coca-Cola Foundation and aimed at tackling marine plastic pollution.
The awards ceremony, which was held under the auspices of the President of the Republic, Mr. Nikos Anastasiadis, was held at the Ammos Bar in Larnaca, in the presence of the Minister of Agriculture, Rural Development and Environment, Mr. Costas Kadis. The six championships were distinguished in the categories of environmental responsibility, sustainability, innovation and social responsibility.
In particular, in the category of large enterprises:

Atlantic Sancta Napa Hotel received the Environmental Responsibility Award,
KANIKA HOTELS & RESORTS Group received the Sustainability Award and
the Altantica Sungarden Beach Hotel won the Innovation Award.

In the small business category:

Paphos Kolonis - Mouttalou Green Spots received the Social Responsibility Award,
the Pafos Coastal Fisheries Association won the Innovation Award while,
the Sustainability Award was given to the restaurant PAS TO KIMA.

AKTIS special medals and thanks were given to representatives of Local Government, Civil Society and volunteers who supported the ""Zero Waste Beach"" program and AKTIS's actions for a cleaner Cyprus. These are the Mayor of Geroskipou, Mr. Michalis Pavlidis, the Secretary General of CYMERA, Mr. Michalis Ierides, the Secretary of the Community Council of Christlings Christoforos Pantelis, and the President of the Community Council of Christlings, Mr. Costis Tingis, as well as Mr. Kostis Tingis Mr Panagiotis Psoma.
At the conclusion of the awards ceremony, a symbolic voluntary clean-up of the Makenzie Coast followed by the ACTIS Scientific Team under the International Ocean Conservancy Protocol followed. With this process implemented by COAST in all coast and bottom cleanups, the data is entered into the International Ocean Conservancy Database and is an important field data supporting global research and efforts to combat marine plastic pollution.
Speaking at the event, Laniti Branch Manager Kalia Patsia noted Zero Waste Beach's contribution to raising public awareness as a major achievement. ""During these two years of program implementation, excellent results have been recorded. We believe, however, that the most important achievement was that we put the issue of marine plastic pollution on the public agenda through the actions and initiatives developed under the program, ""he said.
Xenia Loizidou, Chairman of the Board of Directors of the Akti Research and Research Center, said that the results of the ""Zero Waste Beach"" during the second year of the program implementation were impressive. ""We have collected more than 700 tonnes of recyclable material from the seabed, coast and members of the Network Offshore Responsible Network, which would otherwise go straight into the marine environment or at best into the trash. If we work together, we can tackle plastic pollution. ""





"
