,src,lang,text
0,"











Corte de Apelações obriga Trump a apresentar registros do imposto de renda

04 Nov 2019, 16:34

Donald Trump sofreu nova derrota na Justiça –dessa vez, na Segunda Corte de Apelações de Nova York– e sua firma de contabilidade será obrigada a entregar a promotores as informações do imposto de renda do presidente.
Advogados de Trump disseram que vão recorrer à Suprema Corte.
Trump é investigado por suspeita de ter agido de modo ilegal ao repassar dinheiro para comprar o silêncio de Stormy Daniels, atriz pornô que diz ter tido um encontro com o presidente.
A ação também investiga o uso de dinheiro de origem oculta na campanha de 2016.


",pt,"











Court of Appeals forces Trump to file income tax records

04 Nov 2019, 16:34

Donald Trump has suffered a further defeat in court - this time at the Second Appeal Court in New York - and his accounting firm will be required to hand over to the prosecutors the president's income tax information.
Trump's lawyers have said they will go to the Supreme Court.
Trump is investigated on suspicion that he acted illegally by giving money to buy the silence of Stormy Daniels, a porn star who says she had a meeting with the president.
The lawsuit also investigates the use of hidden source money in the 2016 campaign.


"
