,src,lang,text
0,"











Vereine wollen neues NÖ-Hundehaltegesetz kippen

04 Nov 2019, 16:06

Hundebesitzer sehen das neue Gesetz in Niederösterreich als völlig überzogen. Aktion soll Volksabstimmung möglich machen.
Obwohl das neue niederösterreichische Hundehaltegesetz im Landtag einstimmig beschlossen wurde, ist vielen zum Heulen. Alle Hunde müssen ab Jahresbeginn auf öffentlichen Plätzen, wie Parks und in Gasthäusern an der Leine und mit Beißkorb geführt werden.
Die Novelle ärgert Besitzer von Vierbeinern und Betreiber von Tierheimen, weil sie meinen, dass die neuen Bestimmungen das eigentliche Ziel, Hundebisse zu vermeiden, völlig verfehlen würden.
Verunsichert sind auch Such- und Jagdhundebesitzer. Jetzt hofft man auf mindestens 25.000 Bürgereinsprüche gegen das neue Gesetz bis 5. Dezember – dann müsste die Landesregierung nämlich eine Volksbefragung veranlassen.
""Unnötige"" Regelung in NÖ
„Die Regelung ist ärger als in Wien“, beschwert sich Franz-Joseph Plank vom Verein „Animal Spirit“. Denn in Wien gilt die strenge Maulkorb-Regelung nur für Listenhunde. Obwohl er die Bestimmung in der Stadt noch eher nachvollziehen kann, findet er es am Land „unnötig“.


In Niederösterreich sind nicht nur Listenhunde von der neuen Maulkorb-Regelung betroffen.© Bild: Getty Images/iStockphoto / mari_art/iStockphoto

Dass die neue Novelle in Niederösterreich für alle Hunde gilt, ist für den Tierschützer unverständlich: „Alle Hunde einzubeziehen, ist völlig absurd.“ Seiner Meinung nach wird die Problematik falsch bekämpft.
Er sieht die Lösung für weniger Bissunfälle in genaueren Kontrollen des Hundeführerscheins und einem Charaktertest für Hundehalter sowie in einer Aufklärung der Bürger. Zudem sei das neue Gesetz nicht gut durchdacht, weil kleinere Hunde, die in Taschen getragen werden, ausgenommen sind. „Dabei sind kleine Hunde oft bissiger als große“, so Plank.
Unsicherheit bei Hundeführern
Erst am Wochenende ist eine Dreijährige in Kapelln, Bezirk St. Pölten, von einem Hund am Oberarm gebissen worden, als sie mit ihrer Mutter spazieren war. Danach soll das Tier davon gelaufen sein. Der als Mischling beschriebene Vierbeiner, habe ein „ungepflegtes, schwarzes Fell“ und „weder Halsband, Leine oder Beißkorb“ getragen, berichtet die Polizei. Sie bittet um Hinweise.


Suchhunde sind zum Beispiel von der Regelung ausgeschlossen.© Bild: Kurier/Gilbert Novy

Auch mit dem neuem Gesetz sei ein solcher Unfall leider nicht vermeidbar, sagt Wolfgang Pfitzner, Einsatzleiter der österreichischen Suchhundestaffel, aus Eggenburg.
Er ärgert sich darüber, dass die neuen Bestimmungen ohne vorheriger Sachdebatte beschlossen wurden: „Wenn ich mit Tennisbällen im Wald herumwerfe und meine Suchhunde völlig ohne Beißkorb und Leine für Einsätze trainiere, muss ich glaubhaft machen, dass wir das nicht illegal machen. Aber wer garantiert mir, dass wir nicht angezeigt werden“, meint Pfitzner und startete einen Aufruf, um mithilfe eines Online-Antragsformulars viele Einsprüche gegen das Gesetz zu erheben.



Aus der Landtagsdirektion heißt es, dass es bisher bei keinem Gesetz durch die Einsprüche zu einer Volksbefragung gekommen wäre. Allerdings wurde die Hürde dafür verringert – denn noch vor gut zwei Jahren waren 50.000 Einsprüche nötig.
Laut Novelle sind alle Einsatzhunde – auch während ihrer Schulung – von den Bestimmungen ausgenommen.
Vergabequote sinkt
Erwin Schlosser, Betreiber eines Tierheims im Waldviertel, befürchtet, dass die Vergabequote von Hunden wegen des neuen Gesetzes deutlich sinken wird: „Vor allem in der Stadt. Alle Heime sind ohnehin restlos überfüllt. Wer will noch einen Hund haben, wenn es nur mehr Verbote gibt.
Leider haben die Politiker zu wenig Ahnung, sonst wüssten sie, dass ein Beißkorb eine Form von Tierquälerei ist“, meint Schlosser.


Landesrat Gottfried Waldhäusl (FPÖ) verteidigt das Gesetz.© Bild: Kurier/Jeff Mangione

Tierschutzlandesrat Gottfried Waldhäusl (FPÖ) verteidigt das Gesetz: „Es handelt sich um eine Zusammenfassung von Expertenmeinungen. Tatsache ist, dass ein Hund in NÖ nach wie vor mit Leine oder Maulkorb unterwegs sein kann, außer es handelt sich um Menschenansammlungen.“
Die Maulkorbpflicht in Lokalen sieht er als Notwendigkeit, weil größere und kleinere Verletzungen durch Bisse im Wirtshaus passiert seien. So sehr überzogen könne die Novelle nicht sein, nachdem alle Parteien im Landtag zugestimmt hätten.
infoboxDas neue N&Ouml;-Hundehaltegesetz auf einen Blick<p>Das neue Hundehaltegesetz wurde am 24. Oktober im Landtag beschlossen und tritt mit Jahresbeginn in Kraft. Es schreibt Hundebesitzern in Nieder&ouml;sterreich vor, dass ihre Hunde an &ouml;ffentlichen Orten im Ortsbereich einen Maulkorb tragen und an der Leine gef&uuml;hrt werden m&uuml;ssen.</p> <p>&Ouml;ffentliche Orte sind in dem neuen Gesetz als jene Orte definiert, die f&uuml;r jedermann frei&nbsp; zug&auml;nglich sind. Au&szlig;erdem gilt Leinen- und Bei&szlig;korbpflicht&nbsp; in &ouml;ffentlichen Verkehrsmitteln, Kinderbetreuungseinrichtungen, bei Veranstaltungen und Orten mit gr&ouml;&szlig;eren Menschenansammlungen.</p> <p>Auch die Gastronomie ist von dem Gesetz betroffen. Ausgenommen sind Hunde, die vom Besitzer getragen&nbsp; oder in Beh&auml;ltnissen transportiert werden. Besitzer, deren Hunde aufgrund von Atemproblemen keinen Maulkorb tragen k&ouml;nnen, m&uuml;ssen ein tier&auml;rztliches Attest bei sich tragen.</p> <p>Ausgenommen vom neuen Gesetz sind Hunde mit besonderer Ausbildung (z.B. Jagd- oder Rettungshunde). 2015 wurden in ganz &Ouml;sterreich 3.000 Bisse registriert. 2017 waren es bereits 3.600 Vorf&auml;lle.</p> closednewsletter_signupnewsletter_inline_box


",de,"











Clubs want to overturn new Lower Austria dog ownership law

04 Nov 2019, 16:06

Dog owners see the new law in Lower Austria as completely covered. Action should make referendum possible.
Although the new Lower Austrian dog-keeping law was decided unanimously in the state parliament, many are howling. From the beginning of the year, all dogs must be kept in public places such as parks and inns on a leash and with a bite basket.
The novella annoys four-legged owners and animal shelters because they believe that the new regulations would completely miss the actual goal of avoiding dog bites.
Unsure are search and hunting dog owners. Now one hopes for at least 25,000 citizen objections against the new law to 5 December - then the provincial government would cause namely a plebiscite.
""Unnecessary"" regulation in Lower Austria
""The regulation is worse than in Vienna,"" complains Franz-Joseph Plank from the association ""Animal Spirit"". Because in Vienna, the strict muzzle rule applies only to list dogs. Although he can understand the destination in the city even more, he finds it ""unnecessary"" on land.


In Lower Austria not only list dogs are affected by the new muzzle control © picture: Getty Images / iStockphoto / mari_art / iStockphoto

The fact that the new novella in Lower Austria applies to all dogs, is incomprehensible for the animal rights activists: ""Including all dogs, is completely absurd."" In his opinion, the problem will be fought wrong.
He sees the solution for fewer bite accidents in closer checks of the dog license and a character test for dog owners and in an education of the citizens. Moreover, the new law is not well thought out because smaller dogs carried in bags are exempt. ""Small dogs are often more biting than big ones,"" says Plank.
Uncertainty in dog handlers
It was not until the weekend that a three-year-old girl in Kapelln, St. Pölten district, was bitten by a dog on her upper arm when she was walking with her mother. After that the animal should have run away. The quadruped described as a mixed breed, have worn a ""neglected, black fur"" and ""neither collar, leash or bite basket,"" reports the police. She asks for clues.


For example, search dogs are excluded from the scheme © Image: Kurier / Gilbert Novy

Even with the new law such an accident is unfortunately unavoidable, says Wolfgang Pfitzner, head of operations of the Austrian search dog relay, from Eggenburg.
He is annoyed that the new regulations have been passed without previous debate: ""When I throw tennis balls in the forest and train my search dogs completely without a bite basket and leash for missions, I have to make it clear that we are not doing this illegally. But who can guarantee that we will not be reported, ""said Pfitzner, and launched a call to use the online application form to raise many objections to the law.



From the Landtag Directorate states that it had previously come to any law by the objections to a referendum. However, the hurdle was reduced - because just over two years ago 50,000 objections were needed.
According to the novella, all working dogs are exempt from the regulations, even during their training.
Awarding rate drops
Erwin Schlosser, operator of an animal shelter in the Waldviertel, fears that the contracting rate for dogs will drop considerably because of the new law: ""Especially in the city. All homes are completely overcrowded anyway. Who wants to have a dog if there are only more prohibitions?
Unfortunately, the politicians have too little idea, otherwise they would know that a bite basket is a form of animal cruelty, ""says Schlosser.


Provincial Councilor Gottfried Waldhäusl (FPÖ) defends the law © Image: Kurier / Jeff Mangione

Tierschutzlandesrat Gottfried Waldhäusl (FPÖ) defends the law: ""It is a summary of expert opinions. The fact is that a dog in Lower Austria can still be on a leash or a muzzle, except when it comes to people gathering. ""
He sees the muzzle obligation in local as a necessity, because larger and smaller injuries had happened by bites in the tavern. The novella could not be so exaggerated, after all parties in the state parliament had agreed.
infoboxThe new dog-keeping law at a glance <p> The new dog-keeping law was approved by the Landtag on 24 October and comes into effect at the beginning of the year. It requires dog owners in Lower Austria to have their dogs muzzled and leashed in public places in the local area. </ P> <p> Public places are in the new law defined as those places that are free to anyone & nbsp; are available. In addition, Linen and Customs are compulsory & nbsp; in public transport, childcare facilities, events and places with larger crowds of people. </ p> <p> Gastronomy is also affected by the law. Excluded are dogs worn by the owner & nbsp; or transported in Behältnisse. Owners whose dogs are unable to muzzle due to respiratory problems must carry an animal health certificate. </ P> <p> Dogs with special training (such as hunting or rescue dogs) are excluded from the new law. In 2015, 3,000 bites were registered all over Austria. There were already 3,600 demonstrations in 2017. </ p> closednewsletter_signupnewsletter_inline_box


"
