,src,lang,text
0,"











قتل سرایدار یک مدرسه در مسجدسلیمان

06 Nov 2019, 15:35

رئیس آموزش و پرورش مسجدسلیمان از قتل سرایدار یک مدرسه در این شهر خبر داد.
جانمراد داوودی در گفت‌وگو با ایسنا، اظهار کرد: مرد سرایدار حدودا ۳۰ ساله یکی از مدارس مسجدسلیمان حوالی ساعت ۵ صبح روز سه‌شنبه، ۱۴ آبان در اتاق سرایه‌داری مدرسه با سلاح سرد به قتل رسید.
وی افزود: جسد این سرایدار به پزشکی قانونی تحویل داده شده است.
داوودی با بیان اینکه پرونده مقتول در حال بررسی از طریق نیروی انتظامی است، گفت: هنوز انگیزه قتل مشخص نشده است.


",fa,"











Murderer of a school in Masjed Soleiman

06 Nov 2019, 15:35

The head of the mosque's education announced the killing of a school janitor in the city.
In a conversation with ISNA, Janmor Davoodi said: A 4-year-old caretaker was killed in a cold-blooded school boardroom around 9am on Tuesday, November 9, at a school in Suleiman Mosque.
""The caretaker's body has been turned over to forensics,"" he said.
""The motive behind the killing has not yet been determined,"" Davoodi said, adding that the victim's case was being investigated by law enforcement.


"
