,src,lang,text
0,"











সমবায়ের মাধ্যমে বিপণন ব্যবস্থা শক্তিশালী করতে হবে : প্রধানমন্ত্রী

02 Nov 2019, 21:39




অনলাইন রিপোর্টার ॥ উৎপাদিত পণ্য সমবায়ের মাধ্যমে বাজারজাতকরণের ওপর গুরুত্বারোপ করেছেন প্রধানমন্ত্রী শেখ হাসিনা।
শনিবার (২ নবেম্বর) রাজধানীর বঙ্গবন্ধু আন্তর্জাতিক সম্মেলন কেন্দ্রে ৪৮তম জাতীয় সমবায় দিবস উপলক্ষে সব কর্মসূচি ও আয়োজিত মেলার উদ্বোধনী অনুষ্ঠানে তিনি এ গুরুত্বারোপ করেন।
অনুষ্ঠানে জাতীয় সমবায় পুরস্কার অর্জনকারীদের হাতে পদক তুলে দেন প্রধানমন্ত্রী। শুরুতে মেলা পরিদর্শন করেন তিনি। এ বছরের সমবায় দিবসের প্রতিপাদ্য ‘বঙ্গবন্ধুর দর্শন, সমবায়ে উন্নয়ন’।
সমবায়ের ভিত্তিতে উৎপাদন ও পণ্য বাজারজাতকরণের ওপর গুরুত্বারোপ করে প্রধানমন্ত্রী বলেন, সমবায়ের ভিত্তিতে বিশেষ করে বাজারজাত করা, অর্থাৎ উৎপাদিত পণ্যটা আমি যথাযথভাবে যদি বাজারজাত করতে না পারি, পণ্য উৎপাদনে মানুষ আগ্রহ হারাবে।
সমবায়ের মাধ্যমে বিপণন ব্যবস্থা শক্তিশালী করতে সংশ্লিষ্টদের নির্দেশনা দিয়ে তিনি বলেন, একটা পরিবার কিছু উৎপাদন করলে সেটা বাজারে নিয়ে যাওয়া যথেষ্ট কষ্টকর। সমবায়ের মাধ্যমে যদি বিপণন ব্যবস্থাটা আমরা করে দিতে পারি তাহলে প্রতিটি পরিবারই লাভবান হবে।
সমবায়ের মাধ্যমে অনলাইনে কেনাবেচা কার্যক্রম চালুর কথা উল্লেখ করে প্রধানমন্ত্রী বলেন, সমবায় অধিদপ্তরের সদর কার্যালয় থেকে উপজেলা পর্যন্ত সব কার্যালয়কে আইসিটি নেটওয়ার্কের আওতায় আনা হয়েছে। সমবায়ের মাধ্যমে অনলাইনে কেনা বেচার ব্যবস্থা করা হয়েছে।
সমবায়কে গুরুত্ব দিয়ে সরকারের নেওয়া বিভিন্ন পদক্ষেপের কথা তুলে ধরে টানা তিনবারের সরকারপ্রধান বলেন, জাতির পিতা বঙ্গবন্ধুর নির্দেশনা মেনে আমরা সমবায়কে গুরুত্ব দিচ্ছি, যেন অধিক মানুষ লাভবান হতে পারে।
সমবায়ের সঙ্গে তথ্যপ্রযুক্তির সমন্বয়ের কথা উল্লেখ করে প্রধানমন্ত্রী বলেন, বর্তমান যুগে তথ্যপ্রযুক্তি ব্যবহার করে একেবারে আধুনিক তথ্যপ্রযুক্তি সম্পন্ন ব্যবস্থাপনা গড়ে তুলে সমবায়ের মাধ্যমে উন্নয়ন করতে পারবো।
সমবায় আইনকে যুগোপযোগী করা এবং সমবায় ব্যাংককে লাভজনক করতে প্রয়োজনীয় ব্যবস্থা নিতে সংশ্লিষ্টদের নির্দেশ দিয়ে প্রধানমন্ত্রী বলেন, আমাদের বিদ্যমান সমবায় আইনকে যুগোপোযোগী করতে হবে। সমবায় ব্যাংক যেটা আছে, সেটা অনেকটা মুখ থুবড়ে পড়েছিল। এই ব্যাংক আইনটাকে যুগোপযোগী করে এটাকে লাভবানজনক প্রতিষ্ঠান হিসেবে চালু করার জন্য প্রয়োজনীয় ব্যবস্থা নিতে হবে।
অধিক সুফল পেতে প্রশিক্ষণের ওপর গুরুত্বারোপ করে শেখ হাসিনা বলেন, এক্ষেত্রে সমবায়ের কাজে যারা দক্ষ তাদের প্রশিক্ষণ দিতে হবে। সৎভাবে যেন কাজ করেন আমাদের সেভাবে গুরুত্ব দিতে হবে।
প্রতিটি জমিকে উৎপাদনে কাজে লাগানোর আহ্বান জানিয়ে প্রধানমন্ত্রী বলেন, দেখা যায় যে কোনো জমি চাষ হয় না, অথবা অনেক সময় দেখা যায় পুকুর হেজে-মজে গেছে, চাষ হয় না, খানাখন্দ পড়ে থাকে। সবটুকুকে কাজে লাগালে- সেদিকে লক্ষ্য রেখে প্রতিটি বাড়ি যেন নিজেরা কিছু উপার্জন করতে পারে।
তিনি বলেন, আমাদের দেশের মাটি উর্বর, জমি উর্বর, আমাদের মানুষ যথেষ্ট কাজের, তাদের একটু কাজে লাগাতে পারলেই সুফল নিয়ে আসা সম্ভব। সমবায়ের মাধ্যমে উন্নয়ন ত্বরান্বিত করতে বিভিন্ন গ্রাম উন্নয়ন সমিতি গঠন করে দেওয়ার কথা উল্লেখ করে প্রধানমন্ত্রী বলেন, আমরা এভাবে কাজ করে যাচ্ছি, যা দারিদ্র্য বিমোচনে অবদান রাখছে।
বাংলাদেশে একটি মানুষও গৃহহারা থাকবে না, সে লক্ষ্যে সরকারের নেওয়া বিভিন্ন পদক্ষেপের কথা জানিয়ে শেখ হাসিনা বলেন, সারা বাংলাদেশে আমরা তথ্য নিচ্ছি, একটি মানুষও যেন গৃহহারা না থাকে। তাদের জন্য ঘর করে দেওয়া। সে লক্ষ্য সামনে রেখে আমরা প্রথমে নাম দিয়েছিলাম একটি বাড়ি একটি খামার, পরে আমি নাম দিয়েছিলাম আমার বাড়ি আমার খামার।
তিনি বলেন, মিল্কভিটার মাধ্যমে গো-খাদ্য উৎপাদনের জন্য লাহিড়ী মোহনপুর দুগ্ধ কারখানায় গো-খাদ্য উৎপাদন কারখানা স্থাপন করা হয়েছে। দুগ্ধ উৎপাদন বৃদ্ধির লক্ষ্যে মহিষের কৃত্রিম প্রজনন কেন্দ্র স্থাপন করা হয়েছে। প্রধানমন্ত্রী বলেন, সিরাজগঞ্জের বাঘাবাড়িঘাট গুড়োঁ দুধ উৎপাদন কারখানা স্থাপন করে দিয়েছি। চট্টগ্রামের পটিয়ায় দুগ্ধ কারখানা স্থাপন প্রকল্প বাস্তবায়ন করা হয়েছে। বর্তমানে ‘বৃহত্তর ফরিদপুরের চরাঞ্চল এবং পার্শ্ববর্তী এলাকায় গবাদিপশুর জাত উন্নয়ন ও দুধের বহুমুখী ব্যবহার নিশ্চিতকরণ কারখানা স্থাপন প্রকল্প হাতে নিয়েছি, খুব শিগগির বাস্তবায়ন শুরু হবে।
শেখ হাসিনা বলেন, আমরা ‘উন্নত জাতের গাভী পালনের মাধ্যমে সুবিধাবঞ্চিত নারীদের জীবনযাত্রার মানোন্নয়ন’ প্রকল্প বাস্তবায়ন করছি। এর মাধ্যমে নারীদের সুদবিহীন, জামানতবিহীন, দীর্ঘমেয়াদী ১ লাখ ২০ হাজার টাকা করে ঋণ দেওয়া হচ্ছে।
সমাজের অনগ্রসর ও পিছিয়ে পড়া জনগোষ্ঠীর উন্নয়নকে প্রাধান্য দিয়ে সরকারের নেওয়া বিভিন্ন পদক্ষেপের কথাও তুলে ধরেন প্রধানমন্ত্রী।
শেখ হাসিনা বলেন, পল্লী উন্নয়ন ও সমবায়ভিত্তিক কার্যক্রম পরিচালনার জন্য বাংলাদেশ পল্লী উন্নয়ন বোর্ড (বিআরডিবি) কর্তৃক পাঁচটি উন্নয়ন প্রকল্পে গ্রামের দরিদ্র ও বিত্তহীন জনগোষ্ঠীকে সংগঠিত করে প্রশিক্ষণ, উপকরণ সরবরাহ ও ঋণ সহায়তা দিয়ে স্বাবলম্বী করে তোলা হচ্ছে। প্রধানমন্ত্রী বলেন, ক্ষুদ্র কৃষকদের উন্নয়নে ক্ষুদ্র কৃষক উন্নয়ন ফাউন্ডেশনের মাধ্যমে তিনটি উন্নয়ন প্রকল্প বাস্তবায়ন করা হয়েছে। এ প্রতিষ্ঠানের কার্যক্রম বর্তমানে ১৭৪টি উপজেলায় বিস্তৃত হয়েছে।
তিনি বলেন, পল্লী অবকাঠামো সুবিধা ও দরিদ্র মানুষের জীবনমান উন্নয়নে পল্লী দারিদ্র্য বিমোচন ফাউন্ডেশনের (পিডিবিএফ) মাধ্যমে সরকার ১০টি প্রকল্প বাস্তবায়ন করেছে। গ্রামে যেন আত্ম-কর্মসংস্থান সৃষ্টি হয়, তার ব্যবস্থা নিয়েছি।
বাংলাদেশ পল্লী উন্নয়ন একাডেমির (বার্ড) গবেষণা সক্ষমতা বৃদ্ধি এবং প্রায়োগিক গবেষণা পরিচালনার জন্য দু’টি প্রকল্প বাস্তবায়নের কথা উল্লেখ করেন প্রধানমন্ত্রী।
সরকারের নেওয়া বিভিন্ন পদক্ষেপে গ্রামীণ মানুষের জীবনমান উন্নয়নের কথা উল্লেখ করে শেখ হাসিনা বলেন, বিদ্যুৎ এবং রাস্তাঘাট, নৌ, রেল, সড়কপথ চালু করা, উন্নত করা এবং বিদ্যুৎ সুবিধা দেওয়া, এর ফলে গ্রাম পর্যায় পর্যন্ত অর্থনৈতিক কর্মকাণ্ড বাড়ছে, মানুষের জীবন মান উন্নত হচ্ছে।
অনুষ্ঠান মঞ্চে অন্যদের মধ্যে উপস্থিত ছিলেন স্থানীয় সরকারমন্ত্রী মো. তাজুল ইসলাম, পল্লী উন্নয়ন ও সমবায় প্রতিমন্ত্রী স্বপন ভট্টাচার্য্য, এ মন্ত্রণালয় সম্পর্কিত সংসদীয় স্থায়ী কমিটির সভাপতি খন্দকার মোশাররফ হোসেন, পল্লী উন্নয়ন ও সমবায় বিভাগের সচিব কামাল উদ্দিন তালুকদার, সমবায় অধিদপ্তরের নিবন্ধক ও মহাপরিচালক মো. আমিনুল ইসলাম, বাংলাদেশ জাতীয় সমবায় ইউনিয়নের সভাপতি শেখ নাদির হোসেন লিপু।


",bn,"











We need to strengthen the marketing system through cooperatives: PM

02 Nov 2019, 21:39




Online Reporter. Prime Minister Sheikh Hasina stressed the importance of marketing products through cooperative products.
He addressed this inauguration of all the programs and fairs organized on the occasion of the 7th National Cooperative Day at Bangabandhu International Conference Center in the capital on Saturday (November 2).
The Prime Minister handed over the medal to the recipients of the National Cooperative Award. He initially visited the fair. The theme of this year's Cooperative Day is 'Visions of Bangabandhu, Cooperative Development'.
Emphasizing the importance of cooperative production and marketing of products, the Prime Minister said that people will lose interest in producing products if they cannot be properly marketed on the cooperative basis, that is, the product being produced.
He directed the concerned to strengthen the marketing system through cooperatives and said that if a family produces something, it is difficult to take it to market. If we can do the marketing system through cooperatives, then every family will benefit.
Referring to the launch of online shopping activities through cooperatives, the Prime Minister said that all offices from the headquarters of the cooperative department to the upazila have been covered under the ICT network. Online shopping is provided through cooperatives.
Highlighting the various steps taken by the government with regard to cooperatives, the three-time government chief said, ""We are giving importance to cooperatives so that more people can benefit from the guidance of Bangabandhu, the father of the nation.
Referring to the coordination of information technology with cooperatives, the Prime Minister said that in the present era, using modern technology, we can develop modern cooperative management through cooperative development.
The Prime Minister directed the concerned to take necessary measures to make the cooperative law age-appropriate and to make the cooperative bank profitable, the Prime Minister said. The co-operative bank, which had a lot of mouths, was stunned. Necessary steps must be taken to make this bank law consistent with making it a profitable institution.
Emphasizing the importance of training to achieve greater benefits, Sheikh Hasina said that those who are skilled in cooperative work should be trained. We must give importance to the way we act honestly.
Calling for the use of every land for production, the Prime Minister said, it is seen that no land is cultivated, or it is often seen that the pond is hedged, not cultivated, the fields are dug. Use everything - with every goal in mind, each house can earn itself.
He said that the soil of our country is fertile, the land is fertile, our people have enough work, it is possible to bring benefits only if they can use them a little. Referring to the formation of various village development societies to accelerate development through cooperatives, the Prime Minister said, ""We are doing this work which is contributing to poverty alleviation.""
Talking about the steps taken by the government to ensure that no one person will be homeless in Bangladesh, Sheikh Hasina said, ""We are taking information across Bangladesh, not even a single person is homeless."" Make room for them. With that goal in mind, we first named a house a farm, then I named my home my farm.
He said that a goat food factory has been set up at Lahiri Mohanpur dairy factory for the production of goat food through MilkWitter. Artificial breeding center of buffalo has been set up to increase dairy production. The Prime Minister said that we have set up a milk production factory at Baghabari Ghat of Sirajganj. A dairy factory has been implemented in Chittagong. At present, we have undertaken a project to establish a cattle farming development and milk utilization assurance factory in the grazing and surrounding areas of Greater Faridpur, and implementation will begin very soon.
Sheikh Hasina said, we are implementing 'Improving the living standard of underprivileged women through rearing of cows of advanced breeds'. Through this, women are being given interest free, unsecured, long term loan of Tk.
The Prime Minister also highlighted various steps taken by the government to prioritize the development of the backward and backward populations of the society.
Sheikh Hasina said, in order to carry out rural development and co-operative activities, five rural development boards (BRDB) are organizing self-sufficiency by providing training, materials and loan assistance to the poor and poor people of the village in five development projects. The Prime Minister said three development projects have been implemented through the Small Farmer Development Foundation for the development of small farmers. The activities of this organization have now been extended to five upazilas.
He said that the government has implemented five projects through the Rural Poverty Alleviation Foundation (PDBF) to improve the rural infrastructure facilities and the poor people. I have taken measures to create self-employment in the village.
The Prime Minister mentioned the implementation of two projects for enhancing the research capacity of Bangladesh Rural Development Academy (BARD) and conducting technical research.
Referring to the improvement of the living standards of the rural people in various steps taken by the government, Sheikh Hasina said that the introduction of electricity and roadways, boats, railways, roadways, upgrading and providing electricity facilities, thereby increasing the economic activities up to the village level, improving the quality of life of the people.
Among others, local government minister Md. Tajul Islam, State Minister for Rural Development and Cooperative Swapan Bhattacharya, Chairman of the Parliamentary Standing Committee on the Ministry, Khandaker Mosharraf Hossain, Secretary of the Department of Rural Development and Cooperatives, Kamal Uddin Talukder, Registrar and Director General of the Department of Cooperatives. Aminul Islam, President of Bangladesh National Cooperative Union, Sheikh Nadir Hossain Lipu.


"
