,src,lang,text
0,"











Nuove offerte di lavoro nel Biellese
Anche Decathlon a Biella sta cercando personale

01 Nov 2019, 09:01

Per le seguenti offerte di lavoro è possibile rivolgersi per informazioni alla sede dell’Informagiovani Biella in via Italia oppure direttamente alle agenzie del lavoro che ricercano personale oggetto dell’annuncio stesso.
Offerta numero 1606 del 25 ottobre 2019Studio professionale ricerca IMPIEGATA / O con esperienza pluriennale nel settore paghe da inserire nel proprio organico.Scrivere a Delta srl via Ravetti 2 A, 13900 Biella
Offerta numero 1604 del 25 ottobre 2019Decathlon è alla ricerca di tantissimo personale con la passione per lo sport che lavori nei suoi punti vendita sparsi in tutta Italia.Settori: Retail, Logistica, Produzione, Finance. Al momento nel punto vendita di Biella stanno ricercando VENDITORE SPORTIVO PRATICANTE ESCURSIONISMO / SCI. Requisiti generali: Condizione sine qua non per lavorare con Decathlon è la passione per il mondo dello sport. Sono trasversalmente richiesti, per quasi tutte le offerte: Conoscenza della lingua inglese; Capacità di lavorare in team; Competenza nel settore sportivo di riferimento. L’azienda dichiara di valutare con particolare interesse i curriculum vitae di giovani, neolaureati e profili esperti. Ma molte offerte non richiedono titoli di studio né esperienza nel campo. Info pagina Decathlon Careers.
Offerta numero 1603 del 25 ottobre 2019– DIRETTORI DI STRUTTURA per residenza per anziani in zona Biella. Le risorse si occuperanno di coordinare il personale, organizzare i turni di lavoro, gestire contatti con le altre strutture sanitarie, pianificare gli inserimenti. Si richiede esperienza pregressa e autonomia nella mansione. Si offre contratto a tempo indeterminato.– OPERATORI SOCIO SANITARI (OSS) per struttura nelle vicinanze di Valdilana.  Le risorse si occuperanno di assistere utenti anziani nella gestione della quotidianità. Si richiede qualifica di OSS e disponibilità su turni. Si offre contratto a scopo assunzione.– EDUCATORI per struttura nelle vicinanze di Biella.  Le risorse si occuperanno di riabilitazione in ambito lavorativo di pazienti con disabilità psichiatriche. Si richiede laurea in Scienze dell’Educazione. Si offre contratto a scopo assunzione.– INFERMIERI per struttura in zona Biella. Le risorse si occuperanno di assistenza a pazienti anziani. Si richiede laurea in Scienze Infermieristiche e disponibilità sui turni. Si offre contratto a scopo assunzione.Info: SYNERGIE ITALIA, via Trento n.38/B 13900-Biella tel. 015405881,  biella1@synergie-italia.it
Offerta numero 1602 del 25 ottobre 2019TERMOIDRAULICI per azienda metalmeccanica in vicinanze di Biella. Le risorse si occuperanno di installazione e riparazione di impianti di riscaldamento e centrali termiche. Si richiede esperienza pregressa nella mansione e disponibilità immediata. Si offre contratto a tempo determinato.– ADDETTI CUSTOMER SERVICE per call center in zona Ivrea. Le risorse si occuperanno di assistenza telefonica a clienti. Si richiede buona dimestichezza nell’uso del pc e flessibilità oraria. Si offre contratto a tempo determinato.– COMMERCIALI ITALIA (SETTORE TESSILE) per azienda in zona Biella. Le risorse si occuperanno di gestione clienti, incremento nuova clientela, promozione prodotti delle nuove collezioni, partecipazione a fiere di settore. Si richiede minima esperienza pregressa nella mansione, preferibilmente in ambito tessile, buona padronanza della lingua inglese e disponibilità a trasferte. Si offre contratto a scopo assunzione.Info: SYNERGIE ITALIA, via Trento n.38/B 13900-Biella tel. 015405881,  biella1@synergie-italia.it
Offerta numero 1601 del 25 ottobre 2019– ADDETTI PULIZIA ISCRITTI ALLE CATEGORIE PROTETTE L.68/99 per azienda in vicinanze di Biella. Le risorse si occuperanno di pulizia di uffici. Si richiede iscrizione al collocamento mirato secondo L.68/99 e disponibilità part time in orario mattutino. Si offre contratto a tempo determinato.– OPERAI ADDETTI ALLA MANUTENZIONE per azienda tessile in vicinanze di Biella. Le risorse si occuperanno di conduzione di macchinari, manutenzione meccanica, coordinamento del personale di reparto. Si richiede pregressa esperienza nella mansione, titolo di studio in ambito tecnico, buona conoscenza di lettura del disegno meccanico, doti di problem solving, disponibilità sui tre turni. Si offre contratto a tempo indeterminato.– MAGAZZINIERI per azienda tessile in vicinanze di Cossato. Le risorse si occuperanno di spostamento merci e riorganizzazione del magazzino. Si richiede esperienza nella mansione e patente per la conduzione di carrelli elevatori. Si offre contratto a tempo determinato.Info: SYNERGIE ITALIA, via Trento n.38/B 13900-Biella tel. 015405881,  biella1@synergie-italia.it
Offerta numero 1600 del 25 ottobre 2019– TINTORI PEZZE per azienda tessile in vicinanze di Trivero. Le risorse di occuperanno di tintura delle pezze. Si richiede esperienza pregressa nella mansione e disponibilità su turni diurni. Si offre contratto a scopo assunzione.– TESSITORI per tessitura in vicinanze di Trivero. Le risorse si occuperanno di conduzione di telai. Si richiede esperienza pregressa nella mansione e disponibilità su turno notte. Si offre contratto a scopo assunzione.– ASPATRICI per azienda tessile in vicinanze di Biella. Le risorse si occuperanno di conduzione di aspe. Si richiede esperienza pregressa nella mansione e disponibilità immediata. Si offre contratto a tempo determinatoInfo: SYNERGIE ITALIA, via Trento n.38/B 13900-Biella tel. 015405881,  biella1@synergie-italia.it
Offerta numero 1599 del 25 ottobre 2019– MANUTENTORI MECCANICI DI MAGLIERIA per azienda tessile in zona Biella. Le risorse si occuperanno di manutenzioni meccaniche su macchinari tessili.  Si richiede esperienza pregressa sui seguenti macchinari: telai rettilinei, macchine piane e rettilinee, macchine per il rimaglio, ricamatrici, lavatrici industriali e macchinari per lo stiro a mano o presse. Si offre contratto a tempo indeterminato.– TESSITORI MAGLIERIA per lanificio in vicinanze di Biella. Le risorse si occuperanno di gestione di telai rettilinei.  Si richiede esperienza pregressa nella mansione e disponibilità su turni diurni. Si offre contratto a tempo determinato.– ADDETTI FINISSAGGIO BAGNATO per azienda tessile in vicinanze di Trivero. Le risorse si occuperanno di lavaggi in continuo. Si richiede esperienza pregressa nella mansione e disponibilità su turni diurni. Si offre contratto a scopo assunzione.Info: SYNERGIE ITALIA, via Trento n.38/B 13900-Biella tel. 015405881,  biella1@synergie-italia.it
Offerta numero 1597 del 25 ottobre 2019– MAGAZZINIERI IN STAGE per filatura in vicinanze di Biella. Le risorse, in affiancamento al tutor aziendale, si occuperanno di imballo e confezionamento rocche e gomitoli, etichettatura, spostamento merce. Si richiede disponibilità immediata su orario giornata (08-12 / 14-18 oppure su turni diurni (06 / 14; 14 / 22). Si offre tirocinio a scopo assunzione.– OPERAI TESSILI IN STAGE per azienda tessile in vicinanze di Biella. Le risorse, in affiancamento al tutor aziendale, si occuperanno di conduzione di macchinari per la filatura / tessitura. Si richiede preferibilmente diploma in ambito tecnico o minima conoscenza di meccanica e disponibilità su turni diurni. Si offre tirocinio retribuito 600€ mensili.– STAGE CURRICULARE ADDETTO / A RISORSE UMANE per staff interno. Le risorse, in affiancamento al tutor aziendale, si occuperanno di accoglienza candidati e attività di front office, supporto reclutamento e selezione del personale, supporto all’archivio di filiale. Si richiede di essere attualmente iscritto/a ad un corso di laurea, buona conoscenza del pacchetto office, predisposizione ai rapporti interpersonali. Si offre tirocinio curriculare.Info: SYNERGIE ITALIA, via Trento n.38/B 13900-Biella tel. 015405881,  biella1@synergie-italia.it
Offerta numero 1596 del 25 ottobre 2019– STAMPATORI IN STAGE per azienda grafica in vicinanze di Biella. Le risorse, in affiancamento al tutor aziendale, si occuperanno di avviare, condurre, coordinare e controllare la funzionalità delle macchine da stampa. Si richiede buona manualità e forte interesse ad imparare una nuova mansione. Si offre tirocinio a scopo assunzione.–  OPERATORI CNC IN STAGE per officina meccanica in vicinanze di Biella. Le risorse, in affiancamento al tutor aziendale, si occuperanno di conduzione di macchinari a controllo numerico. Si richiede preferibile titolo di studio in ambito meccanica e disponibilità immediata su turni diurni. Si offre tirocinio a scopo assunzione.– ADDETTI GASTRONOMIA IN STAGE supermercato nella zona di Pray. Le risorse, in affiancamento al tutor aziendale, di occuperanno di rifornimento scaffali, servizio clienti banco gastronomia. Si richiede flessibilità oraria anche nei fine settimana e disponibilità immediata. Si offre tirocinio retribuito 600€ mensili.Info: SYNERGIE ITALIA, via Trento n.38/B 13900-Biella tel. 015405881,  biella1@synergie-italia.it
Offerta numero 1585 del 22 ottobre 2019Industria tessile cerca in Biella 1 ADDETTO ATTIVITÀ AMMINISTRATIVE / CONTABILITÀ, con esperienza; Contratto di lavoro iniziale a tempo determinato + proroga; Orario: 8.30-12.30/14.00-18.00. Laurea o diploma di media superiore. AutomunitiAzienda edile cerca – per cantiere in Aosta – QUATTRO  MURATORI (DI 2° E 3° LIVELLO). Contratto a tempo determinato 2-3 mesi; Tempo pieno. Disponibilità alle trasferte in Valle d`Aosta. Automuniti.Azienda commercio abbigliamento cerca in Biella 1 ADDETTO ALLE VENDITE IN TIROCINIO FORMATIVO (STAGE). Durata 6 mesi – tempo pieno; Rimborso 600 € mensili; Titolo di studio: Diploma di scuola media superiore. Conoscenze informatiche: Word, Excel, Internet.Possibile candidarsi presso il sito www.biellalavoro.itInfo: Centro per l’impiego Biella, via Maestri del Commercio 6, Biella,  tel. 015.8480.611, biellalavoro@provincia.biella.​it, www.biellalavoro.it
Offerta numero 1584 del 22 ottobre 2019OFFERTA N°76667 Consorzio Sociale cerca con carattere di urgenza 1 INFERMIERE PROFESSIONALE da inserire in struttura protetta sita a biella; contratto inziale a t. determinato; orario su turni. Si richiede: diploma di laurea in infermieristica; regolare iscrizione all`ordine certificazione blsd; disponibilità immediata e a lavoro su turni; patente B / automunito/ahr.consorziosociale@gmail.com
– OFFERTA N°76669 Consorzio Sociale ricerca OPERATORI SOCIO SANITARI da inserire in diverse rsa site a Biella e provincia. Il ruolo richiede ottime doti relazionali, autonomia nell`organizzazione del lavoro, massima professionalità e flessibilità; contratto iniziale a t. determinato + t. indeterminato.È richiesta: qualifica di operatore socio sanitariodisponibilità a lavoro su turni; patente B / automunitiRisorse Umane: hr.consorizosociale@gmail.com– OFFERTA N°76687 Studio dentistico in Biella cerca 1 ASSISTENTE DENTALE (con o senza esperienza); assunzione iniziale a t. determinato + t. indeterminato; Orario full-time; AutomunitiPossibile candidarsi presso il sito www.biellalavoro.itInfo: Centro per l’impiego Biella, via Maestri del Commercio 6, Biella,  tel. 015.8480.611, biellalavoro@provincia.biella.​it, www.biellalavoro.it
Offerta numero 1583 del 22 ottobre 2019– OFFERTA N°76664 Consorzio sociale cerca 1 EDUCATORE PROFESSIONALE da inserire in comunità alloggio di Biella per adulti con patologie psichiatriche, contratto a t. determinato iniziale; orario full-time; Requisiti: serietà e correttezza professionale, flessibilità e disponibilità a lavorare su turni.hr.consorziosociale@gmail.com
– OFFERTA N°76665 Azienda settore spedizioni internazionali in Cerrione cerca 1 ADDETTO IMPORT (pratiche di importazione mare / aeree, procedure di spedizione; contatti con clienti e corrispondenti esteri); Assunzione iniziale a t. determinato 12 mesi con possibilità di trasformazione a t. indeterminato; Orario full-time 8,30-12,30/14-18; Titolo di studio richiesto: diploma di media superiore o laurea. Buona conoscenza lingua inglese parlata e scritta. Buon utilizzo dei sistemi informatici. Automuniti.
– OFFERTA N°76666Studio associato cerca in Biella 1 ADDETTO CONTABILITÀ ORDINARIA E SEMPLIFICATA; contratto a tempo indeterminato; orario 8,30/12,30-14/16. Titolo di studio: Diploma di scuola media superiore. Saranno selezionate esclusivamente persone con precedente esperienza nella tenuta della contabilità. Automuniti.Info: Centro per l’impiego Biella, via Maestri del Commercio 6, Biella,  tel. 015.8480.611, biellalavoro@provincia.biella.​it, www.biellalavoro.it
Offerta numero 1582 del 22 ottobre 2019– ADDETTI FILATURA RING E FILOROCCASi ricerca per azienda cliente, settore tessile, personale con comprovata e recente esperienza in filatura pettinata ring e filorocca. Disponibilità al lavoro su turni diurni. Proposto inserimento in somministrazione con contratto mensile prorogabile. Luogo di lavoro: limitrofi di Biella.Se in possesso dei requisiti richiesti inviare cv via mail a welcome.biella@e-workspa.it specificando nell’oggetto rif. filatura ring.– ADDETTI ROCCATURA RITORCITURA E BINATURASi ricerca per azienda cliente, settore tessile, personale con comprovata e recente esperienza in roccatura, ritorcitura e binatura.Disponibilità al lavoro su turni diurni. Proposto inserimento in somministrazione con contratto mensile prorogabile. Luogo di lavoro: provincia di Biella.Se in possesso dei requisiti richiesti inviare cv via mail a welcome.biella@e-workspa.it specificando nell’oggetto rif. roccatura ritorcitura.– ADDETTI PREPARAZIONE DI FILATURASi ricerca per azienda cliente, settore tessile, personale con comprovata e recente esperienza in preparazione.Disponibilità al lavoro su turni diurni. Proposto inserimento in somministrazione con contratto mensile prorogabile. Luogo di lavoro: provincia di Biella.Se in possesso dei requisiti richiesti inviare cv via mail a welcome.biella@e-workspa.it specificando nell’oggetto rif. preparazione.– TIROCINANTE CARROZZIERESi ricerca per azienda cliente, settore automotive, un tirocinante da adibire ad attività di carrozzeria veicoli. Desideriamo incontrare candidati che abbiano da poco conseguito il diploma o la qualifica professionale in meccanica, appassionati del mondo dei motori, interessati ad intraprendere un percorso formativo in una realtà strutturata e all’avanguardia. Disponibilità al lavoro con orario giornata da lunedì a venerdì. Previsto inserimento in tirocinio. Luogo di lavoro: Biella.Se in possesso dei requisiti richiesti inviare cv via mail a welcome.biella@e-workspa.it specificando nell’oggetto rif. carrozziere.Info: e-work S.P.A. Agenzia per il lavoro, via Lorenzo Delleani, 17/B , Biella tel. 015 9248050, welcome.biella@e-workspa.it

Ti potrebbe interessare:






",it,"











New job offers in the Biella area
Also Decathlon in Biella is looking for staff

01 Nov 2019, 09:01

For the following job offers it is possible to contact the Information Office in Via Italia for information or directly to the employment agencies that are looking for personnel subject to the announcement.
Offer number 1606 of 25 October 2019 Professional study research EMPLOYEE with many years' experience in the pay sector to be included in his workforce. Write to Delta srl ​​via Ravetti 2 A, 13900 Biella
Offer number 1604 of 25 October 2019Decathlon is looking for a lot of staff with a passion for sport that works in its sales points scattered throughout Italy. Sectors: Retail, Logistics, Production, Finance. At the moment in the store in Biella they are looking for SPORTS SELLER PRACTICING HIKING / SKIING. General requirements: Sine qua non for working with Decathlon is the passion for the world of sport. They are transversely requested, for almost all offers: Knowledge of English; Ability to work in a team; Competence in the sports sector of reference. The company declares to evaluate with particular interest the curriculum vitae of young people, recent graduates and expert profiles. But many offers do not require qualifications or experience in the field. Info page Decathlon Careers.
Offer number 1603 of 25 October 2019 - STRUCTURE DIRECTORS for residence for the elderly in the Biella area. The resources will be responsible for coordinating the personnel, organizing work shifts, managing contacts with other health facilities, planning the entries. It requires previous experience and autonomy in the job. The contract is open-ended.– HEALING SOCIAL OPERATORS (OSS) for structures in the vicinity of Valdilana. The resources will take care of assisting elderly users in managing daily life. We require OSS qualifications and turn-based availability. A contract is offered for recruitment purposes.– EDUCATORI for structure near Biella. The resources will deal with rehabilitation in the workplace for patients with psychiatric disabilities. A degree in Education is required. A contract is offered for recruitment purposes.– NURSES for facility in the Biella area. The resources will take care of elderly patients. It requires a degree in Nursing and availability on shifts. A contract is offered for recruitment purposes. Info: SYNERGIE ITALIA, via Trento n.38 / B 13900-Biella tel. 015405881, biella1@synergie-italia.it
Offer number 1602 of 25 October 2019TERMOIDRAULICI for engineering company near Biella. The resources will deal with the installation and repair of heating systems and thermal power plants. It requires previous experience in the job and immediate availability. A fixed-term contract is offered. - CUSTOMER SERVICE EMPLOYEES for call centers in the Ivrea area. The resources will take care of telephone assistance to customers. It requires good familiarity with PC use and time flexibility. A fixed-term contract is offered.– COMMERCIALI ITALIA (TEXTILE SECTOR) by company in the Biella area. The resources will deal with customer management, new customer growth, product promotion of new collections, participation in trade fairs. It requires minimal previous experience in the job, preferably in the textile field, good command of the English language and willingness to travel. A contract is offered for recruitment purposes. Info: SYNERGIE ITALIA, via Trento n.38 / B 13900-Biella tel. 015405881, biella1@synergie-italia.it
Offer number 1601 of 25 October 2019 - CLEANING PERSONS ENROLLED IN PROTECTED CATEGORIES L.68 / 99 for a company in the vicinity of Biella. The resources will deal with cleaning offices. It requires enrollment in the targeted placement according to Law 68/99 and part-time availability in the morning. A fixed-term contract is offered. - WORKERS EMPLOYEES for textile company near Biella. The resources will deal with the management of machinery, mechanical maintenance, coordination of department personnel. It requires previous experience in the job, technical qualification, good knowledge of reading the mechanical drawing, problem solving skills, availability on the three shifts. A permanent contract is offered. - MAGAZZINIERI for a textile company near Cossato. Resources will deal with moving goods and reorganizing the warehouse. Experience in the job and driving license for forklift trucks is required. A fixed-term contract is offered. Info: SYNERGIE ITALIA, via Trento n.38 / B 13900-Biella tel. 015405881, biella1@synergie-italia.it
Offer number 1600 of 25 October 2019 - TINTORI PEZZE for textile company near Trivero. The resources will deal with patch dyeing. It requires previous experience in the job and availability on day shifts. A contract is offered for recruitment purposes. - WEBSITES for weaving in the vicinity of Trivero. The resources will deal with the management of frames. It requires previous experience in the job and availability on the night shift. A contract is offered for recruitment purposes.– ASPATRICI for textile company near Biella. The resources will deal with conducting aspe. It requires previous experience in the job and immediate availability. We offer a fixed-term contract Info: SYNERGIE ITALIA, via Trento n.38 / B 13900-Biella tel. 015405881, biella1@synergie-italia.it
Offer number 1599 of 25 October 2019 - MECHANICAL KNITWEAR MANUFACTURERS for textile company in the Biella area. The resources will deal with mechanical maintenance on textile machinery. Previous experience is required on the following machines: straight frames, flat and rectilinear machines, linking machines, embroidery machines, industrial washing machines and machines for ironing by hand or presses. A permanent contract is offered. - KNITWEAR KNIVES for the wool mill near Biella. The resources will deal with the management of straight frames. It requires previous experience in the job and availability on day shifts. A fixed-term contract is offered. - WET FINISHING PERSONS for a textile company near Trivero. The resources will deal with continuous washing. It requires previous experience in the job and availability on day shifts. A contract is offered for recruitment purposes. Info: SYNERGIE ITALIA, via Trento n.38 / B 13900-Biella tel. 015405881, biella1@synergie-italia.it
Offer number 1597 of 25 October 2019 - WAREHOUSES IN STAGE for spinning near Biella. The resources, alongside the company tutor, will take care of packaging and packaging of bobbins and balls, labeling, goods movement. Immediate availability on day time (08-12 / 14-18 or on day shifts (06/14; 14/22) is required. We offer training for recruitment purposes. - TEXTILE WORKERS IN INTERNSHIP for a textile company near Biella.) resources, in addition to the company tutor, will be in charge of running spinning / weaving machines, preferably a technical diploma or minimum knowledge of mechanics and day shifts will be available, and a paid training period of € 600 per month is offered. / A HUMAN RESOURCES for internal staff The resources, alongside the company tutor, will deal with the reception of candidates and front office activities, recruitment support and selection of personnel, support to the branch archive. to a degree course, good knowledge of the office package, predisposition to interpersonal relationships, curricular internship is offered.Info: SYNERGIE ITALIA, via Trento n.3 8 / B 13900-Biella tel. 015405881, biella1@synergie-italia.it
Offer number 1596 of 25 October 2019 - PRINTERS IN STAGE for graphic company near Biella. The resources, alongside the company tutor, will take care of starting, conducting, coordinating and controlling the functionality of the printing machines. It requires good manual skills and a strong interest in learning a new job. We offer internships for recruitment purposes.– CNC IN STAGE OPERATORS for mechanical workshops near Biella. The resources, alongside the company tutor, will deal with the management of numerically controlled machinery. It is preferable to have a degree in mechanics and immediate availability on day shifts. We offer internships for recruitment purposes. - GASTRONOMY EMPLOYEES IN STAGE supermarket in the area of ​​Pray. The resources, together with the company tutor, will take care of supplying shelves, catering counter food service. It requires time flexibility even on weekends and immediate availability. It offers paid training € 600 monthly.Info: SYNERGIE ITALIA, via Trento n.38 / B 13900-Biella tel. 015405881, biella1@synergie-italia.it
Offer number 1585 of 22 October 2019Significance of the textile industry in Biella 1 ADMINISTRATIVE / ACCOUNTING ACTIVITIES, with experience; Fixed-term initial employment contract + extension; Time: 8.30-12.30 / 14.00-18.00. Undergraduate degree or high school diploma. Autuniti Construction company seeks - for construction sites in Aosta - FOUR MASONRY (OF 2 ° AND 3 ° LEVEL). Fixed-term contract 2-3 months; Full time. Availability to travel in the Aosta Valley. Autuniti. Company trade clothing search in Biella 1 TRAINED SALES AGENT (STAGE). Duration 6 months - full time; Repayment € 600 monthly; Education: High school diploma. Computer skills: Word, Excel, Internet. You can apply at the site www.biellalavoro.itInfo: Biella Employment Center, via Maestri del Commercio 6, Biella, tel. 015.8480.611, biellalavoro@provincia.biella.it, www.biellalavoro.it
Offer number 1584 of 22 October 2019OFFERTA N ° 76667 Consorzio Sociale seeks with urgency 1 PROFESSIONAL NURSE to be inserted in a protected structure located in connecting rod; initial contract at t. determined; shift timetable. The following is required: degree in nursing; regular registration with the blsd certification order; immediate availability and work on shifts; driving license B / automunito/ahr.consorziosociale@gmail.com
- OFFER N ° 76669 Social Consortium search HEALTH SOCIAL OPERATORS to be included in different sites in Biella and province. The role requires excellent interpersonal skills, autonomy in the organization of work, maximum professionalism and flexibility; initial contract at t. determined + t. indeterminate.It is required: qualification of social and health operator available for work on shifts; driving license B / driving license Human Resources: hr.consorizosociale@gmail.com - OFFER N ° 76687 Dental office in Biella seeks 1 DENTAL ASSISTANT (with or without experience); initial assumption at t. determined + t. undetermined; Full-time schedule; Car drivers Can apply at www.biellalavoro.itInfo: Biella Employment Center, via Maestri del Commercio 6, Biella, tel. 015.8480.611, biellalavoro@provincia.biella.it, www.biellalavoro.it
Offer number 1583 of 22 October 2019 - OFFER N ° 76664 Social Consortium search 1 PROFESSIONAL EDUCATOR to be included in the Biella housing community for adults with psychiatric pathologies, contract for t. given initial; full-time schedule; Requirements: professionalism and reliability, flexibility and willingness to work on turni.hr.consorziosociale@gmail.com
- OFFER N ° 76665 International shipping company in Cerrione seeks 1 IMPORT EMPLOYEE (sea / air import practices, shipping procedures; contacts with foreign customers and correspondents); Initial intake at t. determined 12 months with the possibility of transformation to t. undetermined; Full-time timetable 8.30-12.30 / 14-18; Qualification required: high school diploma or degree. Good knowledge of spoken and written English. Good use of computer systems. Drivers.
- OFFER N ° 76666Studio associate search in Biella 1 ORDINARY AND SIMPLIFIED ACCOUNTANT OFFICER; permanent contract; hours 8.30 / 12.30-14 / 16. Education: High school diploma. Only persons with previous experience in accounting will be selected. Automuniti.Info: Biella Employment Center, via Maestri del Commercio 6, Biella, tel. 015.8480.611, biellalavoro@provincia.biella.it, www.biellalavoro.it
Offer number 1582 of October 22nd 2019 - RING AND FILOROCCASIN FILTERS Researchers by client company, textile sector, staff with proven and recent experience in ring and filorocca combed spinning. Availability to work on day shifts. Proposed inclusion in administration with extendable monthly contract. Workplace: neighboring Biella. If you meet the requirements, send cv by email to welcome.biella@e-workspa.it specifying in the object ref. ring spinning. - ROCKING RIPPING EMPLOYEES AND BINATURING research by client company, textile sector, staff with proven and recent experience in spooling, twisting and doubling. Availability for work on day shifts. Proposed inclusion in administration with extendable monthly contract. Place of work: province of Biella. If you meet the requirements, send cv by email to welcome.biella@e-workspa.it specifying in the object ref. twisting spooling. - FILATURAL PREPARATION EMPLOYEESSearch by company client, textile sector, staff with proven and recent experience in preparation. Availability for work on day shifts. Proposed inclusion in administration with extendable monthly contract. Place of work: province of Biella. If you meet the requirements, send cv by email to welcome.biella@e-workspa.it specifying in the object ref. preparation.– TRAINING CARROZZIERES research for client company, automotive sector, a trainee to be used for vehicle bodywork activities. We would like to meet candidates who have recently obtained their diploma or professional qualification in mechanics, fans of the motor world, interested in undertaking a training course in a structured and cutting-edge reality. Availability for work hours from Monday to Friday. Expected placement in training. Workplace: Biella. If you meet the requirements, send cv by email to welcome.biella@e-workspa.it specifying in the object ref. carrozziere.Info: e-work S.P.A. Employment Agency, via Lorenzo Delleani, 17 / B, Biella tel. 015 9248050, welcome.biella@e-workspa.it

Could it be interesting for you:






"
