,src,lang,text
0,"











إقالة نيكو كوفاتش من تدريب بايرن ميونيخ
04 Nov 2019, 03:39 by editor15
المواطن - مروة نبيل
أعلن نادي بايرن ميونخ الألماني، مساء أمس الأحد، عن إقالة المدرب الكرواتي نيكو كوفاتش من تدريب الفريق الأول لكرة القدم، وتعيين مساعده هانز فليك مديرًا فنيًّا، وذلك بعد تراجع النتائج.
وأوضح بايرن ميونيخ أن هانز فليك، سيتولى مهمة التحضير لمواجهة أولمبياكوس اليوناني، الأربعاء المقبل، في دوري أبطال أوروبا، ومباراة الفريق ضد بوروسيا دورتموند، السبت المقبل، في الدوري الألماني لكرة القدم.
وأصدر بايرن ميونيخ بيانًا رسميًّا عبر موقعه الإلكتروني، أكد من خلال أن رئيس النادي أولي هونيس، وكارل هاينز رومينيجه، الرئيس التنفيذي، والمدير الرياضي حسن صالح حميديتش، عقدوا جلسة مع كوفاتش، وتوصلوا لهذا الاتفاق.
وقال رومينيجه: “أداء الفريق ونتائجه في الأسابيع الأخيرة أظهرت مدى الحاجة لتحرك من جانبنا، لذا عقدنا محادثات جادة مع كوفاتش على هذا الأساس في الساعات الماضية”.
وأضاف: “أسفرت هذه المحادثات عن اتفاقنا جميعًا على عدم استكمال كوفاتش مهمته مع بايرن، ونحن نأسف لوصولنا لهذا الحل، وأود التوجه بالشكر له بالنيابة عن كافة العاملين بالنادي، خاصة على تتويجه معنا بثنائية الموسم الماضي”.
وتولى كوفاتش مهمة تدريب بايرن ميونخ صيف عام 2018، ونجح في قيادة الفريق للفوز بألقاب السوبر الألماني، الدوري والكأس، وودع دوري أبطال أوروبا الموسم الماضي من الدور ثمن النهائي على يد ليفربول الإنجليزي.
ويحتل الفريق الأول لكرة القدم بنادي بايرن ميونيخ المركز الرابع في جدول ترتيب الدوري الألماني، وبفارق 4 نقاط عن بوروسيا مونشنجلاباخ المتصدر.
‎وسومالدوري الألمانيبايرن ميونيخكوفاتشنيكو كوفاتشهل قرأت هذا ؟  فرانكفورت يُمزق شباك بايرن ميونخ بخماسية ومدرب البافاري في ورطة مونشنجلادباخ يُهدد البايرن ودورتموند في الدوري الألماني نوير يتألق وبايرن ميونيخ يُفرط في صدارة الدوري الألماني كوتينيو: أول ليلة رائعة لي مع بايرن ميونيخ

‎إلغاء الرد

لن يتم نشر عنوان بريدك الإلكتروني.
هذا الموقع يستخدم Akismet للحدّ من التعليقات المزعجة والغير مرغوبة. تعرّف على كيفية معالجة بيانات تعليقك.


",ar,"











Nico Kovac sacked from Bayern
04 Nov 2019, 03:39 by editor15
The citizen - Marwa Nabil
By Sport Editor Bayern Munich have sacked Croatian coach Nico Kovac as coach and appointed assistant Hans Flick as coach after the results dropped.
Bayern Munich said Hans Flick will take charge of Wednesday's Champions League match against Olympiakos and the match against Borussia Dortmund on Saturday.
Bayern Munich issued an official statement on their website, which confirmed that the club's president Uli Hoeness, Karl-Heinz Rummenigge, chief executive, and sporting director Hassan Saleh Hmeidic, had a session with Kovac, and reached the agreement.
""The team's performance and results in recent weeks have shown the need for action on our part, so we have had serious conversations with Kovac on that basis in the past hours,"" Rummenigge said.
He added: ""These talks resulted in all of us agree that Kovac will not complete his mission with Bayern, and we regret that we reached this solution, and I would like to thank him on behalf of all the staff of the club, especially for crowning us with a double last season.""
Kovac took over as coach of Bayern Munich in the summer of 2018.He managed to lead the team to victory in the German Super League, league and cup trophies, and last season's Champions League were knocked out of the final by Liverpool.
Bayern Munich are fourth in the Bundesliga, four points behind leaders Borussia Moenchengladbach.
The German BundesligaBayern MunichKovacchenko KovacIs you read this? Frankfurt beats Bayern Munich with five goals, Bavarian coach in trouble Mönchengladbach threatens Bayern and Dortmund in the Bundesliga

Cancel reply

your e-mail address will not be published.
This site uses Akismet to reduce spam and spam comments. Learn how to process your comment data.


"
