,src,lang,text
0,"











U4
Viele Trassen für U4 nach Frankfurt-Ginnheim
04 Nov 2019, 20:40 by Florian Leclerc

Bei dem Schienen-Projekt sollen sich die Stadtverordneten auf maximal drei Varianten festlegen.

In den kommenden Wochen will der Magistrat den Stadtverordneten einen Vortrag zur Verlängerung der U4 von Bockenheim nach Ginnheim zukommen lassen. „Es ist das wichtigste ÖPNV-Projekt, das wir in dieser Stadt haben“, sagte Verkehrsdezernent Klaus Oesterling (SPD) der Frankfurter Rundschau und begründete, warum der Vortrag nicht wie angekündigt im Sommer fertig war.
Die Planungen seien „außerordentlich schwierig“ gewesen. Viele Ämter und Institutionen mussten einbezogen werden: der Palmengarten, auch für den Botanischen Garten, das Grünflächenamt für den Grüneburgpark und die Bäume entlang der Strecke, die Deutsche Bundesbank, der Sportverein Makkabi Frankfurt für die Sportanlage, die Deutsche Telekom für den Fernmeldeturm, die Goethe-Universität, die Landesregierung vertreten durch Hessen Mobil.
Nun sei die Untersuchung abgeschlossen und werde zwischen den Ämtern abgestimmt, sagte Oesterling. Zu den bekannten Trassen Europaturm, Frauenfriedenskirche und Ginnheimer Kurve sei die Trasse mit zentraler Anbindung des Campus Westend hinzugekommen. Diese hatte der Frankfurter Verkehrspolitiker Frank Nagel (CDU) vorgeschlagen. Sie firmiert unter den Namen Campus Westend, Ausschleifung Europaturm und „Nagel-Kurve“.
Die jetzige Untersuchung habe noch deutlich mehr Streckenverläufe in den Blick genommen. Oesterling sprach von insgesamt „15 oder 16 Trassen“. Sie müssten auf zwei bis drei Varianten reduziert werden. Die Vorauswahl träfen die Stadtverordneten sobald der Magistratsvortrag vorliege. Neben der Erschließungswirkung werden die Kosten das entscheidende Kriterium sein. Im Frühjahr hatte Oesterling bekanntgegeben, dass die Variante Europaturm 160 bis 170 Millionen Euro kosten würde, die Variante Ginnheimer Kurve 220 bis 230 Millionen Euro. Die Varianten Frauenfriedenskirche und Campus Westend lägen deutlich darüber. Von Bund und Land erhofft die Stadt hohe Zuschüsse.



Den Kosten müsse der Nutzen entgegengestellt werden, sagte Oesterling. Die U-Bahn-Linien aus dem Frankfurter Süden in den Norden (U1, U2, U3, U8) seien schon jetzt an ihrer Kapazitätsgrenze. Mehr als 100 000 Menschen fahren laut Nahverkehrsgesellschaft Traffiq täglich zwischen den Stationen Hauptwache und Eschenheimer Tor. Diese Linien bräuchten dringend Entlastung durch den Lückenschluss zwischen Bockenheim und Ginnheim, sagte er.
Die Goethe-Universität Frankfurt rechnet damit, dass bis 2030 weitere 12 000 Menschen auf dem Campus Westend studieren und arbeiten werden. Zahlreiche Institute siedelten sich an: die Sprach- und Kulturwissenschaften, das Sozialzentrum mit Bafög- und Wohnheimabteilung, die Unibibliothek, das Forschungsinstitut Center for Humanities, das Studierendenhaus, das Deutsche Institut für internationale pädagogische Forschung, das Hessische Zentrum für Friedens- und Konfliktforschung. Derzeit hielten sich 30 000 Menschen pro Tag am Campus Westend auf. Unipräsidentin Birgitta Wolff setzt sich stark für die Verlängerung der U4 über den Campus ein. Die 1968 erbaute Station Holzhausenstraße sei für die steigende Zahl an Fahrgästen nicht ausgelegt.
Mit der U-4-Verlängerung hängt auch der Bau einer Ringstraßenbahn zusammen. Sie soll vom Markus-Krankenhaus zur Friedberger Warte fahren – oder, falls bei der U-Bahn die Variante Frauensfriedenskirche umgesetzt wird, vom Kirchplatz über die Ginnheimer Straße nach Ginnheim.
Eine Nutzen-Kosten-Untersuchung für die Ringstraßenbahn und die verschiedenen U-4-Trassen liege noch nicht vor, sagte Oesterling. Er habe dennoch eine Lieblingsvariante. „Aber die behalte ich noch für mich.“


",de,"











U4
Many routes for U4 to Frankfurt-Ginnheim
04 Nov 2019, 20:40 by Florian Leclerc

In the rail project, the city council should set to a maximum of three variants.

In the coming weeks, the city council wants to give the town councilors a speech on the extension of the U4 from Bockenheim to Ginnheim. ""It is the most important public transport project that we have in this city,"" said traffic department head Klaus Oesterling (SPD) of the Frankfurter Rundschau and explained why the lecture was not finished as announced in the summer.
The plans had been ""extraordinarily difficult"". Many offices and institutions had to be included: the Palm Garden, also for the Botanical Garden, the Green Space Office for the Grüneburgpark and the trees along the route, the Deutsche Bundesbank, the sports club Makkabi Frankfurt for the sports facility, the Deutsche Telekom for the telecommunications tower, the Goethe University, the state government represented by Hessen Mobil.
Now the investigation is completed and will be voted between the offices, said Oesterling. To the well-known routes Europaturm, Frauenfriedenskirche and Ginnheimer curve the route with central binding of the Campus Westend was added. This had suggested the Frankfurt traffic politician Frank Nagel (CDU). It trades under the name Campus Westend, grinding Europeaturm and ""nail curve"".
The current investigation has taken significantly more routes in the view. Oesterling spoke of a total of ""15 or 16 tracks"". They would have to be reduced to two or three variants. The preselection would meet the city council as soon as the Magistratsvortrag available. In addition to the development effect, the costs will be the decisive criterion. In the spring Oesterling had announced that the variant of Europe Tower would cost 160 to 170 million euros, the variant Ginnheimer curve 220 to 230 million euros. The variants Frauenfriedenskirche and Campus Westend are clearly above that. The federal and state authorities are hoping for high grants.



The costs must be offset by the benefits, said Oesterling. The subway lines from the south of Frankfurt to the north (U1, U2, U3, U8) are already at their capacity limit. According to local transport company Traffiq, more than 100,000 people travel daily between the stations Hauptwache and Eschenheimer Tor. These lines urgently need relief from the gap between Bockenheim and Ginnheim, he said.
The Goethe University Frankfurt expects that another 12,000 people will study and work on Campus Westend by 2030. Numerous institutes settled down: the linguistics and cultural studies, the social center with Bafög and residential home department, the university library, the research institute Center for Humanities, the student house, the German institute for international pedagogical research, the Hessian center for peace and conflict research. There are currently 30,000 people per day on Campus Westend. Unipresident Birgitta Wolff is heavily involved in extending the U4 over the campus. The built in 1968 station Holzhausen Street is not designed for the increasing number of passengers.
The construction of a ring tramway is also related to the U-4 extension. It is to drive from the Markus Hospital to the Friedberger Warte - or, if the variant Frauensfriedenskirche is implemented on the underground, from the Kirchplatz over the Ginnheimer Straße to Ginnheim.
A benefit-cost investigation for the ring tram and the various U-4 routes is not yet available, said Oesterling. He still has a favorite variant. ""But I'll keep it for myself.""


"
