,src,lang,text
0,"











Жители Лихославля выбирают объект благоустройства

05 Nov 2019, 21:13

Как сообщили на сайте администрации Лихославльского района, жители города Лихославль посредством опроса выбирают территорию для благоустройства. 
На выбранной территории будет выполнен проект создания комфортной городской среды. 
Жителям предлагаются три варианта: около Лихославльского районного центра дополнительного образования и развития (парк у ДДТ) ; парк 70-летия Победы в городе Лихославль (ул. Лихославльская) ; общественная территория ул. Первомайской . 
ОПРОС пройти можно ТУТ
Напомним, в парке 70-летия Победы уже начались работы по благоустройству. По программе ППМИ установлены мостик, ажурные группы (на фото).
103


",ru,"











Residents of Likhoslavl choose an object of improvement

05 Nov 2019, 21:13

According to the website of the administration of the Likhoslavl region, residents of the city of Likhoslavl choose the territory for improvement through a survey.
A project to create a comfortable urban environment will be completed in the selected area.
Residents are offered three options: near the Likhoslavl District Center for Continuing Education and Development (park near DDT); Park of the 70th anniversary of Victory in the city of Likhoslavl (Likhoslavl st.); public area st. May Day.
POLL can be passed HERE
Recall that in the park of the 70th anniversary of the Victory, improvement work has already begun. According to the PPMI program, a bridge and openwork groups were installed (pictured).
103


"
