,src,lang,text
0,"











دلیل سفر دختر صدام به عربستان چیست؟

05 Nov 2019, 21:09

یک منبع آگاه اعلام کرد سفیر عربستان سعودی در اردن از رغد، دختر دیکتاتور سابق عراق برای سفر به ریاض دعوت کرده است.
به گزارش شبکه اطلاع رسانی راه دانا؛ به نقل از خبرگزاری اسپوتنیک عربی، سایت‌های خبری اردن گزارش دادند سفیر عربستان سعودی در امان، پایتخت اردن با «رغد صدام حسین» دختر دیکتاتور سابق عراق ملاقات کرده و از وی برای شرکت در کنفرانسی با محوریت رویداد‌های اخیر عراق که قرار است در ریاض برگزار شود، دعوت کرده است.
سایت «السومریه» عراق نیز به نقل از یک منبع آگاه اعلام کرد در جلسه‌ای که بین دختر دیکتاتور سابق عراق و خالد بن فیصل آل سعود، سفیر عربستان در اردن برگزار شد، دو طرف در خصوص تحولات اخیر در عراق گفت‌وگو کردند.
این منبع افزود: خالد بن فیصل در این دیدار نسبت به شرایط موجود در عراق ابراز نگرانی کرده است.
به گفته این منبع آگاه، سفیر عربستان با اعطای دعوتنامه ریاض، از رغد برای سفر به عربستان و شرکت در کنفرانسی با محوریت رخداد‌های اخیر و چشم انداز‌های آینده در عراق که قرار است ماه آینده در پایتخت عربستان برگزار شود، دعوت کرد.
مردم عراق از ماه اکتبر به دلیل شرایط اقتصادی دست به اعتراض زده‌اند. این در حالی است که برخی از رسانه‌های سعودی با مداخله آشکار در جنبش‌های مردمی عراق به دروغ‌سازی، شایعه‌پراکنی و تحریف گفتمان حقوقی مطالبه‌جویانه متوسل می‌شوند. گفته می‌شود دعوت از دختر صدام حسین برای سفر به عربستان نیز بخشی دیگر از اقدامات مداخله جویانه سعودی‌ها در مسائل داخلی عراق است.
دولت عراق در ۵ فوریه ۲۰۱۸ با انتشار یک فهرست، نام ۶۰ تن از افرادی را که تحت پیگرد هستند، اعلام کرد که دختر صدام یکی از این شصت نفر بود.
انتهای پیام/


",fa,"











Why is Saddam's daughter traveling to Saudi Arabia?

05 Nov 2019, 21:09

An informed source said the Saudi ambassador to Jordan had invited Raghad, the daughter of the former Iraqi dictator, to travel to Riyadh.
Jordanian ambassador to Amman, Jordanian capital, meets former Iraqi dictator Raghad Saddam Hussein to attend a conference focused on events, Jordanian news sites reported. Iraq has recently been invited to Riyadh.
The two sides discussed recent developments in Iraq during a meeting between the daughter of former Iraqi dictator and Jordanian ambassador to Khaled bin Faisal Al Saud.
Khaled bin Faisal expressed concern at the current situation in Iraq, the source added.
According to the source, the Saudi ambassador invited Riyadh to travel to Saudi Arabia and attend a conference focusing on recent events and future prospects in Iraq to be held in the Saudi capital next month, according to the source.
Iraqis have been protesting since October because of economic conditions. However, some Saudi media have resorted to lying, gossip, and distortion of the legal discourse of law with open intervention in popular movements in Iraq. Inviting Saddam Hussein's daughter to travel to Saudi Arabia is also said to be another part of Saudi interference in Iraq's internal affairs.
On February 4, the Iraqi government released a list announcing the names of four people wanted, Saddam's daughter was one of sixty.
End of message /


"
