,src,lang,text
0,"











Grado de participación depende enteramente de México: FBI
""Yo subrayaría que el papel podrá desempeñar el FBI en México depende en gran medida de la voluntad de nuestros socios"", dijo Chris Wray
05 Nov 2019, 21:50 by Agencia Reforma
Washington DC, Estados Unidos.- El grado de participación del Buró Federal de Investigaciones de Estados Unidos (FBI) en la indagatoria mexicana sobre el ataque en murieron nueve miembros de la familia LeBarón depende enteramente de México, dijo Chris Wray, director de la dependencia.
Al comparecer el lunes ante el Comité de Seguridad Interna del Senado de EU, Wray confirmó que el FBI había ofrecido ayudar en las investigaciones sobre la masacre en la zona de Bavispe, Sonora.




""Yo subrayaría que el papel podrá desempeñar el FBI en México depende en gran medida de la voluntad de nuestros socios mexicanos de acogernos e incorporarnos. Eso es algo que se está decidiendo. Es una situación muy fluida"", dijo Wray.
Todavía no sé exactamente cómo se verá nuestra huella.


AFP. Chris Wray

El director Wray confirmó haber contactado a sus socios en el Gobierno mexicano, sin identificar a quien, para ofrecerles ayuda a través de la Oficina del Agregado Legal de la Embajada de EU en México que depende del FBI.



Además de asegurar estar profundamente desconsolados por la pérdida de vidas, el director Wray aseguró que la sección de víctimas del FBI está lista para ayudar con consejería psicológica a los familiares de las víctimas que están en territorio estadounidense al ser ciudadanos de ambos países.
AMLO rechaza ayuda de Trump para iniciar guerra contra el narco
El presidente Andrés Manuel López Obrador dijo que le responderá a Donald Trump después de la conferencia de prensa, quien ofreció todo su apoyo para deshacerse de ""esos monstruos"" que atacaron a la familia LeBarón.
AMLO recordó que el presidente de estadounidos pidió hablar con él después de lo ocurrido en Culiacán.
En esta ocasión, el presidente estadounidense Donald Trump dijo que López Obrador está haciendo un buen trabajo, sin embargo el poder de los cárteles sobrepasó las fuerzas de la autoridad.
""Estados Unidos está listo, dispuesto y capaz de involucrarse y hacer el trabajo de manera rápida y efectiva. ¡El gran nuevo presidente de México ha hecho de esto un gran tema, pero los carteles se han vuelto tan grandes y poderosos que a veces necesitas un ejército para derrotar a un ejército!""



Fue lo que escribió Donald Trump, en una serie de tweets donde proponía el apoyo de su ejército.
El presidente descartó la intervención de Estados Unidos, sin embargo no ha descartado la posibilidad de recibir apoyo del FBI, ya que la familia LeBarón tiene doble nacionalidad.






Familia LeBaron


FBI




",es,"











Degree of participation depends entirely on Mexico: FBI
""I would stress that the role the FBI can play in Mexico depends largely on the will of our partners,"" said Chris Wray
05 Nov 2019, 21:50 by Agencia Reforma
Washington DC, United States.- The degree of participation of the Federal Bureau of Investigations of the United States (FBI) in the Mexican investigation into the attack killed nine members of the LeBarón family depends entirely on Mexico, said Chris Wray, director of the agency .
Appearing on Monday before the US Senate Internal Security Committee, Wray confirmed that the FBI had offered to assist in the investigations into the massacre in the Bavispe, Sonora area.




""I would stress that the role the FBI can play in Mexico depends largely on the willingness of our Mexican partners to welcome us and incorporate us. That is something that is being decided. It is a very fluid situation,"" said Wray.
I still don't know exactly what our footprint will look like.


AFP. Chris Wray

Director Wray confirmed having contacted his partners in the Mexican Government, without identifying who, to offer help through the Office of the Legal Attaché of the US Embassy in Mexico that depends on the FBI.



In addition to ensuring that he is deeply disconsolate about the loss of life, Director Wray said that the FBI victims section is ready to help with psychological counseling to the families of the victims who are in US territory by being citizens of both countries.
AMLO rejects Trump's help to start war on drug trafficking
President Andrés Manuel López Obrador said he will respond to Donald Trump after the press conference, who offered his full support to get rid of ""those monsters"" that attacked the LeBarón family.
AMLO recalled that the president of the United States asked to speak with him after what happened in Culiacán.
On this occasion, US President Donald Trump said that López Obrador is doing a good job, however the power of the cartels exceeded the forces of authority.
""The United States is ready, willing and able to get involved and do the job quickly and effectively. The great new president of Mexico has made this a great issue, but the posters have become so big and powerful that sometimes you need an army to defeat an army! ""



It was what Donald Trump wrote, in a series of tweets where he proposed the support of his army.
The president ruled out the intervention of the United States, however he has not ruled out the possibility of receiving support from the FBI, since the LeBarón family has dual citizenship.






LeBaron family


FBI




"
