,src,lang,text
0,"











Gobierno da paso atrás con el litio; cívicos ratifican medidas
04 Nov 2019, 07:49 by Redacción Central
El Gobierno emitió el Decreto Supremo 4070 que abroga el 3738 que permitía la asociación con una empresa alemana para la industrialización del litio durante 70 años. Pese al cumplimento de una de sus demandas, el Comité Cívico de Potosí (Comcipo) dijo que no abandonará la lucha ni levantará las medidas, informó el dirigente, Marco Pumari.
El gobernador de Potosí, Juan Carlos Cejas, hizo público el DS 4070, ayer.
El documento tiene ocho considerandos y un artículo único que dice: “Se dispone la abrogación del Decreto Supremo N° 3738, de 7 de diciembre de 2018”.
El cuestionado DS 3738, permitía la asociación del Estado boliviano con la empresa alemana ACI Systems por un periodo de 70 años, para la explotación de los recursos evaporíticos. Comcipo rechazó ese decreto por considerarlo “entreguista” de los recursos naturales.
Por este motivo, instalaron una huelga desde hace más de 25 días. Ahora, Pumari dijo que la abrogación es producto de esa lucha perseverante de los potosinos.
“Esto es resultado de la presión de la población, por lo que felicitamos a los potosinos. Sin embargo, eso no cambia en nada las movilizaciones del departamento de Potosí”, aseveró el cívico Pumari.
Agregó que esta abrogación es producto de un nerviosismo que tendría el Gobierno central. Sin embargo, solicita que la continuidad de las manifestaciones sean pacíficas para evitar el enfrentamiento entre bolivianos.
“El Gobierno está nervioso y tiene miedo, por eso recurren a dirigentes prebendales. No creo que exista confrontación entre bolivianos, pero sí es posible. Al Gobierno no le importa arriesgar la vida de sus propias bases, de la policía y los militares. No puede ser que se busque agredir a su propio pueblo y ahí toca que todos nos defendemos”, agregó el dirigente de Comcipo.  
El diputado potosino de oposición, Gonzalo Barrientos, manifestó que la abrogación del Decreto Supremo 3738 no es suficiente. Exige que el departamento de Potosí tenga ingresos por la explotación de este recurso que sale del salar de Uyuni.
“Lo que se exige para Potosí es tener ganancias por el litio. Eso implica la modificación de la Ley 535 y la 928 para que el pueblo, a través de Gobernación, participe de la industrialización y así posibilitar unos 7 mil millones de bolivianos para ingresos”, declaró el diputado.
El Gobierno vio en el salar de Uyuni la posibilidad de aprovechar el litio para la industrialización y exportación. Sin embargo, en ningún momento se dispuso que un porcentaje sea directo para el departamento.
 

Comcipo denunció que la asociación con la empresa alemana era una “entrega” de los recursos de los potosinos y bolivianos

 

CÍVICOS ESTÁN EN SANTA CRUZ PARA UNIFICAR ACCIÓN



REDACCIÓN CENTRAL


El Comité Cívico Potosino (Comcipo) recibió la noticia de la abrogación del DS 3738 en Santa Cruz. Los dirigentes mantuvieron reuniones con líderes del departamento oriental con el fin de unificar criterios y organizar una movilización única y masiva a la ciudad de La Paz.
“Debemos unificar criterios para unificar la lucha. Más allá de las movilizaciones departamentales, es momento de pensar en una nacional y eso se va a conocer en las próximas horas”, expresó el líder potosino Marco Pumari.
Agregó que quienes actualmente defienden al presidente Evo Morales son funcionarios públicos. A quienes invitan a sumarse a las protestas.
“Los supuestos campesinos son funcionarios públicos que están siendo obligados a salir a desbloquear.  Convocamos a todos los funcionarios públicos a dejar de lado a ese patrón y capataz”, agregó Pumari.
Entre los principales pedidos que sostienen los cívicos de Potosí y Santa Cruz están la renuncia del presidente Morales, nuevas elecciones y la renovación de líderes.
“Nuevos líderes y nuevas personas que tengan la capacidad y el compromiso de asumir las riendas de nuestro país”, dijo Pumari. 


",es,"











Government takes step back with lithium; civics ratify measures
04 Nov 2019, 07:49 by Central Writing
The Government issued Supreme Decree 4070 that repeals 3738 that allowed the association with a German company for the industrialization of lithium for 70 years. Despite the fulfillment of one of its demands, the Potosí Civic Committee (Comcipo) said it will not abandon the fight or lift the measures, said the leader, Marco Pumari.
The governor of Potosí, Juan Carlos Cejas, made public the DS 4070, yesterday.
The document has eight recitals and a single article that says: ""The abrogation of Supreme Decree No. 3738, of December 7, 2018, is provided.""
Questioned DS 3738, allowed the association of the Bolivian State with the German company ACI Systems for a period of 70 years, for the exploitation of evaporitic resources. Comcipo rejected that decree because it was considered ""delivered"" by natural resources.
For this reason, they set up a strike for more than 25 days. Now, Pumari said the abrogation is a product of that persevering struggle of the potosinos.
“This is a result of population pressure, so we congratulate the potosinos. However, that does not change the mobilizations of the department of Potosí at all, ”said the civic Pumari.
He added that this repeal is the product of a nervousness that the central government would have. However, he requested that the continuity of the demonstrations be peaceful to avoid confrontation between Bolivians.
“The government is nervous and afraid, that's why they turn to pre-war leaders. I don't think there is a confrontation between Bolivians, but it is possible. The Government does not mind risking the life of its own bases, the police and the military. It cannot be that they seek to attack their own people and that is where we all defend ourselves, ”added the Comcipo leader.
The opposition Potosi deputy, Gonzalo Barrientos, said that the repeal of Supreme Decree 3738 is not enough. It requires that the department of Potosí have income from the exploitation of this resource that comes out of the Uyuni salt flat.
“What is required for Potosí is to have profits from lithium. That implies the modification of Law 535 and 928 so that the people, through the Interior, participate in industrialization and thus enable about 7 billion Bolivians for income, ”said the deputy.
The Government saw in the Salar de Uyuni the possibility of taking advantage of lithium for industrialization and export. However, at no time was it provided that a percentage be direct to the department.


Comcipo denounced that the association with the German company was a “delivery” of the resources of the potosinos and Bolivians



CIVICS ARE IN SANTA CRUZ TO UNIFY ACTION



CENTRAL DRAFTING


The Potosino Civic Committee (Comcipo) received the news of the repeal of DS 3738 in Santa Cruz. The leaders held meetings with leaders of the eastern department in order to unify criteria and organize a unique and massive mobilization to the city of La Paz.
“We must unify criteria to unify the fight. Beyond the departmental mobilizations, it is time to think of a national and that will be known in the next few hours, ”said the Potosi leader Marco Pumari.
He added that those who currently defend President Evo Morales are public officials. To those who invite to join the protests.
“The alleged peasants are public officials who are being forced out to unlock. We call on all public officials to put that employer and foreman aside, ”Pumari added.
Among the main requests that the citizens of Potosí and Santa Cruz maintain are the resignation of President Morales, new elections and the renewal of leaders.
“New leaders and new people who have the capacity and commitment to take over the reins of our country,” said Pumari.


"
