,src,lang,text
0,"











Horóscopo: Conoce tus predicciones para hoy 4 de Noviembre 2019 según tu signo

04 Nov 2019, 07:56


Descubre lo que te depara el futuro, según tu signo zodiacal, para hoy lunes 4  de  noviembre con las predicciones de Luna Ayllón.



Te mostramos lo que te depara el futuro el día de hoy lunes 4 de Noviembre.Fuente: Radio Corazón

Conoce todas las predicciones del horóscopo para hoy lunes 4 de  noviembre de 2019. Descubre con Luna Ayllón y sus cartas del tarot cómo te irá en el amor, trabajo, dinero y salud, según tu signo del zodiaco, en esta fecha. 
 
   Por:  Luna Ayllón   Citas:  989956644
Aries: Tienes experiencia en el trabajo y resuelves lo que te piden. En el amor debes de analizar los pro y los contra de una situación.
Tauro: Cuidado con el aburrimiento en el trabajo porque no sería bueno para ti. En el amor suéltate y haz cambios que sean importantes.
Géminis: Te has quedado en un momento de vacío a nivel profesional, muévete. En el amor no sientes grandes cosas, debes de aclarar tu mente.
Cáncer: Vas a compartir cosas interesantes donde tengas provecho profesional. En el amor se aclaran las cosas y se llega a acuerdos.
Leo: Fluyes con una situación que estaba paralizada en el trabajo, síguelo. En el amor las cosas se calman, tu mente se calma y todo llega a un orden.
Virgo: Llega dinero, seguridad y estabilidad en el trabajo. En el amor todo se acomoda y te da felicidad.
Libra: Estás comparando situaciones que no debes de tener más. En el amor las cosas se ponen más fuertes donde debes decidir.
Escorpio: Momento de reflexionar en el trabajo, no decidas. En el amor estás pensando que hacer, espera.
Sagitario: Tu mente funciona a mil, es momento de descansar. En el amor todo lo que debas hacer será siempre para tu mayor tiempo.
Capricornio: Celebraciones en el trabajo para avanzar y para hacer las cosas con éxito. En el amor se da lo que tanto esperas con beneficios y felicidad.
Acuario: Una nueva aventura, arriésgate en el trabajo. En el amor se da una oportunidad de hacer algo interesante.
Piscis: Todo lo que hagas será para tener éxito y dinero. En el amor te mueves hacia un lugar donde tendrás tranquilidad.
   Por:  Luna Ayllón   Citas:  989956644


",es,"











Horoscope: Know your predictions for today November 4, 2019 according to your sign

04 Nov 2019, 07:56


Discover what the future holds for you, according to your zodiac sign, for Monday, November 4, with Luna Ayllón's predictions.



We show you what the future holds for you today, Monday, November 4. Source: Radio Corazón

Know all the horoscope predictions for today, Monday, November 4, 2019. Discover with Luna Ayllón and his tarot cards how you will be in love, work, money and health, according to your zodiac sign, on this date.

By: Luna Ayllón Quotes: 989956644
Aries: You have work experience and solve what they ask for. In love you must analyze the pros and cons of a situation.
Taurus: Beware of boredom at work because it wouldn't be good for you. In love, let go and make changes that are important.
Gemini: You have been left in a professional moment of emptiness, move. In love you don't feel great things, you must clear your mind.
Cancer: You will share interesting things where you have professional benefit. In love things are clarified and agreements are reached.
Leo: You flow with a situation that was paralyzed at work, follow it. In love things calm down, your mind calms down and everything comes to an order.
Virgo: Money, safety and stability at work arrive. In love everything fits and gives you happiness.
Libra: You are comparing situations that you shouldn't have anymore. In love, things get stronger where you have to decide.
Scorpio: Time to reflect on work, do not decide. In love you are thinking what to do, wait.
Sagittarius: Your mind works a thousand, it's time to rest. In love, everything you should do will always be for your greatest time.
Capricorn: Celebrations at work to move forward and to do things successfully. In love there is what you expect with benefits and happiness.
Aquarius: A new adventure, take a risk at work. In love there is an opportunity to do something interesting.
Pisces: Everything you do will be to succeed and money. In love you move to a place where you will have tranquility.
By: Luna Ayllón Quotes: 989956644


"
