,src,lang,text
0,"











Casados à primeira vista
Inês desfeita em lágrimas ao recordar o passado 
07 Nov 2019, 21:10 by Ravista Vip

Inês e Hugo jantam numa casa de fados e Inês termina a noite bastante emocionada
























































Inês lavada em lágrimas

No episódio de Casados à Primeira Vista desta quinta-feira, 7 novembro, Inês e Hugo terminaram a jantar numa casa de fados. A aveirense deixa-se levar pelas emoções e chora enquanto ouve uma canção de fado.
«O fado acompanha-me desde pequenina. A minha mãe sempre ouviu fado, sempre cresci a ouvir fado. Já tive alguém muito especial que cantava muito para nós e significa muito», diz, emocionada.
Bruno e Tatiana e o clima de cumplicidade
Bruno e Tatiana saíram do cartório e dirigiram-se ao copo-de-água, onde já estavam os convidados. Luísa, a madrinha muito atenta, esteve a investigar a vida de Tatiana. «Já sei tudo da noiva. O quê que achas que eu fui fazer?» , confessa a Ruca, o padrinho, enquanto esperam pelos noivos na mesa.
O facto da nortenha ser enfermeira em Inglaterra não parece ser um impedimento para que esta relação dê certo. «Acredito que para isto arranje solução», diz.
Leia aqui o resumo na íntegra. 
 
Texto: Inês Borges/ Foto: DR


",pt,"











Married at first sight
Inês burst into tears as she recalls the past
07 Nov 2019, 21:10 by Ravista Vip

Inês and Hugo have dinner at a fado house and Inês ends the night very emotionally
























































Inês washed in tears

In the episode of Married at First Sight this Thursday, November 7, Inês and Hugo finished dinner at a fado house. The Aveirense gets carried away by emotions and cries while listening to a fado song.
«Fado accompanies me since I was a little girl. My mother always listened to fado, I always grew up listening to fado. I've had someone very special who sang a lot to us and means a lot, ”she says, thrilled.
Bruno and Tatiana and the climate of complicity
Bruno and Tatiana left the registry office and went to the wedding reception, where the guests were already. Luisa, the very attentive godmother, was investigating Tatiana's life. «I already know all about the bride. What do you think I went to do? 'Confesses to Ruca, the best man, while they wait for the newlyweds at the table.
The fact that the northerner is a nurse in England does not seem to be an impediment for this relationship to work. ""I believe that you can find a solution,"" he says.
Read here the full summary.

Text: Inês Borges / Photo: DR


"
