,src,lang,text
0,"











Lucian Bode: TAROM a plătit un avans de 900.000 euro pentru achiziţionarea celor 9 ATR-uri fără contract
06 Nov 2019, 17:47 by Laura Albu, Mediafax
Ministrul Transporturilor, Lucian Bode a declarat, miercuri, că TAROM a plătit sub conducerea Mădălinei Mezei un avans de 900.000 de euro pentru aeronave ATR în baza unui memorandum, fără a exista un contract. Bode a spus că la TAROM se află în vizită DNA, DIICOT, Poliţia şi Consiliul Concurenţei.
""În acest moment la TAROM sunt în vizită următorii: DNA, DIICOT, Corpul de Control al prim-ministrului, Corpul de Control al Ministerului Transporturilor, Autoritatea pentru Protecţia Datelor, Consiliul Concurenţei, Autoritatea pentru Discriminare, Poliţia. Nu ştiu dacă mai există vreo instituţie care nu... Ce s-a întâmplat cu această companie şi modul în care a fost administrată în ultima perioadă depăşeşte orice imaginaţie"", a declarat ministrul Lucian Bode.
Pierderile TAROM vor depăşi 180 de milioane de euro anul acesta, în contextul în care compania a plătit 900.000 de euro pentru achiziţionarea celor 9 aeronave ATR în baza unui memorandum fără a exista un contract semnat.
""Au disponibili în cont 21 milioane de euro, au înregistrat pierderi de 160 de milioane de lei în 2018 şi se pregătesc să depăşească 180 de milioane de lei în 2019. Sunt în discuţii avansate pentru achiziţionarea celor 9 ATR-uri cu acel contract semnat de doamna Mezei. (...) Doamna Mezei a semnat un memorandum prin care a acordat un avans de 900.000 de euro pe acest contract pentru achiziţionarea acestor 9 aeronave. A acordat un avansat pe baza unui memorandum. Nu am mai văzut aşa ceva. Nu există contract, nu există niciun contract. Tarom a plătit 900 de mii de euro avans pentru achiziţionarea acestor 9 ATR-uri fără contract, pe baza unui memorandum"", a mai spus Bode.
Întrebat despre situaţia avansului pentru cele 9 aeronave, fostul ministrul al Transporturilor, Răzvan Cuc a declarat că nu ştie despre acest lucru, dar presupune că Mădălina Mezei a făcut acest lucru în mod legal.
""Eu nu m-am implicat niciodată în achiziţia de aeronave în niciun mandat. Ce pot să vă spun - că aceste 9 ATR-uri sunt vitale companiei, trebuiau aduse din luna octombrie, graficul de livrare al ATR-urilor era în luna octombrie 2, în luna noiembrie unul şi, ulterior, în anul următor să vină restul aeronvelor. Ele sunt vitale pentru că. din punct de vedere al eficienţei, sunt cele mai bune pe scurt curier, pe distanţele interne. Am solicitat restructurarea TAROM din temelie. Nu ştiu ce a avansat doamna Mezei. (...) Ea nu a venit niciodată să-mi spună mie că dă un avans la ATR-uri. Presupun că dacă l-a dat, l-a dat legal"", a spus Răzvan Cuc.
Ministrul Lucian Bode a mai declarat că TAROM are nevoie de restructurări şi de un management profesionist şi va discuta cu Comisia Europeană în vederea unui ""ajutor de salvare"".
""E clar că avem nevoie de o restructurare urgentă a acestei companii. Dar nu restructurarea din 2017. În 2017 s-a demarat o procedură de restructurare. Aveam 1.874 de angajaţi, iar la final compania avea 1.900 de angajaţi. Deci restructurare... La comercial sunt peste 200 de angajaţi, dar nu fac nimic ca zborul să devină profitabil. La tehnic avem cele mai mari costuri din Europa. Peste 40% costuri mai mari decât la orice companie din Uniunea Europeană. Va trebui să intervenim de urgenţă. (...)
Au nevoie urgent de un ajutor de salvare. O să discutăm cu toţi factorii implicaţi, cu Comisia Europeană pentru ajutor de salvare, dar ne propunem clar să salvăm această companie. Ca să nu mai spun de acele celebre agenţii de tursim din toată lumea care, în multe situaţii, rezervă 100% bilete alocate, dar după le anulează. De ce fac asta? Pentru că încasează un comision şi rămân cu banii respectivi în cont"", a spus Lucian Bode.


",ro,"











Lucian Bode: TAROM has paid an advance of 900,000 euros for the purchase of the 9 ATRs without a contract
06 Nov 2019, 17:47 by Laura Albu, Mediafax
The Minister of Transport, Lucian Bode, said on Wednesday that TAROM paid under the management of Mădălinei Mezei an advance of 900,000 euros for ATR aircraft based on a memorandum, without a contract. Bode said that TAROM is visiting DNA, DIICOT, the Police and the Competition Council.
""At the moment at TAROM are visiting the following: DNA, DIICOT, the Prime Minister's Control Body, the Control Ministry of the Ministry of Transport, the Data Protection Authority, the Competition Council, the Discrimination Authority, the Police. I don't know if there are any more institution that does not ... What happened to this company and the way it has been administered lately exceeds any imagination, ""said Minister Lucian Bode.
TAROM's losses will exceed 180 million euros this year, in the context in which the company paid 900,000 euros for the purchase of the 9 ATR aircraft based on a memorandum without a signed contract.
""They have available in the account 21 million euros, they registered losses of 160 million lei in 2018 and they are preparing to exceed 180 million lei in 2019. They are in advanced discussions for the purchase of the 9 ATRs with that contract signed by Mrs. Mezei (...) Ms. Mezei signed a memorandum granting an advance of 900,000 euros on this contract for the purchase of these 9 aircraft. He granted an advanced one based on a memorandum. I have never seen anything like this before. there is a contract, there is no contract. Tarom paid 900 thousand euros in advance for the purchase of these 9 ATRs without a contract, based on a memorandum, ""said Bode.
Asked about the situation of the advance for the 9 aircraft, the former Minister of Transport, Răzvan Cuc said he did not know about this, but he assumed that Mădălina Mezei did this legally.
""I have never been involved in the acquisition of aircraft in any mandate. What can I say - that these 9 ATRs are vital to the company, they had to be brought in from October, the delivery schedule of the ATRs was in October 2 , in November one and then in the following year the rest of the aircraft come in. They are vital because, in terms of efficiency, they are the best in the short haul, on the internal distances. I have requested the restructuring of TAROM from the foundation. I know what Mrs Mezei has advanced. (...) She never came to tell me she was giving the ATRs a breakthrough. I suppose if she gave it, he gave it legally, ""said Răzvan Cuc.
Minister Lucian Bode also said that TAROM needs restructuring and professional management and will discuss with the European Commission for ""rescue aid"".
""It is clear that we need an urgent restructuring of this company. But not the restructuring of 2017. In 2017, a restructuring procedure was started. We had 1,874 employees, and at the end the company had 1,900 employees. there are over 200 employees, but they do nothing to make the flight profitable. Technically we have the highest costs in Europe. Over 40% higher costs than any company in the European Union. We will have to intervene urgently. .)
They urgently need rescue help. We will discuss with all the involved factors, with the European Commission for rescue aid, but we clearly intend to save this company. Not to mention those famous travel agents from all over the world who, in many situations, reserve 100% allocated tickets, but cancel afterwards. Why do I do this? Because they charge a commission and they stay with the respective money in the account, ""said Lucian Bode.


"
