,src,lang,text
0,"












توافق ریاض هیچ کمکی به حل مشکلات یمن نمی‌کند

سخنگوی وزارت امور خارجه ایران در واکنش به توافق ناقص نیروهای وابسته به اشغالگران و دولت مستعفی یمن، گفت: امضای این اسناد هیچ کمکی به حل مشکلات...
06 Nov 2019, 17:05 by بولتن نیوز | bultannews.com
به گزارش بولتن نیوز، سید عباس موسوی سخنگوی وزارت امور خارجه جمهوری اسلامی ایران در واکنش به امضای سند توافق ریاض بین بعضی از گروه‌های جنوب یمن با منصور هادی اظهار داشت: امضای چنین اسنادی هیچ کمکی به حل مشکلات یمن نخواهد کرد و این امر در جهت تثبیت اشغالگری عربستان سعودی و متحدانش در جنوب یمن به صورت مستقیم و یا از طریق نیروهای نیابتی آنان خواهد بود.
سخنگوی وزارت امور خارجه با اشاره به موضع جمهوری اسلامی ایران در خصوص تشکیل دولت متحد و فراگیر یمن بر اساس گفتگوهای یمنی - یمنی بر حفظ وحدت و تمامیت ارضی این کشور تاکید و اظهار داشت: مردم هوشیار یمن که همیشه با اشغالگران مبارزه کرده اند به دشمنان و بدخواهان آنان اجازه نخواهند داد جنوب این کشور تحت کنترل و اشغال نیروهای خارجی در آید.
موسوی به عربستان سعودی توصیه کرد چنانچه در ادعاهای خود برای حل مشکل یمن جدی هستند به جای تصمیم گیری برای گروه‌هایی که فاقد هر گونه اختیاری هستند به ابتکار ارائه شده از سوی «مهدی مشاط» رئیس شورای عالی سیاسی یمن مبنی بر توقف حملات به 2 کشور پاسخ مثبت دهد.
سخنگوی وزارت امور خارجه خاطرنشان کرد: جمهوری اسلامی ایران همانطور که بارها تاکید کرده است گام اول حل بحران یمن توقف جنگ و خونریزی و رفع محاصره ظالمانه از کشور و مردم یمن و گام بعدی را انجام گفتگوهای یمنی - یمنی برای وصول به توافق برای آینده سیاسی این کشور می‌داند.
به گزارش فارس، دولت مستعفی یمن وابسته به عربستان سعودی و شورای انتقالی جنوب یمن وابسته به امارات روز سه‌شنبه (14 آبان ماه) به منظور پایان جنگ در جنوب توافقنامه‌‌ای موسوم به «توافق ریاض» در شهر ریاض امضا کردند.(بیشتر بخوانید)
«محمد بن سلمان» ولی‌عهد سعودی نیز در سخنانی مدعی شد که این توافق گامی در جهت راه‌حل سیاسی و پایان جنگ یمن است و با بیان اینکه دولت منصور هادی و شورای انتقالی جنوب «برادران» یکدیگر هستند، گفت که دولت سعودی تمام تلاش خود را برای پایان دادن به درگیری‌های میان «برادران» در یمن به کار می‌گیرد.
«محمدعلی الحوثی» رئیس کمیته عالی انقلاب یمن در واکنش به توافق صورت گرفته آن را توافق یمنی ندانست و افزود: چرا که دو طرف توافق از مزدوران ائتلاف سعودی هستند


",fa,"












The Riyadh agreement does not help solve Yemen's problems

Iran's Foreign Ministry spokesman said the signing of these documents did not help solve problems ...
06 Nov 2019, 17:05 by Bulletin News | bultannews.com
Foreign Ministry Spokesman Seyyed Abbas Mousavi in response to the signing of a Riyadh agreement between some groups in southern Yemen with Mansour Hadi said: Signing such documents will not help solve Yemen's problems, according to Bulletin News. The occupation of Saudi Arabia and its allies in southern Yemen will be stabilized either directly or through their proxy forces.
A State Department spokesman, referring to the position of the Islamic Republic of Iran on the formation of a united and inclusive Yemeni government based on Yemeni-Yemeni talks, emphasized the preservation of its unity and territorial integrity: Yemeni people who have always fought the invaders face enemies And their malevolence will not allow the south of this country to be taken over by foreign forces.
Mousavi urges Saudi Arabia if they are serious about their claims to solve the Yemeni problem, rather than deciding on groups that lack any option, given the initiative presented by Yemeni Supreme Council President Mahdi Mashat to stop attacks on two countries. Give a positive answer.
Foreign Ministry spokesman noted: Islamic Republic of Iran, as has repeatedly emphasized the first step in resolving the Yemeni crisis, stopping the war and bloodshed and eliminating the cruel siege of the country and the Yemeni people, and the next step is Yemeni-Yemeni talks to reach an agreement on political future This country knows.
The Saudi-led Yemeni government and the Yemeni Transitional Council of the South of Yemen signed an agreement on Tuesday (November 14th) in Riyadh to end the war in the south (read more).
In a speech, Saudi Crown Prince Mohammed bin Salman said the deal was a step towards a political solution and an end to the Yemeni war, saying the Saudi government had made every effort to bring the Mansour Hadi government and the Transitional Council south together. It is working to end the conflict between the ""brothers"" in Yemen.
Mohammed Ali al-Houthi, head of the Yemeni Revolutionary High Commission in reaction to the deal, did not call it a Yemeni agreement, adding that the two sides were part of the Saudi coalition.


"
