,src,lang,text
0,"











Condenado a 23 años un reincidente por raptar a una mujer y violarla en Chirles
El acusado, que ya fue castigado por la Audiencia a 9 años de prisión por otra agresión sexual, deberá indemnizar con 36.000 euros a la víctima, que fue secuestrada en Benidorm y liberada después de dos horas
06 Nov 2019, 17:05 by p. cerrada
La Audiencia de Alicante ha dictado una contundente condena a 23 años de prisión a un vecino de Callosa d'en Sarrià con antecedentes por violación por secuestrar durante casi dos horas a una mujer en Benidorm y llevarla en su coche a una zona apartada de Chirles, en Polop, donde la agredió sexualmente antes de dejarla marchar y robarle dinero, según la sentencia hecha pública hoy por la Sección Primera.
El fallo también recoge que el acusado Juan María R., de 31 años, no podrá acercarse a la víctima ni comunicarse con ella durante 20 años y una vez salga de prisión se le aplicará la medida de libertad vigilada durante nueve años. El procesado deberá indemnizar a la víctima con algo más de 36.000 euros por las lesiones sufridas, los daños morales causados y los desperfectos ocasionados al coche de la mujer raptada.
Los hechos declarados probados en la sentencia ocurrieron el 11 de junio de 2018. El acusado, que en 2009 fue condenado a 9 años de prisión por violación, acudió sobre las tres de la tarde a un descampado situado en la avenida Beniardá de Benidorm, junto a la estación del TRAM, y se acercó a un coche donde había una mujer que se disponía a salir. El procesado le preguntó por una parada de autobús y simuló que se marchaba, pero de nuevo se acercó a la ventanilla del conductor y le dio un puñetazo en la cara a la conductora.
A continuación, mientras la intimidaba con una navaja, le dijo que se pusiera en el asiento de al lado y que no chillara porque de lo contrario iba a rajarla. El procesado se subió al coche con la víctima y se dirigió hasta La Nucía y continuó hacia Polop de la Marina, donde llegó a la pedanía de Chirles y se metió por diversos caminos rurales hasta llegar a una zona de campo.
El acusado detuvo el vehículo y maniató a la víctima antes de agredirla sexualmente en el interior del coche. Tras consumar la violación se dirigió a Polop y tras robarle 40 euros la dejó marchar.
El tribunal señala en el fallo condenatorio que la declaración de la denunciante ha sido persistentes y es ""sincera, auténtica, fiable y merecedora de la plena y total credibilidad que se le otorga"". Añade el tribunal que la víctima se sintió ""coaccionada en todo momento"" y por ello no ofreció resistencia a la agresión sexual.
La mujer relató entre sollozos en el juicio las cerca de dos horas de auténtico pánico que sintió durante el secuestro y violación, ya que pensaba que la iba a asesinar, aunque al final logró convencerle y asegurándole que no iba a presentar denuncia. 


",es,"











Sentenced to 23 years a repeat offender for abducting a woman and raping her in Chirles
The defendant, who was already punished by the Audience for 9 years in prison for another sexual assault, must compensate the victim with 36,000 euros, who was kidnapped in Benidorm and released after two hours
06 Nov 2019, 17:05 by p. closed
The Audience of Alicante has issued a forceful sentence of 23 years in prison to a neighbor of Callosa d'en Sarrià with a history of rape for kidnapping a woman in Benidorm for almost two hours and taking her in her car to a remote area of Chirles, in Polop, where he sexually assaulted her before letting her go and stealing money, according to the sentence made public today by the First Section.
The ruling also states that the defendant Juan María R., 31, will not be able to approach the victim or communicate with her for 20 years and once he is released from prison, the probation measure will be applied for nine years. The defendant must compensate the victim with just over 36,000 euros for the injuries suffered, the moral damages caused and the damage caused to the car of the abducted woman.
The facts declared proven in the sentence occurred on June 11, 2018. The defendant, who was sentenced to 9 years in prison for rape in 2009, went to a fieldhouse located on Beniardá Avenue in Benidorm around 3 p.m. to the TRAM station, and approached a car where there was a woman who was about to leave. The defendant asked him about a bus stop and pretended he was leaving, but again he approached the driver's window and punched the driver in the face.
Then, while intimidating her with a razor, he told her to put herself in the seat next to her and not to scream because otherwise she was going to crack it. The defendant got into the car with the victim and went to La Nucía and continued to Polop de la Marina, where he reached the hamlet of Chirles and got into various rural roads until he reached a field area.
The defendant stopped the vehicle and hobbled the victim before sexually assaulting her inside the car. After consummating the rape he went to Polop and after stealing 40 euros he let her go.
The court notes in the conviction that the complainant's statement has been persistent and is ""sincere, authentic, reliable and deserving of the full and total credibility granted."" The court adds that the victim felt ""coerced at all times"" and therefore offered no resistance to sexual assault.
The woman related between sobs in the trial about two hours of real panic she felt during the kidnapping and rape, since she thought she was going to kill her, although in the end she managed to convince him and assuring him that he was not going to file a complaint.


"
