,src,lang,text
0,"











Pellegrini nebude využívať vilu, ktorú kúpil úrad vlády za 4,2 milióna eur od štátnej akciovky
01 Nov 2019, 11:35 by Webnoviny
1.11.2019 (Webnoviny.sk) – Premiér Peter Pellegrini (Smer-SD) nebude využívať vilu, ktorú kúpil Úrad vlády za 4,2 milióna eur od štátnej akciovky Správa služieb diplomatickému zboru (SSDZ) v Bratislave. Agentúre SITA to potvrdila hovorkyňa úradu vlády Patrícia Macíková.
Vilu kúpili v júli tohto roka
O jej nákupe rozhodla vláda ešte v roku 2018 na návrh ministerstva zahraničných vecí, ku kúpe došlo v júli tohto roka.
Jednu vilu, ktorá je neobývaná a chátra, štát vlastní aj na Slavíne, určená je pre hlavu štátu. Inú vilu kúpila kancelária NR SR v júli predsedovi parlamentu Andrejovi Dankovi, ten ju však tiež neplánuje využívať.
„Premiér nevidí význam v tom, aby sa na tri mesiace niekam sťahoval. Je to vecou budúceho predsedu vlády,“ reagovala hovorkyňa na otázky agentúry SITA.
Rekonštrukcia za štyri milióny
Takzvaná Lettrichova vila má po rekonštrukcii tri nadzemné podlažia, pracovňu so zimnou záhradou, dve garáže, relaxačné centrum, ktoré je dvojpodlažné, a bazén.
„Bola to vila ministra pre Slovensko z prvej Československej republiky postavená v dvadsiatych rokoch minulého storočia. Jej architektúra nesie klasicistické prvky ovplyvnené nastupujúcou modernou,“ píše sa na oficiálnej stránke SSDZ.
O tom, že by Lettrichova vila mala byť sídlom premiéra, sa špekulovalo už v roku 2010. S informáciami vtedy prišiel denník Sme. Vtedajší premiér Robert Fico to odmietol, aj keď sa na verejnosť dostali dokumenty o stretnutí zástupcov z úradu vlády a štátnej akciovky.
Správa služieb diplomatickému zboru vtedy vilu rekonštruovala za štyri milióny eur. Keď sa stal ministrom zahraničných vecí Mikuláš Dzurinda, celé predstavenstvo štátnej akciovky pre drahú rekonštrukciu odvolal. Ministerstvo označilo rekonštrukciu za nehospodárnu a neetickú.
Viac k témam: premiér Slovenskej republikyZdroj: Webnoviny.sk – Pellegrini nebude využívať vilu, ktorú kúpil úrad vlády za 4,2 milióna eur od štátnej akciovky © SITA Všetky práva vyhradené.


",sk,"











Pellegrini will not use the villa bought by the government office for 4.2 million euros from the state stock
01 Nov 2019, 11:35 by Webnoviny
Nov. 1, 2019 (Webnoviny.sk) - Prime Minister Peter Pellegrini (Smer-SD) will not use a villa bought by the Office of the Government for 4.2 million euros from the state stock Administration of Diplomatic Corps (SSDZ) in Bratislava. SITA agency spokeswoman Patrícia Macíková confirmed it.
The villa was bought in July this year
The government decided to buy it in 2018 on the proposal of the Ministry of Foreign Affairs, the purchase took place in July this year.
One villa, which is uninhabited and dilapidated, the state owns in Slavín, designed for the head of state. Another villa was bought by the office of the National Council of the Slovak Republic in July, the President of Parliament Andrej Danko, but he also does not plan to use it.
“The Prime Minister does not see the importance of moving somewhere for three months. It is a matter for the future Prime Minister, ”the spokeswoman responded to SITA's questions.
Reconstruction for four million
The so-called Lettrich Villa has three floors after reconstruction, study with winter garden, two garages, relaxation center, which is two floors, and swimming pool.
“It was a villa of the Minister for Slovakia from the first Czechoslovak Republic built in the 1920s. Its architecture carries classicist elements influenced by the emerging modern, ”says the official SSDZ website.
The fact that Lettrich's villa should be the seat of the prime minister was speculated already in 2010. The information came at that time, the daily Sme. The then Prime Minister Robert Fico refused, even though the documents on the meeting of representatives from the government office and the state stock company were released to the public.
The administration of the services to the diplomatic corps reconstructed the villa for four million euros. When Mikuláš Dzurinda became Foreign Minister, he dismissed the entire board of the state stock company for expensive reconstruction. The Ministry described the reconstruction as uneconomical and unethical.
More on Topics: Prime Minister of the Slovak Republic Source: Webnoviny.sk - Pellegrini will not use a villa bought by the government office for 4.2 million euros from the state stock © SITA All rights reserved.


"
