,src,lang,text
0,"











Ще гласува ли пак Костов с отвращение?
01 Nov 2019, 11:39 by Стандарт


Партия ""Социолози"" и партия ""bTV"" подливат вода в София и страната


Ще гласува ли с отвращение градската десница за Йорданка Фандъкова? Това е въпросът, който мъчи социолози, политолози и партийни щабове преди балотажа. Цяла седмица всички изчисляват ще се прелеят ли и как гласовете на Борислав Игнатов (12,20%) и на Борис Бонев (10,77%). Защото при която и да е от двете опонентки на балотажа да отиде резултатът, ще стане космичен. За Фандъкова, която убедително спечели първия тур с 36,37 на и 10 процента разлика това означава наистина безапелационна победа. А за Манолова, която разписа 27,79, гласовете на десните са ключът за ""Московски"" 33.


ВИЖ ОЩЕ: Битките на балотажа-участници и прогнози


Преговорите между щабовете обаче са на принципа хем сърби, хем боли. Демократична България обяви, че има свръхинтелигентни избиратели, на които не може да диктува как да гласуват. Пие разговори с Йорданка Фандъкова, но Христо Иванов и Атанас Атанасов абсолютно неджентълментски отказаха да отидат при нея. След визитата на Фандъкова и Малина Едрева в централата им двамата със сигурност се чувстват ако не по-умни и по-красиви, то поне по-високи. Манолова от своя страна непрекъснато говори за кандидатите на промяната и как вотът им трябва да се обедини. Но така и не посмя публично да поска подкрепа на градската десница. Стори ли го губи твърдите социалисти.
Всъщност битката в неделя в София няма да е нито дясно - ляво, нито старо - ново. А вътре в дясното. Големият извод от първия тур е, че градската десница си намери майстора в лицето на Борис Бонев. Отраканият младок стои много по-добре пред публика от провалените политици Христо Иванов, Радан Кънев и Атанас Атанасов, които ""стрелят"" не с програми, а с политически и морални идеологеми. Резултатът на Бонев показа, че ако ""Спаси София"" стане партия, градската десница е спомен. Още повече, че флиртът с ""малкото, русото"", както закачливо описа ситуацията Андрей Райчев, може да й изиграе лоша шега. 7 дни умните и красивите вече се обясняват дали се цепят на лява и дясна десница.
Всичко това прави прогнозите за балотажа крайно несигурни. Още повече, че надпреварата в София стана поле за изявата на двете най-нови партии - партия социолози и партия bTV. Първите подляха вода на Фандъкова като до последния момент даваха на Бонев около 1 процент подкрепа. В страната пък часове наред съобщаваха, че кметовете отличници на първи тур отиват на балотаж и нямат мнозинство в общинските си съвети. От своя страна телевизията преброи всички неравни фуги и счупени плочки, дори несъществуващите, като не пропускаше да слага етикети и оценки. За което и получи две глоби.
Ако градската десница гласува за Манолова, в София може да има обрат. Но това също ще бележи края на жълтопаветниците, защото ще означава колаборация с БСП. Ако обаче решат да пуснат бюлетина за Фандъкова, то със сигурност ще е по изказа на Костов ""с отвращение"". Така, както той го направи преди 15 години.
Най-вероятно е градската десница да си остане вкъщи и оттам да гледа класическия мач ГЕРБ - БСП.


",bg,"











Will Kostov again vote with disgust?
01 Nov 2019, 11:39 by Standard


The Sociologists Party and the bTV Party flood water in Sofia and the country


Will the right-wing town vote for Yordanka Fandakova? This is the question that plagues sociologists, political scientists and party staffs before the run-off. All week long, it will be calculated whether and how the votes of Borislav Ignatov (12.20%) and Boris Bonev (10.77%) will overflow. Because for either of the two opponents of the run-off to go, the result will be cosmic. For Fandakova, who convincingly won the first round with a 36.37 on and 10 percent difference, it really is a winless victory. And for Manolova, who posted 27.79, the right-wing votes are the key to Moscow's 33.


SEE MORE: Battalion Participants and Predictions


However, the negotiations between the staffs are on the principle of hem Serbs, hem hurts. Democratic Bulgaria has announced that it has ultra-intelligent voters who cannot dictate how to vote. She drinks conversations with Yordanka Fandakova, but Hristo Ivanov and Atanas Atanasov absolutely non-gentlemen refused to go to her. After Fandakova and Malina Edreva's visit to their headquarters, both of them certainly feel, if not smarter and more beautiful, at least higher. Manolova, for her part, is constantly talking about the candidates for change and how their vote should be united. But he never dared to publicly seek the support of the city right. Does the hard socialists lose him?
In fact, Sunday's battle in Sofia will be neither right - left nor old - new. And inside the right. The big conclusion from the first round is that the city right found its master in the face of Boris Bonev. The renegade young man stands out much better than the failed politicians Hristo Ivanov, Radan Kanev and Atanas Atanasov, who ""shoot"" not with programs but with political and moral ideologists. Bonev's result showed that if Save Sofia becomes a party, the city right is a memory. Moreover, flirting with ""the little, the blond"", as Andrey Raychev deftly described the situation, could be a bad joke to her. 7 days, smart and beautiful are now explaining whether they split on the left and right right.
All this makes the run-up to the run-up to extremely uncertain. Moreover, the race in Sofia became a field for the appearance of the two newest parties - the Party of Sociologists and the party bTV. The former flooded Fandakova with water, giving Bonev about 1 percent support until the last moment. In the country, for hours, it has been reported that first-round mayors who go to the polls go to the polls and do not have a majority in their municipal councils. For its part, the television counted all the uneven joints and broken tiles, even nonexistent ones, without failing to label and evaluate. For which he received two fines.
If the city right votes Manolova, there could be a twist in Sofia. But it will also mark the end of the Yellow-bearers, because it will mean a collaboration with the BSP. However, if they decide to release the newsletter for Fandakova, it will surely be in Kostov's statement ""with disgust"". Just like he did 15 years ago.
Most likely, the right-hander will stay home and watch the classic GERB-BSP match.


"
