,src,lang,text
0,"











La ville
Munich, la vraie reine du cool à l’allemande
Berlin peut retourner se coucher. Pour le graphiste Mirko Borsche, c'est plutôt dans la capitale bavaroise qu'il fait bon vivre
01 Nov 2019, 11:15 by Séverine Saas
Le restaurant le plus couru du coin? Mai Garten («Jardin de mai»), un boui-boui chinois qui semble tout droit sorti de l’époque Mao. Papier peint saumon délavé, carrelage beigeasse, mobilier genre snack-bar, fresque animalière accrochée au mur. Tellement moche que ça en devient cool. Surtout, les plats sont étonnamment bons. Le bœuf braisé est goûtu, les nouilles se déploient dans une sauce noire, profonde, les xioalongbao – sorte de cousins des dim sums – sont frais et juteux. Aux tables d’à côté, ça parle chinois, allemand, anglais ou encore espagnol. Il y a des businessmen et des étudiants, des costards-cravates et des joggings informes.
C’est cela, le Munich de Mirko Borsche: un melting-pot d’origines et d’habitudes, une promesse de bien-être et de bien vivre ensemble qui déploie tout son potentiel à Au, ancien quartier ouvrier devenu repaire de jeunes familles en quête d’espaces verts et de loyers modérés. Ici, sur la berge est de l’Isar, la rivière qui traverse la ville, les rues étroites sont bordées de petits immeubles résidentiels et ponctuées çà et là de charmants cafés avec terrasse. En cette chaude journée d’août, on est bien loin de l’ambiance bourgeoise qui hante le centre historique de la capitale bavaroise. «Le cœur de la ville est devenu beaucoup trop touristique et aseptisé. A l’opposé, les gens sont ici très chaleureux, il y a un sentiment d’appartenir à communauté, c’est une sorte de ville dans la ville», loue Mirko Borsche, qui vit et travaille à Au depuis une dizaine d’années.
Du graffiti au graphisme


Le graphiste Mirko Borsche, qui vit et travaille à Munich.Matthias Ziegler pour T Magazine

Son nom ne vous dit sans doute rien. Normal. En tant que graphiste, Mirko Borsche, 47 ans, est censé travailler dans l’ombre de ses clients. Sauf que dans la mode, un univers fasciné par les images et leurs auteurs, le Bavarois a quelque chose d’une star. Fondée en 2007, son entreprise, Bureau Borsche, a élaboré les identités visuelles et les campagnes de marques aussi prestigieuses que Balenciaga, Givenchy, Nike ou encore Rimowa, fabricant de bagages haut de gamme. Mirko Borsche se distingue également dans le domaine de l’édition, puisqu’il signe depuis douze ans la direction artistique du très respecté Zeit Magazin, supplément de l’hebdomadaire d’information Die Zeit. Son style? Un surprenant mélange de rigueur graphique, de poésie de l’image et d’humour parfois grinçant, comme cette couverture montrant un Gérard Depardieu en sueur, couteau de boucher à la main.
Quand je suis revenu de Londres, je détestais Munich. C’était une ville très fermée sur elle-même où il n’y avait que des Allemands. Dieu merci ça a beaucoup changéMirko Borsche
Ce goût pour la subversion, Mirko Borsche le cultive depuis son adolescence, lorsque ce fils de photographe arpentait Munich pour s’adonner à sa passion: le graffiti. Nous sommes alors au milieu des années 1980, et la capitale bavaroise porte encore des stigmates de la Deuxième Guerre mondiale. «Munich a été l’une des premières scènes du graffiti en Europe. A l’époque, il y avait encore beaucoup de lieux abandonnés et des murs gigantesques allant jusqu’à 200 mètres de long, ce qui attirait évidemment de très nombreux graffeurs.» Après la chute du mur de Berlin, en 1989, la police s’en mêle et le nom de Borsche atterrit bientôt sur la liste des moutons noirs de la bonbonne. «J’ai décidé de partir étudier le graphisme à Londres, histoire de me faire oublier», se souvient-il.
Lire également: Tout Marseille dans une boutique
A peine diplômé, le jeune homme apprend qu’il va être papa. Pour être auprès de sa nouvelle famille, il rentre au bercail. «Quand je suis revenu de Londres, je détestais Munich. C’était une ville très fermée sur elle-même où il n’y avait que des Allemands. Dieu merci ça a beaucoup chang, notamment grâce à l’ouverture de l’aéroport Franz-Josef Strauss, en 1992.» Le nouveau dynamisme de la ville s’explique aussi par le réaménagement des abords de l’Isar, devenus nouveaux terrains de jeu des citadins. «En fin de journée, à n’importe quel niveau de la ville, les bords du fleuve sont pris d’assaut. Moi-même, je m’y baigne quasiment tous les jours et j’y emmène mes enfants le week-end.»
«Mieux que Berlin»


Alte Utting, le paquebot-boîte de nuit.Matthias Ziegler pour T Magazine

Si cette douceur de vivre est palpable, Munich passe encore pour une ville ennuyeuse aux yeux des étrangers, qui lui préfèrent volontiers Berlin, réputée plus flamboyante, plus excentrique, plus insomniaque aussi. Un verdict que conteste fermement Mirko Borsche. «Berlin est une ville laide, les Berlinois sont très antipathiques, et d’un point de vue professionnel, il est impossible de s’y faire de l’argent. Il y a de grands et beaux appartements, mais ils sont souvent occupés par des expats américains, de riches étudiants venus faire la fête aux frais de leurs parents. Quant aux Allemands installés à Berlin, beaucoup viennent de la campagne. Leurs tatouages, leurs looks de hipsters et leur attitude d’influenceurs, tout cela est complètement surfait.» Et le Bavarois de rappeler ce que la musique contemporaine doit à sa ville. «Les premières discothèques viennent de Munich, le mot disco a pour ainsi dire été inventé ici. De grands noms de la musique électronique sont aussi originaires de cette ville: DJ Hell, les iconiques labels Gigolo Records ou Gomma.» Une subculture qui bat encore son plein au Blitz Club, «l’une des meilleures sonos du pays», assure le graphiste, qui lui préfère pourtant le Rote Sonne, une boîte «plus trash, moins policée».
Mais n’allez pas croire que Mirko Borsche passe sa vie à écumer les clubs. Loin de là. Pour avoir une chance de croiser ce père de trois enfants, on essaiera plutôt les bars confidentiels comme Tabacco, non loin du Jardin anglais, sorte de Central Park local, ou encore Schumann’s, respectable institution munichoise, «parfait pour emmener un rendez-vous galant». Au sud-ouest de la ville, dans le quartier bohème de Westend, on tentera un cocktail au bar du Schwarzer Dackel, ou alors une bière à même le bitume, en lieu et place d’un ancien parking. Quant aux repas, mieux vaut ne pas être végétarien. Les restaurants favoris de Mirko Borsche se nomment Chez Fritz («parfait steak tartare»), Königsquelle («le meilleur schnitzel de ma vie!»), ou encore le très traditionnel Wirtshaus Hohenwart, au sud de Au. «C’est l’un des rares endroits où la cuisine bavaroise n’a pas été pervertie par les touristes. Là-bas, on se sent vraiment à Munich.»


Le restaurant français Chez Fritz.Matthias Ziegler pour T Magazine

Retrouvez tous les articles du T magazine online!


",fr,"











The city
Munich, the true queen of the German cool
Berlin can go back to bed. For the designer Mirko Borsche, it is rather in the Bavarian capital that it is good to live
01 Nov 2019, 11:15 by Séverine Saas
The most popular restaurant in the area? Mai Garten (""May Garden""), a Chinese boui-boui that seems straight out of the Mao era. Faded salmon wallpaper, tiled beigeasse, furniture like snack bar, animal fresco hanging on the wall. So ugly that it gets cool. Above all, the dishes are surprisingly good. The braised beef is tasted, the noodles are spread in a deep black sauce, the xioalongbao - sort of cousins of the dim sums - are fresh and juicy. At the tables next door, it speaks Chinese, German, English or Spanish. There are businessmen and students, suit-ties and shapeless joggings.
This is Munich's Mirko Borsche: a melting pot of origins and habits, a promise of well-being and well-being together that unleashes its full potential in Au, a former working-class district that has become a haven for young families. in search of green spaces and moderate rents. Here, on the east bank of Isar, the river that runs through the city, the narrow streets are lined with small residential buildings and punctuated here and there charming cafes with terrace. On this hot August day, we are far from the bourgeois atmosphere that haunts the historic center of the Bavarian capital. ""The heart of the city has become far too touristy and sanitized. On the other hand, people here are very warm, there is a feeling of belonging to a community, it is a kind of city in the city, ""says Mirko Borsche, who has been living and working in Au for about ten years. years.
From graffiti to graphic design


The graphic designer Mirko Borsche, who lives and works in Munich.Matthias Ziegler for T Magazine

His name probably tells you nothing. Normal. As a graphic designer, Mirko Borsche, 47, is supposed to work in the shadow of his clients. Except that in fashion, a world fascinated by images and their authors, the Bavarian has something of a star. Founded in 2007, his firm, Bureau Borsche, has developed visual identity and brand campaigns as prestigious as Balenciaga, Givenchy, Nike or Rimowa, manufacturer of high-end luggage. Mirko Borsche also distinguished himself in the field of publishing, since he signed for twelve years the artistic direction of the highly respected Zeit Magazin, supplement of the weekly information Die Zeit. His style? A surprising blend of graphic rigor, image poetry and humor sometimes squeaky, like this cover showing a sweaty Gerard Depardieu, a butcher's knife in his hand.
When I came back from London, I hated Munich. It was a very closed city on itself where there were only Germans. Thank God it has changed a lotMirko Borsche
This taste for subversion, Mirko Borsche cultivated since his adolescence, when this son of photographer was pacing Munich to indulge his passion: the graffiti. We are then in the mid-1980s, and the Bavarian capital still bears the stigma of the Second World War. ""Munich was one of the first scenes of graffiti in Europe. At the time, there were still many abandoned places and gigantic walls up to 200 meters long, which obviously attracted many graffiti writers. ""After the fall of the Berlin Wall in 1989, the police and Borsche's name soon lands on the list of black sheep in the bottle. ""I decided to study graphic design in London, just to make me forget,"" he recalls.
Read also: All Marseille in a shop
Just graduated, the young man learns that he will be dad. To be with his new family, he returns to the fold. ""When I came back from London, I hated Munich. It was a very closed city on itself where there were only Germans. Thank goodness it changed a lot, especially thanks to the opening of the Franz Josef Strauss airport in 1992. ""The new dynamism of the city can also be explained by the redevelopment of the Isar surroundings, which have become new city game. ""At the end of the day, at any level of the city, the banks of the river are stormed. Myself, I bathe almost every day and I take my kids there on weekends. ""
""Better than Berlin""


Alte Utting, the liner-nightclub.Matthias Ziegler for T Magazine

If this sweetness of life is palpable, Munich is still considered a boring city in the eyes of foreigners, who prefer him willingly Berlin, reputed more flamboyant, more eccentric, more insomniac too. A verdict that Mirko Borsche strongly challenges. ""Berlin is an ugly city, Berliners are very unfriendly, and from a business point of view it's impossible to make money. There are big and beautiful apartments, but they are often occupied by American expats, rich students come to celebrate at the expense of their parents. As for the Germans living in Berlin, many come from the countryside. Their tattoos, their hipster looks and their influential attitude, all of this is completely overrated. ""And the Bavarian to recall what contemporary music owes to his city. ""The first discotheques come from Munich, the word disco was, so to speak, invented here. Great names in electronic music are also from this city: DJ Hell, the iconic labels Gigolo Records or Gomma. ""A subculture that still in full swing at the Blitz Club,"" one of the best sonos in the country "", ensures the graphic designer, who prefers the Rote Sonne, a box ""trash, less civilized"".
But do not think Mirko Borsche spends his life scouring clubs. Far from there. To have a chance to meet this father of three, we will try rather confidential bars like Tabacco, not far from the English Garden, a kind of Central Park local, or Schumann's, respected institution Munich, ""perfect to take a date galant "". In the southwest of the city, in the bohemian Westend district, there will be a cocktail party at the bar Schwarzer Dackel, or a beer on the pavement, in place of an old car park. As for meals, better not to be vegetarian. The favorite restaurants of Mirko Borsche are Chez Fritz (""perfect steak tartare""), Königsquelle (""the best schnitzel of my life!""), Or the very traditional Wirtshaus Hohenwart, south of Au. ""This is one of the few places where Bavarian cuisine has not been perverted by tourists. There, you really feel in Munich. ""


French restaurant Chez Fritz.Matthias Ziegler for T Magazine

Find all the articles of T magazine online!


"
