,src,lang,text
0,"











МЗС РФ каже, що НАТО в Україні ""провокує розкол""

01 Nov 2019, 11:14

Міністерство закордонних справ Росії заявило, що діяльність НАТО в Україні провокує розкол країни.
Джерело: Коментар прессекретаря МЗС Росії Марії Захарової
Пряма мова Захарової: ""Знову натовці пред'являють на адресу Росії набір нічим не обгрунтованих претензій і звинувачень. Намагаються переінакшити внутрішньоукраїнський конфлікт, подаючи його як конфлікт із Росією""
""Альянс продовжує вести себе деструктивно, працює не на примирення, а на загострення, його кроки сприяють підвищенню градуса напруженості, в тому числі шляхом обіцянок українцям того, що ""НАТО завжди буде на вашому боці"".
""НАТО не може вирішити наявні українські проблеми, в тому числі в сфері національного примирення, боротьби з корупцією, стабілізації ситуації на сході. Швидше навпаки - з урахуванням історичного досвіду розширення альянсу і його ""гуманітарних інтервенцій"" заклики до Києва спрямуватися в євроатлантичні обійми провокують розкол країни, поглиблюють нові розділові лінії в Європі, сприяють зростанню міжетнічних та інших суперечностей"".


Читайте також: Інтеграція без ПДЧ: що стоїть за ""перезапуском відносин"" України з НАТО



Передісторія:


31 жовтня Володимир Зеленський провів спільну конференцію із генеральним секретарем Єнсом Столтенбергом у Києві.
Нова українська влада вважає, що план дії щодо членства має лишатися на порядку денному відносин із НАТО.
Раніше генеральний секретар НАТО Єнс Столтенберг заявив, що Росія не має права втручатись та впливати на рішення України стати членов Альянсу.

Українська правда







",uk,"











Russian Foreign Ministry says NATO in Ukraine ""provokes split""

01 Nov 2019, 12:14

The Russian Foreign Ministry has stated that NATO's activities in Ukraine are provoking a split in the country.
Source: Comment by Russian Foreign Ministry spokeswoman Maria Zakharova
Zakharova's direct language: ""Again, the masses make a set of unjustified claims and accusations against Russia. They try to reconcile the internal Ukrainian conflict by presenting it as a conflict with Russia.""
""The Alliance continues to be destructive, acting not on reconciliation but on exacerbation, and its steps contribute to raising the degree of tension, including by promising Ukrainians that"" NATO will always be on your side. ""
""NATO cannot solve existing Ukrainian problems, including in the area of national reconciliation, fight against corruption, stabilization of the situation in the east. Rather, given the historical experience of the Alliance's expansion and its"" humanitarian interventions, calls for Kiev to go to the Euro-Atlantic pro-Atlantic countries that are deepening new dividing lines in Europe are contributing to the rise of interethnic and other conflicts. ""


Read also: Integration without MAP: What stands for ""Restarting Ukraine's NATO Relations""



Prehistory:


On October 31, Vladimir Zelensky held a joint conference with Secretary General Jens Stoltenberg in Kiev.
The new Ukrainian authorities believe that the membership action plan should remain on NATO's agenda.
Earlier, NATO Secretary General Jens Stoltenberg stated that Russia has no right to interfere and influence Ukraine's decision to become an Alliance member.

Ukrainian Pravda







"
