,src,lang,text
0,"











Польша: психоз антироссийской шпиономании не ослабевает

01 Nov 2019, 11:41

Задержан очередной русский шпион — похвалилось на днях польское Агенство внутренней безопасности. Оказалось, что в нынешней Польше в разряд шпионов можно очень просто попасть даже за «попытку (!) сотрудничества с иностранной (читай: российской) разведкой» — именно такое преступление контразведчики вменяют в вину задержанному злоумышленнику. Однако это отнюдь не забавный абсурд, как могло бы показаться на первый взгляд. Матеуш Пискорский, основатель открыто симпатизирующей России партии «Смена» также был обвинен в шпионаже в пользу Москвы в мае 2016 года, уже провел в тюремном аресте ровно три года, но до сих пор — несмотря даже на решительное вмешательство рабочей группы ООН по вопросам произвольного задержания и ее протесты против действий официальной Варшавы — не дождался ни судебного разбирательства по своему делу, ни тем более его финала.
Традиционно Агенство внутренней безопасности вместе с прокуратурой старалось вокруг очередного шпионского дела создать атмосферу таинственности, не информируя, кто задержанный по образованию и профессии, где он работает, и в чем заключалась его «попытка сотрудничества» с российской разведкой, а тем более — какими секретами мог он с ней поделиться.
Агенство внутренней безопасности в своей информации ограничилось лишь утверждением, что это польский гражданин, а также успокоило публику, что он «не является и не являлся ни сотрудником, ни офицером Агенства».
Зато, кроме обвинения в самой «попытке сотрудничества» с вражеской разведывательной службой, ему вменяется в вину незаконное владение огнестрельным оружием и боеприпасами, а также использование фальшивого документа. Для среднестатистического обывателя такое обвинение — это ясный сигнал, что шпион был, как в известном советском фильме, вооружен и очень опасен, а до вооруженного антипольского заговора было совсем недалеко.
В действительности дело гораздо проще, чем пытаются закодировать это в сознании поляков власти. Зачастую польская правовая система функционирует по памятному принципу «дайте мне человека, а статья на него найдется»: скажем, патруль полиции задерживает участника уличного дебоша и сразу же делает ему, говоря полицейским жаргоном, «наезд на хату» (обыск в квартире), а там находит несколько граммов марихуаны, пистолет деда со времен Второй мировой войны вместе с несколькими патронами. В итоге из мелкого хулигана прокуратура в своем обвинении быстро лепит опасного вооруженного гангстера-наркобарона. И, конечно, хвалится всем вокруг своим успехом.
Именно так было и в истории последнего «русского шпиона». При этом контразведчики провели обыск не только в квартире задержанного (где нашли пистолет и боеприпасы, а также фальшивый документ), но и по месту его работы — с очевидной целью его компрометации среди коллег и руководства.
А чтобы «шпионы всех стран» и их помощники еще больше испугались, Агенство внутренней безопасности создало впечатление широкомасштабной операции и провело налеты также на места проживания — по словам представителей прокуратуры — «лиц, поддерживающих контакты с задержанным». Конечно, реквизированы были компьютеры, телефоны и иные носители данных — может быть, в них удастся найти еще какой-нибудь компромат и сделать вокруг этой истории еще больше шумихи.
Тем не менее, вся секретность вокруг очередного «русского шпиона», которую пытались создать польские власти, не выдержала столкновения с любознательностью варшавского журналистского сообщества. Публицисты быстро вычислили, что задержанный — это 35-летний директор дочерней инвестиционно-строительной фирмы Агенства армейского имущества. Главным заказчиком ее услуг являются Вооруженные силы Польши, для них фирма реализовала более 200 жилищных и специальных объектов; среди них, в частности, здания Центра военно-медицинского обучения в Лодзи и постройки для Многонациональной дивизии «Северо-восток» в Эльблонге.
Пока динамичную карьеру молодого директора прервало решение суда о его заключении под стражу на три ближайших месяца, принятое по запросу Агенства внутренней безопасности и прокуратуры. В дальнейшей перспективе ему грозит трехлетнее тюремное заключение.
Каждый, кто в своей жизни прочитал хотя бы один шпионский детектив, прекрасно знает, что обнародование имени иностранного шпиона с демонстративной шумихой и привлечение его к судебной ответственности — это отнюдь не показатель успеха контразведки, а скорее ее бессилия при его использовании.
Неужели польская контразведка настолько непрофессиональна и беззуба? Необязательно. Скорее, можно говорить о том, что Агенство внутренней безопасности политикам удалось запрячь в реализацию повсеместного антироссийского психоза, одним из проявлений которого стала шпиономания и все более популярная теория заговора и регулярно повторяющихся интриг со стороны враждебной и коварной России. Руководство агенства активно в эту игру включилось — не только из идейных, но также и личных побуждений (можно ведь и грудь под орден за «успехи в службе» подставить, и очередную звездочку на погоны поймать).
Последствия этого антироссийского психоза, который нагнетают в последние годы и польские политики, и спецслужбы, печальны: дело идет к полному разрыву любых отношений с Россией и ее гражданами — политических, экономических, общественных, научных, культурных. В этом контексте каждый поляк, поддерживающий какие-либо связи с Россией — это человек неблагонадежный и подозрительный, и даже потенциальный шпион.
Вывод на политической плоскости очевиден: после недавних парламентских выборов в Польше, которые прошли 13 октября, и продолжающегося формирования очередного правительства «Права и справедливости» — явно антироссийски настроенной партии, выигравшей это голосование, — надежд на улучшение польско-российских отношений нет.
Александр Шторм, специально для «EADaily» из Варшавы


",ru,"











Poland: the psychosis of anti-Russian spy mania does not wane

01 Nov 2019, 11:41

Another Russian spy was detained - the Polish Internal Security Agency recently boasted. It turned out that in present-day Poland it is very easy to fall into the category of spies even for “trying (!) To cooperate with foreign (read: Russian) intelligence” - it’s precisely such a crime that counterintelligence blames the detained attacker for. However, this is by no means a funny absurdity, as it might seem at first glance. Mateusz Piskorski, the founder of the Smena party, who was openly sympathetic to Russia, was also charged with espionage in favor of Moscow in May 2016, has already spent exactly three years in prison, but still despite the decisive intervention of the UN working group on arbitrary detention and her protests against the actions of official Warsaw - did not wait for a trial in his case, much less his final.
Traditionally, the Internal Security Agency, together with the prosecutor’s office, tried to create an atmosphere of mystery around the next espionage case, without informing who was detained by education and profession, where he works, and what his “attempt to cooperate” with Russian intelligence was, and even more so - what secrets he could he share with her.
The Internal Security Agency in its information was limited only to the statement that it was a Polish citizen, and also reassured the public that it “was not and was neither an employee nor an officer of the Agency”.
But, in addition to the accusation of the “attempt to cooperate” with the enemy intelligence service itself, he is charged with illegal possession of firearms and ammunition, as well as the use of a fake document. For the average layman, such an accusation is a clear signal that the spy was, as in the famous Soviet film, armed and very dangerous, and that the armed anti-Polish conspiracy was not far away.
In fact, the matter is much simpler than trying to code it in the minds of the Poles of power. Often, the Polish legal system operates on the basis of the memorable principle of “give me a man, and there is an article on him”: say, a police patrol detains a street brawl participant and immediately makes him, saying with police jargon, “run over to the house” (search the apartment), and there he finds a few grams of marijuana, a grandfather’s pistol from World War II, along with several cartridges. As a result, the prosecutor’s office quickly sculpts a dangerous armed drug gangster out of a petty bully. And, of course, everyone boasts about his success.
That is exactly what happened in the history of the last “Russian spy”. At the same time, counterintelligence officers conducted a search not only in the detainee’s apartment (where they found a gun and ammunition, as well as a false document), but also at his place of work, with the obvious purpose of compromising him among colleagues and management.
And so that “spies of all countries” and their assistants would be even more frightened, the Internal Security Agency created the impression of a large-scale operation and carried out attacks on places of residence - according to representatives of the prosecutor’s office - “persons in contact with the detainee.” Of course, computers, telephones and other storage media were requisitioned - maybe they can still find some other incriminating evidence and make even more hype around this story.
Nevertheless, all the secrecy surrounding the next “Russian spy”, which the Polish authorities tried to create, could not stand the clash with the curiosity of the Warsaw journalistic community. Publicists quickly figured out that the detainee was the 35-year-old director of a subsidiary investment and construction firm of the Army Property Agency. The main customer of her services is the Armed Forces of Poland, for them the company has sold more than 200 housing and special facilities; among them, in particular, the buildings of the Center for Military Medical Education in Lodz and the buildings for the Multinational Division ""Northeast"" in Elblag.
While the dynamic career of the young director was interrupted by a court decision on his detention for the next three months, taken at the request of the Internal Security Agency and the prosecutor's office. In the future, he faces a three-year prison sentence.
Everyone who has read at least one espionage detective in his life knows perfectly well that the publication of the name of a foreign spy with demonstrative hype and bringing him to justice is not an indicator of the success of counterintelligence, but rather its powerlessness in its use.
Is Polish counterintelligence so unprofessional and toothless? Not necessary. Rather, it can be said that the Agency for Homeland Security managed to harbor politicians in the implementation of widespread anti-Russian psychosis, one of the manifestations of which was espionage and an increasingly popular theory of conspiracy and regularly repeated intrigues from hostile and treacherous Russia. The agency’s leadership was actively involved in this game - not only from ideological, but also from personal motives (after all, you can substitute the chest under the order for “successes in the service” and catch the next star on shoulder straps).
The consequences of this anti-Russian psychosis, which has been escalated in recent years by both Polish politicians and special services, are sad: the matter is to completely break off any relations with Russia and its citizens - political, economic, social, scientific, cultural. In this context, every Pole who maintains any ties with Russia is an unreliable and suspicious person, and even a potential spy.
The political conclusion is obvious: after the recent parliamentary elections in Poland on October 13, and the ongoing formation of the next government, Law and Justice, the clearly anti-Russian party that won the vote, there is no hope of improving Polish-Russian relations.
Alexander Storm, specially for EADaily from Warsaw


"
