,src,lang,text
0,"











Por orden de AMLO, revelan responsable del operativo fallido
La decisión la toma el Grupo de Análisis de Información del Narcotráfico, y la comunicación no fluye con el Gabinete de Seguridad, señala el titular de Sedena, a quien debían haber rendido un informe de las acciones
01 Nov 2019, 11:14 by El Debate
Sinaloa.- El secretario de la Defensa Nacional, general Luis Cresencio Sandoval, reveló ante la orden del presidente Andrés Manuel López Obrador el nombre y el cargo del responsable del operativo en Culiacán, el cual pretendía capturar a Ovidio Guzmán, hijo del Chapo Guzmán, en cumplimiento a una orden de aprehensión con fines de extradición.
Durante la conferencia de prensa de la mañana de ayer, el primer mandatario le instruyó: «Mire, general, sin dar el nombre del que fue amenazado por la protección a su familia (el elemento encargado del operativo en Culiacán), sí dé el nombre del encargado responsable del operativo en lo nacional», dijo López Obrador a Sandoval.




1.- Responsable.- Sandoval informó que el responsable fue el coronel de caballería diplomado de Estado Mayor Juan José Verde Montes, titular del Grupo de Análisis de Información del Narcotráfico (GAIN), perteneciente a Sedena, quien maneja a las diferentes partes que constituyen esta estructura, dirige los esfuerzos, realiza el acopio de información, es a quien le llegan todos los datos y mueve a los diferentes efectivos para detener objetivos (presuntos delincuentes) prioritarios para el Gobierno. Este coronel debió informar del operativo en Culiacán al subjefe de Inteligencia, quien a su vez debía poner al tanto al titular de Sedena, Cresencio Sandoval, y este a su vez al Gabinete de Seguridad y al presidente López Obrador sobre los hechos.
2.- Sin información.- El jueves 17, día de los hechos, el Gabinete de Seguridad no tenía la información completa de lo que había realmente ocurrido, por eso se dieron versiones diferentes —dijo Sandoval—, y tuvieron que trasladarse a Culiacán, el 18 por la mañana, y después de la conferencia del presidente dieron un informe ante medios en Palacio de Gobierno: «El Gabinete no teníamos la información completa, tuvimos que trasladarnos en la noche para tener bien la información de qué había pasado, cómo habían estado las operaciones; si la orden la decide el grupo responsable de estar observando el blanco», dijo. El secretario de Seguridad, Alfonso Durazo, dijo que no se protege a nadie, y al ser cuestionado por las versiones diversas que ha dado, dijo: «Cuando recibimos información corregida y corroborada, la corregimos o la expresamos, la damos a conocer al siguiente día (18), asumiendo la responsabilidad del error de tener información equivocada», dijo.



3.- La decisión del operativo y el respaldo.- En cuanto a por qué comenzaron el operativo a plena luz del día, exponiendo a un gran número de ciudadanos, el secretario refrendó que este grupo de inteligencia (GAIN) tomó la decisión porque en ese momento estimaron poder llevar a buen fin la operación que tenían en desarrollo. A las 14:00 horas fue ubicado en su domicilio, y allí se decidió comenzar con el operativo. A las 14:30 inicia la operación en Culiacán, y se rodea el inmueble, «ellos toman la decisión», señaló el general Sandoval. Al respecto, el presidente intervino para afirmar: «Independientemente de la investigación que se está realizando con la independencia y la autonomía que tiene la Secretaría de la Defensa en este caso, a lo que hizo referencia el general, nosotros le tenemos confianza a este grupo, que, como se dijo ayer, venía haciendo estas operaciones de tiempo atrás. No queremos condenarlos a priori».
4.- Investigación militar independiente.- En cuanto a si habrá una sanción contra los responsables del operativo fallido, el general Sandoval reiteró que la Fiscalía de las fuerzas armadas determinó a un grupo de elementos de la misma analizar todo lo que sucedió, el cual se trasladó a esta capital. Revisarán el punto de vista jurídico para determinar si dentro del desarrollo de esta operación fueron infringidos reglamentos o leyes militares que impliquen una responsabilidad para quien haya hecho o no haya hecho algo dentro de lo que marca la disciplina militar.
Dijo desconocer los plazos de la Fiscalía para dar una respuesta, pues expuso que es independiente, aunque esté compuesta por elementos militares.
Los resultados que obtengan de su investigación serán proporcionados a la Fiscalía General de la República —y la parte que sea aplicable nada más dentro de la jurisdicción militar se tomarán las acciones correspondientes— en caso de encontrar algo, destacó el militar.
5.- Continuarán buscando a Ovidio.- El presidente informó que la orden de captura contra Ovidio Guzmán tiene que continuar, que «no se cancela nada y se mantienen los acuerdos de extradición». Una vez más, dijo que no recibió órdenes de Washington para llevar a cabo este operativo.
6. Liberación.- El secretario de la Defensa clarificó que decidieron como Gabinete de Seguridad y con el respaldo del presidente López Obrador dar por terminado el operativo y no detener a nadie: «A las 18:49, por decisión colegiada del consejo del Gabinete de Seguridad, se ordena dar fin a la operación por todo lo que se estaba presentando en la ciudad. Se le transmite a la gente que estaba en la operación, y en ese momento se retira la fuerza, dejan de estar ahí en el lugar donde estaban posicionados, dejan al presunto delincuente ahí en el punto (de la casa en el sector Tres Ríos), nunca es movido de ahí, se retiran, y todo el escalón que teníamos alrededor de la casa que estaba bajo vigilancia todo eso se empieza a retirar hacia el cuartel militar. Esa es la forma en que sucede», explicó.
7. Orden de cateo.- En cuanto a la orden de cateo que nunca llegó, Cresencio Sandoval reiteró que eso le corresponde a la Fiscalía General de la República investigar «para deslindar responsabilidades de las diferentes áreas que tuvieron que ver con esto».
8. Amenazas.- Referente a la información brindada respecto a que los grupos de la delincuencia organizada amenazaron con atacar también en los estados de Sonora, Durango y Chihuahua, el general de la Sedena informó que las amenazas se recibieron como denuncias que se estaban moviendo personal de delincuentes a agredir a militares, así como «a realizar acciones contra la población, instalaciones que usa la sociedad, contra instalaciones estratégicas». En ese momento informaron a los comandantes de las zonas y regiones para desplegar Guardia Nacional, Ejército y policías para que estuvieran alertas y responder en caso de que fueran ciertas las amenazas.
Dijo que cuentan con una estrategia de protección ciudadana que se aplica en todas las poblaciones: «Conforme vaya creciendo la Guardia Nacional, cubrirá todavía más espacios; esa presencia hará que haya una inhibición de los delincuentes por desarrollar actividades en contra de la población. Eso es lo que se está cuidando dentro de la estrategia», mencionó.
GAIN
El Grupo de Análisis de Información del Narcotráfico es un organismo de la Sedena que planea operaciones para dar seguimiento y detener objetivos de importancia institucional. Está integrado con dos componentes:

1 inteligencia (190 elementos)
1 grupo Intervención (350 elementos).

Al operativo en Culiacán acudieron 38 de estos elementos militares élite que eran los encargados de la seguridad interna que rodeaba a la casa de Guzmán, y fueron los que ingresaron a su domicilio.
A la espera de las investigaciones
«Que se transparente la información, eso nos parece muy correcto para tener conocimiento de cómo sucedieron las cosas; nos parece correcto que reconozca que desde un principio falló el operativo; pero estamos esperando que se hagan las investigaciones y se deslinden responsabilidades, como hay distintos elementos que se están poniendo, como información procede que la autoridad reúna la información y deslinde responsabilidades». Sergio Jacobo, líder de la bancada del PRI en el Congreso local




El Gobierno debe sustituir a algunos
«El Gobierno mexicano nos ha dicho cosas inexactas, cosas contradictorias, nos ha mentido y no ha hecho lo necesario para reconstruir la seguridad de los ciudadanos; tiene que sustituir a algunos que estuvieron al frente de este operativo». Audómar Ahumada, presidente estatal del PRD


Balacera en Culiacán


Balacera en Culiacán Sinaloa


Operativo fallido en Culiacán


Sinaloa


Culiacán




",es,"











By order of AMLO, reveal responsible for the failed operation
The decision is made by the Drug Trafficking Information Analysis Group, and communication does not flow with the Security Cabinet, says the head of Sedena, who should have given a report of the actions
01 Nov 2019, 11:14 by The Debate
Sinaloa.- The secretary of the National Defense, General Luis Cresencio Sandoval, revealed to the order of President Andrés Manuel López Obrador the name and position of the person in charge of the operation in Culiacán, which was intended to capture Ovidio Guzmán, son of Chapo Guzmán, in compliance with an arrest warrant for extradition purposes.
During the press conference yesterday morning, the president instructed him: «Look, general, without giving the name of the one who was threatened by the protection of his family (the element in charge of the operation in Culiacán), yes give the name of the person in charge of the operation in the national sector, ”López Obrador told Sandoval.




1.- Responsible.- Sandoval informed that the person in charge was the colonel of cavalry of the General Staff Juan José Verde Montes, head of the Group of Analysis of Drug Trafficking (GAIN), belonging to Sedena, who manages the different parts that constitute This structure, directs the efforts, collects the information, is who gets all the data and moves the different forces to stop targets (alleged criminals) priority for the Government. This colonel had to report the operation in Culiacán to the deputy chief of Intelligence, who in turn should inform the head of Sedena, Cresencio Sandoval, and this in turn to the Security Cabinet and President López Obrador about the facts.
2.- Without information.- On Thursday 17, the day of the events, the Security Cabinet did not have the complete information of what had really happened, that is why different versions were given, ”Sandoval said,“ and they had to move to Culiacán, on the 18th in the morning, and after the president's conference they gave a report to the media in the Government Palace: «The Cabinet did not have the complete information, we had to move at night to have good information about what had happened, how they had operations status; if the order is decided by the group responsible for observing the target, ”he said. The Secretary of Security, Alfonso Durazo, said that no one is protected, and when questioned by the various versions he has given, he said: «When we receive corrected and corroborated information, we correct or express it, we make it known to the following day (18), assuming responsibility for the error of having wrong information, ”he said.



3.- The decision of the operation and the support.- As to why they started the operation in broad daylight, exposing a large number of citizens, the secretary endorsed that this intelligence group (GAIN) made the decision because in At that time they thought they could carry out the operation they had in development. At 2:00 pm he was located at his home, and there he decided to start the operation. At 14:30 the operation begins in Culiacán, and the property is surrounded, ""they make the decision,"" said General Sandoval. In this regard, the president intervened to affirm: “Regardless of the investigation that is being carried out with the independence and autonomy of the Ministry of Defense in this case, to which the general referred, we have confidence in this group , which, as said yesterday, had been doing these operations for some time. We do not want to condemn them a priori ».
4.- Independent military investigation.- As to whether there will be a sanction against those responsible for the failed operation, General Sandoval reiterated that the Prosecutor's Office of the armed forces determined a group of elements of the same to analyze everything that happened, which He moved to this capital. They will review the legal point of view to determine if military regulations or laws that imply a responsibility for those who have done or have not done something within what marks the military discipline were violated within the development of this operation.
He said he did not know the deadlines of the Prosecutor's Office to give an answer, because he explained that it is independent, although it is composed of military elements.
The results obtained from their investigation will be provided to the Office of the Attorney General of the Republic - and the part that is applicable only within the military jurisdiction will take the corresponding actions - in case of finding something, said the military.
5.- They will continue to look for Ovid.- The president informed that the arrest warrant against Ovidio Guzmán must continue, that «nothing is canceled and extradition agreements are maintained». Once again, he said he did not receive orders from Washington to carry out this operation.
6. Liberation.- The Secretary of Defense clarified that they decided as Security Cabinet and with the support of President López Obrador to terminate the operation and not stop anyone: «At 18:49, by collegiate decision of the Cabinet council Security, it is ordered to end the operation for everything that was being presented in the city. It is transmitted to the people who were in the operation, and at that time the force is withdrawn, they stop being there in the place where they were positioned, they leave the alleged offender there at the point (of the house in the Tres Ríos sector) , is never moved from there, they withdraw, and all the steps we had around the house that was under surveillance all that begins to withdraw to the military barracks. That is the way it happens, ”he explained.
7. Search order.- Regarding the search warrant that never arrived, Cresencio Sandoval reiterated that it is up to the Attorney General's Office to investigate ""to demarcate responsibilities from the different areas that had to do with this.""
8. Threats.- Regarding the information provided that organized crime groups threatened to attack also in the states of Sonora, Durango and Chihuahua, the general of the Sedena reported that the threats were received as complaints that were moving criminals personnel to attack the military, as well as «to carry out actions against the population, facilities used by society, against strategic facilities». At that time they informed the commanders of the areas and regions to deploy National Guard, Army and police to be alert and respond in case the threats were true.
He said they have a citizen protection strategy that applies to all populations: “As the National Guard grows, it will cover even more spaces; this presence will cause an inhibition of criminals for carrying out activities against the population. That is what is being taken care of within the strategy, ”he said.
GAIN
The Drug Trafficking Information Analysis Group is a Sedena agency that plans operations to monitor and stop objectives of institutional importance. It is integrated with two components:

1 intelligence (190 elements)
1 Intervention group (350 elements).

The operation in Culiacán was attended by 38 of these elite military elements that were responsible for internal security surrounding Guzman's house, and were those who entered his home.
Waiting for investigations
«That the information is transparent, that seems very correct to us to know how things happened; we think it is right to recognize that the operation failed from the beginning; but we are waiting for the investigations to be carried out and responsibilities are defined, as there are different elements that are being put in place, as information it is appropriate that the authority gather the information and demarcate responsibilities ». Sergio Jacobo, leader of the PRI bench at the local Congress




The Government must replace some
«The Mexican Government has told us inaccurate things, contradictory things, has lied to us and has not done what is necessary to rebuild the safety of citizens; It has to replace some who were in charge of this operation ». Audómar Ahumada, state president of the PRD


Shooting in Culiacán


Shooting in Culiacán Sinaloa


Operative failed in Culiacán


Sinaloa


Culiacan




"
