,src,lang,text
0,"











Bệnh viện Gia An 115 giao trả mèo rừng về hoang dã
Mèo gấm được tìm thấy trong khuôn viên khu Y tế Kỹ thuật cao bệnh viện Gia An 115 được trả về thiên nhiên vào sáng 1/11.
01 Nov 2019, 11:00 by VnExpress
Ngày 1/11, đại diện của Bệnh viện Gia An 115 (quận Bình Tân, TP HCM) thuộc tập đoàn Hoa Lâm và Trung tâm Bảo tồn động vật hoang dã tại Việt Nam, Vườn Quốc gia Cát Tiên đã tổ chức trao trả về thiên nhiên một con mèo rừng trong tình trạng sức khỏe và thể trạng tốt, có thể hòa nhập vào điều kiện sống thiên nhiên. Giống mèo có tên khoa học là Prionailurus Bengalensis. Đây là loài động vật quý hiếm thuộc danh mục 2B, nghị định 06/2019.
Mèo rừng này được tìm thấy trong quá trình các công nhân của khu Y tế kỹ thuật cao dọn dẹp mặt bằng để bệnh viện Gia An 115 chuẩn bị cho công tác động thổ và xây dựng Trung tâm ung bướu và y học hạt nhân.


Mèo rừng phát hiện tại khuôn viên khu Y tế kỹ thuật cao tại bệnh viện Gia An 115.

Theo ông Trương Quang Bảo - Giám sát công trình xây dựng, 40 tuổi, mèo được tìm thấy nặng khoảng 5 kg, dài khoảng 55cm. Sau khi bắt được, đội công nhân đã giao lại con mèo lạ này cho chủ đầu tư của khu Y tế kỹ thuật cao Hoa Lâm Shangrila.
Theo Quỹ thế giới bảo vệ động vật hoang dã (WWF), mèo rừng Việt Nam được đánh giá là một trong những loài khó tìm trên thế giới. Đây là loài động vật có tên gọi là mèo gấm, hay còn gọi là mèo cẩm thạch.
Mèo gấm có bộ lông đẹp trong họ nhà mèo, thuộc chi Pardofelis. Thường sinh sống ở các khu rừng Đông Nam Á. Loài mèo này có họ hàng với báo lửa, cùng với mèo lửa xứ Borneo Pardofelis badia hợp thành chi Pardofelis.


Buổi trao trả diễn ra tại Trung tâm Bảo tồn động vật hoang dã tại Việt Nam thuộc Vườn Quốc gia Cát Tiên.

Kích thước của mèo gấm gần tương đương như mèo nhà. Chiều dài khoảng 60cm, trọng lượng từ 2-5kg và đặc biệt đuôi khá dài lên đến 55cm. Điểm đặc biệt của mèo gấm là bộ lông đẹp. Cằm và dưới môi có màu trắng hoặc vàng nhạt, sau tai có đốm trắng. Mèo gấm có lớp lông dày, mịn, màu xám xanh hoặc xám nâu, nhiều hoa văn cẩm thạch xung quanh. Chân và đuôi của mèo gấm có nhiều đốm thẫm.
Hiện nay, trên thế giới số lượng cá thể mèo gấm còn vào khoảng 10.000 con và vẫn đang tiếp tục giảm. Mèo gấm ở Việt Nam đã được liệt vào danh mục động vật sách đỏ và có chính sách bảo vệ cấp thiết.

Bảo An

Bệnh viện Gia An 115 với mô hình hợp tác công tư (PPP) đầu tiên tại TP HCM phối hợp toàn diện cùng vệnh viện Nhân dân 115 trong các công tác khám chữa bệnh, hội chẩn, điều trị đa chuyên khoa các bệnh lý về lão khoa như tiêu hóa, nội tiết, tim mạch, gan - mật, tụy, thần kinh, đột quỵ, cơ xương khớp.
Thông tin liên hệ: 02862885886
Địa chỉ: số 5, đường 17A, khu phố 11, phường Bình Trị Đông B, quận Bình Tân, TP HCM.


",vi,"











Gia An 115 Hospital returned wild cats to the wild
The spotted cat found on the campus of Gia An 115 Hospital of High Technology was returned to the nature on the morning of November 1.
01 Nov 2019, 11:00 by VnExpress
On November 1, representatives of Gia An 115 Hospital (Binh Tan District, Ho Chi Minh City) of Hoa Lam Group and the Center for Conservation of Wildlife in Vietnam, Cat Tien National Park held the return. Nature, a wildcat in good health and physical condition can integrate into the natural living conditions. The breed has a scientific name of Prionailurus Bengalensis. This is a rare and precious animal on the list of 2B, Decree 06/2019.
This wild cat was found during the cleaning of premises by workers of the High-Tech Health Department so that Gia An 115 Hospital prepared for groundbreaking and the construction of a Cancer and Nuclear Medicine Center.


Wildcat spotted on the campus of the High-Tech Health Zone at Gia An 115 Hospital.

According to Mr. Truong Quang Bao - Supervisor of construction works, 40 years old, the cat was found weighing about 5 kg and about 55cm long. After catching, the team handed over the strange cat to the owner of Hoa Lam Shangrila Hi-Tech Medical Area.
According to the World Wildlife Fund (WWF), Vietnamese wild cats are considered one of the most difficult species to find in the world. This is an animal called a brocade cat, also known as a marble cat.
Leopard cats have beautiful coats in the feline family, belong to the genus Pardofelis. Usually living in the forests of Southeast Asia. This cat is related to the fire leopard, and the fire cat of Borneo Pardofelis badia forms the genus Pardofelis.


The handover took place at the Vietnam Wildlife Conservation Center in Cat Tien National Park.

The size of a tabby cat is nearly the same as that of a domestic cat. Length about 60cm, weight from 2-5kg and especially long tail up to 55cm. The special feature of a spotted cat is its beautiful fur. The chin and lower lip are white or pale yellow, behind the ears are white spots. The gray cat has a thick, fluffy coat, greenish gray or brownish gray, with many marble patterns around it. The cat's legs and tail have many dark spots.
Currently, the number of individual cats in the world is about 10,000 and continues to decrease. The gray cat in Vietnam has been listed as a red book animal and has an urgent protection policy.

Bao An

Gia An 115 Hospital with the first public-private partnership (PPP) model in Ho Chi Minh City fully cooperates with the People's Hospital 115 in medical examination, consultation, multi-specialty treatment of diseases geriatric diseases such as gastrointestinal, endocrinology, cardiovascular, liver - bile, pancreas, neurological, stroke, musculoskeletal.
Contact information: 02862885886
Address: No. 5, Street 17A, Quarter 11, Bình Trị Đông B ward, Bình Tân district, HCM City.


"
