,src,lang,text
0,"











Le pétrole porté par les nouvelles sur le commerce
07 Nov 2019, 20:35 by AWP

Le Brent termine au-dessus des 62 dollars, avec un gain de 55 cents, et le WTI repasse aisément la barre des 57 dollars, en hausse de 80 cents.

Les prix du pétrole ont retrouvé des couleurs jeudi après l’annonce par la Chine d’une levée progressive des droits de douane que s’imposent Pékin et Washington, laissant ainsi entrevoir une possible trêve dans le conflit commercial qui pèse sur la croissance économique.
A Londres, le baril de Brent de la mer du Nord pour livraison en janvier s’est apprécié de 55 cents, ou 0,9%, pour finir à 62,29 dollars.
A New York, le baril de WTI pour décembre a pris 80 cents ou 1,4%, à 57,15 dollars.
Les prix de l’or noir avaient fortement reculé mercredi à la suite du bond des stocks de brut aux Etats-Unis, de 7,9 millions de barils, qui a ravivé le spectre d’une offre excédentaire.
Mais ils se sont redressés jeudi à la faveur d’un regain d’optimisme sur un accord commercial entre la Chine et les Etats-Unis.
Au moment où Pékin et Washington s’efforcent de finaliser un accord partiel sur leur différend commercial, la Chine a annoncé jeudi s’être mise d’accord avec les Etats-Unis pour une levée «par étapes» de leurs tarifs douaniers punitifs mutuels.
Ces déclarations ont redonné confiance aux investisseurs, préoccupés la veille par des informations de presse selon lesquelles la rencontre entre le président américain, Donald Trump, et son homologue chinois, Xi Jinping, pour signer un accord commercial partiel pourrait être repoussée à décembre.
Pour Robert Yawger, spécialiste des marchés de l’énergie chez Mizuho, les cours de l’or noir ont aussi grimpé jeudi en raison «des tensions géopolitiques entourant l’Iran», important producteur de pétrole.
Téhéran a en effet annoncé jeudi avoir relancé ses activités d’enrichissement d’uranium dans son usine souterraine de Fordo, conformément à sa décision de réduire encore davantage ses engagements internationaux concernant son programme nucléaire.
Cette reprise a suscité l’inquiétude de la communauté internationale, les Etats-Unis appelant notamment la communauté internationale à prendre des mesures «sévères» pour faire pression sur l’Iran.
Le prix du WTI est aussi soutenu, selon M. Yawger, par la poursuite de la suspension de l’oléoduc Keystone de TC Energy à la suite d’une fuite de pétrole dans le Dakota du Nord fin octobre.
«L’entreprise a annoncé que l’activité ne reprendrait pas avant au moins deux jours», a relevé l’expert. «Or l’oléoduc de Keystone fournit habituellement en pétrole Cushing, dans l’Oklahoma», où sont entreposés les barils servant de référence au WTI, a-t-il rappelé.
«Alors que les réserves y avaient pas mal augmenté au cours des dernières semaines, on devrait y constater un repli notable des stocks dans les prochains rapports» sur les stocks aux Etats-Unis, a-t-il avancé.

Articles Associés








",fr,"











The oil carried by the news on the trade
07 Nov 2019, 20:35 by AWP

Brent finished above $ 62, with a gain of 55 cents, and the WTI easily passed the $ 57 mark, up 80 cents.

Oil prices regained color on Thursday after China announced a gradual lifting of tariffs imposed by Beijing and Washington, suggesting a possible truce in the trade dispute that weighs on economic growth.
In London, Brent crude oil from the North Sea for delivery in January rose 55 cents, or 0.9%, to finish at 62.29 dollars.
In New York, the barrel of WTI for December took 80 cents or 1.4%, to 57.15 dollars.
The price of black gold fell sharply Wednesday following the jump in crude stocks in the United States, 7.9 million barrels, which revived the specter of oversupply.
But they recovered on Thursday in favor of a renewed optimism on a trade agreement between China and the United States.
At a time when Beijing and Washington are trying to finalize a partial agreement on their trade dispute, China announced Thursday it has agreed with the United States for a ""phased"" lifting of their mutual punitive tariffs.
The statements reassured investors, worried the day before by press reports that the meeting between US President Donald Trump and his Chinese counterpart, Xi Jinping, to sign a partial trade agreement could be postponed to December.
For Robert Yawger, a specialist in energy markets at Mizuho, the price of black gold also climbed on Thursday because of ""geopolitical tensions surrounding Iran,"" a major oil producer.
Tehran has announced Thursday to have restarted its uranium enrichment activities in its underground plant Fordo, in accordance with its decision to further reduce its international commitments on its nuclear program.
This resumption has raised concerns of the international community, the United States calling in particular the international community to take ""severe"" measures to put pressure on Iran.
The WTI award is also supported, according to Yawger, by the continued suspension of TC Energy's Keystone pipeline following an oil spill in North Dakota in late October.
""The company has announced that the activity will not resume for at least two days,"" said the expert. ""But the Keystone pipeline usually provides Cushing oil in Oklahoma,"" where the WTI barrels are stored, he said.
""While the reserves had risen a lot in recent weeks, there should be a significant decline in inventories in future reports"" on stocks in the United States, he said.

Related Articles








"
