,src,lang,text
0,"











Алматинцы пожаловались на перебои с мобильной связью
06 Nov 2019, 07:20 by Шокан Алхабаев
Алматинские пользователи сотовой связи Tele2 и Altel пожаловались на качество услуг, которые предоставляют мобильные операторы, сообщает корреспондент Тengrinews.kz.
По словам потребителей, проблемы со связью и мобильным интернетом начались в ночь с 5 на 6 ноября. Перебои были замечены в разных частях города.
Как сообщается на сайте компании Tele2, 6 ноября с 2:00 до 10:00 проводились технические работы.
""На момент проведения работ возможно временное прерывание голосовых сервисов, SMS, интернет-сервисов, услуг роуминга и исходящих международных вызовов, а также прерывание абонентского обслуживания (состояние баланса, активация услуг и прочее) и приема платежей. При обрывах интернет-соединений и голосовых сервисов рекомендуем вам перезагрузить телефон. Мы приносим свои искренние извинения за неудобства, которые вы можете испытать в этот период, и благодарим вас за понимание и вашу лояльность"", - сообщили в компании.
На сайте Altel также размещена информация о проведении технических работ на оборудовании.

Другие новости рубрики ""Новости Казахстана"" :








",ru,"











Almaty residents complain of interruptions in mobile communications
06 Nov 2019, 07:20 by Shokan Alkhabaev
Almaty's cellular users Tele2 and Altel complained about the quality of services provided by mobile operators, a Tengrinews.kz correspondent reports.
According to consumers, problems with communication and mobile Internet began on the night of November 5-6. Interruptions were seen in different parts of the city.
As reported on the website of Tele2, on November 6, from 2:00 to 10:00, technical work was carried out.
“At the time of work, it is possible to temporarily interrupt voice services, SMS, Internet services, roaming services and outgoing international calls, as well as interrupt subscription services (balance status, activation of services, etc.) and receive payments. In case of interruptions in Internet connections and voice services we recommend that you restart the phone. We sincerely apologize for the inconvenience you may experience during this period and thank you for your understanding and your loyalty, ""the company said.
The Altel website also contains information on technical work on the equipment.

Other news under the heading ""Kazakhstan News"":








"
