,src,lang,text
0,"












A fekete lyuk titka

06 Nov 2019, 07:38 by Bors
Albert Einstein és Stephen Hawking a 20. század legnagyobb elméi közé tartoztak. Einstein volt, aki megalkotta a relativitáselméletet, mely magyarázza és előrejelzi az univerzum működését létrejöttétől utolsó pillanatáig. Hawking mindezt kvantumszinten alkalmazta a világegyetem mélyebb megértéséhez, és legfőbb törekvése volt létrehozni a „mindenség elméletét”.
Stephen Hawking olyan tanulmánnyal robbant be a tudományba, amely elméleti bizonyítékot szolgáltatott arra, hogy az univerzum tényleg az ősrobbanással kezdődött. De élete főművét mégis a kozmosz legfigyelemreméltóbb jelenségeinek szentelte: a fekete lyukaknak.
Hawking azt mondta: „Azt mondják, hogy ez az egész csak furcsa kitaláció lehet… pedig sehol sincs nagyobb igazság, mint a fekete lyukak esetében. Szó szerint lyukak vannak az űrben, amelybe beleeshetnek dolgok és soha többé nem tudnak kijutni onnan. Ezeken a helyeken olyan erős a gravitációs mező, hogy semmi, még a fény sem szabadulhat ki belőlük.”
A fekete lyukakat 1916-ban írták le először. Az első világháborúban egy frontvonalon szolgáló, német tüzérségi tiszt, Karl Schwarzschild, Einstein egyenleteivel kísérletezgetett, hogy kipróbálja, mennyire képes megnyújtani a téridőt. Felfedezte, hogy minél sűrűbbé válik az anyag, annál nagyobb a téridő. Például ha a mi Napunk tömegét alapul véve azt egy három kilométer átmérőjű gömbbé préseljük össze, az egy végtelenül mély lyukat hoz létre a téridőben. Ezen a lyukon belül érvénytelenek a fizika törvényei. Az idő megszűnik, a tér pedig végtelen.
Mégis valahogy elképzelhetetlennek tűnik, hogy oly sok anyagot bele lehessen préselni egy ilyen apró térbe.
Albert Einstein 1939-ben írt tanulmányában azt állítja, hogy az anyagot nem lehet egy bizonyos ponton túl tömöríteni. Elképzelhető, hogy Einstein valójában azt gondolta, hogy a fekete lyukak nem is léteznek. De közvetlenül a második világháború kezdete előtt a tudósok rájöttek, mi történik a csillagokkal életük végén.



Egy normál csillag életének nagy részében, több milliárd éven át saját gravitációjának áll ellen azzal a tágulási erővel, amelyet a hidrogént héliummá alakító nukleáris folyamatok termelnek. Végül azonban a csillag kimeríti saját nukleáris üzemanyagát. Amikor egy csillagból kifogy az üzemanyag, nem tud tovább ellenállni saját gravitációjának. A közepes méretű csillagok egy szupernóvának nevezett hatalmas robbanás után egy sűrű maradvány égitestet hagynak maguk után.
Ezeknek a neutroncsillagoknak a tömege megegyezik a mi Napunk tömegével, de egy alig tíz kilométer átmérőjű golyóba vannak összepréselve. Mégsem ezek a legkülönlegesebb égitestek odakint az űrben. Léteznek sokkal nagyobb csillagok is, amelyek egy napon szintén meghalnak.
És vajon mi lesz a sorsa annak a sok csillagnak, amelynek nagyobb tömege lenne, mint egy neutroncsillagnak ha kimerítették nukleáris üzemanyagukat?
Összehúzódnak a végtelen sűrűség egyetlenegy pontjává: fekete lyukká.
Az óriás csillagok halálakor van egy olyan mechanizmus, amelyen keresztül fekete lyukak alakulhatnak ki.
Feltételezések szerint több milliónak kell lennie odakinn, ámbár még senki se látott sem fekete lyukat, sem pedig neutroncsillagot. Olyan kicsik és távoliak, hogy hagyományos távcsövekkel láthatatlanok – de szerencsére kifejlődött már az új technológia….
A Spektrum „Einstein és Hawking, az Univerzum mesterei” című dokumentumfilm garantáltan lenyűgözi a fizika és az univerzum iránt érdeklődőket, a film ugyanis interjúkon és eredeti felvételeken keresztül kelti életre a két tudós szellemét, újító vitákat, ellentéteket lobbantva fel köztük, és bepillantást engedve életükbe.
Premier: november 6. 20:00


",hu,"












The secret of the black hole

06 Nov 2019, 07:38 by Bors
Albert Einstein and Stephen Hawking were among the greatest minds of the 20th century. It was Einstein who created the theory of relativity, which explains and predicts the functioning of the universe from its inception to its last minute. Hawking applied this at a quantum level to a deeper understanding of the universe, and his ultimate goal was to create a ""theory of the universe"".
Stephen Hawking burst into science with a study that provided theoretical evidence that the universe really started with a big bang. But he dedicated his life's work to the most remarkable phenomena of the cosmos: the black holes.
Hawking said: ""They say this can only be a strange invention ... and nowhere is more truth than in the case of black holes. There are literally holes in space where things can fall and never get out of there again. In these places, the gravitational field is so strong that nothing, even light, can come out of them. ”
The black holes were first described in 1916. During World War I, a German artillery officer on the front line, Karl Schwarzschild, experimented with Einstein's equations to test his ability to extend spacetime. He discovered that the denser the material, the greater the spacetime. For example, compressing it into a three-kilometer sphere, based on the mass of our sun, creates an infinitely deep hole in space. Within this hole, the laws of physics are invalid. Time is gone and space is infinite.
Yet somehow, it seems inconceivable that so much material could be squeezed into such a tiny space.
Albert Einstein in his study of 1939 states that the material cannot be compressed beyond a certain point. It is possible that Einstein actually thought that the black holes did not exist. But just before the start of World War II, scientists realized what was happening to the stars at the end of their lives.



For many billions of years, a normal star will resist its own gravity for many billions of years with the expansion force produced by nuclear processes that convert hydrogen to helium. Eventually, however, the star exhausts its own nuclear fuel. When a star runs out of fuel, it can no longer resist its own gravity. After a massive explosion called a supernova, the medium-sized stars leave a dense remnant of celestial bodies.
The weight of these neutron stars is the same as that of our Sun, but they are compressed into a bullet barely ten kilometers in diameter. Yet these are not the most extraordinary celestial bodies out there in space. There are much bigger stars that also die one day.
And what about the fate of many stars that would be more massive than a neutron star if they run out of nuclear fuel?
They contract to a single point of infinite density: a black hole.
When giant stars die, there is a mechanism through which black holes can develop.
There are supposed to be millions out there, though no one has seen either a black hole or a neutron star. So small and distant that they are invisible with traditional binoculars - but fortunately new technology has developed….
Spectrum's documentary ""Einstein and Hawking, Masters of the Universe,"" is guaranteed to fascinate physics and the universe by revealing the spirit of the two scientists through interviews and original footage, letting go of .
Premier: November 6 at 8:00 pm


"
