,src,lang,text
0,"











Fors meer woonkredieten door afschaffing woonbonus

06 Nov 2019, 16:01


De Centrale voor Kredieten aan Particulieren van de Nationale Bank heeft in oktober een groei van 61 procent van het aantal nieuwe hypotheekleningen ten opzichte van oktober 2018 vastgesteld in België.

Volgens de Nationale Bank werden er in oktober in totaal 56.269 nieuwe hypothecaire leningen in België gemeld. Dat is een stijging van maar liefst 48 procent in vergelijking met september en een toename van 61 procent in vergelijking met oktober 2018.
In alle gewesten van het land valt een groei op te merken, maar Vlaanderen zag een veel grotere stijging. In vergelijking met oktober 2018 was het aantal hypothecaire leningen met 80 procent gegroeid in Vlaanderen, tegenover 31 procent in Wallonië en 26 procent in het Brussels Hoofdstedelijk Gewest. In totaal werd in oktober voor 7,1 miljard euro geleend voor het aanschaffen van een woning.
De uitzonderlijke groeicijfers zijn volgens de Nationale Bank grotendeels te verklaren door de nakende afschaffing van de woonbonus in Vlaanderen.
Herfinanciering
De Nationale Bank stelt ook een felle toename vast van het aantal herfinancieringen sinds mei van dit jaar als gevolg van de lage rentevoeten. Er werd zo maar liefst 120 procent meer heronderhandeld over leningen in de voorbije zes maanden, tegenover dezelfde periode van het jaar voordien.


",nl,"











Significantly more home loans due to abolition of home bonus

06 Nov 2019, 16:01


The Central Bank for Credits to Individuals of the National Bank established a 61 percent increase in the number of new mortgage loans in October compared to October 2018 in Belgium.

According to the National Bank, a total of 56,269 new mortgage loans were reported in Belgium in October. That is an increase of no less than 48 percent compared to September and an increase of 61 percent compared to October 2018.
Growth is noticeable in all regions of the country, but Flanders saw a much larger increase. Compared with October 2018, the number of mortgage loans had grown by 80 percent in Flanders, compared to 31 percent in Wallonia and 26 percent in the Brussels-Capital Region. In October, a total of € 7.1 billion was borrowed for the purchase of a home.
According to the National Bank, the exceptional growth figures can largely be explained by the impending abolition of the housing bonus in Flanders.
Refinancing
The National Bank also notes a sharp increase in the number of refinancing operations since May of this year due to the low interest rates. No less than 120 percent more was renegotiated over loans in the last six months, compared to the same period of the year before.


"
