,src,lang,text
0,"











В Минводах ищут рецидивиста, ограбившего иностранного дальнобойщика

06 Nov 2019, 16:16

В полицию Минеральных Вод обратился водитель большегруза из ближнего зарубежья. По словам мужчины, он стал жертвой ограбления, пока ожидал погрузку в отстойнике.
Расследование показало, что потерпевший вышел ночью в магазин, где повздорил с тремя неизвестными. В ходе конфликта злоумышленники забрали у водителя кошелек, сотовый телефон и ключи от автомашины и скрылись.
Неизвестными оказались трое ранее неоднократно судимых граждан. Двоих грабителей задержали. Теперь им грозит до 7 лет лишения свободы. Местонахождение третьего подельника устанавливается, сообщили в ГУ МВД по Ставропольскому краю.


",ru,"











In Minvody they are looking for a recidivist who robbed a foreign trucker

06 Nov 2019, 16:16

A driver of a heavy truck from neighboring countries turned to the Mineralnye Vody police. According to the man, he was the victim of a robbery while he was waiting for loading in a sump.
The investigation revealed that the victim went to the store at night, where he quarreled with three unknown persons. During the conflict, the attackers took the wallet, cell phone and car keys from the driver and disappeared.
Unknown were three previously convicted citizens. Two robbers were detained. Now they face up to 7 years in prison. The whereabouts of the third accomplice is being established, the State Department of the Ministry of Internal Affairs in the Stavropol Territory reported.


"
