,src,lang,text
0,"











چه کنیم صفحه کلاچ خودرو دیرتر خراب شود؟

06 Nov 2019, 16:42

یکی از بخش‌های مهم در خودرو مجموعه کلاچ خودرو است که باید نکاتی را برای افزایش طول عمر آن مد نظر داشته باشیم.
تمامی قطعات به کار رفته در خودرو وظایفی دارند که هر کدام بسته به نوع آن‌ها وظایف مهمی را به دوش می‌کشند. هر خودرو از هزاران قطعه تشکیل شده است که در بهبود کارکرد خودرو به وسیله نقلیه کمک می‌کند یکی از این قطعات که بسیار وظیفه مهمی در حرکت وسیله نقلیه دارد صفحه کلاچ خودرو می‌باشد که در صورت مواجه شدن با مشکل ممکن است خطرات جبران ناپذیری را برای سر نشینان وسیله نقلیه ایجاد کند.
ما در این مطلب تصمیم داریم زمان تعویض صفحه کلاج را به شما همراهان عزیز معرفی نماییم و نشانه‌های زمان تعویض صفحه کلاج را به شما همراهان گرامی اعلام نماییم.
استفاده صحیح از وسیله نقلیه یکی از مهم‌ترین کارهایی است که رانندگان خودرو باید در نظر بگیرند تا عمر وسیله نقلیه خود را افزایش دهند. صفحه کلاچ نیز یک قطعه مصرفی در خودرو می‌باشد که هر چند وقت باید تعویض شود تا دچار مشکل برای سر نشینان خودرو ننماید. عواملی که باعث کاهش عمر صفحه کلاچ می‌شود را در ادامه برای شما همراهان عزیز بیان خواهیم کرد:
شتاب زیادبرای افزایش طول عمر صفحه کلاچ، یکی از اصلی‌ترین فعالیت‌هایی که باید در نظر گرفته شود رانندگی ایمن و بدون شتاب است، زیرا شتاب زیاد باعث با مشکل مواجه شدن زودتر صفحه کلاچ می‌شود.
فشاردرسربالایی‌هاتمام جاده‌های جهان دارای سر بالایی‌ها و سرازیری‌هایی هستند و مهم‌ترین کاری که در این پستی و بلندی‌های موجود در سطح جاده‌ها باید انجام شود دنده کشی مناسب و فشار نیاوردن بر روی موتور وسیله نقلیه می‌باشد و با دقت بر روی دنده کشی مناسب در سر بالایی‌ها و فشار نیاوردن بر روی موتور می‌توانید عمر صفحه کلاچ خود را افزایش دهید.
تعداد سر نشینهمیشه هر خودرو توان حمل تعداد مسافر خاصی را دارد که در صورت رد شدن از میزان استاندارد بر روی تمام قطعات خودرو فشاری مضاعف ایجاد می‌شود و باعث استهلاک بیشتر وسیله نقلیه می‌شود و ممکن است خودرو را زودتر با مشکل مواجه کند و این اتفاق روی صفحه کلاچ نیز تاثیر مخربی دارد و با استفاده استاندارد وزن از خودرو، می‌توانید از کاهش طول عمر صفحه کلاچ خود جلو گیری کنید.
قراردادن پا بر روی کلاچبعد از تعویض دنده سعی کنید به سرعت پای خودرا از روی کلاچ بردارید، زیرا در صورت تماس بسیار ناچیز پای شما با کلاچ خودرو صفحه کلاچ وسیله نقلیه شما درگیر می‌شود و باعث کاهش طول عمر آن می‌شود. با برداشتن پای خود از روی کلاچ می‌توانید در افزایش طول عمر صفحه کلاچ خود موفق باشید.
در هنگام رانندگی ممکن است برای هر راننده‌ای اتفاق افتد که با مشکلات صفحه کلاچ مواجه شود، برای تشخیص این مشکلات و نشانه‌های ضعف صفحه کلاچ باید نشانه‌های آن را دانست و در ادامه این مطلب ما نشانه‌های ضعف صفحه کلاچ را به شما همراهان عزیز معرفی می‌نماییم تا اگر با این نشانه‌ها مواجه شدید سریع اقدام به تعمیر وسیله نقلیه خود کنید.
کلاچ سفتدر هنگام رانندگی اگر احساس کردید که کلاچ خودرو شما سفت شده است و ویژگی ارتجاعی خود را از دست داده است این نشان از ضعف صفحه کلاچ خودرو شما دارد و باید اقدام به تعویض صفحه کلاچ خود نمایید.
شتاب در کلاچوقتی شما تصمیم به تعویض دنده خودرو خود را دارید از کلاچ استفاده می‌کنید و بازگشت و رها سازی کلاچ یک سرعت و شتاب خاصی دارد، ولی ممکن است این اتفاق با سرعت و شتاب بسیار زیادی برای شما اتفاق افتد و کلاچ خودرو شما پای شما را به سمت بالا با شتاب خاصی پرتاب نماید این اتفاق نشان از با مشکل مواجه شدن صفحه کلاچ خودرو شما می‌باشد.
صدای دندههنگام تعویض دنده خودرو وقتی از کلاچ مناسب خودرو شما برخوردار باشد عمل تعویض دنده به سرعت و بدون صدای اضافه‌ای انجام می‌شود، ولی اگر هنگام تعویض دنده صدایی نا هنجار به گوش شما خورد این نشان از ضعف صفحه کلاچ خودرو شما است و باید هرچه سریع‌تر اقدام به تعویض و تعمیر آن نمایید، زیرا ممکن است برای دنده‌های خودرو شما ایجاد مشکل نماید و هزینه سنگینی بر روی دست شما قرار دهد.
افزایش دور موتور و تغییر نکردن سرعتعمل تعویض دنده و افزایش دنده، جهت افزایش سرعت و شتاب خودرو می‌باشد و این عمل گاهی اوقات ممکن است با مشکل مواجه شود و شتاب و سرعت انتظار رفته برای خودرو شما ایجاد نشود. این عمل یکی از نشانه‌های صفحه کلاچ مشکل دار می‌باشد و شما برای بهبود عمل کرد خودرو خود باید اقدام به تعویض آن نمایید.
منبع: تسنیم


",fa,"











What to do to break down the clutch plate later?

06 Nov 2019, 16:42

One of the most important parts in a car is the car clutch assembly, which should be taken into consideration to increase its life span.
All parts used in the car have tasks that each carry important tasks depending on their type. Each car is made up of thousands of components that help improve the vehicle's performance. One of the most important parts of a vehicle's movement is the car's clutch plate, which can pose irreparable risks to the vehicle if faced with a problem. To make vehicle settlers.
In this post we are going to introduce you to your dear companion page replacement time and to cherish your companion page replacement time signs.
Proper use of the vehicle is one of the most important things that car drivers should consider in order to extend the life of their vehicle. The clutch plate is also a consumable part of the car that needs to be replaced occasionally to avoid problems for the car's occupants. Here are some of the factors that will shorten the life of a clutch screen:
High Acceleration To extend the life of the clutch plate, one of the main activities to consider is safe, non-accelerated driving, as high acceleration can cause the clutch plate to encounter problems earlier.
All highways around the world have highs and lows, and the most important thing to do at these highs and lows is proper gearing and no pressure on the vehicle engine and carefully gearing upright and upright. Not getting on the engine can extend the life of your clutch plate.
The number of seats per car is always capable of carrying a specific number of passengers, which, if exceeded by standard, will create double strain on all vehicle parts, causing further depreciation of the vehicle and may cause the vehicle to crash earlier. The clutch plate also has a devastating effect, and with the standard weight of the car you can reduce the lifespan of your clutch plate.
Putting the Clutch on the Clutch After the gear shift, try to get your foot out of the clutch quickly, as your foot will clash with the clutch of your vehicle's clutch plate and shorten its lifespan. Removing your foot from the clutch can help you extend the life of your clutch plate.
While driving, it may happen to any driver facing clutch plate problems, to identify these clutch plate problems and symptoms, we must know the signs of the clutch plate and hereafter we introduce the clutch plate weakness symptoms to you dear friends. If you experience these symptoms, start repairing your vehicle quickly.
Hard Drive Clutch If you feel that your car clutch is stiff and has lost its elasticity, this indicates the weakness of your car's clutch plate and you need to replace your clutch plate.
Acceleration in the clutch You decide to change your gear You use the clutch and the return and release of the clutch has a certain acceleration and acceleration, but this may happen to you very quickly and with the clutch on your feet. To accelerate upwards, indicating that your car's clutch plate may be experiencing problems.
Gear sound When replacing your car with a suitable clutch, the gear changes quickly and without any additional noise, but if you hear an abnormal sound when switching gears, this is a sign of the weakness of your car's clutch plate and should be as fast as possible. Replace and repair it, as it can cause problems for your car's gears and cost you a heavy price.
Increasing the engine speed and not changing gear and gear speeds can increase the speed and acceleration of the car, and this can sometimes be a problem, and not the expected acceleration or speed for your car. This is one of the hallmarks of a problematic clutch plate and you need to replace it to improve the performance of your car.
Source: Tasnim


"
