,src,lang,text
0,"











Με διαδηλώσεις η πρεμιέρα της Λαγκάρντ ως επικεφαλής της ΕΚΤ
01 Nov 2019, 19:11 by Ioannis Giagkinis



Ξεκίνησε και επίσημα την Παρασκευή η θητεία της Κιρστίν Λαγκάρντ στην προεδρία της Ευρωπαϊκής Κεντρικής Τράπεζας. Αυτή η πρώτη μέρα ωστόσο επισκιάστκε από διαδηλώσεις που πραγματοποιήθηκαν έξω από το κτήριο της Τράπεζας στην Φρανκφούρτη.
«Είμαστε εδώ αλληλέγγυοι με τις ""Παρασκευές για το Μέλλον"". Το κίνημα αυτό ορθά απαιτεί να μεγαλύτερη διαφάνεια στην πολιτική αγοράς ομολόγων και να πάει σε άλλη κατεύθυνση που θα πετύχει τους στόχους που έχουν οριοθετηθεί για το κλίμα», εξηγεί ένας διαδηλωτής.
Μιλώντας στο Ευρωπαϊκό Κοινοβούλιο, η Κριστίν Λαγκάρντ άνέφερε σχετικά με τις προτεραιοτητές της: «Η κλιματική αλλαγή είναι μία από τις πιεστικότερες παγκόσμιες προκλήσεις που αντιμετωπίζει σήμερα η κοινωνία. Η προσωπική μου άποψη είναι ότι κάθε θεσμικό όργανο πρέπει να έχει στην πραγματικότητα τον κίνδυνο της κλιματικής αλλαγής και την προστασία του περιβάλλοντος στον πυρήνα της αποστολής του».
Ωστόσο αυτή η κίνηση πρέπει να προέρχεται από τις χώρες της ευρωζώνης που μπορούν να αντέξουν κάτι τέτοιο, πρόσθεσε. Μιλώντας σε ραδιοφωνικό σταθμό ανέφερε: «Οι χώρες, ιδίως εκείνες που διαθέτουν τον δημοσιονομικό χώρο, δεν έχουν καταβάλει πραγματικά τις απαραίτητες προσπάθειες. Και αναφέρομαι προφανώς σε χώρες που βρίσκονται σε συνεχιζόμενο πλεόνασμα αυτή τη στιγμή, όπως η Ολλανδία, η Γερμανία και ορισμένες άλλες στον κόσμο».
Καθώς οι επίσημοι της ΕΚΤ αποφεύγουν στις δημόσιες τοποθετήσεις τους την αναφορά σε συγκεκριμένες χώρες, η γερμανική κυβέρνηση δεν έδειξε να χαίρεται με αυτήν την δήλωση της Λαγκάρντ. Ο υπουργός Οικονομικών της Γερμανίας απάντησε: «Αν δείτε τις επενδύσεις της γερμανικής κυβέρνησης για την επόμενη δεκαετία και συμπεριλάβετε τη δέσμη μέτρων για το κλίμα, θα διαπιστώσεται ότι ανέρχεται στα 550 δισεκατομμύρια ευρώ το ποσό το οποίο θα επενδυθεί».
Ο Ολαφ Σολτζ είπε ακόμα στους δημοσιογράφους ότι καμία γερμανική κυβέρνηση στο παρελθόν δεν έχει επενδύσει περισσότερα χρήματα.


",el,"











Demonstrations at the Lagarde premiere as head of the ECB
01 Nov 2019, 19:11 by Ioannis Giagkinis



Kirstin Lagarde's presidency of the European Central Bank began officially on Friday. That first day, however, was overshadowed by demonstrations outside the Bank's Frankfurt building.
""We are here in solidarity with 'Fridays for the Future'. This movement rightly calls for greater transparency in bond market policy and to go in the other direction that will achieve the climate-set goals, ""one demonstrator explains.
Speaking to the European Parliament, Christine Lagarde cited her priorities: ""Climate change is one of the most pressing global challenges facing society today. My personal view is that every institution must in fact have the risk of climate change and environmental protection at the core of its mission. ""
But the move must come from eurozone countries that can afford it, he added. Speaking to a radio station, he said: ""The countries, especially those with the financial space, have not really made the necessary efforts. And I'm referring to countries that are currently in surplus right now, such as the Netherlands, Germany and some others in the world. ""
As ECB officials avoid referring to specific countries in their public statements, the German government has not been pleased with this Lagarde statement. The German finance minister replied: ""If you look at the German government's investment for the next decade and include the climate package, it will be estimated at 550 billion euros to be invested.""
Olaf Soltz also told reporters that no German government has invested more money in the past.


"
