,src,lang,text
0,"











Futur antérieur
Quand le voile islamique obscurcit notre vision du monde
CHRONIQUE. La énième querelle française autour de ce signe religieux ostentatoire renvoie à notre (in)capacité d’appréhender l’époque où l’on vit. En 1946, Maurice Merleau-Ponty mettait en garde contre toutes les œillères
01 Nov 2019, 19:22 by Gauthier Ambrus
Le débat public en France donne l’impression depuis quelques semaines d’assister à une étrange cacophonie. Son thème n’a rien de très nouveau, puisqu’il s’agit du voile islamique, objet récurrent de toutes les attentions, et jamais vraiment domestiqué, malgré les tentatives pour légiférer sur son port, là ou ailleurs. Comme un fantôme, il revient hanter les esprits à heures régulières, sans qu’on sache toutefois vraiment pourquoi il fait peur.
Lire aussi: En France, le voile redevient polémique
Tout a commencé lorsqu’un élu du Conseil général de Bourgogne-Franche-Comté s’est scandalisé publiquement de la présence dans la salle d’une femme voilée venue accompagner un groupe scolaire. Il n’en a pas fallu plus pour que l’affaire rebondisse aussitôt. Elle est d’abord récupérée par une partie de la classe politique, qui se positionne pour ou contre le voile, à l’école ou sur les trottoirs.
Puis viennent les prises de position individuelles et les pétitions dans la presse: les unes s’indignent et veulent défendre les musulmans de France, victimes d’une énième campagne de haine; les autres accusent au contraire l’hypocrisie de leurs compatriotes qui n’arrivent pas à voir le foulard islamique pour ce qu’il serait vraiment, à savoir un instrument de soumission des femmes et une arme politique aux services des plus radicaux.
Nouveaux défis
D’un côté les principes, de l’autre la réalité. Et chacun dénonce inlassablement l’aveuglement de l’autre. Pendant ce temps, on aura sans doute compris que le véritable sujet du débat est ailleurs, à quelques pas, à la fois si près et si loin. Il a plusieurs visages, ce qui ne simplifie pas les choses: la lutte contre l’extrémisme islamique, bien sûr, mais aussi le devenir d’une société à l’ère de la globalisation, le multiculturalisme, le rôle de l’Etat face à ces défis, etc. Si tout cela ne faisait pas problème, le voile n’en serait probablement pas un lui non plus.
Lire également: Fronde anti-Macron chez les musulmans
Mais pourquoi est-il si difficile de parler pour de vrai? C’est la question que se pose Maurice Merleau-Ponty en 1946, dans l’éditorial d’un des premiers numéros des Temps modernes, revue au destin célèbre qu’il vient de fonder en compagnie d’un autre philosophe, Jean-Paul Sartre, alors communiste comme lui. Le texte, qui évoque la situation politique présente, s’intitule Pour la vérité, en faisant écho consciemment ou non à un article de Zola paru à l’époque de l’affaire Dreyfus, Pour les juifs.
Chaos apparent
Mais en écrivant Pour la vérité, Merleau-Ponty est bien conscient de toute la difficulté qu’il y a parfois à la défendre, et surtout des pièges qu’il faut éviter pour la trouver. Avant-hier, explique-t-il, la France se divisait en défenseurs des valeurs abstraites, qui réduisent la politique à la morale, et apôtres du réalisme, prêts à s’accommoder du pire.
Puis, l’irruption de la guerre a tout mis à plat. Les esprits en sont ressortis déboussolés, refusant désormais de se fier à un parti pris facile, mais incapables d’analyser correctement les événements sous leurs yeux, avec tout ce qu’ils ont d’inédit, tant un excès de prudence fait qu’on peine à appeler les choses par leur nom.
Merleau-Ponty invite ses contemporains à ne pas avoir peur de regarder leur époque en face et à se frotter à son chaos apparent, en oubliant thèses ou préjugés, mais sans renoncer à y saisir l’éclat d’une idée pour la comprendre et si possible l’orienter dans le bon sens. Sans se méprendre, donc, ni sur les valeurs ni sur la réalité. Le conseil est à retenir.

Extrait
«Peut-être l’engagement ne supprime-t-il la liberté d’esprit que lorsqu’il est confus et faute d’une pensée politique qui soit capable à la fois d’accueillir toutes les vérités et de prendre position dans le réel? Aucun parti en France ne pense son action, ne dit ouvertement ce qu’il est et ce qu’il fait. Chacun d’eux a son double jeu. Quant aux idées, elles ne sont pas formées au contact du présent et pour le comprendre, ce sont des lambeaux idéologiques hérités du XIXe siècle et qui couvrent très mal les faits. Rien d’étonnant si, n’ayant à choisir qu’entre des équivoques, nous nous sentons partout mal à l’aise et si la fidélité à un parti devient pénible.»
(M. Merleau-Ponty, «Sens et non-sens», Gallimard, 1966)


",fr,"











Future
When the Islamic veil obscures our vision of the world
CHRONIC. The umpteenth French quarrel around this ostentatious religious sign refers to our (in) capacity to apprehend the era in which we live. In 1946, Maurice Merleau-Ponty warned against all blinkers
01 Nov 2019, 19:22 by Gauthier Ambrus
The public debate in France gives the impression since a few weeks of attending a strange cacophony. His theme is nothing new, since it is the Islamic veil, a recurring object of attention, and never really domesticated, despite attempts to legislate on its port, there or elsewhere. Like a ghost, he returns to haunt the spirits at regular hours, but we do not really know why he is scared.
Read also: In France, the veil becomes controversial
It all started when an elected member of the General Council of Bourgogne-Franche-Comté publicly scandalized the presence in the hall of a veiled woman who came to accompany a school group. It did not take more for the case to rebound immediately. It is first recovered by a part of the political class, which is positioned for or against the veil, in school or on the sidewalks.
Then come individual positions and petitions in the press: some are indignant and want to defend the Muslims of France, victims of yet another hate campaign; the others, on the contrary, accuse the hypocrisy of their compatriots who fail to see the Islamic headscarf for what it really would be, namely an instrument of submission of women and a political weapon to the services of the most radicals.
New challenges
On one side the principles, on the other the reality. And each tirelessly denounces the blindness of the other. During this time, we will have understood that the real subject of the debate is elsewhere, a few steps, both so close and so far. It has many faces, which does not simplify things: the fight against Islamic extremism, of course, but also the future of a society in the era of globalization, multiculturalism, the role of the state facing to these challenges, etc. If all this was not a problem, the veil would probably not be a problem either.
Read also: Fronde anti-Macron among Muslims
But why is it so difficult to speak for real? This is the question asked by Maurice Merleau-Ponty in 1946, in the editorial of one of the first issues of Modern Times, a magazine with the famous fate he has just founded in the company of another philosopher, Jean-Paul Sartre, then communist like him. The text, which evokes the present political situation, is titled Pour la vérité, echoing consciously or not a Zola article published at the time of the Dreyfus affair, Pour les juifs.
Apparent chaos
But writing For the truth, Merleau-Ponty is well aware of the difficulty it sometimes has to defend it, and especially the pitfalls that must be avoided to find it. The day before yesterday, he explains, France was divided into defenders of abstract values, which reduce politics to morality, and apostles of realism, ready to live with the worst.
Then, the irruption of the war put everything flat. The spirits have emerged disoriented, now refusing to rely on easy bias, but unable to properly analyze the events under their eyes, with all they have new, so much prudence hardly call things by their name.
Merleau-Ponty invites his contemporaries not to be afraid to look at their time in the face and to rub his apparent chaos, forgetting theses or prejudices, but without giving up the idea of an idea to understand it and if possible to steer it in the right direction. Without misunderstanding, therefore, neither about values nor about reality. The advice is to remember.

Extract
""Perhaps commitment only suppresses freedom of mind when it is confused and lacks political thought that is able to accommodate all truths and take a stand in the real world. ? No party in France thinks its action, does not openly say what it is and what it does. Each of them has its double game. As for ideas, they are not formed in contact with the present and to understand it, they are ideological shreds inherited from the nineteenth century and cover the facts very badly. No wonder if, having to choose between ambiguities, we feel uncomfortable everywhere and loyalty to a party becomes painful. ""
(M. Merleau-Ponty, ""Meaning and nonsense"", Gallimard, 1966)


"
