,src,lang,text
0,"











Renuncia el director del Sereci en Pando, tras los comicios de octubre
01 Nov 2019, 19:16 by ANF
Kalil Arab renunció al cargo de director del Servicio de Registro Cívico (Sereci) del departamento de Pando, después de las elecciones generales del 20 de octubre.
Los ataques que hubiera recibido su vivienda, así como la falta de credibilidad en el Sereci, luego de las denuncias de ""acarreo"" de votantes de Beni a Pando podrían ser los factores que hubieran determinado su dimisión
El presidente del Tribunal Electoral Departamental de Pando, René Zambrana, dijo que la vivienda de Arab también fue objeto de agresiones, por los grupos que quemaron las oficinas del TED en rechazo a los resultados de los comicios.
La asambleísta Eliana Acosta señaló que la renuncia nos dice que ""definitivamente algo le molesta y aunque no quiere exteriorizarlo es evidente que existe falta de confianza en las instituciones"".
Acotó que la decisión de Arab, después de cinco años en el ejercicio de esas funciones, demuestra que ""No hay confianza, ni independencia del organismo electoral"".
Zambrana dijo que está a la espera de las determinaciones que asuma el Tribunal Supremo Electoral, porque la dependencia funcional del cargo es la Dirección Nacional del Sereci.
 

Noticias relacionadas





",es,"











The director of Sereci in Pando resigns after the October elections
01 Nov 2019, 19:16 by ANF
Kalil Arab resigned from the position of director of the Civic Registry Service (Sereci) of the department of Pando, after the general elections of October 20.
The attacks that his house would have received, as well as the lack of credibility in the Sereci, after the allegations of ""carry"" of voters from Beni to Pando could be the factors that would have determined his resignation
The president of the Departmental Electoral Court of Pando, René Zambrana, said that Arab housing was also subject to aggression, by the groups that burned TED offices in rejection of the election results.
Assemblywoman Eliana Acosta said the resignation tells us that ""something definitely bothers her and although she does not want to externalize it, it is clear that there is a lack of trust in the institutions.""
He said that the Arab decision, after five years in the exercise of these functions, demonstrates that ""There is no trust or independence of the electoral body.""
Zambrana said he is waiting for the determinations assumed by the Supreme Electoral Tribunal, because the functional unit of the office is the National Directorate of Sereci.


Related news





"
