,src,lang,text
0,"











Diablo 4: Details zu Klassen, nahtlose Oberwelt, zufallsgenerierte Dungeons und mehr
01 Nov 2019, 19:01 by Maik Seidl

Nach der heutigen Ankündigung von ""Diablo 4"" hat Blizzard Entertainment weitere Details zum düsteren Action-RPG nachgereicht. Beschrieben werden die Klassen, Dungeons und weitere Elemente.




Blizzard Entertainment hat heute wenig überraschend „Diablo 4“ angekündigt. Das neue Action-RPG, das laut Publisher zu den düsteren Wurzeln der Serie zurückkehren wird, erscheint zu einem bislang unbekannten Zeitpunkt für PlayStation 4, Xbox One und PC. Besucher der BlizzCon 2019 können sich bereits mit einer Demo beschäftigen.
Im Zuge der Ankündigung von „Diablo 4“ wurden nicht nur erste Details zur Handlung enthüllt. Auch gab Blizzard Entertainment Details zu den Klassen preis. Euch erwarten demnach der Barabar, die Zauberin und der Druide. Nachfolgend haben wir einige Details zu den drei bestätigten Klassen für euch:

Der Barbar ist für seine unvergleichliche Stärke und seinen brutalen Nahkampf bekannt. Im Kampf benutzt er ein neues und mächtigeres System namens Arsenal. Damit kann er vier verschiedene Waffen ausrüsten und zügig zwischen ihnen wechseln. Zu diesem Zweck werden sie einzelnen Angriffen zugewiesen.
Die Zauberin hatte bereits in „Diablo 2“ einen Auftritt und kann Elemente einsetzen, um ihre Feinde zu vernichten. Die Zauberin spießt die Gegner mit Eiszapfen auf, lässt Blitze auf sie niederfahren oder beschwört brennende Meteore vom Himmel herab.
Der Druide ist ein Gestaltwandler. Dank eines aktualisierten Spielstils kann er sich in Sekundenschnelle von seiner menschlichen Form in die eines Werwolfs oder Werbärs verwandeln, um die Dämonen der Brennenden Höllen den Zorn der Natur spüren zu lassen.

Laut Blizzard Entertainment werden die drei Charaktere dem Vermächtnis des Franchise gerecht. „Sie sind ein Beispiel dafür, wie Diablo 4 auf der Geschichte der Reihe aufbaut und den Kern der Fantasy-Welt von Diablo beibehält, aber Spielern gleichzeitig neue Gameplay-Ansätze und frische Ideen bietet“, so der Entwickler und Publisher.
Anpassungen, zufallsgenerierte Dungeons und mehr
Talentbäume und Fertigkeiten: Als Spieler habt ihr in „Diablo 4“ die Möglichkeit, eure Charaktere zu individualisieren. Zur Verfügung stehen euch dabei anpassbare Talentbäume und Fertigkeiten. Hinzu kommen ein Beutesystem, legendäre Gegenstände und Ausrüstungssets, Runen und Runenwörter. Auch auf personalisierte Reittiere müsst ihr nicht verzichten, auf denen ihr die offene Spielwelt bereisen könnt.
Nahtlose Oberwelt: Die Gameplay-Sessions erlebt ihr in „Diablo 4“ in einer „nahtlosen, riesigen Oberwelt“, durch die ihr auf der Suche nach dem nächsten Dungeon voller Reichtümer reisen werdet. Blizzard Entertainment verspricht einzigartige Landschaften und gefährliche Gegner. Ihr reist durch die verschiedene Regionen – von der brennenden Wüste von Kejhistan über die grünen, von Werwölfen heimgesuchten Wälder von Scosglen bis hin zur rauen Wildnis der Trockensteppe.

+++ Diablo 4: Mit einem ersten Trailer, Gameplay und Details angekündigt – Rückkehr zu den Wurzeln versprochen +++

Zufallsgenerierte Dungeons, und PvP: In „Diablo 4“ trefft ihr auf zufallsgenerierte Dungeons, die laut Hersteller mit unvorhersehbaren Widersachern und Schätzen gefüllt sind. Meistern könnt ihr die Herausforderungen allein oder in koordinierten Gruppen. Zudem erhaltet ihr die Möglichkeit, euch in eine gemeinsamen Welt zu begeben – entweder, um euch vereint größeren Herausforderungen zu stellen, oder um euch gegenseitig in PvP-Kämpfen zu meucheln.
„In Diablo 4 werden Spieler versuchen, der Welt wieder Hoffnung zu geben, indem sie das Böse in all seinen Formen bezwingen – von kannibalistischen, Dämonen anbetenden Kultisten bis zu den neuen ertrunkenen Untoten, die an den Küsten auftauchen, um ihre Opfer in ein nasses Grab zu zerren“, so Blizzard.


",de,"











Diablo 4: Class details, seamless overworld, random dungeons, and more
01 Nov 2019, 19:01 by Maik Seidl

Following today's announcement of ""Diablo 4,"" Blizzard Entertainment has added more details to the gritty action RPG. Described are the classes, dungeons and other elements.




Blizzard Entertainment has today announced little surprise ""Diablo 4"". The new action RPG, which, according to the publisher, will return to the dark roots of the series, appears at a previously unknown date for PlayStation 4, Xbox One and PC. Visitors to BlizzCon 2019 can already engage in a demo.
As part of the announcement of ""Diablo 4"" not only first details of the plot were revealed. Blizzard Entertainment also revealed details about the classes. The barabar, the sorceress and the druid are waiting for you. Here are some details about the three confirmed classes for you:

The Barbarian is known for his unparalleled strength and brutal melee combat. In combat, he uses a new and more powerful system called Arsenal. With it he can equip four different weapons and swiftly switch between them. For this purpose, they are assigned to individual attacks.
The sorceress already had an appearance in ""Diablo 2"" and can use elements to destroy her enemies. The sorceress spears enemies with icicles, lets lightning fall on them, or summons flaming meteors from the sky.
The Druid is a shapeshifter. With an updated style of play, he can quickly change from his human form to that of a werewolf or advertiser, letting the Demons of Burning Hell feel the wrath of nature.

According to Blizzard Entertainment, the three characters live up to the legacy of the franchise. ""They are an example of how Diablo 4 builds on the history of the series and retains the essence of Diablo's fantasy world, while providing players with new gameplay approaches and fresh ideas,"" said the developer and publisher.
Adjustments, random dungeons and more
Talent Trees and Skills: As a player, Diablo 4 gives you the ability to customize your characters. At your disposal are customizable talent trees and skills. Add to that a loot system, legendary items and equipment sets, runes and runewords. You do not have to do without personalized mounts, where you can travel the open game world.
Seamless Overseas: You'll experience the gameplay sessions in ""Diablo 4"" in a ""seamless, giant overworld,"" through which you'll travel in search of the next dungeon full of riches. Blizzard Entertainment promises unique landscapes and dangerous opponents. You travel through the various regions - from the burning desert of Kejhistan to the green, werewolf-ridden forests of Scosglen to the rugged wilderness of the dry steppe.

+++ Diablo 4: With a first trailer, gameplay and details announced - promised return to the roots +++

Random Dungeons, and PvP: In ""Diablo 4"" you encounter randomly generated dungeons that according to the manufacturer are filled with unpredictable adversaries and treasures. You can master the challenges alone or in coordinated groups. You also get the opportunity to enter a common world, either to bring you greater challenges together, or to mutiny yourselves into PvP combat.
""In Diablo 4, players will seek to bring hope back to the world by subduing evil in all its forms - from cannibalistic, demon-worshiping cultists to the new drowned undead who appear on the shores to turn their victims into a wet one Tearing the grave, ""says Blizzard.


"
