,src,lang,text
0,"











Le garçon impliqué dans l’accident causé par Claude Barzotti pourrait perdre un œil: il souffre d’un décollement de la rétine qui ne se régénère pas
01 Nov 2019, 20:38 by Rédaction

Vendredi dernier, le chanteur Claude Barzotti avait attiré l’attention de la presse à cause d’un accident de la route dans lequel il était impliqué. Cela s’était passé à hauteur du magasin « Meclets » à Tangissart. Alors qu’il fait demi-tour sur la chaussée, il a été percuté par un véhicule avec 3 occupants. L’un d’eux souffrirait de grosses lésions.

« Je suis en tort. J’ai vu arriver une voiture qui ne semblait pas aller bien vite et j’ai voulu m’engager », avait avoué le chanteur avant de poursuivre : « Non, je n’avais pas bu ! » Au volant de son Range Rover, Claude Barzotti faisait une manœuvre sur la chaussée lorsqu’une Toyota l’a percuté : « Cela s’est passé après 8 heures du matin. la police est venue. J’ai soufflé dans le ballon. Je n’avais rien bu mais on m’a retiré mon permis pendant 6 heures. Je comptais aller conduire mes petites-filles à l’école. Vous savez, je ne roule pratiquement plus. Tout au plus 5 à 10 kilomètres par semaine »
Alors qu’il pensait que le conducteur de l’autre véhicule se portait bien, c’est une tout autre version que livre aujourd’hui la DH. « Les trois occupants de la Toyota (déclarée en sinistre total) ont été emmenés d’urgence à la clinique Saint-Pierre à Ottignies : il s’agissait d’un homme de 65 ans qui emmenait ses deux petits-fils de 13 et 7 ans à l’école. Le conducteur de la Toyota souffre de douleurs thoraciques et dorsales, mais c’est plutôt le garçon de 13 ans, assis sur le siège passager, qui a été le plus sérieusement touché par la collision. Sa tête a été retenue par l’airbag mais cela n’a malheureusement pas suffi à lui épargner des séquelles importantes. On lui a diagnostiqué un décollement et une déchirure de la rétine, qui malheureusement ne se régénère pas. Le jeune a dû être opéré dimanche dernier. » peut-on lire.
Le papa du garçon, qui souhaite rester anonyme, s’inquiète : « Mon fils a des lésions à l’œil droit, il pourrait être en partie aveugle. Sa vue sera de toute façon altérée à jamais. Il a pu ressortir le jour même de l’hôpital mais avec des conditions strictes pour éviter un décollement complet de la rétine. »
Claude Barzotti pourrait être poursuivi pour coup et blessures involontaires.


",fr,"











The boy involved in the accident caused by Claude Barzotti could lose an eye: he suffers from a detachment of the retina that does not regenerate
01 Nov 2019, 20:38 by Writing

Last Friday, the singer Claude Barzotti attracted the attention of the press because of a road accident in which he was involved. This had happened at the ""Meclets"" store in Tangissart. As he turned back on the roadway, he was hit by a vehicle with 3 occupants. One of them would suffer from large lesions.

"" I'm at fault. I saw a car coming up that did not seem to go very fast and I wanted to get involved, ""the singer confessed before continuing:"" No, I did not drink! At the wheel of his Range Rover, Claude Barzotti was maneuvering on the roadway when a Toyota hit him: ""It happened after 8 o'clock in the morning. the police came. I blew in the balloon. I had nothing to drink but I was removed my license for 6 hours. I was going to drive my granddaughters to school. You know, I hardly roll anymore. At most 5 to 10 kilometers a week »
While he thought that the driver of the other vehicle was doing well, this is another version that delivers the DH today. ""The three occupants of the Toyota (declared a total loss) were taken urgently to St. Pierre Clinic in Ottignies: it was a 65-year-old man who was taking his two grandchildren from 13 to 7 years at school. The driver of the Toyota suffers from chest and back pain, but it is rather the 13-year-old boy sitting in the passenger seat who was the most seriously affected by the collision. His head was held back by the airbag but unfortunately it was not enough to spare him any significant aftermath. He has been diagnosed with retinal detachment and tear, which unfortunately does not regenerate. The young man had to be operated last Sunday. Can we read.
The boy's father, who wishes to remain anonymous, is worried: ""My son has lesions in his right eye, he could be partly blind. His sight will be altered forever forever. He was able to come out the same day of the hospital but with strict conditions to avoid a complete detachment of the retina. ""
Claude Barzotti could be prosecuted for blow and unintentional injuries.


"
