,src,lang,text
0,"











ИЛ-76 прибыл в Сербию на помощь в тушении природных пожаров

01 Nov 2019, 20:29

Самолет МЧС России ИЛ-76 прибыл в Сербию для тушения природных пожаров.
Отмечается, что в сербском Нише российское судно встретили представители Российско-Сербского гуманитарного центра, посольства России в Республике Сербия, Сектора по ЧС МВД республики и городская администрация.
Решение о привлечении к борьбе с природными возгораниями в Сербии авиации МЧС России было принято незамедлительно, учитывая дружественные отношения между странами.
К пожаротушению российское судно приступит завтра утром.


",ru,"











IL-76 arrived in Serbia to help extinguish natural fires

01 Nov 2019, 20:29

The plane EMERCOM of Russia IL-76 arrived in Serbia to extinguish natural fires.
It is noted that in the Serbian Niche, the Russian vessel was met by representatives of the Russian-Serbian Humanitarian Center, the Russian Embassy in the Republic of Serbia, the Emergencies Ministry Sector of the Republic and the city administration.
The decision to engage the Ministry of Emergencies of Russia in the fight against natural fires in Serbia was taken immediately, given the friendly relations between the countries.
A Russian ship will start fire fighting tomorrow morning.


"
