,src,lang,text
0,"











Євросолідарність назвала політичним переслідуванням розслідування через слова Федини на адресу Зеленського
Європейська солідарність назвала політичним переслідуванням й порушенням свободи слова розслідування через висловлювання нардепа Софії Федини на адресу президента Володимира Зеленського.

01 Nov 2019, 20:18

Про це повідомляє пресслужба політсили.
У Євросолідарності заявили, що Зеленський «як ніхто інший користувався повною свободою слова».
«Його ніхто не переслідував ні за сцени розстрілу парламенту, ні за похорони діючого глави держави, ні за порівняння України з повією. Навіть такі екстравагантні форми критики безкарно існували, бо справжня свобода слова є надбанням України, що відрізняє її від Росії та інших недемократичних країн», — сказано в заяві.
Партія вимагає закрити кримінальні провадження.
«Не зачіпайте демократії в Україні, бо переслідуючи свободу слова ви зазіхаєте на зміну конституційного ладу», — сказано у заяві.
Раніше генпрокурор Руслан Рябошапка підтвердив початок кримінального розслідування проти народного депутата від євросолідарності Софії Федини через висловлювання про президента Володимира Зеленського.
Нагадаємо, обговорюючи розмову Зеленського з добровольцями в Золотому 26 жовтня Федина та волонтер Маруся Звіробій під час трансляції в Facebook висловили припущення, що під час однієї з таких поїздок президент може потрапити під обстріл або стати жертвою замаху.






У Слузі народу назвали заяви «загрозою» і «закликом до заколоту», в зв’язку з чим заблокували трибуну у Верховній Раді.
Після цього Федина заявила, що їй почали надходити повідомлення з погрозами, в яких говорилося, що її чекає доля Каті Гандзюк.


",uk,"











Euro solidarity called the political persecution of the investigation through the words of Fedyna Zelensky
European solidarity is called political persecution and violation of freedom of speech in the investigation through the statement of People's Deputy Sofia Fedina addressed to President Vladimir Zelensky.

01 Nov 2019, 19:18

Political forces press service reports.
In the European Solidarity stated that Zelensky ""like no other enjoyed full freedom of speech.""
“No one pursued him either during the shooting of the parliament, nor at the funeral of the incumbent head of state, nor for comparing Ukraine to prostitution. Even such extravagant forms of criticism existed with impunity, because true freedom of speech is the property of Ukraine, which sets it apart from Russia and other undemocratic countries, ”the statement said.
The party demands to close criminal proceedings.
""Do not touch democracy in Ukraine, because in your freedom of expression you are encroaching on a change in the constitutional order,"" the statement said.
Earlier, Prosecutor General Ruslan Ryaboshapka confirmed the start of a criminal investigation against the deputy of the European Union of Solidarity, Sophia Fedyna, by speaking about President Volodymyr Zelensky.
Recall, while discussing Zelensky's conversation with volunteers in Gold on October 26, Fedina and volunteer Marusya St. John's wives suggested during a Facebook broadcast that during one of these trips, the president could be attacked or victimized.






The People's Servant called the statements a ""threat"" and a ""call for rebellion,"" in connection with which they blocked the rostrum in the Verkhovna Rada.
After that, Fedina said that she had started receiving threat messages, which stated that she was waiting for the fate of Katie Gandziuk.


"
