,src,lang,text
0,"











Finish Kedua di GP AS, Hamilton Raih Gelar Juara Dunia Keenam
04 Nov 2019, 05:45 by Heri Firmansyah


Finish Kedua di GP AS, Hamilton Raih Gelar Juara Dunia Keenam

KBRN, Jakarta : Lewis Hamilton mengunci gelar juara dunia Formula 1 keenam kalinya setelah finis runner-up pada balapan Grand Prix Amerika Serikat di Austin, Texas, Minggu (3/11/2019) waktu setempat.Rekan satu timnya di Mercedes, Valtteri Bottas, keluar sebagai juara balapan seri ke-19 itu setelah start dari pole position dan menggunakan dua strategi pitstop yang berjalan sempurna.Namun dengan mengemas 18 poin, Hamilton menutup peluang Bottas bertarung untuk titel musim ini setelah sang pebalap Britania itu unggul 67 poin dengan dua balapan tersisa. Hamilton tiba di Sirkuit Americas (COTA) dengan hanya memerlukan empat poin untuk mengunci gelar juara dunia musim ini.Hamilton, dengan satu strategi pitstop, hampir merayakan gelar keenamnya dengan menjuarai balapan di COTA namun di lima lap terakhir dia cukup kewalahan dengan sisa umur ban hard yang dipakai sehingga Bottas menyalip untuk memimpin lomba hingga finis 4,148 detik di depan.""Balapan yang sangat sulit hari ini. Valtteri melakukan tugasnya dengan baik,"" kata Hamilton usai lomba.Ini merupakan kali kedua bagi Hamilton mengunci gelar juara dunia di Austin setelah sebelumnya dia merayakan gelar ketiganya di COTA pada 2015.Hasil itu juga membuat Mercedes menjadi tim pertama dalam sejarah yang meraih enam gelar ganda secara beruntun, setelah mengunci gelar konstruktor bulan lalu di Jepang.
Dalam usia 34 tahun, Hamilton kini menjadi pebalap tersukses kedua dengan enam gelar juara dunia, menyingkirkan mantan pebalap Mercedes Juan Manuel Fangio ke peringkat tiga dan mendekatkan dirinya ke rekor Michael Schumacher yang memegang tujuh gelar.""Ayahku memberitahuku ketika aku berusia enam atau tujuh tahun untuk jangan pernah menyerah, itu adalah moto keluarga. Aku tak memikirkan soal kejuaraan, tapi sebagai seorang atlet aku merasa tak pernah sesegar sekarang. Aku siap untuk balapan selanjutnya, kami akan terus maju,"" kata Hamilton.Bottas pun mengucapkan selamat kepada rekan satu timnya itu. ""Ini kemenangan yang bagus... namun itu tak cukup dan Lewis meraih gelar itu... selamat kepadanya. Dia pantas untuk itu, dia kuat di musim ini.""Max Verstappen yang tampil cepat di lima lap terakhir sempat mengancam posisi Hamilton, namun bendera kuning dikibarkan ketika mobil Haas Kevin Magnussen keluar trek di dua lap terakhir.Oleh karena itu, Verstappen yang mendekat hingga satu detik di belakang Hamilton pun tak boleh melaju lebih kencang dan harus puas di P3 untuk tim Red Bull.""Mereka sedikit lebih kencang hari ini. Balapan yang bagus dan menyenangkan. Kami memiliki kecepatan yang baik. Bendera kuning di lintasan lurus terakhir, jika tidak, aku rasa kami bisa finis kedua hari ini,"" kata Verstappen.Jelang start, Verstappen mendapati retakan di sayap belakang mobilnya sehingga teknisi tim Red Bull harus berpacu dengan waktu mengganti bagian tersebut di starting grid.Sementara itu, di kubu Ferrari, strategi tak berjalan dengan baik. Charles Leclerc tak cukup cepat untuk bersaing memperebutkan podium dan hanya finis P4.Sedangkan Sebastian Vettel menjalani start yang buruk, kehilangan banyak posisi dari P2 ke P7 hingga lap ke-2. Juara GP Amerika 2013 itu mengeluh di radio jika mobilnya mengalami understeer.Belum selesai masalah teknis di mobil Vettel, bencana datang kepada pebalap asal Jerman itu ketika suspensi kanan belakang mobilnya patah saat melaju di Tikungan 9 di lap ke-8.
Alexander Albon kembali tampil impresif dengan finis P5 untuk Red Bull diikuti oleh pebalap Renault Daniel Ricciardo di P6.Duo pebalap McLaren Lando Norris dan Carlos Sainz masing-masing finis di P7 dan P8.Di mobil Renault kedua, Nico Hulkenberg finis P9 di depan Daniil Kvyat yang mengemas poin terakhir di balapan di P10 untuk Toro Rosso.Sergio Perez harus start dari jalur pit karena melewatkan panggilan untuk menimbang mobilnya di sesi latihan bebas. Di akhir lomba, pebalap asal Meksiko itu finis P11 untuk Racing Point.Robert Kubica juga gagal melanjutkan balapan ketika mengalami masalah teknis dengan mobil Williams nya. (Ant) 


",id,"











Finish Second in the US GP, Hamilton Wins Sixth World Champion Title
Nov 04 2019, 05:45 by Heri Firmansyah


Finish Second in the US GP, Hamilton Wins Sixth World Champion Title

KBRN, Jakarta: Lewis Hamilton locked the sixth Formula 1 world title after finishing runner-up in the United States Grand Prix race in Austin, Texas, Sunday (11/03/2019) local time. His teammate at Mercedes, Valtteri Bottas, came out as champions of the 19th series race after starting from pole position and using two pitstop strategies that went perfectly. But by packing 18 points, Hamilton closed the chance Bottas fought for the title this season after the British rider was 67 points ahead with two races remaining . Hamilton arrived at the Americas Circuit (COTA) with only four points needed to lock in the world title this season. Hamilton, with a pitstop strategy, almost celebrated his sixth title by winning the race at COTA but in the last five laps he was quite overwhelmed with the remaining hard tire life which was used so Bottas overtook to lead the race to finish 4.148 seconds ahead. ""A very difficult race today. Valtteri did a good job,"" Hamilton said after the race. This was the second time for Hamilton to lock the world title in Austin after he had previously celebrated its third title at COTA in 2015. The result also made Mercedes the first team in history to win six consecutive double titles, after locking in the constructor's title last month in Japan.
At the age of 34, Hamilton is now the second most successful racer with six world titles, getting rid of former Mercedes driver Juan Manuel Fangio to number three and putting himself close to Michael Schumacher's record of holding seven titles. ""My father told me when I was six or seven years old to ""Don't ever give up, it's a family motto. I don't think about championships, but as an athlete I feel it's never as fresh as now. I'm ready for the next race, we will move on,"" Hamilton said. Bottas also congratulated his team-mates . ""This was a good victory ... but it was not enough and Lewis won the title ... congratulations to him. He deserved it, he is strong this season."" Max Verstappen, who appeared quickly in the last five laps had threatened Hamilton's position, but yellow flags were hoisted when Kevin Magnussen's Haas car went off the track in the last two laps. Therefore, Verstappen who approached up to one second behind Hamilton was not allowed to go faster and had to settle in P3 for the Red Bull team. ""They were a little firmer today ""It's a nice and pleasant race. We have good speed. The yellow flag on the last straight track, if not, I think we can finish second today,"" Verstappen said. ""Before the start, Verstappen found a crack in the rear wing of his car so the team technician Red Bull must race against time to replace these parts in the starting grid. Meanwhile, in the stronghold of Ferrari, the strategy did not go well. Charles Leclerc was not fast enough to compete for the podium and only finished P4. While Sebastian Vettel had a bad start, losing many positions from P2 to P7 until the second lap. The 2013 American Grand Prix champion complained on the radio if her car had an understeer. Before the technical problem in the Vettel car was finished, the disaster came to the German rider when the right and rear suspension of his car broke when driving on Bend 9 on lap 8.
Alexander Albon again made an impressive appearance with P5 finish for Red Bull followed by Renault driver Daniel Ricciardo in P6.Duo McLaren racers Lando Norris and Carlos Sainz each finished in P7 and P8. In the second Renault car, Nico Hulkenberg finished P9 in front of Daniil Kvyat who packed the last point in the race in P10 for Toro Rosso.Sergio Perez had to start from the pit because he missed the call to weigh his car in a free training session. At the end of the race, the Mexican rider finished P11 for Racing Point. Robert Kubica also failed to continue racing when experiencing technical problems with his Williams car. (Ant)


"
