,src,lang,text
0,"











Manifestantes chilenos são os “coletes amarelos” latinos?
07 Nov 2019, 18:30 by Lúcia Müzell

Protestos violentos, prolongados no tempo, sem liderança definida – e com uma profunda rejeição dos partidos políticos -, para pedir a demissão do governo e a refundação do sistema. As semelhanças não são poucas entre o movimento dos coletes amarelos, prestes a fazer um ano na França, e os manifestantes que ocupam as ruas do Chile desde meados de outubro.

“A comparação salta aos olhos. O contexto nos dois países é bastante diferente, mas até a resposta do governo chileno tenta se parecer com a de Emmanuel Macron na França”, afirma Franck Gaudichaud, historiador especialista no Chile contemporâneo e professor da universidade francesa de Toulouse 2 – Jean Jaurès.
A exemplo do líder francês, Piñera lançou uma consulta popular para ouvir as demandas prioritárias da população diante dos protestos, que se iniciaram contra o aumento da tarifa da passagem de metrô e se ampliaram para uma série de demandas, em especial por mais igualdade social no país.

Transportes: estopim da insatisfação

Na França, o estopim foi semelhante – um imposto sobre os combustíveis. Na sequência de uma contestação social que teve o ápice em dezembro de 2018, o governo promoveu três meses de debates em centenas de localidades, para ouvir a população e acalmar as ruas. Até hoje, porém, os coletes amarelos manifestam.


Manifestantes se abrigam durante protesto contra o governo do Chile em Santiago, Chile, em 6 de novembro de 2019.REUTERS/Pablo Sanhueza

O cientista político chileno Daniel Grimaldi, professor da Universidade Central de Santiago e doutor pela Escola de Altos Estudos em Ciências Sociais (EHESS), da França, ressalta que os discursos e as demandas que emanam dos protestos são distintos, já que as realidades sociais e econômicas de Paris e Santiago são diferentes. O Chile é um dos países mais desiguais do mundo: 1% da população concentra 33% das riquezas nacionais.

Distante da revolução

Porém, Grimaldi observa que, em comum, os dois movimentos contestam o regime representativo e seus dirigentes políticos e econômicos. Os coletes amarelos pediam o fim da 5ª República francesa, enquanto os chilenos querem uma nova Constituição.
“Muita gente ligou essa desigualdade a uma arquitetura institucional prevista na Constituição. Uma mudança constitucional poderá representar uma mudança de sistema”, afirma o professor chileno. “Isso é algo que vai se definir a médio prazo. Por enquanto, não é claro que alguma coisa vá mesmo mudar. Ainda é cedo para falar em revolução”, frisa.


Pessoas fogem de gás lacrimogêneo em protesto contra o governo do Chile em Santiago, Chile, 6 de novembro de 2019.REUTERS/Henry Romero

Na França, Gaudichaud concorda. “É um exagero falar em revolução. Há uma revolta social, confrontos urbanos, um grande movimento, bastante radical, mas não é uma revolução no sentido literal”, argumenta o pesquisador, que estuda o Chile há mais de 20 anos e, em 2015, já escrevia sobre as fissuras do neoliberalismo no país.
“Não creio em uma transformação completa do Estado, do sistema político. O Chile ainda está muito longe disso – sequer sabemos se haverá uma nova Constituição”, afirma.
O cientista político destaca que grupos de cidadãos de direita chilenos tentaram se apropriar do imaginário dos coletes amarelos: adotaram a vestimenta para proteger suas propriedades contra o vandalismo dos protestos. “Ou seja, o que fizeram não teve nada a ver com os verdadeiros coletes amarelos franceses”, sublinha Grimaldi.

Sinais de insatisfação desde 2006

Os dois especialistas consideram que os sinais de uma ruptura do modelo liberal em vigor desde Pinochet começaram a ficar evidentes em 2006, com uma forte greve dos mineiros. A contestação voltou em 2011, com intensos protestos estudantis. Nas eleições de 2017, que resultaram na posse do conservador Sebastián Piñera, as insatisfações com as desigualdades estavam tão latentes que a coalizão de esquerda obteve o resultado inédito de 20% dos votos, atrás do segundo colocado de centro-esquerda, Alejandro Guillier, apoiado pela ex-presidente Michele Bachelet.
“Há uma classe política, para não dizer uma casta política, extremamente desconectada da sociedade. Qualquer estudioso que observa o Chile via que o país estava à beira da explosão”, avalia Gaudichaud.
A última pesquisa de opinião sobre as manifestações, divulgada nesta terça-feira (5), mostrou que, apesar da violência, os atos recebem um forte apoio da população: 87% dos chilenos pensam que é bem-vinda a instalação de uma Assembleia Constituinte.


",pt,"











Are Chilean protesters the Latin “yellow vests”?
07 Nov 2019, 18:30 by Lucia Müzell

Violent protests, protracted over time, without definite leadership - and with a profound rejection of political parties - to call for the resignation of the government and the refounding of the system. Similarities are not striking between the year-old yellow vests movement in France and the protesters who have been roaming the streets of Chile since mid-October.

“The comparison is striking. The context in both countries is quite different, but even the Chilean government's response tries to resemble that of Emmanuel Macron in France, ”says Franck Gaudichaud, a historian specializing in contemporary Chile and a professor at the French University of Toulouse 2 - Jean Jaurès.
Following the example of the French leader, Piñera launched a popular consultation to hear the priority demands of the population in the face of the protests, which began against the increase in subway fare and expanded to a number of demands, in particular for more social equality in the region. parents.

Transport: trigger of dissatisfaction

In France, the fuse was similar - a fuel tax. Following a social outcry that peaked in December 2018, the government held three months of debate in hundreds of localities to listen to the population and calm the streets. To this day, however, the yellow vests manifest.


Protesters take shelter during protest against the Chilean government in Santiago, Chile, on November 6, 2019.REUTERS / Pablo Sanhueza

Chilean political scientist Daniel Grimaldi, a professor at the Central University of Santiago and a doctor at the French School of Advanced Studies in Social Sciences (EHESS), points out that the speeches and demands emanating from the protests are different, since the social realities and Economic rates of Paris and Santiago are different. Chile is one of the most unequal countries in the world: 1% of the population concentrates 33% of national wealth.

Far from the revolution

However, Grimaldi notes that, in common, the two movements contest the representative regime and its political and economic leaders. The yellow vests called for the end of the 5th French Republic, while the Chileans want a new constitution.
“Many people have linked this inequality to an institutional architecture provided for in the Constitution. A constitutional change could represent a system change, ”says the Chilean professor. “This is something that will be defined in the medium term. For now, it is not clear that anything will ever change. It is still early to talk about revolution, ”he says.


People flee tear gas in protest against Chilean government in Santiago, Chile, November 6, 2019.REUTERS / Henry Romero

In France, Gaudichaud agrees. “It's an exaggeration to talk about revolution. There is a social upheaval, urban clashes, a big movement, quite radical, but it is not a revolution in the literal sense, ”argues the researcher, who has been studying Chile for over 20 years and, in 2015, was already writing about the cracks of neoliberalism. in the country.
“I do not believe in a complete transformation of the state, the political system. Chile is still a long way from it - we don't even know if there will be a new constitution, ”he says.
The political scientist points out that groups of Chilean right-wing citizens have tried to appropriate the imagery of the yellow vests: they have adopted the suit to protect their property against the vandalism of the protests. “That is, what they did had nothing to do with the true French yellow vests,” says Grimaldi.

Signs of dissatisfaction since 2006

Both experts believe that signs of a break from the liberal model in force since Pinochet began to be evident in 2006, with a strong strike by the miners. The contest came back in 2011, with intense student protests. In the 2017 elections, which resulted in the inauguration of conservative Sebastián Piñera, dissatisfaction with inequalities was so latent that the left-wing coalition won an unprecedented 20% of the vote behind center-left runner-up Alejandro Guillier by former president Michele Bachelet.
“There is a political class, not to mention a political caste, extremely disconnected from society. Any scholar observing Chile saw that the country was on the verge of explosion, ”says Gaudichaud.
The latest opinion poll on the demonstrations, released on Tuesday (5), showed that despite the violence, the acts received strong support from the population: 87% of Chileans think that the establishment of a Constituent Assembly is welcome. .


"
