,src,lang,text
0,"











7 листопада: Смерть НАТО і кіт проти режиму Путіна
У партії Меркель намітився розкол, а Кремлю сподобався заклик садити, залякувати і вбивати росіян
07 Nov 2019, 18:49 by Іван Яковина
1. Главная, на мой взгляд, новость сегодня неожиданно пришла не из США, а из Европы. Самая важная немецкая партия — Христианско-Демократический Союз (ХДС) вошла в тяжелейший идеологический кризис. Ее активисты на местах призвали лидеров партии отказаться от эмбарго на сотрудничество с ультраправыми из «Альтернативы для Германии», а также не стесняться брать на вооружение некоторые лозунги из арсенала АдГ. Дело в том, что из-за нечеткости позиций ХДС по ключевым вопросам, вроде миграции, ее электорат (даже умеренный) стремительно перетекает к правым радикалам. На недавних местных выборах в Тюрингии ХДС из-за этого заняла лишь третье место, чего не было уже многие десятилетия.
Однако центральный аппарат ХДС с гневом отреагировал на письмо местных активистов, посоветовав им забыть о «дружбе с нацистами». Функционеры в Берлине не понимают масштабов и глубину проблемы, поэтому, вероятно, партию Ангелы Меркель ждет судьба немецких Социал-демократов. Из главной левоцентристской партии страны они уже превратились в полумаргиналов. На тех же выборах в Тюрингии они получили лишь 9 процентов, а радикалы из партии «Левые» — 30 процентов. Это очень нехорошая ситуация. Главным партиям Германии сейчас либо надо соглашаться на сотрудничество с правыми и левыми радикалами и брать на вооружение их лозунги, либо просто исчезнуть. В 1933 году очень похожая ситуация обернулась там победой нацистов.
2. Не менее тревожные новости сегодня пришли из Франции. Местный президент Эммануэль Макрон сказал вслух то, о чем многие уже давно шептались. По его словам, НАТО находится в коме, у альянса «наступила смерть мозга». США активно демонстрируют, что им плевать на Европу, а Турция, которая входит в НАТО, проводит операции, которые идут вразрез с миссией и ценностями альянса. Макрон считает, что Европа находится на краю пропасти. Еще шаг — и она лишится какого-либо влияния в мире, а ее судьбу будут определять не сами европейцы, а другие страны. Ну и вишенка на торте: Макрон честно признался, что не знает, можно ли странам НАТО полагаться на Пятую статью устава альянса.
Эта статья постулирует, что нападение на любую из стран НАТО считается нападением на все входящие в него страны. Однако сейчас есть большие сомнения в том, что Дональд Трамп пойдет войной на Россию, если та, например, оккупирует регион какой-нибудь прибалтийской страны. Выходом из сложившейся ситуации французский президент называет создание единой европейской армии. Должен заметить, что я всегда считал Макрона тряпкой и жалким, бестолковым шоуменом. Но, оказывается, иногда он все-таки может трезво оценивать ситуацию и открыто говорить неприятные вещи. Я удивлен!
3. Насколько фигово обстоят дела с оценкой реальности в США, можно судить по этой новости: посол США в Украине Билл Тейлор в своих показаниях Конгрессу рассказал, что для Дональда Трампа бредовая идея покупки Гренландии у Дании была намного более важной и приоритетной, чем помощь Украине, которая ведет вполне реальную войну с Россией. Американский президент действительно живет в мире каких-то безумных фантазий и просто не понимает, что происходит в реальности. Мне от этого наблюдения Тейлора даже немного страшновато стало.
4. Еще одна важная информация из показаний Тейлора — это его оценка влияния бизнесмена Игоря Коломойского на президента Украины Владимира Зеленского. По словам Тейлора, это влияние не просто слишком сильно, оно растет. Тейлор рассказал, что именно лично сказал Зеленскому на эту тему: «Знаете, господин президент, Коломойский не был избран. Вы были избраны, а он, господин Коломойский, увеличивает влияние в вашем правительстве, что может привести к вашему падению». Тут я с Тейлором полностью согласен. Президент, который получил 73 процента на выборах, может запросто разобраться с любым чиновником, политиком и олигархом, а не пытаться договариваться с этой публикой.
5. Российский писатель, поэт и публицист Дмитрий Быков заявил, что смена режима в России произойдет до 2022 года. По его словам, власть попытается как-то имениться, и «все начнет потрескивать», после чего начнутся «лавинообразные изменения». Я с такой оценкой, в целом, согласен: революции в РФ не будет, но выборы в Госдуму в 2021 году станут очень серьезным испытанием для режима, который уже сейчас почти полностью растерял поддержку в обществе и держится только на страхе и силовиках. Если что-то пойдет не так (а это почти неизбежно), то режим начнут сотрясать сильные внутренние противоречия, он рассыпется.
6. Чеченский падишах Рамзан Кадыров честно и открыто рассказал, как власть будет пытаться сохранять власть. По его словам, надо убивать, запугивать и сажать по тюрьмам тех людей, кто «распространяет сплетни и сеет раздор». Видимо, имеется в виду оппозиция, которая, по оценкам властей, только этим и занимается. Пресс-секретарь Путина Дмитрий Песков заявил, что Кадыров ничего плохого не сказал, осуждать его за эти слова российская власть не собирается. Выходит, что Кремль в целом разделяет оккупационные методы общения с населением. Скоро, видимо, там начнутся массовые убийства и посадки недовольных. Запугивания уже сейчас — обычное дело там.
7. Отличная иллюстрация того, как это все происходит в реальности, пришла из Красноярского края. Местный полицейский узнал, что его начальство крышует торговлю наркотиками, и потребовал не делать этого. Его тут же арестовали и отправили в СИЗО по обвинению во взяточничестве. Доказательств, правда, не нашли, поэтому через полгода отпустили. Полицейский записал видеоролик, в котором подробно расписал, кто и как в местном МВД и ФСБ крышует наркоторговлю, у кого какие связи и так далее. Честного мента тут же снова арестовали по делу о раскрытии государственной тайны. На этот раз ему из тюрьмы не выбраться, я думаю. Еще один момент: мент оказался честным, но глупым — он жаловался на свое начальство Путину, хотя именно Путин и является главарем мафии, которая правит сейчас Россией.
8. Но полностью вся гнусная сущность путинского режима раскрылась в новости из московского аэропорта Шереметьево. Некто Михаил Галин летел из Риги во Владивосток с пересадкой в этом аэропорту. Компанию мужчине составлял его кот Виктор. В Риге к коту никаких претензий у сотрудников ажропорта не было, но в Москве наземные службы «Аэрофлота» объявили кота слишком толстым для ручной клади. Виктор весил 10 килограмм — на два больше положенных восьми. Сотрудники авиакомпании (или правильнее сказать «садисты»?) потребовали сдать братана в багаж. Господин Галин резонно ответил, что за 8 часов полета в страшном холоде Виктор может умереть, но его доводы никто не стал слушать. В результате он перенес вылет во Владивосток на день, и во второй раз пришел в Шереметьево с похожей на Виктора кошкой его друзей — Фиби, которая при взвешивании уложилась в 8 кг. После этого Фиби вернули владельцам, а Галин продолжил свое путешествие во Владивосток со своим упитанным котом. Молодец, сломал систему! Эта история, я думаю, и есть одна из тех «трещин», о которых чуть выше говорил Быков.


",ru,"











Leaffall 7: NATO’s death and anti-Putin regime
The party Merkel has a rose, and the Kremlin has added a response of sadity, imply and drive rosiyan
07 Nov 2019, 18:49 by Ivan Yakovina
1. In my opinion, the main news today unexpectedly came not from the USA, but from Europe. The most important German party, the Christian Democratic Union (CDU), has entered a severe ideological crisis. Its local activists called on party leaders to abandon the embargo on ultra-right from the “Alternative for Germany”, and also not to be shy about adopting some slogans from the ADG arsenal. The fact is that due to the vague position of the CDU on key issues such as migration, its electorate (even moderate) is rapidly flowing to the right radicals. In the recent local elections in Thuringia, the CDU took only third place, which has not been around for decades.
However, the CDU central office reacted with anger to a letter from local activists, advising them to forget about ""friendship with the Nazis."" Functionaries in Berlin do not understand the scale and depth of the problem, therefore, probably, the fate of the German Social Democrats is waiting for the party of Angela Merkel. They have already turned from the main center-left party of the country into semi-marginals. In the same elections in Thuringia, they received only 9 percent, and radicals from the Left party — 30 percent. This is a very bad situation. The main parties in Germany now either have to agree to cooperate with right and left radicals and take their slogans into service, or simply disappear. In 1933, a very similar situation turned out to be a victory for the Nazis there.
2. No less disturbing news today came from France. Local President Emmanuel Macron said out loud what many had long been whispering about. According to him, NATO is in a coma, the alliance “has a brain death.” The US is actively demonstrating that they do not care about Europe, and Turkey, which is part of NATO, conducts operations that run counter to the mission and values of the alliance. Macron believes that Europe is on the edge of the abyss. Another step - and she will lose any influence in the world, and her fate will be determined not by the Europeans themselves, but by other countries. Well, the cherry on the cake: Macron honestly admitted that he does not know whether NATO countries can rely on the Fifth article of the charter of the alliance.
This article postulates that an attack on any of the NATO countries is considered an attack on all its member countries. However, now there is great doubt that Donald Trump will go to war against Russia, if that, for example, occupies a region of a Baltic country. The French president calls the creation of a single European army a way out of this situation. I must say that I always considered Macron a rag and a miserable, stupid showman. But it turns out that sometimes he can still soberly assess the situation and openly say unpleasant things. I am surprised!
3. The extent of the situation with the assessment of reality in the USA can be judged by this news: US ambassador to Ukraine Bill Taylor in his testimony to Congress told that for Donald Trump the crazy idea of buying Greenland from Denmark was much more important and priority than helping Ukraine , which is conducting a very real war with Russia. The American president really lives in a world of some crazy fantasies and simply does not understand what is happening in reality. I was even a little scared from this observation of Taylor.
4. Another important information from Taylor’s testimony is his assessment of the influence of businessman Igor Kolomoisky on President of Ukraine Vladimir Zelensky. According to Taylor, this influence is not just too strong, it is growing. Taylor said that he personally told Zelensky on this subject: “You know, Mr. President, Kolomoisky was not elected. You were elected, and he, Mr. Kolomoisky, is increasing influence in your government, which may lead to your downfall. ” Then I completely agree with Taylor. The president, who won 73 percent in the election, can easily deal with any official, politician and oligarch, rather than try to negotiate with this audience.
5. Russian writer, poet and publicist Dmitry Bykov said that the regime change in Russia will happen before 2022. According to him, the authorities will try to somehow name themselves, and “everything will begin to crackle,” after which “avalanche-like changes” will begin. On the whole, I agree with this assessment: there will be no revolution in the Russian Federation, but the elections to the State Duma in 2021 will be a very serious test for the regime, which has now almost completely lost support in society and is based only on fear and security forces. If something goes wrong (and this is almost inevitable), then the regime will be shaken by strong internal contradictions, it will crumble.
6. The Chechen Padishah Ramzan Kadyrov honestly and openly told how the government will try to maintain power. According to him, it is necessary to kill, intimidate and imprison those people who ""spread gossip and sow discord."" Apparently, this refers to the opposition, which, according to the authorities, only deals with this. Putin’s spokesman, Dmitry Peskov, said Kadyrov hadn’t said anything bad, the Russian government was not going to condemn him for these words. It turns out that the Kremlin as a whole shares the occupational methods of communication with the population. Soon, apparently, massacres and landings of the discontented will begin there. Intimidation right now is a common thing there.
7. An excellent illustration of how this all happens in reality came from the Krasnoyarsk Territory. A local policeman found out that his superiors were sheltering the drug trade, and demanded not to do so. He was immediately arrested and sent to a pre-trial detention center on charges of bribery. True, they did not find evidence, so they released them six months later. The policeman recorded a video in which he described in detail who and how in the local Ministry of Internal Affairs and the FSB are protecting the drug trade, who has any connections and so on. An honest cop was immediately arrested again in the case of disclosing state secrets. This time he won’t get out of prison, I think. Another point: the cop turned out to be honest, but stupid - he complained to his superiors to Putin, although it is Putin who is the leader of the mafia that now rules Russia.
8. But completely the whole heinous essence of the Putin regime was revealed in the news from the Moscow Sheremetyevo airport. Someone Mikhail Galin flew from Riga to Vladivostok with a transfer at this airport. The company was made up of a man by his cat, Victor. In Riga, the employees of the airport did not have any complaints about the cat, but in Moscow Aeroflot ground services declared the cat too fat for hand luggage. Victor weighed 10 kilograms - two more than the required eight. Employees of the airline (or is it more correct to say ""sadists""?) Demanded to hand over the bro in baggage. Mr. Galin reasonably replied that in 8 hours of flight in a terrible cold Victor could die, but no one began to listen to his arguments. As a result, he postponed a flight to Vladivostok for a day, and for the second time came to Sheremetyevo with his friends' cat, similar to Victor, Phoebe, which, when weighed, fit into 8 kg. After that, Phoebe was returned to the owners, and Galin continued his journey to Vladivostok with his well-fed cat. Well done, I broke the system! This story, I think, is one of those “cracks” that Bykov spoke about a little higher.


"
