,src,lang,text
0,"











Без опалення два міста на Харківщині: оголошено надзвичайний стан

04 Nov 2019, 14:05

У Куп’янську через проблеми з опаленням у школах подовжили канікули, а в селиші Чкаловське оголосили надзвичайний стан.
У школах Куп’янська Харківської області температура не відповідає нормі, тому канікули подовжили до 8 листопада.
Проблеми з опаленням і в селищі Чкаловське (Чкаловська ОТГ) Чугуївського району. Тут не добудували гібридні мінікотельні, що мали замінити стару газову котельню.
В обох містах проблема із отриманням комунальним підприємством Обласний інформаційно-технічний центр лімітів на газ від Нафтогазу.
Читайте: Зменшення розміру субсидій не буде – Гончарук
ОІТЦ, який раніше обслуговував котельню у Чкаловському, не отримав ліміту через багаторічні борги. Тому в селищі оголосили надзвичайний стан.
В Департаменті житлово-комунального господарства та розвитку інфраструктури Харківської ОДА запевняють, що близько 90% котелень на території області вже подають тепло.
– Подається опалення на об’єкти соцсфери там, де котельні працюють на альтернативному паливі, пелетах, дровах. Зараз керівництво підприємства (КП ОІТЦ) у Києві, йде процес узгодження підписання договору, – пояснив ситуацію у Куп’янську та Чкаловському директор департаменту Сергій Магдисюк.
За його словами, проблема з Нафтогазом вирішиться найближчим часом.
Нагадаємо, 28 жовтня Мінрегіон повідомив, що опалювальний сезон розпочався в усіх областях України, але проблемними залишаються ще вісім регіонів.
Джерело: Mediaport


",uk,"











Without heating two cities in Kharkiv region: a state of emergency has been declared

04 Nov 2019, 15:05

In Kupyansk due to problems with heating in schools extended vacation and declared a state of emergency in the village of Chkalovskoye.
The temperature in the Kupyansk Kharkiv region's schools does not meet the norm, so the holidays were extended until November 8.
Heating problems in the village of Chkalovskoye (Chkalovskaya OTG) of Chuguevsky district. Hybrid mini-boilers, which were supposed to replace the old gas boiler house, were not completed here.
In both cities, the problem with obtaining a utility company is the Regional Information and Technical Center for Gas Limits from Naftogaz.
Read: There will be no reduction in subsidies - Goncharuk
The OITC, which previously operated a boiler room in Chkalovsky, did not receive a limit because of long-standing debts. Therefore, the state declared a state of emergency.
The Department of Housing, Utilities and Infrastructure Development of Kharkiv Regional State Administration says that about 90% of boilers in the region are already supplying heat.
- Heating is provided to the objects of the social sphere where the boiler-houses run on alternative fuel, pellets, firewood. Now the management of the enterprise (KP OITC) in Kiev, is in the process of concluding a contract, - explained the situation in Kupyansk and Chkalovsky department director Sergey Magdysyuk.
According to him, the problem with Naftogaz will be solved in the near future.
We will remind, on October 28 the Ministry of Regional Development reported that the heating season has begun in all regions of Ukraine, but eight more regions remain problematic.
Source: Mediaport


"
