,src,lang,text
0,"











Суд по делу фондатора ""ДНР"" Лягина снова перенесли - фонд ""Изоляция""

06 Nov 2019, 13:40

Судебное заседание по делу одного из основателей террористической организации ""Донецкая народная республика"" Романом Лягиным перенесено. Об этом сообщает пресс-служба фонда ""Изоляция"".
""Рассмотрение дела Романа Лягина, организатора референдума по созданию ""ДНР"" в Донецкой области в 2014 году, перенесен на 17 декабря 2019 года. Заседание должно состояться в 13:30 в Шевченковском районном суде города Киева (ул. Дегтяревская, 31А)"", - говорится в сообщении. Первое заседание по делу Лягина было запланировано на 3 сентября 2019, однако рассмотрение дела перенесли на 1 ноября из-за того, что подозреваемый не ознакомился с материалами дела. ""Но и это заседание снова не произошло. Оно было перенесено на 17 декабря в связи с тем, что судья А.В. Мелешак, председатель коллегии судей, которые должны рассматривать дело, находилась в совещательной комнате по другому делу"", - сообщили в фонде ""Изоляция"". ""Сначала, когда я перед заседанием заходил к секретарю госпоже Мелешак, мне сообщили только о том, что заседания не будет и дату не определили. Впоследствии, когда я во время запланированного начала заседания явился в кабинет вместе с журналистами и камерами, секретарша сообщила уже и новую дату слушания (правда, не выдали ни одного документа по этому поводу, но это видео снимали несколько камер)"", - отметил юрист, адвокатское объединение ""Головань и Партнеры"" Иван Черный.
Как сообщалось ранее, Роман Лягин — бывший “председатель ЦИК” во время проведения незаконного референдума 11 мая 2014 года по поводу самоопределения “ДНР” и экс-”министр труда и социальной политики” сепаратистской республики. Под его руководством было организовано и проведено фейковое голосование среди жителей Донецкой области, в результате которого появилась террористическая организация “ДНР”. Лягин также был инициатором захвата территории фонда ""Изоляция"" в Донецке и причастен к ее превращению в секретную тюрьму “МГБ ДНР”, где содержались, в частности, Дмитрий Потехин, Игорь Козловский, Станислав Асеев. По мнению фонда ""Изоляция"", Лягин является ценным свидетелем, который может предоставить информацию о причастности российских спецслужб к оккупации Донбасса, и этим способствовать доказательству участия России в военной агрессии против Украины в международных судах. ""Однако для полноценного привлечения к ответственности Лягина и подобных ему, необходимо внести изменения в украинское законодательство, в частности, принять закон о военных преступниках (номер зарегистрированного в Верховной Раде законопроекта 9438). Тогда Роман Лягин может быть привлечен к ответственности в соответствии с нормами международного права"", - отмечают в фонде. Как считают в ""Изоляции"", учитывая указанные попытки ограничить доступ к информации по делу Лягина, есть риск, что правоохранительные органы договорились с Романом Лягиным о сотрудничестве на условиях, о которых неизвестно ни пострадавшим от создания “ДНР” и секретной тюрьмы, ни широкой общественности, и которые могут быть недопустимы для украинского общества. Как ранее сообщалось, бывший ""глава ЦИК"" ""ДНР"" Лягин начал давать показания. 

МАТЕРИАЛЫ ПО ТЕМЕ












",ru,"











The trial in the case of the DNR’s donor Lyagin was postponed again - Izolyatsia Foundation

06 Nov 2019, 13:40

The trial in the case of one of the founders of the terrorist organization ""Donetsk People's Republic"" by Roman Lyagin was postponed. This was reported by the press service of the Isolation Fund.
""The consideration of the case of Roman Lyagin, the organizer of the referendum on the creation of the"" DPR ""in the Donetsk region in 2014, was postponed to December 17, 2019. The meeting should be held at 13:30 in the Shevchenkovsky District Court of Kiev (Degtyarevskaya St., 31A),"" the message says. The first meeting in the Lyagin case was scheduled for September 3, 2019, but the trial was postponed to November 1 due to the fact that the suspect did not familiarize himself with the case file. “But this meeting did not happen again. It was postponed until December 17 due to the fact that Judge A.V. Meleshak, chairman of the panel of judges who should consider the case, was in the deliberation room on another case,” the fund said. ""Insulation"". “At first, when I went to see the secretary, Mrs. Meleshak, before the meeting, they only informed me that there would be no meeting and did not set a date. Subsequently, when I arrived at the office with the journalists and cameras during the scheduled start of the meeting, the secretary informed a new date for the hearing (although they didn’t issue a single document about this, but several cameras shot this video), ”said Ivan Cherny, a lawyer at the Golovan & Partners Law Office.
As previously reported, Roman Lyagin is a former “chairman of the CEC” during an illegal referendum on May 11, 2014 regarding the self-determination of the “DPR” and the former “minister of labor and social policy” of the separatist republic. Under his leadership, a fake vote was organized among residents of the Donetsk region, as a result of which the terrorist organization “DPR” appeared. Lyagin was also the initiator of the seizure of the Isolation Fund in Donetsk and was involved in its transformation into the secret prison of the “MGB DPR”, which contained, in particular, Dmitry Potekhin, Igor Kozlovsky, Stanislav Aseev. According to the Isolation Fund, Lyagin is a valuable witness who can provide information on the involvement of Russian special services in the occupation of Donbass, and this will help to prove Russia's participation in military aggression against Ukraine in international courts. ""However, in order to fully bring to justice Lyagin and others like him, it is necessary to amend Ukrainian legislation, in particular, to adopt the law on war criminals (bill number 9438 registered in the Verkhovna Rada). Then Roman Lyagin can be prosecuted in accordance with international standards rights, ”the fund notes. According to Isolation, given these attempts to limit access to information in the Lyagin case, there is a risk that law enforcement agencies agreed with Roman Lyagin on cooperation on terms that are not known to the victims of the creation of the “DPR” and the secret prison, nor to the general public. , and which may be unacceptable for Ukrainian society. As previously reported, the former ""head of the CEC"" ""DPR"" Lyagin began to testify.

MATERIALS ON THE TOPIC












"
