,src,lang,text
0,"











На будівництві торгово-розважального центру в Києві сталася трагедія (фото)

06 Nov 2019, 13:41

На об'єкті під час виконання висотних робіт впав будівельник
Сьогодні, 6 листопада, на будівництві торгово-розважального центру Retroville на проспекті Правди, 47 стався трагічний випадок.
Як повідомляється на сторінці «Київ оперативний» у Facebook, тут під час виконання висотних робіт впав будівельник. Поки що невідомо, з якої саме висоти впав чоловік
Будівельника у важкому стані госпіталізовано.
Наразі на місці працює слідчо-оперативна група, яка має з'ясувати всі обставини події.
1 з 6на весь екран згорнути
















Всі фоторепоратажі

Нагадаємо, нещодавно на будівництві нового житлового комплексу на вулиці Тираспільській у Києві стався трагічний випадок: загинув чоловік, який ремонтував ліфт.







",uk,"











Tragedy happened on construction of shopping and entertainment center in Kiev (photo)

06 Nov 2019, 12:41

At the object, during the construction of high-altitude works fell builder
Today, on November 6, a tragic accident occurred at the construction of the Retroville shopping and entertainment center on Truth Avenue, 47.
According to the Kyiv Operational Facebook page, a builder fell down while performing high-rise work. It is not yet known from what height the man fell
Builder in serious condition hospitalized.
An investigative task force is currently in place to find out all the circumstances of the event.
Collapse all 1 of 6
















All photo reports

We will remind, recently on construction of the new residential complex on Tiraspolskaya Street in Kiev there was a tragic case: the person who repaired the elevator was lost.







"
