,src,lang,text
0,"











Previa del partido de la jornada 11: Mérida AD contra Sevilla At.
02 Nov 2019, 16:02 by SPORT.es

El encuentro tendrá lugar este domingo a las 17:00 en el Romano

El próximo domingo en el Romano a las 17:00, se medirán el Mérida y el Sevilla durante la jornada número 11 de la Segunda División B.
El Mérida AD afronta la undécima jornada del torneo con ganas de remontar su posición después de lograr un empate contra el Badajoz en su último encuentro. Desde el comienzo de la competición, los locales han ganado en uno de los 10 encuentros disputados hasta ahora y acumulan una cifra de 16 tantos encajados frente a 10 a favor.
En el lado de los visitantes, el Sevilla At. se hizo con la victoria frente al UCAM Murcia durante su último encuentro de liga (3-0), con tantos de Pana y Mena, por lo que pretende mantener su racha de victorias en el estadio del Mérida AD. Hasta la fecha, de los 10 partidos que ha jugado el Sevilla At. en la Segunda División B, ha ganado en cuatro de ellos con un balance de 11 goles marcados frente a 11 encajados.
Centrando la atención en el rendimiento como equipo local, el Mérida AD ha sido derrotado en dos ocasiones y ha empatado tres veces en cinco partidos jugados hasta ahora, lo que brinda más oportunidades de las esperadas a los visitantes, que podrían tenerlo más sencillo para ganar. Como visitante, el Sevilla At. ha ganado dos veces y ha perdido en tres ocasiones en sus cinco partidos disputados, por lo que se trata de un rival acostumbrado a sacar puntos a domicilio, así que el Mérida AD deberá estar alerta si no quiere dejarse puntos en casa.
Prestando atención a las estadísticas de los encuentros anteriores entre ambos equipos en la Segunda División B, podemos ver que el balance está dominado por la igualdad ya que han empatado una vez en sus encuentros anteriores de esta competición. La última vez que se enfrentaron el Mérida y el Sevilla en esta competición fue en mayo de 2016 y el partido finalizó con un resultado de 1-2 a favor del Mérida.
Actualmente, el Sevilla At. se sitúa por delante en la clasificación con una diferencia de siete puntos con respecto a su rival. El equipo de Santiago Amaro Barril llega al encuentro en vigésima posición y con siete puntos antes del encuentro. Por su parte, el Sevilla At. tiene 14 puntos y ocupa la décima posición en la clasificación.


",es,"











Previous match of matchday 11: Mérida AD against Sevilla At.
02 Nov 2019, 16:02 by SPORT.es

The meeting will take place this Sunday at 17:00 in the Roman

Next Sunday in the Roman at 17:00, Merida and Seville will be measured during the 11th day of the Second Division B.
Mérida AD faces the eleventh day of the tournament with the desire to trace their position after achieving a draw against Badajoz in their last meeting. Since the beginning of the competition, the locals have won in one of the 10 games played so far and accumulate a figure of 16 goals against 10 in favor.
On the visitors side, the Sevilla At. He took the victory against UCAM Murcia during his last league match (3-0), with many of Pana and Mena, so he intends to maintain his winning streak at the Mérida AD stadium. To date, of the 10 games played by Sevilla At. In the Second Division B, he has won in four of them with a balance of 11 goals scored against 11 conceded.
Focusing attention on performance as a local team, Mérida AD has been defeated twice and has drawn three times in five games played so far, which provides more opportunities than expected to visitors, who could have it easier to win . As a visitor, Sevilla At. He has won twice and has lost three times in his five games played, so it is a rival used to get points at home, so Mérida AD must be alert if he does not want to leave points at home.
Paying attention to the statistics of the previous meetings between both teams in the Second Division B, we can see that the balance is dominated by equality since they have drawn once in their previous meetings of this competition. The last time Mérida and Sevilla met in this competition was in May 2016 and the match ended with a 1-2 result in favor of Mérida.
Currently, Sevilla At. It is ahead in the classification with a difference of seven points with respect to its rival. The team of Santiago Amaro Barril arrives at the meeting in twentieth position and with seven points before the meeting. For its part, Sevilla At. It has 14 points and occupies the tenth position in the classification.


"
