,src,lang,text
0,"











Moyano se suma a los pedidos K para enjuiciar a la prensa
05 Nov 2019 by Redacción Diario de Cuyo
El jefe del sindicato de Camioneros, Hugo Moyano, se mostró a favor de que durante el gobierno de Alberto Fernández se evalúe y juzgue el trabajo de la prensa -periodistas y medios-, hasta deslizó un deseo: ""Como cualquier hijo de vecino tienen que pagar por lo que hicieron"", sentenció.
Tras la polémica por el aval de dirigentes del kirchnerismo a la creación de una ""Conadep"" del periodismo, el gremialista afirmó que ""hay que revisar lo que hicieron algunos periodistas y medios en estos años"".
""Han hecho mucho daño. Han acusado a gente. Como no han vivido, no se dan cuenta, pero hacen mucho daño. Eso no puede ser gratis, que les manden a decir y no pase nada"", advirtió Moyano, quien se reconcilió con Cristina Kirchner antes de las elecciones presidenciales.
Según el líder de los Camioneros, ""los periodistas tienen que darse cuenta de los malos momentos que han hecho pasar a gente inventando cosas"". ""Que paguen como cualquier hijo de vecino. Son parte de la sociedad y tienen mucha responsabilidad en su tarea, no pueden utilizarla para perjudicar a la gente"", afirmó en diálogo con Radio El Destape.
Además, Moyano dijo que con la llegada de Fernández a la Casa Rosada ""empieza una nueva etapa con los medios y la Justicia"".
El gremialista, que es investigado por presunta asociación ilícita en el club Independiente, arremetió contra ""algunos sectores"" de la provincia de Buenos Aires y de la Justicia bonaerense que ""tomaban como base la denuncia de personajes nefastos que nada tienen que ver con la realidad"".
El concepto de ""Conadep del periodismo"" surgió del escritor de Página 12 Mempo Giardinelli y fue rápidamente replicado por el actor Dady Brieva, como un cuestionamiento al rol del periodismo en la cobertura de los hechos de corrupción, principalmente ligados a funcionarios y empresarios k, y del comportamiento de la prensa en su trabajo primario de informar.


",es,"











Moyano joins the K orders to prosecute the press
05 Nov 2019 by Cuyo Daily Writing
The head of the Truckers' union, Hugo Moyano, was in favor of evaluating and judging the work of the press - journalists and media - during the Alberto Fernández administration, until he slipped a wish: ""Like any neighbor's son they have to pay for what they did, ""he said.
After the controversy over the endorsement of leaders of Kirchnerism to the creation of a ""Conadep"" of journalism, the unionist said that ""we must review what some journalists and media did in these years.""
""They have done a lot of damage. They have accused people. Since they have not lived, they do not realize, but they do a lot of damage. That cannot be free, they are told to say and nothing happens,"" said Moyano, who reconciled with Cristina Kirchner before the presidential elections.
According to the leader of the Truckers, ""journalists have to realize the bad times that have caused people to invent things."" ""That they pay like any neighbor's son. They are part of society and have a lot of responsibility in their task, they cannot use it to harm people,"" he said in dialogue with Radio El Destape.
In addition, Moyano said that with the arrival of Fernández at Casa Rosada ""a new stage begins with the media and Justice.""
The unionist, who is investigated for alleged unlawful association in the Independent club, lashed out at ""some sectors"" of the province of Buenos Aires and Buenos Aires Justice that ""took as a basis the denunciation of nefarious characters that have nothing to do with reality. "".
The concept of ""Conadep of journalism"" came from the writer of Page 12 Mempo Giardinelli and was quickly replicated by actor Dady Brieva, as a questioning of the role of journalism in the coverage of corruption events, mainly linked to officials and businessmen, and of the behavior of the press in its primary work of informing.


"
