,src,lang,text
0,"











Agentur am Flughafen kreiert für die Stiftung Kinderdorf Pestalozzi eine Kampagne aus einem Guss
05 Nov 2019 by Redaktion
Die Stiftung Kinderdorf Pestalozzi ist ein international tätiges Kinderhilfswerk. Anlässlich des 30-jährigen Bestehens der Kinderrechtskonvention der Vereinten Nationen hat die Agentur am Flughafen eine Fundraising-Kampagne entwickelt und eine Kinder-Justitia auf Tour de Suisse geschickt.



Glückliche Kinder brauchen Freizeit, Bildung, Gesundheit, Selbstbestimmung und Meinungsfreiheit. Dies alles sollte eigentlich selbstverständlich sein. Doch für viele Kinder weltweit ist dies nicht der Fall, obwohl die Kinderrechtskonvention der Vereinten Nationen in diesem Jahr ihr 30-jähriges Bestehen feiert. Die Stiftung Kinderdorf Pestalozzi unterstützt jährlich rund 170’000 Kinder und Jugendliche in 13 Ländern, um für eine gerechtere und friedlichere Welt zu sorgen. Um dies zu bewerkstelligen, ist die Hilfsorganisation auf Spenden angewiesen. Um die Schweizer Bevölkerung für die Kinderrechte zu sensibilisieren, wurde die Agentur am Flughafen mit der Kreation einer Kommunikationskampagne beauftragt. 
Als Gallionsfigur der Kampagne wurde ein Justitia-Mädchen, das für die Rechte der Kinder steht, geschaffen. In Zusammenarbeit mit der Kunstgiesserei St. Gallen entwickelte die Agentur am Flughafen eine lebensgrosse Bronzestatue, die wie ihr grosses Vorbild eine Waage in der Hand hält und eine Augenbinde trägt. Ihr Look macht sie zur kleinen, starken Superheldin, die für die Kinderrechte weltweit kämpft. 
Diesen Herbst zieht die Stiftung mit ihrem Justitia-Mädchen durch die wichtigsten Schweizer Städte, um sich für die weltweiten Kinderrechte stark zu machen und Spenden zu sammeln. Die Roadshow startete in St. Gallen und endet am 20. November, dem internationalen Tag der Kinderrechte auf dem Bundesplatz in Bern. 
Neben «Justitia on Tour» wurde als weitere Massnahme ein Streuwurf initiiert, mit dem rund eine Million Schweizer Haushalte zum Spenden aufgefordert wurden. Eine Guerilla-Aktion auf Spielplätzen zeigt zudem auf, dass wir uns alle gemeinsam für bessere Kinderrechte einsetzen müssen.
Die Werbemittel sind seit August und noch bis Dezember im Einsatz.



















Verantwortlich bei Stiftung Kinderdorf Pestalozzi: Elisabeth Reisp (Leiterin Kommunikation); Christin Eugster (Leiterin Direktmarketing). Verantwortlich bei Agentur am Flughafen: René Eugstair (Gesamtverantwortung); Dominique Rutishauser (Creative und Art Direction); Ketil Eggum (Art Direction); Tilman Mäder (Grafik); Miriam Egli (Beratung/Text); Julia Lüchinger (Beratung/Koordination). Weitere: Kunstgiesserei St. Gallen (Bronzestatue); Daniel Ammann (Fotografie).


",de,"











Agency at the airport creates a one-stop campaign for the Pestalozzi Children's Foundation
05 Nov 2019 by Editorial staff
The Pestalozzi Children's Village Foundation is an international child relief organization. On the occasion of the 30th anniversary of the United Nations Convention on the Rights of the Child, the agency has developed a fundraising campaign at the airport and has sent a children's justice to Tour de Suisse.



Happy children need free time, education, health, self-determination and freedom of expression. This should all be self-evident. But for many children worldwide, this is not the case, although the United Nations Convention on the Rights of the Child is celebrating its 30th anniversary this year. Every year, the Pestalozzi Children's Foundation supports some 170,000 children and adolescents in 13 countries to ensure a more just and peaceful world. To accomplish this, the aid organization relies on donations. In order to sensitize the Swiss population to children's rights, the agency at the airport was commissioned with the creation of a communication campaign.
As a figurehead of the campaign, a Justitia girl standing for children's rights was created. In cooperation with Kunstgiesserei St. Gallen, the agency developed a life-size bronze statue at the airport, which, like its big role model, holds a scale in its hand and wears a blindfold. Her look makes her a small, strong superheroine fighting for children's rights worldwide.
This fall, the foundation and its Justitia girl will be traveling through the main Swiss cities to campaign for worldwide children's rights and raise funds. The roadshow started in St. Gallen and ends on 20 November, the International Children's Rights Day on the Bundesplatz in Bern.
In addition to ""Justitia on Tour"", a scattering scheme was initiated as a further measure, with which around one million Swiss households were invited to donate. A guerrilla action on playgrounds also shows that we must all work together for better children's rights.
The advertising material has been in use since August and until December.



















Responsible for Stiftung Kinderdorf Pestalozzi: Elisabeth Reisp (Head of Communications); Christin Eugster (Director Direct Marketing). Responsible for agency at the airport: René Eugstair (overall responsibility); Dominique Rutishauser (Creative and Art Direction); Ketil Eggum (Art Direction); Tilman Mäder (graphic); Miriam Egli (advice / text); Julia Lüchinger (Consultation / Coordination). Others: Kunstgiesserei St. Gallen (bronze statue); Daniel Ammann (photography).


"
