,src,lang,text
0,"











У МЗС України прокоментували ""візит"" депутата Держдуми РФ до Золотого
Журавльову заборонено в'їзд на територію України ще у минулому році.

05 Nov 2019, 00:41

Міністерство закордонних справ України висловило рішучий протест у зв'язку із перебуванням депутата Державної думи РФ Олексія Журавльова біля населеного пункту Золоте на позиціях підрозділів терористів ""ЛНР"" на окупованій території Луганської області України, повідомляє УНІАН з посиланням на коментар МЗС.
""Висловлюємо рішучий протест у зв'язку із незаконною поїздкою представника законодавчого органу РФ на тимчасово окуповану територію України до Луганської області, яка відбулася із порушенням встановленого порядку перетину державного кордону України"", – сказано у повідомленні.
У МЗС зазначили, що вважають цю поїздку ""грубим порушенням російською стороною державного суверенітету і територіальної цілісності України"", до того ж, згідно з рішенням Ради національної безпеки і оборони України від 21 червня 2018 року ""Про застосування і скасування персональних спеціальних економічних та інших обмежувальних заходів (санкцій)"", якому надано чинності указом президента України №176 / 2018 від 21 червня 2018 року, Журавльову ще з того часу безстроково заборонено в'їзд на територію України. На даний момент українські дипломати і правоохоронці перевіряють інформацію про перебування зазначеної особи на ділянці розведення сил у районі Золотого, а до МЗС РФ спрямовано ноту з вимогою пояснити мету приїзду російського депутата на українську територію.
""МЗС України закликає російську сторону припинити порушувати українське законодавство і нагадує, що поїздки офіційних осіб РФ можуть здійснюватися за згодою української сторони і через відкриті пункти пропуску на українсько-російському державному кордоні"", – зазначили дипломати.
Як повідомлялося, депутат Державної Думи Росії та голова шовіністичної партії ""Родина"" Олексій Журавльов 1-2 листопада відвідав колишні позиції бойовиків незаконного збройного формування ""ЛНР"" у районі Золотого, де ""проінспектував"" хід розведення сил і засобів.
1 листопада, біля Золотого на Луганщині закінчилося триденне розведення сил і засобів. Розведення розпочалося опівдні 29 жовтня: українські військові та НЗФ бойовиків запустили у повітря зелені та білі ракети, що сигналізують про готовність до початку процесу.
Військовослужбовців ЗСУ почали відводити, попри відсутність семиденного режиму ""тиші"" та регулярні обстріли бойовиків. За процесом спостерігала Спеціальна моніторингова місія ОБСЄ.
Докладніше про наслідки цього кроку читайте в матеріалі Юрія Бутусова ""Мале Золоте, а ціна велика"" у тижневику ""Дзеркало тижня. Україна"".
За матеріалами: УНІАН
Ми повідомляємо тільки дійсно важливі новини. Долучайся до Telegram-каналу DT.UA


",uk,"











The Foreign Ministry of Ukraine commented on the ""visit"" of the State Duma deputy to the Gold
Zhuravlyov was forbidden to enter the territory of Ukraine last year.

05 Nov 2019, 23:41

The Ministry of Foreign Affairs of Ukraine expressed a strong protest over the stay of the State Duma deputy Alexei Zhuravlev near the settlement of Zolote on the positions of the LNR terrorist units in the occupied territory of the Luhansk region of Ukraine, UNIAN reports citing MFA comment.
""We express a strong protest in connection with the illegal visit of a representative of the legislative body of the Russian Federation to the temporarily occupied territory of Ukraine to the Luhansk region, which occurred in violation of the established order of crossing the state border of Ukraine,"" - said in the message.
The Foreign Ministry noted that they considered this visit a ""gross violation of the Russian side of the state sovereignty and territorial integrity of Ukraine"", in addition, in accordance with the decision of the National Security and Defense Council of June 21, 2018 ""On the application and abolition of personal special economic and other restrictive measures (sanctions) "", which came into force by the decree of the President of Ukraine No. 176/2018 of June 21, 2018, Zhuravlyov has been banned from entering Ukraine forever. At the moment, Ukrainian diplomats and law enforcement officers are checking the information about the presence of the specified person on the area of deployment of forces in the region of Gold, and a note has been sent to the Foreign Ministry of the Russian Federation demanding to explain the purpose of the Russian deputy's arrival to Ukrainian territory.
""The Ministry of Foreign Affairs of Ukraine calls on the Russian side to stop violating the Ukrainian legislation and reminds that visits of Russian officials can be made with the consent of the Ukrainian side and through open checkpoints on the Ukrainian-Russian state border,"" the diplomats said.
As it was reported, on November 1-2, the deputy of the State Duma of Russia and the chairman of the chauvinist party ""Family"" Alexei Zhuravlev visited the former positions of fighters of the illegal armed formation of the ""People's Republic of Lithuania"" in the region of Golden, where he ""inspected"" the progress of the breeding of forces and means.
On November 1, a three-day deployment of forces and means ended near the Golden in Luhansk region. The breeding began at noon on October 29: Ukrainian military and NFF fighters launched green and white rockets, signaling readiness to begin the process.
Armed Forces servicemen began to withdraw, despite the absence of a seven-day ""silence"" regime and regular shelling of fighters. The OSCE Special Monitoring Mission monitored the process.
For more information on the consequences of this step, see Yuri Butusov's article ""Small Gold, and the Big Price"" in ""Mirror of the Week. Ukraine"".
According to the materials: UNIAN
We are only reporting really important news. Join the DT.UA Telegram


"
