,src,lang,text
0,"











Chevy представит полностью электрическую версию грузовика C10
05 Nov 2019 by Ирина Котова

Конструкторы автомобильного концерна Chevy представят полностью электрический грузовик C10.






Торжественная презентация модели пройдет в рамках проведения международного мотор-шоу SEMA, посвященного тюнингу. Экстерьер нового автомобиля имеет общие черты с пикапом C10, который был популярен в 1960-х годах. Машина отлично сочетает в себе винтажный экстерьер и современное техническое оснащение.
В салоне машины установлена мультимедийная система с большим цифровым экраном, а также использован новый материал отделки, выбранный для сидений и боковых панелей.
 
Подробные технические данные пока не озвучены и будут объявлены производителями только во время представления. При этом, производители уверены, что смогут удивить поклонников бренда.
Дата начала серийного производства, а также стоимость будущего автомобиля, пока не озвучены и будут объявлены только в следующем году, после того, как руководители уладят несколько формальностей, которые также не разглашаются.


",ru,"











Chevy will introduce a fully electric version of the truck C10
05 Nov 2019 by Irina Kotova

Designers of the Chevy automobile concern will introduce the all-electric C10 truck.






The ceremonial presentation of the model will be held as part of the international tuning show SEMA. The exterior of the new car has similarities with the C10 pickup truck, which was popular in the 1960s. The machine perfectly combines a vintage exterior and modern technical equipment.
Inside the car, a multimedia system with a large digital screen is installed, as well as a new finishing material selected for the seats and side panels.

Detailed technical data has not yet been announced and will be announced by manufacturers only at the time of presentation. At the same time, manufacturers are confident that they will be able to surprise fans of the brand.
The start date of mass production, as well as the cost of the future car, has not yet been announced and will be announced only next year, after the leaders have settled a few formalities that are also not disclosed.


"
