,src,lang,text
0,"











Ходят по квартирам и просят денег на похороны: мошенники возродили старую схему

05 Nov 2019

Аферисты давят на жалость и пытаются зацепить за личное.
Жалуются под дверью и пытаются задеть за живое – Киев захлестнула новая волна мошеннических скитаний по подъездам. Собирают пожертвования якобы на похороны.
""Когда у кого-то кто-то умирает, мы не бежим выбивать двери соседям. Тем более еще и в соседний подъезд или через подъезд. Как-то совсем все не так. А потом думаю: люди же разные, может, так получилось у человека. А оказалось потом, что никто не умер. Спросила у дворника"", – рассказывает о своих ощущениях от встречи с мошенниками жительница Киева Ольга Яковлева.
Психолог объясняет, что в таких ситуациях обычно берут верх эмоции. Поэтому люди готовы отдавать кровные даже невесть кому.
""В Украине очень много людей, которые сами себя жалеют. И когда человек сам себя жалеет, а у него кто-то просит жалостливым голосом: ""Пожалуйста, помогите, у меня умерли"", включается жалость к тому человеку, который просит"", – объясняет психолог Алексей Шевцов.
И пока в сети на вымогателей денег десятки жалоб – в полиции ни одного заявления. Последний раз с таким случаем обращались еще в начале лета.
""Пришли на данный момент неустановленные лица и попросили у гражданки средства якобы на похороны близкого родственника. В зависимости от суммы убытков по статье ""мошенничество"" грозит максимальный срок до 12 лет лишения свободы с конфискацией имущества"", – говорит оперуполномоченный Управления уголовного розыска ГУ Нацполиции Киева Юрий Найдюк в новостях «Сегодня» на телеканале «Украина».
Если же в ваш дом все же пришли с просьбой пожертвовать денег, прежде всего, в полиции советуют не спешить открывать двери. А еще, по возможности, расспросить неизвестного визитера, ведь любая информация о личности может пригодиться правоохранителям.







",ru,"











They go around the apartments and ask for money for the funeral: scammers revived the old scheme

05 Nov 2019

Swindlers press on pity and try to hook on a personal one.
They complain under the door and try to hurt the living - Kiev was swept by a new wave of fraudulent wanderings around the porches. Donations are allegedly being collected for the funeral.
“When someone dies with someone, we don’t run to knock the doors out to neighbors. All the more so to the neighboring staircase or through the staircase. Somehow it’s not at all right. And then I think: people are different, maybe it happened It turned out that no one died. I asked the janitor, ""Olga Yakovleva, a resident of Kiev, talks about her feelings from a meeting with scammers.
The psychologist explains that in such situations emotions usually prevail. Therefore, people are ready to give blood even to whom.
“In Ukraine, there are a lot of people who pity themselves. And when a person pities himself, and someone asks him in a compassionate voice:“ Please help, I’ve died, ”includes pity for the person who asks,“ - explains the psychologist Alexei Shevtsov.
And while there are dozens of complaints online for money extortionists, not a single statement has been filed with the police. The last time this case was addressed was at the beginning of summer.
“Unidentified persons have come at the moment and have asked the citizen for money allegedly for the funeral of a close relative. Depending on the amount of losses under the“ fraud ”article, the maximum term is 12 years of imprisonment with confiscation of property,” said the criminal investigator of the Criminal Investigation Department of the National Police of Kiev Yuriy Naydyuk in the news ""Today"" on the channel ""Ukraine"".
If, nevertheless, they came to your house with a request to donate money, first of all, the police advise you not to rush to open the doors. And also, if possible, to ask an unknown visitor, because any information about the person can be useful to law enforcement officers.







"
