,src,lang,text
0,"











ترمب يؤكد للسيسي حرصه الشخصي على إنجاح مفاوضات سد النهضة
05 Nov 2019 by القاهرة -أشرف عبد الحميد 
أجرى الرئيس المصري عبد الفتاح السيسي، اتصالا هاتفيا بالرئيس الأميركي دونالد ترمب، تناول بحث عدد من الملفات الثنائية والإقليمية والدولية ذات الاهتمام المشترك.
وصرح السفير بسام راضي المتحدث الرسمي باسم رئاسة مصر، أن الرئيس السيسي هنأ ترمب على جهود الولايات المتحدة في مكافحة الإرهاب، وبما يساهم في تحقيق الاستقرار سواء على المستوى الإقليمي والدولي.
وخلال الاتصال، تقدم السيسي بالشكر والتقدير للرئيس ترمب على استضافة ورعاية الولايات المتحدة للمفاوضات الثلاثية الخاصة بسد النهضة، والتي تجري غدا الأربعاء في واشنطن على مستوى وزراء خارجية مصر والسودان وإثيوبيا.
من جانبه، أكد الرئيس الأميركي على اهتمامه الشخصي وحرصه البالغ على نجاح هذه المفاوضات، وأنه شخصيا سيستقبل وزراء الخارجية الثلاثة بالمكتب البيضاوي بالبيت الأبيض، في مستهل هذه المفاوضات، تأكيدا لحرصه البالغ على خروج هذه المفاوضات بنتائج إيجابية وعادلة تحفظ حقوق جميع الأطراف.
وأضاف المتحدث الرسمي أن الاتصال تناول كذلك بحث سبل تعزيز العلاقات الاستراتيجية بين البلدين الصديقين، حيث أكد الرئيسان في هذا الصدد الحرص على تطوير التعاون المشترك بين البلدين في مختلف المجالات.
وكانت واشنطن قد قررت استضافة اجتماع ثلاثي بين وزراء خارجية مصر وإثيوبيا والسودان وبحضور البنك الدولي لبحث مفاوضات سد النهضة .
ومساء الخميس الماضي أعلنت إثيوبيا قبولها بالوساطة الأميركية لحل أزمة مفاوضات السد، حيث أعلن نيبيات جيتاشيو، الناطق باسم وزارة الخارجية الإثيوبية أن حكومة بلاده قبلت دعوة الولايات المتحدة لعقد اجتماع للمناقشة حول السد.
السيسي يعلق على المحادثة
من جانبه وعقب الاتصال قال الرئيس السيسي لقد سعدت كثيرا بمكالمتي مع الرئيس ترمب، والتي تناولنا خلالها القضايا ذات الاهتمام المشترك.
وكتب الرئيس المصري على صفحته الشخصية على مواقع التواصل قائلا: أثبت الرئيس ترمب أنه رجل من طراز فريد ويمتلك القوة لمواجهة الأزمات والتعامل معها، وإيجاد حلول حاسمة لها.
وأضاف: أجدد امتناني الشخصي وتقدير مصر للرئيس ترمب على الجهود التي يبذلها لرعاية المفاوضات الثلاثية بين مصر والسودان وإثيوبيا حول سد النهضة، وأؤكد على ثقتي الكاملة في هذه الرعاية الكريمة والتي من شأنها إيجاد سبيل توافقي يرعى حقوق كافة الأطراف في إطار قواعد القانون الدولي والعدالة الإنسانية.


",ar,"











Trump assures Sisi of his personal interest in the success of the Renaissance Dam negotiations
05 Nov 2019 by Cairo-Ashraf Abdel Hamid
Egyptian President Abdel Fattah El Sisi held a telephone conversation with US President Donald Trump on bilateral, regional and international issues of common concern.
Egyptian Presidential Spokesman Ambassador Bassam Radi said that President El Sisi congratulated Trump on the US efforts to combat terrorism and contribute to regional and international stability.
During the phone call, Sisi thanked President Trump for hosting and sponsoring the United States for the trilateral negotiations on the Renaissance Dam, which will take place on Wednesday in Washington at the level of foreign ministers of Egypt, Sudan and Ethiopia.
For his part, the US President stressed his personal interest and keenness on the success of these negotiations, and that he personally will receive the three foreign ministers in the Oval Office at the White House, at the beginning of these negotiations, to confirm his keenness to get these negotiations with positive and fair results that safeguard the rights of all parties.
The Spokesman added that the talks also touched on ways of boosting the strategic relations between the two friendly countries.
Washington has decided to host a tripartite meeting between the foreign ministers of Egypt, Ethiopia and Sudan in the presence of the World Bank to discuss the negotiations of the Renaissance Dam.
Last Thursday, Ethiopia announced its acceptance of US mediation to resolve the crisis of the dam negotiations.
Sisi comments on the conversation
For his part, President El Sisi said, ""I was very pleased with my conversation with President Trump, during which we discussed issues of mutual interest.""
""President Trump has proved himself to be a unique man with the power to face and deal with crises and find decisive solutions,"" the president wrote on his personal website.
He added: `` I renew my personal gratitude and appreciation to President Trump for his efforts to sponsor the trilateral negotiations between Egypt, Sudan and Ethiopia on the Renaissance Dam, and I reiterate my full confidence in this generous patronage, which will find a consensual way that fosters the rights of all parties within the rules of international law and humanitarian justice.


"
