,src,lang,text
0,"











Стефка Костадинова е на седмото небе, вдига сватба
Легендарната лекоатлетка много скоро официално ще стане свекърва

05 Nov 2019




Шефката на БОК Стефка Костадинова се стяга за сватба. Легендарната лекоатлетка много скоро официално ще стане свекърва, тъй като синът й от първия й брак – 24-годишният Николай, има сериозна приятелка.
Избраницата му се казва Мария и е модел. Двамата били заедно от доста време и обичаи да обикалят романтични дестинации из целия свят.
Winbet - на един клик разстояние! (18+)54-годишната Стефка нямала нищо против да стане баба и одобрявала избора на Николай. След като не успя да сбъдне мечтата си да стане майка повторно, Костадинова щяла да даде цялата си любов на внучето, пише ""Уикенд"".Преди години тя преживя битов инцидент, заради който загуби второто си дете - от настоящия й съпруг Николай Попвасилев. Освен детето обаче Стефка загуби и шанса да забременее повторно.„Бях бременна в шестия месец и претърпях тежък инцидент. И дотам с мечтите ми за второ дете. Не успях да зачена повече”, признавала е Стефка.
Затова и нямала търпение да гушне внуче, след като ожени сина си. Със сигурност обаче неговата сватба трудно ще задмине по пищност втората венчавка на майка му преди 12 години в морския курорт „Елените”.


",bg,"











Stefka Kostadinova is in the seventh heaven, raising a wedding
The legendary female athlete will officially become a mother-in-law very soon

05 Nov 2019




BOC chief Stefka Kostadinova is getting tight for a wedding. The legendary female athlete is about to formally become a mother-in-law, as her son from her first marriage, 24-year-old Nikolai, has a serious girlfriend.
His name is Maria and he is a model. The two have been together for a long time, and they like to travel romantic destinations all over the world.
Winbet - One Click Away! (18+) 54-year-old Stefka did not mind becoming a grandmother and endorsed the election of Nikolai. After failing to fulfill her dream of becoming a mother again, Kostadinova would give all her love to her granddaughter, writes Weekend. However, in addition to the child, Stefka lost the chance to become pregnant again. ""I was six months pregnant and had a serious accident. And so with my dreams of having a second child. I couldn't conceive anymore, ”Stefka admitted.
That's why she couldn't wait to choke on her grandson after he married his son. For sure, however, his wedding will hardly surpass the pomp of his mother's second wedding 12 years ago at the seaside resort of Elenite.


"
