,src,lang,text
0,"











מנכ""ל מאוחדת לשעבר: ""כשהבנתי שגובה הגירעון הוא 485 מיליון, רתחתי""
בראיון ראשון אחרי פרסום דו""ח הבדיקה על המחדל הכספי בקופ""ח מאוחדת, מי שעמד בראשה, זאב וורמברנד, יורה לכל הכיוונים: מגלגל אחריות על מ""מ סמנכ""ל הכספים, תוקף את האוצר ומבקר גם את המנכ""לית החדשה
05 Nov 2019 by אדריאן פילוט
פער של 160 מיליון שקל בחישוב הגירעון – זה מה שדרדר את קופת החולים מאוחדת למצבה האנוש כיום אם תשאלו את המנכ""ל לשעבר, זאב וורמברנד.
לפני כחצי שנה נקלע וורמברנד לעין הסערה, כאשר התברר כי הגירעון של קופת החולים בראשה עמד בשש השנים האחרונות הגיע ל־490 מיליון שקל, במקום 300-330 מיליון שקל בתכנון המקורי. הגירעון העמיק גם אחרי שהקופה חתמה על הסכם ייצוב - חבילת סיוע ממלכתית שהיתה מבוססת על גירעון נמוך.


קופת חולים מאוחדת צילום: צביקה טישלר

במשרד האוצר לא היו סלחניים כלפי מצד הקופה ואף רמזו לחוסר תום לב מצד וורמברנד ודרשו חקירה של הארוע. אתמול פרסמה ועדת הביקורת מטעם מאוחדת את הבדיקה. וורמברנד לא יצא נקי לגמרי, אך האמרות על חוסר תום לב ירדו מהפרק וכן נקבע כי הוא לא היה לבד. כעת, בראיון ראשון מאז התפוצצה הפרשה מספר וורמברנד ל""כלכליסט"" איך נראית ה""תקלה"" מהעיניים שלו.
בלעדי דו""ח משרד הבריאות: מכבי מובילה, הקטנות בסכנה מסמך בנוגע למעבר בין קופות החולים ב-2019 חושף: לאומית היא שיאנית בעזיבת מבוטחים. גם מספר העוזבים את מאוחדת הגיע לשיא של כל הזמנים השנה - ליותר מ-11 אלף נטו בקצב של 4.4%

איפה טעית?

""הטעות המרכזית שלי היתה לחשוב שאני יכול לעשות מהלך התייעלות בארבעה חודשים לפני סוף הקדנציה שלי. זו היתה טעות גדולה. הייתי בחודשים האחרונים שלי בתפקיד ולמרות הדומיננטיות שלי, חלק מחברי הנהלה ידעו שאני לא אהיה שם בעוד חצי שנה. אבל אני לוקח את זה על עצמי. האשמה היא שלי"".

יש לך ביקורת כלפי היו""ר, אייל גבאי?

""אין לי טענות כלפי הדירקטוריון ולא כלפי היו''ר, זאת למרות שהיה לי קשה לממש את תוכניות התייעלות. גבאי ידע את מה שאני ידעתי כל הזמן, בזמן אמת. האחראיות ליישם, היתה שלי. אין לי טענה כלפיו שהיה לי קשה לממש את התוכניות. כתוצאה מהדו""ח, הדירקטוריון יצטרך להפיק לקחים לעתיד ולהיות יותר אקטיבי"".

כתוב בדו""ח שהדירקטוריון איבד בך אמון ככל שהתקדמה 2018 והגירעון גדל.

""אני לא מקבל את זה. הדירקטוריון הקשיב לי עד הדקה האחרונה"".


זאב וורמברנד. ""איפה טעיתי? חשבתי שאוכל לצאת למהלך התייעלות רגע לפני סוף הקדנציה"" צילום: עמית שעל

וורמברנד אולי לוקח את מלוא הביקורת בנושא תוכנית ההתייעלות עליה חתם רגע לפני פרישתו, אך לדבריו ה""באג"" האמיתי היה סביב הסכם הייצוב של מאוחדת ל־2019-2017, שבו נקבע כי הממשלה תזרים לקופה 540 מיליון שקל כדי לייצב את הגירעון שלה, עליו חתם וורמברנד בנובמבר 2018. בדיעבד, אומר וורמברנד, החריגה בתקציב היתה גדולה משנאמר לו כשחתם.

רועי בן משה, מ""מ סמנכ""ל הכספים התריע בזמן אמת על גידול עקבי בגירעון.

""אני חשבתי שתוכניות ההתייעלות יביאו תוצאה, ושניתן לעמוד בגירעון של 300 עד 330 מיליון שקל. חשבתי שונה ממנו. שנינו ניזונו מאותם נתונים אבל אני הייתי יותר אופטימי לגבי התוצאות. האמנתי שבגירעון כזה ניתן ליישם את הסכם הייצוב שאני מוביל, למרות שהוא קשה. התקלה היתה בינואר 2019 כאשר הוא הודיע לי שיש קפיצה נוספת־ ל־485 מיליון שקל. על זה רתחתי. השתגעתי. הבנתי מיד שאנו נמצאים בסרט אחר. לו ידעתי שזו החריגה, לא הייתי חותם על ההסכם כמו שלא חתמתי על הסכם הייצוב הראשון שדיבר על 440 מיליון שקל. הכל היה בנוי על 330 מליון שקל — התקציב, ההסכם. כלומר, שב־2019 היינו אמורים להישאר עם 150 מיליון שקל ולהדק חזק את החגורה, אבל זה היה מתכנס. זה קרה 10 ימים לפני עזיבתי וזה קרה בגלל חוסר מקצועיות של ממלא מקום סמנכ""ל הכספים"".

זו לא היתה טעות מצדך לחתום על הסכם הייצוב? בלתי אפשרי לעמוד בו.

""לא. גם היום הייתי חותם על ההסכם. היתה דילמה ענקית. כשעושים הסכם ייצוב לשלוש שנים וחותמים עליו לאחר שנתיים זה קצת לא הוגן לחתום, כי אני מכתיב את התנאים למנכ""ל שייכנס. היה די צפוי שכל מנכ""ל שיבוא ימצא דרך להגיד שההסכם לא מספיק טוב, כדי לבקש עוד כסף או לטעון כי הוא לא ניתן למימוש, במיוחד כאשר היה ברור שההסכם מחייב מימוש נכסים בהיקף 80-60 מיליון שקל ב־2019 והפחתת הוצאות של כ־25%. המבחן שלי היה פשוט: האם הייתי חותם על ההסכם לו הייתי נשאר? התשובה שלי היא כן. לעולם לא אחתום על הסכם שאני לא יכול לעמוד בו"".

ואחרי שמ""מ סמנכ""ל הכספים הודיע על הקפיצה הנוספת בגירעון – מה קרה?

""הוא בא אלי להתפטר. לשים מפתחות. אני ביקשתי להעביר אותו תפקיד, אבל נתתי לו גיבוי. אני אוהב מנהלים שהם ""סוסים דוהרים"", אחרת אתה לא מצליח. החלטנו להזיז אותו אבל לא לפטר. אני מנהל שאומר שאם יש טעויות בתום לב, אני נותן גיבוי מלא"".

באוצר טענו לחשש לפלילים, חוסר תום לב, אשמות ממש חמורות. כנראה שהצלחת ממש לעצבן אותם.

""אני רואה את השימוש במילים האלו כחצוף. הוא מעיד על המצוקה שאגף התקציבים נמצא בו. האמירות שלהם רק יזיקו להם, כי כאשר הם ירצו לחתום על עוד הסכמים עם קופות אחרות הם יתקשו מאוד"".

כאשר אתה מסתכל היום על הקופה שבנית ב־10 אצבעות, מה אתה מרגיש?

""קראתי שיש גידול משמעותי בקצב עזיבת המבוטחים וזה סימן רע מאוד. מאוחדת ידעה לבלום עזיבה. היום כאשר מספר העזיבות חצה את ה־10,000 נטו – זה דגל אדום וזה חמור מאוד"".


",iw,"











Former United CEO: ""When I realized the deficit was $ 485 million, I was furious""
In the first interview following the release of the financial deficit examination report at Unified Health Fund, the head of the company, Ze'ev Wurembrand, fires in all directions: rolls responsibility for the CFO, attacks the treasury and also criticizes the new CEO
05 Nov 2019 by Adrian Pilot
A NIS 160 million gap in the deficit calculation - that's what degrades the HMO to its human condition today if you ask former CEO Ze'ev Wurembrand.
About six months ago, Wurembrand caught the eye of the storm, when it became clear that the deficit of the sick fund at its head in the last six years had reached NIS 490 million, instead of NIS 300-330 million in the original plan. The deficit deepened even after the fund signed a stabilization agreement - a state aid package that was based on a low deficit.


United health fund Photo: Zvika Tischler

The Treasury was not forgiving of the coffers and even hinted at Wembrandt's bad faith and demanded an investigation into the incident. Yesterday the United Nations Audit Committee released the review. Warbrand did not come out completely clean, but the allegations of bad faith went down and he was not alone. Now, in his first interview since the episode, Warbrand told the Calcalist that what the ""malfunction"" of his eyes looked like.
Exclusive Ministry of Health report: Maccabi leader, in danger of losing a document on the transition between the HMOs in 2019 reveals: Leumi is peaking at the departure of policyholders. %

Where did you go wrong?

""My main mistake was thinking that I could make a streamlining move four months before the end of my term. It was a big mistake. In my last months in office and despite my dominance, some members of management knew I wouldn't be there in six months. But I take it on Myself. The blame is mine. ""

Do you have any criticism of the chairman, Eyal Gabay?

""I have no allegations against the board of directors nor against the chairman, even though it was difficult for me to implement the efficiency plans. Gabay knew what I knew all the time, in real time. Responsibility to implement, was mine. I have no allegation to him that I had difficulty implementing The plans. As a result of the report, the board will have to learn lessons for the future and be more active. ""

The report states that the board has lost confidence in you as 2018 progresses and the deficit grows.

""I don't get it. The board listened to me until the last minute.""


Wolf Wembrand. ""Where did I go wrong? I thought I could make a streamlining move just before the end of my tenure""

Warbrand may have taken full criticism of the streamlining plan he signed just before his retirement, but said the real ""bug"" was around the United States stabilization agreement for 2019, which states that the government will inject NIS 540 million in cash to stabilize its deficit, Warbrand signed in November 2018. In retrospect, Warbrand says, the budget deviation was greater than he was told when he signed.

Roy Ben Moshe, CFO, alerted in real time to a consistent increase in the deficit.

""I thought the efficiency plans would bring about a deficit of NIS 300 to $ 330 million. I thought different from him. We were both fed by the same data, but I was more optimistic about the results. Was in January 2019 when he informed me that there is another jump to NIS 485 million. I was furious about it. I went crazy. I realized immediately that we were in another movie. If I knew it was the exception, I would not sign the agreement as I did not sign the first stabilization agreement that talked about 440 NIS million, everything was built at NIS 330 million - the budget, the agreement, which means that in 2019 we were supposed to stay with 150 Million and tightened the belt tight, but it was converges. It was 10 days before I left and it happened because of the lack of professionalism of Acting CFO. ""

Wasn't it a mistake for you to sign the Stabilization Agreement? Impossible to stand.

""No. Even today I would sign the agreement. There was a huge dilemma. When you do a three-year stabilization agreement and sign it after two years, it's a little unfair to sign, because I dictate the terms for the CEO to enter. It was expected that every CEO who came would find a way to say that the agreement was not good enough, to ask for more money or to claim that it was unenforceable, especially when it was clear that the agreement would require NIS 80-60 million in real estate in 2019 and reduce spending by about ""My test was simple: would I sign the agreement if I stayed? My answer is yes. I will never sign an agreement that I cannot abide by.""

And after the CFO announced the extra jump in the deficit - what happened?

""He came to me to resign. To put keys in. I asked to transfer him a role, but I gave him backing. I like managers who are"" galloping horses "", otherwise you can't. We decided to move him but not fire. I am a manager who says that if there are mistakes in good faith, I give full backup. ""

In the treasury, they feared criminal charges, bad faith, really serious charges. You probably managed to annoy them.

""I see the use of these words as rude. It indicates the distress that the budget department is in. Their statements will only hurt them, because when they want to sign more agreements with other funds they will find it very difficult.""

When you look at the box office you built with 10 fingers today, what do you feel?

""I read that there was a significant increase in the rate of departures, which is a very bad sign. United knew how to block a departure. Today when the number of departures crossed the 10,000 net, it is a red flag and it is very severe.""


"
