,src,lang,text
0,"











קרקע במרכז תל אביב לבניית אלפי מ""ר מסחר תוצע למרבה במחיר
בית המשפט הורה על הליך פירוק שיתוף במגרש במתחם סומייל באמצעות מכירתו למרבה במחיר, ומינה לו כונסי נכסים. במגרש זכויות בנייה ל-38 דירות ו-3,000 מ""ר שטחי מסחר. לאפריקה מגורים ולקבוצת חג'ג' אינטרסים במקום
05 Nov 2019 by שלומית צור
בית משפט השלום בתל אביב הורה על פירוק שיתוף נוסף המצוי במתחם סומייל שבמרכז תל אביב. מדובר במגרש בן 3.1 דונם, המצוי בצומת הרחובות אבן גבירול וז'בוטינסקי, המיועד להקמת 38 דירות ו-3,000 מ""ר שטחי מסחר.
כמה מבעליו של המתחם, המחזיקים במשותף ב-35% מזכויות הבנייה בו ושואפים לממש אותן, הגישו באמצעות עוה""ד שמואל שוב, הילה לביא ואלון קרביצקי ממשרד שוב ושות', תביעה לפירוק שיתוף בדרך של מכירתו למרבה במחיר. על פי ההערכות גם לקבוצת חג'ג' וגם לאפריקה מגורים שמחזיקות במגרשים סמוכים, עשוי להיות עניין מיוחד ברכישה.


מתחם סומייל צילום: תומי הרפז

חלק מבעלי הזכויות האחרים השותפים במגרש, התנגדו לתביעה מטעמים שונים וביקשו לעכב את הליכי פירוק השיתוף במגרש. בין היתר טענו המתנגדים כי לא ניתן לפרק את השיתוף במגרש, מאחר וחלק מהקרקע תפוסה על ידי מחזיקים שונים ויש להמתין עד שאלו יפונו. בנוסף טענו חלק מהמתנגדים שיש לפרק את השיתוף בדרך של בניית הבניין וחלוקת הדירות בו. השופט יגאל נמרודי הורה אתמול (ב') על פירוק השיתוף בדרך של מכירה ומינה את עוה""ד שי רוה ובועז רוה, ככונסי נכסים שיפעלו למכירת המגרש. בית המשפט הוסיף כי לא ניתן להורות על פירוק שיתוף באמצעות חיוב שותף להצטרף לעסקת הבנייה, שכן משמעות הדבר היא - יצירת שיתוף, ולא פירוק שיתוף. בכל הנוגע למחזיקים בקרקע קבע בית המשפט כי אין בעובדה זו למנוע פירוק שיתוף ובמסגרת הליך המכר, יידרש כונס הנכסים לסקר מחזיקים, כך שאם לא יבוצע הפינוי על ידי בעליו, יופחת חלקו בתמורה. בית המשפט אף השית הוצאות על בעלי הזכויות שהתנגדו להליך פירוק השיתוף. מתחם סומייל בתל אביב מחולק לשני חלקים - צפון ודרום, ובהם מתוכננים ארבעה מגדלי מגורים בני 50 קומות, ומספר בניינים מרקמיים. במתחם הדרומי, נמכרו עד כה שני מגרשים לבניית שני מגדלי מגורים בני 50 קומות, שבאחד מחזיקה קבוצת חג'ג' ובשני אפריקה מגורים. במתחם הצפוני מספר מגרשים, שאחד מהם הוא המגרש לגביו ניתנה אתמול ההחלטה. במגרש נוסף במתחם הצפוני מחזיקה קבוצת חג'ג', ומגרש נוסף מצוי אף הוא בהליך פירוק שיתוף, כאשר גם קבוצת חג'ג' וגם אפריקה מגורים מחזיקות בזכויות במגרש, ובקרוב תיערך התמחרות בין הצדדים.


",iw,"











Land in the center of Tel Aviv for the construction of thousands of square meters of commercial space will be offered at a great price
The court ordered a disassembly of a lot in the Somale complex by selling it at a price, and appointing him a property receipt. Building rights plot for 38 apartments and 3,000 square meters of commercial space. Africa Residential and Hajj Group interests
05 Nov 2019 by Shlomit Tzur
The Tel Aviv Magistrate's Court ordered the dismantling of another co-operation located in the Somale complex in central Tel Aviv. This is a 3.1-acre lot, located at the intersection of Ibn Gvirol and Jabotinsky Streets, for the construction of 38 apartments and 3,000 square meters of commercial space.
Some of the owners of the complex, who jointly own 35% of the construction rights therein and strive to exercise them, filed a lawsuit with attorney Shmu again, Hila Lavi, and Alon Kravitzky from the Sheva & Co. office, demanding a joint dissolution by way of sale at a much higher price. C and for Africa residential that hold adjacent lots may be of particular interest in purchasing.


Somale compound Photo: Tommy Harpaz

Some of the other rights-sharing partners in the lot objected to the claim on various grounds and sought to delay the dissolution of the sharing dissolution in the lot. Among other things, the opponents argued that the sharing in the lot could not be disassembled, since some of the land was occupied by various holders and should wait until they were evacuated. In addition, some of the opponents argued that the sharing should be dismantled in the way of building the building and dividing the apartments therein. Justice Yigal Nimrodi on Monday ordered the dissolution of the sale by way of sale and appointed Attorney Shai Roe and Boaz Roe, as asset lenders to sell the lot. The court added that a co-liquidation could not be ordered through a joint charge to join the construction deal, since That is - creating a share, not a dissolution of shares. As far as the holders of the land are concerned, this fact does not prevent the dissolution of a share, and in the context of the sale process, the receiver must be required to hold a survey, so that if the owner is not evicted, his share will be reduced in return. Raise expenses on rights holders who objected to the dissolution process. The Somalil complex in Tel Aviv is divided into two parts. - North and South, with four 50-storey residential towers and a number of textured buildings, have been sold in the southern complex to date for the construction of two 50-story residential towers, one of which is owned by the Hajj Group and two of Africa's residential complexes. Another plot in the northern complex holds a Hajj group, and another plot is also undergoing a joint dissolution process, with both the Hajj and Africa Residential holding rights in the lot, and competition will soon take place between the parties.


"
