,src,lang,text
0,"











Hacienda recortó las expectativas de crecimiento para 2019
Ignacio Briones aseguró que la economía chilena tendrá ""un cuarto trimestre malo"".
05 Nov 2019 by Francisco Espinoza
El ministro de Hacienda, Ignacio Briones, corrigió a la baja las estimaciones de crecimiento para la economía chilena y aseguró que esperan “un cuarto trimestre malo”, principalmente por el efecto de las protestas sociales.
""Nuestra proyección es que durante el cuarto trimestre la economía chilena debiera crecer en torno al 1,5 %, de manera tal de cerrar el año con un crecimiento en torno al 2,0%, que es 0,6 puntos menor que la estimación central que existía"", dijo el secretario de Estado ante la comisión mixta de presupuesto.
Briones informó que las nuevas estimaciones de crecimiento fluctúan entre el 2,2 y el 1,8%.
Para 2020, redujo las expectativas de 3% a 3,5% a un rango entre 2% y 2,5%, centrado en 2,3%.


",es,"











Treasury cut growth expectations for 2019
Ignacio Briones said that the Chilean economy will have ""a bad fourth quarter.""
05 Nov 2019 by Francisco Espinoza
The Minister of Finance, Ignacio Briones, corrected downward the growth estimates for the Chilean economy and said they expect ""a bad fourth quarter"", mainly due to the effect of social protests.
""Our projection is that during the fourth quarter the Chilean economy should grow by around 1.5%, so as to close the year with growth around 2.0%, which is 0.6 points lower than the estimate central that existed, ""said the secretary of state before the mixed budget commission.
Briones reported that the new growth estimates fluctuate between 2.2 and 1.8%.
By 2020, it reduced expectations from 3% to 3.5% to a range between 2% and 2.5%, focusing on 2.3%.


"
