,src,lang,text
0,"











Datang ke RI, Menteri Perdagangan AS Wilbur Ross Bawa 6 Misi
04 Nov 2019, 09:22 by Fajar Pebrianto, Rr. Ariyani Yakti Widyastuti
TEMPO.CO, Bangkok - Menteri Perdagangan Amerika Serikat, Wilbur Ross akan memimpin delegasi bisnis dari negaranya untuk bertandang ke Indonesia. Sejumlah misi dibawa oleh Ross, mulai dari misi dagang hingga bantuan terhadap Indonesia dalam upaya memberantas kejahatan korupsi.
“Besok saya akan ke Indonesia, lalu Vietnam, untuk melanjutkan upaya kami meningkatkan perdagangan dan peluang investasi bagi perusahaan-perusahaan Amerika Serikat,” kata Ross dalam pidatonya pada ajang Indo Pacific Business Forum, Senin, 4 November 2019.
Kunjungan Ross ini dilakukan setelah dirinya hadir dalam ajang Indo-Pacific Business Forum di Bangkok, Thailand. Dalam acara ini, sejumlah kerja sama diteken antara perusahaan Amerika dengan perusahaan Thailand, dan pemerintah sejumlah negara Indo-Pasifik. Selain Indonesia, Ross pun juga akan membawa rombongan ke Vietnam.
Lebih lanjut, dalam keterangan dari Departemen Perdagangan Amerika, terdapat enam misi yang dibawa oleh rombongan pimpinan Ross nantinya. Keenam misi tersebut menggambarkan komitmen Amerika untuk melanjutkan kerja sama ekonomi dengan Indonesia, maupun Vietnam, dan mendukung tujuan bisnis dari perusahaan-perusahaan Amerika.
Keenam misi tersebut yaitu pertama, membantu perusahaan Amerika Serikat mengidentifikasi mitra yang potensial dan strategis. Tujuannya agar perusahaan dari Amerika bisa memperoleh akses terhadap pasar di Indonesia.
Kedua, membantu terciptanya proses bisnis yang adil, terbuka, dan transparan di Indonesia agar perusahaan Amerika bisa memperoleh peluang yang sama untuk berkompetisi dengan perusahaan lain. “Dan memenangkan beberapa kontrak bisnis yang penting, baik publik maupun swasta,” tulis pihak Departemen Keuangan.
Ketiga, mendukung aktivitas bisnis dari perusahaan di Indonesia dan menyediakan akses terhadap pembuat kebijakan di pasar Indonesia. Keempat, mendengarkan kebutuhan, saran, dan pengalaman dari para delegasi bisnis Amerika.
Kelima, mengorganisir pertemuan dengan perusahaan lokal di Indonesia sebagai mitra dan klien dari perusahaan Amerika, Lalu yang kelima yaitu membantu perusahaan Amerika mengembangkan strategi dan akses pasar dari para pemimpin di sektor publik dan swasta di Indonesia.
Sebagai tambahan selain dari tujuan perdagangan, Departemen Perdagangan Amerika juga menjelaskan bahwa fokus dari delegasi yang dipimpin Ross adalah untuk mewujudkan President’s Indo-Pacific Transparency Initiative. “Untuk membantu negara mitra memberantas korupsi, mempromosikan rule of law, dan penguatan institusi pemerintahan.”
Kepala Biro Humas Kementerian Perdagangan Olvy Andrianita membenarkan ihwal kedatangan Ross ke Indonesia. Menurut dia, Menteri Perdagangan Agus Suparmanto dan sejumlah pejabat Menteri Koordinator Bidang Perekonomian juga direncanakan akan melakukan pertemuan khusus dengan Ross pada Rabu, 6 November 2019. “Rencananya iya,” kata Olvy.


",id,"











Coming to RI, US Secretary of Commerce Wilbur Ross Bring 6 Missions
Nov 04 2019, 09:22 by Fajar Pebrianto, Rr. Ariyani Yakti Widyastuti
TEMPO.CO, Bangkok - US Trade Minister Wilbur Ross will lead a business delegation from his country to travel to Indonesia. A number of missions were brought by Ross, ranging from trade missions to assistance to Indonesia in efforts to eradicate corruption.
""Tomorrow I will go to Indonesia, then Vietnam, to continue our efforts to increase trade and investment opportunities for US companies,"" Ross said in his address at the Indo Pacific Business Forum, Monday, November 4, 2019.
Ross's visit was made after he attended the Indo-Pacific Business Forum in Bangkok, Thailand. In this event, a number of collaborations were signed between American companies and Thai companies, and the governments of a number of Indo-Pacific countries. Besides Indonesia, Ross will also bring his entourage to Vietnam.
Furthermore, in a statement from the American Department of Commerce, there are six missions brought by the group led by Ross later. The six missions illustrate America's commitment to continue economic cooperation with Indonesia and Vietnam, and support the business goals of American companies.
The six missions are first, to help US companies identify potential and strategic partners. The goal is that companies from America can gain access to markets in Indonesia.
Second, it helps create fair, open and transparent business processes in Indonesia so that American companies can get the same opportunities to compete with other companies. ""And won several important business contracts, both public and private,"" wrote the Ministry of Finance.
Third, support the business activities of companies in Indonesia and provide access to policy makers in the Indonesian market. Fourth, listen to the needs, suggestions, and experiences of American business delegates.
Fifth, organize meetings with local companies in Indonesia as partners and clients of American companies, then the fifth is to help American companies develop strategies and market access from leaders in the public and private sectors in Indonesia.
In addition to the trade objectives, the US Department of Commerce also explained that the focus of the delegation led by Ross was to realize the President's Indo-Pacific Transparency Initiative. ""To help partner countries eradicate corruption, promote rule of law, and strengthen government institutions.""
The Head of the Ministry of Trade's Public Relations Bureau Olvy Andrianita confirmed Ross's arrival in Indonesia. According to him, Minister of Trade Agus Suparmanto and a number of Coordinating Minister for Economic Affairs officials were also planned to hold a special meeting with Ross on Wednesday, November 6, 2019. ""The plan is yes,"" Olvy said.


"
