,src,lang,text
0,"











Rechnungshof rügt Digitalisierungsprojekt der Bundeswehr
Mehr als 170 Millionen Euro will die Bundeswehr für Zehntausende Laptops ausgeben - damit die Soldaten mobil arbeiten können. Allerdings bleiben die Rechner noch lange offline - der Rechnungshof übt harsche Kritik.
06 Nov 2019, 05:58 by Matthias Gebauer
Der Bundesrechnungshof hat ein millionenschweres Paket zur Digitalisierung der Bundeswehr als weitgehend wirkungslos bezeichnet. In einem vertraulichen Bericht vom 25. Oktober schreiben die Prüfer, das Verteidigungsministerium habe seinen Plan zur Anschaffung von Zehntausenden neuen Laptops für rund 173 Millionen Euro ""weder konzeptionell abgeleitet noch dokumentiert"". Zudem würden durch interne Fehlplanungen auch nach der Anschaffung der Rechner kaum mehr Soldaten als bisher mobil arbeiten können. Der 21-seitige Bericht liegt dem SPIEGEL vor.
Die Kritik des Rechnungshofs bezieht sich auf eine sogenannte 25-Millionen-Vorlage des Ministeriums, über die der Haushaltsausschuss des Bundestags am Mittwoch beraten sollte. In dem umfangreichen Paket zur Finanzierung des bundeseigenen IT-Dienstleisters BWI findet sich unter anderem der Plan, 61.000 neue Laptops für die Bundeswehr einzukaufen und so die Zahl von mobilen Rechnern auf 110.000 zu erhöhen. Dies sei ""zur Realisierung eines sukzessiven Übergangs zu einer mobilen IT-Ausstattung"" nötig, bis 2023 sollten letztlich alle Soldaten mobil arbeiten können.

Faktisch kann nur ein Fünftel der Soldaten mobil arbeiten

Die Prüfer haben sich das Projekt, das die frühere Verteidigungsministerin Ursula von der Leyen angestoßen hatte, genauer angesehen und erhebliche Fehlplanungen entdeckt. So fanden sie heraus, dass trotz der Laptop-Offensive auch in den kommenden Jahren kaum mehr Soldaten als bisher mobil arbeiten können. Der Grund sind die limitierten Zugänge zum gesicherten Intranet der Bundeswehr, über das Soldaten beispielsweise Mails abrufen oder Zugang zu eingestuften Planungsunterlagen oder bestimmten Projektgruppen bekommen können.
Die von den Prüfern recherchierten Zahlen sind eindeutig. So will die Bundeswehr zwar die Zahl an mobilen Endgeräten, die sich über einen ""Remote Access Service"" ins geschützte Intranet einloggen können, in den nächsten Jahren auf insgesamt 60.000 erhöhen. Trotzdem, so der Rechnungshof, könnten von den dann 110.000 mobilen Rechnern nur maximal 12.000 Rechner gleichzeitig auf das Intranet zugreifen. Dass faktisch nur ein Fünftel der Soldaten mobil arbeiten kann, so die Prüfer, habe das Ministerium bei den Cyber-Planungen ""nicht ausreichend berücksichtigt"".
Geht es nach den Prüfern, ist der Erfolg der Kampagne durch die Fehlplanungen akut gefährdet. Wörtlich schreiben die Prüfer, die Bundeswehr gerate durch die Limitierung beim Zugang zum Intranet in eine Art IT-Mangelwirtschaft, da man den Intranet-Zugang ""aufwendig koordinieren muss"". Das Urteil der Experten: ""Auch wenn das Ministerium mit seinem Ansatz eigentlich die Attraktivität des Arbeitgebers Bundeswehr steigern will, kann die Mangelwirtschaft das Gegenteil bewirken.""

""Völlig konzeptlos""

Die Reaktion aus dem Ministerium illustriert indes die antiquierte Sicht des Hauses auf die digitale Welt. So rechtfertigte das Ressort seine Pläne mit dem Hinweis, die Soldaten könnten ja innerhalb der Kasernen der Bundeswehr fast immer auf das geschützte Intranet der Truppe zugreifen. Für das mobile Arbeiten zu Hause sei es zudem möglich, ""mit zuvor lokal abgespeicherten Daten offline zu arbeiten"". Der Rechnungshof schreibt dazu nüchtern, dieser Ansatz des Wehrressorts erfülle ""nicht den Anspruch an eine moderne und leistungsfähige mobile IT-Ausstattung"".
Die Kritik an dem Laptop-Ankauf ist nicht die einzige Rüge. So peilt das Ministerium an, die Zahl der mobilen Arbeitsplätze bis 2023 auf 240.000 zu erhöhen. Der Rechnungshof merkt dazu an, das Ministerium habe nicht dargelegt, ""warum es einen solchen Übergang zu einer mobilen IT-Ausstattung für erforderlich hält und wie es diesen gestalten will"". Bei den Plänen handele es sich um rein ""strategische Überlegungen"". Laut den Prüfern bestehe deswegen das Risiko, ""dass das Ministerium am eigentlichen Bedarf vorbeiplant und unwirtschaftlich beschafft"".
Im Haushaltsausschuss sorgte der vertrauliche Prüfbericht bereits für erhebliche Unruhe. Auf Drängen der SPD wurde das Thema nach SPIEGEL-Informationen spontan wieder von der Tagesordnung für diese Woche genommen, da die Haushälter noch erheblichen Klärungsbedarf zu der Vorlage sehen. Von den Grünen kam ebenfalls harsche Kritik. Haushälter Tobias Lindner sagte: ""Die Bundeswehr ist offenbar völlig konzeptlos, wenn es darum geht, die IT-Ausstattung der Truppe zu modernisieren.""


",de,"











Court of Auditors complains digitization project of the Bundeswehr
The German Armed Forces wants to spend more than 170 million euros on tens of thousands of laptops so that the soldiers can work mobile. However, the computers remain offline for a long time - the Court of Auditors is harsh criticism.
06 Nov 2019, 05:58 by Matthias Gebauer
The Federal Court of Auditors has described a million-euro package to digitize the Bundeswehr as largely ineffective. In a confidential report dated October 25, the examiners write that the Ministry of Defense has ""neither conceptually derived nor documented"" its plan for the purchase of tens of thousands of new laptops for around 173 million euros. In addition, internal maladministration would mean that even after acquiring the computers hardly any more soldiers would be able to work than before. The 21-page report is available to SPIEGEL.
The Court of Auditors' criticism refers to a so-called 25-million submission by the Ministry, which should be discussed by the Budget Committee of the Bundestag on Wednesday. Among other things, the plan to buy 61,000 new laptops for the Bundeswehr and thus increase the number of mobile computers to 110,000 is included in the comprehensive package for financing the state-owned IT service provider BWI. This was necessary ""for the realization of a gradual transition to a mobile IT equipment"", until 2023 finally all soldiers should be able to work mobile.

In fact, only a fifth of soldiers can work mobile

The auditors took a closer look at the project initiated by former Defense Minister Ursula von der Leyen and discovered significant planning errors. So they found out that in spite of the laptop offensive hardly more soldiers can work in the coming years than before. The reason for this is the limited access to the secure intranet of the Bundeswehr, through which soldiers can, for example, retrieve mails or gain access to classified planning documents or specific project groups.
The numbers researched by the examiners are clear. For example, the Bundeswehr intends to increase the number of mobile devices that can log into the protected intranet via a ""remote access service"" in the coming years to a total of 60,000. Nevertheless, according to the audit office, of the then 110,000 mobile computers, only a maximum of 12,000 computers could access the intranet at the same time. The fact that only one-fifth of the soldiers can actually work mobile, according to the examiners, was ""insufficiently taken into account"" by the ministry in its cyber plans.
If it goes by the examiners, the success of the campaign by the misplanning is acutely endangered. Literally, the auditors write that the Bundeswehr is limited by access to the intranet into a kind of IT-scarcity economy, since one must ""coordinate the intranet access"" consuming. The verdict of the experts: ""Even if the ministry with its approach actually wants to increase the attractiveness of the employer Bundeswehr, the economy of shortage can cause the opposite.""

""Completely without concept""

The response from the ministry illustrates the house's antiquated view of the digital world. Thus, the resort justified its plans by pointing out that the soldiers could almost always access the protected Intranet of the troops within the Bundeswehr barracks. For mobile work at home, it is also possible to ""work offline with previously stored data."" The Court of Auditors soberly writes that this approach of the Wehrressort ""does not meet the demand for a modern and efficient mobile IT equipment"".
The criticism of the laptop purchase is not the only complaint. The ministry is aiming to increase the number of mobile workplaces to 240,000 by 2023. The Court of Auditors notes that the ministry has not stated ""why it considers such a transition to mobile IT equipment necessary and how it intends to shape it"". The plans are purely ""strategic considerations"". Therefore, according to the examiners, there is a risk that ""the ministry will provide for the actual needs by-passing and uneconomic"".
In the Committee on Budgets, the confidential audit report has already caused considerable unrest. At the insistence of the SPD, the topic was spontaneously removed from the agenda for this week, according to SPIEGEL information, as the householders still see considerable need for clarification on the submission. The Greens also received harsh criticism. Housekeeper Tobias Lindner said: ""The Bundeswehr is apparently completely devoid of concept when it comes to modernizing the IT equipment of the troops.""


"
