,src,lang,text
0,"











750 optredens door de hele stad tijdens Rotterdamse Popweek

01 Nov 2019, 10:26



Foto: Samuel Dixon / Unsplash



Willem Philipsen van de Popunie over de Rotterdamse Popweek

De zevende editie van de Rotterdamse Popweek gaat vrijdag van start. In tien dagen wordt met 750 optredens laten zien wat Rotterdam op het gebied van popcultuur allemaal te bieden heeft, van pop tot hiphop en van jamsessies tot muziekdocumentaires.
Hoewel het evenement de Popweek wordt genoemd, duurt het spektakel dus langer dan de naam doet vermoeden. ""We doen er gewoon even drie dagen bij, want er is zo veel aanbod in de popscene. Daar heb je gewoon tien dagen voor nodig"", zegt Willem Philipsen van de Popunie.
Die Popunie riep in 2013 de Rotterdamse Popweek in het leven om de popscene in de stad meer in de schijnwerpers te zetten. ""Het is eigenlijk begonnen als een soort positief antwoord op alle negatieve geluiden, zoals dat we geen groot podium in de stad hebben. Dit was eigenlijk de kans om te laten zien wat er allemaal wél is en hoe bloeiend en levendig die scene is.""
Sinds die start is er veel veranderd, zegt Philipsen. ""De hele popsector is weer opgebloeid. We hebben geleerd om de stad in te zetten als podium. We zijn voorbij het feit gegaan dat we geen groot podium hebben, zoals andere steden. Het komt veel meer neer op eigen initiatief en eigen kracht en dat is gewoon heel mooi om te zien.""
Voor elk wat wils
Ook tijdens de komende editie is er door de hele stad wel iets te zien. Gedurende het tien dagen durende evenement zijn er 750 optredens, verdeeld over 225 evenementen die op 125 verschillende locaties in heel Rotterdam plaatsvinden. ""Het is echt van Noord tot aan Hoogvliet. Er is voor iedereen wat wils.""
Vrijdagavond wordt de tiendaagse afgetrapt met een popquiz in Rotown. Daar kijkt Philipsen erg naar uit. ""We hebben dan een mix aan politieke partijen die meequizzen en mensen uit de sector, als organisatoren en artiesten. Iedereen doet mee.""
Zaterdag strijkt het door Nederland rondreizende festival de Popronde neer in Rotterdam, waarbij nieuwe acts uit heel het land zich presenteren op verschillende locaties in de stad. Dinsdag is er in samenwerking met de Erasmus Universiteit een thema-avond in Roodkapje over mental health in de muziekindustrie. ""Dat is wel heel tof"", zegt Philipsen. ""We hebben een panel met professionals die daarover gaat discussiëren.""
Verder staan er onder andere jamsessies en ook de vertoning van Rotterdamse muziekdocumentaires op het programma. Volgens Philipsen moet alles een ding laten zien: ""We mogen trots zijn op de stad.""


",nl,"











750 performances throughout the city during Rotterdam Pop Week

01 Nov 2019, 10:26



Photo: Samuel Dixon / Unsplash



Willem Philipsen from the Popunie about the Rotterdam Popweek

The seventh edition of the Rotterdam Popweek will start on Friday. In ten days, 750 performances show what Rotterdam has to offer in the field of pop culture, from pop to hip hop and from jam sessions to music documentaries.
Although the event is called the Popweek, the spectacle lasts longer than the name suggests. ""We just add three days, because there is so much to offer in the pop scene. You just need ten days for that,"" says Willem Philipsen of Popunie.
Die Popunie created the Rotterdam Pop Week in 2013 to put the pop scene in the city more in the spotlight. ""It actually started as a kind of positive response to all the negative noises, such as that we don't have a big stage in the city. This was actually the chance to show what is there and how flourishing and lively that scene is.""
A lot has changed since that start, Philipsen says. ""The entire pop sector has flourished again. We have learned to use the city as a stage. We have gone beyond the fact that we do not have a large stage like other cities. It comes down much more to our own initiative and our own strength and that is just very beautiful to see. ""
For each his own
There is also something to see throughout the city during the coming edition. During the ten-day event there are 750 performances, divided over 225 events that take place at 125 different locations throughout Rotterdam. ""It is really from North to Hoogvliet. There is something for everyone.""
On Friday evening, the ten-day kick-off will be kicked off with a pop quiz in Rotown. Philipsen is really looking forward to that. ""We then have a mix of political parties that quizzes along with people from the sector, as organizers and artists. Everyone participates.""
On Saturday, the Popronde festival traveling around the Netherlands will land in Rotterdam, with new acts from all over the country presenting themselves at various locations in the city. On Tuesday, in collaboration with Erasmus University, there is a theme evening in Roodkapje about mental health in the music industry. ""That is really cool"", says Philipsen. ""We have a panel of professionals who will discuss this.""
There are also jam sessions and also the screening of Rotterdam music documentaries on the program. According to Philipsen, everything must show one thing: ""We can be proud of the city.""


"
