,src,lang,text
0,"











Жителей Коми призывают поддержать флешмоб ко Дню единства

01 Nov 2019, 10:25

Условия участия простые: сфотографироваться в коми национальном костюме или одежде с традиционными элементами. После этого нужно выложить снимок в социальных сетях с хештегами акции. Одним из первых к флешмобу присоединился глава республики Сергей Гапликов.


Фото vk.com/gaplikovkomi

Флешмоб в соцсетях запустили регионы России в преддверии Дня народного единства. В честь праздника решено организовать акцию, направленную на развитие народных художественных промыслов, а также на вовлечение граждан в дело сохранения традиционной культуры.
Коми также присоединилась к акции. Для участия надо сфотографироваться в национальном костюме или одежде с элементами традиционных фасонов и символов. Можно сделать фото в коми избах или чумах, украсить дом или образ предметами, в которых присутствует душа и самобытность народных промыслов. Снимки нужно опубликовать в социальных сетях с хештегами: #россия, #мыедины, #нхп, #республикакоми, #коми, #мыизкоми.
Одним из первых к акции присоединился Сергей Гапликов. Он опубликовал фотографию с народного праздника, где участники примерили на себя народные костюмы.
- Наше единство и национальная идентичность — это, в первую очередь, сохранение памяти о нашем прошлом и бережное отношение к нашим традициям, - подписал снимок Сергей Гапликов.
Акция будет проходить в социальных сетях до 4 ноября. Организаторы надеются сделать ее ежегодной.


",ru,"











Komi residents are urged to support a flash mob for Unity Day

01 Nov 2019, 10:25

The conditions for participation are simple: take a picture in a Komi national costume or clothing with traditional elements. After that, you need to post a picture on social networks with hashtags of the action. One of the first to join the flash mob was the head of the republic, Sergey Gaplikov.


Photo vk.com/gaplikovkomi

Flashmob in social networks launched the regions of Russia on the eve of National Unity Day. In honor of the holiday, it was decided to organize an action aimed at developing folk art crafts, as well as involving citizens in the preservation of traditional culture.
Komi also joined the action. To participate, you need to take a picture in a national costume or clothing with elements of traditional styles and symbols. You can take a photo in the Komi huts or plague, decorate the house or image with objects in which the soul and originality of folk crafts are present. Pictures must be published on social networks with hashtags: #Russia, #myedins, #nkhp, # republic of Komi, #Komi, #myizkomi.
One of the first to join the action was Sergey Gaplikov. He published a photo from a public holiday, where participants tried on folk costumes.
“Our unity and national identity is, first and foremost, preserving the memory of our past and respecting our traditions,” signed the photograph Sergey Gaplikov.
The promotion will be held on social networks until November 4. The organizers hope to make it annual.


"
