,src,lang,text
0,"











В Нарьян-Маре задержан охранник детсада, в котором убили ребенка

01 Nov 2019, 10:53

Сотрудник частного охранного предприятия, охранявшего детский сад в Нарьян-Маре, где произошло убийство ребенка, задержан, сообщает пресс-служба Следственного комитета России (СКР). Он подозревается в совершении преступления об оказании услуг, не отвечающих требованиям безопасности жизни и здоровья (п. «б» и п. «в» ч. 2 ст. 238 УК РФ).
«Задержан сотрудник ООО ОП ""Святогоръ"", который осуществлял охрану помещений детского сада, но допустил беспрепятственный проход нетрезвого мужчины. Подозреваемый позвонил в домофон, охранник дистанционно, не выходя из комнаты охраны, открыл ему входную дверь, приняв за родителя одного из воспитанников»,— говорится в сообщении. Кроме того, возбуждено уголовное дело из-за халатности (по ч. 2 ст. 293 УК РФ) должностных лиц детского сада «Сказка».
Напомним, 31 октября житель Нарьян-Мара Денис Поздеев зашел в детский сад «Сказка» и, миновав охрану учреждения, принявшую его за отца одного из детей, зашел в комнату, где спали дети, и убил ребенка. Денис Поздеев был задержан на месте преступления, правоохранители заявили, что во время убийства он был пьян. Сам преступник заявил, что совершил убийство после того, как «прочел заклинание в книжке про вечную жизнь». Суд избрал в отношении подозреваемого в убийстве меру пресечения в виде заключения под стражу на два месяца. В ходе допроса Денис Поздеев от дачи показаний отказался.
Губернатор Ненецкого округа Александр Цыбульский поручил провести проверку в детских учреждениях региона. Господин Цыбульский также предложил упростить законодательство для сохранения конкуренции среди охранных агентств, в пользу большего обеспечения безопасности. «По сути, сегодня существует системная проблема, когда на конкурсы выходят частные охранные предприятия, формально имеющие все допуски, а потом вот таким халатным образом выполняющие свои обязанности»,— сказал губернатор.
По распоряжению председателя СКР Александра Бастрыкина в Нарьян-Мар отправлены следователи и эксперты центрального аппарата этого ведомства.

Подробнее читайте в материале “Ъ” «В детский сад запустили убийцу».



",ru,"











In Naryan-Mar, a kindergarten guard was detained in which a child was killed

01 Nov 2019, 10:53

An employee of a private security company guarding a kindergarten in Naryan-Mar, where the child was killed, was detained, the press service of the Investigative Committee of Russia (ICR) reports. He is suspected of committing a crime of providing services that do not meet the safety requirements for life and health (paragraph ""b"" and paragraph ""c"" of part 2 of article 238 of the Criminal Code of the Russian Federation).
“An employee of OP Svyatogor LLC was detained, who guarded the premises of a kindergarten, but allowed unhindered passage of a drunken man. The suspect called the intercom, the security guard remotely, without leaving the security room, opened the front door for him, mistaking one of the pupils for the parent, ”the message says. In addition, a criminal case has been instituted due to negligence (under part 2 of article 293 of the Criminal Code of the Russian Federation) of officials of the Kindergarten “Fairy Tale”.
Recall, on October 31, a resident of Naryan-Mar, Denis Pozdeev, went to the Skazka kindergarten and, passing the security of the institution that mistook him for the father of one of the children, went into the room where the children slept and killed the child. Denis Pozdeev was detained at the crime scene, law enforcement officials said that he was drunk during the murder. The criminal himself stated that he had committed the murder after ""having read a spell in a book about eternal life."" The court chose a measure of restraint in the form of two months of detention in relation to the suspect in the murder. During the interrogation, Denis Pozdeev refused to testify.
The Governor of the Nenets Okrug Alexander Tsybulsky instructed to conduct an audit in the children's institutions of the region. Mr. Tsybulsky also proposed simplifying legislation to maintain competition among security agencies, in favor of greater security. “In fact, today there is a systemic problem when private security companies enter the competitions formally having all the permissions and then doing their duties in such a negligent way,” the governor said.
By order of the Chairman of the TFR, Alexander Bastrykin, investigators and experts from the central office of this department were sent to Naryan-Mar.

Read more in the article ""Kommersant"" ""In the kindergarten launched the killer.""



"
