,src,lang,text
0,"











Тотнъм обжалва червения картон на Хюн Мин Сон
05 Nov 2019, 12:15 by Sportlive.bg
Ръководството на Тотнъм е подало жалба срещу червения картон, който нападателят на тима Хюн Мин Сон получи в мача с Евертън през уикенда. Нарушение на корейския национал срещу Андре Гомеш доведе до ужасяваща контузия за халфа на ""карамелите"".
Португалският футболист бе моментално откаран в болница със счупен глезен, а вчера от Евертън съобщиха, че той е претърпял успешна операция и се очаква да се възстанови напълно от травмата.
Повторенията показаха, че макар и Сон да фаулира в гръб съперника си, контузията бе причинена от последвалото падане и сблъсък на Гомеш с връхлитащия Серж Орие, но въпреки това реферът Мартин Аткинсън показа директен червен картон на корееца.
От Тотнъм считат, че това наказание е твърде сурово и искат картонът на Сон да бъде отменен. ""Очевидно е, че Сон нямаше намерение да причини този проблем, който се случи след фала. Невероятно е, че получи червен картон. ВАР трябва да прецени колко груб е фалът на Сон, а не какво се е случило след това"", коментира мениджърът на Тотнъм Маурисио Почетино след двубоя на ""Гудисън Парк"", който завърши 1:1.

Междувременно може да видите как фенове на Евертън засипаха Хюн Мин Сон с расистки обиди (видео).


Още по темата








",bg,"











Tottenham appeals against Hyun Min Son's red card
05 Nov 2019, 12:15 by Sportlive.bg
Tottenham management have filed a complaint against the red card that team hitter Hyun Min-Son received in a match with Everton over the weekend. A violation of the Korean national against Andre Gomes has caused a horrific injury to the midfielder of the ""caramel"".
The Portuguese footballer was immediately taken to hospital with a broken ankle, and yesterday from Everton it was reported that he had undergone successful surgery and is expected to recover completely from the injury.
Repeats showed that even though Son was fouling his opponent in the back, the injury was caused by Gomes' subsequent fall and clash with rising Serge Orie, but the referee Martin Atkinson showed a direct red card to the Korean.
Tottenham believe this punishment is too harsh and they want Son's card to be reversed. ""Obviously, Son did not intend to cause this problem, which happened after the foul. It is unlikely that he received a red card. VAR should judge how rough the Dream's foul is, not what happened afterwards,"" the manager commented. Tottenham Mauricio Pochettino after Goodison Park's 1-1 draw.

In the meantime, you can see Everton fans bombarding Hyun Min-son with racist insults (video).


More on the topic








"
