,src,lang,text
0,"











Filomena Cautela
Estreia-se no palco principal da Web Summit: «Foi incrível»
05 Nov 2019, 12:34 by Revista Vip

Filomena Cautela volta a subir a um palco muito especial, o da Altice Arena.



























































Filomena Cautela na Web Summit 2019

Esta segunda-feira, 4 de novembro, foi muito especial para Filomena Cautela. A apresentadora estreou-se no Center Stage da Web Summit 2019, que começou precisamente nesse dia e se estende até à próxima quinta-feira (7), na Altice Arena, em Lisboa, e logo como moderadora.
«O melhor da Web Summit a seguir ao Edward Snowden e quem vai moderar? A croma. Irresponsável, bem sei, mas absolutamente imperdível», lê-se num story partilhado pelo rosto da RTP. O debate chamava-se 'A Two Way Street: Portugal & the Tech World' (em português: 'Uma Estrada com Dois Sentidos: Portugal e o Mundo da Tecnologia'), e contou com a presença de Michelle Zatlyn e Daniela Braga.   
«Não posso contar tudo o que se passou aqui hoje mas foi incrível. Mr. Paddy Cosgrave you rock and roll sir. Estreia no Center Stage da Web Summit», assim legendou uma galeria de fotografias que partilhou nas redes sociais.  
Veja as imagens na nossa galeria. 
Momentos antes de subir ao palco, Filomena Cautela partilhou um vídeo em que era possível ver a conhecida sala lisboeta lotada.
Recorde-se que também foi ali que a apresentadora, na companhia de Daniela Ruah, Catarina Furtado e Sílvia Alberto, conduziu a final do Festival Eurovisão da Canção 2018, no dia 12 de maio de 2018. O evento realizou-se em Portugal, uma vez que Salvador Sobral ganhou o certame de 2017, em Kiev, na Ucrânia. 
Texto: Ivan Silva; Fotos: reprodução Instagram 
 


",pt,"











Filomena Cautela
Debuts on Web Summit's main stage: «It was amazing»
05 Nov 2019, 12:34 by Vip Magazine

Filomena Cautela goes back to a very special stage, the Altice Arena.



























































Filomena Cautela at Web Summit 2019

This Monday, November 4, was very special for Filomena Cautela. The host made her debut at the Web Summit 2019 Center Stage, which began just that day and runs until next Thursday (7) at the Altice Arena in Lisbon, and soon as moderator.
«The best of the Web Summit after Edward Snowden and who will moderate? The chroma. Irresponsible, I know, but absolutely unmissable, ”reads a story shared by RTP's face. The debate was called 'A Two Way Street: Portugal & the Tech World' (in English: 'A Two Way Road: Portugal and the World of Technology'), and was attended by Michelle Zatlyn and Daniela Braga.
«I can't tell you everything that happened here today but it was amazing. Mr. Paddy Cosgrave you rock and roll sir. Debut at the Web Summit Center Stage », so he subtitled a photo gallery he shared on social networks.
See the images in our gallery.
Moments before taking the stage, Filomena Cautela shared a video in which it was possible to see the well-known crowded Lisbon room.
It is recalled that it was also there that the host, in the company of Daniela Ruah, Catarina Furtado and Sílvia Alberto, led the final of the Eurovision Song Contest 2018, on May 12, 2018. The event took place in Portugal, a time Salvador Sobral won the 2017 event in Kiev, Ukraine.
Text: Ivan Silva; Photos: Instagram Playback



"
