,src,lang,text
0,"











Ankara veut expulser les jihadistes étrangers, même déchus de leur nationalité
05 Nov 2019, 12:47 by RFI

La Turquie a annoncé ce mardi avoir arrêté, dans le nord de la Syrie, une sœur d'Abou Bakr al-Baghdadi. Cette annonce survient au moment où Ankara presse les Occidentaux de récupérer leurs ressortissants arrêtés. 

Avec notre correspondante à Istanbul, Anne Andlauer
« Nous ne sommes pas un hôtel pour membres de l’État islamique. » La formule, signée du ministre turc de l’Intérieur, Süleyman Soylu, est abrupte, mais elle exprime la lassitude des autorités d’Ankara face au nombre grandissant de jihadistes étrangers détenus dans le pays.
Elle illustre aussi leur rancœur face aux États qui dénoncent les actions de la Turquie en Syrie et l’accusent de compliquer la lutte contre le groupe État islamique, tout en refusant de récupérer leurs ressortissants partis rejoindre les rangs de cette organisation.
Les capitales occidentales s’inquiètent des risques sécuritaires que pourraient créer ces retours et de leur impopularité dans l’opinion publique.
Ankara dénonce notamment des pays comme la France, le Royaume-Uni ou les Pays-Bas, qui ont déchu de leur nationalité des jihadistes présumés pour éviter d’avoir à les récupérer. La Turquie a jugé le procédé « inacceptable » et a promis de les renvoyer dans leur pays « que ces derniers leur retirent leur nationalité ou pas ».
Selon les chiffres officiels, près de 1 200 membres étrangers du groupe État islamique sont actuellement détenus en Turquie. Ankara affirme par ailleurs avoir capturé 287 jihadistes et membres de leur famille dans le cadre de son offensive récente contre les forces kurdes en Syrie.


",fr,"











Ankara wants to expel foreign jihadists, even stripped of their nationality
05 Nov 2019, 12:47 by RFI

Turkey announced on Tuesday that it has arrested a sister of Abu Bakr al-Baghdadi in northern Syria. This announcement comes as Ankara urges Westerners to recover their arrested citizens.

With our correspondent in Istanbul, Anne Andlauer
""We are not a hotel for members of the Islamic State. The formula, signed by Turkish Interior Minister Süleyman Soylu, is abrupt, but it expresses the weariness of the Ankara authorities in the face of the growing number of foreign jihadists detained in the country.
It also illustrates their resentment of states denouncing Turkey's actions in Syria and accusing it of complicating the fight against the Islamic State group, while refusing to recover their nationals who have joined the ranks of the organization.
Western capitals are worried about the security risks that these returns could create and their unpopularity in public opinion.
Ankara denounces countries such as France, the United Kingdom or the Netherlands, which have removed from their nationality jihadists alleged to avoid having to recover. Turkey judged the process ""unacceptable"" and promised to send them back to their country ""whether they withdraw their nationality or not"".
According to official figures, nearly 1,200 foreigners of the Islamic State group are currently detained in Turkey. Ankara also claims to have captured 287 jihadists and their families as part of its recent offensive against Kurdish forces in Syria.


"
