,src,lang,text
0,"











افزایش تنش‌ها بین اصلاحات-کارگزاران

05 Nov 2019, 12:20

قسمت جدید سریال دعوای اصلاحات-کارگزاران امروز پخش شد؛ موضوع این قسمت از این سریال طولانی ولی عمیق، سامانه «سرا»ی اصلاح طلبان است که برای انتخاب کاندیداهای اصلاح‌طلبان برای شرکت در انتخابات مجلس راه‌اندازی شده است.
فارس نوشت: قسمت جدید سریال دعوای اصلاحات-کارگزاران امروز پخش شد. موضوع این قسمت از این سریال طولانی ولی عمیق، سامانه «سرا»ی اصلاح طلبان است که برای انتخاب کاندیداهای اصلاح‌طلبان برای شرکت در انتخابات مجلس راه‌اندازی شده است.
شورای عالی اصلاح طلبان می گوید این سیستم با نظرخواهی از بدنه اجتماعی جریان اصلاح طلب به لیست انتخاباتی خود خواهد رسید. اگر از این بگذریم که عده‌ای معتقدند اصلاح طلبان با این روش می‌خواهند به نوعی شورای نگهبان را در برابر یک فرآیند دموکراتیک قرار داده و به زعم خودشان هزینه عدم تایید صلاحیت‌ها را برای این شورا بالا ببرند، کارگزارانی‌ها و در صدر آن کرباسچی امروز پرچم مقابله شدید با این سامانه را برداشته اند.
تیتر امروز ارگان رسمی حزب کارگزاران سازندگی این است: «سرا دموکراسی وارونه است». 



غلامحسین کرباسچی در این شماره از روزنامه حزب خود ابتدا از در یک ایراد قانونی ظاهرا موجه وارد شده و می‌گوید: «این طرح به دنبال این است که در یک شبکه مجازی گسترده برای یکسری از افراد تبلیغات صورت گیرد، در حالی که مطابق قانون انتخابات هنوز موعد تبلیغات انتخابات نرسیده است و اگر هم بخواهند این تبلیغات را مطابق قانون به یک هفته آخر منتهی به زمان برگزاری انتخابات موکول کنند، به نظر نمی‌رسد کارایی داشته باشد».
او سپس به نحوه انتخاب این لیست خرده گرفته و تصریح می کند: «این مجموعه با انتخاب بدنه اصلاح‌طلبان شکل نمی‌گیرد، بلکه خود شورایعالی به صورت غیرمستقیم انتخاب می‌کند. یک‌دفعه خود شورایعالی لیست را تهیه کند! نیازی به این لایه‌سازی نیست».
کرباسچی شب گذشته در توییتی کنایه‌وار خطاب به عارف نوشته بود: «‏بگویید در مجلس یازدهم چه می‌کنید تا مردم درباره رای دادن و ندادن به شما تصمیم بگیرند. برای مردم اهمیتی ندارد که چگونه نامزد شده‌اید، مهم این است که چه می‌کنید».
عبدالله مومنی دیگر فعال سیاسی اصلاح طلب است که در مصاحبه ای با روزنامه سازندگی با لحنی آک2ادمیک‌تر اما به مراتب تندتر از کرباسچی به طرح سرا انتقاد کرده و می گوید: « طرح «سرا» مهندسی انتخابات مقدماتی برای وجهه‌سازی دموکراتیک برای شورای عالی سیاست‌گذاری غیرقانونی و غیر‌دموکراتیک اصلاح‌طلبان است؛ تلقی تخفیف‌گرایانه و الیگارشیک از اصلاحات که به تمامیت‌خواهی میل دارد و دموکراسی هدایت‌شده‌ای که مبین اندک سالاری است؛ اینکه در جامعه مدنی نیز با نگاه از بالا بخواهیم مناسبات شبه‌دموکراتیک را به نام دموکراسی به دیگران تئوریزه کنیم. از دل این نظام مهندسی شده نه نظام حزبی تقویت می‌شود و نه دال بر تقویت و تمرین دموکراسی است با شکل و مدل انتخاباتی که نیمه‌باز نام گرفته؛ صرفا سامانه‌ای را در اختیار شورایی از اصلاح‌طلبان ناکارآمد تعبیه نموده که منشاء بیشترین تنش‌ها و حاشیه‌های اصلاح‌طلبی بوده‌اند و با روش‌های سال‌های گذشته که اعتبار و سرمایه اجتماعی اصلاحات از کف رفت، نمی‌توان هدایت افکار عمومی و بدنه اجتماعی اصلاح‌طلبان را در جهت احیاء و تقویت اصلاحات بازیابی نمود». 



اما «سرا» فقط یک بهانه است تا سلسله تصادف زنجیره‌ای در جاده اصلاح‌طلبان قطع نشود و اصلاحاتی‌ها و کارگزارانی‌ها بتوانند بار دیگر همدیگر را بکوبند.
نه اصلاح‌طلبان از یاد می برند و نه کارگزارانی‌ها فراموش خواهند کرد که در چندماه گذشته این دو جریان مشتق از جناح اصلاح طلبی همدیگر را با بدترین ادبیات کوبیده‌اند و کار که با جاهای باریک کشیده حتی هویت و ماهیت هم را زیر سوال برده‌اند. 
غلامحسین کرباسچی که تقریبا تمام موضعگیری‌های جنجالی اش را با روزنامه خود می‌کند، همین چند وقت پیش بود که تصریح کرد: «جریان اصلاحات نه در گذشته که در وضعیت فعلی نیز به‌معنای واقعی رهبر نداشته و ندارد، اما نیازمند رهبری است که برنامه، خط‌مشی و استراترن آن را تعیین کند.»
در واکنش به این اظهارات بود که محمود صادقی عضو شورای عالی سیاست‌گذاری اصلاح طلبان گفته بود: «کارگزارانی‌ها از همان ابتدا یک تفاوت ماهوی با بدنه جریان اطلاحات داشتند و آن هم تفاوت در نوع نگاه به تفکر اصلاح‌طلبی است که این موضوع یک افتراق مهم بین کارگزاران و اصلاح‌طلبان به‌حساب می‌آید، در حالی‌که اصلاح‌طلبان جناح چپ را بطور کلی شکل دادند. کارگزارانی‌ها در دولت‌های بخصوص اول و تا حدودی دوم مرحوم‌هاشمی‌خود را عینا در قامت راست مدرن تعریف کردند، اما با شروع دوران دوم خرداد و شکل‌گیری دولت اصلاحات یک چرخشی در مواضع سیاسی این حزب به‌وجود آمد...».



آنچه حائز اهمیت است اینکه کارگزاران علی‌رغم تمام تفاوت‌های نظری با اصلاح طلبان، سال‌هاست که در کشتی اصلاحات جا خوش کرده و نه برای اصلاح طلبان و نه برای کارگزاران میسر است که به راحتی این طلاق سیاسی را اجرایی کنند. هرچند به نظر می‌رسد انتخابات دوازدهمین دوره مجلس را باید آغازی بر پایان سال‌ها آشتی سیاسی اصلاحات و کارگزاران بنامیم.


",fa,"











Increased tensions between reform-agents

05 Nov 2019, 12:20

The new episode of the Reformist-Clerical Fighting Series airs today; the subject of this long but deep series is the reformist ""Serra"" system, which was launched to select reformist candidates to run for parliament.
Fars wrote: The new episode of the Reform-brokers series aired today. The subject of this long but profound series is the reformist ""Serra"" system, which is set up to select reformist candidates to run for parliament.
The Supreme Council of Reformers says the system will reach its electoral roll with a poll of the reformist social body. If we dismiss the belief that the reformists in this way want to somehow put the Council of Guardians on a democratic process and, in their view, raise the cost of disapproval of the council, the brokers and, at the top, Karbasschi today became the flag. With this system removed.
Today's headline is the official organ of the Party of Constructive Brokers: ""Serra is democracy upside down.""



In the issue of his party newspaper, Gholamhossein Karbaschi initially appeared in a seemingly justified legal objection, saying: ""The plan seeks to launch a wide-ranging virtual network for a number of people to propagate, while still under election law. The election campaign has not yet come to an end, and if they want to postpone it by the deadline of one week, by law, it doesn't seem to work. ”
He then summarizes how this list is selected, stating: ""This set is not formed by the choice of the reformers' body, but by the Supreme Council itself, indirectly. Make a list yourself at a glance! There is no need for this layering. ""
""Tell me what you are doing in the Eleventh Majlis so that people will decide whether or not to vote for you,"" Karbasschi wrote in an ironic tweet to Aref last night. It doesn't matter to people how you are nominated, it matters what you do. ""
Another reformist political activist, Abdullah Momeni, criticized Sarah's plan in an interview with the Conspiracy Daily, but far sharper than Karbasschi, saying that ""Sarah's plan"" is a preliminary election engineer for democratic legitimacy for the Supreme Council for Politics and Non-Aligned Politics. It is undemocratic reformers; a rebuttalist and oligarchic view of reform that seeks totalitarianism and a guided democracy that implies minimalism; in civil society, we must also look at democracy as pseudo-democracy. At the heart of this engineered system is neither a party system strengthened, nor a demonstration of the strengthening and practicing of democracy in the form of a half-open electoral model; it merely implements a system of ineffective reformist councils that are the source of most reform tensions and margins. ""With the methods of the past years that the credibility and social capital of the reforms have been undermined, it is not possible to direct the public opinion and the social body of the reformers to restore and foster reform.""



But Serra is just an excuse not to cut the chain of events on the reformist road, and reformers and brokers can hit each other again.
Neither the reformists nor the brokers will forget that in the past few months these two reformist factions have crushed each other with the worst of literature and whose work in narrow places has even compromised their identity and nature.
Gholamhossein Karbasschi, who shares almost all of his controversial stances with his newspaper, said just recently: ""Reforms are not in the past but in the current situation they do not really have a leader, but they need a leader whose program, policy and Straternity to determine it. ""
Reacting to the remarks, Mahmoud Sadeghi, a member of the Supreme Council for Reformist Politics, had said, ""From the beginning, the agents had a substantial difference with the body of the information flow, and that is a difference in the way they look at reformist thinking, which is an important distinction between brokers. And the reformers are counting, while the reformers generally formed the left wing. Agencies in the first and second, especially second, governments have definitively defined the late Hashemi in their modern upright position, but with the beginning of the second of June and the formation of the government, there was a spin-off in the political positions of the party ... "".



What is important is that agents, despite all the theoretical differences with the reformists, have enjoyed years in the reform ship, and neither reformists nor agents can easily enforce this political divorce. However, the 12th parliamentary elections seem to be the beginning of the end of years of political reconciliation for reformers and clerks.


"
