,src,lang,text
0,"











Asaltan a punta de pistola a un cubano en Miami y le roban el auto
05 Nov 2019, 12:12 by Jose Nacher
Un ladrón asaltó a un cubano, que responde al nombre de Marcos Romanes, y le robó el auto a punta de pistola en Miami.
Según informó América Tevé suceso se produjo a las 2:30 de la madrugada del domingo, cuando Marcos entraba con el vehículo a su residencia.
""Tenía la ventanilla a mitad, le apuntó con la pistola y cuando mi hijo le preguntó qué quería, la respuesta del atacante fue: 'Que me des el carro y todo lo que tienes ahí'"", explicó Silvia Sabater Bueno, madre de la víctima.



""Mi hijo se bajó y le dio el auto"", añadió la mujer, quien alertó a la policía, que se personó en el condominio Tequesta Knoll Apartments, ubicado en la avenida 16 y la calle 14 del noroeste.
El atacante, cuya identidad se desconoce, huyó con el automóvil marca KIA. Horas después, envió un mensaje de texto a Silvia Sabater para que le dijera a su hijo que tenía la dirección donde estaba el auto.
Sin embargo no hicieron caso a este individuo, pues las autoridades ya habían recuperado el vehículo.
Por el momento los investigadores desconocen cuál es el paradero de este ladrón. ""Lo único que sabemos de este sujeto es que iba vestido completamente de negro. Es un hombre de raza negra, delgado y de 16 a 19 años de edad"", explicó el portavoz de la policía, Mike Vega.
Marcos Romanes, padre de la víctima, se mostró aliviado porque su hijo no sufrió ningún daño físico. ""Gracias a Dios no ha pasado nada. El miedo que tenía es que le hubiera pasado algo a mi hijo"", confesó.


",es,"











They assault a Cuban in Miami at gunpoint and steal his car
05 Nov 2019, 12:12 by Jose Nacher
A thief assaulted a Cuban, who responds to the name of Marcos Romanes, and stole the car at gunpoint in Miami.
As reported by América Tevé, the event occurred at 2:30 in the morning of Sunday, when Marcos entered with the vehicle to his residence.
""I had the window in the middle, he pointed the gun at him and when my son asked him what he wanted, the response of the attacker was: 'Give me the car and everything you have there,'"" said Silvia Sabater Bueno, mother of the victim.



""My son got out and gave him the car,"" added the woman, who alerted the police, who appeared in the Tequesta Knoll Apartments condominium, located on 16th Avenue and 14th Street Northwest.
The attacker, whose identity is unknown, fled with the KIA car. Hours later, he sent a text message to Silvia Sabater to tell his son that he had the address where the car was.
However, they ignored this individual, as the authorities had already recovered the vehicle.
At the moment the researchers are unaware of the whereabouts of this thief. ""The only thing we know about this guy is that he was dressed completely in black. He is a black man, thin and 16 to 19 years old,"" said police spokesman Mike Vega.
Marcos Romanes, the victim's father, was relieved that his son suffered no physical damage. ""Thank God nothing happened. The fear I had is that something had happened to my son,"" he confessed.


"
