,src,lang,text
0,"











421 млрд тенге выделит государство на программу «Дорожная карта бизнеса-2025»
Новый документ будет принят до конца года

06 Nov 2019, 04:03

Тамара Вааль, Vласть
До конца года в Казахстане правительство примет новую программу «Дорожная карта бизнеса-2025», так как срок реализации старой истекает. Как сообщил в среду в ходе заседания правительства министр национальной экономики Руслан Даленов, на реализацию документа в новом пятилетнем периоде планируется выделить 421 млрд тенге, благодаря которым власти усовершенствуют инструменты поддержки, повысят их эффективность и обеспечат доступность.
«(Проектом программы – V) увеличивается размер кредитования оборотных средств с 60 до 360 млн тенге, расширяется доступ к финансированию. Для этого вводится субсидирование и гарантирование кредитов, выдаваемых микрофинансовыми организациями. Совершенствуются требования к участникам программы обеспечить рост занятости и поступления налогов, усиливается сопровождение предпринимателей на всех этапах. Это обучение, содействие в подготовке документов для получения кредитов и поддержки, налаживание цепочки сбыта», - перечислил планируемые меры поддержки для бизнеса Даленов.
На следующий этап программы, по его словам, выделено 421 млрд тенге, что в 1,5 раза больше финансирования за предыдущие пять лет.
«Программой «Дорожная карта бизнеса-2025» установлены целевые индикаторы. Они соответствуют стратегическому плану развития страны до 2025 года. Ожидается увеличение доли МСБ в ВВП не менее 35%, доведение доли обрабатывающей промышленности в структуре ВВП не менее 13,4%. Поступательное развитие МСБ приведет к качественному изменению экономики», - уверен министр.
Для этого, подчеркнул он, кардинально улучшаются условия ведения бизнеса, снижаются барьеры и сокращается перечень разрешительных документов, принимаются стимулирующие меры для развития МСБ.
«Наша задача – совершенствование делового климата, что будет способствовать экономическому росту. Свыше трети экономики будет приходиться на МСБ уже в 2025 году. А к 2050 году МСБ составит уже половину ВВП», - заверил Даленов.
В свою очередь премьер-министр Аскар Мамин подчеркнул, что программа «Дорожная карта бизнеса-2020» доказала свою эффективность и поручил принять новый документ до конца года.


",ru,"











421 billion tenge will be allocated by the state for the program “Business roadmap-2025”
The new document will be adopted before the end of the year.

06 Nov 2019, 04:03

Tamara Vaal, Power
By the end of the year, in Kazakhstan, the government will adopt a new program, “Business Roadmap-2025,” as the old deadline expires. According to Minister of National Economy Ruslan Dalenov during a government meeting on Wednesday, it is planned to allocate 421 billion tenge to implement the document in the new five-year period, thanks to which the authorities will improve support tools, increase their efficiency and ensure accessibility.
“(The draft program - V) increases the amount of loans for working capital from 60 to 360 million tenge, expanding access to finance. For this, subsidies and guarantees for loans issued by microfinance organizations are introduced. Requirements for program participants are improved to ensure the growth of employment and tax revenues, and escort of entrepreneurs at all stages is strengthened. This is training, assistance in preparing documents for obtaining loans and support, establishing a sales chain, ”Dalenov listed the planned support measures for the business.
According to him, 421 billion tenge was allocated to the next stage of the program, which is 1.5 times more than funding over the previous five years.
“The Business Roadmap-2025 program has set target indicators. They correspond to the strategic development plan of the country until 2025. An increase in the share of SMEs in GDP of at least 35% is expected, bringing the share of manufacturing in the structure of GDP by at least 13.4%. The progressive development of SMEs will lead to a qualitative change in the economy, ”the minister is sure.
To this end, he stressed, the business environment is being radically improved, barriers are reduced and the list of permits is reduced, incentive measures are being taken to develop SMEs.
“Our task is to improve the business climate, which will contribute to economic growth. Over a third of the economy will account for SMEs in 2025. And by 2050, SMEs will already be half of GDP, ”Dalenov assured.
In turn, Prime Minister Askar Mamin emphasized that the Business Roadmap 2020 program has proven its effectiveness and ordered the adoption of a new document by the end of the year.


"
