,src,lang,text
0,"











NOTÍCIA
STF decide contra prisão em segunda instância
07 Nov 2019 by O Povo
O Supremo Tribunal Federal (STF) decidiu contra a prisão em segunda instância. O último e decisivo voto foi do presidente do tribunal, ministro Dias Toffoli, que desempatou e o placar final ficou: 6 a 5.



O decano do STF, Celso de Mello, proferiu o décimo voto, contra a prisão em segunda instância.
O ministro Gilmar Mendes havia dado o voto anterior, contra a possibilidade de prisão de réus para cumprimento da pena após a condenação em segunda instância.
Nono ministro a votar no julgamento iniciado em outubro e retomado nesta quinta-feira, Gilmar Mendes. Gilmar já havia votado duas vezes a favor da prisão em segunda instância, e dedicou parte de seu voto hoje a explicar por que razões ""evoluiu"".
""De forma cristalina, afirmo que o fator fundamental a definir essa minha mudança de orientação foi o próprio desvirtuamento que as instâncias ordinárias passaram a perpetrar em relação à decisão do STF em 2016. O que o STF decidiu em 2016 era que dar-se-ia condição para executar a decisão a partir do julgado em segundo grau. Ou seja, decidiu-se que a execução da pena após condenação em segunda instância seria possível, mas não imperativa"", disse Gilmar Mendes.
Mais cedo, a ministra Cármen Lúcia confirmou sua posição histórica e votou por autorizar o cumprimento de pena após condenação em segunda instância.
Para a ministra, a Constituição deve ser interpretada levando-se em conta a “eficácia do sistema criminal”, de modo que “se tenha garantida a plena observância do acatamento da lei”. Ela considerou que impedir a prisão após segunda instância acarretaria na “frustação daqueles que sofreram como consequência do delito”.
Em seu voto, Cármen Lúcia chegou a dizer que seria “voto vencido”, dando uma pista sobre a resolução do julgamento. Ela também elogiou os colegas que pensam diferente. “O contraditório é do direito porque é da vida. Quem gosta de unanimidade é ditadura. Democracia é plural, sempre”, afirmou.
Ela foi a quinta a votar pelo cumprimento antecipado de pena, junto com os ministros Alexandre de Moraes, Luís Roberto Barroso, Edson Fachin e Luiz Fux. Os ministros Marco Aurélio Mello, relator, Rosa Weber e Ricardo Lewandowski votaram pela prisão somente após o chamado trânsito em julgado, quando encerrados os recursos possíveis também nas instâncias superiores: o Superior Tribunal de Justiça (STJ) e o próprio Supremo. A essa última posição, somaram-se Gilmar Mendes e Celso de Mello.
Debate
Juridicamente, os ministros debatem a constitucionalidade do artigo 283 do Código de Processo Penal (CPP), segundo o qual “ninguém poderá ser preso senão em flagrante delito ou por ordem escrita e fundamentada da autoridade judiciária competente, em decorrência de sentença condenatória transitada em julgado ou, no curso da investigação ou do processo, em virtude de prisão temporária ou prisão preventiva”.
No fundo, os ministros discutem o alcance do artigo 5º da Constituição, segundo o qual “ninguém será considerado culpado até o trânsito em julgado de sentença penal condenatória”, à luz dos demais direitos constitucionais.
O julgamento é visto como decisivo para o combate à corrupção, pois uma decisão em favor do trânsito em julgado tem o potencial de beneficiar criminosos do colarinho branco, entre os quais condenados na Lava Jato, postergando a prisão de condenados com recursos pendentes no próprio Supremo.
Entenda
No dia 17 de outubro, a Corte começou a julgar definitivamente três Ações Declaratórias de Constitucionalidade (ADCs) sobre o assunto, relatadas pelo ministro Marco Aurélio Mello e protocoladas pela Ordem dos Advogados do Brasil (OAB), pelo PCdoB e pelo antigo PEN, atual Patriota. A sessão desta quinta-feira (7) é a quinta dedicada ao tema.
O entendimento atual do Supremo permite a prisão após condenação em segunda instância, mesmo que ainda seja possível recorrer a instâncias superiores. No entanto, a OAB e os partidos sustentam que o entendimento afronta o princípio constitucional da presunção de inocência e que uma sentença criminal somente pode ser executada após o fim de todos os recursos possíveis, incluindo no próprio Supremo.
A questão foi discutida nos últimos anos pelo Supremo ao menos quatro vezes. Em 2016, quando houve decisões liminares (provisórias) nas ações que estão sendo julgadas, a prisão em segunda instância foi autorizada por 6 votos a 5. De 2009 a 2016, prevaleceu o entendimento contrário, no sentido de que a sentença só poderia ser executada após o Supremo julgar os últimos recursos.
Segundo o Conselho Nacional de Justiça (CNJ), o julgamento deve ter impacto na situação de cerca de 4,9 mil presos após decisão na segunda instância. Entre eles, constam condenados na Operação Lava Jato, como o ex-presidente Luiz Inácio Lula da Silva, preso desde 7 de abril do ano passado na Superintendência da Polícia Federal em Curitiba, após ter sua condenação por corrupção e lavagem de dinheiro confirmada pelo Tribunal Regional Federal da 4ª Região (TRF4), no caso do tríplex do Guarujá (SP).
Dúvidas, críticas e sugestões? Fale com a gente


",pt,"











NEWS
Supreme Court decides against arrest in the second instance
07 Nov 2019 by The People
The Federal Supreme Court (STF) ruled against the arrest in the second instance. The final and decisive vote came from the president of the court, Minister Dias Toffoli, who broke the tie and the final score was: 6 to 5.



The dean of the STF, Celso de Mello, made the tenth vote, against the arrest in the second instance.
Minister Gilmar Mendes had cast the previous vote against the possibility of arrest of defendants for serving the sentence after the second instance conviction.
Ninth minister to vote in the trial that began in October and resumed this Thursday, Gilmar Mendes. Gilmar had already voted twice in favor of the second instance arrest, and devoted part of his vote today to explaining why it ""evolved.""
""Clearly, I affirm that the fundamental factor defining this change of my orientation was the very distortion that the ordinary instances began to perpetrate regarding the decision of the Supreme Court in 2016. What the Supreme Court decided in 2016 was that ""This was a condition for enforcing the decision from the lower court. That is, it was decided that the execution of the sentence after conviction in the second instance would be possible, but not imperative,"" said Gilmar Mendes.
Earlier, Minister Cármen Lúcia confirmed her historic position and voted to authorize the serving of sentence after conviction in the second instance.
For the minister, the Constitution must be interpreted taking into account the ""effectiveness of the criminal system"", so that ""full compliance with the law has been guaranteed."" She considered that preventing the arrest after the second instance would result in “the frustration of those who suffered as a result of the offense”.
In his vote, Cármen Lúcia even said that it would be “vote defeated”, giving a clue about the resolution of the trial. She also praised colleagues who think differently. “The contradictory is of law because it is of life. Who likes unanimity is dictatorship. Democracy is plural, always, ”he said.
She was the fifth to vote for the early sentence, along with ministers Alexandre de Moraes, Luis Roberto Barroso, Edson Fachin and Luiz Fux. The ministers Marco Aurélio Mello, rapporteur, Rosa Weber and Ricardo Lewandowski voted for the arrest only after the so-called res judicata, when the possible appeals also closed in the higher courts: the Superior Court of Justice (STJ) and the Supreme Himself. To this last position, were added Gilmar Mendes and Celso de Mello.
Debate
Juridically, the ministers debate the constitutionality of article 283 of the Code of Criminal Procedure (CPP), according to which “no one shall be arrested except in the act of committing a crime or in writing and in good order by the competent judicial authority, as a result of a final sentence. or, in the course of the investigation or prosecution, by reason of temporary or pre-trial detention ”.
In essence, the ministers discuss the scope of Article 5 of the Constitution, according to which ""no one shall be found guilty until the final judgment has been passed"", in the light of the other constitutional rights.
The trial is seen as decisive in fighting corruption, as a ruling in favor of res judicata has the potential to benefit white-collar criminals, including convicted in the Lava Jato, postponing the arrest of convicts with appeals pending the Supreme Court itself. .
Understand
On October 17, the Court began to finally adjudicate three Declaratory Constitutional Actions (ADCs) on the matter, reported by Minister Marco Aurélio Mello and filed by the Brazilian Bar Association, the PCdoB and the former PEN, currently Patriot. Thursday's session (7) is the fifth dedicated to the topic.
The current understanding of the Supreme Court allows for arrest after conviction in the second instance, even though it is still possible to appeal to higher courts. However, the OAB and the parties maintain that the understanding violates the constitutional principle of presumption of innocence and that a criminal sentence can only be enforced after all possible remedies, including the Supreme Court itself, have ended.
The issue has been discussed in recent years by the Supreme at least four times. In 2016, when there were preliminary (provisional) decisions in the actions being judged, the second instance arrest was authorized by 6 votes to 5. From 2009 to 2016, the contrary understanding prevailed, in the sense that the sentence could only be enforced after the Supreme Court judges the last appeals.
According to the National Council of Justice (CNJ), the trial is expected to have an impact on the situation of about 4,900 prisoners after a second instance decision. Among them are convicted in Operation Lava Jato, such as former President Luiz Inacio Lula da Silva, arrested since April 7 last year at the Federal Police Superintendence in Curitiba, after his conviction for corruption and money laundering was confirmed by the Court. Federal Region of the 4th Region (TRF4), in the case of the Guarujá triplex (SP).
Questions, criticisms and suggestions? Talk to us


"
