,src,lang,text
0,"











Подрыв автомобиля в Киеве: В полиции рассказали детали происшествия

07 Nov 2019, 00:54


В результате взрыва автомобиля Mercedes на Брест-Литовском шоссе погиб водитель, еще два человека получили травмы.

Об этом сообщает пресс-служба полиции Киева.
""Около 21:40 полицейские получили сообщение о том, что в Святошинском районе взорвался ""Мерседес"". Когда на место происшествия прибыли полицейские, выяснилось, что водитель автомобиля погиб, еще двое пассажиров получили телесные повреждения. Кроме того, повреждено транспортное средство, которое в момент взрыва было неподалеку"", - говорится в сообщении.



Также в полиции заявили, что к этой трагедии может быть причастен мотоциклист. В связи с этим в столице была введена специальная полицейская операция с целью розыска и задержания злоумышленника.
Кроме этого, анкетные данные погибшего и травмированных устанавливаются.
Напомним, сегодня вечером в Святошинском районе Киева взорвали автомобиль, в результате чего минимум один человек погиб.

читайте также







",ru,"











Car bombing in Kiev: Police told details of the incident

07 Nov 2019, 00:54


As a result of the explosion of a Mercedes car on the Brest-Litovsk highway, the driver died, two more people were injured.

This was reported by the press service of the Kiev police.
""At about 9:40 p.m. police received a message that a Mercedes had exploded in Svyatoshinsky district. When the police arrived at the scene, it turned out that the driver of the car was dead, two more passengers were injured. In addition, the vehicle that was damaged the moment of the explosion was nearby, ""the report said.



The police also said that a motorcyclist could be involved in this tragedy. In this regard, a special police operation was introduced in the capital with the aim of tracing and detaining the attacker.
In addition, the personal data of the deceased and injured are established.
Recall that tonight in the Svyatoshinsky district of Kiev, a car was blown up, resulting in at least one death.

read also







"
