,src,lang,text
0,"











سفر 26 هزار گردشگر ایرانی به روسیه از ابتدای سال
07 Nov 2019 by عصر ايران



انجمن گردشگران روسیه اعلام کرده است که از ماه ژانویه (۱۱دی ۱۳۹۷) تا انتهای سپتامبر ۲۰۱۹ (۸مهرماه ۱۳۹۸) ۲۶هزار و ۸۰۰ گردشگر ایرانی به روسیه سفر کردند.
به گزارش ایرنا در این گزارش که امروز پنجشنبه منتشر شد، آمده است: جریان گردشگران از ایران به روسیه ۳۵.۳درصد رشد داشته است حال آنکه همین آما در خصوص امارات به روسیه در ۹ ماه سال جاری با ۸۱۹.۲ درصد رشد به ۱۷ هزار و ۹۰۰ نفر، از عربستان سعودی با ۶۹ درصد رشد به ۳.۷ هزار نفر و ازقطر با ۱۹۳.۲ درصد رشد به ۲ هزار و ۱۰۰ نفر رسیده است.
انجمن گردشگران روسیه خاطرنشان کرده است که جریان گردشگران خارجی به روسیه در ۹ ماه سال جاری ۲۰.۵ درصد افزایش یافته است.
در گزارش گفته شده است: از ماه ژانویه تا سپتامبر سال جاری ۲۵.۷ میلیون تبعه خارجی به روسیه سفر کردند که ۴.۳ میلیون نفر صرفا گردشگر بوده اند که نسبت به سال گذشته رشد ۲۰.۵ درصدی را نشان می‌دهد.
چینی ها با فاصله زیاد مکان نخست گردشگران خارجی روسیه را در اختیار دارند و در مدت یاد شده ، بیش از ۱.۳ میلیون گردشگر چینی به روسیه رفتند، این آمار نیز رشد ۲۱ درصدی نسبت به مدت مشابه سال قبل خود داشته است.
در مکان دوم آلمان با ۴۶۴.۶ هزار گردشگر و رشد ۱۷.۱ درصدی و در مکان سوم کره جنوبی با ۳۴۱.۴ هزار نفر قرار دارد که نسبت به زمان مشابه سال گذشته ۲۳.۴ درصد رشد کرده است.شمار گردشگران آمریکایی نیز که به روسیه سفر کردند ۲۲۲.۸ هزار نفر گزارش شده که ۴.۳ درصد رشد نشان می‌دهد.
بیشترین اتباع خارجی (برای کار، تحصیل و گردشگری) که از ماه ژانویه تا سپتامبر به روسیه سفر کردند اوکراینی بودند که شمار آنها ۶.۷ میلیون نفر اعلام شده است، این آمار با توجه به روابط رو به وخامت روسیه و اوکراین هر سال کمتر شده است و امسال نسبت به پارسال، ۷.۱۴ درصد کاهش یافته است.در مکان دوم سفر اتباع خارجی به روسیه (برای کار، تحصیل و گردشگری) قزاقستان قرار دارد که ۳.۳ میلیون تبعه آن به روسیه سفر کردند، تعداد قزاق‌ها در روسیه طی این آمار ۱.۱۳ درصد نسبت به زمان مشابه سال گذشته رشد داشته است.ازبکستان نیز با ۲.۱ میلیون نفر در مکان سوم قرار دارد و سفر اتباع این کشور به روسیه ۱۲.۴ درصد رشد کرده است.در مکان های بعدی چین، تاجیکستان، جمهوری آذربایجان، فنلاند و قرقیزستان قرار دارند که به ترتیب ۱.۹ میلیون نفر، ۱.۳ میلیون نفر، ۸۸۸ هزار، ۷۱۳ هزار و ۶۹۴ هزار نفر از اتباع آنان به بهانه های مختلف راهی روسیه شده‌اند.
یادآور می شود که روسیه به صورت سنتی نخستین بازار کاری اتباع کشورهای اوکراین، جمهوری آذربایجان، قزاقستان، ازبکستان و تاجیکستان به حساب می‌آید و اکثر کارهای خدماتی از رانندگی گرفته تا امور خدمات شهری بین نیروهایی از این کشورها تقسیم شده است.


",fa,"











26,000 Iranian tourists travel to Russia since the beginning of the year
07 Nov 2019 by Asr Iran



The Association of Russian Tourists has announced that 1,700 Iranian tourists have traveled to Russia from January to the end of September.
The flow of tourists from Iran to Russia has increased by 4.9 percent, while the same for UAE to Russia in the first six months of this year, with a 4.9 percent increase to 6,000, IRNA said in a report released Thursday. And 2 people, from Saudi Arabia, grew 2 percent to 6.7 thousand and from 2.6 percent to 6.7 thousand.
The Association of Foreign Tourists to Russia noted that the inflow of foreign tourists to Russia increased by 4.9% in the first six months of this year.
The report said: From January to September of this year, 4.1 million foreign nationals traveled to Russia, of which 4.7 million were merely tourists, up 4.3 percent year-on-year.
The Chinese are the longest-serving foreign tourists of Russia, with more than 1.2 million Chinese tourists arriving in Russia in the same period, up 6% from the same period a year earlier.
In second place is Germany with 4.7 thousand tourists and growth of 4.9% and in the third place is South Korea with 6.7 thousand people which has increased by 7.1% compared to the same period of last year. Traveled to Russia, 4.7 thousand were reported, which represents a 4.7% increase.
The largest number of foreigners (for work, education and tourism) who traveled to Russia from January to September were Ukrainians with a population of 1.2 million, a figure that is lower each year due to the deteriorating Russian-Ukrainian relations. The number of foreigners traveling to Russia (for work, education and tourism) is Kazakhstan, of which 1.2 million traveled to Russia, the number of Kazakhs in the country. Russia rose 3.6 percent over the same period last year. Uzbekistan is in third place with 3.7 million people. Next to Russia has grown by 4.9%. Next in the list are China, Tajikistan, Azerbaijan, Finland and Kyrgyzstan, with 2.6 million, 1.2 million, 6,000, 6,000 and 6,000 respectively. Some of their nationals have gone to Russia on various pretexts.
It is recalled that Russia is traditionally considered to be the first labor market for nationals of Ukraine, Azerbaijan, Kazakhstan, Uzbekistan and Tajikistan, with most of the services ranging from driving to utilities being divided between forces from these countries.


"
