,src,lang,text
0,"











Jubilados de la región se capacitan en Las Termas de Río Hondo en Inclusión Financiera
El evento es organizado por el Banco Santiago del Estero, y participan la Anses y centros de jubilados del Noroeste y Centro del país.
07 Nov 2019 by Termas
LAS TERMAS, Río Hondo (C) Con la presencia del vicepresidente del Banco Santiago del Estero (BSE), Jorge González, se desarrolla desde el miércoles el 6º Taller de Capacitación de Inclusión Financiera de zonas Noroeste y Centro. Las actividades tienen lugar en los salones del Amerian Hotel Carlos V y reúne a centros de jubilados y pensionados de Santiago del Estero, Tucumán, Salta, Jujuy, Catamarca y Córdoba.
El evento tiene como finalidad intercambiar inquietudes para continuar trabajando en el logro del mejoramiento en la calidad y la atención de los servicios entre la Anses, el BSE y los centros de jubilados y pensionados que forman parte de las jornadas.
Además del vicepresidente del directorio del BSE, estuvieron presentes la subgerente general del Banco Santiago del Estero, Cecilia Echegaray; la gerente comercial del BSE, Claudia Gelid de Gil. Entre las autoridades de la Anses, el director general de Relaciones Institucionales y con la Comunidad, Patricio Piffano; el gerente Regional Noroeste, Fernando Corrales y todos los jefes de las Udai de la provincia. Además estuvieron presentes gerentes de las sucursales BSE y Tarjeta Sol y presidentes de Federaciones y Centros de Jubilados.
Durante las jornadas se desarrollarán disertaciones y charlas a cargo de funcionarios del organismo nacional y del Banco Santiago del Estero, orientadas al mejoramiento y la dinámica de los servicios en beneficio de los actores de la tercera edad.
Los asistentes, además de las capacitaciones, disfrutaron de actividades sociales en el Amerian Hotel Carlos V, y de los atractivos de la ciudad en el paseo tradicional del trencito.
Durante la apertura, la Anses entregó banderas de ceremonias a centros de jubilados y pensionados.


Jorge González: “Mantenemos el perfil de una institución que se preocupa por un sector importante de la sociedad”


El vicepresidente del BSE, Jorge González, se mostró muy satisfecho con la organización de este nuevo taller.
“Quiero agradecer la confianza depositada por las agrupaciones en nuestra institución, que tiene la posibilidad de operar con más de 800 mil jubilados en los centros de pago que tiene en la región noroeste y centro. En estos tiempos difíciles, seguimos manteniendo el perfil de una institución que se preocupa por un sector importante de nuestra sociedad, como los jubilados y pensionados de la región. Siempre estamos invirtiendo para ofrecer mejores servicios y estamos llegando a lugares muy lejanos para facilitarle el traslado a la gente de la tercera edad”, dijo el directivo.
Más adelante agregó: “En estos 23 años de vida, continuamos por la senda de ofrecer mejores servicios a nuestros jubilados. Este tipo de capacitaciones son fundamentales para que puedan operar mejor en los sistemas tecnológicos que cuenta el BSE. Gracias a Dios, nuestros clientes cada día utilizan con mayor frecuencia las nuevas herramientas. Quiero agradecer a los funcionarios de la Anses con quienes hace muchos venimos trabajando y articulando acciones en beneficio de nuestros mayores, y también al personal del banco que trabaja en distintas sucursales”.


",es,"











Seniors from the region are trained in Las Termas de Río Hondo in Financial Inclusion
The event is organized by Banco Santiago del Estero, and the Anses and retired centers of the Northwest and Center of the country participate.
07 Nov 2019 by Termas
LAS TERMAS, Río Hondo (C) With the presence of the Vice President of the Santiago del Estero Bank (BSE), Jorge González, the 6th Financial Inclusion Training Workshop for Northwest and Central areas has been held since Wednesday. The activities take place in the halls of the Amerian Hotel Carlos V and brings together retired and pensioned centers in Santiago del Estero, Tucumán, Salta, Jujuy, Catamarca and Córdoba.
The event aims to exchange concerns to continue working towards the improvement of the quality and care of services between the Anses, the BSE and the centers of retirees and pensioners that are part of the conference.
In addition to the vice president of the board of the BSE, the deputy general manager of Banco Santiago del Estero, Cecilia Echegaray; the commercial manager of the BSE, Claudia Gelid de Gil. Among the authorities of the Anses, the general director of Institutional and Community Relations, Patricio Piffano; the Northwest Regional Manager, Fernando Corrales and all the heads of the Udai of the province. Also present were managers of the BSE and Sol Card branches and presidents of Federations and Senior Citizens' Centers.
During the conference, dissertations and talks will be carried out by officials of the national organization and of the Santiago del Estero Bank, aimed at improving and dynamics of services for the benefit of senior citizens.
Attendees, in addition to training, enjoyed social activities at the Amerian Hotel Carlos V, and the attractions of the city on the traditional train ride.
During the opening, the Anses handed out ceremony flags to centers for retirees and pensioners.


Jorge González: “We maintain the profile of an institution that cares about an important sector of society”


The vice president of the BSE, Jorge González, was very satisfied with the organization of this new workshop.
“I want to thank the trust placed by the groups in our institution, which has the possibility of operating with more than 800 thousand retirees in the payment centers that it has in the northwestern and central region. In these difficult times, we continue to maintain the profile of an institution that cares about an important sector of our society, such as retirees and pensioners in the region. We are always investing to offer better services and we are reaching far away places to facilitate the transfer to the elderly, ”said the manager.
Later he added: “In these 23 years of life, we continue on the path of offering better services to our retirees. This type of training is essential for them to operate better in the technological systems that the BSE has. Thank God, our customers use the new tools more frequently every day. I want to thank the Anses officials with whom we have been working and articulating actions for the benefit of our elders for many years, and also the bank staff working in different branches ”.


"
