,src,lang,text
0,"











Моя большая ошибка. Билл Гейтс объяснил, почему Windows Mobile уступил рынок Android и взял вину на себя
Билл Гейтс заявил, что, по его мнению, все люди могли бы сейчас использовать Windows Mobile, если бы Microsoft не попала в антимонопольное расследование Министерства юстиции США.
07 Nov 2019, 10:32 by Антон Ходоренко
Выступая на конференции в Нью-Йорке Гейтс признал, что «слишком отвлекся» на этот иск и упустил из виду развитие операционной системы.
«Нет сомнений, что антимонопольный иск нанес ущерб Microsoft. Без него мы бы сфокусировались на создании операционной системы для телефонов и вместо Android вы бы сегодня пользовались Windows Mobile. Если бы не антимонопольный иск… Мы были очень близки, я был слишком отвлечен. Я провалил все из-за того, что отвлекся», — признался Билл Гейтс.
Беспорядочный переход Microsoft с Windows Mobile на Windows Phone дал шанс на развитие Android, но в то время у компании были также и большие возможности в области мобильных устройств. Гейтс сообщил, что Microsoft упустила возможность запустить Windows Mobile на ключевом телефоне Motorola.
«Мы опоздали только на три месяца с выпуском Motorola, так что да, победитель забрал все. Сейчас никто не слышал о Windows Mobile, ну и ладно. Это несколько сотен миллиардов туда-сюда», — сокрушается Гейтс.
Непонятно, о каком телефоне Motorola говорит Гейтс, но Motorola выпустила линейку смартфонов на базе Android Droid 10 лет назад, и они стали большим хитом. Влияние Verizon и Motorola в США действительно помогло Android добиться успеха, как раз тогда, когда Windows Mobile испытывала проблемы.
Ранее Гейтс оценивал убыток от потери мобильного рынка в $400 млрд и называл это своей «крупнейшей ошибкой».



",ru,"











My big mistake. Bill Gates explains why Windows Mobile has ceded the Android market and took the blame
Bill Gates said that, in his opinion, all people could now use Windows Mobile if Microsoft did not get into the antitrust investigation of the US Department of Justice.
07 Nov 2019, 10:32 by Anton Khodorenko
Speaking at a conference in New York, Gates admitted that he was ""too distracted"" by this lawsuit and overlooked the development of the operating system.
“There is no doubt that the antitrust lawsuit harmed Microsoft. Without it, we would have focused on creating an operating system for phones, and instead of Android, you would use Windows Mobile today. If not for the antitrust lawsuit ... We were very close, I was too distracted. I failed because I was distracted, ”admitted Bill Gates.
Microsoft's erratic transition from Windows Mobile to Windows Phone provided a chance for Android to develop, but at that time the company also had great opportunities in the field of mobile devices. Gates said Microsoft missed the opportunity to run Windows Mobile on a Motorola key phone.
“We were only three months late with the release of Motorola, so yes, the winner took everything. No one has heard of Windows Mobile right now, okay. It's a few hundred billion back and forth, ”Gates laments.
It's unclear what Motorola Gates is talking about, but Motorola launched its Android Droid line of smartphones 10 years ago, and it was a big hit. The influence of Verizon and Motorola in the United States really helped Android succeed, just when Windows Mobile was having problems.
Earlier, Gates estimated the loss from the loss of the mobile market at $ 400 billion and called it his ""biggest mistake.""



"
