,src,lang,text
0,"











پسرم خواست تا زینب‌وار شهادتش را بپذیرم/ در ۱۷سالگی راه حسینی را لبیک گفت
مادر دانش آموز شهید قزوینی:

07 Nov 2019, 10:39

مادر دانش آموز شهید قزوینی گفت: پس از شهادتش بارها به خوابم می‌آمد و می‌گفت؛ مادرم گریه نکن زمانی که به مزار من می‌آیی زینب‌وارا بیا مبادا درهنگام گریه و شیون حجاب کسی از بین برود و نگاه نامحرمی به او بخورد.
به گزارش شبکه اطلاع رسانی راه دانا؛ به نقل از صبح قزوین ، شاید برای نسل جدید صحبت در مورد دفاع مقدس و اینکه جنگ تحمیلی چه تفاوت‌هایی با جنگ‌های دیگر داشت و سخن گفتن از شهدا و جانبازان دفاع مقدس کمی دشوارتر باشد اما آشنا شدن این نسل با آرمان‌های شهدا و اهمیت جهاد و مظلومیت ایران در هشت سال دفاع مقدس چیزهای مهمی در آینده را به آن‌ها خواهد آموخت.
شهدای دانش آموز دوران دفاع مقدس تنها کسانی بودند که با سنین کم وارد عرصه شدند و با دل و جان جنگیدند؛ مادران آن‌ها هر چند سخت اما فرزندان خود را دودستی تقدیم این خاک و وطن کردند و پدرانی همچون کوه که فرزندان خود را با تمام رضایت راهی جنگ کردند.
شهید امیر منی در پانزدهم شهریور۱۳۴۶ دراستان قزوین به دنیا آمد؛ نام پدرش نوروز و راننده ماشین سنگین بود و مادرش منصوره نام داشت؛ تا مقطع دوم راهنمایی درس خواند و از سوی بسیج در جبهه حضور یافت.



به مدت سه ماه در اهواز و ۴۵ روز در استان کردستان به کشورش خدمت کرد و در ۲۲ تیرماه سال ۱۳۶۳ در سردشت توسط نیروهای عراقی بر اثر اصابت ترکش به شهادت رسید.
منصوره حاجی فتحعلی مادرشهید امیر منی، اظهار کرد: من دارای ۸ فرزند هستم که امیر فرزند دوم خانواده بود، پسرم در ۱۷ سالگی به ندای شهادت لبیک گفت؛ با این سن کم اطلاعات زیادی در رابطه با دین داشت و از سنین نوجوانی در بسیج با دل و جان فعالیت می‌کرد.
وی افزود: همسرم راضی به رفتنش بود و همیشه می‌گفت که اگر من هم می‌توانستم می‌رفتم اما با ۸ فرزند نمی‌توانم مادرت را تنها بگذارم اما من راضی به رفتن امیر نبودم و هر شب که از پایگاه به خانه می‌آمد به من می‌‌گفت “مادر برای رفتن من راضی نمی‌شوی؟ رضایت بده که من به جبهه بروم” بلاخره با هر جان کندنی بود راضی شدم.
 
مادر شهید ابراز کرد: به اهواز اعزام شد که در دوحمله‌ای که شکل گرفته بود نیز ترکش خورد و سپس به قزوین برگشت و ۱۰ روز در مرخصی بود و برای دومین بار با آغاز طرح لبیک که از سوی امام اعلام شده‌ بود، قرار بر این شد که دوباره اعزام شوند که با پدرش این موضوع را درمیان گذاشت تا برگه رفتنش را امضاء کند.



حاجی فتحعلی گفت: همسرم به او گفت “تو راه خودت را انتخاب کرده‌ای اما اول درست را تمام کن و بعد برو” اما امیر می‌گفت “الان نیاز به درس نیست بیشتر از هر چیزی نیاز به جبهه رفتن و جنگیدن است” که پدرش برگه را امضاء کرد و به او گفت “مبارکت باشد” که از همان لحظه در دل من غوغایی به پا شد.
وی عنوان کرد: انگار از همان روزهای اول کسی به من گفته بود که امیر شهید خواهد شد چراکه از همان زمان بارداری آقایی را در خواب‌هایم می‌دیدم که می‌گفت اسمش را امیر بگذار و بعد از آن که به دنیا آمد همه می‌گفتند چهره او خیلی مومن است.
این مادر شهید ادامه داد: در نوجوانی‌اش دوستانه همه را به کار خیر وا می‌داشت حتی به برادر بزرگترش محترمانه می‌گفت؛ زمانی که بیرون میروی سر به زیر باش تا نکند چشمت به زنی بد حجاب بیفتد.
وی تصریح کرد: در آخرین لحظه‌های رفتن پسرم، پای اتوبوس‌ها که حاضر شدیم همچنان به من می‌گفت “مادرم به رفتن من راضی باش تا با خیال آسوده به جبهه بروم مبادا ناراضی باشی که اگر این طور باشد، میروم و جانباز بر می‌گردم و یک عمر باید مرا در گوشه خانه تحمل کنی” که به او گفتم “تو را به علی اکبر امام حسین(ع) سپردم اگر برنگشتی خودت سعادت شهید شدن در راه خدا را داشته‌ای”.
حاجی فتحعلی تشریح کرد: با پای خودم به پای اتوبوس‌ها رفتم و راهیش کردم اما چه کسی می‌دانست در دل مادرانی که فرزندان خود را دو دستی تقدیم کردند چه می‌گذرد.
وی اضافه کرد: پس از رفتنش به خانه برگشتم، چندی نگذشته بود که به خواب فرو رفتم و در خواب دیدم امیر شهید شده و هراسان از خواب بلند شدم، همسرم برای کار به تبریز رفته بود و او هم شب آن روز خواب شهادت امیر را دیده بود.
 
مادر شهید ادامه داد: دیگر طاقت نداشتم به همه جا رفتم که از امیر خبری بگیریم تا اینکه خودش به منطقه رسیده بود و زنگ زد که با شنیدن صدایش دلم آرام و قرار گرفت اما خوب می‌دانستم این آرام و قرار در دل من همیشگی نخواهد بود.
وی بیان کرد: همزمان با رفتن امیر دخترم هم به پدرش می‌گفت که بگذارید من هم به جبهه بروم اما پدرش قبول نکرد و به او گفت ” تو نمی‌توانی بروی همان حجابت را رعایت کن و نمازت را بخوان تا شرمنده شهدا نباشی”.



این مادر شهید گفت: چند روز از رفتن امیر گذشته بود که خواب بدی دیدم، صبح از خواب بیدارشدم به بنیاد شهید رفتم تا خبری از امیر بگیریم اما کسی جوابی به من نمی‌داد و همه می‌گفتند؛ برو اگر خبری شد ما اطلاع خواهیم داد.
حاجی فتحعلی بیان کرد: صدایی درون خودم می‌شنیدم که امیر شهید شده و دیگر باز نخواهد گشت؛ چندین روز گذشت و کسی خبری نیاورد هرشب گریه می‌کردم و دلتنگ بودم. از اطرافیان شنیدم که به یکی از آشنایان گفته بودند بنیاد شهید منتظر است تا همسرم از تبریز برگردد و خبری دهند.
این مادر شهید تاکید کرد: مادرم و بقیه افراد خانواده به خانه ما می‌آمدند و این شلوغی‌ها بیشتر مرا نگران می‌کرد تا اینکه پدرش به منزل آمد و گفت که دوباره خواب شهادت امیر را دیده و از آن لحظه به بعد درخانه ما غوغا به پا شد؛ همه می‌رفتند و می‌آمدند اما جای پسرم خالی بود.
وی یادآور شد: امیر من شهید شده بود و کسی خبر شهادت او را به من نرساند چراکه از همان روز رفتنش همه چیز را می‌دانستم، قلب یک مادر همه چیز را حس می‌کند و می‌فهمد.
 
حاجی فتحعلی ابراز کرد: پس از شهادتش بارها به خوابم می‌آمد و می‌گفت؛ مادرم گریه نکن زمانی که به مزار من می‌آیی زینب‌وارا بیا مبادا درهنگام گریه و شیون حجاب کسی از بین برود و نگاه نامحرمی به او بخورد.
این مادر شهید بیان کرد: از ابتدای بچگی و نوجوانی‌اش حرفایی در رابطه با حجاب می‌زد که من و پدرش خیلی تعجب می‌کردیم که چطور در این سن کم به این اندازه درک رسیده است؛ با بزرگتر و کوچکتر از خودش همیشه محترمانه و دوستانه برخورد می‌کرد و هیچ وقت دلش نمی‌خواست که کسی او را کودک خطاب کند.
حاجی فتحعلی خاطرنشان کرد: از ابتدا علاقه زیادی به امام حسین(ع) داشتم حتی پیش از انقلاب هم در منزل محفل روضه برپا می‌کردم و اکنون پنجاه سال است که هر ماه روضه برگزار می‌کنم و برای پسر شهیدم یادبود می‌گیرم.
وی ابراز کرد: امیر همیشه و همه جا پیرو دین و رهبری بود و می‌گفت حجاب و امامت را تنها نگذارید و مطیع سخن رهبری باشید و به خواهرانش می‌گفت که حجابشان را رعایت کنند؛ گاهی اوقات هم به کتابخانه می‌رفت و کتاب می‌خواند.
این مادر شهید گفت: هر روز به مزارش می‌رفتم ساعت‌ها در آنجا می‌نشستم و گریه می‌کردم یک روز زمانی که به خانه برگشتم به خوابم آمد و گفت “مادرم پنجشنبه‌ عصرها که به دیدار من می‌آیی به نماز جماعت شب جمعه نمی‌رسم” که از آن خواب به بعد جمعه صبح‌ها به سر مزار پسرم می‌روم.
حاجی فتحعلی تاکید کرد: جوانان امروزی بدانند و آگاه باشند این عکس‌هایی که امروزه از شهدا در سطح شهر دیده می‌شود قبل شهادت آن‌ها است، شهیدان این خاک و وطن قطعه قطعه شدند و به زیر خاک رفتند تا مبادا وجبی از خاک کشورمان به دست دشمنان بی‌افتد.
این مادر شهید در پایان گفت: تمام اعضای خانواده به یکدیگر نگاه می‌کنند؛ اگر بتوانیم پدر و مادر خوبی باشیم بدون شک فرزندان صالح و سالمی به جامعه تحویل خواهیم داد و با بی‌بند و باری در جامعه هیچ نتیجه‌ای مثبتی نخواهیم گرفت.
انتهای پیام/


",fa,"











My son wanted to accept Zaynbar's testimony / At the age of 6 he told Hosseini Road
Mother of Shahid Ghazvini student:

07 Nov 2019, 10:39

The mother of student martyr Qazvini said: ""After his testimony, I would fall asleep many times and say, 'My mother will not cry when you come to my tomb.
It may be a little harder for the new generation to talk about sacred defense and what the difference between the imposed war and other sacred war martyrs and war veterans is, but this generation is a little harder to understand, according to the Dana Road news network. With the aspirations of the martyrs and the importance of Iranian jihad and oppression in the eight years of holy defense, they will learn important things in the future.
The martyred students of the Holy Defense were the only ones who entered the field at a young age and fought with their hearts and souls; their mothers, though hard-working, devoted their children to this land and homeland, and fathers like the mountain with all their children They went to war.
Martyr Amir Mani was born on September 15, in Qazvin province; his father was Norouz, a heavy-duty driver, and his mother was Mansoura. He attended secondary school until the second grade and attended the front in Basij.



He served his country for three months in Ahvaz and for five days in the province of Kurdistan, and was martyred by Iraqi forces in Sardasht on July 6, 2008, after leaving his home.
Mansoor Haji Fath-Ali's mother, Amir Mani, said: ""I have five children, Amir was the second son of the family. My son said at the age of five that he was martyred; The heart and soul worked.
She added: ""My wife was happy to go and she always said that if I could go but with 2 children I could not leave your mother alone but I was not happy to go to Amir and would tell me every night when she came home from the base"" Not satisfied? Let me go to the front. ”I was finally satisfied with any life.

Martyr's mother said: she was sent to Ahwaz that she was left in a bomb attack and then returned to Qazvin and was on leave for 4 days and this was for the second time with the start of the Lubik plan announced by the Imam. To be re-dispatched to discuss it with his father to sign his departure form.



Haji Fath Ali said: ""My wife told him"" you have chosen your own path, but first go right and then go ""but Amir said"" no more lessons are needed now. He signed and told her to be ""blessed"" which was a melee in my heart from that moment.
He said: It was as if from the first days someone had told me that Amir would be a martyr because from that time on I was dreaming of a man in my dreams who would say his name is Amir and after he was born everyone would say that his face is very believable. .
The martyr's mother continued: In her teens, she was friendly to everyone, even respecting her older brother, when you went out head-to-head to prevent your eyes from wearing a bad veil.
He said: In the last moments of my son's passing, the buses that we were present were still telling me, ""My mother is going to make me happy to go to the front so that I will not be unhappy that if so, I will go back and devote a lifetime. You have to bear me in the corner of the house ""when I told him"" I handed you over to Ali Akbar Imam Hussein if you did not have the blessing of being a martyr in the cause of God yourself "".
Haji Fath-Ali explained: I walked on the buses on my own and made my way, but who knew what was going on in the hearts of the mothers who offered their children two-handed.
He added: After returning home, I fell asleep and saw Amir being martyred and asleep I was asleep, my wife had gone to work in Tabriz and she was asleep on that day. had seen.

The martyr's mother continued: ""I could not go anywhere to get news from Amir until he had reached the area and called to hear my voice calm and relaxed, but I knew it would not be permanent in my heart.
He said: ""At the same time my daughter Amir was going to tell her father to let me go to the front, but her father refused and said to her, 'You cannot go to the same hijab and pray until you are ashamed of the martyrs.'



The martyr's mother said: ""It was a few days since Amir had gone to sleep. I woke up in the morning to go to the Martyr Foundation to get news from Amir, but no one would answer me and everyone would say;
Haji Fath-Ali said: I heard a voice inside me that Amir had been martyred and would never come back; several days passed and no one would cry and I would cry every night and miss. I have heard from relatives who told an acquaintance that the Martyr Foundation is waiting for my wife to return from Tabriz and report.
The mother of the martyr emphasized: ""My mother and the rest of the family would come to our house, and these crowds worried me more than when her father came home and said that he had seen Amir's testimony again, and from that moment on our house was in melee; Everyone would go and come, but my son's place was empty.
He recalled: ""My emir was a martyr and no one told me about his testimony because I knew everything from that day on, a mother's heart feels and understands everything.

Haji Fath-Ali said: After his testimony, I would often fall asleep and say, ""Don't cry when you come to my grave, Zeinabwara, lest anyone go away while crying and wearing a veil and look at her shamefully.""
The martyr's mother said: From the beginning of her childhood and adolescence she used to say something about the veil which made me and her father very amazed at how little he understood at this age; he was always respectful and friendly with the older and the younger, and He never wanted anyone to call him a baby.
Haji Fath-Ali noted: From the beginning I was very fond of Imam Hussein (as) even before the revolution, I was holding a house in Rawa and now for fifty years I have been holding a Rawa every month and commemorate my martyr's son.
He said: Amir was always and everywhere a follower of religion and leadership, saying that do not leave the hijab and the Imamate alone and obey the leader's words and tell his sisters to observe their hijab; sometimes he would go to the library and read books.
The martyr's mother said: ""I used to go to Mazar every day for hours, crying, and one day when I got home, I fell asleep and said,"" My mother comes to me on Thursday nights, I don't go to Friday night congregational prayer, "" Then I go to my son's grave on Friday mornings.
Haji Fath-Ali emphasized: Today's youth know and be aware that these are photos of martyrs today in the city before their martyrdom, martyrs of this land and homeland were fragmented and subdued so as not to fall into the hands of our country's enemies .
In the end, the martyr's mother said, ""All the family members look at each other; if we can be good parents we will undoubtedly deliver good and healthy children to the community and we will achieve no positive results in the community.""
End of message /


"
