,src,lang,text
0,"











Venezuela se despide con victoria del Premier-12
07 Nov 2019, 10:37 by Agencias

Superando con amplio marcador de 7 carreras a 1 a Puerto Rico, la selección venezolana de béisbol le dijo adiós al torneo Premier-12 y por ende a los Juegos Olímpicos de Tokio-2020




Taichung.- La selección de Venezuela desplegó un ataque de 16 imparables y con buena actuación de sus lanzadores se impuso este jueves por 7-1 a Puerto Rico en el cierre de la actuación de ambos cuadros en el Premier 12 de béisbol.
En el Taichung Intercontinental Baseball Stadium de Taichung, Taiwán, los venezolanos castigaron el pitcheo de Puerto Rico; en la primera entrada tomaron ventaja de 1-0 con doble de Alí Castillo y sencillo impulsor de Luis Castro y en la segunda ampliaron la diferencia con hits de José Godoy, Diego Rincones y Andrés Blanco y un elevado de sacrificio de Dixon Machado.
Mientras el abridor venezolano Williams Pérez detenía a la ofensiva de los rivales, sus compañeros ampliaron la diferencia con una carrera en el quinto por dobles de Castillo y Castro, agregaron dos en el sexto, empujadas por jonrón de Herlis Rodríguez, y dos en el séptimo con hit de Juniel Querecuto, doble de Luis Castro, elevado de sacrificio de Carlos Rivera y sencillo de José Godoy.
Puerto Rico descontó una carrera en el séptimo acto. Yariel González y Anthony García recibieron boletos y Edwin Gómez empujó al ""home"" al primero con un imparable.
El juego lo ganó William Pérez, con tres hits admitidos en cinco entradas, y lo perdió Luis Cintrón.
Por Venezuela Diego Rincones bateó de 4-3 con un doble y por Puerto Rico Iván de Jesús se fue de 3-3.
El grupo B terminará esta noche con el duelo entre los invictos Japón y Taiwán.

Artículos relacionados






",es,"











Venezuela says goodbye with victory of Premier-12
07 Nov 2019, 10:37 by Agencies

Overcoming with a broad marker of 7 races to 1 to Puerto Rico, the Venezuelan baseball team said goodbye to the Premier-12 tournament and therefore to the Tokyo-2020 Olympic Games




Taichung.- The Venezuelan national team deployed an attack of 16 hits and with good performance of its pitchers won this Thursday by 7-1 to Puerto Rico in the closing of the performance of both teams in the Premier 12 baseball.
At Taichung Intercontinental Baseball Stadium in Taichung, Taiwan, Venezuelans punished Puerto Rico pitching; in the first inning they took advantage of 1-0 with double of Alí Castillo and simple impeller of Luis Castro and in the second they extended the difference with hits by José Godoy, Diego Rincones and Andrés Blanco and a sacrifice sacrifice of Dixon Machado.
While Venezuelan starter Williams Perez stopped the opponents' offense, his teammates widened the difference with a run in the fifth by doubles from Castillo and Castro, added two in the sixth, pushed by Herlis Rodriguez's home run, and two in the seventh with hit by Juniel Querecuto, double by Luis Castro, raised by sacrifice of Carlos Rivera and single by José Godoy.
Puerto Rico discounted a race in the seventh act. Yariel González and Anthony García received tickets and Edwin Gomez pushed the ""home"" to the first with an unstoppable.
The game was won by William Pérez, with three hits admitted in five innings, and Luis Cintrón lost it.
For Venezuela Diego Rincones hit 4-3 with a double and for Puerto Rico Iván de Jesús went 3-3.
Group B will end tonight with the duel between the undefeated Japan and Taiwan.

Related Posts






"
