,src,lang,text
0,"











Суд отправил в тюрьму подростка за ограбление детей и надругательство над могилами
Об этом сообщил сайт прокуратуры Днепропетровской области.

07 Nov 2019, 10:53

Досудебным расследованием уголовного производства по ч. 2 ст. 186 и ч. 3 ст. 297 УК Украины установлено, что ранее судимый за грабежи 17-летний парень во время испытательного срока в 2018 году ограбил двух детей 9 и 13 лет, завладев их мобильными телефонами общей стоимостью более 4 тысяч гривен. Кроме того, он, с целью наживы, похищал из-под надгробных плит металлические трубы и швеллера, которые в дальнейшем сдавал в пункт приема металлолома.
Обвинение поддерживалось Никопольской местной прокуратурой.Свою вину подросток признал частично. По итогам судебного разбирательства, молодому рецидивисту назначили наказание в виде 4 лет и 9 месяцев лишения свободы.Напомним, ранее полицейские Юрьевки ""по горячим следам"" задержали мужчину, который совершил грабеж.

Александр Воловоденко


Хотите получать оперативные и важные новости прямо в свой мессенджер? Подписывайтесь на наш канал в Telegram.

Источник: Прокуратура Днепропетровской области


",ru,"











Court imprisoned teenager for robbery of children and abuse of graves
This was reported by the website of the prosecutor's office of the Dnipropetrovsk region.

07 Nov 2019, 10:53

Pre-trial investigation of criminal proceedings under Part 2 of Art. 186 and h. 3 Art. 297 of the Criminal Code of Ukraine established that a 17-year-old guy previously convicted of robbery during a trial period in 2018 robbed two children of 9 and 13 years of age, taking possession of their mobile phones with a total value of more than 4 thousand hryvnias. In addition, for the purpose of profit, he stole metal pipes and channels from under tombstones, which he later handed over to the scrap metal collection point.
The charge was supported by the Nikopol local prosecutor's office. The teenager partially admitted his guilt. According to the results of the trial, the young recidivist was sentenced to 4 years and 9 months in prison. We will remind, earlier police Yuryevka ""in hot pursuit"" detained a man who committed robbery.

Alexander Volovodenko


Do you want to receive prompt and important news directly to your messenger? Subscribe to our channel in Telegram.

Source: Prosecutor's Office of the Dnipropetrovsk region


"
