,src,lang,text
0,"











""Der Mauerfall war voller Dramatik""
Wende aus US-Perspektive
07 Nov 2019, 10:44 by tagesschau.de

Auch in den USA wird mit zahlreichen Veranstaltungen und Diskussionsforen an die Ereignisse des 9. November 1989 erinnert - und gleichzeitig die Ironie der Geschichte betont.


Von Martin Ganslmeier, ARD-Studio Washington

Als vor vier Jahren der 25. Jahrestag der deutschen Wiedervereinigung gefeiert wurde, hielt sich das Interesse in den USA in Grenzen. Dagegen berichten viele US-Medien derzeit ausführlich über den 30. Jahrestag des Mauerfalls. In Washington gibt es dazu fast täglich Diskussionsveranstaltungen. Die Historikerin Hope Harrison von der George Washington University hat dafür eine einfache Erklärung: ""Der Mauerfall war voller Dramatik. Amerika liebt gute Geschichten, bei denen das Gute über das Böse triumphiert, die Demokratie über den Kommunismus. Das ist wie ein toller Hollywood-Film.""
Harrison ist unter Amerikas Historikern die Expertin für die Berliner Mauer, die deutsche Teilung und die Wiedervereinigung. Pünktlich zum 30. Jahrestag ist gerade ihr drittes Buch, ""After the Berlin Wall"", erschienen - über Deutschland nach dem Fall der Mauer. Harrison verbindet mit dem Thema sehr persönliche Erinnerungen. Als junge Historikerin erfuhr sie von der Maueröffnung im Flugzeug nach Berlin, wo sie an einem Seminar teilnehmen sollte.



Die nächsten zehn Tage erlebte sie als Augenzeugin in Berlin die Aufbruchsstimmung und den Jubel der Bevölkerung. Viele Amerikaner freuten sich mit den Deutschen und waren gleichzeitig stolz über den Erfolg der westlichen Demokratie: ""Wir hatten den Kalten Krieg gewonnen. Die Ostdeutschen wollten das kommunistische System nicht mehr. Sie wollten keine Mauer, sondern die Offenheit und Freiheit des Westens.""
US-Mauerpläne: Ironie der Geschichte
Wenn man Amerikaner fragt, wer am meisten zum Fall der Mauer beigetragen hat, dann werden immer wieder zwei Namen genannt: Papst Johannes Paul II., der die regimekritische Gewerkschaft Solidarnosc in Polen stärkte. Und natürlich der damalige US-Präsident Ronald Reagan und seine berühmte Forderung an der Berliner Mauer: ""Herr Gorbatschow, reißen Sie die Mauer nieder!""
Unstrittig ist, dass Reagans Nachfolger, George Bush senior, viel dazu beitrug, dass nicht nur die Sowjetunion ein wiedervereinigtes Deutschland akzeptierte, sondern auch die europäischen Nachbarn ihre Sorge vor einem allzu starken Deutschland überwanden. Die Historikerin Harrison empfindet es als Ironie der Geschichte, dass es heute ausgerechnet der US-Präsident ist, der Amerika mit einer großen Mauer an der Grenze zu Mexiko abschotten will: ""Es ist traurig, dass 30 Jahre später überall neue Mauern entstehen. Wir erleben den Aufstieg der Rechtsextremen und neuen Protektionismus.""
""Mauern lösen keine Probleme""
Während viele Amerikaner nach dem Fall der Mauer dachten, die westliche Demokratie stehe vor einem weltweiten Siegeszug, spüre sie heute bei ihren Studierenden an der George Washington University die Sorge vor einem Rückfall in autoritäre Strukturen. Auch das Erstarken der Rechtsextremen in Deutschland beunruhige junge Amerikaner: ""Wenn sie etwas über das heutige Deutschland wissen, dann über den Aufstieg der Rechtsradikalen. Denn darüber wird in den Medien so breit berichtet.""
Harrison hofft, dass das Pendel der Geschichte wieder stärker in die Richtung von Freiheit und Demokratie ausschlägt. Ihre Studierenden warnt sie vor ungerechtfertigtem Pessimismus. Schließlich wähle die Mehrheit der Deutschen eben nicht die AfD. Und die Mehrheit der Amerikaner befürworte immer noch ein enges Bündnis mit den Demokratien in Europa. ""Wir alle müssen uns jedoch selbst dafür einsetzen, unsere offene Gesellschaft, die Demokratie und die Bedeutung transatlantischer Beziehungen zu bewahren."" Nach 30 Jahren Mauer-Forschung ist Harrison überzeugt: Mauern lösen keine Probleme. Und von Mauern gehe immer Gewalt aus.


30 Jahre Mauerfall: USA feiern - und Trump will eigene MauerMartin Ganslmeier, ARD Washington 07.11.2019 08:06 Uhr

Über dieses Thema berichtete NDR Info am 07. November 2019 um 06:20 Uhr.


",de,"











""The fall of the Berlin Wall was full of drama""
Turn from the US perspective
07 Nov 2019, 10:44 by Tagesschau.de

In the United States, numerous events and discussion forums also recall the events of November 9, 1989 - and at the same time emphasize the irony of history.


By Martin Ganslmeier, ARD Studio Washington

Four years ago, when the 25th anniversary of German reunification was celebrated, interest in the United States was limited. By contrast, many US media are currently reporting in detail about the 30th anniversary of the fall of the Berlin Wall. In Washington there are almost daily discussion events. Historian Hope Harrison of George Washington University has a simple explanation for this: ""The fall of the Berlin Wall was full of drama, America loves good stories where good triumphs over evil, democracy over communism."" It's like a great Hollywood movie . ""
Harrison is America's historian, the expert on the Berlin Wall, German division and reunification. Just in time for the 30th anniversary, her third book, ""After the Berlin Wall"", has just been published - on Germany after the fall of the Berlin Wall. Harrison associates the subject with very personal memories. As a young historian she learned about the opening of the Berlin Wall on the plane to Berlin, where she was to attend a seminar.



For the next ten days, she witnessed the spirit of optimism and the cheering of the population as an eyewitness in Berlin. Many Americans were happy with the Germans and at the same time were proud of the success of Western democracy: ""We won the Cold War, the East Germans no longer wanted the communist system, they did not want a wall, but the openness and freedom of the West.""
US Wall Plans: Irony of History
If you ask Americans who contributed the most to the fall of the Wall, then there are always two names mentioned: Pope John Paul II, who strengthened the dissident trade union Solidarnosc in Poland. And of course the then US President Ronald Reagan and his famous demand on the Berlin Wall: ""Mr. Gorbachev, tear down the wall!""
It is undisputed that Reagan's successor, George Bush senior, contributed much to the fact that not only did the Soviet Union accept a reunited Germany, but that its European neighbors also overcame their concern about overly strong Germany. The historian Harrison finds it ironic that it is the US President who wants to seal America off with a huge wall on the border with Mexico: ""It is sad that 30 years later, new walls are being built everywhere the rise of the far-right and new protectionism. ""
""Walls do not solve problems""
While many Americans thought after the fall of the wall that Western democracy was on the verge of a worldwide triumph, today it is with its students at George Washington University that they are worried about a relapse into authoritarian structures. The rise of right-wing extremists in Germany also worries young Americans: ""If they know something about today's Germany, then about the rise of the right-wing extremists, because that's what the broad media coverage is about.""
Harrison hopes that the pendulum of history will once again turn more in the direction of freedom and democracy. Her students warn her against unjustified pessimism. After all, the majority of Germans do not choose the AfD. And the majority of Americans still support a close alliance with the democracies in Europe. ""But we all have to work for ourselves to preserve our open society, democracy and the importance of transatlantic relations."" After 30 years of wall research, Harrison is convinced that walls do not solve problems. And there is always violence from walls.


30 years fall of the Berlin Wall: Celebrating the USA - and Trump wants his own WallMartin Ganslmeier, ARD Washington 07.11.2019 08:06

NDR Info reported on this topic on 07 November 2019 at 06:20.


"
