,src,lang,text
0,"











¿Cuánto asciende la herencia de Walter Mercado y quién la recibirá?
Walter Mercado dejó una gran fortuna y ellas serán las herederas del testamento del conocido astrólogo.
07 Nov 2019, 10:44 by Yuriko Cabeza
Walter Mercado, quien falleció el último sábado en Puerto Rico, dejó una gran fortuna, estimada en 10 millones de dólares y está integrada en inversiones y varias colecciones de arte.
El astrólogo dejó estipulado que sus sobrinas Ivonne, Betty, Aida y Dannette Benet, recibirán y cuidarán su patrimonio.



Las cuatro mujeres eran parte del equipo cercano de la popular estrella de televisión y aparte de eso, serán las responsables de publicar las predicciones zodiacales que preparó hasta el 2020.



""Mi tío dejó el horóscopo terminado hasta enero de 2020 incluyendo sus predicciones para el nuevo año”, comentó Ivonne Benet, que también reveló que su tío deseaba que su mansión fuera transformada en un museo donde se conservaran sus singulares capas, instrumentos de observación de las estrellas, anillos de diamantes y demás objetos de valor del astrólogo. Hay que ver, queda en una urbanización, si no, se hará otra cosa la idea es complacerlo"", explicó una de las sobrinas del conocido astrólogo.



No solo son las posesiones materiales, Walter dejó una mascota muy querida de nombre Runo, mismo que quedará bajo el cuidado de sus familiares. En los siguientes días se dará a conocer la fecha exacta de la lectura del testamento. 
Mercado falleció a los 87 años el pasado 2 de noviembre en su natal Puerto Rico.




Te puede interesar





",es,"











How much is Walter Mercado's inheritance and who will receive it?
Walter Mercado left a great fortune and they will be the heirs of the will of the well-known astrologer.
07 Nov 2019, 10:44 by Yuriko Head
Walter Mercado, who died last Saturday in Puerto Rico, left a large fortune, estimated at 10 million dollars and is integrated into investments and various art collections.
The astrologer stipulated that his nieces Ivonne, Betty, Aida and Dannette Benet will receive and take care of their assets.



The four women were part of the nearby team of the popular television star and apart from that, they will be responsible for publishing the zodiacal predictions he prepared until 2020.



""My uncle left the horoscope finished until January 2020 including his predictions for the new year,"" said Ivonne Benet, who also revealed that his uncle wanted his mansion to be transformed into a museum where his unique layers, observation instruments of the stars, diamond rings and other valuables of the astrologer. It is necessary to see, it is in an urbanization, otherwise, the idea will be done to please it, ""said one of the well-known astrologer's nieces.



Not only are the material possessions, Walter left a beloved pet named Runo, who will remain under the care of his relatives. In the following days the exact date of the reading of the will will be announced.
Mercado died at age 87 on November 2 in his native Puerto Rico.




It may interest you





"
