,src,lang,text
0,"











EL CONFLICTO CATALÁN
Sánchez señala en un artículo en la prensa extranjera que el separatismo catalán es un ""desafío a Europa""
Defiende que ""ningún demócrata puede entender que los líderes independentistas emprendieran la vía unilateral""Insiste en tender la mano al diálogo siempre que los dirigentes del 'procés' regresen al marco constitucional
07 Nov 2019, 10:12 by Europa Press
El presidente del Gobierno en funciones, Pedro Sánchez, ha escrito un artículo que publican una veintena de medios europeos como el francés L'Echo o el irlandés Irish Examiner en el que argumenta que el independentismo catalán supone un ""desafío a Europa y a los europeos"". A lo largo del texto, titulado 'Catalunya, España, Europa: mejor unidos', Sánchez defiende la calidad democrática de España y denuncia la unilateralidad, las ""mentiras"", y ""la normalización de la violencia"" de algunos líderes independentistas. [Sigue las últimas noticias de las elecciones generales de noviembre del 2019 en directo.]
Sánchez comienza su artículo explicando que el proyecto secesionista catalán se ha construido ""contra el marco constitucional y silenciando a la mayoría de catalanes contrarios a la independencia"", por lo que es incompatible con los valores europeos.
""Es también un desafío a Europa y a los europeos. Preservar esos valores en Catalunya hoy es proteger la Europa abierta y democrática que defendemos"", ha asegurado Sánchez. ""La Europa que admiramos se ha forjado frente a los nacionalismos excluyentes y los extremismos que superponen identidades al principio de igualdad de todos los ciudadanos"", añade el presidente en su artículo.
Continúa defendiendo la Constitución ""plenamente democrática"" de 1978, ""apoyada por el 90,5% en Catalunya"", y los ""avances sociales y democráticos logrados por el sistema español en las últimas décadas, lo que le ha situado entre las primeras democracias del mundo"".
La deriva unilateral
Al tiempo, Sánchez recuerda la escalada independentista del 2017 y explica que en Catalunya se ""incumplieron todos los requerimientos y resoluciones del Tribunal Constitucional"", los independentistas ""aprobaron leyes de desconexión del Estado español declaradas inconstitucionales, convocaron ilegalmente un referéndum sin ninguna garantía democrática y proclamaron una supuesta república catalana"".
""Ningún Estado contempla la vía unilateral de la secesión de uno de sus territorios en su ordenamiento constitucional. Y ningún demócrata puede entender que los líderes del separatismo emprendieran ese camino y menos aún contando con un apoyo inferior al 48% de los votos emitidos en las elecciones autonómicas"", ha añadido el presidente, quien avisa de que en este tiempo se ""exacerbaron los sentimientos, se hicieron circular noticias falsas y se alentó un espíritu de confrontación con el resto de España"".
Denuncia la normalización de la violencia
Asimismo, hace pedagogía sobre la sentencia del Tribunal Supremo y sobre cómo se ha producido el juicio a los dirigentes del 'procés'. ""Nuestro sistema judicial permite que las decisiones de los tribunales puedan ser revisadas ante instancias nacionales e internacionales"", señala. ""Por ello, no se puede cuestionar el funcionamiento de un Poder Judicial independiente en España, cuyo ordenamiento jurídico descansa en el principio de separación de poderes"", ha asegurado.
Por último, denuncia las respuestas violentas a la sentencia, asegurando que esta violencia ha sido normalizada por algunos dirigentes independentistas. ""Han manifestado públicamente que la violencia puede ser necesaria para que su causa adquiera una mayor visibilidad. Se trata, en definitiva, de la normalización de la violencia como recurso político"", señala, en referencia a las declaraciones de la presidenta de la ANC, Elisenda Paluzie.
""Si algo hemos aprendido con dolorosas lecciones en la historia de Europa es que ninguna pretensión política jamás puede legitimar el uso de violencia"", afea.
Tiende la mano al diálogo
No obstante, Sánchez recalca que hay espacio para el diálogo si el independentismo abandona la unilateralidad y regresa al marco constitucional. ""Existen ámbitos de diálogo a explorar si los líderes separatistas abandonan definitivamente la vía unilateral. Podemos hablar y escucharnos, sin amenazas y sin descalificaciones. Sé que hay heridas abiertas, que hay dolor, que hay frustración"", argumenta el presidente.
""A pesar de ello, hay una oportunidad para la esperanza y para el diálogo, reconociendo lo que hemos hecho juntos y pensando en todo lo que juntos podemos hacer para mejorar el bienestar de todos los ciudadanos"", ha subrayado en su publicación.
Eso sí, Sánchez recalca que ""para eso"", ""el separatismo catalán debe volver a la Constitución y respetar la ley"". En este sentido, concluye que su Gobierno tiene objetivos que trascienden una visión nacionalista, por ello ""necesita a Catalunya y a la sociedad catalana en este empeño"".

Más información





Lo más visto


Edición Global
Catalunya



Encuesta de Andorra de las elecciones generales de noviembre del 2019: tercer sondeo


Últimas noticias de las elecciones generales de noviembre y de Catalunya | Directo


Así 'cazaba' la asesina de Badoo: ""Me gustan los maduritos""


El Reino Unido rectifica y no ve ""desproporcionada"" la euroorden de Ponsatí


CDR ayudaron a los imputados por terrorismo a comprar material para fabricar explosivos




Últimas noticias de las elecciones generales de noviembre y de Catalunya | Directo


Encuesta de Andorra de las elecciones generales de noviembre del 2019: tercer sondeo


CDR ayudaron a los imputados por terrorismo a comprar material para fabricar explosivos


El Reino Unido rectifica y no ve ""desproporcionada"" la euroorden de Ponsatí


Antonio Maestre se enfrenta a Ana Rosa por el conflicto en Catalunya: ""Yo sí estoy en la calle, tú no""




",es,"











THE CATALAN CONFLICT
Sánchez points out in an article in the foreign press that Catalan separatism is a ""challenge to Europe""
He defends that ""no democrat can understand that the independence leaders undertook the unilateral way"" Insists on reaching out for dialogue whenever the leaders of the 'procés' return to the constitutional framework
07 Nov 2019, 10:12 by Europa Press
The acting government president, Pedro Sánchez, has written an article published by about twenty European media such as the French L'Echo or the Irish Irish Examiner in which he argues that Catalan independence is a ""challenge to Europe and Europeans"" . Throughout the text, entitled 'Catalonia, Spain, Europe: better united', Sanchez defends the democratic quality of Spain and denounces the unilaterality, the ""lies"", and ""the normalization of violence"" of some independence leaders. [Follow the latest news of the November 2019 general election live.]
Sánchez begins his article explaining that the Catalan secessionist project has been built ""against the constitutional framework and silencing the majority of Catalans against independence"", so it is incompatible with European values.
""It is also a challenge for Europe and Europeans. Preserving those values in Catalonia today is to protect the open and democratic Europe that we defend,"" said Sánchez. ""The Europe we admire has been forged against the exclusionary nationalisms and extremists that overlap identities to the principle of equality of all citizens,"" the president adds in his article.
He continues to defend the ""fully democratic"" Constitution of 1978, ""supported by 90.5% in Catalonia"", and the ""social and democratic advances achieved by the Spanish system in recent decades, which has placed him among the first democracies of the world"".
Unilateral drift
At the same time, Sanchez recalls the independence escalation of 2017 and explains that in Catalonia all the requirements and resolutions of the Constitutional Court were violated, the independentists approved laws to disconnect the Spanish State declared unconstitutional, illegally called a referendum without any democratic guarantee and proclaimed a supposed Catalan republic. ""
""No State contemplates the unilateral way of secession of one of its territories in its constitutional order. And no Democrat can understand that the leaders of separatism undertook that path and even less with less than 48% of the votes cast in the autonomous elections, ""added the president, who warns that at this time"" feelings were exacerbated, false news circulated and a spirit of confrontation with the rest of Spain was encouraged. ""
Denounces the normalization of violence
He also pedagogy about the ruling of the Supreme Court and how the trial of the leaders of the 'procés' took place. ""Our judicial system allows court decisions to be reviewed before national and international authorities,"" he says. ""Therefore, you cannot question the functioning of an independent judiciary in Spain, whose legal system rests on the principle of separation of powers,"" he said.
Finally, he denounces the violent responses to the sentence, ensuring that this violence has been normalized by some independence leaders. ""They have publicly stated that violence may be necessary for their cause to gain greater visibility. It is, in short, the normalization of violence as a political resource,"" he says, referring to the statements of the president of the ANC, Elisenda Paluzie.
""If we have learned something with painful lessons in the history of Europe, it is that no political claim can ever legitimize the use of violence,"" he says.
Hold your hand to dialogue
However, Sanchez emphasizes that there is room for dialogue if the independence movement abandons unilateralism and returns to the constitutional framework. ""There are areas of dialogue to explore if the separatist leaders leave the unilateral route definitively. We can talk and listen, without threats and without disqualifications. I know that there are open wounds, that there is pain, that there is frustration,"" argues the president.
""Despite this, there is an opportunity for hope and for dialogue, recognizing what we have done together and thinking of everything we can do together to improve the well-being of all citizens,"" he stressed in his publication.
Of course, Sánchez stresses that ""for that,"" ""Catalan separatism must return to the Constitution and respect the law."" In this sense, he concludes that his Government has objectives that transcend a nationalist vision, which is why ""it needs Catalonia and Catalan society in this endeavor.""

More information





Most seen


Global Edition
Catalunya



Andorra survey of the November 2019 general elections: third poll


Latest news of the November and Catalunya general elections | Direct


So 'hunted' the killer of Badoo: ""I like the mature""


The United Kingdom rectifies and does not see ""Ponsatí Euroorder"" disproportionate


CDR helped those accused of terrorism to buy material to make explosives




Latest news of the November and Catalunya general elections | Direct


Andorra survey of the November 2019 general elections: third poll


CDR helped those accused of terrorism to buy material to make explosives


The United Kingdom rectifies and does not see ""Ponsatí Euroorder"" disproportionate


Antonio Maestre confronts Ana Rosa about the conflict in Catalonia: ""I am on the street, you are not""




"
