,src,lang,text
0,"











Штаб ООС заявил о готовности начать разведение войск в Петровском на Донбассе
Украинская сторона готова начать разведение сил и средств в районе Петровского и Богдановки на Донбассе в пятницу, 8 ноября.

07 Nov 2019, 10:59

Об этом сообщил руководитель пресс-центра Операции объединенных сил Андрей Агеев, пишет Интерфакс-Украина.
«Сегодня заканчиваются седьмые сутки (соблюдения режима тишины), сегодня мы уведомили ОБСЕ через Министерство иностранных дел о том, что мы готовы. От МИД поступит подтверждение, и надеюсь, что завтра в 12 часов все пройдет по плану», — пояснил он.
Напомним, президент Владимир Зеленский заявил, что разведение сил и средств от линии соприкосновения на Донбассе в районе населенного пункта Петровское должно начаться 4 ноября.
Дату разведения пересмотрели из-за обстрелов 30 октября.
Процесс разведения сил на Донбассе начали после договоренности, достигнутой 1 октября во время трехсторонних переговоров в Минске по урегулированию ситуации на востоке Украины.
Вооруженные силы Украины и пророссийские боевики должны отойти с занимаемых ими сейчас позиций на трех участках: Станица Луганская, Петровское и Золотое.
В Станице Луганской и Золотом процесс уже начался, вызвав протесты части населения, которая опасается, что боевики займут оставленные украинскими военными позиции.


",ru,"











OOS headquarters announced its readiness to begin troop withdrawal in Petrovsky in the Donbass
The Ukrainian side is ready to begin the withdrawal of forces and assets in the area of Petrovsky and Bogdanovka in the Donbass on Friday, November 8.

07 Nov 2019, 10:59

This was announced by the head of the press center of the Operation of the combined forces, Andrey Ageev, writes Interfax-Ukraine.
“Today is the seventh day (observing the silence regime), today we notified the OSCE through the Ministry of Foreign Affairs that we are ready. A confirmation will be received from the Foreign Ministry, and I hope that tomorrow at 12 o’clock everything will go according to plan, ”he explained.
Recall, President Vladimir Zelensky said that the withdrawal of forces and assets from the contact line in the Donbass in the area of the Petrovskoye settlement should begin on November 4.
The breeding date was revised due to shelling on October 30th.
The process of the separation of forces in the Donbass began after the agreement reached on October 1 during tripartite negotiations in Minsk to resolve the situation in eastern Ukraine.
The Armed Forces of Ukraine and pro-Russian militants must withdraw from the positions they currently occupy in three sectors: the Village of Lugansk, Petrovskoye and Zolotoye.
In the village of Lugansk and Zolotoy, the process has already begun, provoking protests from a part of the population who fear that the militants will occupy the positions left by the Ukrainian military.


"
