,src,lang,text
0,"











Kontantrallyt smittar av sig på svenska börsen
Kontanthanteringen är i fokus när säkerhetskoncernen G4S släpper sin kvartalsuppdatering på torsdagen. Ska den säljas eller delas ut? Det får betydelse även för svenska konkurrenten Loomis. 
06 Nov 2019, 20:43 by Agnetha Jönsson



Artikeln du läser är låst. Logga in eller teckna en digital prenumeration för att läsa Nordens största affärstidning.

Full tillgång till Di.se med nyheter och analyser
Tillgång till över 1100 aktiekurser i realtid
Dagens industri som e-tidning redan kvällen innan
Innehållet i alla Di:s appar, tjänster och nyhetsbrev

Är du prenumerant? Prova att ladda om sidan och kontrollera att du är inloggad.
Saknar du en prenumeration? Bli prenumerant
Detta är en artikel från Di:s analysredaktion. Dagens industris journalister måste rapportera privata aktieinköp till ansvarig utgivare, och innehavet får säljas tidigast efter en månad.
Kommentera artikeln


",sv,"











Cash rally infects on the Swedish stock exchange
Cash management is in focus when the security group G4S releases its quarterly update on Thursday. Should it be sold or distributed? It will also have significance for Swedish competitor Loomis.
06 Nov 2019, 20:43 by Agnetha Jönsson



The article you are reading is locked. Log in or sign up for a digital subscription to read the largest business newspaper in the Nordic region.

Full access to Di.se with news and analysis
Access to over 1100 real-time share prices
Today's industry as an e-newspaper already the night before
The content of all Di's apps, services and newsletters

Are you a subscriber? Try reloading the page and make sure you are logged in.
Missing a subscription? Become a subscriber
This is an article from Di's analysis editor. Today's industry journalists must report private share purchases to the responsible publisher, and the holding may be sold at the earliest after one month.
Comment on this article


"
