,src,lang,text
0,"











Пребывание Кулика на должности в ГПУ может навредить государству, – Шинкаренко

06 Nov 2019, 20:25


Пребывание прокурора Константина Кулика на посту в Генеральной прокуратуре может нанести вред нашему государству.

Об этом в эфире информационно-аналитического проекта «Великолепная четверка» на телеканале ZIK заявил народный депутат Украины (фракция «Слуга народа») Иван Шинкаренко.
Господин Шинкаренко, комментируя события, происходящие вокруг прокурора Константина Кулика, отметил, что вопрос об увольнении или неувольнении скандального прокурора уже не стоит, поскольку он точно будет уволен, и в этом нардепов лично заверил Руслан Рябошапка. Однако, он отметил, что в этом контексте более важен другой вопрос, что будет делать господин Кулик до момента его увольнения.
«Как вы отметили, что осенью Джулиани получал какие-то документы от господина Кулика, то, по моему мнению, это говорит о шпионаже в пользу другого государства. Поэтому вопрос пребывания господина Кулика на посту в Генеральной прокуратуре может сделать вред нашему государству таким путем, как это уже происходило, о чем уже есть показания», – заявил депутат.



Поэтому, по его словам, у него есть надежда, что господин Рябошапка быстрее примет решение и уволит Константина Кулика до того момента, когда начнет работать новая прокуратура.
«Еще одна из причин, почему  не увольняют Кулика, потому что он должен передать дела другим следователем. На мой вопрос, может ли он каким-то образом навредить следствию и, действительно, спрятать какие-то документы или использовать их с какой-то целью несанкционированной, господин Рябошапка сказал, что это возможно, потому что сейчас не происходит никакого следствия  по Кулику, за ним никто не наблюдает 24 часа в сутки. Такой риск есть», – подчеркнул нардеп Шинкаренко и подчеркнул, что комитет ВР будет инициировать обращение к генпрокурору относительно увольнения Константина Кулика «до того момента, когда тот успеет навредить прокуратуре и следственным действиям».
Напомним, активисты общественной организации «Стоп коррупции» обратились к нардепам из Антикоррупционного комитета относительно недопущения прокурора Константина Кулика к работе в новой прокуратуре.
Как сообщалось, нардепы подписали коллективный запрос на отстранение от должности прокурора Константина Кулика.
Впоследствии, 1 ноября, на сайте официального интернет-представительства Президента Украины появилась электронная петиция «Об увольнении с должности работника Офиса Генерального прокурора Кулика Константина Геннадьевича».
Генеральный прокурор Руслан Рябошапка 5 ноября рассмотрел обращения народных депутатов Украины относительно переназначения в органы прокуратуры прокурора Константина Кулика.

читайте также







",ru,"











Kulik's stay at positions in GPU can harm the state, - Shinkarenko

06 Nov 2019, 20:25


The stay of the prosecutor Konstantin Kulik at the post in the Prosecutor General’s Office may harm our state.

This was announced by Ivan Shinkarenko, People’s Deputy of Ukraine (faction “Servant of the People”), on the air of the informational and analytical project “The Magnificent Four” on ZIK channel.
Mr. Shinkarenko, commenting on the events taking place around the prosecutor Konstantin Kulik, noted that the question of dismissal or dismissal of the scandalous prosecutor is no longer standing, as he will definitely be dismissed, and Ruslan Ryaboshapka personally assured the people's deputies. However, he noted that in this context, another question is more important, what will Mr. Kulik do until his dismissal.
“As you noted that in the autumn Giuliani received some documents from Mr. Kulik, then, in my opinion, this speaks of espionage in favor of another state. Therefore, the question of Mr. Kulik’s stay at the post in the General Prosecutor’s Office can do harm to our state in the same way as it has already happened, about which there is already evidence, ”the deputy said.



Therefore, according to him, he has a hope that Mr. Ryaboshapka will quickly make a decision and dismiss Konstantin Kulik before the new prosecutor’s office begins to work.
“Another of the reasons why Kulik is not fired, because he must transfer the case to another investigator. To my question, can he somehow harm the investigation and, indeed, hide some documents or use them for some unauthorized purpose, Mr. Ryaboshapka said that this is possible, because now there is no investigation on Kulik, no one is watching him 24 hours a day. There is such a risk, ”the People’s Deputy Shinkarenko emphasized and emphasized that the Verkhovna Rada Committee would initiate an appeal to the Prosecutor General regarding the dismissal of Konstantin Kulik“ until the moment when he manages to harm the prosecutor’s office and investigative actions. ”
We will remind, activists of the public organization ""Stop Corruption"" appealed to people's deputies from the Anti-corruption Committee regarding the prohibition of the prosecutor Konstantin Kulik to work in the new prosecutor's office.
As reported, the people's deputies signed a collective request for the dismissal of the prosecutor Konstantin Kulik.
Subsequently, on November 1, the electronic petition “On the dismissal of an employee of the Office of the Attorney General Kulik Konstantin Gennadyevich” appeared on the official website of the President of Ukraine.
On November 5, the Prosecutor General Ruslan Ryaboshapka examined appeals from people's deputies of Ukraine regarding the reassignment of the prosecutor Konstantin Kulik to the prosecution authorities.

read also







"
