,src,lang,text
0,"











IL RICORDO
Brunello Rondi, un uomo del Rinascimento
A trenta anni dalla scomparsa il racconto appassionato del figlio. Storico sceneggiatore di Fellini, ricevette due nomination all’Oscar
07 Nov 2019, 05:59 by Umberto Rondi
Sono felice che in questi ultimi anni ci sia stata una riscoperta  della grandezza del lascito culturale e artistico  di mio padre Brunello. Scriverlo, oggi, nel giorno del trentesimo anniversario della sua morte è particolarmente significativo e fonte di consolazione e serenità pensando a quanto mio padre stesso ne sarebbe stato  contento dopo dimenticanze, ingiustizie e approssimazioni che non sono certo mancati, in particolare rispetto alla sua lunga ed eccezionale collaborazione e amicizia con Federico Fellini, il suo geniale e vampiresco sodale di tante meravigliose avventure artistiche e umane.
Mio padre spaziò come un vero uomo del Rinascimento in tantissimi  campi artistici, intellettuali, espressivi. Fu poeta, sceneggiatore, regista di film e autore di drammi per il teatro;  filosofo, saggista musicale e critico d’arte, teorico del cinema con  libri pionieristici e reporter di viaggi avventurosi in terre lontane, docente al Centro Sperimentale di Cinematografia e documentarista . Nel cinema, ricevette due volte la Nomination all’Oscar come miglior sceneggiatore per la sua co-autorialità di copioni di  capolavori leggendari come ""La dolce vita"" e ""8 ½"" di Federico Fellini. Roberto Rossellini, che gli fu presentato dal fratello di mio padre, Gian Luigi Rondi gli disse: ‘’Ti ringrazio molto: mi hai presentato un genio’’.
Da anni c’è, in svariati Paesi nel mondo una felice, feconda e importante riscoperta e valorizzazione del geniale lavoro di mio padre. Di recente il suo film da regista più importante ‘’Il demonio’’ –che oggi in molti indicano come anticipatore –più colto, mistico e raffinato, però- dell’Esorcista di Friedkin, arrivato dieci anni dopo, è stato presentato al Lincoln Center di New York dopo essere stato riprogrammato alla Mostra di Cinema di Venezia e al Festival di Locarno. Enrico Ghezzi lo ha programmato su Rai Tre definendolo un capolavoro; anche un altro suo film, co-diretto da Polo Heusch, ""Una vita violenta"", dal libro di Pasolini,  ha trovato una nuova vita, uscendo dall’oblio e venendo proiettato ed editato in dvd. E’ uscita una bellissima raccolta di saggi sulla sua opera complessiva dal titolo ""Il lungo respiro di Brunello Rondi"" (curato da Alberto Pezzotta e Stefania Parigi per le Edizioni Sabinae, 2010) lungo perché anticipatore, dotato di un’ampia e riccissima gittata nel tempo e nello spazio della conoscenza. Con il suo film ‘’Valeria dentro e fuori’’ con una straordinaria Barbar Bouchet, anticipò il tema, diventato dirompente pochi anni dopo, nel 1978, dell’istituzione manicomiale e della segregazione dei malati psichici. Con la sua racconta di versi ""Carta d’Europa"" sembrò profetizzare la nascita della di lì a poco sorta Comunità Europea.  O, da giovane, con il suo saggio ""Il neorealismo italiano"" , ""Il cinema di Fellini"", ""Bartòk"" anticipò interi filoni di studi dedicati  questi tre argomenti, e infatti si tratta di testi citatissimi nelle bibliografie o nei corsi universitari. Nel 2014 è uscito presso la ‘’Toronto University Press’’ il saggio, di Federico Pacchioni, dl titolo ‘’Inspiring Fellini’ - Literary Collaborations behind the Scenes (‘Ispirando Fellini-Collaborazioni letterarie dietro le immagini.’’) in cui si attribuisce la giusta importanza allo straordinario contributo che hanno dato  gli sceneggiatori a Felini  con bellissime parti dedicate a mio padre. L’ ‘’Osservatore Romano’’ gli ha dedicato, poco tempo fa, un ampio elzeviro incentrato sulle sue raccolte poetiche. Alcuni suoi film vengono proiettati in piccole e grandi rassegne in Italia e all’estero. E la lista potrebbe continuare a lungo. Basti pensare che su Internet  continuano ad uscire molti studi analitici sul suo lavoro.
Rispetto ad un capitolo fondamentale della sua vita creativa ma anche umana, il rapporto con Federico Fellini, che durò circa quasi trentacinque anni, desidero qui dire che purtroppo, negli anni, tale relazione si guastò per via della rapacità vampiresca, sleale, furba e scorrettissima (citerò alcuni esempi documentati più avanti)che manifestò, con una certa frequenza Fellini; un veleno –tanto più pericoloso perché ammantato di un’irresistibile seduttività, e di un’affascinante simpatia. Fellini è stato, in numerose circostanze,  per i suo i collaboratori, e in modo specialissimo per il mio padre – il più ingenuo e io ritengo anche il più generoso e signorile di tutti-il parente umano, per così dire di quelle piante carnivore tanto affascinanti quanto subdole. Il Drosophyllum, temibile pianta carnivora, per esempio, leggo da https://www.deabyday.tv/  su internet ""emette un dolce profumo che attrae gli insetti intrappolandoli sulle sue lunghe foglie appiccicose’’. Mi sembra una metafora perfetta per questi lugubri aspetti felliniani.
Del resto, mio padre fu in buona, anzi ottima compagnia. In un Paese, dove certi mostri sacri non si criticano mai come l’Italia devoto ai santini laici, agli intoccabili, tra cui appunto Fellini, peraltro sicuramente un autentico genio e una persona spesso spiritosa e divertente che fece morire dal ridere mio padre e che seppe avere,talora, anche momenti di  generosità nei suo confronti (per quanto del tutto imparagonabile a quella che ricevette da ‘’Brunellone’’,  come lo lui chiamava che come scrisse Tullio Kezich,che definì mio padre ‘’sapientissimo’’  nella rivista di studi felliniana ora defunta ‘’Amarcord’’ gli fece anche da ghost writer, da ‘’negro’’ come purtroppo si usa dire ancora in tante occasioni in  cui venivano richiesti  articoli e pareri a Fellini sui più disparati argomenti e che il riminese non sapeva assolutamente affrontare anche perché al tempo stesso molto intelligente e molto ignorante. Mio padre nel suo saggio dedicato appunto a Fellini , peraltro colmo di stima e di affetto ma anche indipendente, scrive per esempio di ‘’Federicone’’ ‘’Quei cinque libri al massimo che avrà letto per intero in tutta la sua vita’’. E mio padre lo conosceva benissimo, intimamente,  tanto che Fellini stesso disse in un’intervista che aveva tre amici :’’Nino Rota, Marcello Mastroianni e Brunello Rondi’’.
Fu proprio Fellini in ‘eccezionale intervista scritta da Oriana Fallaci, che certo non aveva prona soggezione dei ‘mostri sacri  ‘’Proust? Mah! Io sono molto ignorante... Che vergogna eh? Una sana, vasta, solida, coriacea ignoranza. Non so nulla di nulla. E il discorso non vale solo pei libri. Vale anche pei film (‘’Gli antipatici’’, 1963). Dicevamo, in ottima compagnia anche se di fronte al Drosophyllum c’è poco da fare, credo. “Fellini era un genio, ma tendeva a comportarsi come  se tutto fosse suo, non il frutto di un lavoro comune’’ (Tullio Pinelli in ‘’Fellini raccontando di me’’, di Costanzo Costantini,  Editori Riuniti); Suso Cecchi D’Amico: “Fellini mise a dura prova il fegato di Flaiano dichiarando sempre di non avere sceneggiatura e di andare sul set con in tasca un fogliettino grande quanto il biglietto dell’autobus sul quale nottetempo aveva segnato qualche appunto. Sfacciato. Le sceneggiature le aveva eccome…”.   (Il Fatto Quotidiano articolo di Malcom Pagani, 20/7/ 2016 ); ‘’Mi ha trattato come fossi  una bottiglia di Coca-Cola, lui tira dalla cannuccia e aspira’’   Ennio Flaiano; ‘’Oltre a dirigere il film io voglio essere l’autore del soggetto e un collaboratore alla sceneggiatura. In questo caso è sciocco chiedersi chi sia l’autore del film. Sarebbe come chiedere a un poeta se l‘autore dei versi è lui oppure la carta e l’inchiostro che adopera’’  (intervista a Fellini di Mino Guerrini ‘’Il Mondo’’ 1950)‘’Federico si è servito di sceneggiatori  (…) non di rado sopraffatti’’ (Tullio Kezich  ‘’Fellini- Amarcord, 2007) La succitata Fallaci disse ,di Fellini :’’Io gli volevo bene davvero a Federico Fellini. Dopo quel tragico incontro gliene voglio assai meno, ho anche smesso di dargli del tu. Lui può anche negarlo. Ma, come dice Jeanne Moreau un po’ più in là, egli è un tale bugiardo che la menzogna diventa alla sua buona fede verità sacrosanta. Fellini secondo la Fallaci l’aveva trattata malissimo, in modo arrogante e vergognoso perché lei aveva osato criticarlo, che del resto proprio alla Fallaci aveva dichiarato: ‘’So bene che anche la critica negativa può essere costruttiva, ma la sola che capisco è quella materna, fatta di bacetti, di carezze, di paroline lusinghiere...’’.
Certo, non proprio l’approccio e lo stile, grazie a Dio, della Fallaci che ricostruisce e raccontare l’episodio avvenuto dopo l’uscita id un articolo non gradito all’ormai famosissimo regista: ‘’Ero al giornale quando telefonò e gridava tanto che tutti lo udirono quando mi ricordava che Fellini è un grande regista, un artista, un grandissimo artista, tirando fuori una voce che avrebbe fatto morire di spavento il gangster  che aveva fatto morire lui di spavento, insultandomi a morte mentre  immaginavo il suo piglio mussolinesco, la sua saliva che copriva come rugiada il telefono, il suo faccione sudato d’ira ed orrore per la blasfemia che avevo osato commettere. Tentai di girare con garbo gli insulti, di spiegargli quel che pensavo in quel momento di lui. Non mi udì, non mi udiva. E mentre tutti ridevano commentandone gli urli, dolcemente deposi il ricevitore’’. (Gli antipatici, Rizzoli). Pervaso dai  sensi di colpa Fellini richiamò  la Fallaci  con i suoi toni ben diversi: ‘’Tesorino, amorino, Orianina, bambina…’’ Eh,  Fellini, il Drosophyllum, non si smentisce mai.
Pasolini usò una metafora sempre legata alla terra, per descrivere queste parti limacciose e subdole di Federico Fellini che tutto il mondo si appresta a celebrare nel 2020 per il centenario della nascita –cosa sicuramente giusta-credo omettendo le varie parti in ombra di questo famoso regista. Pasolini scrive infatti: ‘’Fellini è una savana piena di sabbie mobili, per penetrare nella quale necessita o la guida nera della malafede o l’esploratore bianco della razionalità’’. Anche io ho qualcosa e sicuramente di ben più importante e grave da raccontare. Parto dalla fine, e si tratta dell’episodio più doloroso. Fellini chiese a mio padre dei testi per ‘’Ginger e Fred’’ , una piccola collaborazione rispetto  ai fasti del passato comunque io stesso  portai a Fellini decine di cartelle dattiloscritte che lui usò ma alla fine non citò né tantomeno ringraziò mio padre nei titoli di testa. Mio padre ci rimase malissimo. Come scrisse mio zio Gian Luigi Rondi, storico critico proprio de Il Tempo, parlando di mio padre: ‘’E l’hanno tradito tutti a cominciare da Fellini. Le idee che gli ha portato ,e lui quasi a trattarlo da ‘’negro’’, tenendolo tanto spesso nell’anonimato, egoista geloso    (Gian Luigi Rondi ‘’Le mie vite allo specchio. Diari 1947-97. Edizione Sabinae, 2016). Sempre zio Gian Luigi riporta che dopo questo misfatto Fellini telefonò a mio zio dicendogli ‘’Se sei cristiano, non dovresti portarmi rancore’’ (stessa fonte) riferendosi a mio padre e alla citazione mancata, appunto, per ‘’Ginger e Fred,’’ con mio zio che annota: ‘’A Federico non l’ho mai perdonata’’. Nel 1978 esce ‘’Prova d’orchestra’’, sceneggiato a quattro mani da Fellini e mio padre, straordinario musicologo e saggista. Chi coltiva correttezza e professionalità si sarebbe aspettato di leggere, nei titoli ‘’sceneggiatura di F.Fellini e B. Rondi’’ ma il grandissimo artista ancora una volta non si era smentito. Fu il produttore del film e amico della mia famiglia, Leo Pescarolo a rivelarmelo, casualmente ‘’Sai mi ha telefonato Federico chiedendomi di mettere Brunello come collaboratore alla sceneggiatura (non come più ‘’sceneggiatore’’, cioè)  ‘’Egoista, geloso’’, come, appunto, diceva zio Gian Luigi. E che dire del  copione de ‘Il viaggio di Mastorna’’, ‘’il film non realizzato più famoso della storia del cinema’’ secondo Vicenzo Mollica? Solo che il il grandissimo artista lo depositò, e lo fece con delega depositare alla Siae dolo con il suo nome ‘’di Federico Fellini’’.
Peccato che gli autori fossero anche Brunello Rondi, Dino Buzzati e Bernardino Zapponi. Come è stato successivamente dimostrato e come da anni risulta presso la stessa Siae. Il vampiro aveva colpito ancora ed è stato chi scrive a ristabilire giustizia e verità per tutti, Buzzati e Zapponi compresi. E per ‘’Fellini Satyricon’’, anno del Signore 1968? Mio padre collaborò alla sceneggiatura, secondo contratto, ma poi venne accreditato solo come ‘’soggettista’’. Mia madre Ludovica spinse mio padre, tante questa palese ingiustizia, a bloccare l’uscita del film,  anche su suggerimento  dell’avvocato Nicola Manfredi che aveva detestato questa prepotenza Ma alla fine mio padre cedette alle lusinghe, anche un pò ricattatorie di Fellini  il quale telefonò a  mio padre, il suo ‘’leale, preziosissimo collaboratore’’ che aveva ‘’un cervellone che capisce tutto al volo’  come gli scrisse in alcune lettere o dediche - dicendogli  più o meno (mia madre se  lo  ricorda benissimo )‘’dai Brunellone, lascia perdere, faremo tanti altri film insieme’’. Il Drosophyllum era entrato di nuovo in azione. Anche per  i celeberrimi ‘’La dolce vita’’ e ‘’Otto e mezzo’’ ci furono delle vistose ingiustizie visto che, come risulta da numerosi documenti e lettere dello stesso Fellini mio padre lavorò da subito al soggetto di questi due film ma venne poi accreditato solo per la sceneggiatura. E questo non sono in grado di dirlo se per responsabilità di Fellini, del produttore, o di entrambi. Ultima gravissima ingiustizia, è  molto recente. La neonata casa editrice Sem-Società Editrice Milanese pubblica, nel 2017, attribuendolo incautamente un dattiloscritto ‘’Olimpo-i Miti greci’’ rinvenuto negli archivi della ex-fondazione Fellini ora gestita dal Comune di Rimini-dalla ricercatrice Rosita Copioli –che si accorge subito che non si tratta dello stile di Fellini, e mi dice lei stessa al telefono ‘’Sa che avevo pensato che potesse essere opera di suo padre?’’. La Sem con un grande lancio presenta così questo prezioso reperto inedito :’’Fellini ripercorre gli archetipi della nostra immaginazione - suo tratto artistico distintivo e magistrale - con la libertà fantastica e l'intelligenza critica del grande romanziere, onirico e pungente. L'invenzione inesauribile, la capacità unica di sorprendere propria di Fellini sfida qui l'impossibile, sceneggiando in un'opera totale di sensi, suoni, visioni e movimenti la metamorfosi incessante delle forme, propria della realtà come del sogno. Concepito come soggetto e trattamento cinematografico, ma anche come narrazione ""guida"" per una serie televisiva, L'Olimpo fu elaborato dal Maestro dopo La città delle donne. Il film però non fu mai realizzato, né per il cinema, né per la televisione, e oggi rimane solo come testo scritto. Un inatteso capolavoro che testimonia, una volta di più, il genio inimitabile di Federico Fellini.’’ Tutti si accorgono immediatamente che non si tratta dello stile di Fellini, tra cui alcuni degli amici e collaboratori più stretti di Fellini: “I curatori avrebbero dovuto lasciarsi insospettire dallo stile: il lessico, la sintassi, la costruzione della frase, e infine certe affermazioni fuori registro che Fellini non avrebbe mai pronunciate, come sa bene chiunque abbia avuto con lui anche soltanto una conoscenza superficiale”  ( Gianfranco Angelucci, un amico  e collaboratore di Fellini già direttore della Fondazione Fellini in ‘’Articolo 21’’, del 16 aprile 2017, che indicherà Brunello Rondi come uno dei probabili, reali autori o coutori di ‘’Olimpo’’)  Un giornale romagnolo esce con vari servizi del giornalista d’inchiesta David Brullo. I titoli sono eloquenti : ‘’E se quello non fosse un Fellini’’ e ‘’L’inedito: e se fosse di Brunello Rondi’’? Io  posso dire con assoluta certezza che si tratta di un’ opera, interamente o quasi interamente (Fellini gli avrò dar qualche input di massima, a dire tanto) di mio padre. Lo stile è assolutamente inconfondibile –come ha scritto il critico Alberto Pezzotta su ‘’Film Tv: ‘’direi proprio che sono farina del sacco di Brunello Rondi, verosimilmente l’ estensore materiale del testo(…). Non solo è il suo stile, mia madre ed io ci ricordiamo con assoluta sicurezza che ci lavorò, abbiamo anche rinvenuto il libro che gli fu da memoria filologica, il celebre ‘’ I miti greci’’, di Robert Graves e, dettagli o non esattamente trascurabile sul dattiloscritto ritrovato ci sono, a penna- la ‘’Grinta’’ blu che usava sempre-molte correzioni,  ortografiche o piccole aggiunte che fece, appunto, sul suo testo  (è evidente che se fosse stato contattato da Fellini per correggere o ampliare un suo scritto non avrebbe fatto qua e là semplici correzioni ortografiche o poche parole aggiunte ai lati del testo lui gli dava decine, centinaia di cartelle per i suoi film! Potete vedere chiaramente nella fotografia la parola ‘’morte’’ aggiunta nel dattiloscritto e la stessa parola  citata in altro scritto di mio padre: come si può vedere si tratta senza ombra di dubbio della stesa calligrafia. Naturalmente, cosa molti anni dopo, quale dicitura è stata rinvenuta sul frontespizio del dattiloscritto? Come per ‘’Il viaggio di Mastorna’’? ‘, di Federico Fellini, è ovvio.
Scrive Alberto Pezzotta nel suo saggio ‘’Brunellone e Federico’’(nel già citato ‘’Il lungo respiro’’ di Brunello Rondi’’):“Forse nessun collaboratore ha seguito Federico Fellini in un arco di tempo così lungo come Brunello Rondi. Eppure la sua figura è rimasta nell’ombra, ed è stata trascurata, sottovalutata o addirittura rimossa da quasi tutti gli studiosi felliniani”. Con assurda e amara ironia fu proprio Fellini ad esortare il suo biografo Tullio Kezich a mettere più luce, nella nuova edizione della biografia di Fellini, la figura di mio padre scrivendogli ( missiva  poi pubblicata nel volume  ‘’N’demo al cinema’’ , Lindau, 1998) dello stesso Kezich  ‘’Caro Tullietto..cerca di mettere più in risalto la figura di Brunellone (Brunello Rondi ndr) che è proprio un bravo amico, ricco di idee, leale, entusiasta’’. Il Drosophyllum…come spesso si manifestava Federico Fellini  si era mutato nel ‘’Crocodilus porosus’’; secondo la Treccani ‘’il più grande Crocodilide vivente’’. Mio padre nel testamento (datato 1979, vent’ anni prima della morte) si dichiara, e si conferma, credente nel cristianesimo cattolico e fa riferimento a ‘’Cristo, luce eterna’’. E finisce scrivendo ‘’Voglio bene a tutti’’.  Uno stupendo proposito cristiano, totalmente da condividere. Naturalmente, si può voler bene anche alla luce della correzione fraterna che è, infatti, per la Chiesa Cattolica, una delle sette opere di misericordia. Proprio ispirandoci a nostro Signore Gesù Cristo che disse: ‘’Dio non è dei morti, ma dei viventi’’ permettetemi allora di dire,  idealmente- a tutti coloro che lavorano con grandi o grandissimi artisti o scrittori o in qualsiasi campo professionale e subiscono ingiustizie, soprusi, sopraffazioni : denunciatele, e che la vostra bontà e signorilità d’animo non consenta all’arrogante ego altrui-come quello di Fellini, per intenderci, anche se, nel suo caso,  sapientemente occultato –di sopraffarvi, di sfruttarvi se non addirittura di schiacciarvi. Su costoro rimarrà tutta l’ingiustizia a ma voi  l’amarezza  di non essere stati prudenti come serpenti  e non solo candidi come colombe, sempre per citare il santo vangelo.  E mia intenzione lanciare, in tutto il mondo, nel 2020 l’hashtag ‘’with me too’’, ‘’anche con me’’, e cioè ci ho lavorato anche io parafrasando il noto movimento che ha denunciato i molestatori sessuali, oppure ‘oppure  ‘’it’s mine’’ ‘’è mio’’ affinchè sorga un movimento internazionale di scrittori, artisti e di qualunque altra categoria i cui talenti vengono sopraffatti da personalità più in vista e più potenti di loro. Lo farò  a cominciare proprio dalla storia, per altri aspetti magnifica di mio padre e Fellini due geni, di cui però uno era spesso anche un vampiro. ‘’With me too’’: si parte. Oggi, però, andrò a ricordarlo e a pregare per lui in un luogo dove avvenne un incontro indimenticabile, per mio padre e me: quando, nel 1982, incontrammo madre Teresa di Calcutta, a Roma, a san Gregorio al Celio. Mio padre realizzò un film per la Rai su di lei: ‘’La Voce- infanzia e giovinezza di Madre Teresa di Calcutta’’. Lei, la donna minuta, la persona immensa che tutti conosciamo. Fu vera gioia.


",it,"











THE MEMORY
Brunello Rondi, a Renaissance man
Thirty years after his death, the passionate story of his son. Historian Fellini scriptwriter, he received two Oscar nominations
07 Nov 2019, 05:59 by Umberto Rondi
I am happy that in recent years there has been a rediscovery of the greatness of the cultural and artistic legacy of my father Brunello. Writing it today on the day of the thirtieth anniversary of his death is particularly significant and a source of consolation and serenity, thinking about how happy my father would have been after forgetting, injustices and approximations that are certainly not lacking, in particular with respect to his long and exceptional collaboration and friendship with Federico Fellini, his brilliant and sodal vampire of many wonderful artistic and human adventures.
My father traveled as a true Renaissance man in many artistic, intellectual and expressive fields. He was a poet, screenwriter, film director and author of dramas for the theater; philosopher, musical essayist and art critic, film theorist with pioneering books and reporter of adventurous travels in distant lands, professor at the Experimental Center of Cinematography and documentary filmmaker. In cinema, he twice received the Oscar nomination for best screenwriter for his co-authorship of scripts of legendary masterpieces such as ""La dolce vita"" and ""8 ½"" by Federico Fellini. Roberto Rossellini, who was introduced to him by my father's brother, Gian Luigi Rondi, said to him: ‘’ Thank you very much: you presented me with a genius ’’.
For years there has been, in various countries around the world, a happy, fruitful and important rediscovery and enhancement of my father's brilliant work. Recently his most important director's film '' Il demonio '' - which today many people indicate as a forerunner - more cultured, mystical and refined, however - than Friedkin's Exorcist, who arrived ten years later, was presented at Lincoln Center of New York after being reprogrammed at the Venice Film Festival and the Locarno Festival. Enrico Ghezzi programmed it on Rai Tre, calling it a masterpiece; another of his films, co-directed by Polo Heusch, ""Una vita violenta"", from Pasolini's book, has found a new life, emerging from oblivion and being screened and edited on DVD. A beautiful collection of essays has been published on his overall work entitled ""The long breath of Brunello Rondi"" (edited by Alberto Pezzotta and Stefania Parigi for Edizioni Sabinae, 2010), long because it is a forerunner, with a wide and very rich range in the time and in the space of knowledge. With his film ‘’ Valeria inside and out ’’ with an extraordinary Barbar Bouchet, he anticipated the theme, which became disruptive a few years later, in 1978, of the mental hospital and the segregation of the mentally ill. With his recounts of verses ""Carta d’Europa"" seemed to prophesy the birth of the European Community shortly thereafter. Or, as a young man, with his essay ""Italian neorealism"", ""Fellini's cinema"", ""Bartòk"" anticipated whole strands of studies devoted to these three topics, and in fact these are highly quoted texts in bibliographies or university courses. In 2014, the essay by Federico Pacchioni, entitled ""Inspiring Fellini"" - Literary Collaborations behind the Scenes (""Inspirando Fellini - Literary collaborations behind images"") was published at the ""Toronto University Press"". he attributes the right importance to the extraordinary contribution that the screenwriters gave to Felini with beautiful parts dedicated to my father. The ""Roman Observer"" dedicated, recently, a large elzeviro focused on his poetic collections. Some of his films are shown in small and large shows in Italy and abroad. And the list could go on and on. Suffice it to say that many analytical studies of his work continue to come out on the Internet.
Compared to a fundamental chapter of his creative but also human life, the relationship with Federico Fellini, which lasted for almost thirty-five years, I would like to say here that unfortunately, over the years, this relationship broke down due to the vampire rapacity, unfair, sly and very wrong (I will cite some examples documented below) which Fellini frequently showed; a poison - so much more dangerous because covered with an irresistible seductiveness, and with a fascinating sympathy. Fellini was, in many circumstances, for his collaborators, and especially for my father - the most naive and I also consider the most generous and noble of all - the human relative, so to speak of those carnivorous plants so much fascinating and subtle. The Drosophyllum, a fearsome carnivorous plant, for example, I read from https://www.deabyday.tv/ on the internet ""emits a sweet scent that attracts insects by trapping them on its long sticky leaves"". It seems to me a perfect metaphor for these dismal fellinian aspects.
Besides, my father was in good, indeed excellent company. In a country, where certain sacred monsters are never criticized as Italy devoted to lay saints, to the untouchables, including Fellini, who is certainly a genuine genius and a person often witty and funny who made my father die with laughter and who sometimes he even had moments of generosity towards him (although he was completely incomparable to the one he received from '' Brunellone '', as he called it, as Tullio Kezich wrote, who called my father ""wise"" in the magazine of Fellini-born studies now '' Amarcord '' also made him as a ghost writer, from '' negro '' as unfortunately it is still used to say on many occasions when articles and opinions were requested to Fellini on the most disparate topics and that the Rimini does not absolutely knew how to deal with it because at the same time it was very intelligent and very ignorant My father, in his essay dedicated precisely to Fellini, also full of esteem and affection or but also independent, he writes for example of ‘’ Federicone ’’ ‘’ Those five books at most that he will have read in full throughout his life ’’. And my father knew him very well, intimately, so much so that Fellini himself said in an interview that he had three friends: ’’ Nino Rota, Marcello Mastroianni and Brunello Rondi ’’.
Was Fellini himself in an 'exceptional interview written by Oriana Fallaci, who certainly had no prone awe of the ‘sacred monsters‘ ’Proust? Mah! I am very ignorant ... What a shame eh? A healthy, vast, solid, leathery ignorance. I don't know anything about anything. And the speech is not only valid for books. It also applies to films (""Gli antipatici"", 1963). We were saying, in excellent company even if in front of the Drosophyllum there is little to do, I think. ""Fellini was a genius, but he tended to behave as if everything was his, not the fruit of a common work"" (Tullio Pinelli in ‘’ Fellini telling about me ’’, by Costanzo Costantini, Editori Riuniti); Suso Cecchi D’Amico: “Fellini put a strain on Flaiano's liver by always declaring that he didn't have a script and that he went to the set with a slip in his pocket the size of the bus ticket on which he had made some notes at night. Brash. The screenplays had them all right ... "". (Il Fatto Quotidiano article by Malcom Pagani, 20/7/2016); ""He treated me like I was a bottle of Coca-Cola, he pulls from the straw and sucks in Ennio Flaiano; ‘’ In addition to directing the film I want to be the author of the subject and a contributor to the script. In this case it is foolish to wonder who the author of the film is. It would be like asking a poet if he is the author of the verses or the paper and ink he uses '' (interview with Fellini by Mino Guerrini '' Il Mondo '' 1950) '' Federico used screenwriters (... ) often overwhelmed '' (Tullio Kezich '' Fellini-Amarcord, 2007) The aforementioned Fallaci said, of Fellini: '' I really loved Federico Fellini. After that tragic meeting I want him much less, I also stopped giving him the tu. He can even deny it. But, as Jeanne Moreau says a little further, he is such a liar that falsehood becomes to his good faith the sacrosanct truth. Fellini according to Fallaci had treated her badly, in an arrogant and shameful way because she had dared to criticize him, who after all had said to Fallaci: ""I know that even negative criticism can be constructive, but the only one I understand is that maternal, made of kisses, caresses, flattering little words ... ''.
Of course, not really the approach and style, thank God, of Fallaci who reconstructs and recounts the episode that occurred after the release of an article that was not liked by the now famous director: '' I was at the newspaper when he phoned and shouted so much that everyone heard him when he reminded me that Fellini is a great director, an artist, a great artist, pulling out a voice that would have made the gangster who had made him die of fright die of fright, insulting me to death while I imagined his mussolinesco look , his saliva that covered the telephone like dew, his face sweaty with anger and horror at the blasphemy I had dared to commit. I tried to turn the insults gracefully, to explain to him what I thought at that moment about him. He didn't hear me, he didn't hear me. And while everyone was laughing and commenting on the screams, I gently placed the receiver down. "" (Gli antipatici, Rizzoli). Fazed by guilt, Fellini recalled Fallaci with his very different tones: ‘’ Tesorino, amorino, Orianina, child… ’’ Eh, Fellini, the Drosophyllum, never denies.
Pasolini used a metaphor always linked to the earth, to describe these slimy and subtle parts of Federico Fellini that the whole world is preparing to celebrate in 2020 for the centenary of birth - which is certainly right - I believe omitting the various shadow parts of this famous director . Pasolini writes: ‘’ Fellini is a savannah full of quicksand, for examplenarre in which it needs either the black guide of bad faith or the white explorer of rationality "". I also have something and certainly much more important and serious to tell. I start from the end, and this is the most painful episode. Fellini asked my father for the texts for '' Ginger and Fred '', a small collaboration with respect to the glories of the past, however, I myself brought Fellini dozens of typewritten folders that he used but in the end he did not quote nor thank my father in the titles of head. My father was very upset. As my uncle Gian Luigi Rondi, a historical critic of Il Tempo, wrote about my father: ""And they all betrayed him starting with Fellini. The ideas he brought him, and he almost treated him as '' negro '', keeping him so often in anonymity, jealous egoist (Gian Luigi Rondi '' My lives in the mirror. Diaries 1947-97. Sabinae Edition, 2016) . Again Uncle Gian Luigi reports that after this misdeed Fellini phoned my uncle telling him '' If you are a Christian, you should not hold me resentment '' (same source) referring to my father and to the missed quote, precisely, for '' Ginger and Fred, ' 'with my uncle who notes: ""I never forgave Federico"". In 1978 ‘’ Prova d'’Orchestra ’’ came out, written by Fellini and my father, an extraordinary musicologist and essayist. Those who cultivate fairness and professionalism would have expected to read, in the titles ‘’ screenplay by F. Fellini and B. Rondi ’’ but the great artist once again had not denied it. It was the producer of the film and friend of my family, Leo Pescarolo who revealed it to me, by chance ""Federico called me Federico asking me to put Brunello as a script writer (not as a"" scriptwriter "", that is)"" ""Selfish, jealous"" ', as, indeed, said uncle Gian Luigi. And what about the script of ‘The journey of Mastorna’ ’,‘ ’the most famous unrealized film in the history of cinema’ ’according to Vicenzo Mollica? Only that the great artist deposited him, and he did so by delegating to the Siae dolo with his name ""by Federico Fellini"".
Too bad the authors were also Brunello Rondi, Dino Buzzati and Bernardino Zapponi. As has been subsequently demonstrated and as for years results at the same Siae. The vampire had struck again and it was the writer who re-established justice and truth for everyone, Buzzati and Zapponi included. And for ‘’ Fellini Satyricon ’’, year of the Lord 1968? My father collaborated on the script, according to the contract, but was then credited only as a ‘’ subject writer ’’. My mother Ludovica pushed my father, so many this blatant injustice, to block the release of the film, even at the suggestion of the lawyer Nicola Manfredi who had detested this arrogance. But in the end my father succumbed to flattery, even a little blackmail by Fellini which he phoned my father, his' loyal, precious collaborator 'who had' 'a brain that understands everything on the fly' as he wrote in some letters or dedications - telling him more or less (my mother remembers it very well) '' by Brunellone, forget it, we will make many other films together "". The Drosophyllum had again entered into action. Even for the famous '' La dolce vita '' and '' Otto e mezzo '' there were glaring injustices since, as can be seen from numerous documents and letters by Fellini himself, my father immediately worked on the subject of these two films but came then credited only for the script. And I am not able to say this if by responsibility of Fellini, the producer, or both. The last grave injustice is very recent. The newly founded Sem-Società Editrice Milanese publisher publishes, in 2017, recklessly assigning it a typescript '' Olimpo-i Miti greci '' found in the archives of the former Fellini foundation now managed by the Municipality of Rimini - by the researcher Rosita Copioli - who realizes immediately that this is not Fellini's style, and she tells me herself on the phone ""Do you know that I thought it might be his father's work?"" With a great launch, La Sem presents this precious new exhibit: ’’ Fellini traces the archetypes of our imagination - its distinctive and masterful artistic trait - with the fantastic freedom and critical intelligence of the great novelist, dreamlike and pungent. The inexhaustible invention, Fellini's unique ability to surprise, here challenges the impossible, scripting in a total work of senses, sounds, visions and movements the incessant metamorphosis of forms, typical of reality as of dream. Conceived as a subject and cinematographic treatment, but also as a ""guide"" narrative for a television series, the Olympus was elaborated by the Master after The City of Women. But the film was never made, neither for cinema nor for television, and today it remains only as a written text. An unexpected masterpiece that once again bears witness to the inimitable genius of Federico Fellini. ""Everyone immediately realizes that this is not Fellini's style, including some of Fellini's closest friends and collaborators:"" The curators should have letting the style make you suspicious: the vocabulary, the syntax, the construction of the sentence, and finally certain out-of-register statements that Fellini would never have uttered, as anyone who has had even a superficial knowledge with him knows well "" collaborator of Fellini already director of the Fellini Foundation in '' Article 21 '', of 16 April 2017, which will indicate Brunello Rondi as one of the probable, real authors or coutori of '' Olimpo '') A newspaper from Romagna comes out with various services of the journalist of inquiry David Brullo. The titles are eloquent: ‘’ And if that was not a Fellini ’’ and ‘’ L''edito: and if it was Brunello Rondi ’’? I can say with absolute certainty that it is a work, entirely or almost entirely (Fellini I will give him some rough input, to say so) about my father. The style is absolutely unmistakable - as the critic Alberto Pezzotta wrote on ‘’ Film TV: ‘’ I would say that they are flour from the sack of Brunello Rondi, probably the material extender of the text (...). Not only is his style, my mother and I remember with absolute assurance that he worked on it, we also found the book that was his philological memory, the famous '' Greek myths '', by Robert Graves and, details or not exactly negligible on the typescript found there are, in pen - the '' Grinta '' blue that always used-many corrections, spellings or small additions that he did, precisely, on his text (it is evident that if he had been contacted by Fellini to correct or extending his writing would not have made here and there simple spelling corrections or a few words added to the sides of the text he gave him dozens, hundreds of folders for his films! You can clearly see in the photograph the word '' death '' added in the typescript and the same word quoted in my father's other paper: as you can see, it is without a doubt the same calligraphy: of course, what many years later, which word was found on the title page of the typescript? As for ‘’ The journey of Mastorna ’’? ‘, By Federico Fellini, it is obvious.
Alberto Pezzotta writes in his essay ‘’ Brunellone e Federico ’’ (in the aforementioned ‘’ The long breath ’’ by Brunello Rondi ’’): “Perhaps no collaborator has followed Federico Fellini in such a long time span as Brunello Rondi. Yet his figure has remained in the shadows, and has been neglected, underestimated or even removed by almost all Fellini scholars "". With absurd and bitter irony it was Fellini himself who urged his biographer Tullio Kezich to shed more light, in the new edition of Fellini's biography, on the figure of my father writing to him (letter then published in the volume '' N'demo al cinema '', Lindau, 1998) of the same Kezich '' Dear Tullietto .. tries to put more emphasis on the figure of Brunellone (Brunello Rondi ed) who is really a good friend, full of ideas, loyal, enthusiastic ''. The Drosophyllum ... as was often the case Federico Fellini had changed in the ‘’ Crocodilus porosus ’’; according to Treccani, ""the greatest living Crocodilide"". My father in the will (dated 1979, twenty years before his death) declares himself, and confirms himself, as a believer in Catholic Christianity and refers to ""Christ, eternal light"". And it ends by writing ‘’ I want everyone well ’’. A wonderful Christian purpose, totally to be shared. Of course, one can also love in the light of fraternal correction, which is, in fact, one of the seven works of mercy for the Catholic Church. Just inspiring us to our Lord Jesus Christ who said: ""God is not of the dead, but of the living"", allow me then, ideally, to say to all those who work with great or very great artists or writers or in any professional field and suffer injustices , abuses, oppression: denounce them, and that your kindness and noble spirit do not allow the arrogant ego of others-like that of Fellini, so to speak, even if, in his case, wisely concealed –to overwhelm you, to exploit you if not even crush you. On them all the injustice will remain but to you the bitterness of not having been prudent as snakes and not only white as doves, always to quote the holy gospel. It is my intention to launch the hashtag '' with me too '', '' also with me '', all over the world in 2020, that is, I worked on it also paraphrasing the well-known movement that denounced sex offenders, or 'or' 'it's mine' '' is mine '' for an international movement of writers, artists and any other category to arise whose talents are overwhelmed by more prominent and more powerful personalities than themselves. I will do it starting right from history, in other respects magnificent of my father and Fellini two geniuses, of which however onehe was often also a vampire. ‘’ With me too ’’: it starts. Today, however, I will go to remember him and pray for him in a place where an unforgettable meeting took place, for my father and me: when, in 1982, we met Mother Teresa of Calcutta, in Rome, at St. Gregory of the Celio. My father made a film for RAI about her: ‘’ La Voce- youth and youth of Mother Teresa of Calcutta ’’. She, the petite woman, the immense person we all know. It was real joy.


"
