,src,lang,text
0,"











تاجیک: از کاهش تعهدات برجامی کوتاه نیاییم

03 Nov 2019, 01:30

سفیر پیشین ایران در اردن بر این باور است که اروپا در فرصت چند روز باقیمانده تا پایان گام سوم اقدام خاصی را انجام نخواهد داد و ایران هم نباید از کاهش تعهدات برجامی کوتاه بیاید.
به گزارش فارس، در روزهای پایانی فرصت ۶۰ روزه سوم ایران به طرف‌های باقیمانده در برجام برای اجرای تعهداتشان به سر می‌بریم و جمهوری اسلامی ایران همانگونه که پیش از این اعلام کرده، بعد از پایان این فرصت وارد گام چهارم کاهش تعهدات برجامی خواهد شد، در همین خصوص «نصرت‌الله تاجیک» سفیر پیشین ایران در اردن در گفتگو با خبرنگار خبرگزاری فارس، معتقد است که به دلایلی و در اثر تقابل اهداف و تضارب منافع، ما با آمریکای ترامپ وارد بازی چیکن گیم (Chicken Game) شده‌ایم.
وی با بیان اینکه طی ۲ ماه گذشته فاصله بین گام سوم و چهارم، تحولات فشرده و سرنوشت سازی در خلیج فارس اتفاق افتاد که می‌تواند آینده منطقه را از منظر توازن ژئوپلیتیکی عناصر تاثیرگذار تحت تاثیر قرار دهد، عنوان کرد: به دنبال خروج ترامپ از برجام و اعمال تحریم‌های فلج کننده علیه اقتصاد ایران، فرانسه در غیاب اتحادیه اروپا، به دنبال آن بود که اگر هم قرار باشد طرح‌های تکمیلی برجام محقق شود، نه با استراتژی خروج از برجام همچون ترامپ، بلکه با حفظ سازه برجام و تکمیل آن صورت گیرد.

*چرا طرح ماکرون به پیش نرفت

تاجیک افزود: در این راستا فعالیت دیپلماتیک فشرده‌ای بین ایران و اروپا و مخصوصاً فرانسه که در غیاب انگلیس که زنجیر برگزیت بر پای سیاست خارجی‌اش پیچیده شده و سرگرم بودن آلمان به تثبیت جایگاهش در نظام اقتصادی اروپا و جهان، صورت گرفت که منجر به ارائه طرح چهار ماده‌ای ماکرون رئیس جمهور فرانسه شد. اما به دلیل اهداف، رویکرد و ویژگی شخصیتی ترامپ خیلی جلو نرفت، زیرا ترامپ می‌خواهد ابتکار عمل دست خودش باشد و استراتژی مذاکره و تحریم همزمان را جلو ببرد.
* از کاهش تعهدات برجامی کوتاه نیاییموی با بیان اینکه در تئوری بازی‌ها بحثی تحت عنوان Chicken Game داریم، اظهار داشت: با توجه به تحولاتی که رخ داده است، راهی نداریم جز اینکه از کاهش تعهدات برجامی مطابق بند ۳۶ برجام کوتاه نیاییم. ولی از نظر تکنیکی، تاکتیکی و عملیاتی خوب است به گونه‌ای عمل نکنیم که یکی از اصلی‌ترین راهبردهایمان، یعنی منزوی نگهداشتن ترامپ در اثر خروج از برجام، نقض شود. 
این تحلیلگر مسائل بین‌الملل یادآور شد: نظریه بازی‌ها در تلاش است تا به وسیله ریاضیات، رفتار ۲ طرف را در شرایط راهبردی یا در یک بازی که در آن‌ موفقیت یک طرف در انتخاب کردن، وابسته به انتخاب طرف‌های دیگر از جمله آمریکا و اروپا می‌باشد، برآورد کرده و تلاش می‌کند تا رفتار ریاضی حاکم بر این موقعیت راهبردی ناشی از تضارب منافع را مدل‌سازی کند. زیرا این موقعیت، زمانی پدید می‌آید که موفقیت یک فرد وابسته به راهبردهایی است که دیگران انتخاب می‌کنند.
وی توضیح داد: لذا هر آنچه را در توان داریم باید در این (Chicken Game) به کار بگیریم که از دور خارج نشویم، ولی نباید به صورتی باشد که ما به ترامپ کمک کرده و کسانی که در برجام هستند، حتی بی‌خاصیت‌ترین آنها، به اردوگاه ترامپ بپیوندند.تاجیک در این زمینه به شرایط جدید در منطقه اشاره کرد از جمله مشکلاتی که الان ترامپ از نظر داخلی و شخصی با آن مواجه است از جمله بحث استیضاحش و از هم پاشیدن «تیم بی»، منفعل شدن آمریکا در مقابل ایران در مسائل خلیج فارس، برآورد نادرست ترامپ از تأثیر تحریم‌ها بر ایران، مأیوس شدن عربستان و امارات از رودرویی نظامی ترامپ با ایران و بازی‌های دیپلماتیک، سیاسی و عملیاتی که در این مدت داشتیم.
وی اضافه کرد: استراتژی گام‌های مرحله‌ای با فواصل 2 ماهه ایران، خود نوعی رویکرد تشویقی در کار با اروپا و سایر همپیمانان‌مان در برجام است تا اولاً آنها را در اردوگاه خود نگهداریم و ثانیاً به آنها فرصت داده شود اگر اقداماتی برای راضی نگهداشتن ایران به منظور ماندن در برجام در نظر دارند، آنها را اجرایی کنند.

*استراتژی قورباغه آب‌پز را ناکارآمد کرده و وارد بازی Chicken Game شده‌ایم

این تحلیلگر مسائل بین‌الملل اضافه کرد: معتقدم استراتژی غرب اعم از آمریکا و اروپا، در قبال ایران استراتژی قورباغه آب‌پز بوده است، استراتژی که به تدریج و مرحله‌ای از نظر زمان، موضوع و گستره جغرافیایی کشورهای شرکت کننده در این استراتژی، فشار بر ایران را افزایش دهند.
وی یادآور شد: اما سلسله تحولات منطقه‌ای و بین‌المللی و توانمندی‌های ایران در بازی‌هایش باعث عدم کارآیی این راهبرد و ورود ما به (Chicken Game) شده است. یعنی ما با نوع اقداماتی که طراحی و اجرا کردیم و نیز تحولاتی که در منطقه و جهان اتفاق افتاده، توانسته‌ایم استراتژی قورباغه آب‌پز را ناکارآمد کرده و وارد بازی (Chicken Game) شده‌ایم و باید ببینیم چه کسی از سر راه دیگری کنار می‌رود و این جاست که کار ما یعنی طراحی ما و اقداماتی که می‌خواهیم در گام چهارم صورت دهیم، معنا و مفهوم می‌یابد.

*در گام چهارم چه اقداماتی صورت خواهد گرفت؟

سفیر پیشین ایران در اردن با یادآوری این نکته که من تخصصی در بحث‌های هسته‌ای ندارم که چه اقداماتی در این زمینه (گام چهارم)‌ می‌توانیم انجام دهیم، عنوان کرد: ولی براساس آن چیزی که توسط مسؤولان وزارت امور خارجه، وزیر و سخنگوی آن اعلام شده، شورای عالی امنیت ملی طراحی‌هایی کرده است و اگر اروپایی‌ها اقدامی صورت ندهند، آن طراحی‌ها اجرا می‌شود.
وی در عین حال گفت: آنگونه که تحلیلگران این حوزه حدس می‌زنند ممکن است در گام چهارم کاهش تعهدات ایران در برجام، سانتریفیوژهای جدید رونمایی شده و اقداماتی چون آماده کردن زمینه برای رونمایی از زنجیره ۳۰ تایی IR6، افزایش ظرفیت غنی‌سازی، راه‌اندازی قسمت ثانویه راکتور آب سنگین اراک و همچنین ماشین سوخت‌گذار آن و رونمایی از سانتریفیوژهای نسل جدید IR7 و IR8 و IR9 صورت پذیرد.
این تحلیلگر مسائل بین‌الملل باز هم تاکید کرد که من تخصص هسته‌ای ندارم، اما هرگونه توانایی سیاسی و اجرایی که داریم و هر اهرمی که در دست داریم، برای تثبیت یک راه بدون بازگشت که بتواند بر اراده طرف مقابل تاثیر بگذارد تا زودتر در این بازی از سر راه ما کنار رود، مثبت تلقی می‌کنم تا زمینه برای ایجاد یک تفاهم منصفانه آغاز شود.تاجیک افزود: ما نباید اضافه برآورد داشته باشیم. در حال حاضر ما در منطقه‌ای قرار گرفته‌ایم که عوامل آن متغیر است. یعنی تحولات با سرعت و شتاب زیادی در حال وقوع بوده و اگر امروز تصمیمی گرفته شود، معلوم نیست فردا این تصمیم درست باشد یا خیر. منطقه مانند بشکه‌ای پر از باروت بوده که هر لحظه منتظر کشیدن کبریت و جرقه‌ای است. بنابراین با توجه به التهابات می‌بایست این گام چهارم و تبعات آن را خوب تجزیه و تحلیل کرد و یا دست به نسخه پیچی زد.
وی ادامه داد: لازم است یک تصویر از زندگی ما در نظم جهانی متکثر و چند تکه و موقعیت ما مخصوصا بعد از سلسله تحولات خلیج فارس از جمله ماجرای نفتکش‌ها، ساقط شدن پهپاد آمریکایی، مایوس شدن اعراب از رودررویی نظامی ترامپ با ایران و دست برتر مبارزان یمنی در مقابل عربستان و ماجرای آرامکو و نجران، ارائه دهیم.
تاجیک اضافه کرد: درست است که ترامپ مشکلاتی دارد، اما اولاً آمریکا به عنوان قدرت هژمون با آنکه در داخل و خارج دارای مشکلاتی است، اما با روش‌هایی به جز روش‌های قبلی که بر چند جانبه گرایی استوار بود، در تلاش برای تثبیت موقعیت خود در جهان است. اما در همین نظم ژله‌ای و لرزان، در حالی که به دلیل قدرت اقتصادی آمریکا و نقش دلار شاهد اقتصادی جهانی، ولی با غلظت بیشتر سیاست محلی هستیم، مشکل از آنجا ناشی می‌شود که اقتصاد جهانی خود نیازمند صلح و ثبات و امنیت جهانی است که این هم نیازمند دولت جهانی است که وجود خارجی ندارد و سیاست محلی و مخصوصاً سیاست مناطق ژئوپلیتیکی همچون خاورمیانه و خلیج فارس به دلیل ذخایر انرژی بر آن تاثیر مستقیم دارد.
وی ادامه داد: اما در غیاب دولت جهانی، نه لزوماً به دلیل عدم وجود مکانیسم اجرایی و عملیاتی آن حتی به دلیل نبود هویت جهان شهری و نظام حقیقت و ایدئولوژی اجماعی جهانشمول، بلوک‌های قدرت منطقه‌ای اجتناب ناپذیر هستند.اما این ضرورت با تلقی آمریکا که می‌پندارد بعد از سقوط شوروی در دهه ۹۰ میلادی و اتمام جنگ سرد جهان از نظامی دو قطبی به نظامی یک قطبی میل کرده و این کشور به تنها ابرقدرت جهانی بدل شده است که متکفل برقراری نظم در امپراطوری جهانی خویش است، کاملاً مغایرت دارد.

* رئیس جمهور آمریکا برای حل مشکلات داخلی خود به دنبال یکجانبه گرایی است

سفیر پیشین ایران در اردن خاطرنشان کرد: در اینجا مشکل تنها به این مغایرت اساسی که بعضی کشورها هر یک به نوعی قائل به پذیرش این هژمون نیستند برنمی‌گردد، بلکه مشکل اصلی از آنجا آغاز می‌شود که رئیس جمهور آمریکا برای حل مشکلات داخلی خود به دنبال یکجانبه گرایی است، قدرت‌های بزرگی همچون چین و روسیه و نیز قدرت‌های نوظهور همچون برزیل و هند هر یک نقش انتقادی خود را در درون نظام کنونی تعریف کرده و اروپا نیز به عنوان عضوی موثر در درون این نظام آمریکا - محور عمل می‌کند.
وی افزود: در چنین جهانی چند جانبه گرایی واقعی که بعد از 2 جنگ جهانی شکل گرفت، یا شدنی نیست و یا سخت است؛ اما نمی‌توان بدون این روش یعنی مشارکت مسؤولیت پذیر همه کشورها، جهان را اداره کرد. بخش دیگر مشکل به آنجا برمی‌گردد که آمریکا حاضر نیست نقش منطقه‌ای قدرت‌های کوچک‌تر که خارج از سلطه این کشور تعریف می‌شوند از جمله ایران را به راحتی بپذیرد.
تاجیک همچنین گفت: این را هم نمی‌توانیم از نظر دور بداریم که ایران و آمریکا در این بازی رو در رو نیازهایی دارند و این نیازها باید به نوعی در قالب یک استراتژی منسجم و مدون پاسخ داده شود. نباید از نظر دور داشت که از منظر اوضاع سیاسی، اجتماعی و اقتصادی ایران ادامه روند موجود بدون دسترسی به یک توافق منصفانه که هم پاسخگوی مشکلات، بحرا‌ن‌ها و چالش‌های موجود باشد و هم عزت روحیه ایرانی را رعایت کند، در نهایت یا کشور را با فروپاشی اقتصادی مواجه خواهد ساخت و یا با سر و سامان دادن اوضاع داخلی و بر طرف کردن سوء مدیریت و تغییر رویکرد نحوه اداره جامعه به سختی می‌توان از مشکلات و بحران‌ها عبور کرد؛ مگر آنکه ایران همچون  ۲ سه ماه گذشته از اهرم‌ها و مزیت‌های نسبی خود بیشتر و موثر‌تر استفاده کند.
این تحلیلگر مسائل بین‌الملل خاطرنشان کرد: در غیر این صورت ادامه روند کنونی و تزاید خصومت‌های منطقه‌ای و بین‌المللی منجر به ورود به فضای جنگی شده که در هر دو حالت منافع و امنیت ملی با مخاطره جدی مواجه خواهد شد.  شاید به خاطر همین مسائل و ظرایف است که هنوز طرفین منازعه مرز بین مذاکره و جنگ را رعایت کرده‌اند و از فضای مذاکره خارج نشده‌اند.

* اروپا کار خاصی انجام نخواهد داد

به گفته وی در شرایط موجود، هر دو طرف تقریبا سقف توان خود در به‌ کارگیری مزیت‌های نسبی‌شان را نشان داده‌اند. تاجیک در ادامه این گفتگو اضافه کرد: من احتمال نمی‌دهم اروپا در این فرصت کار خاصی انجام دهد، چون تحولاتی که اخیرا در منطقه رخ داده گفتمان گام سوم و گفتمان طرح چهار ماده‌ای فرانسه را تقریبا به محاق برده و فضای دیگری ایجاد شده است و بعید می‌دانم ادامه آن گفتمان‌های قبلی را انجام دهیم.
سفیر پیشین ایران در اردن اضافه کرد: ولی از آن جایی که این تحولاتی که در منطقه برشمردم یعنی مشکلات داخلی و شخصی ترامپ و سایر تحولات منطقه و از جمله کنار رفتن نتانیاهو و ... باعث تضعیف موضع آمریکا به صورت کلی شده، این نیز فرصت خوبی برای اروپا است که اگر بخواهد، نه برای ایران بلکه ایفای نقش تاریخی خود در منطقه و جهان، هم دست خویش را از زیر ساطور آمریکا خارج کند و هم تعهدات خود در مقابل ایران را انجام دهد، اقداماتی را انجام دهد تا ایران در ماندن در برجام دارای منافع اقتصادی باشد و مردم نتیجه آن را ببینند.وی با ذکر این نکته که باید در کنار اقدامات عملیاتی، اقدامات دیپلماتیک و سیاسی با اروپا انجام دهیم، چه با فرانسه و چه سایر کشورها، عنوان کرد: موضع اروپا در مقابل آمریکا مقداری قوی‌تر از گذشته است و می‌توان در کنار آن کارهای عملیاتی و یا اقدامات اجرایی که شورای عالی امنیت ملی درصدد طراحی و اجرای آن است، سعی کنیم از اهرم های سیاسی خودمان نیز استفاده کنیم.
* تحولاتی که کمک کرد سه گام قبلی اثرگذار باشدتاجیک در ارزیابی از سه گام قبلی کاهش تعهدات برجامی نیز گفت: تحلیل من این است که ما یک مقداری در ابتدا تقریبا با عجله و بدون برنامه درازمدت و بدون ایجاد زمینه‌ها و تمهیدات قبلی کار را شروع کردیم، ولی خوشبختانه آن گام‌ها با یک سلسله اقدامات عملیاتی در خلیج فارس، جریان نفتکش‌ها، ساقط شدن پهپاد آمریکایی و بی عملی ترامپ که می‌دانست اقدام اشتباهی کردند و وارد فضای آب‌های سرزمینی ما شدند و مایوس شدن هم پیمانانش مخصوصا امارات و عربستان از اینکه ترامپ را رودروی ما قرار دهند، این تحولات کمک کرد آن سه گام تا حدی اثرگذار باشند و اروپا کمی به خود آمد.وی افزود: در کنار عملیاتی که قرار است به عنوان گام چهارم شورای عالی امنیت ملی طراحی و دستگاه ها اجرا کنند،  یک سلسله اقدامات سیاسی و دیپلماتیک و تحرکاتی صورت گیرد که استراتژی انزوای ترامپ همچنان پایدار و برقرار بماند.
*برجام تا مدتی سازه پایداری خواهد بودسفیر اسبق ایران در اردن درباره آینده برجام خاطرنشان کرد: اگر تحولاتی چون کنار رفتن بولتون، عدم حضور نتانیاهو در صحنه حکومت رژیم صهیونیستی و مایوس شدن بن سلمان و بن زاید از آمریکا به اضافه تحولات شمال سوریه به گام چهارم کمک کنند، به عقیده من برجام همچنان این ظرفیت تداوم را دارد. چون ما علاقه‌مندیم که سازه برجام برپا باشد و اروپایی‌ها هم معتقدند برای مدیریت رفتار ایران در صحنه خاورمیانه بهتر است برجام پایدار بماند و سکوی پرش برای همکاری‌های بعدی باشد، لذا تحلیلم این است که برجام همچنان تا مدتی سازه پایداری خواهد بود.


",fa,"











Tajikistan: Let's not shorten the terms of the brokerage agreement

03 Nov 2019, 01:30

The former Iranian ambassador to Jordan believes that Europe will not take any action in the days remaining until the end of the third step, and Iran should not fall short of its obligations.
According to Fars, in the final days of Iran's third 3-day opportunity, we will remain with the remaining parties in Brajam to fulfill their commitments, and the Islamic Republic of Iran, as previously announced, will enter the fourth step of reducing its brokerage obligations after this opportunity expires. Speaking to Fars News Agency, the former Iranian ambassador to Jordan, Nusratullah Tajik, believes that we have entered the game of Chicken Game with Trump for some reason.
He said that during the last six months, the gap between the third and fourth steps, intensive developments and decisive events in the Persian Gulf that could affect the future of the region in terms of geopolitical balance of influential elements, said: Following Trump's departure from Brigham And the crippling sanctions against Iran's economy, France, in the absence of the European Union, sought to supplement the plan if it were to be implemented, not by a strategy of exit, such as Trump, but by preserving and completing it.

* Why the Macron Plan didn't go ahead

Tajikistan added that intensive diplomatic activity between Iran and Europe, especially France, took place in the absence of the British, whose chains were complicated by its foreign policy and Germany's preoccupation with stabilizing its position in the European and world economic system. Macron became President of France. But because of Trump's goals, approach, and personality, he did not go too far, as Trump wants to be his own initiative and push for a simultaneous negotiation and sanctions strategy.
* Nayimui Short Term Liabilities Reduction We stated that we have a discussion in game theory called Chicken Game: Given the developments that have taken place, we have no choice but to shorten the terms of the Brijami obligations under paragraph 2. But technically, tactically, and operationally, it is best not to act in a way that violates one of our main strategies, namely keeping Trump out of the doldrums.
The analyst of international issues noted: Game theory is trying to mate, by mathematics, the behavior of two parties in strategic terms, or in a game in which the success of one party in the election depends on the choice of the other party, including the US and Europe, Estimates and attempts to model the mathematical behavior of this strategic positioning of conflict of interest. Because this situation arises when one person's success depends on the strategies that others choose.
He explained: ""So everything we can do should be used in this (chicken game) not to be outdone, but it should not be in the way that we have helped Trump and those in the brothel, even the most inept, to Tajikistan cites new conditions in the region, including problems that Trump is currently facing internally and personally, including his impeachment and the disintegration of Team B, the passivity of the US against Iran. Gulf issues, Trump's misconception of the impact of sanctions on Iran, Saudi Arabia's and UAE's disappointment over Trump's military confrontation with Iran and the game Diplomatic, political and operational at the time we had.
He added: Iran's 2-month step-by-step strategy itself is a kind of encouraging approach to work with Europe and our other allies in Brajam to keep them in our camp first, and secondly, if given the opportunity to keep Iran satisfied. They plan to stay in the brothel, to implement them.

* Inefficient frog strategy and we have entered the game Chicken Game

""I believe the West's strategy, both in the US and in Europe, has been a boiled frog strategy for Iran, a strategy that has gradually and gradually overtaken the pressure of Iran on the timing, subject and geographical scope of the countries participating in the strategy,"" the analyst said. To increase.
But he noted: But the series of regional and international developments and Iran's capabilities in its games have rendered this strategy ineffective and our entry into the (Chicken Game). That is, with the kind of actions we've designed and implemented, as well as developments in the region and around the world, we've been able to disrupt the strategy of the boiled frog and get into the game of chicken and have to see who's going the other way. That our work means our design and the actions we want to take in step four makes sense.

* What will be done in step four?

The former Iranian ambassador to Jordan recalled that I had no expertise in nuclear discussions as to what we could do (step four), but based on what was announced by Foreign Ministry officials, ministers and spokesmen. That is, the Supreme National Security Council has made plans, and if the Europeans do nothing, those plans will be implemented.
He also said: As analysts in the field speculate, the fourth step may be to reduce Iran's commitments to the Brajam, to unveil new centrifuges and measures such as preparing the ground for the unveiling of the IR6 single chain, increasing enrichment capacity, launching a secondary reactor. Arak heavy water as well as its refueling machine and unveiling of the new generation IR7, IR8 and IR9 centrifuges.
The international affairs analyst again emphasized that I do not have the nuclear expertise, but whatever political and executive capacity we have and any leverage we have, to stabilize a non-return path that can influence the will of the other party sooner rather than later. On our way down, I consider it positive to start the ground for a fair understanding. Tajik should not overestimate. We are now in an area where the factors are variable. That is, developments are taking place at a very fast pace, and if a decision is made today, it is unclear whether tomorrow's decision will be correct. The area was like a barrel full of gunpowder, waiting for a match and spark every moment. Therefore, with regard to inflammation, this fourth step and its consequences should be thoroughly analyzed or revised.
He added: It is necessary to have a picture of our lives in a multiparty world order and our position, especially after the Gulf developments such as the tanker affair, the overthrow of the US drone, the despair of the Arabs facing Trump's military confrontation with Iran and the superior. Let's present the Yemeni fighters against Saudi Arabia and the story of Aramco and Najran.
Tajikistan added: ""True, Trump has problems, but first the US as hegemonic power, while having problems at home and abroad, but in ways other than previous approaches based on multilateralism, in an attempt to consolidate its position in the The world. But in this jarring and shaky order, as the US economic power and the role of the dollar witness the global economy, but with a greater concentration of local politics, the problem arises that the global economy itself needs global peace and stability and security. It also needs a world government that does not exist and has a direct influence on local politics, especially geopolitical policy, such as the Middle East and the Persian Gulf.
But in the absence of the world government, regional power blocks are inevitable, not necessarily because of the lack of an executive and operational mechanism, even because of the lack of an urban world identity and a universal consensus of truth and ideology. He thinks that after the fall of the Soviet Union in the 1980s and the end of the Cold War, the world has shifted from a bipolar to a unipolar one, and it has become the only global superpower that is in charge of restoring order in its global empire.

* The President of the United States seeks unilateralism to solve his domestic problems

The former Iranian ambassador to Jordan pointed out: The problem here is not just the fundamental contradiction that some countries each have in accepting this hegemony, but the main problem that begins when the US president seeks unilateral domestic solutions. Realistically, major powers such as China and Russia, as well as emerging powers such as Brazil and India, have each defined their critical roles within the current system, and Europe has also acted as an effective member within this American-centric system.
He added: ""In such a world of real multilateralism that emerged after World War II, it would not be possible or difficult, but it would not be possible to run the world without this method of responsible participation by all countries."" The other part of the problem is that the US simply refuses to accept the regional role of the smaller powers defined outside its control, including Iran.
Tajik also said: ""We cannot miss the point that Iran and the US have needs in the face-to-face game, and these needs must be met in a form of a coherent and consistent strategy."" It should be kept in mind that, from the point of view of Iran's political, social and economic situation, the continuation of the existing process without access to a fair agreement that responds to both existing problems, crises and challenges, and respects Iranian morale, will ultimately disrupt the country or the country. The economy will face or regulate the internal situation and eliminate the mismanagement and change of the way of managing the society can hardly pass through the problems and crises, unless Iran has exceeded its comparative leverage and advantages over the past three months. And use it more effectively.
The international affairs analyst noted: otherwise the ongoing trend and the escalation of regional and international hostilities will lead to the entry into a war zone that will be seriously endangered in both national interests and national security. It is perhaps because of these issues and subtleties that the parties to the conflict between negotiation and war have yet to adhere and have not left the negotiating arena.

* Europe will do nothing

According to him, under the current circumstances, both sides have shown their relative advantage in using their relative advantages. Tajikistan added: ""I do not expect Europe to do anything special at this time, because the recent developments in the region have brought about a third step and the French four-point plan discourse has almost taken over and created more space. I know we'll continue with those earlier discussions.
The former Iranian ambassador to Jordan added: ""But since the changes I mentioned in the region, such as the internal and personal problems of Trump and other developments in the region, including Netanyahu's departure, ... have weakened the US position in general. It is a good opportunity for Europe, if it wishes, not only for Iran but for its historic role in the region and in the world, to unleash its hand and fulfill its obligations to Iran, to take steps to persuade Iran to Staying in Brajam has the economic benefits and people to see the results.Operational rounds, diplomatic and political actions with Europe, whether with France or other countries, said: Europe's position against the United States is a bit stronger than before and can be combined with the operational or executive actions that the Supreme National Security Council may seek. It's designed and implemented, and we try to use our own political leverage.
* Developments that helped make the previous three steps effectiveTajik also said: ""My analysis is that we started a little early in the hurry, without a long-term plan, without creating the background and arrangements."" But fortunately those steps were followed by a series of actions in the Persian Gulf, tanker flows, the American drone overturned and the impracticality of Trump who knew they were doing wrong and entered our territorial waters and disappointed his allies, especially the UAE and Saudi Arabia, with Trump. Faced with these developments, these three steps helped to some extent He added: ""Alongside operations that are to be designed and implemented by the Supreme National Security Council as a fourth step, a series of political, diplomatic, and pro-active measures will be taken to ensure that Trump's strategy of isolation remains sustainable."" Stay tuned.
* Berjam will be a stable structure for some time The former Iranian ambassador to Jordan on the future of Burjam noted: If developments such as Bolton's departure, Netanyahu's absence from the Zionist scene and the despair of bin Salman and bin Zayed from the US plus the developments in northern Syria Fourthly, in my opinion, Brajam still has the capacity to continue. Because we are interested in the Brjam Structure, and the Europeans believe it is better to stay stable in the Middle East scene and to be the jumping off point for future cooperation, so my analysis is that Brjam will remain a sustainable structure for some time.


"
