,src,lang,text
0,"











Поматросил и бросил или как Янковский воспользовался влюбчивой Асмус?
03 Nov 2019, 01:00 by Мария Гришаева
Похоже, что роман с женой Харламова нужен был Ивану, чтобы преодолеть детские комплексы.



После того, как на экранах появился фильм «Текст», пошли слухи, что между исполнителями главных ролей – Кристиной Асмус и Иваном Янковским, завязался настоящий роман. А по некоторым сведениям, скандальная сцена, где актеры играют любовную связь, произошла по-настоящему.
Подтвердить или опровергнуть это никто не может. Ведь съемка велась самим Иваном на камеру смартфона, а в комнате кроме него и Кристины больше никого не было.
Но шумиха вокруг киноленты постепенно улеглась, а вместе с ней и истории о романе актеров. Похоже, что Янковский просто воспользовался влюбчивой Асмус, как говорится – поматросил и бросил.



Но как же так произошло? Ведь Кристина красива, молода, приветлива. Она мечта многих мужчин.
Как бы парадоксально не звучало – это и могло с ней сыграть злую шутку.
Дело в том, что в детстве бабушка Ивана Янковского учила его, что во всем он должен быть лучшим и добиваться лидерства во всем, чем занимается. И если раньше он этого не понимал, то с возрастом смысл нравоучений до него дошел.
Поэтому для Янковского Асмус могла быть лишь «галочкой» в его списке побед и достижений. Ведь девушку неоднократно признавали лучшей российской актрисой. Да и внешние данные ее не раз возносили на вершины рейтингов красоты. Поэтому соблазнить ее было бы очень приятно хотя бы ради собственного тщеславия.

Vista по теме






",ru,"











Matrosit and abandoned, or how did Jankovsky take advantage of the amorous Asmus?
03 Nov 2019, 01:00 by Maria Grishaeva
It seems that Ivan needed an affair with Kharlamov’s wife to overcome the children's complexes.



After the film “Text” appeared on the screens, there were rumors that a real romance began between the leading actors - Kristina Asmus and Ivan Yankovsky. And according to some reports, the scandalous scene where the actors play a love affair happened for real.
No one can confirm or deny this. After all, the shooting was conducted by Ivan himself on the smartphone camera, and in the room there was no one else except him and Christina.
But the hype around the film gradually subsided, and with it the stories about the romance of the actors. It seems that Jankowski simply took advantage of the amorous Asmus, as they say - he poured and threw it away.



But how did this happen? After all, Christina is beautiful, young, affable. She is the dream of many men.
As paradoxical as it sounds, this could play a cruel joke with her.
The fact is that as a child, Ivan Yankovsky’s grandmother taught him that in everything he should be the best and seek leadership in everything he does. And if before he did not understand this, then with age the meaning of moralizing came to him.
Therefore, for Yankovsky, Asmus could only be a “tick” in his list of victories and achievements. After all, the girl was repeatedly recognized as the best Russian actress. Yes, and external data has repeatedly raised it to the top of the beauty ratings. Therefore, it would be very pleasant to seduce her, if only for the sake of her own vanity.

Vista on the topic






"
