,src,lang,text
0,"











Lula e mais de 40 são intimados a depor sobre compra de senadores do MDB

05 Nov 2019, 19:46

Além de Dilma Rousseff, Lula também foi intimado a depor na operação realizada hoje para aprofundar as investigações sobre a compra de apoio político do MDB do Senado em 2014.
No total, a Polícia Federal listou 44 pessoas para serem ouvidas simultaneamente sobre a suspeita de que, a pedido de Guido Mantega, a JBS tenha repassado mais de R$ 40 milhões a senadores do MDB para convencê-los a fechar a aliança com o PT na disputa presidencial.
Também foram intimados os atuais senadores Eduardo Braga, Jader Barbalho, Renan Calheiros, Dário Berger; os ex-senadores Vital do Rêgo (atual ministro do TCU), Eunício Oliveira e Valdir Raupp; além dos governadores Renan Filho (AL) e Helder Barbalho (PA), todos do MDB.
Do PT, além de Dilma, Guido e Lula, também foi intimado Edinho Silva, tesoureiro da campanha e atual prefeito de Araraquara.
Ao autorizar buscas e apreensões — sobre operadores, emissários e empresários que teriam intermediado o pagamento aos políticos — Edson Fachin considerou que as intimações não precisavam de autorização judicial, uma vez que a própria lei admite sua realização pela polícia.
A PF pediu a realização de depoimentos simultâneos dos envolvidos “como forma de se obter declarações fidedignas e evitar combinação de versões e influências externas”. Vários deles não compareceram e pediram para falar em data futura.
Veja, abaixo, a lista dos intimados:

José Renan Vasconcelos Calheiros
José Renan Vasconcelos Calheiros Filho
Roseane Nogueira De Andrade
Ricardo José Gomes Da Rocha
Átila Yurtsever
Metin Yurtsever
Carlos Eduardo De Souza Braga
Gilvam Pinheiro Borges
Maurenizia Dias Andrade Alves
Mauricio Tadeu Garcia
Eunício Lopes De Oliveira
Leonardo Santos De Souza
Alexandre Santos De Souza
Henrique Santos De Souza
Karine Pinto Alcantara Santos
Jader Fontenelle Barbalho
Vital Do Rego Filho
André Gustavo Vieira Da Silva
Dario Elias Berger
Valdir Raupp De Matos
Gilberto Junior De Loyola
Luís Henrique De Oliveira Resende
Luiz Otavio Oliveira Campos
José Aparecido Alves Diniz
Helder Zahluth Barbalho
Antonio Carlos Borges Leal De Britto
Daniel Henrique Macedo Pereira
Milene Soares Sentes
Isaac Ramiro Sentes
Luís Inácio Lula Da Silva
Jose Nivaldo Barbosa De Souza Junior
Antônio Carlos Vieira Da Silva Júnior
Dilma Vana Rousseff
Carlos Adriano Gehres
Paulo Roberto Barreto Bornhausen
José Augusto Fretta
José Almeida Lima
Jose Aristeu Santos Neto
Breno Ferreira Teixeira
Rubens Ferreira
Vladmir Oliveira Da Silveira
Márcia Cavallari Nunes
Edson Antônio Edinho Da Silva
Guido Mantega



",pt,"











Lula and more than 40 are summoned to testify over MDB purchase

05 Nov 2019, 19:46

In addition to Dilma Rousseff, Lula was also summoned to testify in the operation today to deepen investigations into the purchase of political support from the Senate MDB in 2014.
In total, the Federal Police listed 44 people to be heard simultaneously on the suspicion that, at Guido Mantega's request, JBS passed over $ 40 million to MDB senators to convince them to close the alliance with the PT in the presidential dispute.
Also present were the current senators Eduardo Braga, Jader Barbalho, Renan Calheiros, Dario Berger; former senators Vital do Rêgo (current TCU minister), Eunício Oliveira and Valdir Raupp; besides the governors Renan Filho (AL) and Helder Barbalho (PA), all from MDB.
From PT, besides Dilma, Guido and Lula, was also summoned Edinho Silva, campaign treasurer and current mayor of Araraquara.
In authorizing searches and seizures - about operators, emissaries and businessmen who would have mediated the payment to politicians - Edson Fachin considered that the subpoenas did not need judicial authorization, since the law itself admits that they were carried out by the police.
The PF called for the simultaneous testimony of those involved “as a way of obtaining reliable statements and avoiding combination of versions and external influences”. Several of them did not attend and asked to speak at a future date.
See below for a list of subpoenas:

José Renan Vasconcelos Calheiros
José Renan Vasconcelos Calheiros Filho
Roseane Nogueira De Andrade
Ricardo José Gomes Da Rocha
Attila Yurtsever
Metin Yurtsever
Carlos Eduardo Souza Braga
Gilvam Pinheiro Borges
Maurenizia Dias Andrade Alves
Mauricio Tadeu Garcia
Eunício Lopes De Oliveira
Leonardo Santos De Souza
Alexandre Santos De Souza
Henrique Santos De Souza
Karine Pinto Alcantara Santos
Jader Fontenelle Shaving
Vital Do Rego Filho
André Gustavo Vieira Da Silva
Dario Elias Berger
Valdir Raupp De Matos
Gilberto Junior De Loyola
Luís Henrique De Oliveira Resende
Luiz Otavio Oliveira Campos
José Aparecido Alves Diniz
Helder Zahluth Shaving
Antonio Carlos Borges Leal De Britto
Daniel Henrique Macedo Pereira
Milene Soares Feels
Isaac Ramiro Feels
Luís Inácio Lula Da Silva
Jose Nivaldo Barbosa De Souza Junior
Antonio Carlos Vieira Da Silva Junior
Dilma Vana Rousseff
Carlos Adriano Gehres
Paulo Roberto Barreto Bornhausen
José Augusto Fretta
José Almeida Lima
Jose Aristeu Santos Neto
Breno Ferreira Teixeira
Rubens Ferreira
Vladmir Oliveira Da Silveira
Marcia Cavallari Nunes
Edson Antonio Edinho Da Silva
Guido Mantega



"
