,src,lang,text
0,"











Un jugador del Lleida Esportiu, convocado por Guinea Ecuatorial
05 Nov 2019, 19:01 by SPORT.es

Joanet López se estrenará con la selección de su país por ascendencia materna en la fase de clasificación para la Copa África 2021
El centrocampista de la cantera azulada ha subido esta temporada al primer equipo, líder del grupo 3 de Segunda B

Joan López Elo, conocido futbolisticamente como Joanet, vivirá en los próximos días su primera experiencia como futbolista internacional. El centrocampista del Lleida Esportiu, que posee la doble nacionalidad hispano-guineana, ha sido convocado por Guinea Ecuatorial para disputar dos partidos de clasificación para la Copa África 2021, contra Tanzania y Túnez.
El jugador, que afronta su primera temporada oficial en el primer equipo azulado -en la anterior participó en alguna convocatoria pero no llegó a debutar en la Liga-, fue llamado por primera vez por el gijonés Dani Guindos, máximo responsable técnico de la selección guineana. Al tener que incorporarse en fechas FIFA, en las que hay competición en Segunda B, Joanet se perderá al menos el partido que el equipo de Molo disputará en Llagostera.
La convocatoria internacional de Joanet no es la primera de un futbolista del Lleida Esportiu. Tiempo atrás, el defensa Max Llovera -actualmente en las filas del Granollers, en Tercera División- también se ausentó en parones por fechas FIFA al estar convocado por la selección de su país de nacimiento, Andorra.
Joanet ha participado en nueve de los once partidos del Lleida Esportiu en Segunda B esta temporada, en los que anotó un gol. El conjunto de la Terra Ferma es actualmente líder en solitario del grupo 3, con 22 puntos, uno más que el Sabadell y dos más que Andorra, Castellón y Villarreal B. El joven futbolista, que cumplió 20 años el 1 de marzo, optará a jugar contra la escuadra tanzana el próximo viernes 15, y contra los tunecinos, el martes 19.


",es,"











A player from Lleida Esportiu, summoned by Equatorial Guinea
05 Nov 2019, 19:01 by SPORT.es

Joanet López will debut with the selection of his country by maternal ancestry in the qualification phase for the 2021 Africa Cup
The midfielder of the blue quarry has climbed this season to the first team, leader of group 3 of Second B

Joan López Elo, known footballily as Joanet, will live his first experience as an international footballer in the next few days. The Lleida Esportiu midfielder, who has dual Hispanic-Guinean nationality, has been summoned by Equatorial Guinea to play two qualifying matches for the 2021 Africa Cup, against Tanzania and Tunisia.
The player, who faces his first official season in the first bluish team - in the previous one he participated in a call but did not debut in the League -, he was first called by the Gijon Dani Guindos, head of the Guinean team . Having to join FIFA dates, in which there is competition in Second B, Joanet will miss at least the match that the Molo team will play in Llagostera.
Joanet's international call is not the first of a football player from Lleida Esportiu. Long ago, defender Max Llovera - currently in the ranks of the Granollers, in the Third Division - was also absent in stoppages by FIFA dates when he was summoned by the selection of his country of birth, Andorra.
Joanet has participated in nine of Lleida Esportiu's eleven games in Segunda B this season, in which he scored a goal. The Terra Ferma team is currently the solo leader of group 3, with 22 points, one more than Sabadell and two more than Andorra, Castellón and Villarreal B. The young soccer player, who turned 20 on March 1, will be eligible for play against the Tanzanian squad next Friday 15, and against the Tunisians, on Tuesday 19.


"
