,src,lang,text
0,"











Основатель американской частной военной компании ведет переговоры о покупке Мотор Сич, - СМИ
05 Nov 2019, 19:39 by Владимир Андреев

Неофициальный советник президента США Дональда Трампа, основатель американской частной военной компании Blackwater (Academi) Эрик Принс ведет переговоры о покупке авиастроительного завода «Мотор Сич».

Об этом со ссылкой на свои источники сообщает издание Wall Street Journal, пишет ""Новое время"".
Принс является исполнительным директором частной компании в сфере безопасности Frontier Services Group, которая базируется в Гонконге и Пекине. Принс также является братом министра образования администрации Трампа Бетси ДеВос (Betsy DeVos), а в его послужном списке было создание авиакомпании Presidential Airways, парк которой насчитывал 70 самолетов, пишет 061.
СМИ утверждают, что американец посещал запорожский завод 24 — 27 октября и обсуждал ситуацию, сложившуюся на предприятии, с украинскими официальными лицами.
В материале также говорится, по данным государственной пограничной службы Украины, с 2014 года Принс приезжал в Украину не менее девяти раз.
Комментария самого Принса у журналистов нет. В то же время представитель Frontier Services Group и бизнесмена сказал журналистам, что он хочет инвестировать в Украину. СМИ отмечают, что в случае покупки завода, он останется зарегистрован в Украине, а Принс получит список его клиентов. 
В Мотор Сичи на запрос не ответили. Нет комментария на этот счет и на официальном сайте предприятия.
Ранее мы писали о том, что китайская компания Skyrizon Aircraft инвестирует в госбюджет 100 млн долларов, если Антимонопольный комитет Украины выдаст разрешение на покупку более 50% акций АО «Мотор Сич». 
Глава Антимонопольного комитета Юрий Терентьев отмечал, что контрольный пакет запорожского авиастроительного завода принадлежит китайцам. Сделка по продаже акций была совершена в 2016 году. Если процесс купли-продажи прошел в обход Антимонопольного комитета, по покупатель должен быть привлечен к ответственности. 
Напомним, в 2017 году, в рамках уголовного производства был наложен арест на пакет акций ОАО «Мотор Сич» (56%). В СБУ факт продажи акций расценили, как диверсия, в то время как Богуслаев назвал это коммерцией.
В апреле 2018 года на «Мотор Сич» прошли обыски. Собственник предприятия прокомментировал их и сказал, что «готовится вооруженный захват» предприятия.
«Я вынужден говорить «рейдерский захват», я же не могу, опустив глаза говорить, что все хорошо, прекрасная маркиза, с нами обходятся нормально. Я говорю честно», - сказал тогда во время брифинга Богуслаев. Тогда же он признался, что продал свои 15%, получив разрешение Национального банка и привлек 100 млн долларов инвестиций.


",ru,"











The founder of an American private military company is in talks to buy Motor Sich, - the media
05 Nov 2019, 19:39 by Vladimir Andreev

Eric Prince, an unofficial adviser to US President Donald Trump, founder of the American private military company Blackwater (Academi), is negotiating the purchase of the Motor Sich aircraft plant.

About this with reference to its sources, the Wall Street Journal reports, writes ""New time"".
Prince is the executive director of Frontier Services Group, a privately held security company based in Hong Kong and Beijing. Prince is also the brother of the trump administration minister of education, Betsy DeVos, and his track record has included the creation of Presidential Airways, a fleet of 70 aircraft, writes 061.
The media claim that the American visited the Zaporizhzhya plant on October 24-27 and discussed the situation at the enterprise with Ukrainian officials.
The material also says, according to the state border service of Ukraine, since 2014, Prince has come to Ukraine at least nine times.
Journalists have no comment on Prince himself. At the same time, a representative of Frontier Services Group and a businessman told reporters that he wants to invest in Ukraine. Media noted that in case of purchase of the plant, it will remain registered in Ukraine, and Prince will receive a list of its customers.
Motor Sich did not respond to the request. There is no comment on this subject either on the official website of the enterprise.
Earlier, we wrote that the Chinese company Skyrizon Aircraft will invest $ 100 million in the state budget if the Antimonopoly Committee of Ukraine issues a permit to purchase more than 50% of Motor Sich JSC.
The head of the Antimonopoly Committee, Yuri Terentyev, noted that the majority stake in the Zaporizhzhya aircraft factory belongs to the Chinese. The sale of shares was completed in 2016. If the sale process has bypassed the Antimonopoly Committee, the buyer should be held accountable.
Recall that in 2017, in the framework of criminal proceedings, an arrest was imposed on a stake in Motor Sich OJSC (56%). In the SBU, the fact of the sale of shares was regarded as a diversion, while Boguslaev called it commerce.
In April 2018, searches were held at Motor Sich. The owner of the enterprise commented on them and said that “an armed capture is being prepared” for the enterprise.
“I am forced to say“ raider seizure ”, but I can’t, looking down, say that everything is fine, a beautiful marquise, they treat us normally. I speak honestly, ”Boguslaev said at the time of the briefing. Then he admitted that he sold his 15%, having received permission from the National Bank and attracted $ 100 million of investments.


"
