,src,lang,text
0,"











Законопроект об установке российского ПО на гаджеты одобрили в Госдуме
Депутаты приняли законопроект в первом чтении.

05 Nov 2019, 19:00

Госдума приняла в первом чтении законопроект, который обязывает ритейлеров предустанавливать российские программы на определенные товары с 2020 года. Предполагается, что российское ПО будет устанавливаться на технически сложные товары, включая смартфоны, компьютеры и телевизоры с функцией Smart TV.
Как сообщает ""Интерфакс"", перечень устройств будет определять правительство.
Считается, что принятие закона позволит покупателям сразу использовать устройства без установки дополнительных приложений, которые ориентированы на российский рынок.
В правительстве поддержали законопроект и дали положительный отзыв. Считается, что он позволит продвигать российское ПО на рынке.


",ru,"











The bill on the installation of Russian software on gadgets approved in the State Duma
Deputies passed the bill on first reading.

05 Nov 2019, 19:00

The State Duma adopted a bill on first reading, which obliges retailers to pre-install Russian programs on certain products since 2020. It is assumed that Russian software will be installed on technically sophisticated products, including smartphones, computers and televisions with the Smart TV function.
According to Interfax, the list of devices will be determined by the government.
It is believed that the adoption of the law will allow customers to immediately use the device without installing additional applications that are focused on the Russian market.
The government supported the bill and gave positive feedback. It is believed that it will promote Russian software on the market.


"
