,src,lang,text
0,"











Previa del partido: el Vissel Kobe recibe al Vegalta Sendai en la trigésima jornada
01 Nov 2019, 04:03 by SPORT.es

El duelo se disputará en el NOEVIR Stadium Kobe el próximo sábado a las 05:00

El próximo sábado a las 05:00 se jugará el encuentro de la trigésima jornada de liga, en el que veremos enfrentarse al Vissel Kobe y al Vegalta Sendai en el NOEVIR Stadium Kobe.
El Vissel Kobe llega a la trigésima jornada con la ilusión de recuperar puntos después de sufrir una derrota contra el FC Tokyo en el partido anterior por un resultado de 1-3. Desde el inicio de liga, los locales han ganado en 10 de los 29 encuentros disputados hasta ahora, con una racha de 51 tantos a favor y 54 en contra.
Por su parte, el Vegalta Sendai logró derrotar al Nagoya Grampus 0-2 durante su último encuentro de liga, con tantos de Ramon Lopes y Hiraoka, por lo que espera repetir resultado, esta vez en el feudo del Vissel Kobe. De los 29 partidos jugados en esta temporada de la J1 League, el Vegalta Sendai ha ganado en 10 de ellos y suma una cifra de 40 goles encajados frente a 34 a favor.
Como local, el Vissel Kobe tiene un balance de cinco victorias, seis derrotas y tres empates en 14 partidos jugados en su campo, lo que demuestra que se le están escapando puntos en su casa, dando esperanzas a los visitantes de lograr resultados positivos. A domicilio, el Vegalta Sendai ha perdido en 10 ocasiones y ha empatado una vez en sus 14 partidos disputados, por lo que deberá esforzarse en arañar puntos en su visita al estadio del Vissel Kobe para intentar romper las estadísticas.
Con anterioridad han existido otros enfrentamientos en el NOEVIR Stadium Kobe en los cuales el Vissel Kobe ha conseguido ganar cuatro veces al Vegalta Sendai, mientras que éste lo ha hecho en una ocasión; además, en el partido restante el resultado fue de empate. A su vez, es destacable la racha de los locales, que llevan tres partidos seguidos ganando en casa frente al Vegalta Sendai. El último enfrentamiento en esta competición entre ambos equipos se disputó en marzo de 2019 y terminó con un marcador de 1-3 para el Vissel Kobe.
Además, los dos equipos están empatados a 35 puntos en la clasificación de la J1 League, por lo que el encuentro puede ser una buena oportunidad para deshacer las tablas. El equipo local se encuentra en undécimo lugar, mientras que el equipo visitante se sitúa en la undécima plaza.


",es,"











Preview of the match: Vissel Kobe receives Vegalta Sendai on the thirtieth day
01 Nov 2019, 04:03 by SPORT.es

The duel will be played at the NOEVIR Stadium Kobe next Saturday at 05:00

Next Saturday at 05:00 will be played the match of the thirtieth day of the league, in which we will see Vissel Kobe and Vegalta Sendai face in the NOEVIR Stadium Kobe.
Vissel Kobe reaches the thirtieth day with the illusion of recovering points after suffering a defeat against FC Tokyo in the previous match for a result of 1-3. Since the beginning of the league, the locals have won in 10 of the 29 games played so far, with a streak of 51 points in favor and 54 against.
For his part, Vegalta Sendai managed to defeat Nagoya Grampus 0-2 during his last league match, with many of Ramon Lopes and Hiraoka, so he hopes to repeat the result, this time in the Vissel Kobe fief. Of the 29 games played this season in the J1 League, Vegalta Sendai has won in 10 of them and adds a number of 40 goals conceded against 34 in favor.
As a local, Vissel Kobe has a balance of five wins, six losses and three draws in 14 games played in his field, which shows that points are escaping at home, giving visitors hope to achieve positive results. At home, Vegalta Sendai has lost 10 times and has drawn once in his 14 matches, so he must strive to scratch points during his visit to the Vissel Kobe stadium to try to break the statistics.
Previously there have been other clashes at the NOEVIR Stadium Kobe in which the Vissel Kobe has managed to win the Vegalta Sendai four times, while he has done so once; In addition, in the remaining match the result was a draw. At the same time, the streak of the locals, who have been winning three straight games at home against Vegalta Sendai, is remarkable. The last confrontation in this competition between both teams was played in March 2019 and ended with a score of 1-3 for the Vissel Kobe.
In addition, both teams are tied at 35 points in the J1 League standings, so the match can be a good opportunity to undo the tables. The home team is in eleventh place, while the visiting team is in eleventh place.


"
