,src,lang,text
0,"











‘Megafiesta’ Día de Muertos-Candelaria ‘elevan’ a Chocolate Abuelita con el 60% de sus ventas anuales
Juan Carlos Peralejo-Serrano, vicepresidente de chocolates y confitería en Nestlé México, dijo que la empresa creció el portafolio de presentaciones como granulada, y productos ‘on the go’ como barritas, listos para beber y bebidas de máquina.
01 Nov 2019, 04:50 by Alejandra Rodríguez
El maratón de festejos desde Día de Muertos hasta Candelaria representa el 60 por ciento de las ventas anuales del Chocolate Abuelita.
“Empieza un periodo interesante, primero es Día de Muertos, luego la virgen de Guadalupe, las posadas, Navidad, Reyes y Candelaria, ahí es el meollo del consumo, el 60 por ciento de nuestras ventas anuales”, reveló Juan Carlos Peralejo-Serrano, vicepresidente de chocolates y confitería en Nestlé México.
El vicepresidente de Nestlé en el país dijo que para crecer su presencia y consumo durante el año la empresa creció el portafolio de presentaciones como granulada, y productos ‘on the go’ como barritas, listos para beber y bebidas de máquina, aunque las tabletas de chocolate aún representan 85 por ciento de las ventas.
La innovación del portafolio contempla en el mediano plazo un producto orgánico e incluso sin azúcar.
“Estamos trabajando mucho en desarrollar innovaciones para la marca, lanzamos listo para beber y en máquinas, y en otra categoría que presentaremos pronto para tener otros usos de Abuelita en la cocina”, adelantó Claudia Buenrostro, encargada de mercadotecnia de Chocolate Abuelita.
Agregó que en el mediano plazo se contempla incursionar la marca en la oferta de productos orgánicos, donde el principal reto es contar con el sello que lo avale.
Al año se elaboran aproximadamente 27 mil toneladas de Chocolate Abuelita en la planta de Toluca. La producción de toda la cartera de chocolates de Nestlé, como Carlos V, Freskas y Tin Larin, es por 64 mil toneladas anuales, en dicha planta.


",es,"











‘Megafiesta’ Day of the Dead-Candelaria ‘raise’ Chocolate Abuelita with 60% of its annual sales
Juan Carlos Peralejo-Serrano, vice president of chocolates and confectionery at Nestlé Mexico, said the company grew the portfolio of presentations as granules, and products ""on the go"" like bars, ready to drink and machine drinks.
01 Nov 2019, 04:50 by Alejandra Rodríguez
The marathon of celebrations from Día de Muertos to Candelaria represents 60 percent of the annual sales of Abuelita Chocolate.
“An interesting period begins, first is Día de Muertos, then the Virgin of Guadalupe, the inns, Christmas, Reyes and Candelaria, there is the crux of consumption, 60 percent of our annual sales,” said Juan Carlos Peralejo-Serrano , vice president of chocolates and confectionery at Nestlé Mexico.
The vice president of Nestlé in the country said that to increase its presence and consumption during the year the company grew the portfolio of presentations as granules, and products 'on the go' such as bars, ready to drink and machine drinks, although tablets Chocolate still accounts for 85 percent of sales.
The innovation of the portfolio includes in the medium term an organic product and even without sugar.
""We are working hard to develop innovations for the brand, we launch ready to drink and in machines, and in another category that we will present soon to have other uses of Abuelita in the kitchen,"" said Claudia Buenrostro, marketing manager of Chocolate Abuelita.
He added that in the medium term it is contemplated to enter the brand in the offer of organic products, where the main challenge is to have the seal that guarantees it.
Approximately 27 thousand tons of Abuelita Chocolate are produced at the Toluca plant each year. The production of the entire Nestlé chocolate portfolio, such as Carlos V, Freskas and Tin Larin, is for 64 thousand tons per year, in that plant.


"
