,src,lang,text
0,"











Два автомобільні гіганти домовилися про злиття — ЗМІ

01 Nov 2019, 04:28

Угода між корпораціями Fiat Chrysler та Peugeot створить підприємство із загальною ринковою вартістю майже $50 млрд
Автомобільні корпорації Fiat Chrysler та Peugeot вирішили оголосити про злиття.
Про це повідомляє ВВС.
«Угода між двома виробниками автомобілів створить підприємство із загальною ринковою вартістю майже $50 млрд (39,9 млрд. фунтів стерлінгів)», - йдеться у повідомленні.
За інформацією ЗМІ, про злиття планується оголосити у четвер, 31 жовтня.
Старший аналітик фінансової компанії Morningstar Річард Гільгерт каже, що загальний обсяг проданих автомобілів PSA Group і Fiat Chrysler у 2018 році становить 8,7 мільйона одиниць.
У разі об'єднання нова компанія посяде четверту сходинку у списку найбільших автомобільних компаній.
У червні повідомлялося, що Fiat Chrysler вела переговори про злиття з Renault-Nissan-Mitsubishi, однак угоду так і не підписали.







",uk,"











Two car giants have agreed to merge - the media

01 Nov 2019, 03:28

Fiat Chrysler-Peugeot deal creates nearly $ 50 billion in market value
Fiat corporations Fiat Chrysler and Peugeot have decided to announce the merger.
About it reports Air Force.
""The agreement between the two carmakers will create an enterprise with a total market value of almost $ 50 billion (£ 39.9 billion),"" the statement said.
According to media reports, the merger is scheduled to be announced on Thursday, October 31.
Senior financial analyst at Morningstar finance company Richard Hilgert says the total sales of PSA Group and Fiat Chrysler cars in 2018 are 8.7 million units.
If merged, the new company will be ranked fourth in the list of largest car companies.
In June, it was reported that Fiat Chrysler was negotiating a merger with Renault-Nissan-Mitsubishi, but they did not sign the agreement.







"
