,src,lang,text
0,"











Manifestantes usam fantasias de Halloween no 14º dia de protestos no Chile

01 Nov 2019, 03:01

Santiago, 31 out (EFE).- Milhares de chilenos voltaram a se manifestar nesta quinta-feira pelas ruas do país, desta vez fantasiados por conta da celebração do Halloween, em um dia marcado por novos distúrbios entre manifestantes e policiais.
No 14º dia de protestos, os chilenos se reuniram em frente ao Palácio de La Moneda (sede do governo), para mostrar seu descontentamento, até que foram dispersados pela polícia.
Usando fantasias com temas ""macabros"", como um diabo com a máscara do presidente chileno Sebastián Piñera, Coringa, palhaços, entre outros, a atmosfera festiva reinou entre os manifestantes.
""Constituição ou travessura"", dizia o cartaz de um manifestante, parafraseando o clássico ""doce ou travessura, com o qual as crianças pedem doces nas casas na noite de Halloween e, neste caso, referia-se a uma das exigências dos cidadãos: uma nova Carta Magna para o Chile.
A manifestação de hoje também foi acompanhada por um grupo de motociclistas, que trafegavam pelas avenidas que dão na Praça Itália.
Como vem acontecendo, a manifestação pacífica da maioria dos cidadãos foi interrompida após confrontos onde os policiais usaram bombas de gás lacrimogêneo e jatos d'água para dispersar as pessoas.
Desde o último dia 18, o Chile é palco de grandes manifestações, com focos de violência e distúrbios que até o momento deixaram 20 mortos. EFE


",pt,"











Protesters wear Halloween costumes on 14th day of protests in Chile

01 Nov 2019, 03:01

Santiago, Oct 31 (EFE) .- Thousands of Chileans rallied on Thursday through the streets of the country, this time in costume because of the celebration of Halloween, on a day marked by new disturbances between protesters and police.
On the 14th day of protests, the Chileans gathered in front of the La Moneda Palace to show their discontent until they were dispersed by the police.
Using ""macabre"" themed costumes, such as a devil in the mask of Chilean President Sebastián Piñera, Joker, and clowns, among others, the festive atmosphere reigned among the protesters.
""Trick or Treat,"" read one protester's poster, paraphrasing the classic ""trick or treat,"" with which children ask for candy in their homes on Halloween night, and in this case referred to one of the citizens' demands: new Magna Carta for Chile.
Today's demonstration was also accompanied by a group of motorcyclists, who were traveling along the avenues leading to Piazza Italia.
As has been happening, the peaceful demonstration of most citizens was interrupted after clashes where police officers used tear gas and water jets to disperse people.
Since the last 18th, Chile has been the scene of large demonstrations, with outbreaks of violence and disturbances that so far left 20 dead. EFE


"
