,src,lang,text
0,"











Ataque armado contra Fiscalía de Ciudad Juárez deja un herido
La agresión contra la fiscalía local forma parte de una jornada violenta que vivió este martes Ciudad Juárez en distintas zonas, en la que murieron al menos ocho personas.
05 Nov 2019, 22:44 by Samuel García I Corresponsal
Un grupo de hombres disparó en varias ocasiones contra el edificio de la Fiscalía General del Estado en Ciudad Juárez, dejando herido a uno de los guardias de seguridad.
El inmueble, que se ubica en el cruce del Eje Vial Juan Gabriel y avenida Aserraderos, fue rodeado por policías estatales y municipales, quienes implementaron un operativo para desviar el tránsito vehicular a calles aledañas y hacer recorridos por la zona.
Además, al exterior del edificio localizaron una camioneta oficial de la propia dependencia; hasta el momento se desconoce la ubicación de los agentes que la tripulaban.
La agresión contra estas oficinas gubernamentales forma parte de una jornada violenta que vivió este martes Ciudad Juárez en distintas zonas, en la que murieron al menos ocho personas.
En el fraccionamiento Salvarcar tres personas fueron asesinadas a balazos y sus cuerpos fueron abandonados dentro de un vehículo al que prendieron fuego.
Previamente hubo tiroteos en colonias Américas, Independencia, Riberas del Bravo, Patria y Toribio Ortega, en donde también hubo fallecidos.


",es,"











Armed attack against the Prosecutor's Office of Ciudad Juárez leaves an injured
The aggression against the local prosecutor is part of a violent day that Ciudad Juárez lived in different areas on Tuesday, where at least eight people died.
05 Nov 2019, 22:44 by Samuel García I Correspondent
A group of men fired several times against the building of the State Attorney General's Office in Ciudad Juarez, leaving one of the security guards injured.
The property, which is located at the intersection of the Juan Gabriel Road Axis and Aserraderos Avenue, was surrounded by state and municipal police officers, who implemented an operation to divert vehicular traffic to nearby streets and make tours of the area.
In addition, outside the building they located an official van of the agency itself; So far the location of the agents that manned it is unknown.
The aggression against these government offices is part of a violent day that Ciudad Juárez lived in different areas on Tuesday, where at least eight people died.
In the Salvarcar subdivision three people were shot dead and their bodies were abandoned inside a vehicle that they set on fire.
Previously there were shootings in the Americas, Independence, Riberas del Bravo, Patria and Toribio Ortega colonies, where there were also deaths.


"
