,src,lang,text
0,"











ولي عهد أبوظبي يثمن الجهود السعودية.. والرياض تشيد بدور وتضحيات الإمارات
محمد بن زايد ومحمـد بـن سلمان يشهدان مراسم توقيع «اتفــاق الريــاض» بين الحكومةاليمنية و«الانتقالي»

05 Nov 2019, 22:05




محمد بن زايد ومحمد بن سلمان خلال مراسم توقيع اتفاق الرياض. وام



محمد بن زايد ومحمد بن سلمان والرئيس اليمني. وام


شهد صاحب السمو الشيخ محمد بن زايد آل نهيان، ولي عهد أبوظبي نائب القائد الأعلى للقوات المسلحة، والأمير محمد بن سلمان بن عبدالعزيز آل سعود، ولي العهد نائب رئيس مجلس الوزراء وزير الدفاع بالمملكة العربية السعودية الشقيقة، أمس، مراسم توقيع «اتفاق الرياض»، بين الحكومة اليمنية والمجلس الانتقالي الجنوبي، بحضور الرئيس اليمني، عبدربه منصور هادي. من جانبه، قال صاحب السمو الشيخ محمد بن زايد آل نهيان: «أثمن الجهود الكبيرة التي قامت بها الشقيقة المملكة العربية السعودية، في توحيد الصف اليمني ودورها المحوري في التوصل إلى (اتفاق الرياض).. تمنياتنا القلبية أن يعم الخير والسلام ربوع اليمن، وأن ينعم شعبه بالأمن والاستقرار والتنمية».
وأعرب الأمير محمد بن سلمان بن عبدالعزيز آل سعود عن شكره لصاحب السمو الشيخ محمد بن زايد آل نهيان، ونوه بما قدمته الإمارات من تضحيات جليلة في ساحات الشرف مع جنود المملكة وزملائهم في بقية قوات التحالف على الأرض اليمنية.
وقال الأمير محمد بن سلمان، في كلمة له خلال حفل التوقيع، الذي جرى في الديوان الملكي السعودي بالرياض، تحت رعاية خادم الحرمين الشريفين الملك سلمان بن عبدالعزيز آل سعود، عاهل المملكة العربية السعودية: «نؤكد أن مواقف المملكة تجاه اليمن مواقف أصيلة كأصالة شعبه العزيز، الذي تربطنا به أواصر الدين والقربى والجوار».
وأشاد باستجابة الرئيس اليمني عبدربه منصور هادي، والمجلس الانتقالي الجنوبي، لدعوة المملكة للحوار فيها، وما تم التوصل إليه في اتفاق الرياض، وأن يجعله الله فاتحة خير لمرحلة جديدة من الاستقرار والبناء والتنمية في اليمن، وقال: «ستكون المملكة معكم فيها، كما كانت دوماً».
وقال سموه: «لقد كان شغلنا الشاغل، منذ أن بدأت الأزمة اليمنية، هو نصرة الشعب اليمني الشقيق، استجابة لطلب رئيسه الشرعي، وانطلاقاً من مبدأ الدفاع عن النفس، ولوقف التدخلات الخارجية التي تسعى لفرض واقع جديد عليه بقوة السلاح، والانقلاب على شرعيته ومؤسساته، وتهديد أمن جيرانه، وأمن المنطقة وممراتها المائية الحيوية للعالم كله».
وفي وقت لاحق، أمس، التقى صاحب السمو الشيخ محمد بن زايد آل نهيان، الأمير محمد بن سلمان بن عبدالعزيز آل سعود، حيث بحث الجانبان، خلال اللقاء الذي جرى في الديوان الملكي بالرياض، العلاقات الأخوية بين دولة الإمارات العربية المتحدة والمملكة العربية السعودية على المستويات كافة، إضافة إلى تطورات ملف اليمن، والسبل الكفيلة بمساعدة الشعب اليمني الشقيق، لتحقيق تطلعاته المشروعة في التنمية والسلام.
كما استعرض سموهما المستجدات في منطقتي الخليج العربي والشرق الأوسط، والقضايا الإقليمية والدولية محل الاهتمام المشترك، وتبادلا وجهات النظر بشأنها.
وأكد صاحب السمو الشيخ محمد بن زايد آل نهيان، خلال اللقاء، عمق العلاقات الإماراتية السعودية، التي تستند إلى قاعدة صلبة من التفاهم والثقة والاحترام المتبادل والمصير المشترك، مثمناً دور المملكة العربية السعودية في تعزيز الاستقرار بالمنطقة، خلال هذه الظروف الاستثنائية المهمة التي تشهدها.
وثمن نائب وزير الدفاع السعودي، الأمير خالد بن سلمان، الدور الإيجابي للإمارات في التوصل إلى «اتفاق الرياض».
وأبدى مبعوث الأمم المتحدة إلى اليمن، مارتن غريفيث، أمس، ترحيبه بالاتفاق، وقال إن الاتفاق يشكل خطوة نحو الحل السلمي للأزمة.
واعتبرت الجامعة العربية اتفاق الرياض خطوة مهمة للحفاظ على كامل التراب اليمني، والحيلولة دون انزلاق اليمن نحو مزيد من الانقسام.
وأشاد الأمين العام لمنظمة التعاون الإسلامي، الدكتور يوسف بن أحمد العثيمين، أمس، بتوقيع الاتفاق، وأكد أن الاتفاق سيسهم في تعزيز أمن واستقرار اليمن. وأعرب عن تقدير المنظمة للدور الذي لعبته الإمارات، للتوصل إلى اتفاق الرياض.
وأعربت مصر عن ترحيبها بتوقيع اتفاق الرياض، أمس، وثمنت الجهود التي بذلتها الإمارات والسعودية، في سبيل التوصل للاتفاق.
كما أشاد أمير الكويت، الشيخ صباح الأحمد الجابر المبارك الصباح، باتفاق الرياض، وأكد أهميته في تعزيز وحدة الصف اليمني وحل الخلافات، كما رحبت مملكة البحرين بالاتفاق، وأشادت بدور السعودية الريادي والاستراتيجي في حفظ أمن المنطقة واستقرارها.


محمد بن زايد:

«تمنياتنا القلبية أن يعم الخير والسلام ربوع اليمن، وأن ينعم شعبه بالأمن والاستقرار».

محمد بن سلمان:

«الإمارات قدمت تضحيات جليلة في ساحات الشرف مع قوات التحالف».


",ar,"











Crown Prince of Abu Dhabi praises Saudi efforts .. Riyadh praises the role and sacrifices of the UAE
Mohammed bin Zayed and Mohammed bin Salman witness the signing of the «Riyadh Agreement» between the Yemeni government and «transitional»

05 Nov 2019, 22:05




Mohammed bin Zayed and Mohammed bin Salman during the signing ceremony of the Riyadh agreement. Wam



Mohammed bin Zayed, Mohammed bin Salman and the Yemeni President. Wam


His Highness Sheikh Mohammed bin Zayed Al Nahyan, Crown Prince of Abu Dhabi and Deputy Supreme Commander of the UAE Armed Forces, and Prince Mohammed bin Salman bin Abdulaziz Al Saud, Crown Prince and Deputy Prime Minister and Minister of Defense of the Kingdom of Saudi Arabia, witnessed yesterday the signing ceremony of the Riyadh Agreement, Between the Yemeni government and the Southern Transitional Council, in the presence of the Yemeni President, Abed Rabbo Mansour Hadi. For his part, His Highness Sheikh Mohammed bin Zayed Al Nahyan, said: “I appreciate the great efforts exerted by the sisterly Kingdom of Saudi Arabia in unifying the Yemeni rank and its pivotal role in reaching the (Riyadh Agreement). ""His people enjoy security, stability and development.""
Prince Mohammed bin Salman bin Abdulaziz Al Saud thanked His Highness Sheikh Mohammed bin Zayed Al Nahyan, and praised the UAE's sacrifices in the yards of honor with the Kingdom's soldiers and their colleagues in the rest of the coalition forces on Yemeni soil.
Prince Mohammed bin Salman, in a speech during the signing ceremony, which took place at the Saudi Royal Court in Riyadh, under the auspices of the Custodian of the Two Holy Mosques King Salman bin Abdulaziz Al Saud, the King of Saudi Arabia: , Which we have bonds of religion, kinship and neighborhood ».
He praised the response of Yemeni President Abd Rabbo Mansour Hadi and the Southern Transitional Council to the Kingdom's call for dialogue and what was reached in the Riyadh agreement, and that God makes it a good start for a new phase of stability, construction and development in Yemen. ».
His Highness said, ""Since the Yemen crisis began, our main concern has been to support the brotherly Yemeni people, in response to the request of their legitimate president, and based on the principle of self-defense, and to stop external interventions that seek to impose a new reality on him by force of arms, and to turn against his legitimacy and institutions."" And threaten the security of its neighbors, the security of the region and its vital waterways for the whole world. ”
Later, HH Sheikh Mohammed bin Zayed Al Nahyan met with Prince Mohammed bin Salman bin Abdulaziz Al Saud, during which the two sides discussed the brotherly relations between the UAE and Saudi Arabia at the levels. All, in addition to the developments of the Yemeni file, and ways to help the brotherly Yemeni people, to achieve their legitimate aspirations for development and peace.
They also reviewed the latest developments in the Gulf and the Middle East, and regional and international issues of common concern.
During the meeting, His Highness Sheikh Mohammed bin Zayed Al Nahyan, affirmed the depth of the UAE-Saudi relations, which are based on a solid base of understanding, trust, mutual respect and common destiny, and valued the role of Saudi Arabia in promoting stability in the region during these exceptional circumstances witnessing it.
Saudi Deputy Defense Minister Prince Khalid bin Salman praised the UAE's positive role in reaching the Riyadh agreement.
The UN envoy to Yemen, Martin Griffiths, yesterday welcomed the agreement, saying that the agreement is a step towards a peaceful solution to the crisis.
The Arab League considered the Riyadh agreement an important step to preserve the entire Yemeni soil and prevent Yemen from sliding towards further division.
The Secretary General of the Organization of Islamic Cooperation, Dr. Yousef bin Ahmed Al-Othaimeen, yesterday, praised the signing of the agreement, and stressed that the agreement will contribute to enhancing the security and stability of Yemen. He expressed the organization's appreciation for the role played by the UAE in reaching the Riyadh agreement.
Egypt welcomed the signing of the Riyadh agreement yesterday, and appreciated the efforts exerted by the UAE and Saudi Arabia to reach the agreement.
The Emir of Kuwait, Sheikh Sabah Al-Ahmad Al-Jaber Al-Mubarak Al-Sabah, also praised the Riyadh agreement and stressed its importance in strengthening Yemeni unity and resolving disputes.The Kingdom of Bahrain welcomed the agreement and praised Saudi Arabia's pioneering and strategic role in maintaining regional security and stability.


Mohammed bin Zayed:

""Our heartfelt wishes that good and peace prevail throughout Yemen, and that his people enjoy security and stability.""

Mohammed bin Salman:

«UAE made great sacrifices in the yards of honor with coalition forces».


"
