,src,lang,text
0,"











WhatsApp Plus se actualiza a la versión 8.10 con estas novedades

05 Nov 2019, 22:08




Conversar a través de un Smartphone es una práctica que se ha hecho más viral con el paso del tiempo. Tanto que incluso los más pequeños de la casa se han unido a esta tendencia.
Y entre tantas, una de las aplicaciones más populares de comunicación ha sido WhatsApp; sin embargo, cuando también se está en búsqueda de la personalización y comodidad, la versión WhatsApp Plus provee los mejores servicios en este sentido. Es por ello que hoy te daremos todos los detalles sobre ésta gran modificación de la app oficial, para que la utilices cuando desees
¿Qué es WhatsApp Plus?
Básicamente, es una aplicación o una modificación no oficial de WhatsApp que fue diseñada por un ciudadano español en el año 2012 con el objetivo de ofrecer una gran variedad de funciones que no tenía la versión original.
Una de las grandes diferencias entre esta aplicación y la versión original es el logo, ya que pese a ser el mismo en cuanto a forma, el de WhatsApp Plus es azul.
WhatsApp Plus funciona igual a la versión original, simplemente cuenta con otro tipo de ítems, que no están en la oficial y esto es lo que más ha llamado la atención de las personas.
¿Cuáles son las principales características de la aplicación?
WhatsApp Plus tiene diferentes características, que no posee la versión oficial. A continuación, te vamos a detallar las más importantes:

Temas: este es uno de los aspectos que más agrada a los usuarios, y es que WhatsApp Plus te permite seleccionar diferentes fuentes para que tus conversaciones se observen más atractivas y llamativas. La aplicación trae unos 700 temas. Hay para todos los gustos.
Emoticonos: la aplicación te permite explicar el sentimiento o transmitir la emoción que desees gracias a su gran número de emoticonos. No hay dudas de que tiene una lista más amplia y variada que la de la versión oficial.
Personalización: este es la función que atrapa más a las personas, ya que con WhatsApp Plus puedes personalizar tu dispositivo totalmente. Para lograrlo podrás cambiar colores, diseños, íconos e incluso colocar fotos de personas al lado de algún contacto; en pocas pocas palabras, puedes hacer lo que quieras.
Archivos: en cuanto al envío de archivos con WhatsApp Plus no tendrás problemas con la cantidad de megas, pues es ilimitado este aspecto, así que podrás enviar y recibir fotos y videos sin preocupación alguna, porque ni siquiera se le bajará la calidad al archivo.

Pasos para descargar e instalar WhatsApp Plus
Debido a que la aplicación es una modificación de la oficial, resulta evidente que no la podrás encontrar en la Play Store, sin embargo, eso no será impedimento a la hora de descargarla.
Lo primero que debes hacer –no puedes olvidar este paso- es desinstalar la versión oficial de WhatsApp que tienes en tu dispositivo móvil, a fin de que no haya inconveniente alguno.
Luego, ingresa a un portal web de confianza para descargar whatsapp plus gratis, obtendrás la versión 8.10, la cual está cargada de varias novedades que te contaremos un poco más adelante.
Una vez ya tengas el archivo APK en tu dispositivo móvil debes dirigirte a la opción “Ajustes” y seleccionar la que dice “Seguridad”. Cuando entres allí tendrás que pulsar la opción “Orígenes desconocidos”, la cual te permite instalar aplicaciones que no provienen de la tienda de aplicaciones de Google.
Cumplidos estos pasos, tienes que dirigirte al menú del dispositivo para pulsar la opción “Descargas”, la cual se encuentra en la carpeta de “Archivos”, allí encontrarás el archivo WhatsAppPlus.apk que deberás pulsar para que inicie la instalación.
Luego ya podrás disfrutar de tu nueva aplicación para interactuar con los demás.
Algunas novedades de la actualización
En comparación con la anterior, la versión 8.10 de WhatsApp Plus, lo primero que hay que decir es que se ha tenido en cuenta algunas de las opiniones de los usuarios, y esta actualización posee mejoras notables en el rendimiento y reducción del tedioso lag.
Aunque por otro lado, se le han añadido más emoticonos, permitiendo expresar más sin hacer uso de letras, además, una función que nos ha resultado de lo más interesante como la de poder ver los estados una vez han sido eliminados.
Entre otras de las nuevas novedades, también se ha incluido un bloqueador de llamadas entrantes (incluso puedes elegir quiénes podrán llamarte), una nueva función para ignorar todos los chat que han sido archivados, una nueva opción para cambiar el color del ícono de mensaje borrado y mucho más.


",es,"











WhatsApp Plus is updated to version 8.10 with these news

05 Nov 2019, 22:08




Talking through a Smartphone is a practice that has become more viral over time. So much that even the smallest of the house have joined this trend.
And among many, one of the most popular communication applications has been WhatsApp; However, when you are also in search of customization and comfort, the WhatsApp Plus version provides the best services in this regard. That is why today we will give you all the details about this great modification of the official app, so you can use it whenever you want
What is WhatsApp Plus?
Basically, it is an unofficial application or modification of WhatsApp that was designed by a Spanish citizen in 2012 with the aim of offering a wide variety of functions that the original version did not have.
One of the big differences between this application and the original version is the logo, since despite being the same in terms of shape, the WhatsApp Plus is blue.
WhatsApp Plus works the same as the original version, it simply has other types of items, which are not in the official one and this is what has most caught people's attention.
What are the main features of the application?
WhatsApp Plus has different features, which the official version does not have. Next, we will detail the most important:

Topics: this is one of the aspects that pleases users the most, and that is that WhatsApp Plus allows you to select different sources so that your conversations are more attractive and striking. The application brings about 700 themes. There is something for everyone.
Emoticons: the application allows you to explain the feeling or convey the emotion you want thanks to its large number of emoticons. There is no doubt that it has a wider and more varied list than the official version.
Personalization: this is the function that catches people the most, since with WhatsApp Plus you can fully customize your device. To achieve this you can change colors, designs, icons and even place photos of people next to a contact; In a few words, you can do whatever you want.
Files: Regarding the sending of files with WhatsApp Plus you will not have problems with the amount of megabytes, because this aspect is unlimited, so you can send and receive photos and videos without any concern, because the quality of the file will not even be reduced.

Steps to download and install WhatsApp Plus
Because the application is a modification of the official one, it is clear that you will not be able to find it in the Play Store, however, that will not be an impediment when downloading it.
The first thing to do - you cannot forget this step - is to uninstall the official version of WhatsApp that you have on your mobile device, so that there is no inconvenience.
Then, enter a trusted web portal to download whatsapp plus free, you will get version 8.10, which is loaded with several new features that we will tell you a little later.
Once you have the APK file on your mobile device you should go to the ""Settings"" option and select the one that says ""Security"". When you enter there you will have to press the option “Unknown origins”, which allows you to install applications that do not come from the Google application store.
Once these steps are completed, you have to go to the device menu to click on the “Downloads” option, which is located in the “Files” folder, there you will find the WhatsAppPlus.apk file that you must press to start the installation.
Then you can enjoy your new application to interact with others.
Some updates of the update
Compared to the previous version, WhatsApp Plus version 8.10, the first thing to say is that some of the opinions of users have been taken into account, and this update has notable improvements in performance and reduction of the tedious lag.
Although on the other hand, more emoticons have been added, allowing to express more without using letters, in addition, a function that has been as interesting as being able to see the states once they have been eliminated.
Among other new developments, it has also included an incoming call blocker (you can even choose who can call you), a new function to ignore all chat that has been archived, a new option to change the color of the deleted message icon and much more.


"
