,src,lang,text
0,"











Así fue como mataron a líder campesino al que Ejército se llevó, según senador
Se trata de Flower Jair Trompeta, que apareció muerto el pasado 28 de octubre en zona rural de Corinto, en Cauca, en hechos que están en investigación.

05 Nov 2019, 22:16

Si bien el Ejército emitió un comunicado en el que aseguraba que Trompeta “muere en desarrollo de operaciones militares”, y hasta lo relacionaba con un grupo de disidencias de las Farc, el senador Roy Barreras dio a conocer otra hipótesis del caso en medio del debate de moción de censura en contra del ministro de Defensa, Guillermo Botero.
Según Barreras, la comunidad de Corinto denunció que el Ejército retuvo y se llevó al líder campesino, que fue hallado sin vida a escasos metros “de la casa de la abuela materna”, en la vereda Media Naranja, en donde también encontraron “artefactos explosivos y casquillos”.
“Miren este detalle, senadores, el joven fue asesinado en la finca propiedad de su padre, Belisario Trompeta, en donde decidieron hacer un combate. ¡Qué cosa tan interesante! Un combate en la propia finca, porque testigos dicen que él estaba en su parcela”, afirmó Barreras, según transmisión en vivo del Congreso.
El senador también se refirió al argumento que dio el Ejército en el boletín, en donde aseguró que la víctima “tenía en su poder un fusil M-16, un lanzagranadas artesanal, material explosivo y municiones”. Además, citó el resultado de la autopsia en donde se establece que Trompeta “muere por cuatro disparos: dos en la espalda, uno en el cuello y otro en un brazo”.
“Los campesinos afirmaron que no hubo combate. Ya sabemos que lo mataron en la finca de su padre y de su abuela. Escucharon disparos a las 10:30 de la mañana y luego un sobrevuelo de helicóptero. La comunidad dice que Flower no pertenece a ningún grupo armado, y a esta fecha el ministro de la Defensa no ha aportado ninguna prueba sobre esa afirmación suya. Yo me pregunto, ¿cuántos eran los enemigos en ese combate? ¿Dónde están los otros capturados o las otras bajas? ¿O era el combate de un batallón contra un solo hombre?”, cuestionó Barreras en plenaria del Senado.
Con documentos de los resultados que entregó Medicina Legal y varios interrogantes por resolver, el senador Barreras concluyó que “esto fue una muerte por la espalda y con el campesino corriendo” en busca de refugio en su casa.
Esto, reiteró el senador, porque por la forma en que hallaron el cuerpo y por como entraron los proyectiles se podría hablar de que “lo mataron fusilado por la espalda”, pues “los tiros no fueron a ráfaga, sino uno a uno, de precisión”.
Finalmente, Barreras denunció que de acuerdo con el reporte de varios testigos, entre ellos los hermanos de la víctima, “tres personas de civil y con pistolas preguntaron a los soldados que dónde estaba el paquete” y se llevaron el cuerpo de allí. No obstante, el Ejército precisó en el boletín que fue la comunidad la que alteró la escena de los hechos en medio de una “asonada”.
“Los civiles a los que se refiere la comunidad, de acuerdo a la versión de un líder, son los mismos que bajaron del helicóptero en la torre juntó a miembros del Ejercito y de la Policía”, puntualizó el senador.


Imagen de los disparos que presentó el senador Barreras

En respuesta a esta denuncia, el ministro Botero dijo que serán las autoridades competentes las que investiguen esta muerte, pues aseguró que no le han llegado de manera oficial los resultados de los exámenes que practicó Medicina Legal.
Este es el debate completo:





",es,"











That's how they killed a peasant leader that the Army took, according to senator
It is about Flower Jair Trumpet, which appeared dead on October 28 in rural area of Corinth, in Cauca, in events that are under investigation.

05 Nov 2019, 22:16

Although the Army issued a statement in which it said that Trumpet ""dies in the development of military operations"", and even related it to a group of FARC dissidents, Senator Roy Barreras disclosed another hypothesis of the case in the middle of the debate of motion of censure against the Minister of Defense, Guillermo Botero.
According to Barreras, the community of Corinth denounced that the Army retained and took the peasant leader, who was found lifeless a few meters away ""from the house of the maternal grandmother"", in the Half Orange village, where they also found ""explosive devices and caps ”.
“Look at this detail, senators, the young man was killed on the estate owned by his father, Belisario Trumpet, where they decided to fight. What an interesting thing! A fight on the farm itself, because witnesses say he was on his plot, ”said Barreras, according to live broadcast from Congress.
The senator also referred to the argument given by the Army in the bulletin, where he said that the victim ""had an M-16 rifle, an artisan grenade launcher, explosive material and ammunition."" In addition, he cited the result of the autopsy where it is established that Trumpet ""dies by four shots: two in the back, one in the neck and one in one arm.""
“The peasants said there was no combat. We already know that he was killed on his father's and grandmother's estate. They heard shots at 10:30 in the morning and then a helicopter overflight. The community says that Flower does not belong to any armed group, and to this date the Minister of Defense has not provided any evidence on his claim. I wonder, how many were the enemies in that fight? Where are the other captured or the other casualties? Or was it the battle of a battalion against a single man? ”Barriers questioned in the Senate plenary.
With documents of the results delivered by Legal Medicine and several questions to be resolved, Senator Barreras concluded that ""this was a death from behind and with the farmer running"" in search of refuge in his home.
This, the senator reiterated, because of the way they found the body and how the projectiles entered, it could be said that they “killed him shot in the back”, because “the shots were not burst, but one by one, of precision"".
Finally, Barreras denounced that according to the report of several witnesses, among them the brothers of the victim, ""three civilians and gunmen asked the soldiers where the package was"" and took the body there. However, the Army said in the bulletin that it was the community that altered the scene of events in the midst of a ""raid.""
""The civilians referred to by the community, according to the version of a leader, are the same who got off the helicopter in the tower together with members of the Army and the Police,"" said the senator.


Image of the shots presented by Senator Barreras

In response to this complaint, Minister Botero said that it will be the competent authorities that investigate this death, since he assured that the results of the exams that Legal Medicine practiced have not officially reached him.
This is the full debate:





"
