,src,lang,text
0,"











Permintaan Fans Liverpool Usai Sadio Mane Disindir Guardiola: Tiru Luis Suarez!
05 Nov 2019, 14:21 by Bola.net
Bola.net - Komentar pelatih Manchester City, Josep Guardiola yang mengatakan Sadio Mane suka melakukan diving membuat fans Liverpool geram.
Sebagaimana diketahui, kedua tim akan bertemu pada pekan ke-12 Premier League di Anfield, Minggu (10/11/2019) malam WIB. Liverpool tengah memimpin klasemen dengan koleksi 31 poin, dan Manchester City ada di peringkat kedua dengan enam poin terpisah.
Perang urat syaraf yang dilontarkan Guardiola terkait kemenangan dramatis Liverpool di Villa Park. The Reds meraih poin penuh berkat gol Sadio Mane.
Guardiola memberikan tanggapan terkait kemampuan penyerang berpaspor Senegal tersebut.
""Itu (kemenangan dramatis) telah terjadi berkali-kali, apa yang dilakukan oleh Liverpool dalam beberapa tahun terakhir, itu karena Mane memiliki bakat khusus,"" kata Pep Guardiola dikutip Sportbible, Selasa (5/11/2019).
""Kadang-kadang dia diving, kadang-kadang dia memiliki bakat ini untuk mencetak gol luar biasa di menit terakhir. Dia berbakat,"" imbuhnya.
Guardiola menganggap Mane berusaha melakukan diving saat melawan Aston Villa. Ia juga dituduh jatuh terlalu mudah yang membuat Liverpool mendapat hadiah penalti saat melawan Leicester dan Tottenham Hotspur pada musim ini.
Komentar Guardiola tersebut membuat fans Liverpool marah. Mereka menyarankan Mane membalas komentar manajer Manchester City seperti yang dilakukan Luis Suarez 2012.


",id,"











Liverpool Fans' Request After Sadio Mane Quipped Guardiola: Imitate Luis Suarez!
05 Nov 2019, 14:21 by Bola.net
Soccer - Manchester City coach Josep Guardiola's comment that says Sadio Mane likes diving makes Liverpool fans furious.
As is known, the two teams will meet in the 12th week of the Premier League at Anfield on Sunday (11/10/2019) night hrs. Liverpool are leading the standings with 31 points, and Manchester City are second with six separate points.
The nerve war that Guardiola launched was related to Liverpool's dramatic victory at Villa Park. The Reds won full points thanks to Sadio Mane's goal.
Guardiola gave a response regarding the ability of the Senegalese passport attacker.
""That (dramatic victory) has happened many times, what has been done by Liverpool in recent years, it is because Mane has a special talent,"" Pep Guardiola was quoted as saying on Sportbible, Tuesday (11/05/2019).
""Sometimes he dives, sometimes he has this talent to score amazing goals at the last minute. He is talented,"" he added.
Guardiola thinks Mane is trying to dive against Aston Villa. He was also accused of falling too easily which gave Liverpool a penalty prize against Leicester and Tottenham Hotspur this season.
Guardiola's comments made Liverpool fans angry. They suggested Mane reply to the Manchester City manager's comments as did Luis Suarez 2012.


"
