,src,lang,text
0,"











В России планируют ввести минимальный размер алиментов
05 Nov 2019, 14:55 by Алексей Громов

Руководитель партии «Справедливая Россия» Сергей Миронов предложил установить государственные гарантии выплаты алиментов. Инициатива гарантирует защиту прав ребенка даже в случае уклонения родителей от своих финансовых обязательств.

Руководитель партии «Справедливая Россия» Сергей Миронов предложил установить государственные гарантии выплаты алиментов. Об этом рассказали в пресс-службе председателя политической партии и руководителя фракции в Госдуме.
Миронов, совместно с коллегами, внес в Госдуму законопроект, который устанавливает минимальный размер и новый порядок выплат алиментов. Инициатива гарантирует защиту прав ребенка даже в случае уклонения родителей от своих финансовых обязательств.
Лидер «Справедливой России» напомнил, что в настоящее время размер алиментов привязан к финансовому положению плательщиков, которые часто специально занижают доходы или действительно получают мизерную зарплату, с которой начисляются копейки.
«Получается, что выплата алиментов превращается в фикцию, они не выполняют главную свою задачу – не позволяют обеспечить ребенку достойный жизненный уровень», – подчеркнул Миронов.
Внесенное предложение предусматривает введение минимального размера алиментов, и их величина не должна быть ниже прожиточного минимума для ребенка, установленного в регионе, где постоянно проживает получатель алиментов. Также инициатива предусматривает механизм бюджетных выплат в случаях, когда плательщик игнорирует свои обязательства.
В конце октября НЕВСКИЕ НОВОСТИ писали, что в Петербурге алиментщица задолжала 300 тысяч рублей на содержание двух сыновей, которые проживают с отцом. После списаний денежных средств с зарплаты и банковской карт, а также запрета на выезд за границу и угрозы наложить арест на имущество женщина поспешила выплатить долг.
#дети #россия #выплаты #долг #алименты


",ru,"











Russia plans to introduce a minimum amount of alimony
05 Nov 2019, 14:55 by Alexey Gromov

The head of the Just Russia party, Sergei Mironov, proposed establishing state guarantees for the payment of alimony. The initiative guarantees the protection of the rights of the child even in the event that the parents evade their financial obligations.

The head of the Just Russia party, Sergei Mironov, proposed establishing state guarantees for the payment of alimony. This was told in the press service of the chairman of the political party and the head of the faction in the State Duma.
Mironov, together with his colleagues, introduced a bill to the State Duma that establishes a minimum amount and a new procedure for alimony payments. The initiative guarantees the protection of the rights of the child even in the event that the parents evade their financial obligations.
The leader of ""Fair Russia"" recalled that currently the amount of alimony is tied to the financial situation of payers, who often specifically underestimate income or actually receive a meager salary, from which pennies are charged.
“It turns out that the payment of alimony turns into a fiction, they do not fulfill their main task - they do not allow providing the child with a decent standard of living,” Mironov emphasized.
The proposed proposal provides for the introduction of a minimum amount of alimony, and their value should not be lower than the subsistence minimum for a child established in the region where the alimony recipient resides. The initiative also provides a mechanism for budget payments in cases where the payer ignores his obligations.
At the end of October, NEVSKY NEWS wrote that in St. Petersburg an alimentary woman owed 300 thousand rubles for the maintenance of two sons who live with her father. After deducting money from her salary and a bank card, as well as a ban on traveling abroad and the threat of seizing property, the woman hastened to pay the debt.
#children #Russia # payments # debt # alimony


"
