,src,lang,text
0,"











Первоуральский химзавод заплатит 200 тысяч рублей за размещение опасных отходов

05 Nov 2019, 14:10

Свердловский областной суд оставил в силе решение Росприроднадзора, который наложил на АО «Русский хром 1915» штраф за нелегальное размещение отходов III-IV класса опасности на своих площадях. Лицензия предприятия закончилась еще 1 января 2019 года, но желтая река и ядовитые отвалы неподалеку от жилого района Первоуральска беспокоили жителей и летом.
После плановой выездной проверки в июле специалисты Росприроднадзора составили протокол об административном правонарушении. Химпредприятие было оштрафовано на 200 тысяч рублей. Первоуральский городской суд подтвердил постановление надзорного органа. Но защита предприятия подала апелляцию в областной суд, юристы просили прекратить производство по делу. «Судья апелляционной инстанции, проверив материалы дела, не нашел оснований к отмене постановления. Вопреки доводам жалобы предприятие размещало отходы, что подтверждается материалами дела», – сообщили в пресс-службе облсуда. Предприятию придется заплатить штраф. Сейчас «Русский хром» занимается переоформлением лицензии, отметили в инстанции.



Жителей Первоуральска пугают зеленые сосульки
Пресс-служба АО «Русский хром 1915» сообщила, что решение Свердловского областного суда будет обжаловано в кассационной инстанции. «Федеральная служба по надзору в сфере природопользования составила протокол об административном правонарушении в отношении объекта временного накопления отходов и, по нашему мнению, не учла, что деятельность по накоплению отходов на срок не более одиннадцати месяцев не подлежит лицензированию, – отмечается в комментарии предприятия. – До 1 января 2019 года на АО «Русский хром 1915» действовала бессрочная лицензия на обращение с отходами. Но из-за изменений в законодательстве потребовалось оформление новой лицензии».

Екатеринбург, служба информации РИА «Новый День»

© 2019, РИА «Новый День»
Написать автору или сообщить новостьПодписывайтесь на каналыЯндекс НовостиЯндекс ДзенYouTube


",ru,"











Pervouralsky Chemical Plant will pay 200 thousand rubles for the disposal of hazardous waste

05 Nov 2019, 14:10

The Sverdlovsk Regional Court upheld the decision of Rosprirodnadzor, which imposed a fine on JSC Russian Chrome 1915 for illegally disposing of hazard class III-IV waste on its premises. The enterprise license ended on January 1, 2019, but the yellow river and poisonous dumps near the residential area of Pervouralsk bothered residents in the summer.
After a scheduled on-site inspection in July, Rosprirodnadzor specialists drew up an administrative offense report. The chemical enterprise was fined 200 thousand rubles. Pervouralsky city court upheld the decision of the supervisor. But the defense of the company appealed to the regional court, lawyers asked to stop the proceedings. “The appellate judge, after checking the case file, did not find any reason to cancel the decision. Contrary to the arguments of the complaint, the enterprise disposed of waste, which is confirmed by the case materials, ”the press service of the regional court said. The company will have to pay a fine. Now Russian Chrome is re-issuing a license, the authorities noted.



Residents of Pervouralsk are frightened by green icicles
The press service of JSC Russian Chrome 1915 reported that the decision of the Sverdlovsk Regional Court would be appealed to the cassation instance. “The Federal Service for Supervision in the Field of Nature Management has compiled a protocol on an administrative offense in respect of a temporary waste storage facility and, in our opinion, did not take into account that waste storage activities for a period of not more than eleven months are not subject to licensing,” the company’s comment says. - Until January 1, 2019, Russian Chrome 1915 JSC had a perpetual license for waste management. But due to changes in legislation, a new license was required. ”

Yekaterinburg, information service RIA ""New Day""

© 2019, RIA ""New Day""
Write to the author or report newsSubscribe to channelsYandex NewsYandex ZenYouTube


"
