,src,lang,text
0,"











Путин связал популярность русского языка в мире с мощью и влиянием России

05 Nov 2019, 14:06

Путин связал популярность русского языка в мире с мощью и влиянием России
Без этой силы даже появление трех Толстых и четырех Пушкиных не вызовет интереса к русскому, уверен он
Москва. 5 ноября. INTERFAX.RU - Интерес в мире к русскому языку будет расти по мере роста российской экономики и усиления влияния России, считает президент Владимир Путин. Он заявил об этом на заседании Совета при президенте по русскому языку.
""Интерес к русскому языку в мире будет возрастать по мере роста нашего благосостояния в самом широком смысле этого слова - и народного благосостояния, и страны в целом. Не будет этого, ты хоть тресни, - пусть у нас еще два-три Толстых появится и четыре Пушкина - будут переводить просто и все. А если страна будет мощной, сильной, привлекательной, притягательной - будут учить русский язык"", - считает он.
Путин напомнил, что в советское время в странах Восточной Европы ""активно и неплохо изучали русский язык"", и Россия и ее партнеры до сих пор этим пользуются ""в хорошем смысле слова"". Тогда, по его словам, знать русский было выгодно.
""От этого зависела карьера, от этого зависело продвижение по службе, было реально большое сотрудничество с Советским Союзом. Это было влияние. Советский Союз растворился и все, интерес к (русскому) языку начал затухать, и это затухание искусственно подогревается"", - продолжил он.
Сейчас в странах, с которыми у России возрождается экономическое и политическое сотрудничество, начался всплеск интереса к русскому, и это происходит не только в бывших советских республиках, но и в дальнем зарубежье, рассказал президент.
Путин также привел мнение экспертов о том, что ""влияние той или иной страны в современном мире определяется не оружием, а экономикой, и как производная от экономики - оружие, культура, образование, наука"": ""Все имеет, конечно, свою предысторию, но очень быстро закисает, если не поддерживается высокоразвитой и энергично развивающейся экономикой"".
Ранее на этом заседании президент возразил против сравнения языка с оружием и назвал его инструментом мягкой силы. Также он отметил попытки ""русофобов"" и ""националистов"" в разных странах ограничить русский язык и вытеснить на периферию.


",ru,"











Putin linked the popularity of the Russian language in the world with the power and influence of Russia

05 Nov 2019, 14:06

Putin linked the popularity of the Russian language in the world with the power and influence of Russia
Without this force, even the appearance of three Tolstoys and four Pushkins will not cause interest in Russian, he is sure
Moscow. November 5. INTERFAX.RU - Worldwide interest in the Russian language will grow as the Russian economy grows and Russia's influence grows, said President Vladimir Putin. He announced this at a meeting of the Presidential Council on the Russian language.
""The interest in the Russian language in the world will increase as our well-being in the broadest sense of the word grows - both national welfare and the country as a whole. There will not be this, at least you crack, let us have two or three more Tolstoys and four ""They will translate Pushkin simply and that’s all. And if the country is powerful, strong, attractive, attractive, they will learn the Russian language,"" he said.
Putin recalled that in Soviet times in the countries of Eastern Europe they ""actively and fairly studied the Russian language,"" and Russia and its partners still use it ""in a good sense of the word."" Then, according to him, knowing Russian was beneficial.
""Career depended on it, career advancement depended on it, there was really great cooperation with the Soviet Union. It was an influence. The Soviet Union dissolved and everything, interest in the (Russian) language began to fade, and this fading is artificially heated up,"" he continued .
Now in countries with which economic and political cooperation is reviving, a surge of interest in Russian has begun, and this is happening not only in the former Soviet republics, but also in far abroad countries, the president said.
Putin also cited the opinion of experts that ""the influence of a country in the modern world is determined not by weapons, but by the economy, and as a derivative of the economy - weapons, culture, education, science"": ""Everything, of course, has its own background, but sour very quickly, if not supported by a highly developed and vibrantly developing economy. ""
Earlier in the meeting, the president objected to comparing language with weapons and called it a soft power tool. He also noted the attempts of ""Russophobes"" and ""nationalists"" in different countries to limit the Russian language and push them to the periphery.


"
