,src,lang,text
0,"











Những bộ phim Hoa Ngữ khiến khán giả mong chờ ra mắt phần 2: Bao giờ Vũ Văn Nguyệt của 'Sở Kiều truyện' mới được cứu ra khỏi sông băng?
05 Nov 2019, 14:06 by Phượng Nguyễn
1. Hoa Thiên Cốt
Hoa thiên cốt (花千骨) là bộ phim điển hình về chuyện tình ngược tâm của sư và đồ. Bộ phim mở đầu bằng những tình tiết vô cùng ngọt ngào, để rồi số mệnh trêu ngươi con người, thầy trò Hoa Thiên Cốt và Bạch Tử Họa tương ái tương sát, kết quả Hoa Thiên Cốt vì muốn ngăn chặn chiến tranh mà lựa chọn hi sinh chính bản thân mình. Kết cục này đã lấy đi nước mắt của vô số khán giả.






Một bộ phim quá ngọt ngào trở thành bộ phim ngược tâm, kết cục cuối cùng cũng không thể khiến khán giả mãn nguyện. Bởi vậy nên có rất nhiều khán giả hi vọng có Hoa Thiên Cốt phần 2 để những người yêu nhau có thể ở bên nhau.



2. Sở Kiều truyện
Sở Kiều truyện (楚乔传) là một bộ phim truyền hình cổ trang dựa trên tiểu thuyết Hoàng phi sở đặc công số 11. Phim lấy bối cảnh thời Tây Ngụy loạn thế hỗn chiến, rất nhiều dân thường trong chiến loạn bị bắt làm nô bộc, mạng như cỏ rác, trong đó có thiếu nữ Sở Kiều. Nhưng Sở Kiều không cam chịu số phận nô lệ, với ý chí sắt đá và sự thông minh vốn có, Sở Kiều đã đứng lên đấu tranh trở thành một nữ anh hùng thời loạn thế.



Sở Kiều truyện từng đạt số lượt phát sóng trên mạng internet lên đến hơn 40 tỷ lượt. Với cốt truyện chặt chẽ, diễn xuất diễn viên vô cùng xuất sắc, phim đã thành công để lại dấu ấn đối với khán giả.






Tuy nhiên có một điều vô cùng đáng tiếc, đó là bộ phim đi vào hồi kết vẫn để lại rất nhiều khoảng trống trong lòng khán giả. Kết phim Sở Kiều (Triệu Lệ Dĩnh) và Vũ Văn Nguyệt (Lâm Canh Tân) đều bị rơi xuống hồ băng, câu chuyện tình đầy lãng mạn và trắc trở như đi vào ngõ cụt. Sau đó được biết phim mới quay được một nửa, còn một nửa vẫn chưa khởi quay. Bởi thế nên hai năm nay thường xuyên có thông tin đồn rằng Sở Kiều truyện 2 sắp khởi quay, nhưng đáng tiếc rằng đến thời điểm hiện tại vẫn chưa có thông tin chính thức từ phía nhà sản xuất.



3. Bạch dạ truy hung
Bạch dạ truy hung (白夜追凶) là một bộ phim chiếu mạng, ban đầu phim không nhận được sự đánh giá cao từ phía khán giả. Nhưng sau khi ra mắt, với đội ngũ chế tác tinh túy, cốt truyện hấp dẫn, tiết tấu nhanh cùng diễn xuất xuất chúng của Phan Việt Minh đã đưa bộ phim đến với đông đảo khán giả và trở thành một bộ phim kinh điển.






Có thông tin cho rằng, nhà sản xuất đang chuẩn bị cho phần tiếp theo của phim, và phần 2 sẽ nhanh chóng ra mắt khán giả trong thời gian tới.
4. Trần tình lệnh
Mùa hè năm nay, Trần tình lệnh (陈情令) trở thành tâm điểm của các trang mạng phim Hoa Ngữ. Tuy trước khi lên sóng, Trần tình lệnh không được đánh giá cao, thậm chí khi bắt đầu lên sóng phim cũng nhận không ít ý kiến chê bai từ khán giả.



Ban đầu, phim khởi điểm với đánh giá cực thấp, chỉ với 4.8 điểm douban. Nhưng dần dần, cốt truyện và diễn xuất diễn viên nhận được sự công nhận của khán giả và fan nguyên tác, từ đó Trần tình lệnh không ngừng thay đổi cục diện khi tăng vọt lên mức 7.0 khi ở nửa chặng đường, sau đó số điểm này tiếp tục tăng lên 8.2 và trở thành một trong những bộ phim hot nhất mùa hè năm nay.






Tuy nhiên, sau khi bộ phim khép lại, fan hâm mộ vẫn còn rất nhiều nuối tiếc, ngày bộ phim phát sóng tập cuối cùng, rất nhiều cư dân mạng đã bày tỏ “Trần tình lệnh, ngày tháng còn dài, đừng nói lời tạm biệt”.






Có thể cái kết trong Trần tình lệnh chưa phải cái kết mà đông đảo khán giả mong đợi, Ngụy Vô Tiện một lần nữa trở về nơi chia tay với Lam Trạm nhưng hai người lại không hề có cảnh gặp nhau. Tuy nhiên, có lễ đây mới là cái kết lãng mạn, cái kết để lại không gian tưởng tượng cho khán giả. Bởi vậy nên fan Tiêu Chiến -Vương Nhất Bác đều vô cùng mong đợi Trần tình lệnh ra mắt phần 2.












Xem thêm về Hoa thiên cốt






",vi,"











Chinese-language movies that make the audience look forward to the opening of part 2: When will Vu Van Nguyet of 'So Kieu stories' be saved from the glaciers?
05 Nov 2019, 14:06 by Phuong Nguyen
1. Thien Hoa Flower
Natural flower essence (花 千 骨) is a typical film about the love story of monks and monks. The film opens with extremely sweet details, so that the fate can tantalize people, Hoa Thien Cot and Bach Tu Hoa's teachers and students are close to each other, Hoa Thien Cot results in wanting to prevent war. sacrifice yourself. This outcome has taken the tears from countless audiences.






A film so sweet becomes an antithetical film, the end result can not satisfy the audience. Therefore, there are many people hoping to have Thien Thien Hoa part 2 so that lovers can be together.



2. So Kieu story
So Kieu story (楚 乔 传) is a historical drama based on the novel Hoang non-special agent No. 11. The film is set in the period of the West during the chaos of the war, many civilians in the war were arrested. slaves, lives like trash, including young woman So Kieu. But So Kieu did not bear the fate of slavery, with her iron will and inherent intelligence, So Kieu stood up to fight to become a hero in times of chaos.



So Kieu Kieu story once reached over 40 billion times on the internet. With a tight storyline, excellent acting, the film has successfully left a mark on the audience.






However, one thing is extremely regrettable, that the film came to an end still leaving a lot of space in the audience's heart. The film ending So Kieu (Trieu Le Dinh) and Vu Van Nguyet (Lam Canh Tan) are both falling into an ice lake, the love story is full of romance and obstacles as if going into a dead end. Later it was known that the movie was only shot in half, and half had not started filming yet. Therefore, there have been frequent rumors for the past two years that So Kieu story 2 is about to start, but unfortunately, so far there has been no official information from the manufacturer.



3. Bach tu trac hung
Zong Zi Hung (白夜 追凶) is a web-based movie, which initially did not receive high praise from the audience. But after debuting, with a team of quintessential crafters, compelling storyline, fast-paced and outstanding acting of Phan Viet Minh brought the film to a large audience and became a classic film.






It has been reported that the producer is preparing for the sequel of the movie, and that part 2 will quickly debut in the near future.
4. Tran the command
This summer, Chen's command (陈 情 令) became the focus of Chinese film websites. Although before the broadcast, Tran's command was not appreciated, even when it started airing the film also received many disparaging comments from the audience.



Initially, the film started with an extremely low rating, with only 4.8 douban points. But gradually, the plot and the actor's acting received the recognition of the original audience and fans, from then on Chen constantly changed the situation when he soared to 7.0 at half way, then the number This score continued to rise to 8.2 and became one of the hottest movies this summer.






However, after the movie was closed, the fans still had a lot of regrets, the day the drama aired the last episode, many netizens expressed, ""Tran said orders, the days are long, don't say anything. goodbye"".






Perhaps the ending in Tran's order was not the end that many people expected, Wei Vo Tien once again returned to his parting place with Lam Tram, but the two of them did not see each other. However, there is a ceremony this is the romantic ending, the ending to leave an imagination for the audience. Therefore, Tieu Chien -Vuong Nhat Bac fans are extremely looking forward to Tran Tinh's order to debut part 2.












Read more about Flower nature






"
