,src,lang,text
0,"











Місія МВФ поки не підтвердила дату прибуття до України

05 Nov 2019, 14:21


Місія Міжнародного валютного фонду поки не підтвердила дати, коли прибуде до України.

Про це заявила міністр фінансів Оксана Маркарова під час презентації держбюджету на 2020 рік.



«Як тільки місія МВФ підтвердить дати, ми відразу про це повідомимо. Ми з місією МВФ постійно працюємо над бюджетом: і до першого читання, і до другого читання обговорюємо всі цифри. Я хочу зауважити, що бюджет реалістичний», - додала міністр.
Нагадаємо, Маркарова вважає, що немає ризику, що Міжнародний валютний фонд не затвердить проєкт держбюджету через озвучених планових показників зростання ВВП.
«Слово і Діло» проаналізувало, на що і скільки в наступному році будуть витрачати бюджетні кошти.
Також «Слово і Діло» проаналізувало, як основні показники бюджету-2020 відрізняються від проєкту на 2019-й.
Хочете обговорити цю новину? Долучайтеся до телеграм-чату CHORNA RADA

Читайте також







",uk,"











The IMF mission has not yet confirmed the date of its arrival in Ukraine

05 Nov 2019, 14:21


The IMF mission has not yet confirmed the date it will arrive in Ukraine.

This was stated by Finance Minister Oksana Markarova during the presentation of the state budget for 2020.



""As soon as the IMF mission confirms the date, we will immediately notify it. The IMF mission and we are constantly working on a budget: before the first reading and the second reading we discuss all the numbers. I want to emphasize that the budget is realistic, ”the minister added.
We would like to remind you that Markarova believes that there is no risk that the International Monetary Fund will not approve the draft state budget due to the announced GDP growth targets.
Word and Delo analyzed how and how much budget funds would be spent next year.
Word and Delo also analyzed how the key budget 2020 indicators differ from the 2019 project.
Want to discuss this news? Join in telegram chat CHORNA RADA

Read also







"
