,src,lang,text
0,"











En Toledo
Encuentran dos cadáveres parcialmente calcinados en Quintanar de la Orden
06 Nov 2019, 08:42 by La Información

La Guardia Civil investiga el hallazgo de los dos cuerpos sin vida en una vivienda abandonada y frecuentada por indigentes. 

La Guardia Civil investiga el hallazgo de dos cadáveres parcialmente calcinados en una vivienda abandonada y frecuentada por indigentes en la localidad toledana de Quintanar de la Orden.  En principio los dos cuerpos no presentan signos de violencia
Según han informado a Efe fuentes próximas a la investigación, este martes un hombre entró en la casa y descubrió los cadáveres que estaban parcialmente calcinados.



La Guardia Civil se ha hecho cargo de la investigación, mientras que está previsto que este miércoles se practique la autopsia a los cuerpos en el Instituto de Medicina Legal de Toledo.
Quintanar de la Orden es una localidad con alrededor de 11.000 habitantes separada por 112 kilómetros de Toledo y a 123 kilómetros de distancia de Madrid.


",es,"











In Toledo
They find two partially calcined bodies in Quintanar de la Orden
06 Nov 2019, 08:42 by The Information

The Civil Guard investigates the discovery of the two lifeless bodies in an abandoned house frequented by homeless people.

The Civil Guard investigates the finding of two partially calcined bodies in an abandoned house frequented by homeless people in the town of Toledo in Quintanar de la Orden. In principle the two bodies do not show signs of violence
As sources close to the investigation have informed Efe, on Tuesday a man entered the house and discovered the bodies that were partially burned.



The Civil Guard has taken charge of the investigation, while it is planned that this Wednesday an autopsy will be carried out on the bodies at the Toledo Institute of Legal Medicine.
Quintanar de la Orden is a town with about 11,000 inhabitants separated by 112 kilometers from Toledo and 123 kilometers away from Madrid.


"
