,src,lang,text
0,"











L'ultima offerta del governo ad arcelor mittal: la reintroduzione di una tutela legale soft

06 Nov 2019, 08:16



ILVA, CHE FARE? - L'ULTIMA OFFERTA DEL GOVERNO AD ARCELOR MITTAL: LA REINTRODUZIONE DI UNA TUTELA LEGALE SOFT E LA POSSIBILITÀ DI AIUTARE L'AZIENDA CON LA CASSA INTEGRAZIONE - SE L'ILVA TORNERÀ NELLE MANI DELLO STATO, E’ POSSIBILE CHE LA GESTIONE DELLO STABILIMENTO VENGA AFFIDATA A UN “SUPERCOMMISSARIO” CHE RIMETTA A POSTO I CONTI, COMPLETI IL RISANAMENTO AMBIENTALE E CERCHI UNA CORDATA A CUI RIFILARE L'AZIENDA...




Carlo Bertini Ilario Lombardo per “la Stampa”





ARCELOR MITTAL

A Giuseppe Conte il compito di guardare negli occhi Laksshmi Mittal e Aditya Mittal e capire «quali sono le loro reali intenzioni». Appuntamento questa mattina alle 11, alla presenza dei ministri dello Sviluppo economico e del Sud Stefano Patuanelli, M5S, e Giuseppe Provenzano, Pd. Il premier pubblicamente indossa la maschera dura dell'avvocato pronto a tuffarsi in una causa giudiziaria per dimostrare che ArcelorMittal non aveva ragioni a supporto della sua volontà di recedere.




stefano patuanelli

Semplicemente perché lo scudo penale, evaporato lo scorso 23 ottobre dal decreto Salva imprese per volontà di una pattuglia di 5 Stelle irriducibili, non era previsto nel contratto sull' acciaieria ex Ilva. Ma a quel tavolo, oggi, se davvero una trattativa ci sarà, entrambi le parti dovranno essere disponibili a cedere qualcosa.
E Conte avrà in mano una doppia offerta: la reintroduzione in forma più temperata e temporanea di una tutela legale, e la possibilità di condividere i costi di un mercato in affanno aiutando l' azienda sul lato dell' occupazione con una possibile cassa integrazione. Strumento al quale si riferisce implicitamente Patuanelli quando dice che «i cicli produttivi in flessione possono essere accompagnati con mezzi di sostegno, non licenziando le persone». Questi i paletti oltre i quali il divorzio con Arcelor sarà certo e doloroso.




peppe provenzano

Ma se, come molti nel governo temono, la storia con i franco-indiani è ormai avviata sul viale del tramonto, l' Ilva tornerà nelle mani dello Stato. E nel Pd, dove l' angoscia di trovare una soluzione è al massimo grado, spunta pure l' idea di affidare la gestione ad un «supercommissario» come fu Enrico Bondi, che rimetta a posto i conti, completi il risanamento ambientale e nel frattempo cerchi una cordata disposta a rilevare l' azienda di qui a un anno.




ARCELOR MITTAL

È uno sbocco, ipotizzato da uno dei ministri Dem che stanno gestendo la partita, e non escluso da chi, come il governatore pugliese Michele Emiliano, non vedrebbe male un ritorno alla gestione diretta dello Stato. Fonti del Mise però parlano di un' amministrazione straordinaria affidata, come previsto dalla legge, a tre commissari. Questo affanno alla ricerca di un piano B è sintomatico di un clima di passione in cui si sta vivendo alla vigilia dell' incontro clou.
Il primo punto da chiarire è se serva reintrodurre lo scudo penale per i manager Ilva. In quel caso il governo è pronto a fare la sua parte: quando il ministro dell' Economia Roberto Gualtieri dice che uno Stato serio deve fare «qualunque cosa serva», si riferisce a questo. Un ""lodo» di mediazione, in mano a Provenzano, prevede una norma per cui chiunque sia impegnato in un piano di risanamento ambientale, non può essere ritenuto responsabile di quanto fatto dai suoi predecessori.




CONTE E DI MAIO

Il battello potrebbe essere il decreto fiscale all' esame della Camera o un nuovo decreto più vasto. Attorno al provvedimento si è già creata la calca con una polemica che investe la voglia di rivalsa di Matteo Renzi. Il leader di Italia Viva ha smentito la notizia di lavorare a una cordata alternativa con in testa il colosso indiano dell' acciaio Jindal, nel cui Cda siede l' amico Marco Carrai, e che fu avversaria di Arcelor ai tempi della gara sull' Ilva. Ma Jindal sarà in Italia giovedì e potrebbe incontrare i commissari straordinari.
La smentita di Renzi però è arrivata a seguito di quella di Cdp, tirata in ballo all' insaputa della società proprio dai renziani, e assieme al sostegno, inatteso in questa forma, a Conte: «Quando dice che Mittal deve onorare il contratto, noi stiamo con il premier». Solo se l' azienda accetterà di trattare, a quel punto l' alibi dell' immunità penale potrà essere tolto.




DAVIDE FARAONE

Come? Maria Stella Gelmini ha fatto sapere che Forza Italia aveva già presentato un emendamento al Dl Fiscale alla Camera. Simile a quello con il quale Renzi punta a spogliare di ogni scusa l' azienda, presentato dalla deputata di Iv Raffaella Paita. Invotabili entrambi per i grillini, perché ripristinerebbero l' immunità bocciata a Palazzo Madama dalla fronda sfuggita a Luigi Di Maio.
L' apertura di Patuanelli a una versione soft dello scudo si può spingere a una leggina che salvaguardi gli attuali concessionari «senza cedere a norme ad personam». Con il M5S in subbuglio e i numeri in bilico in Senato, Davide Faraone chiede alla Lega di votare l' emendamento dell' immunità. Il centrodestra è pronto a votarlo: supplirebbe ai voti mancanti tra i grillini ma fotograferebbe le divisioni della maggioranza.


",it,"











The latest government offer to arcelor mittal: the reintroduction of a soft legal protection

06 Nov 2019, 08:16



ILVA, WHAT TO DO? - THE LAST GOVERNMENT OFFER AT ARCELOR MITTAL: THE REINTRODUCTION OF A SOFT LEGAL PROTECTION AND THE POSSIBILITY OF HELPING THE COMPANY WITH THE INTEGRATION CASH - IF THE ILVA RETURNS IN THE HANDS OF THE STATE, IT IS POSSIBLE THAT THE MANAGEMENT OF THE ESTABLISHMENT ENTRUSTED TO A ""SUPERCOMMISSARY"" THAT REMOVES THE ACCOUNTS, COMPLETE THE ENVIRONMENTAL REHABILITATION AND LOOK FOR A CORDATA IN WHICH YOU SHOOT THE COMPANY ...




Carlo Bertini Ilario Lombardo for ""la Stampa""





ARCELOR MITTAL

To Giuseppe Conte the task of looking into the eyes of Laksshmi Mittal and Aditya Mittal and understanding ""what their real intentions are"". Appointment this morning at 11am, in the presence of the Ministers for Economic Development and South Stefano Patuanelli, M5S, and Giuseppe Provenzano, Pd. The premier publicly wears the lawyer's tough mask ready to plunge into a court case to prove that ArcelorMittal had no reason to support his willingness to withdraw.




stefano patuanelli

Simply because the criminal shield, evaporated last October 23 by the Save companies decree by the will of a 5 Star irreducible patrol, was not included in the contract on the former Ilva steel plant. But at that table, today, if there really is a deal, both parties will have to be willing to give up something.
And Conte will have a double offer in hand: the reintroduction in a more temperate and temporary form of legal protection, and the possibility of sharing the costs of a struggling market by helping the company on the employment side with a possible layoff. An instrument to which Patuanelli refers implicitly when he says that ""production cycles in flexion can be accompanied by means of support, not firing people"". These are the poles beyond which divorce with Arcelor will be certain and painful.




peppe provenzano

But if, as many in the government fear, the history with the Franco-Indians has now begun on the avenue of the sunset, the Ilva will return to the hands of the State. And in the Democratic Party, where the anxiety of finding a solution is at its best, the idea of entrusting the management to a ""super-commissioner"" as was Enrico Bondi, who puts the accounts in order, completes the environmental remediation and in the meantime look for a consortium willing to take over the company in one year.




ARCELOR MITTAL

It is an outlet, hypothesized by one of the Dem ministers who are managing the game, and not excluded by those who, like the Apulian governor Michele Emiliano, would not see badly a return to the direct management of the State. Sources of the Mise however speak of an extraordinary administration entrusted, as foreseen by the law, to three commissioners. This anxiety in search of a plan B is symptomatic of a climate of passion in which one is living on the eve of the highlight meeting.
The first point to clarify is whether we need to reintroduce the penal shield for Ilva managers. In that case the government is ready to do its part: when Economics Minister Roberto Gualtieri says that a serious State must do ""whatever it takes"", refers to this. A ""award"" of mediation, in the hands of Provenzano, provides for a rule that anyone engaged in an environmental recovery plan cannot be held responsible for what has been done by his predecessors.




COUNT AND MAIO

The boat could be a fiscal decree before the Chamber or a new larger decree. The crowd has already been created around the provision with a controversy that invests Matteo Renzi's desire for revenge. The leader of Italia Viva denied the news of working on an alternative consortium led by the Indian steel giant Jindal, in whose board the friend Marco Carrai sits, and who was Arcelor's opponent at the time of the Ilva race. But Jindal will be in Italy on Thursday and could meet with extraordinary commissioners.
However, Renzi's denial came following that of CDP, which was thrown into play at the hands of the company by the Renzians, and together with the unexpected support in this form, to Conte: ""When he says that Mittal must honor the contract, we we are with the premier ». Only if the company agrees to negotiate, then the excuse of criminal immunity can be lifted.




DAVIDE FARAONE

Such as? Maria Stella Gelmini said that Forza Italia had already submitted an amendment to the Dl Fiscale in the Chamber. Similar to the one with which Renzi aims to strip the company of every excuse, presented by Iv Raffaella Paita's deputy. Both are invotable for the grillini, because they would restore the immunity rejected by Palazzo Madama from the friar escaped from Luigi Di Maio.
The opening of Patuanelli to a soft version of the shield can be pushed towards a lightweight one that safeguards the current dealers ""without giving in to ad personam standards"". With the M5S in turmoil and the numbers hanging in the Senate, Davide Faraone asks the League to vote on the amendment of immunity. The center-right is ready to vote for it: it would make up for the missing votes among the grillini but it would photograph the divisions of the majority.


"
