,src,lang,text
0,"











TV GOSSIP: पढ़ें टीवी की 10 बड़ी खबरें और गॉसिप
06 Nov 2019, 08:38 by लाइव हिन्दुस्तान टीम,नई दिल्ली
1- ‘उतरन’ एक्ट्रेस टीना दत्ता को प्रोड्यूसर ने दिया धोखा, लगाया 30 लाख का चूना
टीवी की दुनिया में 90 दिन का चेक पे सिस्टम होता है। शायद हम में से ये बात कम ही लोग जानते हों। लेकिन टीवी इंडस्ट्री एक ऐसी दुनिया है जहां एक्टर्स को काम करने के बाद 90 दिन के अंदर पेमेंट चेक से होती है। टीवी के कई सितारे ऐसे हैं जो पेमेंट न मिलने की वजह से सुर्खियों में आए हैं। 
2- एक बेटी गोद लेना चाहती हैं मंदिरा बेदी, दो साल से कर रही हैं प्रयास
क्रिकेट कमेंटेटर से अपने करियर की शुरुआत करने वाली बतौर एक्ट्रेस मंदिरा बेदी ने एक इंटरव्यू के दौरान खुलासा किया है कि वे जल्द ही एक बेटी को अडोप्ट करने वाली हैं। जिसकी कोशिश वे पिछले दो सालों से कर रही हैं। बताते चलें कि मंदिरा बेदी का एक आठ साल का बेटा है जिसका नाम वीर कौशल है। 
3- स्टार बनते ही रानू मंडल के बदले तेवर, फैन के साथ की बदतमीजी तो ट्विटर पर हुईं ट्रोल
सोशल मीडिया स्टार रानू मंडल एक सेलिब्रिटी बन चुकी हैं। उनकी आवाज के दीवाने हुए हिमेश रेशमिया ने उन्हें अपनी फिल्म में गाना गाने का मौका दिया था जिसके बाद से ही वे लोगों की आंखों का तारा बन गईं। लंबे वक्त से रानू मंडल के वीडियो सोशल मीडिया पर नहीं आए थे। लेकिन अब उनका एक वीडियो सोशल मीडिया पर वायरल हो रहा है और रानू मंडल अपनी आवाज के कारण नहीं बल्कि फैन के साथ बदतमीजी करने की वजह से सुर्खियों में बनी हुई हैं। 
4- BIGG BOSS 13: आरती बनीं घर की पहली कैप्टन, रहेंगी इस शानदार रूम में
बिग बॉस के बीते हफ्ते में कई बड़े ट्विस्ट देखने को मिले। इसके साथ ही घर का पहला कैप्टन भी चुना गया है। दरअसल, लास्ट एपिसोड में सभी वाइल्ड़ कार्ड कंटेस्टेंट्स की एंट्री होने के बाद बिग बॉस ने घरवालों से किसी एक कंटेस्टेंट को कैप्टन चुनने के लिए कहा। ज्यादातर कंटेस्टेंट्स ने इस दौरान आरती का नाम लिया, लेकिन बिग बॉस ने फिर कहा कि सबसे ज्यादा वोट मिलने वाले कंटेस्टेंट को घर का पहला कैप्टन बनाया जाएगा। तो सबसे ज्यादा वोट आरती को मिला था इसलिए आरती को घर का पहला कैप्टन बनाया गया। 
5- Bigg Boss 13 Video: हिमांशी को घर के अंदर देख शहनाज के उड़े होश, खुद को मारने लगीं थप्पड़
बिग बॉस में एक के बाद एक बड़े ट्विस्ट आ रहे हैं। अब शो में एक और वाइल्ड कार्ड कंटेस्टेंट की एंट्री हो चुकी है। दरअसल, शहनाज गिल की कॉम्पटीटर हिमांशी खुराना ने शो में एंट्री ले ली है। हिमांशी को देखकर शहनाज के होश उड़ गए हैं। बिग बॉस ने दरअसल एक प्रोमो वीडियो शेयर किया है। वीडियो में आप देखेंगे कि हिमांशी को देखकर शहनाज अजीव तरीके से बिहेव करने लगती हैं। शहनाज बार-बार ये कहती हैं कि बिग बॉस ने उनके साथ अच्छा नहीं किया है। वो गुस्से में अपना माइक भी उतार कर फेंक देती हैं। इसके बाद जब शेफाली जरीवाला और पारस जब शहनाज को समझाने जाते हैं तो वो खुद को थप्पड़ मारने शुरू कर देती हैं।
6- Bigg Boss 13: शो से बेघर होने के बाद शेफाली बग्गा ने बाकी कंटेस्टेंट्स को लेकर कही ये बात
शनिवार को वीकेंड का वार में रश्मि देसाई, देवोलीना भट्टाचार्य और शेफाली बग्गा शो से एलिमिनेट हुई हैं। शो से बाहर आने के बाद शेफाली ने एक इंटरव्यू में बाकी कंटेस्टेंट्स को लेकर बात की है। शेफाली ने इंटरव्यू में बताया कि उन्हें उम्मीद नहीं थी कि वो इतनी जल्दी घर से बेघर होंगी। शेफाली ने कहा, माहिरा शर्मा और आरती सिंह सबसे ज्यादा कंटेस्टेंट थे। बाहर आने से मैं दुखी जरूर हूं क्योंकि मैं उन लोगों से पहले आई हूं जो सबसे कमजोर कंटेस्टेंट हैं।
7- Bigg boss 13: फैन्स को लगा झटका, शो से बाहर हुईं रश्मि-देवोलीना-शेफाली
बिग बॉस 13 में शनिवार को बहुत शॉकिंग एलिमिनेशन हुए। घरवालों के साथ-साथ दर्शकों को भी इस एलिमिनेशन की उम्मीद नहीं थी। दरअसल, घर की 3 मजबूत कंटेस्टेंट रश्मि देसाई, देवोलीना भट्टाचार्य और शेफाली बग्गा को घर से बेघर कर दिया है। रश्मि और देवोलीना के एलिमिनेशन सेसब चौंक गए हैं। किसी को भी उम्मीद नहीं थी कि ये दोनों टीवी की टॉप एक्ट्रेसेस इतनी जल्दी घर से बेघर कर दी जाएंगी।
8- Bigg Boss 13: सिद्धार्थ शुक्ला के साथ डेटिंग की खबरों पर ऑनस्क्रीन 'सास' का आया बयान, जानें क्या कहा
बिग बॉस 13 में सबसे ज्यादा सुर्खियों में रहने वाले कंटेस्टेंट सिद्धार्थ शुक्ला अपने अफेयर्स को लेकर काफी लाइमलाइट में बने हुए हैं। अभी कुछ दिनों पहले ही ये खबरें वायरल हो रही थीं कि सिद्धार्थ शुक्ला ने अपनी ऑनस्क्रीन सास स्मिता बंसल को भी डेट किया था। बता दें कि दोनों शो बालिका वधू में साथ काम कर चुके हैं। इस शो में स्मिता ने सिद्धार्थ की सास का रोल किया था। इन खबरों पर अब स्मिता का रिएक्शन आया है। मीडिया रिपोर्ट्स के मुताबिक स्मिता ने इन खबरों को गलत बताया है। स्मिता का कहना है कि वो दोनों बस को-एक्टर्स थे।
9- दिल से जुड़ी बीमारी से जूझ रही हैं ऐश्वर्या, 'उजड़ा चमन' से की फिल्मों में एंट्री
टीवी की पॉपुलर एक्ट्रेस ऐश्वर्या सखुजा ने हाल ही में खुद को लेकर बड़े खुलासे किए हैं। बता दें कि ऐश्वर्या फिल्म उजड़ा चमन से बॉलीवुड डेब्यू करने जा रही हैं। तो हाल ही में एक इंटरव्यू के दौरान ऐश्वर्या ने अपनी हैल्थ से जुड़ा बड़ा खुलासा किया है। ऐश्वर्या ने बताया कि उनके दिल में बचपन से छेद है और उनकी आंखों में भी दिक्कत है।
10- 'साथ निभाना साथिया' फेम मोहम्मद नाजिम की मां का निधन
टीवी का पॉपुलर शो साथ निभाना साथिया के लीड एक्टर रहे मोहम्मद नाजिम के फैन्स के लिए बुरी खबर है। मीडिया रिपोर्ट्स के मुताबिक नाजिम की मां का निधन हो गया है। नाजिम की मां सुरैया का निधन गुरुवार के दिन पंजाब में हार्ट अटैक की वजह से हुआ है। टेली चक्कर की रिपोर्ट के मुताबिक नाजिम ने इस बरे में बात करते हुए कहा, मैंने ऐसा कभी नहीं सोचा था। मैं अभी भी शॉक्ड हूं। अल्लाह उनकी आत्मा को शांति दे।


",hi,"











TV GOSSIP: Read 10 big TV news and Gossip
06 Nov 2019, 08:38 by Live Hindustan Team, New Delhi
1- 'Utran' actress Tina Dutta was cheated by the producer, imposed 30 lakhs of lime
The world of TV has a 90 day check pay system. Perhaps few of us know this. But the TV industry is a world where actors get paid by check within 90 days of working. There are many TV stars who have come in the headlines due to non-payment.
2- Mandira Bedi wants to adopt a daughter, has been trying for two years
Actress Mandira Bedi, who started her career as a cricket commentator, has revealed during an interview that she will soon be adopting a daughter. Which they have been trying for the last two years. Let's say that Mandira Bedi has an eight-year-old son named Veer Kaushal.
3- Tvor in lieu of Ranu Mandal as soon as he became a star, trolls were abusive with fans
Social media star Ranu Mandal has become a celebrity. Her voice crazy Himesh Reshammiya gave her the opportunity to sing in her film, after which she became the star of people's eyes. Videos of Ranu Mandal had not appeared on social media for a long time. But now one of his videos is going viral on social media and Ranu Mandal is in the headlines not because of his voice but because of profanity with the fan.
4- BIGG BOSS 13: Aarti becomes first captain of the house, will be in this magnificent room
In the last week of Bigg Boss, there were many big twists. With this, the first captain of the house has also been elected. Actually, after the entry of all the wild card contestants in the last episode, Bigg Boss asked the householders to choose one of the contestants as captain. Most of the contestants took the name of Aarti during this time, but Bigg Boss again said that the contestant who got the most votes will be made the first captain of the house. Aarti got the maximum votes, so Aarti was made the first captain of the house.
5- Bigg Boss 13 Video: Shehnaaz's senses after seeing Himanshi inside the house, slapped herself
Bigg Boss is getting big twists one after the other. Now another wild card contestant has been entered in the show. Actually, Shahnaz Gill's competitor Himanshi Khurana has taken an entry in the show. On seeing Himanshi, Shahnaz's senses are blown away. Bigg Boss has actually shared a promo video. In the video, you will see that on seeing Himanshi, Shehnaz starts behaving in a strange way. Shahnaz repeatedly says that Bigg Boss has not done well with him. She also throws her mic away in anger. After this, when Shefali Jariwala and Paras go to convince Shehnaz, she starts slapping herself.
6- Bigg Boss 13: After being homeless from the show, Shefali Bagga said this to the rest of the contestants.
Rashmi Desai, Devolina Bhattacharya and Shefali Bagga have been eliminated from the show on Saturday's Weekend Ka Vaar. After coming out of the show, Shefali talked about the rest of the contestants in an interview. Shefali told in the interview that she did not expect that she would be homeless from home so soon. Shefali said, Mahira Sharma and Aarti Singh were the most contestants. I am saddened to come out because I have come before those who are the weakest contestants.
7- Bigg boss 13: Fans got a shock, Rashmi-Devoleena-Shefali exited the show
Bigg Boss 13 saw a lot of shocking elimination on Saturday. The audience was not expecting this elimination along with the family. In fact, 3 strong contestants of the house Rashmi Desai, Devoleena Bhattacharya and Shefali Bagga have been rendered homeless. Rashmi and Devolina's elimination Sesab is shocked. Nobody expected that these two TV's top actresses would be made homeless from home so soon.
8- Bigg Boss 13: On-screen statement of 'Saas' on the news of dating Siddharth Shukla, know what said
Contestant Siddharth Shukla, who made the most headlines in Bigg Boss 13, has been in the limelight for his affairs. Just a few days ago, the news was getting viral that Siddharth Shukla had also dated his onscreen mother-in-law Smita Bansal. Please tell that both shows have worked together in Balika Vadhu. In this show, Smita played Siddharth's mother-in-law. Smita's reaction has now come to these reports. According to media reports, Smita has denied these reports as incorrect. Smita says that both of them were just co-actors.
9 - Aishwarya is struggling with heart disease, Entry in films from 'Ujda Chaman'
Popular TV actress Aishwarya Sakhuja has recently made big revelations about herself. Please tell that Aishwarya is going to make her Bollywood debut with the film Ujra Chaman. So during a recent interview, Aishwarya has made a big disclosure about her health. Aishwarya told that she has a hole in her heart since childhood and also has problems in her eyes.
10- 'Saath Nibhana Saathiya' fame Mohammad Nazim's mother passes away
TV's popular show Saath Nibhana is bad news for the fans of Saathia's lead actor Mohammad Nazim. According to media reports, Nazim's mother has passed away. Nazim's mother Suraiya died on Thursday due to a heart attack in Punjab. According to the report of Tele Chakkar, Nazim while talking in this barre, said, ""I never thought so."" I am still shocked. May his soul rest in peace.


"
