,src,lang,text
0,"











Σε πανελλαδική κινητοποίηση οι εργαζόμενοι Κοινωφελούς Εργασίας για παράταση των συμβάσεων
Την κινητοποίηση στηρίζουν ο Σύλλογος Υπαλλήλων Περιφέρειας Αττικής και η ΠΟΠΟΚΠ, ενώ κάλεσμα συμμετοχής απευθύνει το Εργατικό Κέντρο Λαυρίου – Αν. Αττικής.
06 Nov 2019, 08:45 by neolaia.gr Team
Η Ομοσπονδία Συλλόγων Εργαζομένων Αποκεντρωμένων Διοικήσεων Ελλάδας (ΟΣΕΑΔΕ) προκηρύσσει στάση εργασίας σήμερα Τετάρτη 6 Νοέμβρη, από τις 11.00 π.μ. έως τη λήξη της βάρδιας.
Καλεί στην πανελλαδική κινητοποίηση στο υπουργείο Περιβάλλοντος (Λ. Μεσογείων 119), στις 12.00, μαζί με την Πανελλαδική Συντονιστική Επιτροπή των Συμβασιούχων στις δασικές υπηρεσίες.
Διεκδικεί την ανανέωση των συμβάσεων των 5.066 συμβασιούχων, μετατροπή όλων των συμβάσεων, σε όλες τις υπηρεσίες σε αορίστου χρόνου, άρση όλων των νομικών περιορισμών για τη μετατροπή των συμβάσεων, προσλήψεις μόνιμου προσωπικού, αυξήσεις στους μισθούς.
Παράλληλα, τόσο η ΟΣΕΑΔΕ όσο και η Πανελλαδική Συντονιστική Επιτροπή των Συμβασιούχων στις δασικές υπηρεσίες καταγγέλλουν τις διασπαστικές ενέργειες του γνωστού Καραγεωργόπουλου «που μοστράρει στις στημένες φωτογραφίες, που με τον ατομικό του σύλλογο “ΕΝΩΣΗ” στα κρυφά στήνει συναντήσεις με κυβερνητικούς εκπρόσωπους, με αιτήματα που βολεύουν την κυβέρνηση, αφού παραπέμπουν σε γενικές και αόριστες αναφορές». Καταγγέλλουν «τον άθλιο αυτό κυβερνητικό συνδικαλισμό, τον οποίο φαίνεται ότι επιλέγει να προωθεί η κυβέρνηση για συνομιλητή και προσπαθεί να υπονομεύσει τον αγώνα μας για το δικαίωμά μας στη μόνιμη και σταθερή δουλειά». 
Την κινητοποίηση στηρίζουν ο Σύλλογος Υπαλλήλων Περιφέρειας Αττικής και η ΠΟΠΟΚΠ ενώ κάλεσμα συμμετοχής απευθύνει το Εργατικό Κέντρο Λαυρίου – Αν. Αττικής.

Πηγή: aftodioikisi


Δείτε ακόμα: ΟΑΕΔ Κοινωφελής Εργασία 2019: Πότε θα βγει το νέο πρόγραμμα 35.000 ανέργων

ΕΙΣΑΙ ΜΕΣΑ ΓΙΑ ΤΑ ΝΕΑ ΚΟΝΤΟΠΑΚ VIBER ΣΤΙΚΕΡΣ; ΝΤΑΟΥΝΛΟΟΥΝΤ ΛΕΜΕ ΕΔΩ --> https://vb.me/fac486

ΔΙΑΒΑΣΤΕ ΕΠΙΣΗΣ











",el,"











In a nationwide mobilization of Public Welfare workers to extend contracts
The mobilization is supported by the Attica District Employees Association and POPOKP, while a call for participation is being made by the Lavrion - East Attica Labor Center.
06 Nov 2019, 08:45 by neolaia.gr Team
The Federation of Decentralized Workers' Associations of Greece (OSEADE) has announced a work stoppage today Wednesday, November 6, from 11.00 am until the end of the shift.
It calls on the nationwide mobilization at the Ministry of the Environment (119 Mesogeion Ave.) at 12.00, along with the Pan-Hellenic Contracting Committee on Forestry Services.
Claims renewal of 5,066 contractors, conversion of all contracts to all services for an indefinite period, removal of all legal restrictions on contract conversion, recruitment of permanent staff, salary increases.
At the same time, both the OSEADE and the Panhellenic Coordinating Committee of the Contracting Officers in the forest services denounce the divisive actions of the well-known Karageorgopoulos ""who lurks at the stills, who with his personal club"" ENOSSI ""secretly sneers at me. they like the government, after referring to general and vague references. "" They denounce ""this wretched government unionism, which seems to be choosing to promote the government as an interlocutor and trying to undermine our struggle for our right to permanent and stable employment.""
The mobilization is supported by the Attica District Employees Association and POPOKP, while the Lavrion - East Attica Labor Center is calling for participation.

Source: aftodioikisi


See also: OAED Utility Work 2019: When will the new 35,000 unemployed program come out

ARE YOU IN FOR THE NEW VIBER STICKERS? Downtown Lemme HERE -> https://vb.me/fac486

READ ALSO











"
