,src,lang,text
0,"











Nuevo programa de recompra de acciones
Santander invertirá hasta 400 millones para el bonus de sus directivos en Brasil
07 Nov 2019, 03:30 by Pepe Bravo

La filial brasileña del grupo cántabro podrá adquirir un máximo de 37,3 millones de títulos propios hasta comienzos de noviembre de 2020.

Banco Santander está dispuesto a comprar durante los próximos doce meses cerca de 400 millones de euros en acciones de su filial en Brasil. Tal inversión de dinero en apenas un año responde a la necesidad de la entidad que preside Ana Botín de poder hacer frente al bonus de sus directivos en el país carioca, que representa la actual 'gallina de los huevos de oro' del grupo, pues es en este mercado donde recoge casi un tercio de sus beneficios globales.
En concreto, el consejo de administración de Santander Brasil acaba de aprobar la extensión por un año de un programa de recompra de acciones que empezó en 2016. Así, la filial brasileña del grupo cántabro podrá adquirir un máximo de 37,3 millones de títulos propios hasta comienzos de noviembre de 2020 con el objetivo de ""habilitar el pago"" a algunos directivos y empleados señalados y de ""crear valor para los accionistas"" mediante una gestión adecuada del capital. 
Esta cantidad de acciones representa un 1% del capital de Santander Brasil, que está participada al 90% por la matriz española y que tiene un valor de mercado de casi 40.000 millones de euros en la actualidad. Por lo tanto, el paquete que está dispuesto a recomprar Santander tiene un valor de unos 400 millones. Según un hecho relevante remitido a la Comisión de Valores de Estados Unidos (SEC, según sus siglas en inglés), el banco articulará la compra a través de la propia filial brasileña o a través de la sucursal que mantiene el grupo en las Islas Caimán.



A través de un programa similar de recompra de acciones, Santander Brasil adquirió durante 2018 15,8 millones de acciones, de los que 4,5 millones de títulos, valorados actualmente en algo menos de 50 millones de euros, fueron a parar a sus directivos, según consta en las cuentas anuales de la filial carioca. El importe de la remuneración en especie de los directivos brasileños durante 2017 fue similar del año pasado, si bien en 2016 fue de 8,7 millones de títulos.
Brasil cada vez gana más peso para Santander
Brasil está adquiriendo cada vez más importancia para Santander, que en Europa padece el actual escenario de tipos de interés en negativo. La filial carioca -representada en el consejo de administración del grupo a través de su presidente no ejecutivo, Álvaro Cardoso de Souza-  es la más rentable, con un RoTE del 22% en lo que va de 2019. Entre enero y septiembre, el beneficio ordinario cosechado en este país asciende a 2.250 millones de euros, un 19% más que un año antes y casi el doble de lo que gana en España (1.185 millones), su segundo mercado.
Otro ejemplo de la relevancia que ha adquirido Brasil para Santander es que, a principios de octubre, la filial organizó un Investor Day dedicado solo al mercado brasileño. Reafirmó su apuesta por el país y anunció que prevé terminar 2020 con 27 millones de clientes allí, un 7% más que ahora, con un crecimiento de la cartera del crédito del 10%. Entre los retos a futuro, Santander se propuso alcanzar en tres años una cuota del 10% en el crédito al sector agrario de Brasil. Con esta porción, el banco lideraría un mercado que moverá 80.000 millones de euros en 2022.
De cara al futuro, otro de los mercados donde Santander concentrará sus esfuerzos es México. Con la recompra de parte de la participación de los accionistas minoritarios en su filial del país azteca la entidad cántabra acaba de emprender una estrategia semejante a la que ya ejecutó en Brasil en 2014. Y es que el mercado mexicano, que aporta en la actualidad el 8% de los beneficios -860 millones de euros hasta el tercer trimestre de 2019- está previsto que sea igual de rentable que el brasileño.


",es,"











New share buyback program
Santander will invest up to 400 million for the bonus of its executives in Brazil
07 Nov 2019, 03:30 by Pepe Bravo

The Brazilian subsidiary of the Cantabrian group may acquire a maximum of 37.3 million of its own titles until the beginning of November 2020.

Banco Santander is willing to buy about 400 million euros in shares of its subsidiary in Brazil over the next twelve months. Such investment of money in just one year responds to the need of the entity that presides over Ana Botín to be able to meet the bonus of its managers in the Carioca country, which represents the current 'golden egg hen' of the group, as it is in this market where it collects almost a third of its global benefits.
Specifically, the board of directors of Santander Brasil has just approved the extension for a year of a share repurchase program that began in 2016. Thus, the Brazilian subsidiary of the Cantabrian group may acquire a maximum of 37.3 million own shares until the beginning of November 2020 with the aim of ""enabling payment"" to some managers and employees indicated and ""creating value for shareholders"" through proper capital management.
This amount of shares represents 1% of the capital of Santander Brazil, which is 90% owned by the Spanish parent company and has a market value of almost 40,000 million euros at present. Therefore, the package that Santander is willing to repurchase has a value of about 400 million. According to a relevant fact referred to the United States Securities Commission (SEC, according to its acronym in English), the bank will articulate the purchase through the Brazilian subsidiary itself or through the branch that maintains the group in the Cayman Islands.



Through a similar share buy-back program, Santander Brazil acquired 15.8 million shares during 2018, of which 4.5 million titles, currently valued at just under 50 million euros, went to their managers , as recorded in the annual accounts of the carioca subsidiary. The amount of remuneration in kind of Brazilian managers during 2017 was similar from last year, although in 2016 it was 8.7 million titles.
Brazil is gaining more weight for Santander
Brazil is becoming increasingly important for Santander, which in Europe suffers from the current scenario of negative interest rates. The carioca subsidiary -represented on the group's board of directors through its non-executive president, Álvaro Cardoso de Souza- is the most profitable, with a RoTE of 22% so far in 2019. Between January and September, the benefit Ordinary harvested in this country amounts to 2,250 million euros, 19% more than a year earlier and almost double what it earns in Spain (1,185 million), its second market.
Another example of the relevance that Brazil has acquired for Santander is that, in early October, the subsidiary organized an Investor Day dedicated only to the Brazilian market. He reaffirmed his commitment to the country and announced that he plans to end 2020 with 27 million customers there, 7% more than now, with a 10% loan portfolio growth. Among the future challenges, Santander set out to reach a 10% share of the credit to the agricultural sector in Brazil in three years. With this portion, the bank would lead a market that will move 80,000 million euros in 2022.
Looking ahead, another of the markets where Santander will concentrate its efforts is Mexico. With the repurchase of part of the participation of minority shareholders in its subsidiary in the Aztec country, the Cantabrian entity has just embarked on a strategy similar to that already executed in Brazil in 2014. And it is that the Mexican market, which currently provides the 8% of the profits -860 million euros until the third quarter of 2019- is expected to be as profitable as the Brazilian.


"
