,src,lang,text
0,"












حدود يك سوم مالیات دریافت شده در مهر ماه سالجاری از محل وصول مالیات های معوق بوده است

وزیر امور اقتصادی و دارایی در سفر امروز خود به استان فارس طی سخنانی در نشست هم اندیشی اساتید و صاحب نظران دانشگاه های شیراز به تشریح برنامه ها و ...
05 Nov 2019, 23:23 by بولتن نیوز | bultannews.com
گروه اقتصادی: دکتر فرهاد دژپسند با اشاره به مباحث مطرح شده در خصوص بودجه های سالیانه کشور گفت: از ابتداي دولت يازدهم اتکای بودجه به نفت روند کاهشي داشته است و به دنبال آن هستیم که باز هم کاهش یابد.
 
 
به گزارش بولتن نیوز به نقل از خبرگزاری شادا، دژپسند با اشاره به اینکه حدود يك سوم مالیات دریافت شده در مهر ماه سالجاری از محل وصول مالیات های معوق بوده است، تصریح کرد: این نتیجه سیاست بخشودگی جرایم معوقات مالیاتی بود، زیرا پذیرفته ایم كه باید سیاست های متنوعی را بکار بست.
وزیر اقتصاد ضمن تاكيد بر مولد سازي دارايي ها، از ""انتشار اوراق"" نيز به عنوان یکی ديگر از ابزار ها ياد كرد.
وزیر امور اقتصادی و دارایی با اشاره به بهبود یک رتبه ای جمهوری اسلامی ایران در شاخص کسب و کار بر اساس اعلام نهادهای بین المللی، تصریح کرد: نکته ای را که باید پذیرفت این است که بهبود فضای کسب و کار صرفا وظیفه قوه مجریه نیست، کما اینکه در سال ۱۳۹۷ بخشي از بهبود رتبه ایران در این شاخص، به فعاليت هاي بیرون از قوه مجریه بر می گشت و در همین راستا نيز مذاکراتی با مسئولان مربوط صورت گرفته است.
وزیر امور اقتصادی و دارایی در بخش دیگری از سخنان خود با تاکید بر این که ارتباط دولت با دانشگاه باید مستمر باشد، متذکر شد: در شرایط اقتصادي و اجتماعی مختلف نياز به پژوهش هاي كاربردي براي ارايه راهكارهاي مناسب وجود دارد. لذا بر اين باور هستيم كه بايد ارتباط دانشگاه ها با وزارت اقتصاد به صورت عميق و مستمر باشد.
وي همچنين تاكيد كرد: باید زمینه را برای ورود اندیشه های جدید دانشگاهی به حوزه خط مشی گذاری های اقتصادی کشور فراهم کنیم و با استفاده از ظرفیت اندیشه ورزان، در حوزه اقتصاد تحول ایجاد شود.
وی ادامه داد: برای ورود دانشگاه ها و اندیشه ورزان به حوزه خط مشی گذاری های اقتصادی شاهد یک حلقه مفقوده هستیم به همین خاطر یکی از برنامه های محوری اينجانب برای وزارت اقتصاد، تشکیل هسته های اندیشه ورزی در ۹ موضوع بود و در حال حاضر بطور مستمر از نظرات و اندیشه های اساتید دانشگاه در این هسته ها بهره می گیریم، امری که باید به استان ها نیز تعمیم یابد.
وی راه اندازی شبکه تحلیلگران جوان اقتصادی در كنار هسته هاي انديشه ورزي را یکی دیگر از ظرفیت های جدید وزارت اقتصاد برای بهره گیری از ایده ها و نظرات دانشگاهیان در سراسر کشور خواند و افزود: باید شبکه دومی هم در همین ارتباط به منظور استفاده از همفکری اساتید دانشگاهی، بدون محدودیت سن، در همه زمینه های مربوط اعم از اقتصاد، مدیریت، صنعت، حسابداری و ... راه اندازی شود که امیدواریم در آینده نزدیک از آن رونمایی کنیم.
وزیر امور اقتصادی و دارایی با تاکید بر ضرورت استفاده دستگاه های اجرایی از ظرفیت دانشگاه ها عنوان کرد: نظام علمی و پژوهشی کشور نیز باید کاملا به روز ، جامع و کاربردی باشد.
دژپسند در ادامه، اداره کل امور اقتصادی و دارایی استان فارس را مکلف کرد که منتقل کننده پیشنهاد های دانشگاه های استان فارس به وزارتخانه باشد.


",fa,"












About one-third of the taxes received in October of this year were from deferred tax collections

Minister of Economic Affairs and Finance during his visit to Fars province during a speech at a meeting of professors and scholars of Shiraz universities outlining plans and ...
05 Nov 2019, 23:23 by Bulletin News | bultannews.com
Economic Group: Dr. Farhad Dejapsand, referring to the debate over the country's annual budgets, said: ""Since the eleventh government, the budget reliance on oil has been declining and we are looking to reduce it again.""


Dejapsand pointed out that about one-third of the taxes received in October were from deferred tax collections, stating: ""This was the result of a policy of forgiveness for deferred tax, because we have accepted that A variety of policies must be applied.
The Minister of Economy, while emphasizing the productivity of assets, also referred to the ""issue of securities"" as another tool.
Minister of Economic Affairs and Finance, referring to the improvement of the Islamic Republic of Iran in the index of business according to the announcement of international institutions, stated: The point to be accepted is that improvement of business environment is not only the task of the executive branch, As part of Iran's improvement in the index in the second half of the year, it has returned to activities outside the executive branch and negotiations have been held with relevant officials.
In another part of his speech, the Minister of Economic Affairs and Finance emphasized that the relationship between the government and the university should be continuous: In different economic and social conditions, there is a need for applied research to provide appropriate solutions. Therefore, we believe that the relationship between universities and the Ministry of Economy should be deep and continuous.
He also emphasized: We must provide the ground for the introduction of new academic ideas into the field of economic policy of the country and with the capacity of thinkers, to transform the economy.
He continued: ""There is a missing link for universities and thinkers in the field of economic policy making, so one of the central plans for the Ministry of Economy was to form think tanks in four issues and now We constantly use the ideas and ideas of university professors in these cores, which should be extended to the provinces as well.
He called the launch of the network of young economic analysts alongside the think tanks another new capacity of the Ministry of Economy to exploit the ideas and opinions of academics across the country, adding that a second network should also be used in this regard in order to use consultation. Academic lecturers, without limitation of age, set up in all areas of economics, management, industry, accounting, etc. that we hope to unveil in the near future.
The Minister of Economic Affairs and Finance emphasized the necessity of using the executive capacities of universities: The scientific and research system of the country should be fully up-to-date, comprehensive and practical.
Dejapsand further instructed the Fars Province Department of Economic and Financial Affairs to forward the proposals of Fars province universities to the ministry.


"
