,src,lang,text
0,"











796 niños y adolescentes fueron asesinados en México de enero a septiembre: Red por los Derechos de la Infancia
Juan Martín Pérez García, director de la Red por los Derechos de la Infancia, dijo en entrevista con Javier Risco para La Nota Dura, que Guanajuato ocupa el primer sitio en asesinato de menores, seguido por el Estado de México, Chihuahua y Baja California.
05 Nov 2019, 23:22 by Redacción



El Financiero Bloomberg TV
Un total de 7906 niños y adolescentes fueron asesinados de enero a septiembre de este año, informó este martes Juan Martín Pérez García, director de la Red por los Derechos de la Infancia.
""Cada día asesinan a tres, cuatro en total impunidad. Solo de enero a septiembre de este 2019, 796 niños, niñas y adolescentes asesinados, de los cuales, 653 son varones y 143 mujeres"", dijo en entrevista con Javier Risco para La Nota Dura.
""Guanajuato ocupa el primer sitio, seguido por el Estado de México, Chihuahua y Baja California"", detalló.
El experto calificó este martes como una mentira que el ataque de este lunes contra la familia LeBarón fuera por confusión.
""Te puedo asegurar que todo es una mentira de las que ya hemos escuchado, no hay lógica de confusión, son mujeres y niños, claramente se ve"", dijo e
""Los testimonios de los niños sobrevivientes refieren que una de las mujeres salió con las manos levantadas y literalmente entregó su vida. Fueron atacados, fueron cazados"", agregó.
Añadió que esto es un patrón que ya se ha visto en otros estados como Guerrero donde grupos criminales atacan a sus enemigos.
Este lunes, un convoy en el que viajaban miembros de dicha familia fue emboscado, declaró Julian LeBarón a El Financiero Bloomberg.
LeBarón dijo, vía telefónica para La Nota Dura de El Financiero Bloomberg, que en una de las camionetas viajaba su prima ‘Nita’, quien se dirigía al aeropuerto por su esposo, quien a su vez trabaja en Dakota.
Este martes, el presidente Andrés Manuel López Obrado afirmó que las fuerzas federales tardaron en llegar a la zona del ataque contra la familia LeBarón en Chihuahua por lo apartada de la zona.
Mientras que Alfonso Durazo, secretario de Seguridad Pública, explicó que la agresión ocurrió alrededor de las 13:00 horas, tiempo local, en los límites de Sonora con Chihuahua, y que 18 minutos después, Julián LeBarón solicitó el apoyo de la Guardia Nacional para auxiliar a los afectados.
A las 15:00 horas, elementos de ese cuerpo de seguridad apostados en las localidades de Zaragoza, Janos y Mocteuzuma (en Chihuahua) se trasladaron a la zona del ataque.
El funcionario informó que el número de muertos por el ataque es de nueve personas -tres adultos y seis menores de edad-, de acuerdo con datos de la Secretaría de la Defensa Nacional en Sonora.
El funcionario también precisó que seis menores de edad quedaron lesionados, otro no presentó heridas, mientras que una niña está desaparecida.


",es,"











796 children and adolescents were killed in Mexico from January to September: Network for Children's Rights
Juan Martín Pérez García, director of the Network for the Rights of the Child, said in an interview with Javier Risco for La Nota Dura, that Guanajuato occupies the first place in murder of minors, followed by the State of Mexico, Chihuahua and Baja California.
05 Nov 2019, 23:22 by Editorial Staff



The Bloomberg TV Financial
A total of 7906 children and adolescents were killed from January to September of this year, Juan Martín Pérez García, director of the Network for Children's Rights, reported Tuesday.
""Every day they kill three, four in total impunity. Only from January to September of this 2019, 796 children and adolescents killed, of which 653 are men and 143 women,"" he said in an interview with Javier Risco for La Nota Hard.
""Guanajuato occupies the first place, followed by the State of Mexico, Chihuahua and Baja California,"" he said.
The expert described Tuesday as a lie that this Monday's attack on the LeBarón family was due to confusion.
""I can assure you that everything is a lie that we have already heard, there is no logic of confusion, they are women and children, clearly seen,"" said e
""The testimonies of the surviving children indicate that one of the women left with raised hands and literally gave up her life. They were attacked, were hunted.""
He added that this is a pattern that has already been seen in other states such as Guerrero where criminal groups attack their enemies.
On Monday, a convoy in which members of that family were traveling was ambushed, Julian LeBarón told El Financiero Bloomberg.
LeBarón said, via telephone for The Hard Note of The Financial Bloomberg, that in one of the trucks his cousin ‘Nita’ was traveling, who was going to the airport for her husband, who in turn works in Dakota.
On Tuesday, President Andrés Manuel López Obrado said it took federal forces to reach the area of the attack against the LeBarón family in Chihuahua because of the remoteness of the area.
While Alfonso Durazo, secretary of Public Security, explained that the aggression occurred around 1:00 p.m., local time, in the limits of Sonora with Chihuahua, and that 18 minutes later, Julián LeBarón requested the support of the National Guard to Help those affected.
At 3:00 p.m., elements of that security body stationed in the towns of Zaragoza, Janos and Mocteuzuma (in Chihuahua) moved to the area of the attack.
The official reported that the death toll from the attack is nine people - three adults and six minors - according to data from the Secretariat of National Defense in Sonora.
The official also said that six minors were injured, another was not injured, while one girl is missing.


"
