,src,lang,text
0,"











ബാങ്ക് തട്ടിപ്പ്: കേരളത്തിലുൾപ്പെടെ രാജ്യവ്യാപക സിബിഐ റെയ്ഡ്
05 Nov 2019, 23:36 by മനോരമ ലേഖകൻ
ന്യൂഡൽഹി ∙ പൊതുമേഖലാ ബാങ്ക് തട്ടിപ്പുകളുമായി ബന്ധപ്പെട്ട് കേരളത്തിലടക്കം രാജ്യത്ത് 169 ഇടങ്ങളിൽ സിബിഐ റെയ്ഡ്. 7000 കോടി രൂപയുടെ തിരിമറി ഉൾപ്പെട്ട 35 കേസുകൾ റജിസ്റ്റർ ചെയ്തു. രാവിലെ ആരംഭിച്ച റെയ്ഡ് പലയിടങ്ങളിലും രാത്രി വരെ നീണ്ടു. പ്രധാനമായും 4 സ്വകാര്യ കമ്പനികളുടെ ക്രമക്കേടുകളുമായി ബന്ധപ്പെട്ടായിരുന്നു റെയ്ഡ്.
കമ്പനികൾ ഇവ: എസ്ഇഎൽ മാനുഫാക്ചറിങ് (113.55 കോടി), അഡ്വാൻസ് സർഫക്ടന്റ്സ് (118.49 കോടി), എസ്കേ നിറ്റ് (42.16 കോടി), കൃഷ്ണ നിറ്റ്‌വെയർ ടെക്നോളജി (27 കോടി).
അന്വേഷണ പരിധിയിലുള്ള ബാങ്കുകൾ: എസ്ബിഐ, പഞ്ചാബ് നാഷനൽ ബാങ്ക്, ആന്ധ്ര ബാങ്ക്, ഓറിയന്റൽ ബാങ്ക് ഓഫ് കൊമേഴ്സ്, ഇന്ത്യൻ ഓവർസീസ് ബാങ്ക്, അലഹാബാദ് ബാങ്ക്, കാനറ ബാങ്ക്, ദേന ബാങ്ക്, സെൻട്രൽ ബാങ്ക് ഓഫ് ഇന്ത്യ, യൂണിയൻ ബാങ്ക് ഓഫ് ഇന്ത്യ, ഐഡിബിഐ, ബാങ്ക് ഓഫ് ബറോഡ, ബാങ്ക് ഓഫ് മഹാരാഷ്ട്ര, ബാങ്ക് ഓഫ് ഇന്ത്യ, പഞ്ചാബ് ആൻഡ് സിന്ധ് ബാങ്ക്.
കേരളത്തിനു പുറമേ റെയ്ഡ് നടന്ന സംസ്ഥാനങ്ങൾ: ഡൽഹി, ഹരിയാന, പഞ്ചാബ്, ഉത്തരാഖണ്ഡ്, യുപി, ബിഹാർ, ബംഗാൾ, മഹാരാഷ്ട്ര, ഗുജറാത്ത്, മധ്യപ്രദേശ്, കർണാടക, തമിഴ്നാട്, ആന്ധ്ര.
English summary: CBI conducts raids nationwide


",ml,"











Bank scam: CBI raids all over Kerala
05 Nov 2019, 23:36 by Manorama Correspondent
CBI raids in 169 places, including Kerala A total of 35 cases involving fraud worth Rs 7,000 crore have been registered. The raid, which began in the morning, lasted till night. The raid was mainly related to the irregularities of 4 private companies.
Companies include: SEL Manufacturing (113.55 crores), Advanced Surfactants (118.49 crores), SK Knit (42.16 crores), Krishna Knitwear Technology (27 crores).
Banks under investigation: SBI, Punjab National Bank, Andhra Bank, Oriental Bank of Commerce, Indian Overseas Bank, Allahabad Bank, Canara Bank, Dena Bank, Central Bank of India, Union Bank of India, IDBI, Bank of Baroda, Bank of Maharashtra , Bank of India, Punjab and Sind Bank.
The states where the raid took place were: Delhi, Haryana, Punjab, Uttarakhand, UP, Bihar, Bengal, Maharashtra, Gujarat, Madhya Pradesh, Karnataka, Tamil Nadu and Andhra Pradesh.
English summary: CBI conducts raids nationwide


"
