,src,lang,text
0,"











ارتش سوریه یکی از میادین نفتی را به کنترل خود درآورد

05 Nov 2019, 23:14

ارتش سوریه توانست میدان نفتی «الرمیلان» واقع در استان الحسکه را (شمال شرق) به کنترل خود درآورد.
به گزارش فارس، ارتش سوریه توانست میدان نفتی «الرمیلان» واقع در استان الحسکه را به کنترل خود درآورد.
رسانه‌های غیررسمی سوریه از جمله «رادیو شام اف ام» شامگاه سه‌شنبه (۱۴ آبان) گزارش دادند که ارتش سوریه در ادامه پیشروی و استقرار در شمال شرق این کشور، امروز وارد منطقه الرمیلان در استان حسکه شده و کنترل میدان نفتی مذکور را بعد از سال‌ها به دست گرفته است.
بر اساس این گزارش‌ها، نیروهای ارتش سوریه کنترل میدان نفتی «مُلا عباس» که جزو میدان بزرگ نفتی رمیلان است، در دست دارند.
میدان نفتی ملا عباس در نزدیکی شهر الرمیلان (واقع در ریف شمال شرقی استان حسکه) قرار دارد. ارتش سویه امروز در منطقه شمال قامشلی که نزدیک به مرز با ترکیه است، مستقر شد.
استقرار ارتش سوریه در شمال شرق سوریه بر اساس توافق شبه‌نظامیان کرد این کشور با دمشق صورت می‌گیرد. طرفین بعد از آغاز عملیات نظامی اخیر ترکیه علیه این شبه‌نظامیان، توافق کردند که نیروهای ارتش سوریه با استقرار در امتداد مرزهای شمالی مانع از پیشروی بیشتر نیروهای ترکیه شوند.
با آنکه سوریه کشور نفت‌خیزی نیست ولی عمده مناطق و میادین نفتی این کشور در شمال شرق است که از آغاز بحران و جنگ داخلی سوریه در ابتداء به کنترل داعش و سپس به کنترل شبه‌نظامیان کرد سوری درآمد که مورد حمایت آمریکا طی این مدت بودند.
طی سال‌های گذشته داعش و شبه نظامیان کرد نفت سوریه را استخراج و به طرف‌های خارجی فروخته‌اند. اخیرا رئیس‌جمهور آمریکا که نیروهای کشورش با عملیات نظامی ترکیه در شمال سوریه، این کشور را ترک کردند، اعلام کرد که تعدادی از این نیروها (بیش از ۲۰۰ نظامی) در سوریه و برای حفاظت از این میادین نفتی باقی خواهند ماند.
رئیس‌جمهوری سوریه در واکنش به این اظهارات دونالد ترامپ گفت که او «صادق‌ترین رئیس‌‌جمهور آمریکا» خواند؛ چرا که بی‌پرده از سیاست‌های استعماری و اشغالگرانه واشنگتن سخن می‌گوید.


",fa,"











The Syrian army took control of one of the oil fields

05 Nov 2019, 23:14

The Syrian army was able to take control of the Al-Rumilan oil field in al-Hasakah province (northeast).
According to Fars, the Syrian army was able to take control of the al-Ramailan oil field in al-Hasakah province.
Unofficial Syrian media, including Radio Sham FM, reported Tuesday (November 7th) that the Syrian army continued to advance and deploy in the northeast of the country, today entering the Al-Ramilan area of Hassaka province and controlling the oil field after years. Has taken over.
According to reports, Syrian forces are in control of the Mullah Abbas oil field, which is part of the large Ramilan oil field.
The Mullah Abbas oil field is located near the town of Al-Rimilan (in the northeast ridge of Hosea province). Today's unilateral army is stationed in the north of Qamsheli, which is close to the Turkish border.
The deployment of the Syrian army in northeast Syria is based on an agreement by Kurdish militias with Damascus. Following the recent Turkish military offensive against the militants, the two sides agreed that the Syrian military forces should be deployed further along the northern border to prevent further Turkish troops.
Although Syria is not an oil-rich country, most of the oilfields and areas in the north-east of the country came under US-backed control from the outset of the Syrian crisis and civil war, first under the control of ISIS and then by Kurdish militias.
For years, ISIL and Kurdish militias have extracted and sold Syrian oil to foreigners. The US president recently announced that some of his troops (more than three) will remain in Syria to protect these oilfields when Turkish troops leave Turkey in northern Syria.
In response, Syrian President Donald Trump said he called ""the most honest US president"" because he spoke frankly about Washington's colonial and occupation policies.


"
