,src,lang,text
0,"











Balotelli'ye ırkçı tezahürat sonrası Verona’ya tribün kapatma cezası
05 Nov 2019, 23:10 by Zehra Yildiz
Brescia’nın forvet oyuncusu Mario Balotelli’ye yönelik ırkçı tezahüratların ardından İtalyan futbol takımı Verona’ya, bir maçlık tribün kapatma cezası verildi.
Balotelli, Hellas Verona takımı ile pazar günü oynanan maç esnasında maymun sesleri eşliğinde ırkçı saldırılara maruz kalmıştı.
Söz konusu ırkçı tezahüratların ardından A Serisi Futbol Disiplin Komisyonu, Verona’ya stadyumun yaklaşık 3 bin 500 kişilik ""Poltrone Est"" tribününü bir maçlık kapatma cezası verdiklerini duyurdu.
Verona’nın tribün lideri Castellini 2030’a kadar stadyumdan men edildi
“Balotelli asla tamamen bir İtalyan olamayacak” diyen Verona'nın tribün lideri Luca Castellini'ye 2030’a kadar stadyuma girme cezası verildi.
Castellini futbolcu Balotelli’ye yapılan ırkçı saldırılarla ilgili, “Bizim takımımızda da bir zenci var ve Balotelli gol attığında Verona taraftarları kendisini alkışladı.” şeklinde konuştu.
Castellini pazartesi günü radyoda verdiği bir röportajında ise, “Balotelli İtalya vatandaşlığı olduğu için İtalyan, ama asla tamamen bir İtalyan olamayacak” demişti.


İtalya'da göçmenlere karşı ırkçı saldırılar ve yabancı düşmanlığı artıyor


Afrika kökenli çocuklara ırkçı saldırı İtalya'da tartışma yarattı


Ek kaynaklar • AFP


",tr,"











Balotelli'ya Verona after the racist cheer the tribune closure penalty
05 Nov 2019, 23:10 by Zehra Yildiz
After racist cheering for Brescia's striker Mario Balotelli, the Italian football team Verona was given a one-minute standoff.
Balotelli, on Sunday during the match with Hellas Verona team was exposed to racist attacks accompanied by the sounds of monkeys.
After the racist cheers in question, the A-Series Football Discipline Commission announced that they had given a penalty of closing the stadium to one of the three pole ""Poltrone Est"" tribunes.
Verona's grandstand leader Castellini was banned from the stadium until 2030
“Balotelli will never be completely Italian, Verona said Verona's grandstand leader Luca Castellini.
Castellini footballer Balotelli'ye racist attacks on the, ""There is a nigger in our team and Balotelli scored a goal when the fans of Verona applauded him."" He said.
Ini Balotelli is Italian because he is an Italian citizen, but he will never be completely Italian, Castell Castellini said in an interview on radio on Monday.


Racist attacks and xenophobia against immigrants increase in Italy


Racist attack on African children raises controversy in Italy


Additional resources • AFP


"
