,src,lang,text
0,"











Oroscopo Paolo Fox 8 novembre 2019: le previsioni segno per segno
07 Nov 2019, 08:37 by Redazione



Oroscopo Paolo Fox 8 novembre 2019. Finalmente venerdì! Il weekend ormai è alle porte, possiamo organizzare il tempo libero e vivere questa giornata con maggiore spensieratezza. Ma come andrà questa giornata secondo le stelle? Quali saranno i segni che avranno i transiti planetari migliori?

LEGGI ANCHE: LA CLASSIFICA DEI SEGNI DAL 4 AL 10 NOVEMBRE 2019

Vediamolo insieme con le previsioni fatte nell’oroscopo di Paolo Fox trasmesso su ‘Radio Lattemiele’. Per chi se la fosse persa, ecco un’utile anticipazione della settimana con le previsioni valide fino al 10 novembre 2019.

Leggi anche: L’oroscopo mensile di Paolo Fox, novembre

Oroscopo Paolo Fox 8 novembre 2019: Ariete, Toro, Gemelli, le previsioni
Oroscopo 8 novembre 2019 Paolo Fox Ariete. Si prospetta un buon fine settimana perché la Luna passerà nel tuo segno. Non sarà più contraria dopo oltre un mese e già questo è positivo. Hai comunque alcune situazioni da sbrogliare ancora. Amore: non mancano i consensi, Venere è con te.
Toro. Le discussioni tra le coppie sono finalmente alle spalle, c’è molta più tranquillità ora. Novembre è un mese in cui Venere non sarà opposta. Nel finesettimana fai attenzione agli sforzi fisici.
Gemelli. Le ultime 48 ore sono state veramente pesanti. Ben venga questo venerdì allora. C’è qualche momento di nervosismo certo ma va sicuramente meglio. Occasione di aiutare qualcuno che non se la passa bene.
Oroscopo domani, le previsioni per Cancro, Leone e Vergine per il 8 novembre 2019
Oroscopo 8 novembre 2019 Paolo Fox Cancro. Fine settimana all’insegna del nervosismo dato che la Luna farà un po’ i capricci. Qualche ombra potrebbe coprire buona parte delle tue emozioni. Amore: usa prudenza.
Oroscopo 8 novembre 2019 Paolo Fox Leone. Venere e Giove sono favorevoli e molti avranno la gioia di sentirsi più passionali. Tre giorni utili per le relazioni, per fare incontri piacevoli. Dovresti avere molta più energia addosso rispetto agli inizi della settimana.
Vergine. Novembre per te non fa rima con amore, semmai questo è il mese dove mettere a posto certe situazioni legali (in questo caso non aspettarti però risposte prima di dicembre), finanziarie e personali. Nel weekend la Luna sarà dissonante, impattando negativamente su questioni economiche. In famiglia, se devi prendere una decisione, parla con franchezza. Amore: non fare il passo più lungo della gamba.

Paolo Fox 8 novembre 2019: le previsioni per Bilancia, Scorpione, Sagittario secondo Paolo Fox

Bilancia. Non strafare, la Luna resta in opposizione. Tra venerdì e domenica potrebbero esserci complicazioni, potrebbero nascere tensioni. In famiglia forse c’è qualcosa da rivedere, forse qualcosa è rimasto in sospeso. Non essere troppo drastico nei giudizi e torna, se puoi, sui tuoi passi.
Oroscopo 8 novembre 2019 Paolo Fox Scorpione. Sei davvero molto forte in questo fine settimana. Molti forse hanno già vissuto una forte emozione. Il lavoro ha comportato prove pesanti ma se avevi dei dubbi su alcune attività forse hai capito dove devi andare. Weekend di successo personale e amore sempre più intrigante. Le crisi di agosto sono ormai superate.
Oroscopo 8 novembre 2019 Paolo Fox Sagittario. Migliorano le situazioni sentimentali nei rapporti con gli altri nel weekend. I prossimi tre giorni sono favorevoli e possono regalarti la giusta intraprendenza. Nuovi rapporti in vista.
Oroscopo 8 novembre 2019:  Capricorno, Acquario e Pesci
Oroscopo 8 novembre 2019 Paolo Fox Capricorno. Sei una persona forte, però in questo weekend pare che l’energia sia minore. C’è qualcosa che non va insomma. Sono tre giorni che vedono un po’ di ruggine, forse una certa ruggine nei rapporti con un ex. 
Acquario. Incontri fortunati in vista e emozioni possibili. Tra venerdì e domenica tutto sembra essere più facile. Venere e Marte sono dalla tua, quindi significa recupero in vista. Nuovi rapporti da preferire rispetto a quelli di lunga data che forse andrebbero rinvigoriti.
Pesci. Fine settimana discreto anche se costoso, forse devi spostarti e fare un viaggio. Contieni le uscite di denaro. Amore: manca la presenza di una persona. Chi vive una storia clandestina avrà maggiori difficoltà in questo periodo. Attenzione a relazioni del passato che potrebbero riaffacciarsi.
 
 

Articoli correlati









",it,"











Paul Fox Horoscope November 8th 2019: forecasts sign by sign
07 Nov 2019, 08:37 by Redazione



Paul Fox Horoscope November 8th 2019. Finally Friday! The weekend is now upon us, we can organize free time and live this day with more carefree. But how will this day go by the stars? What will be the signs that the best planetary transits will have?

READ ALSO: THE CLASSIFICATION OF SIGNS FROM 4 TO 10 NOVEMBER 2019

Let's look at it together with the predictions made in Paolo Fox's horoscope broadcast on ‘Radio Lattemiele’. For those who missed it, here is a useful preview of the week with forecasts valid until November 10, 2019.

Read also: Paolo Fox's monthly horoscope, November

Paul Fox Horoscope November 8th 2019: Aries, Taurus, Gemini, forecasts
Horoscope 8 November 2019 Paul Fox Ariete. It looks like a good weekend because the Moon will pass in your sign. It will no longer be opposed after more than a month and this is already positive. You still have some situations to untangle again. Love: consensus is not lacking, Venus is with you.
Bull. The discussions between the couples are finally behind us, there is much more tranquility now. November is a month in which Venus will not be the opposite. In the weekend, pay attention to your physical efforts.
Gemini. The last 48 hours have been really heavy. Ben come this Friday then. There are some moments of nervous nervousness, but it's definitely better. Opportunity to help someone who is not doing well.
Horoscope tomorrow, forecasts for Cancer, Leo and Virgo for November 8, 2019
Horoscope 8 November 2019 Paul Fox Cancer. Weekend full of nervousness as the Moon will do a little whims. Some shade could cover most of your emotions. Love: use prudence.
Horoscope 8 November 2019 Paolo Fox Leone. Venus and Jupiter are favorable and many will have the joy of feeling more passionate. Three days useful for relationships, for pleasant encounters. You should have a lot more energy on you than at the beginning of the week.
Virgin. November for you does not rhyme with love, if anything this is the month where to fix certain legal situations (in this case, however, do not expect answers before December), financial and personal. Over the weekend the Moon will be dissonant, impacting negatively on economic issues. In the family, if you have to make a decision, speak frankly. Love: don't take the longest step of your leg.

Paolo Fox 8 November 2019: forecasts for Libra, Scorpio, Sagittarius according to Paolo Fox

Weight scale. Don't overdo it, the Moon remains in opposition. Between Friday and Sunday there could be complications, tensions could arise. Perhaps there is something in the family to review, perhaps something has remained outstanding. Don't be too drastic in the judgments and come back, if you can, on your steps.
Horoscope 8 November 2019 Paolo Fox Scorpio. You are really very strong this weekend. Many have perhaps already experienced a strong emotion. The work involved heavy tests but if you had any doubts about some activities you may have understood where you need to go. Weekend of personal success and ever more intriguing love. The August crises are now over.
Horoscope 8 November 2019 Paul Fox Sagittarius. Sentimental situations improve in relationships with others over the weekend. The next three days are favorable and can give you the right initiative. New reports in sight.
Horoscope 8 November 2019: Capricorn, Aquarius and Pisces
Horoscope 8 November 2019 Paul Fox Capricorn. You are a strong person, but this weekend it seems that the energy is less. There is something wrong in short. It's been three days that they see a little rust, maybe some rust in their dealings with an ex.
Aquarium. Lucky encounters in sight and possible emotions. Between Friday and Sunday everything seems to be easier. Venus and Mars are from yours, so it means recovery in sight. New relationships to be preferred over long-standing ones that might be reinvigorated.
Fish. Discreet weekend even if expensive, maybe you have to move and take a trip. Hold the money out. Love: a person's presence is missing. Those who live a clandestine history will have more difficulties in this period. Beware of past relationships that may reappear.



Related articles









"
