,src,lang,text
0,"











البساطة وسهولة استخدام راوترPro HUAWEI WiFi Q2 يرتقيان بتجربة الاتصال بشبكة الواي فاي نحو آفاق جديدة

07 Nov 2019, 08:17

في ظل التسارع الكبير والديناميكية العالية التي يشهدها عالمنا اليوم، بات الناس بحاجة إلى راوتر فعّال قادر على مجاراة هذا الواقع الجديد. ومن هذا المنطلق، قامت هواوي بابتكار راوتر HUAWEI WiFi Q2 pro الجديد للمساعدة على التخفيف من وطأة حالات التوتر الناجمة عن وسائل الاتصال غير الموثوقة والضعيفة بشبكات الواي فاي. وأصبح بإمكانكم الآن الاستمتاع بأفلامكم ومسلسلاتكم وألعابكم الإلكترونية المفضّلة، إلى جانب أيّ من الأنشطة التي تتطلب وجود اتصال بشبكة الواي فاي في جميع أرجاء المنزل دون مواجهة أي مشاكل؛ إذ يُمكن وصل راوتر HUAWEI Wifi Q2 Pro في أيّ مكان يُعاني من ضعف إشارة الواي فاي داخل المنزل ليقوم بتقوية هذه الإشارة، وبالتالي الارتقاء بتجربتكم نحو آفاق جديدة.
تكنولوجيا الاتصال الهجين بين حلول MESH Wi-Fi وGigabit PLC: اتصال سريع بشبكة الواي فاي في كل مكان
أسهمت السرعة المتزايدة لهذه التقنية ذات النطاق العريض إلى جانب العدد المتزايد من الأجهزة الذكية المتصلة داخل المنازل الخاصة، في إحداث زيادة ملحوظة في معدلات البث عبر قنوات الإشارة الرئيسية. ويُركز راوتر HUAWEI WiFi Q2 Pro الرائد على حلّ مشكلات التداخل التي تطرأ خلال بث إشارة الشبكة. ويستخدم الراوتر تقنية هجينة تجمع بين حلول mesh Wi-Fi بتردد 5 غيغاهرتز/2.4 غيغاهرتز ونظام Gigabit PLC بغية توفير سُرعات شبكة نظرية تصل إلى 1.867 ميغابت في الثانية، ما يجعلها الاختيار المثالي للمنازل التي تتمتع بإمكانية وصول سريع إلى الشبكة ذات النطاق العريض.

شبكة واي فاي تتسم بسهولة التركيب والاستخدام وتُغطي كافة أرجاء المنزل

وعلى عكس نظرائه من أنظمة الواي فاي التي تتطلب إجراء العديد من خطوات التهيئة، يحظى راوتر HUAWEI WiFi Q2 Pro الجديد بميزة سهولة التركيب والاستخدام التي لطالما ميّزت النسخة السابقة منه؛ وتُتيح لكم هذه الخاصية سرعة تهيئة الوحدة الأولى من راوتر HUAWEI WiFi Q2 Pro من خلال تطبيق HUAWEI AI Life، ومن ثم يسمح الراوتر بتركيب واستخدام الوحدات الثانوية دون الحاجة إلى إجراء أيّ من خطوات التهيئة التي عادة ما تستهلك وقتاً طويلاً. ومن ثم ستقوم الوحدة الثانوية بمزامنة اسم شبكة الواي فاي وكلمة السر من الموجّه الأول لضمان إتمام الاتصال بكل سرعة ويُسر.
يُشار إلى أن راوتر HUAWEI WiFi Q2 Pro سيتوفر في الأسواق السعودية اعتباراً من 14 نوفمبر الجاري، ضمن متجر هواوي الرئيسي في مول ’الرياض بارك‘ ومتجر هواوي الإلكتروني وفي العديد من متاجر التجزئة المعتمدة في المملكة العربية السعودية.


",ar,"











Simplicity and ease of use Pro HUAWEI WiFi Q2 takes the Wi-Fi experience to new heights

07 Nov 2019, 08:17

With the acceleration and high dynamics of our world today, people need an efficient router that can keep up with this new reality. Huawei has created the new HUAWEI WiFi Q2 pro router to help alleviate stress from unreliable and weak Wi-Fi connections. Now you can enjoy your favorite movies, series and electronic games, as well as any activities that require Wi-Fi connectivity throughout the house without any problems. The HUAWEI Wifi Q2 Pro router can be connected anywhere with a weak Wi-Fi signal indoors. To strengthen this signal, and thus elevate your experience to new heights.
Hybrid Connectivity between MESH Wi-Fi and Gigabit PLC: Fast Wi-Fi Everywhere
The increased speed of this broadband technology, combined with the increasing number of smart devices connected to private homes, has contributed to a significant increase in transmission rates across the main signal channels. The flagship HUAWEI WiFi Q2 Pro router focuses on resolving interference problems during network signal transmission. The router uses a hybrid technology that combines 5GHz / 2.4GHz mesh Wi-Fi and Gigabit PLC to provide theoretical network speeds of 1.867Mbps, making it the ideal choice for homes with fast broadband access.

The Wi-Fi network is easy to install and use and covers the entire home

Unlike its Wi-Fi counterparts that require many configuration steps, the new HUAWEI WiFi Q2 Pro router has the ease of installation and use that the previous version has long characterized; HUAWEI AI Life, so the router allows the installation and use of secondary modules without having to perform any of the time-consuming configuration steps. The secondary unit will then synchronize the Wi-Fi network name and password from the first router to ensure the connection is completed quickly and smoothly.
The HUAWEI WiFi Q2 Pro router will be available in the Saudi market starting November 14, within the Huawei flagship store in Riyadh Park Mall, Huawei e-store and in many authorized retailers in Saudi Arabia.


"
