,src,lang,text
0,"











На Новосибирской ГЭС поменяли главный щит управления
На Новосибирской ГЭС запустили новый главный щит управления. Это один из ключевых элементов для работы станции и предотвращения ЧП. Старый щит работал с момента запуска ГЭС в 1957 году.

07 Nov 2019, 08:24

Начальник смены машинного зала станции Демьян Бобриков отметил, что в разы увеличилось количество контролируемых параметров. Улучшились возможности к анализу, локализации и ликвидации аварий.
С главного щита можно управлять всеми генераторами ГЭС и линиями электропередачи, по которым энергию поставляют в несколько районов города и области.
Для того, чтобы заменить старый щит управления на новый, потребовалось 1,5 года. Все это время сотрудники работали одновременно на двух щитах.
Данная модернизация – один из этапов масштабной реконструкции Новосибирской ГЭС. В ближайшее время планируется заменить генераторы.
 
Фото: из открытых источников


",ru,"











At the Novosibirsk hydroelectric station changed the main control panel
At the Novosibirsk hydroelectric station launched a new main control panel. This is one of the key elements for the operation of the station and the prevention of emergency. The old shield has been operating since the launch of the hydroelectric station in 1957.

07 Nov 2019, 08:24

The head of the shift in the machine room of the station, Demyan Bobrikov, noted that the number of monitored parameters has increased significantly. Improved capabilities for analysis, containment and liquidation of accidents.
From the main panel, you can control all the hydroelectric generators and power lines, through which energy is supplied to several areas of the city and region.
In order to replace the old control panel with a new one, it took 1.5 years. All this time, employees worked simultaneously on two shields.
This modernization is one of the stages of large-scale reconstruction of the Novosibirsk hydroelectric station. In the near future it is planned to replace the generators.

Photo: open source


"
