,src,lang,text
0,"











Streik bei der Lufthansa hat begonnen
Unzufriedene Flugbegleiter
07 Nov 2019, 08:08 by tagesschau.de

Um Mitternacht hat bei der Lufthansa der Flugbegleiter-Streik begonnen. Zuvor wurden 1300 Flüge abgesagt. Betroffen davon sind rund 180.000 Passagiere. Versuche, den Streik gerichtlich zu unterbinden, scheiterten.

Bei der Lufthansa hat um Mitternacht ein 48-Stunden-Streik der Flugbegleiter begonnen. Der Konzern strich für heute bei seiner Hauptmarke Lufthansa rund 700 der weltweit 1100 geplanten Flüge, so dass an den Drehkreuzen München und Frankfurt viele Maschinen am Boden bleiben und auch ein Großteil der lukrativen Überseeflüge ausfallen müssen. Zusammen mit 600 geplanten Stornierungen am Freitag sind der Airline zufolge rund 180.000 Passagiere betroffen. Auch Zubringerflüge von den kleineren deutschen Flughäfen fallen aus.
Den Kunden wurden Umbuchungen auf andere Gesellschaften und Tage sowie im innerdeutschen Verkehr auf die Bahn angeboten. Die Gewerkschaft UFO will heute am Flughafen München für die Belange der rund 21.000 Flugbegleiter bei der Lufthansa-Kernmarke demonstrieren. Morgen ist dann eine Kundgebung vor der Frankfurter Konzernzentrale am Flughafen geplant.



Lufthansa scheitert vor Gericht
Die Lufthansa war gestern in zwei Gerichtsinstanzen mit dem Versuch gescheitert, den Streik noch mit juristischen Mitteln zu stoppen. Sowohl das Arbeitsgericht Frankfurt als auch das hessische Landesarbeitsgericht lehnten eine Einstweilige Verfügung gegen den Streik ab.
Die Gewerkschaft UFO hat eine Ausweitung des Arbeitskampfes auf bis zu vier weitere Airlines mit deutschem Tarifrecht angekündigt, die zum Lufthansa-Konzern gehören. Davon könnten vor allem Eurowings-Flüge betroffen sein. Einzelheiten will UFO im Laufe des Tages nennen. Ein Gespräch auf Einladung von Lufthansa-Chef Carsten Spohr mit anderen im Konzern aktiven Gewerkschaften schlug die UFO-Vorsitzende Sylvia de la Cruz aus. Unter anderem habe sich das Unternehmen in die Frage einmischen wollen, wer von Seiten der UFO an dem Gespräch teilnehmen sollte.


Tarifkonflikt der Lufthansa führt zu 1300 gestrichenen Flügentagesschau 20:00 Uhr, 06.11.2019, Uli Meerkamm, HR

UFO: ""Wir sind bereit für ausgeweitete Streiks""
Der Vize-Vorsitzende Daniel Flohr forderte Lufthansa auf, den festgefahrenen Konflikt zu beenden. ""Wir brauchen konkrete Verhandlungen, die auf Augenhöhe geführt werden und schnell zu einem Abschluss gebracht werden können"", sagte er. Die Forderungen seien schnell umzusetzen und berührten Themen, die teils seit Jahrzehnten nicht mehr angefasst worden seien. Wenn es nicht zu einer Annäherung komme, habe man von dem Mitgliedern in Urabstimmungen ein eindeutiges Mandat erhalten. ""Wir sind bereit für ausgeweitete Streiks, um unsere Forderungen durchzusetzen"", erklärte Flohr.



In der ersten Frankfurter Gerichtsverhandlung hatte Lufthansa der Gewerkschaft noch sofortige Vorverhandlungen zu tariflichen Themen angeboten, die aber erst mit dem neu zu wählenden UFO-Vorstand ab dem 15. Februar 2020 finalisiert werden könnten. Den jetzigen Vorstand lehne man weiterhin als nicht vertretungsberechtigt ab, sagte Lufthansa-Anwalt Thomas Ubber.
UFO fordert für die rund 21.000 Lufthansa-Flugbegleiter höhere Spesen und Zulagen sowie den besseren Zugang für Saisonkräfte in reguläre Anstellungsverhältnisse. Für die vier anderen Flugbetriebe wurden jeweils separate Forderungen aufgestellt und Urabstimmungen abgehalten.
In dem gesamten Konflikt geht es aber hauptsächlich um die vom Konzern aufgeworfene Frage, ob UFO überhaupt noch Tarifverträge für das Kabinenpersonal durchsetzen kann. In einem ersten Warnstreik bei den vier Tochter-Flugbetrieben hatte UFO am 20. Oktober dieses Jahres mehr als 100 Flüge ausfallen lassen. Damals hatte der Lufthansa-Konzern keinen Ersatzflugplan erstellt. Der letzte reguläre UFO-Streik bei der Lufthansa-Kerngesellschaft datiert aus dem Jahr 2015 und war mit einer Woche Dauer der längste in der Unternehmensgeschichte.
Über dieses Thema berichtete die tagesschau am 07. November 2019 um 01:53 Uhr.


",de,"











Strike at Lufthansa has begun
Disgruntled flight attendants
07 Nov 2019, 08:08 by Tagesschau.de

At midnight Lufthansa has started a flight attendant strike. Previously, 1300 flights were canceled. Affected are about 180,000 passengers. Attempts to prevent the strike in court, failed.

At midnight Lufthansa has begun a 48-hour strike by flight attendants. For its flagship brand, Lufthansa, Lufthansa is cutting around 700 of the 1100 scheduled flights worldwide, leaving many aircraft on the ground at the hubs in Munich and Frankfurt, and many of the lucrative overseas flights. Together with 600 planned cancellations on Friday, according to the airline, about 180,000 passengers are affected. Also feeder flights from the smaller German airports are canceled.
The customers were offered transfers to other companies and days as well as domestic rail traffic. The UFO union wants to demonstrate today at Munich Airport for the concerns of the approximately 21,000 flight attendants at the Lufthansa core brand. Tomorrow, a rally is planned in front of the Frankfurt headquarters at the airport.



Lufthansa fails in court
Lufthansa failed yesterday in two judicial courts with the attempt to stop the strike by legal means. Both the Frankfurt Labor Court and the Hessian State Labor Court rejected a restraining order against the strike.
The union UFO has announced an extension of the industrial action to up to four further airlines with German collective bargaining right, which belong to the Lufthansa company. This could particularly affect Eurowings flights. Details UFO wants to call during the day. An interview at the invitation of Lufthansa CEO Carsten Spohr with other unions active in the group suggested UFO leader Sylvia de la Cruz. Among other things, the company had wanted to interfere in the question of who should take part in the conversation from the UFO.


Tariff dispute of Lufthansa leads to 1300 canceled airshow 20:00, 06.11.2019, Uli Meerkamm, HR

UFO: ""We are ready for extended strikes""
Vice-Chairman Daniel Flohr called on Lufthansa to end the stalled conflict. ""We need concrete negotiations that are on an equal footing and can be brought to a quick conclusion,"" he said. The demands were to be implemented quickly and touched topics that had not been touched in part for decades. If it does not come to an approximation, one has received from the members in ballot a clear mandate. ""We are ready for extended strikes to enforce our demands,"" said Flohr.



In the first Frankfurt court hearing Lufthansa had offered the union still immediate pre-negotiations on tariff-related topics, which could be finalized however only with the again to be selected UFO executive committee starting from 15 February 2020. The current board refuses to continue as not authorized to represent, said Lufthansa lawyer Thomas Ubber.
UFO demands for the approximately 21,000 Lufthansa flight attendants higher expenses and allowances as well as better access for seasonal workers to regular employment. Separate demands were made and ballots were held for the four other airlines.
The whole conflict is mainly about the question raised by the Group, whether UFO can still enforce collective agreements for the cabin crew. In a first warning strike at the four subsidiary airlines, UFO had canceled more than 100 flights on 20 October this year. At that time, the Lufthansa Group had not prepared a replacement flight plan. The last regular UFO strike at the Lufthansa core company dates from 2015 and was one week longest in the company's history.
The Tagesschau reported on this topic on 07 November 2019 at 01:53.


"
