,src,lang,text
0,"











Destitution: le chef de cabinet de Trump convoqué au Congrès
Mick Mulvaney est le plus haut responsable de la Maison Blanche à recevoir une telle convocation dans le cadre de l'enquête menée par les démocrates du Congrès.

05 Nov 2019, 18:49

Le directeur de cabinet de Donald Trump, Mick Mulvaney, a été convoqué pour témoigner vendredi dans l'enquête menée par les démocrates du Congrès en vue de destituer le président américain. Mick Mulvaney est le plus haut responsable de la Maison Blanche à recevoir une telle convocation. Dénonçant une ""mascarade"", l'exécutif refuse de coopérer à l'enquête et le chef de cabinet devrait donc probablement ignorer cette demande.
L'""enquête a révélé que vous avez pu être directement impliqué dans la tentative, orchestrée par le président Trump, son agent personnel Rudolph Giuliani, et d'autres"" de faire pression sur l'Ukraine pour qu'elle enquête sur son rival démocrate Joe Biden, ont écrit mardi les chefs démocrates chargés de l'enquête à la Chambre des représentants.
Plus précisément, ils soupçonnent Donald Trump et son entourage d'avoir suspendu une rencontre à la Maison Blanche et quelque 400 millions de dollars d'aide militaire ""afin de faire pression sur le président ukrainien Volodymyr Zelensky pour qu'il mène des investigations qui bénéficieraient aux intérêts politiques de Donald Trump"".
""Rôle direct""
""Les indices rassemblés (...) laissent entendre que M. Mulvaney a pu jouer un rôle direct dans le stratagème pour faire pression sur le gouvernement ukrainien afin qu'il s'immisce dans l'élection américaine de 2020 en fabriquant des informations nuisibles sur les opposants politiques du président Trump, ainsi que dans la tentative de dissimuler ces actes"", avancent les démocrates.
Les présidents des commissions du Renseignement, des Affaires étrangères et de supervision de l'exécutif ont convoqué Mick Mulvaney à 09H00 le 8 novembre au Congrès, à Washington. Mardi, un conseiller de la Maison Blanche, Wells Griffith, ne s'est pas présenté à sa convocation. La veille, quatre témoins avaient ignoré le rendez-vous fixé par les démocrates.
Malgré le refus de coopérer de la Maison Blanche, les commission ont déjà entendu une dizaine de témoins à huis clos. Elles prévoient d'organiser bientôt des auditions publiques, qui pourraient conduire à la mise en accusation, ""impeachment"" en anglais"", de Donald Trump.
Convaincus de tenir la preuve d'un ""abus de pouvoir"" du président, les démocrates ont engagé le 24 septembre cette enquête à la Chambre, où ils sont majoritaires. Les républicains contrôlent le Sénat, qui serait ensuite chargé de rendre son verdict sur une destitution de Donald Trump.
Compte tenu du soutien dont le président dispose à la chambre haute, cette issue paraît improbable.
(Avec AFP)


",fr,"











Destitution: Trump's chief of staff summoned to Congress
Mick Mulvaney is the highest White House official to receive such a summons as part of the Congressional Democrats' investigation.

05 Nov 2019, 18:49

Donald Trump's chief of staff, Mick Mulvaney, was summoned to testify on Friday in the congressional Democrats' investigation into deposing the US president. Mick Mulvaney is the highest official in the White House to receive such a summons. Denouncing a ""masquerade"", the executive refuses to cooperate with the investigation and the chief of staff should probably ignore this request.
The ""investigation revealed that you may have been directly involved in the attempt, orchestrated by President Trump, his personal agent Rudolph Giuliani, and others"" to pressure Ukraine to investigate its Democratic rival Joe Biden, Tuesday wrote the Democratic leaders in charge of the inquiry in the House of Representatives.
More specifically, they suspect Donald Trump and his entourage of having suspended a meeting at the White House and some $ 400 million of military aid ""to pressure Ukrainian President Volodymyr Zelensky to carry out investigations that would benefit to Donald Trump's political interests "".
""Direct role""
""The clues gathered ... suggest that Mulvaney was able to play a direct role in the scheme to pressure the Ukrainian government to interfere in the 2020 US election by fabricating harmful information. on the political opponents of President Trump, as well as in the attempt to conceal these acts "", say the Democrats.
The chairpersons of the Intelligence, Foreign Affairs and Executive Oversight Committees convened Mick Mulvaney at 9:00 am on November 8 at the Congress in Washington. On Tuesday, a White House advisor, Wells Griffith, did not show up for his summons. The day before, four witnesses had ignored the appointment set by the Democrats.
Despite the refusal to cooperate from the White House, the commission has already heard about ten witnesses in camera. They plan to hold public hearings soon, which could lead to the indictment, ""impeachment"" in English, of Donald Trump.
Convinced to hold the evidence of an ""abuse of power"" of the president, the Democrats began September 24 this investigation in the House, where they are in the majority. The Republicans control the Senate, which would then be responsible for rendering its verdict on a dismissal of Donald Trump.
Given the support the president has in the upper house, this outcome seems unlikely.
(With AFP)


"
