,src,lang,text
0,"











Estado de saúde de turista que diz ter sido intoxicado por óleo é estável
Secretário de Saúde de Ilhéus negou quadro de intoxicação em paciente
05 Nov 2019, 18:24 by Gabriel Moura*


Foto: Acervo Pessoal

O turista mineiro Anderson Gabriel Palmela, 38 anos, que apresentou sintomas de intoxicação após, segundo ele, ter contato com petróleo cru em uma praia de Ilhéus, no Sul da Bahia, apresentou uma melhora de seu estado de saúde nesta terça-feira (5). Ele foi internado no Hospital do Cacau nessa segunda-feira (4), quando apresentou sangue nas fezes.
De acordo com o secretário de Saúde de Ilhéus, Geraldo Magela, o turista não apresentou nenhum novo sintoma e as costas, que sofreram as queimaduras, já estão ""descascando"".
Ainda segundo Geraldo, o paciente já poderia ter recebido alta ainda nessa segunda, mas o hospital optou por mantê-lo isolado para controlar sua ingestão de alimentos e líquidos e observar possíveis reações.
Já sobre o diagnóstico, o secretário diz que Anderson sofreu uma queimadura de primeiro grau e não apresentou quadro de intoxicação. Ainda assim, foi internado por precaução e passou por uma bateria de exames de vários especialistas.
Não identificadoJá o enfermeiro que atendeu o paciente, Gleidson Souza Santana, acredita que o que causou as queimaduras em Anderson não foi o óleo, mas algo ainda não identificado.
Ele argumentou que não foi registrado nenhum outro caso deste tipo em todo o Nordeste, área infectada pela substância, e que no local onde o turista disse ter tomado banho não tinha sido atingido nos dias em que ele disse ter entrado no mar. 
O mineiro, no entanto, conta uma versão diferente. “No momento em que eu me banhava no mar, não vi manchas de petróleo. Depois que voltamos lá, ainda no sábado, encontramos fragmentos”, disse ele, que afirmou ainda que saiu da praia com as costas sujas de óleo.
Apesar dos relatos e teorias, apenas os resultados dos exames poderão informar com exatidão o que aconteceu.
RelembreO empresário Anderson Gabriel deu entrada no Pronto Atendimento da Zona Sul de Ilhéus na tarde do último sábado (2), com queimaduras no corpo após tomar banho de mar na Praia dos Milionários, também localizada no litoral sul. Segundo Gleidson, o paciente relatou que sentiu o incômodo ainda no mar, “que estava limpo”.
Depois de ir para casa e tomar banho, o rapaz percebeu que os sintomas pioraram. “Meu corpo começou a coçar e queimar muito no mar. Quando cheguei em casa, no banho, a água ficou escura no chão e oleosa, mas na praia eu não vi óleo. À noite, quando voltei com o secretário de saúde para mostrar onde estava tomando banho, vimos fragmento de óleo na areia”, relatou Anderson, ao CORREIO.
O empresário mineiro, que está visitando o tio em Ilhéus, deu entrada no Pronto Atendimento por volta do meio-dia de sábado (2), com o corpo marcado por manchas e bolhas. Já na segunda-feira (4), o paciente apresentou quadro de náusea e disse que começaram a aparecer sangue em suas fezes.
Apesar das investigações, o coordenador da Vigilância de Saúde afirmou que não há como relacionar o caso com a presença de óleo nas praias do Nordeste. “A partir da notificação do caso dele, que foi isolado, a Vigilância investiga e alimenta o sistema. Além disso, liga para o Centro de Toxicologia para informar sobre o caso e faz o monitoramento do paciente pelo menos uma vez por dia”, explica Santana.
Desde a chegada do óleo em Ilhéus, na sexta-feira (25), outros dois casos foram registrados, sendo um de uma voluntária que se queixou de reações inalatórias, náusea, dor de cabeça e dor de estômago, e outro de um surfista, mas ambos foram atendidos e passam bem.
“Até agora a gente não sabe ao certo quais são os sintomas. O Estado da Bahia não trabalha com petróleo, então a gente não tem equipe especializada nessa área. Seria o caso de alguém da Petrobras informar a gente como conduzir a situação. Por enquanto, estamos seguindo as orientações da Sesab e do Ministério da Saúde”, afirma Santana. A Marinha e o Corpo de Bombeiros também estão dando apoio, junto com a prefeitura municipal de Ilhéus.

*Com orientação do chefe de reportagem Jorge Gauthier







",pt,"











State of health of tourist who says to have been intoxicated by oil is stable
Health Secretary of Ilhéus denied intoxication in patient
Nov 05 2019, 18:24 by Gabriel Moura *


Photo: Personal Collection

Miner tourist Anderson Gabriel Palmela, 38, who showed symptoms of intoxication after he said he had contact with crude oil on a beach in Ilhéus, southern Bahia, reported an improvement in his health on Tuesday (5). ). He was admitted to the Cocoa Hospital on Monday (4), when he had blood in his stool.
According to the Secretary of Health of Ilhéus, Geraldo Magela, the tourist has not presented any new symptoms and the back, which suffered the burns, are already ""peeling"".
Also according to Geraldo, the patient could have been discharged later this Monday, but the hospital chose to keep him isolated to control his food and fluid intake and observe possible reactions.
Regarding the diagnosis, the secretary says that Anderson suffered a first degree burn and did not present intoxication. Still, he was hospitalized as a precaution and underwent a battery of examinations by various experts.
UnidentifiedNow the nurse who attended the patient, Gleidson Souza Santana, believes that what caused the burns in Anderson was not the oil, but something not yet identified.
He argued that no other case of this kind was reported in the entire Northeast, an area infected with the substance, and that where the tourist said he had bathed had not been hit on the days he said he had entered the sea.
The miner, however, tells a different version. “The moment I was bathing in the sea, I saw no oil slicks. After we got back there on Saturday, we found fragments, ”he said, who said he left the beach with his oil-soaked back.
Despite reports and theories, only test results can accurately tell what happened.
RemindBusinessman Anderson Gabriel was admitted to the South Zone of Ilhéus Emergency Service on Saturday afternoon (2), with body burns after taking a sea bath at the Millionaires Beach, also located on the south coast. According to Gleidson, the patient reported that he felt uncomfortable while at sea, ""which was clean.""
After going home and showering, the boy noticed that his symptoms got worse. “My body started to itch and burn a lot in the sea. When I got home, in the bath, the water turned dark on the floor and oily, but on the beach I saw no oil. At night, when I came back with the health secretary to show him where I was taking a bath, we saw oil fragments in the sand, ”Anderson told the MAIL.
The businessman from Minas Gerais, who is visiting his uncle in Ilhéus, was admitted to the Emergency Room around noon on Saturday (2), his body marked by spots and bubbles. Already on Monday (4), the patient presented nausea and said that blood began to appear in his stool.
Despite the investigations, the Health Surveillance coordinator stated that there is no way to relate the case to the presence of oil on the beaches of the Northeast. “From the notification of his case, which has been isolated, the Surveillance investigates and feeds the system. In addition, she calls the Toxicology Center to report on the case and monitors the patient at least once a day, ”explains Santana.
Since the arrival of the oil in Ilhéus on Friday (25), two other cases have been reported, one of a volunteer who complained of inhalation reactions, nausea, headache and stomach ache, and another of a surfer, but both were met and are doing well.
“So far we are not sure what the symptoms are. The state of Bahia doesn't work with oil, so we don't have a specialized team in this area. It would be the case of someone from Petrobras informing us how to handle the situation. For now, we are following the guidelines of Sesab and the Ministry of Health, ”says Santana. The Navy and the Fire Department are also giving support, along with the Ilhéus City Hall.

* With guidance from reporting chief Jorge Gauthier







"
