,src,lang,text
0,"











Ας σταματήσουν πια κάποιοι να βαράνε μύγες…

05 Nov 2019, 18:05


Κι εκεί που κάποιοι περνούσαν την ώρα τους βαρώντας μύγες και πίστευαν πως το πρωτάθλημα της Α’ Κατηγορίας θα το διεκδικούσαν απλώς (χωρίς να σχολιάσω περαιτέρω) ο Ηρακλής Μαριτσών με τον ΑΟ Πυλίου, άντε και το πολύ κι ο Άρης με τον ΑΕΡΑ, μπήκαν …σφήνα ο Απόλλων Καλυθιών με τον Αστέρα Παστίδας.

Με βάση το πώς έχουν κυλήσει οι αγωνιστικές έως τώρα, βγαίνει ευκόλως το συμπέρασμα ότι αυτή η διοργάνωση θα είναι απίστευτα συναρπαστική στο κομμάτι κατάκτησης του τίτλου.
Αυτό δηλαδή που ζήσαμε πρόπερσι με τη «μάχη» ανάμεσα σε Φοίβο και Άρη δεν θα είναι τίποτα μπροστά σ’ αυτό που θα συμβεί φέτος.
Σιγά ρε μεγάλε, και τον καφέ θα μας λες σε λίγο άμα λάχει, θα σκεφτεί κάποιος διαβάζοντας τις παραπάνω αράδες, αλλά κάτι ξέρουμε κι εμείς από το τοπικό τόσα χρόνια που το φάγαμε στη μάπα, με την καλή έννοια, για να μη δημιουργηθούν άστοχοι συνειρμοί.
Σε κάθε περίπτωση οι ομάδες από τα Μαριτσά και το Πυλί παραμένουν κατ’ εμέ τα φαβορί, όχι όμως ότι στο τέλος θα μείνουν οι δυο τους να τα… πουν για το πρωτάθλημα. Και μην αρχίσουν τώρα τα σχόλια για την πεντάρα του ΑΕΡΑ στον Απόλλωνα…
Ας μην ξεχνάμε πρόπερσι πόσο κέρδισε ο Άρης στον Αρχάγγελο τον Φοίβο και ποιος τελικώς πήρε το πρωτάθλημα. Η μάχη της κορυφής σε κάθε διοργάνωση είναι ό, τι πουλάει κι αυτό αναμένεται το επόμενο διάστημα να σπάσει τα …ταμεία, που λέμε.
Επιπλέον, και για τους φίλους του στοιχήματος είναι καλύτερα, έτσι για την αγωνία ως το τέλος και τη μάχη προς το τελικό σημείο, τη χασούρα ή το κέρδος. Κι επειδή βιάζονται να βγάλουν συμπέρασμα κάποιοι, αρκεί να πω ότι ασφαλώς και στο τοπικό «Απαγορεύεται το στοιχηματίζειν…», η χαρά όμως του λόγου και της φωνής την ώρα του αγώνα, όπως στον ιππόδρομο, εκεί όπου οι βασιλείς τα «σπρώχνανε» χοντρά, έχει άλλη χάρη…
Το επιμύθιο λοιπόν είναι το ακόλουθο: το μόνο σίγουρο είναι ότι στο πρωτάθλημα της Α’ Κατηγορίας, τουλάχιστον όσον αφορά τους αγώνες για την κατάκτηση του τίτλου, δεν θα βαρεθούμε, όλα τ’ άλλα είναι κάτι σαν πασατέμπο, μπας και περάσει η ρημάδα η ώρα…

ΤΣΑΜΠΙΚΟΣ ΠΑΤΣΑΪΣ



",el,"











Let somebody stop flies anymore ...

05 Nov 2019, 18:05


And where some people were spending their time flying flies and thinking that the First Division championship would just be claimed (without further comment) by Heracles Maritson with AO Pyliou, and most of all Mars by AERA, they entered… Apollo of Kalithia with Aster Pastida.

Based on how the races have gone so far, it is easy to conclude that this event will be incredibly exciting on the title track.
That is, what we lived through with the ""battle"" between Phoebus and Mars will be nothing ahead of what will happen this year.
It's great, and the coffee will tell you a little bit, if you think about reading the above, but we also know something from the local so many years that we ate it in the map, in a good way, in order to avoid creating inappropriate associations. .
In any case, the teams from Maritsa and Pyli remain the favorites for me, but not that in the end they will be left to tell them about the championship. And don't start commenting on Apollo's five on air right now ...
Let's not forget just how much Mars had won over Archangel Phivus and who eventually won the championship. The battle for the top in every competition is what sells and that is to be expected next time to break the… funds we say.
In addition, it is better for betting friends as well, for anxiety to the end and the battle to the end point, gash or win. And because some are in a hurry to reach a conclusion, suffice it to say that of course in the local ""No betting ..."", but the joy of speech and voice at race time, as on the race track, where the kings pushed them thick, has another grace ...
So the story is the following: the only sure thing is that in the Division I championship, at least in terms of the title race, we won't be bored, everything else is like a passerby, bash and the team's time is up. …

TABLE PATSAS



"
