,src,lang,text
0,"











С начала года на Украине зафиксированы 60 нападений на журналистов
05 Nov 2019, 18:15 by leia
Каждый пятый день на Украине нападают на журналистов. Об этом сообщил глава Национального совета журналистов Украины (НСЖУ) Томиленко.
По данным «Индекса физической безопасности журналистов», за 10 месяцев 2019 года на Украине зафиксированы 60 случаев физической агрессии по отношению к журналистам. В октябре были зафиксированы четыре таких инцидента: два в Киеве, один на Волыни и один в Кировоградской области.
Такие данные были обнародованы во время дискуссии «Международная солидарность и защита украинских журналистов» которая состоялась накануне парламентских слушаний по вопросам физической безопасности журналистов 6 ноября.
Отмечается, что парламентские слушания по вопросам физической безопасности журналистов на Украине не проводились в течение последних 10 лет.
Напомним, в конце октября сообщалось о том, что с начала года на Украине было совершено более 50 нападений на журналистов.
Ранее, 30 сентября ОБСЕ выразила обеспокоенность действиями украинских неонацистов в отношении журналистов.
25 сентября произошел конфликт между украинским журналистом Коцабой и одним из главарей нацистской организации С14*.
20 сентября украинский нацист Карась напал на журналиста во время суда над террористом Белько.
В конце августа полиция задержала более 30 человек, избивших журналистов в Харьковской области.
В конце июня в Одессе неизвестные напали на журналистов и повредили их автомобиль.
22 июня сообщалось, что за текущий год на Украине зафиксировано 39 нападений на журналистов и активистов.
Днем ранее сообщалось, что американское посольство потребовало тщательно расследовать убийство журналиста Комарова.
20 июня стало известно, что избитый в Черкассах украинский журналист Комаров скончался в больнице.
Напомним, что 4 мая Комаров после жестокого избиения был доставлен в реанимацию.
*Экстремистские и террористические организации, запрещенные в Российской Федерации: «Свидетели Иеговы», Национал-Большевистская партия, «Правый сектор», «Украинская повстанческая армия» (УПА), «Исламское государство» (ИГ, ИГИЛ, ДАИШ), «Джабхат Фатх аш-Шам», «Джабхат ан-Нусра», «Аль-Каида», «УНА-УНСО», «Талибан», «Меджлис крымско-татарского народа», «Мизантропик Дивижн», «Братство» Корчинского, «Тризуб им. Степана Бандеры», «Организация украинских националистов» (ОУН), С14 (Січ), ВО «Свобода».


",ru,"











Since the beginning of the year, 60 attacks on journalists have been recorded in Ukraine
05 Nov 2019, 18:15 by leia
Every fifth day in Ukraine attack journalists. This was announced by the head of the National Council of Journalists of Ukraine (NSJU) Tomilenko.
According to the Journalists' Physical Security Index, for 10 months of 2019, Ukraine recorded 60 cases of physical aggression against journalists. In October, four such incidents were recorded: two in Kiev, one in Volyn and one in the Kirovograd region.
Such data were released during the discussion “International Solidarity and Protection of Ukrainian Journalists” which took place on the eve of the parliamentary hearings on the physical security of journalists on November 6.
It is noted that parliamentary hearings on the physical security of journalists in Ukraine have not been held over the past 10 years.
Recall that at the end of October it was reported that since the beginning of the year in Ukraine more than 50 attacks on journalists have been committed.
Earlier, on September 30, the OSCE expressed concern about the actions of Ukrainian neo-Nazis against journalists.
On September 25, there was a conflict between the Ukrainian journalist Kotsaba and one of the leaders of the Nazi organization C14 *.
September 20, the Ukrainian Nazi Karas attacked a journalist during the trial of the terrorist Belko.
In late August, police detained more than 30 people who beat journalists in the Kharkiv region.
At the end of June in Odessa, unidentified men attacked journalists and damaged their car.
June 22 it was reported that over the current year in Ukraine recorded 39 attacks on journalists and activists.
A day earlier it was reported that the US embassy demanded a thorough investigation into the murder of journalist Komarov.
On June 20, it became known that the Ukrainian journalist Komarov, beaten up in Cherkasy, had died in a hospital.
Recall that on May 4, Komarov, after a brutal beating, was taken to intensive care.
* Extremist and terrorist organizations banned in the Russian Federation: Jehovah's Witnesses, National Bolshevik Party, Right Sector, Ukrainian Insurgent Army (UPA), Islamic State (ISIS, ISIS, Daesh), Jabhat Fatah ash-Sham ”,“ Jabhat al-Nusra ”,“ Al-Qaeda ”,“ UNA-UNSO ”,“ Taliban ”,“ Mejlis of the Crimean Tatar people ”,“ Misanthropic Division ”,“ Brotherhood ”of Korchinsky,“ Trident named after Stepan Bandera ”,“ Organization of Ukrainian Nationalists ”(OUN), С14 (Січ), VO“ Freedom ”.


"
