,src,lang,text
0,"












نمایشگاه میراث وقف افتتاح شد

نمایشگاه میراث وقف با حضور مسئولان و اصحاب رسانه افتتاح شد.
03 Nov 2019, 10:06 by بولتن نیوز | bultannews.com
به گزارش بولتن نیوز، جبرئیل نوکنده مدیر جدید موزه ملی در نمایشگاه میراث وقف که امروز در موزه ملی برگزار شد، گفت:وقف فرهنگی مهم‌ترین و پرکاربردترین نوع وقف است.
وی افزود:وقف از یک سو به عنوان یک عمل خیر در زمره باقیات و صالحات قرار گرفته و از یک سو میراث فرهنگی ارزشمندی را به جای گذاشته و یکی از مهم‌ترین منابع غنی سازی موزه‌ها به شمار می‌آید.
نمایشگاه میراث وقف۴۰+۱ اثر وقفی و تاریخی را در معرض دید عموم قرار می‌دهد و توجه اقشار مختلف جامعه را به وقف فرهنگی جلب می‌کند.
ارائه گزارش عملکرد به مردم در هفته وقف
حجت الاسلام عادل معاون اجتماعی سازمان اوقاف کشور به بیان اهداف برگزاری نمایشگاه میراث وقف پرداخت و گفت:ما در هفته وقف در همه استان‌ها گزارش عملکرد را به مردم ارائه می‌دهیم و برای تجلیل از همه اصحاب وقف برنامه ای در سطح کشور در حال اجرا است البته موزه میراث وقف نیز برگزار می‌شود.
وی افزود:عملکرد۱۰شرکت دانش بنیان که با سازمان اوقاف همکاری می‌کنند، ارائه و در کنار این کار همایش یاوران وقف نیز برگزار می‌شود؛ تفاهمنامه‌ای نیز میان سازمان اوقاف و وزارت میراث فرهنگی، گردشگری و صنایع دستی امضاء خواهد شد.
محمدحسن طالبیان نیز از برگزاری نمایشگاه میراث وقف ابراز خوشحالی کرد و گفت:وقف به موضوع نگهداری از میراث فرهنگی ارتباط دارد و به نظر می رسد سندی که امروز امضا می شود خیلی هدفمند و دقیق است.البته ما با چالش هایی مواجه هستیم که در سند گنجانده شده اند مثلا در برخی از وقف نامه ها گفته شده است که درآمد به دست آمده باید در راه خاصی خرج شود و چنین نمی شود.در خصوص معماری نیز اموری هست که امید است با امضای این سند حل شود البته مفاد درج شده در این سند فقط مختص به میراث فرهنگی نبوده و به صنایع دستی و گردشگری نیز ارتباط دارد.موضوع موزه های وقف نیز می تواند فرهنگ ارادت و اخلاص وقف را ترویج دهد.
حجت الاسلام والمسلمین سید مهدی خاموشی،رئیس سازمان اوقاف و نماینده مقام معظم رهبری گفت:اگرچه می گویند لفظ وقف در قرآن نیامده اما آیات زیادی راجع به وقف در قرآن آمده است.
او در ادامه‌ چند آیه مرتبط با وقف را قرائت و بیان کرد: وقف ریشه ای در فرهنگ ایرانی و اسلامی ما دارد.امروز قبیل۲۰۰هزار موقوفه و ۱میلیون و ۴۰۰هزار رقبه داریم.در خصوص میراث فرهنگی نیز باید گفت ما دست نوشته های کهن و وقف نامه های ارزشمندی داریم که گاهی روابط بین کشورها را بیان می کنند پس اصل آنها باید حفظ شود و نحوه نگهداری،طبقه بندی،تاریخ گذاری و حفاظت از آنها تخصص میراث فرهنگی است و نگهداری از قرآن های خطی نیز در این زمره است.
رئیس سازمان اوقاف ادامه داد:ما سعی کردیم به بهانه فرارسیدن هفته وقف آثار شرکت های دانش بنیانی که با ما همکاری کردند را در معرض دید عموم قرار بدهیم و گامی در جهت خروج از تحریم ها برداریم.
او گفت:کمیسیون فقهی ما در خصوص برخی از شاخه های جدید فعالیت می کند و از شما هم درخواست داریم که در این زمینه به ما کمک کنید.مثلا در بحث وقف پول به نظر می رسد اگر بتوانیم صندوق وقف پول راه بیندازیم منبع مالی مناسبی در اختیارمان قرار می گیرد و در خصوص وقف اشتراکی نیز ما قابلیت استفاده داریم.
در بخش دیگر از مراسم تفاهمنامه ای میان سازمان اوقاف خیریه و وزارت میراث فرهنگی،گردشگری و صنایع دستی امضا شد.بیش از یک میلیون سایت تاریخی شناسایی شده است
علی اصغر مونسان وزیر میراث فرهنگی، گردشگری و صنایع دستی هم در حاشیه افتتاح موزه و نمایشگاه میراث وقف در جمع خبرنگاران گفت: بخشی از بنا‌های تاریخی ما مرتبط به سازمان اوقاف است. ما در این سازمان، اشیا و بنا‌های تاریخی متعددی داریم. بخش قرآنی یک بخش ویژه در سازمان اوقاف است؛ بنابراین بسیاری از آثاری که میراث فرهنگی و معنوی کشور به حساب می‌آیند، در تملک سایر دستگاه‌ها و سازمان اوقاف است.
او افزود: ما در خصوص بنا‌های تاریخی چندی است که واگذاری حق بهره برداری بنا‌ها به منظور مشارکت مردم در امر مرمت را شروع کرده ایم، زیرا در حال حاضر بیش از یک میلیون سایت شناخته شده تاریخی را شناسایی کردیم و می دانیم کشور ایران، کشوری با تاریخ قابل توجه و تمدن کهن است. بنابراین هرچه جلو می‌رویم، اماکن تاریخی مان بیشتر و بیشتر می‌شوند، اما بودجه مان بسیار محدود است.
وزیر میراث فرهنگی، گردشگری و صنایع ستی بیان کرد: همانطور که گفتم سازمان اوقاف سهم زیادی در مشارکت در مرمت بنا‌های تاریخی دارد. اگرچه ما حوزه بقاع متبرکه و امامزاده‌ها را هم جزو ردیف‌های بودجه‌ای داریم و کمک زیادی به مرمت مساجد تاریخی، بقاع متبرکه و امامزاده‌ها کردیم، اما نیاز بود که با همکاری سازمان اوقاف بتوانیم ارتباط تنگاتنگی را داشته باشیم و بتوانیم نقش‌های موثرتری را ایفا کنیم ضمن اینکه به نظر می‌آید باید بتوانیم فضا‌های موزه‌ای مان را هر چه بیشتر در اختیار سازمان اوقاف قرار بدهیم تا این اشیای تاریخی بیشتر به ملت شریف و گردشگران معرفی شوند. بنابراین وجود حضرت حجت الاسلام والمسلمین خاموشی را غنیمت دانستیم و با آگاهی از نگاه ویژه او به حوزه میراث فرهنگی، زمینه فراهم شد که بتوانیم یک تفاهمنامه کاملا اجرایی را امضا کنیم. امیدواریم که این تفاهمنامه در قالب کاغذ باقی نماند و به اجرا دربیاید البته چنین نبود که تفاهمنامه‌های قبلی اجرا نشود، اما نیاز به بازنگری بود.
او بیان کرد: یکی از مفاد تفاهمنامه این است که بنا‌های تاریخی که توسط سازمان اوقاف به ما اعلام می‌شود، بررسی شود تا ببینیم که آیا باید ثبت ملی یا جهانی بشوند یا نه؟


",fa,"












The Waqf Heritage Fair opened

The Waqf Heritage Fair was inaugurated by officials and media outlets.
03 Nov 2019, 10:06 by Bulletin News | bultannews.com
According to Bulletin News, Gabriel Nawakht, the new director of the National Museum at the Waqf Heritage Exhibition, which was held today at the National Museum, said: ""Cultural waqf is the most important and most used type of waqf.""
He added: Waqf, on the one hand, is a good deed among the remnants and competencies, and on the one hand it holds a valuable cultural heritage and is one of the most important sources of museum enrichment.
The Waqf Heritage Exhibition 1 + 1 brings public and historical work to the attention of various segments of the society to cultural endowment.
Presenting performance reports to people on a weekly basis
Hojat al-Islam Adel, social welfare deputy director of Waqf, stated the aims of the Waqf Heritage Exhibition, saying: ""We provide performance reports to people in Waqf week in all provinces and a program is being implemented nationwide to commemorate all Waqf associates. The Waqf Heritage Museum will also be held.
He added that the performance of a knowledge-based company that works with the endowment organization will be presented and a waqf helper conference will also be held; a memorandum will also be signed between the endowment organization and the Ministry of Cultural Heritage, Tourism and Crafts.
Mohammad Hassan Talebian also expressed his happiness at holding the Waqf Heritage Exhibition and said: Waqf is related to the preservation of cultural heritage and it seems that the document signed today is very purposeful and accurate. Included are, for example, some endowments stating that the proceeds should be spent in a particular way and that they would not. As for architecture, there is hope that the document will be resolved by signing this document, of course. The document is not only about cultural heritage and is also related to handicrafts and tourism. Waqf museums can also be voluntary Dedication and sincerity to promote.
Hojat al-Islam Muslim Muslim Sayyid Mehdi Khushki, head of the Awqaf organization and the Supreme Leader's representative, said: Although they say that the term 'waqf' has not been mentioned in the Qur'an, there are many verses in the Quran.
He has read and stated several verses related to waqf: Waqf is rooted in our Iranian and Islamic culture. Today we have 6,000 endowments and 7 million and 6,000 competitions. We also have ancient manuscripts and endowments on cultural heritage. We have valuable references that sometimes state relations between countries so their principle must be preserved and their preservation, classification, dating and preservation are the specialty of cultural heritage and the preservation of linear Qur'an is one of them.
""We tried to publicize the work of knowledge-based companies working with us under the pretext of ending the week and taking a step towards sanctions relief,"" the endowment chief said.
He said: ""Our jurisprudence commission is working on some new branches and we also ask you to help us in this regard. For example, it seems to be a matter of money endowment if we are able to set up an endowment fund. We are also available for shared endowments.
In another part, a memorandum of understanding was signed between the charity endowment organization and the Ministry of Cultural Heritage, Tourism and Crafts. More than one million historical sites have been identified
Ali Asghar Mounsan, Minister of Culture, Tourism and Handicrafts, also told reporters on the sidelines of the opening of the Waqf Heritage Museum and Exhibition: ""Part of our historical monuments is related to the Endowment Organization. We have many historical objects and structures in this organization. The Qur'anic section is a special part of the endowment organization, so many of the works considered to be the country's cultural and spiritual heritage are owned by other endowments and organizations.
He added: ""We have begun to renovate the monuments for the participation of the people in the restoration because we have already identified over one million known historical sites and we know the country of Iran, a country. With remarkable history and ancient civilization. So as we move forward, our historical sites become more and more, but our budget is very limited.
The Minister of Cultural Heritage, Tourism and Industries said: As I said, the Endowment Organization has a great part to play in the restoration of historical monuments. Although we have the Blessed Beast and the Imamzadeh as part of the budget line and helped greatly with the restoration of the historic mosques, the Blessed Imamate and the Imamzadeh, we needed to work closely together with the Endowment Organization and be able to play more effective roles. It seems that we should be able to make our museum spaces more accessible to the endowment organization so that these historic objects can be introduced to the noble nation and tourists. So we considered the silence of Prophet Hojat al-Islam as a trophy, and with the knowledge of his special view of the field of cultural heritage, we were able to sign a fully-fledged MOU. We hope that this Memorandum of Understanding will not remain in paper form and will be implemented. However, the previous Memorandum of Understanding was not implemented, but needed revision.
""One of the provisions of the Memorandum is to examine the historical monuments announced by the Endowment Organization to see if they should become national or global registrations,"" he said.


"
