,src,lang,text
0,"











Венесуела висилає всіх дипломатів Сальвадору

03 Nov 2019, 21:57

2 листопада про висилку всіх дипломатів Венесуели оголосив Сальвадор
Венесуела висилає з країни дипломатів Сальвадору: у співробітників дипломатичної місії Сальвадора буде 48 годин, щоб покинути країну.
Про це йдеться у повідомленні на сайті МЗС Венесуели.
У відомстві зазначили, що таке рішення було прийнято «при суворому дотриманні принципу взаємності» - 2 листопада про висилку всіх дипломатів Венесуели оголосив Сальвадор. Їм також надали дві доби для виїзду з країни.
У повідомленні також сказано, що своїм рішенням влада Сальвадору намагається посприяти стратегії США щодо інтервенції до Венесуели. Втім, такий «швидкоплинний фарс не вплине на глибокі й історичні зв'язки», які об'єднують народи обох країн, додали у Каракасі.
У свою чергу Сальвадор пояснив своє рішення тим, що президент країни неодноразово відмовлявся визнавати легітимність уряду Ніколаса Мадуро.
Як повідомлялося, Венесуела в останні роки переживає гостру соціально-економічну кризу, що супроводжується девальвацією національної валюти. Згідно з оцінками ООН, країну залишили вже більше чотирьох мільйонів осіб.
У вересні інфляція у Венесуелі перевищила 3300%.
Також нагадаємо, що президент Мадуро пообіцяв, що економіка Венесуели не залежатиме від нафти. Перед цим США ввели санкції проти родини Мадуро.







",uk,"











Venezuela sends all diplomats to El Salvador

03 Nov 2019, 20:57

On November 2, El Salvador announced the expulsion of all Venezuelan diplomats
Venezuela sends diplomats from El Salvador: El Salvador diplomatic mission staff will have 48 hours to leave the country.
This is stated in the message on the website of the Ministry of Foreign Affairs of Venezuela.
The department noted that such a decision was made ""in strict compliance with the principle of reciprocity"" - on November 2, the expulsion of all Venezuelan diplomats announced El Salvador. They were also given two days to leave the country.
The report also said that by its decision, the authorities of El Salvador are trying to promote the US strategy for intervention in Venezuela. However, such a ""fleeting farce will not affect the deep and historical ties"" that unite the peoples of both countries, added in Caracas.
In turn, El Salvador explained his decision by saying that the country's president has repeatedly refused to recognize the legitimacy of the government of Nicolas Maduro.
In recent years, Venezuela has been experiencing an acute socio-economic crisis, accompanied by the devaluation of the national currency. According to UN estimates, more than four million people have already left the country.
In September, inflation in Venezuela exceeded 3300%.
We also remind that President Maduro has promised that Venezuela's economy will not be dependent on oil. Before that, the US imposed sanctions against the Maduro family.







"
