,src,lang,text
0,"











Бесплатно сдать тест на ВИЧ могут казахстанцы
05 Nov 2019, 10:43 by Али Аманов
Бесплатно пройти экспресс-тест на ВИЧ могут казахстанцы в течение месяца, передает корреспондент Tengrinews.kz. 
В рамках мероприятия, приуроченного ко Всемирному дню борьбы с ВИЧ, во всех регионах страны запускается акция - любой желающий сможет пройти экспресс-тест на ВИЧ.
""В местах наибольшего скопления людей, например в торговых центрах, будут установлены мобильные лаборатории, где каждый желающий сможет сдать слюну для теста на ВИЧ и в течение 15 минут получить результат"", - рассказал директор Казахского научного центра дерматологии и инфекционных заболеваний Бауыржан Байсеркин.
В ходе специальной пресс-конференции Бауржан Байсеркин отметил, что в стране сохраняется устойчивый рост передачи ВИЧ-инфекции половым путем.



""Порядка пяти лет наблюдается тенденция, когда в эпидемиологический процесс вовлечены лица, которые имели половой контакт с ВИЧ-инфицированными инъекционным путем. Вторая проблема - это широкое применение синтетических наркотиков молодыми людьми, которые ведут активную половую жизнь. Во время употребления наркотиков возрастает либидо, что приводит к беспорядочным половым связям без использования презервативов"", - отметил специалист.



Всего в стране проживает более 24 тысяч людей с ВИЧ или СПИДом. За последние 10 лет смертность среди людей, живущих с ВИЧ, сократилась в полтора раза. При этом 80 процентов ЛЖВ умирает от сочетанных с ВИЧ-инфекцией заболеваний, а не от СПИДа. 

Как ВИЧ-положительная алматинка создала семью и родила троих детей

Отметим, что в четыре раза сократилось количество случаев передачи ВИЧ-инфекции от матери ребенку. Беременные женщины при правильном подходе и под наблюдением врачей в 98 процентах рожают здоровых детей.

Ссылки по теме:









",ru,"











Kazakhstan citizens can take an HIV test for free
05 Nov 2019, 10:43 by Ali Amanov
Kazakhstanis can take a rapid HIV test for free within a month, Tengrinews.kz correspondent reports.
As part of the event dedicated to World HIV Day, an action is launched in all regions of the country - anyone can pass an express HIV test.
""Mobile laboratories will be installed in places with the largest concentration of people, for example, in shopping centers, where everyone can give saliva for an HIV test and get a result within 15 minutes,"" said Bauyrzhan Bayserkin, director of the Kazakh Scientific Center for Dermatology and Infectious Diseases.
During a special press conference, Baurzhan Bayserkin noted that there has been a steady increase in sexual transmission of HIV in the country.



“About five years there is a tendency when people who have had sexual contact with HIV-infected people are injected into the epidemiological process. The second problem is the widespread use of synthetic drugs by young people who have an active sex life. During drug use, libido increases, which leads to promiscuous sexual intercourse without the use of condoms, ""said the specialist.



In total, more than 24 thousand people with HIV or AIDS live in the country. Over the past 10 years, mortality among people living with HIV has decreased by one and a half times. At the same time, 80 percent of PLHIV die from diseases associated with HIV infection, and not from AIDS.

How HIV-positive Almaty woman started a family and gave birth to three children

It should be noted that the number of cases of transmission of HIV infection from mother to child was reduced four times. With the right approach and under the supervision of doctors, pregnant women in 98 percent give birth to healthy children.

Related links:









"
