,src,lang,text
0,"











Con gran participación de público se realizó una nueva edición de la Noche de los Museos
05 Nov 2019, 10:07 by El Eco de Tandil

Miles de tandilenses coparon los diferentes espacios incluidos en una nueva edición de la Noche de los Museos, el evento anual consolidado en el calendario cultural tandilense y que permite disfrutar diferentes muestras estáticas, shows musicales, actividades culturales y propuestas gastronómicas.















El Eco


Este año fueron 23 los lugares públicos y privados que abrieron sus puertas hasta la medianoche, con una amplia variedad de ofertas, además del proyecto transposiciones urbanas  que se exhibió en distintas pantallas.
El intendente Miguel Lunghi destacó que “una vez más los tandilenses disfrutamos de una gran noche, plagada de ofertas culturales y expresiones artísticas diversas. Es muy bueno ver que en todos los lugares la gente la está pasando bien, en familia y disfrutando”.
Además celebró el trabajo conjunto en el evento entre el Municipio y los diferentes espacios e instituciones que “permite que el evento continúe creciendo, se sumen más propuestas y los disfruten más familias. Queremos seguir consolidando entre todos una ciudad creativa, innovadora, integrada, diversa y cultural, en este camino este tipo de acciones son un paso fundamental”.
Este año participaron el Museo de Bellas Artes, el Museo del Juguete, el Museo de Arte Religioso, el Museo Histórico Fuerte Independencia, el Museo del Ejército Argentino, el Museo del Vehículo de Época, el Museo del Colegio San José, el Museo de los deportes Tandil, el Museo Malvinas en Gardey, la Escuela de Cerámica, el Instituto Profesorado de Arte 4 Carlos Allende (IPAT),la Escuela de Artes Visuales 1 Vicente Seritti, la Incubadora de Arte, el Centro Cultural La Compañía, la Facultad de Arte, la Biblioteca Rivadavia-Museo del libro, Taller El Suri, Espacio Beirut, Espacio Nido, Galería Artemio, Dalila, el Taller-Espacio Cultural y la Casa de la Cultura.
La subsecretaria de Cultura y Educación, Natalia Correa, también resaltó el éxito de la propuesta y la masiva participación de público. “La Noche de los Museos es un evento fuertemente instalado a nivel mundial y desde hace algunos años Tandil se sumó a la iniciativa con toda la fuerza creativa de nuestros artistas, año tras año vemos como crece y esperemos en las próximas ediciones se puedan agregar más espacios y propuestas”.
“Estas son las primeras actividades de la temporada de primavera y verano, que estaremos lanzando en pocas semanas y que como ya es habitual, tendrá un gran variedad de ciclos y eventos culturales de acceso gratuito para que podamos disfrutar todos los tandilenses”, indicó.


",es,"











A new edition of Museum Night was held with great public participation
05 Nov 2019, 10:07 by El Eco de Tandil

Thousands of locals took over the different spaces included in a new edition of the Night of the Museums, the annual event consolidated in the Tandilense cultural calendar and that allows you to enjoy different static samples, musical shows, cultural activities and gastronomic proposals.















The Echo


This year there were 23 public and private places that opened until midnight, with a wide variety of offers, in addition to the urban transpositions project that was exhibited on different screens.
The mayor Miguel Lunghi stressed that “once again we people from Guadalajara enjoy a great night, full of cultural offers and diverse artistic expressions. It is very good to see that in all places people are having a good time, with family and enjoying ”.
He also celebrated the joint work in the event between the Municipality and the different spaces and institutions that “allows the event to continue growing, more proposals are added and more families enjoy them. We want to continue consolidating a creative, innovative, integrated, diverse and cultural city together, in this way these types of actions are a fundamental step ”.
This year the Museum of Fine Arts, the Toy Museum, the Museum of Religious Art, the Fort Independencia Historical Museum, the Argentine Army Museum, the Vintage Vehicle Museum, the San José College Museum, the Museum of the Arts participated Tandil sports, the Malvinas Museum in Gardey, the School of Ceramics, the Art Teaching Institute 4 Carlos Allende (IPAT), the School of Visual Arts 1 Vicente Seritti, the Incubator of Art, the Cultural Center The Company, the Faculty of Art , the Rivadavia Library-Museum of the book, El Suri Workshop, Beirut Space, Nido Space, Artemio Gallery, Delilah, the Workshop-Cultural Space and the House of Culture.
The Undersecretary of Culture and Education, Natalia Correa, also highlighted the success of the proposal and the massive participation of the public. “The Night of the Museums is an event strongly installed worldwide and for some years Tandil joined the initiative with all the creative force of our artists, year after year we see how it grows and hopefully in the next editions more can be added spaces and proposals ”.
""These are the first activities of the spring and summer season, which we will be launching in a few weeks and as usual, will have a wide variety of cycles and cultural events for free access so we can enjoy all Tandilenses,"" he said.


"
