,src,lang,text
0,"











Průzkum: Volby by vyhrálo ANO před Piráty, levice zastavila propad
05 Nov 2019, 10:14 by ČTK
""ANO dominuje politické scéně a jeho postavení je stabilní,"" uvedli autoři průzkumu. Říjnový výsledek hnutí premiéra Andreje Babiše je mírně lepší než 32,5 procenta v předchozím průzkumu STEM z června.




Průzkum: ANO si v říjnu polepšilo, podpora SPD klesla pod pět procent Přečíst článek ›

Piráti si proti červnu pohoršili z 15,6 procenta na říjnových 12,2 procenta, možný zisk občanských demokratů se snížil na 10,5 procenta z 13,1 procenta v červnu. Podle STEM je podpora Pirátů kolísavá, ODS ve srovnání s červnem hypoteticky ztratila ve Sněmovně pět míst.
Levice mírně posílila 
""Levice naopak mírně posílila a zastavila tak svůj propad,"" uvedli autoři průzkumu. Komunisté na čtvrtém místě si proti červnu polepšili ze 7,8 na 8,4 procenta. Sociální demokraté by v říjnu získali 6,5 procenta, tedy o desetinu procentního bodu víc než v červnu.
SPD mírně ztratila na 7,5 procenta ze 7,9 procenta v červnu. Lidovci by dostali 5,6 procenta, v červnovém volebním modelu STEM to bylo o desetinu procentního bodu méně. Lehce nahoru šla také podpora TOP 09 z červnových 3,7 procenta na 4,4 procenta v říjnu a stejně i STAN z červnových 3,8 procenta na aktuálních 4,3 procenta. Trikolóra by v říjnu dostala 4,2 procenta. Zisk dalších stran by nepřesáhl dvě procenta.




Říjnové volby by s velkým náskokem vyhrálo ANO. Levicové strany posilují Přečíst článek ›

Říjnový volební model odráží nerozhodnost a váhání voličů, je postaven na předpokladu spíše nižší volební účasti kolem 57 procent, uvedl STEM. Průzkum zjistil, že k volbám by v říjnu šlo 60 procent dotázaných, zúčastnit se nechce 23 procent a rozhodnuto není 17 procent. ""Volební motivace se oproti červnu o něco zlepšila,"" doplnili autoři průzkumu, ve kterém mezi 11. a 25. říjnem odpovídalo 1002 lidí.


",cs,"











Survey: The elections would win YES in front of the Pirates, the left stopped the plunge
05 Nov 2019, 10:14 by CTK
""YES dominates the political scene and its position is stable,"" the authors said. The October outcome of Prime Minister Andrej Babiš's movement is slightly better than 32.5 percent in a June STEM poll.




Survey: YES improved in October, SPD support fell below five percent Read article ›

Pirates have been down from June 15.6 percent to 12.2 percent in October, the possible profit of the Civic Democrats decreased to 10.5 percent from 13.1 percent in June. According to STEM, the support of the Pirates is volatile, the ODS has hypothetically lost five seats in the House compared to June.
The left strengthened slightly
""The left, on the other hand, slightly strengthened and halted its fall,"" the authors said. Communists in fourth place compared to June improved from 7.8 to 8.4 percent. The Social Democrats would gain 6.5 percent in October, a tenth of a percentage point more than in June.
The SPD lost slightly to 7.5 percent from 7.9 percent in June. The Christian Democrats would get 5.6 percent, in the June STEM election model it was one tenth of a percentage point less. The TOP 09 support also went slightly up from 3.7 percent in June to 4.4 percent in October, as did STAN from 3.8 percent in June to the current 4.3 percent. The tricolor would get 4.2 percent in October. The profit of the other parties would not exceed two percent.




The October elections would have won YES by a large margin. Left-wing parties strengthen Read article ›

The October election model reflects the indecision and hesitation of voters, based on the assumption of a rather lower turnout of around 57 percent, STEM said. The survey found that 60 percent of the respondents would vote in October, 23 percent did not want to vote, and 17 percent were not decided. ""The electoral motivation improved somewhat compared to June,"" added the authors of the survey, in which between 10 and 25 October responded 1002 people.


"
