,src,lang,text
0,"











Ткаченко заселился в дом на Труханов после расследования 1+1 о незаконности застройки острова — Bihus.info
Нардеп и экс-гендиректор 1+1 Александр Ткаченко заселился в арендованный дом на Трухановом острове в Киеве после расследования телеканала о незаконной застройке местности, говорится в материале журналистов Bihus.info.

05 Nov 2019, 10:07

Отмечается, что расследование на телеканале 1+1 вышло в 2015 году, а уже в 2016 году в соцсетях Ткаченко и его жены Анны начали появляться фото, сделанные на территории особняка.
С 2017 года такие фото начали появляться регулярно.


Фото: bihus.info

Отмечается, что по документам дом значится административным зданием и находится в частной собственности Дениса Копылова — совладельца ООО Учебно-спортивный клуб Украина. Он подтвердил Bihus.Info, что сдает нардепу дом в аренду.
Сам Ткаченко уверяет, что арендует дом только с весны 2019 года.



Ранее журналисты Bihus.info опубликовали материал о том, что Ткаченко не указал в декларации дом в природоохранной зоне на Трухановом острове.
Позже он заявил, что укажет дом в декларации в следующем году.


",ru,"











Tkachenko settled in a house on Trukhanov after an investigation of 1 + 1 on the illegality of building the island - Bihus.info
The people's deputy and the ex-general director 1 + 1 Alexander Tkachenko settled in a rented house on Trukhanovy island in Kiev after an investigation by the television channel about the illegal development of the area, according to a Bihus.info reporter.

05 Nov 2019, 10:07

It is noted that the investigation on the 1 + 1 TV channel was released in 2015, and already in 2016 in social networks Tkachenko and his wife Anna began to appear photos taken on the territory of the mansion.
Since 2017, such photos began to appear regularly.


Photo: bihus.info

It is noted that according to the documents, the house is listed as an administrative building and is privately owned by Denis Kopylov - co-owner of the Training and Sports Club Ukraine LLC. He confirmed to Bihus.Info that he is renting a house to the people's deputy.
Tkachenko himself assures that he rents a house only in the spring of 2019.



Earlier, Bihus.info reporters published material that Tkachenko did not indicate in the declaration a house in the conservation zone on Trukhanov Island.
He later stated that he would indicate the house in a declaration next year.


"
