,src,lang,text
0,"











Фальшивомонетчики попали на видео в момент сбыта купюр в Ингушетии
03 Nov 2019, 11:50 by Яна Багдадян

Сотрудники полиции просят всех, кто узнал злоумышленников, обратиться в правоохранительные органы

Магас, 3 ноября. Сотрудники полиции Республики Ингушетия опубликовали видео, на котором два парня пытаются сбыть поддельные купюры. Само преступление произошло еще летом в магазине по улице Свердлова в городе Сунжа. Парней ищут до сих пор.
- Двое молодых людей купили товар и дали продавщице поддельную купюру. Сотрудница магазина ничего не заподозрила, и парни ушли, но попали в объективы камер наблюдения, - сообщили «Регион online» в пресс-службе ГУ МВД по Республике Ингушетия.
Правоохранительные органы просят всех, кто знает этих людей или видел их, сообщить в полицию. Звонить следует по телефонам: 8 (8734) 55-01-54, 55-04-99 либо 02.
Самим подозреваемым настоятельно рекомендуют сдаться добровольно. Это сочтется при установлении степени вины и вынесении приговора.
Ранее «Регион online» сообщал, что правоохранители нашли у жителя Карабулака в Республике Ингушетия наркотики. Парень разъезжал с запрещенными веществами в машине друга.



Читайте нас в    News


",ru,"











Counterfeiters hit the video at the time of selling bills in Ingushetia
03 Nov 2019, 11:50 by Yana Baghdadyan

Police officers ask all who recognize the attackers to contact law enforcement

Magas, November 3. Police officers of the Republic of Ingushetia published a video in which two guys try to sell fake banknotes. The crime itself occurred in the summer in a store on Sverdlov Street in the city of Sunzha. Guys are still looking.
- Two young people bought the goods and gave the saleswoman a fake bill. The store employee didn’t suspect anything, and the guys left, but fell into the lenses of the surveillance cameras, - Region Online reported in the press service of the Main Directorate of the Ministry of Internal Affairs for the Republic of Ingushetia.
Law enforcement agencies are asking everyone who knows these people or saw them to report to the police. Call should be by phone: 8 (8734) 55-01-54, 55-04-99 or 02.
The suspects themselves are urged to surrender voluntarily. This shall be considered in determining the degree of guilt and sentencing.
Earlier, Region Online reported that law enforcement officers found drugs from a resident of Karabulak in the Republic of Ingushetia. A guy was driving around with forbidden substances in a friend's car.



Read us on News


"
