,src,lang,text
0,"











Простой унитаз вызывает атеросклероз и геморрой: Врачи признали опасность традиционных туалетов
03 Nov 2019, 11:28 by Дмитрий Романов
Неестественное давление ободка нарушает кровоток ягодиц.



Если долго сидеть на унитазе, то сами ягодицы расслабляются, а выход калла продолжается. Это приводит к развитию геморроя.
У человека имеются все необходимые мышцы для здоровой жизни, однако с приходом унитаза некоторые ягодичные мышцы больше не задействуются, и в итоге атрофируются.
Атрофированная мышца более не поддерживает прямую кишку и при давлении она может вывалиться. Особенно сильно это проявляется во время запоров, когда давление увеличивается, а сопротивление мышц ягодиц не даёт нужных результатов. Такая процедура чаще всего приводит к проявлению геморроя. Эта болезнь с каждым разом только усугубляется, и нуждается в непосредственном лечении.
Также, неестественное давление ободка на ягодицы сильно нарушает кровоток, который с длительностью нахождения только ухудшается. При длительном сидении на унитазе можно почувствовать, как немеют ноги, это свидетельство передавленной артерии бедра, которая является ключевым поставщиком крови в нижнюю часть тела. Нарушение состояния артерий вызывает атеросклероз, который в дальнейшем будет только усиливаться и влиять не только на ноги, но и всю половую систему. Из-за этого врачи признали опасность традиционных туалетов для человеческого зада.
Таким образом, простой унитаз вызывает атеросклероз и геморрой, а люди, как ни в чём не бывало продолжают им пользоваться. Вредная привычка прививается ещё с младших лет, однако такой туалет был не всегда.



В советское время были сильно распространены напольные унитазы (или чаша «Генуя»), которые при использовании повторяли естественную позу для испражнения. Эксперты считают, что при позе «на корточках» риск получения травм значительно ниже. Помимо этого, срок службы такого туалета значительно выше, а польза несопоставима.


",ru,"











A simple toilet causes atherosclerosis and hemorrhoids: Doctors have recognized the dangers of traditional toilets
03 Nov 2019, 11:28 by Dmitry Romanov
An unnatural rim pressure disturbs the blood flow of the buttocks.



If you sit on the toilet for a long time, then the buttocks themselves relax, and the calla yield continues. This leads to the development of hemorrhoids.
A person has all the necessary muscles for a healthy life, but with the advent of the toilet some gluteal muscles are no longer involved, and eventually atrophy.
An atrophied muscle no longer supports the rectum and may fall out under pressure. This is especially pronounced during constipation, when the pressure increases, and the resistance of the muscles of the buttocks does not give the desired results. This procedure most often leads to the manifestation of hemorrhoids. This disease is only aggravated each time, and needs immediate treatment.
Also, the unnatural pressure of the rim on the buttocks greatly disrupts the blood flow, which only worsens with the length of stay. With prolonged sitting on the toilet you can feel the legs go numb, this is evidence of the transmitted femoral artery, which is a key supplier of blood to the lower body. Violation of the condition of the arteries causes atherosclerosis, which in the future will only increase and affect not only the legs, but the entire reproductive system. Because of this, doctors have recognized the dangers of traditional toilets for the human butt.
Thus, a simple toilet causes atherosclerosis and hemorrhoids, and people, as if nothing had happened, continue to use it. A bad habit is instilled from a young age, however, such a toilet was not always.



In Soviet times, floor toilets (or the Genoa bowl) were very common, which when used repeated the natural posture for bowel movement. Experts believe that with a squatting pose, the risk of injury is significantly lower. In addition, the service life of such a toilet is much higher, and the benefits are not comparable.


"
