,src,lang,text
0,"











Элина Свитолина проиграла первой «ракетке» мира Эшли Барти в финале Итогового турнира года WTA

03 Nov 2019, 18:22


Украинке Элине Свитолиной не удалось выиграть Итоговый турнир 2019 года Женской теннисной ассоциации (WTA), который сегодня, 3 ноября, завершился в китайском Шэньчжэне. В финале 25-летняя украинка уступила первой «ракетке» мира австралийке Эшли Барти в двух сетах со счетом 4:6, 3:6.

Как сообщает btu.org.ua, на протяжении двух сетов всего теннисистки провели на корте полтора часа. В первой партии теннисистки провели восемь геймов, не заработав ни одного брейк-пойнта. В девятом гейме Свитолиной не удалось воспользоваться скрытым сетболом, после чего завязалась борьба уже на подаче украинки. Элина ушла с двух сетболов соперницы, но с третьего брейк-пойнта проиграла гейм на своей подаче.
На старте второго сета Свитолина впервые вышла вперед в этом матче (2:1), но Барти ответила обратным брейком. Австралийка продолжила успешную серию и повела 4:2.
На этот раз уже Свитолина выполнила обратный брейк, сократив отставание от соперницы. Еще один гейм на подаче украинки получился затяжным: Элина ушла с двойного брейк-поинта, но Эшли воспользовалась своим третьим шансом. Барт и«под ноль» выиграла гейм на подаче, чтобы оформить свой четвертый титул в этом году.
Для теннисисток это был шестой очный поединок. В прошлых пяти матчах победу праздновала Свитолина, а Барти удалось у них выиграть лишь два сета.



Беспроигрышная серия Свитолиной на кортах WTA Finals насчитывала 10 матчей (2017 – Симона Халеп; 2018 – Петра Квитова, Каролина Плишкова, Каролин Возняцки, Кики Бертенс, Слоан Стивенс; 2019 – Каролина Плишкова, Симона Халеп, София Кенинов, Белинда Бенчич).
За последние 20 лет как минимум два раза подряд в финалах играли: Мартина Хингис (финал-1999 / титул-2000), Серена Уильямс (титул-2001 / финал-2002), Ким Клийстерс (титул-2002 / титул-2003), Амели Моресмо (титул-2005 / финал-2006), Жюстин Энен (титул-2006 / титул-2007), Винус Уильямс (титул-2008 / финал-2009), Серена Уильямс (титул-2012 / титул-2013 / титул 2014).
За всю историю соревнований (с 1972 года) свой титул на Итоговом чемпионате защищали Крис Эверт (1972/1973), Мартина Навратилова (1978/1979; 1983/1986), Моника Селеш (1990/1992), Штеффи Граф (1995/1996), а также уже упомянутые выше Ким Клийстерс, Жюстин Энен и Серена Уильямс.
25-летняя украинка Элина Свитолина могла стать десятой теннисисткой, на счету которой как минимум два трофея Итогового чемпионата (Мартина Навратилова – восемь, Штеффи Граф – пять, Серена Уильямс – пять, Крис Эверт – четыре, Ким Клийстерс – три, Ивонн Гулагонг Коули – два, Габриэла Сабатини – два, Мартина Хингис – два, Жюстин Энен – два).

читайте также







",ru,"











Elina Svitolina lost to the first “racket” of the world Ashley Barty in the final of the WTA Final tournament of the year

03 Nov 2019, 18:22


Ukrainian Elina Svitolina failed to win the 2019 Women's Tennis Association (WTA) Final Tournament, which ended today in November 3 in Shenzhen, China. In the final, the 25-year-old Ukrainian lost to the first “racket” of the world to Australian Ashley Barty in two sets with a score of 4: 6, 3: 6.

According to btu.org.ua, during two sets all tennis players spent an hour and a half on the court. In the first game, the tennis players played eight games without earning a single break point. In the ninth game, Svitolina failed to use the hidden setball, after which a fight ensued already on the pitch of the Ukrainian. Elina left two rival setballs, but from the third break point she lost the game on her serve.
At the start of the second set, Svitolina first came forward in this match (2: 1), but Barty responded with a reverse break. The Australian continued the successful series and led 4: 2.
This time, Svitolina completed the reverse break, reducing the gap from the opponent. Another game on the pitch of the Ukrainian turned out to be protracted: Elina left the double break point, but Ashley took her third chance. Bart and “under zero” won the game on the pitch to issue his fourth title this year.
For tennis players it was the sixth full-time duel. In the last five matches, Svitolina celebrated the victory, and Barty managed to win only two sets against them.



The win-win series of Svitolina on the WTA Finals courts totaled 10 matches (2017 - Simona Halep; 2018 - Petra Kvitova, Karolina Plishkova, Caroline Wozniacki, Kiki Bertens, Sloan Stevens; 2019 - Karolina Plishkova, Simone Halep, Sofia Keninov, Belinda Benchich).
Over the past 20 years, at least two consecutive finals in the finals have played: Martina Hingis (1999 finals / 2000 title), Serena Williams (2001 title / 2002 final), Kim Clijsters (2002 title / 2003 title), Amelie Moresmo (title-2005 / final-2006), Justine Henin (title-2006 / title-2007), Venus Williams (title-2008 / final-2009), Serena Williams (title-2012 / title-2013 / title 2014).
Throughout the history of the competition (since 1972), his title at the Final Championship was defended by Chris Evert (1972/1973), Martina Navratilova (1978/1979; 1983/1986), Monica Seles (1990/1992), Steffi Graf (1995/1996) as well as the aforementioned Kim Clijsters, Justin Henin and Serena Williams.
25-year-old Ukrainian Elina Svitolina could become the tenth tennis player who has at least two trophies in the Final Championship (Martina Navratilova - eight, Steffi Graf - five, Serena Williams - five, Chris Evert - four, Kim Clijsters - three, Yvonne Gulagong Cowley - two, Gabriela Sabatini - two, Martina Hingis - two, Justin Henin - two).

read also







"
