,src,lang,text
0,"











EEUU notifica formalmente a la ONU su retiro del Acuerdo de París sobre el clima
05 Nov 2019, 06:45 by AFP

Estados Unidos comunicó formalmente este lunes a la ONU su retiro del Acuerdo de París sobre el clima, decidido por el presidente Donald Trump en 2017.

Esta etapa clave, que no podía tener lugar antes en razón de una cláusula inscrita en el texto, inicia un lapso de un año para que Washington pueda efectivamente concretar su salida, con lo que la mayor economía del mundo se convirtió en el único país que se retiró del pacto.
""Hoy, Estados Unidos inicia el proceso de retiro de los acuerdos de París. Conforme a los términos del acuerdo, Estados Unidos sometió una notificación formal de su retiro a las Naciones Unidas. El retiro será efectivo un año después de la notificación"", declaró el secretario de Estado, Mike Pompeo.
La partida tendrá lugar no antes del 4 de noviembre de 2020, es decir, al día siguiente de la elección presidencial estadounidense, en la que Trump aspira a un segundo mandato.
Pompeo invocó nuevamente ""la injusta carga económica impuesta a los trabajadores, corporaciones y contribuyentes estadounidenses por los compromisos asumidos por Estados Unidos en virtud del acuerdo"".
Al presentar a Estados Unidos como un buen alumno en la lucha contra las emisiones de gases de efecto invernadero, prometió que Washington continuaría ""proponiendo un modelo realista y pragmático en las conversaciones internacionales sobre el clima"".
""Continuaremos trabajando con nuestros socios internacionales para crear resiliencia a los impactos del cambio climático"", dijo Pompeo.
""Como en el pasado, Estados Unidos continuará promoviendo la investigación, la innovación y el crecimiento económico mientras reduce las emisiones y se comunica con (sus) amigos y socios en todo el mundo"", señaló.
Luego Pompeo volvió sobre el tema al declarar a la cadena Fox Business que ""era Estados Unidos que iba a sufrir con un chaleco de fuerza"" debido a los estrictos compromisos ambientales.
Horas después de esos pronunciamientos, Francia, a través de un comunicado de su presidencia, afirmó que ""lamenta"" que Estados Unidos oficializara su salida del acuerdo.
La notificación de Washington el lunes fue ""un elemento de procedimiento que se esperaba"". Sin embargo, ""lo lamentamos y esto hace todavía más necesaria la asociación franco-china sobre el clima y la biodiversidad"", indicó la nota, en momentos en que el presidente Emmanuel Macron visita China, el mayor emisor mundial de gases de efecto invernadero responsabilizados por el cambio climático.

- Elecciones -

Las ONG y los expertos, por su parte, denunciaron el egoísmo del segundo país que más emite gases de efecto invernadero, mientras que China se mantiene en el pacto.
""El abandono del Acuerdo de París es una abdicación de liderazgo a la cual se oponen la mayoría de los estadounidenses"", declaró Michael Bloomberg, un exalcalde de Nueva York que financia una gran campaña a favor de cerrar las centrales a carbón y contra los candidatos que se oponen a las acciones a favor del medioambiente.
La decisión de Trump no creó sin embargo el efecto dominó que muchos temían en países como Australia y Brasil. En cambio, llevó a muchos actores no federales en Estados Unidos a comprometerse con el medioambiente, desde el Partido Demócrata hasta grandes ciudades y empresas privadas.
Muchas entidades se comprometieron voluntariamente a lograr un balance de carbono neutro antes de 2050 o pasar a un sistema que esté 100% basado en las energías renovables.
Finalmente, el Acuerdo de París no ha sucumbido y además ha sido reforzado por las movilizaciones globales de jóvenes que se iniciaron hace un año.
En cambio, el resultado de las elecciones de 2020 en Estados Unidos si podría ser más determinante. ""Si hay otro gobierno de Trump por cuatro años, las consecuencias van a ser muy, pero muy diferentes"", dijo a la AFP David Levaï, del centro de estudios Iddri.
Todos los precandidatos demócratas que buscan enfrentar a Trump en las elecciones se comprometieron a volver al pacto, lo que podrían hacer si alguno llega a la Casa Blanca el 20 de enero de 2021.
""Esta decisión es un insulto para la humanidad y una vergüenza para nuestro país"", dijo el Comité Nacional del Partido Demócrata.


",es,"











The US formally notifies the UN of its withdrawal from the Paris Agreement on the climate
05 Nov 2019, 06:45 by AFP

The United States formally communicated to the UN on Monday its withdrawal from the Paris Agreement on climate, decided by President Donald Trump in 2017.

This key stage, which could not take place before due to a clause inscribed in the text, begins a period of one year so that Washington can effectively finalize its exit, so that the world's largest economy became the only country that He withdrew from the pact.
""Today, the United States begins the process of withdrawing the Paris agreements. Under the terms of the agreement, the United States submitted a formal notification of its withdrawal to the United Nations. The withdrawal will be effective one year after the notification,"" he said. Secretary of State Mike Pompeo.
The game will take place not before November 4, 2020, that is, the day after the US presidential election, in which Trump aspires to a second term.
Pompeo again invoked ""the unfair economic burden imposed on US workers, corporations and taxpayers for the commitments made by the United States under the agreement.""
By presenting the United States as a good student in the fight against greenhouse gas emissions, he promised that Washington would continue to ""propose a realistic and pragmatic model in international climate talks.""
""We will continue to work with our international partners to build resilience to the impacts of climate change,"" said Pompeo.
""As in the past, the United States will continue to promote research, innovation and economic growth while reducing emissions and communicating with (your) friends and partners worldwide,"" he said.
Then Pompeo returned to the subject by declaring to the Fox Business chain that ""it was the United States that was going to suffer with a force vest"" due to strict environmental commitments.
Hours after those pronouncements, France, through a statement from its presidency, said it ""regrets"" that the United States formalized its exit from the agreement.
Washington's notification on Monday was ""an expected procedural element."" However, ""we are sorry and this makes the Franco-Chinese association on climate and biodiversity even more necessary,"" said the note, at a time when President Emmanuel Macron visits China, the world's largest emitter of responsible greenhouse gases for climate change

- Elections -

NGOs and experts, for their part, denounced the selfishness of the second country that emits most greenhouse gases, while China remains in the pact.
""The abandonment of the Paris Agreement is an abdication of leadership that most Americans oppose,"" said Michael Bloomberg, a former New York mayor who funds a major campaign in favor of shutting down coal plants and against candidates that oppose actions in favor of the environment.
Trump's decision did not, however, create the domino effect that many feared in countries like Australia and Brazil. Instead, it led many non-federal actors in the United States to commit to the environment, from the Democratic Party to large cities and private companies.
Many entities voluntarily committed themselves to achieving a neutral carbon balance before 2050 or moving to a system that is 100% based on renewable energy.
Finally, the Paris Agreement has not succumbed and has also been reinforced by the global mobilizations of young people that began a year ago.
Instead, the result of the 2020 elections in the United States could be more decisive. ""If there is another Trump administration for four years, the consequences will be very, very different,"" David Levaï of the Iddri study center told AFP.
All Democratic candidates seeking to confront Trump in the elections pledged to return to the pact, which they could do if anyone arrives at the White House on January 20, 2021.
""This decision is an insult to humanity and a shame to our country,"" said the National Committee of the Democratic Party.


"
