,src,lang,text
0,"











روایت پایگاه خبری لبنانی از چرایی هدف قراردادن پهبادهای اسراییلی از سوی حزب الله

05 Nov 2019, 06:30

پایگاه خبری العهد لبنان در گزارشی نوشت که پس از حمله به پهپاد جاسوسی صهیونیستی در جنوب لبنان توسط حزب‌الله٬ چندین سوال مطرح شده است. اول اینکه چرا حزب‌الله اکنون و در این زمان پهپادهای جاسوسی دشمن را مورد هدف قرار می‌دهد؟ سوال دوم این است که آیا ارتباطی میان این اتفاق و تحولات اخیر لبنان وجود دارد و اینکه حزب‌الله قصد دارد چه پیامی به دشمن صهیونیستی بدهد؟
به گزارش الف نویسنده پایگاه خبری فوق در ادامه مطلب خود به این پرسش ها پاسخ داده است:« با توجه به این مطالب٬ می‌توان گزینه‌هایی را که موجب عقب‌نشینی رژیم صهیونیستی از پاسخ به این اقدام حزب‌الله شده٬ تخمین زد.
همانطور که در بیانیه مقاومت اسلامی آمده است٬ سید حسن نصرالله مورد هدف قراردادن هواپیماهای جاسوسی دشمن با یک سلاح مناسب که طبق محاسبات ارتش صهیونیستی٬ این حمله با یک موشک زمین به هوا بوده است٬ در راستای ماموریت‌های عادی و معمول مقاومت است.
در واقع باید بگوییم مقاومت که همواره با تجاوز زمینی دشمن به خاک لبنان مقابله کرده و در برابر فشارهای صهیونیست‌ها بر کشور از طریق محاصره دریایی ایستادگی می‌کند؛ لذا کاملا طبیعی است که در برابر نقض حریم هوایی لبنان توسط صهیونیست‌ها واکنش نشان دهد، به‌ ویژه که دشمن با این اقدامات به دنبال جاسوسی از مقاومت و عرصه داخلی لبنان است.
به طور طبیعی اقدامات مقاومت در این خصوص٬ در درجه اول مرتبط با توانایی‌های آن است که امکان انجام چنین عملیات‌هایی را به آن می‌دهد. اما این اقدامات از سوی دیگر به این مسئله برمی‌گردد که ممکن است مردم لبنان در سایه مشغله‌های مربوط به تحولات اخیر این کشور٬ فراموش کنند که دشمن صهیونیستی به دنبال تغییر معادله در لبنان است. این امر٬ پس از تجاوز صهیونیست‌ها به ضاحیه جنوبی بیروت و اظهارات آویو کوخافی رئیس ستاد ارتش رژیم صهیونیستی مبنی بر تغییر معادله در مقابله با حزب‌الله مشخص شد.
البته در همین راستا کاملا روشن است که اقدام حزب‌الله ضد پهپاد صهیونیستی در جنوب لبنان٬ هیچ ارتباطی با تحولات داخلی لبنان ندارد. همچنین این موضوع٬ مسئله‌ای است که دبیرکل حزب‌الله به آن اشاره و تاکید کرد که موضوع مقاومت کاملا جدا از تحولات داخلی لبنان است و این دو مسئله‌ هیچ ارتباطی به هم ندارند٬ قابل توجه است که این اقدام مقاومت همچنین محاسبات رژیم صهیونیستی را مبنی بر اینکه تحولات داخلی لبنان٬ ابتکار عمل حزب‌الله را محدود می‌کند٬ به هم ریخت.
مقاومت لبنان در مقابله با رژیم صهیونیستی یک واقعیت پایدار است و از هرگونه اتفاق و تحولی جدا بوده و هرگز نه خود را درگیر آن می‌کند و نه تحت تاثیر آن قرار می‌گیرد.
باید اشاره کنیم که محاسبات رژیم صهیونیستی تنها در حد حدس و گمان نبود؛ بلکه یوسی میلمان تحلیلگر امور امنیتی صهیونیست‌ها به نقل از آویو کوخافی رئيس ستاد ارتش رژیم صهیونیستی ادعا کرد که حزب‌الله پس از ۱۷ اکتبر سال جاری درگیر تظاهرات‌های مردمی لبنان است. لذا مهم‌ترین پیام اقدام اخیر حزب‌الله ضد پهپاد جاسوسی صهیونیستی این بود که نشان داد چنین عملیات‌هایی همچنان ادامه خواهد داشت؛ سید حسن نصرالله نیزدر همین راستا تاکید کرد که در همین مسیر باقی می‌مانیم.
همچنین دبیرکل حزب‌الله تصریح کرد که هدف اصلی ما تنها سرنگون کردن این پهپادها نیست٬ بلکه هدفمان مقابله با نقض حریم هوایی لبنان توسط دشمن است. سید نصرالله خاطرنشان کرد که اگر بتوانیم این پهپادها را ساقط کنیم خوب است؛ اما اگر هم نتوانیم آنها را سرنگون کنیم٬ قطعا آنها را از آسمان کشور دور کرده و حاکمیت و امنیت مقاومت و نیز کشور را حفظ می‌کنیم که هدف اصلی ما همین است.
پیام دیگر اقدام اخیر حزب‌الله ضد پهپاد جاسوسی صهیونیست‌ها در جنوب لبنان٬ مربوط به عامل بازدارندگی بود که سید حسن نصرالله در این خصوص خاطرنشان کرد که دشمن سکوت کرده والبته حق هم دارد در این مرحله سکوت کند. دشمن صهیونیستی گمان می‌کرد که مقاومت جرأت استفاده از این سلاح را ندارد، درصورتی که با استفاده از این سلاح در مورد هدف قرار دادن پهپاد جاسوسی دشمن٬ ثابت کرد که جسارت استفاده از آن را داشته و به همه وعده‌ها و تصمیم‌ها در حمایت از کشور و حفظ حاکمیت مقاومت پایبند است.
همچنین این اتفاق٬ همه محاسبات رژیم صهیونیستی در خصوص تاثیر پیام‌‌‌های تهدیدآمیز آن ضد مقاومت را به هم ریخته و قطعا این مفهوم به نهاد تصمیم‌گیری سیاسی و امنیتی در تل‌آویو نیز خواهد رسید.
واضح است که ممانعت دشمن از پاسخ به پیام بازدارندگی مقاومت٬ اتفاقی نبوده است. صهیونیست‌ها در نتیجه این حمله دریافتند که هرگونه اقدامی در خصوص نقض حریم هوایی لبنان٬ با پاسخ مقاومت مواجه خواهد شد و به همین دلیل بود که دشمن برای جلوگیری از تکرار چنین اقدامی از سوی حزب‌الله٬ هیچ واکنشی نشان نداد.
البته در همین راستا باید اشاره کنیم که صهیونیست‌ها در خصوص تحقیق درباره نوع موشکی که حزب‌الله توسط آن٬ پهپاد صهیونیستی را مورد هدف قرار داد، دچار سردرگمی و نگرانی شده‌اند. این حالت را می‌توان به خوبی در واکنش رسانه‌های آن نسبت به این اتفاق مشاهده کرد.
برای مثال روزنامه اسرائيل‌الیوم با اشاره به تغییر سیاست‌های حزب‌الله که در پرتاب یک موشک به سمت پهپاد صهیونیستی در روز پنجشنه گذشته در جنوب لبنان منعکس شد٬ تاکید کرد که إسرائيل باید در ارزیابی سیاست‌های خود در منطقه تجدید نظر کند.
طبق گزارش‌های این روزنامه٬ رژیم صهیونیستی به این نتیجه رسیده که سیدحسن نصرالله دبیرکل حزب‌الله این بار در عملی کردن تهدیدهایش بسیار جدی و قاطع است.
این روزنامه اشاره کرد که حزب‌الله در خصوص نوع سلاحی که پهپاد صهیونیستی را هدف قرار داد چیزی نگفته است؛ در حالی‌ که طبق اطلاعات چندین گزارش از سوی صهیونیست‌ها٬ این یک موشک از نوع استرلا بوده است.
روزنامه اسرائيل‌الیوم نتیجه گیری کرد که حزب‌الله در راستای تلاش برای ایجاد موازنه‌ های بازدارندگی جدید در مقابل ارتش صهیونیستی سیاست‌های خود را تغییر داده است.»


",fa,"











Lebanese news site narrates why Hezbollah targets Israeli drones

05 Nov 2019, 06:30

Lebanon's al-Ahd news agency wrote in a report that several questions have been raised by Hezbollah since the Zionist espionage attack in southern Lebanon. First, why is Hezbollah targeting enemy spy drones now and at this time? The second question is whether there is a connection between this and the recent developments in Lebanon and what message does Hezbollah intend to give to the Zionist enemy?
According to the author of the aforementioned newsletter, the following answers to these questions: ""With this in mind, one can estimate the options that led the Zionist regime to withdraw from this Hezbollah response.
As stated in the Islamic Resistance Statement, Sayyed Hassan Nasrallah is targeting enemy spy planes with a suitable weapon, which is calculated by the Zionist Army to launch an attack with a ground-to-air missile, in line with routine resistance missions.
In fact, it must be said that the resistance, which has always resisted enemy ground invasion and is resisting the Zionist pressure on the country through sea blockade, so it is quite natural to respond to the Zionist violations of Lebanese airspace, especially that The enemy seeks to spy on Lebanon's internal resistance and arena.
Naturally, resistance measures in this regard are primarily related to its capability to enable such operations. But these actions, on the other hand, are due to the fact that the Lebanese people may forget, in the wake of recent developments in the country, that the Zionist enemy is seeking to change the equation in Lebanon. This came to light after the Zionist invasion of southern Beirut and the statements of Zionist Army Chief of Staff Aviv Kukhafi that the equation was changed to counter Hezbollah.
Of course, it is quite clear that Hezbollah's anti-Zionist activity in southern Lebanon has nothing to do with Lebanese internal developments. It is also a matter that the Hezbollah Secretary General has pointed out and emphasized that the issue of resistance is completely separate from Lebanon's internal developments and that these two issues have nothing to do with each other. It is noteworthy that the resistance measure also calculates the Zionist regime's Lebanese internal developments are limiting Hezbollah's initiative.
The Lebanese resistance to the Zionist regime is a lasting reality, separate from any developments and never involved or affected by it.
It should be noted that the calculations of the Zionist regime were not only speculative, but also Yusufi Milman, Zionist security analyst, quoted Zionist Army Chief of Staff Aviv Kukhafi as claiming that Hezbollah was dead after the October 5 attacks. So the most important message of Hezbollah's latest Zionist espionage move was to show that such operations would continue; Sayyed Hassan Nasrallah insisted that we remain on that path.
Hezbollah Secretary-General also stated that our main goal is not only to overthrow these drones, but also to counter the enemy's violation of Lebanese airspace. Sayed Nasrallah pointed out that if we were able to overthrow these drones, it would be good, but if we could not overthrow them, we would certainly remove them from the sky and maintain the sovereignty and security of the resistance as well as our country.
Another message of Hezbollah Zionist anti-UAV spying in southern Lebanon was related to deterrence, which Sayyid Hassan Nasrallah said was silent and, of course, entitled to remain silent at this point. The Zionist enemy thought that the resistance would not dare to use the weapon, while using it to target the enemy's spy drone proved that it dared to use it and made all promises and decisions in support of the country and Maintaining sovereignty is the Resistance.
It also disrupts all calculations of the Zionist regime about the impact of its threatening anti-resistance messages and will certainly reach the political and security decision-making body in Tel Aviv.
Clearly, the enemy's impediment to responding to the deterrence message was not accidental. As a result of the attack, the Zionists found that any action to violate Lebanese airspace would be met with resistance, and that was why the enemy did not respond to Hezbollah to prevent such a move.
It should be noted, however, that the Zionists are confused about the type of missile targeting Hezbollah targeted by the Zionist UAV. This can be seen in the media's reaction to the incident.
The Israeli newspaper, for example, cited the change in Hezbollah's policies, which was reflected in the launch of a rocket on the Zionist drone in southern Lebanon in the past five days, insisting that Israel should reconsider its policies in the region.
The Zionist daily reports that Hezbollah Secretary-General Seyyed Hassan Nasrallah is very serious about his threats this time around.
The newspaper noted that Hezbollah did not say anything about the type of weapon that targeted the Zionist UAVs, although according to several Zionist reports it was a sterile rocket.
The Israeli daily newspaper concludes that Hezbollah has changed its policies in an effort to balance new deterrence with the Zionist army. ""


"
