,src,lang,text
0,"











В Анапе откроют прямые авиарейсы в Дубай
01 Nov 2019, 15:41 by Ася Шахабасова

Из Международного аэропорта города-курорта Анапа ожидается три чартерных рейса

Краснодар, 1 ноября. В аэропорту Анапы запустят прямое авиасообщение с Объединенными Арабскими Эмиратами.
Согласно полученной информации, в рамках зимнего расписания авиаперелетов в период c 27 октября 2019 года по 28 марта 2020 года из Международного аэропорта Анапа будут выполнены чартерные рейсы в Дубай.
- Всего запланировано три рейса: вылеты назначены на 26 декабря 2019 года, а также 2 и 9 января 2020 года, - сообщили в пресс-службе аэропорта Краснодар.
По данным пресс-службы, организатором чартерных авиарейсов является туристический оператор Anex tour, а также авиакомпания Azur air.
Ранее «Регион Online» сообщал, что на Кубани откроется прямое авиасообщение с Мордовией. Авиарейсы запустят в 2020 году.
Читайте нас в    News


",ru,"











Direct flights to Dubai will open in Anapa
01 Nov 2019, 15:41 by Asya Shakhabasova

Three charter flights are expected from the international airport of the resort city of Anapa

Krasnodar, November 1. Anapa airport will launch direct flights with the United Arab Emirates.
According to the information received, as part of the winter flight schedule from October 27, 2019 to March 28, 2020, charter flights to Dubai will be operated from Anapa International Airport.
“In total, three flights are planned: departures are scheduled for December 26, 2019, and also on January 2 and 9, 2020,” the press service of the Krasnodar Airport said.
According to the press service, the organizer of charter flights is the tour operator Anex tour, as well as the airline Azur air.
Earlier, Region Online reported that direct flights with Mordovia will open in the Kuban. Flights will be launched in 2020.
Read us on News


"
