,src,lang,text
0,"











Albert Rivera: ""En estos 37 años los socialistas han convertido la Junta de Andalucía en el paraíso de los chorizos""
01 Nov 2019, 15:10 by Carmen Moraga
El candidato a La Moncloa por Ciudadanos ha protagonizado este viernes su primer acto oficial de campaña en Málaga 
Rivera se ha ofrecido al PP y al PSOE para ser ""la llave"" y desbloquear el próximo Gobierno mientras se ha colocado en el ""centro"" del tablero político
Ha presumido de la gestión que está haciendo su partido en la Junta de Andalucía, en donde gobierna en coalición con el PP y gracias al apoyo de Vox
El candidato a la Moncloa de Ciudadanos, Albert Rivera, ha protagonizado este viernes su primer acto oficial de campaña en Málaga en donde ha compartido un coloquio con los responsables de su equipo económico, Marcos de Quinto, Luis Garicano y María Muñoz, que han sido los encargados de presentar las medidas que han preparado para el Programa. Rivera ha presumido de la gestión que está haciendo su partido en la Junta de Andalucía, en donde gobierna en coalición con el PP y el apoyo de Vox desde hace cerca de un año, y ha arremetido contra los socialistas a los que ha acusado de haber convertido la Junta de Andalucía en estos 37 años ""en el paraíso de los chorizos y en el infierno de los emprendedores"".
""Pero tengo una mala noticia para los chorizos y una buena para los emprendedores"", ha añadido, mirando a Juan Marín y a otros miembros del nuevo Ejecutivo andaluz, como Javier Imbroda, que estaban sentados en la primera fila de la sala donde se ha celebrado el acto: ""Y es que ha llegado Ciudadanos al Gobierno y con nosotros en el Gobierno ahora le vamos a dar a todo eso la vuelta. La Junta de Andalucía va a ser el infierno de los chorizos y el paraíso de los emprendedores"".
A partir de esas promesas, que han sido acogidas con grandes aplausos por los suyos, el líder de Ciudadanos no ha dejado de echar flores al trabajo de sus compañeros andaluces a los que ha puesto como ejemplo de lo que podría hacer un Gobierno presidido por él en toda España.
En su intervención, como viene haciendo últimamente, ha ofrecido al PSOE y al PP formar una gran coalición, pero solo para ""hacer reformas"" y a ser ""la llave"" que facilite el desbloqueo político. El líder de Ciudadanos se ha situado en el ""centro del tablero político: ""Claro que somos de centro, por eso nos atacan por todos los lados, los extremistas de la izquierda y los de la derecha"", ha lamentado.
Después, se ha reivindicado como la mejor solución para España.""Estamos cambiando las cosas porque España necesita grandes dosis de libertad, de igualdad, de reformas y de energía"", ha afirmado, cambios que en su opinión solo Ciudadanos puede garantizar. ""Yo quiero convertir este país en un sueño, no en una pesadilla para las familias ni en  un infierno para los ciudadanos"", ha recalcado Rivera, que ha aprovechado para cargar contra Pedro Sánchez porque ""ha batido todos los récords"" en ""repartir cargos, colocar a sus amigos"" o en apegarse al sillón ""y al helicóptero"". 
Rivera ha insistido en que quiere ""un país donde no te quiten las ganas de trabajar con contratos basura ni les quiten los sueños a los emprendedores"", en donde ""los jóvenes tengan más fácil poder tener hijos"" y los mayores garantizarse sus pensiones ""que se han ganado con el sudor de su frente"".
Rivera ha insistido en poner como ejemplo Andalucía. ""Ahora se publican las listas de espera, y los dependientes tiene cara y ojos, no como antes"", ha asegurado. ""Lo que estáis haciendo aquí es fundamental para que los españoles vean lo que podemos hacer en España. Aquí [el Gobierno del PSOE] ha tenido a la gente con la soga al cuello y robando"", ha lamentado. ""Para el PSOE los huesos de Franco no pueden esperar, pero la sentencia de los ERE sí"", ha criticado, mientras pedía el voto para su partido, ""los liberales"" que han ocupado ya ""el centro"". 
Durante el acto, celebrado en un Hotel de la capital malagueña, han intervenido previamente los responsables del equipo económico. Primero, el empresario Marcos de Quinto, que ha alertado de que no hay que votar al bipartidismo. ""Ni PP ni PSOE van a ejecutar las reformas necesarias para cambiar las cosas en España"".
De Quintos ha recordado las cifras económicas ""terroríficas"" que hay en España y la ""desaceleración"" en la que hemos entrado, pero ha ironizado de que de eso ""no se le puede echar la culpa a Pedro Sánchez, porque no está haciendo absolutamente nada"", ya que ""lleva viviendo desde que llegó al Gobierno con los presupuestos de Montoro"".
Luego ha criticado a Sánchez por estar haciendo la campaña ""con el dinero de todos"". El empresario no ha dudado en acusar, no solo al PSOE de ""ser el campeón del paro"", sino también al PP por ser ""el campeón de la precariedad"".
El eurodiputado Luis Garicano, por su parte, también se ha sumado a los piropos a sus compañeros andaluces. ""Gracias a Ciudadanos, Andalucía está dejando de ser el farolillo rojo de España con unas políticas eficaces"". ""En Andalucía hemos puesto ya en marcha un Plan de Choque contra el abandono escolar y hemos impulsado la formación profesional"", ha presumido. ""Este año Andalucía crece más que la media de España gracias a la buena gestión que se está haciendo del dinero público"", ha sentenciado.
También Marta Muñoz en su intervención ha vaticinado que si el 10N gobierna Ciudadanos van ""a dar la vuelta"" a la situación económica en la que está dejando a España Sánchez. Según ha adelantado, primarán medidas para emprender y para ayudar a las Pymes, a las familias, a los trabajadores del mundo rural y a los autónomos. ""Somos el partido de las familias y de los autónomos"". ""Ni el PP ni el PSOE va a sacarnos de esta. Solo Ciudadanos lo puede hacer con un presidente como Albert Rivera"", ha sentenciado.

MÁS INFO


Rivera aspira a ser el presidente de los ""agraviados"" por los pactos de PP y PSOE con nacionalistas


Albert Rivera se juega su liderazgo en la campaña más difícil de Ciudadanos




",es,"











Albert Rivera: ""In these 37 years the Socialists have turned the Junta de Andalucía into the paradise of chorizos""
01 Nov 2019, 15:10 by Carmen Moraga
The candidate for La Moncloa for Citizens has starred on Friday his first official campaign event in Malaga
Rivera has offered to the PP and the PSOE to be ""the key"" and unlock the next government while it has been placed in the ""center"" of the political board
He has boasted of the management that his party is doing in the Junta de Andalucía, where he governs in coalition with the PP and thanks to the support of Vox
The candidate for the Moncloa de Ciudadanos, Albert Rivera, has starred on Friday his first official campaign event in Malaga where he has shared a colloquium with the heads of his economic team, Marcos de Quinto, Luis Garicano and María Muñoz, who have been Those responsible for presenting the measures they have prepared for the Program. Rivera has boasted of the management that his party is doing in the Junta de Andalucía, where he governs in coalition with the PP and the support of Vox for about a year, and has lashed out at the Socialists whom he has accused of having the Junta de Andalucía has become in these 37 years ""in the paradise of sausages and in the hell of entrepreneurs.""
""But I have bad news for sausages and good news for entrepreneurs,"" he added, looking at Juan Marín and other members of the new Andalusian Executive, such as Javier Imbroda, who were sitting in the front row of the room where it was held the act: ""And it is that Citizens have come to the Government and with us in the Government now we are going to turn all that around. The Junta de Andalucía is going to be the hell of the sausages and the paradise of entrepreneurs.""
From these promises, which have been received with great applause by his people, the leader of Citizens has not stopped throwing flowers at the work of his Andalusian colleagues whom he has set as an example of what a government presided by him could do in all Spain.
In his speech, as he has been doing lately, he has offered the PSOE and the PP to form a great coalition, but only to ""make reforms"" and to be ""the key"" that facilitates political unlocking. The leader of Citizens has been located in the ""center of the political board:"" Of course we are center, that's why they attack us from all sides, the extremists on the left and those on the right, ""he lamented.
Then, it has been claimed as the best solution for Spain. ""We are changing things because Spain needs large doses of freedom, equality, reforms and energy,"" he said, changes that in his opinion only citizens can guarantee. ""I want to turn this country into a dream, not a nightmare for families or a hell for citizens,"" Rivera said, who took the opportunity to charge Pedro Sánchez because ""he has broken all records"" in ""sharing charges , place your friends ""or stick to the chair"" and the helicopter. ""
Rivera has insisted that he wants ""a country where they don't take away the desire to work with junk contracts or take away dreams of entrepreneurs,"" where ""young people have easier to have children"" and the elderly guarantee their pensions ""that they have won with the sweat of their forehead. ""
Rivera has insisted on setting Andalusia as an example. ""Now waiting lists are published, and dependents have a face and eyes, not as before,"" he said. ""What you are doing here is essential for the Spaniards to see what we can do in Spain. Here [the PSOE Government] has had people with the rope around their neck and stealing,"" he lamented. ""For the PSOE Franco's bones cannot wait, but the ERE's sentence does,"" he criticized, while asking for the vote for his party, ""the liberals"" who have already occupied ""the center.""
During the event, held in a Hotel in the capital of Malaga, the heads of the economic team have previously intervened. First, the businessman Marcos de Quinto, who has warned that we should not vote for bipartisanship. ""Neither PP nor PSOE are going to carry out the necessary reforms to change things in Spain.""
De Quintos has recalled the ""terrifying"" economic figures in Spain and the ""slowdown"" in which we have entered, but he has ironized that ""Sanchez cannot be blamed for that, because he is doing absolutely nothing "", since"" he has been living since he came to the Government with the budgets of Montoro "".
Then he criticized Sánchez for being campaigning ""with everyone's money."" The businessman has not hesitated to accuse, not only the PSOE of ""being the champion of unemployment"", but also the PP for being ""the champion of precariousness.""
MEP Luis Garicano, meanwhile, has also joined the compliments of his fellow Andalusians. ""Thanks to Citizens, Andalusia is ceasing to be the red lantern of Spain with effective policies."" ""In Andalusia we have already launched a Crash Plan against dropping out of school and we have promoted professional training,"" he has presumed. ""This year Andalusia grows more than the average of Spain thanks to the good management of public money,"" he said.
Marta Muñoz also in her intervention has predicted that if the 10N governs Citizens they will ""turn around"" the economic situation in which Sánchez is leaving Spain. As he has advanced, measures to undertake and to help SMEs, families, workers in the rural world and the self-employed will prevail. ""We are the party of families and the self-employed."" ""Neither the PP nor the PSOE will get us out of this. Only Citizens can do it with a president like Albert Rivera,"" he said.

MORE INFO


Rivera aspires to be the president of the ""aggrieved"" by the PP and PSOE pacts with nationalists


Albert Rivera plays his leadership in the most difficult campaign of Citizens




"
