,src,lang,text
0,"











В Кингисеппе ученик жестоко избил одноклассника за замечание во время урока
01 Nov 2019, 15:02 by Алексей Громов

Как стало известно НЕВСКИМ НОВОСТЯМ, ученик одной из школ в Кингисеппе был избит одноклассником. По версии пострадавшего, причиной нападения стала его просьба вести себя потише.

По данным НЕВСКИХ НОВОСТЕЙ, инцидент произошел 19 октября на уроке английского языка. По словам Михаила, двое одноклассников вели себя вызывающе, когда он читал текст с доски, и без умолку болтали. Один из болтунов принял за хамство просьбу мальчика не мешать и решил его проучить.
Михаил позже рассказал, что после уроков одноклассник подкараулил его, повалил на пол и начал душить до тех пор, пока юноша не потерял сознание. Когда мальчик пришел в себя и попытался встать, обидчик снова накинулся на него: бил по голове руками и ногами, пока Михаил опять не потерял сознание.
«Всем, кто был на лестнице в это время, было плевать [на происходящее]», — вспоминает школьник.
Мальчику понадобилась экстренная госпитализация. В больнице помимо ушибов у него диагностировали перелом нижней челюсти, сотрясение и гипоксическое поражение головного мозга. В стационаре ученик провел десять дней, его выписали, но он еще долго пробудет на больничном.



Родители Михаила написали заявление в полицию, однако они недовольны ее работой: по их мнению, правоохранительные органы не заинтересованы в том, чтобы разобраться в ситуации и привлечь виновных к ответственности.
По словам адвоката Елизаветы Сайкиной, за восемь дней полицейские никого не опросили, даже потерпевшего, но составили и отправили на утверждение в прокуратуру решение об отказе в возбуждении дела.
Сайкина рассказала, что школьная администрация, намекая на неадекватное поведение школьника, озвучила свою версию событий, согласно которой Михаил сам бился головой о стену в присутствии отца.
По словам самого пострадавшего, после инцидента он позвонил своей классной руководительнице, которая ответила, что находится дома и не может говорить, так как занята ребенком. Кроме этого, мальчик позвонил папе Алексею и попросил приехать. Вместе с отцом они пообщались с завучем о случившемся.
Из разговора с ней Алексей сделал вывод, что классная руководительница сына была так сильно занята, что не уведомила руководство об инциденте, потому что заместитель директора встретила их вопросом «Что случилось?».
По словам Алексея, классная руководительница пыталась узнать подробности избиения, однако не у Михаила, а в классном чате, организованном в одной из социальных сетей, и спрашивала о свидетелях произошедшего.
По мнению Сайкиной, директор школы, которая одновременно является муниципальным депутатом и женой экс-главы Кингисеппа, имеет связи и поэтому способна повлиять на решение полиции, а также унять шумиху, чтобы сохранить репутацию школы.
В местные прокуратуру и Следственный комитет поступили заявления с просьбой провести проверку и привлечь к ответственности виновных в том, что произошло с Михаилом.
#драка #избиение #школьник #отец #кингисепп #удушение #замечание


",ru,"











In Kingisepp, a student brutally beat a classmate for remarks during class
01 Nov 2019, 15:02 by Alexey Gromov

As it became known to NEVSK NEWS, a student at a school in Kingisepp was beaten by a classmate. According to the victim, the reason for the attack was his request to be quiet.

According to NEVSKY NEWS, the incident occurred on October 19 at an English lesson. According to Mikhail, two classmates behaved provocatively when he read the text from the board, and chatted incessantly. One of the talkers accepted the boy’s request not to interfere for rudeness and decided to teach him a lesson.
Mikhail later said that after class, a classmate kept him on guard, knocked him to the floor and began to choke him until the young man lost consciousness. When the boy came to his senses and tried to get up, the offender attacked him again: he hit him on the head with his hands and feet, until Mikhail again lost consciousness.
“Everyone who was on the stairs at that time did not care [about what was happening],” the student recalls.
The boy needed emergency hospitalization. In addition to bruises, he was diagnosed with a fracture of the lower jaw, concussion and hypoxic brain damage in the hospital. The student spent ten days in the hospital, he was discharged, but he will stay on sick leave for a long time.



Mikhail's parents wrote a statement to the police, but they are dissatisfied with her work: in their opinion, law enforcement agencies are not interested in understanding the situation and holding those responsible to justice.
According to lawyer Elizaveta Saykina, for eight days the police did not interrogate anyone, not even the victim, but compiled and sent for approval to the prosecutor's office a decision not to initiate proceedings.
Saykina said that the school administration, hinting at the inappropriate behavior of the student, voiced her version of the events, according to which Mikhail himself banged his head against the wall in the presence of his father.
According to the victim himself, after the incident, he called his class teacher, who replied that she was at home and could not speak, as she was busy with the child. In addition, the boy called dad Alexei and asked to come. Together with his father, they talked with the head teacher of what happened.
From a conversation with her, Alexei concluded that her son’s class teacher was so busy that she didn’t notify the management about the incident, because the deputy director met them with the question “What happened?”.
According to Alexei, the class teacher tried to find out the details of the beating, but not from Mikhail, but in a classroom chat organized in one of the social networks, and asked about witnesses to the incident.
According to Saykina, the director of the school, which is both a municipal deputy and the wife of the ex-head of Kingisepp, has connections and therefore can influence the decision of the police, as well as calm down the fuss in order to maintain the school’s reputation.
Statements were sent to the local prosecutor’s office and the Investigative Committee with a request to conduct an audit and prosecute those responsible for what happened to Mikhail.
#fight #beating # schoolboy #father # kingisepp #strangulation # remark


"
