,src,lang,text
0,"











El Banco Central endurece el cepo cambiario: solo se podrá retirar 50 dólares en el exterior
La medida que tomó la autoridad monetaria empezará a regir a partir de noviembre.
01 Nov 2019, 15:18 by TKM
Después de reestringir la compra de dólares a 200 vía online y cien por ventanilla, el Banco Central endureció aún más el cepo cambiario y limitó las operaciones con tarjeta de crédito en el exterior. Los turistas tendrán desde noviembre un límite para extraer adelantos de efectivo con la tarjeta de crédito de U$S50 dólares.
De esta manera, la autoridad monetaria prohibió el uso de plásticos para hacer compras en establecimientos de juegos de azar, para la compra de criptoactivos como Bitcoin y para hacerse de moneda extranjera a través de sistemas de pago internacionales.



Esta medida prohibirá la mecánica del “dólar casino” por el cual era posible hacerse de divisas sin límite comprando y vendiendo fichas, que se cobran en dólares. El sistema era muy simple. En un casino del exterior se compraban fichas con tarjeta de crédito y, sin usarlas, se vendían en caja para recibir las divisas. Así, ese turista conseguía moneda extranjera a tipo de cambio oficial y sin topes.
Otra transacción que quedará suspendida es el “dólar PayPal”, el cualconsistía en fondear cuentas con pesos a través de la tarjeta de crédito y poder convertirlas, también a tipo de cambio oficial, en billete verde.

VER MÁS: Guido Sandleris, sobre el cepo al dólar: “Esta medida es para preservar las reservas”


articulos relacionados






",es,"











The Central Bank hardens the exchange rate: only 50 dollars can be withdrawn abroad
The measure taken by the monetary authority will take effect from November.
01 Nov 2019, 15:18 by TKM
After restricting the purchase of dollars to 200 via online and one hundred per window, the Central Bank further tightened the exchange rate and limited credit card operations abroad. Tourists will have a limit from November to withdraw cash advances with the credit card of US $ 50.
In this way, the monetary authority prohibited the use of plastics to make purchases in gambling establishments, for the purchase of crypto assets such as Bitcoin and to make foreign currency through international payment systems.



This measure will prohibit the mechanics of the ""dollar casino"" by which it was possible to make unlimited currencies by buying and selling chips, which are charged in dollars. The system was very simple. In a casino abroad, credit cards were bought and, without using them, they were sold in cash to receive the currencies. Thus, that tourist obtained foreign currency at the official exchange rate and without caps.
Another transaction that will be suspended is the “PayPal dollar”, which consisted of funding accounts with pesos through the credit card and being able to convert them, also at the official exchange rate, into a greenback.

SEE MORE: Guido Sandleris, on the dollar stock: “This measure is to preserve reserves”


Related Posts






"
