,src,lang,text
0,"











আবরার হত্যাকাণ্ডে জড়িতদের পরিচয় যাই হোক মূলত তারা দুর্বৃত্ত ॥ মনিরুল

01 Nov 2019, 15:40




অনলাইন রিপোর্টার ॥ বাংলাদেশ প্রকৌশল বিশ্ববিদ্যালয়ের (বুয়েট) দ্বিতীয় বর্ষের শিক্ষার্থী আবরার ফাহাদ রাব্বীকে পিটিয়ে হত্যার ঘটনায় জড়িতদের কার কী ভূমিকা ছিল তা নিরুপণ করা হচ্ছে। এই মামলার চার্জশিট নবেম্বরের প্রথম সপ্তাহের মধ্যেই দাখিল করা হবে। পুলিশের কাউন্টার টেরোরিজম অ্যান্ড ট্রান্সন্যাশনাল ক্রাইম (সিটিটিসি) ইউনিটের প্রধান মনিরুল ইসলাম আজ শুক্রবার এই তথ্য জানান।
দুপুর ১২টার দিকে রাজধানীর তেজগাঁওয়ে বাংলাদেশ চলচ্চিত্র উন্নয়ন করপোরেশনের (বিএফডিসি) হলে ডিবেট ফর ডেমোক্রেসি আয়োজিত ‘আবরার হত্যাকাণ্ডের জন্য ছাত্র রাজনীতি না মূল্যবোধের অবক্ষয়, কোনটি দায়ী’-শীর্ষক ছায়া সংসদ বিতর্ক অনুষ্ঠানে তিনি এসব কথা বলেন।
সিটিটিসি’র প্রধান মনিরুল ইসলাম বলেন, ‘আবরার হত্যাকাণ্ডে জড়িতদের পরিচয় যাই হোক মূলত তারা দুর্বৃত্ত ও অপরাধী। রাজনীতি থেকেও তাদের বহিষ্কার করা হয়েছে। আমরা এই মামলার চার্জশিট নবেম্বরের প্রথম সপ্তাহের মধ্যেই দাখিল করবো। সেখানে প্রাসঙ্গিক ডকুমেন্ট হিসেবে সিটিটিভি ফুজেটও দাখিল করা হবে।’
তিনি বলেন, ‘কোনও ছাত্র সংগঠন অন্য ছাত্র বা সাধারণ কাউকে হত্যা বা মারধরের নির্দেশ দেয় না। বরং রাজনীতির প্ল্যাটফর্মকে ব্যবহার করে কেউ কেউ নিজের স্বার্থ হাসিলের চেষ্টা করে থাকে। এটা রাজনীতির দায় নয়। বরং ওই সব অপরাধী দুর্বৃত্তের দায়।’
আবরার হত্যার ঘটনায় ২১ আসামি গ্রেফতার হয়েছে উল্লেখ করে তিনি বলেন, ‘ঘটনার পরপরই পুলিশ ১০ জনকে আটক করে। পরে জানা যায় তারা সবাই ওই মামলার আসামি। হত্যা মামলায় ১৯ জন আসামির বাইরেও তদন্তে বেশ কয়েকজনকে জড়িত পাওয়া গেছে। ১৯ আসামি হলেও এখন পর্যন্ত আমরা গ্রেফতার করেছি ২১ জনকে। এদের মধ্যে অনেকেই ১৬৪ ধারায় জবানবন্দি দিয়েছে। হত্যার ঘটনায় কার কী ভূমিকা ছিল সেটা আসামিরা বলেছে।’
আবরার হত্যার তদন্তে পুলিশ কোনও প্রতিবন্ধকতার সম্মুখিন হয়েছিল কিনা- জানতে চাইলে মনিরুল ইসলাম বলেন, ‘সঠিক এবং উপযুক্ত তথ্যের প্রতিবন্ধকতা ছিল। এছাড়া অন্য কোনও ঝামেলা হয়নি।’
বিতর্ক প্রতিযোগিতার অংশগ্রহণকারীদের সঙ্গে মনিরুল ইসলামসহ অন্যরা
তিনি আরও বলেন, ‘ঘটনার রাতে টহল পুলিশের দল কোনও মাধ্যমে তথ্য পেয়ে সেখানে যায়। কিন্তু অনুমতি ছাড়া কোনও বিশ্ববিদ্যালয় ক্যাম্পাসের ভেতরে প্রবেশ করা যায় না এমন একটা নিয়ম ছিল। কিন্তু পুলিশ যদি ওই রাতে সঠিক তথ্যটি পেতো যে আবরার নামে কোনও ছাত্রকে হত্যার উদ্দেশ্যে মারধর করা হচ্ছে, তাহলে অবশ্যই পুলিশ ওই নিয়মকে অমান্য করে ভেতরে প্রবেশ করতো। কারণ তখন নিয়মের অপরাধ ঠেকানো বেশি জরুরি।’
সাংবাদিকদের এক প্রশ্নের জবাবে সিটিটিসি'র প্রধান বলেন, ‘এমন অনেক চাঞ্চল্যকর ঘটনা রয়েছে যেখানে রাজধানীতির কোনও প্রভাব নেই। যেমন হলি আর্টিজান হামলা ও নুসরাত হত্যা। যেখানে আসলে রাজনীতি বা ছাত্র রাজনীতির কোনও দায় নেই, দায় মূল্যবোধের।’
‘মেধাবী মাত্রই আমরা মূল্যবোধ সম্পন্ন, বিবেক সম্পন্ন বলতে পারি না’ উল্লেখ করে মনিরুল ইসলাম বলেন, ‘কাগুজে নম্বরের ওপর ভিত্তি করে অনেককে আমরা মেধাবী আখ্যা দিয়ে থাকি। কিন্তু প্রকৃত মেধাবী তারাই যাদের মূল্যবোধ রয়েছে, দেশের প্রতি, মানুষের প্রতি, সমাজের প্রতি ও পরিবারের প্রতি দায়বদ্ধতা রয়েছে। আর এই মূল্যবোধ পর্যায়ক্রমে তৈরি হতে থাকে।’
ডিবেট ফর ডেমোক্রেসির চেয়ারম্যান হাসান আহমেদ চৌধুরী কিরণের সভাপতিত্বে ছায়া বিতর্কে অংশ নেন তেজগাঁও কলেজ ও সরকারি বাংলা কলেজের শিক্ষার্থীরা।
উল্লেখ্য, গত ৬ অক্টোবর রাতে আবরার ফাহাদকে ডেকে নিয়ে যায় বুয়েট শাখা ছাত্রলীগের কয়েকজন নেতাকর্মী। এরপর রাত ৩টার দিকে শেরেবাংলা হলের নিচতলা ও দুইতলার সিঁড়ির করিডোর থেকে তার মরদেহ উদ্ধার করে পুলিশ। ময়নাতদন্তের পর চিকিৎসকরা জানান, আবরারকে পিটিয়ে হত্যা করা হয়েছে। নিহত আবরার বুয়েটের ইলেকট্রিক্যাল অ্যান্ড ইলেকট্রনিক ইঞ্জিনিয়ারিং বিভাগের দ্বিতীয় বর্ষের শিক্ষার্থী ছিলেন। তিনি শেরে বাংলা হলের ১০১১ নম্বর কক্ষে থাকতেন।
এ হত্যার ঘটনায় আবরারের বাবা বাদী হয়ে ১৯ জনকে আসামি করে চকবাজার থানায় একটি মামলা দায়ের করেন।


",bn,"











The identities of those involved in the murder of Abrar are essentially rogue. Monirul

01 Nov 2019, 15:40




Online Reporter. The role of those involved in the beating of second-year student Abarra Fahad Rabbi of Bangladesh Engineering University (BUET) is being determined. Charges for this case will be filed within the first week of November. Monirul Islam, head of the police's Counter Terrorism and Transnational Crime (CTTC) unit, said this information on Friday.
He said this at a Shadow Parliament debate at the Tejgaon capital of the capital, at the Bangladesh Film Development Corporation's (BFDC) Hall, Debate for Democracy.
""The identities of those involved in the murder of Abrar are basically rogue and criminal,"" said Manitrul Islam, chief of the CTTC. They have also been expelled from politics. We will file the charge sheet for this case within the first week of November. There will also be a CCTV Fugate submitted as a relevant document. '
He said, ""No student organization orders any other student or general public to be killed or beaten."" Instead of using the platform of politics, some try to earn their own interest. It is not the responsibility of politics. Rather, those criminals are responsible for the mischief. '
""Twenty-two accused have been arrested in connection with Abara's murder,"" he said. Later it was learned that they were all accused in the case. Out of the five accused in the murder case, several were found involved in the investigation. We have arrested 20 persons, even though they are accused. Many of them have given a statement in that section. The accused has said who played the role in the murder.
Asked if the police had any obstacles in investigating Abara's murder, Monirul Islam said, ""There was a barrier to accurate and proper information. There was no other problem.
Monirul Islam and others along with the participants of the debate
He added, “On the night of the incident, the patrol police team went to the area without any information. But there was a rule that a university could not enter campus without permission. But if the police had received the correct information that night that a student by the name of Abra was being beaten for murder, then the police would have disobeyed and entered. Because then it is more important to prevent crime.
Responding to a question from reporters, the head of the CTTC said, ""There are many exciting events where capital has no effect. Such as the Holy Artizan attack and the killing of Nusrat. Where there is actually no responsibility for politics or student politics, the responsibility is worth it. '
Mentioning that 'we can not say that we are just intellectual, we cannot say conscience', Monirul Islam said, ""Based on numbers on paper, we call many people talented. But the true merits are those who have values, responsibility towards the country, people, society and family. And these values continue to be created periodically. '
Students from Tejgaon College and Government Bangla College participated in the shadow debate chaired by Debate for Democracy Chairman Hasan Ahmed Chowdhury Kiran.
It is to be noted that on the night of October 8, some leaders of the BUET branch Chhatra League called Abara Fahad. Police recovered his body from the lower corridor of the two-storey staircase at Shrebangla Hall around 9pm. After the autopsy, doctors said Abner had been beaten and killed. The deceased was a second-year student of the Department of Electrical and Electronic Engineering at Abra's Buet. He used to live in room number 8 in Sher Bangla Hall.
Abrar's father filed a case with Chakbazar police station in connection with the murder.


"
