,src,lang,text
0,"











Белорусское продовольствие стало проигрывать импорту
Власти серьезно напряглись.

07 Nov 2019, 11:18

В правительстве Беларуси обеспокоены растущим импортом продовольствия. Предыдущие попытки властей отрегулировать ввоз товаров из-за границы не увенчались успехом, пишут naviny.by.

Больная тема

Во внешней торговле товарами у нас продолжает проявляться дисбаланс: при спаде собственных продаж наращиваем импорт, рассказал на недавнем заседании Совета министров глава правительства Сергей Румас.
Например, импорт воды, включая минеральную и газированную, в стоимостном выражении увеличился на 6%, кондитерских изделий — на 15%, пива — на 19%, шоколадных изделий — на 30%, пшеничной муки — в 2 раза.
В связи с этим премьер-министр попросил руководство концерна «Белгоспищепром» разобраться в складывающейся ситуации.
А ситуация выглядит следующим образом: за последний год в белорусских магазинах стало продаваться больше импортных продовольственных товаров и меньше отечественных.
К примеру, рассказали в «Белгоспищепроме», за январь—сентябрь этого года на внутреннем рынке продано более 24 тысяч тонн шоколадных изделий, что на 10,1% больше, чем в прошлом году. При этом удельный вес отечественной продукции составил 56,4% и снизился на 7,5%.
Продажи пива в Беларуси за девять месяцев этого года составили 30,1 млн дал, что на 3% больше прошлогоднего показателя. При этом удельный вес отечественной продукции составил 79,9% и снизился на 2,2%.
Как объяснили в концерне, крупные белорусские сети предпочитают закупать импортные товары, потому что они стоят дешевле.
Так, если за восемь месяцев прошлого года средняя входная стоимость килограмма кондитерских изделий из России составляла 2,88 доллара, то в этом году она снизилась до 2,27 доллара.
«Да, импорт прёт. Сети смотрят, где выгоднее. Им главное заработать. Это бизнес», — отметил в комментарии для Naviny.by первый заместитель председателя концерна «Белгоспищепром» Игорь Шустов.
При этом, по его словам, зачастую на полки белорусских магазинов попадает продукция более низкого качества. Те же российские производители кондитерских изделий используют при производстве пальмовое масло и другие заменители, за счет чего происходит удешевление продукции.
В Беларуси же не намерены сокращать издержки в ущерб качеству продукции, отметил первый заместитель председателя концерна «Белгоспищепром»:
«Мы не пойдем на обман покупателя. Если это шоколад, то это должен быть шоколад. Мы не будем заменять натуральное какао-масло на пальмовое. Да, это дороже, но это будет и вкусно, и безопасно».
При этом, по словам Шустова, ведомство постоянно проводит мониторинги и анализ продукции и снимает не соответствующие регламентам товары с продажи, но они снова появляются в магазинах. Ввести же ограничения на ввоз определенных товаров в «Белгоспищепроме» считают невозможной мерой, поскольку «у нас открытый рынок и либерализация».
В целом, сказали в концерне, у них «вообще нет никаких полномочий в данной сфере». Лишь однажды «Белгоспищепрому» удалось пробить запрет на выплату бонусов и других маркетинговых платежей при поставках алкогольной продукции в торговые сети. Да и то через главу государства.
«Вопрос импорта — эта наша головная боль. Можно ее приглушить, можно приостановить, но “вылечить” это невозможно. Даже в таких чувствительных областях как алкоголь и табак», — подчеркнул Игорь Шустов.

Красная черта

Власти неоднократно объявляли войну импорту, но ни одна попытка успехом не увенчалась.
В свое время первый вице-премьер, а ныне посол Беларуси в России Владимир Семашко даже предлагал ввести в Беларуси институт специмпортера, но это предложение посчитали нецелесообразным.
«Благосостояние страны коренным образом зависит от торгового баланса. Если он отрицательный, и мы не используем то, что сами производим, а закупаем из-за границы, то вся страна понемногу теряет. Кто бы что не говорил, но импортозамещением в тех либо иных формах занимаются все. Например, сейчас этим занимаются США по отношению к Китаю и Европе. Каждый защищает свой рынок», — сказал в комментарии для Naviny.by сопредседатель Республиканской конфедерации предпринимательства, член общественно-консультативного совета при Министерстве антимонопольного регулирования и торговли Виктор Маргелов.
По его словам, в стране должно продаваться не менее 80% отечественных продуктов питания. Такая доля, продолжил эксперт, считается приемлемым уровнем продовольственной безопасности, в Беларуси же этот уровень давно опустился ниже красной черты.
«Мы уже эту линию перешли. Этот вопрос можно и крайне нужно решать», — отметил сопредседатель РКП.
По его мнению, решение напрямую связано с состоянием конкурентной среды в сфере розничной и оптовой торговли продуктами питания. В Беларуси, продолжил эксперт, созданы условия для стремительной монополизации торговли. Крупные сети строят большие магазины, что способствует повышению импортоемкости.

МАРТ хочет поменять правила игры для торговых сетей. Для всех или только одной?

«Когда мы строим гипермаркеты по 100 тысяч квадратных метров, то мы сознательно создаем условия для импорта, потому что в гипермаркете надо продавать 100 тысяч наименований продукции, а мы имеем свое производство на 5-10 тысяч наименований. Все это можно отрегулировать. В Финляндии, например, размер магазина ограничен двумя тысячами квадратных метров», — сказал Виктор Маргелов.
Помимо регулирования инфраструктуры, он считает необходимым также создать равные условия для хозяйствования. Сейчас, по его словам, сети торгуют тем, что можно дешево купить и дорого продать, забывая об общей пользе и преследуя шкурные цели.
«В России крупные сетевые структуры договорились с производителями отпускать продукцию по единым ценам, а в Беларуси вообще нет ограничений по демпингу. Сегодня в рознице можно торговать по ценам ниже заводских, и это не является нарушением законодательства. Нужно выровнять условия хозяйствования», — подчеркнул сопредседатель РКП.
Вместе с тем он сомневается, что власти серьезно намерены решать эти проблемы.
«Белгоспищепром» — это коллективный субъект хозяйствования. Он ничего на этом рынке изменить не может. Он — не регулятор в отличие от МАРТ. В связи с тем, что поручение дали не тому органу, возникает вопрос, собираются ли власти заниматься этим серьезно. Лично я не вижу такого желания», — сказал Виктор Маргелов.


",ru,"











Belarusian food starts losing to import
The authorities seriously strained.

07 Nov 2019, 11:18

The Belarusian government is worried about growing food imports. Previous attempts by the authorities to regulate the import of goods from abroad were unsuccessful, naviny.by writes.

Unpleasant topic

In foreign trade in goods, we continue to show an imbalance: with a decline in our sales, we increase imports, said at a recent meeting of the Council of Ministers the head of government Sergei Rumas.
For example, imports of water, including mineral and carbonated, in value terms increased by 6%, confectionery products - by 15%, beer - 19%, chocolate products - 30%, wheat flour - 2 times.
In this regard, the Prime Minister asked the leadership of the Belgospischeprom concern to understand the current situation.
And the situation is as follows: over the past year, more imported food products and fewer domestic ones began to be sold in Belarusian stores.
For example, they said in Belgospischeprom, in January-September of this year, more than 24 thousand tons of chocolate products were sold on the domestic market, which is 10.1% more than last year. At the same time, the share of domestic products amounted to 56.4% and decreased by 7.5%.
Beer sales in Belarus for the nine months of this year amounted to 30.1 million decalitres, which is 3% more than last year. At the same time, the share of domestic products amounted to 79.9% and decreased by 2.2%.
As the concern explained, large Belarusian chains prefer to buy imported goods, because they are cheaper.
So, if over the eight months of last year, the average input cost of a kilogram of confectionery from Russia was $ 2.88, this year it fell to $ 2.27.
“Yes, imports are rushing. Networks look where it’s more profitable. The main thing for them to earn. This is a business, ”Igor Shustov, First Deputy Chairman of Belgospischeprom Concern, noted in a comment to Naviny.by.
At the same time, according to him, often products of lower quality fall on the shelves of Belarusian stores. The same Russian manufacturers of confectionery products use palm oil and other substitutes in the production, due to which the cost of production decreases.
In Belarus, they don’t intend to reduce costs to the detriment of product quality, said the First Deputy Chairman of the Belgospischeprom Concern:
“We will not deceive the buyer. If it's chocolate, then it should be chocolate. We will not replace natural cocoa butter with palm. Yes, it is more expensive, but it will be both tasty and safe. ”
At the same time, according to Shustov, the agency constantly monitors and analyzes products and removes non-conforming products from sale, but they reappear in stores. To introduce restrictions on the import of certain goods into Belgospischeprom is considered an impossible measure, since ""we have an open market and liberalization.""
In general, they said in the concern, they ""generally have no authority in this area."" Only once did Belgospischeprom manage to break the ban on paying bonuses and other marketing payments for deliveries of alcoholic beverages to retail chains. And even then through the head of state.
“The issue of import is our headache. You can muffle it, you can pause it, but it is impossible to “cure” it. Even in such sensitive areas as alcohol and tobacco, ”Igor Shustov emphasized.

Red line

Authorities repeatedly declared war on imports, but not a single attempt was successful.
At one time, the First Deputy Prime Minister, and now the Ambassador of Belarus to Russia, Vladimir Semashko even proposed introducing a special importer institution in Belarus, but this proposal was considered inappropriate.
“The country's welfare is fundamentally dependent on the trade balance. If it is negative, and we do not use what we ourselves produce, but purchase from abroad, then the whole country is losing a little. Whoever said that, but everyone is engaged in import substitution in one form or another. For example, now the United States is doing this in relation to China and Europe. Everyone protects their market, ”Victor Margelov, co-chair of the Republican Confederation of Entrepreneurship, member of the Public Advisory Council at the Ministry of Antimonopoly Regulation and Trade, said in a comment to Naviny.by.
According to him, at least 80% of domestic food products should be sold in the country. This share, the expert continued, is considered an acceptable level of food security, while in Belarus this level has long fallen below the red line.
“We have already crossed this line. This issue can and must be resolved, ”said the co-chairman of the RCP.
In his opinion, the decision is directly related to the state of the competitive environment in the retail and wholesale trade in food products. In Belarus, the expert continued, conditions were created for the rapid monopolization of trade. Large chains build large stores, which contributes to increased import capacity.

MARCH wants to change the rules of the game for retail chains. For all or just one?

“When we build hypermarkets of 100 thousand square meters, we deliberately create conditions for imports, because we need to sell 100 thousand products in the hypermarket, and we have our own production for 5-10 thousand items. All of this can be adjusted. In Finland, for example, the size of the store is limited to two thousand square meters, ”said Victor Margelov.
In addition to regulating infrastructure, he considers it necessary to create equal conditions for managing. Now, according to him, networks sell what can be bought cheaply and sold expensively, forgetting about the common good and pursuing selfish goals.
“In Russia, large network structures have agreed with manufacturers to sell products at uniform prices, and in Belarus there are no dumping restrictions at all. Today in retail you can trade at prices lower than factory prices, and this is not a violation of the law. It is necessary to level the economic conditions, ”the co-chairman of the RCP emphasized.
However, he doubts that the authorities seriously intend to solve these problems.
Belgospischeprom is a collective business entity. He cannot change anything in this market. He is not a regulator, unlike MART. Due to the fact that the order was given to the wrong body, the question arises whether the authorities are going to deal with this seriously. Personally, I don’t see such a desire, ”said Victor Margelov.


"
