,src,lang,text
0,"











Вечный огонь на новосибирский Монумент Славы доставили на бронетранспортере

07 Nov 2019, 11:06

7 ноября. Interfax-Russia.ru - Торжественная церемония зажжения Вечного огня на мемориальном комплексе ""Монумент Славы"" состоялась в Новосибирской области в четверг, сообщает пресс-служба областного правительства.
Накануне в Москве на Могиле Неизвестного Солдата состоялось возложение венков и цветов, прошла церемония зажжения факела от Вечного огня и размещения частицы огня в лампе Дэви для дальнейшей транспортировки в Новосибирск.
Огонь на новосибирском Монументе Славы был потушен на время капитального ремонта мемориала и прилегающей территории.
В четверг доставленный из Москвы огонь провезли на бронетранспортере через весь город: маршрут начался на Новосибирском авиазаводе им. Чкалова, откуда огонь был доставлен на Монумент Славы при открытии в 1967 году.
""Честь зажжения Вечного огня на Монументе Славы была предоставлена студенту Новосибирского государственного технического университета за его подвиг - два года назад он спас людей из горящего дома"", - говорится в пресс-релизе.
Со своей стороны пресс-служба Центрального военного округа сообщает, что колонна военной техники проехала через весь город в сопровождении военной автомобильной инспекции и сотрудников ГИБДД, преодолев более 13 км.
Также отмечается, что к 75-летнему юбилею Победы планируется отреставрировать более 300 мемориалов и памятников в Новосибирской области.


",ru,"











Eternal flame at the Novosibirsk Monument of Glory delivered by armored personnel carrier

07 Nov 2019, 11:06

November 7th. Interfax-Russia.ru - The ceremony of lighting the Eternal Flame at the Monument of Glory memorial complex took place in the Novosibirsk Region on Thursday, the press service of the regional government reports.
On the eve of the laying of wreaths and flowers at the Tomb of the Unknown Soldier in Moscow, a ceremony was held to light a torch from the Eternal Flame and to place a particle of fire in Davy's lamp for further transportation to Novosibirsk.
The fire at the Novosibirsk Monument of Glory was extinguished during the overhaul of the memorial and the surrounding area.
On Thursday, the fire delivered from Moscow was transported by armored personnel carrier through the whole city: the route began at the Novosibirsk Aviation Plant named after Chkalov, from where the fire was delivered to the Glory Monument at its opening in 1967.
""The honor of lighting the Eternal Flame at the Glory Monument was given to a student of Novosibirsk State Technical University for his feat - two years ago he saved people from a burning house,"" the press release said.
For its part, the press service of the Central Military District reports that a convoy of military equipment drove through the city, accompanied by a military automobile inspectorate and traffic police, covering more than 13 km.
It is also noted that more than 300 memorials and monuments in the Novosibirsk region are planned to be restored by the 75th anniversary of the Victory.


"
