,src,lang,text
0,"











अमिताभ बच्चन ने फिल्म इंडस्ट्री में पूरे किए 50 साल, अभिषेक बच्चन ने ट्वीट कर लिखा उनके लिए प्यारा-सा मैसेज
07 Nov 2019, 11:23 by लाइव हिन्दुस्तान टीम,नई दिल्ली
बॉलीवुड के महानायक अमिताभ बच्चन ने फिल्म इंडस्ट्री में अपने 50 साल पूरे कर लिये हैं। अमिताभ ने बॉलीवुड में अपने करियर की शुरुआत ख्वाजा अहमद अब्बास निर्मित-निर्देशित वर्ष 1969 में प्रदर्शित फिल्म सात हिंदुस्तानी से की थी। फिल्म सात हिंदुस्तानी 7 नवंबर 1969 को प्रदर्शित हुयी थी। बॉलीवुड में अमिताभ के 50 साल पूरे होने पर उन्हें चारों तरफ से खूब बधाइयां मिल रही हैं।
इस खास मौके पर अमिताभ के पुत्र अभिषेक बच्चन ने ट्वीट किया है। अभिषेक बच्चन ने अपने सोशल मीडिया एकाउंट से अमिताभ की फोटो शेयर कर उनके लिए प्यारा सा मैसेज लिखा है। सिर्फ बेटा ही नहीं बल्कि एक एक्टर और फैन के तौर पर भी, हम सबको एक महानता (अमिताभ को संबोधित) को देखने का अवसर मिला! इसमें बहुत कुछ प्रशंसा करने वाला, सीखने वाला और सराहने वाला है। सिनेप्रमियों की कई पीढ़ियों को यह बोलने मिलता है कि हम बच्चन के जमाने से हैं, फिल्म इंडस्ट्री में 50 साल पूरे करने पर आपको बहुत बधाई, हम अब अगले 50 साल का इंजतार करते हैं। बहुत सारा प्यार।






अमिताभ बच्चन इन दिनों सोनी टीवी पर आने वाले शो कौन बनेगा करोड़पति होस्ट कर रहे हैं। इसके अलावा वह जल्द ही कई फिल्मों में नजर आयेंगे। उनकी अपकमिंग फिल्मों में ब्रह्मास्त्र, झुंड, चेहरे और गुलाबो-सिताबो शामिल हैं।


फैन के साथ बदतमीजी करने के बाद रानू मंडल पर बन रहे हैं मीम्स, ट्विटर पर हो रहे हैं वायरल




रानी चटर्जी ने किया खेसारी लाल यादव के गाने पर जमकर डांस, सोशल मीडिया पर वीडियो वायरल




",hi,"











Amitabh Bachchan completes 50 years in the film industry, Abhishek Bachchan tweeted and wrote a cute message for him
07 Nov 2019, 11:23 by Live Hindustan Team, New Delhi
Bollywood superstar Amitabh Bachchan has completed his 50 years in the film industry. Amitabh made his Bollywood debut in the Khwaja Ahmad Abbas production-directed film Saat Hindustani in 1969. The film Saat Hindustani was released on 7 November 1969. On the completion of 50 years of Amitabh in Bollywood, he is getting many congratulations from all around.
On this special occasion, Amitabh's son Abhishek Bachchan has tweeted. Abhishek Bachchan has shared a cute message for him by sharing the photo of Amitabh with his social media account. Not only son but also as an actor and fan, we all got an opportunity to see a greatness (addressed to Amitabh)! There is much to admire, learn and appreciate. Many generations of cinematographers get to say that we are from the time of Bachchan, congratulations on completing 50 years in the film industry, we now look forward to the next 50 years. lots of love.






Amitabh Bachchan is hosting the upcoming Kaun Banega Crorepati on Sony TV these days. Apart from this, he will soon be seen in many films. His upcoming films include Brahmastra, Jhad, Faces and Gulabo-Sitabo.


Mims are being made on Ranu Mandal after abusive with fan, are becoming viral on Twitter




Rani Chatterjee dances to Khesari Lal Yadav's song, video viral on social media




"
