,src,lang,text
0,"











MUJERES EN CAMPAÑA
Carmen Calvo, 'la vice' fuerte de un Gobierno frágil
Sánchez ha depositado en ella sus dos grandes quebraderos de cabeza: el independentismo y Pablo IglesiasDoctora en derecho constitucional, exministra con Zapatero, temida por sus adversarios y de proverbial locuacidad
02 Nov 2019, 05:30 by Iolanda Mármol
Cuenta Carmen Calvo (Cabra, Córdoba, 1957) que su abuelo le inculcó de pequeña que es imprescindible encarar la vida con valentía y que ese aprendizaje ha guiado su trayectoria hasta hoy. Adversarios políticos, compañeros y colaboradores dan fe de ese coraje; unos desde el calvario que les ha hecho pasar y otros desde el aplauso a su valentía. Dicen, quienes la conocen, que su maternidad a los 22 años (tiene una hija) y su precoz conciencia feminista en una Transición patriarcal la forjaron ese carácter rocoso. Ella lo lleva a gala y parece haber aprendido a mimar esa personalidad desde que se levanta, cada mañana a las seis, y se reserva la primera hora del día para sí misma, antes de sumergirse en el avatar de una vicepresidencia en la que Pedro Sánchez depositó el peso de la política de Igualdad y los dos grandes quebraderos de cabeza de un Gobierno que nació débil por su fragilidad parlamentaria: el independentismo y Pablo Iglesias.
‘La vice’, como la llaman los suyos, es la mujer fuerte del Ejecutivo con más mujeres, una de las que estos días se dejan la piel en la campaña, pese que el foco está en los hombres. Una de las personas más próximas al presidente, relación en la que algunos ven una pugna con el jefe de Gabinete, Iván Redondo. Si la hay, ella no la revela, y sonríe, porque en lo personal solo habla de sus dos nietos.
Calvo llegó a la política como independiente en las filas del PSOE y Manuel Chaves la eligió como consejera de Cultura de la Junta de Andalucía en el 2000. Cuatro años más tarde José Luis Rodríguez Zapatero se la llevó a Madrid como ministra de la misma área y ahí le tocó torear en una de las plazas más complicadas por primera vez: Catalunya.
Defendió la controvertida devolución a la Generalitat de los archivos expoliados por las tropas franquistas tras la Guerra Civil, que permanecían desde entonces en el archivo de Salamanca. Peleó por poner fin a la piratería intelectual y la ley del cine, fue vicepresidenta del Congreso y, tras la derrota de Zapatero, volvió a Córdoba, a dar clases en la universidad. En el pueblo conserva su casa, a la que, dice, le gusta volver para reunir a sus amigos y cocinar potaje de habichuelas de su tierra con la calma que Madrid no le concede.
Artífice del diálogo
Calvo volvió a la arena política en el 2017 para apoyar a Pedro Sánchez frente a Susana Díaz. Él la designó vicepresidenta y la ha situado desde entonces a la cabeza de los dos grandes conflictos que ha atravesado el Gobierno en su breve andadura: Catalunya y la investidura.
Fue la interlocutora con la Generalitat. Reconocen dirigentes independentistas que logró trabar una relación fluida con su homólogo en el Govern, Pere Aragonés (ERC), y también con la entonces 'consellera' de Predidència, Elsa Artadi (PEDECat) en pos de un apaciguamiento que cristalizó en un encuentro con Quim Torra el 21 de diciembre en Barcelona que dio pie a la Declaración de Pedralbes, un comunicado conjunto en el que se  se apostaba por una salida política a conflicto catalán. Tanto y tan poco.
Lo conseguido voló por los aires con el torpedo lanzado por ERC y PDECat a los Presupuestos, en febrero, una decisión que tumbaría la legislatura y provocaría el adelanto electoral de abril. Calvo lidió esa semana con un enorme dolor de muelas (tuvo que ser intervenida) y con la ‘crisis del relator’, que prácticamente liquidó la política de “ibuprofeno&rdquor; (como la bautizó Josep Borrell). Desde entonces Calvo mantiene un hilo de conversación con Aragonés, pero en la discreción. A nadie se le escapa que los socialistas creen que la única salida para la crisis catalana pasa, también, por unas elecciones autonómicas tras las que podría abrirse una etapa de entendimiento entre independentistas, soberanistas y socialistas.
En verano, Sánchez situó a Calvo como punta de lanza del comité negociador con Unidas Podemos para pactar una investidura. Los morados dieron fe de la proverbial locuacidad de ‘la vice’. Hay quien señala que se sentó a la mesa con la misión de no llegar a acuerdo alguno y de bajar las persianas en cuanto Iglesias rechazó la oferta de coalición de Sánchez porque nunca hubo voluntad de acuerdo. Ella lo niega y explica que el líder morado nunca estuvo dispuesto a pactar tras haber renunciado a la vicepresidencia.

Más noticias de Política





Lo más visto


Edición Global
Catalunya



Encuesta elecciones generales España: El PSOE resiste ante una derecha que no suma


Encuesta elecciones generales Catalunya: ERC se afianza al frente de un independentismo al alza


Wallapop avisa de que han sufrido un ataque informático


Últimas noticias de Catalunya y de las elecciones generales | Directo


Los problemas con la cita previa para trámites en extranjería disparan la picaresca




Encuesta elecciones generales España: El PSOE resiste ante una derecha que no suma


Encuesta elecciones generales Catalunya: ERC se afianza al frente de un independentismo al alza


Últimas noticias de Catalunya y de las elecciones generales | Directo


Wallapop avisa de que han sufrido un ataque informático


Sánchez avisa contra el boicot al 10-N en Catalunya: ""Serían delitos importantes""




",es,"











WOMEN IN CAMPAIGN
Carmen Calvo, the 'strong vice' of a fragile government
Sanchez has deposited in her two great headaches: independence and Pablo Iglesias Doctor in constitutional law, ex-minister with Zapatero, feared by his adversaries and proverbial loquacity
02 Nov 2019, 05:30 by Iolanda Marble
Carmen Calvo (Cabra, Córdoba, 1957) tells that his grandfather instilled in him as a child that it is essential to face life with courage and that this learning has guided his career until today. Political adversaries, colleagues and collaborators attest to that courage; some from the ordeal that has made them pass and others from the applause to their bravery. They say, those who know her, that her motherhood at age 22 (she has a daughter) and her early feminist conscience in a Patriarchal Transition forged that rocky character. She takes it to the gala and seems to have learned to pamper that personality since she gets up, every morning at six, and reserves the first hour of the day for herself, before plunging into the avatar of a vice presidency in which Pedro Sánchez He placed the weight of the Equality policy and the two great headaches of a government that was born weak because of its parliamentary fragility: independence and Pablo Iglesias.
Vice The vice ’, as they call her, is the strong woman of the Executive with more women, one of those who leave the skin these days in the campaign, although the focus is on men. One of the people closest to the president, a relationship in which some see a struggle with the head of Cabinet, Iván Redondo. If there is, she does not reveal it, and smiles, because personally she only talks about her two grandchildren.
Calvo came to politics as an independent in the ranks of the PSOE and Manuel Chaves elected her as Minister of Culture of the Junta de Andalucía in 2000. Four years later José Luis Rodríguez Zapatero took her to Madrid as minister of the same area and There he had to fight in one of the most complicated places for the first time: Catalunya.
He defended the controversial return to the Generalitat of the files expelled by Franco's troops after the Civil War, which remained since then in the Salamanca archive. He fought to end intellectual piracy and the law of cinema, was vice president of Congress and, after the defeat of Zapatero, returned to Córdoba, to teach at the university. In the town he keeps his house, which, he says, likes to return to gather his friends and cook bean stew from his land with the calm that Madrid does not grant him.
Architect of the dialogue
Calvo returned to the political arena in 2017 to support Pedro Sánchez against Susana Díaz. He appointed her vice president and has since placed her at the head of the two major conflicts that the Government has gone through in its brief journey: Catalonia and the investiture.
It was the interlocutor with the Generalitat. Recognize independent leaders who managed to establish a fluid relationship with his counterpart in the Government, Pere Aragonés (ERC), and also with the then 'consellera' of Predidència, Elsa Artadi (PEDECat) in pursuit of an appeasement that crystallized in a meeting with Quim Torra on December 21 in Barcelona that gave rise to the Declaration of Pedralbes, a joint statement in which he opted for a political exit to Catalan conflict. So much and so little.
The achieved flew through the air with the torpedo launched by ERC and PDECat to the Budgets, in February, a decision that would knock down the legislature and cause the electoral advance of April. Calvo dealt that week with a huge toothache (had to be intervened) and with the ""crisis of the rapporteur"", which virtually eliminated the policy of ""ibuprofen & rdquor; (as Josep Borrell baptized her). Since then Calvo maintains a thread of conversation with Aragonese, but at the discretion. It is not lost to anyone that the Socialists believe that the only way out for the Catalan crisis is also going through regional elections after which a stage of understanding between independence, sovereignty and socialists could open.
In summer, Sánchez placed Calvo as the spearhead of the negotiating committee with United We can to agree on an investiture. Purple people attested to the proverbial loquacity of ‘the vice’. Some say that he sat at the table with the mission of not reaching any agreement and lowering the blinds as soon as Iglesias rejected Sanchez's coalition offer because there was never a willingness to agree. She denies it and explains that the purple leader was never willing to agree after resigning from the vice presidency.

More news from Politics





Most seen


Global Edition
Catalunya



General Elections Survey Spain: The PSOE resists a right that does not add


General Elections Survey Catalonia: ERC takes the lead in an upward independence movement


Wallapop warns that they have suffered a computer attack


Latest news from Catalonia and the general elections | Direct


Problems with prior appointment for procedures abroad trigger the picaresque




General Elections Survey Spain: The PSOE resists a right that does not add


General Elections Survey Catalonia: ERC takes the lead in an upward independence movement


Latest news from Catalonia and the general elections | Direct


Wallapop warns that they have suffered a computer attack


Sanchez warns against the boycott of 10-N in Catalonia: ""They would be important crimes""




"
