,src,lang,text
0,"











Білий дім підготовлений до можливого імпічменту Трампа

02 Nov 2019, 05:06


Адміністрація президента США Дональда Трампа підготовлена ​​до розвитку подій, при якому американський лідер буде підданий імпічменту.

Про це заявила в п'ятницю прес-секретар Білого дому Стефані Грішем в ефірі телеканалу Fox News.
«Ми, природно, сподіваємося на те, що всі прийдуть в себе і зрозуміють, що президент не зробив нічого поганого, але ми підготовлені до того, що станеться імпічмент», - зазначила вона.
Грішем підкреслила, що Палата представників повного складу Конгресу США, найімовірніше, проголосує за те, щоб висунути звинувачення проти чинного американського президента.
«З огляду на всі їх закриті зустрічі і вибіркові витоки показань свідків, все спочатку було підлаштовано таким чином, щоб піддати президента імпічменту», - підкреслила прес-секретар Білого дому.
У США раніше розгорівся великий скандал навколо липневої телефонної розмови Трампа із Зеленським, який в підсумку став приводом для початку процедури імпічменту стосовно американського лідера. Як стверджують політичні опоненти президента США, посилаючись на свідчення інформатора, Трамп під час дзвінка намагався переконати Зеленського почати розслідування діяльності в Україні Хантера Байдена, який є сином колишнього віцепрезидента США Джозефа Байдена, в обмін на надання фінансової та військової допомоги Києву.
Хочете обговорити цю новину? Долучайтеся до телеграм-чату CHORNA RADA

Читайте також







",uk,"











White House prepared for possible impeachment of Trump

02 Nov 2019, 05:06


The administration of the President of the United States, Donald Trump, is prepared for an event in which the American leader will be impeached.

The White House press secretary, Stephanie Grisham, aired this Friday on Fox News.
""Of course, we hope that everyone will come to their senses and realize that the president has done nothing wrong, but we are prepared for the impeachment to happen,"" she said.
Grisham stressed that the House of Representatives of the full Congress is likely to vote to press charges against the incumbent US president.
""Given all their closed meetings and the selective leaks of witness testimony, everything was initially tweaked to impeach the president,"" the White House press secretary said.
A major scandal has erupted in the US over Trump's July telephone conversation with Zelensky, which eventually led to the impeachment of the US leader. According to political opponents of the US president, citing the testimony of the informant, Trump during the call tried to persuade Zelensky to start investigating the activities of Hunter Biden, son of former US Vice President Joseph Biden, in exchange for financial and military assistance to Kyiv.
Want to discuss this news? Join the telegram chat CHORNA RADA

Read also







"
