,src,lang,text
0,"











La Chine presse Trump d'annuler de nouvelles taxes

04 Nov 2019, 21:45

(Reuters) - La Chine presse le président américain Donald Trump d'annuler des droits de douane imposés à Pékin en septembre avant la signature d'un premier accord d'étape sur le commerce, rapporte lundi le site d'informations américain Politico, citant trois sources au fait des négociations.
Pékin réclame la levée d'une taxe de 15% imposée le 1er septembre par les Etats-Unis sur 112 milliards de dollars de produits chinois importés, mais aucune décision n'a été prise, précisent ces sources.
En cas de succès des discussions, le président Xi Jinping envisage de se rendre aux Etats-Unis pour la signature de cet accord partiel, dit de ""phase un"", ajoute Politico.
(Mekhla Raina à Bangalore, Jean-Stéphane Brosse pour le service français)


",fr,"











China urges Trump to cancel new taxes

04 Nov 2019, 21:45

(Reuters) - China urges US President Donald Trump to cancel tariffs imposed on Beijing in September before signing a first trade agreement, reports the US news website Politico on Monday. three sources familiar with the negotiations.
Beijing calls for the lifting of a 15% tax imposed on September 1 by the United States on $ 112 billion of Chinese products imported, but no decision has been made, specify these sources.
In the event of successful talks, President Xi Jinping plans to travel to the United States for the signing of this partial, so-called ""phase one"" agreement, Politico adds.
(Mekhla Raina in Bangalore, Jean-Stéphane Brosse for French service)


"
