,src,lang,text
0,"











Autogipfel
Regierung will Kaufprämie für Elektroautos auf 6000 Euro anheben

04 Nov 2019, 21:56

Berlin - Bundesregierung und Autoindustrie haben sich bei einem Spitzentreffen auf eine milliardenschwere höhere Kaufprämie für Elektroautos verständigt. Beide Seiten übernehmen wie bisher jeweils zur Hälfte die Kosten, wie die Deutsche Presse-Agentur am Montagabend aus Regierungskreisen erfuhr.
Die Kaufprämie soll bis Ende 2025 verlängert werden, wie aus einer Vorlage für das Spitzentreffen hervorging, die der Deutschen Presse-Agentur vorliegt. Die vor mehr als drei Jahren eingeführte Prämie ist bisher bis Ende 2020 befristet. Die Verlängerung soll Unternehmen und Verbrauchern langfristig Planungssicherheit geben.
Vorgesehen ist auch, die Prämie deutlich anzuheben. Für rein elektrische Autos unterhalb eines Listenpreises von 40.000 Euro soll der Zuschuss von bisher 4000 Euro auf 6000 Euro steigen. Für sogenannte Plug-In-Hybride soll es laut Vorlage künftig in dieser Preisklasse statt 3000 dann 4500 Euro geben.
Für Autos mit einem Listenpreis über 40.000 Euro soll der Zuschuss für reine E-Autos künftig bei 5000 Euro liegen, für Plug-in-Hybride bei 4000 Euro. Bisher werden Elektroautos nur bis zu einem Netto-Listenpreises von 60.000 Euro gefördert. Diese Deckelung soll künftig entfallen.
Industrie beteiligt sich an Kosten
Vor dem Treffen war zunächst unklar, ob die Industrie die Kosten weiter anteilig übernimmt. Der deutsche Marktführer Volkswagen signalisierte dann aber Bereitschaft, die höhere Kaufprämie für Elektroautos weiter zur Hälfte mitzufinanzieren, wie zu erfahren war. Zur bestehenden Kaufprämie hatten Bund und Industrie jeweils 600 Millionen Euro beitragen.
An dem Spitzentreffen nahmen neben Kanzlerin Angela Merkel (CDU) mehrere Bundesminister und Ministerpräsidenten teil, dazu die Chefs des Autoverbandes VDA sowie von Autoherstellern, Zulieferern und Gewerkschaften. Mit den höheren Kaufprämien soll der Verkauf von E-Fahrzeugen angekurbelt werden.
Zwar steigen die Neuzulassungen, aber auf einem immer noch niedrigen Niveau. Die Autohersteller wollen in den kommenden Monaten und Jahren zahlreiche E-Autos auf den Markt bringen, auch im Massenmarkt.
Auf dem „Autogipfel“ ging es neben der Kaufprämie auch darum, den Aufbau eines flächendeckenden Netzes an Ladestationen für E-Autos zu beschleunigen. Dies gilt als zentrale Voraussetzung für den Erfolg der Elektromobilität. (dpa)

Das könnte Sie auch interessieren





",de,"











auto summit
Government wants to raise purchase premium for electric cars to 6000 euros

04 Nov 2019, 21:56

Berlin - Federal Government and the auto industry have agreed on a billionaire higher purchase price for electric cars at a peak meeting. Both sides will continue to pay the costs, as the German Press Agency learned on Monday evening from government circles.
The purchase premium is to be extended to the end of 2025, as emerged from a template for the top meeting, which is the German Press Agency. The premium introduced more than three years ago is currently limited until the end of 2020. The extension is intended to provide companies and consumers with long-term planning security.
It is also planned to increase the premium significantly. For purely electric cars below a list price of 40,000 euros, the subsidy will rise from 4,000 euros to 6,000 euros. For so-called plug-in hybrids it should be according to template in future in this price range instead of 3000 then 4500 euros.
For cars with a list price over 40,000 euros, the subsidy for pure e-cars will in future be 5000 euros, for plug-in hybrids at 4000 euros. So far, electric cars are only promoted up to a net list price of 60,000 euros. This cap should be omitted in the future.
Industry participates in costs
Before the meeting, it was initially unclear whether the industry would continue to pay the costs proportionately. The German market leader Volkswagen signaled then willingness to co-finance the higher purchase premium for electric cars in half, as was to be learned. The federal government and industry each contributed 600 million euros to the existing purchase premium.
In addition to Chancellor Angela Merkel (CDU), several federal ministers and prime ministers took part in the summit meeting, as well as the heads of the automobile association VDA, as well as car manufacturers, suppliers and trade unions. With the higher purchase premiums, the sale of electric vehicles should be boosted.
Although new registrations are rising, but still at a low level. The automakers want to bring in the coming months and years numerous e-cars on the market, even in the mass market.
At the ""car summit"", in addition to the purchase premium, it was also about accelerating the development of a nationwide network of charging stations for e-cars. This is considered a key prerequisite for the success of electromobility. (AP)

You might also be interested in





"
