,src,lang,text
0,"











Trente-sept morts liées au vapotage rapportées aux Etats-Unis

01 Nov 2019, 06:18

(Reuters) - Trente-sept personnes sont mortes aux Etats-Unis des suites d'une mystérieuse maladie respiratoire liée à l'utilisation de cigarettes électroniques et d'autres produits de vapotage, ont rapporté jeudi les services de santé américains.
Trois décès supplémentaires sont survenus depuis la semaine précédente, a indiqué le Centre de contrôle et de prévention des maladies (CDC), qui fait par ailleurs état de plus de 1.800 personnes souffrant de graves troubles pulmonaires qui sont ou seraient vraisemblablement liés au vapotage.
(Manojna Maddipatla et Saumya Sibi Joseph à Bangalore; Jean Terzian pour le service français)


",fr,"











Thirty-seven vaping-related deaths reported in the United States

01 Nov 2019, 06:18

(Reuters) - Thirty-seven people died in the United States following a mysterious respiratory illness linked to the use of electronic cigarettes and other vaping products, US health services reported on Thursday.
Three more deaths have occurred since the previous week, said the Center for Disease Control and Prevention (CDC), which is also home to more than 1,800 people suffering from serious pulmonary disorders that are or are likely to be related to vaping.
(Manojna Maddipatla and Saumya Sibi Joseph in Bangalore, Jean Terzian for French service)


"
