,src,lang,text
0,"











Gigaberuházás kezdődhet a Balatonnál, de nem mindenki örül neki
01 Nov 2019, 06:00 by Infostart
Egy ipari kikötő építésének előkészületei zajlanak Balatongyörök és Vonyarcvashegy határában, a Szent Mihály-kápolnától alig 400 méterre.
Bár a tó egésze nyerhet a létesítmény megvalósulásán, a különleges helyszín miatt mégsem fogadja mindenki örömmel a tervet – írja a balatontipp.hu, amely annak járt utána, miről szólnak a tervek.
A tervről először Pécseli Péter, a Közép-dunántúli Vízügyi Igazgatóság Balatoni Vízügyi Kirendeltségének vezetője beszélt nagyobb nyilvánosság előtt a Balaton Fejlesztési Tanács nyár eleji környezetvédelmi konferenciáján Csopakon. Mint elmondta, az ipari kikötőt a Balatongyörök és Vonyarcvashegy között jelenleg is üzemelő 110 ezer köbméter befogadóképességű zagytér mellett szeretnék kialakítani.
Vetőné Zeke Erzsébet, a Nők a Balatonért Egyesület (NABE) térségi vezetője már közvetlenül az előadás után megdöbbenését fejezte ki, amiért minden előzetes egyeztetés nélkül ilyen tervet akarnak megvalósítani. Megjegyezte, úgy tűnik, hogy a pálköveiek jól lobbiztak, hisz korábban oda lett volna tervezve egy ilyen kikötő.
Pécseli Péter szerint ez az egyetlen olyan terület a Közép-dunántúli Vízügyi Igazgatóság kezelésében a Balatonon, ahol ezt a tervet meg lehet valósítani. Hatalmas az igény, hogy valahol létrehozzanak egy kőberakó helyet, és az egyre jobban gyarapodó “fekete flottát”, az ipari flottát is el kell helyezni valahol. Jelenleg egyre nagyobb fejtörést okoz az eszközök koncentrált elhelyezése.
Üzemen kívül a Bahart is egyik-másik kikötőben dugdossa el azokat az ipari jellegű úszóegységeit, amikkel fenntartási munkáit végzi.
Ha ezt koncentráltan, egy helyen lehetne kezelni, akkor környezeti kockázat szempontjából sokkal kisebb veszélyforrást jelentenének. Hozzátette, hogy jelenleg ez egy beerdősült terület, ahol nem terveznek teljes tarvágást. Az ipari tevékenység most is zajlik a területen a zagytér működése miatt. A kikötőt próbálják a tájba, természetbe illesztve, a legkisebb károkozással elhelyezni. Hozzátette,
nyitottak arra, hogy a terveiket ismertessék, de ezt nem kívánság műsorként kellene elképzelni. Szeretnék, ha kompromisszum alakulna ki az ügyben.
Kollár József, a Balatoni Hajózási Zrt. vezérigazgatója október elején a portálnak nyilatkozva azzal érvelt a kikitű mellett, hogy a Balatont üzemeltetni kell. Karban kell tartani a partvédőműveket, a kikötőket, adott esetben új kikötőket kell építeni, kotorni kell. Mindehhez kell egy olyan műszaki flotta, amielynek hajói a települések kikötőiben nem mutatnak jól. Mint fogalmazott, ezekkel a turizmus nehezen egyeztethető össze. Tehát kell egy olyan elkülönített hely, ami lehetőség szerint nem lakott területen van, távol van a frekventált üdülőhelyektől.
Arról is beszélt, hogy korábban önállóan próbálkoztak egy ilyen létesítmény kialakításával, de nem találtak megfelelő helyet, ekkor vetődött fel, hogy a Vízüggyel közösen valósítsák meg a tervet. Jelenleg ott tartanak a tárgyalásokban, hogy ennek a kikötőnek milyen részei lennének, hol lenne a kőrakodó, hol lehetne kialakítani helyet egy parti darunak.
Kollár József arról is beszélt, hogy a megfelelő közúti kapcsolatot is meg kell oldani, hisz a jelenlegi út kőszállításra nem lesz alkalmas, és akadályt jelenthet az is, hogy az érintett terület szomszédságában vitorláskikötő és kemping működik, egyik környező település sem szeretne, ha tavasztól őszig zajos, poros tevékenységgel együtt élni, nehéz teherautókkal találkozni.

Nyitókép: MTI/Varga György



",hu,"











Gigging may start at Lake Balaton, but not everyone is happy with it
01 Nov 2019, 06:00 by Infostart
Preparations are underway for the construction of an industrial harbor on the border of Balatongyörök and Vonyarcvashegy, just 400 meters from St. Michael's Chapel.
Although the lake as a whole can benefit from the realization of the facility, the special location does not make everyone happy with the plan - writes balatontipp.hu, who followed what the plans are all about.
The plan was first discussed by Pécseli Péter, Head of the Central Transdanubian Water Directorate of the Balaton Water Department, at the Balaton Development Council's environmental conference in Csopak at the beginning of the summer. As he said, I would like to develop the industrial harbor with a 110,000 cubic meter sludge space currently operating between Balatongyörök and Vonyarcvashegy.
Erzsébet Vetőné Zeke, the regional leader of the Association for Women for the Balaton (NABE), expressed her astonishment immediately after the performance that they would like to implement such a plan without prior consultation. He noted that the Stones seemed to be lobbying well, as such a harbor would have been planned there.
According to Pécseli Péter, this is the only area managed by the Central Transdanubian Water Directorate on Lake Balaton where this plan can be implemented. There is an enormous need for somewhere to set up a quarry, and the ever-expanding ""black fleet"", the industrial fleet, must be located somewhere. At present, the concentrated placement of devices is causing more and more headaches.
In addition to the plant, the Bahart also plugs industrial floating units at one of its ports to carry out its maintenance work.
If concentrated in one place, they would represent a much smaller source of environmental risk. He added that this is currently a forested area where full felling is not planned. Industrial activity is still taking place in the area due to the operation of the tailingspeed. They try to locate the harbor in the landscape, with the least damage possible. He added,
they are open to presenting their plans, but this should not be conceived as a show. I would like to see a compromise on this matter.
József Kollár, Managing Director of Balatoni Hajózási Zrt., Arguing to the portal at the beginning of October, argued that the Balaton should be operated. Coast guards must be maintained, harbors must be built, and new harbors built and dredged if necessary. All this requires a technical fleet whose ships do not perform well in the ports of the municipalities. As stated, tourism is hard to reconcile with these. So there is a need for a secluded place that is located in an uninhabited area, away from frequented resorts.
He also said that they had previously tried to set up such a facility on their own, but that they did not find the right place, and then raised the idea of implementing the plan together with the Water Authority. They are currently in talks about what parts of this harbor would be, where the quarry would be, and where a crane for shore could be built.
József Kollár also said that the right road connection must be solved as the current road will not be suitable for stone transport, and there may be obstacles to the operation of a marina and a campsite in the vicinity of the area. living with noisy, dusty activities, meeting heavy trucks.

Opening image: MTI / György Varga



"
