,src,lang,text
0,"











ОБСЕ подтвердила полное разведение сил в Золотом
04 Nov 2019, 13:10 by Корреспондент.net
Мартин Сайдик призвал сделать все необходимое для скорейшего разведения сил в районе Петровского.
Специальная мониторинговая миссия ОБСЕ в Украине подтвердила завершение отвода сил и средств в районе Золотого Луганской области. Об этом говорится в отчете на сайте миссии.
""Я приветствую завершение вывода сил и техники из Золотого и начало деятельности по разминированию территории. Воодушевленный прогрессом в Станице-Луганской и Золотом, я настоятельно призываю стороны сделать все необходимое для скорейшего разведения сил в районе Петровского"", - заявил спецпредставитель главы ОБСЕ в Украине Мартин Сайдик.
Он также отметил, что выполнение обязательств относительно разъединения сил и техники будет способствовать укреплению доверия между сторонами и мирному урегулированию конфликта на востоке Украины.
Напомним, во вторник отвод в Золотом начался, несмотря на заявления об обстрелах.
В штабе ООС сообщили подробности обстрела в Золотом-4, который произошел еще в понедельник, 28 октября. Также были опубликованы фото с места обстрела. Однако в среду президент Зеленский отрицал обстрелы в Золотом.

Перемирие на Донбассе








",ru,"











OSCE Confirms Complete Breeding in Golden
04 Nov 2019, 13:10 by Correspondent.net
Martin Saidik urged to do everything necessary for the speedy separation of forces in the Petrovsky area.
The OSCE Special Monitoring Mission in Ukraine confirmed the completion of the withdrawal of forces and assets in the Zolotoy Luhansk region. This is stated in the report on the mission website.
""I welcome the completion of the withdrawal of forces and equipment from Zolotoy and the beginning of mine clearance activities. Encouraged by the progress in Stanitsa-Lugansk and Zolotoy, I urge the parties to do everything necessary for the speedy withdrawal of forces in the Petrovsky region,"" said Special Representative of the OSCE Head in Ukraine Martin Saydik.
He also noted that the fulfillment of obligations regarding the separation of forces and equipment will help to build confidence between the parties and a peaceful settlement of the conflict in eastern Ukraine.
Recall that on Tuesday, the withdrawal in Zolotoy began, despite statements about shelling.
The OOS headquarters reported the details of the shelling in Zolotoy-4, which occurred on Monday, October 28. Also photos from the place of shelling were published. However, on Wednesday, President Zelensky denied the shelling at Zolotoy.

Truce in the Donbass








"
