,src,lang,text
0,"











Nicolás Maduro cierra filas en La Habana en encuentro antimperialista y por la ""democracia""
04 Nov 2019, 13:53 by Redacción de CiberCuba
El dictador Nicolás Maduro apareció este domingo en La Habana para participar en la clausura del ""Encuentro Antimperialista de Solidaridad, por la Democracia y contra el Neoliberalismo"" junto al gobernante cubano Miguel Díaz-Canel y el primer secretario del partido único, PCC, Raúl Castro. 
Después de adelantar las Navidades en Venezuela este sábado, Maduro llegó a Cuba para repetir los eslóganes de los fallecidos dictadores Fidel Castro y Hugo Chávez en unas jornadas donde el régimen de La Habana insistió en culpar a Estados Unidos de todos los problemas en América Latina. 
En su discurso el actual gobernante de Venezuela recordó el debilitado Socialismo del Siglo XXI impulsado por Chávez y Castro, y dijo que las protestas en Chile están pidiendo un cambio del modelo neoliberal, así como las elecciones en Argentina en las que ganó el candidato kirchnerista Alberto Fernández. 
""A nosotros nos acusan desde temprano de que somos una dictadura, desde temprano al comandante Chávez le acusaron de dictador, caudillo, omnipresente (...) Hoy a mí también se me acusa de dictador y se nos persigue y se nos acusa de todo para justificar cualquier cosa (...) Y hay gente en el mundo, no de derechas, que se lo cree y que nos tienen miedo"", señaló Maduro. 



El dictador alabó el ejemplo de Cuba durante el Período Especial de los noventa y cerró filas con el régimen de la Isla contra las medidas de Estados Unidos, a quienes calificó junto a la derecha de América Latina de ""estúpidos"" por señalarlos a él y a Raúl Castro como incitadores de las protestas en la región.
Maduro criticó al presidente de El Salvador, Nayib Bukele, por dejarse manipular y querer separar a los pueblos de ese país y Venezuela, apuntó. Este país recientemente desconoció a los diplomáticos chavistas y sí a los del presidente interino Juan Guaidó. 
Sin embargo, agregó que el mandatario electo de Argentina y el mexicano Andrés Manuel López Obrador son un segundo frente progresista ""que va a desempeñar un papel clave en América Latina contra el neoliberalismo, en tanto destacó como un tercer frente el conformado por los movimientos populares, que están en las calles en Brasil, en Ecuador, en Colombia y en Chile"", agrega el diario oficialista Granma.
Para Maduro el frente de resistencia principal es la Alianza Bolivariana de los Pueblos de Nuestra América (ALBA) con Cuba, Venezuela, Nicaragua al frente.
Desde Estados Unidos consideran a estos países como ""la troika de la tiranía"", como dijo John Bolton, el exasesor de Seguridad Nacional del presidente Donald Trump. 
En el encuentro, Díaz-Canel afirmó –entre otros eslóganes– que ""cómo no me voy a reír de la OEA, si es una cosa tan fea, tan fea que causa risa"" ante el aplauso de los presentes. La Organización de Estados Americanos es una de las que constantemente denuncia la falta de derechos humanos en esos países y otros del continente. 
El ratificado gobernante cubano fue uno de los pocos que apareció en Venezuela en el pasado Foro de Sau Paulo celebrado en Caracas. Otros como el boliviano Evo Morales dejaron solo a Maduro frente a ese encuentro de la izquierda radical.   


",es,"











Nicolás Maduro closes ranks in Havana in an anti-imperialist meeting and for ""democracy""
04 Nov 2019, 13:53 by CiberCuba Writing
The dictator Nicolás Maduro appeared this Sunday in Havana to participate in the closing of the ""Anti-Imperialist Solidarity Encounter for Democracy and Against Neoliberalism"" together with the Cuban ruler Miguel Díaz-Canel and the first secretary of the single party, PCC, Raúl Castro .
After advancing Christmas in Venezuela this Saturday, Maduro arrived in Cuba to repeat the slogans of the late dictators Fidel Castro and Hugo Chávez in a conference where the Havana regime insisted on blaming the United States for all the problems in Latin America.
In his speech, the current ruler of Venezuela recalled the weakened Socialism of the 21st Century promoted by Chavez and Castro, and said that the protests in Chile are calling for a change of the neoliberal model, as well as the elections in Argentina in which the candidate Kirchnerista Alberto won Fernandez
""We are accused early on that we are a dictatorship, from early on Commander Chávez was accused of dictator, leader, omnipresent (...) Today I am also accused of dictator and we are persecuted and accused of everything to justify anything ... And there are people in the world, not right, who believe it and who are afraid of us, ""Maduro said.



The dictator praised the example of Cuba during the Special Period of the 1990s and closed ranks with the Island regime against the measures of the United States, whom he described next to the right of Latin America as ""stupid"" for pointing him and Raul Castro as inciters of protests in the region.
Maduro criticized the president of El Salvador, Nayib Bukele, for letting himself be manipulated and wanting to separate the people of that country and Venezuela, he said. This country recently ignored the Chavista diplomats and yes those of the interim president Juan Guaidó.
However, he added that the elected president of Argentina and the Mexican Andrés Manuel López Obrador are a second progressive front ""that will play a key role in Latin America against neoliberalism, while it highlighted as a third front formed by popular movements , which are on the streets in Brazil, in Ecuador, in Colombia and in Chile, ""adds the official newspaper Granma.
For Maduro, the main resistance front is the Bolivarian Alliance of the Peoples of Our America (ALBA) with Cuba, Venezuela, Nicaragua in front.
From the United States they consider these countries to be ""the troika of tyranny,"" as John Bolton, the former National Security advisor to President Donald Trump, said.
At the meeting, Díaz-Canel said - among other slogans - that ""how I am not going to laugh at the OAS, if it is such an ugly thing, so ugly that causes laughter"" at the applause of those present. The Organization of American States is one of those that constantly denounces the lack of human rights in those countries and others on the continent.
The ratified Cuban ruler was one of the few who appeared in Venezuela at the last Sau Paulo Forum held in Caracas. Others like Bolivian Evo Morales left Maduro alone in the face of that meeting of the radical left.


"
