,src,lang,text
0,"











Trump potrebbe leggere in tv la telefonata con Zelensky
La Camera ha dato il via libera alla procedura di impeachment legata al caso Ucraina
01 Nov 2019, 12:33 by AGI - Agenzia Giornalistica Italia
Il presidente Donald Trump sta pensando di leggere in diretta tv agli americani la trascrizione della telefonata dello scorso 25 luglio con il presidente ucraino Volodymyr Zelensky che ha portato il Congresso ad avviare una procedura di impeachment. L'accusa è che l'inquilino della Casa Bianca abbia premuto su Zelensky perché indagasse sugli affari in Ucraina di Hunter Biden, figlio del suo probabile sfidante democratico alle presidenziali, Joe Biden. 
""Ad un certo punto, mi siederò, forse per un conversazione dal vivo in tv, e leggerò la trascrizione della telefonata perché la gente deve ascoltarla. Quando la leggi è una telefonata corretta"", ha dichiarato Trump in un'intervista al Washington Examiner nel giorno in cui la Camera dei Rappresentanti Usa ha approvato la risoluzione che formalizza la procedura dell'inchiesta di impeachment. Il tycoon, che ha definito la mossa ""la più grande caccia alle streghe della storia"", ha ribadito che non intende collaborare con l'inchiesta dei democratici.



Paragonando poi il suo caso a quello dei predecessori sottoposti alla procedura di impeachment, Trump ha rimarcato di non aver fatto nulla di sbagliato. ""Tutti sanno che non ho fatto nulla di male"", ha detto. ""Bill Clinton ha fatto cose sbagliate. Richard Nixon ha fatto cose sbagliate e non arrivo a (Andrew) Johnson perché è stato prima del mio tempo. Loro hanno sbagliato - ha insistito - ma io non ho fatto nulla di sbagliato""


",it,"











Trump could read the call with Zelensky on TV
The Chamber has given the green light to the impeachment procedure linked to the Ukraine case
01 Nov 2019, 12:33 by AGI - Italian News Agency
President Donald Trump is thinking of reading the transcript of the July 25th phone call with Ukrainian President Volodymyr Zelensky on the Americans' live TV broadcast, which led the Congress to start an impeachment procedure. The accusation is that the White House tenant pressed Zelensky to investigate Hunter Biden, son of his probable Democratic presidential challenger, Joe Biden, in Ukraine.
""At some point, I'll sit down, maybe for a live conversation on TV, and I'll read the transcript of the call because people have to listen to it. When the law is a correct call,"" Trump said in an interview with the Washington Examiner in day the US House of Representatives approved the resolution formalizing the impeachment investigation procedure. The tycoon, which called the move ""the greatest witch hunt in history"", reiterated that it does not intend to cooperate with the Democrats' inquiry.



Then comparing his case to that of the predecessors subjected to the impeachment procedure, Trump remarked that he had done nothing wrong. ""Everyone knows I didn't do anything wrong,"" he said. ""Bill Clinton did the wrong things. Richard Nixon did wrong things and didn't get to (Andrew) Johnson because it was before my time. They were wrong - he insisted - but I didn't do anything wrong""


"
