,src,lang,text
0,"











اتصال برق ایران و عراق برقرار شد

01 Nov 2019, 12:28


عملیات اتصال (سنکرون) شبکه برق ایران به شبکه برق عراق آغاز شد.


آفتاب‌‌نیوز :

عملیات اتصال شبکه برق ایران به شبکه برق کشور عراق صبح امروز جمعه نهم آبان ماه با حضور رضا اردکانیان وزیر نیروی ایران و معاون برق عراق کلید خورد.
این اتصال با هدف پایداری بیشتر برق دو کشور، امکان صادرات برق و بر طرف کردن نیاز های برقی دو کشور انجام شد.



با اتصال شبکه های برق دو کشور می توانند به راحتی برق را با یکدیگر تبادل کرده و در زمان های اوج مصرف از توان یک دیگر استفاده کنند.
مراسم سنکرون سازی شبکه برق در خط ۴۰۰ کیلوولت العماره _ کرخه انجام شد.
در این مراسم همایون حائری معاون برق و انرژی وزیر نیرو، نافع عبدالساده. معاون وزیر برق عراق و دانایی فر مشاور معاون اول رییس جمهوری حضور داشتند.


",fa,"











The Iran-Iraq electricity connection was established

01 Nov 2019, 12:28


The synchronization operation of the Iranian grid has started with the Iraqi grid.


Sunshine News:

The operation of connecting Iran's electricity grid to Iraq's electricity grid this morning on Friday, November 9th, was attended by Iranian Minister of Energy Reza Ardekanian and Iraqi Deputy Minister of Electricity.
The interconnection was aimed at further stabilizing the electricity of the two countries, enabling the export of electricity and meeting the electricity needs of the two countries.



By connecting electricity networks, the two countries can easily exchange electricity and use each other's power at peak times.
The synchronization ceremony of the electricity grid took place at the 2 kV Al-Amara-Karkheh line.
At the ceremony, Homayoun Haeri, Deputy Minister of Electricity and Energy, Nafi Abdul Saada. Iraq's Deputy Minister of Electricity and Danaifar were the first Vice Presidential Advisers.


"
