,src,lang,text
0,"











Дети Кейт Миддлтон из-за разных темпераментов стали ссориться
01 Nov 2019, 12:58 by Grazia


Legion-Media

На совместных фотографиях наследники герцогов Кембриджских кажутся очень дружелюбными друг с другом, однако в реальности все не так гладко. Шестилетний Джордж и четырехлетняя Шарлотта частенько не ладят между собой.
Причины для этого оказались вполне актуальными для детей их возраста.


Принцесса Шарлотта и принц Джордж часто ссорятся друг с другомLegion-Media

Приближенный королевской четы рассказал о том, что Джордж и Шалотта часто спорят друг с другом. К примеру, дети не могут поделить любимые игрушки. «Они ссорятся из-за всяких глупостей вроде игрушек или программ, которые хотят посмотреть по телевизору», — цитирует инсайдера Express.


Принцесса Шарлотта любит общественное вниманиеLegion-Media

Источник предположил, что основа конфликтов наследников 37-летних Кейт Миддлтон и принца Уильяма лежит в разнице их характеров. Шарлотта — уверенная в себе озорница, которая любит быть в центре внимания, а принц Джордж обладает мягким и спокойным характером. Мальчик кажется немного замкнутым по сравнению с сестрой, которая не стесняется ни в словах, ни в действиях.
«Джордж более закрытый, хотя в последнее время он начинает выбираться из своей скорлупы. Он присматривает за младшими братом и сестрой и уже демонстрирует качества отличного лидера», — заключил инсайдер.


Принц Джордж достаточно закрытый ребенокLegion-Media

Младшего наследника Кейт и Уильяма — полуторогодовалого Луи — королевский приближенный назвал «маминым любимчиком».
Недавно Кейт Миддлтон и принц Уильям с детьми пообедали в пабе и торжественно отвели их в школу. Сын Кейт Миддлтон и принца Уильяма эмоционально болел за любимую команду на игре.


",ru,"











Kate Middleton's children began to quarrel due to different temperaments
01 Nov 2019, 12:58 by Grazia


Legion media

In joint photographs, the heirs of the Dukes of Cambridge seem very friendly with each other, but in reality everything is not so smooth. Six-year-old George and four-year-old Charlotte often do not get along with each other.
The reasons for this turned out to be quite relevant for children of their age.


Princess Charlotte and Prince George often quarrel with each otherLegion-Media

An approximate royal couple said that George and Shallotta often argue with each other. For example, children cannot share their favorite toys. “They quarrel over all sorts of stupid things like toys or programs that they want to watch on TV,” Express quotes an insider.


Princess Charlotte loves public attention Legion-Media

The source suggested that the basis of conflicts between the heirs of 37-year-old Kate Middleton and Prince William lies in the difference in their characters. Charlotte is a confident naughty girl who loves to be in the spotlight, and Prince George has a soft and calm character. The boy seems a little reserved in comparison with his sister, who is not shy in words or actions.
“George is more closed, although recently he has begun to get out of his shell. He looks after his younger brother and sister and already demonstrates the qualities of an excellent leader, ”the insider concluded.


Prince George is a fairly enclosed childLegion-Media

The royal heir to Kate and William, one and a half year old Louis, was called by his royal close associate “his mother’s favorite.”
Recently, Kate Middleton and Prince William had lunch with their children in a pub and solemnly took them to school. The son of Kate Middleton and Prince William was emotionally rooting for his favorite team at the game.


"
