,src,lang,text
0,"











В России вступил в силу закон о «суверенном интернете»

01 Nov 2019, 12:10

Сегодня, 1 ноября, в Российской Федерации начал действовать закон об обеспечении автономной работы российского сегмента интернета в случаях сбоев или целенаправленного масштабного внешнего воздействия.
Об этом сообщает «Интерфакс».
Пакет поправок в законы «О связи» и «Об информации» в конце 2018 года разработали и внесли в Госдуму председатель комитет Совета Федерации по конституционному законодательству и госстроительству Андрей Клишас, его первый заместитель Людмила Бокова и депутат Госдумы Андрей Луговой (ЛДПР) «с учетом агрессивного характера принятой в сентябре 2018 года Стратегии национальной кибербезопасности США», в которой Россия «впрямую и бездоказательно обвиняется в совершении хакерских атак».
В апреле 2019 года новый закон был принят Госдумой, в мае его подписал президент Владимир Путин.
Законом предусматривается создание в РФ независимой инфраструктуры, позволяющей «обеспечить работоспособность российских интернет-ресурсов в случае невозможности подключения российских операторов связи к зарубежным корневым серверам сети Интернет».
Операторов связи закон обязывает установить технические средства, способные определять источник трафика, а с 1 января 2021 года — пользоваться национальной доменной зоной. С этого же дня государственные органы должны будут использовать исключительно отечественные средства шифрования информации.
Согласно закону, при возникновении угроз функционированию интернета на территории РФ Роскомнадзор может осуществлять централизованное управление трафиком в порядке, утвержденном правительством РФ, которое также будет определять виды подобных угроз. Требования к обеспечению функционирования точек обмена трафиком будет утверждать Минкомсвязи по согласованию с ФСБ.
Не реже одного раза в год с участием операторов связи должны проводиться учения по обеспечению устойчивой работы российского интернета. Одна из задач учений — апробирование сценариев реагирования на угрозы и отработка механизмов восстановления сети. Роскомнадзор организует тестирование оборудования, необходимого для реализации закона (операторы связи ставят на своей сети в избранных регионах оборудование с функциями фильтрации по сетевым адресам и контенту).
ПОДПИСЫВАЙТЕСЬ НА КАНАЛ COLTA.RU В ЯНДЕКС.ДЗЕН, ЧТОБЫ НИЧЕГО НЕ ПРОПУСТИТЬ


",ru,"











In Russia, the law on ""sovereign Internet"" entered into force

01 Nov 2019, 12:10

Today, November 1, the law on the autonomous operation of the Russian segment of the Internet in cases of malfunctions or targeted large-scale external influences began to apply in the Russian Federation.
It is reported by Interfax.
A package of amendments to the laws “On Communications” and “On Information” at the end of 2018 was developed and submitted to the State Duma by the chairman of the Federation Council Committee on Constitutional Legislation and State Building Andrey Klishas, his first deputy Lyudmila Bokova and State Duma deputy Andrei Lugovoi (LDPR) “taking into account the aggressive nature of the US National Cybersecurity Strategy adopted in September 2018, in which Russia is “directly and unsubstantially accused of committing hacker attacks.”
In April 2019, a new law was adopted by the State Duma, in May it was signed by President Vladimir Putin.
The law provides for the creation of an independent infrastructure in the Russian Federation, which allows ""to ensure the operability of Russian Internet resources in the event of impossibility of connecting Russian telecom operators to foreign Internet root servers.""
Telecommunications operators are required by law to establish technical means that can determine the source of traffic, and from January 1, 2021, use the national domain zone. Starting from the same day, state bodies will have to use exclusively domestic means of encrypting information.
According to the law, in the event of threats to the functioning of the Internet in the Russian Federation, Roskomnadzor can carry out centralized traffic control in the manner approved by the Government of the Russian Federation, which will also determine the types of such threats. The requirements for ensuring the functioning of traffic exchange points will be approved by the Ministry of Communications in coordination with the FSB.
At least once a year, with the participation of telecom operators, exercises should be conducted to ensure the stable operation of the Russian Internet. One of the objectives of the exercises is to test threat response scenarios and develop network recovery mechanisms. Roskomnadzor organizes testing of equipment necessary for the implementation of the law (telecom operators install equipment on their network in selected regions with filtering functions by network addresses and content).
SUBSCRIBE TO COLTA.RU CHANNEL IN YANDEX.ZEN TO NOT MISS ANYTHING


"
