,src,lang,text
0,"











Названа лучшая диета

07 Nov 2019, 07:29

Лучшей диетой на сегодняшний день можно назвать средиземноморскую, заявила российский врач-диетолог Елена Соломатина, передает Tengrinews.kz со ссылкой на РИА Новости. 
""Когда мы говорим о диетах, хороша золотая середина. Все крайности - упор на белки, жиры или даже сложные углеводы (каши, макароны, зерновой хлеб) - имеют побочный эффект"", - рассказала врач.  
По ее словам, набору лишних килограммов способствуют курение, алкоголь, стрессы, а также эндокринные заболевания. Кроме того, потолстеть можно даже из-за вируса, грибка или бактерий.Соломатина назвала оптимальной средиземноморскую диету, которая основана на употреблении продуктов, богатых полиненасыщенными жирами и ненасыщенными жирными кислотами омега-3. В частности, это рыба и оливковое масло. Также в день необходимо употреблять не менее 40 граммов клетчатки.
Врач отметила, что параметры диеты должны подбираться индивидуально. Если уровень холестерина в организме соответствует норме, можно даже в небольших количествах есть сало, считает диетолог. Не навредит и молоко средней жирности.
Соломатина подчеркнула, что детям можно есть практически любые продукты, включая сливки и масло. Подросткам же стоит ограничить себя в жирах. Людям старшего возраста нужно делать больший упор на растительную пищу.
""Похудеть можно на любой диете, если серьезно заняться этим вопросом. Главное, чтобы после того, как весы покажут заветную цифру и цель будет достигнута, не набрать за считаные дни вес заново и не получить различные заболевания в качестве ""сопутствующего эффекта"", - заключила врач.

Другие новости рубрики ""Новости мира"" :








",ru,"











Named the best diet

07 Nov 2019, 07:29

The best diet to date can be called Mediterranean, said Russian dietician Elena Solomatina, Tengrinews.kz reports with reference to RIA Novosti.
“When we talk about diets, the golden mean is good. All extremes - emphasis on proteins, fats, or even complex carbohydrates (cereals, pasta, cereal bread) - have a side effect,” the doctor said.
According to her, smoking, alcohol, stress, and endocrine diseases contribute to a set of extra pounds. In addition, you can get fat even because of a virus, fungus or bacteria. Solomatina called the optimal Mediterranean diet, which is based on the use of foods rich in polyunsaturated fats and unsaturated omega-3 fatty acids. In particular, it is fish and olive oil. Also, at least 40 grams of fiber should be consumed per day.
The doctor noted that diet parameters should be selected individually. If the level of cholesterol in the body is normal, you can even eat lard in small amounts, the nutritionist believes. Milk of medium fat content will not harm either.
Solomatina emphasized that children can eat almost any food, including cream and butter. Teenagers should limit themselves in fats. Older people need to put more emphasis on plant foods.
""You can lose weight on any diet, if you seriously address this issue. The main thing is that after the scales show the cherished figure and the goal is achieved, not to gain weight again in a matter of days and not get various diseases as a"" concomitant effect, ""she concluded doctor.

Other news of the section ""World News"":








"
