,src,lang,text
0,"











केंद्रीय मंत्री रिजिजू ने क्यों डिलीट किया था पुलिस वाला ट्वीट, किया खुलासा
07 Nov 2019, 07:53 by लाइव हिन्दुस्तान, नई दिल्ली
केंद्रीय मंत्री किरेन रिजिजू ने दिल्ली पुलिस और वकील विवाद पर पहले किए गए अपने ट्वीट और फिर उसे डिलीट कर देने के पीछे की वजह का खुलासा किया है। किरेन रिजिजू ने 'हिन्दुस्तान' के कार्यक्रम 'मेरे युवा, मेरी शान' में कहा कि मैं कुछ भी ट्वीट करता हूं तो विवाद बन जाता है। मैं विवाद में नहीं रहना चाहता हूं। 
उन्होंने कहा कि मैं गृह मंत्रालय में रहा हूं और जो यूनिफॉर्म में रहते हैं, पुलिस फोर्स आदि, उनका जीवन काफी मुश्किल होता है। लोग समझते नहीं है कि वे कितना त्याग करते हैं। रिजिजू ने कहा कि मैं नहीं चाहता कि पूरे देश के वकील मेरे खिलाफ हो जाएं। यह मामला कोर्ट में है इसलिए मैं टिप्पणी नहीं करूंगा।
बता दें कि अल्मोड़ा में आयोजित हिन्दुस्तान अखबार के युवा सम्मेलन मेरे युवा मेरी शान में केंद्रीय युवा और खेल मंत्री किरेन रिजिजू ने कहा कि हम खिलाड़ियों को और बेहतर बनाएंगे। हमें देश के खिलाड़ियों को आगे ले जाना है। 
उन्होंने कहा कि ओलंपिक में हम पिछड़े हुए हैं, आगे आने के लिए तैयारियां चल रही है। इस पर काम हो रहा है। रियो ओलंपिक में भारत को सिर्फ दो मेडल मिले। हमारी कोशिश होगी कि अब ज्यादा से ज्यादा मेडल आए, खिलाड़ी इसके लिए जी जान से जुटे हैं। 


मेरे युवा मेरी शान: केंद्रीय मंत्री रिजिजू बोले, सरकार की हर स्कीम युवाओं को ध्यान में रखकर




",hi,"











Why did Union Minister Rijiju delete police tweet, revealed
07 Nov 2019, 07:53 by Live Hindustan, New Delhi
Union Minister Kiren Rijiju has revealed his tweet made earlier on the Delhi Police and lawyer controversy and then the reason behind the deletion. Kiren Rijiju said in 'Hindustan' program 'Mere Yuva, Meri Shaan' that if I tweet anything, controversy is created. I do not want to be in dispute.
He said that I have been in the Ministry of Home Affairs and those who live in uniform, police force etc., their life is very difficult. People do not understand how much they sacrifice. Rijiju said that I do not want lawyers from all over the country to turn against me. This matter is in court so I will not comment.
Let me tell that in the youth conference of Hindustan newspaper held in Almora, in my youth, my youth, Union Minister for Youth and Sports, Kiren Rijiju said that we will make players better. We have to take the players of the country forward.
He said that we are backward in the Olympics, preparations are going on to come forward. It is being worked out. India won just two medals at the Rio Olympics. It will be our endeavor that now more and more medals come, the players are busy with it.


My youth, my pride: Union Minister Rijiju said, every scheme of the government is in keeping with the youth




"
