,src,lang,text
0,"











Una pareja santiagueña fue detenida con más de 30 kilos de cocaína en su poder
Los sospechosos viajaban con una menor en su camioneta. La droga estaba debajo del asiento trasero.
01 Nov 2019 by Policiales
Una pareja santiagueña que viajaba con un menor de edad en una camioneta 4x4 fue detenida en Tucumán después de que se descubriera que debajo de los asientos traseros transportaban más de 30 kilogramos de cocaína. Aparentemente los sospechosos estaban siendo investigados por la Justicia Federal de Corrientes y venían siendo monitoreados por las fuerzas de seguridad de las tres provincias.
Gendarmería Nacional, en el marco de la lucha contra el narcotráfico llevada adelante por el Ministerio de Seguridad de la Nación, incautó 30 kilos, 549 gramos de cocaína y detuvo a la pareja santiagueña, presuntamente miembros de una organización dedicada al tráfico de drogas.
La fuentes señalaron que fue el resultado de una investigación iniciada en marzo en la provincia de Corrientes.
Con intervención del Juzgado Federal Nº 1 de Corrientes, a cargo del Dr. Juan Carlos Vallejos, efectivos de los Centros de Reunión de Información “Corrientes” y “Tucumán”, en coordinación con el Centro de Reconocimiento y Operaciones contra el Narcotráfico, el Escuadrón 55 y las Unidades de Reconocimiento “Santiago del Estero” y “Tucumán”, desplegaron un operativo cerrojo sobre la Ruta Nacional Nº 38, a la altura del ingreso a la localidad Juan Bautista Alberdi, donde detuvieron una Toyota Hilux ocupada por un hombre, una mujer y un menor de edad.
Del registro de la camioneta con testigos, los gendarmes observaron unos paquetes rectangulares blancos ocultos debajo del asiento trasero, por lo que procedieron a trasladar el rodado y ocupantes hasta la Base de la Unidad a fin de profundizar la inspección con el apoyo del can antinarcóticos de la Fuerza.
Allí constataron que se trataba de 30 kilos, 549 gramos de cocaína distribuidos en 29 “ladrillos”. Además, los uniformados hallaron 1.605 pesos argentinos, 700 dólares estadounidenses y tres celulares.
El magistrado interviniente dispuso el decomiso del estupefaciente y demás elementos, así como también la detención de ambos ciudadanos mayores de edad, entre ellos un colaborador y la cabecilla de la banda delictiva dedicada a la comercialización de droga en distintos puntos del territorio argentino, abarcando el Suroeste de Salta y Noroeste de Tucumán.
La pareja santiagueña habría estado siendo seguida de cerca por los efectivos de la fuerza de seguridad y su viaje era monitoreado, por lo que al interceptarla tenían mucha certeza de que había droga en su poder.
El valor de la droga secuestrada supera los U$S 180.000 (más de $12 millones) en nuestra provincia. La sustancia podría haber sido estirada hasta ocho veces, es decir, se podría obtener un rinde de más de 240 kilos. Con esa cantidad, se ubican en la calle más de 240.000 dosis que se comercializan a un valor de $250 cada una.


",es,"











A couple from Santiago was arrested with more than 30 kilos of cocaine in their possession
The suspects were traveling with a minor in their van. The drug was under the back seat.
01 Nov 2019 by Policiales
A couple from Santiago traveling with a minor in a 4x4 truck was arrested in Tucumán after it was discovered that under the rear seats they were carrying more than 30 kilograms of cocaine. Apparently the suspects were being investigated by the Federal Current Justice and were being monitored by the security forces of the three provinces.
National Gendarmerie, in the framework of the fight against drug trafficking carried out by the Ministry of Security of the Nation, seized 30 kilos, 549 grams of cocaine and arrested the couple from Santiago, allegedly members of an organization dedicated to drug trafficking.
The sources indicated that it was the result of an investigation initiated in March in the province of Corrientes.
With the intervention of the Federal Court No. 1 of Corrientes, in charge of Dr. Juan Carlos Vallejos, members of the Information Centers ""Corrientes"" and ""Tucumán"", in coordination with the Center for Recognition and Operations against Drug Trafficking, the Squadron 55 and the Recognition Units ""Santiago del Estero"" and ""Tucumán"", deployed an operational bolt on National Route No. 38, at the height of the entrance to the town Juan Bautista Alberdi, where they stopped a Toyota Hilux occupied by a man, a Woman and a minor.
From the search of the van with witnesses, the gendarmes observed some white rectangular packages hidden under the back seat, so they proceeded to move the wheeler and occupants to the Base of the Unit in order to deepen the inspection with the support of the anti-narcotics can the force.
There they found that it was 30 kilos, 549 grams of cocaine distributed in 29 “bricks”. In addition, the uniformed found 1,605 Argentine pesos, 700 US dollars and three cell phones.
The intervening magistrate ordered the confiscation of the narcotic drug and other elements, as well as the detention of both citizens of legal age, including a collaborator and the leader of the criminal gang dedicated to the commercialization of drugs in different parts of the Argentine territory, covering the Southwest of Salta and Northwest of Tucumán.
The couple from Santiago would have been being closely followed by the security forces and their trip was monitored, so when they intercepted it they were very certain that there was a drug in their possession.
The value of the kidnapped drug exceeds US $ 180,000 (more than $ 12 million) in our province. The substance could have been stretched up to eight times, that is, a yield of more than 240 kilos could be obtained. With that amount, more than 240,000 doses that are sold at a value of $ 250 each are located on the street.


"
