,src,lang,text
0,"











بغداد تشيع أول متظاهرة واشتباكات وإطلاق غاز على محتجي البصرة
02 Nov 2019, 10:42 by editor25
المواطن - متابعة
المواطن – الرياض
شهد العراق، اليوم السبت، استمراراً للاعتصامات والاحتجاجات في عدد من المناطق. وخرجت احتجاجات في البصرة (جنوباً)، حيث توجه عدد من المتظاهرين، السبت، إلى بوابة ميناء أم قصر للمطالبة بتوفير فرص عمل والقضاء على الفساد وتوفير خدمات، واجهتها قوة مكافحة الشغب بالغاز المسيل للدموع.
كما هاجمت قوة من مكافحة الشغب خيم الاعتصام أمام بوابة ميناء أم قصر في المحافظة الغنية بالنفط.
إلى ذلك، تجددت التظاهرات في الناصرية، مركز محافظة ذي قار، (جنوب شرقي العراق) لليوم التاسع في ساحة الحبوبي وسط الناصرية، حيث توافد العشرات إليها. وقال الناشط المدني، رعد سالم، للعربية “لن نغادر الساحة ما لم تتحقق مطالبنا والمتمثلة بإسقاط الحكومة”.
وليلاً شهدت العاصمة العراقية، ساعات صاخبة امتدت حتى فجر السبت، حيث بقي آلاف المتظاهرين الذين توافدوا منذ صباح الجمعة في أكبر تظاهرة منذ سقوط صدام حسين، محتشدين في ساحة التحرير، متحدين إطلاق قوات الأمن للغاز المسيل للدموع والرصاص المطاط.
 



 
وذكرت المفوضية العليا لحقوق الإنسان في العراق، بحسب ما نقلت وكالة رويترز، أن امرأة لقيت حتفها إثر إصابتها بعبوة غاز في رأسها، مضيفة أن 155 شخصاً على الأقل أصيبوا، الجمعة، مع استخدام الأمن الغاز المسيل للدموع والرصاص المطاطي ضد المحتجين بساحة التحرير في بغداد.
كما لقي خمسة أشخاص حتفهم خلال الليل في حوادث مشابهة.
من جهتهم، أفاد نشطاء ومدونون عراقيون أن ساحة التحرير ستشهد، السبت، تشييع أول متظاهرة، وتدعى نور رحيم علي، لافتين إلى أن الشابة العراقية القتيلة التي درست الطب، كانت تعمل مسعفة للمتظاهرين.
في المقابل، نفى المتحدث باسم رئيس الوزراء عادل عبد المهدي، وفاة متظاهرة قرب جسر الجمهورية، قائلاً “لم يتسلمها أي مستشفى”.
وأظهرت الصور والفيديوهات المتدفقة من ساحة التحرير أعداداً هائلة من المحتجين. كما أظهرت تحدي بعض الشبان بالصدور العارية لقنابل الغاز المسيلة للدموع.
وكما الأيام الخالية، ظلت الاحتجاجات سلمية نسبيا خلال النهار، لكنها اتخذت طابعا أكثر عنفا بعد حلول الظلام، إذ بدأت الشرطة تستخدم الغاز المسيل للدموع والرصاص المطاطي للتصدي للشبان الذين يسمون أنفسهم “الثوريين”.
وتركزت الاشتباكات عند الأسوار خارج جسر الجمهورية المؤدي إلى المنطقة الخضراء فوق نهر دجلة حيث المباني الحكومية التي يقول المحتجون إن القادة عزلوا أنفسهم فيها بعد أن صارت معقلا للامتيازات تحميه الأسوار. وكتب محتج على جدار قريب “كلما نشتم رائحة الموت بدخانكم نشتاق أكثر لعبور جسر جمهوريتكم”.
ونصب الآلاف خياماً في ساحة التحرير وانضم إليهم آلاف آخرون كثر أمس الجمعة. واجتذبت صلاة الجمعة أكبر الحشود من المتظاهرين حتى الآن.
وبحلول عصر الجمعة كان عشرات الآلاف قد احتشدوا في الميدان منددين بالنخب التي يرونها فاسدة تأتمر بأمر القوى الأجنبية ويحملونها المسؤولية عن تردي أوضاع المعيشة.



‎وسومالعراقمظاهراتهل قرأت هذا ؟  عبدالرحمن الراشد: نظام إيران أصبح مكروهاً في العراق ولبنان فيديو.. عراقي ينجو من رصاصة قاتلة بمراوغة أشبه بأفلام الأكشن مقتل شخص وإصابة 50 خلال تظاهرات في بغداد أمريكا تتخلص من أشلاء البغدادي

‎إلغاء الرد

لن يتم نشر عنوان بريدك الإلكتروني.
هذا الموقع يستخدم Akismet للحدّ من التعليقات المزعجة والغير مرغوبة. تعرّف على كيفية معالجة بيانات تعليقك.


",ar,"











Baghdad mourns the first demonstration, clashes and the release of gas at Basra protesters
02 Nov 2019, 10:42 by editor25
Citizen - Continue
Citizen - Riyadh
On Saturday, Iraq witnessed a continuation of sit-ins and protests in a number of areas. There were protests in Basra (south), where a number of demonstrators, on Saturday, to the gate of the port of Umm Qasr to demand jobs and eliminate corruption and provide services, faced by the riot police with tear gas.
A riot force also attacked sit-in tents in front of the port of Umm Qasr in the oil-rich province.
Demonstrations in Nassiriya, the center of Dhi Qar province (southeastern Iraq), were renewed for the ninth day in al-Haboubi Square in central Nassiriya, where dozens flocked to it. ""We will not leave the scene unless our demands for the overthrow of the government are fulfilled,"" civil activist Raad Salem told Al Arabiya.
Overnight, the Iraqi capital witnessed noisy hours until dawn on Saturday, as thousands of demonstrators who had gathered since Friday morning in the largest demonstration since the fall of Saddam Hussein, gathered in Tahrir Square, defying the security forces' release of tear gas and rubber bullets.





A woman was killed by a tear gas canister in the head, the UN High Commissioner for Human Rights in Iraq said, adding that at least 155 people were injured on Friday as security forces used tear gas and rubber bullets against protesters in Baghdad's Tahrir Square.
Five people died overnight in similar incidents.
For their part, Iraqi activists and bloggers said that Tahrir Square will witness on Saturday, the funeral of the first female demonstrator, named Rahim Ali, pointing out that the young Iraqi woman who studied medicine, was working as a paramedic for the demonstrators.
On the other hand, denied the spokesman for Prime Minister Adel Abdul-Mahdi, the death of a protester near the bridge of the Republic, saying, ""no hospital received it.""
Images and videos streamed from Tahrir Square showed huge numbers of protesters. It also showed the challenge of some young men with bare breasts of tear gas canisters.
Like the old days, the protests remained relatively peaceful during the day, but they became more violent after dark, as police began using tear gas and rubber bullets to counter youths calling themselves ""revolutionaries.""
The clashes centered on the walls outside the Republic Bridge leading to the Green Zone above the Tigris River, where government buildings where protesters say leaders isolated themselves after they became a stronghold of privileges protected by the walls. ""The more we smell death with your smoke, the more we miss to cross the bridge of your republic,"" one protester wrote on a nearby wall.
Thousands set up tents in Tahrir Square and many thousands more joined them on Friday. Friday prayers have attracted the largest crowd of demonstrators so far.
By Friday afternoon, tens of thousands had rallied in the square, denouncing elites they saw as corrupt, ordering foreign powers to blame for poor living conditions.



Somal Iraq demonstrations, have you read this? Abdul Rahman Al-Rashed: the regime of Iran has become unpopular in Iraq and Lebanon Video .. Iraqi escapes from a deadly bullet dodging more like action films killed one person and wounded 50 during demonstrations in Baghdad America get rid of the remains of Baghdadi

Cancel reply

your e-mail address will not be published.
This site uses Akismet to reduce spam and spam comments. Learn how to process your comment data.


"
