,src,lang,text
0,"











États-Unis : une femme retrouvée morte dans un vivarium, un python autour du cou
Le corps de Laura Hurst, 36 ans, a été découvert mercredi 30 octobre dans une maison inhabitée de l'Indiana, où se trouvaient 140 serpents.
02 Nov 2019, 10:58 by Léa Stassinet
Les médecins ont tenté sans succès de la réanimer. Mercredi 30 octobre, une américaine de 36 ans a été retrouvée morte avec un python autour du cou dans une maison de l'Indiana. Le lieu abritait près de 140 serpents, a indiqué jeudi 31 octobre la police de cet État du nord-est des États-Unis.
Le corps de Laura Hurst a été découvert mercredi dans une maison inhabitée d'Oxford, avec un python réticulé de 2,4 mètres enroulé autour de son cou, a précisé un porte-parole de la police dans un communiqué. ""Il semble qu'elle ait été étranglée par le serpent"", a dit la policière, citée par le quotidien Lafayette Journal & Courier. ""Nous en serons sûrs après l'autopsie"".
La maison, qui appartient au chef de la police locale, Don Munson, servait de vivarium pour environ 140 reptiles, dont une vingtaine appartenaient à la victime, selon le journal. La mort de Laura Hurst est un ""accident tragique"", a dit au quotidien le propriétaire de la maison, qui a découvert le corps.

La rédaction vous recommande







",fr,"











United States: a woman found dead in a vivarium, a python around her neck
The body of 36-year-old Laura Hurst was found on Wednesday, October 30 in an uninhabited house in Indiana, home to 140 snakes.
02 Nov 2019, 10:58 by Léa Stassinet
The doctors tried unsuccessfully to revive her. On Wednesday, October 30, a 36-year-old American woman was found dead with a python around her neck in an Indiana home. The place was home to nearly 140 snakes, said Thursday, October 31, the police of this state of the northeastern United States.
Laura Hurst's body was discovered Wednesday in an uninhabited Oxford house, with a 2.4-meter reticulated python wrapped around her neck, a police spokeswoman said in a statement. ""It seems like she was strangled by the snake,"" said the policewoman, quoted by the daily Lafayette Journal & Courier. ""We will be sure after the autopsy.""
The house, which belongs to local police chief Don Munson, served as a vivarium for about 140 reptiles, of which about 20 belonged to the victim, according to the newspaper. Laura Hurst's death is a ""tragic accident,"" the homeowner, who discovered the body, told the daily newspaper.

The editor recommends you







"
