,src,lang,text
0,"











بالفيديو..أفنان الباتل تثير الجدل لوصفها الرجال بـ «التحف»
06 Nov 2019, 02:26 by أميرة خالد
أثارت نجمة مواقع التواصل الاجتماعي المواطنة أفنان الباتل، جدلا واسعا بسبب وصفها الرجال بـ«التحف».
وكانت الباتل قد نشرت مقطع فيديو لطفلها الصغير تركي الذي وضعته مؤخرًا، موضحة أنها بعد الولادة اكتشفت أن الرجال لديهم هاجس داخلي بأنهم يريدون أن يكون ولدهم الذكر يشبه الأب.
وأشارت إلى أن الرجال يتفاخرون بذلك عند دخولهم أي مجلس ليقال إن الولد يشبه أبوه مو بيشبه أمه، واصفة الرجال قائلًة: «تحب الرجال دول تحف».
وتعرضت أفنان للعديد من الانتقادات بشأن هذا المقطع، مشيرين إلى أنها تستعرض طفلها وتجهل كيفية الحديث عن الرجال.
اقرأ أيضًا:

متابعة تٌرعب أفنان الباتل بتعليق حاسد: « حتى المرض ما يقدر عليها »


أفنان الباتل تؤكد ولادتها بـ «فيديو» على سناب شات



",ar,"











Video .. Artist Battel raise controversy to describe men as «antiques»
06 Nov 2019, 02:26 by Amira Khalid
Social media star Afnan al-Batel has sparked controversy by calling men ""antiques.""
Al-Batel had published a video of her young child, Turki, who recently put it, explaining that after birth she discovered that the men have an internal obsession that they want to be their male son resembles the father.
She pointed out that the men boast about this when they enter any council to say that the boy resembles his father Mo similar to his mother, describing the men, saying: «men love countries antiques».
Afnan has been criticized for this passage, pointing out that she is reviewing her child and do not know how to talk about men.
Also read:

Afnan al-Batel terrifies with a sharp comment: «Even the disease is capable»


Afnan Al-Batel confirms her birth with «Video» on Snapchat



"
