,src,lang,text
0,"











Previa del partido de la jornada 10: Union Berlín - Hertha BSC
01 Nov 2019, 17:31 by SPORT.es

El partido se disputará en el An der alten Forsterei el próximo sábado a las 18:30

El próximo sábado a las 18:30 se enfrentarán en el An der alten Forsterei el Union Berlín y el Hertha en el partido que corresponde a la jornada número 10 de la Bundesliga.
El Union Berlín encara con ilusión de recuperar puntos en el encuentro correspondiente a la décima jornada tras sufrir una derrota contra el Bayern München en el partido anterior por un resultado de 2-1. Desde el comienzo de la temporada, los locales han vencido dos de los nueve encuentros jugados hasta la fecha, con nueve tantos a favor y 15 en contra.
Por su parte, el Hertha BSC no pudo hacer frente al Hoffenheim en su último partido (2-3), por lo que llega al encuentro con la necesidad de recuperar la victoria en el campo del Union Berlín.
Centrando la atención en el rendimiento como equipo local, el Union Berlín ha vencido dos veces y ha perdido en tres ocasiones en cinco partidos jugados hasta ahora, de modo que no podremos conocer cuál será su desenlace en este encuentro, pero sí que deberá luchar para ganar. En las salidas, el Hertha BSC ha vencido una vez, ha sido derrotado en dos ocasiones y ha empatado dos veces en sus cinco encuentros que ha jugado hasta ahora, por lo que deberá esforzarse en arañar puntos en su visita al estadio del Union Berlín para intentar romper las estadísticas.
Las cifras sobre los encuentros en este estadio entre ambos equipos en la Bundesliga indican que el Hertha ha ganado en dos ocasiones al Union Berlín, mientras que éste no ha conseguido ganar ninguna vez y el otro partido restante acabó con un empate. Además, los visitantes no pierden en sus últimas tres visitas al estadio del Union Berlín. El último encuentro entre el Union Berlín y el Hertha en esta competición se disputó en febrero de 2013 y finalizó en tablas (2-2).
Analizando la situación de estos equipos en la tabla clasificatoria de la Bundesliga, podemos ver que el equipo visitante está por delante del Union Berlín con una diferencia de cuatro puntos. El equipo de Urs Fischer se sitúa en el decimoquinto puesto con siete puntos en el casillero. Por su lado, los visitantes cuentan con 11 puntos y ocupan la undécima posición en el torneo.


",es,"











Preview of matchday 10: Union Berlin - Hertha BSC
01 Nov 2019, 17:31 by SPORT.es

The match will be played at the An der alten Forsterei on Saturday at 6:30 p.m.

Next Saturday at 6:30 p.m., the Union Berlin and Hertha will meet in the An der alten Forsterei in the match corresponding to the 10th day of the Bundesliga.
The Union Berlin is looking forward to recovering points in the match corresponding to the tenth day after suffering a defeat against Bayern München in the previous match for a 2-1 result. Since the beginning of the season, the locals have won two of the nine games played to date, with nine goals in favor and 15 against.
For his part, Hertha BSC could not face Hoffenheim in his last game (2-3), so he came to the meeting with the need to regain victory in the field of Union Berlin.
Focusing attention on performance as a local team, Union Berlin has won twice and has lost three times in five games played so far, so that we will not be able to know what its outcome will be in this match, but it will have to fight for win. In the outings, the Hertha BSC has won once, has been defeated twice and has drawn twice in his five games he has played so far, so he must strive to scratch points during his visit to the Union Berlin stadium to Try to break the statistics.
The figures on the meetings in this stadium between both teams in the Bundesliga indicate that Hertha has won twice at Union Berlin, while he has not managed to win at any time and the other match ended with a draw. In addition, visitors do not lose in their last three visits to the stadium of the Union Berlin. The last meeting between Union Berlin and Hertha in this competition was held in February 2013 and ended in tables (2-2).
Analyzing the situation of these teams in the Bundesliga leaderboard, we can see that the visiting team is ahead of the Berlin Union with a difference of four points. The team of Urs Fischer is placed in the fifteenth place with seven points in the locker. On the other hand, visitors have 11 points and occupy the eleventh position in the tournament.


"
