,src,lang,text
0,"











TST considera cobrador de ônibus atividade de risco e manda empresa indenizar por depressão
Trabalhador passou por cinco assaltos; ele pediu R$ 200 mil
01 Nov 2019, 17:35 by Fernanda Brigatti

São Paulo

​A Terceira Turma do TST (Tribunal Superior do Trabalho) condenou a CS Brasil, empresa de transporte público de Mogi das Cruzes (Grande SP), a pagar indenização a um cobrador de ônibus que desenvolveu depressão grave após passar por cinco assaltos durante a jornada de trabalho. 
O trabalhador pediu R$ 200 mil, mas o valor ainda será definido no TRT-2 (Tribunal Regional do Trabalho de São Paulo).
A condenação ocorreu porque os ministros consideraram que a função exercida por ele se enquadra no conceito de atividade de risco e, portanto, havia responsabilidade objetiva da empresa no dano sofrido pelo empregado.
A decisão é um avanço em relação às atividades que recebem esse enquadramento. 
A responsabilidade objetiva em caso de atividade de risco já é prevista no artigo 927 do Código de Processo Civil. A norma chamada de teoria do risco define que as empresas têm de “reparar o dano, independentemente da culpa”, nos casos em que, devido à natureza do trabalho, o funcionário fique vulnerável à violência.



Gallery: Função de cobrador de ônibus é considerada atividade de risco na Justiça do Trabalho


O ministro Agra Belmonte afirmou, em relatório na ação no TST, que o trabalhador teria direito à indenização mesmo que não tivesse demonstrado o abalo psicológico. Ele disse também que deve ser atribuída responsabilidade ao empregador quando a atividade ofereça risco à integridade física do empregado.
Para Belmonte, o trabalho no transporte público se enquadra nesse entendimento, pois é “sabidamente visado por criminosos, ante a facilidade de se acessar o dinheiro do caixa.” Além disso, o fato de a segurança pública ser dever do Estado, não exime a responsabilidade da empresa.
O cobrador que foi à Justiça do Trabalho relatou ter sido vítima de cinco assaltos, nos quais sofreu ameaças de morte. Ele foi afastado e laudo médico pericial confirmou o nexo causal, que é a incapacidade decorrente do trabalho. O diagnóstico foi de episódio depressivo grave e transtorno de pânico.
A CS Brasil informou que, embora respeite a decisão da TST, não concorda com a condenação por não desenvolver atividade de risco e, “sobretudo, porque o evento se trata de fortuito externo ao contrato de trabalho.” A empresa vai aguardar o TRT-2.
O advogado Ricardo Calcini, professor de direito do trabalho, diz que o entendimento quanto à responsabilidade das empresas é pacificado, mas que vem aumentando a percepção de que trabalhos como o de cobrador de transporte coletivo é considerado atividade de risco. 
“Especialmente em grandes cidades e capitais, é um trabalho que expõe o trabalhador”, explica. “A Justiça vai considerar também se o empregador tomou alguma medida para mitigar os riscos, de modo a reduzir o dano para o funcionário.”
O entendimento de que a empresa tem essa obrigação foi confirmado pelo STF (Supremo Tribunal Federal) em setembro, em recurso especial que discutia se a Protege S/A, empresa de transporte de valores, precisava ou não indenizar um vigilante de carro-forte que sofreu danos psicológicos decorrentes de um assalto. 
Esse caso foi analisado como repercussão geral, mas a tese a ser aplicada ainda não foi declarada. Quando isso for feito, o entendimento definido pelos ministros do Supremo deve passar a ser usado em todos os processos que discutem o tema.


",pt,"











TST considers bus collector a risky activity and orders company to compensate for depression
Worker went through five robberies; he asked for $ 200 thousand
01 Nov 2019, 17:35 by Fernanda Brigatti

Sao Paulo

The Third Panel of the Superior Labor Court (TST) ordered CS Brasil, a public transport company from Mogi das Cruzes (Grande SP), to pay compensation to a bus collector who developed severe depression after experiencing five robberies during the journey. Work
The worker asked for $ 200,000, but the amount will still be set in TRT-2 (Regional Labor Court of São Paulo).
The condemnation came because the ministers considered that the function performed by him falls under the concept of risk activity and, therefore, there was objective liability of the company in the damage suffered by the employee.
The decision is an advance in relation to the activities that receive this framework.
Objective liability in case of risky activity is already provided for in Article 927 of the Code of Civil Procedure. The so-called risk theory rule states that companies have to “repair damage regardless of fault” in cases where, due to the nature of the work, the employee is vulnerable to violence.



Gallery: Bus Charger Function Is Considered a Risk Activity in the Labor Court


Minister Agra Belmonte stated in a report in the TST suit that the worker would be entitled to compensation even if he had not shown psychological upheaval. He also said that responsibility should be given to the employer when the activity poses a risk to the employee's physical integrity.
For Belmonte, work in public transport fits this understanding, since it is “wisely targeted by criminals, given the ease of access to cash.” In addition, the fact that public security is the duty of the state does not exempt Company responsibility.
The collector who went to Labor Court reported being the victim of five robberies in which he suffered death threats. He was removed and medical report confirmed the causal link, which is the disability due to work. The diagnosis was severe depressive episode and panic disorder.
CS Brasil reported that while complying with TST's decision, it does not agree with the conviction for not engaging in risky activity and “above all because the event is a fortuitous event outside the employment contract.” The company will await TRT- 2.
Lawyer Ricardo Calcini, professor of labor law, says that the understanding about corporate responsibility is pacified, but that has been increasing the perception that works such as public transportation collector is considered a risky activity.
“Especially in big cities and capitals, it's a job that exposes the worker,” he explains. ""The court will also consider whether the employer has taken any steps to mitigate the risks in order to reduce the harm to the employee.""
The understanding that the company has this obligation was confirmed by the Supreme Court (STF) in September, in a special appeal discussing whether or not Protege S / A, a securities company, needed to indemnify a strongman vigilante who suffered psychological damage from a robbery.
This case was analyzed as a general repercussion, but the thesis to be applied has not been stated yet. When this is done, the understanding defined by the ministers of the Supreme should be used in all processes that discuss the issue.


"
