,src,lang,text
0,"











Антикорупційний суд 6 листопада розгляне справу Труханова
Вищий антикорупційний суд 6 листопада розпочне розгляд справи щодо недостовірного декларування доходів одеським міським головою Геннадієм Трухановим.

01 Nov 2019, 17:56

Про це повідомляє пресслужба Спеціалізованої антикорупційної прокуратури.
«У п’ятницю, 1 листопада 2019 року, за участі прокурорів САП в Антикорупційному суді призначили вказану справу до розгляду по суті. Засідання заплановано на 6 листопада 2019 року». — йдеться у повідомленні.
У цій справі йдеться про злочин, передбачений статтею 366-1 КК України, скоєний посадовою особою органу місцевого самоврядування, а такі справи підсудні ВАКС.
Раніше САП встановила, що в деклараціях Труханова за 2015 та 2016 роки відсутня інформація про майно та інші об'єкти декларування на суму понад 33 млн грн та 18 млн грн відповідно.
Читайте також:


НАБУ і САП проводять обшуки у екснардепа Дубневича — агентство


Корупційний скандал у Раді: САП кличе на допит всіх членів фінкомітету




",uk,"











Anti-corruption court will consider Trukhanov's case on November 6
On November 6, the Supreme Anti-Corruption Court will start considering the case of false declaration of income by the mayor of Odessa Gennady Trukhanov.

01 Nov 2019, 16:56

About it reports a press-service of the Specialized anti-corruption prosecutor's office.
“On Friday, November 1, 2019, with the participation of the SAP prosecutors in the Anti-Corruption Court, they assigned the case to the merits. The meeting is scheduled for November 6, 2019. "" - the message says.
In this case, it is a crime under Article 366-1 of the Criminal Code of Ukraine, committed by a local government official, and such cases are the responsibility of the WACC.
Earlier, the SAP found that Trukhanov's declarations for 2015 and 2016 did not contain information about property and other objects of declaring in the amount of more than UAH 33 million and UAH 18 million, respectively.
Read also:


NABU and SAP conduct searches at Dubnevich's ex-deputy agency


Corruption scandal in the Council: SAP calls for questioning by all members of the committee




"
