,src,lang,text
0,"











Verstappen, el más rápido en el Libre1
01 Nov 2019, 18:36 by Europa Press

El neerlandés paró el crono en 1:34:057 para demostrar que llega con ritmo
Los pilotos elevaron sus quejas por los baches del trazado estadounidense

El piloto neerlandés Max Verstappen (Red Bull) fue el más rápido este viernes en la primera sesión de entrenamientos libres del Gran Premio de Estados Unidos, decimonovena cita del Mundial que se disputa en el circuito de Las Américas, marcada por las numerosas pruebas con los neumáticos y por la falta de conclusiones de cara a la carrera del domingo.
Verstappen -que afronta su Gran Premio número 100 en la Fórmula 1- paró el reloj en 1:34:057 demostrando ser el más fuerte en un trazado con muchos baches que generó las quejas de buena parte del 'paddock'. Los pilotos elevaron su malestar a las escuderías y la organización explicó que poco pueden hacer después de haber reasfaltado el circuito recientemente. En cualquier caso, las imágenes hablan por sí solas.
El holandés, a sus 22 años, logró su primera 'pole' el pasado mes de agosto y desde entonces aparece siempre en las quinielas de los mejores. Este viernes se sobrepuso a los saltos y a las dificultades planteadas en la prueba americana, aunque su registro tiene poco valor porque todos los equipos adoptaron el neumático prototipo de 2020, algo que impide dotar de fiabilidad al crono de cara al domingo.
De hecho, Lewis Hamilton (Mercedes), actual líder del Mundial y previsible campeón este fin de semana, acabó con el octavo mejor tiempo, un puesto por debajo del Ferrari de Charles Leclerc, quien se llevó la 'pole' hace una semana por la sanción a Verstappen. En cualquier caso, todo podría dar un vuelco esta noche con la segunda sesión de libres.
El segundo mejor tiempo fue para el alemán Sebastian Vettel (Ferrari), que paró el reloj a 16 centésimas de Verstappen, mientras que la tercera posición correspondió a Alexander Albon (Red Bull). El británico entró a 25 centésimas después de salvar con maestría los problemas de bacheado en sus 28 giros al circuito estadounidense.
Por su parte, el piloto español Carlos Sainz (McLaren) -que también se convirtió en centenario en la Fórmula 1-, aprovechó la sesión para probar un prototipo de compuesto suave de cara a la temporada que viene y concluyó con el duodécimo mejor cronómetro, a un segundo y 66 centésimas de Verstappen.


",es,"











Verstappen, the fastest in Libre1
01 Nov 2019, 18:36 by Europa Press

The Dutchman stopped the clock at 1: 34: 057 to show that he arrives with rhythm
The pilots raised their complaints about the bumps on the US track

The Dutch rider Max Verstappen (Red Bull) was the fastest this Friday in the first free practice session of the United States Grand Prix, nineteenth World Cup event held in the circuit of Las Americas, marked by numerous tests with the tires and the lack of conclusions for the race on Sunday.
Verstappen - who faces his 100th Grand Prix in Formula 1- stopped the clock at 1: 34: 057 proving to be the strongest on a track with many potholes that generated complaints of much of the 'paddock'. The pilots raised their discomfort to the teams and the organization explained that little can be done after having recently resurfaced the circuit. In any case, the images speak for themselves.
The Dutchman, at 22, achieved his first pole last August and since then always appears in the best pools. This Friday he overcame the jumps and the difficulties posed in the American test, although his record has little value because all the teams adopted the 2020 prototype tire, something that prevents providing reliability to the clock ahead of Sunday.
In fact, Lewis Hamilton (Mercedes), current World Cup leader and predictable champion this weekend, finished with the eighth fastest time, one place below the Ferrari of Charles Leclerc, who took the 'pole' a week ago by the sanction to Verstappen. In any case, everything could turn around tonight with the second session of free.
The second best time was for German Sebastian Vettel (Ferrari), who stopped the clock at 16 hundredths of Verstappen, while third place was Alexander Albon (Red Bull). The Briton entered 25 cents after mastering the problems of potholes in his 28 turns to the American circuit.
For its part, the Spanish pilot Carlos Sainz (McLaren) - who also became a centenary in Formula 1-, took advantage of the session to test a prototype of a soft compound for the coming season and concluded with the twelfth best stopwatch, to a second and 66 hundredths of Verstappen.


"
