,src,lang,text
0,"











Στην Ινδία η Άνγκελα Μέρκελ
01 Nov 2019, 18:41 by Γιώργος Αϊβαλιώτης



Στην Ινδία για τριήμερη επίσημη επίσκεψη βρίσκεται η Άνγκελα Μέρκελ.
Η καγκελάριος της Γερμανίας συναντήθηκε την Παρασκευή με τον Ινδό Πρωθυπουργό, Ναρέντα Μόντι.
Ήδη υπεγράφησαν 22 εμπορικές συμφωνίας ανάμεσα σε Νέο Δελχί και Βερολίνο.
«Οι τομείς στους οποίους θέλουμε να συνεργαστούμε είναι η τεχνητή νοημοσύνη και η ψηφιακή μεταμόρφωση. Η Ινδία έχει μεγάλες προοπτικές σε αυτά», τόνισε η Άνγκελα Μέρκελ.
Η υγεία, ο αγροτικός τομέας, η επιστήμη μέχρι και τα απόβλητα είναι μεταξύ των οικονομικών συμφωνιών των δύο πλευρών.
«Το 2022 η Ινδία γιορτάζει τα 75 χρόνια από την ανεξαρτησία της. Έχουμε θέσει ως στόχο την οικοδόμηση μίας καινούριας Ινδίας έως τότε. Για να πετύχουμε αυτόν τον πολυδιάστατο στόχο, η τεχνογνωσία μίας τεχνολογικής και οικονομικής υπερδύναμης όπως η Γερμανία θα είναι πολύ χρήσιμη για την προτεραιότητες και τις ανάγκες της Ινδίας», ανέφερε ο Ναρέντα Μόντι.
Οι δύο ηγέτες επισκέφθηκαν ακολούθως το μαυσωλείο και το μουσείο του Μαχάτμα Γκάντι.


",el,"











In India, Angela Merkel
01 Nov 2019, 18:41 by George Aivaliotis



Angela Merkel is in India for a three-day official visit.
The German Chancellor met Friday with the Indian Prime Minister, Narendra Modi.
22 trade agreements have already been signed between New Delhi and Berlin.
""The areas in which we want to work together are artificial intelligence and digital transformation. India has great prospects in them, ""said Angela Merkel.
Health, the agricultural sector, science and waste are among the economic agreements of the two sides.
""In 2022, India is celebrating its 75th anniversary. We have set the goal of building a new India by then. To achieve this multi-dimensional goal, the know-how of a technological and economic superpower such as Germany will be very useful for India's priorities and needs, ”said Narendra Modi.
The two leaders then visited Mahatma Gandhi's mausoleum and museum.


"
