,src,lang,text
0,"











Turiştii nu mai au voie să fotografieze gheişe în Kyoto pentru că le hărţuiesc
05 Nov 2019, 16:32 by Jurnal.md

Autorităţile din Kyoto au interzis fotografiile în zonele turistice populate de geishe, după ce plângeri au fost înregistrate în ceea ce priveşte comportamentul abuziv şi hărţuirea de către turiştii în căutarea selfie-ului perfect a geishelor, relatează The Guardian.

Interdicţia va fi aplicată în districtul Gion al fostei capitale japoneze. Cei care nu o vor respecta, vor primi amenzi de 80 de euro. Kyoto, dar şi întreaga Japonie primesc constant valuri de turişti în ultima vreme, mai ales ca urmare a faptului că ţara va găzdui Jocurile Olimpice de anul viitor.
„Poluarea turistică” a devenit, astfel, o adevărată probleă pentru Kyoto, unde turiştii se năpustesc pentru a se fotografia cu altare Shinto şi urmăresc geishele pentru a le fotografia sau pentru a îşi face selfie-uri cu ele.
Districtul Gion găzduieşte mai multe restaurante unde geishele îi servesc pe clienţi pe muşamale tatami. Într-un sondaj în 300 de restaurante şi magazine din zona, oamenii s-au plâns că turiştii aruncă ambalaje, fumează în mers, blochează traficul şi încalcă proprietatea privată. Unii spun chiar că turiştii aleargă după geishe şi le hărţuiesc pentru a îşi face fotografii alături de ele.
Măsura vine la pachet cu implementări de mesaje pe telefoane pentru turişti - în momentul în care cineva se apropie de districtul Gion, smartphone-ul său va primi un mesaj în engleză şi mandarină în care li se va cere să se comporte civilizat, să nu hărţuiască geishele şi să fotografieze pe cineva doar după ce primesc permisiune, scrie digi24.ro.
31 de milioane de turişti au vizitat Japonia anul trecut, o creştere de 9% faţă de anul precedent.


",ro,"











Tourists are no longer allowed to photograph geysers in Kyoto because they are harassing them
05 Nov 2019, 4:32 pm by Jurnal.md

Authorities in Kyoto have banned photos in tourist areas populated by geysers, after complaints were filed regarding abusive behavior and harassment by tourists in search of the perfect selfies of geysers, reports The Guardian.

The ban will be enforced in the Gion district of the former Japanese capital. Those who do not comply will receive fines of 80 euros. Kyoto, as well as the whole of Japan, has been receiving waves of tourists constantly lately, especially as a result of the country hosting the next year's Olympics.
""Tourist pollution"" has thus become a real problem for Kyoto, where tourists flock to take pictures of Shinto altars and follow the geisha to photograph them or take selfies with them.
Gion district hosts several restaurants where geisha serve customers on tatami meats. In a survey of 300 restaurants and shops in the area, people complained that tourists throw away their packs, smoke on the go, block traffic and breach private property. Some even say that tourists go after the geysers and harass them to take pictures with them.
The measure comes bundled with mobile phone deployments for tourists - the moment someone approaches the Gion district, their smartphone will receive an English and Mandarin message asking them to behave civilly, not to harass. geyses and to photograph someone only after receiving permission, writes digi24.ro.
31 million tourists visited Japan last year, an increase of 9% over the previous year.


"
