,src,lang,text
0,"











La variant de Vallirana obre avui, després de 15 anys d’obres
La infraestructura ha patit aturades i canvis diverses vegades

05 Nov 2019, 11:26

Han fet falta més de 15 anys d’obres i moltes hores de cua a la carretera, però finalment el ministeri de Foment va anunciar ahir que l’esperada variant de Vallirana s’obre des d’avui dimarts al trànsit. Es tracta del tram d’autovia B-24 que, a partir d’avui, es converteix en l’alternativa a la N-340 al pas per aquest municipi, una reivindicació històrica al territori. Les obres, de fet, es van licitar l’any 2003 i van començar el 2004. Seguint aquest calendari, la infraestructura s’hauria hagut d’inaugurar tres anys després, el 2007. En canvi, no s’ha obert a la circulació fins dotze anys més tard.
El traçat que avui s’obre al trànsit comença en una rotonda sobre la N-340, a l’entrada del nucli urbà de Vallirana, que arriba del port de l’Ordal, i finalitza a l’enllaç amb Cervelló oest de la B-24. Segons va explicar ahir el ministeri en un comunicat, el nou itinerari representa “una alternativa de gran capacitat per al trànsit de llarg i mitjà recorregut” que fins ara es veia obligat a circular pel mig de Vallirana -seguint la N-340-, on hi ha una limitació de velocitat a 50 km/h, moltes interseccions amb semàfors i passos de vianants. Tot plegat ha fet que aquest tram hagi estat, fins avui, un focus de retencions freqüents.
L’obertura d’aquesta infraestructura llargament reclamada suposa, per tant, un canvi substancial per als veïns del municipi, que fins ara suportaven el pas d’uns 19.000 vehicles de mitjana diaris pel centre urbà. Ara aquesta alternativa servirà per desviar una gran part del trànsit i en minimitzarà els efectes, com ara el de la pol·lució, el soroll i el risc d’atropellaments, a banda de millorar la seguretat viària. La longitud total del tram és d’uns tres quilòmetres, amb dues calçades de dos carrils per sentit, i la majoria del tram discorre pel nou túnel de Vallirana.
El cost final de les obres ha ascendit fins a 176 milions d’euros, incloent-hi les expropiacions, la redacció del projecte i el control i la vigilància.
Obres intermitents
Vallirana reclama aquesta variant des de finals dels 80. La culminació de l’obra ha estat motiu de queixes i retrets constants entre els governs municipal, català i espanyol. L’acte de col·locació de la primera pedra -el març del 2004- va suposar, a la pràctica, el tret de sortida d’un calendari molt accidentat. Durant aquests anys, les obres s’han engegat i aturat diverses vegades i els temps d’execució s’han dilatat. L’últim sotrac va ser durant la crisi, amb les retallades: el 2011 es van aturar les obres i també se’n va suspendre el pressupost fins al 2014, quan es van reprendre.


",ca,"











The variant of Vallirana opens today, after 15 years of works
The infrastructure has suffered stoppages and changes several times

05 Nov 2019, 11:26

More than 15 years of work and many hours of queuing have been needed on the road, but finally the Ministry of Development announced yesterday that the expected variant of Vallirana opens up today on Tuesday in the traffic. It is the section of the B-24 dual carriageway that, as of today, becomes the alternative to the N-340 passing through this municipality, a historical claim to the territory. The works, in fact, were tendered in 2003 and began in 2004. Following this calendar, the infrastructure had to be inaugurated three years later, in 2007. Instead, it was not open to circulation up to twelve years later.
The route that opens today to the traffic begins at a roundabout on the N-340, at the entrance to the urban nucleus of Vallirana, which arrives from the port of L'Ordal, and ends at the link with Cervelló west of the B -24. As explained yesterday by the ministry in a statement, the new itinerary represents ""an alternative of great capacity for long and medium-distance traffic"" which until now was forced to travel in the middle of Vallirana, following the N-340-, where there is a speed limitation at 50 km / h, many intersections with traffic lights and pedestrian crossings. All this made that this section has been, until today, a focus of frequent retentions.
The opening of this long-claimed infrastructure means, therefore, a substantial change for the residents of the municipality, which up until now had been supporting about 19,000 vehicles per day on the urban center. Now this alternative will serve to divert a large part of the traffic and minimize the effects, such as pollution, noise and the risk of accidents, as well as improving road safety. The total length of the stretch is about three kilometers, with two roads of two lanes per direction, and most of the section runs through the new Vallirana tunnel.
The final cost of the works has risen to 176 million euros, including expropriations, drafting of the project, and monitoring and monitoring.
Intermittent works
Vallirana claims this variant since late 80. The culmination of the work has been the subject of constant complaints and accusations between municipal governments, Catalan and Spanish. The act of laying the first stone - in March 2004 - supposed, in practice, the outcome of a very rugged calendar. During these years, the works have been set up and stopped several times and the execution times have been dilated. The last sotrac was during the crisis, with the cuts: in 2011 the works were stopped and the budget was suspended until 2014, when they were resumed.


"
