,src,lang,text
0,"











OCDE: l'inflation annuelle ralentit en septembre 2019
05 Nov 2019, 11:00 by AWP

Les prix de l'énergie ont continué à baisser, tandis que l'inflation des prix des produits alimentaires a ralenti.

L'inflation annuelle dans la zone OCDE a ralenti à 1,6% en septembre 2019, contre 1,9% en août, reflétant principalement le ralentissement de l'inflation en Turquie à 9,3% en septembre contre 15,0% en août. Les prix de l'énergie ont continué à baisser, de (moins) 2,6% après (moins) 1,7% en août, tandis que l'inflation des prix des produits alimentaires a ralenti à 1,5% contre 1,9% en août. L'inflation annuelle hors alimentation et énergie a également ralenti à 2,1% en septembre contre 2,3% en août.


Prix à la consommation, sélection


Septembre 2019, glissement annuel, en pourcentage





OCDE-Total (Prix à la consommation) et zone euro (IPCH)


Glissement annuel, en pourcentage



En septembre 2019, l'inflation annuelle a ralenti ou a été stable dans toutes les principales économies. Elle a diminué en Allemagne (à 1,2% contre 1,4% en août), en France (à 0,9% contre 1,0%), en Italie (à 0,3% contre 0,4%), au Japon (à 0,2% contre 0,3%), alors qu’elle a été stable au Canada (à 1,9%), au Royaume-Uni et aux États-Unis (tous les deux à 1,7%).
Dans la zone euro, l’inflation annuelle, mesurée par l’IPCH1, a diminué à 0,8% en septembre après 1,0% en août. Hors alimentation et énergie, l’inflation annuelle dans la zone euro a légèrement augmenté à 1,0% après 0,9% en août. L’estimation rapide d’Eurostat pour octobre indique une inflation annuelle ralentissant à 0,7%, tandis que l’inflation hors alimentation et énergie augmente à 1,1%.
L’inflation annuelle dans les pays du G202 a diminué légèrement à 3,1% en septembre 2019 après 3,2% en août. Parmi les économies du G20 non membres de l'OCDE, l'inflation annuelle a légèrement diminué, mais est restée très élevée en Argentine (à 53,5% après 54,5%). Des baisses de l'inflation ont également été enregistrées au Brésil (à 2,9% après 3,4%), en Fédération de Russie (à 4,0% après 4,3%), en Afrique du Sud (à 4,1% après 4,3%) et en Indonésie (à 3,4% après 3,5%). En Arabie saoudite, les prix ont continué à baisser, mais à un rythme plus lent (moins 0,7% en septembre contre moins 1,1% en août). En revanche, l'inflation annuelle a accéléré en Inde (à 7,0% après 6,3%) et en Chine (à 3,0% après 2,8%).
1 Les IPCH (Indices des Prix à la Consommation Harmonisés) publiés par Eurostat
2 Le 11 juillet 2017, les autorités argentines ont publié un nouvel IPC (décembre 2016=100) qui couvre l'ensemble du pays. Cette série officielle de l'IPC argentin qui commence en décembre 2016 est, à compter de janvier 2018, incluse dans l'agrégat du G-20. L'inclusion de l'IPC de l'Argentine dans l'agrégat du G-20 a entraîné une rupture nette de la série.

Articles Associés








",fr,"











OECD: Annual inflation slows in September 2019
05 Nov 2019, 11:00 by AWP

Energy prices continued to fall, while food price inflation slowed.

Annual inflation in the OECD area slowed to 1.6% in September 2019, from 1.9% in August, mainly reflecting the slowdown in inflation in Turkey to 9.3% in September against 15.0% in August. Energy prices continued to fall, from (minus) 2.6% after (minus) 1.7% in August, while food price inflation slowed to 1.5% vs. 1, 9% in August. Annual inflation excluding food and energy also slowed to 2.1% in September against 2.3% in August.


Consumer prices, selection


September 2019, YoY, as a percentage





OECD-Total (Consumer price) and euro area (HICP)


Year-over-year percentage



In September 2019, annual inflation slowed or was stable in all major economies. It decreased in Germany (to 1.2% against 1.4% in August), in France (to 0.9% against 1.0%), in Italy (to 0.3% against 0.4%), Japan (0.2% vs. 0.3%), while stable in Canada (at 1.9%), the United Kingdom and the United States (both at 1.7%). ).
In the euro area, annual inflation, as measured by the HICP1, decreased to 0.8% in September from 1.0% in August. Excluding food and energy, annual inflation in the euro area edged up 1.0% after 0.9% in August. Eurostat's flash estimate for October shows annual inflation slowing to 0.7%, while inflation excluding food and energy increases to 1.1%.
Annual inflation in G202 countries declined slightly to 3.1% in September 2019 from 3.2% in August. Among non-OECD G20 economies, annual inflation declined slightly, but remained very high in Argentina (53.5% after 54.5%). Declines in inflation were also recorded in Brazil (at 2.9% after 3.4%), in the Russian Federation (at 4.0% after 4.3%), in South Africa (at 1% after 4.3%) and Indonesia (3.4% after 3.5%). In Saudi Arabia, prices continued to fall, but at a slower pace (minus 0.7% in September compared with minus 1.1% in August). In contrast, annual inflation accelerated in India (to 7.0% after 6.3%) and China (to 3.0% after 2.8%).
1 HICPs (Harmonized Indices of Consumption Prices) published by Eurostat
2 On 11 July 2017, the Argentinian authorities published a new CPI (December 2016 = 100) that covers the entire country. This official series of the Argentine CPI starting in December 2016 is, as of January 2018, included in the G-20 aggregate. The inclusion of Argentina's CPI in the G-20 aggregate led to a clear break in the series.

Related Articles








"
