,src,lang,text
0,"











В РФС похвалили работу судьи на матче ""Зенит"" - ЦСКА, несмотря на критику

05 Nov 2019, 11:21

Москва. 5 ноября. INTERFAX.RU - Арбитр Михаил Вилков качественно отработал матч 15-го тура чемпионата Российской премьер-лиги ""Зенит"" - ЦСКА, считает глава Департамента судейства и инспектирования Российского футбольного союза (РФС) Александр Егоров.



""На Вилкова вылился негатив, так как некоторые моменты были преподнесены в другом формате. Бесспорно, он провел игру на хорошем уровне"", - сказал Егоров на пресс-конференции во вторник.
""В той ситуации с Азмуном арбитр не увидел компонентов для того, чтобы показать красную карточку. Для Вилкова была пограничная ситуация, игрок пытался сыграть в мяч, тянул ногу, задевая ногу соперника и одергивая его. Для судьи не было грубости, он решил дать побороться и не показывать карточку в самом начале матча. Мое мнение - должна была быть показана желтая карточка"", - сказал Егоров.
Глава департамента считает, что Вилков поступил верно, показав вторую желтую карточку (приведшую к удалению) полузащитнику ЦСКА Яку Бийолу на 54-й минуте.
""Игрок должен понимать, поднимая ногу вверх, куда он ее опустит. Никто не имеет умысла ударить кого-то. Игрок поднял ногу, ударил соперника носком в районе плеча или головы. Арбитр правильно ее оценил, показав желтую карточку"", - отметил Егоров.
Матч ""Зенит"" - ЦСКА прошел 2 ноября в Санкт-Петербурге и завершился вничью - 1:1. По ходу игры на поле возникали потасовки с участием игроков обеих команд. В том числе - после грубого игрового приема в исполнении нападающего ""Зенита"" Азмуна, въехавшего шипами в ногу соперника.

Новости по теме




",ru,"











The RFU praised the work of the judge at the match “Zenith” - CSKA, despite criticism

05 Nov 2019, 11:21

Moscow. November 5. INTERFAX.RU - Referee Mikhail Vilkov qualitatively completed the match of the 15th round of the Russian Premier League championship “Zenit” - CSKA, said the head of the refereeing and inspection department of the Russian Football Union (RFU) Alexander Egorov.



""Negativity poured on Vilkova, as some points were presented in a different format. Undoubtedly, he played at a good level,"" Yegorov said at a press conference on Tuesday.
“In the situation with Azmoon, the referee did not see the components in order to show the red card. For Vilkov there was a border situation, the player tried to play the ball, pulled his leg, touching the opponent’s leg and pulling him. For the judge there was no rudeness, he decided to let him fight and not show the card at the very beginning of the match. My opinion is that a yellow card should have been shown, ""Yegorov said.
The head of the department believes that Vilkov did the right thing by showing the second yellow card (which led to the removal) to CSKA midfielder Yak Biyol in the 54th minute.
“The player must understand, lifting his leg up, where he will lower it. No one has the intention to hit someone. The player raised his leg, hit the opponent with a toe in the area of the shoulder or head. The referee correctly assessed it by showing a yellow card,” said Yegorov.
The match “Zenith” - CSKA was held on November 2 in St. Petersburg and ended in a draw - 1: 1. During the game on the field, brawls arose with the participation of players from both teams. Including - after a rough game reception performed by striker “Zenith” Azmuna, who entered the opponent’s foot with spikes.

Related News




"
