,src,lang,text
0,"











Istanbuldan Buxoroga ilk charter reys muvaffaqiyatli amalga oshirildi (foto)

02 Nov 2019, 09:50

31-oktabr kuni Turkiyaning Atlasglobal Airlines aviakompaniyasiga qarashli Airbus-321 samolyoti “Istanbul—Buxoro” yo‘nalishidagi ilk charter reysni amalga oshirdi. Bu haqda Turizmni rivojlantirish davlat qo‘mitasi xabar berdi.


Foto: Turizmni rivojlantirish davlat qo‘mitasi

Turkiyaning Atlasglobal Airlines aviakompaniyasi tomonidan O‘zbekistonning Grand Atlas Discovery kompaniyasi ko‘magida yo‘lga qo‘yilgan “Istanbul—Buxoro” birinchi charter reysi Buxoro xalqaro aeroportida viloyat hokimligining qator mutasaddi tashkilotlari vakillari tomonidan tantanali ravishda kutib olindi.
Mavzuga doir: Turkiya aviakompaniyasi Istanbuldan Buxoro va Samarqandga charter reyslarni yo‘lga qo‘yadi
Charter reysning ilk yo‘lovchilari turkiyalik jurnalist, bloger, turistik firmalar rahbarlari va xodimlari, shuningdek, qator din arboblari va olimlarini o‘zida jamlagan.


Foto: Turizmni rivojlantirish davlat qo‘mitasi

“Tarixiy merosga to‘la Buxoroni qardosh turk xalqi kelib ko‘rishi biz uchun juda muhim. Biz turoperator sifatida O‘zbekistonga keladigan sayyohlar soni oshirish masalasida qo‘limizdan kelgan barcha ishlarni qilishga tayyormiz. Sayohat xarajatlari muhim omillardan biridir, u hamyonbop bo‘lgani sayin turistlar soni ortib boraveradi. Yurtingizdagi bunday islohotlardan juda xursandmiz”, — deydi Uchbey turistik kompaniyasi rahbari Muhammad Gulseren.


Foto: Turizmni rivojlantirish davlat qo‘mitasi

Uchbey turistik firmasi idorasi Anqarada joylashgan bo‘lib, u Turkiya Madaniyat va turizm vazirligi hamda Türsab Turkiya sayohatlar agentliklari birlashmasining ruxsati asosida ish olib boradi. Turkiyada 11 mingga yaqin turagent faoliyat yuritadi, ularning bir qismi “A” toifasidagi agentliklar bo‘lib, xorijiy sayohatlarni uyushtirish huquqiga ega. Uchbey turistik firmasi ham mana shunday huquqqa ega. Tashkilot 1998-yildan beri O‘zbekistonga sayohatlarni tashkillashtirib keladi.


Foto: Turizmni rivojlantirish davlat qo‘mitasi

Navbatdagi charter reys 4-noyabr kuni “Istanbul—Samarqand” yo‘nalishida amalga oshirilishi kutilmoqda.


",uz,"











First charter flight from Istanbul to Bukhara successfully completed

02 Nov 2019, 09:50

On October 31, Airbus-321, a Turkish charter flight from Atlasglobal Airlines, made its first charter flight from Istanbul to Bukhara. This was reported by the State Committee for Tourism Development.


Photo: State Committee for Tourism Development

The first charter flight ""Istanbul - Bukhara"", launched by Turkish Atlasglobal Airlines with support from Uzbekistan's Grand Atlas Discovery, was greeted by a group of regional government officials at the Bukhara International Airport.
Topic: Turkey starts charter flights from Istanbul to Bukhara and Samarkand
The first passengers of the charter flight were Turkish journalists, bloggers, executives and employees of tourism companies, as well as a number of religious leaders and scholars.


Photo: State Committee for Tourism Development

“It is very important for us that the brotherly Turkish people visit Bukhara, full of historical heritage. As a tour operator, we are ready to do our best to increase the number of tourists coming to Uzbekistan. Travel expenses are an important factor, and as it is affordable, the number of tourists will increase. We are very happy about such reforms in your country, ”said Mohammed Gulseren, head of Uchbey tourism company.


Photo: State Committee for Tourism Development

The office of the Turkish tourism company Uchbey is located in Ankara with the permission of the Ministry of Culture and Tourism of Turkey and the Association of Turkish Travel Agencies Tursab. There are about 11,000 travel agencies in Turkey, some of which are A-class agencies and have the right to travel abroad. Tourist firm Uchbey has the same right. The organization has been organizing tours to Uzbekistan since 1998.


Photo: State Committee for Tourism Development

The next charter flight is scheduled for November 4 on the route Istanbul - Samarkand.


"
