,src,lang,text
0,"











Орбакайте сменила имидж и стала похожа на Пугачеву, считают в Сети

02 Nov 2019, 11:48




Кристина Орбакайте не перестает удивлять своих поклонников. В этот раз она примерила розовый парик и многие не сразу узнали любимую певицу, также нашлось немало тех, кто сравнил артистку с ее матерью.На своей странице в соцсети Instagram 48-летняя Орбакайте опубликовала новое фото, на котором она позирует в весьма смелом образе – с розовыми волосами.



Мнения поклонников разделились: кто-то посчитал, что такой образ ей идет, а некоторые отметили, что розовый парик ее состарил на несколько лет. Однако подавляющее большинство написало, что в таком амплуа Кристина стала похожа на свою маму Аллу Борисовну Пугачеву.
«На втором фото так на маму похожи», «Борисовна», «Второе фото-копия мамы)», «Вылитая Алла», «На втором фото очень, очень похожа на маму!!!», «Очень похожа на маму», - отметили подписчики в комментариях под фото Орбакайте в Instagram.
Ранее наш портал «МедикФорум» писал, что 50-летняя актриса Юлия Меньшова показалась в соцсетях без макияжа, и многие ее не узнали.


",ru,"











Orbakaite changed her image and looked like Pugacheva, according to the Network

02 Nov 2019, 11:48




Kristina Orbakaite does not cease to amaze her fans. This time she tried on a pink wig and many did not immediately recognize her favorite singer, there were also many who compared the artist to her mother. On her Instagram page, 48-year-old Orbakaite published a new photo in which she poses in a very bold way - with pink hair.



The opinions of fans were divided: someone thought that such an image suits her, and some noted that the pink wig had aged her for several years. However, the vast majority wrote that in such a role, Kristina became similar to her mother Alla Borisovna Pugacheva.
“In the second photo they look like mom”, “Borisovna”, “Second photo-copy of mom)”, “Poured Alla”, “In the second photo they are very, very similar to mom !!!”, “Very similar to mom”, - noted the subscribers in the comments under the photo Orbakaite on Instagram.
Earlier, our portal “Forum” wrote that the 50-year-old actress Julia Menshova appeared on social networks without makeup, and many did not recognize her.


"
