,src,lang,text
0,"











У Гонконзі поновилися протести: поліція застосувала водомети і сльозогінний газ
У суботу, 2 листопада, поліція Гонконгу застосувала водомети і сльозогінний газ проти колони протестувальників.

02 Nov 2019, 11:56

Як повідомляє Reuters, учасники акції зібралися в центрі міста.
Активісти в масках і з парасольками рухалися в напрямку парку Вікторії, співаючи британський і американський національні гімни і закликаючи світову спільноту допомогти в захисті автономії Гонконгу.
Масові протести в Гонконзі почалися після розгляду поправок до закону про екстрадицію правопорушників за запитом Пекіна в материковий Китай.
Демонстранти виступають проти видачі ймовірних правопорушників і злочинців владі КНР, де деяким може загрожувати страта.
Нинішні акції протесту стали наймасовішими в Гонконзі з часу передачі цієї колишньої британської колонії Китаю в 1997 році. За даними спостерігачів, максимальна кількість протестувальників досягала 1,7 млн. осіб.
Уряд Китаю звинувачує протестувальників у насильстві, вандалізмі та «тероризмі».
25 серпня поліція Гонконгу вперше застосувала зброю проти учасників масових протестів у місті.
Також поліція вперше з часу початку масових протестів використовувала водомети проти протестувальників.


",uk,"











In Hong Kong, protests resumed: police used water cannons and tear gas
On Saturday, November 2, Hong Kong police used water cannons and tear gas against a column of protesters.

02 Nov 2019, 12:56

According to Reuters, participants of the action gathered in the city center.
Masked and umbrella activists were moving in the direction of Victoria Park, singing the British and American national anthems and calling on the world community to help protect Hong Kong's autonomy.
Mass protests in Hong Kong began after consideration of amendments to the law on extradition of offenders at Beijing's request to mainland China.
Demonstrators oppose extradition of alleged offenders and criminals to PRC authorities, where some may be threatened with executions.
Current protests have become the largest in Hong Kong since the transfer of this former British colony to China in 1997. According to observers, the maximum number of protesters reached 1.7 million.
The Chinese government has accused protesters of violence, vandalism and ""terrorism"".
On August 25, Hong Kong police first used weapons against protesters in the city.
Police also used water cannons against protesters for the first time since the protests began.


"
