,src,lang,text
0,"











Avec un médecin pour 2.000 habitants, le Livradois-Forez (Puy-de-Dôme) est au cœur d'un désert médical

04 Nov 2019, 08:51


Le Livradois-Forez, à l'est du Puy-de-Dôme, n’échappe pas à la tendance nationale et voit apparaître, depuis des années, des territoires privés de médecins généralistes.

Le décompte, réalisé avec les données de l’ARS et de l’annuaire de l’Assurance maladie, parle de lui-même : il ne reste que 53 médecins généralistes libéraux sur le Livradois-Forez, dans le Puy-de-Dôme, de Puy-Guillaume à Arlanc, de Joze à Chabreloche, pour une population estimée à près de 110.000 habitants. Soit un médecin pour 2.000 habitants, alors que selon plusieurs généralistes, « il faudrait entre 700 et 1.000 patients par médecin pour ne pas être en surcharge de travail ». 



En ville comme à la campagne, « aucun territoire n'est épargné »
Des secteurs sont plus en tension que d’autres, alors que l’Agence régionale de santé en a classé quatre en « zone d’intervention prioritaire », à la campagne, comme en ville. Car c’est bien là le symptôme.
« Aucun territoire n’est épargné », résume Émilie Grille, chargée de mission santé au Pays Vallée de la Dore, qui regroupe les trois communautés de communes du territoire.
Nous sommes passés de neuf à deux médecins sur Courpière en dix ans. À Thiers, l’effectif stagne, les médecins en âge de partir à la retraite peinent à trouver des successeurs



Une situation qui préoccupe également le délégué départemental de l'Agence régionale de santé, Jean Schweyer. « Le territoire est concerné par un déficit important de médecins généralistes, plus qu’ailleurs dans le Puy-de-Dôme, avec les Combrailles à l’est. Cela est d’abord dû à des raisons géographiques, nous sommes sur un territoire montagneux, rural, parfois difficile d’accès. Mais il n’y a pas de raison d’être alarmiste. Il n’y a pas de dégradation soudaine. » 
Pour autant, il se dit « très vigilant » car certaines zones sont très sous-dotées en médecins généralistes, dans la région d’Ambert notamment. 



L’exercice regroupé, la meilleure des pistes ?
Pour pallier ce déficit, une solution efficace selon lui, c'est l'exercice regroupé des professionnels de santé. «  C’est-ce que recherchent les jeunes médecins. Notre rôle, à l’ARS, est de soutenir les dynamiques qui se créent avec les projets de maison de santé. Il ne faut surtout pas les laisser dépérir quand il y a une motivation des praticiens ou même des élus.
Dans les Combrailles, il n’y a pas davantage de médecin qu’en Livradois-Forez, mais plusieurs projets de regroupement ont porté leurs fruits, nous devons réaliser la même chose ici. Il ne faut pas louper le virage de l’exercice regroupé.
En Livradois-Forez, trois projets de Maisons de santé pluridisciplinaires (MSP) sont labellisées : à Joze, pour la Vallée de la Dore (qui regroupent les médecins d'Augerolles, Cunlhat, Saint-Dier d’Auvergne, Olliergues, Courpière), et à Ambert. Il y a également deux Équipes de soins primaires (ESP) reconnues (à Chabreloche et à Puy-Guillaume). À noter, l'exemple réussi à proximité de la MSP de Noirétable (Loire), qui fonctionne depuis 2014.
Des aides financières pour l'installation
Des aides sont également mises en place par l'ARS pour encourager l'installation dans des zones sous-dotées. Le Livradois-Forez est en grande partie considérée par l'ARS comme une Zone d'intervention prioritaire. 
Ce zonage permet, pour les médecins qui s’installent sur le territoire, de bénéficier de l’ensemble des aides de l’ARS. Cela implique par exemple une exonération fiscale, des aides à l’installation, parfois même une garantie de rémunération.  « Même si on le sait, l’attractivité financière seule ne fonctionne pas, cela peut être un plus », souligne Jean Schweyer.



Le « dispositif 400 médecins », peut aussi permettre à des jeunes médecins de diversifier leur mode d’exercice. Ils exercent une partie de leur activité en milieu hospitalier sous un statut salarié. Le reste de leur temps est consacré à la pratique libérale en ville.
 « Là encore, le fait que deux CH soient ancrés sur le territoire est un vrai plus. Le Livradois-Forez a des atouts, à nous de mener à bien le chantier, en lien avec les élus et les praticiens déjà installés, qui portent ces dynamiques », conclut le délégué départemental de l'ARS. 



À Viverols (Puy-de-Dôme), une « solution provisoire » qui dure



Le cabinet médical est intégré dans la Maison des services, située en centre-bourg de Viverols.

Quatre ans après s’être installée, le seul médecin d’origine roumaine avait quitté la petite commune de Viverols pour se rapprocher de son mari, dans le sud de la France, en février 2019. Les élus et cette ancienne généraliste s’étaient alors afférés en amont pour trouver au plus vite un successeur et ainsi éviter une pénurie de soins. Un avis de recherche avait même été lancé par le PNR Livradois-Forez dans tous les réseaux médicaux pour aider au recrutement, en vain. « Une solution provisoire » a donc été envisagée, en accord avec le Conseil de l’ordre des médecins. Depuis le début d’année, c’est une remplaçante du médecin d’Usson-en-Forez, à 9 km de Viverols, dans la Loire, qui assure des consultations secondaires dans le cabinet médical, intégré à la Maison des services, en centre-bourg. « Nous recherchons toujours une solution plus pérenne », indique le maire de la commune, Christian Alexandre. 




Fanny Guiné



Follow @FannyGuine



",fr,"











With a doctor for 2,000 inhabitants, the Livradois-Forez (Puy-de-Dôme) is at the heart of a medical desert

04 Nov 2019, 08:51


The Livradois-Forez, east of Puy-de-Dôme, does not escape the national trend and sees appear, for years, private territories of general practitioners.

The count, made with the data of the ARS and the directory of Health Insurance, speaks for itself: there are only 53 liberal general practitioners on the Livradois-Forez, in Puy-de-Dôme, from Puy-Guillaume to Arlanc, from Joze to Chabreloche, for a population estimated at nearly 110,000 inhabitants. Either a doctor for 2,000 inhabitants, while according to several generalists, ""it would take between 700 and 1,000 patients per doctor to not be overworked.""



In the city as in the countryside, ""no territory is spared""
Some sectors are more in tension than others, while the Regional Health Agency has classified four in ""priority intervention zone"" in the countryside, as in the city. Because that's the symptom.
""No territory is spared"", summarizes Émilie Grille, health mission manager in the Pays Vallée de la Dore, which brings together the three communities of municipalities of the territory.
We went from nine to two doctors on Courpière in ten years. In Thiers, the workforce stagnates, doctors of retirement age struggle to find successors



A situation that also concerns the regional delegate of the Regional Health Agency, Jean Schweyer. ""The territory is affected by a large deficit of general practitioners, more than elsewhere in the Puy-de-Dôme, with Combrailles in the east. This is primarily due to geographical reasons, we are in mountainous territory, rural, sometimes difficult to access. But there is no reason to be alarmist. There is no sudden deterioration. ""
However, he says he is ""very vigilant"" because some areas are very under-equipped general practitioners, especially in the Ambert region.



The grouped exercise, the best of the tracks?
To overcome this deficit, an effective solution, according to him, is the combined exercise of health professionals. ""What are the young doctors looking for? Our role, at ARS, is to support the dynamics that are created with health home projects. It is important not to let them wither away when there is a motivation of practitioners or even elected officials.
In the Combrailles, there is no more doctor than in Livradois-Forez, but several projects of grouping have borne fruit, we must realize the same thing here. Do not miss the turn of the grouped exercise.
In Livradois-Forez, three projects of Multidisciplinary Health Centers (MSP) are labeled: in Joze, for the Valley of the Dore (which include the doctors of Augerolles, Cunlhat, Saint-Dier d'Auvergne, Olliergues, Courpière), and Ambert. There are also two recognized primary care teams (ESP) (Chabreloche and Puy-Guillaume). To note, the successful example near the MSP Noirétable (Loire), which operates since 2014.
Financial support for the installation
Assistance is also provided by the LRA to encourage settlement in underserved areas. The Livradois-Forez is largely considered by the ARS as a priority intervention zone.
This zoning allows, for doctors who settle on the territory, to benefit from all the help of the ARS. This implies for example a tax exemption, installation aids, sometimes even a guarantee of remuneration. ""Even if we know, the financial attractiveness alone does not work, it can be a plus,"" said Jean Schweyer.



The ""device 400 physicians"", can also allow young doctors to diversify their mode of exercise. They perform part of their activity in a hospital environment under a salaried status. The rest of their time is devoted to liberal practice in the city.
""Again, the fact that two CHs are anchored on the territory is a real plus. The Livradois-Forez has assets to us to carry out the building site, in connection with elected officials and already established practitioners, who carry these dynamics, ""concludes the departmental delegate of the ARS.



In Viverols (Puy-de-Dôme), an ""interim solution"" that lasts



The medical office is integrated into the House of Services, located in the center of the town of Viverols.

Four years after settling down, the only doctor of Romanian origin had left the small town of Viverols to get closer to her husband, in the south of France, in February 2019. The elected and this former generalist had then upstream to find a successor as soon as possible and thus avoid a shortage of care. A notice of research had even been launched by the PNR Livradois-Forez in all medical networks to help recruitment, to no avail. ""An interim solution"" was therefore considered, in agreement with the Council of the Order of Physicians. Since the beginning of the year, she is a replacement for Usson-en-Forez's doctor, 9 km from Viverols, in the Loire, who provides secondary consultations in the medical office, integrated into the House of Services, in town center. ""We are still looking for a more sustainable solution,"" says the mayor of the town, Christian Alexandre.




Fanny Guiné



Follow @FannyGuine



"
