,src,lang,text
0,"











Boicot amenaza marcas de EU durante el Día de los Solteros en China
Los consumidores chinos piensan replantearse comprar a compañías estadounidenses durante el gran día de compras el 11 de noviembre, esto por la guerra comercial que sostienen ambas naciones.
04 Nov 2019, 08:46 by Bloomberg NEWS
Las marcas estadounidenses podrían ser objeto de un amplio boicot en el mayor evento de compras del mundo este año debido a las tensiones entre Estados Unidos y China por cuestiones como los aranceles o el dominio tecnológico.
Más de 75 por ciento de los consumidores chinos encuestados dijeron que van a replantearse comprar a compañías estadounidenses durante la jornada de compras del Día de los Solteros del 11 de noviembre, según un informe publicado la semana pasada por la consultora AlixPartners.
De ellos, más de la mitad citó la lealtad a su país como razón para tomar esa decisión.
“Las marcas estadounidenses deben esperar cierto trastorno debido al impacto de la guerra comercial entre Estados Unidos y China sobre el ánimo del consumidor”, cita el informe.
El Día de los Solteros, una celebración de las personas sin pareja introducido hace diez años por el gigante del comercio electrónico Alibaba, es ahora mayor que el Black Friday y el Cyber Monday juntos. La jornada, una repuesta al Día de San Valentín, se celebra el 11 de noviembre. El año pasado se registraron ventas superiores a 30 mil millones de dólares en 24 horas.
Los consumidores chinos están optando por una ola de gasto nacionalista a medida que se vuelven más sensibles a cualquier menosprecio percibido sobre su cultura o soberanía en medio de un conflicto comercial de varios años entre Estados Unidos y China.
A medida que las empresas occidentales miran cada vez más a China para el crecimiento futuro, dado el tamaño del mercado, los compradores las están sometiendo a cierto escrutinio, y han señalado a empresas como Coach o Calvin Klein por chocar con las sensibilidades políticas de Beijing.


",es,"











Boycott threatens EU marks during Singles Day in China
Chinese consumers plan to rethink buying from US companies during the big shopping day on November 11, this because of the trade war between both nations.
04 Nov 2019, 08:46 by Bloomberg NEWS
US brands could be subject to a broad boycott of the world's largest shopping event this year due to tensions between the United States and China over issues such as tariffs or technological dominance.
More than 75 percent of Chinese consumers surveyed said they are going to rethink buying from US companies during the shopping day on November 11, according to a report published last week by AlixPartners.
Of them, more than half cited loyalty to their country as a reason to make that decision.
""US brands must expect some disorder due to the impact of the US-China trade war on the mood of the consumer,"" the report cites.
Singles Day, a celebration of the unmarried people introduced ten years ago by the e-commerce giant Alibaba, is now greater than Black Friday and Cyber Monday together. The day, a response to Valentine's Day, is celebrated on November 11. Last year there were sales of more than 30 billion dollars in 24 hours.
Chinese consumers are opting for a wave of nationalist spending as they become more sensitive to any perceived disregard for their culture or sovereignty amid a multi-year trade conflict between the United States and China.
As Western companies increasingly look to China for future growth, given the size of the market, buyers are subjecting them to some scrutiny, and have pointed to companies like Coach or Calvin Klein for clashing with Beijing's political sensibilities. .


"
