,src,lang,text
0,"











Vitória só precisa fazer o 'dever de casa' para escapar da queda
Rubro-negro precisa de mais 8 pontos para alcançar o número mágico na fuga contra a zona
04 Nov 2019, 08:00 by Vinícius Nascimento*
O Vitória fará, nessa terça-feira (4), o antepenúltimo jogo dentro de casa em 2019. Contra o Brasil de Pelotas, às 20h30, o rubro-negro dará sequência à luta que trava contra o rebaixamento. Com 37 pontos após 32 rodadas, o risco de queda para a Série C, aos poucos, vai caindo.
Segundo o departamento de Matemática da Universidade Federal de Minas Gerais (UFMG), o Vitória está com 12,1% de possibilidades de terminar a Série B entre os quatro piores times. O primeiro clube dentro do Z4 é o Figueirense, que tem 33 pontos e o estudo aponta com 72% de chance de queda.
Com seis rodadas restantes para o fim do campeonato, a vantagem de quatro pontos para o primeiro clube na zona de rebaixamento dá ao Leão a relativa tranquilidade de ter uma jornada de “frente”.
Além do Brasil de Pelotas, o Vitória ainda enfrentará, no Barradão, CRB e Coritiba. O jogo contra o Coxa será o último do ano, no dia 30 de novembro. O CRB será o rival no dia 12, pela 35ª rodada.
Ao todo, o Leão soma 25 jogos em casa na temporada, considerando Barradão e Fonte Nova. O retrospecto é de sete triunfos, dez empates e oito derrotas, com aproveitamento de 41%.
Foram 22 jogos no Barradão e três na Fonte Nova. Foi dentro do Manoel Barradas que o Vitória conseguiu todos os triunfos como mandante. Na Fonte, foram dois empates (0x0 contra o Atlético-GO e 2x2 com o Sport) e uma derrota, por 0x1, contra o Guarani.
Os três jogos restantes em casa são mais do que suficientes para o Vitória escapar do rebaixamento. Com os nove pontos em disputa no Barradão é possível chegar a 46, acima do número “mágico” de 45. E no momento, a UFMG aponta apenas 7% de risco de rebaixamento com 44 pontos e 20% com 43. 
A partida contra o Brasil de Pelotas deve ser a última do Vitória contra uma equipe que está na metade de baixo da classificação da Série B. Depois, o time visitará o Paraná (7º), receberá o CRB (6º) antes de viajar para dois compromissos fora de casa contra América-MG (5º) e Operário (8º) e depois encerrar a competição contra o Coritiba (3º).
Quando enfrentou essas mesmas equipes no primeiro turno, o Vitória somou nove pontos dos 18 possíveis. Perdeu apenas para o Brasil de Pelotas antes de engatar dois triunfos contra Paraná e CRB e, por fim, empatar três consecutivas contra América, Operário e Coritiba. Se repetir o feito, escapa da Série C sem sustos.
O elenco voltou aos treinos no domingo (3). Hoje o meia Chiquinho e o atacante Wesley, que saíram machucados contra o Figueirense, serão avaliados pelo departamento médico. O volante Léo Gomes está livre de suspensão, enquanto Jordy sai do time pelo mesmo motivo.

*Com supervisão do editor Herbem Gramacho








",pt,"











Victory just needs to do 'homework' to escape the fall
Blackblack needs 8 more points to reach the magic number on the escape zone
04 Nov 2019, 08:00 by Vinícius Nascimento *
Vitoria will make, on Tuesday (4), the second-last home match in 2019. Against Brasil de Pelotas, at 20:30, the red-black will continue the fight against relegation. With 37 points after 32 rounds, the risk of falling for the C Series will slowly fall.
According to the Department of Mathematics at the Federal University of Minas Gerais (UFMG), Vitória has a 12.1% chance of finishing Series B among the four worst teams. The first club within Z4 is Figueirense, which has 33 points and the study points with a 72% chance of falling.
With six rounds left to the end of the championship, the four-point advantage for the first club in the relegation zone gives Leo the relative peace of mind of having a “forward” journey.
In addition to Brazil Pelotas, Vitória will still face, in Barradão, CRB and Coritiba. The game against the Thigh will be the last of the year, on November 30th. The CRB will be the rival on the 12th, for the 35th round.
In all, the Lion adds 25 home games in the season, considering Barradão and Fonte Nova. The record is seven wins, 10 draws and 8 losses, with 41%.
There were 22 games at Barradão and three at Fonte Nova. It was inside Manoel Barradas that Vitória got all the triumphs as home team. At Fonte, there were two draws (0x0 against Atlético-GO and 2x2 with Sport) and a defeat, by 0x1, against Guarani.
The three remaining home matches are more than enough for Vitória to escape from relegation. With the nine points in dispute in Barradão is possible to reach 46, above the ""magic"" number of 45. And at the moment, UFMG points only 7% risk of relegation with 44 points and 20% with 43.
The match against Brasil de Pelotas should be the last of Vitória against a team that is in the lower half of the Serie B classification. After that, the team will visit Paraná (7th), receive the CRB (6th) before traveling to two away home against América-MG (5th) and Operário (8th) and then close the competition against Coritiba (3rd).
When they faced these same teams in the first round, Vitória scored nine points out of the 18 possible. They lost only to Brasil de Pelotas before engaging two triumphs against Paraná and CRB and, finally, drawing three consecutive wins against América, Operário and Coritiba. If you repeat the feat, you escape the C Series without fear.
The cast returned to practice on Sunday (3). Today midfielder Chiquinho and striker Wesley, who were injured against Figueirense, will be evaluated by the medical department. Midfielder Léo Gomes is free from suspension, while Jordy leaves the team for the same reason.

* With supervision of editor Herbem Gramacho








"
