,src,lang,text
0,"











США и Китай согласовали основные пункты торгового соглашения
04 Nov 2019, 08:57 by Интерфакс
Пекину и Вашингтону удалось согласовать основные положения готовящегося торгового соглашения между двумя странами, сообщает телеканал CNBC со ссылкой на Министерство коммерции КНР
В министерстве отметили, что таких результатов удалось добиться по итогам состоявшихся в пятницу телефонных переговоров вице-премьера Госсовета КНР Лю Хэ с торговым представителем США Робертом Лайтхайзером и министром финансов США Стивеном Мнучином.
В Минкоммерции КНР при этом охарактеризовали переговоры «как серьезные и конструктивные» и затрагивающие ключевые торговые вопросы.
Как сообщалось, встреча председателя КНР Си Цзиньпина и президента США Дональда Трампа в рамках саммита АТЭС, на которой ожидалось подписание главами двух стран достигнутого ранее в этом месяце соглашения по первой фазе урегулирования торговых споров, оказалась под вопросом. Это связано с отказом властей Чили от проведения саммита. Тем не менее Белый дом заявил, что рассчитывает на подписание соглашения с Китаем в намеченные ранее сроки.






",ru,"











US and China agree on main points of trade agreement
04 Nov 2019, 08:57 by Interfax
Beijing and Washington managed to agree on the main provisions of the upcoming trade agreement between the two countries, the CNBC Channel reported with reference to the Ministry of Commerce of China
The ministry noted that such results were achieved following the telephone talks held on Friday by Vice Premier of the State Council of the PRC Liu He with US Trade Representative Robert Lighthizer and US Secretary of the Treasury Stephen Mnuchin.
At the same time, the Ministry of Commerce of the PRC characterized the negotiations “as serious and constructive” and affecting key trade issues.
As reported, the meeting between President Xi Jinping and US President Donald Trump at the APEC summit, which was expected to be signed by the two countries' leaders earlier this month on the first phase of the settlement of trade disputes, was called into question. This is due to the refusal of the Chilean authorities to host the summit. Nevertheless, the White House said it was counting on the signing of an agreement with China as scheduled earlier.






"
