,src,lang,text
0,"











Soal Ade Armando, Fahira Idris Akan Temui Kapolda Metro Jaya
04 Nov 2019, 08:03 by M Julnis Firmansyah, Febriyan
TEMPO.CO, Jakarta - Anggota Dewan Pimpinan Daerah (DPD) RI Fahira Idris melaporkan Dosen Universitas Indonesia Ade Armando terkait unggahannya di media sosial twitter. Dia pun meminta Kapolda Metro Jaya Inspektur Jenderal Gatot Eddy Pramono untuk memberikan perhatian khusus terhadap laporannya itu.
Fahira menyatakan akan bertemu dengan Gatot pada Rabu mendatang. ""Pertama saya mau sampaikan ke beliau (Kapolda), kasus ini saya minta atensi beliau juga lah,"" kata Fahira di Polda Metro Jaya, Jakarta Selatan, Senin, 4 November 2019.
Fahira menjelaskan Ade Armando sebelumnya juga pernah terjerat kasus dan telah ditetapkan polisi sebagai tersangka. Namun, status tersangka itu hanya menggantung selama 2 tahun dan belum ada tindak lanjutnya.
""Udah pernah dikasih SP3, diprapradilankan, (Ade Armando) masih status tersangka. Jadi kami minta atensi beliau lah dalam kasus ini,"" kata Fahira.
Sebelumnya Ade Armando dilaporkan oleh Fahira Idris terkait unggahan foto Anies Baswedan dengan riasan wajah Joker di media. Tapi menurut Ade, foto wajah Anies dengan riasan ala tokoh fiksi dalam DC Comics itu bukan buatan dirinya. Dia berujar foto itu merupakan bentuk kecaman.
""Anies Baswedan memang harus dikecam secara terbuka akibat anggaran Aica Aibon dan bolpen yang tidak masuk di akal,"" kata dia.
Foto Anies dengan riasan ala Joker tersebut mencuat setelah terbongkarnya sejumlah anggaran janggal dalam rencana APBD DKI 2020. Anggaran janggal tersebut dibongkar oleh Anggota DPRD DKI dari Fraksi Partai Solidaritas Indonesia (PSI) William Aditya Sarana di Twitter. William menyoroti usulan anggaran Rp 82 miliar untuk pembelian lem aibon yang diajukan oleh Suku Dinas Pendidikan Jakarta Barat. Selain itu ada juga usulan anggaran sebesar Rp 123 miliar untuk pengadaan ballpoint oleh Sudin Pendidikan Jakarta Timur.
""Menurut saya, apa yang dilakukannya jahat,"" kata Ade.
Fahira Idris melaporkan Ade ke polisi karena dinilai melanggar Pasal 32 Ayat 1 juncto 48 ayat 1 Undang-Undang Nomor 19 Tahun 2016 tentang Informasi dan Transaksi Elektronik (ITE). Pasal itu berbunyi, setiap orang dengan sengaja dan tanpa hak atau melawan hukum dengan cara apa pun mengubah, menambah, mengurangi, melakukan transmisi, merusak, menghilangkan, memindahkan, menyembunyikan suatu informasi elektronik dan atau dokumen elektronik milik orang lain atau milik publik.
Menurut Fahira Idris, foto Anies Baswedan yang diunggah oleh Ade Armando merupakan dokumen milik Pemerintah Provinsi DKI Jakarta atau milik publik yang diubah menjadi seperti Joker.


",id,"











Problem Ade Armando, Fahira Idris Will Meet Metro Jaya Police Chief
Nov 04 2019, 08:03 by M Julnis Firmansyah, Febriyan
TEMPO.CO, Jakarta - RI Regional Leadership Council (DPD) member Fahira Idris reported University of Indonesia Lecturer Ade Armando about his upload on Twitter social media. He also asked the Jakarta Police Chief Inspector General Gatot Eddy Pramono to pay special attention to his report.
Fahira said he would meet with Gatot on Wednesday. ""First, I want to convey to him (Kapolda), this case I ask for his attention too,"" Fahira said at the Jakarta Metropolitan Police, South Jakarta, Monday, November 4, 2019.
Fahira explained that Ade Armando had also previously been caught in a case and had been named by the police as a suspect. However, the suspect's status only hung for 2 years and there has been no follow up.
""I have been given SP3, pre-trial, (Ade Armando) is still a suspect status. So we ask for his attention in this case,"" Fahira said.
Previously, Ade Armando was reported by Fahira Idris about uploading photos of Anies Baswedan with Joker's makeup on the media. But according to Ade, the photo of Anies's face with makeup in the style of a fictional character in DC Comics was not made by him. He said the photo was a form of criticism.
""Anies Baswedan must be openly criticized for Aica Aibon's budget and pens that don't make sense,"" he said.
Anies photo with Joker-style makeup sticking out after the opening of a number of odd budget in the 2020 2020 APBD plan. William highlighted the proposed budget of Rp. 82 billion for the purchase of aibon glue submitted by the West Jakarta Education Agency. In addition there is also a proposed budget of Rp. 123 billion for the procurement of ballpoints by the East Jakarta Education Sub-Department.
""In my opinion, what he does is evil,"" Ade said.
Fahira Idris reported Ade to the police because it was considered to violate Article 32 Paragraph 1 juncto 48 paragraph 1 of Law Number 19 of 2016 concerning Information and Electronic Transactions (ITE). The article reads, every person intentionally and without rights or against the law in any way change, add, reduce, transmit, destroy, delete, move, hide an electronic information and or electronic documents that belong to other people or public property.
According to Fahira Idris, Anies Baswedan's photo uploaded by Ade Armando was a document owned by the Provincial Government of DKI Jakarta or publicly-owned, which was changed to be like a Joker.


"
