,src,lang,text
0,"











Названо первое предприятие, которое запретили приватизировать
06 Nov 2019, 18:18 by Корреспондент.net
Кабмин запретил продавать Николаевский бронетанковый завод. Его включили в перечень предприятий, имеющих стратегическое значение.
Правительство на заседании в среду, 6 ноября, приняло решение о запрете приватизации Николаевского бронетанкового завода.
Как сообщается на сайте Кабмина, предприятие включили в Перечень объектов государственной собственности, которые не подлежат приватизации, как таковой, что имеет стратегическое значение для экономики и безопасности Украины. 
Николаевский бронетанковый завод стал первым госпредприятием, которое внесли в новый перечень запрещенных к приватизации, о котором стало публично известно.
Напомним, президент Владимир Зеленский подписал закон об отмене списка запрещенных к приватизации госпредприятий.
Первые пять предприятий переданы в Фонд госимущества. 
 





",ru,"











Named the first enterprise that was banned from privatization
06 Nov 2019, 18:18 by Correspondent.net
The Cabinet of Ministers forbade to sell the Nikolaev armored plant. He was included in the list of enterprises of strategic importance.
The government at a meeting on Wednesday, November 6, decided to ban the privatization of the Nikolaev armored plant.
As reported on the website of the Cabinet of Ministers, the enterprise was included in the List of state-owned objects that are not subject to privatization, as such, which is of strategic importance for the economy and security of Ukraine.
The Nikolaev armored plant was the first state-owned enterprise to be added to the new list of banned privatization, which became publicly known.
Recall, President Vladimir Zelensky signed the law on the abolition of the list of state enterprises banned for privatization.
The first five enterprises were transferred to the State Property Fund.






"
