,src,lang,text
0,"











Mãe de Jorge Fernando, aos 95 anos, não segura o sofrimento em missa de sétimo dia
06 Nov 2019, 18:32 by Rafael
Com grandes perdas, esse ano, sem dúvidas, foi um dos mais tristes para o mundo das telinhas. Mês passado faleceu o ator e diretor da Rede Globo, Jorge Fernando, e sua missa de sétimo dia foi celebrada nesta segunda-feira (04).
Jorge Fernando, ou Jorginho, como era carinhosamente chamado por amigos e colegas de trabalho, faleceu devido a uma parada cardíaca. Sua missa de sétimo dia foi marcada por muita dor e sofrimento.

Publicidade
A missa contou a presença de vários famosos como Edson Celulari, Patricya Travassos, Jorge Benjor, Flávia Alessandra entre outros. A dona Hilda Rebello, mãe de Jorge Fernando, já com 95 anos, não segurou o sofrimento, caiu aos prantos e precisou ser amparada por quem estava ali perto.
Perder um filho não é nada fácil, mas, felizmente, amigos do Jorginho estavam ali para a consolar e prestar o apoio e carinho para confortar a perda de Hilda.  A missa foi realizada na igreja de São Jorge, situada na cidade do Rio de Janeiro.

Publicidade
De acordo com uma cuidadora, a mãe de Jorginho tem demorado a pegar no sono a noite, e se deita chorando todos os dias devido a saudades do filho. Em entrevista ao Extra, a cuidadora disse: “O dia de Hilda se resume a tocar e olhar tudo o que remete a Jorge. Na sala, tem um quadro deles juntos, que ela fica admirando, e não larga um enfeite em forma de capela, dado por ele”.
Jorge Fernando faleceu aos 64 anos, mas deixou um legado e várias memórias boas com o seu jeito peculiar de ser, sempre alegre, feliz e de bom-humor, de acordo com quem era próximo do diretor.
Participou, como diretor, em diversas novelas, entre elas: Verão 90 (2019), Êta Mundo Bom (2016) e Alto Astral (2014-2015).




",pt,"











Jorge Fernando's mother, at 95, does not hold back suffering at seventh-day mass
06 Nov 2019, 18:32 by Rafael
With great losses, this year, without doubt, was one of the saddest for the world of small screens. Last month the actor and director of Rede Globo, Jorge Fernando, passed away and his seventh day mass was celebrated on Monday (04).
Jorge Fernando, or Jorginho, as he was affectionately called by friends and co-workers, died of cardiac arrest. His seventh-day mass was marked by much pain and suffering.

publicity
The mass was attended by several famous people such as Edson Celulari, Patricya Travassos, Jorge Benjor, Flávia Alessandra and others. Dona Hilda Rebello, the mother of Jorge Fernando, now 95 years old, did not handle the suffering, fell into tears and needed to be supported by those nearby.
Losing a child is not easy, but fortunately, Jorginho's friends were there to comfort her and provide the support and affection to comfort Hilda's loss. The mass was held in the church of St. George, located in the city of Rio de Janeiro.

publicity
According to one caregiver, Jorginho's mother has been slow to sleep at night, and lies down crying every day due to missing her son. In an interview with Extra, the caregiver said: “Hilda's day is all about touching and looking at everything that refers to Jorge. In the living room is a picture of them together, which she is admiring, and she doesn't drop a chapel-shaped ornament from him. ”
Jorge Fernando died at the age of 64, but left a legacy and several good memories with his peculiar way of being, always happy, happy and in a good mood, according to who was close to the director.
He has participated, as director, in several soap operas, including: Summer 90 (2019), Êta Mundo Bom (2016) and Alto Astral (2014-2015).




"
