,src,lang,text
0,"











ماکرون: همکاری‌ میان اروپا و چین در تغییرات اقلیمی تعیین کننده است
05 Nov 2019, 08:44 by یورونیوز فارسی 
امانوئل ماکرون، رئیس جمهوری فرانسه، روز سه‌شنبه گفت که همکاری میان اروپا و چین برای کاهش انتشار گاز‌های گلخانه‌ای «تعیین کننده» خواهد بود. همزمان با این سخنان دولت ترامپ فرآیند خروج از توافق اقلیمی پاریس را به‌طور رسمی آغاز کرد.
این اقدام ایالات متحده که به اطلاع سازمان ملل رسیده است، نخستین گام رسمی در روندی یک ساله برای خروج از پیمان جهانی برای مقابله با تغییرات آب و هوایی است.
چین و فرانسه در نشست سالجاری سران گروه ۲۰ متعهد شدند که سهم خود را در مورد تغییرات اقلیمی فراتر از موارد فعلی «به روز» کنند.
توافق‌ اقلیمی پاریس که در سال ۲۰۱۵ بین ۱۸۷ کشور امضاء شد، کشورها را تشویق می‌کند که در صورت امکان تعهداتی را متقبل شوند.
اگر بخواهیم به توافق‌نامه پاریس پایبند باشیم نیاز است که در سال آینده تعهدات خود برای کاهش تولید گازهای گلخانه‌ای را افزایش دهیمامانوئل ماکرون رئیس جمهوری فرانسه
رئیس جمهوری فرانسه که هم اکنون در شانگهای چین حضور دارد، در یک نمایشگاه بزرگ تجاری خطاب به شی جین پینگ، رئیس جمهوری چین گفت که تعهدات در حوزه اقلیمی باید افزایش پیدا کند.
وی گفت: «اگر بخواهیم به توافق‌نامه پاریس پایبند باشیم نیاز است که در سال آینده تعهدات خود برای کاهش تولید گازهای گلخانه‌ای را افزایش دهیم و باید تعهدات جدید برای سال‌های ۲۰۳۰ و ۲۰۵۰ را نیز تایید کنیم.»
ماکرون تاکید کرد که همکاری بین چین و اتحادیه اروپا در این زمینه تعیین کننده است: «سال آینده نیاز است با ارتقاء دستور کار، به طور جمعی وظایف خود را انجام دهیم.»
از سوی دیگر یک مقام رسمی دفتر ریاست جمهوری فرانسه با ابراز تأسف از اقدام ایالات متحده مبنی بر خروج از این توافق در عین حال تاکید کرد که آقای ماکرون و شی تعهدات خود درباره توافق پاریس را بار دیگر تأیید می‌کنند.
این مقام فرانسوی که علاقمند به افشای نامش نبود به رویترز گفت: «متنی که فردا امضاء می‌شود شامل پاراگرافی درباره برگشت ناپذیر بودن توافق‌نامه پاریس است.»
ماکرون و شی قرار است نشست رسمی خود را در روز چهارشنبه ۱۵ آبان در پکن برگزار کنند.
چین و ایالات متحده بزرگترین تولید کنندگان گازهای گلخانه‌ای در جهان هستند. میزان تولید گازهای گلخانه‌ای در چین به مانند دیگر کشورهای در حال توسعه روندی افزایشی دارد.
چین متعهد به کاهش گازهای گلخانه‌ای است و پیش‌بینی می‌شود طبق توافق پاریس، ۱۵ درصد از کل انرژی مصرفی این کشور در سال ۲۰۲۰ از سوخت‌های غیرفسیلی تامین شود.


",fa,"











Macron: Cooperation between Europe and China on climate change is crucial
05 Nov 2019, 08:44 by euronews Persian
French President Emmanuel Macron said on Tuesday that cooperation between Europe and China would be ""decisive"" in reducing greenhouse gas emissions. At the same time, the Trump administration officially began the process of withdrawing from the Paris climate agreement.
The United States, reported to the United Nations, is the first formal step in a one-year process to withdraw from the global treaty to tackle climate change.
China and France pledged to ""update"" their share of climate change beyond the current one at the Group of 7 annual meeting.
The Paris Agreement, signed between the two countries in the year 5, encourages countries to make commitments whenever possible.
If we want to abide by the Paris Agreement, we need to increase our commitments to reduce greenhouse gas emissions next year. French President Manuel Macron
The president of France, currently in Shanghai, China, said at a major trade fair to Xi Jinping that the commitments in the area of climate should be increased.
""If we want to abide by the Paris Agreement, we need to increase our commitments to reduce greenhouse gas emissions next year and also have to approve new commitments for years 1 and 2,"" he said.
Macron stressed that cooperation between China and the European Union is crucial: ""Next year, we need to work together to raise the agenda.""
On the other hand, an official from the French presidential office, regretting the US move to withdraw from the deal, also insisted that Mr Macron and Shei reaffirm their commitment to the Paris agreement.
The French official, who was not interested in anonymity, told Reuters, ""The text to be signed tomorrow contains a paragraph about the irreversibility of the Paris Agreement.""
Macron and Shi are scheduled to hold their official meeting in Beijing on Wednesday.
China and the United States are the largest producers of greenhouse gases in the world. China's greenhouse gas production is increasing, as in other developing countries.
China is committed to reducing greenhouse gases and is projected to supply about 2 percent of its total energy consumption per year by non-fossil fuels, according to Paris.


"
